[
  {
    "doc_id": 0,
    "doc": {
      "question": "What is the term for a sub-optimal but acceptable outcome of negotiations between parties?",
      "subject": "management",
      "choices": [
        "Bargaining",
        "Satisficing",
        "Accepting",
        "Compromising"
      ],
      "answer": 1
    },
    "target": "(B)",
    "arguments": [
      [
        "The following are multiple choice questions (with answers) about management.\n\nQ: What characteristic is not a key feature of the 'open systems' model of management?\n(A) Morale (B) Innovation (C) Growth resource (D) Adaptation\nA:  (A)\n\nQ: What are the two main dimensions of the Ohio Studies into leadership?\n(A) Starting position and end position (B) Initial environment and changed environment (C) Organisational structure and conditioning (D) Initiating structure and considerations\nA:  (D)\n\nQ: How can organisational structures that are characterised by democratic and inclusive styles of management be described?\n(A) Hierarchical (B) Bureaucratic (C) Flat (D) Functional\nA:  (C)\n\nQ: Which element of the cultural web forms regalia?\n(A) Symbols (B) Rituals and routines (C) Power structures (D) Control systems\nA:  (A)\n\nQ: Hygiene factors are associated with which writer?\n(A) Frederick Hertzberg (B) D.C. McClelland (C) Abraham Maslow (D) Douglas McGregor\nA:  (A)\n\nQ: What is the term for a sub-optimal but acceptable outcome of negotiations between parties?\n(A) Bargaining (B) Satisficing (C) Accepting (D) Compromising\nA: ",
        {
          "until": [
            "</s>"
          ]
        }
      ]
    ],
    "resps": [
      [
        "(D)"
      ]
    ],
    "filtered_resps": [
      "(D)"
    ],
    "exact_match": 0.0
  },
  {
    "doc_id": 8,
    "doc": {
      "question": "Which writer is most associated with bureaucratic structures?",
      "subject": "management",
      "choices": [
        "Henry Fayol",
        "Max Weber",
        "Adam Smith",
        "Mary Parker Follett"
      ],
      "answer": 1
    },
    "target": "(B)",
    "arguments": [
      [
        "The following are multiple choice questions (with answers) about management.\n\nQ: What are the two main dimensions of the Ohio Studies into leadership?\n(A) Starting position and end position (B) Initial environment and changed environment (C) Organisational structure and conditioning (D) Initiating structure and considerations\nA:  (D)\n\nQ: How can organisational structures that are characterised by democratic and inclusive styles of management be described?\n(A) Hierarchical (B) Bureaucratic (C) Flat (D) Functional\nA:  (C)\n\nQ: Hygiene factors are associated with which writer?\n(A) Frederick Hertzberg (B) D.C. McClelland (C) Abraham Maslow (D) Douglas McGregor\nA:  (A)\n\nQ: What characteristic is not a key feature of the 'open systems' model of management?\n(A) Morale (B) Innovation (C) Growth resource (D) Adaptation\nA:  (A)\n\nQ: Which element of the cultural web forms regalia?\n(A) Symbols (B) Rituals and routines (C) Power structures (D) Control systems\nA:  (A)\n\nQ: Which writer is most associated with bureaucratic structures?\n(A) Henry Fayol (B) Max Weber (C) Adam Smith (D) Mary Parker Follett\nA: ",
        {
          "until": [
            "</s>"
          ]
        }
      ]
    ],
    "resps": [
      [
        "(B)"
      ]
    ],
    "filtered_resps": [
      "(B)"
    ],
    "exact_match": 1.0
  },
  {
    "doc_id": 16,
    "doc": {
      "question": "What is a paradigm?",
      "subject": "management",
      "choices": [
        "A theoretical assumption",
        "An illustration",
        "A theoretical model",
        "An example serving as a model"
      ],
      "answer": 3
    },
    "target": "(D)",
    "arguments": [
      [
        "The following are multiple choice questions (with answers) about management.\n\nQ: What are the two main dimensions of the Ohio Studies into leadership?\n(A) Starting position and end position (B) Initial environment and changed environment (C) Organisational structure and conditioning (D) Initiating structure and considerations\nA:  (D)\n\nQ: How can organisational structures that are characterised by democratic and inclusive styles of management be described?\n(A) Hierarchical (B) Bureaucratic (C) Flat (D) Functional\nA:  (C)\n\nQ: Hygiene factors are associated with which writer?\n(A) Frederick Hertzberg (B) D.C. McClelland (C) Abraham Maslow (D) Douglas McGregor\nA:  (A)\n\nQ: Which element of the cultural web forms regalia?\n(A) Symbols (B) Rituals and routines (C) Power structures (D) Control systems\nA:  (A)\n\nQ: What characteristic is not a key feature of the 'open systems' model of management?\n(A) Morale (B) Innovation (C) Growth resource (D) Adaptation\nA:  (A)\n\nQ: What is a paradigm?\n(A) A theoretical assumption (B) An illustration (C) A theoretical model (D) An example serving as a model\nA: ",
        {
          "until": [
            "</s>"
          ]
        }
      ]
    ],
    "resps": [
      [
        "(C)"
      ]
    ],
    "filtered_resps": [
      "(C)"
    ],
    "exact_match": 0.0
  },
  {
    "doc_id": 24,
    "doc": {
      "question": "What are workers primarily motivated by according to the instrumental approach?",
      "subject": "management",
      "choices": [
        "Peer recognition",
        "Promotion",
        "Greater freedom",
        "Economic reward"
      ],
      "answer": 3
    },
    "target": "(D)",
    "arguments": [
      [
        "The following are multiple choice questions (with answers) about management.\n\nQ: Hygiene factors are associated with which writer?\n(A) Frederick Hertzberg (B) D.C. McClelland (C) Abraham Maslow (D) Douglas McGregor\nA:  (A)\n\nQ: What are the two main dimensions of the Ohio Studies into leadership?\n(A) Starting position and end position (B) Initial environment and changed environment (C) Organisational structure and conditioning (D) Initiating structure and considerations\nA:  (D)\n\nQ: What characteristic is not a key feature of the 'open systems' model of management?\n(A) Morale (B) Innovation (C) Growth resource (D) Adaptation\nA:  (A)\n\nQ: Which element of the cultural web forms regalia?\n(A) Symbols (B) Rituals and routines (C) Power structures (D) Control systems\nA:  (A)\n\nQ: How can organisational structures that are characterised by democratic and inclusive styles of management be described?\n(A) Hierarchical (B) Bureaucratic (C) Flat (D) Functional\nA:  (C)\n\nQ: What are workers primarily motivated by according to the instrumental approach?\n(A) Peer recognition (B) Promotion (C) Greater freedom (D) Economic reward\nA: ",
        {
          "until": [
            "</s>"
          ]
        }
      ]
    ],
    "resps": [
      [
        "(D)"
      ]
    ],
    "filtered_resps": [
      "(D)"
    ],
    "exact_match": 1.0
  },
  {
    "doc_id": 32,
    "doc": {
      "question": "When does an acquisition take place?",
      "subject": "management",
      "choices": [
        "Two equal partners decide to work together.",
        "Two equal partners share resources.",
        "Two unequal partners join together.",
        "Two unequal partners become one after a buyout."
      ],
      "answer": 3
    },
    "target": "(D)",
    "arguments": [
      [
        "The following are multiple choice questions (with answers) about management.\n\nQ: How can organisational structures that are characterised by democratic and inclusive styles of management be described?\n(A) Hierarchical (B) Bureaucratic (C) Flat (D) Functional\nA:  (C)\n\nQ: What characteristic is not a key feature of the 'open systems' model of management?\n(A) Morale (B) Innovation (C) Growth resource (D) Adaptation\nA:  (A)\n\nQ: What are the two main dimensions of the Ohio Studies into leadership?\n(A) Starting position and end position (B) Initial environment and changed environment (C) Organisational structure and conditioning (D) Initiating structure and considerations\nA:  (D)\n\nQ: Which element of the cultural web forms regalia?\n(A) Symbols (B) Rituals and routines (C) Power structures (D) Control systems\nA:  (A)\n\nQ: Hygiene factors are associated with which writer?\n(A) Frederick Hertzberg (B) D.C. McClelland (C) Abraham Maslow (D) Douglas McGregor\nA:  (A)\n\nQ: When does an acquisition take place?\n(A) Two equal partners decide to work together. (B) Two equal partners share resources. (C) Two unequal partners join together. (D) Two unequal partners become one after a buyout.\nA: ",
        {
          "until": [
            "</s>"
          ]
        }
      ]
    ],
    "resps": [
      [
        "(D)"
      ]
    ],
    "filtered_resps": [
      "(D)"
    ],
    "exact_match": 1.0
  },
  {
    "doc_id": 40,
    "doc": {
      "question": "What is a succession plan?",
      "subject": "management",
      "choices": [
        "Dismissing an employee for a more favourable employee",
        "A formal process of planning to fill a role that will become vacant",
        "A vote of no confidence in a board member",
        "The formal process of acquiring a new staff member"
      ],
      "answer": 1
    },
    "target": "(B)",
    "arguments": [
      [
        "The following are multiple choice questions (with answers) about management.\n\nQ: What are the two main dimensions of the Ohio Studies into leadership?\n(A) Starting position and end position (B) Initial environment and changed environment (C) Organisational structure and conditioning (D) Initiating structure and considerations\nA:  (D)\n\nQ: How can organisational structures that are characterised by democratic and inclusive styles of management be described?\n(A) Hierarchical (B) Bureaucratic (C) Flat (D) Functional\nA:  (C)\n\nQ: Which element of the cultural web forms regalia?\n(A) Symbols (B) Rituals and routines (C) Power structures (D) Control systems\nA:  (A)\n\nQ: What characteristic is not a key feature of the 'open systems' model of management?\n(A) Morale (B) Innovation (C) Growth resource (D) Adaptation\nA:  (A)\n\nQ: Hygiene factors are associated with which writer?\n(A) Frederick Hertzberg (B) D.C. McClelland (C) Abraham Maslow (D) Douglas McGregor\nA:  (A)\n\nQ: What is a succession plan?\n(A) Dismissing an employee for a more favourable employee (B) A formal process of planning to fill a role that will become vacant (C) A vote of no confidence in a board member (D) The formal process of acquiring a new staff member\nA: ",
        {
          "until": [
            "</s>"
          ]
        }
      ]
    ],
    "resps": [
      [
        "(B)"
      ]
    ],
    "filtered_resps": [
      "(B)"
    ],
    "exact_match": 1.0
  },
  {
    "doc_id": 48,
    "doc": {
      "question": "What are characteristics of a programmed decision?",
      "subject": "management",
      "choices": [
        "Complex and risky",
        "Uncertain and non-routine",
        "Low risk and certain",
        "Routine and non-complex"
      ],
      "answer": 3
    },
    "target": "(D)",
    "arguments": [
      [
        "The following are multiple choice questions (with answers) about management.\n\nQ: How can organisational structures that are characterised by democratic and inclusive styles of management be described?\n(A) Hierarchical (B) Bureaucratic (C) Flat (D) Functional\nA:  (C)\n\nQ: What are the two main dimensions of the Ohio Studies into leadership?\n(A) Starting position and end position (B) Initial environment and changed environment (C) Organisational structure and conditioning (D) Initiating structure and considerations\nA:  (D)\n\nQ: Which element of the cultural web forms regalia?\n(A) Symbols (B) Rituals and routines (C) Power structures (D) Control systems\nA:  (A)\n\nQ: Hygiene factors are associated with which writer?\n(A) Frederick Hertzberg (B) D.C. McClelland (C) Abraham Maslow (D) Douglas McGregor\nA:  (A)\n\nQ: What characteristic is not a key feature of the 'open systems' model of management?\n(A) Morale (B) Innovation (C) Growth resource (D) Adaptation\nA:  (A)\n\nQ: What are characteristics of a programmed decision?\n(A) Complex and risky (B) Uncertain and non-routine (C) Low risk and certain (D) Routine and non-complex\nA: ",
        {
          "until": [
            "</s>"
          ]
        }
      ]
    ],
    "resps": [
      [
        "(A)"
      ]
    ],
    "filtered_resps": [
      "(A)"
    ],
    "exact_match": 0.0
  },
  {
    "doc_id": 56,
    "doc": {
      "question": "What does PEST stand for?",
      "subject": "management",
      "choices": [
        "Political, environmental, strategic, testing",
        "Political, environmental, strategic, technological",
        "Political, economic, strategic, technological",
        "Political, economic, social, technological"
      ],
      "answer": 3
    },
    "target": "(D)",
    "arguments": [
      [
        "The following are multiple choice questions (with answers) about management.\n\nQ: Which element of the cultural web forms regalia?\n(A) Symbols (B) Rituals and routines (C) Power structures (D) Control systems\nA:  (A)\n\nQ: How can organisational structures that are characterised by democratic and inclusive styles of management be described?\n(A) Hierarchical (B) Bureaucratic (C) Flat (D) Functional\nA:  (C)\n\nQ: What are the two main dimensions of the Ohio Studies into leadership?\n(A) Starting position and end position (B) Initial environment and changed environment (C) Organisational structure and conditioning (D) Initiating structure and considerations\nA:  (D)\n\nQ: What characteristic is not a key feature of the 'open systems' model of management?\n(A) Morale (B) Innovation (C) Growth resource (D) Adaptation\nA:  (A)\n\nQ: Hygiene factors are associated with which writer?\n(A) Frederick Hertzberg (B) D.C. McClelland (C) Abraham Maslow (D) Douglas McGregor\nA:  (A)\n\nQ: What does PEST stand for?\n(A) Political, environmental, strategic, testing (B) Political, environmental, strategic, technological (C) Political, economic, strategic, technological (D) Political, economic, social, technological\nA: ",
        {
          "until": [
            "</s>"
          ]
        }
      ]
    ],
    "resps": [
      [
        "(D)"
      ]
    ],
    "filtered_resps": [
      "(D)"
    ],
    "exact_match": 1.0
  },
  {
    "doc_id": 64,
    "doc": {
      "question": "What is characteristic for the location of a virtual team?",
      "subject": "management",
      "choices": [
        "In the same building",
        "In the same industry",
        "In the same country",
        "remotely"
      ],
      "answer": 3
    },
    "target": "(D)",
    "arguments": [
      [
        "The following are multiple choice questions (with answers) about management.\n\nQ: How can organisational structures that are characterised by democratic and inclusive styles of management be described?\n(A) Hierarchical (B) Bureaucratic (C) Flat (D) Functional\nA:  (C)\n\nQ: What are the two main dimensions of the Ohio Studies into leadership?\n(A) Starting position and end position (B) Initial environment and changed environment (C) Organisational structure and conditioning (D) Initiating structure and considerations\nA:  (D)\n\nQ: Which element of the cultural web forms regalia?\n(A) Symbols (B) Rituals and routines (C) Power structures (D) Control systems\nA:  (A)\n\nQ: What characteristic is not a key feature of the 'open systems' model of management?\n(A) Morale (B) Innovation (C) Growth resource (D) Adaptation\nA:  (A)\n\nQ: Hygiene factors are associated with which writer?\n(A) Frederick Hertzberg (B) D.C. McClelland (C) Abraham Maslow (D) Douglas McGregor\nA:  (A)\n\nQ: What is characteristic for the location of a virtual team?\n(A) In the same building (B) In the same industry (C) In the same country (D) remotely\nA: ",
        {
          "until": [
            "</s>"
          ]
        }
      ]
    ],
    "resps": [
      [
        "(D)"
      ]
    ],
    "filtered_resps": [
      "(D)"
    ],
    "exact_match": 1.0
  },
  {
    "doc_id": 72,
    "doc": {
      "question": "Workers' acceptance of change is characteristic of what type of culture?",
      "subject": "management",
      "choices": [
        "Team culture",
        "Collaborative culture",
        "Group culture",
        "Collective culture"
      ],
      "answer": 1
    },
    "target": "(B)",
    "arguments": [
      [
        "The following are multiple choice questions (with answers) about management.\n\nQ: Which element of the cultural web forms regalia?\n(A) Symbols (B) Rituals and routines (C) Power structures (D) Control systems\nA:  (A)\n\nQ: Hygiene factors are associated with which writer?\n(A) Frederick Hertzberg (B) D.C. McClelland (C) Abraham Maslow (D) Douglas McGregor\nA:  (A)\n\nQ: How can organisational structures that are characterised by democratic and inclusive styles of management be described?\n(A) Hierarchical (B) Bureaucratic (C) Flat (D) Functional\nA:  (C)\n\nQ: What characteristic is not a key feature of the 'open systems' model of management?\n(A) Morale (B) Innovation (C) Growth resource (D) Adaptation\nA:  (A)\n\nQ: What are the two main dimensions of the Ohio Studies into leadership?\n(A) Starting position and end position (B) Initial environment and changed environment (C) Organisational structure and conditioning (D) Initiating structure and considerations\nA:  (D)\n\nQ: Workers' acceptance of change is characteristic of what type of culture?\n(A) Team culture (B) Collaborative culture (C) Group culture (D) Collective culture\nA: ",
        {
          "until": [
            "</s>"
          ]
        }
      ]
    ],
    "resps": [
      [
        "(D)"
      ]
    ],
    "filtered_resps": [
      "(D)"
    ],
    "exact_match": 0.0
  },
  {
    "doc_id": 80,
    "doc": {
      "question": "What is a definition of an objective?",
      "subject": "management",
      "choices": [
        "A defined specified outcome to be achieved in the long-term",
        "A clear set of goals to be attained given a set number of resources",
        "A clearly defined and measurable outcome to be achieved over a specified timeframe",
        "A set standard of performance agreed by workers and managers"
      ],
      "answer": 2
    },
    "target": "(C)",
    "arguments": [
      [
        "The following are multiple choice questions (with answers) about management.\n\nQ: Hygiene factors are associated with which writer?\n(A) Frederick Hertzberg (B) D.C. McClelland (C) Abraham Maslow (D) Douglas McGregor\nA:  (A)\n\nQ: What are the two main dimensions of the Ohio Studies into leadership?\n(A) Starting position and end position (B) Initial environment and changed environment (C) Organisational structure and conditioning (D) Initiating structure and considerations\nA:  (D)\n\nQ: What characteristic is not a key feature of the 'open systems' model of management?\n(A) Morale (B) Innovation (C) Growth resource (D) Adaptation\nA:  (A)\n\nQ: How can organisational structures that are characterised by democratic and inclusive styles of management be described?\n(A) Hierarchical (B) Bureaucratic (C) Flat (D) Functional\nA:  (C)\n\nQ: Which element of the cultural web forms regalia?\n(A) Symbols (B) Rituals and routines (C) Power structures (D) Control systems\nA:  (A)\n\nQ: What is a definition of an objective?\n(A) A defined specified outcome to be achieved in the long-term (B) A clear set of goals to be attained given a set number of resources (C) A clearly defined and measurable outcome to be achieved over a specified timeframe (D) A set standard of performance agreed by workers and managers\nA: ",
        {
          "until": [
            "</s>"
          ]
        }
      ]
    ],
    "resps": [
      [
        "(C)"
      ]
    ],
    "filtered_resps": [
      "(C)"
    ],
    "exact_match": 1.0
  },
  {
    "doc_id": 88,
    "doc": {
      "question": "Which 18th century writer produced a famous book called 'The Wealth of Nations'?",
      "subject": "management",
      "choices": [
        "Frederick Taylor",
        "Henry Mintzberg",
        "Adam Smith",
        "Dr Samuel Johnson"
      ],
      "answer": 2
    },
    "target": "(C)",
    "arguments": [
      [
        "The following are multiple choice questions (with answers) about management.\n\nQ: What are the two main dimensions of the Ohio Studies into leadership?\n(A) Starting position and end position (B) Initial environment and changed environment (C) Organisational structure and conditioning (D) Initiating structure and considerations\nA:  (D)\n\nQ: Hygiene factors are associated with which writer?\n(A) Frederick Hertzberg (B) D.C. McClelland (C) Abraham Maslow (D) Douglas McGregor\nA:  (A)\n\nQ: How can organisational structures that are characterised by democratic and inclusive styles of management be described?\n(A) Hierarchical (B) Bureaucratic (C) Flat (D) Functional\nA:  (C)\n\nQ: Which element of the cultural web forms regalia?\n(A) Symbols (B) Rituals and routines (C) Power structures (D) Control systems\nA:  (A)\n\nQ: What characteristic is not a key feature of the 'open systems' model of management?\n(A) Morale (B) Innovation (C) Growth resource (D) Adaptation\nA:  (A)\n\nQ: Which 18th century writer produced a famous book called 'The Wealth of Nations'?\n(A) Frederick Taylor (B) Henry Mintzberg (C) Adam Smith (D) Dr Samuel Johnson\nA: ",
        {
          "until": [
            "</s>"
          ]
        }
      ]
    ],
    "resps": [
      [
        "(A)"
      ]
    ],
    "filtered_resps": [
      "(A)"
    ],
    "exact_match": 0.0
  },
  {
    "doc_id": 96,
    "doc": {
      "question": "What is the term for an autonomous business entity within an overall corporate enterprise which is set apart from other areas of the business?",
      "subject": "management",
      "choices": [
        "Subsidiary",
        "Strategic partnership",
        "Strategic alliance",
        "Strategic business unit"
      ],
      "answer": 3
    },
    "target": "(D)",
    "arguments": [
      [
        "The following are multiple choice questions (with answers) about management.\n\nQ: What are the two main dimensions of the Ohio Studies into leadership?\n(A) Starting position and end position (B) Initial environment and changed environment (C) Organisational structure and conditioning (D) Initiating structure and considerations\nA:  (D)\n\nQ: Hygiene factors are associated with which writer?\n(A) Frederick Hertzberg (B) D.C. McClelland (C) Abraham Maslow (D) Douglas McGregor\nA:  (A)\n\nQ: Which element of the cultural web forms regalia?\n(A) Symbols (B) Rituals and routines (C) Power structures (D) Control systems\nA:  (A)\n\nQ: What characteristic is not a key feature of the 'open systems' model of management?\n(A) Morale (B) Innovation (C) Growth resource (D) Adaptation\nA:  (A)\n\nQ: How can organisational structures that are characterised by democratic and inclusive styles of management be described?\n(A) Hierarchical (B) Bureaucratic (C) Flat (D) Functional\nA:  (C)\n\nQ: What is the term for an autonomous business entity within an overall corporate enterprise which is set apart from other areas of the business?\n(A) Subsidiary (B) Strategic partnership (C) Strategic alliance (D) Strategic business unit\nA: ",
        {
          "until": [
            "</s>"
          ]
        }
      ]
    ],
    "resps": [
      [
        "(D)"
      ]
    ],
    "filtered_resps": [
      "(D)"
    ],
    "exact_match": 1.0
  },
  {
    "doc_id": 1,
    "doc": {
      "question": "What is the term for the 'rule of thumb' type of bias in decision making?",
      "subject": "management",
      "choices": [
        "Framing bias",
        "Hindsight bias",
        "Over-confidence bias",
        "Heuristics"
      ],
      "answer": 3
    },
    "target": "(D)",
    "arguments": [
      [
        "The following are multiple choice questions (with answers) about management.\n\nQ: What characteristic is not a key feature of the 'open systems' model of management?\n(A) Morale (B) Innovation (C) Growth resource (D) Adaptation\nA:  (A)\n\nQ: What are the two main dimensions of the Ohio Studies into leadership?\n(A) Starting position and end position (B) Initial environment and changed environment (C) Organisational structure and conditioning (D) Initiating structure and considerations\nA:  (D)\n\nQ: How can organisational structures that are characterised by democratic and inclusive styles of management be described?\n(A) Hierarchical (B) Bureaucratic (C) Flat (D) Functional\nA:  (C)\n\nQ: Which element of the cultural web forms regalia?\n(A) Symbols (B) Rituals and routines (C) Power structures (D) Control systems\nA:  (A)\n\nQ: Hygiene factors are associated with which writer?\n(A) Frederick Hertzberg (B) D.C. McClelland (C) Abraham Maslow (D) Douglas McGregor\nA:  (A)\n\nQ: What is the term for the 'rule of thumb' type of bias in decision making?\n(A) Framing bias (B) Hindsight bias (C) Over-confidence bias (D) Heuristics\nA: ",
        {
          "until": [
            "</s>"
          ]
        }
      ]
    ],
    "resps": [
      [
        "(B)"
      ]
    ],
    "filtered_resps": [
      "(B)"
    ],
    "exact_match": 0.0
  },
  {
    "doc_id": 9,
    "doc": {
      "question": "Who of the following is the industrial philanthropist?",
      "subject": "management",
      "choices": [
        "Frederick Taylor",
        "Seebohm Rowntree",
        "Henry Ford",
        "Max Weber"
      ],
      "answer": 1
    },
    "target": "(B)",
    "arguments": [
      [
        "The following are multiple choice questions (with answers) about management.\n\nQ: What are the two main dimensions of the Ohio Studies into leadership?\n(A) Starting position and end position (B) Initial environment and changed environment (C) Organisational structure and conditioning (D) Initiating structure and considerations\nA:  (D)\n\nQ: How can organisational structures that are characterised by democratic and inclusive styles of management be described?\n(A) Hierarchical (B) Bureaucratic (C) Flat (D) Functional\nA:  (C)\n\nQ: Hygiene factors are associated with which writer?\n(A) Frederick Hertzberg (B) D.C. McClelland (C) Abraham Maslow (D) Douglas McGregor\nA:  (A)\n\nQ: What characteristic is not a key feature of the 'open systems' model of management?\n(A) Morale (B) Innovation (C) Growth resource (D) Adaptation\nA:  (A)\n\nQ: Which element of the cultural web forms regalia?\n(A) Symbols (B) Rituals and routines (C) Power structures (D) Control systems\nA:  (A)\n\nQ: Who of the following is the industrial philanthropist?\n(A) Frederick Taylor (B) Seebohm Rowntree (C) Henry Ford (D) Max Weber\nA: ",
        {
          "until": [
            "</s>"
          ]
        }
      ]
    ],
    "resps": [
      [
        "(C)"
      ]
    ],
    "filtered_resps": [
      "(C)"
    ],
    "exact_match": 0.0
  },
  {
    "doc_id": 17,
    "doc": {
      "question": "What one of the following is not a key management skill in planning?",
      "subject": "management",
      "choices": [
        "Conceptual skills",
        "Analytical skills",
        "IT and computing skills",
        "Communication skills"
      ],
      "answer": 2
    },
    "target": "(C)",
    "arguments": [
      [
        "The following are multiple choice questions (with answers) about management.\n\nQ: What are the two main dimensions of the Ohio Studies into leadership?\n(A) Starting position and end position (B) Initial environment and changed environment (C) Organisational structure and conditioning (D) Initiating structure and considerations\nA:  (D)\n\nQ: How can organisational structures that are characterised by democratic and inclusive styles of management be described?\n(A) Hierarchical (B) Bureaucratic (C) Flat (D) Functional\nA:  (C)\n\nQ: Hygiene factors are associated with which writer?\n(A) Frederick Hertzberg (B) D.C. McClelland (C) Abraham Maslow (D) Douglas McGregor\nA:  (A)\n\nQ: Which element of the cultural web forms regalia?\n(A) Symbols (B) Rituals and routines (C) Power structures (D) Control systems\nA:  (A)\n\nQ: What characteristic is not a key feature of the 'open systems' model of management?\n(A) Morale (B) Innovation (C) Growth resource (D) Adaptation\nA:  (A)\n\nQ: What one of the following is not a key management skill in planning?\n(A) Conceptual skills (B) Analytical skills (C) IT and computing skills (D) Communication skills\nA: ",
        {
          "until": [
            "</s>"
          ]
        }
      ]
    ],
    "resps": [
      [
        "(C)"
      ]
    ],
    "filtered_resps": [
      "(C)"
    ],
    "exact_match": 1.0
  },
  {
    "doc_id": 25,
    "doc": {
      "question": "Which is not a characteristic of corporate social responsibility?",
      "subject": "management",
      "choices": [
        "Product safety",
        "Consumer rights",
        "Environmental policies",
        "Price-fixing"
      ],
      "answer": 3
    },
    "target": "(D)",
    "arguments": [
      [
        "The following are multiple choice questions (with answers) about management.\n\nQ: Hygiene factors are associated with which writer?\n(A) Frederick Hertzberg (B) D.C. McClelland (C) Abraham Maslow (D) Douglas McGregor\nA:  (A)\n\nQ: What are the two main dimensions of the Ohio Studies into leadership?\n(A) Starting position and end position (B) Initial environment and changed environment (C) Organisational structure and conditioning (D) Initiating structure and considerations\nA:  (D)\n\nQ: What characteristic is not a key feature of the 'open systems' model of management?\n(A) Morale (B) Innovation (C) Growth resource (D) Adaptation\nA:  (A)\n\nQ: Which element of the cultural web forms regalia?\n(A) Symbols (B) Rituals and routines (C) Power structures (D) Control systems\nA:  (A)\n\nQ: How can organisational structures that are characterised by democratic and inclusive styles of management be described?\n(A) Hierarchical (B) Bureaucratic (C) Flat (D) Functional\nA:  (C)\n\nQ: Which is not a characteristic of corporate social responsibility?\n(A) Product safety (B) Consumer rights (C) Environmental policies (D) Price-fixing\nA: ",
        {
          "until": [
            "</s>"
          ]
        }
      ]
    ],
    "resps": [
      [
        "(D)"
      ]
    ],
    "filtered_resps": [
      "(D)"
    ],
    "exact_match": 1.0
  },
  {
    "doc_id": 33,
    "doc": {
      "question": "Who of these is the entrepreneur?",
      "subject": "management",
      "choices": [
        "Barack Obama",
        "James Dyson",
        "Damien Hirst",
        "Mo Farah"
      ],
      "answer": 1
    },
    "target": "(B)",
    "arguments": [
      [
        "The following are multiple choice questions (with answers) about management.\n\nQ: How can organisational structures that are characterised by democratic and inclusive styles of management be described?\n(A) Hierarchical (B) Bureaucratic (C) Flat (D) Functional\nA:  (C)\n\nQ: What characteristic is not a key feature of the 'open systems' model of management?\n(A) Morale (B) Innovation (C) Growth resource (D) Adaptation\nA:  (A)\n\nQ: What are the two main dimensions of the Ohio Studies into leadership?\n(A) Starting position and end position (B) Initial environment and changed environment (C) Organisational structure and conditioning (D) Initiating structure and considerations\nA:  (D)\n\nQ: Which element of the cultural web forms regalia?\n(A) Symbols (B) Rituals and routines (C) Power structures (D) Control systems\nA:  (A)\n\nQ: Hygiene factors are associated with which writer?\n(A) Frederick Hertzberg (B) D.C. McClelland (C) Abraham Maslow (D) Douglas McGregor\nA:  (A)\n\nQ: Who of these is the entrepreneur?\n(A) Barack Obama (B) James Dyson (C) Damien Hirst (D) Mo Farah\nA: ",
        {
          "until": [
            "</s>"
          ]
        }
      ]
    ],
    "resps": [
      [
        "(D)"
      ]
    ],
    "filtered_resps": [
      "(D)"
    ],
    "exact_match": 0.0
  },
  {
    "doc_id": 41,
    "doc": {
      "question": "What is the definition of a scenario in scenario planning?",
      "subject": "management",
      "choices": [
        "An imagined sequence of future events",
        "An unpredictable event",
        "A planned for event",
        "An unplanned for event"
      ],
      "answer": 0
    },
    "target": "(A)",
    "arguments": [
      [
        "The following are multiple choice questions (with answers) about management.\n\nQ: What are the two main dimensions of the Ohio Studies into leadership?\n(A) Starting position and end position (B) Initial environment and changed environment (C) Organisational structure and conditioning (D) Initiating structure and considerations\nA:  (D)\n\nQ: How can organisational structures that are characterised by democratic and inclusive styles of management be described?\n(A) Hierarchical (B) Bureaucratic (C) Flat (D) Functional\nA:  (C)\n\nQ: Which element of the cultural web forms regalia?\n(A) Symbols (B) Rituals and routines (C) Power structures (D) Control systems\nA:  (A)\n\nQ: What characteristic is not a key feature of the 'open systems' model of management?\n(A) Morale (B) Innovation (C) Growth resource (D) Adaptation\nA:  (A)\n\nQ: Hygiene factors are associated with which writer?\n(A) Frederick Hertzberg (B) D.C. McClelland (C) Abraham Maslow (D) Douglas McGregor\nA:  (A)\n\nQ: What is the definition of a scenario in scenario planning?\n(A) An imagined sequence of future events (B) An unpredictable event (C) A planned for event (D) An unplanned for event\nA: ",
        {
          "until": [
            "</s>"
          ]
        }
      ]
    ],
    "resps": [
      [
        "(A)"
      ]
    ],
    "filtered_resps": [
      "(A)"
    ],
    "exact_match": 1.0
  },
  {
    "doc_id": 49,
    "doc": {
      "question": "What is not an advantage of a hierarchical structure?",
      "subject": "management",
      "choices": [
        "Clear chain of command",
        "Quick response to change",
        "Discipline and stability",
        "Small span of control"
      ],
      "answer": 1
    },
    "target": "(B)",
    "arguments": [
      [
        "The following are multiple choice questions (with answers) about management.\n\nQ: How can organisational structures that are characterised by democratic and inclusive styles of management be described?\n(A) Hierarchical (B) Bureaucratic (C) Flat (D) Functional\nA:  (C)\n\nQ: What are the two main dimensions of the Ohio Studies into leadership?\n(A) Starting position and end position (B) Initial environment and changed environment (C) Organisational structure and conditioning (D) Initiating structure and considerations\nA:  (D)\n\nQ: Which element of the cultural web forms regalia?\n(A) Symbols (B) Rituals and routines (C) Power structures (D) Control systems\nA:  (A)\n\nQ: Hygiene factors are associated with which writer?\n(A) Frederick Hertzberg (B) D.C. McClelland (C) Abraham Maslow (D) Douglas McGregor\nA:  (A)\n\nQ: What characteristic is not a key feature of the 'open systems' model of management?\n(A) Morale (B) Innovation (C) Growth resource (D) Adaptation\nA:  (A)\n\nQ: What is not an advantage of a hierarchical structure?\n(A) Clear chain of command (B) Quick response to change (C) Discipline and stability (D) Small span of control\nA: ",
        {
          "until": [
            "</s>"
          ]
        }
      ]
    ],
    "resps": [
      [
        "(D)"
      ]
    ],
    "filtered_resps": [
      "(D)"
    ],
    "exact_match": 0.0
  },
  {
    "doc_id": 57,
    "doc": {
      "question": "What does the acronym SMART stand for?",
      "subject": "management",
      "choices": [
        "Suitable, measurable, actionable, rewarded and timely",
        "Specific, measurable, actionable, resourced and timely",
        "Standardised, measurable, achievable, rewarded, and timely",
        "Specific, measurable, achievable, rewarded and timely"
      ],
      "answer": 3
    },
    "target": "(D)",
    "arguments": [
      [
        "The following are multiple choice questions (with answers) about management.\n\nQ: Which element of the cultural web forms regalia?\n(A) Symbols (B) Rituals and routines (C) Power structures (D) Control systems\nA:  (A)\n\nQ: How can organisational structures that are characterised by democratic and inclusive styles of management be described?\n(A) Hierarchical (B) Bureaucratic (C) Flat (D) Functional\nA:  (C)\n\nQ: What are the two main dimensions of the Ohio Studies into leadership?\n(A) Starting position and end position (B) Initial environment and changed environment (C) Organisational structure and conditioning (D) Initiating structure and considerations\nA:  (D)\n\nQ: What characteristic is not a key feature of the 'open systems' model of management?\n(A) Morale (B) Innovation (C) Growth resource (D) Adaptation\nA:  (A)\n\nQ: Hygiene factors are associated with which writer?\n(A) Frederick Hertzberg (B) D.C. McClelland (C) Abraham Maslow (D) Douglas McGregor\nA:  (A)\n\nQ: What does the acronym SMART stand for?\n(A) Suitable, measurable, actionable, rewarded and timely (B) Specific, measurable, actionable, resourced and timely (C) Standardised, measurable, achievable, rewarded, and timely (D) Specific, measurable, achievable, rewarded and timely\nA: ",
        {
          "until": [
            "</s>"
          ]
        }
      ]
    ],
    "resps": [
      [
        "(D)"
      ]
    ],
    "filtered_resps": [
      "(D)"
    ],
    "exact_match": 1.0
  },
  {
    "doc_id": 65,
    "doc": {
      "question": "According to the Five Factor model, 'extraversion' as a personality type is characterised by what type of people?",
      "subject": "management",
      "choices": [
        "Good natured",
        "Calm and self-confident",
        "Sensitive and curious",
        "Assertive and sociable"
      ],
      "answer": 3
    },
    "target": "(D)",
    "arguments": [
      [
        "The following are multiple choice questions (with answers) about management.\n\nQ: How can organisational structures that are characterised by democratic and inclusive styles of management be described?\n(A) Hierarchical (B) Bureaucratic (C) Flat (D) Functional\nA:  (C)\n\nQ: What are the two main dimensions of the Ohio Studies into leadership?\n(A) Starting position and end position (B) Initial environment and changed environment (C) Organisational structure and conditioning (D) Initiating structure and considerations\nA:  (D)\n\nQ: Which element of the cultural web forms regalia?\n(A) Symbols (B) Rituals and routines (C) Power structures (D) Control systems\nA:  (A)\n\nQ: What characteristic is not a key feature of the 'open systems' model of management?\n(A) Morale (B) Innovation (C) Growth resource (D) Adaptation\nA:  (A)\n\nQ: Hygiene factors are associated with which writer?\n(A) Frederick Hertzberg (B) D.C. McClelland (C) Abraham Maslow (D) Douglas McGregor\nA:  (A)\n\nQ: According to the Five Factor model, 'extraversion' as a personality type is characterised by what type of people?\n(A) Good natured (B) Calm and self-confident (C) Sensitive and curious (D) Assertive and sociable\nA: ",
        {
          "until": [
            "</s>"
          ]
        }
      ]
    ],
    "resps": [
      [
        "(D)"
      ]
    ],
    "filtered_resps": [
      "(D)"
    ],
    "exact_match": 1.0
  },
  {
    "doc_id": 73,
    "doc": {
      "question": "What is a virtual organisation?",
      "subject": "management",
      "choices": [
        "An organisation that uses information and communications technologies (ICT's) to coordinate activities without physical boundaries between different functions",
        "An organisation that uses internet technologies to sell products to customers",
        "An organisation that manages the supply chain using digital technologies",
        "An organisation that coordinates the workforce via video conferencing"
      ],
      "answer": 0
    },
    "target": "(A)",
    "arguments": [
      [
        "The following are multiple choice questions (with answers) about management.\n\nQ: Which element of the cultural web forms regalia?\n(A) Symbols (B) Rituals and routines (C) Power structures (D) Control systems\nA:  (A)\n\nQ: Hygiene factors are associated with which writer?\n(A) Frederick Hertzberg (B) D.C. McClelland (C) Abraham Maslow (D) Douglas McGregor\nA:  (A)\n\nQ: How can organisational structures that are characterised by democratic and inclusive styles of management be described?\n(A) Hierarchical (B) Bureaucratic (C) Flat (D) Functional\nA:  (C)\n\nQ: What characteristic is not a key feature of the 'open systems' model of management?\n(A) Morale (B) Innovation (C) Growth resource (D) Adaptation\nA:  (A)\n\nQ: What are the two main dimensions of the Ohio Studies into leadership?\n(A) Starting position and end position (B) Initial environment and changed environment (C) Organisational structure and conditioning (D) Initiating structure and considerations\nA:  (D)\n\nQ: What is a virtual organisation?\n(A) An organisation that uses information and communications technologies (ICT's) to coordinate activities without physical boundaries between different functions (B) An organisation that uses internet technologies to sell products to customers (C) An organisation that manages the supply chain using digital technologies (D) An organisation that coordinates the workforce via video conferencing\nA: ",
        {
          "until": [
            "</s>"
          ]
        }
      ]
    ],
    "resps": [
      [
        "(A)"
      ]
    ],
    "filtered_resps": [
      "(A)"
    ],
    "exact_match": 1.0
  },
  {
    "doc_id": 81,
    "doc": {
      "question": "What is not a purpose of an organisational structure?",
      "subject": "management",
      "choices": [
        "To coordinate people and resources",
        "To organise lines of communication",
        "To formalise authority",
        "To limit workers' rights"
      ],
      "answer": 3
    },
    "target": "(D)",
    "arguments": [
      [
        "The following are multiple choice questions (with answers) about management.\n\nQ: Hygiene factors are associated with which writer?\n(A) Frederick Hertzberg (B) D.C. McClelland (C) Abraham Maslow (D) Douglas McGregor\nA:  (A)\n\nQ: What are the two main dimensions of the Ohio Studies into leadership?\n(A) Starting position and end position (B) Initial environment and changed environment (C) Organisational structure and conditioning (D) Initiating structure and considerations\nA:  (D)\n\nQ: What characteristic is not a key feature of the 'open systems' model of management?\n(A) Morale (B) Innovation (C) Growth resource (D) Adaptation\nA:  (A)\n\nQ: How can organisational structures that are characterised by democratic and inclusive styles of management be described?\n(A) Hierarchical (B) Bureaucratic (C) Flat (D) Functional\nA:  (C)\n\nQ: Which element of the cultural web forms regalia?\n(A) Symbols (B) Rituals and routines (C) Power structures (D) Control systems\nA:  (A)\n\nQ: What is not a purpose of an organisational structure?\n(A) To coordinate people and resources (B) To organise lines of communication (C) To formalise authority (D) To limit workers' rights\nA: ",
        {
          "until": [
            "</s>"
          ]
        }
      ]
    ],
    "resps": [
      [
        "(D)"
      ]
    ],
    "filtered_resps": [
      "(D)"
    ],
    "exact_match": 1.0
  },
  {
    "doc_id": 89,
    "doc": {
      "question": "Which one of these characteristics is most commonly associated with the 'rational goal' model of management?",
      "subject": "management",
      "choices": [
        "Worker welfare",
        "Health and safety",
        "Interpersonal relationships",
        "Productivity"
      ],
      "answer": 3
    },
    "target": "(D)",
    "arguments": [
      [
        "The following are multiple choice questions (with answers) about management.\n\nQ: What are the two main dimensions of the Ohio Studies into leadership?\n(A) Starting position and end position (B) Initial environment and changed environment (C) Organisational structure and conditioning (D) Initiating structure and considerations\nA:  (D)\n\nQ: Hygiene factors are associated with which writer?\n(A) Frederick Hertzberg (B) D.C. McClelland (C) Abraham Maslow (D) Douglas McGregor\nA:  (A)\n\nQ: How can organisational structures that are characterised by democratic and inclusive styles of management be described?\n(A) Hierarchical (B) Bureaucratic (C) Flat (D) Functional\nA:  (C)\n\nQ: Which element of the cultural web forms regalia?\n(A) Symbols (B) Rituals and routines (C) Power structures (D) Control systems\nA:  (A)\n\nQ: What characteristic is not a key feature of the 'open systems' model of management?\n(A) Morale (B) Innovation (C) Growth resource (D) Adaptation\nA:  (A)\n\nQ: Which one of these characteristics is most commonly associated with the 'rational goal' model of management?\n(A) Worker welfare (B) Health and safety (C) Interpersonal relationships (D) Productivity\nA: ",
        {
          "until": [
            "</s>"
          ]
        }
      ]
    ],
    "resps": [
      [
        "(D)"
      ]
    ],
    "filtered_resps": [
      "(D)"
    ],
    "exact_match": 1.0
  },
  {
    "doc_id": 97,
    "doc": {
      "question": "What is not a characteristic of a corporate social responsibility framework?",
      "subject": "management",
      "choices": [
        "Retaining the status quo",
        "Understanding society",
        "Harnessing diversity",
        "Building capacity"
      ],
      "answer": 0
    },
    "target": "(A)",
    "arguments": [
      [
        "The following are multiple choice questions (with answers) about management.\n\nQ: What are the two main dimensions of the Ohio Studies into leadership?\n(A) Starting position and end position (B) Initial environment and changed environment (C) Organisational structure and conditioning (D) Initiating structure and considerations\nA:  (D)\n\nQ: Hygiene factors are associated with which writer?\n(A) Frederick Hertzberg (B) D.C. McClelland (C) Abraham Maslow (D) Douglas McGregor\nA:  (A)\n\nQ: Which element of the cultural web forms regalia?\n(A) Symbols (B) Rituals and routines (C) Power structures (D) Control systems\nA:  (A)\n\nQ: What characteristic is not a key feature of the 'open systems' model of management?\n(A) Morale (B) Innovation (C) Growth resource (D) Adaptation\nA:  (A)\n\nQ: How can organisational structures that are characterised by democratic and inclusive styles of management be described?\n(A) Hierarchical (B) Bureaucratic (C) Flat (D) Functional\nA:  (C)\n\nQ: What is not a characteristic of a corporate social responsibility framework?\n(A) Retaining the status quo (B) Understanding society (C) Harnessing diversity (D) Building capacity\nA: ",
        {
          "until": [
            "</s>"
          ]
        }
      ]
    ],
    "resps": [
      [
        "(A)"
      ]
    ],
    "filtered_resps": [
      "(A)"
    ],
    "exact_match": 1.0
  },
  {
    "doc_id": 2,
    "doc": {
      "question": "What is a normative perspective?",
      "subject": "management",
      "choices": [
        "The way things are.",
        "The way things are going to be.",
        "The way things should be.",
        "The way things were."
      ],
      "answer": 2
    },
    "target": "(C)",
    "arguments": [
      [
        "The following are multiple choice questions (with answers) about management.\n\nQ: What characteristic is not a key feature of the 'open systems' model of management?\n(A) Morale (B) Innovation (C) Growth resource (D) Adaptation\nA:  (A)\n\nQ: What are the two main dimensions of the Ohio Studies into leadership?\n(A) Starting position and end position (B) Initial environment and changed environment (C) Organisational structure and conditioning (D) Initiating structure and considerations\nA:  (D)\n\nQ: How can organisational structures that are characterised by democratic and inclusive styles of management be described?\n(A) Hierarchical (B) Bureaucratic (C) Flat (D) Functional\nA:  (C)\n\nQ: Which element of the cultural web forms regalia?\n(A) Symbols (B) Rituals and routines (C) Power structures (D) Control systems\nA:  (A)\n\nQ: Hygiene factors are associated with which writer?\n(A) Frederick Hertzberg (B) D.C. McClelland (C) Abraham Maslow (D) Douglas McGregor\nA:  (A)\n\nQ: What is a normative perspective?\n(A) The way things are. (B) The way things are going to be. (C) The way things should be. (D) The way things were.\nA: ",
        {
          "until": [
            "</s>"
          ]
        }
      ]
    ],
    "resps": [
      [
        "(C)"
      ]
    ],
    "filtered_resps": [
      "(C)"
    ],
    "exact_match": 1.0
  },
  {
    "doc_id": 10,
    "doc": {
      "question": "Individualism as a guiding moral philosophy was advocated by which economist?",
      "subject": "management",
      "choices": [
        "John Kenneth Galbraith",
        "John Maynard Keynes",
        "Milton Friedman",
        "Alfred Marshall"
      ],
      "answer": 2
    },
    "target": "(C)",
    "arguments": [
      [
        "The following are multiple choice questions (with answers) about management.\n\nQ: What are the two main dimensions of the Ohio Studies into leadership?\n(A) Starting position and end position (B) Initial environment and changed environment (C) Organisational structure and conditioning (D) Initiating structure and considerations\nA:  (D)\n\nQ: How can organisational structures that are characterised by democratic and inclusive styles of management be described?\n(A) Hierarchical (B) Bureaucratic (C) Flat (D) Functional\nA:  (C)\n\nQ: Hygiene factors are associated with which writer?\n(A) Frederick Hertzberg (B) D.C. McClelland (C) Abraham Maslow (D) Douglas McGregor\nA:  (A)\n\nQ: What characteristic is not a key feature of the 'open systems' model of management?\n(A) Morale (B) Innovation (C) Growth resource (D) Adaptation\nA:  (A)\n\nQ: Which element of the cultural web forms regalia?\n(A) Symbols (B) Rituals and routines (C) Power structures (D) Control systems\nA:  (A)\n\nQ: Individualism as a guiding moral philosophy was advocated by which economist?\n(A) John Kenneth Galbraith (B) John Maynard Keynes (C) Milton Friedman (D) Alfred Marshall\nA: ",
        {
          "until": [
            "</s>"
          ]
        }
      ]
    ],
    "resps": [
      [
        "(B)"
      ]
    ],
    "filtered_resps": [
      "(B)"
    ],
    "exact_match": 0.0
  },
  {
    "doc_id": 18,
    "doc": {
      "question": "According to Belbin (1981) an extroverted and enthusiastic person fits with what role?",
      "subject": "management",
      "choices": [
        "Co-ordinator",
        "Shaper",
        "Resource investigator",
        "Implementer"
      ],
      "answer": 2
    },
    "target": "(C)",
    "arguments": [
      [
        "The following are multiple choice questions (with answers) about management.\n\nQ: What are the two main dimensions of the Ohio Studies into leadership?\n(A) Starting position and end position (B) Initial environment and changed environment (C) Organisational structure and conditioning (D) Initiating structure and considerations\nA:  (D)\n\nQ: How can organisational structures that are characterised by democratic and inclusive styles of management be described?\n(A) Hierarchical (B) Bureaucratic (C) Flat (D) Functional\nA:  (C)\n\nQ: Hygiene factors are associated with which writer?\n(A) Frederick Hertzberg (B) D.C. McClelland (C) Abraham Maslow (D) Douglas McGregor\nA:  (A)\n\nQ: Which element of the cultural web forms regalia?\n(A) Symbols (B) Rituals and routines (C) Power structures (D) Control systems\nA:  (A)\n\nQ: What characteristic is not a key feature of the 'open systems' model of management?\n(A) Morale (B) Innovation (C) Growth resource (D) Adaptation\nA:  (A)\n\nQ: According to Belbin (1981) an extroverted and enthusiastic person fits with what role?\n(A) Co-ordinator (B) Shaper (C) Resource investigator (D) Implementer\nA: ",
        {
          "until": [
            "</s>"
          ]
        }
      ]
    ],
    "resps": [
      [
        "(D)"
      ]
    ],
    "filtered_resps": [
      "(D)"
    ],
    "exact_match": 0.0
  },
  {
    "doc_id": 26,
    "doc": {
      "question": "Who was a major protagonist of utilitarianism?",
      "subject": "management",
      "choices": [
        "John Stuart Mill",
        "Thomas Hobbes",
        "Karl Marx",
        "Adam Smith"
      ],
      "answer": 0
    },
    "target": "(A)",
    "arguments": [
      [
        "The following are multiple choice questions (with answers) about management.\n\nQ: Hygiene factors are associated with which writer?\n(A) Frederick Hertzberg (B) D.C. McClelland (C) Abraham Maslow (D) Douglas McGregor\nA:  (A)\n\nQ: What are the two main dimensions of the Ohio Studies into leadership?\n(A) Starting position and end position (B) Initial environment and changed environment (C) Organisational structure and conditioning (D) Initiating structure and considerations\nA:  (D)\n\nQ: What characteristic is not a key feature of the 'open systems' model of management?\n(A) Morale (B) Innovation (C) Growth resource (D) Adaptation\nA:  (A)\n\nQ: Which element of the cultural web forms regalia?\n(A) Symbols (B) Rituals and routines (C) Power structures (D) Control systems\nA:  (A)\n\nQ: How can organisational structures that are characterised by democratic and inclusive styles of management be described?\n(A) Hierarchical (B) Bureaucratic (C) Flat (D) Functional\nA:  (C)\n\nQ: Who was a major protagonist of utilitarianism?\n(A) John Stuart Mill (B) Thomas Hobbes (C) Karl Marx (D) Adam Smith\nA: ",
        {
          "until": [
            "</s>"
          ]
        }
      ]
    ],
    "resps": [
      [
        "(C)"
      ]
    ],
    "filtered_resps": [
      "(C)"
    ],
    "exact_match": 0.0
  },
  {
    "doc_id": 34,
    "doc": {
      "question": "Which of these is not an advantage of a virtual team?",
      "subject": "management",
      "choices": [
        "Team members can be recruited for their specific skills or experience.",
        "No overhead costs associated with physical buildings.",
        "Conflict can be resolved easily using face-to-face meetings.",
        "Low transport or commuting costs."
      ],
      "answer": 2
    },
    "target": "(C)",
    "arguments": [
      [
        "The following are multiple choice questions (with answers) about management.\n\nQ: How can organisational structures that are characterised by democratic and inclusive styles of management be described?\n(A) Hierarchical (B) Bureaucratic (C) Flat (D) Functional\nA:  (C)\n\nQ: What characteristic is not a key feature of the 'open systems' model of management?\n(A) Morale (B) Innovation (C) Growth resource (D) Adaptation\nA:  (A)\n\nQ: What are the two main dimensions of the Ohio Studies into leadership?\n(A) Starting position and end position (B) Initial environment and changed environment (C) Organisational structure and conditioning (D) Initiating structure and considerations\nA:  (D)\n\nQ: Which element of the cultural web forms regalia?\n(A) Symbols (B) Rituals and routines (C) Power structures (D) Control systems\nA:  (A)\n\nQ: Hygiene factors are associated with which writer?\n(A) Frederick Hertzberg (B) D.C. McClelland (C) Abraham Maslow (D) Douglas McGregor\nA:  (A)\n\nQ: Which of these is not an advantage of a virtual team?\n(A) Team members can be recruited for their specific skills or experience. (B) No overhead costs associated with physical buildings. (C) Conflict can be resolved easily using face-to-face meetings. (D) Low transport or commuting costs.\nA: ",
        {
          "until": [
            "</s>"
          ]
        }
      ]
    ],
    "resps": [
      [
        "(C)"
      ]
    ],
    "filtered_resps": [
      "(C)"
    ],
    "exact_match": 1.0
  },
  {
    "doc_id": 42,
    "doc": {
      "question": "What assumption is the garbage can model of decision making based on?",
      "subject": "management",
      "choices": [
        "Limited knowledge and great insight",
        "Limited knowledge but high level of experience",
        "Limited knowledge and uncertainty",
        "Limited knowledge and high risk"
      ],
      "answer": 2
    },
    "target": "(C)",
    "arguments": [
      [
        "The following are multiple choice questions (with answers) about management.\n\nQ: What are the two main dimensions of the Ohio Studies into leadership?\n(A) Starting position and end position (B) Initial environment and changed environment (C) Organisational structure and conditioning (D) Initiating structure and considerations\nA:  (D)\n\nQ: How can organisational structures that are characterised by democratic and inclusive styles of management be described?\n(A) Hierarchical (B) Bureaucratic (C) Flat (D) Functional\nA:  (C)\n\nQ: Which element of the cultural web forms regalia?\n(A) Symbols (B) Rituals and routines (C) Power structures (D) Control systems\nA:  (A)\n\nQ: What characteristic is not a key feature of the 'open systems' model of management?\n(A) Morale (B) Innovation (C) Growth resource (D) Adaptation\nA:  (A)\n\nQ: Hygiene factors are associated with which writer?\n(A) Frederick Hertzberg (B) D.C. McClelland (C) Abraham Maslow (D) Douglas McGregor\nA:  (A)\n\nQ: What assumption is the garbage can model of decision making based on?\n(A) Limited knowledge and great insight (B) Limited knowledge but high level of experience (C) Limited knowledge and uncertainty (D) Limited knowledge and high risk\nA: ",
        {
          "until": [
            "</s>"
          ]
        }
      ]
    ],
    "resps": [
      [
        "(C)"
      ]
    ],
    "filtered_resps": [
      "(C)"
    ],
    "exact_match": 1.0
  },
  {
    "doc_id": 50,
    "doc": {
      "question": "What is a strategic alliance?",
      "subject": "management",
      "choices": [
        "Any form of partnership between one firm and another",
        "Formal agreement committing two or more firms to exchange resources to produce products or services",
        "Formal agreement to share profits from a shared investment",
        "Formal agreement to share knowledge"
      ],
      "answer": 1
    },
    "target": "(B)",
    "arguments": [
      [
        "The following are multiple choice questions (with answers) about management.\n\nQ: How can organisational structures that are characterised by democratic and inclusive styles of management be described?\n(A) Hierarchical (B) Bureaucratic (C) Flat (D) Functional\nA:  (C)\n\nQ: What are the two main dimensions of the Ohio Studies into leadership?\n(A) Starting position and end position (B) Initial environment and changed environment (C) Organisational structure and conditioning (D) Initiating structure and considerations\nA:  (D)\n\nQ: Which element of the cultural web forms regalia?\n(A) Symbols (B) Rituals and routines (C) Power structures (D) Control systems\nA:  (A)\n\nQ: Hygiene factors are associated with which writer?\n(A) Frederick Hertzberg (B) D.C. McClelland (C) Abraham Maslow (D) Douglas McGregor\nA:  (A)\n\nQ: What characteristic is not a key feature of the 'open systems' model of management?\n(A) Morale (B) Innovation (C) Growth resource (D) Adaptation\nA:  (A)\n\nQ: What is a strategic alliance?\n(A) Any form of partnership between one firm and another (B) Formal agreement committing two or more firms to exchange resources to produce products or services (C) Formal agreement to share profits from a shared investment (D) Formal agreement to share knowledge\nA: ",
        {
          "until": [
            "</s>"
          ]
        }
      ]
    ],
    "resps": [
      [
        "(A)"
      ]
    ],
    "filtered_resps": [
      "(A)"
    ],
    "exact_match": 0.0
  },
  {
    "doc_id": 58,
    "doc": {
      "question": "Which writer was concerned with the reaction of workers to key characteristics of bureaucracies?",
      "subject": "management",
      "choices": [
        "Merton",
        "Weber",
        "Gouldner",
        "Mayo"
      ],
      "answer": 2
    },
    "target": "(C)",
    "arguments": [
      [
        "The following are multiple choice questions (with answers) about management.\n\nQ: Which element of the cultural web forms regalia?\n(A) Symbols (B) Rituals and routines (C) Power structures (D) Control systems\nA:  (A)\n\nQ: How can organisational structures that are characterised by democratic and inclusive styles of management be described?\n(A) Hierarchical (B) Bureaucratic (C) Flat (D) Functional\nA:  (C)\n\nQ: What are the two main dimensions of the Ohio Studies into leadership?\n(A) Starting position and end position (B) Initial environment and changed environment (C) Organisational structure and conditioning (D) Initiating structure and considerations\nA:  (D)\n\nQ: What characteristic is not a key feature of the 'open systems' model of management?\n(A) Morale (B) Innovation (C) Growth resource (D) Adaptation\nA:  (A)\n\nQ: Hygiene factors are associated with which writer?\n(A) Frederick Hertzberg (B) D.C. McClelland (C) Abraham Maslow (D) Douglas McGregor\nA:  (A)\n\nQ: Which writer was concerned with the reaction of workers to key characteristics of bureaucracies?\n(A) Merton (B) Weber (C) Gouldner (D) Mayo\nA: ",
        {
          "until": [
            "</s>"
          ]
        }
      ]
    ],
    "resps": [
      [
        "(B)"
      ]
    ],
    "filtered_resps": [
      "(B)"
    ],
    "exact_match": 0.0
  },
  {
    "doc_id": 66,
    "doc": {
      "question": "What is the overriding philosophy underpinning the strategic direction of an organisation?",
      "subject": "management",
      "choices": [
        "Vision statement",
        "Mission statement",
        "Strategy statement",
        "Business statement"
      ],
      "answer": 1
    },
    "target": "(B)",
    "arguments": [
      [
        "The following are multiple choice questions (with answers) about management.\n\nQ: How can organisational structures that are characterised by democratic and inclusive styles of management be described?\n(A) Hierarchical (B) Bureaucratic (C) Flat (D) Functional\nA:  (C)\n\nQ: What are the two main dimensions of the Ohio Studies into leadership?\n(A) Starting position and end position (B) Initial environment and changed environment (C) Organisational structure and conditioning (D) Initiating structure and considerations\nA:  (D)\n\nQ: Which element of the cultural web forms regalia?\n(A) Symbols (B) Rituals and routines (C) Power structures (D) Control systems\nA:  (A)\n\nQ: What characteristic is not a key feature of the 'open systems' model of management?\n(A) Morale (B) Innovation (C) Growth resource (D) Adaptation\nA:  (A)\n\nQ: Hygiene factors are associated with which writer?\n(A) Frederick Hertzberg (B) D.C. McClelland (C) Abraham Maslow (D) Douglas McGregor\nA:  (A)\n\nQ: What is the overriding philosophy underpinning the strategic direction of an organisation?\n(A) Vision statement (B) Mission statement (C) Strategy statement (D) Business statement\nA: ",
        {
          "until": [
            "</s>"
          ]
        }
      ]
    ],
    "resps": [
      [
        "(C)"
      ]
    ],
    "filtered_resps": [
      "(C)"
    ],
    "exact_match": 0.0
  },
  {
    "doc_id": 74,
    "doc": {
      "question": "From what does a chain of command extend?",
      "subject": "management",
      "choices": [
        "Bottom to top",
        "Top to bottom",
        "Diagonally",
        "Laterally"
      ],
      "answer": 1
    },
    "target": "(B)",
    "arguments": [
      [
        "The following are multiple choice questions (with answers) about management.\n\nQ: Which element of the cultural web forms regalia?\n(A) Symbols (B) Rituals and routines (C) Power structures (D) Control systems\nA:  (A)\n\nQ: Hygiene factors are associated with which writer?\n(A) Frederick Hertzberg (B) D.C. McClelland (C) Abraham Maslow (D) Douglas McGregor\nA:  (A)\n\nQ: How can organisational structures that are characterised by democratic and inclusive styles of management be described?\n(A) Hierarchical (B) Bureaucratic (C) Flat (D) Functional\nA:  (C)\n\nQ: What characteristic is not a key feature of the 'open systems' model of management?\n(A) Morale (B) Innovation (C) Growth resource (D) Adaptation\nA:  (A)\n\nQ: What are the two main dimensions of the Ohio Studies into leadership?\n(A) Starting position and end position (B) Initial environment and changed environment (C) Organisational structure and conditioning (D) Initiating structure and considerations\nA:  (D)\n\nQ: From what does a chain of command extend?\n(A) Bottom to top (B) Top to bottom (C) Diagonally (D) Laterally\nA: ",
        {
          "until": [
            "</s>"
          ]
        }
      ]
    ],
    "resps": [
      [
        "(D)"
      ]
    ],
    "filtered_resps": [
      "(D)"
    ],
    "exact_match": 0.0
  },
  {
    "doc_id": 82,
    "doc": {
      "question": "To what time-frame do strategic plans relate?",
      "subject": "management",
      "choices": [
        "Long-term",
        "Medium-term",
        "Short-term",
        "Unspecified time it takes to achieve an aim"
      ],
      "answer": 0
    },
    "target": "(A)",
    "arguments": [
      [
        "The following are multiple choice questions (with answers) about management.\n\nQ: Hygiene factors are associated with which writer?\n(A) Frederick Hertzberg (B) D.C. McClelland (C) Abraham Maslow (D) Douglas McGregor\nA:  (A)\n\nQ: What are the two main dimensions of the Ohio Studies into leadership?\n(A) Starting position and end position (B) Initial environment and changed environment (C) Organisational structure and conditioning (D) Initiating structure and considerations\nA:  (D)\n\nQ: What characteristic is not a key feature of the 'open systems' model of management?\n(A) Morale (B) Innovation (C) Growth resource (D) Adaptation\nA:  (A)\n\nQ: How can organisational structures that are characterised by democratic and inclusive styles of management be described?\n(A) Hierarchical (B) Bureaucratic (C) Flat (D) Functional\nA:  (C)\n\nQ: Which element of the cultural web forms regalia?\n(A) Symbols (B) Rituals and routines (C) Power structures (D) Control systems\nA:  (A)\n\nQ: To what time-frame do strategic plans relate?\n(A) Long-term (B) Medium-term (C) Short-term (D) Unspecified time it takes to achieve an aim\nA: ",
        {
          "until": [
            "</s>"
          ]
        }
      ]
    ],
    "resps": [
      [
        "(A)"
      ]
    ],
    "filtered_resps": [
      "(A)"
    ],
    "exact_match": 1.0
  },
  {
    "doc_id": 90,
    "doc": {
      "question": "In what order do managers typically perform the managerial functions?",
      "subject": "management",
      "choices": [
        "organising, planning, controlling, leading",
        "organising, leading, planning, controlling",
        "planning, organising, leading, controlling",
        "planning, organising, controlling, leading"
      ],
      "answer": 2
    },
    "target": "(C)",
    "arguments": [
      [
        "The following are multiple choice questions (with answers) about management.\n\nQ: What are the two main dimensions of the Ohio Studies into leadership?\n(A) Starting position and end position (B) Initial environment and changed environment (C) Organisational structure and conditioning (D) Initiating structure and considerations\nA:  (D)\n\nQ: Hygiene factors are associated with which writer?\n(A) Frederick Hertzberg (B) D.C. McClelland (C) Abraham Maslow (D) Douglas McGregor\nA:  (A)\n\nQ: How can organisational structures that are characterised by democratic and inclusive styles of management be described?\n(A) Hierarchical (B) Bureaucratic (C) Flat (D) Functional\nA:  (C)\n\nQ: Which element of the cultural web forms regalia?\n(A) Symbols (B) Rituals and routines (C) Power structures (D) Control systems\nA:  (A)\n\nQ: What characteristic is not a key feature of the 'open systems' model of management?\n(A) Morale (B) Innovation (C) Growth resource (D) Adaptation\nA:  (A)\n\nQ: In what order do managers typically perform the managerial functions?\n(A) organising, planning, controlling, leading (B) organising, leading, planning, controlling (C) planning, organising, leading, controlling (D) planning, organising, controlling, leading\nA: ",
        {
          "until": [
            "</s>"
          ]
        }
      ]
    ],
    "resps": [
      [
        "(D)"
      ]
    ],
    "filtered_resps": [
      "(D)"
    ],
    "exact_match": 0.0
  },
  {
    "doc_id": 98,
    "doc": {
      "question": "What is a whistleblower?",
      "subject": "management",
      "choices": [
        "Someone who reports illegal or unethical acts",
        "Someone who commits illegal or unethical acts",
        "Someone who benefits from illegal or unethical acts",
        "Someone who devises illegal or unethical acts"
      ],
      "answer": 0
    },
    "target": "(A)",
    "arguments": [
      [
        "The following are multiple choice questions (with answers) about management.\n\nQ: What are the two main dimensions of the Ohio Studies into leadership?\n(A) Starting position and end position (B) Initial environment and changed environment (C) Organisational structure and conditioning (D) Initiating structure and considerations\nA:  (D)\n\nQ: Hygiene factors are associated with which writer?\n(A) Frederick Hertzberg (B) D.C. McClelland (C) Abraham Maslow (D) Douglas McGregor\nA:  (A)\n\nQ: Which element of the cultural web forms regalia?\n(A) Symbols (B) Rituals and routines (C) Power structures (D) Control systems\nA:  (A)\n\nQ: What characteristic is not a key feature of the 'open systems' model of management?\n(A) Morale (B) Innovation (C) Growth resource (D) Adaptation\nA:  (A)\n\nQ: How can organisational structures that are characterised by democratic and inclusive styles of management be described?\n(A) Hierarchical (B) Bureaucratic (C) Flat (D) Functional\nA:  (C)\n\nQ: What is a whistleblower?\n(A) Someone who reports illegal or unethical acts (B) Someone who commits illegal or unethical acts (C) Someone who benefits from illegal or unethical acts (D) Someone who devises illegal or unethical acts\nA: ",
        {
          "until": [
            "</s>"
          ]
        }
      ]
    ],
    "resps": [
      [
        "(A)"
      ]
    ],
    "filtered_resps": [
      "(A)"
    ],
    "exact_match": 1.0
  },
  {
    "doc_id": 3,
    "doc": {
      "question": "In the 'five forces model', what is the type of competitive activity that exists between organisations?",
      "subject": "management",
      "choices": [
        "The potential for entry into the industry",
        "The threat of substitute products",
        "The power of customers",
        "The level of rivalry"
      ],
      "answer": 3
    },
    "target": "(D)",
    "arguments": [
      [
        "The following are multiple choice questions (with answers) about management.\n\nQ: What characteristic is not a key feature of the 'open systems' model of management?\n(A) Morale (B) Innovation (C) Growth resource (D) Adaptation\nA:  (A)\n\nQ: What are the two main dimensions of the Ohio Studies into leadership?\n(A) Starting position and end position (B) Initial environment and changed environment (C) Organisational structure and conditioning (D) Initiating structure and considerations\nA:  (D)\n\nQ: How can organisational structures that are characterised by democratic and inclusive styles of management be described?\n(A) Hierarchical (B) Bureaucratic (C) Flat (D) Functional\nA:  (C)\n\nQ: Which element of the cultural web forms regalia?\n(A) Symbols (B) Rituals and routines (C) Power structures (D) Control systems\nA:  (A)\n\nQ: Hygiene factors are associated with which writer?\n(A) Frederick Hertzberg (B) D.C. McClelland (C) Abraham Maslow (D) Douglas McGregor\nA:  (A)\n\nQ: In the 'five forces model', what is the type of competitive activity that exists between organisations?\n(A) The potential for entry into the industry (B) The threat of substitute products (C) The power of customers (D) The level of rivalry\nA: ",
        {
          "until": [
            "</s>"
          ]
        }
      ]
    ],
    "resps": [
      [
        "(D)"
      ]
    ],
    "filtered_resps": [
      "(D)"
    ],
    "exact_match": 1.0
  },
  {
    "doc_id": 11,
    "doc": {
      "question": "The Hawthorn Studies are most associated with which writer?",
      "subject": "management",
      "choices": [
        "Mary Parker Follett",
        "Elton Mayo",
        "Lillian Gilbreth",
        "Frederick Taylor"
      ],
      "answer": 1
    },
    "target": "(B)",
    "arguments": [
      [
        "The following are multiple choice questions (with answers) about management.\n\nQ: What are the two main dimensions of the Ohio Studies into leadership?\n(A) Starting position and end position (B) Initial environment and changed environment (C) Organisational structure and conditioning (D) Initiating structure and considerations\nA:  (D)\n\nQ: How can organisational structures that are characterised by democratic and inclusive styles of management be described?\n(A) Hierarchical (B) Bureaucratic (C) Flat (D) Functional\nA:  (C)\n\nQ: Hygiene factors are associated with which writer?\n(A) Frederick Hertzberg (B) D.C. McClelland (C) Abraham Maslow (D) Douglas McGregor\nA:  (A)\n\nQ: What characteristic is not a key feature of the 'open systems' model of management?\n(A) Morale (B) Innovation (C) Growth resource (D) Adaptation\nA:  (A)\n\nQ: Which element of the cultural web forms regalia?\n(A) Symbols (B) Rituals and routines (C) Power structures (D) Control systems\nA:  (A)\n\nQ: The Hawthorn Studies are most associated with which writer?\n(A) Mary Parker Follett (B) Elton Mayo (C) Lillian Gilbreth (D) Frederick Taylor\nA: ",
        {
          "until": [
            "</s>"
          ]
        }
      ]
    ],
    "resps": [
      [
        "(C)"
      ]
    ],
    "filtered_resps": [
      "(C)"
    ],
    "exact_match": 0.0
  },
  {
    "doc_id": 19,
    "doc": {
      "question": "Which is not a recognised form of business continuity planning?",
      "subject": "management",
      "choices": [
        "Contingency planning",
        "Scenario planning",
        "Financial planning",
        "Building planning"
      ],
      "answer": 3
    },
    "target": "(D)",
    "arguments": [
      [
        "The following are multiple choice questions (with answers) about management.\n\nQ: What are the two main dimensions of the Ohio Studies into leadership?\n(A) Starting position and end position (B) Initial environment and changed environment (C) Organisational structure and conditioning (D) Initiating structure and considerations\nA:  (D)\n\nQ: How can organisational structures that are characterised by democratic and inclusive styles of management be described?\n(A) Hierarchical (B) Bureaucratic (C) Flat (D) Functional\nA:  (C)\n\nQ: Hygiene factors are associated with which writer?\n(A) Frederick Hertzberg (B) D.C. McClelland (C) Abraham Maslow (D) Douglas McGregor\nA:  (A)\n\nQ: Which element of the cultural web forms regalia?\n(A) Symbols (B) Rituals and routines (C) Power structures (D) Control systems\nA:  (A)\n\nQ: What characteristic is not a key feature of the 'open systems' model of management?\n(A) Morale (B) Innovation (C) Growth resource (D) Adaptation\nA:  (A)\n\nQ: Which is not a recognised form of business continuity planning?\n(A) Contingency planning (B) Scenario planning (C) Financial planning (D) Building planning\nA: ",
        {
          "until": [
            "</s>"
          ]
        }
      ]
    ],
    "resps": [
      [
        "(B)"
      ]
    ],
    "filtered_resps": [
      "(B)"
    ],
    "exact_match": 0.0
  },
  {
    "doc_id": 27,
    "doc": {
      "question": "As what is ensuring that one individual does not carry the burden of a whole work task referred to?",
      "subject": "management",
      "choices": [
        "Work specialisation",
        "Work design",
        "Work schedule",
        "Work shift"
      ],
      "answer": 0
    },
    "target": "(A)",
    "arguments": [
      [
        "The following are multiple choice questions (with answers) about management.\n\nQ: Hygiene factors are associated with which writer?\n(A) Frederick Hertzberg (B) D.C. McClelland (C) Abraham Maslow (D) Douglas McGregor\nA:  (A)\n\nQ: What are the two main dimensions of the Ohio Studies into leadership?\n(A) Starting position and end position (B) Initial environment and changed environment (C) Organisational structure and conditioning (D) Initiating structure and considerations\nA:  (D)\n\nQ: What characteristic is not a key feature of the 'open systems' model of management?\n(A) Morale (B) Innovation (C) Growth resource (D) Adaptation\nA:  (A)\n\nQ: Which element of the cultural web forms regalia?\n(A) Symbols (B) Rituals and routines (C) Power structures (D) Control systems\nA:  (A)\n\nQ: How can organisational structures that are characterised by democratic and inclusive styles of management be described?\n(A) Hierarchical (B) Bureaucratic (C) Flat (D) Functional\nA:  (C)\n\nQ: As what is ensuring that one individual does not carry the burden of a whole work task referred to?\n(A) Work specialisation (B) Work design (C) Work schedule (D) Work shift\nA: ",
        {
          "until": [
            "</s>"
          ]
        }
      ]
    ],
    "resps": [
      [
        "(A)"
      ]
    ],
    "filtered_resps": [
      "(A)"
    ],
    "exact_match": 1.0
  },
  {
    "doc_id": 35,
    "doc": {
      "question": "What is the richest form of information?",
      "subject": "management",
      "choices": [
        "Telephone",
        "Face-to-face",
        "E-mail",
        "Video conference"
      ],
      "answer": 1
    },
    "target": "(B)",
    "arguments": [
      [
        "The following are multiple choice questions (with answers) about management.\n\nQ: How can organisational structures that are characterised by democratic and inclusive styles of management be described?\n(A) Hierarchical (B) Bureaucratic (C) Flat (D) Functional\nA:  (C)\n\nQ: What characteristic is not a key feature of the 'open systems' model of management?\n(A) Morale (B) Innovation (C) Growth resource (D) Adaptation\nA:  (A)\n\nQ: What are the two main dimensions of the Ohio Studies into leadership?\n(A) Starting position and end position (B) Initial environment and changed environment (C) Organisational structure and conditioning (D) Initiating structure and considerations\nA:  (D)\n\nQ: Which element of the cultural web forms regalia?\n(A) Symbols (B) Rituals and routines (C) Power structures (D) Control systems\nA:  (A)\n\nQ: Hygiene factors are associated with which writer?\n(A) Frederick Hertzberg (B) D.C. McClelland (C) Abraham Maslow (D) Douglas McGregor\nA:  (A)\n\nQ: What is the richest form of information?\n(A) Telephone (B) Face-to-face (C) E-mail (D) Video conference\nA: ",
        {
          "until": [
            "</s>"
          ]
        }
      ]
    ],
    "resps": [
      [
        "(C)"
      ]
    ],
    "filtered_resps": [
      "(C)"
    ],
    "exact_match": 0.0
  },
  {
    "doc_id": 43,
    "doc": {
      "question": "By which principle is utilitarianism defined?",
      "subject": "management",
      "choices": [
        "Equality for everyone",
        "Maximisation of outcomes for individuals",
        "The best outcome for the majority of people",
        "The least worst outcome for everybody"
      ],
      "answer": 2
    },
    "target": "(C)",
    "arguments": [
      [
        "The following are multiple choice questions (with answers) about management.\n\nQ: What are the two main dimensions of the Ohio Studies into leadership?\n(A) Starting position and end position (B) Initial environment and changed environment (C) Organisational structure and conditioning (D) Initiating structure and considerations\nA:  (D)\n\nQ: How can organisational structures that are characterised by democratic and inclusive styles of management be described?\n(A) Hierarchical (B) Bureaucratic (C) Flat (D) Functional\nA:  (C)\n\nQ: Which element of the cultural web forms regalia?\n(A) Symbols (B) Rituals and routines (C) Power structures (D) Control systems\nA:  (A)\n\nQ: What characteristic is not a key feature of the 'open systems' model of management?\n(A) Morale (B) Innovation (C) Growth resource (D) Adaptation\nA:  (A)\n\nQ: Hygiene factors are associated with which writer?\n(A) Frederick Hertzberg (B) D.C. McClelland (C) Abraham Maslow (D) Douglas McGregor\nA:  (A)\n\nQ: By which principle is utilitarianism defined?\n(A) Equality for everyone (B) Maximisation of outcomes for individuals (C) The best outcome for the majority of people (D) The least worst outcome for everybody\nA: ",
        {
          "until": [
            "</s>"
          ]
        }
      ]
    ],
    "resps": [
      [
        "(B)"
      ]
    ],
    "filtered_resps": [
      "(B)"
    ],
    "exact_match": 0.0
  },
  {
    "doc_id": 51,
    "doc": {
      "question": "What are group norms?",
      "subject": "management",
      "choices": [
        "Modes of behaviour that are acceptable to and shared by group members",
        "Modes of behaviour that are shared by some members of the group",
        "Modes of behaviour that challenge group values and beliefs",
        "Modes of behaviour that are different of those of the other group members"
      ],
      "answer": 0
    },
    "target": "(A)",
    "arguments": [
      [
        "The following are multiple choice questions (with answers) about management.\n\nQ: How can organisational structures that are characterised by democratic and inclusive styles of management be described?\n(A) Hierarchical (B) Bureaucratic (C) Flat (D) Functional\nA:  (C)\n\nQ: What are the two main dimensions of the Ohio Studies into leadership?\n(A) Starting position and end position (B) Initial environment and changed environment (C) Organisational structure and conditioning (D) Initiating structure and considerations\nA:  (D)\n\nQ: Which element of the cultural web forms regalia?\n(A) Symbols (B) Rituals and routines (C) Power structures (D) Control systems\nA:  (A)\n\nQ: Hygiene factors are associated with which writer?\n(A) Frederick Hertzberg (B) D.C. McClelland (C) Abraham Maslow (D) Douglas McGregor\nA:  (A)\n\nQ: What characteristic is not a key feature of the 'open systems' model of management?\n(A) Morale (B) Innovation (C) Growth resource (D) Adaptation\nA:  (A)\n\nQ: What are group norms?\n(A) Modes of behaviour that are acceptable to and shared by group members (B) Modes of behaviour that are shared by some members of the group (C) Modes of behaviour that challenge group values and beliefs (D) Modes of behaviour that are different of those of the other group members\nA: ",
        {
          "until": [
            "</s>"
          ]
        }
      ]
    ],
    "resps": [
      [
        "(A)"
      ]
    ],
    "filtered_resps": [
      "(A)"
    ],
    "exact_match": 1.0
  },
  {
    "doc_id": 59,
    "doc": {
      "question": "What is the optimal span of control?",
      "subject": "management",
      "choices": [
        "2",
        "5",
        "7",
        "None of the above"
      ],
      "answer": 3
    },
    "target": "(D)",
    "arguments": [
      [
        "The following are multiple choice questions (with answers) about management.\n\nQ: Which element of the cultural web forms regalia?\n(A) Symbols (B) Rituals and routines (C) Power structures (D) Control systems\nA:  (A)\n\nQ: How can organisational structures that are characterised by democratic and inclusive styles of management be described?\n(A) Hierarchical (B) Bureaucratic (C) Flat (D) Functional\nA:  (C)\n\nQ: What are the two main dimensions of the Ohio Studies into leadership?\n(A) Starting position and end position (B) Initial environment and changed environment (C) Organisational structure and conditioning (D) Initiating structure and considerations\nA:  (D)\n\nQ: What characteristic is not a key feature of the 'open systems' model of management?\n(A) Morale (B) Innovation (C) Growth resource (D) Adaptation\nA:  (A)\n\nQ: Hygiene factors are associated with which writer?\n(A) Frederick Hertzberg (B) D.C. McClelland (C) Abraham Maslow (D) Douglas McGregor\nA:  (A)\n\nQ: What is the optimal span of control?\n(A) 2 (B) 5 (C) 7 (D) None of the above\nA: ",
        {
          "until": [
            "</s>"
          ]
        }
      ]
    ],
    "resps": [
      [
        "(B)"
      ]
    ],
    "filtered_resps": [
      "(B)"
    ],
    "exact_match": 0.0
  },
  {
    "doc_id": 67,
    "doc": {
      "question": "What is the term for the action in which managers at an organisation analyse the current situation of their organisation and then develop plans to accomplish its mission and achieve its goals?",
      "subject": "management",
      "choices": [
        "Synergy planning",
        "Strategy formulation",
        "Functional planning",
        "SWOT analysis"
      ],
      "answer": 1
    },
    "target": "(B)",
    "arguments": [
      [
        "The following are multiple choice questions (with answers) about management.\n\nQ: How can organisational structures that are characterised by democratic and inclusive styles of management be described?\n(A) Hierarchical (B) Bureaucratic (C) Flat (D) Functional\nA:  (C)\n\nQ: What are the two main dimensions of the Ohio Studies into leadership?\n(A) Starting position and end position (B) Initial environment and changed environment (C) Organisational structure and conditioning (D) Initiating structure and considerations\nA:  (D)\n\nQ: Which element of the cultural web forms regalia?\n(A) Symbols (B) Rituals and routines (C) Power structures (D) Control systems\nA:  (A)\n\nQ: What characteristic is not a key feature of the 'open systems' model of management?\n(A) Morale (B) Innovation (C) Growth resource (D) Adaptation\nA:  (A)\n\nQ: Hygiene factors are associated with which writer?\n(A) Frederick Hertzberg (B) D.C. McClelland (C) Abraham Maslow (D) Douglas McGregor\nA:  (A)\n\nQ: What is the term for the action in which managers at an organisation analyse the current situation of their organisation and then develop plans to accomplish its mission and achieve its goals?\n(A) Synergy planning (B) Strategy formulation (C) Functional planning (D) SWOT analysis\nA: ",
        {
          "until": [
            "</s>"
          ]
        }
      ]
    ],
    "resps": [
      [
        "(D)"
      ]
    ],
    "filtered_resps": [
      "(D)"
    ],
    "exact_match": 0.0
  },
  {
    "doc_id": 75,
    "doc": {
      "question": "What do you call a style of leadership that takes account of others' views, opinions and ideas?",
      "subject": "management",
      "choices": [
        "Laissez-faire",
        "People-oriented",
        "Democratic",
        "Autocratic"
      ],
      "answer": 2
    },
    "target": "(C)",
    "arguments": [
      [
        "The following are multiple choice questions (with answers) about management.\n\nQ: Which element of the cultural web forms regalia?\n(A) Symbols (B) Rituals and routines (C) Power structures (D) Control systems\nA:  (A)\n\nQ: Hygiene factors are associated with which writer?\n(A) Frederick Hertzberg (B) D.C. McClelland (C) Abraham Maslow (D) Douglas McGregor\nA:  (A)\n\nQ: How can organisational structures that are characterised by democratic and inclusive styles of management be described?\n(A) Hierarchical (B) Bureaucratic (C) Flat (D) Functional\nA:  (C)\n\nQ: What characteristic is not a key feature of the 'open systems' model of management?\n(A) Morale (B) Innovation (C) Growth resource (D) Adaptation\nA:  (A)\n\nQ: What are the two main dimensions of the Ohio Studies into leadership?\n(A) Starting position and end position (B) Initial environment and changed environment (C) Organisational structure and conditioning (D) Initiating structure and considerations\nA:  (D)\n\nQ: What do you call a style of leadership that takes account of others' views, opinions and ideas?\n(A) Laissez-faire (B) People-oriented (C) Democratic (D) Autocratic\nA: ",
        {
          "until": [
            "</s>"
          ]
        }
      ]
    ],
    "resps": [
      [
        "(B)"
      ]
    ],
    "filtered_resps": [
      "(B)"
    ],
    "exact_match": 0.0
  },
  {
    "doc_id": 83,
    "doc": {
      "question": "What is the term for organisational development through a formally designed organisational structure?",
      "subject": "management",
      "choices": [
        "Organic",
        "Mechanistic",
        "Formal",
        "Structured"
      ],
      "answer": 1
    },
    "target": "(B)",
    "arguments": [
      [
        "The following are multiple choice questions (with answers) about management.\n\nQ: Hygiene factors are associated with which writer?\n(A) Frederick Hertzberg (B) D.C. McClelland (C) Abraham Maslow (D) Douglas McGregor\nA:  (A)\n\nQ: What are the two main dimensions of the Ohio Studies into leadership?\n(A) Starting position and end position (B) Initial environment and changed environment (C) Organisational structure and conditioning (D) Initiating structure and considerations\nA:  (D)\n\nQ: What characteristic is not a key feature of the 'open systems' model of management?\n(A) Morale (B) Innovation (C) Growth resource (D) Adaptation\nA:  (A)\n\nQ: How can organisational structures that are characterised by democratic and inclusive styles of management be described?\n(A) Hierarchical (B) Bureaucratic (C) Flat (D) Functional\nA:  (C)\n\nQ: Which element of the cultural web forms regalia?\n(A) Symbols (B) Rituals and routines (C) Power structures (D) Control systems\nA:  (A)\n\nQ: What is the term for organisational development through a formally designed organisational structure?\n(A) Organic (B) Mechanistic (C) Formal (D) Structured\nA: ",
        {
          "until": [
            "</s>"
          ]
        }
      ]
    ],
    "resps": [
      [
        "(D)"
      ]
    ],
    "filtered_resps": [
      "(D)"
    ],
    "exact_match": 0.0
  },
  {
    "doc_id": 91,
    "doc": {
      "question": "How does lateral communication in an organisation occur?",
      "subject": "management",
      "choices": [
        "Information passes upwards.",
        "Information passes downwards.",
        "Information is a two-way process.",
        "Information passes between different departments and functions."
      ],
      "answer": 3
    },
    "target": "(D)",
    "arguments": [
      [
        "The following are multiple choice questions (with answers) about management.\n\nQ: What are the two main dimensions of the Ohio Studies into leadership?\n(A) Starting position and end position (B) Initial environment and changed environment (C) Organisational structure and conditioning (D) Initiating structure and considerations\nA:  (D)\n\nQ: Hygiene factors are associated with which writer?\n(A) Frederick Hertzberg (B) D.C. McClelland (C) Abraham Maslow (D) Douglas McGregor\nA:  (A)\n\nQ: How can organisational structures that are characterised by democratic and inclusive styles of management be described?\n(A) Hierarchical (B) Bureaucratic (C) Flat (D) Functional\nA:  (C)\n\nQ: Which element of the cultural web forms regalia?\n(A) Symbols (B) Rituals and routines (C) Power structures (D) Control systems\nA:  (A)\n\nQ: What characteristic is not a key feature of the 'open systems' model of management?\n(A) Morale (B) Innovation (C) Growth resource (D) Adaptation\nA:  (A)\n\nQ: How does lateral communication in an organisation occur?\n(A) Information passes upwards. (B) Information passes downwards. (C) Information is a two-way process. (D) Information passes between different departments and functions.\nA: ",
        {
          "until": [
            "</s>"
          ]
        }
      ]
    ],
    "resps": [
      [
        "(C)"
      ]
    ],
    "filtered_resps": [
      "(C)"
    ],
    "exact_match": 0.0
  },
  {
    "doc_id": 99,
    "doc": {
      "question": "What is T-group training?",
      "subject": "management",
      "choices": [
        "A group whose aim is transformational change",
        "A group brought together to deliver training programmes",
        "Team training for the purposes of advancing technology",
        "Team building activities involving learning"
      ],
      "answer": 3
    },
    "target": "(D)",
    "arguments": [
      [
        "The following are multiple choice questions (with answers) about management.\n\nQ: What are the two main dimensions of the Ohio Studies into leadership?\n(A) Starting position and end position (B) Initial environment and changed environment (C) Organisational structure and conditioning (D) Initiating structure and considerations\nA:  (D)\n\nQ: Hygiene factors are associated with which writer?\n(A) Frederick Hertzberg (B) D.C. McClelland (C) Abraham Maslow (D) Douglas McGregor\nA:  (A)\n\nQ: Which element of the cultural web forms regalia?\n(A) Symbols (B) Rituals and routines (C) Power structures (D) Control systems\nA:  (A)\n\nQ: What characteristic is not a key feature of the 'open systems' model of management?\n(A) Morale (B) Innovation (C) Growth resource (D) Adaptation\nA:  (A)\n\nQ: How can organisational structures that are characterised by democratic and inclusive styles of management be described?\n(A) Hierarchical (B) Bureaucratic (C) Flat (D) Functional\nA:  (C)\n\nQ: What is T-group training?\n(A) A group whose aim is transformational change (B) A group brought together to deliver training programmes (C) Team training for the purposes of advancing technology (D) Team building activities involving learning\nA: ",
        {
          "until": [
            "</s>"
          ]
        }
      ]
    ],
    "resps": [
      [
        "(B)"
      ]
    ],
    "filtered_resps": [
      "(B)"
    ],
    "exact_match": 0.0
  },
  {
    "doc_id": 4,
    "doc": {
      "question": "Which one of the following political leaders could not be termed a 'transformational' leader?",
      "subject": "management",
      "choices": [
        "Margaret Thatcher",
        "Mikhail Gorbachov",
        "Nelson Mandela",
        "Bill Clinton"
      ],
      "answer": 3
    },
    "target": "(D)",
    "arguments": [
      [
        "The following are multiple choice questions (with answers) about management.\n\nQ: What characteristic is not a key feature of the 'open systems' model of management?\n(A) Morale (B) Innovation (C) Growth resource (D) Adaptation\nA:  (A)\n\nQ: What are the two main dimensions of the Ohio Studies into leadership?\n(A) Starting position and end position (B) Initial environment and changed environment (C) Organisational structure and conditioning (D) Initiating structure and considerations\nA:  (D)\n\nQ: How can organisational structures that are characterised by democratic and inclusive styles of management be described?\n(A) Hierarchical (B) Bureaucratic (C) Flat (D) Functional\nA:  (C)\n\nQ: Which element of the cultural web forms regalia?\n(A) Symbols (B) Rituals and routines (C) Power structures (D) Control systems\nA:  (A)\n\nQ: Hygiene factors are associated with which writer?\n(A) Frederick Hertzberg (B) D.C. McClelland (C) Abraham Maslow (D) Douglas McGregor\nA:  (A)\n\nQ: Which one of the following political leaders could not be termed a 'transformational' leader?\n(A) Margaret Thatcher (B) Mikhail Gorbachov (C) Nelson Mandela (D) Bill Clinton\nA: ",
        {
          "until": [
            "</s>"
          ]
        }
      ]
    ],
    "resps": [
      [
        "(A)"
      ]
    ],
    "filtered_resps": [
      "(A)"
    ],
    "exact_match": 0.0
  },
  {
    "doc_id": 12,
    "doc": {
      "question": "How can you describe the thinking and outlook of transformational leaders?",
      "subject": "management",
      "choices": [
        "Strategic",
        "Operational",
        "Functional",
        "Developmental"
      ],
      "answer": 0
    },
    "target": "(A)",
    "arguments": [
      [
        "The following are multiple choice questions (with answers) about management.\n\nQ: What are the two main dimensions of the Ohio Studies into leadership?\n(A) Starting position and end position (B) Initial environment and changed environment (C) Organisational structure and conditioning (D) Initiating structure and considerations\nA:  (D)\n\nQ: How can organisational structures that are characterised by democratic and inclusive styles of management be described?\n(A) Hierarchical (B) Bureaucratic (C) Flat (D) Functional\nA:  (C)\n\nQ: Hygiene factors are associated with which writer?\n(A) Frederick Hertzberg (B) D.C. McClelland (C) Abraham Maslow (D) Douglas McGregor\nA:  (A)\n\nQ: What characteristic is not a key feature of the 'open systems' model of management?\n(A) Morale (B) Innovation (C) Growth resource (D) Adaptation\nA:  (A)\n\nQ: Which element of the cultural web forms regalia?\n(A) Symbols (B) Rituals and routines (C) Power structures (D) Control systems\nA:  (A)\n\nQ: How can you describe the thinking and outlook of transformational leaders?\n(A) Strategic (B) Operational (C) Functional (D) Developmental\nA: ",
        {
          "until": [
            "</s>"
          ]
        }
      ]
    ],
    "resps": [
      [
        "(D)"
      ]
    ],
    "filtered_resps": [
      "(D)"
    ],
    "exact_match": 0.0
  },
  {
    "doc_id": 20,
    "doc": {
      "question": "What is the term for an organisation that adapts to changes in the environment by quickly responding to shifts in supply and demand conditions?",
      "subject": "management",
      "choices": [
        "Opportunistic organisation",
        "Enterprising organisation",
        "International organisation",
        "Agile organisation"
      ],
      "answer": 3
    },
    "target": "(D)",
    "arguments": [
      [
        "The following are multiple choice questions (with answers) about management.\n\nQ: What are the two main dimensions of the Ohio Studies into leadership?\n(A) Starting position and end position (B) Initial environment and changed environment (C) Organisational structure and conditioning (D) Initiating structure and considerations\nA:  (D)\n\nQ: How can organisational structures that are characterised by democratic and inclusive styles of management be described?\n(A) Hierarchical (B) Bureaucratic (C) Flat (D) Functional\nA:  (C)\n\nQ: Hygiene factors are associated with which writer?\n(A) Frederick Hertzberg (B) D.C. McClelland (C) Abraham Maslow (D) Douglas McGregor\nA:  (A)\n\nQ: Which element of the cultural web forms regalia?\n(A) Symbols (B) Rituals and routines (C) Power structures (D) Control systems\nA:  (A)\n\nQ: What characteristic is not a key feature of the 'open systems' model of management?\n(A) Morale (B) Innovation (C) Growth resource (D) Adaptation\nA:  (A)\n\nQ: What is the term for an organisation that adapts to changes in the environment by quickly responding to shifts in supply and demand conditions?\n(A) Opportunistic organisation (B) Enterprising organisation (C) International organisation (D) Agile organisation\nA: ",
        {
          "until": [
            "</s>"
          ]
        }
      ]
    ],
    "resps": [
      [
        "(D)"
      ]
    ],
    "filtered_resps": [
      "(D)"
    ],
    "exact_match": 1.0
  },
  {
    "doc_id": 28,
    "doc": {
      "question": "How do you describe a work group that comprises workers with demarcated tasks and distant line managers?",
      "subject": "management",
      "choices": [
        "Dependent",
        "Independent",
        "Interdependent",
        "Collaborative"
      ],
      "answer": 1
    },
    "target": "(B)",
    "arguments": [
      [
        "The following are multiple choice questions (with answers) about management.\n\nQ: Hygiene factors are associated with which writer?\n(A) Frederick Hertzberg (B) D.C. McClelland (C) Abraham Maslow (D) Douglas McGregor\nA:  (A)\n\nQ: What are the two main dimensions of the Ohio Studies into leadership?\n(A) Starting position and end position (B) Initial environment and changed environment (C) Organisational structure and conditioning (D) Initiating structure and considerations\nA:  (D)\n\nQ: What characteristic is not a key feature of the 'open systems' model of management?\n(A) Morale (B) Innovation (C) Growth resource (D) Adaptation\nA:  (A)\n\nQ: Which element of the cultural web forms regalia?\n(A) Symbols (B) Rituals and routines (C) Power structures (D) Control systems\nA:  (A)\n\nQ: How can organisational structures that are characterised by democratic and inclusive styles of management be described?\n(A) Hierarchical (B) Bureaucratic (C) Flat (D) Functional\nA:  (C)\n\nQ: How do you describe a work group that comprises workers with demarcated tasks and distant line managers?\n(A) Dependent (B) Independent (C) Interdependent (D) Collaborative\nA: ",
        {
          "until": [
            "</s>"
          ]
        }
      ]
    ],
    "resps": [
      [
        "(D)"
      ]
    ],
    "filtered_resps": [
      "(D)"
    ],
    "exact_match": 0.0
  },
  {
    "doc_id": 36,
    "doc": {
      "question": "What is the purpose of a 'quality circle'?",
      "subject": "management",
      "choices": [
        "Bring together managers and workers to find improvements.",
        "Bring together managers and workers to discuss output.",
        "Bring together managers and workers to review quality of work.",
        "Bring together managers and workers to review targets."
      ],
      "answer": 0
    },
    "target": "(A)",
    "arguments": [
      [
        "The following are multiple choice questions (with answers) about management.\n\nQ: How can organisational structures that are characterised by democratic and inclusive styles of management be described?\n(A) Hierarchical (B) Bureaucratic (C) Flat (D) Functional\nA:  (C)\n\nQ: What characteristic is not a key feature of the 'open systems' model of management?\n(A) Morale (B) Innovation (C) Growth resource (D) Adaptation\nA:  (A)\n\nQ: What are the two main dimensions of the Ohio Studies into leadership?\n(A) Starting position and end position (B) Initial environment and changed environment (C) Organisational structure and conditioning (D) Initiating structure and considerations\nA:  (D)\n\nQ: Which element of the cultural web forms regalia?\n(A) Symbols (B) Rituals and routines (C) Power structures (D) Control systems\nA:  (A)\n\nQ: Hygiene factors are associated with which writer?\n(A) Frederick Hertzberg (B) D.C. McClelland (C) Abraham Maslow (D) Douglas McGregor\nA:  (A)\n\nQ: What is the purpose of a 'quality circle'?\n(A) Bring together managers and workers to find improvements. (B) Bring together managers and workers to discuss output. (C) Bring together managers and workers to review quality of work. (D) Bring together managers and workers to review targets.\nA: ",
        {
          "until": [
            "</s>"
          ]
        }
      ]
    ],
    "resps": [
      [
        "(C)"
      ]
    ],
    "filtered_resps": [
      "(C)"
    ],
    "exact_match": 0.0
  },
  {
    "doc_id": 44,
    "doc": {
      "question": "What is the term for the set of behaviours and tasks that a member of the group is expected to perform because he or she is a member of the group?",
      "subject": "management",
      "choices": [
        "Group roles",
        "Virtual teamwork",
        "Synergy",
        "Role making"
      ],
      "answer": 0
    },
    "target": "(A)",
    "arguments": [
      [
        "The following are multiple choice questions (with answers) about management.\n\nQ: What are the two main dimensions of the Ohio Studies into leadership?\n(A) Starting position and end position (B) Initial environment and changed environment (C) Organisational structure and conditioning (D) Initiating structure and considerations\nA:  (D)\n\nQ: How can organisational structures that are characterised by democratic and inclusive styles of management be described?\n(A) Hierarchical (B) Bureaucratic (C) Flat (D) Functional\nA:  (C)\n\nQ: Which element of the cultural web forms regalia?\n(A) Symbols (B) Rituals and routines (C) Power structures (D) Control systems\nA:  (A)\n\nQ: What characteristic is not a key feature of the 'open systems' model of management?\n(A) Morale (B) Innovation (C) Growth resource (D) Adaptation\nA:  (A)\n\nQ: Hygiene factors are associated with which writer?\n(A) Frederick Hertzberg (B) D.C. McClelland (C) Abraham Maslow (D) Douglas McGregor\nA:  (A)\n\nQ: What is the term for the set of behaviours and tasks that a member of the group is expected to perform because he or she is a member of the group?\n(A) Group roles (B) Virtual teamwork (C) Synergy (D) Role making\nA: ",
        {
          "until": [
            "</s>"
          ]
        }
      ]
    ],
    "resps": [
      [
        "(A)"
      ]
    ],
    "filtered_resps": [
      "(A)"
    ],
    "exact_match": 1.0
  },
  {
    "doc_id": 52,
    "doc": {
      "question": "Which of the following is not a recognised type of plan?",
      "subject": "management",
      "choices": [
        "Business",
        "Succession",
        "Ad hoc",
        "Financial"
      ],
      "answer": 2
    },
    "target": "(C)",
    "arguments": [
      [
        "The following are multiple choice questions (with answers) about management.\n\nQ: How can organisational structures that are characterised by democratic and inclusive styles of management be described?\n(A) Hierarchical (B) Bureaucratic (C) Flat (D) Functional\nA:  (C)\n\nQ: What are the two main dimensions of the Ohio Studies into leadership?\n(A) Starting position and end position (B) Initial environment and changed environment (C) Organisational structure and conditioning (D) Initiating structure and considerations\nA:  (D)\n\nQ: Which element of the cultural web forms regalia?\n(A) Symbols (B) Rituals and routines (C) Power structures (D) Control systems\nA:  (A)\n\nQ: Hygiene factors are associated with which writer?\n(A) Frederick Hertzberg (B) D.C. McClelland (C) Abraham Maslow (D) Douglas McGregor\nA:  (A)\n\nQ: What characteristic is not a key feature of the 'open systems' model of management?\n(A) Morale (B) Innovation (C) Growth resource (D) Adaptation\nA:  (A)\n\nQ: Which of the following is not a recognised type of plan?\n(A) Business (B) Succession (C) Ad hoc (D) Financial\nA: ",
        {
          "until": [
            "</s>"
          ]
        }
      ]
    ],
    "resps": [
      [
        "(C)"
      ]
    ],
    "filtered_resps": [
      "(C)"
    ],
    "exact_match": 1.0
  },
  {
    "doc_id": 60,
    "doc": {
      "question": "What one of these is not a recognised type of authority?",
      "subject": "management",
      "choices": [
        "Executive",
        "Functional",
        "Line management",
        "Supplier"
      ],
      "answer": 3
    },
    "target": "(D)",
    "arguments": [
      [
        "The following are multiple choice questions (with answers) about management.\n\nQ: Which element of the cultural web forms regalia?\n(A) Symbols (B) Rituals and routines (C) Power structures (D) Control systems\nA:  (A)\n\nQ: How can organisational structures that are characterised by democratic and inclusive styles of management be described?\n(A) Hierarchical (B) Bureaucratic (C) Flat (D) Functional\nA:  (C)\n\nQ: What are the two main dimensions of the Ohio Studies into leadership?\n(A) Starting position and end position (B) Initial environment and changed environment (C) Organisational structure and conditioning (D) Initiating structure and considerations\nA:  (D)\n\nQ: What characteristic is not a key feature of the 'open systems' model of management?\n(A) Morale (B) Innovation (C) Growth resource (D) Adaptation\nA:  (A)\n\nQ: Hygiene factors are associated with which writer?\n(A) Frederick Hertzberg (B) D.C. McClelland (C) Abraham Maslow (D) Douglas McGregor\nA:  (A)\n\nQ: What one of these is not a recognised type of authority?\n(A) Executive (B) Functional (C) Line management (D) Supplier\nA: ",
        {
          "until": [
            "</s>"
          ]
        }
      ]
    ],
    "resps": [
      [
        "(D)"
      ]
    ],
    "filtered_resps": [
      "(D)"
    ],
    "exact_match": 1.0
  },
  {
    "doc_id": 68,
    "doc": {
      "question": "What is Frank Gilbreth`s work most noted for?",
      "subject": "management",
      "choices": [
        "Working conditions",
        "Time and motion studies",
        "Work psychology",
        "Work as a social setting"
      ],
      "answer": 1
    },
    "target": "(B)",
    "arguments": [
      [
        "The following are multiple choice questions (with answers) about management.\n\nQ: How can organisational structures that are characterised by democratic and inclusive styles of management be described?\n(A) Hierarchical (B) Bureaucratic (C) Flat (D) Functional\nA:  (C)\n\nQ: What are the two main dimensions of the Ohio Studies into leadership?\n(A) Starting position and end position (B) Initial environment and changed environment (C) Organisational structure and conditioning (D) Initiating structure and considerations\nA:  (D)\n\nQ: Which element of the cultural web forms regalia?\n(A) Symbols (B) Rituals and routines (C) Power structures (D) Control systems\nA:  (A)\n\nQ: What characteristic is not a key feature of the 'open systems' model of management?\n(A) Morale (B) Innovation (C) Growth resource (D) Adaptation\nA:  (A)\n\nQ: Hygiene factors are associated with which writer?\n(A) Frederick Hertzberg (B) D.C. McClelland (C) Abraham Maslow (D) Douglas McGregor\nA:  (A)\n\nQ: What is Frank Gilbreth`s work most noted for?\n(A) Working conditions (B) Time and motion studies (C) Work psychology (D) Work as a social setting\nA: ",
        {
          "until": [
            "</s>"
          ]
        }
      ]
    ],
    "resps": [
      [
        "(C)"
      ]
    ],
    "filtered_resps": [
      "(C)"
    ],
    "exact_match": 0.0
  },
  {
    "doc_id": 76,
    "doc": {
      "question": "What is the guiding principle of scientific management?",
      "subject": "management",
      "choices": [
        "Experimentation",
        "Fluid working relationships",
        "Freedom of association",
        "One best way to do a job"
      ],
      "answer": 3
    },
    "target": "(D)",
    "arguments": [
      [
        "The following are multiple choice questions (with answers) about management.\n\nQ: Which element of the cultural web forms regalia?\n(A) Symbols (B) Rituals and routines (C) Power structures (D) Control systems\nA:  (A)\n\nQ: Hygiene factors are associated with which writer?\n(A) Frederick Hertzberg (B) D.C. McClelland (C) Abraham Maslow (D) Douglas McGregor\nA:  (A)\n\nQ: How can organisational structures that are characterised by democratic and inclusive styles of management be described?\n(A) Hierarchical (B) Bureaucratic (C) Flat (D) Functional\nA:  (C)\n\nQ: What characteristic is not a key feature of the 'open systems' model of management?\n(A) Morale (B) Innovation (C) Growth resource (D) Adaptation\nA:  (A)\n\nQ: What are the two main dimensions of the Ohio Studies into leadership?\n(A) Starting position and end position (B) Initial environment and changed environment (C) Organisational structure and conditioning (D) Initiating structure and considerations\nA:  (D)\n\nQ: What is the guiding principle of scientific management?\n(A) Experimentation (B) Fluid working relationships (C) Freedom of association (D) One best way to do a job\nA: ",
        {
          "until": [
            "</s>"
          ]
        }
      ]
    ],
    "resps": [
      [
        "(D)"
      ]
    ],
    "filtered_resps": [
      "(D)"
    ],
    "exact_match": 1.0
  },
  {
    "doc_id": 84,
    "doc": {
      "question": "'There is no discernible link between planning and performance'. Who is this position held by?",
      "subject": "management",
      "choices": [
        "Michael Porter",
        "Milton Friedman",
        "Gary Hamel",
        "Henry Mintzberg"
      ],
      "answer": 3
    },
    "target": "(D)",
    "arguments": [
      [
        "The following are multiple choice questions (with answers) about management.\n\nQ: Hygiene factors are associated with which writer?\n(A) Frederick Hertzberg (B) D.C. McClelland (C) Abraham Maslow (D) Douglas McGregor\nA:  (A)\n\nQ: What are the two main dimensions of the Ohio Studies into leadership?\n(A) Starting position and end position (B) Initial environment and changed environment (C) Organisational structure and conditioning (D) Initiating structure and considerations\nA:  (D)\n\nQ: What characteristic is not a key feature of the 'open systems' model of management?\n(A) Morale (B) Innovation (C) Growth resource (D) Adaptation\nA:  (A)\n\nQ: How can organisational structures that are characterised by democratic and inclusive styles of management be described?\n(A) Hierarchical (B) Bureaucratic (C) Flat (D) Functional\nA:  (C)\n\nQ: Which element of the cultural web forms regalia?\n(A) Symbols (B) Rituals and routines (C) Power structures (D) Control systems\nA:  (A)\n\nQ: 'There is no discernible link between planning and performance'. Who is this position held by?\n(A) Michael Porter (B) Milton Friedman (C) Gary Hamel (D) Henry Mintzberg\nA: ",
        {
          "until": [
            "</s>"
          ]
        }
      ]
    ],
    "resps": [
      [
        "(B)"
      ]
    ],
    "filtered_resps": [
      "(B)"
    ],
    "exact_match": 0.0
  },
  {
    "doc_id": 92,
    "doc": {
      "question": "Of what is advertising a form?",
      "subject": "management",
      "choices": [
        "Focusing strategy",
        "Differentiation",
        "Cost leadership",
        "Growth"
      ],
      "answer": 1
    },
    "target": "(B)",
    "arguments": [
      [
        "The following are multiple choice questions (with answers) about management.\n\nQ: What are the two main dimensions of the Ohio Studies into leadership?\n(A) Starting position and end position (B) Initial environment and changed environment (C) Organisational structure and conditioning (D) Initiating structure and considerations\nA:  (D)\n\nQ: Hygiene factors are associated with which writer?\n(A) Frederick Hertzberg (B) D.C. McClelland (C) Abraham Maslow (D) Douglas McGregor\nA:  (A)\n\nQ: How can organisational structures that are characterised by democratic and inclusive styles of management be described?\n(A) Hierarchical (B) Bureaucratic (C) Flat (D) Functional\nA:  (C)\n\nQ: Which element of the cultural web forms regalia?\n(A) Symbols (B) Rituals and routines (C) Power structures (D) Control systems\nA:  (A)\n\nQ: What characteristic is not a key feature of the 'open systems' model of management?\n(A) Morale (B) Innovation (C) Growth resource (D) Adaptation\nA:  (A)\n\nQ: Of what is advertising a form?\n(A) Focusing strategy (B) Differentiation (C) Cost leadership (D) Growth\nA: ",
        {
          "until": [
            "</s>"
          ]
        }
      ]
    ],
    "resps": [
      [
        "(D)"
      ]
    ],
    "filtered_resps": [
      "(D)"
    ],
    "exact_match": 0.0
  },
  {
    "doc_id": 100,
    "doc": {
      "question": "What is a social enterprise concerned with?",
      "subject": "management",
      "choices": [
        "Profit maximisation",
        "Maximising market share",
        "Providing public service",
        "Running a business to create social benefits"
      ],
      "answer": 3
    },
    "target": "(D)",
    "arguments": [
      [
        "The following are multiple choice questions (with answers) about management.\n\nQ: What are the two main dimensions of the Ohio Studies into leadership?\n(A) Starting position and end position (B) Initial environment and changed environment (C) Organisational structure and conditioning (D) Initiating structure and considerations\nA:  (D)\n\nQ: Hygiene factors are associated with which writer?\n(A) Frederick Hertzberg (B) D.C. McClelland (C) Abraham Maslow (D) Douglas McGregor\nA:  (A)\n\nQ: Which element of the cultural web forms regalia?\n(A) Symbols (B) Rituals and routines (C) Power structures (D) Control systems\nA:  (A)\n\nQ: What characteristic is not a key feature of the 'open systems' model of management?\n(A) Morale (B) Innovation (C) Growth resource (D) Adaptation\nA:  (A)\n\nQ: How can organisational structures that are characterised by democratic and inclusive styles of management be described?\n(A) Hierarchical (B) Bureaucratic (C) Flat (D) Functional\nA:  (C)\n\nQ: What is a social enterprise concerned with?\n(A) Profit maximisation (B) Maximising market share (C) Providing public service (D) Running a business to create social benefits\nA: ",
        {
          "until": [
            "</s>"
          ]
        }
      ]
    ],
    "resps": [
      [
        "(D)"
      ]
    ],
    "filtered_resps": [
      "(D)"
    ],
    "exact_match": 1.0
  },
  {
    "doc_id": 5,
    "doc": {
      "question": "What is a Gantt chart a type of?",
      "subject": "management",
      "choices": [
        "Work flow design",
        "Work schedule design",
        "Work rate design",
        "Work output design"
      ],
      "answer": 1
    },
    "target": "(B)",
    "arguments": [
      [
        "The following are multiple choice questions (with answers) about management.\n\nQ: What characteristic is not a key feature of the 'open systems' model of management?\n(A) Morale (B) Innovation (C) Growth resource (D) Adaptation\nA:  (A)\n\nQ: What are the two main dimensions of the Ohio Studies into leadership?\n(A) Starting position and end position (B) Initial environment and changed environment (C) Organisational structure and conditioning (D) Initiating structure and considerations\nA:  (D)\n\nQ: How can organisational structures that are characterised by democratic and inclusive styles of management be described?\n(A) Hierarchical (B) Bureaucratic (C) Flat (D) Functional\nA:  (C)\n\nQ: Which element of the cultural web forms regalia?\n(A) Symbols (B) Rituals and routines (C) Power structures (D) Control systems\nA:  (A)\n\nQ: Hygiene factors are associated with which writer?\n(A) Frederick Hertzberg (B) D.C. McClelland (C) Abraham Maslow (D) Douglas McGregor\nA:  (A)\n\nQ: What is a Gantt chart a type of?\n(A) Work flow design (B) Work schedule design (C) Work rate design (D) Work output design\nA: ",
        {
          "until": [
            "</s>"
          ]
        }
      ]
    ],
    "resps": [
      [
        "(D)"
      ]
    ],
    "filtered_resps": [
      "(D)"
    ],
    "exact_match": 0.0
  },
  {
    "doc_id": 13,
    "doc": {
      "question": "What are the key characteristics of transactional leaders?",
      "subject": "management",
      "choices": [
        "Guiding, mentoring and motivating",
        "Guiding, commanding and motivating",
        "Guiding, demonstrating and motivating",
        "Guiding, mentoring and demonstrating"
      ],
      "answer": 0
    },
    "target": "(A)",
    "arguments": [
      [
        "The following are multiple choice questions (with answers) about management.\n\nQ: What are the two main dimensions of the Ohio Studies into leadership?\n(A) Starting position and end position (B) Initial environment and changed environment (C) Organisational structure and conditioning (D) Initiating structure and considerations\nA:  (D)\n\nQ: How can organisational structures that are characterised by democratic and inclusive styles of management be described?\n(A) Hierarchical (B) Bureaucratic (C) Flat (D) Functional\nA:  (C)\n\nQ: Hygiene factors are associated with which writer?\n(A) Frederick Hertzberg (B) D.C. McClelland (C) Abraham Maslow (D) Douglas McGregor\nA:  (A)\n\nQ: What characteristic is not a key feature of the 'open systems' model of management?\n(A) Morale (B) Innovation (C) Growth resource (D) Adaptation\nA:  (A)\n\nQ: Which element of the cultural web forms regalia?\n(A) Symbols (B) Rituals and routines (C) Power structures (D) Control systems\nA:  (A)\n\nQ: What are the key characteristics of transactional leaders?\n(A) Guiding, mentoring and motivating (B) Guiding, commanding and motivating (C) Guiding, demonstrating and motivating (D) Guiding, mentoring and demonstrating\nA: ",
        {
          "until": [
            "</s>"
          ]
        }
      ]
    ],
    "resps": [
      [
        "(A)"
      ]
    ],
    "filtered_resps": [
      "(A)"
    ],
    "exact_match": 1.0
  },
  {
    "doc_id": 21,
    "doc": {
      "question": "Which of these is not part of the recognised challenges for modern managers?",
      "subject": "management",
      "choices": [
        "Micro-managing the workforce",
        "Managing communications",
        "Managing change",
        "Managing the learning organisation"
      ],
      "answer": 0
    },
    "target": "(A)",
    "arguments": [
      [
        "The following are multiple choice questions (with answers) about management.\n\nQ: What are the two main dimensions of the Ohio Studies into leadership?\n(A) Starting position and end position (B) Initial environment and changed environment (C) Organisational structure and conditioning (D) Initiating structure and considerations\nA:  (D)\n\nQ: How can organisational structures that are characterised by democratic and inclusive styles of management be described?\n(A) Hierarchical (B) Bureaucratic (C) Flat (D) Functional\nA:  (C)\n\nQ: Hygiene factors are associated with which writer?\n(A) Frederick Hertzberg (B) D.C. McClelland (C) Abraham Maslow (D) Douglas McGregor\nA:  (A)\n\nQ: Which element of the cultural web forms regalia?\n(A) Symbols (B) Rituals and routines (C) Power structures (D) Control systems\nA:  (A)\n\nQ: What characteristic is not a key feature of the 'open systems' model of management?\n(A) Morale (B) Innovation (C) Growth resource (D) Adaptation\nA:  (A)\n\nQ: Which of these is not part of the recognised challenges for modern managers?\n(A) Micro-managing the workforce (B) Managing communications (C) Managing change (D) Managing the learning organisation\nA: ",
        {
          "until": [
            "</s>"
          ]
        }
      ]
    ],
    "resps": [
      [
        "(A)"
      ]
    ],
    "filtered_resps": [
      "(A)"
    ],
    "exact_match": 1.0
  },
  {
    "doc_id": 29,
    "doc": {
      "question": "Specialisation is a feature of which organisational structure?",
      "subject": "management",
      "choices": [
        "Matrix",
        "Divisional",
        "Multi-divisional",
        "Functional"
      ],
      "answer": 3
    },
    "target": "(D)",
    "arguments": [
      [
        "The following are multiple choice questions (with answers) about management.\n\nQ: Hygiene factors are associated with which writer?\n(A) Frederick Hertzberg (B) D.C. McClelland (C) Abraham Maslow (D) Douglas McGregor\nA:  (A)\n\nQ: What are the two main dimensions of the Ohio Studies into leadership?\n(A) Starting position and end position (B) Initial environment and changed environment (C) Organisational structure and conditioning (D) Initiating structure and considerations\nA:  (D)\n\nQ: What characteristic is not a key feature of the 'open systems' model of management?\n(A) Morale (B) Innovation (C) Growth resource (D) Adaptation\nA:  (A)\n\nQ: Which element of the cultural web forms regalia?\n(A) Symbols (B) Rituals and routines (C) Power structures (D) Control systems\nA:  (A)\n\nQ: How can organisational structures that are characterised by democratic and inclusive styles of management be described?\n(A) Hierarchical (B) Bureaucratic (C) Flat (D) Functional\nA:  (C)\n\nQ: Specialisation is a feature of which organisational structure?\n(A) Matrix (B) Divisional (C) Multi-divisional (D) Functional\nA: ",
        {
          "until": [
            "</s>"
          ]
        }
      ]
    ],
    "resps": [
      [
        "(C)"
      ]
    ],
    "filtered_resps": [
      "(C)"
    ],
    "exact_match": 0.0
  },
  {
    "doc_id": 37,
    "doc": {
      "question": "What is the guiding principle behind New Public Management?",
      "subject": "management",
      "choices": [
        "Profit maximisation",
        "Introducing private sector business principles into the public sector",
        "Replacing public management with private sector management",
        "Restructuring public organisations"
      ],
      "answer": 1
    },
    "target": "(B)",
    "arguments": [
      [
        "The following are multiple choice questions (with answers) about management.\n\nQ: How can organisational structures that are characterised by democratic and inclusive styles of management be described?\n(A) Hierarchical (B) Bureaucratic (C) Flat (D) Functional\nA:  (C)\n\nQ: What characteristic is not a key feature of the 'open systems' model of management?\n(A) Morale (B) Innovation (C) Growth resource (D) Adaptation\nA:  (A)\n\nQ: What are the two main dimensions of the Ohio Studies into leadership?\n(A) Starting position and end position (B) Initial environment and changed environment (C) Organisational structure and conditioning (D) Initiating structure and considerations\nA:  (D)\n\nQ: Which element of the cultural web forms regalia?\n(A) Symbols (B) Rituals and routines (C) Power structures (D) Control systems\nA:  (A)\n\nQ: Hygiene factors are associated with which writer?\n(A) Frederick Hertzberg (B) D.C. McClelland (C) Abraham Maslow (D) Douglas McGregor\nA:  (A)\n\nQ: What is the guiding principle behind New Public Management?\n(A) Profit maximisation (B) Introducing private sector business principles into the public sector (C) Replacing public management with private sector management (D) Restructuring public organisations\nA: ",
        {
          "until": [
            "</s>"
          ]
        }
      ]
    ],
    "resps": [
      [
        "(B)"
      ]
    ],
    "filtered_resps": [
      "(B)"
    ],
    "exact_match": 1.0
  },
  {
    "doc_id": 45,
    "doc": {
      "question": "What is the term for a process that enables an organisation to assess and demonstrate its social, economic, and environmental benefits and limitation?",
      "subject": "management",
      "choices": [
        "Social plan",
        "Social strategy",
        "Social audit",
        "Social account"
      ],
      "answer": 2
    },
    "target": "(C)",
    "arguments": [
      [
        "The following are multiple choice questions (with answers) about management.\n\nQ: What are the two main dimensions of the Ohio Studies into leadership?\n(A) Starting position and end position (B) Initial environment and changed environment (C) Organisational structure and conditioning (D) Initiating structure and considerations\nA:  (D)\n\nQ: How can organisational structures that are characterised by democratic and inclusive styles of management be described?\n(A) Hierarchical (B) Bureaucratic (C) Flat (D) Functional\nA:  (C)\n\nQ: Which element of the cultural web forms regalia?\n(A) Symbols (B) Rituals and routines (C) Power structures (D) Control systems\nA:  (A)\n\nQ: What characteristic is not a key feature of the 'open systems' model of management?\n(A) Morale (B) Innovation (C) Growth resource (D) Adaptation\nA:  (A)\n\nQ: Hygiene factors are associated with which writer?\n(A) Frederick Hertzberg (B) D.C. McClelland (C) Abraham Maslow (D) Douglas McGregor\nA:  (A)\n\nQ: What is the term for a process that enables an organisation to assess and demonstrate its social, economic, and environmental benefits and limitation?\n(A) Social plan (B) Social strategy (C) Social audit (D) Social account\nA: ",
        {
          "until": [
            "</s>"
          ]
        }
      ]
    ],
    "resps": [
      [
        "(D)"
      ]
    ],
    "filtered_resps": [
      "(D)"
    ],
    "exact_match": 0.0
  },
  {
    "doc_id": 53,
    "doc": {
      "question": "What is the term for the extent to which competition in one country is influenced by competition in other countries?",
      "subject": "management",
      "choices": [
        "International trade",
        "Global economics",
        "Global competition",
        "Globalisation"
      ],
      "answer": 3
    },
    "target": "(D)",
    "arguments": [
      [
        "The following are multiple choice questions (with answers) about management.\n\nQ: How can organisational structures that are characterised by democratic and inclusive styles of management be described?\n(A) Hierarchical (B) Bureaucratic (C) Flat (D) Functional\nA:  (C)\n\nQ: What are the two main dimensions of the Ohio Studies into leadership?\n(A) Starting position and end position (B) Initial environment and changed environment (C) Organisational structure and conditioning (D) Initiating structure and considerations\nA:  (D)\n\nQ: Which element of the cultural web forms regalia?\n(A) Symbols (B) Rituals and routines (C) Power structures (D) Control systems\nA:  (A)\n\nQ: Hygiene factors are associated with which writer?\n(A) Frederick Hertzberg (B) D.C. McClelland (C) Abraham Maslow (D) Douglas McGregor\nA:  (A)\n\nQ: What characteristic is not a key feature of the 'open systems' model of management?\n(A) Morale (B) Innovation (C) Growth resource (D) Adaptation\nA:  (A)\n\nQ: What is the term for the extent to which competition in one country is influenced by competition in other countries?\n(A) International trade (B) Global economics (C) Global competition (D) Globalisation\nA: ",
        {
          "until": [
            "</s>"
          ]
        }
      ]
    ],
    "resps": [
      [
        "(C)"
      ]
    ],
    "filtered_resps": [
      "(C)"
    ],
    "exact_match": 0.0
  },
  {
    "doc_id": 61,
    "doc": {
      "question": "Which one of the following is not a characteristic of a team?",
      "subject": "management",
      "choices": [
        "Minimal and formal knowledge sharing",
        "Collective output",
        "Individual and collective responsibility",
        "Fluid dimension to roles and tasks"
      ],
      "answer": 0
    },
    "target": "(A)",
    "arguments": [
      [
        "The following are multiple choice questions (with answers) about management.\n\nQ: Which element of the cultural web forms regalia?\n(A) Symbols (B) Rituals and routines (C) Power structures (D) Control systems\nA:  (A)\n\nQ: How can organisational structures that are characterised by democratic and inclusive styles of management be described?\n(A) Hierarchical (B) Bureaucratic (C) Flat (D) Functional\nA:  (C)\n\nQ: What are the two main dimensions of the Ohio Studies into leadership?\n(A) Starting position and end position (B) Initial environment and changed environment (C) Organisational structure and conditioning (D) Initiating structure and considerations\nA:  (D)\n\nQ: What characteristic is not a key feature of the 'open systems' model of management?\n(A) Morale (B) Innovation (C) Growth resource (D) Adaptation\nA:  (A)\n\nQ: Hygiene factors are associated with which writer?\n(A) Frederick Hertzberg (B) D.C. McClelland (C) Abraham Maslow (D) Douglas McGregor\nA:  (A)\n\nQ: Which one of the following is not a characteristic of a team?\n(A) Minimal and formal knowledge sharing (B) Collective output (C) Individual and collective responsibility (D) Fluid dimension to roles and tasks\nA: ",
        {
          "until": [
            "</s>"
          ]
        }
      ]
    ],
    "resps": [
      [
        "(B)"
      ]
    ],
    "filtered_resps": [
      "(B)"
    ],
    "exact_match": 0.0
  },
  {
    "doc_id": 69,
    "doc": {
      "question": "What is another name for contingency planning?",
      "subject": "management",
      "choices": [
        "Synergy planning",
        "Ad hoc planning",
        "Business level planning",
        "Scenario planning"
      ],
      "answer": 3
    },
    "target": "(D)",
    "arguments": [
      [
        "The following are multiple choice questions (with answers) about management.\n\nQ: How can organisational structures that are characterised by democratic and inclusive styles of management be described?\n(A) Hierarchical (B) Bureaucratic (C) Flat (D) Functional\nA:  (C)\n\nQ: What are the two main dimensions of the Ohio Studies into leadership?\n(A) Starting position and end position (B) Initial environment and changed environment (C) Organisational structure and conditioning (D) Initiating structure and considerations\nA:  (D)\n\nQ: Which element of the cultural web forms regalia?\n(A) Symbols (B) Rituals and routines (C) Power structures (D) Control systems\nA:  (A)\n\nQ: What characteristic is not a key feature of the 'open systems' model of management?\n(A) Morale (B) Innovation (C) Growth resource (D) Adaptation\nA:  (A)\n\nQ: Hygiene factors are associated with which writer?\n(A) Frederick Hertzberg (B) D.C. McClelland (C) Abraham Maslow (D) Douglas McGregor\nA:  (A)\n\nQ: What is another name for contingency planning?\n(A) Synergy planning (B) Ad hoc planning (C) Business level planning (D) Scenario planning\nA: ",
        {
          "until": [
            "</s>"
          ]
        }
      ]
    ],
    "resps": [
      [
        "(D)"
      ]
    ],
    "filtered_resps": [
      "(D)"
    ],
    "exact_match": 1.0
  },
  {
    "doc_id": 77,
    "doc": {
      "question": "What is the term Tuckman uses for reaching consensus as a group?",
      "subject": "management",
      "choices": [
        "Storming",
        "Performing",
        "Forming",
        "Norming"
      ],
      "answer": 3
    },
    "target": "(D)",
    "arguments": [
      [
        "The following are multiple choice questions (with answers) about management.\n\nQ: Which element of the cultural web forms regalia?\n(A) Symbols (B) Rituals and routines (C) Power structures (D) Control systems\nA:  (A)\n\nQ: Hygiene factors are associated with which writer?\n(A) Frederick Hertzberg (B) D.C. McClelland (C) Abraham Maslow (D) Douglas McGregor\nA:  (A)\n\nQ: How can organisational structures that are characterised by democratic and inclusive styles of management be described?\n(A) Hierarchical (B) Bureaucratic (C) Flat (D) Functional\nA:  (C)\n\nQ: What characteristic is not a key feature of the 'open systems' model of management?\n(A) Morale (B) Innovation (C) Growth resource (D) Adaptation\nA:  (A)\n\nQ: What are the two main dimensions of the Ohio Studies into leadership?\n(A) Starting position and end position (B) Initial environment and changed environment (C) Organisational structure and conditioning (D) Initiating structure and considerations\nA:  (D)\n\nQ: What is the term Tuckman uses for reaching consensus as a group?\n(A) Storming (B) Performing (C) Forming (D) Norming\nA: ",
        {
          "until": [
            "</s>"
          ]
        }
      ]
    ],
    "resps": [
      [
        "(C)"
      ]
    ],
    "filtered_resps": [
      "(C)"
    ],
    "exact_match": 0.0
  },
  {
    "doc_id": 85,
    "doc": {
      "question": "What does situational theory of leadership emphasise?",
      "subject": "management",
      "choices": [
        "Personality traits",
        "Events",
        "Environment",
        "Political situation"
      ],
      "answer": 1
    },
    "target": "(B)",
    "arguments": [
      [
        "The following are multiple choice questions (with answers) about management.\n\nQ: Hygiene factors are associated with which writer?\n(A) Frederick Hertzberg (B) D.C. McClelland (C) Abraham Maslow (D) Douglas McGregor\nA:  (A)\n\nQ: What are the two main dimensions of the Ohio Studies into leadership?\n(A) Starting position and end position (B) Initial environment and changed environment (C) Organisational structure and conditioning (D) Initiating structure and considerations\nA:  (D)\n\nQ: What characteristic is not a key feature of the 'open systems' model of management?\n(A) Morale (B) Innovation (C) Growth resource (D) Adaptation\nA:  (A)\n\nQ: How can organisational structures that are characterised by democratic and inclusive styles of management be described?\n(A) Hierarchical (B) Bureaucratic (C) Flat (D) Functional\nA:  (C)\n\nQ: Which element of the cultural web forms regalia?\n(A) Symbols (B) Rituals and routines (C) Power structures (D) Control systems\nA:  (A)\n\nQ: What does situational theory of leadership emphasise?\n(A) Personality traits (B) Events (C) Environment (D) Political situation\nA: ",
        {
          "until": [
            "</s>"
          ]
        }
      ]
    ],
    "resps": [
      [
        "(D)"
      ]
    ],
    "filtered_resps": [
      "(D)"
    ],
    "exact_match": 0.0
  },
  {
    "doc_id": 93,
    "doc": {
      "question": "What is not a component of an agile organisation?",
      "subject": "management",
      "choices": [
        "Market focus and position",
        "Human resources: multi-skilling",
        "Organisational structure",
        "Project-based culture"
      ],
      "answer": 3
    },
    "target": "(D)",
    "arguments": [
      [
        "The following are multiple choice questions (with answers) about management.\n\nQ: What are the two main dimensions of the Ohio Studies into leadership?\n(A) Starting position and end position (B) Initial environment and changed environment (C) Organisational structure and conditioning (D) Initiating structure and considerations\nA:  (D)\n\nQ: Hygiene factors are associated with which writer?\n(A) Frederick Hertzberg (B) D.C. McClelland (C) Abraham Maslow (D) Douglas McGregor\nA:  (A)\n\nQ: How can organisational structures that are characterised by democratic and inclusive styles of management be described?\n(A) Hierarchical (B) Bureaucratic (C) Flat (D) Functional\nA:  (C)\n\nQ: Which element of the cultural web forms regalia?\n(A) Symbols (B) Rituals and routines (C) Power structures (D) Control systems\nA:  (A)\n\nQ: What characteristic is not a key feature of the 'open systems' model of management?\n(A) Morale (B) Innovation (C) Growth resource (D) Adaptation\nA:  (A)\n\nQ: What is not a component of an agile organisation?\n(A) Market focus and position (B) Human resources: multi-skilling (C) Organisational structure (D) Project-based culture\nA: ",
        {
          "until": [
            "</s>"
          ]
        }
      ]
    ],
    "resps": [
      [
        "(D)"
      ]
    ],
    "filtered_resps": [
      "(D)"
    ],
    "exact_match": 1.0
  },
  {
    "doc_id": 101,
    "doc": {
      "question": "Which of the following is not part of Schein's model of the formation of culture?",
      "subject": "management",
      "choices": [
        "Shared values",
        "Pre-conceptions",
        "Shared beliefs",
        "Norms"
      ],
      "answer": 1
    },
    "target": "(B)",
    "arguments": [
      [
        "The following are multiple choice questions (with answers) about management.\n\nQ: What are the two main dimensions of the Ohio Studies into leadership?\n(A) Starting position and end position (B) Initial environment and changed environment (C) Organisational structure and conditioning (D) Initiating structure and considerations\nA:  (D)\n\nQ: Hygiene factors are associated with which writer?\n(A) Frederick Hertzberg (B) D.C. McClelland (C) Abraham Maslow (D) Douglas McGregor\nA:  (A)\n\nQ: Which element of the cultural web forms regalia?\n(A) Symbols (B) Rituals and routines (C) Power structures (D) Control systems\nA:  (A)\n\nQ: What characteristic is not a key feature of the 'open systems' model of management?\n(A) Morale (B) Innovation (C) Growth resource (D) Adaptation\nA:  (A)\n\nQ: How can organisational structures that are characterised by democratic and inclusive styles of management be described?\n(A) Hierarchical (B) Bureaucratic (C) Flat (D) Functional\nA:  (C)\n\nQ: Which of the following is not part of Schein's model of the formation of culture?\n(A) Shared values (B) Pre-conceptions (C) Shared beliefs (D) Norms\nA: ",
        {
          "until": [
            "</s>"
          ]
        }
      ]
    ],
    "resps": [
      [
        "(B)"
      ]
    ],
    "filtered_resps": [
      "(B)"
    ],
    "exact_match": 1.0
  },
  {
    "doc_id": 6,
    "doc": {
      "question": "Which one of the following is a feature of McGregor's Theory X?",
      "subject": "management",
      "choices": [
        "Workers enjoy responsibility.",
        "Workers view physical and mental effort as a natural part of work.",
        "Workers like to show initiative.",
        "Workers like to be directed."
      ],
      "answer": 3
    },
    "target": "(D)",
    "arguments": [
      [
        "The following are multiple choice questions (with answers) about management.\n\nQ: What characteristic is not a key feature of the 'open systems' model of management?\n(A) Morale (B) Innovation (C) Growth resource (D) Adaptation\nA:  (A)\n\nQ: What are the two main dimensions of the Ohio Studies into leadership?\n(A) Starting position and end position (B) Initial environment and changed environment (C) Organisational structure and conditioning (D) Initiating structure and considerations\nA:  (D)\n\nQ: How can organisational structures that are characterised by democratic and inclusive styles of management be described?\n(A) Hierarchical (B) Bureaucratic (C) Flat (D) Functional\nA:  (C)\n\nQ: Which element of the cultural web forms regalia?\n(A) Symbols (B) Rituals and routines (C) Power structures (D) Control systems\nA:  (A)\n\nQ: Hygiene factors are associated with which writer?\n(A) Frederick Hertzberg (B) D.C. McClelland (C) Abraham Maslow (D) Douglas McGregor\nA:  (A)\n\nQ: Which one of the following is a feature of McGregor's Theory X?\n(A) Workers enjoy responsibility. (B) Workers view physical and mental effort as a natural part of work. (C) Workers like to show initiative. (D) Workers like to be directed.\nA: ",
        {
          "until": [
            "</s>"
          ]
        }
      ]
    ],
    "resps": [
      [
        "(B)"
      ]
    ],
    "filtered_resps": [
      "(B)"
    ],
    "exact_match": 0.0
  },
  {
    "doc_id": 14,
    "doc": {
      "question": "What is not an assumption underpinning the rational decision making model?",
      "subject": "management",
      "choices": [
        "Incomplete information",
        "An agreed goal",
        "A structured problem",
        "High level of certainty regarding the environment"
      ],
      "answer": 0
    },
    "target": "(A)",
    "arguments": [
      [
        "The following are multiple choice questions (with answers) about management.\n\nQ: What are the two main dimensions of the Ohio Studies into leadership?\n(A) Starting position and end position (B) Initial environment and changed environment (C) Organisational structure and conditioning (D) Initiating structure and considerations\nA:  (D)\n\nQ: How can organisational structures that are characterised by democratic and inclusive styles of management be described?\n(A) Hierarchical (B) Bureaucratic (C) Flat (D) Functional\nA:  (C)\n\nQ: Hygiene factors are associated with which writer?\n(A) Frederick Hertzberg (B) D.C. McClelland (C) Abraham Maslow (D) Douglas McGregor\nA:  (A)\n\nQ: What characteristic is not a key feature of the 'open systems' model of management?\n(A) Morale (B) Innovation (C) Growth resource (D) Adaptation\nA:  (A)\n\nQ: Which element of the cultural web forms regalia?\n(A) Symbols (B) Rituals and routines (C) Power structures (D) Control systems\nA:  (A)\n\nQ: What is not an assumption underpinning the rational decision making model?\n(A) Incomplete information (B) An agreed goal (C) A structured problem (D) High level of certainty regarding the environment\nA: ",
        {
          "until": [
            "</s>"
          ]
        }
      ]
    ],
    "resps": [
      [
        "(D)"
      ]
    ],
    "filtered_resps": [
      "(D)"
    ],
    "exact_match": 0.0
  },
  {
    "doc_id": 22,
    "doc": {
      "question": "To what does emotional intelligence refer?",
      "subject": "management",
      "choices": [
        "How people view and understand the world.",
        "How people view and understand themselves.",
        "How people view and understand others.",
        "How people view and understand themselves and others."
      ],
      "answer": 3
    },
    "target": "(D)",
    "arguments": [
      [
        "The following are multiple choice questions (with answers) about management.\n\nQ: What are the two main dimensions of the Ohio Studies into leadership?\n(A) Starting position and end position (B) Initial environment and changed environment (C) Organisational structure and conditioning (D) Initiating structure and considerations\nA:  (D)\n\nQ: How can organisational structures that are characterised by democratic and inclusive styles of management be described?\n(A) Hierarchical (B) Bureaucratic (C) Flat (D) Functional\nA:  (C)\n\nQ: Hygiene factors are associated with which writer?\n(A) Frederick Hertzberg (B) D.C. McClelland (C) Abraham Maslow (D) Douglas McGregor\nA:  (A)\n\nQ: Which element of the cultural web forms regalia?\n(A) Symbols (B) Rituals and routines (C) Power structures (D) Control systems\nA:  (A)\n\nQ: What characteristic is not a key feature of the 'open systems' model of management?\n(A) Morale (B) Innovation (C) Growth resource (D) Adaptation\nA:  (A)\n\nQ: To what does emotional intelligence refer?\n(A) How people view and understand the world. (B) How people view and understand themselves. (C) How people view and understand others. (D) How people view and understand themselves and others.\nA: ",
        {
          "until": [
            "</s>"
          ]
        }
      ]
    ],
    "resps": [
      [
        "(D)"
      ]
    ],
    "filtered_resps": [
      "(D)"
    ],
    "exact_match": 1.0
  },
  {
    "doc_id": 30,
    "doc": {
      "question": "Which one is not an element in the primary activities of a value chain?",
      "subject": "management",
      "choices": [
        "Procurement",
        "Inbound logistics",
        "Outbound logistics",
        "Service"
      ],
      "answer": 0
    },
    "target": "(A)",
    "arguments": [
      [
        "The following are multiple choice questions (with answers) about management.\n\nQ: Hygiene factors are associated with which writer?\n(A) Frederick Hertzberg (B) D.C. McClelland (C) Abraham Maslow (D) Douglas McGregor\nA:  (A)\n\nQ: What are the two main dimensions of the Ohio Studies into leadership?\n(A) Starting position and end position (B) Initial environment and changed environment (C) Organisational structure and conditioning (D) Initiating structure and considerations\nA:  (D)\n\nQ: What characteristic is not a key feature of the 'open systems' model of management?\n(A) Morale (B) Innovation (C) Growth resource (D) Adaptation\nA:  (A)\n\nQ: Which element of the cultural web forms regalia?\n(A) Symbols (B) Rituals and routines (C) Power structures (D) Control systems\nA:  (A)\n\nQ: How can organisational structures that are characterised by democratic and inclusive styles of management be described?\n(A) Hierarchical (B) Bureaucratic (C) Flat (D) Functional\nA:  (C)\n\nQ: Which one is not an element in the primary activities of a value chain?\n(A) Procurement (B) Inbound logistics (C) Outbound logistics (D) Service\nA: ",
        {
          "until": [
            "</s>"
          ]
        }
      ]
    ],
    "resps": [
      [
        "(A)"
      ]
    ],
    "filtered_resps": [
      "(A)"
    ],
    "exact_match": 1.0
  },
  {
    "doc_id": 38,
    "doc": {
      "question": "Profitability stemming from how well a firm positions itself in the market is a key feature of which writer's view on strategy?",
      "subject": "management",
      "choices": [
        "Peter Drucker",
        "Jay Barney",
        "Michael Porter",
        "Henry Mintzberg"
      ],
      "answer": 2
    },
    "target": "(C)",
    "arguments": [
      [
        "The following are multiple choice questions (with answers) about management.\n\nQ: How can organisational structures that are characterised by democratic and inclusive styles of management be described?\n(A) Hierarchical (B) Bureaucratic (C) Flat (D) Functional\nA:  (C)\n\nQ: What characteristic is not a key feature of the 'open systems' model of management?\n(A) Morale (B) Innovation (C) Growth resource (D) Adaptation\nA:  (A)\n\nQ: What are the two main dimensions of the Ohio Studies into leadership?\n(A) Starting position and end position (B) Initial environment and changed environment (C) Organisational structure and conditioning (D) Initiating structure and considerations\nA:  (D)\n\nQ: Which element of the cultural web forms regalia?\n(A) Symbols (B) Rituals and routines (C) Power structures (D) Control systems\nA:  (A)\n\nQ: Hygiene factors are associated with which writer?\n(A) Frederick Hertzberg (B) D.C. McClelland (C) Abraham Maslow (D) Douglas McGregor\nA:  (A)\n\nQ: Profitability stemming from how well a firm positions itself in the market is a key feature of which writer's view on strategy?\n(A) Peter Drucker (B) Jay Barney (C) Michael Porter (D) Henry Mintzberg\nA: ",
        {
          "until": [
            "</s>"
          ]
        }
      ]
    ],
    "resps": [
      [
        "(A)"
      ]
    ],
    "filtered_resps": [
      "(A)"
    ],
    "exact_match": 0.0
  },
  {
    "doc_id": 46,
    "doc": {
      "question": "What type of organisational culture is most likely to deliver stability and efficiency?",
      "subject": "management",
      "choices": [
        "Task culture",
        "Role culture",
        "Power culture",
        "People culture"
      ],
      "answer": 1
    },
    "target": "(B)",
    "arguments": [
      [
        "The following are multiple choice questions (with answers) about management.\n\nQ: What are the two main dimensions of the Ohio Studies into leadership?\n(A) Starting position and end position (B) Initial environment and changed environment (C) Organisational structure and conditioning (D) Initiating structure and considerations\nA:  (D)\n\nQ: How can organisational structures that are characterised by democratic and inclusive styles of management be described?\n(A) Hierarchical (B) Bureaucratic (C) Flat (D) Functional\nA:  (C)\n\nQ: Which element of the cultural web forms regalia?\n(A) Symbols (B) Rituals and routines (C) Power structures (D) Control systems\nA:  (A)\n\nQ: What characteristic is not a key feature of the 'open systems' model of management?\n(A) Morale (B) Innovation (C) Growth resource (D) Adaptation\nA:  (A)\n\nQ: Hygiene factors are associated with which writer?\n(A) Frederick Hertzberg (B) D.C. McClelland (C) Abraham Maslow (D) Douglas McGregor\nA:  (A)\n\nQ: What type of organisational culture is most likely to deliver stability and efficiency?\n(A) Task culture (B) Role culture (C) Power culture (D) People culture\nA: ",
        {
          "until": [
            "</s>"
          ]
        }
      ]
    ],
    "resps": [
      [
        "(D)"
      ]
    ],
    "filtered_resps": [
      "(D)"
    ],
    "exact_match": 0.0
  },
  {
    "doc_id": 54,
    "doc": {
      "question": "As what are key factors that reflect the situation of an organisation referred to?",
      "subject": "management",
      "choices": [
        "Administrations",
        "Processes",
        "Activities",
        "Contingencies"
      ],
      "answer": 3
    },
    "target": "(D)",
    "arguments": [
      [
        "The following are multiple choice questions (with answers) about management.\n\nQ: How can organisational structures that are characterised by democratic and inclusive styles of management be described?\n(A) Hierarchical (B) Bureaucratic (C) Flat (D) Functional\nA:  (C)\n\nQ: What are the two main dimensions of the Ohio Studies into leadership?\n(A) Starting position and end position (B) Initial environment and changed environment (C) Organisational structure and conditioning (D) Initiating structure and considerations\nA:  (D)\n\nQ: Which element of the cultural web forms regalia?\n(A) Symbols (B) Rituals and routines (C) Power structures (D) Control systems\nA:  (A)\n\nQ: Hygiene factors are associated with which writer?\n(A) Frederick Hertzberg (B) D.C. McClelland (C) Abraham Maslow (D) Douglas McGregor\nA:  (A)\n\nQ: What characteristic is not a key feature of the 'open systems' model of management?\n(A) Morale (B) Innovation (C) Growth resource (D) Adaptation\nA:  (A)\n\nQ: As what are key factors that reflect the situation of an organisation referred to?\n(A) Administrations (B) Processes (C) Activities (D) Contingencies\nA: ",
        {
          "until": [
            "</s>"
          ]
        }
      ]
    ],
    "resps": [
      [
        "(D)"
      ]
    ],
    "filtered_resps": [
      "(D)"
    ],
    "exact_match": 1.0
  },
  {
    "doc_id": 62,
    "doc": {
      "question": "Which of these factors is not one of the competing responsibilities that influence corporate social responsibility?",
      "subject": "management",
      "choices": [
        "Ethical",
        "Economic",
        "Discretionary",
        "Technical"
      ],
      "answer": 3
    },
    "target": "(D)",
    "arguments": [
      [
        "The following are multiple choice questions (with answers) about management.\n\nQ: Which element of the cultural web forms regalia?\n(A) Symbols (B) Rituals and routines (C) Power structures (D) Control systems\nA:  (A)\n\nQ: How can organisational structures that are characterised by democratic and inclusive styles of management be described?\n(A) Hierarchical (B) Bureaucratic (C) Flat (D) Functional\nA:  (C)\n\nQ: What are the two main dimensions of the Ohio Studies into leadership?\n(A) Starting position and end position (B) Initial environment and changed environment (C) Organisational structure and conditioning (D) Initiating structure and considerations\nA:  (D)\n\nQ: What characteristic is not a key feature of the 'open systems' model of management?\n(A) Morale (B) Innovation (C) Growth resource (D) Adaptation\nA:  (A)\n\nQ: Hygiene factors are associated with which writer?\n(A) Frederick Hertzberg (B) D.C. McClelland (C) Abraham Maslow (D) Douglas McGregor\nA:  (A)\n\nQ: Which of these factors is not one of the competing responsibilities that influence corporate social responsibility?\n(A) Ethical (B) Economic (C) Discretionary (D) Technical\nA: ",
        {
          "until": [
            "</s>"
          ]
        }
      ]
    ],
    "resps": [
      [
        "(B)"
      ]
    ],
    "filtered_resps": [
      "(B)"
    ],
    "exact_match": 0.0
  },
  {
    "doc_id": 70,
    "doc": {
      "question": "Which feature does not form one of Fayol's 14 principles of management?",
      "subject": "management",
      "choices": [
        "Esprit de corps",
        "Initiative",
        "Order",
        "Individualism"
      ],
      "answer": 3
    },
    "target": "(D)",
    "arguments": [
      [
        "The following are multiple choice questions (with answers) about management.\n\nQ: How can organisational structures that are characterised by democratic and inclusive styles of management be described?\n(A) Hierarchical (B) Bureaucratic (C) Flat (D) Functional\nA:  (C)\n\nQ: What are the two main dimensions of the Ohio Studies into leadership?\n(A) Starting position and end position (B) Initial environment and changed environment (C) Organisational structure and conditioning (D) Initiating structure and considerations\nA:  (D)\n\nQ: Which element of the cultural web forms regalia?\n(A) Symbols (B) Rituals and routines (C) Power structures (D) Control systems\nA:  (A)\n\nQ: What characteristic is not a key feature of the 'open systems' model of management?\n(A) Morale (B) Innovation (C) Growth resource (D) Adaptation\nA:  (A)\n\nQ: Hygiene factors are associated with which writer?\n(A) Frederick Hertzberg (B) D.C. McClelland (C) Abraham Maslow (D) Douglas McGregor\nA:  (A)\n\nQ: Which feature does not form one of Fayol's 14 principles of management?\n(A) Esprit de corps (B) Initiative (C) Order (D) Individualism\nA: ",
        {
          "until": [
            "</s>"
          ]
        }
      ]
    ],
    "resps": [
      [
        "(A)"
      ]
    ],
    "filtered_resps": [
      "(A)"
    ],
    "exact_match": 0.0
  },
  {
    "doc_id": 78,
    "doc": {
      "question": "What theory is built around the principle that 'people make choices regarding how to behave based on values and beliefs'?",
      "subject": "management",
      "choices": [
        "Expectancy",
        "Instrumental",
        "Classical",
        "Contingency"
      ],
      "answer": 0
    },
    "target": "(A)",
    "arguments": [
      [
        "The following are multiple choice questions (with answers) about management.\n\nQ: Which element of the cultural web forms regalia?\n(A) Symbols (B) Rituals and routines (C) Power structures (D) Control systems\nA:  (A)\n\nQ: Hygiene factors are associated with which writer?\n(A) Frederick Hertzberg (B) D.C. McClelland (C) Abraham Maslow (D) Douglas McGregor\nA:  (A)\n\nQ: How can organisational structures that are characterised by democratic and inclusive styles of management be described?\n(A) Hierarchical (B) Bureaucratic (C) Flat (D) Functional\nA:  (C)\n\nQ: What characteristic is not a key feature of the 'open systems' model of management?\n(A) Morale (B) Innovation (C) Growth resource (D) Adaptation\nA:  (A)\n\nQ: What are the two main dimensions of the Ohio Studies into leadership?\n(A) Starting position and end position (B) Initial environment and changed environment (C) Organisational structure and conditioning (D) Initiating structure and considerations\nA:  (D)\n\nQ: What theory is built around the principle that 'people make choices regarding how to behave based on values and beliefs'?\n(A) Expectancy (B) Instrumental (C) Classical (D) Contingency\nA: ",
        {
          "until": [
            "</s>"
          ]
        }
      ]
    ],
    "resps": [
      [
        "(D)"
      ]
    ],
    "filtered_resps": [
      "(D)"
    ],
    "exact_match": 0.0
  },
  {
    "doc_id": 86,
    "doc": {
      "question": "What is intuitive decision making based on?",
      "subject": "management",
      "choices": [
        "Guesswork",
        "Gambling",
        "Instinct",
        "Rationality"
      ],
      "answer": 2
    },
    "target": "(C)",
    "arguments": [
      [
        "The following are multiple choice questions (with answers) about management.\n\nQ: Hygiene factors are associated with which writer?\n(A) Frederick Hertzberg (B) D.C. McClelland (C) Abraham Maslow (D) Douglas McGregor\nA:  (A)\n\nQ: What are the two main dimensions of the Ohio Studies into leadership?\n(A) Starting position and end position (B) Initial environment and changed environment (C) Organisational structure and conditioning (D) Initiating structure and considerations\nA:  (D)\n\nQ: What characteristic is not a key feature of the 'open systems' model of management?\n(A) Morale (B) Innovation (C) Growth resource (D) Adaptation\nA:  (A)\n\nQ: How can organisational structures that are characterised by democratic and inclusive styles of management be described?\n(A) Hierarchical (B) Bureaucratic (C) Flat (D) Functional\nA:  (C)\n\nQ: Which element of the cultural web forms regalia?\n(A) Symbols (B) Rituals and routines (C) Power structures (D) Control systems\nA:  (A)\n\nQ: What is intuitive decision making based on?\n(A) Guesswork (B) Gambling (C) Instinct (D) Rationality\nA: ",
        {
          "until": [
            "</s>"
          ]
        }
      ]
    ],
    "resps": [
      [
        "(C)"
      ]
    ],
    "filtered_resps": [
      "(C)"
    ],
    "exact_match": 1.0
  },
  {
    "doc_id": 94,
    "doc": {
      "question": "Of what is worker autonomy in decision making an example?",
      "subject": "management",
      "choices": [
        "Worker freedom",
        "Greater worker negotiation",
        "Worker empowerment",
        "Increased worker power"
      ],
      "answer": 2
    },
    "target": "(C)",
    "arguments": [
      [
        "The following are multiple choice questions (with answers) about management.\n\nQ: What are the two main dimensions of the Ohio Studies into leadership?\n(A) Starting position and end position (B) Initial environment and changed environment (C) Organisational structure and conditioning (D) Initiating structure and considerations\nA:  (D)\n\nQ: Hygiene factors are associated with which writer?\n(A) Frederick Hertzberg (B) D.C. McClelland (C) Abraham Maslow (D) Douglas McGregor\nA:  (A)\n\nQ: How can organisational structures that are characterised by democratic and inclusive styles of management be described?\n(A) Hierarchical (B) Bureaucratic (C) Flat (D) Functional\nA:  (C)\n\nQ: Which element of the cultural web forms regalia?\n(A) Symbols (B) Rituals and routines (C) Power structures (D) Control systems\nA:  (A)\n\nQ: What characteristic is not a key feature of the 'open systems' model of management?\n(A) Morale (B) Innovation (C) Growth resource (D) Adaptation\nA:  (A)\n\nQ: Of what is worker autonomy in decision making an example?\n(A) Worker freedom (B) Greater worker negotiation (C) Worker empowerment (D) Increased worker power\nA: ",
        {
          "until": [
            "</s>"
          ]
        }
      ]
    ],
    "resps": [
      [
        "(C)"
      ]
    ],
    "filtered_resps": [
      "(C)"
    ],
    "exact_match": 1.0
  },
  {
    "doc_id": 102,
    "doc": {
      "question": "What is not one of the layers of cultural influence?",
      "subject": "management",
      "choices": [
        "Social",
        "Business",
        "Organisational",
        "Company"
      ],
      "answer": 3
    },
    "target": "(D)",
    "arguments": [
      [
        "The following are multiple choice questions (with answers) about management.\n\nQ: What are the two main dimensions of the Ohio Studies into leadership?\n(A) Starting position and end position (B) Initial environment and changed environment (C) Organisational structure and conditioning (D) Initiating structure and considerations\nA:  (D)\n\nQ: Hygiene factors are associated with which writer?\n(A) Frederick Hertzberg (B) D.C. McClelland (C) Abraham Maslow (D) Douglas McGregor\nA:  (A)\n\nQ: Which element of the cultural web forms regalia?\n(A) Symbols (B) Rituals and routines (C) Power structures (D) Control systems\nA:  (A)\n\nQ: What characteristic is not a key feature of the 'open systems' model of management?\n(A) Morale (B) Innovation (C) Growth resource (D) Adaptation\nA:  (A)\n\nQ: How can organisational structures that are characterised by democratic and inclusive styles of management be described?\n(A) Hierarchical (B) Bureaucratic (C) Flat (D) Functional\nA:  (C)\n\nQ: What is not one of the layers of cultural influence?\n(A) Social (B) Business (C) Organisational (D) Company\nA: ",
        {
          "until": [
            "</s>"
          ]
        }
      ]
    ],
    "resps": [
      [
        "(D)"
      ]
    ],
    "filtered_resps": [
      "(D)"
    ],
    "exact_match": 1.0
  },
  {
    "doc_id": 7,
    "doc": {
      "question": "What is the term for power derived from status or position in an organisation?",
      "subject": "management",
      "choices": [
        "Referent",
        "Expert",
        "Reward",
        "Legitimate"
      ],
      "answer": 3
    },
    "target": "(D)",
    "arguments": [
      [
        "The following are multiple choice questions (with answers) about management.\n\nQ: What characteristic is not a key feature of the 'open systems' model of management?\n(A) Morale (B) Innovation (C) Growth resource (D) Adaptation\nA:  (A)\n\nQ: What are the two main dimensions of the Ohio Studies into leadership?\n(A) Starting position and end position (B) Initial environment and changed environment (C) Organisational structure and conditioning (D) Initiating structure and considerations\nA:  (D)\n\nQ: How can organisational structures that are characterised by democratic and inclusive styles of management be described?\n(A) Hierarchical (B) Bureaucratic (C) Flat (D) Functional\nA:  (C)\n\nQ: Which element of the cultural web forms regalia?\n(A) Symbols (B) Rituals and routines (C) Power structures (D) Control systems\nA:  (A)\n\nQ: Hygiene factors are associated with which writer?\n(A) Frederick Hertzberg (B) D.C. McClelland (C) Abraham Maslow (D) Douglas McGregor\nA:  (A)\n\nQ: What is the term for power derived from status or position in an organisation?\n(A) Referent (B) Expert (C) Reward (D) Legitimate\nA: ",
        {
          "until": [
            "</s>"
          ]
        }
      ]
    ],
    "resps": [
      [
        "(D)"
      ]
    ],
    "filtered_resps": [
      "(D)"
    ],
    "exact_match": 1.0
  },
  {
    "doc_id": 15,
    "doc": {
      "question": "Which one of the following is not one of Drucker's five guiding principles of management?",
      "subject": "management",
      "choices": [
        "Making people's strengths effective and their weaknesses irrelevant.",
        "Enhancing the ability of people to contribute.",
        "To operate the organisation's status system.",
        "Integrating people in a common venture by thinking through, setting and exemplifying the organisational objectives, values and goals."
      ],
      "answer": 2
    },
    "target": "(C)",
    "arguments": [
      [
        "The following are multiple choice questions (with answers) about management.\n\nQ: What are the two main dimensions of the Ohio Studies into leadership?\n(A) Starting position and end position (B) Initial environment and changed environment (C) Organisational structure and conditioning (D) Initiating structure and considerations\nA:  (D)\n\nQ: How can organisational structures that are characterised by democratic and inclusive styles of management be described?\n(A) Hierarchical (B) Bureaucratic (C) Flat (D) Functional\nA:  (C)\n\nQ: Hygiene factors are associated with which writer?\n(A) Frederick Hertzberg (B) D.C. McClelland (C) Abraham Maslow (D) Douglas McGregor\nA:  (A)\n\nQ: What characteristic is not a key feature of the 'open systems' model of management?\n(A) Morale (B) Innovation (C) Growth resource (D) Adaptation\nA:  (A)\n\nQ: Which element of the cultural web forms regalia?\n(A) Symbols (B) Rituals and routines (C) Power structures (D) Control systems\nA:  (A)\n\nQ: Which one of the following is not one of Drucker's five guiding principles of management?\n(A) Making people's strengths effective and their weaknesses irrelevant. (B) Enhancing the ability of people to contribute. (C) To operate the organisation's status system. (D) Integrating people in a common venture by thinking through, setting and exemplifying the organisational objectives, values and goals.\nA: ",
        {
          "until": [
            "</s>"
          ]
        }
      ]
    ],
    "resps": [
      [
        "(D)"
      ]
    ],
    "filtered_resps": [
      "(D)"
    ],
    "exact_match": 0.0
  },
  {
    "doc_id": 23,
    "doc": {
      "question": "Of what is individual freedom to schedule work an example?",
      "subject": "management",
      "choices": [
        "Job design",
        "Job enrichment",
        "Job rate",
        "Job planning"
      ],
      "answer": 1
    },
    "target": "(B)",
    "arguments": [
      [
        "The following are multiple choice questions (with answers) about management.\n\nQ: What are the two main dimensions of the Ohio Studies into leadership?\n(A) Starting position and end position (B) Initial environment and changed environment (C) Organisational structure and conditioning (D) Initiating structure and considerations\nA:  (D)\n\nQ: How can organisational structures that are characterised by democratic and inclusive styles of management be described?\n(A) Hierarchical (B) Bureaucratic (C) Flat (D) Functional\nA:  (C)\n\nQ: Hygiene factors are associated with which writer?\n(A) Frederick Hertzberg (B) D.C. McClelland (C) Abraham Maslow (D) Douglas McGregor\nA:  (A)\n\nQ: Which element of the cultural web forms regalia?\n(A) Symbols (B) Rituals and routines (C) Power structures (D) Control systems\nA:  (A)\n\nQ: What characteristic is not a key feature of the 'open systems' model of management?\n(A) Morale (B) Innovation (C) Growth resource (D) Adaptation\nA:  (A)\n\nQ: Of what is individual freedom to schedule work an example?\n(A) Job design (B) Job enrichment (C) Job rate (D) Job planning\nA: ",
        {
          "until": [
            "</s>"
          ]
        }
      ]
    ],
    "resps": [
      [
        "(D)"
      ]
    ],
    "filtered_resps": [
      "(D)"
    ],
    "exact_match": 0.0
  },
  {
    "doc_id": 31,
    "doc": {
      "question": "What is the term for the act of getting individuals to behave in ways that are acceptable to a group?",
      "subject": "management",
      "choices": [
        "Indoctrination",
        "Brainwashing",
        "Propaganda",
        "Socialisation"
      ],
      "answer": 3
    },
    "target": "(D)",
    "arguments": [
      [
        "The following are multiple choice questions (with answers) about management.\n\nQ: Hygiene factors are associated with which writer?\n(A) Frederick Hertzberg (B) D.C. McClelland (C) Abraham Maslow (D) Douglas McGregor\nA:  (A)\n\nQ: What are the two main dimensions of the Ohio Studies into leadership?\n(A) Starting position and end position (B) Initial environment and changed environment (C) Organisational structure and conditioning (D) Initiating structure and considerations\nA:  (D)\n\nQ: What characteristic is not a key feature of the 'open systems' model of management?\n(A) Morale (B) Innovation (C) Growth resource (D) Adaptation\nA:  (A)\n\nQ: Which element of the cultural web forms regalia?\n(A) Symbols (B) Rituals and routines (C) Power structures (D) Control systems\nA:  (A)\n\nQ: How can organisational structures that are characterised by democratic and inclusive styles of management be described?\n(A) Hierarchical (B) Bureaucratic (C) Flat (D) Functional\nA:  (C)\n\nQ: What is the term for the act of getting individuals to behave in ways that are acceptable to a group?\n(A) Indoctrination (B) Brainwashing (C) Propaganda (D) Socialisation\nA: ",
        {
          "until": [
            "</s>"
          ]
        }
      ]
    ],
    "resps": [
      [
        "(D)"
      ]
    ],
    "filtered_resps": [
      "(D)"
    ],
    "exact_match": 1.0
  },
  {
    "doc_id": 39,
    "doc": {
      "question": "Functional structures help to create\u0085...",
      "subject": "management",
      "choices": [
        "teamwork",
        "specialisation",
        "project work groups",
        "multi-skilled employees"
      ],
      "answer": 1
    },
    "target": "(B)",
    "arguments": [
      [
        "The following are multiple choice questions (with answers) about management.\n\nQ: How can organisational structures that are characterised by democratic and inclusive styles of management be described?\n(A) Hierarchical (B) Bureaucratic (C) Flat (D) Functional\nA:  (C)\n\nQ: What characteristic is not a key feature of the 'open systems' model of management?\n(A) Morale (B) Innovation (C) Growth resource (D) Adaptation\nA:  (A)\n\nQ: What are the two main dimensions of the Ohio Studies into leadership?\n(A) Starting position and end position (B) Initial environment and changed environment (C) Organisational structure and conditioning (D) Initiating structure and considerations\nA:  (D)\n\nQ: Which element of the cultural web forms regalia?\n(A) Symbols (B) Rituals and routines (C) Power structures (D) Control systems\nA:  (A)\n\nQ: Hygiene factors are associated with which writer?\n(A) Frederick Hertzberg (B) D.C. McClelland (C) Abraham Maslow (D) Douglas McGregor\nA:  (A)\n\nQ: Functional structures help to create\u0085...\n(A) teamwork (B) specialisation (C) project work groups (D) multi-skilled employees\nA: ",
        {
          "until": [
            "</s>"
          ]
        }
      ]
    ],
    "resps": [
      [
        "(D)"
      ]
    ],
    "filtered_resps": [
      "(D)"
    ],
    "exact_match": 0.0
  },
  {
    "doc_id": 47,
    "doc": {
      "question": "Who of the following is a leading writer on contingency theory of leadership?",
      "subject": "management",
      "choices": [
        "Rosabeth Kanter",
        "Joan Woodward",
        "Rensis Likert",
        "Fred Fiedler"
      ],
      "answer": 3
    },
    "target": "(D)",
    "arguments": [
      [
        "The following are multiple choice questions (with answers) about management.\n\nQ: What are the two main dimensions of the Ohio Studies into leadership?\n(A) Starting position and end position (B) Initial environment and changed environment (C) Organisational structure and conditioning (D) Initiating structure and considerations\nA:  (D)\n\nQ: How can organisational structures that are characterised by democratic and inclusive styles of management be described?\n(A) Hierarchical (B) Bureaucratic (C) Flat (D) Functional\nA:  (C)\n\nQ: Which element of the cultural web forms regalia?\n(A) Symbols (B) Rituals and routines (C) Power structures (D) Control systems\nA:  (A)\n\nQ: What characteristic is not a key feature of the 'open systems' model of management?\n(A) Morale (B) Innovation (C) Growth resource (D) Adaptation\nA:  (A)\n\nQ: Hygiene factors are associated with which writer?\n(A) Frederick Hertzberg (B) D.C. McClelland (C) Abraham Maslow (D) Douglas McGregor\nA:  (A)\n\nQ: Who of the following is a leading writer on contingency theory of leadership?\n(A) Rosabeth Kanter (B) Joan Woodward (C) Rensis Likert (D) Fred Fiedler\nA: ",
        {
          "until": [
            "</s>"
          ]
        }
      ]
    ],
    "resps": [
      [
        "(C)"
      ]
    ],
    "filtered_resps": [
      "(C)"
    ],
    "exact_match": 0.0
  },
  {
    "doc_id": 55,
    "doc": {
      "question": "Which of these does not form part of the key streams identified by March (1988) in decision making in highly ambiguous environments?",
      "subject": "management",
      "choices": [
        "Expectations",
        "Choice opportunities",
        "Problems",
        "Solutions"
      ],
      "answer": 0
    },
    "target": "(A)",
    "arguments": [
      [
        "The following are multiple choice questions (with answers) about management.\n\nQ: How can organisational structures that are characterised by democratic and inclusive styles of management be described?\n(A) Hierarchical (B) Bureaucratic (C) Flat (D) Functional\nA:  (C)\n\nQ: What are the two main dimensions of the Ohio Studies into leadership?\n(A) Starting position and end position (B) Initial environment and changed environment (C) Organisational structure and conditioning (D) Initiating structure and considerations\nA:  (D)\n\nQ: Which element of the cultural web forms regalia?\n(A) Symbols (B) Rituals and routines (C) Power structures (D) Control systems\nA:  (A)\n\nQ: Hygiene factors are associated with which writer?\n(A) Frederick Hertzberg (B) D.C. McClelland (C) Abraham Maslow (D) Douglas McGregor\nA:  (A)\n\nQ: What characteristic is not a key feature of the 'open systems' model of management?\n(A) Morale (B) Innovation (C) Growth resource (D) Adaptation\nA:  (A)\n\nQ: Which of these does not form part of the key streams identified by March (1988) in decision making in highly ambiguous environments?\n(A) Expectations (B) Choice opportunities (C) Problems (D) Solutions\nA: ",
        {
          "until": [
            "</s>"
          ]
        }
      ]
    ],
    "resps": [
      [
        "(A)"
      ]
    ],
    "filtered_resps": [
      "(A)"
    ],
    "exact_match": 1.0
  },
  {
    "doc_id": 63,
    "doc": {
      "question": "What is the term used in Ansoff's matrix for increasing market share with existing products in existing markets?",
      "subject": "management",
      "choices": [
        "Product development",
        "Market penetration",
        "Diversification",
        "Market development"
      ],
      "answer": 1
    },
    "target": "(B)",
    "arguments": [
      [
        "The following are multiple choice questions (with answers) about management.\n\nQ: Which element of the cultural web forms regalia?\n(A) Symbols (B) Rituals and routines (C) Power structures (D) Control systems\nA:  (A)\n\nQ: How can organisational structures that are characterised by democratic and inclusive styles of management be described?\n(A) Hierarchical (B) Bureaucratic (C) Flat (D) Functional\nA:  (C)\n\nQ: What are the two main dimensions of the Ohio Studies into leadership?\n(A) Starting position and end position (B) Initial environment and changed environment (C) Organisational structure and conditioning (D) Initiating structure and considerations\nA:  (D)\n\nQ: What characteristic is not a key feature of the 'open systems' model of management?\n(A) Morale (B) Innovation (C) Growth resource (D) Adaptation\nA:  (A)\n\nQ: Hygiene factors are associated with which writer?\n(A) Frederick Hertzberg (B) D.C. McClelland (C) Abraham Maslow (D) Douglas McGregor\nA:  (A)\n\nQ: What is the term used in Ansoff's matrix for increasing market share with existing products in existing markets?\n(A) Product development (B) Market penetration (C) Diversification (D) Market development\nA: ",
        {
          "until": [
            "</s>"
          ]
        }
      ]
    ],
    "resps": [
      [
        "(C)"
      ]
    ],
    "filtered_resps": [
      "(C)"
    ],
    "exact_match": 0.0
  },
  {
    "doc_id": 71,
    "doc": {
      "question": "What one of the following is not a characteristic of the job characteristics model?",
      "subject": "management",
      "choices": [
        "Task identity",
        "Autonomy",
        "Reward",
        "Feedback"
      ],
      "answer": 2
    },
    "target": "(C)",
    "arguments": [
      [
        "The following are multiple choice questions (with answers) about management.\n\nQ: How can organisational structures that are characterised by democratic and inclusive styles of management be described?\n(A) Hierarchical (B) Bureaucratic (C) Flat (D) Functional\nA:  (C)\n\nQ: What are the two main dimensions of the Ohio Studies into leadership?\n(A) Starting position and end position (B) Initial environment and changed environment (C) Organisational structure and conditioning (D) Initiating structure and considerations\nA:  (D)\n\nQ: Which element of the cultural web forms regalia?\n(A) Symbols (B) Rituals and routines (C) Power structures (D) Control systems\nA:  (A)\n\nQ: What characteristic is not a key feature of the 'open systems' model of management?\n(A) Morale (B) Innovation (C) Growth resource (D) Adaptation\nA:  (A)\n\nQ: Hygiene factors are associated with which writer?\n(A) Frederick Hertzberg (B) D.C. McClelland (C) Abraham Maslow (D) Douglas McGregor\nA:  (A)\n\nQ: What one of the following is not a characteristic of the job characteristics model?\n(A) Task identity (B) Autonomy (C) Reward (D) Feedback\nA: ",
        {
          "until": [
            "</s>"
          ]
        }
      ]
    ],
    "resps": [
      [
        "(A)"
      ]
    ],
    "filtered_resps": [
      "(A)"
    ],
    "exact_match": 0.0
  },
  {
    "doc_id": 79,
    "doc": {
      "question": "What is the term for decisions limited by human capacity to absorb and analyse information?",
      "subject": "management",
      "choices": [
        "Cognitive rationality",
        "Conscious rationality",
        "Bounded rationality",
        "Restricted rationality"
      ],
      "answer": 2
    },
    "target": "(C)",
    "arguments": [
      [
        "The following are multiple choice questions (with answers) about management.\n\nQ: Which element of the cultural web forms regalia?\n(A) Symbols (B) Rituals and routines (C) Power structures (D) Control systems\nA:  (A)\n\nQ: Hygiene factors are associated with which writer?\n(A) Frederick Hertzberg (B) D.C. McClelland (C) Abraham Maslow (D) Douglas McGregor\nA:  (A)\n\nQ: How can organisational structures that are characterised by democratic and inclusive styles of management be described?\n(A) Hierarchical (B) Bureaucratic (C) Flat (D) Functional\nA:  (C)\n\nQ: What characteristic is not a key feature of the 'open systems' model of management?\n(A) Morale (B) Innovation (C) Growth resource (D) Adaptation\nA:  (A)\n\nQ: What are the two main dimensions of the Ohio Studies into leadership?\n(A) Starting position and end position (B) Initial environment and changed environment (C) Organisational structure and conditioning (D) Initiating structure and considerations\nA:  (D)\n\nQ: What is the term for decisions limited by human capacity to absorb and analyse information?\n(A) Cognitive rationality (B) Conscious rationality (C) Bounded rationality (D) Restricted rationality\nA: ",
        {
          "until": [
            "</s>"
          ]
        }
      ]
    ],
    "resps": [
      [
        "(D)"
      ]
    ],
    "filtered_resps": [
      "(D)"
    ],
    "exact_match": 0.0
  },
  {
    "doc_id": 87,
    "doc": {
      "question": "Enhancement of job satisfaction and productivity are key characteristics of which theoretical perspective of work design?",
      "subject": "management",
      "choices": [
        "Process improvement",
        "Techno-structural change model",
        "Job characteristics model",
        "Socio-technical systems"
      ],
      "answer": 3
    },
    "target": "(D)",
    "arguments": [
      [
        "The following are multiple choice questions (with answers) about management.\n\nQ: Hygiene factors are associated with which writer?\n(A) Frederick Hertzberg (B) D.C. McClelland (C) Abraham Maslow (D) Douglas McGregor\nA:  (A)\n\nQ: What are the two main dimensions of the Ohio Studies into leadership?\n(A) Starting position and end position (B) Initial environment and changed environment (C) Organisational structure and conditioning (D) Initiating structure and considerations\nA:  (D)\n\nQ: What characteristic is not a key feature of the 'open systems' model of management?\n(A) Morale (B) Innovation (C) Growth resource (D) Adaptation\nA:  (A)\n\nQ: How can organisational structures that are characterised by democratic and inclusive styles of management be described?\n(A) Hierarchical (B) Bureaucratic (C) Flat (D) Functional\nA:  (C)\n\nQ: Which element of the cultural web forms regalia?\n(A) Symbols (B) Rituals and routines (C) Power structures (D) Control systems\nA:  (A)\n\nQ: Enhancement of job satisfaction and productivity are key characteristics of which theoretical perspective of work design?\n(A) Process improvement (B) Techno-structural change model (C) Job characteristics model (D) Socio-technical systems\nA: ",
        {
          "until": [
            "</s>"
          ]
        }
      ]
    ],
    "resps": [
      [
        "(C)"
      ]
    ],
    "filtered_resps": [
      "(C)"
    ],
    "exact_match": 0.0
  },
  {
    "doc_id": 95,
    "doc": {
      "question": "Vertical integration forwards is when a firm mergers or acquires another",
      "subject": "management",
      "choices": [
        "Towards the source of supply",
        "Towards the consumer",
        "At the same stage of the supply chain",
        "In another industry"
      ],
      "answer": 1
    },
    "target": "(B)",
    "arguments": [
      [
        "The following are multiple choice questions (with answers) about management.\n\nQ: What are the two main dimensions of the Ohio Studies into leadership?\n(A) Starting position and end position (B) Initial environment and changed environment (C) Organisational structure and conditioning (D) Initiating structure and considerations\nA:  (D)\n\nQ: Hygiene factors are associated with which writer?\n(A) Frederick Hertzberg (B) D.C. McClelland (C) Abraham Maslow (D) Douglas McGregor\nA:  (A)\n\nQ: How can organisational structures that are characterised by democratic and inclusive styles of management be described?\n(A) Hierarchical (B) Bureaucratic (C) Flat (D) Functional\nA:  (C)\n\nQ: Which element of the cultural web forms regalia?\n(A) Symbols (B) Rituals and routines (C) Power structures (D) Control systems\nA:  (A)\n\nQ: What characteristic is not a key feature of the 'open systems' model of management?\n(A) Morale (B) Innovation (C) Growth resource (D) Adaptation\nA:  (A)\n\nQ: Vertical integration forwards is when a firm mergers or acquires another\n(A) Towards the source of supply (B) Towards the consumer (C) At the same stage of the supply chain (D) In another industry\nA: ",
        {
          "until": [
            "</s>"
          ]
        }
      ]
    ],
    "resps": [
      [
        "(D)"
      ]
    ],
    "filtered_resps": [
      "(D)"
    ],
    "exact_match": 0.0
  }
]