[
  {
    "doc_id": 0,
    "doc": {
      "question": "Which of the following methods of detecting breast cancer involves exposure to radiation?",
      "subject": "human_sexuality",
      "choices": [
        "Needle aspiration",
        "Mammography",
        "Mastectomy",
        "Lumpectomy"
      ],
      "answer": 1
    },
    "target": "(B)",
    "arguments": [
      [
        "The following are multiple choice questions (with answers) about human sexuality.\n\nQ: The nature of homosexual activities that occur during preadolescence include all but which of the following?\n(A) sexual intercourse (B) circle jerks (C) exhibitionism (D) touching each other's genitals\nA:  (A)\n\nQ: Morning sickness is typically a problem:\n(A) during the first trimester (B) during the second trimester (C) during the third trimester (D) all through the pregnancy\nA:  (A)\n\nQ: The most common disorder among men who seek sexual therapy is:\n(A) premature ejaculation (B) inhibited ejaculation (C) erectile disorder (D) ejaculatory disorder\nA:  (C)\n\nQ: Women's ability to have multiple orgasms is primarily due to:\n(A) the fact that they do not have a refractory period. (B) the response of the inner layers of the vagina. (C) having alternating orgasms in different locations. (D) the G-Spot.\nA:  (A)\n\nQ: A woman who knows she has active herpes and untreated syphilis but continues to have sex without informing her partners of her condition has, in psychoanalytic terms:\n(A) a strong ego (B) a weak superego (C) a weak id (D) a strong superego\nA:  (B)\n\nQ: Which of the following methods of detecting breast cancer involves exposure to radiation?\n(A) Needle aspiration (B) Mammography (C) Mastectomy (D) Lumpectomy\nA: ",
        {
          "until": [
            "</s>"
          ]
        }
      ]
    ],
    "resps": [
      [
        "(B)"
      ]
    ],
    "filtered_resps": [
      "(B)"
    ],
    "exact_match": 1.0
  },
  {
    "doc_id": 8,
    "doc": {
      "question": "Bruce is a homosexual man. His friend Chuck is a heterosexual man. If we could have observed Bruce and Chuck as children we might have expected which of the following?",
      "subject": "human_sexuality",
      "choices": [
        "Bruce likely participated in more female-typical play than Chuck.",
        "Bruce likely participated in more male-typical play than Chuck.",
        "Bruce and Chuck likely participated in more male-typical play than female-typical play.",
        "Bruce's father was more likely to have homosexual tendencies than Chuck's father."
      ],
      "answer": 0
    },
    "target": "(A)",
    "arguments": [
      [
        "The following are multiple choice questions (with answers) about human sexuality.\n\nQ: Morning sickness is typically a problem:\n(A) during the first trimester (B) during the second trimester (C) during the third trimester (D) all through the pregnancy\nA:  (A)\n\nQ: The most common disorder among men who seek sexual therapy is:\n(A) premature ejaculation (B) inhibited ejaculation (C) erectile disorder (D) ejaculatory disorder\nA:  (C)\n\nQ: A woman who knows she has active herpes and untreated syphilis but continues to have sex without informing her partners of her condition has, in psychoanalytic terms:\n(A) a strong ego (B) a weak superego (C) a weak id (D) a strong superego\nA:  (B)\n\nQ: The nature of homosexual activities that occur during preadolescence include all but which of the following?\n(A) sexual intercourse (B) circle jerks (C) exhibitionism (D) touching each other's genitals\nA:  (A)\n\nQ: Women's ability to have multiple orgasms is primarily due to:\n(A) the fact that they do not have a refractory period. (B) the response of the inner layers of the vagina. (C) having alternating orgasms in different locations. (D) the G-Spot.\nA:  (A)\n\nQ: Bruce is a homosexual man. His friend Chuck is a heterosexual man. If we could have observed Bruce and Chuck as children we might have expected which of the following?\n(A) Bruce likely participated in more female-typical play than Chuck. (B) Bruce likely participated in more male-typical play than Chuck. (C) Bruce and Chuck likely participated in more male-typical play than female-typical play. (D) Bruce's father was more likely to have homosexual tendencies than Chuck's father.\nA: ",
        {
          "until": [
            "</s>"
          ]
        }
      ]
    ],
    "resps": [
      [
        "(B)"
      ]
    ],
    "filtered_resps": [
      "(B)"
    ],
    "exact_match": 0.0
  },
  {
    "doc_id": 16,
    "doc": {
      "question": "Which of the following theories uses terms such as \"modelling\" and \"imitation\" to explain the effects of exposure to erotica on a person's behaviour?",
      "subject": "human_sexuality",
      "choices": [
        "sociobiology",
        "psychoanalytic theory",
        "script theory",
        "social learning theory"
      ],
      "answer": 3
    },
    "target": "(D)",
    "arguments": [
      [
        "The following are multiple choice questions (with answers) about human sexuality.\n\nQ: Morning sickness is typically a problem:\n(A) during the first trimester (B) during the second trimester (C) during the third trimester (D) all through the pregnancy\nA:  (A)\n\nQ: The most common disorder among men who seek sexual therapy is:\n(A) premature ejaculation (B) inhibited ejaculation (C) erectile disorder (D) ejaculatory disorder\nA:  (C)\n\nQ: A woman who knows she has active herpes and untreated syphilis but continues to have sex without informing her partners of her condition has, in psychoanalytic terms:\n(A) a strong ego (B) a weak superego (C) a weak id (D) a strong superego\nA:  (B)\n\nQ: Women's ability to have multiple orgasms is primarily due to:\n(A) the fact that they do not have a refractory period. (B) the response of the inner layers of the vagina. (C) having alternating orgasms in different locations. (D) the G-Spot.\nA:  (A)\n\nQ: The nature of homosexual activities that occur during preadolescence include all but which of the following?\n(A) sexual intercourse (B) circle jerks (C) exhibitionism (D) touching each other's genitals\nA:  (A)\n\nQ: Which of the following theories uses terms such as \"modelling\" and \"imitation\" to explain the effects of exposure to erotica on a person's behaviour?\n(A) sociobiology (B) psychoanalytic theory (C) script theory (D) social learning theory\nA: ",
        {
          "until": [
            "</s>"
          ]
        }
      ]
    ],
    "resps": [
      [
        "(B)"
      ]
    ],
    "filtered_resps": [
      "(B)"
    ],
    "exact_match": 0.0
  },
  {
    "doc_id": 24,
    "doc": {
      "question": "What seems to be the case when the folk saying \"opposites attract\" (i.e., dissimilar attitudes tend to cause liking) when it is considered in light of current research?",
      "subject": "human_sexuality",
      "choices": [
        "It does not seem to be true.",
        "It seems to be true for heterosexuals but not for homosexuals.",
        "It seems to be true for homosexuals but not for heterosexuals.",
        "It seems to be true for women but not for men"
      ],
      "answer": 0
    },
    "target": "(A)",
    "arguments": [
      [
        "The following are multiple choice questions (with answers) about human sexuality.\n\nQ: A woman who knows she has active herpes and untreated syphilis but continues to have sex without informing her partners of her condition has, in psychoanalytic terms:\n(A) a strong ego (B) a weak superego (C) a weak id (D) a strong superego\nA:  (B)\n\nQ: Morning sickness is typically a problem:\n(A) during the first trimester (B) during the second trimester (C) during the third trimester (D) all through the pregnancy\nA:  (A)\n\nQ: The nature of homosexual activities that occur during preadolescence include all but which of the following?\n(A) sexual intercourse (B) circle jerks (C) exhibitionism (D) touching each other's genitals\nA:  (A)\n\nQ: Women's ability to have multiple orgasms is primarily due to:\n(A) the fact that they do not have a refractory period. (B) the response of the inner layers of the vagina. (C) having alternating orgasms in different locations. (D) the G-Spot.\nA:  (A)\n\nQ: The most common disorder among men who seek sexual therapy is:\n(A) premature ejaculation (B) inhibited ejaculation (C) erectile disorder (D) ejaculatory disorder\nA:  (C)\n\nQ: What seems to be the case when the folk saying \"opposites attract\" (i.e., dissimilar attitudes tend to cause liking) when it is considered in light of current research?\n(A) It does not seem to be true. (B) It seems to be true for heterosexuals but not for homosexuals. (C) It seems to be true for homosexuals but not for heterosexuals. (D) It seems to be true for women but not for men\nA: ",
        {
          "until": [
            "</s>"
          ]
        }
      ]
    ],
    "resps": [
      [
        "(A)"
      ]
    ],
    "filtered_resps": [
      "(A)"
    ],
    "exact_match": 1.0
  },
  {
    "doc_id": 32,
    "doc": {
      "question": "Which of the following restrictions existed in at least one culture? No sex",
      "subject": "human_sexuality",
      "choices": [
        "for a period of time following childbirth",
        "during menstruation",
        "between parents and children",
        "all of the above"
      ],
      "answer": 3
    },
    "target": "(D)",
    "arguments": [
      [
        "The following are multiple choice questions (with answers) about human sexuality.\n\nQ: The most common disorder among men who seek sexual therapy is:\n(A) premature ejaculation (B) inhibited ejaculation (C) erectile disorder (D) ejaculatory disorder\nA:  (C)\n\nQ: The nature of homosexual activities that occur during preadolescence include all but which of the following?\n(A) sexual intercourse (B) circle jerks (C) exhibitionism (D) touching each other's genitals\nA:  (A)\n\nQ: Morning sickness is typically a problem:\n(A) during the first trimester (B) during the second trimester (C) during the third trimester (D) all through the pregnancy\nA:  (A)\n\nQ: Women's ability to have multiple orgasms is primarily due to:\n(A) the fact that they do not have a refractory period. (B) the response of the inner layers of the vagina. (C) having alternating orgasms in different locations. (D) the G-Spot.\nA:  (A)\n\nQ: A woman who knows she has active herpes and untreated syphilis but continues to have sex without informing her partners of her condition has, in psychoanalytic terms:\n(A) a strong ego (B) a weak superego (C) a weak id (D) a strong superego\nA:  (B)\n\nQ: Which of the following restrictions existed in at least one culture? No sex\n(A) for a period of time following childbirth (B) during menstruation (C) between parents and children (D) all of the above\nA: ",
        {
          "until": [
            "</s>"
          ]
        }
      ]
    ],
    "resps": [
      [
        "(D)"
      ]
    ],
    "filtered_resps": [
      "(D)"
    ],
    "exact_match": 1.0
  },
  {
    "doc_id": 40,
    "doc": {
      "question": "Which of the following is homologous to the glans of the penis?",
      "subject": "human_sexuality",
      "choices": [
        "labia minora",
        "labia majora",
        "mons",
        "clitoris"
      ],
      "answer": 3
    },
    "target": "(D)",
    "arguments": [
      [
        "The following are multiple choice questions (with answers) about human sexuality.\n\nQ: Morning sickness is typically a problem:\n(A) during the first trimester (B) during the second trimester (C) during the third trimester (D) all through the pregnancy\nA:  (A)\n\nQ: The most common disorder among men who seek sexual therapy is:\n(A) premature ejaculation (B) inhibited ejaculation (C) erectile disorder (D) ejaculatory disorder\nA:  (C)\n\nQ: Women's ability to have multiple orgasms is primarily due to:\n(A) the fact that they do not have a refractory period. (B) the response of the inner layers of the vagina. (C) having alternating orgasms in different locations. (D) the G-Spot.\nA:  (A)\n\nQ: The nature of homosexual activities that occur during preadolescence include all but which of the following?\n(A) sexual intercourse (B) circle jerks (C) exhibitionism (D) touching each other's genitals\nA:  (A)\n\nQ: A woman who knows she has active herpes and untreated syphilis but continues to have sex without informing her partners of her condition has, in psychoanalytic terms:\n(A) a strong ego (B) a weak superego (C) a weak id (D) a strong superego\nA:  (B)\n\nQ: Which of the following is homologous to the glans of the penis?\n(A) labia minora (B) labia majora (C) mons (D) clitoris\nA: ",
        {
          "until": [
            "</s>"
          ]
        }
      ]
    ],
    "resps": [
      [
        "(B)"
      ]
    ],
    "filtered_resps": [
      "(B)"
    ],
    "exact_match": 0.0
  },
  {
    "doc_id": 48,
    "doc": {
      "question": "Roman Catholicism takes the position that it is sinful to",
      "subject": "human_sexuality",
      "choices": [
        "engage in homosexual acts",
        "engage in heterosexual acts outside of marriage",
        "take the birth control pill",
        "all of the above"
      ],
      "answer": 3
    },
    "target": "(D)",
    "arguments": [
      [
        "The following are multiple choice questions (with answers) about human sexuality.\n\nQ: The most common disorder among men who seek sexual therapy is:\n(A) premature ejaculation (B) inhibited ejaculation (C) erectile disorder (D) ejaculatory disorder\nA:  (C)\n\nQ: Morning sickness is typically a problem:\n(A) during the first trimester (B) during the second trimester (C) during the third trimester (D) all through the pregnancy\nA:  (A)\n\nQ: Women's ability to have multiple orgasms is primarily due to:\n(A) the fact that they do not have a refractory period. (B) the response of the inner layers of the vagina. (C) having alternating orgasms in different locations. (D) the G-Spot.\nA:  (A)\n\nQ: A woman who knows she has active herpes and untreated syphilis but continues to have sex without informing her partners of her condition has, in psychoanalytic terms:\n(A) a strong ego (B) a weak superego (C) a weak id (D) a strong superego\nA:  (B)\n\nQ: The nature of homosexual activities that occur during preadolescence include all but which of the following?\n(A) sexual intercourse (B) circle jerks (C) exhibitionism (D) touching each other's genitals\nA:  (A)\n\nQ: Roman Catholicism takes the position that it is sinful to\n(A) engage in homosexual acts (B) engage in heterosexual acts outside of marriage (C) take the birth control pill (D) all of the above\nA: ",
        {
          "until": [
            "</s>"
          ]
        }
      ]
    ],
    "resps": [
      [
        "(D)"
      ]
    ],
    "filtered_resps": [
      "(D)"
    ],
    "exact_match": 1.0
  },
  {
    "doc_id": 56,
    "doc": {
      "question": "Jeffrey Dahmer's behaviour might best fit into the category of:",
      "subject": "human_sexuality",
      "choices": [
        "zoophilia",
        "necrophilia",
        "urophilia",
        "scoptophilia"
      ],
      "answer": 1
    },
    "target": "(B)",
    "arguments": [
      [
        "The following are multiple choice questions (with answers) about human sexuality.\n\nQ: Women's ability to have multiple orgasms is primarily due to:\n(A) the fact that they do not have a refractory period. (B) the response of the inner layers of the vagina. (C) having alternating orgasms in different locations. (D) the G-Spot.\nA:  (A)\n\nQ: The most common disorder among men who seek sexual therapy is:\n(A) premature ejaculation (B) inhibited ejaculation (C) erectile disorder (D) ejaculatory disorder\nA:  (C)\n\nQ: Morning sickness is typically a problem:\n(A) during the first trimester (B) during the second trimester (C) during the third trimester (D) all through the pregnancy\nA:  (A)\n\nQ: The nature of homosexual activities that occur during preadolescence include all but which of the following?\n(A) sexual intercourse (B) circle jerks (C) exhibitionism (D) touching each other's genitals\nA:  (A)\n\nQ: A woman who knows she has active herpes and untreated syphilis but continues to have sex without informing her partners of her condition has, in psychoanalytic terms:\n(A) a strong ego (B) a weak superego (C) a weak id (D) a strong superego\nA:  (B)\n\nQ: Jeffrey Dahmer's behaviour might best fit into the category of:\n(A) zoophilia (B) necrophilia (C) urophilia (D) scoptophilia\nA: ",
        {
          "until": [
            "</s>"
          ]
        }
      ]
    ],
    "resps": [
      [
        "(C)"
      ]
    ],
    "filtered_resps": [
      "(C)"
    ],
    "exact_match": 0.0
  },
  {
    "doc_id": 64,
    "doc": {
      "question": "At about _________ months after conception, the gender of the fetus is clear from the appearance of external genitals.",
      "subject": "human_sexuality",
      "choices": [
        "2",
        "4",
        "6",
        "8"
      ],
      "answer": 1
    },
    "target": "(B)",
    "arguments": [
      [
        "The following are multiple choice questions (with answers) about human sexuality.\n\nQ: The most common disorder among men who seek sexual therapy is:\n(A) premature ejaculation (B) inhibited ejaculation (C) erectile disorder (D) ejaculatory disorder\nA:  (C)\n\nQ: Morning sickness is typically a problem:\n(A) during the first trimester (B) during the second trimester (C) during the third trimester (D) all through the pregnancy\nA:  (A)\n\nQ: Women's ability to have multiple orgasms is primarily due to:\n(A) the fact that they do not have a refractory period. (B) the response of the inner layers of the vagina. (C) having alternating orgasms in different locations. (D) the G-Spot.\nA:  (A)\n\nQ: The nature of homosexual activities that occur during preadolescence include all but which of the following?\n(A) sexual intercourse (B) circle jerks (C) exhibitionism (D) touching each other's genitals\nA:  (A)\n\nQ: A woman who knows she has active herpes and untreated syphilis but continues to have sex without informing her partners of her condition has, in psychoanalytic terms:\n(A) a strong ego (B) a weak superego (C) a weak id (D) a strong superego\nA:  (B)\n\nQ: At about _________ months after conception, the gender of the fetus is clear from the appearance of external genitals.\n(A) 2 (B) 4 (C) 6 (D) 8\nA: ",
        {
          "until": [
            "</s>"
          ]
        }
      ]
    ],
    "resps": [
      [
        "(B)"
      ]
    ],
    "filtered_resps": [
      "(B)"
    ],
    "exact_match": 1.0
  },
  {
    "doc_id": 72,
    "doc": {
      "question": "Vasocongestion is a process of :",
      "subject": "human_sexuality",
      "choices": [
        "muscle contraction",
        "blood accumulation in the genitals",
        "muscle relaxation",
        "detumescence"
      ],
      "answer": 1
    },
    "target": "(B)",
    "arguments": [
      [
        "The following are multiple choice questions (with answers) about human sexuality.\n\nQ: Women's ability to have multiple orgasms is primarily due to:\n(A) the fact that they do not have a refractory period. (B) the response of the inner layers of the vagina. (C) having alternating orgasms in different locations. (D) the G-Spot.\nA:  (A)\n\nQ: A woman who knows she has active herpes and untreated syphilis but continues to have sex without informing her partners of her condition has, in psychoanalytic terms:\n(A) a strong ego (B) a weak superego (C) a weak id (D) a strong superego\nA:  (B)\n\nQ: The most common disorder among men who seek sexual therapy is:\n(A) premature ejaculation (B) inhibited ejaculation (C) erectile disorder (D) ejaculatory disorder\nA:  (C)\n\nQ: The nature of homosexual activities that occur during preadolescence include all but which of the following?\n(A) sexual intercourse (B) circle jerks (C) exhibitionism (D) touching each other's genitals\nA:  (A)\n\nQ: Morning sickness is typically a problem:\n(A) during the first trimester (B) during the second trimester (C) during the third trimester (D) all through the pregnancy\nA:  (A)\n\nQ: Vasocongestion is a process of :\n(A) muscle contraction (B) blood accumulation in the genitals (C) muscle relaxation (D) detumescence\nA: ",
        {
          "until": [
            "</s>"
          ]
        }
      ]
    ],
    "resps": [
      [
        "(B)"
      ]
    ],
    "filtered_resps": [
      "(B)"
    ],
    "exact_match": 1.0
  },
  {
    "doc_id": 80,
    "doc": {
      "question": "Which of the following are reflexes?",
      "subject": "human_sexuality",
      "choices": [
        "ejaculation",
        "erection",
        "orgasm",
        "both A and B"
      ],
      "answer": 3
    },
    "target": "(D)",
    "arguments": [
      [
        "The following are multiple choice questions (with answers) about human sexuality.\n\nQ: A woman who knows she has active herpes and untreated syphilis but continues to have sex without informing her partners of her condition has, in psychoanalytic terms:\n(A) a strong ego (B) a weak superego (C) a weak id (D) a strong superego\nA:  (B)\n\nQ: Morning sickness is typically a problem:\n(A) during the first trimester (B) during the second trimester (C) during the third trimester (D) all through the pregnancy\nA:  (A)\n\nQ: The nature of homosexual activities that occur during preadolescence include all but which of the following?\n(A) sexual intercourse (B) circle jerks (C) exhibitionism (D) touching each other's genitals\nA:  (A)\n\nQ: The most common disorder among men who seek sexual therapy is:\n(A) premature ejaculation (B) inhibited ejaculation (C) erectile disorder (D) ejaculatory disorder\nA:  (C)\n\nQ: Women's ability to have multiple orgasms is primarily due to:\n(A) the fact that they do not have a refractory period. (B) the response of the inner layers of the vagina. (C) having alternating orgasms in different locations. (D) the G-Spot.\nA:  (A)\n\nQ: Which of the following are reflexes?\n(A) ejaculation (B) erection (C) orgasm (D) both A and B\nA: ",
        {
          "until": [
            "</s>"
          ]
        }
      ]
    ],
    "resps": [
      [
        "(D)"
      ]
    ],
    "filtered_resps": [
      "(D)"
    ],
    "exact_match": 1.0
  },
  {
    "doc_id": 88,
    "doc": {
      "question": "In all of her relationships Helen is typically uncomfortable feeling close to another person or having that person feel close to her. According to attachment theory Helen would best be described as:",
      "subject": "human_sexuality",
      "choices": [
        "a secure lover",
        "an avoidant lover",
        "an anxious-ambivalent lover",
        "a passionate lover"
      ],
      "answer": 1
    },
    "target": "(B)",
    "arguments": [
      [
        "The following are multiple choice questions (with answers) about human sexuality.\n\nQ: Morning sickness is typically a problem:\n(A) during the first trimester (B) during the second trimester (C) during the third trimester (D) all through the pregnancy\nA:  (A)\n\nQ: A woman who knows she has active herpes and untreated syphilis but continues to have sex without informing her partners of her condition has, in psychoanalytic terms:\n(A) a strong ego (B) a weak superego (C) a weak id (D) a strong superego\nA:  (B)\n\nQ: The most common disorder among men who seek sexual therapy is:\n(A) premature ejaculation (B) inhibited ejaculation (C) erectile disorder (D) ejaculatory disorder\nA:  (C)\n\nQ: Women's ability to have multiple orgasms is primarily due to:\n(A) the fact that they do not have a refractory period. (B) the response of the inner layers of the vagina. (C) having alternating orgasms in different locations. (D) the G-Spot.\nA:  (A)\n\nQ: The nature of homosexual activities that occur during preadolescence include all but which of the following?\n(A) sexual intercourse (B) circle jerks (C) exhibitionism (D) touching each other's genitals\nA:  (A)\n\nQ: In all of her relationships Helen is typically uncomfortable feeling close to another person or having that person feel close to her. According to attachment theory Helen would best be described as:\n(A) a secure lover (B) an avoidant lover (C) an anxious-ambivalent lover (D) a passionate lover\nA: ",
        {
          "until": [
            "</s>"
          ]
        }
      ]
    ],
    "resps": [
      [
        "(C)"
      ]
    ],
    "filtered_resps": [
      "(C)"
    ],
    "exact_match": 0.0
  },
  {
    "doc_id": 96,
    "doc": {
      "question": "Benny is the head of a successful corporation. After a hard day at work during which he is under incredible pressure to perform well, he goes home to his wife who proceeds to spank him, tie him to their four poster bed, and tease him until he begs for intercourse. According to psychological theory, what is the most likely reason Benny finds this alluring?",
      "subject": "human_sexuality",
      "choices": [
        "As a child be became sexually aroused pretending to be a powerful executive, so he now becomes aroused at work and must discharge this when he gets home.",
        "He is overcome with feelings of self doubt and his sadomasochistic behaviour allows him a safe outlet for that self doubt.",
        "He is overwhelmed with pressures and responsibilities at work, and the masochistic behaviour allows him to escape from being an autonomous, separate individual.",
        "He is secretly fascinated by violence and engaging in sadomasochistic behaviour is a relatively safe outlet for it."
      ],
      "answer": 2
    },
    "target": "(C)",
    "arguments": [
      [
        "The following are multiple choice questions (with answers) about human sexuality.\n\nQ: Morning sickness is typically a problem:\n(A) during the first trimester (B) during the second trimester (C) during the third trimester (D) all through the pregnancy\nA:  (A)\n\nQ: A woman who knows she has active herpes and untreated syphilis but continues to have sex without informing her partners of her condition has, in psychoanalytic terms:\n(A) a strong ego (B) a weak superego (C) a weak id (D) a strong superego\nA:  (B)\n\nQ: Women's ability to have multiple orgasms is primarily due to:\n(A) the fact that they do not have a refractory period. (B) the response of the inner layers of the vagina. (C) having alternating orgasms in different locations. (D) the G-Spot.\nA:  (A)\n\nQ: The nature of homosexual activities that occur during preadolescence include all but which of the following?\n(A) sexual intercourse (B) circle jerks (C) exhibitionism (D) touching each other's genitals\nA:  (A)\n\nQ: The most common disorder among men who seek sexual therapy is:\n(A) premature ejaculation (B) inhibited ejaculation (C) erectile disorder (D) ejaculatory disorder\nA:  (C)\n\nQ: Benny is the head of a successful corporation. After a hard day at work during which he is under incredible pressure to perform well, he goes home to his wife who proceeds to spank him, tie him to their four poster bed, and tease him until he begs for intercourse. According to psychological theory, what is the most likely reason Benny finds this alluring?\n(A) As a child be became sexually aroused pretending to be a powerful executive, so he now becomes aroused at work and must discharge this when he gets home. (B) He is overcome with feelings of self doubt and his sadomasochistic behaviour allows him a safe outlet for that self doubt. (C) He is overwhelmed with pressures and responsibilities at work, and the masochistic behaviour allows him to escape from being an autonomous, separate individual. (D) He is secretly fascinated by violence and engaging in sadomasochistic behaviour is a relatively safe outlet for it.\nA: ",
        {
          "until": [
            "</s>"
          ]
        }
      ]
    ],
    "resps": [
      [
        "(C)"
      ]
    ],
    "filtered_resps": [
      "(C)"
    ],
    "exact_match": 1.0
  },
  {
    "doc_id": 104,
    "doc": {
      "question": "How do girls most frequently learn about masturbation?",
      "subject": "human_sexuality",
      "choices": [
        "through reading about it",
        "being told by peers",
        "self-discovery",
        "observing others doing it."
      ],
      "answer": 2
    },
    "target": "(C)",
    "arguments": [
      [
        "The following are multiple choice questions (with answers) about human sexuality.\n\nQ: Morning sickness is typically a problem:\n(A) during the first trimester (B) during the second trimester (C) during the third trimester (D) all through the pregnancy\nA:  (A)\n\nQ: The nature of homosexual activities that occur during preadolescence include all but which of the following?\n(A) sexual intercourse (B) circle jerks (C) exhibitionism (D) touching each other's genitals\nA:  (A)\n\nQ: A woman who knows she has active herpes and untreated syphilis but continues to have sex without informing her partners of her condition has, in psychoanalytic terms:\n(A) a strong ego (B) a weak superego (C) a weak id (D) a strong superego\nA:  (B)\n\nQ: The most common disorder among men who seek sexual therapy is:\n(A) premature ejaculation (B) inhibited ejaculation (C) erectile disorder (D) ejaculatory disorder\nA:  (C)\n\nQ: Women's ability to have multiple orgasms is primarily due to:\n(A) the fact that they do not have a refractory period. (B) the response of the inner layers of the vagina. (C) having alternating orgasms in different locations. (D) the G-Spot.\nA:  (A)\n\nQ: How do girls most frequently learn about masturbation?\n(A) through reading about it (B) being told by peers (C) self-discovery (D) observing others doing it.\nA: ",
        {
          "until": [
            "</s>"
          ]
        }
      ]
    ],
    "resps": [
      [
        "(A)"
      ]
    ],
    "filtered_resps": [
      "(A)"
    ],
    "exact_match": 0.0
  },
  {
    "doc_id": 112,
    "doc": {
      "question": "Menstruation is triggered by...",
      "subject": "human_sexuality",
      "choices": [
        "...a sharp increase in estrogen levels",
        "...a sharp increase in progesterone levels",
        "...a sharp decrease in estrogen and progesterone levels",
        "...a sharp increase in estrogen and progesterone levels"
      ],
      "answer": 2
    },
    "target": "(C)",
    "arguments": [
      [
        "The following are multiple choice questions (with answers) about human sexuality.\n\nQ: Women's ability to have multiple orgasms is primarily due to:\n(A) the fact that they do not have a refractory period. (B) the response of the inner layers of the vagina. (C) having alternating orgasms in different locations. (D) the G-Spot.\nA:  (A)\n\nQ: A woman who knows she has active herpes and untreated syphilis but continues to have sex without informing her partners of her condition has, in psychoanalytic terms:\n(A) a strong ego (B) a weak superego (C) a weak id (D) a strong superego\nA:  (B)\n\nQ: The nature of homosexual activities that occur during preadolescence include all but which of the following?\n(A) sexual intercourse (B) circle jerks (C) exhibitionism (D) touching each other's genitals\nA:  (A)\n\nQ: Morning sickness is typically a problem:\n(A) during the first trimester (B) during the second trimester (C) during the third trimester (D) all through the pregnancy\nA:  (A)\n\nQ: The most common disorder among men who seek sexual therapy is:\n(A) premature ejaculation (B) inhibited ejaculation (C) erectile disorder (D) ejaculatory disorder\nA:  (C)\n\nQ: Menstruation is triggered by...\n(A) ...a sharp increase in estrogen levels (B) ...a sharp increase in progesterone levels (C) ...a sharp decrease in estrogen and progesterone levels (D) ...a sharp increase in estrogen and progesterone levels\nA: ",
        {
          "until": [
            "</s>"
          ]
        }
      ]
    ],
    "resps": [
      [
        "(D)"
      ]
    ],
    "filtered_resps": [
      "(D)"
    ],
    "exact_match": 0.0
  },
  {
    "doc_id": 120,
    "doc": {
      "question": "By 28 days after conception, the embryo is about __________ centimetres long.",
      "subject": "human_sexuality",
      "choices": [
        "1",
        "2",
        "3",
        "4"
      ],
      "answer": 0
    },
    "target": "(A)",
    "arguments": [
      [
        "The following are multiple choice questions (with answers) about human sexuality.\n\nQ: Morning sickness is typically a problem:\n(A) during the first trimester (B) during the second trimester (C) during the third trimester (D) all through the pregnancy\nA:  (A)\n\nQ: The nature of homosexual activities that occur during preadolescence include all but which of the following?\n(A) sexual intercourse (B) circle jerks (C) exhibitionism (D) touching each other's genitals\nA:  (A)\n\nQ: A woman who knows she has active herpes and untreated syphilis but continues to have sex without informing her partners of her condition has, in psychoanalytic terms:\n(A) a strong ego (B) a weak superego (C) a weak id (D) a strong superego\nA:  (B)\n\nQ: Women's ability to have multiple orgasms is primarily due to:\n(A) the fact that they do not have a refractory period. (B) the response of the inner layers of the vagina. (C) having alternating orgasms in different locations. (D) the G-Spot.\nA:  (A)\n\nQ: The most common disorder among men who seek sexual therapy is:\n(A) premature ejaculation (B) inhibited ejaculation (C) erectile disorder (D) ejaculatory disorder\nA:  (C)\n\nQ: By 28 days after conception, the embryo is about __________ centimetres long.\n(A) 1 (B) 2 (C) 3 (D) 4\nA: ",
        {
          "until": [
            "</s>"
          ]
        }
      ]
    ],
    "resps": [
      [
        "(D)"
      ]
    ],
    "filtered_resps": [
      "(D)"
    ],
    "exact_match": 0.0
  },
  {
    "doc_id": 128,
    "doc": {
      "question": "Miss Jones has been concerned about her health lately. She has noticed some itching and skin irritation around her genitals. Given her promiscuous sexual history she suspects that she has contracted:",
      "subject": "human_sexuality",
      "choices": [
        "chlamydia",
        "genital warts",
        "gonorrhea",
        "pubic lice"
      ],
      "answer": 3
    },
    "target": "(D)",
    "arguments": [
      [
        "The following are multiple choice questions (with answers) about human sexuality.\n\nQ: The most common disorder among men who seek sexual therapy is:\n(A) premature ejaculation (B) inhibited ejaculation (C) erectile disorder (D) ejaculatory disorder\nA:  (C)\n\nQ: The nature of homosexual activities that occur during preadolescence include all but which of the following?\n(A) sexual intercourse (B) circle jerks (C) exhibitionism (D) touching each other's genitals\nA:  (A)\n\nQ: A woman who knows she has active herpes and untreated syphilis but continues to have sex without informing her partners of her condition has, in psychoanalytic terms:\n(A) a strong ego (B) a weak superego (C) a weak id (D) a strong superego\nA:  (B)\n\nQ: Morning sickness is typically a problem:\n(A) during the first trimester (B) during the second trimester (C) during the third trimester (D) all through the pregnancy\nA:  (A)\n\nQ: Women's ability to have multiple orgasms is primarily due to:\n(A) the fact that they do not have a refractory period. (B) the response of the inner layers of the vagina. (C) having alternating orgasms in different locations. (D) the G-Spot.\nA:  (A)\n\nQ: Miss Jones has been concerned about her health lately. She has noticed some itching and skin irritation around her genitals. Given her promiscuous sexual history she suspects that she has contracted:\n(A) chlamydia (B) genital warts (C) gonorrhea (D) pubic lice\nA: ",
        {
          "until": [
            "</s>"
          ]
        }
      ]
    ],
    "resps": [
      [
        "(B)"
      ]
    ],
    "filtered_resps": [
      "(B)"
    ],
    "exact_match": 0.0
  },
  {
    "doc_id": 1,
    "doc": {
      "question": "The regions of the body that, when touched, are sexually exciting:",
      "subject": "human_sexuality",
      "choices": [
        "vary from person to person",
        "vary for women depending on the phases of the menstrual cycle",
        "are mainly on the lower portion of the body",
        "all of the above"
      ],
      "answer": 3
    },
    "target": "(D)",
    "arguments": [
      [
        "The following are multiple choice questions (with answers) about human sexuality.\n\nQ: The nature of homosexual activities that occur during preadolescence include all but which of the following?\n(A) sexual intercourse (B) circle jerks (C) exhibitionism (D) touching each other's genitals\nA:  (A)\n\nQ: Morning sickness is typically a problem:\n(A) during the first trimester (B) during the second trimester (C) during the third trimester (D) all through the pregnancy\nA:  (A)\n\nQ: The most common disorder among men who seek sexual therapy is:\n(A) premature ejaculation (B) inhibited ejaculation (C) erectile disorder (D) ejaculatory disorder\nA:  (C)\n\nQ: Women's ability to have multiple orgasms is primarily due to:\n(A) the fact that they do not have a refractory period. (B) the response of the inner layers of the vagina. (C) having alternating orgasms in different locations. (D) the G-Spot.\nA:  (A)\n\nQ: A woman who knows she has active herpes and untreated syphilis but continues to have sex without informing her partners of her condition has, in psychoanalytic terms:\n(A) a strong ego (B) a weak superego (C) a weak id (D) a strong superego\nA:  (B)\n\nQ: The regions of the body that, when touched, are sexually exciting:\n(A) vary from person to person (B) vary for women depending on the phases of the menstrual cycle (C) are mainly on the lower portion of the body (D) all of the above\nA: ",
        {
          "until": [
            "</s>"
          ]
        }
      ]
    ],
    "resps": [
      [
        "(D)"
      ]
    ],
    "filtered_resps": [
      "(D)"
    ],
    "exact_match": 1.0
  },
  {
    "doc_id": 9,
    "doc": {
      "question": "Judaism regards sexuality as",
      "subject": "human_sexuality",
      "choices": [
        "inherently evil",
        "God's afterthought and has become an aberration",
        "a gift from God",
        "primarily a biological function"
      ],
      "answer": 2
    },
    "target": "(C)",
    "arguments": [
      [
        "The following are multiple choice questions (with answers) about human sexuality.\n\nQ: Morning sickness is typically a problem:\n(A) during the first trimester (B) during the second trimester (C) during the third trimester (D) all through the pregnancy\nA:  (A)\n\nQ: The most common disorder among men who seek sexual therapy is:\n(A) premature ejaculation (B) inhibited ejaculation (C) erectile disorder (D) ejaculatory disorder\nA:  (C)\n\nQ: A woman who knows she has active herpes and untreated syphilis but continues to have sex without informing her partners of her condition has, in psychoanalytic terms:\n(A) a strong ego (B) a weak superego (C) a weak id (D) a strong superego\nA:  (B)\n\nQ: The nature of homosexual activities that occur during preadolescence include all but which of the following?\n(A) sexual intercourse (B) circle jerks (C) exhibitionism (D) touching each other's genitals\nA:  (A)\n\nQ: Women's ability to have multiple orgasms is primarily due to:\n(A) the fact that they do not have a refractory period. (B) the response of the inner layers of the vagina. (C) having alternating orgasms in different locations. (D) the G-Spot.\nA:  (A)\n\nQ: Judaism regards sexuality as\n(A) inherently evil (B) God's afterthought and has become an aberration (C) a gift from God (D) primarily a biological function\nA: ",
        {
          "until": [
            "</s>"
          ]
        }
      ]
    ],
    "resps": [
      [
        "(A)"
      ]
    ],
    "filtered_resps": [
      "(A)"
    ],
    "exact_match": 0.0
  },
  {
    "doc_id": 17,
    "doc": {
      "question": "________ men, on the average, begin engaging in sexual intercourse approximately two years later than ________ men do.",
      "subject": "human_sexuality",
      "choices": [
        "Mexican Americans and whites; African Americans",
        "Mexican Americans; African Americans and whites",
        "African Americans; whites and Latinos",
        "Whites; African Americans and Latinos"
      ],
      "answer": 0
    },
    "target": "(A)",
    "arguments": [
      [
        "The following are multiple choice questions (with answers) about human sexuality.\n\nQ: Morning sickness is typically a problem:\n(A) during the first trimester (B) during the second trimester (C) during the third trimester (D) all through the pregnancy\nA:  (A)\n\nQ: The most common disorder among men who seek sexual therapy is:\n(A) premature ejaculation (B) inhibited ejaculation (C) erectile disorder (D) ejaculatory disorder\nA:  (C)\n\nQ: A woman who knows she has active herpes and untreated syphilis but continues to have sex without informing her partners of her condition has, in psychoanalytic terms:\n(A) a strong ego (B) a weak superego (C) a weak id (D) a strong superego\nA:  (B)\n\nQ: Women's ability to have multiple orgasms is primarily due to:\n(A) the fact that they do not have a refractory period. (B) the response of the inner layers of the vagina. (C) having alternating orgasms in different locations. (D) the G-Spot.\nA:  (A)\n\nQ: The nature of homosexual activities that occur during preadolescence include all but which of the following?\n(A) sexual intercourse (B) circle jerks (C) exhibitionism (D) touching each other's genitals\nA:  (A)\n\nQ: ________ men, on the average, begin engaging in sexual intercourse approximately two years later than ________ men do.\n(A) Mexican Americans and whites; African Americans (B) Mexican Americans; African Americans and whites (C) African Americans; whites and Latinos (D) Whites; African Americans and Latinos\nA: ",
        {
          "until": [
            "</s>"
          ]
        }
      ]
    ],
    "resps": [
      [
        "(D)"
      ]
    ],
    "filtered_resps": [
      "(D)"
    ],
    "exact_match": 0.0
  },
  {
    "doc_id": 25,
    "doc": {
      "question": "The egg can be fertilized until about _______ after ovulation.",
      "subject": "human_sexuality",
      "choices": [
        "6 hours",
        "24 hours",
        "72 hours",
        "1 week"
      ],
      "answer": 1
    },
    "target": "(B)",
    "arguments": [
      [
        "The following are multiple choice questions (with answers) about human sexuality.\n\nQ: A woman who knows she has active herpes and untreated syphilis but continues to have sex without informing her partners of her condition has, in psychoanalytic terms:\n(A) a strong ego (B) a weak superego (C) a weak id (D) a strong superego\nA:  (B)\n\nQ: Morning sickness is typically a problem:\n(A) during the first trimester (B) during the second trimester (C) during the third trimester (D) all through the pregnancy\nA:  (A)\n\nQ: The nature of homosexual activities that occur during preadolescence include all but which of the following?\n(A) sexual intercourse (B) circle jerks (C) exhibitionism (D) touching each other's genitals\nA:  (A)\n\nQ: Women's ability to have multiple orgasms is primarily due to:\n(A) the fact that they do not have a refractory period. (B) the response of the inner layers of the vagina. (C) having alternating orgasms in different locations. (D) the G-Spot.\nA:  (A)\n\nQ: The most common disorder among men who seek sexual therapy is:\n(A) premature ejaculation (B) inhibited ejaculation (C) erectile disorder (D) ejaculatory disorder\nA:  (C)\n\nQ: The egg can be fertilized until about _______ after ovulation.\n(A) 6 hours (B) 24 hours (C) 72 hours (D) 1 week\nA: ",
        {
          "until": [
            "</s>"
          ]
        }
      ]
    ],
    "resps": [
      [
        "(B)"
      ]
    ],
    "filtered_resps": [
      "(B)"
    ],
    "exact_match": 1.0
  },
  {
    "doc_id": 33,
    "doc": {
      "question": "Which of the following teenagers have the highest pregnancy rates?",
      "subject": "human_sexuality",
      "choices": [
        "U.S.",
        "Canadian",
        "Swedish",
        "French"
      ],
      "answer": 0
    },
    "target": "(A)",
    "arguments": [
      [
        "The following are multiple choice questions (with answers) about human sexuality.\n\nQ: The most common disorder among men who seek sexual therapy is:\n(A) premature ejaculation (B) inhibited ejaculation (C) erectile disorder (D) ejaculatory disorder\nA:  (C)\n\nQ: The nature of homosexual activities that occur during preadolescence include all but which of the following?\n(A) sexual intercourse (B) circle jerks (C) exhibitionism (D) touching each other's genitals\nA:  (A)\n\nQ: Morning sickness is typically a problem:\n(A) during the first trimester (B) during the second trimester (C) during the third trimester (D) all through the pregnancy\nA:  (A)\n\nQ: Women's ability to have multiple orgasms is primarily due to:\n(A) the fact that they do not have a refractory period. (B) the response of the inner layers of the vagina. (C) having alternating orgasms in different locations. (D) the G-Spot.\nA:  (A)\n\nQ: A woman who knows she has active herpes and untreated syphilis but continues to have sex without informing her partners of her condition has, in psychoanalytic terms:\n(A) a strong ego (B) a weak superego (C) a weak id (D) a strong superego\nA:  (B)\n\nQ: Which of the following teenagers have the highest pregnancy rates?\n(A) U.S. (B) Canadian (C) Swedish (D) French\nA: ",
        {
          "until": [
            "</s>"
          ]
        }
      ]
    ],
    "resps": [
      [
        "(B)"
      ]
    ],
    "filtered_resps": [
      "(B)"
    ],
    "exact_match": 0.0
  },
  {
    "doc_id": 41,
    "doc": {
      "question": "What day of a typical 28-day menstrual cycle is a woman likely to ovulate?",
      "subject": "human_sexuality",
      "choices": [
        "4",
        "10",
        "14",
        "22"
      ],
      "answer": 2
    },
    "target": "(C)",
    "arguments": [
      [
        "The following are multiple choice questions (with answers) about human sexuality.\n\nQ: Morning sickness is typically a problem:\n(A) during the first trimester (B) during the second trimester (C) during the third trimester (D) all through the pregnancy\nA:  (A)\n\nQ: The most common disorder among men who seek sexual therapy is:\n(A) premature ejaculation (B) inhibited ejaculation (C) erectile disorder (D) ejaculatory disorder\nA:  (C)\n\nQ: Women's ability to have multiple orgasms is primarily due to:\n(A) the fact that they do not have a refractory period. (B) the response of the inner layers of the vagina. (C) having alternating orgasms in different locations. (D) the G-Spot.\nA:  (A)\n\nQ: The nature of homosexual activities that occur during preadolescence include all but which of the following?\n(A) sexual intercourse (B) circle jerks (C) exhibitionism (D) touching each other's genitals\nA:  (A)\n\nQ: A woman who knows she has active herpes and untreated syphilis but continues to have sex without informing her partners of her condition has, in psychoanalytic terms:\n(A) a strong ego (B) a weak superego (C) a weak id (D) a strong superego\nA:  (B)\n\nQ: What day of a typical 28-day menstrual cycle is a woman likely to ovulate?\n(A) 4 (B) 10 (C) 14 (D) 22\nA: ",
        {
          "until": [
            "</s>"
          ]
        }
      ]
    ],
    "resps": [
      [
        "(B)"
      ]
    ],
    "filtered_resps": [
      "(B)"
    ],
    "exact_match": 0.0
  },
  {
    "doc_id": 49,
    "doc": {
      "question": "Which of the following is the most common method of birth control for married couples in the U.S..",
      "subject": "human_sexuality",
      "choices": [
        "Sterilization",
        "The IUD",
        "The diaphragm",
        "The rhythm method"
      ],
      "answer": 0
    },
    "target": "(A)",
    "arguments": [
      [
        "The following are multiple choice questions (with answers) about human sexuality.\n\nQ: The most common disorder among men who seek sexual therapy is:\n(A) premature ejaculation (B) inhibited ejaculation (C) erectile disorder (D) ejaculatory disorder\nA:  (C)\n\nQ: Morning sickness is typically a problem:\n(A) during the first trimester (B) during the second trimester (C) during the third trimester (D) all through the pregnancy\nA:  (A)\n\nQ: Women's ability to have multiple orgasms is primarily due to:\n(A) the fact that they do not have a refractory period. (B) the response of the inner layers of the vagina. (C) having alternating orgasms in different locations. (D) the G-Spot.\nA:  (A)\n\nQ: A woman who knows she has active herpes and untreated syphilis but continues to have sex without informing her partners of her condition has, in psychoanalytic terms:\n(A) a strong ego (B) a weak superego (C) a weak id (D) a strong superego\nA:  (B)\n\nQ: The nature of homosexual activities that occur during preadolescence include all but which of the following?\n(A) sexual intercourse (B) circle jerks (C) exhibitionism (D) touching each other's genitals\nA:  (A)\n\nQ: Which of the following is the most common method of birth control for married couples in the U.S..\n(A) Sterilization (B) The IUD (C) The diaphragm (D) The rhythm method\nA: ",
        {
          "until": [
            "</s>"
          ]
        }
      ]
    ],
    "resps": [
      [
        "(B)"
      ]
    ],
    "filtered_resps": [
      "(B)"
    ],
    "exact_match": 0.0
  },
  {
    "doc_id": 57,
    "doc": {
      "question": "An anatomical difference between males and females is:",
      "subject": "human_sexuality",
      "choices": [
        "males have one exit structure for urine and reproductive fluids, whereas females have two",
        "males have an external sexual organ that gets engorged with blood, whereas females do not",
        "males have many times the number of nerve endings in the penis that females have in the clitoris.",
        "all of the above"
      ],
      "answer": 0
    },
    "target": "(A)",
    "arguments": [
      [
        "The following are multiple choice questions (with answers) about human sexuality.\n\nQ: Women's ability to have multiple orgasms is primarily due to:\n(A) the fact that they do not have a refractory period. (B) the response of the inner layers of the vagina. (C) having alternating orgasms in different locations. (D) the G-Spot.\nA:  (A)\n\nQ: The most common disorder among men who seek sexual therapy is:\n(A) premature ejaculation (B) inhibited ejaculation (C) erectile disorder (D) ejaculatory disorder\nA:  (C)\n\nQ: Morning sickness is typically a problem:\n(A) during the first trimester (B) during the second trimester (C) during the third trimester (D) all through the pregnancy\nA:  (A)\n\nQ: The nature of homosexual activities that occur during preadolescence include all but which of the following?\n(A) sexual intercourse (B) circle jerks (C) exhibitionism (D) touching each other's genitals\nA:  (A)\n\nQ: A woman who knows she has active herpes and untreated syphilis but continues to have sex without informing her partners of her condition has, in psychoanalytic terms:\n(A) a strong ego (B) a weak superego (C) a weak id (D) a strong superego\nA:  (B)\n\nQ: An anatomical difference between males and females is:\n(A) males have one exit structure for urine and reproductive fluids, whereas females have two (B) males have an external sexual organ that gets engorged with blood, whereas females do not (C) males have many times the number of nerve endings in the penis that females have in the clitoris. (D) all of the above\nA: ",
        {
          "until": [
            "</s>"
          ]
        }
      ]
    ],
    "resps": [
      [
        "(D)"
      ]
    ],
    "filtered_resps": [
      "(D)"
    ],
    "exact_match": 0.0
  },
  {
    "doc_id": 65,
    "doc": {
      "question": "__________ is a shedding of the inner lining of the uterus.",
      "subject": "human_sexuality",
      "choices": [
        "Menstruation",
        "Ovulation",
        "The luteal phase",
        "The follicular phase"
      ],
      "answer": 0
    },
    "target": "(A)",
    "arguments": [
      [
        "The following are multiple choice questions (with answers) about human sexuality.\n\nQ: The most common disorder among men who seek sexual therapy is:\n(A) premature ejaculation (B) inhibited ejaculation (C) erectile disorder (D) ejaculatory disorder\nA:  (C)\n\nQ: Morning sickness is typically a problem:\n(A) during the first trimester (B) during the second trimester (C) during the third trimester (D) all through the pregnancy\nA:  (A)\n\nQ: Women's ability to have multiple orgasms is primarily due to:\n(A) the fact that they do not have a refractory period. (B) the response of the inner layers of the vagina. (C) having alternating orgasms in different locations. (D) the G-Spot.\nA:  (A)\n\nQ: The nature of homosexual activities that occur during preadolescence include all but which of the following?\n(A) sexual intercourse (B) circle jerks (C) exhibitionism (D) touching each other's genitals\nA:  (A)\n\nQ: A woman who knows she has active herpes and untreated syphilis but continues to have sex without informing her partners of her condition has, in psychoanalytic terms:\n(A) a strong ego (B) a weak superego (C) a weak id (D) a strong superego\nA:  (B)\n\nQ: __________ is a shedding of the inner lining of the uterus.\n(A) Menstruation (B) Ovulation (C) The luteal phase (D) The follicular phase\nA: ",
        {
          "until": [
            "</s>"
          ]
        }
      ]
    ],
    "resps": [
      [
        "(D)"
      ]
    ],
    "filtered_resps": [
      "(D)"
    ],
    "exact_match": 0.0
  },
  {
    "doc_id": 73,
    "doc": {
      "question": "Which of the following is/are secondary sex characteristics in males AND females?",
      "subject": "human_sexuality",
      "choices": [
        "underarm hair",
        "sweat and oil glands",
        "deepening of the voice",
        "both A and B"
      ],
      "answer": 3
    },
    "target": "(D)",
    "arguments": [
      [
        "The following are multiple choice questions (with answers) about human sexuality.\n\nQ: Women's ability to have multiple orgasms is primarily due to:\n(A) the fact that they do not have a refractory period. (B) the response of the inner layers of the vagina. (C) having alternating orgasms in different locations. (D) the G-Spot.\nA:  (A)\n\nQ: A woman who knows she has active herpes and untreated syphilis but continues to have sex without informing her partners of her condition has, in psychoanalytic terms:\n(A) a strong ego (B) a weak superego (C) a weak id (D) a strong superego\nA:  (B)\n\nQ: The most common disorder among men who seek sexual therapy is:\n(A) premature ejaculation (B) inhibited ejaculation (C) erectile disorder (D) ejaculatory disorder\nA:  (C)\n\nQ: The nature of homosexual activities that occur during preadolescence include all but which of the following?\n(A) sexual intercourse (B) circle jerks (C) exhibitionism (D) touching each other's genitals\nA:  (A)\n\nQ: Morning sickness is typically a problem:\n(A) during the first trimester (B) during the second trimester (C) during the third trimester (D) all through the pregnancy\nA:  (A)\n\nQ: Which of the following is/are secondary sex characteristics in males AND females?\n(A) underarm hair (B) sweat and oil glands (C) deepening of the voice (D) both A and B\nA: ",
        {
          "until": [
            "</s>"
          ]
        }
      ]
    ],
    "resps": [
      [
        "(D)"
      ]
    ],
    "filtered_resps": [
      "(D)"
    ],
    "exact_match": 1.0
  },
  {
    "doc_id": 81,
    "doc": {
      "question": "Which of the following sexual variations is probably the most dangerous?",
      "subject": "human_sexuality",
      "choices": [
        "troilism",
        "asphyxiophilia",
        "zoophilia",
        "necrophilia"
      ],
      "answer": 1
    },
    "target": "(B)",
    "arguments": [
      [
        "The following are multiple choice questions (with answers) about human sexuality.\n\nQ: A woman who knows she has active herpes and untreated syphilis but continues to have sex without informing her partners of her condition has, in psychoanalytic terms:\n(A) a strong ego (B) a weak superego (C) a weak id (D) a strong superego\nA:  (B)\n\nQ: Morning sickness is typically a problem:\n(A) during the first trimester (B) during the second trimester (C) during the third trimester (D) all through the pregnancy\nA:  (A)\n\nQ: The nature of homosexual activities that occur during preadolescence include all but which of the following?\n(A) sexual intercourse (B) circle jerks (C) exhibitionism (D) touching each other's genitals\nA:  (A)\n\nQ: The most common disorder among men who seek sexual therapy is:\n(A) premature ejaculation (B) inhibited ejaculation (C) erectile disorder (D) ejaculatory disorder\nA:  (C)\n\nQ: Women's ability to have multiple orgasms is primarily due to:\n(A) the fact that they do not have a refractory period. (B) the response of the inner layers of the vagina. (C) having alternating orgasms in different locations. (D) the G-Spot.\nA:  (A)\n\nQ: Which of the following sexual variations is probably the most dangerous?\n(A) troilism (B) asphyxiophilia (C) zoophilia (D) necrophilia\nA: ",
        {
          "until": [
            "</s>"
          ]
        }
      ]
    ],
    "resps": [
      [
        "(D)"
      ]
    ],
    "filtered_resps": [
      "(D)"
    ],
    "exact_match": 0.0
  },
  {
    "doc_id": 89,
    "doc": {
      "question": "Approximately how many sperm are in the typical ejaculate?",
      "subject": "human_sexuality",
      "choices": [
        "300,000",
        "300 million",
        "3 million",
        "30 million"
      ],
      "answer": 1
    },
    "target": "(B)",
    "arguments": [
      [
        "The following are multiple choice questions (with answers) about human sexuality.\n\nQ: Morning sickness is typically a problem:\n(A) during the first trimester (B) during the second trimester (C) during the third trimester (D) all through the pregnancy\nA:  (A)\n\nQ: A woman who knows she has active herpes and untreated syphilis but continues to have sex without informing her partners of her condition has, in psychoanalytic terms:\n(A) a strong ego (B) a weak superego (C) a weak id (D) a strong superego\nA:  (B)\n\nQ: The most common disorder among men who seek sexual therapy is:\n(A) premature ejaculation (B) inhibited ejaculation (C) erectile disorder (D) ejaculatory disorder\nA:  (C)\n\nQ: Women's ability to have multiple orgasms is primarily due to:\n(A) the fact that they do not have a refractory period. (B) the response of the inner layers of the vagina. (C) having alternating orgasms in different locations. (D) the G-Spot.\nA:  (A)\n\nQ: The nature of homosexual activities that occur during preadolescence include all but which of the following?\n(A) sexual intercourse (B) circle jerks (C) exhibitionism (D) touching each other's genitals\nA:  (A)\n\nQ: Approximately how many sperm are in the typical ejaculate?\n(A) 300,000 (B) 300 million (C) 3 million (D) 30 million\nA: ",
        {
          "until": [
            "</s>"
          ]
        }
      ]
    ],
    "resps": [
      [
        "(D)"
      ]
    ],
    "filtered_resps": [
      "(D)"
    ],
    "exact_match": 0.0
  },
  {
    "doc_id": 97,
    "doc": {
      "question": "Darla and Janice are two moms raising a son Timmy. Which of the following most likely characterizes Timmy?",
      "subject": "human_sexuality",
      "choices": [
        "He will probably grow up to be gay.",
        "He will not be popular with his peers.",
        "As long as Timmy has at least one supportive and accepting caregiver he will have a healthy development.",
        "His social skills will lag behind his peers who are raised in heterosexual families."
      ],
      "answer": 2
    },
    "target": "(C)",
    "arguments": [
      [
        "The following are multiple choice questions (with answers) about human sexuality.\n\nQ: Morning sickness is typically a problem:\n(A) during the first trimester (B) during the second trimester (C) during the third trimester (D) all through the pregnancy\nA:  (A)\n\nQ: A woman who knows she has active herpes and untreated syphilis but continues to have sex without informing her partners of her condition has, in psychoanalytic terms:\n(A) a strong ego (B) a weak superego (C) a weak id (D) a strong superego\nA:  (B)\n\nQ: Women's ability to have multiple orgasms is primarily due to:\n(A) the fact that they do not have a refractory period. (B) the response of the inner layers of the vagina. (C) having alternating orgasms in different locations. (D) the G-Spot.\nA:  (A)\n\nQ: The nature of homosexual activities that occur during preadolescence include all but which of the following?\n(A) sexual intercourse (B) circle jerks (C) exhibitionism (D) touching each other's genitals\nA:  (A)\n\nQ: The most common disorder among men who seek sexual therapy is:\n(A) premature ejaculation (B) inhibited ejaculation (C) erectile disorder (D) ejaculatory disorder\nA:  (C)\n\nQ: Darla and Janice are two moms raising a son Timmy. Which of the following most likely characterizes Timmy?\n(A) He will probably grow up to be gay. (B) He will not be popular with his peers. (C) As long as Timmy has at least one supportive and accepting caregiver he will have a healthy development. (D) His social skills will lag behind his peers who are raised in heterosexual families.\nA: ",
        {
          "until": [
            "</s>"
          ]
        }
      ]
    ],
    "resps": [
      [
        "(A)"
      ]
    ],
    "filtered_resps": [
      "(A)"
    ],
    "exact_match": 0.0
  },
  {
    "doc_id": 105,
    "doc": {
      "question": "How many centimetres must the cervix dilute to before a baby can be born?",
      "subject": "human_sexuality",
      "choices": [
        "5",
        "10",
        "15",
        "20"
      ],
      "answer": 1
    },
    "target": "(B)",
    "arguments": [
      [
        "The following are multiple choice questions (with answers) about human sexuality.\n\nQ: Morning sickness is typically a problem:\n(A) during the first trimester (B) during the second trimester (C) during the third trimester (D) all through the pregnancy\nA:  (A)\n\nQ: The nature of homosexual activities that occur during preadolescence include all but which of the following?\n(A) sexual intercourse (B) circle jerks (C) exhibitionism (D) touching each other's genitals\nA:  (A)\n\nQ: A woman who knows she has active herpes and untreated syphilis but continues to have sex without informing her partners of her condition has, in psychoanalytic terms:\n(A) a strong ego (B) a weak superego (C) a weak id (D) a strong superego\nA:  (B)\n\nQ: The most common disorder among men who seek sexual therapy is:\n(A) premature ejaculation (B) inhibited ejaculation (C) erectile disorder (D) ejaculatory disorder\nA:  (C)\n\nQ: Women's ability to have multiple orgasms is primarily due to:\n(A) the fact that they do not have a refractory period. (B) the response of the inner layers of the vagina. (C) having alternating orgasms in different locations. (D) the G-Spot.\nA:  (A)\n\nQ: How many centimetres must the cervix dilute to before a baby can be born?\n(A) 5 (B) 10 (C) 15 (D) 20\nA: ",
        {
          "until": [
            "</s>"
          ]
        }
      ]
    ],
    "resps": [
      [
        "(D)"
      ]
    ],
    "filtered_resps": [
      "(D)"
    ],
    "exact_match": 0.0
  },
  {
    "doc_id": 113,
    "doc": {
      "question": "Which of the following concerning self-disclosure in relationships is supported by research?",
      "subject": "human_sexuality",
      "choices": [
        "when one partner in a relationship self-discloses, the other is unlikely to do so",
        "self-disclosure on the part of one partner often leads to self-disclosure on the part of the other",
        "there is a negative correlation between amount of self-disclosure and relationship satisfaction",
        "there is no relationship between amount of self-disclosure and relationship satisfaction"
      ],
      "answer": 1
    },
    "target": "(B)",
    "arguments": [
      [
        "The following are multiple choice questions (with answers) about human sexuality.\n\nQ: Women's ability to have multiple orgasms is primarily due to:\n(A) the fact that they do not have a refractory period. (B) the response of the inner layers of the vagina. (C) having alternating orgasms in different locations. (D) the G-Spot.\nA:  (A)\n\nQ: A woman who knows she has active herpes and untreated syphilis but continues to have sex without informing her partners of her condition has, in psychoanalytic terms:\n(A) a strong ego (B) a weak superego (C) a weak id (D) a strong superego\nA:  (B)\n\nQ: The nature of homosexual activities that occur during preadolescence include all but which of the following?\n(A) sexual intercourse (B) circle jerks (C) exhibitionism (D) touching each other's genitals\nA:  (A)\n\nQ: Morning sickness is typically a problem:\n(A) during the first trimester (B) during the second trimester (C) during the third trimester (D) all through the pregnancy\nA:  (A)\n\nQ: The most common disorder among men who seek sexual therapy is:\n(A) premature ejaculation (B) inhibited ejaculation (C) erectile disorder (D) ejaculatory disorder\nA:  (C)\n\nQ: Which of the following concerning self-disclosure in relationships is supported by research?\n(A) when one partner in a relationship self-discloses, the other is unlikely to do so (B) self-disclosure on the part of one partner often leads to self-disclosure on the part of the other (C) there is a negative correlation between amount of self-disclosure and relationship satisfaction (D) there is no relationship between amount of self-disclosure and relationship satisfaction\nA: ",
        {
          "until": [
            "</s>"
          ]
        }
      ]
    ],
    "resps": [
      [
        "(B)"
      ]
    ],
    "filtered_resps": [
      "(B)"
    ],
    "exact_match": 1.0
  },
  {
    "doc_id": 121,
    "doc": {
      "question": "\"The state has no business in the bedrooms of the nation,\" is a famous quote by this former Canadian Prime Minister.",
      "subject": "human_sexuality",
      "choices": [
        "Clark",
        "Mulroney",
        "King",
        "Trudeau"
      ],
      "answer": 3
    },
    "target": "(D)",
    "arguments": [
      [
        "The following are multiple choice questions (with answers) about human sexuality.\n\nQ: Morning sickness is typically a problem:\n(A) during the first trimester (B) during the second trimester (C) during the third trimester (D) all through the pregnancy\nA:  (A)\n\nQ: The nature of homosexual activities that occur during preadolescence include all but which of the following?\n(A) sexual intercourse (B) circle jerks (C) exhibitionism (D) touching each other's genitals\nA:  (A)\n\nQ: A woman who knows she has active herpes and untreated syphilis but continues to have sex without informing her partners of her condition has, in psychoanalytic terms:\n(A) a strong ego (B) a weak superego (C) a weak id (D) a strong superego\nA:  (B)\n\nQ: Women's ability to have multiple orgasms is primarily due to:\n(A) the fact that they do not have a refractory period. (B) the response of the inner layers of the vagina. (C) having alternating orgasms in different locations. (D) the G-Spot.\nA:  (A)\n\nQ: The most common disorder among men who seek sexual therapy is:\n(A) premature ejaculation (B) inhibited ejaculation (C) erectile disorder (D) ejaculatory disorder\nA:  (C)\n\nQ: \"The state has no business in the bedrooms of the nation,\" is a famous quote by this former Canadian Prime Minister.\n(A) Clark (B) Mulroney (C) King (D) Trudeau\nA: ",
        {
          "until": [
            "</s>"
          ]
        }
      ]
    ],
    "resps": [
      [
        "(D)"
      ]
    ],
    "filtered_resps": [
      "(D)"
    ],
    "exact_match": 1.0
  },
  {
    "doc_id": 129,
    "doc": {
      "question": "Which of the following is NOT part of the internal structure of a female's breast?",
      "subject": "human_sexuality",
      "choices": [
        "Breast lobule",
        "Lactiferous duct",
        "Lactiferous sinus",
        "Dartos Muscle"
      ],
      "answer": 3
    },
    "target": "(D)",
    "arguments": [
      [
        "The following are multiple choice questions (with answers) about human sexuality.\n\nQ: The most common disorder among men who seek sexual therapy is:\n(A) premature ejaculation (B) inhibited ejaculation (C) erectile disorder (D) ejaculatory disorder\nA:  (C)\n\nQ: The nature of homosexual activities that occur during preadolescence include all but which of the following?\n(A) sexual intercourse (B) circle jerks (C) exhibitionism (D) touching each other's genitals\nA:  (A)\n\nQ: A woman who knows she has active herpes and untreated syphilis but continues to have sex without informing her partners of her condition has, in psychoanalytic terms:\n(A) a strong ego (B) a weak superego (C) a weak id (D) a strong superego\nA:  (B)\n\nQ: Morning sickness is typically a problem:\n(A) during the first trimester (B) during the second trimester (C) during the third trimester (D) all through the pregnancy\nA:  (A)\n\nQ: Women's ability to have multiple orgasms is primarily due to:\n(A) the fact that they do not have a refractory period. (B) the response of the inner layers of the vagina. (C) having alternating orgasms in different locations. (D) the G-Spot.\nA:  (A)\n\nQ: Which of the following is NOT part of the internal structure of a female's breast?\n(A) Breast lobule (B) Lactiferous duct (C) Lactiferous sinus (D) Dartos Muscle\nA: ",
        {
          "until": [
            "</s>"
          ]
        }
      ]
    ],
    "resps": [
      [
        "(D)"
      ]
    ],
    "filtered_resps": [
      "(D)"
    ],
    "exact_match": 1.0
  },
  {
    "doc_id": 2,
    "doc": {
      "question": "Which of the following is/are true of gonorrhea?",
      "subject": "human_sexuality",
      "choices": [
        "can be treated with antibiotics",
        "has a high risk of infection with a single exposure",
        "is asymptomatic (without symptoms) in only a small percentage of those infected",
        "infections are limited to genital areas"
      ],
      "answer": 0
    },
    "target": "(A)",
    "arguments": [
      [
        "The following are multiple choice questions (with answers) about human sexuality.\n\nQ: The nature of homosexual activities that occur during preadolescence include all but which of the following?\n(A) sexual intercourse (B) circle jerks (C) exhibitionism (D) touching each other's genitals\nA:  (A)\n\nQ: Morning sickness is typically a problem:\n(A) during the first trimester (B) during the second trimester (C) during the third trimester (D) all through the pregnancy\nA:  (A)\n\nQ: The most common disorder among men who seek sexual therapy is:\n(A) premature ejaculation (B) inhibited ejaculation (C) erectile disorder (D) ejaculatory disorder\nA:  (C)\n\nQ: Women's ability to have multiple orgasms is primarily due to:\n(A) the fact that they do not have a refractory period. (B) the response of the inner layers of the vagina. (C) having alternating orgasms in different locations. (D) the G-Spot.\nA:  (A)\n\nQ: A woman who knows she has active herpes and untreated syphilis but continues to have sex without informing her partners of her condition has, in psychoanalytic terms:\n(A) a strong ego (B) a weak superego (C) a weak id (D) a strong superego\nA:  (B)\n\nQ: Which of the following is/are true of gonorrhea?\n(A) can be treated with antibiotics (B) has a high risk of infection with a single exposure (C) is asymptomatic (without symptoms) in only a small percentage of those infected (D) infections are limited to genital areas\nA: ",
        {
          "until": [
            "</s>"
          ]
        }
      ]
    ],
    "resps": [
      [
        "(B)"
      ]
    ],
    "filtered_resps": [
      "(B)"
    ],
    "exact_match": 0.0
  },
  {
    "doc_id": 10,
    "doc": {
      "question": "Freud said that the penis first becomes the major focus of pleasure-seeking at:",
      "subject": "human_sexuality",
      "choices": [
        "birth",
        "about age 1",
        "between the ages of 3 and 6",
        "puberty"
      ],
      "answer": 2
    },
    "target": "(C)",
    "arguments": [
      [
        "The following are multiple choice questions (with answers) about human sexuality.\n\nQ: Morning sickness is typically a problem:\n(A) during the first trimester (B) during the second trimester (C) during the third trimester (D) all through the pregnancy\nA:  (A)\n\nQ: The most common disorder among men who seek sexual therapy is:\n(A) premature ejaculation (B) inhibited ejaculation (C) erectile disorder (D) ejaculatory disorder\nA:  (C)\n\nQ: A woman who knows she has active herpes and untreated syphilis but continues to have sex without informing her partners of her condition has, in psychoanalytic terms:\n(A) a strong ego (B) a weak superego (C) a weak id (D) a strong superego\nA:  (B)\n\nQ: The nature of homosexual activities that occur during preadolescence include all but which of the following?\n(A) sexual intercourse (B) circle jerks (C) exhibitionism (D) touching each other's genitals\nA:  (A)\n\nQ: Women's ability to have multiple orgasms is primarily due to:\n(A) the fact that they do not have a refractory period. (B) the response of the inner layers of the vagina. (C) having alternating orgasms in different locations. (D) the G-Spot.\nA:  (A)\n\nQ: Freud said that the penis first becomes the major focus of pleasure-seeking at:\n(A) birth (B) about age 1 (C) between the ages of 3 and 6 (D) puberty\nA: ",
        {
          "until": [
            "</s>"
          ]
        }
      ]
    ],
    "resps": [
      [
        "(D)"
      ]
    ],
    "filtered_resps": [
      "(D)"
    ],
    "exact_match": 0.0
  },
  {
    "doc_id": 18,
    "doc": {
      "question": "In the scientific community, women's capacity for multiple orgasms was originally discovered by:",
      "subject": "human_sexuality",
      "choices": [
        "Kinsey",
        "Freud",
        "Masters and Johnson",
        "Kaplan"
      ],
      "answer": 0
    },
    "target": "(A)",
    "arguments": [
      [
        "The following are multiple choice questions (with answers) about human sexuality.\n\nQ: Morning sickness is typically a problem:\n(A) during the first trimester (B) during the second trimester (C) during the third trimester (D) all through the pregnancy\nA:  (A)\n\nQ: The most common disorder among men who seek sexual therapy is:\n(A) premature ejaculation (B) inhibited ejaculation (C) erectile disorder (D) ejaculatory disorder\nA:  (C)\n\nQ: A woman who knows she has active herpes and untreated syphilis but continues to have sex without informing her partners of her condition has, in psychoanalytic terms:\n(A) a strong ego (B) a weak superego (C) a weak id (D) a strong superego\nA:  (B)\n\nQ: Women's ability to have multiple orgasms is primarily due to:\n(A) the fact that they do not have a refractory period. (B) the response of the inner layers of the vagina. (C) having alternating orgasms in different locations. (D) the G-Spot.\nA:  (A)\n\nQ: The nature of homosexual activities that occur during preadolescence include all but which of the following?\n(A) sexual intercourse (B) circle jerks (C) exhibitionism (D) touching each other's genitals\nA:  (A)\n\nQ: In the scientific community, women's capacity for multiple orgasms was originally discovered by:\n(A) Kinsey (B) Freud (C) Masters and Johnson (D) Kaplan\nA: ",
        {
          "until": [
            "</s>"
          ]
        }
      ]
    ],
    "resps": [
      [
        "(D)"
      ]
    ],
    "filtered_resps": [
      "(D)"
    ],
    "exact_match": 0.0
  },
  {
    "doc_id": 26,
    "doc": {
      "question": "After releasing an egg, the follicle, under stimulation of luteinizing hormone, turns into a a glandular mass of cells called the __________",
      "subject": "human_sexuality",
      "choices": [
        "corpus cavernosum",
        "corpus luteum",
        "corpus callosum",
        "corpus glandula"
      ],
      "answer": 1
    },
    "target": "(B)",
    "arguments": [
      [
        "The following are multiple choice questions (with answers) about human sexuality.\n\nQ: A woman who knows she has active herpes and untreated syphilis but continues to have sex without informing her partners of her condition has, in psychoanalytic terms:\n(A) a strong ego (B) a weak superego (C) a weak id (D) a strong superego\nA:  (B)\n\nQ: Morning sickness is typically a problem:\n(A) during the first trimester (B) during the second trimester (C) during the third trimester (D) all through the pregnancy\nA:  (A)\n\nQ: The nature of homosexual activities that occur during preadolescence include all but which of the following?\n(A) sexual intercourse (B) circle jerks (C) exhibitionism (D) touching each other's genitals\nA:  (A)\n\nQ: Women's ability to have multiple orgasms is primarily due to:\n(A) the fact that they do not have a refractory period. (B) the response of the inner layers of the vagina. (C) having alternating orgasms in different locations. (D) the G-Spot.\nA:  (A)\n\nQ: The most common disorder among men who seek sexual therapy is:\n(A) premature ejaculation (B) inhibited ejaculation (C) erectile disorder (D) ejaculatory disorder\nA:  (C)\n\nQ: After releasing an egg, the follicle, under stimulation of luteinizing hormone, turns into a a glandular mass of cells called the __________\n(A) corpus cavernosum (B) corpus luteum (C) corpus callosum (D) corpus glandula\nA: ",
        {
          "until": [
            "</s>"
          ]
        }
      ]
    ],
    "resps": [
      [
        "(D)"
      ]
    ],
    "filtered_resps": [
      "(D)"
    ],
    "exact_match": 0.0
  },
  {
    "doc_id": 34,
    "doc": {
      "question": "The onset (the very beginning) of labor is first triggered by",
      "subject": "human_sexuality",
      "choices": [
        "hormones secreted by the Mother's ovaries",
        "hormones secreted by the Mother's hypothalamus",
        "hormones secreted by the fetus' adrenal gland",
        "the placenta and uterus secretion of prostaglandins"
      ],
      "answer": 2
    },
    "target": "(C)",
    "arguments": [
      [
        "The following are multiple choice questions (with answers) about human sexuality.\n\nQ: The most common disorder among men who seek sexual therapy is:\n(A) premature ejaculation (B) inhibited ejaculation (C) erectile disorder (D) ejaculatory disorder\nA:  (C)\n\nQ: The nature of homosexual activities that occur during preadolescence include all but which of the following?\n(A) sexual intercourse (B) circle jerks (C) exhibitionism (D) touching each other's genitals\nA:  (A)\n\nQ: Morning sickness is typically a problem:\n(A) during the first trimester (B) during the second trimester (C) during the third trimester (D) all through the pregnancy\nA:  (A)\n\nQ: Women's ability to have multiple orgasms is primarily due to:\n(A) the fact that they do not have a refractory period. (B) the response of the inner layers of the vagina. (C) having alternating orgasms in different locations. (D) the G-Spot.\nA:  (A)\n\nQ: A woman who knows she has active herpes and untreated syphilis but continues to have sex without informing her partners of her condition has, in psychoanalytic terms:\n(A) a strong ego (B) a weak superego (C) a weak id (D) a strong superego\nA:  (B)\n\nQ: The onset (the very beginning) of labor is first triggered by\n(A) hormones secreted by the Mother's ovaries (B) hormones secreted by the Mother's hypothalamus (C) hormones secreted by the fetus' adrenal gland (D) the placenta and uterus secretion of prostaglandins\nA: ",
        {
          "until": [
            "</s>"
          ]
        }
      ]
    ],
    "resps": [
      [
        "(D)"
      ]
    ],
    "filtered_resps": [
      "(D)"
    ],
    "exact_match": 0.0
  },
  {
    "doc_id": 42,
    "doc": {
      "question": "The two principles that deal with questions of values are:",
      "subject": "human_sexuality",
      "choices": [
        "religion and ethics",
        "faith and science",
        "legal and ethics",
        "legal and religion"
      ],
      "answer": 0
    },
    "target": "(A)",
    "arguments": [
      [
        "The following are multiple choice questions (with answers) about human sexuality.\n\nQ: Morning sickness is typically a problem:\n(A) during the first trimester (B) during the second trimester (C) during the third trimester (D) all through the pregnancy\nA:  (A)\n\nQ: The most common disorder among men who seek sexual therapy is:\n(A) premature ejaculation (B) inhibited ejaculation (C) erectile disorder (D) ejaculatory disorder\nA:  (C)\n\nQ: Women's ability to have multiple orgasms is primarily due to:\n(A) the fact that they do not have a refractory period. (B) the response of the inner layers of the vagina. (C) having alternating orgasms in different locations. (D) the G-Spot.\nA:  (A)\n\nQ: The nature of homosexual activities that occur during preadolescence include all but which of the following?\n(A) sexual intercourse (B) circle jerks (C) exhibitionism (D) touching each other's genitals\nA:  (A)\n\nQ: A woman who knows she has active herpes and untreated syphilis but continues to have sex without informing her partners of her condition has, in psychoanalytic terms:\n(A) a strong ego (B) a weak superego (C) a weak id (D) a strong superego\nA:  (B)\n\nQ: The two principles that deal with questions of values are:\n(A) religion and ethics (B) faith and science (C) legal and ethics (D) legal and religion\nA: ",
        {
          "until": [
            "</s>"
          ]
        }
      ]
    ],
    "resps": [
      [
        "(D)"
      ]
    ],
    "filtered_resps": [
      "(D)"
    ],
    "exact_match": 0.0
  },
  {
    "doc_id": 50,
    "doc": {
      "question": "The theory of _______ is used by sociobiologists specifically to explain the evolution of gender differences.",
      "subject": "human_sexuality",
      "choices": [
        "natural selection",
        "the new synthesis",
        "sexual selection",
        "the gender schema"
      ],
      "answer": 2
    },
    "target": "(C)",
    "arguments": [
      [
        "The following are multiple choice questions (with answers) about human sexuality.\n\nQ: The most common disorder among men who seek sexual therapy is:\n(A) premature ejaculation (B) inhibited ejaculation (C) erectile disorder (D) ejaculatory disorder\nA:  (C)\n\nQ: Morning sickness is typically a problem:\n(A) during the first trimester (B) during the second trimester (C) during the third trimester (D) all through the pregnancy\nA:  (A)\n\nQ: Women's ability to have multiple orgasms is primarily due to:\n(A) the fact that they do not have a refractory period. (B) the response of the inner layers of the vagina. (C) having alternating orgasms in different locations. (D) the G-Spot.\nA:  (A)\n\nQ: A woman who knows she has active herpes and untreated syphilis but continues to have sex without informing her partners of her condition has, in psychoanalytic terms:\n(A) a strong ego (B) a weak superego (C) a weak id (D) a strong superego\nA:  (B)\n\nQ: The nature of homosexual activities that occur during preadolescence include all but which of the following?\n(A) sexual intercourse (B) circle jerks (C) exhibitionism (D) touching each other's genitals\nA:  (A)\n\nQ: The theory of _______ is used by sociobiologists specifically to explain the evolution of gender differences.\n(A) natural selection (B) the new synthesis (C) sexual selection (D) the gender schema\nA: ",
        {
          "until": [
            "</s>"
          ]
        }
      ]
    ],
    "resps": [
      [
        "(D)"
      ]
    ],
    "filtered_resps": [
      "(D)"
    ],
    "exact_match": 0.0
  },
  {
    "doc_id": 58,
    "doc": {
      "question": "Kenny fell off a ladder while trying to change a lightbulb. He suffered an injury his upper back transecting his spinal cord and leaving him quadraplegic. Which of the following are probably impaired in Kenny?",
      "subject": "human_sexuality",
      "choices": [
        "ejaculation",
        "erection",
        "genital sensation",
        "both A and C"
      ],
      "answer": 3
    },
    "target": "(D)",
    "arguments": [
      [
        "The following are multiple choice questions (with answers) about human sexuality.\n\nQ: Women's ability to have multiple orgasms is primarily due to:\n(A) the fact that they do not have a refractory period. (B) the response of the inner layers of the vagina. (C) having alternating orgasms in different locations. (D) the G-Spot.\nA:  (A)\n\nQ: The most common disorder among men who seek sexual therapy is:\n(A) premature ejaculation (B) inhibited ejaculation (C) erectile disorder (D) ejaculatory disorder\nA:  (C)\n\nQ: Morning sickness is typically a problem:\n(A) during the first trimester (B) during the second trimester (C) during the third trimester (D) all through the pregnancy\nA:  (A)\n\nQ: The nature of homosexual activities that occur during preadolescence include all but which of the following?\n(A) sexual intercourse (B) circle jerks (C) exhibitionism (D) touching each other's genitals\nA:  (A)\n\nQ: A woman who knows she has active herpes and untreated syphilis but continues to have sex without informing her partners of her condition has, in psychoanalytic terms:\n(A) a strong ego (B) a weak superego (C) a weak id (D) a strong superego\nA:  (B)\n\nQ: Kenny fell off a ladder while trying to change a lightbulb. He suffered an injury his upper back transecting his spinal cord and leaving him quadraplegic. Which of the following are probably impaired in Kenny?\n(A) ejaculation (B) erection (C) genital sensation (D) both A and C\nA: ",
        {
          "until": [
            "</s>"
          ]
        }
      ]
    ],
    "resps": [
      [
        "(D)"
      ]
    ],
    "filtered_resps": [
      "(D)"
    ],
    "exact_match": 1.0
  },
  {
    "doc_id": 66,
    "doc": {
      "question": "When a woman thinks that she probably is a lesbian, she is at the:",
      "subject": "human_sexuality",
      "choices": [
        "pride stage",
        "tolerance stage",
        "acceptance stage",
        "confusion stage"
      ],
      "answer": 1
    },
    "target": "(B)",
    "arguments": [
      [
        "The following are multiple choice questions (with answers) about human sexuality.\n\nQ: The most common disorder among men who seek sexual therapy is:\n(A) premature ejaculation (B) inhibited ejaculation (C) erectile disorder (D) ejaculatory disorder\nA:  (C)\n\nQ: Morning sickness is typically a problem:\n(A) during the first trimester (B) during the second trimester (C) during the third trimester (D) all through the pregnancy\nA:  (A)\n\nQ: Women's ability to have multiple orgasms is primarily due to:\n(A) the fact that they do not have a refractory period. (B) the response of the inner layers of the vagina. (C) having alternating orgasms in different locations. (D) the G-Spot.\nA:  (A)\n\nQ: The nature of homosexual activities that occur during preadolescence include all but which of the following?\n(A) sexual intercourse (B) circle jerks (C) exhibitionism (D) touching each other's genitals\nA:  (A)\n\nQ: A woman who knows she has active herpes and untreated syphilis but continues to have sex without informing her partners of her condition has, in psychoanalytic terms:\n(A) a strong ego (B) a weak superego (C) a weak id (D) a strong superego\nA:  (B)\n\nQ: When a woman thinks that she probably is a lesbian, she is at the:\n(A) pride stage (B) tolerance stage (C) acceptance stage (D) confusion stage\nA: ",
        {
          "until": [
            "</s>"
          ]
        }
      ]
    ],
    "resps": [
      [
        "(D)"
      ]
    ],
    "filtered_resps": [
      "(D)"
    ],
    "exact_match": 0.0
  },
  {
    "doc_id": 74,
    "doc": {
      "question": "It's 3:00 A.M. You are male. You awaken to urinate. Standing at the commode you are in extreme agony. Your penis feels as if it is on fire. You notice a yellowish discharge coming out of your penis after you finish urinating. Your moans have awakened your significant other. She comes running into the bathroom and asks you what is wrong. You tell her you probably have:",
      "subject": "human_sexuality",
      "choices": [
        "genital herpes",
        "AIDS",
        "syphilis",
        "gonorrhea"
      ],
      "answer": 3
    },
    "target": "(D)",
    "arguments": [
      [
        "The following are multiple choice questions (with answers) about human sexuality.\n\nQ: Women's ability to have multiple orgasms is primarily due to:\n(A) the fact that they do not have a refractory period. (B) the response of the inner layers of the vagina. (C) having alternating orgasms in different locations. (D) the G-Spot.\nA:  (A)\n\nQ: A woman who knows she has active herpes and untreated syphilis but continues to have sex without informing her partners of her condition has, in psychoanalytic terms:\n(A) a strong ego (B) a weak superego (C) a weak id (D) a strong superego\nA:  (B)\n\nQ: The most common disorder among men who seek sexual therapy is:\n(A) premature ejaculation (B) inhibited ejaculation (C) erectile disorder (D) ejaculatory disorder\nA:  (C)\n\nQ: The nature of homosexual activities that occur during preadolescence include all but which of the following?\n(A) sexual intercourse (B) circle jerks (C) exhibitionism (D) touching each other's genitals\nA:  (A)\n\nQ: Morning sickness is typically a problem:\n(A) during the first trimester (B) during the second trimester (C) during the third trimester (D) all through the pregnancy\nA:  (A)\n\nQ: It's 3:00 A.M. You are male. You awaken to urinate. Standing at the commode you are in extreme agony. Your penis feels as if it is on fire. You notice a yellowish discharge coming out of your penis after you finish urinating. Your moans have awakened your significant other. She comes running into the bathroom and asks you what is wrong. You tell her you probably have:\n(A) genital herpes (B) AIDS (C) syphilis (D) gonorrhea\nA: ",
        {
          "until": [
            "</s>"
          ]
        }
      ]
    ],
    "resps": [
      [
        "(D)"
      ]
    ],
    "filtered_resps": [
      "(D)"
    ],
    "exact_match": 1.0
  },
  {
    "doc_id": 82,
    "doc": {
      "question": "The follicular phase is to the __________ as the luteal phase is to the secretory phase.",
      "subject": "human_sexuality",
      "choices": [
        "postovulatory",
        "menstrual",
        "proliferative",
        "myometrial"
      ],
      "answer": 2
    },
    "target": "(C)",
    "arguments": [
      [
        "The following are multiple choice questions (with answers) about human sexuality.\n\nQ: A woman who knows she has active herpes and untreated syphilis but continues to have sex without informing her partners of her condition has, in psychoanalytic terms:\n(A) a strong ego (B) a weak superego (C) a weak id (D) a strong superego\nA:  (B)\n\nQ: Morning sickness is typically a problem:\n(A) during the first trimester (B) during the second trimester (C) during the third trimester (D) all through the pregnancy\nA:  (A)\n\nQ: The nature of homosexual activities that occur during preadolescence include all but which of the following?\n(A) sexual intercourse (B) circle jerks (C) exhibitionism (D) touching each other's genitals\nA:  (A)\n\nQ: The most common disorder among men who seek sexual therapy is:\n(A) premature ejaculation (B) inhibited ejaculation (C) erectile disorder (D) ejaculatory disorder\nA:  (C)\n\nQ: Women's ability to have multiple orgasms is primarily due to:\n(A) the fact that they do not have a refractory period. (B) the response of the inner layers of the vagina. (C) having alternating orgasms in different locations. (D) the G-Spot.\nA:  (A)\n\nQ: The follicular phase is to the __________ as the luteal phase is to the secretory phase.\n(A) postovulatory (B) menstrual (C) proliferative (D) myometrial\nA: ",
        {
          "until": [
            "</s>"
          ]
        }
      ]
    ],
    "resps": [
      [
        "(B)"
      ]
    ],
    "filtered_resps": [
      "(B)"
    ],
    "exact_match": 0.0
  },
  {
    "doc_id": 90,
    "doc": {
      "question": "Bill is a successful ad executive for a computer company. He is 32 married and the father of two children. When Bill's wife is not home he puts on her satin stockings garter belt bra skirt blouse and red stilettos. While dressing he becomes sexually excited and proceeds to masturbate. Which of the following descriptions best fits Bill?",
      "subject": "human_sexuality",
      "choices": [
        "female impersonator",
        "drag queen",
        "transsexual",
        "transvestite"
      ],
      "answer": 3
    },
    "target": "(D)",
    "arguments": [
      [
        "The following are multiple choice questions (with answers) about human sexuality.\n\nQ: Morning sickness is typically a problem:\n(A) during the first trimester (B) during the second trimester (C) during the third trimester (D) all through the pregnancy\nA:  (A)\n\nQ: A woman who knows she has active herpes and untreated syphilis but continues to have sex without informing her partners of her condition has, in psychoanalytic terms:\n(A) a strong ego (B) a weak superego (C) a weak id (D) a strong superego\nA:  (B)\n\nQ: The most common disorder among men who seek sexual therapy is:\n(A) premature ejaculation (B) inhibited ejaculation (C) erectile disorder (D) ejaculatory disorder\nA:  (C)\n\nQ: Women's ability to have multiple orgasms is primarily due to:\n(A) the fact that they do not have a refractory period. (B) the response of the inner layers of the vagina. (C) having alternating orgasms in different locations. (D) the G-Spot.\nA:  (A)\n\nQ: The nature of homosexual activities that occur during preadolescence include all but which of the following?\n(A) sexual intercourse (B) circle jerks (C) exhibitionism (D) touching each other's genitals\nA:  (A)\n\nQ: Bill is a successful ad executive for a computer company. He is 32 married and the father of two children. When Bill's wife is not home he puts on her satin stockings garter belt bra skirt blouse and red stilettos. While dressing he becomes sexually excited and proceeds to masturbate. Which of the following descriptions best fits Bill?\n(A) female impersonator (B) drag queen (C) transsexual (D) transvestite\nA: ",
        {
          "until": [
            "</s>"
          ]
        }
      ]
    ],
    "resps": [
      [
        "(C)"
      ]
    ],
    "filtered_resps": [
      "(C)"
    ],
    "exact_match": 0.0
  },
  {
    "doc_id": 98,
    "doc": {
      "question": "What are the experiences when a sexual addict has completed the sexual act?",
      "subject": "human_sexuality",
      "choices": [
        "(s)he experiences feelings of hopelessness and despair",
        "(s)he uses the fantasy of the behaviour just completed to become aroused again",
        "(s)he feels relaxed and emotionally relieved",
        "(s)he immediately becomes sexually aroused again and feels good about the behaviour"
      ],
      "answer": 0
    },
    "target": "(A)",
    "arguments": [
      [
        "The following are multiple choice questions (with answers) about human sexuality.\n\nQ: Morning sickness is typically a problem:\n(A) during the first trimester (B) during the second trimester (C) during the third trimester (D) all through the pregnancy\nA:  (A)\n\nQ: A woman who knows she has active herpes and untreated syphilis but continues to have sex without informing her partners of her condition has, in psychoanalytic terms:\n(A) a strong ego (B) a weak superego (C) a weak id (D) a strong superego\nA:  (B)\n\nQ: Women's ability to have multiple orgasms is primarily due to:\n(A) the fact that they do not have a refractory period. (B) the response of the inner layers of the vagina. (C) having alternating orgasms in different locations. (D) the G-Spot.\nA:  (A)\n\nQ: The nature of homosexual activities that occur during preadolescence include all but which of the following?\n(A) sexual intercourse (B) circle jerks (C) exhibitionism (D) touching each other's genitals\nA:  (A)\n\nQ: The most common disorder among men who seek sexual therapy is:\n(A) premature ejaculation (B) inhibited ejaculation (C) erectile disorder (D) ejaculatory disorder\nA:  (C)\n\nQ: What are the experiences when a sexual addict has completed the sexual act?\n(A) (s)he experiences feelings of hopelessness and despair (B) (s)he uses the fantasy of the behaviour just completed to become aroused again (C) (s)he feels relaxed and emotionally relieved (D) (s)he immediately becomes sexually aroused again and feels good about the behaviour\nA: ",
        {
          "until": [
            "</s>"
          ]
        }
      ]
    ],
    "resps": [
      [
        "(A)"
      ]
    ],
    "filtered_resps": [
      "(A)"
    ],
    "exact_match": 1.0
  },
  {
    "doc_id": 106,
    "doc": {
      "question": "From 1988 to 1990 among heterosexuals in the US, the number of unmarried adults aged 20 to 45 who report having multiple partners has:",
      "subject": "human_sexuality",
      "choices": [
        "declined for both men and women",
        "declined for men, but not for women",
        "declined for women, but not for men",
        "declined for men, and remained the same for women"
      ],
      "answer": 0
    },
    "target": "(A)",
    "arguments": [
      [
        "The following are multiple choice questions (with answers) about human sexuality.\n\nQ: Morning sickness is typically a problem:\n(A) during the first trimester (B) during the second trimester (C) during the third trimester (D) all through the pregnancy\nA:  (A)\n\nQ: The nature of homosexual activities that occur during preadolescence include all but which of the following?\n(A) sexual intercourse (B) circle jerks (C) exhibitionism (D) touching each other's genitals\nA:  (A)\n\nQ: A woman who knows she has active herpes and untreated syphilis but continues to have sex without informing her partners of her condition has, in psychoanalytic terms:\n(A) a strong ego (B) a weak superego (C) a weak id (D) a strong superego\nA:  (B)\n\nQ: The most common disorder among men who seek sexual therapy is:\n(A) premature ejaculation (B) inhibited ejaculation (C) erectile disorder (D) ejaculatory disorder\nA:  (C)\n\nQ: Women's ability to have multiple orgasms is primarily due to:\n(A) the fact that they do not have a refractory period. (B) the response of the inner layers of the vagina. (C) having alternating orgasms in different locations. (D) the G-Spot.\nA:  (A)\n\nQ: From 1988 to 1990 among heterosexuals in the US, the number of unmarried adults aged 20 to 45 who report having multiple partners has:\n(A) declined for both men and women (B) declined for men, but not for women (C) declined for women, but not for men (D) declined for men, and remained the same for women\nA: ",
        {
          "until": [
            "</s>"
          ]
        }
      ]
    ],
    "resps": [
      [
        "(A)"
      ]
    ],
    "filtered_resps": [
      "(A)"
    ],
    "exact_match": 1.0
  },
  {
    "doc_id": 114,
    "doc": {
      "question": "Attachment to a care-giver begins:",
      "subject": "human_sexuality",
      "choices": [
        "in the hours immediately following birth",
        "several weeks after birth",
        "several months after birth",
        "when the child learns to speak"
      ],
      "answer": 0
    },
    "target": "(A)",
    "arguments": [
      [
        "The following are multiple choice questions (with answers) about human sexuality.\n\nQ: Women's ability to have multiple orgasms is primarily due to:\n(A) the fact that they do not have a refractory period. (B) the response of the inner layers of the vagina. (C) having alternating orgasms in different locations. (D) the G-Spot.\nA:  (A)\n\nQ: A woman who knows she has active herpes and untreated syphilis but continues to have sex without informing her partners of her condition has, in psychoanalytic terms:\n(A) a strong ego (B) a weak superego (C) a weak id (D) a strong superego\nA:  (B)\n\nQ: The nature of homosexual activities that occur during preadolescence include all but which of the following?\n(A) sexual intercourse (B) circle jerks (C) exhibitionism (D) touching each other's genitals\nA:  (A)\n\nQ: Morning sickness is typically a problem:\n(A) during the first trimester (B) during the second trimester (C) during the third trimester (D) all through the pregnancy\nA:  (A)\n\nQ: The most common disorder among men who seek sexual therapy is:\n(A) premature ejaculation (B) inhibited ejaculation (C) erectile disorder (D) ejaculatory disorder\nA:  (C)\n\nQ: Attachment to a care-giver begins:\n(A) in the hours immediately following birth (B) several weeks after birth (C) several months after birth (D) when the child learns to speak\nA: ",
        {
          "until": [
            "</s>"
          ]
        }
      ]
    ],
    "resps": [
      [
        "(B)"
      ]
    ],
    "filtered_resps": [
      "(B)"
    ],
    "exact_match": 0.0
  },
  {
    "doc_id": 122,
    "doc": {
      "question": "Keith is really anxious about a big presentation he has to give at work tomorrow. As a result tonight he is having trouble getting an erection. Which of the following BEST explains why Keith might be having this problem?",
      "subject": "human_sexuality",
      "choices": [
        "relaxation is necessary for vasocongestion",
        "anxiety inhibits the sympathetic system",
        "anxiety causes retrograde ejaculation which inhibits arousal",
        "anxiety decreases blood flow to the upper spinal cord inhibiting vasocongestion"
      ],
      "answer": 0
    },
    "target": "(A)",
    "arguments": [
      [
        "The following are multiple choice questions (with answers) about human sexuality.\n\nQ: Morning sickness is typically a problem:\n(A) during the first trimester (B) during the second trimester (C) during the third trimester (D) all through the pregnancy\nA:  (A)\n\nQ: The nature of homosexual activities that occur during preadolescence include all but which of the following?\n(A) sexual intercourse (B) circle jerks (C) exhibitionism (D) touching each other's genitals\nA:  (A)\n\nQ: A woman who knows she has active herpes and untreated syphilis but continues to have sex without informing her partners of her condition has, in psychoanalytic terms:\n(A) a strong ego (B) a weak superego (C) a weak id (D) a strong superego\nA:  (B)\n\nQ: Women's ability to have multiple orgasms is primarily due to:\n(A) the fact that they do not have a refractory period. (B) the response of the inner layers of the vagina. (C) having alternating orgasms in different locations. (D) the G-Spot.\nA:  (A)\n\nQ: The most common disorder among men who seek sexual therapy is:\n(A) premature ejaculation (B) inhibited ejaculation (C) erectile disorder (D) ejaculatory disorder\nA:  (C)\n\nQ: Keith is really anxious about a big presentation he has to give at work tomorrow. As a result tonight he is having trouble getting an erection. Which of the following BEST explains why Keith might be having this problem?\n(A) relaxation is necessary for vasocongestion (B) anxiety inhibits the sympathetic system (C) anxiety causes retrograde ejaculation which inhibits arousal (D) anxiety decreases blood flow to the upper spinal cord inhibiting vasocongestion\nA: ",
        {
          "until": [
            "</s>"
          ]
        }
      ]
    ],
    "resps": [
      [
        "(C)"
      ]
    ],
    "filtered_resps": [
      "(C)"
    ],
    "exact_match": 0.0
  },
  {
    "doc_id": 130,
    "doc": {
      "question": "Over the past several decades, attitudes toward premarital sex have __________; attitudes toward extramarital sex have __________.",
      "subject": "human_sexuality",
      "choices": [
        "remained constant; remained constant",
        "become less permissive; become more accepting",
        "remained constant; become less accepting",
        "become more more permissive; become less accepting"
      ],
      "answer": 3
    },
    "target": "(D)",
    "arguments": [
      [
        "The following are multiple choice questions (with answers) about human sexuality.\n\nQ: The most common disorder among men who seek sexual therapy is:\n(A) premature ejaculation (B) inhibited ejaculation (C) erectile disorder (D) ejaculatory disorder\nA:  (C)\n\nQ: The nature of homosexual activities that occur during preadolescence include all but which of the following?\n(A) sexual intercourse (B) circle jerks (C) exhibitionism (D) touching each other's genitals\nA:  (A)\n\nQ: A woman who knows she has active herpes and untreated syphilis but continues to have sex without informing her partners of her condition has, in psychoanalytic terms:\n(A) a strong ego (B) a weak superego (C) a weak id (D) a strong superego\nA:  (B)\n\nQ: Morning sickness is typically a problem:\n(A) during the first trimester (B) during the second trimester (C) during the third trimester (D) all through the pregnancy\nA:  (A)\n\nQ: Women's ability to have multiple orgasms is primarily due to:\n(A) the fact that they do not have a refractory period. (B) the response of the inner layers of the vagina. (C) having alternating orgasms in different locations. (D) the G-Spot.\nA:  (A)\n\nQ: Over the past several decades, attitudes toward premarital sex have __________; attitudes toward extramarital sex have __________.\n(A) remained constant; remained constant (B) become less permissive; become more accepting (C) remained constant; become less accepting (D) become more more permissive; become less accepting\nA: ",
        {
          "until": [
            "</s>"
          ]
        }
      ]
    ],
    "resps": [
      [
        "(B)"
      ]
    ],
    "filtered_resps": [
      "(B)"
    ],
    "exact_match": 0.0
  },
  {
    "doc_id": 3,
    "doc": {
      "question": "You are a homosexual male: Last night, you were tempted by lusty, swarthy Jacques (the king of fraternity row) to join him at the local dairy bar for a tall cool glass of milk. You also briefly considered studying for this test, but Jacques won out. In Freudian terms, which of the following was dominant?",
      "subject": "human_sexuality",
      "choices": [
        "the id",
        "the ego",
        "the superego",
        "the Oedipus complex"
      ],
      "answer": 0
    },
    "target": "(A)",
    "arguments": [
      [
        "The following are multiple choice questions (with answers) about human sexuality.\n\nQ: The nature of homosexual activities that occur during preadolescence include all but which of the following?\n(A) sexual intercourse (B) circle jerks (C) exhibitionism (D) touching each other's genitals\nA:  (A)\n\nQ: Morning sickness is typically a problem:\n(A) during the first trimester (B) during the second trimester (C) during the third trimester (D) all through the pregnancy\nA:  (A)\n\nQ: The most common disorder among men who seek sexual therapy is:\n(A) premature ejaculation (B) inhibited ejaculation (C) erectile disorder (D) ejaculatory disorder\nA:  (C)\n\nQ: Women's ability to have multiple orgasms is primarily due to:\n(A) the fact that they do not have a refractory period. (B) the response of the inner layers of the vagina. (C) having alternating orgasms in different locations. (D) the G-Spot.\nA:  (A)\n\nQ: A woman who knows she has active herpes and untreated syphilis but continues to have sex without informing her partners of her condition has, in psychoanalytic terms:\n(A) a strong ego (B) a weak superego (C) a weak id (D) a strong superego\nA:  (B)\n\nQ: You are a homosexual male: Last night, you were tempted by lusty, swarthy Jacques (the king of fraternity row) to join him at the local dairy bar for a tall cool glass of milk. You also briefly considered studying for this test, but Jacques won out. In Freudian terms, which of the following was dominant?\n(A) the id (B) the ego (C) the superego (D) the Oedipus complex\nA: ",
        {
          "until": [
            "</s>"
          ]
        }
      ]
    ],
    "resps": [
      [
        "(B)"
      ]
    ],
    "filtered_resps": [
      "(B)"
    ],
    "exact_match": 0.0
  },
  {
    "doc_id": 11,
    "doc": {
      "question": "What makes a relationships last, according to Sternberg?",
      "subject": "human_sexuality",
      "choices": [
        "intimacy",
        "commitment",
        "decision",
        "passion"
      ],
      "answer": 1
    },
    "target": "(B)",
    "arguments": [
      [
        "The following are multiple choice questions (with answers) about human sexuality.\n\nQ: Morning sickness is typically a problem:\n(A) during the first trimester (B) during the second trimester (C) during the third trimester (D) all through the pregnancy\nA:  (A)\n\nQ: The most common disorder among men who seek sexual therapy is:\n(A) premature ejaculation (B) inhibited ejaculation (C) erectile disorder (D) ejaculatory disorder\nA:  (C)\n\nQ: A woman who knows she has active herpes and untreated syphilis but continues to have sex without informing her partners of her condition has, in psychoanalytic terms:\n(A) a strong ego (B) a weak superego (C) a weak id (D) a strong superego\nA:  (B)\n\nQ: The nature of homosexual activities that occur during preadolescence include all but which of the following?\n(A) sexual intercourse (B) circle jerks (C) exhibitionism (D) touching each other's genitals\nA:  (A)\n\nQ: Women's ability to have multiple orgasms is primarily due to:\n(A) the fact that they do not have a refractory period. (B) the response of the inner layers of the vagina. (C) having alternating orgasms in different locations. (D) the G-Spot.\nA:  (A)\n\nQ: What makes a relationships last, according to Sternberg?\n(A) intimacy (B) commitment (C) decision (D) passion\nA: ",
        {
          "until": [
            "</s>"
          ]
        }
      ]
    ],
    "resps": [
      [
        "(B)"
      ]
    ],
    "filtered_resps": [
      "(B)"
    ],
    "exact_match": 1.0
  },
  {
    "doc_id": 19,
    "doc": {
      "question": "Which of the following characteristics are generally consistent with date rape?",
      "subject": "human_sexuality",
      "choices": [
        "use of excessive force",
        "premeditated",
        "sexually motivated",
        "involves use of a weapon"
      ],
      "answer": 2
    },
    "target": "(C)",
    "arguments": [
      [
        "The following are multiple choice questions (with answers) about human sexuality.\n\nQ: Morning sickness is typically a problem:\n(A) during the first trimester (B) during the second trimester (C) during the third trimester (D) all through the pregnancy\nA:  (A)\n\nQ: The most common disorder among men who seek sexual therapy is:\n(A) premature ejaculation (B) inhibited ejaculation (C) erectile disorder (D) ejaculatory disorder\nA:  (C)\n\nQ: A woman who knows she has active herpes and untreated syphilis but continues to have sex without informing her partners of her condition has, in psychoanalytic terms:\n(A) a strong ego (B) a weak superego (C) a weak id (D) a strong superego\nA:  (B)\n\nQ: Women's ability to have multiple orgasms is primarily due to:\n(A) the fact that they do not have a refractory period. (B) the response of the inner layers of the vagina. (C) having alternating orgasms in different locations. (D) the G-Spot.\nA:  (A)\n\nQ: The nature of homosexual activities that occur during preadolescence include all but which of the following?\n(A) sexual intercourse (B) circle jerks (C) exhibitionism (D) touching each other's genitals\nA:  (A)\n\nQ: Which of the following characteristics are generally consistent with date rape?\n(A) use of excessive force (B) premeditated (C) sexually motivated (D) involves use of a weapon\nA: ",
        {
          "until": [
            "</s>"
          ]
        }
      ]
    ],
    "resps": [
      [
        "(C)"
      ]
    ],
    "filtered_resps": [
      "(C)"
    ],
    "exact_match": 1.0
  },
  {
    "doc_id": 27,
    "doc": {
      "question": "How is endometriosis generally treated?",
      "subject": "human_sexuality",
      "choices": [
        "antiprosaglandin drugs",
        "prostaglandin drugs",
        "hormones",
        "aspirin"
      ],
      "answer": 2
    },
    "target": "(C)",
    "arguments": [
      [
        "The following are multiple choice questions (with answers) about human sexuality.\n\nQ: A woman who knows she has active herpes and untreated syphilis but continues to have sex without informing her partners of her condition has, in psychoanalytic terms:\n(A) a strong ego (B) a weak superego (C) a weak id (D) a strong superego\nA:  (B)\n\nQ: Morning sickness is typically a problem:\n(A) during the first trimester (B) during the second trimester (C) during the third trimester (D) all through the pregnancy\nA:  (A)\n\nQ: The nature of homosexual activities that occur during preadolescence include all but which of the following?\n(A) sexual intercourse (B) circle jerks (C) exhibitionism (D) touching each other's genitals\nA:  (A)\n\nQ: Women's ability to have multiple orgasms is primarily due to:\n(A) the fact that they do not have a refractory period. (B) the response of the inner layers of the vagina. (C) having alternating orgasms in different locations. (D) the G-Spot.\nA:  (A)\n\nQ: The most common disorder among men who seek sexual therapy is:\n(A) premature ejaculation (B) inhibited ejaculation (C) erectile disorder (D) ejaculatory disorder\nA:  (C)\n\nQ: How is endometriosis generally treated?\n(A) antiprosaglandin drugs (B) prostaglandin drugs (C) hormones (D) aspirin\nA: ",
        {
          "until": [
            "</s>"
          ]
        }
      ]
    ],
    "resps": [
      [
        "(B)"
      ]
    ],
    "filtered_resps": [
      "(B)"
    ],
    "exact_match": 0.0
  },
  {
    "doc_id": 35,
    "doc": {
      "question": "One of the first models of the physiology of the human sexual response was provided by",
      "subject": "human_sexuality",
      "choices": [
        "Henry Havelock Ellis",
        "Sigmund Freud",
        "Linda George and Stephen Weiler",
        "William Masters and Virginia Johnson"
      ],
      "answer": 3
    },
    "target": "(D)",
    "arguments": [
      [
        "The following are multiple choice questions (with answers) about human sexuality.\n\nQ: The most common disorder among men who seek sexual therapy is:\n(A) premature ejaculation (B) inhibited ejaculation (C) erectile disorder (D) ejaculatory disorder\nA:  (C)\n\nQ: The nature of homosexual activities that occur during preadolescence include all but which of the following?\n(A) sexual intercourse (B) circle jerks (C) exhibitionism (D) touching each other's genitals\nA:  (A)\n\nQ: Morning sickness is typically a problem:\n(A) during the first trimester (B) during the second trimester (C) during the third trimester (D) all through the pregnancy\nA:  (A)\n\nQ: Women's ability to have multiple orgasms is primarily due to:\n(A) the fact that they do not have a refractory period. (B) the response of the inner layers of the vagina. (C) having alternating orgasms in different locations. (D) the G-Spot.\nA:  (A)\n\nQ: A woman who knows she has active herpes and untreated syphilis but continues to have sex without informing her partners of her condition has, in psychoanalytic terms:\n(A) a strong ego (B) a weak superego (C) a weak id (D) a strong superego\nA:  (B)\n\nQ: One of the first models of the physiology of the human sexual response was provided by\n(A) Henry Havelock Ellis (B) Sigmund Freud (C) Linda George and Stephen Weiler (D) William Masters and Virginia Johnson\nA: ",
        {
          "until": [
            "</s>"
          ]
        }
      ]
    ],
    "resps": [
      [
        "(B)"
      ]
    ],
    "filtered_resps": [
      "(B)"
    ],
    "exact_match": 0.0
  },
  {
    "doc_id": 43,
    "doc": {
      "question": "Studies conducted by Bailey and Pillard (1991) have shown that:",
      "subject": "human_sexuality",
      "choices": [
        "the homosexuality concordance rate for identical twins is 100%",
        "the homosexuality concordance rate for identical twins and fraternal twins is approximately the same",
        "the homosexuality concordance rate for identical twins is higher than for fraternal twins",
        "the homosexuality concordance rate for adoptive brothers differs little from that of biological brothers"
      ],
      "answer": 2
    },
    "target": "(C)",
    "arguments": [
      [
        "The following are multiple choice questions (with answers) about human sexuality.\n\nQ: Morning sickness is typically a problem:\n(A) during the first trimester (B) during the second trimester (C) during the third trimester (D) all through the pregnancy\nA:  (A)\n\nQ: The most common disorder among men who seek sexual therapy is:\n(A) premature ejaculation (B) inhibited ejaculation (C) erectile disorder (D) ejaculatory disorder\nA:  (C)\n\nQ: Women's ability to have multiple orgasms is primarily due to:\n(A) the fact that they do not have a refractory period. (B) the response of the inner layers of the vagina. (C) having alternating orgasms in different locations. (D) the G-Spot.\nA:  (A)\n\nQ: The nature of homosexual activities that occur during preadolescence include all but which of the following?\n(A) sexual intercourse (B) circle jerks (C) exhibitionism (D) touching each other's genitals\nA:  (A)\n\nQ: A woman who knows she has active herpes and untreated syphilis but continues to have sex without informing her partners of her condition has, in psychoanalytic terms:\n(A) a strong ego (B) a weak superego (C) a weak id (D) a strong superego\nA:  (B)\n\nQ: Studies conducted by Bailey and Pillard (1991) have shown that:\n(A) the homosexuality concordance rate for identical twins is 100% (B) the homosexuality concordance rate for identical twins and fraternal twins is approximately the same (C) the homosexuality concordance rate for identical twins is higher than for fraternal twins (D) the homosexuality concordance rate for adoptive brothers differs little from that of biological brothers\nA: ",
        {
          "until": [
            "</s>"
          ]
        }
      ]
    ],
    "resps": [
      [
        "(C)"
      ]
    ],
    "filtered_resps": [
      "(C)"
    ],
    "exact_match": 1.0
  },
  {
    "doc_id": 51,
    "doc": {
      "question": "Experimental work on the introduction of the birth control pill was done with",
      "subject": "human_sexuality",
      "choices": [
        "middle- and upper-class American women",
        "white American women",
        "poor Puerto Rican women",
        "Asian American women"
      ],
      "answer": 2
    },
    "target": "(C)",
    "arguments": [
      [
        "The following are multiple choice questions (with answers) about human sexuality.\n\nQ: The most common disorder among men who seek sexual therapy is:\n(A) premature ejaculation (B) inhibited ejaculation (C) erectile disorder (D) ejaculatory disorder\nA:  (C)\n\nQ: Morning sickness is typically a problem:\n(A) during the first trimester (B) during the second trimester (C) during the third trimester (D) all through the pregnancy\nA:  (A)\n\nQ: Women's ability to have multiple orgasms is primarily due to:\n(A) the fact that they do not have a refractory period. (B) the response of the inner layers of the vagina. (C) having alternating orgasms in different locations. (D) the G-Spot.\nA:  (A)\n\nQ: A woman who knows she has active herpes and untreated syphilis but continues to have sex without informing her partners of her condition has, in psychoanalytic terms:\n(A) a strong ego (B) a weak superego (C) a weak id (D) a strong superego\nA:  (B)\n\nQ: The nature of homosexual activities that occur during preadolescence include all but which of the following?\n(A) sexual intercourse (B) circle jerks (C) exhibitionism (D) touching each other's genitals\nA:  (A)\n\nQ: Experimental work on the introduction of the birth control pill was done with\n(A) middle- and upper-class American women (B) white American women (C) poor Puerto Rican women (D) Asian American women\nA: ",
        {
          "until": [
            "</s>"
          ]
        }
      ]
    ],
    "resps": [
      [
        "(B)"
      ]
    ],
    "filtered_resps": [
      "(B)"
    ],
    "exact_match": 0.0
  },
  {
    "doc_id": 59,
    "doc": {
      "question": "The feedback loop in men which regulates the production of sex hormones includes all but which of the following?",
      "subject": "human_sexuality",
      "choices": [
        "oxytocin",
        "gonadotropin-releasing hormone",
        "follicle-stimulating hormone",
        "pituitary gland"
      ],
      "answer": 0
    },
    "target": "(A)",
    "arguments": [
      [
        "The following are multiple choice questions (with answers) about human sexuality.\n\nQ: Women's ability to have multiple orgasms is primarily due to:\n(A) the fact that they do not have a refractory period. (B) the response of the inner layers of the vagina. (C) having alternating orgasms in different locations. (D) the G-Spot.\nA:  (A)\n\nQ: The most common disorder among men who seek sexual therapy is:\n(A) premature ejaculation (B) inhibited ejaculation (C) erectile disorder (D) ejaculatory disorder\nA:  (C)\n\nQ: Morning sickness is typically a problem:\n(A) during the first trimester (B) during the second trimester (C) during the third trimester (D) all through the pregnancy\nA:  (A)\n\nQ: The nature of homosexual activities that occur during preadolescence include all but which of the following?\n(A) sexual intercourse (B) circle jerks (C) exhibitionism (D) touching each other's genitals\nA:  (A)\n\nQ: A woman who knows she has active herpes and untreated syphilis but continues to have sex without informing her partners of her condition has, in psychoanalytic terms:\n(A) a strong ego (B) a weak superego (C) a weak id (D) a strong superego\nA:  (B)\n\nQ: The feedback loop in men which regulates the production of sex hormones includes all but which of the following?\n(A) oxytocin (B) gonadotropin-releasing hormone (C) follicle-stimulating hormone (D) pituitary gland\nA: ",
        {
          "until": [
            "</s>"
          ]
        }
      ]
    ],
    "resps": [
      [
        "(D)"
      ]
    ],
    "filtered_resps": [
      "(D)"
    ],
    "exact_match": 0.0
  },
  {
    "doc_id": 67,
    "doc": {
      "question": "Which of the following STDs can be passed from mother to child through the placenta?",
      "subject": "human_sexuality",
      "choices": [
        "gonorrhea",
        "syphilis",
        "genital herpes",
        "chlamydia"
      ],
      "answer": 1
    },
    "target": "(B)",
    "arguments": [
      [
        "The following are multiple choice questions (with answers) about human sexuality.\n\nQ: The most common disorder among men who seek sexual therapy is:\n(A) premature ejaculation (B) inhibited ejaculation (C) erectile disorder (D) ejaculatory disorder\nA:  (C)\n\nQ: Morning sickness is typically a problem:\n(A) during the first trimester (B) during the second trimester (C) during the third trimester (D) all through the pregnancy\nA:  (A)\n\nQ: Women's ability to have multiple orgasms is primarily due to:\n(A) the fact that they do not have a refractory period. (B) the response of the inner layers of the vagina. (C) having alternating orgasms in different locations. (D) the G-Spot.\nA:  (A)\n\nQ: The nature of homosexual activities that occur during preadolescence include all but which of the following?\n(A) sexual intercourse (B) circle jerks (C) exhibitionism (D) touching each other's genitals\nA:  (A)\n\nQ: A woman who knows she has active herpes and untreated syphilis but continues to have sex without informing her partners of her condition has, in psychoanalytic terms:\n(A) a strong ego (B) a weak superego (C) a weak id (D) a strong superego\nA:  (B)\n\nQ: Which of the following STDs can be passed from mother to child through the placenta?\n(A) gonorrhea (B) syphilis (C) genital herpes (D) chlamydia\nA: ",
        {
          "until": [
            "</s>"
          ]
        }
      ]
    ],
    "resps": [
      [
        "(C)"
      ]
    ],
    "filtered_resps": [
      "(C)"
    ],
    "exact_match": 0.0
  },
  {
    "doc_id": 75,
    "doc": {
      "question": "Which of these statements is accurate concerning the norms of swinging?",
      "subject": "human_sexuality",
      "choices": [
        "Male and female homosexual acts are common and widely accepted.",
        "It is expected that couples will engage in sex with the same partners on several occasions.",
        "The combination of two men with one woman is the typical introduction to swinging.",
        " Most swingers also tend to have tolerant attitudes towards various forms of \"exotic\" sexuality."
      ],
      "answer": 3
    },
    "target": "(D)",
    "arguments": [
      [
        "The following are multiple choice questions (with answers) about human sexuality.\n\nQ: Women's ability to have multiple orgasms is primarily due to:\n(A) the fact that they do not have a refractory period. (B) the response of the inner layers of the vagina. (C) having alternating orgasms in different locations. (D) the G-Spot.\nA:  (A)\n\nQ: A woman who knows she has active herpes and untreated syphilis but continues to have sex without informing her partners of her condition has, in psychoanalytic terms:\n(A) a strong ego (B) a weak superego (C) a weak id (D) a strong superego\nA:  (B)\n\nQ: The most common disorder among men who seek sexual therapy is:\n(A) premature ejaculation (B) inhibited ejaculation (C) erectile disorder (D) ejaculatory disorder\nA:  (C)\n\nQ: The nature of homosexual activities that occur during preadolescence include all but which of the following?\n(A) sexual intercourse (B) circle jerks (C) exhibitionism (D) touching each other's genitals\nA:  (A)\n\nQ: Morning sickness is typically a problem:\n(A) during the first trimester (B) during the second trimester (C) during the third trimester (D) all through the pregnancy\nA:  (A)\n\nQ: Which of these statements is accurate concerning the norms of swinging?\n(A) Male and female homosexual acts are common and widely accepted. (B) It is expected that couples will engage in sex with the same partners on several occasions. (C) The combination of two men with one woman is the typical introduction to swinging. (D)  Most swingers also tend to have tolerant attitudes towards various forms of \"exotic\" sexuality.\nA: ",
        {
          "until": [
            "</s>"
          ]
        }
      ]
    ],
    "resps": [
      [
        "(D)"
      ]
    ],
    "filtered_resps": [
      "(D)"
    ],
    "exact_match": 1.0
  },
  {
    "doc_id": 83,
    "doc": {
      "question": "For purposes of conception, the best position for intercourse is:",
      "subject": "human_sexuality",
      "choices": [
        "woman-on-top",
        "man-on-top",
        "rear entry",
        "side-to-side"
      ],
      "answer": 1
    },
    "target": "(B)",
    "arguments": [
      [
        "The following are multiple choice questions (with answers) about human sexuality.\n\nQ: A woman who knows she has active herpes and untreated syphilis but continues to have sex without informing her partners of her condition has, in psychoanalytic terms:\n(A) a strong ego (B) a weak superego (C) a weak id (D) a strong superego\nA:  (B)\n\nQ: Morning sickness is typically a problem:\n(A) during the first trimester (B) during the second trimester (C) during the third trimester (D) all through the pregnancy\nA:  (A)\n\nQ: The nature of homosexual activities that occur during preadolescence include all but which of the following?\n(A) sexual intercourse (B) circle jerks (C) exhibitionism (D) touching each other's genitals\nA:  (A)\n\nQ: The most common disorder among men who seek sexual therapy is:\n(A) premature ejaculation (B) inhibited ejaculation (C) erectile disorder (D) ejaculatory disorder\nA:  (C)\n\nQ: Women's ability to have multiple orgasms is primarily due to:\n(A) the fact that they do not have a refractory period. (B) the response of the inner layers of the vagina. (C) having alternating orgasms in different locations. (D) the G-Spot.\nA:  (A)\n\nQ: For purposes of conception, the best position for intercourse is:\n(A) woman-on-top (B) man-on-top (C) rear entry (D) side-to-side\nA: ",
        {
          "until": [
            "</s>"
          ]
        }
      ]
    ],
    "resps": [
      [
        "(D)"
      ]
    ],
    "filtered_resps": [
      "(D)"
    ],
    "exact_match": 0.0
  },
  {
    "doc_id": 91,
    "doc": {
      "question": "Sociobiologists assume that the central function of sex is:",
      "subject": "human_sexuality",
      "choices": [
        "pleasure",
        "reproduction",
        "to maintain the double standard",
        "to relieve tension"
      ],
      "answer": 1
    },
    "target": "(B)",
    "arguments": [
      [
        "The following are multiple choice questions (with answers) about human sexuality.\n\nQ: Morning sickness is typically a problem:\n(A) during the first trimester (B) during the second trimester (C) during the third trimester (D) all through the pregnancy\nA:  (A)\n\nQ: A woman who knows she has active herpes and untreated syphilis but continues to have sex without informing her partners of her condition has, in psychoanalytic terms:\n(A) a strong ego (B) a weak superego (C) a weak id (D) a strong superego\nA:  (B)\n\nQ: The most common disorder among men who seek sexual therapy is:\n(A) premature ejaculation (B) inhibited ejaculation (C) erectile disorder (D) ejaculatory disorder\nA:  (C)\n\nQ: Women's ability to have multiple orgasms is primarily due to:\n(A) the fact that they do not have a refractory period. (B) the response of the inner layers of the vagina. (C) having alternating orgasms in different locations. (D) the G-Spot.\nA:  (A)\n\nQ: The nature of homosexual activities that occur during preadolescence include all but which of the following?\n(A) sexual intercourse (B) circle jerks (C) exhibitionism (D) touching each other's genitals\nA:  (A)\n\nQ: Sociobiologists assume that the central function of sex is:\n(A) pleasure (B) reproduction (C) to maintain the double standard (D) to relieve tension\nA: ",
        {
          "until": [
            "</s>"
          ]
        }
      ]
    ],
    "resps": [
      [
        "(B)"
      ]
    ],
    "filtered_resps": [
      "(B)"
    ],
    "exact_match": 1.0
  },
  {
    "doc_id": 99,
    "doc": {
      "question": "Which of the following is/are likely to cause coital pain for BOTH men and women?",
      "subject": "human_sexuality",
      "choices": [
        "infections",
        "foreskin too tight",
        "vaginismus",
        "both A and C"
      ],
      "answer": 0
    },
    "target": "(A)",
    "arguments": [
      [
        "The following are multiple choice questions (with answers) about human sexuality.\n\nQ: Morning sickness is typically a problem:\n(A) during the first trimester (B) during the second trimester (C) during the third trimester (D) all through the pregnancy\nA:  (A)\n\nQ: A woman who knows she has active herpes and untreated syphilis but continues to have sex without informing her partners of her condition has, in psychoanalytic terms:\n(A) a strong ego (B) a weak superego (C) a weak id (D) a strong superego\nA:  (B)\n\nQ: Women's ability to have multiple orgasms is primarily due to:\n(A) the fact that they do not have a refractory period. (B) the response of the inner layers of the vagina. (C) having alternating orgasms in different locations. (D) the G-Spot.\nA:  (A)\n\nQ: The nature of homosexual activities that occur during preadolescence include all but which of the following?\n(A) sexual intercourse (B) circle jerks (C) exhibitionism (D) touching each other's genitals\nA:  (A)\n\nQ: The most common disorder among men who seek sexual therapy is:\n(A) premature ejaculation (B) inhibited ejaculation (C) erectile disorder (D) ejaculatory disorder\nA:  (C)\n\nQ: Which of the following is/are likely to cause coital pain for BOTH men and women?\n(A) infections (B) foreskin too tight (C) vaginismus (D) both A and C\nA: ",
        {
          "until": [
            "</s>"
          ]
        }
      ]
    ],
    "resps": [
      [
        "(C)"
      ]
    ],
    "filtered_resps": [
      "(C)"
    ],
    "exact_match": 0.0
  },
  {
    "doc_id": 107,
    "doc": {
      "question": "Which is true with regard to voyeurs?",
      "subject": "human_sexuality",
      "choices": [
        "They are generally middle-aged.",
        "They are usually dangerous.",
        "They typically want to view friends' sexual behaviours.",
        "They typically want to observe strangers' activities."
      ],
      "answer": 3
    },
    "target": "(D)",
    "arguments": [
      [
        "The following are multiple choice questions (with answers) about human sexuality.\n\nQ: Morning sickness is typically a problem:\n(A) during the first trimester (B) during the second trimester (C) during the third trimester (D) all through the pregnancy\nA:  (A)\n\nQ: The nature of homosexual activities that occur during preadolescence include all but which of the following?\n(A) sexual intercourse (B) circle jerks (C) exhibitionism (D) touching each other's genitals\nA:  (A)\n\nQ: A woman who knows she has active herpes and untreated syphilis but continues to have sex without informing her partners of her condition has, in psychoanalytic terms:\n(A) a strong ego (B) a weak superego (C) a weak id (D) a strong superego\nA:  (B)\n\nQ: The most common disorder among men who seek sexual therapy is:\n(A) premature ejaculation (B) inhibited ejaculation (C) erectile disorder (D) ejaculatory disorder\nA:  (C)\n\nQ: Women's ability to have multiple orgasms is primarily due to:\n(A) the fact that they do not have a refractory period. (B) the response of the inner layers of the vagina. (C) having alternating orgasms in different locations. (D) the G-Spot.\nA:  (A)\n\nQ: Which is true with regard to voyeurs?\n(A) They are generally middle-aged. (B) They are usually dangerous. (C) They typically want to view friends' sexual behaviours. (D) They typically want to observe strangers' activities.\nA: ",
        {
          "until": [
            "</s>"
          ]
        }
      ]
    ],
    "resps": [
      [
        "(D)"
      ]
    ],
    "filtered_resps": [
      "(D)"
    ],
    "exact_match": 1.0
  },
  {
    "doc_id": 115,
    "doc": {
      "question": "Female sterilization inhibits _________ production.",
      "subject": "human_sexuality",
      "choices": [
        "egg",
        "estrogen",
        "progesterone",
        "none of the above"
      ],
      "answer": 3
    },
    "target": "(D)",
    "arguments": [
      [
        "The following are multiple choice questions (with answers) about human sexuality.\n\nQ: Women's ability to have multiple orgasms is primarily due to:\n(A) the fact that they do not have a refractory period. (B) the response of the inner layers of the vagina. (C) having alternating orgasms in different locations. (D) the G-Spot.\nA:  (A)\n\nQ: A woman who knows she has active herpes and untreated syphilis but continues to have sex without informing her partners of her condition has, in psychoanalytic terms:\n(A) a strong ego (B) a weak superego (C) a weak id (D) a strong superego\nA:  (B)\n\nQ: The nature of homosexual activities that occur during preadolescence include all but which of the following?\n(A) sexual intercourse (B) circle jerks (C) exhibitionism (D) touching each other's genitals\nA:  (A)\n\nQ: Morning sickness is typically a problem:\n(A) during the first trimester (B) during the second trimester (C) during the third trimester (D) all through the pregnancy\nA:  (A)\n\nQ: The most common disorder among men who seek sexual therapy is:\n(A) premature ejaculation (B) inhibited ejaculation (C) erectile disorder (D) ejaculatory disorder\nA:  (C)\n\nQ: Female sterilization inhibits _________ production.\n(A) egg (B) estrogen (C) progesterone (D) none of the above\nA: ",
        {
          "until": [
            "</s>"
          ]
        }
      ]
    ],
    "resps": [
      [
        "(B)"
      ]
    ],
    "filtered_resps": [
      "(B)"
    ],
    "exact_match": 0.0
  },
  {
    "doc_id": 123,
    "doc": {
      "question": "A person with a rating of 4 on the Kinsey scale would be classified as:",
      "subject": "human_sexuality",
      "choices": [
        "mostly heterosexual with incidental homosexual experience",
        "heterosexual with substantial homosexual experience",
        "homosexual with substantial heterosexual experience",
        "mostly homosexual with incidental heterosexual experience"
      ],
      "answer": 2
    },
    "target": "(C)",
    "arguments": [
      [
        "The following are multiple choice questions (with answers) about human sexuality.\n\nQ: Morning sickness is typically a problem:\n(A) during the first trimester (B) during the second trimester (C) during the third trimester (D) all through the pregnancy\nA:  (A)\n\nQ: The nature of homosexual activities that occur during preadolescence include all but which of the following?\n(A) sexual intercourse (B) circle jerks (C) exhibitionism (D) touching each other's genitals\nA:  (A)\n\nQ: A woman who knows she has active herpes and untreated syphilis but continues to have sex without informing her partners of her condition has, in psychoanalytic terms:\n(A) a strong ego (B) a weak superego (C) a weak id (D) a strong superego\nA:  (B)\n\nQ: Women's ability to have multiple orgasms is primarily due to:\n(A) the fact that they do not have a refractory period. (B) the response of the inner layers of the vagina. (C) having alternating orgasms in different locations. (D) the G-Spot.\nA:  (A)\n\nQ: The most common disorder among men who seek sexual therapy is:\n(A) premature ejaculation (B) inhibited ejaculation (C) erectile disorder (D) ejaculatory disorder\nA:  (C)\n\nQ: A person with a rating of 4 on the Kinsey scale would be classified as:\n(A) mostly heterosexual with incidental homosexual experience (B) heterosexual with substantial homosexual experience (C) homosexual with substantial heterosexual experience (D) mostly homosexual with incidental heterosexual experience\nA: ",
        {
          "until": [
            "</s>"
          ]
        }
      ]
    ],
    "resps": [
      [
        "(B)"
      ]
    ],
    "filtered_resps": [
      "(B)"
    ],
    "exact_match": 0.0
  },
  {
    "doc_id": 4,
    "doc": {
      "question": "Sociobiologists believe that there are more males than females with paraphilias because:",
      "subject": "human_sexuality",
      "choices": [
        "paraphilias guarantee survival of the species",
        "evolutionary selection has favored the development of males who respond to novel sexual stimuli",
        "of left brain/right brain differences between the genders",
        "male brains are better developed than are female brains"
      ],
      "answer": 1
    },
    "target": "(B)",
    "arguments": [
      [
        "The following are multiple choice questions (with answers) about human sexuality.\n\nQ: The nature of homosexual activities that occur during preadolescence include all but which of the following?\n(A) sexual intercourse (B) circle jerks (C) exhibitionism (D) touching each other's genitals\nA:  (A)\n\nQ: Morning sickness is typically a problem:\n(A) during the first trimester (B) during the second trimester (C) during the third trimester (D) all through the pregnancy\nA:  (A)\n\nQ: The most common disorder among men who seek sexual therapy is:\n(A) premature ejaculation (B) inhibited ejaculation (C) erectile disorder (D) ejaculatory disorder\nA:  (C)\n\nQ: Women's ability to have multiple orgasms is primarily due to:\n(A) the fact that they do not have a refractory period. (B) the response of the inner layers of the vagina. (C) having alternating orgasms in different locations. (D) the G-Spot.\nA:  (A)\n\nQ: A woman who knows she has active herpes and untreated syphilis but continues to have sex without informing her partners of her condition has, in psychoanalytic terms:\n(A) a strong ego (B) a weak superego (C) a weak id (D) a strong superego\nA:  (B)\n\nQ: Sociobiologists believe that there are more males than females with paraphilias because:\n(A) paraphilias guarantee survival of the species (B) evolutionary selection has favored the development of males who respond to novel sexual stimuli (C) of left brain/right brain differences between the genders (D) male brains are better developed than are female brains\nA: ",
        {
          "until": [
            "</s>"
          ]
        }
      ]
    ],
    "resps": [
      [
        "(B)"
      ]
    ],
    "filtered_resps": [
      "(B)"
    ],
    "exact_match": 1.0
  },
  {
    "doc_id": 12,
    "doc": {
      "question": "The position that abortion is murder is held by certain people in which religion?",
      "subject": "human_sexuality",
      "choices": [
        "Orthodox Jews",
        "Fundamentalist Protestants",
        "Eastern Orthodox Christians",
        "all of the above"
      ],
      "answer": 3
    },
    "target": "(D)",
    "arguments": [
      [
        "The following are multiple choice questions (with answers) about human sexuality.\n\nQ: Morning sickness is typically a problem:\n(A) during the first trimester (B) during the second trimester (C) during the third trimester (D) all through the pregnancy\nA:  (A)\n\nQ: The most common disorder among men who seek sexual therapy is:\n(A) premature ejaculation (B) inhibited ejaculation (C) erectile disorder (D) ejaculatory disorder\nA:  (C)\n\nQ: A woman who knows she has active herpes and untreated syphilis but continues to have sex without informing her partners of her condition has, in psychoanalytic terms:\n(A) a strong ego (B) a weak superego (C) a weak id (D) a strong superego\nA:  (B)\n\nQ: The nature of homosexual activities that occur during preadolescence include all but which of the following?\n(A) sexual intercourse (B) circle jerks (C) exhibitionism (D) touching each other's genitals\nA:  (A)\n\nQ: Women's ability to have multiple orgasms is primarily due to:\n(A) the fact that they do not have a refractory period. (B) the response of the inner layers of the vagina. (C) having alternating orgasms in different locations. (D) the G-Spot.\nA:  (A)\n\nQ: The position that abortion is murder is held by certain people in which religion?\n(A) Orthodox Jews (B) Fundamentalist Protestants (C) Eastern Orthodox Christians (D) all of the above\nA: ",
        {
          "until": [
            "</s>"
          ]
        }
      ]
    ],
    "resps": [
      [
        "(D)"
      ]
    ],
    "filtered_resps": [
      "(D)"
    ],
    "exact_match": 1.0
  },
  {
    "doc_id": 20,
    "doc": {
      "question": "According to John Money, __________ refers to a person's private internal sense of maleness or femaleness.",
      "subject": "human_sexuality",
      "choices": [
        "Gender identity",
        "Sexual nomenclature",
        "Gender schema",
        "Intrapsychic sexual orientation"
      ],
      "answer": 0
    },
    "target": "(A)",
    "arguments": [
      [
        "The following are multiple choice questions (with answers) about human sexuality.\n\nQ: Morning sickness is typically a problem:\n(A) during the first trimester (B) during the second trimester (C) during the third trimester (D) all through the pregnancy\nA:  (A)\n\nQ: The most common disorder among men who seek sexual therapy is:\n(A) premature ejaculation (B) inhibited ejaculation (C) erectile disorder (D) ejaculatory disorder\nA:  (C)\n\nQ: A woman who knows she has active herpes and untreated syphilis but continues to have sex without informing her partners of her condition has, in psychoanalytic terms:\n(A) a strong ego (B) a weak superego (C) a weak id (D) a strong superego\nA:  (B)\n\nQ: Women's ability to have multiple orgasms is primarily due to:\n(A) the fact that they do not have a refractory period. (B) the response of the inner layers of the vagina. (C) having alternating orgasms in different locations. (D) the G-Spot.\nA:  (A)\n\nQ: The nature of homosexual activities that occur during preadolescence include all but which of the following?\n(A) sexual intercourse (B) circle jerks (C) exhibitionism (D) touching each other's genitals\nA:  (A)\n\nQ: According to John Money, __________ refers to a person's private internal sense of maleness or femaleness.\n(A) Gender identity (B) Sexual nomenclature (C) Gender schema (D) Intrapsychic sexual orientation\nA: ",
        {
          "until": [
            "</s>"
          ]
        }
      ]
    ],
    "resps": [
      [
        "(D)"
      ]
    ],
    "filtered_resps": [
      "(D)"
    ],
    "exact_match": 0.0
  },
  {
    "doc_id": 28,
    "doc": {
      "question": "Before the Masters and Johnson research, it was thought that vaginal lubrication was due to secretions of",
      "subject": "human_sexuality",
      "choices": [
        "Cowper's gland",
        "Prostate gland",
        "Bartholin glands",
        "Adrenal gland"
      ],
      "answer": 2
    },
    "target": "(C)",
    "arguments": [
      [
        "The following are multiple choice questions (with answers) about human sexuality.\n\nQ: A woman who knows she has active herpes and untreated syphilis but continues to have sex without informing her partners of her condition has, in psychoanalytic terms:\n(A) a strong ego (B) a weak superego (C) a weak id (D) a strong superego\nA:  (B)\n\nQ: Morning sickness is typically a problem:\n(A) during the first trimester (B) during the second trimester (C) during the third trimester (D) all through the pregnancy\nA:  (A)\n\nQ: The nature of homosexual activities that occur during preadolescence include all but which of the following?\n(A) sexual intercourse (B) circle jerks (C) exhibitionism (D) touching each other's genitals\nA:  (A)\n\nQ: Women's ability to have multiple orgasms is primarily due to:\n(A) the fact that they do not have a refractory period. (B) the response of the inner layers of the vagina. (C) having alternating orgasms in different locations. (D) the G-Spot.\nA:  (A)\n\nQ: The most common disorder among men who seek sexual therapy is:\n(A) premature ejaculation (B) inhibited ejaculation (C) erectile disorder (D) ejaculatory disorder\nA:  (C)\n\nQ: Before the Masters and Johnson research, it was thought that vaginal lubrication was due to secretions of\n(A) Cowper's gland (B) Prostate gland (C) Bartholin glands (D) Adrenal gland\nA: ",
        {
          "until": [
            "</s>"
          ]
        }
      ]
    ],
    "resps": [
      [
        "(B)"
      ]
    ],
    "filtered_resps": [
      "(B)"
    ],
    "exact_match": 0.0
  },
  {
    "doc_id": 36,
    "doc": {
      "question": "An adult feels himself becoming aroused when looking at a child and realizes that the response is totally inappropriate, as a result he feels anxiety rather than arousal. This is an example of __________ according to Walen and Roth's cognitive model of the sexual response.",
      "subject": "human_sexuality",
      "choices": [
        "negative perception",
        "negative evaluation",
        "negative arousal",
        "cognitive dissonance"
      ],
      "answer": 1
    },
    "target": "(B)",
    "arguments": [
      [
        "The following are multiple choice questions (with answers) about human sexuality.\n\nQ: The most common disorder among men who seek sexual therapy is:\n(A) premature ejaculation (B) inhibited ejaculation (C) erectile disorder (D) ejaculatory disorder\nA:  (C)\n\nQ: The nature of homosexual activities that occur during preadolescence include all but which of the following?\n(A) sexual intercourse (B) circle jerks (C) exhibitionism (D) touching each other's genitals\nA:  (A)\n\nQ: Morning sickness is typically a problem:\n(A) during the first trimester (B) during the second trimester (C) during the third trimester (D) all through the pregnancy\nA:  (A)\n\nQ: Women's ability to have multiple orgasms is primarily due to:\n(A) the fact that they do not have a refractory period. (B) the response of the inner layers of the vagina. (C) having alternating orgasms in different locations. (D) the G-Spot.\nA:  (A)\n\nQ: A woman who knows she has active herpes and untreated syphilis but continues to have sex without informing her partners of her condition has, in psychoanalytic terms:\n(A) a strong ego (B) a weak superego (C) a weak id (D) a strong superego\nA:  (B)\n\nQ: An adult feels himself becoming aroused when looking at a child and realizes that the response is totally inappropriate, as a result he feels anxiety rather than arousal. This is an example of __________ according to Walen and Roth's cognitive model of the sexual response.\n(A) negative perception (B) negative evaluation (C) negative arousal (D) cognitive dissonance\nA: ",
        {
          "until": [
            "</s>"
          ]
        }
      ]
    ],
    "resps": [
      [
        "(D)"
      ]
    ],
    "filtered_resps": [
      "(D)"
    ],
    "exact_match": 0.0
  },
  {
    "doc_id": 44,
    "doc": {
      "question": "The capacity of a spinal-cord injured man to have erections depends on:",
      "subject": "human_sexuality",
      "choices": [
        "the level of the spinal cord at which the injury occurred",
        "whether the spinal cord was partially or completely severed",
        "the man's age",
        "both a and b"
      ],
      "answer": 3
    },
    "target": "(D)",
    "arguments": [
      [
        "The following are multiple choice questions (with answers) about human sexuality.\n\nQ: Morning sickness is typically a problem:\n(A) during the first trimester (B) during the second trimester (C) during the third trimester (D) all through the pregnancy\nA:  (A)\n\nQ: The most common disorder among men who seek sexual therapy is:\n(A) premature ejaculation (B) inhibited ejaculation (C) erectile disorder (D) ejaculatory disorder\nA:  (C)\n\nQ: Women's ability to have multiple orgasms is primarily due to:\n(A) the fact that they do not have a refractory period. (B) the response of the inner layers of the vagina. (C) having alternating orgasms in different locations. (D) the G-Spot.\nA:  (A)\n\nQ: The nature of homosexual activities that occur during preadolescence include all but which of the following?\n(A) sexual intercourse (B) circle jerks (C) exhibitionism (D) touching each other's genitals\nA:  (A)\n\nQ: A woman who knows she has active herpes and untreated syphilis but continues to have sex without informing her partners of her condition has, in psychoanalytic terms:\n(A) a strong ego (B) a weak superego (C) a weak id (D) a strong superego\nA:  (B)\n\nQ: The capacity of a spinal-cord injured man to have erections depends on:\n(A) the level of the spinal cord at which the injury occurred (B) whether the spinal cord was partially or completely severed (C) the man's age (D) both a and b\nA: ",
        {
          "until": [
            "</s>"
          ]
        }
      ]
    ],
    "resps": [
      [
        "(D)"
      ]
    ],
    "filtered_resps": [
      "(D)"
    ],
    "exact_match": 1.0
  },
  {
    "doc_id": 52,
    "doc": {
      "question": "Which of the following have menstrual cycles?",
      "subject": "human_sexuality",
      "choices": [
        "some monkey species",
        "some ape species",
        "some breeds of dogs",
        "a and b only"
      ],
      "answer": 3
    },
    "target": "(D)",
    "arguments": [
      [
        "The following are multiple choice questions (with answers) about human sexuality.\n\nQ: The most common disorder among men who seek sexual therapy is:\n(A) premature ejaculation (B) inhibited ejaculation (C) erectile disorder (D) ejaculatory disorder\nA:  (C)\n\nQ: Morning sickness is typically a problem:\n(A) during the first trimester (B) during the second trimester (C) during the third trimester (D) all through the pregnancy\nA:  (A)\n\nQ: Women's ability to have multiple orgasms is primarily due to:\n(A) the fact that they do not have a refractory period. (B) the response of the inner layers of the vagina. (C) having alternating orgasms in different locations. (D) the G-Spot.\nA:  (A)\n\nQ: A woman who knows she has active herpes and untreated syphilis but continues to have sex without informing her partners of her condition has, in psychoanalytic terms:\n(A) a strong ego (B) a weak superego (C) a weak id (D) a strong superego\nA:  (B)\n\nQ: The nature of homosexual activities that occur during preadolescence include all but which of the following?\n(A) sexual intercourse (B) circle jerks (C) exhibitionism (D) touching each other's genitals\nA:  (A)\n\nQ: Which of the following have menstrual cycles?\n(A) some monkey species (B) some ape species (C) some breeds of dogs (D) a and b only\nA: ",
        {
          "until": [
            "</s>"
          ]
        }
      ]
    ],
    "resps": [
      [
        "(D)"
      ]
    ],
    "filtered_resps": [
      "(D)"
    ],
    "exact_match": 1.0
  },
  {
    "doc_id": 60,
    "doc": {
      "question": "The Old Testament presents the view that sexuality is",
      "subject": "human_sexuality",
      "choices": [
        "fundamentally positive",
        "to be considered in light of its social consequences",
        "comparable to other biological functions",
        "a and b"
      ],
      "answer": 3
    },
    "target": "(D)",
    "arguments": [
      [
        "The following are multiple choice questions (with answers) about human sexuality.\n\nQ: Women's ability to have multiple orgasms is primarily due to:\n(A) the fact that they do not have a refractory period. (B) the response of the inner layers of the vagina. (C) having alternating orgasms in different locations. (D) the G-Spot.\nA:  (A)\n\nQ: The most common disorder among men who seek sexual therapy is:\n(A) premature ejaculation (B) inhibited ejaculation (C) erectile disorder (D) ejaculatory disorder\nA:  (C)\n\nQ: Morning sickness is typically a problem:\n(A) during the first trimester (B) during the second trimester (C) during the third trimester (D) all through the pregnancy\nA:  (A)\n\nQ: The nature of homosexual activities that occur during preadolescence include all but which of the following?\n(A) sexual intercourse (B) circle jerks (C) exhibitionism (D) touching each other's genitals\nA:  (A)\n\nQ: A woman who knows she has active herpes and untreated syphilis but continues to have sex without informing her partners of her condition has, in psychoanalytic terms:\n(A) a strong ego (B) a weak superego (C) a weak id (D) a strong superego\nA:  (B)\n\nQ: The Old Testament presents the view that sexuality is\n(A) fundamentally positive (B) to be considered in light of its social consequences (C) comparable to other biological functions (D) a and b\nA: ",
        {
          "until": [
            "</s>"
          ]
        }
      ]
    ],
    "resps": [
      [
        "(D)"
      ]
    ],
    "filtered_resps": [
      "(D)"
    ],
    "exact_match": 1.0
  },
  {
    "doc_id": 68,
    "doc": {
      "question": "Persons with liberal attitudes about premarital sex are likely to:",
      "subject": "human_sexuality",
      "choices": [
        "have liberal attitudes about extramarital sex",
        "engage in accidental extramarital sexual activity",
        "engage in open swinging",
        "all of the above"
      ],
      "answer": 0
    },
    "target": "(A)",
    "arguments": [
      [
        "The following are multiple choice questions (with answers) about human sexuality.\n\nQ: The most common disorder among men who seek sexual therapy is:\n(A) premature ejaculation (B) inhibited ejaculation (C) erectile disorder (D) ejaculatory disorder\nA:  (C)\n\nQ: Morning sickness is typically a problem:\n(A) during the first trimester (B) during the second trimester (C) during the third trimester (D) all through the pregnancy\nA:  (A)\n\nQ: Women's ability to have multiple orgasms is primarily due to:\n(A) the fact that they do not have a refractory period. (B) the response of the inner layers of the vagina. (C) having alternating orgasms in different locations. (D) the G-Spot.\nA:  (A)\n\nQ: The nature of homosexual activities that occur during preadolescence include all but which of the following?\n(A) sexual intercourse (B) circle jerks (C) exhibitionism (D) touching each other's genitals\nA:  (A)\n\nQ: A woman who knows she has active herpes and untreated syphilis but continues to have sex without informing her partners of her condition has, in psychoanalytic terms:\n(A) a strong ego (B) a weak superego (C) a weak id (D) a strong superego\nA:  (B)\n\nQ: Persons with liberal attitudes about premarital sex are likely to:\n(A) have liberal attitudes about extramarital sex (B) engage in accidental extramarital sexual activity (C) engage in open swinging (D) all of the above\nA: ",
        {
          "until": [
            "</s>"
          ]
        }
      ]
    ],
    "resps": [
      [
        "(D)"
      ]
    ],
    "filtered_resps": [
      "(D)"
    ],
    "exact_match": 0.0
  },
  {
    "doc_id": 76,
    "doc": {
      "question": "Romulo is on a crowded bus and he sees a woman near the door. Feeling a little saucy Romulo proceeds to rub up against the woman and is immediately aroused. Romulo's inappropriate behavior would be characterized as:",
      "subject": "human_sexuality",
      "choices": [
        "Frotteurism",
        "Exhibitionism",
        "Voyeurism",
        "Sadomasochism"
      ],
      "answer": 0
    },
    "target": "(A)",
    "arguments": [
      [
        "The following are multiple choice questions (with answers) about human sexuality.\n\nQ: Women's ability to have multiple orgasms is primarily due to:\n(A) the fact that they do not have a refractory period. (B) the response of the inner layers of the vagina. (C) having alternating orgasms in different locations. (D) the G-Spot.\nA:  (A)\n\nQ: A woman who knows she has active herpes and untreated syphilis but continues to have sex without informing her partners of her condition has, in psychoanalytic terms:\n(A) a strong ego (B) a weak superego (C) a weak id (D) a strong superego\nA:  (B)\n\nQ: The most common disorder among men who seek sexual therapy is:\n(A) premature ejaculation (B) inhibited ejaculation (C) erectile disorder (D) ejaculatory disorder\nA:  (C)\n\nQ: The nature of homosexual activities that occur during preadolescence include all but which of the following?\n(A) sexual intercourse (B) circle jerks (C) exhibitionism (D) touching each other's genitals\nA:  (A)\n\nQ: Morning sickness is typically a problem:\n(A) during the first trimester (B) during the second trimester (C) during the third trimester (D) all through the pregnancy\nA:  (A)\n\nQ: Romulo is on a crowded bus and he sees a woman near the door. Feeling a little saucy Romulo proceeds to rub up against the woman and is immediately aroused. Romulo's inappropriate behavior would be characterized as:\n(A) Frotteurism (B) Exhibitionism (C) Voyeurism (D) Sadomasochism\nA: ",
        {
          "until": [
            "</s>"
          ]
        }
      ]
    ],
    "resps": [
      [
        "(D)"
      ]
    ],
    "filtered_resps": [
      "(D)"
    ],
    "exact_match": 0.0
  },
  {
    "doc_id": 84,
    "doc": {
      "question": "Danny and Sandy are coworkers. Sandy sees Danny in the break room and says \"Hey Stud! Nice buns! Wanna do it?\" This would be considered harrassment if:",
      "subject": "human_sexuality",
      "choices": [
        "Sandy is Danny's supervisor",
        "Danny has previously told Sandy that he does not appreciate her advances",
        "Danny responds with \"Sure baby your office or mine?\"",
        "both A and B"
      ],
      "answer": 3
    },
    "target": "(D)",
    "arguments": [
      [
        "The following are multiple choice questions (with answers) about human sexuality.\n\nQ: A woman who knows she has active herpes and untreated syphilis but continues to have sex without informing her partners of her condition has, in psychoanalytic terms:\n(A) a strong ego (B) a weak superego (C) a weak id (D) a strong superego\nA:  (B)\n\nQ: Morning sickness is typically a problem:\n(A) during the first trimester (B) during the second trimester (C) during the third trimester (D) all through the pregnancy\nA:  (A)\n\nQ: The nature of homosexual activities that occur during preadolescence include all but which of the following?\n(A) sexual intercourse (B) circle jerks (C) exhibitionism (D) touching each other's genitals\nA:  (A)\n\nQ: The most common disorder among men who seek sexual therapy is:\n(A) premature ejaculation (B) inhibited ejaculation (C) erectile disorder (D) ejaculatory disorder\nA:  (C)\n\nQ: Women's ability to have multiple orgasms is primarily due to:\n(A) the fact that they do not have a refractory period. (B) the response of the inner layers of the vagina. (C) having alternating orgasms in different locations. (D) the G-Spot.\nA:  (A)\n\nQ: Danny and Sandy are coworkers. Sandy sees Danny in the break room and says \"Hey Stud! Nice buns! Wanna do it?\" This would be considered harrassment if:\n(A) Sandy is Danny's supervisor (B) Danny has previously told Sandy that he does not appreciate her advances (C) Danny responds with \"Sure baby your office or mine?\" (D) both A and B\nA: ",
        {
          "until": [
            "</s>"
          ]
        }
      ]
    ],
    "resps": [
      [
        "(D)"
      ]
    ],
    "filtered_resps": [
      "(D)"
    ],
    "exact_match": 1.0
  },
  {
    "doc_id": 92,
    "doc": {
      "question": "Which of the following approaches to psychotherapy focuses only the problem behaviour and how to modify it?",
      "subject": "human_sexuality",
      "choices": [
        "Behaviour modification",
        "psychoanalytic",
        "sociological",
        "evolutionary"
      ],
      "answer": 0
    },
    "target": "(A)",
    "arguments": [
      [
        "The following are multiple choice questions (with answers) about human sexuality.\n\nQ: Morning sickness is typically a problem:\n(A) during the first trimester (B) during the second trimester (C) during the third trimester (D) all through the pregnancy\nA:  (A)\n\nQ: A woman who knows she has active herpes and untreated syphilis but continues to have sex without informing her partners of her condition has, in psychoanalytic terms:\n(A) a strong ego (B) a weak superego (C) a weak id (D) a strong superego\nA:  (B)\n\nQ: The most common disorder among men who seek sexual therapy is:\n(A) premature ejaculation (B) inhibited ejaculation (C) erectile disorder (D) ejaculatory disorder\nA:  (C)\n\nQ: Women's ability to have multiple orgasms is primarily due to:\n(A) the fact that they do not have a refractory period. (B) the response of the inner layers of the vagina. (C) having alternating orgasms in different locations. (D) the G-Spot.\nA:  (A)\n\nQ: The nature of homosexual activities that occur during preadolescence include all but which of the following?\n(A) sexual intercourse (B) circle jerks (C) exhibitionism (D) touching each other's genitals\nA:  (A)\n\nQ: Which of the following approaches to psychotherapy focuses only the problem behaviour and how to modify it?\n(A) Behaviour modification (B) psychoanalytic (C) sociological (D) evolutionary\nA: ",
        {
          "until": [
            "</s>"
          ]
        }
      ]
    ],
    "resps": [
      [
        "(A)"
      ]
    ],
    "filtered_resps": [
      "(A)"
    ],
    "exact_match": 1.0
  },
  {
    "doc_id": 100,
    "doc": {
      "question": "The endometrium grows and thickens during:",
      "subject": "human_sexuality",
      "choices": [
        "menstruation",
        "the follicular phase",
        "the luteal phase",
        "ovulation"
      ],
      "answer": 1
    },
    "target": "(B)",
    "arguments": [
      [
        "The following are multiple choice questions (with answers) about human sexuality.\n\nQ: Morning sickness is typically a problem:\n(A) during the first trimester (B) during the second trimester (C) during the third trimester (D) all through the pregnancy\nA:  (A)\n\nQ: A woman who knows she has active herpes and untreated syphilis but continues to have sex without informing her partners of her condition has, in psychoanalytic terms:\n(A) a strong ego (B) a weak superego (C) a weak id (D) a strong superego\nA:  (B)\n\nQ: Women's ability to have multiple orgasms is primarily due to:\n(A) the fact that they do not have a refractory period. (B) the response of the inner layers of the vagina. (C) having alternating orgasms in different locations. (D) the G-Spot.\nA:  (A)\n\nQ: The nature of homosexual activities that occur during preadolescence include all but which of the following?\n(A) sexual intercourse (B) circle jerks (C) exhibitionism (D) touching each other's genitals\nA:  (A)\n\nQ: The most common disorder among men who seek sexual therapy is:\n(A) premature ejaculation (B) inhibited ejaculation (C) erectile disorder (D) ejaculatory disorder\nA:  (C)\n\nQ: The endometrium grows and thickens during:\n(A) menstruation (B) the follicular phase (C) the luteal phase (D) ovulation\nA: ",
        {
          "until": [
            "</s>"
          ]
        }
      ]
    ],
    "resps": [
      [
        "(D)"
      ]
    ],
    "filtered_resps": [
      "(D)"
    ],
    "exact_match": 0.0
  },
  {
    "doc_id": 108,
    "doc": {
      "question": "What are the three dimensions of intimacy in romantic relationships that outline closeness and sharing?",
      "subject": "human_sexuality",
      "choices": [
        "affective, trusting, and friendship",
        "becoming emotional, caring, and physical",
        "affective, cognitive, and physical",
        "mutual self-disclosure, sexuality, and trusting"
      ],
      "answer": 2
    },
    "target": "(C)",
    "arguments": [
      [
        "The following are multiple choice questions (with answers) about human sexuality.\n\nQ: Morning sickness is typically a problem:\n(A) during the first trimester (B) during the second trimester (C) during the third trimester (D) all through the pregnancy\nA:  (A)\n\nQ: The nature of homosexual activities that occur during preadolescence include all but which of the following?\n(A) sexual intercourse (B) circle jerks (C) exhibitionism (D) touching each other's genitals\nA:  (A)\n\nQ: A woman who knows she has active herpes and untreated syphilis but continues to have sex without informing her partners of her condition has, in psychoanalytic terms:\n(A) a strong ego (B) a weak superego (C) a weak id (D) a strong superego\nA:  (B)\n\nQ: The most common disorder among men who seek sexual therapy is:\n(A) premature ejaculation (B) inhibited ejaculation (C) erectile disorder (D) ejaculatory disorder\nA:  (C)\n\nQ: Women's ability to have multiple orgasms is primarily due to:\n(A) the fact that they do not have a refractory period. (B) the response of the inner layers of the vagina. (C) having alternating orgasms in different locations. (D) the G-Spot.\nA:  (A)\n\nQ: What are the three dimensions of intimacy in romantic relationships that outline closeness and sharing?\n(A) affective, trusting, and friendship (B) becoming emotional, caring, and physical (C) affective, cognitive, and physical (D) mutual self-disclosure, sexuality, and trusting\nA: ",
        {
          "until": [
            "</s>"
          ]
        }
      ]
    ],
    "resps": [
      [
        "(D)"
      ]
    ],
    "filtered_resps": [
      "(D)"
    ],
    "exact_match": 0.0
  },
  {
    "doc_id": 116,
    "doc": {
      "question": "Another term for sexual self-stimulation is:",
      "subject": "human_sexuality",
      "choices": [
        "masturbation",
        "autoeroticism",
        "self-eroticism",
        "a and b"
      ],
      "answer": 3
    },
    "target": "(D)",
    "arguments": [
      [
        "The following are multiple choice questions (with answers) about human sexuality.\n\nQ: Women's ability to have multiple orgasms is primarily due to:\n(A) the fact that they do not have a refractory period. (B) the response of the inner layers of the vagina. (C) having alternating orgasms in different locations. (D) the G-Spot.\nA:  (A)\n\nQ: A woman who knows she has active herpes and untreated syphilis but continues to have sex without informing her partners of her condition has, in psychoanalytic terms:\n(A) a strong ego (B) a weak superego (C) a weak id (D) a strong superego\nA:  (B)\n\nQ: The nature of homosexual activities that occur during preadolescence include all but which of the following?\n(A) sexual intercourse (B) circle jerks (C) exhibitionism (D) touching each other's genitals\nA:  (A)\n\nQ: Morning sickness is typically a problem:\n(A) during the first trimester (B) during the second trimester (C) during the third trimester (D) all through the pregnancy\nA:  (A)\n\nQ: The most common disorder among men who seek sexual therapy is:\n(A) premature ejaculation (B) inhibited ejaculation (C) erectile disorder (D) ejaculatory disorder\nA:  (C)\n\nQ: Another term for sexual self-stimulation is:\n(A) masturbation (B) autoeroticism (C) self-eroticism (D) a and b\nA: ",
        {
          "until": [
            "</s>"
          ]
        }
      ]
    ],
    "resps": [
      [
        "(B)"
      ]
    ],
    "filtered_resps": [
      "(B)"
    ],
    "exact_match": 0.0
  },
  {
    "doc_id": 124,
    "doc": {
      "question": "The refractory period occurs in males during the ______ stage.",
      "subject": "human_sexuality",
      "choices": [
        "resolution",
        "orgasm",
        "plateau",
        "excitement"
      ],
      "answer": 0
    },
    "target": "(A)",
    "arguments": [
      [
        "The following are multiple choice questions (with answers) about human sexuality.\n\nQ: Morning sickness is typically a problem:\n(A) during the first trimester (B) during the second trimester (C) during the third trimester (D) all through the pregnancy\nA:  (A)\n\nQ: The nature of homosexual activities that occur during preadolescence include all but which of the following?\n(A) sexual intercourse (B) circle jerks (C) exhibitionism (D) touching each other's genitals\nA:  (A)\n\nQ: A woman who knows she has active herpes and untreated syphilis but continues to have sex without informing her partners of her condition has, in psychoanalytic terms:\n(A) a strong ego (B) a weak superego (C) a weak id (D) a strong superego\nA:  (B)\n\nQ: Women's ability to have multiple orgasms is primarily due to:\n(A) the fact that they do not have a refractory period. (B) the response of the inner layers of the vagina. (C) having alternating orgasms in different locations. (D) the G-Spot.\nA:  (A)\n\nQ: The most common disorder among men who seek sexual therapy is:\n(A) premature ejaculation (B) inhibited ejaculation (C) erectile disorder (D) ejaculatory disorder\nA:  (C)\n\nQ: The refractory period occurs in males during the ______ stage.\n(A) resolution (B) orgasm (C) plateau (D) excitement\nA: ",
        {
          "until": [
            "</s>"
          ]
        }
      ]
    ],
    "resps": [
      [
        "(C)"
      ]
    ],
    "filtered_resps": [
      "(C)"
    ],
    "exact_match": 0.0
  },
  {
    "doc_id": 5,
    "doc": {
      "question": "According to a study by Sprecher, Barbee, and Schwartz (1995), women were more likely than men to have ________ following their first act of intercourse.",
      "subject": "human_sexuality",
      "choices": [
        "felt glad",
        "felt fear",
        "experienced guilt",
        "experienced regret"
      ],
      "answer": 2
    },
    "target": "(C)",
    "arguments": [
      [
        "The following are multiple choice questions (with answers) about human sexuality.\n\nQ: The nature of homosexual activities that occur during preadolescence include all but which of the following?\n(A) sexual intercourse (B) circle jerks (C) exhibitionism (D) touching each other's genitals\nA:  (A)\n\nQ: Morning sickness is typically a problem:\n(A) during the first trimester (B) during the second trimester (C) during the third trimester (D) all through the pregnancy\nA:  (A)\n\nQ: The most common disorder among men who seek sexual therapy is:\n(A) premature ejaculation (B) inhibited ejaculation (C) erectile disorder (D) ejaculatory disorder\nA:  (C)\n\nQ: Women's ability to have multiple orgasms is primarily due to:\n(A) the fact that they do not have a refractory period. (B) the response of the inner layers of the vagina. (C) having alternating orgasms in different locations. (D) the G-Spot.\nA:  (A)\n\nQ: A woman who knows she has active herpes and untreated syphilis but continues to have sex without informing her partners of her condition has, in psychoanalytic terms:\n(A) a strong ego (B) a weak superego (C) a weak id (D) a strong superego\nA:  (B)\n\nQ: According to a study by Sprecher, Barbee, and Schwartz (1995), women were more likely than men to have ________ following their first act of intercourse.\n(A) felt glad (B) felt fear (C) experienced guilt (D) experienced regret\nA: ",
        {
          "until": [
            "</s>"
          ]
        }
      ]
    ],
    "resps": [
      [
        "(D)"
      ]
    ],
    "filtered_resps": [
      "(D)"
    ],
    "exact_match": 0.0
  },
  {
    "doc_id": 13,
    "doc": {
      "question": "Orders of monks and nuns found both in Eastern religions and in Christianity who affirm celibacy, virginity, and poverty follow the ethical system of:",
      "subject": "human_sexuality",
      "choices": [
        "legalism",
        "asceticism",
        "situationism",
        "hedonism"
      ],
      "answer": 1
    },
    "target": "(B)",
    "arguments": [
      [
        "The following are multiple choice questions (with answers) about human sexuality.\n\nQ: Morning sickness is typically a problem:\n(A) during the first trimester (B) during the second trimester (C) during the third trimester (D) all through the pregnancy\nA:  (A)\n\nQ: The most common disorder among men who seek sexual therapy is:\n(A) premature ejaculation (B) inhibited ejaculation (C) erectile disorder (D) ejaculatory disorder\nA:  (C)\n\nQ: A woman who knows she has active herpes and untreated syphilis but continues to have sex without informing her partners of her condition has, in psychoanalytic terms:\n(A) a strong ego (B) a weak superego (C) a weak id (D) a strong superego\nA:  (B)\n\nQ: The nature of homosexual activities that occur during preadolescence include all but which of the following?\n(A) sexual intercourse (B) circle jerks (C) exhibitionism (D) touching each other's genitals\nA:  (A)\n\nQ: Women's ability to have multiple orgasms is primarily due to:\n(A) the fact that they do not have a refractory period. (B) the response of the inner layers of the vagina. (C) having alternating orgasms in different locations. (D) the G-Spot.\nA:  (A)\n\nQ: Orders of monks and nuns found both in Eastern religions and in Christianity who affirm celibacy, virginity, and poverty follow the ethical system of:\n(A) legalism (B) asceticism (C) situationism (D) hedonism\nA: ",
        {
          "until": [
            "</s>"
          ]
        }
      ]
    ],
    "resps": [
      [
        "(B)"
      ]
    ],
    "filtered_resps": [
      "(B)"
    ],
    "exact_match": 1.0
  },
  {
    "doc_id": 21,
    "doc": {
      "question": "The average male genital size is approximately",
      "subject": "human_sexuality",
      "choices": [
        "4 inches",
        "5 inches",
        "7 inches",
        "1 foot"
      ],
      "answer": 1
    },
    "target": "(B)",
    "arguments": [
      [
        "The following are multiple choice questions (with answers) about human sexuality.\n\nQ: Morning sickness is typically a problem:\n(A) during the first trimester (B) during the second trimester (C) during the third trimester (D) all through the pregnancy\nA:  (A)\n\nQ: The most common disorder among men who seek sexual therapy is:\n(A) premature ejaculation (B) inhibited ejaculation (C) erectile disorder (D) ejaculatory disorder\nA:  (C)\n\nQ: A woman who knows she has active herpes and untreated syphilis but continues to have sex without informing her partners of her condition has, in psychoanalytic terms:\n(A) a strong ego (B) a weak superego (C) a weak id (D) a strong superego\nA:  (B)\n\nQ: Women's ability to have multiple orgasms is primarily due to:\n(A) the fact that they do not have a refractory period. (B) the response of the inner layers of the vagina. (C) having alternating orgasms in different locations. (D) the G-Spot.\nA:  (A)\n\nQ: The nature of homosexual activities that occur during preadolescence include all but which of the following?\n(A) sexual intercourse (B) circle jerks (C) exhibitionism (D) touching each other's genitals\nA:  (A)\n\nQ: The average male genital size is approximately\n(A) 4 inches (B) 5 inches (C) 7 inches (D) 1 foot\nA: ",
        {
          "until": [
            "</s>"
          ]
        }
      ]
    ],
    "resps": [
      [
        "(B)"
      ]
    ],
    "filtered_resps": [
      "(B)"
    ],
    "exact_match": 1.0
  },
  {
    "doc_id": 29,
    "doc": {
      "question": "Buffy and Willow were discussing their sexual fantasies. Buffy revealed that she sometimes fantasizes about sex with other women even though she normally finds herself attracted to men. She also fantasizes about group sex. Which of the following statements can be inferred from Buffy's fantasies?",
      "subject": "human_sexuality",
      "choices": [
        "Buffy's fantasies suggest that she must be a latent homosexual or bisexual.",
        "Buffy's fantasies are indicative of a paraphilia.",
        "Buffy's fantasies indicate that she is not getting enough sex to keep her satisfied.",
        "Buffy's fantasies are fairly typical and tell us little about her sexual tendencies."
      ],
      "answer": 3
    },
    "target": "(D)",
    "arguments": [
      [
        "The following are multiple choice questions (with answers) about human sexuality.\n\nQ: A woman who knows she has active herpes and untreated syphilis but continues to have sex without informing her partners of her condition has, in psychoanalytic terms:\n(A) a strong ego (B) a weak superego (C) a weak id (D) a strong superego\nA:  (B)\n\nQ: Morning sickness is typically a problem:\n(A) during the first trimester (B) during the second trimester (C) during the third trimester (D) all through the pregnancy\nA:  (A)\n\nQ: The nature of homosexual activities that occur during preadolescence include all but which of the following?\n(A) sexual intercourse (B) circle jerks (C) exhibitionism (D) touching each other's genitals\nA:  (A)\n\nQ: Women's ability to have multiple orgasms is primarily due to:\n(A) the fact that they do not have a refractory period. (B) the response of the inner layers of the vagina. (C) having alternating orgasms in different locations. (D) the G-Spot.\nA:  (A)\n\nQ: The most common disorder among men who seek sexual therapy is:\n(A) premature ejaculation (B) inhibited ejaculation (C) erectile disorder (D) ejaculatory disorder\nA:  (C)\n\nQ: Buffy and Willow were discussing their sexual fantasies. Buffy revealed that she sometimes fantasizes about sex with other women even though she normally finds herself attracted to men. She also fantasizes about group sex. Which of the following statements can be inferred from Buffy's fantasies?\n(A) Buffy's fantasies suggest that she must be a latent homosexual or bisexual. (B) Buffy's fantasies are indicative of a paraphilia. (C) Buffy's fantasies indicate that she is not getting enough sex to keep her satisfied. (D) Buffy's fantasies are fairly typical and tell us little about her sexual tendencies.\nA: ",
        {
          "until": [
            "</s>"
          ]
        }
      ]
    ],
    "resps": [
      [
        "(B)"
      ]
    ],
    "filtered_resps": [
      "(B)"
    ],
    "exact_match": 0.0
  },
  {
    "doc_id": 37,
    "doc": {
      "question": "We are attracted to a person who is similar to us in attitudes because:",
      "subject": "human_sexuality",
      "choices": [
        "we get positive reinforcement from that person agreeing with us",
        "the other person's agreement bolsters our sense of rightness",
        "we anticipate positive interactions with that person",
        "all of the above"
      ],
      "answer": 3
    },
    "target": "(D)",
    "arguments": [
      [
        "The following are multiple choice questions (with answers) about human sexuality.\n\nQ: The most common disorder among men who seek sexual therapy is:\n(A) premature ejaculation (B) inhibited ejaculation (C) erectile disorder (D) ejaculatory disorder\nA:  (C)\n\nQ: The nature of homosexual activities that occur during preadolescence include all but which of the following?\n(A) sexual intercourse (B) circle jerks (C) exhibitionism (D) touching each other's genitals\nA:  (A)\n\nQ: Morning sickness is typically a problem:\n(A) during the first trimester (B) during the second trimester (C) during the third trimester (D) all through the pregnancy\nA:  (A)\n\nQ: Women's ability to have multiple orgasms is primarily due to:\n(A) the fact that they do not have a refractory period. (B) the response of the inner layers of the vagina. (C) having alternating orgasms in different locations. (D) the G-Spot.\nA:  (A)\n\nQ: A woman who knows she has active herpes and untreated syphilis but continues to have sex without informing her partners of her condition has, in psychoanalytic terms:\n(A) a strong ego (B) a weak superego (C) a weak id (D) a strong superego\nA:  (B)\n\nQ: We are attracted to a person who is similar to us in attitudes because:\n(A) we get positive reinforcement from that person agreeing with us (B) the other person's agreement bolsters our sense of rightness (C) we anticipate positive interactions with that person (D) all of the above\nA: ",
        {
          "until": [
            "</s>"
          ]
        }
      ]
    ],
    "resps": [
      [
        "(D)"
      ]
    ],
    "filtered_resps": [
      "(D)"
    ],
    "exact_match": 1.0
  },
  {
    "doc_id": 45,
    "doc": {
      "question": "Research on the effects of sexually explicit material using material that the viewer finds acceptable has shown that:",
      "subject": "human_sexuality",
      "choices": [
        "erotica has no effect on sexual behavior",
        "erotica may lead to increases in sexual arousal for men and women",
        "nonaggressive erotica leads to massive increases in aggressive behavior",
        "erotica decreases sexual arousal and sexual interest"
      ],
      "answer": 1
    },
    "target": "(B)",
    "arguments": [
      [
        "The following are multiple choice questions (with answers) about human sexuality.\n\nQ: Morning sickness is typically a problem:\n(A) during the first trimester (B) during the second trimester (C) during the third trimester (D) all through the pregnancy\nA:  (A)\n\nQ: The most common disorder among men who seek sexual therapy is:\n(A) premature ejaculation (B) inhibited ejaculation (C) erectile disorder (D) ejaculatory disorder\nA:  (C)\n\nQ: Women's ability to have multiple orgasms is primarily due to:\n(A) the fact that they do not have a refractory period. (B) the response of the inner layers of the vagina. (C) having alternating orgasms in different locations. (D) the G-Spot.\nA:  (A)\n\nQ: The nature of homosexual activities that occur during preadolescence include all but which of the following?\n(A) sexual intercourse (B) circle jerks (C) exhibitionism (D) touching each other's genitals\nA:  (A)\n\nQ: A woman who knows she has active herpes and untreated syphilis but continues to have sex without informing her partners of her condition has, in psychoanalytic terms:\n(A) a strong ego (B) a weak superego (C) a weak id (D) a strong superego\nA:  (B)\n\nQ: Research on the effects of sexually explicit material using material that the viewer finds acceptable has shown that:\n(A) erotica has no effect on sexual behavior (B) erotica may lead to increases in sexual arousal for men and women (C) nonaggressive erotica leads to massive increases in aggressive behavior (D) erotica decreases sexual arousal and sexual interest\nA: ",
        {
          "until": [
            "</s>"
          ]
        }
      ]
    ],
    "resps": [
      [
        "(B)"
      ]
    ],
    "filtered_resps": [
      "(B)"
    ],
    "exact_match": 1.0
  },
  {
    "doc_id": 53,
    "doc": {
      "question": "What sexual act is prohibited in most societies?",
      "subject": "human_sexuality",
      "choices": [
        "masturbation",
        "incest",
        "sex during menstruation",
        "sex with a non-spouse if the person is married."
      ],
      "answer": 1
    },
    "target": "(B)",
    "arguments": [
      [
        "The following are multiple choice questions (with answers) about human sexuality.\n\nQ: The most common disorder among men who seek sexual therapy is:\n(A) premature ejaculation (B) inhibited ejaculation (C) erectile disorder (D) ejaculatory disorder\nA:  (C)\n\nQ: Morning sickness is typically a problem:\n(A) during the first trimester (B) during the second trimester (C) during the third trimester (D) all through the pregnancy\nA:  (A)\n\nQ: Women's ability to have multiple orgasms is primarily due to:\n(A) the fact that they do not have a refractory period. (B) the response of the inner layers of the vagina. (C) having alternating orgasms in different locations. (D) the G-Spot.\nA:  (A)\n\nQ: A woman who knows she has active herpes and untreated syphilis but continues to have sex without informing her partners of her condition has, in psychoanalytic terms:\n(A) a strong ego (B) a weak superego (C) a weak id (D) a strong superego\nA:  (B)\n\nQ: The nature of homosexual activities that occur during preadolescence include all but which of the following?\n(A) sexual intercourse (B) circle jerks (C) exhibitionism (D) touching each other's genitals\nA:  (A)\n\nQ: What sexual act is prohibited in most societies?\n(A) masturbation (B) incest (C) sex during menstruation (D) sex with a non-spouse if the person is married.\nA: ",
        {
          "until": [
            "</s>"
          ]
        }
      ]
    ],
    "resps": [
      [
        "(A)"
      ]
    ],
    "filtered_resps": [
      "(A)"
    ],
    "exact_match": 0.0
  },
  {
    "doc_id": 61,
    "doc": {
      "question": "Castration in adulthood",
      "subject": "human_sexuality",
      "choices": [
        "will produce a high voice because of decreased testosterone production.",
        "will produce a high voice because of the pain that accompanies the procedure.",
        "will not produce a high voice because the larynx has already grown.",
        "will not produce a high voice because castration does not affect testosterone production."
      ],
      "answer": 2
    },
    "target": "(C)",
    "arguments": [
      [
        "The following are multiple choice questions (with answers) about human sexuality.\n\nQ: Women's ability to have multiple orgasms is primarily due to:\n(A) the fact that they do not have a refractory period. (B) the response of the inner layers of the vagina. (C) having alternating orgasms in different locations. (D) the G-Spot.\nA:  (A)\n\nQ: The most common disorder among men who seek sexual therapy is:\n(A) premature ejaculation (B) inhibited ejaculation (C) erectile disorder (D) ejaculatory disorder\nA:  (C)\n\nQ: Morning sickness is typically a problem:\n(A) during the first trimester (B) during the second trimester (C) during the third trimester (D) all through the pregnancy\nA:  (A)\n\nQ: The nature of homosexual activities that occur during preadolescence include all but which of the following?\n(A) sexual intercourse (B) circle jerks (C) exhibitionism (D) touching each other's genitals\nA:  (A)\n\nQ: A woman who knows she has active herpes and untreated syphilis but continues to have sex without informing her partners of her condition has, in psychoanalytic terms:\n(A) a strong ego (B) a weak superego (C) a weak id (D) a strong superego\nA:  (B)\n\nQ: Castration in adulthood\n(A) will produce a high voice because of decreased testosterone production. (B) will produce a high voice because of the pain that accompanies the procedure. (C) will not produce a high voice because the larynx has already grown. (D) will not produce a high voice because castration does not affect testosterone production.\nA: ",
        {
          "until": [
            "</s>"
          ]
        }
      ]
    ],
    "resps": [
      [
        "(A)"
      ]
    ],
    "filtered_resps": [
      "(A)"
    ],
    "exact_match": 0.0
  },
  {
    "doc_id": 69,
    "doc": {
      "question": "Menstrual cramps may be caused, in part, by:",
      "subject": "human_sexuality",
      "choices": [
        "low levels of prostaglandin",
        "an increased oxygen supply to the uterus",
        "highly sensitive nerve endings",
        "frequent masturbation"
      ],
      "answer": 0
    },
    "target": "(A)",
    "arguments": [
      [
        "The following are multiple choice questions (with answers) about human sexuality.\n\nQ: The most common disorder among men who seek sexual therapy is:\n(A) premature ejaculation (B) inhibited ejaculation (C) erectile disorder (D) ejaculatory disorder\nA:  (C)\n\nQ: Morning sickness is typically a problem:\n(A) during the first trimester (B) during the second trimester (C) during the third trimester (D) all through the pregnancy\nA:  (A)\n\nQ: Women's ability to have multiple orgasms is primarily due to:\n(A) the fact that they do not have a refractory period. (B) the response of the inner layers of the vagina. (C) having alternating orgasms in different locations. (D) the G-Spot.\nA:  (A)\n\nQ: The nature of homosexual activities that occur during preadolescence include all but which of the following?\n(A) sexual intercourse (B) circle jerks (C) exhibitionism (D) touching each other's genitals\nA:  (A)\n\nQ: A woman who knows she has active herpes and untreated syphilis but continues to have sex without informing her partners of her condition has, in psychoanalytic terms:\n(A) a strong ego (B) a weak superego (C) a weak id (D) a strong superego\nA:  (B)\n\nQ: Menstrual cramps may be caused, in part, by:\n(A) low levels of prostaglandin (B) an increased oxygen supply to the uterus (C) highly sensitive nerve endings (D) frequent masturbation\nA: ",
        {
          "until": [
            "</s>"
          ]
        }
      ]
    ],
    "resps": [
      [
        "(A)"
      ]
    ],
    "filtered_resps": [
      "(A)"
    ],
    "exact_match": 1.0
  },
  {
    "doc_id": 77,
    "doc": {
      "question": "Mini-pills contain:",
      "subject": "human_sexuality",
      "choices": [
        "estrogen only",
        "progestin only",
        "synthetic androgens and estrogen",
        "synthetic estrogen"
      ],
      "answer": 1
    },
    "target": "(B)",
    "arguments": [
      [
        "The following are multiple choice questions (with answers) about human sexuality.\n\nQ: Women's ability to have multiple orgasms is primarily due to:\n(A) the fact that they do not have a refractory period. (B) the response of the inner layers of the vagina. (C) having alternating orgasms in different locations. (D) the G-Spot.\nA:  (A)\n\nQ: A woman who knows she has active herpes and untreated syphilis but continues to have sex without informing her partners of her condition has, in psychoanalytic terms:\n(A) a strong ego (B) a weak superego (C) a weak id (D) a strong superego\nA:  (B)\n\nQ: The most common disorder among men who seek sexual therapy is:\n(A) premature ejaculation (B) inhibited ejaculation (C) erectile disorder (D) ejaculatory disorder\nA:  (C)\n\nQ: The nature of homosexual activities that occur during preadolescence include all but which of the following?\n(A) sexual intercourse (B) circle jerks (C) exhibitionism (D) touching each other's genitals\nA:  (A)\n\nQ: Morning sickness is typically a problem:\n(A) during the first trimester (B) during the second trimester (C) during the third trimester (D) all through the pregnancy\nA:  (A)\n\nQ: Mini-pills contain:\n(A) estrogen only (B) progestin only (C) synthetic androgens and estrogen (D) synthetic estrogen\nA: ",
        {
          "until": [
            "</s>"
          ]
        }
      ]
    ],
    "resps": [
      [
        "(D)"
      ]
    ],
    "filtered_resps": [
      "(D)"
    ],
    "exact_match": 0.0
  },
  {
    "doc_id": 85,
    "doc": {
      "question": "Erection in the male and vaginal lubrication in the female mark the __________ stage of sexual response.",
      "subject": "human_sexuality",
      "choices": [
        "excitement",
        "resolution",
        "plateau",
        "orgasm"
      ],
      "answer": 0
    },
    "target": "(A)",
    "arguments": [
      [
        "The following are multiple choice questions (with answers) about human sexuality.\n\nQ: A woman who knows she has active herpes and untreated syphilis but continues to have sex without informing her partners of her condition has, in psychoanalytic terms:\n(A) a strong ego (B) a weak superego (C) a weak id (D) a strong superego\nA:  (B)\n\nQ: Morning sickness is typically a problem:\n(A) during the first trimester (B) during the second trimester (C) during the third trimester (D) all through the pregnancy\nA:  (A)\n\nQ: The nature of homosexual activities that occur during preadolescence include all but which of the following?\n(A) sexual intercourse (B) circle jerks (C) exhibitionism (D) touching each other's genitals\nA:  (A)\n\nQ: The most common disorder among men who seek sexual therapy is:\n(A) premature ejaculation (B) inhibited ejaculation (C) erectile disorder (D) ejaculatory disorder\nA:  (C)\n\nQ: Women's ability to have multiple orgasms is primarily due to:\n(A) the fact that they do not have a refractory period. (B) the response of the inner layers of the vagina. (C) having alternating orgasms in different locations. (D) the G-Spot.\nA:  (A)\n\nQ: Erection in the male and vaginal lubrication in the female mark the __________ stage of sexual response.\n(A) excitement (B) resolution (C) plateau (D) orgasm\nA: ",
        {
          "until": [
            "</s>"
          ]
        }
      ]
    ],
    "resps": [
      [
        "(D)"
      ]
    ],
    "filtered_resps": [
      "(D)"
    ],
    "exact_match": 0.0
  },
  {
    "doc_id": 93,
    "doc": {
      "question": "JD Unwin's book _Sex and Culture_ argues what two things are linked?",
      "subject": "human_sexuality",
      "choices": [
        "homosexuality in sons with distant fathers",
        "sexual abuse and Christianity",
        "civilizational collapse and promiscuity",
        "anthropology and evolution"
      ],
      "answer": 2
    },
    "target": "(C)",
    "arguments": [
      [
        "The following are multiple choice questions (with answers) about human sexuality.\n\nQ: Morning sickness is typically a problem:\n(A) during the first trimester (B) during the second trimester (C) during the third trimester (D) all through the pregnancy\nA:  (A)\n\nQ: A woman who knows she has active herpes and untreated syphilis but continues to have sex without informing her partners of her condition has, in psychoanalytic terms:\n(A) a strong ego (B) a weak superego (C) a weak id (D) a strong superego\nA:  (B)\n\nQ: The most common disorder among men who seek sexual therapy is:\n(A) premature ejaculation (B) inhibited ejaculation (C) erectile disorder (D) ejaculatory disorder\nA:  (C)\n\nQ: Women's ability to have multiple orgasms is primarily due to:\n(A) the fact that they do not have a refractory period. (B) the response of the inner layers of the vagina. (C) having alternating orgasms in different locations. (D) the G-Spot.\nA:  (A)\n\nQ: The nature of homosexual activities that occur during preadolescence include all but which of the following?\n(A) sexual intercourse (B) circle jerks (C) exhibitionism (D) touching each other's genitals\nA:  (A)\n\nQ: JD Unwin's book _Sex and Culture_ argues what two things are linked?\n(A) homosexuality in sons with distant fathers (B) sexual abuse and Christianity (C) civilizational collapse and promiscuity (D) anthropology and evolution\nA: ",
        {
          "until": [
            "</s>"
          ]
        }
      ]
    ],
    "resps": [
      [
        "(B)"
      ]
    ],
    "filtered_resps": [
      "(B)"
    ],
    "exact_match": 0.0
  },
  {
    "doc_id": 101,
    "doc": {
      "question": "Which of the following events INITIATES puberty?",
      "subject": "human_sexuality",
      "choices": [
        "pituitary gland releases FSH",
        "pituitary gland releases growth hormone",
        "hypothalamus releases GNRS",
        "hypothalamus releases LH"
      ],
      "answer": 2
    },
    "target": "(C)",
    "arguments": [
      [
        "The following are multiple choice questions (with answers) about human sexuality.\n\nQ: Morning sickness is typically a problem:\n(A) during the first trimester (B) during the second trimester (C) during the third trimester (D) all through the pregnancy\nA:  (A)\n\nQ: A woman who knows she has active herpes and untreated syphilis but continues to have sex without informing her partners of her condition has, in psychoanalytic terms:\n(A) a strong ego (B) a weak superego (C) a weak id (D) a strong superego\nA:  (B)\n\nQ: Women's ability to have multiple orgasms is primarily due to:\n(A) the fact that they do not have a refractory period. (B) the response of the inner layers of the vagina. (C) having alternating orgasms in different locations. (D) the G-Spot.\nA:  (A)\n\nQ: The nature of homosexual activities that occur during preadolescence include all but which of the following?\n(A) sexual intercourse (B) circle jerks (C) exhibitionism (D) touching each other's genitals\nA:  (A)\n\nQ: The most common disorder among men who seek sexual therapy is:\n(A) premature ejaculation (B) inhibited ejaculation (C) erectile disorder (D) ejaculatory disorder\nA:  (C)\n\nQ: Which of the following events INITIATES puberty?\n(A) pituitary gland releases FSH (B) pituitary gland releases growth hormone (C) hypothalamus releases GNRS (D) hypothalamus releases LH\nA: ",
        {
          "until": [
            "</s>"
          ]
        }
      ]
    ],
    "resps": [
      [
        "(B)"
      ]
    ],
    "filtered_resps": [
      "(B)"
    ],
    "exact_match": 0.0
  },
  {
    "doc_id": 109,
    "doc": {
      "question": "Mike and Carol have been married for 5 years. Recently Mike has found that although he wants to have sex with Carol he has trouble getting aroused. However he does not have trouble getting aroused when he sees his secretary at work. Which of the following describe(s) Mike's dysfunction?",
      "subject": "human_sexuality",
      "choices": [
        "Mike suffers from a global dysfunction.",
        "Mike suffers from erectile dysfunction.",
        "Mike suffers from lubrication inhibition.",
        "Mike must be having an affair with his secretary."
      ],
      "answer": 1
    },
    "target": "(B)",
    "arguments": [
      [
        "The following are multiple choice questions (with answers) about human sexuality.\n\nQ: Morning sickness is typically a problem:\n(A) during the first trimester (B) during the second trimester (C) during the third trimester (D) all through the pregnancy\nA:  (A)\n\nQ: The nature of homosexual activities that occur during preadolescence include all but which of the following?\n(A) sexual intercourse (B) circle jerks (C) exhibitionism (D) touching each other's genitals\nA:  (A)\n\nQ: A woman who knows she has active herpes and untreated syphilis but continues to have sex without informing her partners of her condition has, in psychoanalytic terms:\n(A) a strong ego (B) a weak superego (C) a weak id (D) a strong superego\nA:  (B)\n\nQ: The most common disorder among men who seek sexual therapy is:\n(A) premature ejaculation (B) inhibited ejaculation (C) erectile disorder (D) ejaculatory disorder\nA:  (C)\n\nQ: Women's ability to have multiple orgasms is primarily due to:\n(A) the fact that they do not have a refractory period. (B) the response of the inner layers of the vagina. (C) having alternating orgasms in different locations. (D) the G-Spot.\nA:  (A)\n\nQ: Mike and Carol have been married for 5 years. Recently Mike has found that although he wants to have sex with Carol he has trouble getting aroused. However he does not have trouble getting aroused when he sees his secretary at work. Which of the following describe(s) Mike's dysfunction?\n(A) Mike suffers from a global dysfunction. (B) Mike suffers from erectile dysfunction. (C) Mike suffers from lubrication inhibition. (D) Mike must be having an affair with his secretary.\nA: ",
        {
          "until": [
            "</s>"
          ]
        }
      ]
    ],
    "resps": [
      [
        "(B)"
      ]
    ],
    "filtered_resps": [
      "(B)"
    ],
    "exact_match": 1.0
  },
  {
    "doc_id": 117,
    "doc": {
      "question": "You have been asked to write a response paper to LeVay's research on brain differences between heterosexuals and homosexuals. Which are plausible criticisms of LeVay's work?",
      "subject": "human_sexuality",
      "choices": [
        "Sample size was relatively small.",
        "Gay and straight groups were not equivalent in terms of the number of deaths due to AIDS.",
        "Lesbians were omitted from the study.",
        "all of the above"
      ],
      "answer": 3
    },
    "target": "(D)",
    "arguments": [
      [
        "The following are multiple choice questions (with answers) about human sexuality.\n\nQ: Women's ability to have multiple orgasms is primarily due to:\n(A) the fact that they do not have a refractory period. (B) the response of the inner layers of the vagina. (C) having alternating orgasms in different locations. (D) the G-Spot.\nA:  (A)\n\nQ: A woman who knows she has active herpes and untreated syphilis but continues to have sex without informing her partners of her condition has, in psychoanalytic terms:\n(A) a strong ego (B) a weak superego (C) a weak id (D) a strong superego\nA:  (B)\n\nQ: The nature of homosexual activities that occur during preadolescence include all but which of the following?\n(A) sexual intercourse (B) circle jerks (C) exhibitionism (D) touching each other's genitals\nA:  (A)\n\nQ: Morning sickness is typically a problem:\n(A) during the first trimester (B) during the second trimester (C) during the third trimester (D) all through the pregnancy\nA:  (A)\n\nQ: The most common disorder among men who seek sexual therapy is:\n(A) premature ejaculation (B) inhibited ejaculation (C) erectile disorder (D) ejaculatory disorder\nA:  (C)\n\nQ: You have been asked to write a response paper to LeVay's research on brain differences between heterosexuals and homosexuals. Which are plausible criticisms of LeVay's work?\n(A) Sample size was relatively small. (B) Gay and straight groups were not equivalent in terms of the number of deaths due to AIDS. (C) Lesbians were omitted from the study. (D) all of the above\nA: ",
        {
          "until": [
            "</s>"
          ]
        }
      ]
    ],
    "resps": [
      [
        "(D)"
      ]
    ],
    "filtered_resps": [
      "(D)"
    ],
    "exact_match": 1.0
  },
  {
    "doc_id": 125,
    "doc": {
      "question": "The zona pellucida is...",
      "subject": "human_sexuality",
      "choices": [
        "...a protective layer surrounding the egg",
        "...the fertilized egg",
        "...an enzyme secreted by sperm to break down the protective coating on the egg.",
        "...the area where sperm collect before attempting to fertilize the egg."
      ],
      "answer": 0
    },
    "target": "(A)",
    "arguments": [
      [
        "The following are multiple choice questions (with answers) about human sexuality.\n\nQ: Morning sickness is typically a problem:\n(A) during the first trimester (B) during the second trimester (C) during the third trimester (D) all through the pregnancy\nA:  (A)\n\nQ: The nature of homosexual activities that occur during preadolescence include all but which of the following?\n(A) sexual intercourse (B) circle jerks (C) exhibitionism (D) touching each other's genitals\nA:  (A)\n\nQ: A woman who knows she has active herpes and untreated syphilis but continues to have sex without informing her partners of her condition has, in psychoanalytic terms:\n(A) a strong ego (B) a weak superego (C) a weak id (D) a strong superego\nA:  (B)\n\nQ: Women's ability to have multiple orgasms is primarily due to:\n(A) the fact that they do not have a refractory period. (B) the response of the inner layers of the vagina. (C) having alternating orgasms in different locations. (D) the G-Spot.\nA:  (A)\n\nQ: The most common disorder among men who seek sexual therapy is:\n(A) premature ejaculation (B) inhibited ejaculation (C) erectile disorder (D) ejaculatory disorder\nA:  (C)\n\nQ: The zona pellucida is...\n(A) ...a protective layer surrounding the egg (B) ...the fertilized egg (C) ...an enzyme secreted by sperm to break down the protective coating on the egg. (D) ...the area where sperm collect before attempting to fertilize the egg.\nA: ",
        {
          "until": [
            "</s>"
          ]
        }
      ]
    ],
    "resps": [
      [
        "(A)"
      ]
    ],
    "filtered_resps": [
      "(A)"
    ],
    "exact_match": 1.0
  },
  {
    "doc_id": 6,
    "doc": {
      "question": "What is cocaine abuse during pregnancy related to?",
      "subject": "human_sexuality",
      "choices": [
        "an increased risk of low birth weight babies",
        "poorer growth and lower intelligence",
        "smaller head circumference",
        "all of the above"
      ],
      "answer": 3
    },
    "target": "(D)",
    "arguments": [
      [
        "The following are multiple choice questions (with answers) about human sexuality.\n\nQ: The nature of homosexual activities that occur during preadolescence include all but which of the following?\n(A) sexual intercourse (B) circle jerks (C) exhibitionism (D) touching each other's genitals\nA:  (A)\n\nQ: Morning sickness is typically a problem:\n(A) during the first trimester (B) during the second trimester (C) during the third trimester (D) all through the pregnancy\nA:  (A)\n\nQ: The most common disorder among men who seek sexual therapy is:\n(A) premature ejaculation (B) inhibited ejaculation (C) erectile disorder (D) ejaculatory disorder\nA:  (C)\n\nQ: Women's ability to have multiple orgasms is primarily due to:\n(A) the fact that they do not have a refractory period. (B) the response of the inner layers of the vagina. (C) having alternating orgasms in different locations. (D) the G-Spot.\nA:  (A)\n\nQ: A woman who knows she has active herpes and untreated syphilis but continues to have sex without informing her partners of her condition has, in psychoanalytic terms:\n(A) a strong ego (B) a weak superego (C) a weak id (D) a strong superego\nA:  (B)\n\nQ: What is cocaine abuse during pregnancy related to?\n(A) an increased risk of low birth weight babies (B) poorer growth and lower intelligence (C) smaller head circumference (D) all of the above\nA: ",
        {
          "until": [
            "</s>"
          ]
        }
      ]
    ],
    "resps": [
      [
        "(D)"
      ]
    ],
    "filtered_resps": [
      "(D)"
    ],
    "exact_match": 1.0
  },
  {
    "doc_id": 14,
    "doc": {
      "question": "Ovaries and testes",
      "subject": "human_sexuality",
      "choices": [
        "are homologous",
        "produce gametes",
        "produce sex hormones",
        "all of the above"
      ],
      "answer": 3
    },
    "target": "(D)",
    "arguments": [
      [
        "The following are multiple choice questions (with answers) about human sexuality.\n\nQ: Morning sickness is typically a problem:\n(A) during the first trimester (B) during the second trimester (C) during the third trimester (D) all through the pregnancy\nA:  (A)\n\nQ: The most common disorder among men who seek sexual therapy is:\n(A) premature ejaculation (B) inhibited ejaculation (C) erectile disorder (D) ejaculatory disorder\nA:  (C)\n\nQ: A woman who knows she has active herpes and untreated syphilis but continues to have sex without informing her partners of her condition has, in psychoanalytic terms:\n(A) a strong ego (B) a weak superego (C) a weak id (D) a strong superego\nA:  (B)\n\nQ: The nature of homosexual activities that occur during preadolescence include all but which of the following?\n(A) sexual intercourse (B) circle jerks (C) exhibitionism (D) touching each other's genitals\nA:  (A)\n\nQ: Women's ability to have multiple orgasms is primarily due to:\n(A) the fact that they do not have a refractory period. (B) the response of the inner layers of the vagina. (C) having alternating orgasms in different locations. (D) the G-Spot.\nA:  (A)\n\nQ: Ovaries and testes\n(A) are homologous (B) produce gametes (C) produce sex hormones (D) all of the above\nA: ",
        {
          "until": [
            "</s>"
          ]
        }
      ]
    ],
    "resps": [
      [
        "(D)"
      ]
    ],
    "filtered_resps": [
      "(D)"
    ],
    "exact_match": 1.0
  },
  {
    "doc_id": 22,
    "doc": {
      "question": "People who cannot reach orgasm without touching a woman's shoe would certainly be considered sexually abnormal or deviant by which of the following definitions?",
      "subject": "human_sexuality",
      "choices": [
        "psychological",
        "sociological",
        "statistical",
        "b and c"
      ],
      "answer": 3
    },
    "target": "(D)",
    "arguments": [
      [
        "The following are multiple choice questions (with answers) about human sexuality.\n\nQ: Morning sickness is typically a problem:\n(A) during the first trimester (B) during the second trimester (C) during the third trimester (D) all through the pregnancy\nA:  (A)\n\nQ: The most common disorder among men who seek sexual therapy is:\n(A) premature ejaculation (B) inhibited ejaculation (C) erectile disorder (D) ejaculatory disorder\nA:  (C)\n\nQ: A woman who knows she has active herpes and untreated syphilis but continues to have sex without informing her partners of her condition has, in psychoanalytic terms:\n(A) a strong ego (B) a weak superego (C) a weak id (D) a strong superego\nA:  (B)\n\nQ: Women's ability to have multiple orgasms is primarily due to:\n(A) the fact that they do not have a refractory period. (B) the response of the inner layers of the vagina. (C) having alternating orgasms in different locations. (D) the G-Spot.\nA:  (A)\n\nQ: The nature of homosexual activities that occur during preadolescence include all but which of the following?\n(A) sexual intercourse (B) circle jerks (C) exhibitionism (D) touching each other's genitals\nA:  (A)\n\nQ: People who cannot reach orgasm without touching a woman's shoe would certainly be considered sexually abnormal or deviant by which of the following definitions?\n(A) psychological (B) sociological (C) statistical (D) b and c\nA: ",
        {
          "until": [
            "</s>"
          ]
        }
      ]
    ],
    "resps": [
      [
        "(D)"
      ]
    ],
    "filtered_resps": [
      "(D)"
    ],
    "exact_match": 1.0
  },
  {
    "doc_id": 30,
    "doc": {
      "question": "The environment for sperm passage is most hospitable just at",
      "subject": "human_sexuality",
      "choices": [
        "preovulation",
        "proliferation",
        "ovulation",
        "menstruation"
      ],
      "answer": 2
    },
    "target": "(C)",
    "arguments": [
      [
        "The following are multiple choice questions (with answers) about human sexuality.\n\nQ: A woman who knows she has active herpes and untreated syphilis but continues to have sex without informing her partners of her condition has, in psychoanalytic terms:\n(A) a strong ego (B) a weak superego (C) a weak id (D) a strong superego\nA:  (B)\n\nQ: Morning sickness is typically a problem:\n(A) during the first trimester (B) during the second trimester (C) during the third trimester (D) all through the pregnancy\nA:  (A)\n\nQ: The nature of homosexual activities that occur during preadolescence include all but which of the following?\n(A) sexual intercourse (B) circle jerks (C) exhibitionism (D) touching each other's genitals\nA:  (A)\n\nQ: Women's ability to have multiple orgasms is primarily due to:\n(A) the fact that they do not have a refractory period. (B) the response of the inner layers of the vagina. (C) having alternating orgasms in different locations. (D) the G-Spot.\nA:  (A)\n\nQ: The most common disorder among men who seek sexual therapy is:\n(A) premature ejaculation (B) inhibited ejaculation (C) erectile disorder (D) ejaculatory disorder\nA:  (C)\n\nQ: The environment for sperm passage is most hospitable just at\n(A) preovulation (B) proliferation (C) ovulation (D) menstruation\nA: ",
        {
          "until": [
            "</s>"
          ]
        }
      ]
    ],
    "resps": [
      [
        "(D)"
      ]
    ],
    "filtered_resps": [
      "(D)"
    ],
    "exact_match": 0.0
  },
  {
    "doc_id": 38,
    "doc": {
      "question": "According to the Ethnocultural Communities Facing AIDS study, single _________ men are more likely than single _________ to report having had more than one sexual partner in the previous year.",
      "subject": "human_sexuality",
      "choices": [
        "Chinese; North African Muslim",
        "South Asian; English-speaking Caribbean",
        "South Asian; Chinese",
        "North African Muslim; Latin American"
      ],
      "answer": 1
    },
    "target": "(B)",
    "arguments": [
      [
        "The following are multiple choice questions (with answers) about human sexuality.\n\nQ: The most common disorder among men who seek sexual therapy is:\n(A) premature ejaculation (B) inhibited ejaculation (C) erectile disorder (D) ejaculatory disorder\nA:  (C)\n\nQ: The nature of homosexual activities that occur during preadolescence include all but which of the following?\n(A) sexual intercourse (B) circle jerks (C) exhibitionism (D) touching each other's genitals\nA:  (A)\n\nQ: Morning sickness is typically a problem:\n(A) during the first trimester (B) during the second trimester (C) during the third trimester (D) all through the pregnancy\nA:  (A)\n\nQ: Women's ability to have multiple orgasms is primarily due to:\n(A) the fact that they do not have a refractory period. (B) the response of the inner layers of the vagina. (C) having alternating orgasms in different locations. (D) the G-Spot.\nA:  (A)\n\nQ: A woman who knows she has active herpes and untreated syphilis but continues to have sex without informing her partners of her condition has, in psychoanalytic terms:\n(A) a strong ego (B) a weak superego (C) a weak id (D) a strong superego\nA:  (B)\n\nQ: According to the Ethnocultural Communities Facing AIDS study, single _________ men are more likely than single _________ to report having had more than one sexual partner in the previous year.\n(A) Chinese; North African Muslim (B) South Asian; English-speaking Caribbean (C) South Asian; Chinese (D) North African Muslim; Latin American\nA: ",
        {
          "until": [
            "</s>"
          ]
        }
      ]
    ],
    "resps": [
      [
        "(D)"
      ]
    ],
    "filtered_resps": [
      "(D)"
    ],
    "exact_match": 0.0
  },
  {
    "doc_id": 46,
    "doc": {
      "question": "Fetishism typically develops at the age of:",
      "subject": "human_sexuality",
      "choices": [
        "30 through 50",
        "at birth",
        "10 through 20",
        "20 through 30"
      ],
      "answer": 2
    },
    "target": "(C)",
    "arguments": [
      [
        "The following are multiple choice questions (with answers) about human sexuality.\n\nQ: Morning sickness is typically a problem:\n(A) during the first trimester (B) during the second trimester (C) during the third trimester (D) all through the pregnancy\nA:  (A)\n\nQ: The most common disorder among men who seek sexual therapy is:\n(A) premature ejaculation (B) inhibited ejaculation (C) erectile disorder (D) ejaculatory disorder\nA:  (C)\n\nQ: Women's ability to have multiple orgasms is primarily due to:\n(A) the fact that they do not have a refractory period. (B) the response of the inner layers of the vagina. (C) having alternating orgasms in different locations. (D) the G-Spot.\nA:  (A)\n\nQ: The nature of homosexual activities that occur during preadolescence include all but which of the following?\n(A) sexual intercourse (B) circle jerks (C) exhibitionism (D) touching each other's genitals\nA:  (A)\n\nQ: A woman who knows she has active herpes and untreated syphilis but continues to have sex without informing her partners of her condition has, in psychoanalytic terms:\n(A) a strong ego (B) a weak superego (C) a weak id (D) a strong superego\nA:  (B)\n\nQ: Fetishism typically develops at the age of:\n(A) 30 through 50 (B) at birth (C) 10 through 20 (D) 20 through 30\nA: ",
        {
          "until": [
            "</s>"
          ]
        }
      ]
    ],
    "resps": [
      [
        "(A)"
      ]
    ],
    "filtered_resps": [
      "(A)"
    ],
    "exact_match": 0.0
  },
  {
    "doc_id": 54,
    "doc": {
      "question": "Which of the following is removed when a male is circumcised?",
      "subject": "human_sexuality",
      "choices": [
        "sunna",
        "corpus spongiosum",
        "septum",
        "prepuce"
      ],
      "answer": 3
    },
    "target": "(D)",
    "arguments": [
      [
        "The following are multiple choice questions (with answers) about human sexuality.\n\nQ: The most common disorder among men who seek sexual therapy is:\n(A) premature ejaculation (B) inhibited ejaculation (C) erectile disorder (D) ejaculatory disorder\nA:  (C)\n\nQ: Morning sickness is typically a problem:\n(A) during the first trimester (B) during the second trimester (C) during the third trimester (D) all through the pregnancy\nA:  (A)\n\nQ: Women's ability to have multiple orgasms is primarily due to:\n(A) the fact that they do not have a refractory period. (B) the response of the inner layers of the vagina. (C) having alternating orgasms in different locations. (D) the G-Spot.\nA:  (A)\n\nQ: A woman who knows she has active herpes and untreated syphilis but continues to have sex without informing her partners of her condition has, in psychoanalytic terms:\n(A) a strong ego (B) a weak superego (C) a weak id (D) a strong superego\nA:  (B)\n\nQ: The nature of homosexual activities that occur during preadolescence include all but which of the following?\n(A) sexual intercourse (B) circle jerks (C) exhibitionism (D) touching each other's genitals\nA:  (A)\n\nQ: Which of the following is removed when a male is circumcised?\n(A) sunna (B) corpus spongiosum (C) septum (D) prepuce\nA: ",
        {
          "until": [
            "</s>"
          ]
        }
      ]
    ],
    "resps": [
      [
        "(C)"
      ]
    ],
    "filtered_resps": [
      "(C)"
    ],
    "exact_match": 0.0
  },
  {
    "doc_id": 62,
    "doc": {
      "question": "Xena has been able to conceive but has repeatedly miscarried early in her pregnancies. Which of the following would be her best option for having a child?",
      "subject": "human_sexuality",
      "choices": [
        "artificial insemination",
        "in vitro fertilization",
        "zygote intra-fallopian transfer",
        "embryo transfer"
      ],
      "answer": 3
    },
    "target": "(D)",
    "arguments": [
      [
        "The following are multiple choice questions (with answers) about human sexuality.\n\nQ: Women's ability to have multiple orgasms is primarily due to:\n(A) the fact that they do not have a refractory period. (B) the response of the inner layers of the vagina. (C) having alternating orgasms in different locations. (D) the G-Spot.\nA:  (A)\n\nQ: The most common disorder among men who seek sexual therapy is:\n(A) premature ejaculation (B) inhibited ejaculation (C) erectile disorder (D) ejaculatory disorder\nA:  (C)\n\nQ: Morning sickness is typically a problem:\n(A) during the first trimester (B) during the second trimester (C) during the third trimester (D) all through the pregnancy\nA:  (A)\n\nQ: The nature of homosexual activities that occur during preadolescence include all but which of the following?\n(A) sexual intercourse (B) circle jerks (C) exhibitionism (D) touching each other's genitals\nA:  (A)\n\nQ: A woman who knows she has active herpes and untreated syphilis but continues to have sex without informing her partners of her condition has, in psychoanalytic terms:\n(A) a strong ego (B) a weak superego (C) a weak id (D) a strong superego\nA:  (B)\n\nQ: Xena has been able to conceive but has repeatedly miscarried early in her pregnancies. Which of the following would be her best option for having a child?\n(A) artificial insemination (B) in vitro fertilization (C) zygote intra-fallopian transfer (D) embryo transfer\nA: ",
        {
          "until": [
            "</s>"
          ]
        }
      ]
    ],
    "resps": [
      [
        "(B)"
      ]
    ],
    "filtered_resps": [
      "(B)"
    ],
    "exact_match": 0.0
  },
  {
    "doc_id": 70,
    "doc": {
      "question": "Avalon had a wild time during spring break. Unfortunately the guy she hooked up with in Palm Beach had genital herpes. Which of the following is true about genital herpes?",
      "subject": "human_sexuality",
      "choices": [
        "Avalon could not contract genital herpes from performing fellatio (oral-genital sex) on the guy.",
        "If Avalon contracted genital herpes she can be cured with antibiotics if administered immediately after the first occurrence.",
        "If Avalon contracted genital herpes she will only be contagious when she has a break out.",
        "none of the above"
      ],
      "answer": 3
    },
    "target": "(D)",
    "arguments": [
      [
        "The following are multiple choice questions (with answers) about human sexuality.\n\nQ: The most common disorder among men who seek sexual therapy is:\n(A) premature ejaculation (B) inhibited ejaculation (C) erectile disorder (D) ejaculatory disorder\nA:  (C)\n\nQ: Morning sickness is typically a problem:\n(A) during the first trimester (B) during the second trimester (C) during the third trimester (D) all through the pregnancy\nA:  (A)\n\nQ: Women's ability to have multiple orgasms is primarily due to:\n(A) the fact that they do not have a refractory period. (B) the response of the inner layers of the vagina. (C) having alternating orgasms in different locations. (D) the G-Spot.\nA:  (A)\n\nQ: The nature of homosexual activities that occur during preadolescence include all but which of the following?\n(A) sexual intercourse (B) circle jerks (C) exhibitionism (D) touching each other's genitals\nA:  (A)\n\nQ: A woman who knows she has active herpes and untreated syphilis but continues to have sex without informing her partners of her condition has, in psychoanalytic terms:\n(A) a strong ego (B) a weak superego (C) a weak id (D) a strong superego\nA:  (B)\n\nQ: Avalon had a wild time during spring break. Unfortunately the guy she hooked up with in Palm Beach had genital herpes. Which of the following is true about genital herpes?\n(A) Avalon could not contract genital herpes from performing fellatio (oral-genital sex) on the guy. (B) If Avalon contracted genital herpes she can be cured with antibiotics if administered immediately after the first occurrence. (C) If Avalon contracted genital herpes she will only be contagious when she has a break out. (D) none of the above\nA: ",
        {
          "until": [
            "</s>"
          ]
        }
      ]
    ],
    "resps": [
      [
        "(D)"
      ]
    ],
    "filtered_resps": [
      "(D)"
    ],
    "exact_match": 1.0
  },
  {
    "doc_id": 78,
    "doc": {
      "question": "Heterosexual fantasies about sexual activity never involve someone _________, and gay and lesbian fantasies never involve persons of __________",
      "subject": "human_sexuality",
      "choices": [
        "Both heterosexual and homosexual fantasies may involve persons of the same or other gender",
        "of the other gender; of the same gender",
        "of the same gender; of the same gender",
        "of the same gender; of the other gender"
      ],
      "answer": 0
    },
    "target": "(A)",
    "arguments": [
      [
        "The following are multiple choice questions (with answers) about human sexuality.\n\nQ: Women's ability to have multiple orgasms is primarily due to:\n(A) the fact that they do not have a refractory period. (B) the response of the inner layers of the vagina. (C) having alternating orgasms in different locations. (D) the G-Spot.\nA:  (A)\n\nQ: A woman who knows she has active herpes and untreated syphilis but continues to have sex without informing her partners of her condition has, in psychoanalytic terms:\n(A) a strong ego (B) a weak superego (C) a weak id (D) a strong superego\nA:  (B)\n\nQ: The most common disorder among men who seek sexual therapy is:\n(A) premature ejaculation (B) inhibited ejaculation (C) erectile disorder (D) ejaculatory disorder\nA:  (C)\n\nQ: The nature of homosexual activities that occur during preadolescence include all but which of the following?\n(A) sexual intercourse (B) circle jerks (C) exhibitionism (D) touching each other's genitals\nA:  (A)\n\nQ: Morning sickness is typically a problem:\n(A) during the first trimester (B) during the second trimester (C) during the third trimester (D) all through the pregnancy\nA:  (A)\n\nQ: Heterosexual fantasies about sexual activity never involve someone _________, and gay and lesbian fantasies never involve persons of __________\n(A) Both heterosexual and homosexual fantasies may involve persons of the same or other gender (B) of the other gender; of the same gender (C) of the same gender; of the same gender (D) of the same gender; of the other gender\nA: ",
        {
          "until": [
            "</s>"
          ]
        }
      ]
    ],
    "resps": [
      [
        "(C)"
      ]
    ],
    "filtered_resps": [
      "(C)"
    ],
    "exact_match": 0.0
  },
  {
    "doc_id": 86,
    "doc": {
      "question": "The placenta does all of the following except:",
      "subject": "human_sexuality",
      "choices": [
        "supplies oxygen to the fetus",
        "supplies nutrients to the fetus",
        "supplies blood to the fetus",
        "secretes hormones"
      ],
      "answer": 2
    },
    "target": "(C)",
    "arguments": [
      [
        "The following are multiple choice questions (with answers) about human sexuality.\n\nQ: A woman who knows she has active herpes and untreated syphilis but continues to have sex without informing her partners of her condition has, in psychoanalytic terms:\n(A) a strong ego (B) a weak superego (C) a weak id (D) a strong superego\nA:  (B)\n\nQ: Morning sickness is typically a problem:\n(A) during the first trimester (B) during the second trimester (C) during the third trimester (D) all through the pregnancy\nA:  (A)\n\nQ: The nature of homosexual activities that occur during preadolescence include all but which of the following?\n(A) sexual intercourse (B) circle jerks (C) exhibitionism (D) touching each other's genitals\nA:  (A)\n\nQ: The most common disorder among men who seek sexual therapy is:\n(A) premature ejaculation (B) inhibited ejaculation (C) erectile disorder (D) ejaculatory disorder\nA:  (C)\n\nQ: Women's ability to have multiple orgasms is primarily due to:\n(A) the fact that they do not have a refractory period. (B) the response of the inner layers of the vagina. (C) having alternating orgasms in different locations. (D) the G-Spot.\nA:  (A)\n\nQ: The placenta does all of the following except:\n(A) supplies oxygen to the fetus (B) supplies nutrients to the fetus (C) supplies blood to the fetus (D) secretes hormones\nA: ",
        {
          "until": [
            "</s>"
          ]
        }
      ]
    ],
    "resps": [
      [
        "(A)"
      ]
    ],
    "filtered_resps": [
      "(A)"
    ],
    "exact_match": 0.0
  },
  {
    "doc_id": 94,
    "doc": {
      "question": "The official condemnation by the Catholic Church of artificial birth control is set forth in _______ encyclical called Humanae Vitae.",
      "subject": "human_sexuality",
      "choices": [
        "Pope John II's",
        "Pope Paul VI's",
        "Pope John Paul I's",
        "Pope John Paul II's"
      ],
      "answer": 1
    },
    "target": "(B)",
    "arguments": [
      [
        "The following are multiple choice questions (with answers) about human sexuality.\n\nQ: Morning sickness is typically a problem:\n(A) during the first trimester (B) during the second trimester (C) during the third trimester (D) all through the pregnancy\nA:  (A)\n\nQ: A woman who knows she has active herpes and untreated syphilis but continues to have sex without informing her partners of her condition has, in psychoanalytic terms:\n(A) a strong ego (B) a weak superego (C) a weak id (D) a strong superego\nA:  (B)\n\nQ: The most common disorder among men who seek sexual therapy is:\n(A) premature ejaculation (B) inhibited ejaculation (C) erectile disorder (D) ejaculatory disorder\nA:  (C)\n\nQ: Women's ability to have multiple orgasms is primarily due to:\n(A) the fact that they do not have a refractory period. (B) the response of the inner layers of the vagina. (C) having alternating orgasms in different locations. (D) the G-Spot.\nA:  (A)\n\nQ: The nature of homosexual activities that occur during preadolescence include all but which of the following?\n(A) sexual intercourse (B) circle jerks (C) exhibitionism (D) touching each other's genitals\nA:  (A)\n\nQ: The official condemnation by the Catholic Church of artificial birth control is set forth in _______ encyclical called Humanae Vitae.\n(A) Pope John II's (B) Pope Paul VI's (C) Pope John Paul I's (D) Pope John Paul II's\nA: ",
        {
          "until": [
            "</s>"
          ]
        }
      ]
    ],
    "resps": [
      [
        "(D)"
      ]
    ],
    "filtered_resps": [
      "(D)"
    ],
    "exact_match": 0.0
  },
  {
    "doc_id": 102,
    "doc": {
      "question": "Alexander the Great was probably",
      "subject": "human_sexuality",
      "choices": [
        "bisexual",
        "asexual",
        "heterosexual",
        "pedosexual"
      ],
      "answer": 0
    },
    "target": "(A)",
    "arguments": [
      [
        "The following are multiple choice questions (with answers) about human sexuality.\n\nQ: Morning sickness is typically a problem:\n(A) during the first trimester (B) during the second trimester (C) during the third trimester (D) all through the pregnancy\nA:  (A)\n\nQ: A woman who knows she has active herpes and untreated syphilis but continues to have sex without informing her partners of her condition has, in psychoanalytic terms:\n(A) a strong ego (B) a weak superego (C) a weak id (D) a strong superego\nA:  (B)\n\nQ: Women's ability to have multiple orgasms is primarily due to:\n(A) the fact that they do not have a refractory period. (B) the response of the inner layers of the vagina. (C) having alternating orgasms in different locations. (D) the G-Spot.\nA:  (A)\n\nQ: The nature of homosexual activities that occur during preadolescence include all but which of the following?\n(A) sexual intercourse (B) circle jerks (C) exhibitionism (D) touching each other's genitals\nA:  (A)\n\nQ: The most common disorder among men who seek sexual therapy is:\n(A) premature ejaculation (B) inhibited ejaculation (C) erectile disorder (D) ejaculatory disorder\nA:  (C)\n\nQ: Alexander the Great was probably\n(A) bisexual (B) asexual (C) heterosexual (D) pedosexual\nA: ",
        {
          "until": [
            "</s>"
          ]
        }
      ]
    ],
    "resps": [
      [
        "(C)"
      ]
    ],
    "filtered_resps": [
      "(C)"
    ],
    "exact_match": 0.0
  },
  {
    "doc_id": 110,
    "doc": {
      "question": "__________ occurs when the fertilized egg implants somewhere other than the uterus.",
      "subject": "human_sexuality",
      "choices": [
        "Pseudocystitis",
        "Ectopic pregnancy",
        "Pre-eclamptic pregnancy",
        "Eclamptic pregnancy"
      ],
      "answer": 1
    },
    "target": "(B)",
    "arguments": [
      [
        "The following are multiple choice questions (with answers) about human sexuality.\n\nQ: Morning sickness is typically a problem:\n(A) during the first trimester (B) during the second trimester (C) during the third trimester (D) all through the pregnancy\nA:  (A)\n\nQ: The nature of homosexual activities that occur during preadolescence include all but which of the following?\n(A) sexual intercourse (B) circle jerks (C) exhibitionism (D) touching each other's genitals\nA:  (A)\n\nQ: A woman who knows she has active herpes and untreated syphilis but continues to have sex without informing her partners of her condition has, in psychoanalytic terms:\n(A) a strong ego (B) a weak superego (C) a weak id (D) a strong superego\nA:  (B)\n\nQ: The most common disorder among men who seek sexual therapy is:\n(A) premature ejaculation (B) inhibited ejaculation (C) erectile disorder (D) ejaculatory disorder\nA:  (C)\n\nQ: Women's ability to have multiple orgasms is primarily due to:\n(A) the fact that they do not have a refractory period. (B) the response of the inner layers of the vagina. (C) having alternating orgasms in different locations. (D) the G-Spot.\nA:  (A)\n\nQ: __________ occurs when the fertilized egg implants somewhere other than the uterus.\n(A) Pseudocystitis (B) Ectopic pregnancy (C) Pre-eclamptic pregnancy (D) Eclamptic pregnancy\nA: ",
        {
          "until": [
            "</s>"
          ]
        }
      ]
    ],
    "resps": [
      [
        "(B)"
      ]
    ],
    "filtered_resps": [
      "(B)"
    ],
    "exact_match": 1.0
  },
  {
    "doc_id": 118,
    "doc": {
      "question": "About ___ % of adolescent males have homosexual experiences during their teenage years.",
      "subject": "human_sexuality",
      "choices": [
        "5",
        "10",
        "20",
        "30"
      ],
      "answer": 1
    },
    "target": "(B)",
    "arguments": [
      [
        "The following are multiple choice questions (with answers) about human sexuality.\n\nQ: Women's ability to have multiple orgasms is primarily due to:\n(A) the fact that they do not have a refractory period. (B) the response of the inner layers of the vagina. (C) having alternating orgasms in different locations. (D) the G-Spot.\nA:  (A)\n\nQ: A woman who knows she has active herpes and untreated syphilis but continues to have sex without informing her partners of her condition has, in psychoanalytic terms:\n(A) a strong ego (B) a weak superego (C) a weak id (D) a strong superego\nA:  (B)\n\nQ: The nature of homosexual activities that occur during preadolescence include all but which of the following?\n(A) sexual intercourse (B) circle jerks (C) exhibitionism (D) touching each other's genitals\nA:  (A)\n\nQ: Morning sickness is typically a problem:\n(A) during the first trimester (B) during the second trimester (C) during the third trimester (D) all through the pregnancy\nA:  (A)\n\nQ: The most common disorder among men who seek sexual therapy is:\n(A) premature ejaculation (B) inhibited ejaculation (C) erectile disorder (D) ejaculatory disorder\nA:  (C)\n\nQ: About ___ % of adolescent males have homosexual experiences during their teenage years.\n(A) 5 (B) 10 (C) 20 (D) 30\nA: ",
        {
          "until": [
            "</s>"
          ]
        }
      ]
    ],
    "resps": [
      [
        "(D)"
      ]
    ],
    "filtered_resps": [
      "(D)"
    ],
    "exact_match": 0.0
  },
  {
    "doc_id": 126,
    "doc": {
      "question": "In men gonorrhea and chlamydia most often infect the:",
      "subject": "human_sexuality",
      "choices": [
        "penis",
        "scrotum",
        "urethra",
        "bladder"
      ],
      "answer": 2
    },
    "target": "(C)",
    "arguments": [
      [
        "The following are multiple choice questions (with answers) about human sexuality.\n\nQ: Morning sickness is typically a problem:\n(A) during the first trimester (B) during the second trimester (C) during the third trimester (D) all through the pregnancy\nA:  (A)\n\nQ: The nature of homosexual activities that occur during preadolescence include all but which of the following?\n(A) sexual intercourse (B) circle jerks (C) exhibitionism (D) touching each other's genitals\nA:  (A)\n\nQ: A woman who knows she has active herpes and untreated syphilis but continues to have sex without informing her partners of her condition has, in psychoanalytic terms:\n(A) a strong ego (B) a weak superego (C) a weak id (D) a strong superego\nA:  (B)\n\nQ: Women's ability to have multiple orgasms is primarily due to:\n(A) the fact that they do not have a refractory period. (B) the response of the inner layers of the vagina. (C) having alternating orgasms in different locations. (D) the G-Spot.\nA:  (A)\n\nQ: The most common disorder among men who seek sexual therapy is:\n(A) premature ejaculation (B) inhibited ejaculation (C) erectile disorder (D) ejaculatory disorder\nA:  (C)\n\nQ: In men gonorrhea and chlamydia most often infect the:\n(A) penis (B) scrotum (C) urethra (D) bladder\nA: ",
        {
          "until": [
            "</s>"
          ]
        }
      ]
    ],
    "resps": [
      [
        "(D)"
      ]
    ],
    "filtered_resps": [
      "(D)"
    ],
    "exact_match": 0.0
  },
  {
    "doc_id": 7,
    "doc": {
      "question": "Joe wants desperately to get close to Helen. Helen appears to be put off by Joe's desperate advances. This is typical of Joe's relationships with women. According to attachment theory Joe would best be described as:",
      "subject": "human_sexuality",
      "choices": [
        "a secure lover",
        "an avoidant lover",
        "an anxious-ambivalent lover",
        "a passionate lover"
      ],
      "answer": 2
    },
    "target": "(C)",
    "arguments": [
      [
        "The following are multiple choice questions (with answers) about human sexuality.\n\nQ: The nature of homosexual activities that occur during preadolescence include all but which of the following?\n(A) sexual intercourse (B) circle jerks (C) exhibitionism (D) touching each other's genitals\nA:  (A)\n\nQ: Morning sickness is typically a problem:\n(A) during the first trimester (B) during the second trimester (C) during the third trimester (D) all through the pregnancy\nA:  (A)\n\nQ: The most common disorder among men who seek sexual therapy is:\n(A) premature ejaculation (B) inhibited ejaculation (C) erectile disorder (D) ejaculatory disorder\nA:  (C)\n\nQ: Women's ability to have multiple orgasms is primarily due to:\n(A) the fact that they do not have a refractory period. (B) the response of the inner layers of the vagina. (C) having alternating orgasms in different locations. (D) the G-Spot.\nA:  (A)\n\nQ: A woman who knows she has active herpes and untreated syphilis but continues to have sex without informing her partners of her condition has, in psychoanalytic terms:\n(A) a strong ego (B) a weak superego (C) a weak id (D) a strong superego\nA:  (B)\n\nQ: Joe wants desperately to get close to Helen. Helen appears to be put off by Joe's desperate advances. This is typical of Joe's relationships with women. According to attachment theory Joe would best be described as:\n(A) a secure lover (B) an avoidant lover (C) an anxious-ambivalent lover (D) a passionate lover\nA: ",
        {
          "until": [
            "</s>"
          ]
        }
      ]
    ],
    "resps": [
      [
        "(D)"
      ]
    ],
    "filtered_resps": [
      "(D)"
    ],
    "exact_match": 0.0
  },
  {
    "doc_id": 15,
    "doc": {
      "question": "Simon LeVay studied the brains of heterosexuals and homosexuals. He found differences in:",
      "subject": "human_sexuality",
      "choices": [
        "the cortical activity of these two groups",
        "the overall brain weights of these two groups",
        "the cell structure in the hypothalamus of these two groups",
        "blood volume and metabolism of sugars in the brains of these two groups"
      ],
      "answer": 2
    },
    "target": "(C)",
    "arguments": [
      [
        "The following are multiple choice questions (with answers) about human sexuality.\n\nQ: Morning sickness is typically a problem:\n(A) during the first trimester (B) during the second trimester (C) during the third trimester (D) all through the pregnancy\nA:  (A)\n\nQ: The most common disorder among men who seek sexual therapy is:\n(A) premature ejaculation (B) inhibited ejaculation (C) erectile disorder (D) ejaculatory disorder\nA:  (C)\n\nQ: A woman who knows she has active herpes and untreated syphilis but continues to have sex without informing her partners of her condition has, in psychoanalytic terms:\n(A) a strong ego (B) a weak superego (C) a weak id (D) a strong superego\nA:  (B)\n\nQ: The nature of homosexual activities that occur during preadolescence include all but which of the following?\n(A) sexual intercourse (B) circle jerks (C) exhibitionism (D) touching each other's genitals\nA:  (A)\n\nQ: Women's ability to have multiple orgasms is primarily due to:\n(A) the fact that they do not have a refractory period. (B) the response of the inner layers of the vagina. (C) having alternating orgasms in different locations. (D) the G-Spot.\nA:  (A)\n\nQ: Simon LeVay studied the brains of heterosexuals and homosexuals. He found differences in:\n(A) the cortical activity of these two groups (B) the overall brain weights of these two groups (C) the cell structure in the hypothalamus of these two groups (D) blood volume and metabolism of sugars in the brains of these two groups\nA: ",
        {
          "until": [
            "</s>"
          ]
        }
      ]
    ],
    "resps": [
      [
        "(C)"
      ]
    ],
    "filtered_resps": [
      "(C)"
    ],
    "exact_match": 1.0
  },
  {
    "doc_id": 23,
    "doc": {
      "question": "If a woman or man repeatedly experiences pain during intercourse, she will probably want to have intercourse infrequently or not all. In this situation, __________ would likely classify the pain as a punishment.",
      "subject": "human_sexuality",
      "choices": [
        "Sigmund Freud",
        "John Money",
        "B. F. Skinner",
        "Havelock Ellis"
      ],
      "answer": 2
    },
    "target": "(C)",
    "arguments": [
      [
        "The following are multiple choice questions (with answers) about human sexuality.\n\nQ: Morning sickness is typically a problem:\n(A) during the first trimester (B) during the second trimester (C) during the third trimester (D) all through the pregnancy\nA:  (A)\n\nQ: The most common disorder among men who seek sexual therapy is:\n(A) premature ejaculation (B) inhibited ejaculation (C) erectile disorder (D) ejaculatory disorder\nA:  (C)\n\nQ: A woman who knows she has active herpes and untreated syphilis but continues to have sex without informing her partners of her condition has, in psychoanalytic terms:\n(A) a strong ego (B) a weak superego (C) a weak id (D) a strong superego\nA:  (B)\n\nQ: Women's ability to have multiple orgasms is primarily due to:\n(A) the fact that they do not have a refractory period. (B) the response of the inner layers of the vagina. (C) having alternating orgasms in different locations. (D) the G-Spot.\nA:  (A)\n\nQ: The nature of homosexual activities that occur during preadolescence include all but which of the following?\n(A) sexual intercourse (B) circle jerks (C) exhibitionism (D) touching each other's genitals\nA:  (A)\n\nQ: If a woman or man repeatedly experiences pain during intercourse, she will probably want to have intercourse infrequently or not all. In this situation, __________ would likely classify the pain as a punishment.\n(A) Sigmund Freud (B) John Money (C) B. F. Skinner (D) Havelock Ellis\nA: ",
        {
          "until": [
            "</s>"
          ]
        }
      ]
    ],
    "resps": [
      [
        "(C)"
      ]
    ],
    "filtered_resps": [
      "(C)"
    ],
    "exact_match": 1.0
  },
  {
    "doc_id": 31,
    "doc": {
      "question": "Secretions of Cowper's gland fluid at the tip of the penis are first evident:",
      "subject": "human_sexuality",
      "choices": [
        "following orgasm",
        "immediately before orgasm",
        "prior to vasocongestion",
        "during the plateau phase"
      ],
      "answer": 3
    },
    "target": "(D)",
    "arguments": [
      [
        "The following are multiple choice questions (with answers) about human sexuality.\n\nQ: A woman who knows she has active herpes and untreated syphilis but continues to have sex without informing her partners of her condition has, in psychoanalytic terms:\n(A) a strong ego (B) a weak superego (C) a weak id (D) a strong superego\nA:  (B)\n\nQ: Morning sickness is typically a problem:\n(A) during the first trimester (B) during the second trimester (C) during the third trimester (D) all through the pregnancy\nA:  (A)\n\nQ: The nature of homosexual activities that occur during preadolescence include all but which of the following?\n(A) sexual intercourse (B) circle jerks (C) exhibitionism (D) touching each other's genitals\nA:  (A)\n\nQ: Women's ability to have multiple orgasms is primarily due to:\n(A) the fact that they do not have a refractory period. (B) the response of the inner layers of the vagina. (C) having alternating orgasms in different locations. (D) the G-Spot.\nA:  (A)\n\nQ: The most common disorder among men who seek sexual therapy is:\n(A) premature ejaculation (B) inhibited ejaculation (C) erectile disorder (D) ejaculatory disorder\nA:  (C)\n\nQ: Secretions of Cowper's gland fluid at the tip of the penis are first evident:\n(A) following orgasm (B) immediately before orgasm (C) prior to vasocongestion (D) during the plateau phase\nA: ",
        {
          "until": [
            "</s>"
          ]
        }
      ]
    ],
    "resps": [
      [
        "(B)"
      ]
    ],
    "filtered_resps": [
      "(B)"
    ],
    "exact_match": 0.0
  },
  {
    "doc_id": 39,
    "doc": {
      "question": "Penile or clitoral erection occurs because of activation of the _________ system.",
      "subject": "human_sexuality",
      "choices": [
        "pathetic",
        "apathetic",
        "sympathetic",
        "parasympathetic"
      ],
      "answer": 3
    },
    "target": "(D)",
    "arguments": [
      [
        "The following are multiple choice questions (with answers) about human sexuality.\n\nQ: The most common disorder among men who seek sexual therapy is:\n(A) premature ejaculation (B) inhibited ejaculation (C) erectile disorder (D) ejaculatory disorder\nA:  (C)\n\nQ: The nature of homosexual activities that occur during preadolescence include all but which of the following?\n(A) sexual intercourse (B) circle jerks (C) exhibitionism (D) touching each other's genitals\nA:  (A)\n\nQ: Morning sickness is typically a problem:\n(A) during the first trimester (B) during the second trimester (C) during the third trimester (D) all through the pregnancy\nA:  (A)\n\nQ: Women's ability to have multiple orgasms is primarily due to:\n(A) the fact that they do not have a refractory period. (B) the response of the inner layers of the vagina. (C) having alternating orgasms in different locations. (D) the G-Spot.\nA:  (A)\n\nQ: A woman who knows she has active herpes and untreated syphilis but continues to have sex without informing her partners of her condition has, in psychoanalytic terms:\n(A) a strong ego (B) a weak superego (C) a weak id (D) a strong superego\nA:  (B)\n\nQ: Penile or clitoral erection occurs because of activation of the _________ system.\n(A) pathetic (B) apathetic (C) sympathetic (D) parasympathetic\nA: ",
        {
          "until": [
            "</s>"
          ]
        }
      ]
    ],
    "resps": [
      [
        "(C)"
      ]
    ],
    "filtered_resps": [
      "(C)"
    ],
    "exact_match": 0.0
  },
  {
    "doc_id": 47,
    "doc": {
      "question": "Hillary just found out that she is pregnant but she suspects that her husband has been fooling around. It is important that she be tested for chlamydia because chlamydia can cause which of the following complications?",
      "subject": "human_sexuality",
      "choices": [
        "tubal pregnancies",
        "premature delivery",
        "spontaneous abortion",
        "all of the above"
      ],
      "answer": 3
    },
    "target": "(D)",
    "arguments": [
      [
        "The following are multiple choice questions (with answers) about human sexuality.\n\nQ: Morning sickness is typically a problem:\n(A) during the first trimester (B) during the second trimester (C) during the third trimester (D) all through the pregnancy\nA:  (A)\n\nQ: The most common disorder among men who seek sexual therapy is:\n(A) premature ejaculation (B) inhibited ejaculation (C) erectile disorder (D) ejaculatory disorder\nA:  (C)\n\nQ: Women's ability to have multiple orgasms is primarily due to:\n(A) the fact that they do not have a refractory period. (B) the response of the inner layers of the vagina. (C) having alternating orgasms in different locations. (D) the G-Spot.\nA:  (A)\n\nQ: The nature of homosexual activities that occur during preadolescence include all but which of the following?\n(A) sexual intercourse (B) circle jerks (C) exhibitionism (D) touching each other's genitals\nA:  (A)\n\nQ: A woman who knows she has active herpes and untreated syphilis but continues to have sex without informing her partners of her condition has, in psychoanalytic terms:\n(A) a strong ego (B) a weak superego (C) a weak id (D) a strong superego\nA:  (B)\n\nQ: Hillary just found out that she is pregnant but she suspects that her husband has been fooling around. It is important that she be tested for chlamydia because chlamydia can cause which of the following complications?\n(A) tubal pregnancies (B) premature delivery (C) spontaneous abortion (D) all of the above\nA: ",
        {
          "until": [
            "</s>"
          ]
        }
      ]
    ],
    "resps": [
      [
        "(D)"
      ]
    ],
    "filtered_resps": [
      "(D)"
    ],
    "exact_match": 1.0
  },
  {
    "doc_id": 55,
    "doc": {
      "question": "Staphylococcus aureus is...",
      "subject": "human_sexuality",
      "choices": [
        "...a hormone released during menstruation",
        "...the term for the follicle after it has ruptured",
        "...a bacterium associated with Toxic Shock Syndrome",
        "...the term for the mass of cells in the corpus luteum"
      ],
      "answer": 2
    },
    "target": "(C)",
    "arguments": [
      [
        "The following are multiple choice questions (with answers) about human sexuality.\n\nQ: The most common disorder among men who seek sexual therapy is:\n(A) premature ejaculation (B) inhibited ejaculation (C) erectile disorder (D) ejaculatory disorder\nA:  (C)\n\nQ: Morning sickness is typically a problem:\n(A) during the first trimester (B) during the second trimester (C) during the third trimester (D) all through the pregnancy\nA:  (A)\n\nQ: Women's ability to have multiple orgasms is primarily due to:\n(A) the fact that they do not have a refractory period. (B) the response of the inner layers of the vagina. (C) having alternating orgasms in different locations. (D) the G-Spot.\nA:  (A)\n\nQ: A woman who knows she has active herpes and untreated syphilis but continues to have sex without informing her partners of her condition has, in psychoanalytic terms:\n(A) a strong ego (B) a weak superego (C) a weak id (D) a strong superego\nA:  (B)\n\nQ: The nature of homosexual activities that occur during preadolescence include all but which of the following?\n(A) sexual intercourse (B) circle jerks (C) exhibitionism (D) touching each other's genitals\nA:  (A)\n\nQ: Staphylococcus aureus is...\n(A) ...a hormone released during menstruation (B) ...the term for the follicle after it has ruptured (C) ...a bacterium associated with Toxic Shock Syndrome (D) ...the term for the mass of cells in the corpus luteum\nA: ",
        {
          "until": [
            "</s>"
          ]
        }
      ]
    ],
    "resps": [
      [
        "(C)"
      ]
    ],
    "filtered_resps": [
      "(C)"
    ],
    "exact_match": 1.0
  },
  {
    "doc_id": 63,
    "doc": {
      "question": "Which of the following is TRUE of the duration of the refractory period experienced by men?",
      "subject": "human_sexuality",
      "choices": [
        "it is consistent across men and lasts 20 minutes",
        "it varies across men lasting from a few minutes to 24 hours",
        "it tends to be shorter with alcohol consumption",
        "it tends to be longer in younger men"
      ],
      "answer": 1
    },
    "target": "(B)",
    "arguments": [
      [
        "The following are multiple choice questions (with answers) about human sexuality.\n\nQ: Women's ability to have multiple orgasms is primarily due to:\n(A) the fact that they do not have a refractory period. (B) the response of the inner layers of the vagina. (C) having alternating orgasms in different locations. (D) the G-Spot.\nA:  (A)\n\nQ: The most common disorder among men who seek sexual therapy is:\n(A) premature ejaculation (B) inhibited ejaculation (C) erectile disorder (D) ejaculatory disorder\nA:  (C)\n\nQ: Morning sickness is typically a problem:\n(A) during the first trimester (B) during the second trimester (C) during the third trimester (D) all through the pregnancy\nA:  (A)\n\nQ: The nature of homosexual activities that occur during preadolescence include all but which of the following?\n(A) sexual intercourse (B) circle jerks (C) exhibitionism (D) touching each other's genitals\nA:  (A)\n\nQ: A woman who knows she has active herpes and untreated syphilis but continues to have sex without informing her partners of her condition has, in psychoanalytic terms:\n(A) a strong ego (B) a weak superego (C) a weak id (D) a strong superego\nA:  (B)\n\nQ: Which of the following is TRUE of the duration of the refractory period experienced by men?\n(A) it is consistent across men and lasts 20 minutes (B) it varies across men lasting from a few minutes to 24 hours (C) it tends to be shorter with alcohol consumption (D) it tends to be longer in younger men\nA: ",
        {
          "until": [
            "</s>"
          ]
        }
      ]
    ],
    "resps": [
      [
        "(B)"
      ]
    ],
    "filtered_resps": [
      "(B)"
    ],
    "exact_match": 1.0
  },
  {
    "doc_id": 71,
    "doc": {
      "question": "Stan is out having a few beers with some friends. Which of the following will be DECREASED if Stan only consumes 1 beer?",
      "subject": "human_sexuality",
      "choices": [
        "arousal",
        "erection",
        "inhibition",
        "orgasm"
      ],
      "answer": 2
    },
    "target": "(C)",
    "arguments": [
      [
        "The following are multiple choice questions (with answers) about human sexuality.\n\nQ: The most common disorder among men who seek sexual therapy is:\n(A) premature ejaculation (B) inhibited ejaculation (C) erectile disorder (D) ejaculatory disorder\nA:  (C)\n\nQ: Morning sickness is typically a problem:\n(A) during the first trimester (B) during the second trimester (C) during the third trimester (D) all through the pregnancy\nA:  (A)\n\nQ: Women's ability to have multiple orgasms is primarily due to:\n(A) the fact that they do not have a refractory period. (B) the response of the inner layers of the vagina. (C) having alternating orgasms in different locations. (D) the G-Spot.\nA:  (A)\n\nQ: The nature of homosexual activities that occur during preadolescence include all but which of the following?\n(A) sexual intercourse (B) circle jerks (C) exhibitionism (D) touching each other's genitals\nA:  (A)\n\nQ: A woman who knows she has active herpes and untreated syphilis but continues to have sex without informing her partners of her condition has, in psychoanalytic terms:\n(A) a strong ego (B) a weak superego (C) a weak id (D) a strong superego\nA:  (B)\n\nQ: Stan is out having a few beers with some friends. Which of the following will be DECREASED if Stan only consumes 1 beer?\n(A) arousal (B) erection (C) inhibition (D) orgasm\nA: ",
        {
          "until": [
            "</s>"
          ]
        }
      ]
    ],
    "resps": [
      [
        "(B)"
      ]
    ],
    "filtered_resps": [
      "(B)"
    ],
    "exact_match": 0.0
  },
  {
    "doc_id": 79,
    "doc": {
      "question": "Which of the following is typically associated with having a vasectomy?",
      "subject": "human_sexuality",
      "choices": [
        "decreased testosterone production",
        "reduced rigidity of erections",
        "decreased sperm production",
        "normal orgasm"
      ],
      "answer": 3
    },
    "target": "(D)",
    "arguments": [
      [
        "The following are multiple choice questions (with answers) about human sexuality.\n\nQ: Women's ability to have multiple orgasms is primarily due to:\n(A) the fact that they do not have a refractory period. (B) the response of the inner layers of the vagina. (C) having alternating orgasms in different locations. (D) the G-Spot.\nA:  (A)\n\nQ: A woman who knows she has active herpes and untreated syphilis but continues to have sex without informing her partners of her condition has, in psychoanalytic terms:\n(A) a strong ego (B) a weak superego (C) a weak id (D) a strong superego\nA:  (B)\n\nQ: The most common disorder among men who seek sexual therapy is:\n(A) premature ejaculation (B) inhibited ejaculation (C) erectile disorder (D) ejaculatory disorder\nA:  (C)\n\nQ: The nature of homosexual activities that occur during preadolescence include all but which of the following?\n(A) sexual intercourse (B) circle jerks (C) exhibitionism (D) touching each other's genitals\nA:  (A)\n\nQ: Morning sickness is typically a problem:\n(A) during the first trimester (B) during the second trimester (C) during the third trimester (D) all through the pregnancy\nA:  (A)\n\nQ: Which of the following is typically associated with having a vasectomy?\n(A) decreased testosterone production (B) reduced rigidity of erections (C) decreased sperm production (D) normal orgasm\nA: ",
        {
          "until": [
            "</s>"
          ]
        }
      ]
    ],
    "resps": [
      [
        "(C)"
      ]
    ],
    "filtered_resps": [
      "(C)"
    ],
    "exact_match": 0.0
  },
  {
    "doc_id": 87,
    "doc": {
      "question": "Which of the following is the MOST COMMON menstrual problem?",
      "subject": "human_sexuality",
      "choices": [
        "painful menstruation",
        "absence of menstruation",
        "menstruation without ovulation",
        "ovulation without menstruation"
      ],
      "answer": 0
    },
    "target": "(A)",
    "arguments": [
      [
        "The following are multiple choice questions (with answers) about human sexuality.\n\nQ: A woman who knows she has active herpes and untreated syphilis but continues to have sex without informing her partners of her condition has, in psychoanalytic terms:\n(A) a strong ego (B) a weak superego (C) a weak id (D) a strong superego\nA:  (B)\n\nQ: Morning sickness is typically a problem:\n(A) during the first trimester (B) during the second trimester (C) during the third trimester (D) all through the pregnancy\nA:  (A)\n\nQ: The nature of homosexual activities that occur during preadolescence include all but which of the following?\n(A) sexual intercourse (B) circle jerks (C) exhibitionism (D) touching each other's genitals\nA:  (A)\n\nQ: The most common disorder among men who seek sexual therapy is:\n(A) premature ejaculation (B) inhibited ejaculation (C) erectile disorder (D) ejaculatory disorder\nA:  (C)\n\nQ: Women's ability to have multiple orgasms is primarily due to:\n(A) the fact that they do not have a refractory period. (B) the response of the inner layers of the vagina. (C) having alternating orgasms in different locations. (D) the G-Spot.\nA:  (A)\n\nQ: Which of the following is the MOST COMMON menstrual problem?\n(A) painful menstruation (B) absence of menstruation (C) menstruation without ovulation (D) ovulation without menstruation\nA: ",
        {
          "until": [
            "</s>"
          ]
        }
      ]
    ],
    "resps": [
      [
        "(B)"
      ]
    ],
    "filtered_resps": [
      "(B)"
    ],
    "exact_match": 0.0
  },
  {
    "doc_id": 95,
    "doc": {
      "question": "According to Byrne's law of attraction and his formula, we are attracted to people who:",
      "subject": "human_sexuality",
      "choices": [
        "provide a lot of reinforcement and a small amount of punishment",
        "provide more punishment than reinforcement",
        "provide an equal balance of punishment and reinforcement",
        "are extremely attractive and provide a lot of reinforcement"
      ],
      "answer": 0
    },
    "target": "(A)",
    "arguments": [
      [
        "The following are multiple choice questions (with answers) about human sexuality.\n\nQ: Morning sickness is typically a problem:\n(A) during the first trimester (B) during the second trimester (C) during the third trimester (D) all through the pregnancy\nA:  (A)\n\nQ: A woman who knows she has active herpes and untreated syphilis but continues to have sex without informing her partners of her condition has, in psychoanalytic terms:\n(A) a strong ego (B) a weak superego (C) a weak id (D) a strong superego\nA:  (B)\n\nQ: The most common disorder among men who seek sexual therapy is:\n(A) premature ejaculation (B) inhibited ejaculation (C) erectile disorder (D) ejaculatory disorder\nA:  (C)\n\nQ: Women's ability to have multiple orgasms is primarily due to:\n(A) the fact that they do not have a refractory period. (B) the response of the inner layers of the vagina. (C) having alternating orgasms in different locations. (D) the G-Spot.\nA:  (A)\n\nQ: The nature of homosexual activities that occur during preadolescence include all but which of the following?\n(A) sexual intercourse (B) circle jerks (C) exhibitionism (D) touching each other's genitals\nA:  (A)\n\nQ: According to Byrne's law of attraction and his formula, we are attracted to people who:\n(A) provide a lot of reinforcement and a small amount of punishment (B) provide more punishment than reinforcement (C) provide an equal balance of punishment and reinforcement (D) are extremely attractive and provide a lot of reinforcement\nA: ",
        {
          "until": [
            "</s>"
          ]
        }
      ]
    ],
    "resps": [
      [
        "(D)"
      ]
    ],
    "filtered_resps": [
      "(D)"
    ],
    "exact_match": 0.0
  },
  {
    "doc_id": 103,
    "doc": {
      "question": "Shaggy has a fantasy about digging up a recently buried woman and having sex with her. He told his friends this and they encouraged him to get therapy. As part of the treatment he masturbates to his fantasy and at the last moment before orgasm he switches to a fantasy about having sex with a living woman. This procedure is part of the process of:",
      "subject": "human_sexuality",
      "choices": [
        "orgasmic reconditioning",
        "aversive conditioning",
        "covert sensitization",
        "desensitization therapy"
      ],
      "answer": 0
    },
    "target": "(A)",
    "arguments": [
      [
        "The following are multiple choice questions (with answers) about human sexuality.\n\nQ: Morning sickness is typically a problem:\n(A) during the first trimester (B) during the second trimester (C) during the third trimester (D) all through the pregnancy\nA:  (A)\n\nQ: A woman who knows she has active herpes and untreated syphilis but continues to have sex without informing her partners of her condition has, in psychoanalytic terms:\n(A) a strong ego (B) a weak superego (C) a weak id (D) a strong superego\nA:  (B)\n\nQ: Women's ability to have multiple orgasms is primarily due to:\n(A) the fact that they do not have a refractory period. (B) the response of the inner layers of the vagina. (C) having alternating orgasms in different locations. (D) the G-Spot.\nA:  (A)\n\nQ: The nature of homosexual activities that occur during preadolescence include all but which of the following?\n(A) sexual intercourse (B) circle jerks (C) exhibitionism (D) touching each other's genitals\nA:  (A)\n\nQ: The most common disorder among men who seek sexual therapy is:\n(A) premature ejaculation (B) inhibited ejaculation (C) erectile disorder (D) ejaculatory disorder\nA:  (C)\n\nQ: Shaggy has a fantasy about digging up a recently buried woman and having sex with her. He told his friends this and they encouraged him to get therapy. As part of the treatment he masturbates to his fantasy and at the last moment before orgasm he switches to a fantasy about having sex with a living woman. This procedure is part of the process of:\n(A) orgasmic reconditioning (B) aversive conditioning (C) covert sensitization (D) desensitization therapy\nA: ",
        {
          "until": [
            "</s>"
          ]
        }
      ]
    ],
    "resps": [
      [
        "(A)"
      ]
    ],
    "filtered_resps": [
      "(A)"
    ],
    "exact_match": 1.0
  },
  {
    "doc_id": 111,
    "doc": {
      "question": "A pimp can be best described as ",
      "subject": "human_sexuality",
      "choices": [
        "...a male companion-master of a prostitute",
        "...a gigolo who works with a street walker",
        "...an experienced male prostitute",
        "...an escort to a female prostitute"
      ],
      "answer": 0
    },
    "target": "(A)",
    "arguments": [
      [
        "The following are multiple choice questions (with answers) about human sexuality.\n\nQ: Morning sickness is typically a problem:\n(A) during the first trimester (B) during the second trimester (C) during the third trimester (D) all through the pregnancy\nA:  (A)\n\nQ: The nature of homosexual activities that occur during preadolescence include all but which of the following?\n(A) sexual intercourse (B) circle jerks (C) exhibitionism (D) touching each other's genitals\nA:  (A)\n\nQ: A woman who knows she has active herpes and untreated syphilis but continues to have sex without informing her partners of her condition has, in psychoanalytic terms:\n(A) a strong ego (B) a weak superego (C) a weak id (D) a strong superego\nA:  (B)\n\nQ: The most common disorder among men who seek sexual therapy is:\n(A) premature ejaculation (B) inhibited ejaculation (C) erectile disorder (D) ejaculatory disorder\nA:  (C)\n\nQ: Women's ability to have multiple orgasms is primarily due to:\n(A) the fact that they do not have a refractory period. (B) the response of the inner layers of the vagina. (C) having alternating orgasms in different locations. (D) the G-Spot.\nA:  (A)\n\nQ: A pimp can be best described as\n(A) ...a male companion-master of a prostitute (B) ...a gigolo who works with a street walker (C) ...an experienced male prostitute (D) ...an escort to a female prostitute\nA: ",
        {
          "until": [
            "</s>"
          ]
        }
      ]
    ],
    "resps": [
      [
        "(C)"
      ]
    ],
    "filtered_resps": [
      "(C)"
    ],
    "exact_match": 0.0
  },
  {
    "doc_id": 119,
    "doc": {
      "question": "Hormones are secreted:",
      "subject": "human_sexuality",
      "choices": [
        "directly into the bloodstream",
        "into the tissues surrounding the glands where they were manufactured",
        "into the stomach and then are digested and travel throughout the body",
        "into the ovaries and testes"
      ],
      "answer": 0
    },
    "target": "(A)",
    "arguments": [
      [
        "The following are multiple choice questions (with answers) about human sexuality.\n\nQ: Women's ability to have multiple orgasms is primarily due to:\n(A) the fact that they do not have a refractory period. (B) the response of the inner layers of the vagina. (C) having alternating orgasms in different locations. (D) the G-Spot.\nA:  (A)\n\nQ: A woman who knows she has active herpes and untreated syphilis but continues to have sex without informing her partners of her condition has, in psychoanalytic terms:\n(A) a strong ego (B) a weak superego (C) a weak id (D) a strong superego\nA:  (B)\n\nQ: The nature of homosexual activities that occur during preadolescence include all but which of the following?\n(A) sexual intercourse (B) circle jerks (C) exhibitionism (D) touching each other's genitals\nA:  (A)\n\nQ: Morning sickness is typically a problem:\n(A) during the first trimester (B) during the second trimester (C) during the third trimester (D) all through the pregnancy\nA:  (A)\n\nQ: The most common disorder among men who seek sexual therapy is:\n(A) premature ejaculation (B) inhibited ejaculation (C) erectile disorder (D) ejaculatory disorder\nA:  (C)\n\nQ: Hormones are secreted:\n(A) directly into the bloodstream (B) into the tissues surrounding the glands where they were manufactured (C) into the stomach and then are digested and travel throughout the body (D) into the ovaries and testes\nA: ",
        {
          "until": [
            "</s>"
          ]
        }
      ]
    ],
    "resps": [
      [
        "(D)"
      ]
    ],
    "filtered_resps": [
      "(D)"
    ],
    "exact_match": 0.0
  },
  {
    "doc_id": 127,
    "doc": {
      "question": "Which method of abortion is most costly and carries the greatest risk of complications?",
      "subject": "human_sexuality",
      "choices": [
        "hysterotomy",
        "saline-induced abortion",
        "prostaglandin abortion",
        "dilation and curettage"
      ],
      "answer": 0
    },
    "target": "(A)",
    "arguments": [
      [
        "The following are multiple choice questions (with answers) about human sexuality.\n\nQ: Morning sickness is typically a problem:\n(A) during the first trimester (B) during the second trimester (C) during the third trimester (D) all through the pregnancy\nA:  (A)\n\nQ: The nature of homosexual activities that occur during preadolescence include all but which of the following?\n(A) sexual intercourse (B) circle jerks (C) exhibitionism (D) touching each other's genitals\nA:  (A)\n\nQ: A woman who knows she has active herpes and untreated syphilis but continues to have sex without informing her partners of her condition has, in psychoanalytic terms:\n(A) a strong ego (B) a weak superego (C) a weak id (D) a strong superego\nA:  (B)\n\nQ: Women's ability to have multiple orgasms is primarily due to:\n(A) the fact that they do not have a refractory period. (B) the response of the inner layers of the vagina. (C) having alternating orgasms in different locations. (D) the G-Spot.\nA:  (A)\n\nQ: The most common disorder among men who seek sexual therapy is:\n(A) premature ejaculation (B) inhibited ejaculation (C) erectile disorder (D) ejaculatory disorder\nA:  (C)\n\nQ: Which method of abortion is most costly and carries the greatest risk of complications?\n(A) hysterotomy (B) saline-induced abortion (C) prostaglandin abortion (D) dilation and curettage\nA: ",
        {
          "until": [
            "</s>"
          ]
        }
      ]
    ],
    "resps": [
      [
        "(A)"
      ]
    ],
    "filtered_resps": [
      "(A)"
    ],
    "exact_match": 1.0
  }
]