[
  {
    "doc_id": 0,
    "doc": {
      "question": "The study of older adults and aging is referred to as",
      "subject": "human_aging",
      "choices": [
        "Gerontology",
        "Geropsychiatry",
        "Geriatrics",
        "Gero-education"
      ],
      "answer": 0
    },
    "target": "(A)",
    "arguments": [
      [
        "The following are multiple choice questions (with answers) about human aging.\n\nQ: Which element in tobacco smoke is responsible for cancers?\n(A) Nicotine (B) Tar (C) Carbon monoxide (D) Smoke particles\nA:  (B)\n\nQ: Which of the following persons is more likely to remain at home alone, as of 2019?\n(A) An Asian man or woman (B) A Hispanic man (C) An African American woman (D) A white man or woman\nA:  (C)\n\nQ: All other things being equal, which of the following persons is more likely to show osteoporosis?\n(A) An older Hispanic American woman (B) An older African American woman (C) An older Asian American woman (D) An older Native American woman\nA:  (C)\n\nQ: When older adults move to a new state after retirement, which of the following is the more likely destination?\n(A) Texas (B) California (C) Hawaii (D) Vermont\nA:  (A)\n\nQ: The finding that adults tend to remember events from their adolescence better than from other periods in their lives is referred to as the\n(A) Adolescence advantage (B) Reminiscence bump (C) Memorial memorial (D) Quadratic retrieval spike\nA:  (B)\n\nQ: The study of older adults and aging is referred to as\n(A) Gerontology (B) Geropsychiatry (C) Geriatrics (D) Gero-education\nA: ",
        {
          "until": [
            "</s>"
          ]
        }
      ]
    ],
    "resps": [
      [
        "(A)"
      ]
    ],
    "filtered_resps": [
      "(A)"
    ],
    "exact_match": 1.0
  },
  {
    "doc_id": 8,
    "doc": {
      "question": "The reaction time difference between younger and older adults is reduced when older adults",
      "subject": "human_aging",
      "choices": [
        "Practice regular aerobic exercise",
        "Lift weights on a regular schedule",
        "Consume large quantities of vitamins",
        "Practice Tai chi"
      ],
      "answer": 0
    },
    "target": "(A)",
    "arguments": [
      [
        "The following are multiple choice questions (with answers) about human aging.\n\nQ: Which of the following persons is more likely to remain at home alone, as of 2019?\n(A) An Asian man or woman (B) A Hispanic man (C) An African American woman (D) A white man or woman\nA:  (C)\n\nQ: All other things being equal, which of the following persons is more likely to show osteoporosis?\n(A) An older Hispanic American woman (B) An older African American woman (C) An older Asian American woman (D) An older Native American woman\nA:  (C)\n\nQ: The finding that adults tend to remember events from their adolescence better than from other periods in their lives is referred to as the\n(A) Adolescence advantage (B) Reminiscence bump (C) Memorial memorial (D) Quadratic retrieval spike\nA:  (B)\n\nQ: Which element in tobacco smoke is responsible for cancers?\n(A) Nicotine (B) Tar (C) Carbon monoxide (D) Smoke particles\nA:  (B)\n\nQ: When older adults move to a new state after retirement, which of the following is the more likely destination?\n(A) Texas (B) California (C) Hawaii (D) Vermont\nA:  (A)\n\nQ: The reaction time difference between younger and older adults is reduced when older adults\n(A) Practice regular aerobic exercise (B) Lift weights on a regular schedule (C) Consume large quantities of vitamins (D) Practice Tai chi\nA: ",
        {
          "until": [
            "</s>"
          ]
        }
      ]
    ],
    "resps": [
      [
        "(A)"
      ]
    ],
    "filtered_resps": [
      "(A)"
    ],
    "exact_match": 1.0
  },
  {
    "doc_id": 16,
    "doc": {
      "question": "In this chapter's Senior View, Dr. Donham told us that mental stimulation, exercise, diet, and what other factor is important for long life?",
      "subject": "human_aging",
      "choices": [
        "Moderate amounts of alcohol",
        "Social support",
        "Good genes",
        "Avoiding stress"
      ],
      "answer": 2
    },
    "target": "(C)",
    "arguments": [
      [
        "The following are multiple choice questions (with answers) about human aging.\n\nQ: Which of the following persons is more likely to remain at home alone, as of 2019?\n(A) An Asian man or woman (B) A Hispanic man (C) An African American woman (D) A white man or woman\nA:  (C)\n\nQ: All other things being equal, which of the following persons is more likely to show osteoporosis?\n(A) An older Hispanic American woman (B) An older African American woman (C) An older Asian American woman (D) An older Native American woman\nA:  (C)\n\nQ: The finding that adults tend to remember events from their adolescence better than from other periods in their lives is referred to as the\n(A) Adolescence advantage (B) Reminiscence bump (C) Memorial memorial (D) Quadratic retrieval spike\nA:  (B)\n\nQ: When older adults move to a new state after retirement, which of the following is the more likely destination?\n(A) Texas (B) California (C) Hawaii (D) Vermont\nA:  (A)\n\nQ: Which element in tobacco smoke is responsible for cancers?\n(A) Nicotine (B) Tar (C) Carbon monoxide (D) Smoke particles\nA:  (B)\n\nQ: In this chapter's Senior View, Dr. Donham told us that mental stimulation, exercise, diet, and what other factor is important for long life?\n(A) Moderate amounts of alcohol (B) Social support (C) Good genes (D) Avoiding stress\nA: ",
        {
          "until": [
            "</s>"
          ]
        }
      ]
    ],
    "resps": [
      [
        "(D)"
      ]
    ],
    "filtered_resps": [
      "(D)"
    ],
    "exact_match": 0.0
  },
  {
    "doc_id": 24,
    "doc": {
      "question": "In which dementia are cognitive symptoms less likely?",
      "subject": "human_aging",
      "choices": [
        "Parkinson's",
        "Pick's",
        "Huntington's",
        "NeuroAIDS"
      ],
      "answer": 0
    },
    "target": "(A)",
    "arguments": [
      [
        "The following are multiple choice questions (with answers) about human aging.\n\nQ: The finding that adults tend to remember events from their adolescence better than from other periods in their lives is referred to as the\n(A) Adolescence advantage (B) Reminiscence bump (C) Memorial memorial (D) Quadratic retrieval spike\nA:  (B)\n\nQ: Which of the following persons is more likely to remain at home alone, as of 2019?\n(A) An Asian man or woman (B) A Hispanic man (C) An African American woman (D) A white man or woman\nA:  (C)\n\nQ: Which element in tobacco smoke is responsible for cancers?\n(A) Nicotine (B) Tar (C) Carbon monoxide (D) Smoke particles\nA:  (B)\n\nQ: When older adults move to a new state after retirement, which of the following is the more likely destination?\n(A) Texas (B) California (C) Hawaii (D) Vermont\nA:  (A)\n\nQ: All other things being equal, which of the following persons is more likely to show osteoporosis?\n(A) An older Hispanic American woman (B) An older African American woman (C) An older Asian American woman (D) An older Native American woman\nA:  (C)\n\nQ: In which dementia are cognitive symptoms less likely?\n(A) Parkinson's (B) Pick's (C) Huntington's (D) NeuroAIDS\nA: ",
        {
          "until": [
            "</s>"
          ]
        }
      ]
    ],
    "resps": [
      [
        "(A)"
      ]
    ],
    "filtered_resps": [
      "(A)"
    ],
    "exact_match": 1.0
  },
  {
    "doc_id": 32,
    "doc": {
      "question": "Free radicals are produced by",
      "subject": "human_aging",
      "choices": [
        "Normal metabolism",
        "Excess consumption of Vitamins A and C",
        "Lack of sunlight",
        "A weakened immune system"
      ],
      "answer": 0
    },
    "target": "(A)",
    "arguments": [
      [
        "The following are multiple choice questions (with answers) about human aging.\n\nQ: All other things being equal, which of the following persons is more likely to show osteoporosis?\n(A) An older Hispanic American woman (B) An older African American woman (C) An older Asian American woman (D) An older Native American woman\nA:  (C)\n\nQ: Which element in tobacco smoke is responsible for cancers?\n(A) Nicotine (B) Tar (C) Carbon monoxide (D) Smoke particles\nA:  (B)\n\nQ: Which of the following persons is more likely to remain at home alone, as of 2019?\n(A) An Asian man or woman (B) A Hispanic man (C) An African American woman (D) A white man or woman\nA:  (C)\n\nQ: When older adults move to a new state after retirement, which of the following is the more likely destination?\n(A) Texas (B) California (C) Hawaii (D) Vermont\nA:  (A)\n\nQ: The finding that adults tend to remember events from their adolescence better than from other periods in their lives is referred to as the\n(A) Adolescence advantage (B) Reminiscence bump (C) Memorial memorial (D) Quadratic retrieval spike\nA:  (B)\n\nQ: Free radicals are produced by\n(A) Normal metabolism (B) Excess consumption of Vitamins A and C (C) Lack of sunlight (D) A weakened immune system\nA: ",
        {
          "until": [
            "</s>"
          ]
        }
      ]
    ],
    "resps": [
      [
        "(D)"
      ]
    ],
    "filtered_resps": [
      "(D)"
    ],
    "exact_match": 0.0
  },
  {
    "doc_id": 40,
    "doc": {
      "question": "Some work on age stereotypes suggests that",
      "subject": "human_aging",
      "choices": [
        "Positive ones are stronger",
        "Negative ones are stronger",
        "They never last very long",
        "They are very rare"
      ],
      "answer": 1
    },
    "target": "(B)",
    "arguments": [
      [
        "The following are multiple choice questions (with answers) about human aging.\n\nQ: Which of the following persons is more likely to remain at home alone, as of 2019?\n(A) An Asian man or woman (B) A Hispanic man (C) An African American woman (D) A white man or woman\nA:  (C)\n\nQ: All other things being equal, which of the following persons is more likely to show osteoporosis?\n(A) An older Hispanic American woman (B) An older African American woman (C) An older Asian American woman (D) An older Native American woman\nA:  (C)\n\nQ: When older adults move to a new state after retirement, which of the following is the more likely destination?\n(A) Texas (B) California (C) Hawaii (D) Vermont\nA:  (A)\n\nQ: Which element in tobacco smoke is responsible for cancers?\n(A) Nicotine (B) Tar (C) Carbon monoxide (D) Smoke particles\nA:  (B)\n\nQ: The finding that adults tend to remember events from their adolescence better than from other periods in their lives is referred to as the\n(A) Adolescence advantage (B) Reminiscence bump (C) Memorial memorial (D) Quadratic retrieval spike\nA:  (B)\n\nQ: Some work on age stereotypes suggests that\n(A) Positive ones are stronger (B) Negative ones are stronger (C) They never last very long (D) They are very rare\nA: ",
        {
          "until": [
            "</s>"
          ]
        }
      ]
    ],
    "resps": [
      [
        "(B)"
      ]
    ],
    "filtered_resps": [
      "(B)"
    ],
    "exact_match": 1.0
  },
  {
    "doc_id": 48,
    "doc": {
      "question": "Which of the following hormones has not yet been claimed to ward off senescence?",
      "subject": "human_aging",
      "choices": [
        "DHEA",
        "Human growth hormone",
        "Melatonin",
        "Viasterol"
      ],
      "answer": 3
    },
    "target": "(D)",
    "arguments": [
      [
        "The following are multiple choice questions (with answers) about human aging.\n\nQ: All other things being equal, which of the following persons is more likely to show osteoporosis?\n(A) An older Hispanic American woman (B) An older African American woman (C) An older Asian American woman (D) An older Native American woman\nA:  (C)\n\nQ: Which of the following persons is more likely to remain at home alone, as of 2019?\n(A) An Asian man or woman (B) A Hispanic man (C) An African American woman (D) A white man or woman\nA:  (C)\n\nQ: When older adults move to a new state after retirement, which of the following is the more likely destination?\n(A) Texas (B) California (C) Hawaii (D) Vermont\nA:  (A)\n\nQ: The finding that adults tend to remember events from their adolescence better than from other periods in their lives is referred to as the\n(A) Adolescence advantage (B) Reminiscence bump (C) Memorial memorial (D) Quadratic retrieval spike\nA:  (B)\n\nQ: Which element in tobacco smoke is responsible for cancers?\n(A) Nicotine (B) Tar (C) Carbon monoxide (D) Smoke particles\nA:  (B)\n\nQ: Which of the following hormones has not yet been claimed to ward off senescence?\n(A) DHEA (B) Human growth hormone (C) Melatonin (D) Viasterol\nA: ",
        {
          "until": [
            "</s>"
          ]
        }
      ]
    ],
    "resps": [
      [
        "(D)"
      ]
    ],
    "filtered_resps": [
      "(D)"
    ],
    "exact_match": 1.0
  },
  {
    "doc_id": 56,
    "doc": {
      "question": "Clifford and Lucia Pauling, in Senior View, told us that physical changes",
      "subject": "human_aging",
      "choices": [
        "Are rapid and frightening",
        "Can be offset by meditation",
        "Take a long time",
        "Should not be discussed in public"
      ],
      "answer": 2
    },
    "target": "(C)",
    "arguments": [
      [
        "The following are multiple choice questions (with answers) about human aging.\n\nQ: When older adults move to a new state after retirement, which of the following is the more likely destination?\n(A) Texas (B) California (C) Hawaii (D) Vermont\nA:  (A)\n\nQ: All other things being equal, which of the following persons is more likely to show osteoporosis?\n(A) An older Hispanic American woman (B) An older African American woman (C) An older Asian American woman (D) An older Native American woman\nA:  (C)\n\nQ: Which of the following persons is more likely to remain at home alone, as of 2019?\n(A) An Asian man or woman (B) A Hispanic man (C) An African American woman (D) A white man or woman\nA:  (C)\n\nQ: Which element in tobacco smoke is responsible for cancers?\n(A) Nicotine (B) Tar (C) Carbon monoxide (D) Smoke particles\nA:  (B)\n\nQ: The finding that adults tend to remember events from their adolescence better than from other periods in their lives is referred to as the\n(A) Adolescence advantage (B) Reminiscence bump (C) Memorial memorial (D) Quadratic retrieval spike\nA:  (B)\n\nQ: Clifford and Lucia Pauling, in Senior View, told us that physical changes\n(A) Are rapid and frightening (B) Can be offset by meditation (C) Take a long time (D) Should not be discussed in public\nA: ",
        {
          "until": [
            "</s>"
          ]
        }
      ]
    ],
    "resps": [
      [
        "(B)"
      ]
    ],
    "filtered_resps": [
      "(B)"
    ],
    "exact_match": 0.0
  },
  {
    "doc_id": 64,
    "doc": {
      "question": "The term \"work-family conflict\" for middle-aged adults can occur when they must",
      "subject": "human_aging",
      "choices": [
        "Care for an ailing parent while continuing to work",
        "Work a high stress job while their children are at home",
        "Pay for nursing home care by sacrificing their own care",
        "Serving as an executor of their parent's estate while still working full time"
      ],
      "answer": 0
    },
    "target": "(A)",
    "arguments": [
      [
        "The following are multiple choice questions (with answers) about human aging.\n\nQ: All other things being equal, which of the following persons is more likely to show osteoporosis?\n(A) An older Hispanic American woman (B) An older African American woman (C) An older Asian American woman (D) An older Native American woman\nA:  (C)\n\nQ: Which of the following persons is more likely to remain at home alone, as of 2019?\n(A) An Asian man or woman (B) A Hispanic man (C) An African American woman (D) A white man or woman\nA:  (C)\n\nQ: When older adults move to a new state after retirement, which of the following is the more likely destination?\n(A) Texas (B) California (C) Hawaii (D) Vermont\nA:  (A)\n\nQ: Which element in tobacco smoke is responsible for cancers?\n(A) Nicotine (B) Tar (C) Carbon monoxide (D) Smoke particles\nA:  (B)\n\nQ: The finding that adults tend to remember events from their adolescence better than from other periods in their lives is referred to as the\n(A) Adolescence advantage (B) Reminiscence bump (C) Memorial memorial (D) Quadratic retrieval spike\nA:  (B)\n\nQ: The term \"work-family conflict\" for middle-aged adults can occur when they must\n(A) Care for an ailing parent while continuing to work (B) Work a high stress job while their children are at home (C) Pay for nursing home care by sacrificing their own care (D) Serving as an executor of their parent's estate while still working full time\nA: ",
        {
          "until": [
            "</s>"
          ]
        }
      ]
    ],
    "resps": [
      [
        "(B)"
      ]
    ],
    "filtered_resps": [
      "(B)"
    ],
    "exact_match": 0.0
  },
  {
    "doc_id": 72,
    "doc": {
      "question": "Human factors examines the performance of different tasks by examining",
      "subject": "human_aging",
      "choices": [
        "The factors that influence performance",
        "The interaction between human and environment",
        "The human side of the equation",
        "The effects of environmental changes on humans"
      ],
      "answer": 1
    },
    "target": "(B)",
    "arguments": [
      [
        "The following are multiple choice questions (with answers) about human aging.\n\nQ: When older adults move to a new state after retirement, which of the following is the more likely destination?\n(A) Texas (B) California (C) Hawaii (D) Vermont\nA:  (A)\n\nQ: The finding that adults tend to remember events from their adolescence better than from other periods in their lives is referred to as the\n(A) Adolescence advantage (B) Reminiscence bump (C) Memorial memorial (D) Quadratic retrieval spike\nA:  (B)\n\nQ: All other things being equal, which of the following persons is more likely to show osteoporosis?\n(A) An older Hispanic American woman (B) An older African American woman (C) An older Asian American woman (D) An older Native American woman\nA:  (C)\n\nQ: Which element in tobacco smoke is responsible for cancers?\n(A) Nicotine (B) Tar (C) Carbon monoxide (D) Smoke particles\nA:  (B)\n\nQ: Which of the following persons is more likely to remain at home alone, as of 2019?\n(A) An Asian man or woman (B) A Hispanic man (C) An African American woman (D) A white man or woman\nA:  (C)\n\nQ: Human factors examines the performance of different tasks by examining\n(A) The factors that influence performance (B) The interaction between human and environment (C) The human side of the equation (D) The effects of environmental changes on humans\nA: ",
        {
          "until": [
            "</s>"
          ]
        }
      ]
    ],
    "resps": [
      [
        "(A)"
      ]
    ],
    "filtered_resps": [
      "(A)"
    ],
    "exact_match": 0.0
  },
  {
    "doc_id": 80,
    "doc": {
      "question": "The most frequent chronic condition for older adults is",
      "subject": "human_aging",
      "choices": [
        "Hypertension",
        "Arthritis",
        "Diabetes",
        "Cataracts"
      ],
      "answer": 1
    },
    "target": "(B)",
    "arguments": [
      [
        "The following are multiple choice questions (with answers) about human aging.\n\nQ: The finding that adults tend to remember events from their adolescence better than from other periods in their lives is referred to as the\n(A) Adolescence advantage (B) Reminiscence bump (C) Memorial memorial (D) Quadratic retrieval spike\nA:  (B)\n\nQ: Which of the following persons is more likely to remain at home alone, as of 2019?\n(A) An Asian man or woman (B) A Hispanic man (C) An African American woman (D) A white man or woman\nA:  (C)\n\nQ: Which element in tobacco smoke is responsible for cancers?\n(A) Nicotine (B) Tar (C) Carbon monoxide (D) Smoke particles\nA:  (B)\n\nQ: All other things being equal, which of the following persons is more likely to show osteoporosis?\n(A) An older Hispanic American woman (B) An older African American woman (C) An older Asian American woman (D) An older Native American woman\nA:  (C)\n\nQ: When older adults move to a new state after retirement, which of the following is the more likely destination?\n(A) Texas (B) California (C) Hawaii (D) Vermont\nA:  (A)\n\nQ: The most frequent chronic condition for older adults is\n(A) Hypertension (B) Arthritis (C) Diabetes (D) Cataracts\nA: ",
        {
          "until": [
            "</s>"
          ]
        }
      ]
    ],
    "resps": [
      [
        "(B)"
      ]
    ],
    "filtered_resps": [
      "(B)"
    ],
    "exact_match": 1.0
  },
  {
    "doc_id": 88,
    "doc": {
      "question": "The term \"cohort\" refers to",
      "subject": "human_aging",
      "choices": [
        "An individual's chronological age",
        "A generation of people who lived through major events",
        "A person's gender",
        "A group of people living in the same culture"
      ],
      "answer": 1
    },
    "target": "(B)",
    "arguments": [
      [
        "The following are multiple choice questions (with answers) about human aging.\n\nQ: Which of the following persons is more likely to remain at home alone, as of 2019?\n(A) An Asian man or woman (B) A Hispanic man (C) An African American woman (D) A white man or woman\nA:  (C)\n\nQ: The finding that adults tend to remember events from their adolescence better than from other periods in their lives is referred to as the\n(A) Adolescence advantage (B) Reminiscence bump (C) Memorial memorial (D) Quadratic retrieval spike\nA:  (B)\n\nQ: All other things being equal, which of the following persons is more likely to show osteoporosis?\n(A) An older Hispanic American woman (B) An older African American woman (C) An older Asian American woman (D) An older Native American woman\nA:  (C)\n\nQ: When older adults move to a new state after retirement, which of the following is the more likely destination?\n(A) Texas (B) California (C) Hawaii (D) Vermont\nA:  (A)\n\nQ: Which element in tobacco smoke is responsible for cancers?\n(A) Nicotine (B) Tar (C) Carbon monoxide (D) Smoke particles\nA:  (B)\n\nQ: The term \"cohort\" refers to\n(A) An individual's chronological age (B) A generation of people who lived through major events (C) A person's gender (D) A group of people living in the same culture\nA: ",
        {
          "until": [
            "</s>"
          ]
        }
      ]
    ],
    "resps": [
      [
        "(B)"
      ]
    ],
    "filtered_resps": [
      "(B)"
    ],
    "exact_match": 1.0
  },
  {
    "doc_id": 96,
    "doc": {
      "question": "Being in bright light during the later parts of the day seems to",
      "subject": "human_aging",
      "choices": [
        "Restore normal circadian rhythm",
        "Increase insomnia",
        "Restore deep sleep",
        "Have no real influence on sleep or dreams"
      ],
      "answer": 0
    },
    "target": "(A)",
    "arguments": [
      [
        "The following are multiple choice questions (with answers) about human aging.\n\nQ: Which of the following persons is more likely to remain at home alone, as of 2019?\n(A) An Asian man or woman (B) A Hispanic man (C) An African American woman (D) A white man or woman\nA:  (C)\n\nQ: The finding that adults tend to remember events from their adolescence better than from other periods in their lives is referred to as the\n(A) Adolescence advantage (B) Reminiscence bump (C) Memorial memorial (D) Quadratic retrieval spike\nA:  (B)\n\nQ: When older adults move to a new state after retirement, which of the following is the more likely destination?\n(A) Texas (B) California (C) Hawaii (D) Vermont\nA:  (A)\n\nQ: Which element in tobacco smoke is responsible for cancers?\n(A) Nicotine (B) Tar (C) Carbon monoxide (D) Smoke particles\nA:  (B)\n\nQ: All other things being equal, which of the following persons is more likely to show osteoporosis?\n(A) An older Hispanic American woman (B) An older African American woman (C) An older Asian American woman (D) An older Native American woman\nA:  (C)\n\nQ: Being in bright light during the later parts of the day seems to\n(A) Restore normal circadian rhythm (B) Increase insomnia (C) Restore deep sleep (D) Have no real influence on sleep or dreams\nA: ",
        {
          "until": [
            "</s>"
          ]
        }
      ]
    ],
    "resps": [
      [
        "(B)"
      ]
    ],
    "filtered_resps": [
      "(B)"
    ],
    "exact_match": 0.0
  },
  {
    "doc_id": 104,
    "doc": {
      "question": "The gender gap is likely to be associated with male/female differences in",
      "subject": "human_aging",
      "choices": [
        "Hormones",
        "Risky behaviors and occupations",
        "Proportion who smoke",
        "All of the above"
      ],
      "answer": 3
    },
    "target": "(D)",
    "arguments": [
      [
        "The following are multiple choice questions (with answers) about human aging.\n\nQ: Which of the following persons is more likely to remain at home alone, as of 2019?\n(A) An Asian man or woman (B) A Hispanic man (C) An African American woman (D) A white man or woman\nA:  (C)\n\nQ: Which element in tobacco smoke is responsible for cancers?\n(A) Nicotine (B) Tar (C) Carbon monoxide (D) Smoke particles\nA:  (B)\n\nQ: The finding that adults tend to remember events from their adolescence better than from other periods in their lives is referred to as the\n(A) Adolescence advantage (B) Reminiscence bump (C) Memorial memorial (D) Quadratic retrieval spike\nA:  (B)\n\nQ: All other things being equal, which of the following persons is more likely to show osteoporosis?\n(A) An older Hispanic American woman (B) An older African American woman (C) An older Asian American woman (D) An older Native American woman\nA:  (C)\n\nQ: When older adults move to a new state after retirement, which of the following is the more likely destination?\n(A) Texas (B) California (C) Hawaii (D) Vermont\nA:  (A)\n\nQ: The gender gap is likely to be associated with male/female differences in\n(A) Hormones (B) Risky behaviors and occupations (C) Proportion who smoke (D) All of the above\nA: ",
        {
          "until": [
            "</s>"
          ]
        }
      ]
    ],
    "resps": [
      [
        "(D)"
      ]
    ],
    "filtered_resps": [
      "(D)"
    ],
    "exact_match": 1.0
  },
  {
    "doc_id": 112,
    "doc": {
      "question": "With respect to hair loss",
      "subject": "human_aging",
      "choices": [
        "Men lose but women do not",
        "Men are more systematic than women",
        "Women lose hair less frequently but more rapidly than men",
        "Environmental factors are the main causes"
      ],
      "answer": 1
    },
    "target": "(B)",
    "arguments": [
      [
        "The following are multiple choice questions (with answers) about human aging.\n\nQ: When older adults move to a new state after retirement, which of the following is the more likely destination?\n(A) Texas (B) California (C) Hawaii (D) Vermont\nA:  (A)\n\nQ: The finding that adults tend to remember events from their adolescence better than from other periods in their lives is referred to as the\n(A) Adolescence advantage (B) Reminiscence bump (C) Memorial memorial (D) Quadratic retrieval spike\nA:  (B)\n\nQ: Which element in tobacco smoke is responsible for cancers?\n(A) Nicotine (B) Tar (C) Carbon monoxide (D) Smoke particles\nA:  (B)\n\nQ: Which of the following persons is more likely to remain at home alone, as of 2019?\n(A) An Asian man or woman (B) A Hispanic man (C) An African American woman (D) A white man or woman\nA:  (C)\n\nQ: All other things being equal, which of the following persons is more likely to show osteoporosis?\n(A) An older Hispanic American woman (B) An older African American woman (C) An older Asian American woman (D) An older Native American woman\nA:  (C)\n\nQ: With respect to hair loss\n(A) Men lose but women do not (B) Men are more systematic than women (C) Women lose hair less frequently but more rapidly than men (D) Environmental factors are the main causes\nA: ",
        {
          "until": [
            "</s>"
          ]
        }
      ]
    ],
    "resps": [
      [
        "(C)"
      ]
    ],
    "filtered_resps": [
      "(C)"
    ],
    "exact_match": 0.0
  },
  {
    "doc_id": 120,
    "doc": {
      "question": "When a measure actually quantifies what it claims to measure, we say that it has good",
      "subject": "human_aging",
      "choices": [
        "Accuracy",
        "Validity",
        "Reliability",
        "Associative value"
      ],
      "answer": 1
    },
    "target": "(B)",
    "arguments": [
      [
        "The following are multiple choice questions (with answers) about human aging.\n\nQ: Which of the following persons is more likely to remain at home alone, as of 2019?\n(A) An Asian man or woman (B) A Hispanic man (C) An African American woman (D) A white man or woman\nA:  (C)\n\nQ: Which element in tobacco smoke is responsible for cancers?\n(A) Nicotine (B) Tar (C) Carbon monoxide (D) Smoke particles\nA:  (B)\n\nQ: The finding that adults tend to remember events from their adolescence better than from other periods in their lives is referred to as the\n(A) Adolescence advantage (B) Reminiscence bump (C) Memorial memorial (D) Quadratic retrieval spike\nA:  (B)\n\nQ: When older adults move to a new state after retirement, which of the following is the more likely destination?\n(A) Texas (B) California (C) Hawaii (D) Vermont\nA:  (A)\n\nQ: All other things being equal, which of the following persons is more likely to show osteoporosis?\n(A) An older Hispanic American woman (B) An older African American woman (C) An older Asian American woman (D) An older Native American woman\nA:  (C)\n\nQ: When a measure actually quantifies what it claims to measure, we say that it has good\n(A) Accuracy (B) Validity (C) Reliability (D) Associative value\nA: ",
        {
          "until": [
            "</s>"
          ]
        }
      ]
    ],
    "resps": [
      [
        "(A)"
      ]
    ],
    "filtered_resps": [
      "(A)"
    ],
    "exact_match": 0.0
  },
  {
    "doc_id": 128,
    "doc": {
      "question": "In this chapter's\u00a0Senior View, May Lee told us that we should all respect our elders because",
      "subject": "human_aging",
      "choices": [
        "They are much older than we are",
        "They raised us",
        "They lived through difficult times",
        "They ask nothing in return"
      ],
      "answer": 1
    },
    "target": "(B)",
    "arguments": [
      [
        "The following are multiple choice questions (with answers) about human aging.\n\nQ: All other things being equal, which of the following persons is more likely to show osteoporosis?\n(A) An older Hispanic American woman (B) An older African American woman (C) An older Asian American woman (D) An older Native American woman\nA:  (C)\n\nQ: Which element in tobacco smoke is responsible for cancers?\n(A) Nicotine (B) Tar (C) Carbon monoxide (D) Smoke particles\nA:  (B)\n\nQ: The finding that adults tend to remember events from their adolescence better than from other periods in their lives is referred to as the\n(A) Adolescence advantage (B) Reminiscence bump (C) Memorial memorial (D) Quadratic retrieval spike\nA:  (B)\n\nQ: Which of the following persons is more likely to remain at home alone, as of 2019?\n(A) An Asian man or woman (B) A Hispanic man (C) An African American woman (D) A white man or woman\nA:  (C)\n\nQ: When older adults move to a new state after retirement, which of the following is the more likely destination?\n(A) Texas (B) California (C) Hawaii (D) Vermont\nA:  (A)\n\nQ: In this chapter's\u00a0Senior View, May Lee told us that we should all respect our elders because\n(A) They are much older than we are (B) They raised us (C) They lived through difficult times (D) They ask nothing in return\nA: ",
        {
          "until": [
            "</s>"
          ]
        }
      ]
    ],
    "resps": [
      [
        "(B)"
      ]
    ],
    "filtered_resps": [
      "(B)"
    ],
    "exact_match": 1.0
  },
  {
    "doc_id": 136,
    "doc": {
      "question": "One possible reason that time seems to pass more rapidly for older adults is that",
      "subject": "human_aging",
      "choices": [
        "Their memories are poor so they forget to check the time",
        "They have fewer novel experiences",
        "They pay less attention to important events in life",
        "Their lives are full of events which they don't recall at a later time"
      ],
      "answer": 1
    },
    "target": "(B)",
    "arguments": [
      [
        "The following are multiple choice questions (with answers) about human aging.\n\nQ: All other things being equal, which of the following persons is more likely to show osteoporosis?\n(A) An older Hispanic American woman (B) An older African American woman (C) An older Asian American woman (D) An older Native American woman\nA:  (C)\n\nQ: The finding that adults tend to remember events from their adolescence better than from other periods in their lives is referred to as the\n(A) Adolescence advantage (B) Reminiscence bump (C) Memorial memorial (D) Quadratic retrieval spike\nA:  (B)\n\nQ: Which element in tobacco smoke is responsible for cancers?\n(A) Nicotine (B) Tar (C) Carbon monoxide (D) Smoke particles\nA:  (B)\n\nQ: When older adults move to a new state after retirement, which of the following is the more likely destination?\n(A) Texas (B) California (C) Hawaii (D) Vermont\nA:  (A)\n\nQ: Which of the following persons is more likely to remain at home alone, as of 2019?\n(A) An Asian man or woman (B) A Hispanic man (C) An African American woman (D) A white man or woman\nA:  (C)\n\nQ: One possible reason that time seems to pass more rapidly for older adults is that\n(A) Their memories are poor so they forget to check the time (B) They have fewer novel experiences (C) They pay less attention to important events in life (D) Their lives are full of events which they don't recall at a later time\nA: ",
        {
          "until": [
            "</s>"
          ]
        }
      ]
    ],
    "resps": [
      [
        "(D)"
      ]
    ],
    "filtered_resps": [
      "(D)"
    ],
    "exact_match": 0.0
  },
  {
    "doc_id": 144,
    "doc": {
      "question": "Validation therapy refers to treatments in which the person with dementia",
      "subject": "human_aging",
      "choices": [
        "Is carefully monitored day and night",
        "Is treated like a fellow human being",
        "Is left alone to die peacefully",
        "Is given double or triple doses of medication"
      ],
      "answer": 1
    },
    "target": "(B)",
    "arguments": [
      [
        "The following are multiple choice questions (with answers) about human aging.\n\nQ: When older adults move to a new state after retirement, which of the following is the more likely destination?\n(A) Texas (B) California (C) Hawaii (D) Vermont\nA:  (A)\n\nQ: Which of the following persons is more likely to remain at home alone, as of 2019?\n(A) An Asian man or woman (B) A Hispanic man (C) An African American woman (D) A white man or woman\nA:  (C)\n\nQ: Which element in tobacco smoke is responsible for cancers?\n(A) Nicotine (B) Tar (C) Carbon monoxide (D) Smoke particles\nA:  (B)\n\nQ: The finding that adults tend to remember events from their adolescence better than from other periods in their lives is referred to as the\n(A) Adolescence advantage (B) Reminiscence bump (C) Memorial memorial (D) Quadratic retrieval spike\nA:  (B)\n\nQ: All other things being equal, which of the following persons is more likely to show osteoporosis?\n(A) An older Hispanic American woman (B) An older African American woman (C) An older Asian American woman (D) An older Native American woman\nA:  (C)\n\nQ: Validation therapy refers to treatments in which the person with dementia\n(A) Is carefully monitored day and night (B) Is treated like a fellow human being (C) Is left alone to die peacefully (D) Is given double or triple doses of medication\nA: ",
        {
          "until": [
            "</s>"
          ]
        }
      ]
    ],
    "resps": [
      [
        "(D)"
      ]
    ],
    "filtered_resps": [
      "(D)"
    ],
    "exact_match": 0.0
  },
  {
    "doc_id": 152,
    "doc": {
      "question": "NEAT may be one way in which some people are able to maintain a healthy BMI; NEAT refers to",
      "subject": "human_aging",
      "choices": [
        "Eating the right kinds of low calorie foods",
        "Daily activities like walking, gesturing, and even fidgeting",
        "Intense aerobic exercise practiced at least 3 times a week",
        "Surgical removal of fatty tissue"
      ],
      "answer": 1
    },
    "target": "(B)",
    "arguments": [
      [
        "The following are multiple choice questions (with answers) about human aging.\n\nQ: Which of the following persons is more likely to remain at home alone, as of 2019?\n(A) An Asian man or woman (B) A Hispanic man (C) An African American woman (D) A white man or woman\nA:  (C)\n\nQ: All other things being equal, which of the following persons is more likely to show osteoporosis?\n(A) An older Hispanic American woman (B) An older African American woman (C) An older Asian American woman (D) An older Native American woman\nA:  (C)\n\nQ: The finding that adults tend to remember events from their adolescence better than from other periods in their lives is referred to as the\n(A) Adolescence advantage (B) Reminiscence bump (C) Memorial memorial (D) Quadratic retrieval spike\nA:  (B)\n\nQ: When older adults move to a new state after retirement, which of the following is the more likely destination?\n(A) Texas (B) California (C) Hawaii (D) Vermont\nA:  (A)\n\nQ: Which element in tobacco smoke is responsible for cancers?\n(A) Nicotine (B) Tar (C) Carbon monoxide (D) Smoke particles\nA:  (B)\n\nQ: NEAT may be one way in which some people are able to maintain a healthy BMI; NEAT refers to\n(A) Eating the right kinds of low calorie foods (B) Daily activities like walking, gesturing, and even fidgeting (C) Intense aerobic exercise practiced at least 3 times a week (D) Surgical removal of fatty tissue\nA: ",
        {
          "until": [
            "</s>"
          ]
        }
      ]
    ],
    "resps": [
      [
        "(A)"
      ]
    ],
    "filtered_resps": [
      "(A)"
    ],
    "exact_match": 0.0
  },
  {
    "doc_id": 160,
    "doc": {
      "question": "The main reason given by men and women for their long lasting marriage is that",
      "subject": "human_aging",
      "choices": [
        "They are best friends",
        "They must fulfill their vows",
        "They agree on almost everything",
        "They owe it to their children"
      ],
      "answer": 0
    },
    "target": "(A)",
    "arguments": [
      [
        "The following are multiple choice questions (with answers) about human aging.\n\nQ: The finding that adults tend to remember events from their adolescence better than from other periods in their lives is referred to as the\n(A) Adolescence advantage (B) Reminiscence bump (C) Memorial memorial (D) Quadratic retrieval spike\nA:  (B)\n\nQ: When older adults move to a new state after retirement, which of the following is the more likely destination?\n(A) Texas (B) California (C) Hawaii (D) Vermont\nA:  (A)\n\nQ: Which of the following persons is more likely to remain at home alone, as of 2019?\n(A) An Asian man or woman (B) A Hispanic man (C) An African American woman (D) A white man or woman\nA:  (C)\n\nQ: Which element in tobacco smoke is responsible for cancers?\n(A) Nicotine (B) Tar (C) Carbon monoxide (D) Smoke particles\nA:  (B)\n\nQ: All other things being equal, which of the following persons is more likely to show osteoporosis?\n(A) An older Hispanic American woman (B) An older African American woman (C) An older Asian American woman (D) An older Native American woman\nA:  (C)\n\nQ: The main reason given by men and women for their long lasting marriage is that\n(A) They are best friends (B) They must fulfill their vows (C) They agree on almost everything (D) They owe it to their children\nA: ",
        {
          "until": [
            "</s>"
          ]
        }
      ]
    ],
    "resps": [
      [
        "(B)"
      ]
    ],
    "filtered_resps": [
      "(B)"
    ],
    "exact_match": 0.0
  },
  {
    "doc_id": 168,
    "doc": {
      "question": "Which of the following is NOT among the top 10 causes of death in the U. S.?",
      "subject": "human_aging",
      "choices": [
        "Kidney diseases",
        "AIDS",
        "Septicemia",
        "Accidents"
      ],
      "answer": 1
    },
    "target": "(B)",
    "arguments": [
      [
        "The following are multiple choice questions (with answers) about human aging.\n\nQ: The finding that adults tend to remember events from their adolescence better than from other periods in their lives is referred to as the\n(A) Adolescence advantage (B) Reminiscence bump (C) Memorial memorial (D) Quadratic retrieval spike\nA:  (B)\n\nQ: When older adults move to a new state after retirement, which of the following is the more likely destination?\n(A) Texas (B) California (C) Hawaii (D) Vermont\nA:  (A)\n\nQ: All other things being equal, which of the following persons is more likely to show osteoporosis?\n(A) An older Hispanic American woman (B) An older African American woman (C) An older Asian American woman (D) An older Native American woman\nA:  (C)\n\nQ: Which of the following persons is more likely to remain at home alone, as of 2019?\n(A) An Asian man or woman (B) A Hispanic man (C) An African American woman (D) A white man or woman\nA:  (C)\n\nQ: Which element in tobacco smoke is responsible for cancers?\n(A) Nicotine (B) Tar (C) Carbon monoxide (D) Smoke particles\nA:  (B)\n\nQ: Which of the following is NOT among the top 10 causes of death in the U. S.?\n(A) Kidney diseases (B) AIDS (C) Septicemia (D) Accidents\nA: ",
        {
          "until": [
            "</s>"
          ]
        }
      ]
    ],
    "resps": [
      [
        "(D)"
      ]
    ],
    "filtered_resps": [
      "(D)"
    ],
    "exact_match": 0.0
  },
  {
    "doc_id": 176,
    "doc": {
      "question": "Life stories are more likely for people who have a sense of",
      "subject": "human_aging",
      "choices": [
        "Well being",
        "Personal control",
        "Generativity",
        "Humor"
      ],
      "answer": 1
    },
    "target": "(B)",
    "arguments": [
      [
        "The following are multiple choice questions (with answers) about human aging.\n\nQ: Which element in tobacco smoke is responsible for cancers?\n(A) Nicotine (B) Tar (C) Carbon monoxide (D) Smoke particles\nA:  (B)\n\nQ: The finding that adults tend to remember events from their adolescence better than from other periods in their lives is referred to as the\n(A) Adolescence advantage (B) Reminiscence bump (C) Memorial memorial (D) Quadratic retrieval spike\nA:  (B)\n\nQ: Which of the following persons is more likely to remain at home alone, as of 2019?\n(A) An Asian man or woman (B) A Hispanic man (C) An African American woman (D) A white man or woman\nA:  (C)\n\nQ: All other things being equal, which of the following persons is more likely to show osteoporosis?\n(A) An older Hispanic American woman (B) An older African American woman (C) An older Asian American woman (D) An older Native American woman\nA:  (C)\n\nQ: When older adults move to a new state after retirement, which of the following is the more likely destination?\n(A) Texas (B) California (C) Hawaii (D) Vermont\nA:  (A)\n\nQ: Life stories are more likely for people who have a sense of\n(A) Well being (B) Personal control (C) Generativity (D) Humor\nA: ",
        {
          "until": [
            "</s>"
          ]
        }
      ]
    ],
    "resps": [
      [
        "(A)"
      ]
    ],
    "filtered_resps": [
      "(A)"
    ],
    "exact_match": 0.0
  },
  {
    "doc_id": 184,
    "doc": {
      "question": "A difference between the social networks of older and younger adults is that older adults have",
      "subject": "human_aging",
      "choices": [
        "Larger inner circles",
        "Larger outer circles",
        "Smaller inner circles",
        "Smaller outer circles"
      ],
      "answer": 3
    },
    "target": "(D)",
    "arguments": [
      [
        "The following are multiple choice questions (with answers) about human aging.\n\nQ: The finding that adults tend to remember events from their adolescence better than from other periods in their lives is referred to as the\n(A) Adolescence advantage (B) Reminiscence bump (C) Memorial memorial (D) Quadratic retrieval spike\nA:  (B)\n\nQ: Which of the following persons is more likely to remain at home alone, as of 2019?\n(A) An Asian man or woman (B) A Hispanic man (C) An African American woman (D) A white man or woman\nA:  (C)\n\nQ: When older adults move to a new state after retirement, which of the following is the more likely destination?\n(A) Texas (B) California (C) Hawaii (D) Vermont\nA:  (A)\n\nQ: All other things being equal, which of the following persons is more likely to show osteoporosis?\n(A) An older Hispanic American woman (B) An older African American woman (C) An older Asian American woman (D) An older Native American woman\nA:  (C)\n\nQ: Which element in tobacco smoke is responsible for cancers?\n(A) Nicotine (B) Tar (C) Carbon monoxide (D) Smoke particles\nA:  (B)\n\nQ: A difference between the social networks of older and younger adults is that older adults have\n(A) Larger inner circles (B) Larger outer circles (C) Smaller inner circles (D) Smaller outer circles\nA: ",
        {
          "until": [
            "</s>"
          ]
        }
      ]
    ],
    "resps": [
      [
        "(A)"
      ]
    ],
    "filtered_resps": [
      "(A)"
    ],
    "exact_match": 0.0
  },
  {
    "doc_id": 192,
    "doc": {
      "question": "Comorbidity is a problem for older adults because it",
      "subject": "human_aging",
      "choices": [
        "Makes correct diagnoses difficult",
        "Increases funeral costs",
        "Is very contagious",
        "Cannot, at present, be cured"
      ],
      "answer": 0
    },
    "target": "(A)",
    "arguments": [
      [
        "The following are multiple choice questions (with answers) about human aging.\n\nQ: Which element in tobacco smoke is responsible for cancers?\n(A) Nicotine (B) Tar (C) Carbon monoxide (D) Smoke particles\nA:  (B)\n\nQ: Which of the following persons is more likely to remain at home alone, as of 2019?\n(A) An Asian man or woman (B) A Hispanic man (C) An African American woman (D) A white man or woman\nA:  (C)\n\nQ: When older adults move to a new state after retirement, which of the following is the more likely destination?\n(A) Texas (B) California (C) Hawaii (D) Vermont\nA:  (A)\n\nQ: The finding that adults tend to remember events from their adolescence better than from other periods in their lives is referred to as the\n(A) Adolescence advantage (B) Reminiscence bump (C) Memorial memorial (D) Quadratic retrieval spike\nA:  (B)\n\nQ: All other things being equal, which of the following persons is more likely to show osteoporosis?\n(A) An older Hispanic American woman (B) An older African American woman (C) An older Asian American woman (D) An older Native American woman\nA:  (C)\n\nQ: Comorbidity is a problem for older adults because it\n(A) Makes correct diagnoses difficult (B) Increases funeral costs (C) Is very contagious (D) Cannot, at present, be cured\nA: ",
        {
          "until": [
            "</s>"
          ]
        }
      ]
    ],
    "resps": [
      [
        "(A)"
      ]
    ],
    "filtered_resps": [
      "(A)"
    ],
    "exact_match": 1.0
  },
  {
    "doc_id": 200,
    "doc": {
      "question": "Hearing loss for higher pitch is referred to as",
      "subject": "human_aging",
      "choices": [
        "Presbyopia",
        "Presbycusis",
        "Pitch deafness",
        "Conductive loss"
      ],
      "answer": 1
    },
    "target": "(B)",
    "arguments": [
      [
        "The following are multiple choice questions (with answers) about human aging.\n\nQ: Which element in tobacco smoke is responsible for cancers?\n(A) Nicotine (B) Tar (C) Carbon monoxide (D) Smoke particles\nA:  (B)\n\nQ: The finding that adults tend to remember events from their adolescence better than from other periods in their lives is referred to as the\n(A) Adolescence advantage (B) Reminiscence bump (C) Memorial memorial (D) Quadratic retrieval spike\nA:  (B)\n\nQ: Which of the following persons is more likely to remain at home alone, as of 2019?\n(A) An Asian man or woman (B) A Hispanic man (C) An African American woman (D) A white man or woman\nA:  (C)\n\nQ: All other things being equal, which of the following persons is more likely to show osteoporosis?\n(A) An older Hispanic American woman (B) An older African American woman (C) An older Asian American woman (D) An older Native American woman\nA:  (C)\n\nQ: When older adults move to a new state after retirement, which of the following is the more likely destination?\n(A) Texas (B) California (C) Hawaii (D) Vermont\nA:  (A)\n\nQ: Hearing loss for higher pitch is referred to as\n(A) Presbyopia (B) Presbycusis (C) Pitch deafness (D) Conductive loss\nA: ",
        {
          "until": [
            "</s>"
          ]
        }
      ]
    ],
    "resps": [
      [
        "(C)"
      ]
    ],
    "filtered_resps": [
      "(C)"
    ],
    "exact_match": 0.0
  },
  {
    "doc_id": 208,
    "doc": {
      "question": "The Supreme Court has now ruled that older workers need no longer prove _____________ to win a job discrimination suit.",
      "subject": "human_aging",
      "choices": [
        "Discrimination",
        "Age bias",
        "Negative impact",
        "Intention"
      ],
      "answer": 3
    },
    "target": "(D)",
    "arguments": [
      [
        "The following are multiple choice questions (with answers) about human aging.\n\nQ: Which element in tobacco smoke is responsible for cancers?\n(A) Nicotine (B) Tar (C) Carbon monoxide (D) Smoke particles\nA:  (B)\n\nQ: The finding that adults tend to remember events from their adolescence better than from other periods in their lives is referred to as the\n(A) Adolescence advantage (B) Reminiscence bump (C) Memorial memorial (D) Quadratic retrieval spike\nA:  (B)\n\nQ: All other things being equal, which of the following persons is more likely to show osteoporosis?\n(A) An older Hispanic American woman (B) An older African American woman (C) An older Asian American woman (D) An older Native American woman\nA:  (C)\n\nQ: Which of the following persons is more likely to remain at home alone, as of 2019?\n(A) An Asian man or woman (B) A Hispanic man (C) An African American woman (D) A white man or woman\nA:  (C)\n\nQ: When older adults move to a new state after retirement, which of the following is the more likely destination?\n(A) Texas (B) California (C) Hawaii (D) Vermont\nA:  (A)\n\nQ: The Supreme Court has now ruled that older workers need no longer prove _____________ to win a job discrimination suit.\n(A) Discrimination (B) Age bias (C) Negative impact (D) Intention\nA: ",
        {
          "until": [
            "</s>"
          ]
        }
      ]
    ],
    "resps": [
      [
        "(B)"
      ]
    ],
    "filtered_resps": [
      "(B)"
    ],
    "exact_match": 0.0
  },
  {
    "doc_id": 216,
    "doc": {
      "question": "Older workers are more likely to",
      "subject": "human_aging",
      "choices": [
        "Be absent from work",
        "Be dissatisfied with their jobs",
        "Be less productive",
        "Be laid off"
      ],
      "answer": 3
    },
    "target": "(D)",
    "arguments": [
      [
        "The following are multiple choice questions (with answers) about human aging.\n\nQ: The finding that adults tend to remember events from their adolescence better than from other periods in their lives is referred to as the\n(A) Adolescence advantage (B) Reminiscence bump (C) Memorial memorial (D) Quadratic retrieval spike\nA:  (B)\n\nQ: All other things being equal, which of the following persons is more likely to show osteoporosis?\n(A) An older Hispanic American woman (B) An older African American woman (C) An older Asian American woman (D) An older Native American woman\nA:  (C)\n\nQ: Which element in tobacco smoke is responsible for cancers?\n(A) Nicotine (B) Tar (C) Carbon monoxide (D) Smoke particles\nA:  (B)\n\nQ: Which of the following persons is more likely to remain at home alone, as of 2019?\n(A) An Asian man or woman (B) A Hispanic man (C) An African American woman (D) A white man or woman\nA:  (C)\n\nQ: When older adults move to a new state after retirement, which of the following is the more likely destination?\n(A) Texas (B) California (C) Hawaii (D) Vermont\nA:  (A)\n\nQ: Older workers are more likely to\n(A) Be absent from work (B) Be dissatisfied with their jobs (C) Be less productive (D) Be laid off\nA: ",
        {
          "until": [
            "</s>"
          ]
        }
      ]
    ],
    "resps": [
      [
        "(C)"
      ]
    ],
    "filtered_resps": [
      "(C)"
    ],
    "exact_match": 0.0
  },
  {
    "doc_id": 1,
    "doc": {
      "question": "Which of the following factors is associated with a decreased risk of Alzheimer's?",
      "subject": "human_aging",
      "choices": [
        "Being African or Hispanic American",
        "Eating fish",
        "A lower level of education",
        "Being married"
      ],
      "answer": 1
    },
    "target": "(B)",
    "arguments": [
      [
        "The following are multiple choice questions (with answers) about human aging.\n\nQ: Which element in tobacco smoke is responsible for cancers?\n(A) Nicotine (B) Tar (C) Carbon monoxide (D) Smoke particles\nA:  (B)\n\nQ: Which of the following persons is more likely to remain at home alone, as of 2019?\n(A) An Asian man or woman (B) A Hispanic man (C) An African American woman (D) A white man or woman\nA:  (C)\n\nQ: All other things being equal, which of the following persons is more likely to show osteoporosis?\n(A) An older Hispanic American woman (B) An older African American woman (C) An older Asian American woman (D) An older Native American woman\nA:  (C)\n\nQ: When older adults move to a new state after retirement, which of the following is the more likely destination?\n(A) Texas (B) California (C) Hawaii (D) Vermont\nA:  (A)\n\nQ: The finding that adults tend to remember events from their adolescence better than from other periods in their lives is referred to as the\n(A) Adolescence advantage (B) Reminiscence bump (C) Memorial memorial (D) Quadratic retrieval spike\nA:  (B)\n\nQ: Which of the following factors is associated with a decreased risk of Alzheimer's?\n(A) Being African or Hispanic American (B) Eating fish (C) A lower level of education (D) Being married\nA: ",
        {
          "until": [
            "</s>"
          ]
        }
      ]
    ],
    "resps": [
      [
        "(D)"
      ]
    ],
    "filtered_resps": [
      "(D)"
    ],
    "exact_match": 0.0
  },
  {
    "doc_id": 9,
    "doc": {
      "question": "A major difference between programmed and unprogrammed theories of senescence is that programmed theories",
      "subject": "human_aging",
      "choices": [
        "Attribute senescence only to environmental factors",
        "Are far too difficulty to test",
        "Claim that senescence follows a predetermined plan",
        "Rely too heavily on computer models"
      ],
      "answer": 2
    },
    "target": "(C)",
    "arguments": [
      [
        "The following are multiple choice questions (with answers) about human aging.\n\nQ: Which of the following persons is more likely to remain at home alone, as of 2019?\n(A) An Asian man or woman (B) A Hispanic man (C) An African American woman (D) A white man or woman\nA:  (C)\n\nQ: All other things being equal, which of the following persons is more likely to show osteoporosis?\n(A) An older Hispanic American woman (B) An older African American woman (C) An older Asian American woman (D) An older Native American woman\nA:  (C)\n\nQ: The finding that adults tend to remember events from their adolescence better than from other periods in their lives is referred to as the\n(A) Adolescence advantage (B) Reminiscence bump (C) Memorial memorial (D) Quadratic retrieval spike\nA:  (B)\n\nQ: Which element in tobacco smoke is responsible for cancers?\n(A) Nicotine (B) Tar (C) Carbon monoxide (D) Smoke particles\nA:  (B)\n\nQ: When older adults move to a new state after retirement, which of the following is the more likely destination?\n(A) Texas (B) California (C) Hawaii (D) Vermont\nA:  (A)\n\nQ: A major difference between programmed and unprogrammed theories of senescence is that programmed theories\n(A) Attribute senescence only to environmental factors (B) Are far too difficulty to test (C) Claim that senescence follows a predetermined plan (D) Rely too heavily on computer models\nA: ",
        {
          "until": [
            "</s>"
          ]
        }
      ]
    ],
    "resps": [
      [
        "(C)"
      ]
    ],
    "filtered_resps": [
      "(C)"
    ],
    "exact_match": 1.0
  },
  {
    "doc_id": 17,
    "doc": {
      "question": "Surveys of older adults who are living together show that they tend to view cohabitation as",
      "subject": "human_aging",
      "choices": [
        "A first step toward eventual marriage",
        "An alternative to marriage",
        "A way to save on expenses",
        "Their swan song"
      ],
      "answer": 1
    },
    "target": "(B)",
    "arguments": [
      [
        "The following are multiple choice questions (with answers) about human aging.\n\nQ: Which of the following persons is more likely to remain at home alone, as of 2019?\n(A) An Asian man or woman (B) A Hispanic man (C) An African American woman (D) A white man or woman\nA:  (C)\n\nQ: All other things being equal, which of the following persons is more likely to show osteoporosis?\n(A) An older Hispanic American woman (B) An older African American woman (C) An older Asian American woman (D) An older Native American woman\nA:  (C)\n\nQ: The finding that adults tend to remember events from their adolescence better than from other periods in their lives is referred to as the\n(A) Adolescence advantage (B) Reminiscence bump (C) Memorial memorial (D) Quadratic retrieval spike\nA:  (B)\n\nQ: When older adults move to a new state after retirement, which of the following is the more likely destination?\n(A) Texas (B) California (C) Hawaii (D) Vermont\nA:  (A)\n\nQ: Which element in tobacco smoke is responsible for cancers?\n(A) Nicotine (B) Tar (C) Carbon monoxide (D) Smoke particles\nA:  (B)\n\nQ: Surveys of older adults who are living together show that they tend to view cohabitation as\n(A) A first step toward eventual marriage (B) An alternative to marriage (C) A way to save on expenses (D) Their swan song\nA: ",
        {
          "until": [
            "</s>"
          ]
        }
      ]
    ],
    "resps": [
      [
        "(B)"
      ]
    ],
    "filtered_resps": [
      "(B)"
    ],
    "exact_match": 1.0
  },
  {
    "doc_id": 25,
    "doc": {
      "question": "In this chapter's Senior View, Dr. Shealy advises you to",
      "subject": "human_aging",
      "choices": [
        "Stay in school",
        "Eat the right foods",
        "Get plenty of exercise",
        "Find a high paying job"
      ],
      "answer": 0
    },
    "target": "(A)",
    "arguments": [
      [
        "The following are multiple choice questions (with answers) about human aging.\n\nQ: The finding that adults tend to remember events from their adolescence better than from other periods in their lives is referred to as the\n(A) Adolescence advantage (B) Reminiscence bump (C) Memorial memorial (D) Quadratic retrieval spike\nA:  (B)\n\nQ: Which of the following persons is more likely to remain at home alone, as of 2019?\n(A) An Asian man or woman (B) A Hispanic man (C) An African American woman (D) A white man or woman\nA:  (C)\n\nQ: Which element in tobacco smoke is responsible for cancers?\n(A) Nicotine (B) Tar (C) Carbon monoxide (D) Smoke particles\nA:  (B)\n\nQ: When older adults move to a new state after retirement, which of the following is the more likely destination?\n(A) Texas (B) California (C) Hawaii (D) Vermont\nA:  (A)\n\nQ: All other things being equal, which of the following persons is more likely to show osteoporosis?\n(A) An older Hispanic American woman (B) An older African American woman (C) An older Asian American woman (D) An older Native American woman\nA:  (C)\n\nQ: In this chapter's Senior View, Dr. Shealy advises you to\n(A) Stay in school (B) Eat the right foods (C) Get plenty of exercise (D) Find a high paying job\nA: ",
        {
          "until": [
            "</s>"
          ]
        }
      ]
    ],
    "resps": [
      [
        "(C)"
      ]
    ],
    "filtered_resps": [
      "(C)"
    ],
    "exact_match": 0.0
  },
  {
    "doc_id": 33,
    "doc": {
      "question": "Prejudice or bias against older adults is referred to as",
      "subject": "human_aging",
      "choices": [
        "Ageism",
        "Oldism",
        "Age bigotry",
        "Senilism"
      ],
      "answer": 0
    },
    "target": "(A)",
    "arguments": [
      [
        "The following are multiple choice questions (with answers) about human aging.\n\nQ: All other things being equal, which of the following persons is more likely to show osteoporosis?\n(A) An older Hispanic American woman (B) An older African American woman (C) An older Asian American woman (D) An older Native American woman\nA:  (C)\n\nQ: Which element in tobacco smoke is responsible for cancers?\n(A) Nicotine (B) Tar (C) Carbon monoxide (D) Smoke particles\nA:  (B)\n\nQ: Which of the following persons is more likely to remain at home alone, as of 2019?\n(A) An Asian man or woman (B) A Hispanic man (C) An African American woman (D) A white man or woman\nA:  (C)\n\nQ: When older adults move to a new state after retirement, which of the following is the more likely destination?\n(A) Texas (B) California (C) Hawaii (D) Vermont\nA:  (A)\n\nQ: The finding that adults tend to remember events from their adolescence better than from other periods in their lives is referred to as the\n(A) Adolescence advantage (B) Reminiscence bump (C) Memorial memorial (D) Quadratic retrieval spike\nA:  (B)\n\nQ: Prejudice or bias against older adults is referred to as\n(A) Ageism (B) Oldism (C) Age bigotry (D) Senilism\nA: ",
        {
          "until": [
            "</s>"
          ]
        }
      ]
    ],
    "resps": [
      [
        "(A)"
      ]
    ],
    "filtered_resps": [
      "(A)"
    ],
    "exact_match": 1.0
  },
  {
    "doc_id": 41,
    "doc": {
      "question": "Which of the following could very well be a cohort difference rather than a change that occurs with age?",
      "subject": "human_aging",
      "choices": [
        "Differences in weight",
        "Shrinkage of the thymus gland",
        "Enlargement of the heart",
        "Increasing size of nose and ears"
      ],
      "answer": 0
    },
    "target": "(A)",
    "arguments": [
      [
        "The following are multiple choice questions (with answers) about human aging.\n\nQ: Which of the following persons is more likely to remain at home alone, as of 2019?\n(A) An Asian man or woman (B) A Hispanic man (C) An African American woman (D) A white man or woman\nA:  (C)\n\nQ: All other things being equal, which of the following persons is more likely to show osteoporosis?\n(A) An older Hispanic American woman (B) An older African American woman (C) An older Asian American woman (D) An older Native American woman\nA:  (C)\n\nQ: When older adults move to a new state after retirement, which of the following is the more likely destination?\n(A) Texas (B) California (C) Hawaii (D) Vermont\nA:  (A)\n\nQ: Which element in tobacco smoke is responsible for cancers?\n(A) Nicotine (B) Tar (C) Carbon monoxide (D) Smoke particles\nA:  (B)\n\nQ: The finding that adults tend to remember events from their adolescence better than from other periods in their lives is referred to as the\n(A) Adolescence advantage (B) Reminiscence bump (C) Memorial memorial (D) Quadratic retrieval spike\nA:  (B)\n\nQ: Which of the following could very well be a cohort difference rather than a change that occurs with age?\n(A) Differences in weight (B) Shrinkage of the thymus gland (C) Enlargement of the heart (D) Increasing size of nose and ears\nA: ",
        {
          "until": [
            "</s>"
          ]
        }
      ]
    ],
    "resps": [
      [
        "(C)"
      ]
    ],
    "filtered_resps": [
      "(C)"
    ],
    "exact_match": 0.0
  },
  {
    "doc_id": 49,
    "doc": {
      "question": "The majority of older widows live",
      "subject": "human_aging",
      "choices": [
        "Alone",
        "With children",
        "With a friend",
        "In an institution"
      ],
      "answer": 0
    },
    "target": "(A)",
    "arguments": [
      [
        "The following are multiple choice questions (with answers) about human aging.\n\nQ: All other things being equal, which of the following persons is more likely to show osteoporosis?\n(A) An older Hispanic American woman (B) An older African American woman (C) An older Asian American woman (D) An older Native American woman\nA:  (C)\n\nQ: Which of the following persons is more likely to remain at home alone, as of 2019?\n(A) An Asian man or woman (B) A Hispanic man (C) An African American woman (D) A white man or woman\nA:  (C)\n\nQ: When older adults move to a new state after retirement, which of the following is the more likely destination?\n(A) Texas (B) California (C) Hawaii (D) Vermont\nA:  (A)\n\nQ: The finding that adults tend to remember events from their adolescence better than from other periods in their lives is referred to as the\n(A) Adolescence advantage (B) Reminiscence bump (C) Memorial memorial (D) Quadratic retrieval spike\nA:  (B)\n\nQ: Which element in tobacco smoke is responsible for cancers?\n(A) Nicotine (B) Tar (C) Carbon monoxide (D) Smoke particles\nA:  (B)\n\nQ: The majority of older widows live\n(A) Alone (B) With children (C) With a friend (D) In an institution\nA: ",
        {
          "until": [
            "</s>"
          ]
        }
      ]
    ],
    "resps": [
      [
        "(A)"
      ]
    ],
    "filtered_resps": [
      "(A)"
    ],
    "exact_match": 1.0
  },
  {
    "doc_id": 57,
    "doc": {
      "question": "The biggest and most dangerous changes in the cardiovascular system take place in the",
      "subject": "human_aging",
      "choices": [
        "Heart",
        "Blood vessels",
        "Red blood cells",
        "Plasma"
      ],
      "answer": 1
    },
    "target": "(B)",
    "arguments": [
      [
        "The following are multiple choice questions (with answers) about human aging.\n\nQ: When older adults move to a new state after retirement, which of the following is the more likely destination?\n(A) Texas (B) California (C) Hawaii (D) Vermont\nA:  (A)\n\nQ: All other things being equal, which of the following persons is more likely to show osteoporosis?\n(A) An older Hispanic American woman (B) An older African American woman (C) An older Asian American woman (D) An older Native American woman\nA:  (C)\n\nQ: Which of the following persons is more likely to remain at home alone, as of 2019?\n(A) An Asian man or woman (B) A Hispanic man (C) An African American woman (D) A white man or woman\nA:  (C)\n\nQ: Which element in tobacco smoke is responsible for cancers?\n(A) Nicotine (B) Tar (C) Carbon monoxide (D) Smoke particles\nA:  (B)\n\nQ: The finding that adults tend to remember events from their adolescence better than from other periods in their lives is referred to as the\n(A) Adolescence advantage (B) Reminiscence bump (C) Memorial memorial (D) Quadratic retrieval spike\nA:  (B)\n\nQ: The biggest and most dangerous changes in the cardiovascular system take place in the\n(A) Heart (B) Blood vessels (C) Red blood cells (D) Plasma\nA: ",
        {
          "until": [
            "</s>"
          ]
        }
      ]
    ],
    "resps": [
      [
        "(A)"
      ]
    ],
    "filtered_resps": [
      "(A)"
    ],
    "exact_match": 0.0
  },
  {
    "doc_id": 65,
    "doc": {
      "question": "Do traits change with age?",
      "subject": "human_aging",
      "choices": [
        "No",
        "They change a little",
        "Only for women",
        "They change quite a lot"
      ],
      "answer": 1
    },
    "target": "(B)",
    "arguments": [
      [
        "The following are multiple choice questions (with answers) about human aging.\n\nQ: All other things being equal, which of the following persons is more likely to show osteoporosis?\n(A) An older Hispanic American woman (B) An older African American woman (C) An older Asian American woman (D) An older Native American woman\nA:  (C)\n\nQ: Which of the following persons is more likely to remain at home alone, as of 2019?\n(A) An Asian man or woman (B) A Hispanic man (C) An African American woman (D) A white man or woman\nA:  (C)\n\nQ: When older adults move to a new state after retirement, which of the following is the more likely destination?\n(A) Texas (B) California (C) Hawaii (D) Vermont\nA:  (A)\n\nQ: Which element in tobacco smoke is responsible for cancers?\n(A) Nicotine (B) Tar (C) Carbon monoxide (D) Smoke particles\nA:  (B)\n\nQ: The finding that adults tend to remember events from their adolescence better than from other periods in their lives is referred to as the\n(A) Adolescence advantage (B) Reminiscence bump (C) Memorial memorial (D) Quadratic retrieval spike\nA:  (B)\n\nQ: Do traits change with age?\n(A) No (B) They change a little (C) Only for women (D) They change quite a lot\nA: ",
        {
          "until": [
            "</s>"
          ]
        }
      ]
    ],
    "resps": [
      [
        "(D)"
      ]
    ],
    "filtered_resps": [
      "(D)"
    ],
    "exact_match": 0.0
  },
  {
    "doc_id": 73,
    "doc": {
      "question": "Prospective memory refers to memory",
      "subject": "human_aging",
      "choices": [
        "For some recent event",
        "For something that happened a long time ago",
        "To do something in the future",
        "For the context and source of remembered information"
      ],
      "answer": 2
    },
    "target": "(C)",
    "arguments": [
      [
        "The following are multiple choice questions (with answers) about human aging.\n\nQ: When older adults move to a new state after retirement, which of the following is the more likely destination?\n(A) Texas (B) California (C) Hawaii (D) Vermont\nA:  (A)\n\nQ: The finding that adults tend to remember events from their adolescence better than from other periods in their lives is referred to as the\n(A) Adolescence advantage (B) Reminiscence bump (C) Memorial memorial (D) Quadratic retrieval spike\nA:  (B)\n\nQ: All other things being equal, which of the following persons is more likely to show osteoporosis?\n(A) An older Hispanic American woman (B) An older African American woman (C) An older Asian American woman (D) An older Native American woman\nA:  (C)\n\nQ: Which element in tobacco smoke is responsible for cancers?\n(A) Nicotine (B) Tar (C) Carbon monoxide (D) Smoke particles\nA:  (B)\n\nQ: Which of the following persons is more likely to remain at home alone, as of 2019?\n(A) An Asian man or woman (B) A Hispanic man (C) An African American woman (D) A white man or woman\nA:  (C)\n\nQ: Prospective memory refers to memory\n(A) For some recent event (B) For something that happened a long time ago (C) To do something in the future (D) For the context and source of remembered information\nA: ",
        {
          "until": [
            "</s>"
          ]
        }
      ]
    ],
    "resps": [
      [
        "(D)"
      ]
    ],
    "filtered_resps": [
      "(D)"
    ],
    "exact_match": 0.0
  },
  {
    "doc_id": 81,
    "doc": {
      "question": "Hypokinesia refers to",
      "subject": "human_aging",
      "choices": [
        "Severe obesity",
        "Loss of muscle strength and bone density",
        "Increased sensitivity to stress",
        "Social isolation and lack of support"
      ],
      "answer": 1
    },
    "target": "(B)",
    "arguments": [
      [
        "The following are multiple choice questions (with answers) about human aging.\n\nQ: The finding that adults tend to remember events from their adolescence better than from other periods in their lives is referred to as the\n(A) Adolescence advantage (B) Reminiscence bump (C) Memorial memorial (D) Quadratic retrieval spike\nA:  (B)\n\nQ: Which of the following persons is more likely to remain at home alone, as of 2019?\n(A) An Asian man or woman (B) A Hispanic man (C) An African American woman (D) A white man or woman\nA:  (C)\n\nQ: Which element in tobacco smoke is responsible for cancers?\n(A) Nicotine (B) Tar (C) Carbon monoxide (D) Smoke particles\nA:  (B)\n\nQ: All other things being equal, which of the following persons is more likely to show osteoporosis?\n(A) An older Hispanic American woman (B) An older African American woman (C) An older Asian American woman (D) An older Native American woman\nA:  (C)\n\nQ: When older adults move to a new state after retirement, which of the following is the more likely destination?\n(A) Texas (B) California (C) Hawaii (D) Vermont\nA:  (A)\n\nQ: Hypokinesia refers to\n(A) Severe obesity (B) Loss of muscle strength and bone density (C) Increased sensitivity to stress (D) Social isolation and lack of support\nA: ",
        {
          "until": [
            "</s>"
          ]
        }
      ]
    ],
    "resps": [
      [
        "(B)"
      ]
    ],
    "filtered_resps": [
      "(B)"
    ],
    "exact_match": 1.0
  },
  {
    "doc_id": 89,
    "doc": {
      "question": "Middle-aged adults appear to be more ____ than older or younger adults",
      "subject": "human_aging",
      "choices": [
        "Generative",
        "Neurotic",
        "Agreeable",
        "Certain"
      ],
      "answer": 0
    },
    "target": "(A)",
    "arguments": [
      [
        "The following are multiple choice questions (with answers) about human aging.\n\nQ: Which of the following persons is more likely to remain at home alone, as of 2019?\n(A) An Asian man or woman (B) A Hispanic man (C) An African American woman (D) A white man or woman\nA:  (C)\n\nQ: The finding that adults tend to remember events from their adolescence better than from other periods in their lives is referred to as the\n(A) Adolescence advantage (B) Reminiscence bump (C) Memorial memorial (D) Quadratic retrieval spike\nA:  (B)\n\nQ: All other things being equal, which of the following persons is more likely to show osteoporosis?\n(A) An older Hispanic American woman (B) An older African American woman (C) An older Asian American woman (D) An older Native American woman\nA:  (C)\n\nQ: When older adults move to a new state after retirement, which of the following is the more likely destination?\n(A) Texas (B) California (C) Hawaii (D) Vermont\nA:  (A)\n\nQ: Which element in tobacco smoke is responsible for cancers?\n(A) Nicotine (B) Tar (C) Carbon monoxide (D) Smoke particles\nA:  (B)\n\nQ: Middle-aged adults appear to be more ____ than older or younger adults\n(A) Generative (B) Neurotic (C) Agreeable (D) Certain\nA: ",
        {
          "until": [
            "</s>"
          ]
        }
      ]
    ],
    "resps": [
      [
        "(B)"
      ]
    ],
    "filtered_resps": [
      "(B)"
    ],
    "exact_match": 0.0
  },
  {
    "doc_id": 97,
    "doc": {
      "question": "A major reason for studying human aging is that",
      "subject": "human_aging",
      "choices": [
        "We are all growing older",
        "The number and proportion of older adults is increasing",
        "More job opportunities are available for those with some knowledge of aging",
        "All of the above"
      ],
      "answer": 3
    },
    "target": "(D)",
    "arguments": [
      [
        "The following are multiple choice questions (with answers) about human aging.\n\nQ: Which of the following persons is more likely to remain at home alone, as of 2019?\n(A) An Asian man or woman (B) A Hispanic man (C) An African American woman (D) A white man or woman\nA:  (C)\n\nQ: The finding that adults tend to remember events from their adolescence better than from other periods in their lives is referred to as the\n(A) Adolescence advantage (B) Reminiscence bump (C) Memorial memorial (D) Quadratic retrieval spike\nA:  (B)\n\nQ: When older adults move to a new state after retirement, which of the following is the more likely destination?\n(A) Texas (B) California (C) Hawaii (D) Vermont\nA:  (A)\n\nQ: Which element in tobacco smoke is responsible for cancers?\n(A) Nicotine (B) Tar (C) Carbon monoxide (D) Smoke particles\nA:  (B)\n\nQ: All other things being equal, which of the following persons is more likely to show osteoporosis?\n(A) An older Hispanic American woman (B) An older African American woman (C) An older Asian American woman (D) An older Native American woman\nA:  (C)\n\nQ: A major reason for studying human aging is that\n(A) We are all growing older (B) The number and proportion of older adults is increasing (C) More job opportunities are available for those with some knowledge of aging (D) All of the above\nA: ",
        {
          "until": [
            "</s>"
          ]
        }
      ]
    ],
    "resps": [
      [
        "(D)"
      ]
    ],
    "filtered_resps": [
      "(D)"
    ],
    "exact_match": 1.0
  },
  {
    "doc_id": 105,
    "doc": {
      "question": "Those cells that build bone are called",
      "subject": "human_aging",
      "choices": [
        "Osteoblasts",
        "Osteoclasts",
        "Osteostructs",
        "Osteopori"
      ],
      "answer": 0
    },
    "target": "(A)",
    "arguments": [
      [
        "The following are multiple choice questions (with answers) about human aging.\n\nQ: Which of the following persons is more likely to remain at home alone, as of 2019?\n(A) An Asian man or woman (B) A Hispanic man (C) An African American woman (D) A white man or woman\nA:  (C)\n\nQ: Which element in tobacco smoke is responsible for cancers?\n(A) Nicotine (B) Tar (C) Carbon monoxide (D) Smoke particles\nA:  (B)\n\nQ: The finding that adults tend to remember events from their adolescence better than from other periods in their lives is referred to as the\n(A) Adolescence advantage (B) Reminiscence bump (C) Memorial memorial (D) Quadratic retrieval spike\nA:  (B)\n\nQ: All other things being equal, which of the following persons is more likely to show osteoporosis?\n(A) An older Hispanic American woman (B) An older African American woman (C) An older Asian American woman (D) An older Native American woman\nA:  (C)\n\nQ: When older adults move to a new state after retirement, which of the following is the more likely destination?\n(A) Texas (B) California (C) Hawaii (D) Vermont\nA:  (A)\n\nQ: Those cells that build bone are called\n(A) Osteoblasts (B) Osteoclasts (C) Osteostructs (D) Osteopori\nA: ",
        {
          "until": [
            "</s>"
          ]
        }
      ]
    ],
    "resps": [
      [
        "(B)"
      ]
    ],
    "filtered_resps": [
      "(B)"
    ],
    "exact_match": 0.0
  },
  {
    "doc_id": 113,
    "doc": {
      "question": "In this chapter's\u00a0Senior View, Pat Shelley told us that you shouldn't retire if",
      "subject": "human_aging",
      "choices": [
        "You can't do it right",
        "You're younger than 60",
        "Your family wants you to keep working",
        "You have no hobbies"
      ],
      "answer": 0
    },
    "target": "(A)",
    "arguments": [
      [
        "The following are multiple choice questions (with answers) about human aging.\n\nQ: When older adults move to a new state after retirement, which of the following is the more likely destination?\n(A) Texas (B) California (C) Hawaii (D) Vermont\nA:  (A)\n\nQ: The finding that adults tend to remember events from their adolescence better than from other periods in their lives is referred to as the\n(A) Adolescence advantage (B) Reminiscence bump (C) Memorial memorial (D) Quadratic retrieval spike\nA:  (B)\n\nQ: Which element in tobacco smoke is responsible for cancers?\n(A) Nicotine (B) Tar (C) Carbon monoxide (D) Smoke particles\nA:  (B)\n\nQ: Which of the following persons is more likely to remain at home alone, as of 2019?\n(A) An Asian man or woman (B) A Hispanic man (C) An African American woman (D) A white man or woman\nA:  (C)\n\nQ: All other things being equal, which of the following persons is more likely to show osteoporosis?\n(A) An older Hispanic American woman (B) An older African American woman (C) An older Asian American woman (D) An older Native American woman\nA:  (C)\n\nQ: In this chapter's\u00a0Senior View, Pat Shelley told us that you shouldn't retire if\n(A) You can't do it right (B) You're younger than 60 (C) Your family wants you to keep working (D) You have no hobbies\nA: ",
        {
          "until": [
            "</s>"
          ]
        }
      ]
    ],
    "resps": [
      [
        "(B)"
      ]
    ],
    "filtered_resps": [
      "(B)"
    ],
    "exact_match": 0.0
  },
  {
    "doc_id": 121,
    "doc": {
      "question": "In which country do most individuals choose to be cremated?",
      "subject": "human_aging",
      "choices": [
        "Japan",
        "U. S. A.",
        "Kenya",
        "Mexico"
      ],
      "answer": 0
    },
    "target": "(A)",
    "arguments": [
      [
        "The following are multiple choice questions (with answers) about human aging.\n\nQ: Which of the following persons is more likely to remain at home alone, as of 2019?\n(A) An Asian man or woman (B) A Hispanic man (C) An African American woman (D) A white man or woman\nA:  (C)\n\nQ: Which element in tobacco smoke is responsible for cancers?\n(A) Nicotine (B) Tar (C) Carbon monoxide (D) Smoke particles\nA:  (B)\n\nQ: The finding that adults tend to remember events from their adolescence better than from other periods in their lives is referred to as the\n(A) Adolescence advantage (B) Reminiscence bump (C) Memorial memorial (D) Quadratic retrieval spike\nA:  (B)\n\nQ: When older adults move to a new state after retirement, which of the following is the more likely destination?\n(A) Texas (B) California (C) Hawaii (D) Vermont\nA:  (A)\n\nQ: All other things being equal, which of the following persons is more likely to show osteoporosis?\n(A) An older Hispanic American woman (B) An older African American woman (C) An older Asian American woman (D) An older Native American woman\nA:  (C)\n\nQ: In which country do most individuals choose to be cremated?\n(A) Japan (B) U. S. A. (C) Kenya (D) Mexico\nA: ",
        {
          "until": [
            "</s>"
          ]
        }
      ]
    ],
    "resps": [
      [
        "(B)"
      ]
    ],
    "filtered_resps": [
      "(B)"
    ],
    "exact_match": 0.0
  },
  {
    "doc_id": 129,
    "doc": {
      "question": "One line of evidence against antagonistic pleiotropy is that",
      "subject": "human_aging",
      "choices": [
        "Women who have more children tend to live longer",
        "Some animals show little or no senescence",
        "Even tissue cells with longer telomere strands can show senescence",
        "Exercise increases rather than decreases longevity"
      ],
      "answer": 0
    },
    "target": "(A)",
    "arguments": [
      [
        "The following are multiple choice questions (with answers) about human aging.\n\nQ: All other things being equal, which of the following persons is more likely to show osteoporosis?\n(A) An older Hispanic American woman (B) An older African American woman (C) An older Asian American woman (D) An older Native American woman\nA:  (C)\n\nQ: Which element in tobacco smoke is responsible for cancers?\n(A) Nicotine (B) Tar (C) Carbon monoxide (D) Smoke particles\nA:  (B)\n\nQ: The finding that adults tend to remember events from their adolescence better than from other periods in their lives is referred to as the\n(A) Adolescence advantage (B) Reminiscence bump (C) Memorial memorial (D) Quadratic retrieval spike\nA:  (B)\n\nQ: Which of the following persons is more likely to remain at home alone, as of 2019?\n(A) An Asian man or woman (B) A Hispanic man (C) An African American woman (D) A white man or woman\nA:  (C)\n\nQ: When older adults move to a new state after retirement, which of the following is the more likely destination?\n(A) Texas (B) California (C) Hawaii (D) Vermont\nA:  (A)\n\nQ: One line of evidence against antagonistic pleiotropy is that\n(A) Women who have more children tend to live longer (B) Some animals show little or no senescence (C) Even tissue cells with longer telomere strands can show senescence (D) Exercise increases rather than decreases longevity\nA: ",
        {
          "until": [
            "</s>"
          ]
        }
      ]
    ],
    "resps": [
      [
        "(C)"
      ]
    ],
    "filtered_resps": [
      "(C)"
    ],
    "exact_match": 0.0
  },
  {
    "doc_id": 137,
    "doc": {
      "question": "If we found that adult age was significantly and positively correlated with consumption of herbal teas, we could conclude that",
      "subject": "human_aging",
      "choices": [
        "Drinking herbal teas makes one grow older more slowly",
        "Becoming older causes one to begin or increase consumption of herbal teas",
        "Older adults drink less herbal tea than do younger adults",
        "Older adults drink more herbal tea than do younger adults"
      ],
      "answer": 3
    },
    "target": "(D)",
    "arguments": [
      [
        "The following are multiple choice questions (with answers) about human aging.\n\nQ: All other things being equal, which of the following persons is more likely to show osteoporosis?\n(A) An older Hispanic American woman (B) An older African American woman (C) An older Asian American woman (D) An older Native American woman\nA:  (C)\n\nQ: The finding that adults tend to remember events from their adolescence better than from other periods in their lives is referred to as the\n(A) Adolescence advantage (B) Reminiscence bump (C) Memorial memorial (D) Quadratic retrieval spike\nA:  (B)\n\nQ: Which element in tobacco smoke is responsible for cancers?\n(A) Nicotine (B) Tar (C) Carbon monoxide (D) Smoke particles\nA:  (B)\n\nQ: When older adults move to a new state after retirement, which of the following is the more likely destination?\n(A) Texas (B) California (C) Hawaii (D) Vermont\nA:  (A)\n\nQ: Which of the following persons is more likely to remain at home alone, as of 2019?\n(A) An Asian man or woman (B) A Hispanic man (C) An African American woman (D) A white man or woman\nA:  (C)\n\nQ: If we found that adult age was significantly and positively correlated with consumption of herbal teas, we could conclude that\n(A) Drinking herbal teas makes one grow older more slowly (B) Becoming older causes one to begin or increase consumption of herbal teas (C) Older adults drink less herbal tea than do younger adults (D) Older adults drink more herbal tea than do younger adults\nA: ",
        {
          "until": [
            "</s>"
          ]
        }
      ]
    ],
    "resps": [
      [
        "(B)"
      ]
    ],
    "filtered_resps": [
      "(B)"
    ],
    "exact_match": 0.0
  },
  {
    "doc_id": 145,
    "doc": {
      "question": "Surveys of bereaved individuals have found that one of the things that is reported as being most helpful is when others",
      "subject": "human_aging",
      "choices": [
        "Avoid any discussion of the deceased",
        "Remain in close contact",
        "Stay away and let the person grieve",
        "Change the home environment for the bereaved"
      ],
      "answer": 1
    },
    "target": "(B)",
    "arguments": [
      [
        "The following are multiple choice questions (with answers) about human aging.\n\nQ: When older adults move to a new state after retirement, which of the following is the more likely destination?\n(A) Texas (B) California (C) Hawaii (D) Vermont\nA:  (A)\n\nQ: Which of the following persons is more likely to remain at home alone, as of 2019?\n(A) An Asian man or woman (B) A Hispanic man (C) An African American woman (D) A white man or woman\nA:  (C)\n\nQ: Which element in tobacco smoke is responsible for cancers?\n(A) Nicotine (B) Tar (C) Carbon monoxide (D) Smoke particles\nA:  (B)\n\nQ: The finding that adults tend to remember events from their adolescence better than from other periods in their lives is referred to as the\n(A) Adolescence advantage (B) Reminiscence bump (C) Memorial memorial (D) Quadratic retrieval spike\nA:  (B)\n\nQ: All other things being equal, which of the following persons is more likely to show osteoporosis?\n(A) An older Hispanic American woman (B) An older African American woman (C) An older Asian American woman (D) An older Native American woman\nA:  (C)\n\nQ: Surveys of bereaved individuals have found that one of the things that is reported as being most helpful is when others\n(A) Avoid any discussion of the deceased (B) Remain in close contact (C) Stay away and let the person grieve (D) Change the home environment for the bereaved\nA: ",
        {
          "until": [
            "</s>"
          ]
        }
      ]
    ],
    "resps": [
      [
        "(B)"
      ]
    ],
    "filtered_resps": [
      "(B)"
    ],
    "exact_match": 1.0
  },
  {
    "doc_id": 153,
    "doc": {
      "question": "Over the last decade or two, which of the following causes of death has shown a huge increase?",
      "subject": "human_aging",
      "choices": [
        "Alzheimer's",
        "Cancer",
        "Cardiovascular diseases",
        "Homicide"
      ],
      "answer": 0
    },
    "target": "(A)",
    "arguments": [
      [
        "The following are multiple choice questions (with answers) about human aging.\n\nQ: Which of the following persons is more likely to remain at home alone, as of 2019?\n(A) An Asian man or woman (B) A Hispanic man (C) An African American woman (D) A white man or woman\nA:  (C)\n\nQ: All other things being equal, which of the following persons is more likely to show osteoporosis?\n(A) An older Hispanic American woman (B) An older African American woman (C) An older Asian American woman (D) An older Native American woman\nA:  (C)\n\nQ: The finding that adults tend to remember events from their adolescence better than from other periods in their lives is referred to as the\n(A) Adolescence advantage (B) Reminiscence bump (C) Memorial memorial (D) Quadratic retrieval spike\nA:  (B)\n\nQ: When older adults move to a new state after retirement, which of the following is the more likely destination?\n(A) Texas (B) California (C) Hawaii (D) Vermont\nA:  (A)\n\nQ: Which element in tobacco smoke is responsible for cancers?\n(A) Nicotine (B) Tar (C) Carbon monoxide (D) Smoke particles\nA:  (B)\n\nQ: Over the last decade or two, which of the following causes of death has shown a huge increase?\n(A) Alzheimer's (B) Cancer (C) Cardiovascular diseases (D) Homicide\nA: ",
        {
          "until": [
            "</s>"
          ]
        }
      ]
    ],
    "resps": [
      [
        "(B)"
      ]
    ],
    "filtered_resps": [
      "(B)"
    ],
    "exact_match": 0.0
  },
  {
    "doc_id": 161,
    "doc": {
      "question": "An older adult who has received a message (e.g., it's going to rain tomorrow) would be most likely to remember what when telling another person?",
      "subject": "human_aging",
      "choices": [
        "The person who told them it would rain",
        "Where they were when they received the message",
        "The contents of the message",
        "The time of day that the message was received"
      ],
      "answer": 2
    },
    "target": "(C)",
    "arguments": [
      [
        "The following are multiple choice questions (with answers) about human aging.\n\nQ: The finding that adults tend to remember events from their adolescence better than from other periods in their lives is referred to as the\n(A) Adolescence advantage (B) Reminiscence bump (C) Memorial memorial (D) Quadratic retrieval spike\nA:  (B)\n\nQ: When older adults move to a new state after retirement, which of the following is the more likely destination?\n(A) Texas (B) California (C) Hawaii (D) Vermont\nA:  (A)\n\nQ: Which of the following persons is more likely to remain at home alone, as of 2019?\n(A) An Asian man or woman (B) A Hispanic man (C) An African American woman (D) A white man or woman\nA:  (C)\n\nQ: Which element in tobacco smoke is responsible for cancers?\n(A) Nicotine (B) Tar (C) Carbon monoxide (D) Smoke particles\nA:  (B)\n\nQ: All other things being equal, which of the following persons is more likely to show osteoporosis?\n(A) An older Hispanic American woman (B) An older African American woman (C) An older Asian American woman (D) An older Native American woman\nA:  (C)\n\nQ: An older adult who has received a message (e.g., it's going to rain tomorrow) would be most likely to remember what when telling another person?\n(A) The person who told them it would rain (B) Where they were when they received the message (C) The contents of the message (D) The time of day that the message was received\nA: ",
        {
          "until": [
            "</s>"
          ]
        }
      ]
    ],
    "resps": [
      [
        "(C)"
      ]
    ],
    "filtered_resps": [
      "(C)"
    ],
    "exact_match": 1.0
  },
  {
    "doc_id": 169,
    "doc": {
      "question": "Presbyopia refers to",
      "subject": "human_aging",
      "choices": [
        "The point of clearest vision moving closer to the eye",
        "The decline in vision with advanced age",
        "The loss of hearing for higher pitch as one grows older",
        "The point of clearest vision moving farther from the eye"
      ],
      "answer": 3
    },
    "target": "(D)",
    "arguments": [
      [
        "The following are multiple choice questions (with answers) about human aging.\n\nQ: The finding that adults tend to remember events from their adolescence better than from other periods in their lives is referred to as the\n(A) Adolescence advantage (B) Reminiscence bump (C) Memorial memorial (D) Quadratic retrieval spike\nA:  (B)\n\nQ: When older adults move to a new state after retirement, which of the following is the more likely destination?\n(A) Texas (B) California (C) Hawaii (D) Vermont\nA:  (A)\n\nQ: All other things being equal, which of the following persons is more likely to show osteoporosis?\n(A) An older Hispanic American woman (B) An older African American woman (C) An older Asian American woman (D) An older Native American woman\nA:  (C)\n\nQ: Which of the following persons is more likely to remain at home alone, as of 2019?\n(A) An Asian man or woman (B) A Hispanic man (C) An African American woman (D) A white man or woman\nA:  (C)\n\nQ: Which element in tobacco smoke is responsible for cancers?\n(A) Nicotine (B) Tar (C) Carbon monoxide (D) Smoke particles\nA:  (B)\n\nQ: Presbyopia refers to\n(A) The point of clearest vision moving closer to the eye (B) The decline in vision with advanced age (C) The loss of hearing for higher pitch as one grows older (D) The point of clearest vision moving farther from the eye\nA: ",
        {
          "until": [
            "</s>"
          ]
        }
      ]
    ],
    "resps": [
      [
        "(A)"
      ]
    ],
    "filtered_resps": [
      "(A)"
    ],
    "exact_match": 0.0
  },
  {
    "doc_id": 177,
    "doc": {
      "question": "The idea that the ability to complete a task depends on the fit between the environment and the person undertaking the task is a basic tenet of which of the following theories of aging?",
      "subject": "human_aging",
      "choices": [
        "Environmental",
        "Ecological",
        "Fitness",
        "Congruence"
      ],
      "answer": 1
    },
    "target": "(B)",
    "arguments": [
      [
        "The following are multiple choice questions (with answers) about human aging.\n\nQ: Which element in tobacco smoke is responsible for cancers?\n(A) Nicotine (B) Tar (C) Carbon monoxide (D) Smoke particles\nA:  (B)\n\nQ: The finding that adults tend to remember events from their adolescence better than from other periods in their lives is referred to as the\n(A) Adolescence advantage (B) Reminiscence bump (C) Memorial memorial (D) Quadratic retrieval spike\nA:  (B)\n\nQ: Which of the following persons is more likely to remain at home alone, as of 2019?\n(A) An Asian man or woman (B) A Hispanic man (C) An African American woman (D) A white man or woman\nA:  (C)\n\nQ: All other things being equal, which of the following persons is more likely to show osteoporosis?\n(A) An older Hispanic American woman (B) An older African American woman (C) An older Asian American woman (D) An older Native American woman\nA:  (C)\n\nQ: When older adults move to a new state after retirement, which of the following is the more likely destination?\n(A) Texas (B) California (C) Hawaii (D) Vermont\nA:  (A)\n\nQ: The idea that the ability to complete a task depends on the fit between the environment and the person undertaking the task is a basic tenet of which of the following theories of aging?\n(A) Environmental (B) Ecological (C) Fitness (D) Congruence\nA: ",
        {
          "until": [
            "</s>"
          ]
        }
      ]
    ],
    "resps": [
      [
        "(B)"
      ]
    ],
    "filtered_resps": [
      "(B)"
    ],
    "exact_match": 1.0
  },
  {
    "doc_id": 185,
    "doc": {
      "question": "The first person to measure and compare the response times of young and old was",
      "subject": "human_aging",
      "choices": [
        "Francis Galton",
        "William James",
        "Michelle Meer",
        "Tom Penge"
      ],
      "answer": 0
    },
    "target": "(A)",
    "arguments": [
      [
        "The following are multiple choice questions (with answers) about human aging.\n\nQ: The finding that adults tend to remember events from their adolescence better than from other periods in their lives is referred to as the\n(A) Adolescence advantage (B) Reminiscence bump (C) Memorial memorial (D) Quadratic retrieval spike\nA:  (B)\n\nQ: Which of the following persons is more likely to remain at home alone, as of 2019?\n(A) An Asian man or woman (B) A Hispanic man (C) An African American woman (D) A white man or woman\nA:  (C)\n\nQ: When older adults move to a new state after retirement, which of the following is the more likely destination?\n(A) Texas (B) California (C) Hawaii (D) Vermont\nA:  (A)\n\nQ: All other things being equal, which of the following persons is more likely to show osteoporosis?\n(A) An older Hispanic American woman (B) An older African American woman (C) An older Asian American woman (D) An older Native American woman\nA:  (C)\n\nQ: Which element in tobacco smoke is responsible for cancers?\n(A) Nicotine (B) Tar (C) Carbon monoxide (D) Smoke particles\nA:  (B)\n\nQ: The first person to measure and compare the response times of young and old was\n(A) Francis Galton (B) William James (C) Michelle Meer (D) Tom Penge\nA: ",
        {
          "until": [
            "</s>"
          ]
        }
      ]
    ],
    "resps": [
      [
        "(A)"
      ]
    ],
    "filtered_resps": [
      "(A)"
    ],
    "exact_match": 1.0
  },
  {
    "doc_id": 193,
    "doc": {
      "question": "With respect to theories of senescence, it's probably safe to say that",
      "subject": "human_aging",
      "choices": [
        "Programmed theories are the best we have at present",
        "Many theories will have to be combined to explain senescence",
        "The evidence for these theories is direct and quickly accumulating",
        "All of these theories are merely speculation at this point"
      ],
      "answer": 1
    },
    "target": "(B)",
    "arguments": [
      [
        "The following are multiple choice questions (with answers) about human aging.\n\nQ: Which element in tobacco smoke is responsible for cancers?\n(A) Nicotine (B) Tar (C) Carbon monoxide (D) Smoke particles\nA:  (B)\n\nQ: Which of the following persons is more likely to remain at home alone, as of 2019?\n(A) An Asian man or woman (B) A Hispanic man (C) An African American woman (D) A white man or woman\nA:  (C)\n\nQ: When older adults move to a new state after retirement, which of the following is the more likely destination?\n(A) Texas (B) California (C) Hawaii (D) Vermont\nA:  (A)\n\nQ: The finding that adults tend to remember events from their adolescence better than from other periods in their lives is referred to as the\n(A) Adolescence advantage (B) Reminiscence bump (C) Memorial memorial (D) Quadratic retrieval spike\nA:  (B)\n\nQ: All other things being equal, which of the following persons is more likely to show osteoporosis?\n(A) An older Hispanic American woman (B) An older African American woman (C) An older Asian American woman (D) An older Native American woman\nA:  (C)\n\nQ: With respect to theories of senescence, it's probably safe to say that\n(A) Programmed theories are the best we have at present (B) Many theories will have to be combined to explain senescence (C) The evidence for these theories is direct and quickly accumulating (D) All of these theories are merely speculation at this point\nA: ",
        {
          "until": [
            "</s>"
          ]
        }
      ]
    ],
    "resps": [
      [
        "(D)"
      ]
    ],
    "filtered_resps": [
      "(D)"
    ],
    "exact_match": 0.0
  },
  {
    "doc_id": 201,
    "doc": {
      "question": "In this chapter's Senior View, Tolly Kleckley told us that personality",
      "subject": "human_aging",
      "choices": [
        "Changes a lot past age 50",
        "Doesn't change past age 50",
        "Pretty much stays the same",
        "Changes more for women than for men"
      ],
      "answer": 2
    },
    "target": "(C)",
    "arguments": [
      [
        "The following are multiple choice questions (with answers) about human aging.\n\nQ: Which element in tobacco smoke is responsible for cancers?\n(A) Nicotine (B) Tar (C) Carbon monoxide (D) Smoke particles\nA:  (B)\n\nQ: The finding that adults tend to remember events from their adolescence better than from other periods in their lives is referred to as the\n(A) Adolescence advantage (B) Reminiscence bump (C) Memorial memorial (D) Quadratic retrieval spike\nA:  (B)\n\nQ: Which of the following persons is more likely to remain at home alone, as of 2019?\n(A) An Asian man or woman (B) A Hispanic man (C) An African American woman (D) A white man or woman\nA:  (C)\n\nQ: All other things being equal, which of the following persons is more likely to show osteoporosis?\n(A) An older Hispanic American woman (B) An older African American woman (C) An older Asian American woman (D) An older Native American woman\nA:  (C)\n\nQ: When older adults move to a new state after retirement, which of the following is the more likely destination?\n(A) Texas (B) California (C) Hawaii (D) Vermont\nA:  (A)\n\nQ: In this chapter's Senior View, Tolly Kleckley told us that personality\n(A) Changes a lot past age 50 (B) Doesn't change past age 50 (C) Pretty much stays the same (D) Changes more for women than for men\nA: ",
        {
          "until": [
            "</s>"
          ]
        }
      ]
    ],
    "resps": [
      [
        "(A)"
      ]
    ],
    "filtered_resps": [
      "(A)"
    ],
    "exact_match": 0.0
  },
  {
    "doc_id": 209,
    "doc": {
      "question": "The decline in working memory with advanced age seems to be due to",
      "subject": "human_aging",
      "choices": [
        "A loss of resources and slower processing speed",
        "An increase in the inhibition of relevant information",
        "A general decline in the ability to process information",
        "A severe loss of neural connections and decreased blood flow"
      ],
      "answer": 0
    },
    "target": "(A)",
    "arguments": [
      [
        "The following are multiple choice questions (with answers) about human aging.\n\nQ: Which element in tobacco smoke is responsible for cancers?\n(A) Nicotine (B) Tar (C) Carbon monoxide (D) Smoke particles\nA:  (B)\n\nQ: The finding that adults tend to remember events from their adolescence better than from other periods in their lives is referred to as the\n(A) Adolescence advantage (B) Reminiscence bump (C) Memorial memorial (D) Quadratic retrieval spike\nA:  (B)\n\nQ: All other things being equal, which of the following persons is more likely to show osteoporosis?\n(A) An older Hispanic American woman (B) An older African American woman (C) An older Asian American woman (D) An older Native American woman\nA:  (C)\n\nQ: Which of the following persons is more likely to remain at home alone, as of 2019?\n(A) An Asian man or woman (B) A Hispanic man (C) An African American woman (D) A white man or woman\nA:  (C)\n\nQ: When older adults move to a new state after retirement, which of the following is the more likely destination?\n(A) Texas (B) California (C) Hawaii (D) Vermont\nA:  (A)\n\nQ: The decline in working memory with advanced age seems to be due to\n(A) A loss of resources and slower processing speed (B) An increase in the inhibition of relevant information (C) A general decline in the ability to process information (D) A severe loss of neural connections and decreased blood flow\nA: ",
        {
          "until": [
            "</s>"
          ]
        }
      ]
    ],
    "resps": [
      [
        "(C)"
      ]
    ],
    "filtered_resps": [
      "(C)"
    ],
    "exact_match": 0.0
  },
  {
    "doc_id": 217,
    "doc": {
      "question": "Mabel Davis, in this chapter's Senior View, would agree with which of the following?",
      "subject": "human_aging",
      "choices": [
        "Time seems to speed up when you grow older",
        "Exercise keeps your mind sharp",
        "Women are tougher than men",
        "Glasses and hearing aids should be avoided"
      ],
      "answer": 0
    },
    "target": "(A)",
    "arguments": [
      [
        "The following are multiple choice questions (with answers) about human aging.\n\nQ: The finding that adults tend to remember events from their adolescence better than from other periods in their lives is referred to as the\n(A) Adolescence advantage (B) Reminiscence bump (C) Memorial memorial (D) Quadratic retrieval spike\nA:  (B)\n\nQ: All other things being equal, which of the following persons is more likely to show osteoporosis?\n(A) An older Hispanic American woman (B) An older African American woman (C) An older Asian American woman (D) An older Native American woman\nA:  (C)\n\nQ: Which element in tobacco smoke is responsible for cancers?\n(A) Nicotine (B) Tar (C) Carbon monoxide (D) Smoke particles\nA:  (B)\n\nQ: Which of the following persons is more likely to remain at home alone, as of 2019?\n(A) An Asian man or woman (B) A Hispanic man (C) An African American woman (D) A white man or woman\nA:  (C)\n\nQ: When older adults move to a new state after retirement, which of the following is the more likely destination?\n(A) Texas (B) California (C) Hawaii (D) Vermont\nA:  (A)\n\nQ: Mabel Davis, in this chapter's Senior View, would agree with which of the following?\n(A) Time seems to speed up when you grow older (B) Exercise keeps your mind sharp (C) Women are tougher than men (D) Glasses and hearing aids should be avoided\nA: ",
        {
          "until": [
            "</s>"
          ]
        }
      ]
    ],
    "resps": [
      [
        "(A)"
      ]
    ],
    "filtered_resps": [
      "(A)"
    ],
    "exact_match": 1.0
  },
  {
    "doc_id": 2,
    "doc": {
      "question": "The docility hypothesis is that",
      "subject": "human_aging",
      "choices": [
        "Those with low capabilities are more vulnerable to environmental demands",
        "Those who experience high environmental demands become more docile",
        "Those who experience high environmental demands become less docile",
        "Those with less capability are less vulnerable to environmental demands"
      ],
      "answer": 0
    },
    "target": "(A)",
    "arguments": [
      [
        "The following are multiple choice questions (with answers) about human aging.\n\nQ: Which element in tobacco smoke is responsible for cancers?\n(A) Nicotine (B) Tar (C) Carbon monoxide (D) Smoke particles\nA:  (B)\n\nQ: Which of the following persons is more likely to remain at home alone, as of 2019?\n(A) An Asian man or woman (B) A Hispanic man (C) An African American woman (D) A white man or woman\nA:  (C)\n\nQ: All other things being equal, which of the following persons is more likely to show osteoporosis?\n(A) An older Hispanic American woman (B) An older African American woman (C) An older Asian American woman (D) An older Native American woman\nA:  (C)\n\nQ: When older adults move to a new state after retirement, which of the following is the more likely destination?\n(A) Texas (B) California (C) Hawaii (D) Vermont\nA:  (A)\n\nQ: The finding that adults tend to remember events from their adolescence better than from other periods in their lives is referred to as the\n(A) Adolescence advantage (B) Reminiscence bump (C) Memorial memorial (D) Quadratic retrieval spike\nA:  (B)\n\nQ: The docility hypothesis is that\n(A) Those with low capabilities are more vulnerable to environmental demands (B) Those who experience high environmental demands become more docile (C) Those who experience high environmental demands become less docile (D) Those with less capability are less vulnerable to environmental demands\nA: ",
        {
          "until": [
            "</s>"
          ]
        }
      ]
    ],
    "resps": [
      [
        "(C)"
      ]
    ],
    "filtered_resps": [
      "(C)"
    ],
    "exact_match": 0.0
  },
  {
    "doc_id": 10,
    "doc": {
      "question": "One reason that older adults show high levels of optimism is that",
      "subject": "human_aging",
      "choices": [
        "Many pessimists die at a younger age",
        "They do not really know what is going on",
        "This may be a warning sign for dementia",
        "Our measures have low validity"
      ],
      "answer": 0
    },
    "target": "(A)",
    "arguments": [
      [
        "The following are multiple choice questions (with answers) about human aging.\n\nQ: Which of the following persons is more likely to remain at home alone, as of 2019?\n(A) An Asian man or woman (B) A Hispanic man (C) An African American woman (D) A white man or woman\nA:  (C)\n\nQ: All other things being equal, which of the following persons is more likely to show osteoporosis?\n(A) An older Hispanic American woman (B) An older African American woman (C) An older Asian American woman (D) An older Native American woman\nA:  (C)\n\nQ: The finding that adults tend to remember events from their adolescence better than from other periods in their lives is referred to as the\n(A) Adolescence advantage (B) Reminiscence bump (C) Memorial memorial (D) Quadratic retrieval spike\nA:  (B)\n\nQ: Which element in tobacco smoke is responsible for cancers?\n(A) Nicotine (B) Tar (C) Carbon monoxide (D) Smoke particles\nA:  (B)\n\nQ: When older adults move to a new state after retirement, which of the following is the more likely destination?\n(A) Texas (B) California (C) Hawaii (D) Vermont\nA:  (A)\n\nQ: One reason that older adults show high levels of optimism is that\n(A) Many pessimists die at a younger age (B) They do not really know what is going on (C) This may be a warning sign for dementia (D) Our measures have low validity\nA: ",
        {
          "until": [
            "</s>"
          ]
        }
      ]
    ],
    "resps": [
      [
        "(B)"
      ]
    ],
    "filtered_resps": [
      "(B)"
    ],
    "exact_match": 0.0
  },
  {
    "doc_id": 18,
    "doc": {
      "question": "Older adults may be more attached to a place than younger adults because",
      "subject": "human_aging",
      "choices": [
        "That place holds many memories",
        "It's much harder to move when you're older",
        "Young adults pay less attention to place then do older adults",
        "That place represents transcendence"
      ],
      "answer": 0
    },
    "target": "(A)",
    "arguments": [
      [
        "The following are multiple choice questions (with answers) about human aging.\n\nQ: Which of the following persons is more likely to remain at home alone, as of 2019?\n(A) An Asian man or woman (B) A Hispanic man (C) An African American woman (D) A white man or woman\nA:  (C)\n\nQ: All other things being equal, which of the following persons is more likely to show osteoporosis?\n(A) An older Hispanic American woman (B) An older African American woman (C) An older Asian American woman (D) An older Native American woman\nA:  (C)\n\nQ: The finding that adults tend to remember events from their adolescence better than from other periods in their lives is referred to as the\n(A) Adolescence advantage (B) Reminiscence bump (C) Memorial memorial (D) Quadratic retrieval spike\nA:  (B)\n\nQ: When older adults move to a new state after retirement, which of the following is the more likely destination?\n(A) Texas (B) California (C) Hawaii (D) Vermont\nA:  (A)\n\nQ: Which element in tobacco smoke is responsible for cancers?\n(A) Nicotine (B) Tar (C) Carbon monoxide (D) Smoke particles\nA:  (B)\n\nQ: Older adults may be more attached to a place than younger adults because\n(A) That place holds many memories (B) It's much harder to move when you're older (C) Young adults pay less attention to place then do older adults (D) That place represents transcendence\nA: ",
        {
          "until": [
            "</s>"
          ]
        }
      ]
    ],
    "resps": [
      [
        "(A)"
      ]
    ],
    "filtered_resps": [
      "(A)"
    ],
    "exact_match": 1.0
  },
  {
    "doc_id": 26,
    "doc": {
      "question": "When your sister Patricia was feeling depressed, you comforted her and reminisced about happier times. You provided which type of social support?",
      "subject": "human_aging",
      "choices": [
        "Emotional",
        "Instrumental",
        "Informational",
        "Friendly"
      ],
      "answer": 0
    },
    "target": "(A)",
    "arguments": [
      [
        "The following are multiple choice questions (with answers) about human aging.\n\nQ: The finding that adults tend to remember events from their adolescence better than from other periods in their lives is referred to as the\n(A) Adolescence advantage (B) Reminiscence bump (C) Memorial memorial (D) Quadratic retrieval spike\nA:  (B)\n\nQ: Which of the following persons is more likely to remain at home alone, as of 2019?\n(A) An Asian man or woman (B) A Hispanic man (C) An African American woman (D) A white man or woman\nA:  (C)\n\nQ: Which element in tobacco smoke is responsible for cancers?\n(A) Nicotine (B) Tar (C) Carbon monoxide (D) Smoke particles\nA:  (B)\n\nQ: When older adults move to a new state after retirement, which of the following is the more likely destination?\n(A) Texas (B) California (C) Hawaii (D) Vermont\nA:  (A)\n\nQ: All other things being equal, which of the following persons is more likely to show osteoporosis?\n(A) An older Hispanic American woman (B) An older African American woman (C) An older Asian American woman (D) An older Native American woman\nA:  (C)\n\nQ: When your sister Patricia was feeling depressed, you comforted her and reminisced about happier times. You provided which type of social support?\n(A) Emotional (B) Instrumental (C) Informational (D) Friendly\nA: ",
        {
          "until": [
            "</s>"
          ]
        }
      ]
    ],
    "resps": [
      [
        "(A)"
      ]
    ],
    "filtered_resps": [
      "(A)"
    ],
    "exact_match": 1.0
  },
  {
    "doc_id": 34,
    "doc": {
      "question": "The program that takes over care for those with 6 or fewer months to live, attempts to keep them at home, provides pain relief, and ends all life-prolonging technologies is called",
      "subject": "human_aging",
      "choices": [
        "Euthanasia",
        "Cryonics",
        "Medicare",
        "Hospice"
      ],
      "answer": 3
    },
    "target": "(D)",
    "arguments": [
      [
        "The following are multiple choice questions (with answers) about human aging.\n\nQ: All other things being equal, which of the following persons is more likely to show osteoporosis?\n(A) An older Hispanic American woman (B) An older African American woman (C) An older Asian American woman (D) An older Native American woman\nA:  (C)\n\nQ: Which element in tobacco smoke is responsible for cancers?\n(A) Nicotine (B) Tar (C) Carbon monoxide (D) Smoke particles\nA:  (B)\n\nQ: Which of the following persons is more likely to remain at home alone, as of 2019?\n(A) An Asian man or woman (B) A Hispanic man (C) An African American woman (D) A white man or woman\nA:  (C)\n\nQ: When older adults move to a new state after retirement, which of the following is the more likely destination?\n(A) Texas (B) California (C) Hawaii (D) Vermont\nA:  (A)\n\nQ: The finding that adults tend to remember events from their adolescence better than from other periods in their lives is referred to as the\n(A) Adolescence advantage (B) Reminiscence bump (C) Memorial memorial (D) Quadratic retrieval spike\nA:  (B)\n\nQ: The program that takes over care for those with 6 or fewer months to live, attempts to keep them at home, provides pain relief, and ends all life-prolonging technologies is called\n(A) Euthanasia (B) Cryonics (C) Medicare (D) Hospice\nA: ",
        {
          "until": [
            "</s>"
          ]
        }
      ]
    ],
    "resps": [
      [
        "(D)"
      ]
    ],
    "filtered_resps": [
      "(D)"
    ],
    "exact_match": 1.0
  },
  {
    "doc_id": 42,
    "doc": {
      "question": "The major question concerning aging and personality is:",
      "subject": "human_aging",
      "choices": [
        "Do older adults still have personalities?",
        "Does personality change with age?",
        "Does personality decline as we grow older?",
        "Does personality increase of decrease with age?"
      ],
      "answer": 1
    },
    "target": "(B)",
    "arguments": [
      [
        "The following are multiple choice questions (with answers) about human aging.\n\nQ: Which of the following persons is more likely to remain at home alone, as of 2019?\n(A) An Asian man or woman (B) A Hispanic man (C) An African American woman (D) A white man or woman\nA:  (C)\n\nQ: All other things being equal, which of the following persons is more likely to show osteoporosis?\n(A) An older Hispanic American woman (B) An older African American woman (C) An older Asian American woman (D) An older Native American woman\nA:  (C)\n\nQ: When older adults move to a new state after retirement, which of the following is the more likely destination?\n(A) Texas (B) California (C) Hawaii (D) Vermont\nA:  (A)\n\nQ: Which element in tobacco smoke is responsible for cancers?\n(A) Nicotine (B) Tar (C) Carbon monoxide (D) Smoke particles\nA:  (B)\n\nQ: The finding that adults tend to remember events from their adolescence better than from other periods in their lives is referred to as the\n(A) Adolescence advantage (B) Reminiscence bump (C) Memorial memorial (D) Quadratic retrieval spike\nA:  (B)\n\nQ: The major question concerning aging and personality is:\n(A) Do older adults still have personalities? (B) Does personality change with age? (C) Does personality decline as we grow older? (D) Does personality increase of decrease with age?\nA: ",
        {
          "until": [
            "</s>"
          ]
        }
      ]
    ],
    "resps": [
      [
        "(B)"
      ]
    ],
    "filtered_resps": [
      "(B)"
    ],
    "exact_match": 1.0
  },
  {
    "doc_id": 50,
    "doc": {
      "question": "Centenarians are people who",
      "subject": "human_aging",
      "choices": [
        "Were born before the centennial",
        "Study old age and older adults",
        "Are 100 or more years old",
        "Have not yet reached old age"
      ],
      "answer": 2
    },
    "target": "(C)",
    "arguments": [
      [
        "The following are multiple choice questions (with answers) about human aging.\n\nQ: All other things being equal, which of the following persons is more likely to show osteoporosis?\n(A) An older Hispanic American woman (B) An older African American woman (C) An older Asian American woman (D) An older Native American woman\nA:  (C)\n\nQ: Which of the following persons is more likely to remain at home alone, as of 2019?\n(A) An Asian man or woman (B) A Hispanic man (C) An African American woman (D) A white man or woman\nA:  (C)\n\nQ: When older adults move to a new state after retirement, which of the following is the more likely destination?\n(A) Texas (B) California (C) Hawaii (D) Vermont\nA:  (A)\n\nQ: The finding that adults tend to remember events from their adolescence better than from other periods in their lives is referred to as the\n(A) Adolescence advantage (B) Reminiscence bump (C) Memorial memorial (D) Quadratic retrieval spike\nA:  (B)\n\nQ: Which element in tobacco smoke is responsible for cancers?\n(A) Nicotine (B) Tar (C) Carbon monoxide (D) Smoke particles\nA:  (B)\n\nQ: Centenarians are people who\n(A) Were born before the centennial (B) Study old age and older adults (C) Are 100 or more years old (D) Have not yet reached old age\nA: ",
        {
          "until": [
            "</s>"
          ]
        }
      ]
    ],
    "resps": [
      [
        "(C)"
      ]
    ],
    "filtered_resps": [
      "(C)"
    ],
    "exact_match": 1.0
  },
  {
    "doc_id": 58,
    "doc": {
      "question": "Older adults generally perform very well when their _____ memory is tested.",
      "subject": "human_aging",
      "choices": [
        "Episodic",
        "Working",
        "Retrospective",
        "Semantic"
      ],
      "answer": 3
    },
    "target": "(D)",
    "arguments": [
      [
        "The following are multiple choice questions (with answers) about human aging.\n\nQ: When older adults move to a new state after retirement, which of the following is the more likely destination?\n(A) Texas (B) California (C) Hawaii (D) Vermont\nA:  (A)\n\nQ: All other things being equal, which of the following persons is more likely to show osteoporosis?\n(A) An older Hispanic American woman (B) An older African American woman (C) An older Asian American woman (D) An older Native American woman\nA:  (C)\n\nQ: Which of the following persons is more likely to remain at home alone, as of 2019?\n(A) An Asian man or woman (B) A Hispanic man (C) An African American woman (D) A white man or woman\nA:  (C)\n\nQ: Which element in tobacco smoke is responsible for cancers?\n(A) Nicotine (B) Tar (C) Carbon monoxide (D) Smoke particles\nA:  (B)\n\nQ: The finding that adults tend to remember events from their adolescence better than from other periods in their lives is referred to as the\n(A) Adolescence advantage (B) Reminiscence bump (C) Memorial memorial (D) Quadratic retrieval spike\nA:  (B)\n\nQ: Older adults generally perform very well when their _____ memory is tested.\n(A) Episodic (B) Working (C) Retrospective (D) Semantic\nA: ",
        {
          "until": [
            "</s>"
          ]
        }
      ]
    ],
    "resps": [
      [
        "(D)"
      ]
    ],
    "filtered_resps": [
      "(D)"
    ],
    "exact_match": 1.0
  },
  {
    "doc_id": 66,
    "doc": {
      "question": "The cause of Alzheimer's appears to be",
      "subject": "human_aging",
      "choices": [
        "Mostly environmental",
        "Aluminum",
        "Mostly genetic",
        "Apo-E 4"
      ],
      "answer": 2
    },
    "target": "(C)",
    "arguments": [
      [
        "The following are multiple choice questions (with answers) about human aging.\n\nQ: All other things being equal, which of the following persons is more likely to show osteoporosis?\n(A) An older Hispanic American woman (B) An older African American woman (C) An older Asian American woman (D) An older Native American woman\nA:  (C)\n\nQ: Which of the following persons is more likely to remain at home alone, as of 2019?\n(A) An Asian man or woman (B) A Hispanic man (C) An African American woman (D) A white man or woman\nA:  (C)\n\nQ: When older adults move to a new state after retirement, which of the following is the more likely destination?\n(A) Texas (B) California (C) Hawaii (D) Vermont\nA:  (A)\n\nQ: Which element in tobacco smoke is responsible for cancers?\n(A) Nicotine (B) Tar (C) Carbon monoxide (D) Smoke particles\nA:  (B)\n\nQ: The finding that adults tend to remember events from their adolescence better than from other periods in their lives is referred to as the\n(A) Adolescence advantage (B) Reminiscence bump (C) Memorial memorial (D) Quadratic retrieval spike\nA:  (B)\n\nQ: The cause of Alzheimer's appears to be\n(A) Mostly environmental (B) Aluminum (C) Mostly genetic (D) Apo-E 4\nA: ",
        {
          "until": [
            "</s>"
          ]
        }
      ]
    ],
    "resps": [
      [
        "(C)"
      ]
    ],
    "filtered_resps": [
      "(C)"
    ],
    "exact_match": 1.0
  },
  {
    "doc_id": 74,
    "doc": {
      "question": "The total number of people who have some disorder divided by the total number of people gives you the ____ rate.",
      "subject": "human_aging",
      "choices": [
        "Prevalence",
        "Incidence",
        "Incipient",
        "Diseased"
      ],
      "answer": 0
    },
    "target": "(A)",
    "arguments": [
      [
        "The following are multiple choice questions (with answers) about human aging.\n\nQ: When older adults move to a new state after retirement, which of the following is the more likely destination?\n(A) Texas (B) California (C) Hawaii (D) Vermont\nA:  (A)\n\nQ: The finding that adults tend to remember events from their adolescence better than from other periods in their lives is referred to as the\n(A) Adolescence advantage (B) Reminiscence bump (C) Memorial memorial (D) Quadratic retrieval spike\nA:  (B)\n\nQ: All other things being equal, which of the following persons is more likely to show osteoporosis?\n(A) An older Hispanic American woman (B) An older African American woman (C) An older Asian American woman (D) An older Native American woman\nA:  (C)\n\nQ: Which element in tobacco smoke is responsible for cancers?\n(A) Nicotine (B) Tar (C) Carbon monoxide (D) Smoke particles\nA:  (B)\n\nQ: Which of the following persons is more likely to remain at home alone, as of 2019?\n(A) An Asian man or woman (B) A Hispanic man (C) An African American woman (D) A white man or woman\nA:  (C)\n\nQ: The total number of people who have some disorder divided by the total number of people gives you the ____ rate.\n(A) Prevalence (B) Incidence (C) Incipient (D) Diseased\nA: ",
        {
          "until": [
            "</s>"
          ]
        }
      ]
    ],
    "resps": [
      [
        "(A)"
      ]
    ],
    "filtered_resps": [
      "(A)"
    ],
    "exact_match": 1.0
  },
  {
    "doc_id": 82,
    "doc": {
      "question": "What percentage of older adults report feeling very or often lonely?",
      "subject": "human_aging",
      "choices": [
        "10%",
        "25%",
        "50%",
        "75%"
      ],
      "answer": 0
    },
    "target": "(A)",
    "arguments": [
      [
        "The following are multiple choice questions (with answers) about human aging.\n\nQ: The finding that adults tend to remember events from their adolescence better than from other periods in their lives is referred to as the\n(A) Adolescence advantage (B) Reminiscence bump (C) Memorial memorial (D) Quadratic retrieval spike\nA:  (B)\n\nQ: Which of the following persons is more likely to remain at home alone, as of 2019?\n(A) An Asian man or woman (B) A Hispanic man (C) An African American woman (D) A white man or woman\nA:  (C)\n\nQ: Which element in tobacco smoke is responsible for cancers?\n(A) Nicotine (B) Tar (C) Carbon monoxide (D) Smoke particles\nA:  (B)\n\nQ: All other things being equal, which of the following persons is more likely to show osteoporosis?\n(A) An older Hispanic American woman (B) An older African American woman (C) An older Asian American woman (D) An older Native American woman\nA:  (C)\n\nQ: When older adults move to a new state after retirement, which of the following is the more likely destination?\n(A) Texas (B) California (C) Hawaii (D) Vermont\nA:  (A)\n\nQ: What percentage of older adults report feeling very or often lonely?\n(A) 10% (B) 25% (C) 50% (D) 75%\nA: ",
        {
          "until": [
            "</s>"
          ]
        }
      ]
    ],
    "resps": [
      [
        "(C)"
      ]
    ],
    "filtered_resps": [
      "(C)"
    ],
    "exact_match": 0.0
  },
  {
    "doc_id": 90,
    "doc": {
      "question": "Which of the following improves attitudes toward aging and older adults?",
      "subject": "human_aging",
      "choices": [
        "Staying away from older adults",
        "Education about older adults",
        "Travelling to older communities",
        "Watching the portrayals of older adults in movies and on TV"
      ],
      "answer": 1
    },
    "target": "(B)",
    "arguments": [
      [
        "The following are multiple choice questions (with answers) about human aging.\n\nQ: Which of the following persons is more likely to remain at home alone, as of 2019?\n(A) An Asian man or woman (B) A Hispanic man (C) An African American woman (D) A white man or woman\nA:  (C)\n\nQ: The finding that adults tend to remember events from their adolescence better than from other periods in their lives is referred to as the\n(A) Adolescence advantage (B) Reminiscence bump (C) Memorial memorial (D) Quadratic retrieval spike\nA:  (B)\n\nQ: All other things being equal, which of the following persons is more likely to show osteoporosis?\n(A) An older Hispanic American woman (B) An older African American woman (C) An older Asian American woman (D) An older Native American woman\nA:  (C)\n\nQ: When older adults move to a new state after retirement, which of the following is the more likely destination?\n(A) Texas (B) California (C) Hawaii (D) Vermont\nA:  (A)\n\nQ: Which element in tobacco smoke is responsible for cancers?\n(A) Nicotine (B) Tar (C) Carbon monoxide (D) Smoke particles\nA:  (B)\n\nQ: Which of the following improves attitudes toward aging and older adults?\n(A) Staying away from older adults (B) Education about older adults (C) Travelling to older communities (D) Watching the portrayals of older adults in movies and on TV\nA: ",
        {
          "until": [
            "</s>"
          ]
        }
      ]
    ],
    "resps": [
      [
        "(B)"
      ]
    ],
    "filtered_resps": [
      "(B)"
    ],
    "exact_match": 1.0
  },
  {
    "doc_id": 98,
    "doc": {
      "question": "The model of social support that says that those who are close to you now are likely to be close for the rest of your days is called the ____ model",
      "subject": "human_aging",
      "choices": [
        "Consistency",
        "Convoy",
        "Attachment",
        "Train"
      ],
      "answer": 1
    },
    "target": "(B)",
    "arguments": [
      [
        "The following are multiple choice questions (with answers) about human aging.\n\nQ: Which of the following persons is more likely to remain at home alone, as of 2019?\n(A) An Asian man or woman (B) A Hispanic man (C) An African American woman (D) A white man or woman\nA:  (C)\n\nQ: The finding that adults tend to remember events from their adolescence better than from other periods in their lives is referred to as the\n(A) Adolescence advantage (B) Reminiscence bump (C) Memorial memorial (D) Quadratic retrieval spike\nA:  (B)\n\nQ: When older adults move to a new state after retirement, which of the following is the more likely destination?\n(A) Texas (B) California (C) Hawaii (D) Vermont\nA:  (A)\n\nQ: Which element in tobacco smoke is responsible for cancers?\n(A) Nicotine (B) Tar (C) Carbon monoxide (D) Smoke particles\nA:  (B)\n\nQ: All other things being equal, which of the following persons is more likely to show osteoporosis?\n(A) An older Hispanic American woman (B) An older African American woman (C) An older Asian American woman (D) An older Native American woman\nA:  (C)\n\nQ: The model of social support that says that those who are close to you now are likely to be close for the rest of your days is called the ____ model\n(A) Consistency (B) Convoy (C) Attachment (D) Train\nA: ",
        {
          "until": [
            "</s>"
          ]
        }
      ]
    ],
    "resps": [
      [
        "(A)"
      ]
    ],
    "filtered_resps": [
      "(A)"
    ],
    "exact_match": 0.0
  },
  {
    "doc_id": 106,
    "doc": {
      "question": "An increase in neuroticism later in life is a strong predictor of",
      "subject": "human_aging",
      "choices": [
        "Mortality",
        "Loss of social support",
        "Cognitive decline",
        "Independence"
      ],
      "answer": 0
    },
    "target": "(A)",
    "arguments": [
      [
        "The following are multiple choice questions (with answers) about human aging.\n\nQ: Which of the following persons is more likely to remain at home alone, as of 2019?\n(A) An Asian man or woman (B) A Hispanic man (C) An African American woman (D) A white man or woman\nA:  (C)\n\nQ: Which element in tobacco smoke is responsible for cancers?\n(A) Nicotine (B) Tar (C) Carbon monoxide (D) Smoke particles\nA:  (B)\n\nQ: The finding that adults tend to remember events from their adolescence better than from other periods in their lives is referred to as the\n(A) Adolescence advantage (B) Reminiscence bump (C) Memorial memorial (D) Quadratic retrieval spike\nA:  (B)\n\nQ: All other things being equal, which of the following persons is more likely to show osteoporosis?\n(A) An older Hispanic American woman (B) An older African American woman (C) An older Asian American woman (D) An older Native American woman\nA:  (C)\n\nQ: When older adults move to a new state after retirement, which of the following is the more likely destination?\n(A) Texas (B) California (C) Hawaii (D) Vermont\nA:  (A)\n\nQ: An increase in neuroticism later in life is a strong predictor of\n(A) Mortality (B) Loss of social support (C) Cognitive decline (D) Independence\nA: ",
        {
          "until": [
            "</s>"
          ]
        }
      ]
    ],
    "resps": [
      [
        "(C)"
      ]
    ],
    "filtered_resps": [
      "(C)"
    ],
    "exact_match": 0.0
  },
  {
    "doc_id": 114,
    "doc": {
      "question": "A person who is not very well organized, rarely sets goals, and frequently puts things off until the last minute would be said to be low on which trait?",
      "subject": "human_aging",
      "choices": [
        "Agreeableness",
        "Conscientiousness",
        "Openness",
        "Neuroticism"
      ],
      "answer": 1
    },
    "target": "(B)",
    "arguments": [
      [
        "The following are multiple choice questions (with answers) about human aging.\n\nQ: When older adults move to a new state after retirement, which of the following is the more likely destination?\n(A) Texas (B) California (C) Hawaii (D) Vermont\nA:  (A)\n\nQ: The finding that adults tend to remember events from their adolescence better than from other periods in their lives is referred to as the\n(A) Adolescence advantage (B) Reminiscence bump (C) Memorial memorial (D) Quadratic retrieval spike\nA:  (B)\n\nQ: Which element in tobacco smoke is responsible for cancers?\n(A) Nicotine (B) Tar (C) Carbon monoxide (D) Smoke particles\nA:  (B)\n\nQ: Which of the following persons is more likely to remain at home alone, as of 2019?\n(A) An Asian man or woman (B) A Hispanic man (C) An African American woman (D) A white man or woman\nA:  (C)\n\nQ: All other things being equal, which of the following persons is more likely to show osteoporosis?\n(A) An older Hispanic American woman (B) An older African American woman (C) An older Asian American woman (D) An older Native American woman\nA:  (C)\n\nQ: A person who is not very well organized, rarely sets goals, and frequently puts things off until the last minute would be said to be low on which trait?\n(A) Agreeableness (B) Conscientiousness (C) Openness (D) Neuroticism\nA: ",
        {
          "until": [
            "</s>"
          ]
        }
      ]
    ],
    "resps": [
      [
        "(B)"
      ]
    ],
    "filtered_resps": [
      "(B)"
    ],
    "exact_match": 1.0
  },
  {
    "doc_id": 122,
    "doc": {
      "question": "A possible positive effect of moderate alcohol consumption is that it may",
      "subject": "human_aging",
      "choices": [
        "Inhibit the growth of cancers",
        "Promote healing from injuries and illnesses",
        "Keep blood vessels from stiffening",
        "Result in relaxation and lower blood pressure"
      ],
      "answer": 2
    },
    "target": "(C)",
    "arguments": [
      [
        "The following are multiple choice questions (with answers) about human aging.\n\nQ: Which of the following persons is more likely to remain at home alone, as of 2019?\n(A) An Asian man or woman (B) A Hispanic man (C) An African American woman (D) A white man or woman\nA:  (C)\n\nQ: Which element in tobacco smoke is responsible for cancers?\n(A) Nicotine (B) Tar (C) Carbon monoxide (D) Smoke particles\nA:  (B)\n\nQ: The finding that adults tend to remember events from their adolescence better than from other periods in their lives is referred to as the\n(A) Adolescence advantage (B) Reminiscence bump (C) Memorial memorial (D) Quadratic retrieval spike\nA:  (B)\n\nQ: When older adults move to a new state after retirement, which of the following is the more likely destination?\n(A) Texas (B) California (C) Hawaii (D) Vermont\nA:  (A)\n\nQ: All other things being equal, which of the following persons is more likely to show osteoporosis?\n(A) An older Hispanic American woman (B) An older African American woman (C) An older Asian American woman (D) An older Native American woman\nA:  (C)\n\nQ: A possible positive effect of moderate alcohol consumption is that it may\n(A) Inhibit the growth of cancers (B) Promote healing from injuries and illnesses (C) Keep blood vessels from stiffening (D) Result in relaxation and lower blood pressure\nA: ",
        {
          "until": [
            "</s>"
          ]
        }
      ]
    ],
    "resps": [
      [
        "(D)"
      ]
    ],
    "filtered_resps": [
      "(D)"
    ],
    "exact_match": 0.0
  },
  {
    "doc_id": 130,
    "doc": {
      "question": "Loss of muscle fiber may be due to loss of neurons which may be due to",
      "subject": "human_aging",
      "choices": [
        "Clogged blood vessels",
        "Loss of bone density",
        "Changes in hormone levels",
        "Loss of collagen"
      ],
      "answer": 0
    },
    "target": "(A)",
    "arguments": [
      [
        "The following are multiple choice questions (with answers) about human aging.\n\nQ: All other things being equal, which of the following persons is more likely to show osteoporosis?\n(A) An older Hispanic American woman (B) An older African American woman (C) An older Asian American woman (D) An older Native American woman\nA:  (C)\n\nQ: Which element in tobacco smoke is responsible for cancers?\n(A) Nicotine (B) Tar (C) Carbon monoxide (D) Smoke particles\nA:  (B)\n\nQ: The finding that adults tend to remember events from their adolescence better than from other periods in their lives is referred to as the\n(A) Adolescence advantage (B) Reminiscence bump (C) Memorial memorial (D) Quadratic retrieval spike\nA:  (B)\n\nQ: Which of the following persons is more likely to remain at home alone, as of 2019?\n(A) An Asian man or woman (B) A Hispanic man (C) An African American woman (D) A white man or woman\nA:  (C)\n\nQ: When older adults move to a new state after retirement, which of the following is the more likely destination?\n(A) Texas (B) California (C) Hawaii (D) Vermont\nA:  (A)\n\nQ: Loss of muscle fiber may be due to loss of neurons which may be due to\n(A) Clogged blood vessels (B) Loss of bone density (C) Changes in hormone levels (D) Loss of collagen\nA: ",
        {
          "until": [
            "</s>"
          ]
        }
      ]
    ],
    "resps": [
      [
        "(D)"
      ]
    ],
    "filtered_resps": [
      "(D)"
    ],
    "exact_match": 0.0
  },
  {
    "doc_id": 138,
    "doc": {
      "question": "The initials ADL stand for",
      "subject": "human_aging",
      "choices": [
        "Activities of Daily Living",
        "American Disease Legion",
        "Always Delay Learning",
        "Ancient Dependent Ladies"
      ],
      "answer": 0
    },
    "target": "(A)",
    "arguments": [
      [
        "The following are multiple choice questions (with answers) about human aging.\n\nQ: All other things being equal, which of the following persons is more likely to show osteoporosis?\n(A) An older Hispanic American woman (B) An older African American woman (C) An older Asian American woman (D) An older Native American woman\nA:  (C)\n\nQ: The finding that adults tend to remember events from their adolescence better than from other periods in their lives is referred to as the\n(A) Adolescence advantage (B) Reminiscence bump (C) Memorial memorial (D) Quadratic retrieval spike\nA:  (B)\n\nQ: Which element in tobacco smoke is responsible for cancers?\n(A) Nicotine (B) Tar (C) Carbon monoxide (D) Smoke particles\nA:  (B)\n\nQ: When older adults move to a new state after retirement, which of the following is the more likely destination?\n(A) Texas (B) California (C) Hawaii (D) Vermont\nA:  (A)\n\nQ: Which of the following persons is more likely to remain at home alone, as of 2019?\n(A) An Asian man or woman (B) A Hispanic man (C) An African American woman (D) A white man or woman\nA:  (C)\n\nQ: The initials ADL stand for\n(A) Activities of Daily Living (B) American Disease Legion (C) Always Delay Learning (D) Ancient Dependent Ladies\nA: ",
        {
          "until": [
            "</s>"
          ]
        }
      ]
    ],
    "resps": [
      [
        "(A)"
      ]
    ],
    "filtered_resps": [
      "(A)"
    ],
    "exact_match": 1.0
  },
  {
    "doc_id": 146,
    "doc": {
      "question": "An example of a gain, rather than a loss, that occurs as we grow older is our gain in",
      "subject": "human_aging",
      "choices": [
        "Perspective",
        "Quickness",
        "Size of our social networks",
        "Certainty"
      ],
      "answer": 0
    },
    "target": "(A)",
    "arguments": [
      [
        "The following are multiple choice questions (with answers) about human aging.\n\nQ: When older adults move to a new state after retirement, which of the following is the more likely destination?\n(A) Texas (B) California (C) Hawaii (D) Vermont\nA:  (A)\n\nQ: Which of the following persons is more likely to remain at home alone, as of 2019?\n(A) An Asian man or woman (B) A Hispanic man (C) An African American woman (D) A white man or woman\nA:  (C)\n\nQ: Which element in tobacco smoke is responsible for cancers?\n(A) Nicotine (B) Tar (C) Carbon monoxide (D) Smoke particles\nA:  (B)\n\nQ: The finding that adults tend to remember events from their adolescence better than from other periods in their lives is referred to as the\n(A) Adolescence advantage (B) Reminiscence bump (C) Memorial memorial (D) Quadratic retrieval spike\nA:  (B)\n\nQ: All other things being equal, which of the following persons is more likely to show osteoporosis?\n(A) An older Hispanic American woman (B) An older African American woman (C) An older Asian American woman (D) An older Native American woman\nA:  (C)\n\nQ: An example of a gain, rather than a loss, that occurs as we grow older is our gain in\n(A) Perspective (B) Quickness (C) Size of our social networks (D) Certainty\nA: ",
        {
          "until": [
            "</s>"
          ]
        }
      ]
    ],
    "resps": [
      [
        "(D)"
      ]
    ],
    "filtered_resps": [
      "(D)"
    ],
    "exact_match": 0.0
  },
  {
    "doc_id": 154,
    "doc": {
      "question": "Which of the following statements is TRUE concerning older workers' job performance?",
      "subject": "human_aging",
      "choices": [
        "Older workers always perform better because of their vast experience",
        "Older workers never perform better than younger workers because with age, a worker's skills decline.",
        "Job performance for older workers depends both upon the decline of skills and the benefits of experience",
        "Most jobs are performed better by younger adults but a few are performed better by older adults"
      ],
      "answer": 2
    },
    "target": "(C)",
    "arguments": [
      [
        "The following are multiple choice questions (with answers) about human aging.\n\nQ: Which of the following persons is more likely to remain at home alone, as of 2019?\n(A) An Asian man or woman (B) A Hispanic man (C) An African American woman (D) A white man or woman\nA:  (C)\n\nQ: All other things being equal, which of the following persons is more likely to show osteoporosis?\n(A) An older Hispanic American woman (B) An older African American woman (C) An older Asian American woman (D) An older Native American woman\nA:  (C)\n\nQ: The finding that adults tend to remember events from their adolescence better than from other periods in their lives is referred to as the\n(A) Adolescence advantage (B) Reminiscence bump (C) Memorial memorial (D) Quadratic retrieval spike\nA:  (B)\n\nQ: When older adults move to a new state after retirement, which of the following is the more likely destination?\n(A) Texas (B) California (C) Hawaii (D) Vermont\nA:  (A)\n\nQ: Which element in tobacco smoke is responsible for cancers?\n(A) Nicotine (B) Tar (C) Carbon monoxide (D) Smoke particles\nA:  (B)\n\nQ: Which of the following statements is TRUE concerning older workers' job performance?\n(A) Older workers always perform better because of their vast experience (B) Older workers never perform better than younger workers because with age, a worker's skills decline. (C) Job performance for older workers depends both upon the decline of skills and the benefits of experience (D) Most jobs are performed better by younger adults but a few are performed better by older adults\nA: ",
        {
          "until": [
            "</s>"
          ]
        }
      ]
    ],
    "resps": [
      [
        "(C)"
      ]
    ],
    "filtered_resps": [
      "(C)"
    ],
    "exact_match": 1.0
  },
  {
    "doc_id": 162,
    "doc": {
      "question": "The lifespan perspective says that development is composed of gains and losses; this means that",
      "subject": "human_aging",
      "choices": [
        "We gain while we are younger but lose when we are older",
        "We gain some things and lose others at every age",
        "For every aspect of development there is no overall change since each gain is offset by loss",
        "Gains are far more important than losses but losses occur too"
      ],
      "answer": 1
    },
    "target": "(B)",
    "arguments": [
      [
        "The following are multiple choice questions (with answers) about human aging.\n\nQ: The finding that adults tend to remember events from their adolescence better than from other periods in their lives is referred to as the\n(A) Adolescence advantage (B) Reminiscence bump (C) Memorial memorial (D) Quadratic retrieval spike\nA:  (B)\n\nQ: When older adults move to a new state after retirement, which of the following is the more likely destination?\n(A) Texas (B) California (C) Hawaii (D) Vermont\nA:  (A)\n\nQ: Which of the following persons is more likely to remain at home alone, as of 2019?\n(A) An Asian man or woman (B) A Hispanic man (C) An African American woman (D) A white man or woman\nA:  (C)\n\nQ: Which element in tobacco smoke is responsible for cancers?\n(A) Nicotine (B) Tar (C) Carbon monoxide (D) Smoke particles\nA:  (B)\n\nQ: All other things being equal, which of the following persons is more likely to show osteoporosis?\n(A) An older Hispanic American woman (B) An older African American woman (C) An older Asian American woman (D) An older Native American woman\nA:  (C)\n\nQ: The lifespan perspective says that development is composed of gains and losses; this means that\n(A) We gain while we are younger but lose when we are older (B) We gain some things and lose others at every age (C) For every aspect of development there is no overall change since each gain is offset by loss (D) Gains are far more important than losses but losses occur too\nA: ",
        {
          "until": [
            "</s>"
          ]
        }
      ]
    ],
    "resps": [
      [
        "(B)"
      ]
    ],
    "filtered_resps": [
      "(B)"
    ],
    "exact_match": 1.0
  },
  {
    "doc_id": 170,
    "doc": {
      "question": "The design of products and environments to fit the capabilities of people who use them or live there is called _____ design",
      "subject": "human_aging",
      "choices": [
        "Environmental",
        "Ecological",
        "Ergonomic",
        "Eclectic"
      ],
      "answer": 2
    },
    "target": "(C)",
    "arguments": [
      [
        "The following are multiple choice questions (with answers) about human aging.\n\nQ: The finding that adults tend to remember events from their adolescence better than from other periods in their lives is referred to as the\n(A) Adolescence advantage (B) Reminiscence bump (C) Memorial memorial (D) Quadratic retrieval spike\nA:  (B)\n\nQ: When older adults move to a new state after retirement, which of the following is the more likely destination?\n(A) Texas (B) California (C) Hawaii (D) Vermont\nA:  (A)\n\nQ: All other things being equal, which of the following persons is more likely to show osteoporosis?\n(A) An older Hispanic American woman (B) An older African American woman (C) An older Asian American woman (D) An older Native American woman\nA:  (C)\n\nQ: Which of the following persons is more likely to remain at home alone, as of 2019?\n(A) An Asian man or woman (B) A Hispanic man (C) An African American woman (D) A white man or woman\nA:  (C)\n\nQ: Which element in tobacco smoke is responsible for cancers?\n(A) Nicotine (B) Tar (C) Carbon monoxide (D) Smoke particles\nA:  (B)\n\nQ: The design of products and environments to fit the capabilities of people who use them or live there is called _____ design\n(A) Environmental (B) Ecological (C) Ergonomic (D) Eclectic\nA: ",
        {
          "until": [
            "</s>"
          ]
        }
      ]
    ],
    "resps": [
      [
        "(B)"
      ]
    ],
    "filtered_resps": [
      "(B)"
    ],
    "exact_match": 0.0
  },
  {
    "doc_id": 178,
    "doc": {
      "question": "Neuroticism has been found to be correlated with which of the following?",
      "subject": "human_aging",
      "choices": [
        "Anger and guilt",
        "Apathy and indifference",
        "Deceit and cunning",
        "Mania and hypertension"
      ],
      "answer": 0
    },
    "target": "(A)",
    "arguments": [
      [
        "The following are multiple choice questions (with answers) about human aging.\n\nQ: Which element in tobacco smoke is responsible for cancers?\n(A) Nicotine (B) Tar (C) Carbon monoxide (D) Smoke particles\nA:  (B)\n\nQ: The finding that adults tend to remember events from their adolescence better than from other periods in their lives is referred to as the\n(A) Adolescence advantage (B) Reminiscence bump (C) Memorial memorial (D) Quadratic retrieval spike\nA:  (B)\n\nQ: Which of the following persons is more likely to remain at home alone, as of 2019?\n(A) An Asian man or woman (B) A Hispanic man (C) An African American woman (D) A white man or woman\nA:  (C)\n\nQ: All other things being equal, which of the following persons is more likely to show osteoporosis?\n(A) An older Hispanic American woman (B) An older African American woman (C) An older Asian American woman (D) An older Native American woman\nA:  (C)\n\nQ: When older adults move to a new state after retirement, which of the following is the more likely destination?\n(A) Texas (B) California (C) Hawaii (D) Vermont\nA:  (A)\n\nQ: Neuroticism has been found to be correlated with which of the following?\n(A) Anger and guilt (B) Apathy and indifference (C) Deceit and cunning (D) Mania and hypertension\nA: ",
        {
          "until": [
            "</s>"
          ]
        }
      ]
    ],
    "resps": [
      [
        "(D)"
      ]
    ],
    "filtered_resps": [
      "(D)"
    ],
    "exact_match": 0.0
  },
  {
    "doc_id": 186,
    "doc": {
      "question": "About what percentage of people who have had bridge jobs say it was better than their career job?",
      "subject": "human_aging",
      "choices": [
        "Less than 25%",
        "Less than 50%",
        "More than 50%",
        "More than 75%"
      ],
      "answer": 2
    },
    "target": "(C)",
    "arguments": [
      [
        "The following are multiple choice questions (with answers) about human aging.\n\nQ: The finding that adults tend to remember events from their adolescence better than from other periods in their lives is referred to as the\n(A) Adolescence advantage (B) Reminiscence bump (C) Memorial memorial (D) Quadratic retrieval spike\nA:  (B)\n\nQ: Which of the following persons is more likely to remain at home alone, as of 2019?\n(A) An Asian man or woman (B) A Hispanic man (C) An African American woman (D) A white man or woman\nA:  (C)\n\nQ: When older adults move to a new state after retirement, which of the following is the more likely destination?\n(A) Texas (B) California (C) Hawaii (D) Vermont\nA:  (A)\n\nQ: All other things being equal, which of the following persons is more likely to show osteoporosis?\n(A) An older Hispanic American woman (B) An older African American woman (C) An older Asian American woman (D) An older Native American woman\nA:  (C)\n\nQ: Which element in tobacco smoke is responsible for cancers?\n(A) Nicotine (B) Tar (C) Carbon monoxide (D) Smoke particles\nA:  (B)\n\nQ: About what percentage of people who have had bridge jobs say it was better than their career job?\n(A) Less than 25% (B) Less than 50% (C) More than 50% (D) More than 75%\nA: ",
        {
          "until": [
            "</s>"
          ]
        }
      ]
    ],
    "resps": [
      [
        "(C)"
      ]
    ],
    "filtered_resps": [
      "(C)"
    ],
    "exact_match": 1.0
  },
  {
    "doc_id": 194,
    "doc": {
      "question": "Current life expectancy in the United States is about",
      "subject": "human_aging",
      "choices": [
        "78",
        "82",
        "68",
        "75"
      ],
      "answer": 0
    },
    "target": "(A)",
    "arguments": [
      [
        "The following are multiple choice questions (with answers) about human aging.\n\nQ: Which element in tobacco smoke is responsible for cancers?\n(A) Nicotine (B) Tar (C) Carbon monoxide (D) Smoke particles\nA:  (B)\n\nQ: Which of the following persons is more likely to remain at home alone, as of 2019?\n(A) An Asian man or woman (B) A Hispanic man (C) An African American woman (D) A white man or woman\nA:  (C)\n\nQ: When older adults move to a new state after retirement, which of the following is the more likely destination?\n(A) Texas (B) California (C) Hawaii (D) Vermont\nA:  (A)\n\nQ: The finding that adults tend to remember events from their adolescence better than from other periods in their lives is referred to as the\n(A) Adolescence advantage (B) Reminiscence bump (C) Memorial memorial (D) Quadratic retrieval spike\nA:  (B)\n\nQ: All other things being equal, which of the following persons is more likely to show osteoporosis?\n(A) An older Hispanic American woman (B) An older African American woman (C) An older Asian American woman (D) An older Native American woman\nA:  (C)\n\nQ: Current life expectancy in the United States is about\n(A) 78 (B) 82 (C) 68 (D) 75\nA: ",
        {
          "until": [
            "</s>"
          ]
        }
      ]
    ],
    "resps": [
      [
        "(D)"
      ]
    ],
    "filtered_resps": [
      "(D)"
    ],
    "exact_match": 0.0
  },
  {
    "doc_id": 202,
    "doc": {
      "question": "The Kingbergs give us several keys to successful aging; which of the following is one that they did not name?",
      "subject": "human_aging",
      "choices": [
        "Eat the correct food but not too much.",
        "Respect each other",
        "Party at least once a month",
        "Make long-range plans"
      ],
      "answer": 2
    },
    "target": "(C)",
    "arguments": [
      [
        "The following are multiple choice questions (with answers) about human aging.\n\nQ: Which element in tobacco smoke is responsible for cancers?\n(A) Nicotine (B) Tar (C) Carbon monoxide (D) Smoke particles\nA:  (B)\n\nQ: The finding that adults tend to remember events from their adolescence better than from other periods in their lives is referred to as the\n(A) Adolescence advantage (B) Reminiscence bump (C) Memorial memorial (D) Quadratic retrieval spike\nA:  (B)\n\nQ: Which of the following persons is more likely to remain at home alone, as of 2019?\n(A) An Asian man or woman (B) A Hispanic man (C) An African American woman (D) A white man or woman\nA:  (C)\n\nQ: All other things being equal, which of the following persons is more likely to show osteoporosis?\n(A) An older Hispanic American woman (B) An older African American woman (C) An older Asian American woman (D) An older Native American woman\nA:  (C)\n\nQ: When older adults move to a new state after retirement, which of the following is the more likely destination?\n(A) Texas (B) California (C) Hawaii (D) Vermont\nA:  (A)\n\nQ: The Kingbergs give us several keys to successful aging; which of the following is one that they did not name?\n(A) Eat the correct food but not too much. (B) Respect each other (C) Party at least once a month (D) Make long-range plans\nA: ",
        {
          "until": [
            "</s>"
          ]
        }
      ]
    ],
    "resps": [
      [
        "(D)"
      ]
    ],
    "filtered_resps": [
      "(D)"
    ],
    "exact_match": 0.0
  },
  {
    "doc_id": 210,
    "doc": {
      "question": "A disadvantage of institutional care is that the staff frequently teach older residents to be",
      "subject": "human_aging",
      "choices": [
        "Rude",
        "Dependent",
        "Independent",
        "Selfish"
      ],
      "answer": 1
    },
    "target": "(B)",
    "arguments": [
      [
        "The following are multiple choice questions (with answers) about human aging.\n\nQ: Which element in tobacco smoke is responsible for cancers?\n(A) Nicotine (B) Tar (C) Carbon monoxide (D) Smoke particles\nA:  (B)\n\nQ: The finding that adults tend to remember events from their adolescence better than from other periods in their lives is referred to as the\n(A) Adolescence advantage (B) Reminiscence bump (C) Memorial memorial (D) Quadratic retrieval spike\nA:  (B)\n\nQ: All other things being equal, which of the following persons is more likely to show osteoporosis?\n(A) An older Hispanic American woman (B) An older African American woman (C) An older Asian American woman (D) An older Native American woman\nA:  (C)\n\nQ: Which of the following persons is more likely to remain at home alone, as of 2019?\n(A) An Asian man or woman (B) A Hispanic man (C) An African American woman (D) A white man or woman\nA:  (C)\n\nQ: When older adults move to a new state after retirement, which of the following is the more likely destination?\n(A) Texas (B) California (C) Hawaii (D) Vermont\nA:  (A)\n\nQ: A disadvantage of institutional care is that the staff frequently teach older residents to be\n(A) Rude (B) Dependent (C) Independent (D) Selfish\nA: ",
        {
          "until": [
            "</s>"
          ]
        }
      ]
    ],
    "resps": [
      [
        "(B)"
      ]
    ],
    "filtered_resps": [
      "(B)"
    ],
    "exact_match": 1.0
  },
  {
    "doc_id": 218,
    "doc": {
      "question": "The information stored in memory, according to research and our Senior View interviewees, is",
      "subject": "human_aging",
      "choices": [
        "True to life",
        "Our own interpretation",
        "Always exaggerated",
        "Never accurate"
      ],
      "answer": 1
    },
    "target": "(B)",
    "arguments": [
      [
        "The following are multiple choice questions (with answers) about human aging.\n\nQ: The finding that adults tend to remember events from their adolescence better than from other periods in their lives is referred to as the\n(A) Adolescence advantage (B) Reminiscence bump (C) Memorial memorial (D) Quadratic retrieval spike\nA:  (B)\n\nQ: All other things being equal, which of the following persons is more likely to show osteoporosis?\n(A) An older Hispanic American woman (B) An older African American woman (C) An older Asian American woman (D) An older Native American woman\nA:  (C)\n\nQ: Which element in tobacco smoke is responsible for cancers?\n(A) Nicotine (B) Tar (C) Carbon monoxide (D) Smoke particles\nA:  (B)\n\nQ: Which of the following persons is more likely to remain at home alone, as of 2019?\n(A) An Asian man or woman (B) A Hispanic man (C) An African American woman (D) A white man or woman\nA:  (C)\n\nQ: When older adults move to a new state after retirement, which of the following is the more likely destination?\n(A) Texas (B) California (C) Hawaii (D) Vermont\nA:  (A)\n\nQ: The information stored in memory, according to research and our Senior View interviewees, is\n(A) True to life (B) Our own interpretation (C) Always exaggerated (D) Never accurate\nA: ",
        {
          "until": [
            "</s>"
          ]
        }
      ]
    ],
    "resps": [
      [
        "(A)"
      ]
    ],
    "filtered_resps": [
      "(A)"
    ],
    "exact_match": 0.0
  },
  {
    "doc_id": 3,
    "doc": {
      "question": "Normal memory seems to be improved by",
      "subject": "human_aging",
      "choices": [
        "Aerobic exercise",
        "Taking acetylcholine",
        "Taking gingko",
        "Increasing social contacts"
      ],
      "answer": 0
    },
    "target": "(A)",
    "arguments": [
      [
        "The following are multiple choice questions (with answers) about human aging.\n\nQ: Which element in tobacco smoke is responsible for cancers?\n(A) Nicotine (B) Tar (C) Carbon monoxide (D) Smoke particles\nA:  (B)\n\nQ: Which of the following persons is more likely to remain at home alone, as of 2019?\n(A) An Asian man or woman (B) A Hispanic man (C) An African American woman (D) A white man or woman\nA:  (C)\n\nQ: All other things being equal, which of the following persons is more likely to show osteoporosis?\n(A) An older Hispanic American woman (B) An older African American woman (C) An older Asian American woman (D) An older Native American woman\nA:  (C)\n\nQ: When older adults move to a new state after retirement, which of the following is the more likely destination?\n(A) Texas (B) California (C) Hawaii (D) Vermont\nA:  (A)\n\nQ: The finding that adults tend to remember events from their adolescence better than from other periods in their lives is referred to as the\n(A) Adolescence advantage (B) Reminiscence bump (C) Memorial memorial (D) Quadratic retrieval spike\nA:  (B)\n\nQ: Normal memory seems to be improved by\n(A) Aerobic exercise (B) Taking acetylcholine (C) Taking gingko (D) Increasing social contacts\nA: ",
        {
          "until": [
            "</s>"
          ]
        }
      ]
    ],
    "resps": [
      [
        "(B)"
      ]
    ],
    "filtered_resps": [
      "(B)"
    ],
    "exact_match": 0.0
  },
  {
    "doc_id": 11,
    "doc": {
      "question": "Bu is often late for appointments but says it's because she had more important things on her mind. This is an example of which coping strategy?",
      "subject": "human_aging",
      "choices": [
        "Immunization",
        "Accommodation",
        "Avoidance",
        "Assimilation"
      ],
      "answer": 0
    },
    "target": "(A)",
    "arguments": [
      [
        "The following are multiple choice questions (with answers) about human aging.\n\nQ: Which of the following persons is more likely to remain at home alone, as of 2019?\n(A) An Asian man or woman (B) A Hispanic man (C) An African American woman (D) A white man or woman\nA:  (C)\n\nQ: All other things being equal, which of the following persons is more likely to show osteoporosis?\n(A) An older Hispanic American woman (B) An older African American woman (C) An older Asian American woman (D) An older Native American woman\nA:  (C)\n\nQ: The finding that adults tend to remember events from their adolescence better than from other periods in their lives is referred to as the\n(A) Adolescence advantage (B) Reminiscence bump (C) Memorial memorial (D) Quadratic retrieval spike\nA:  (B)\n\nQ: Which element in tobacco smoke is responsible for cancers?\n(A) Nicotine (B) Tar (C) Carbon monoxide (D) Smoke particles\nA:  (B)\n\nQ: When older adults move to a new state after retirement, which of the following is the more likely destination?\n(A) Texas (B) California (C) Hawaii (D) Vermont\nA:  (A)\n\nQ: Bu is often late for appointments but says it's because she had more important things on her mind. This is an example of which coping strategy?\n(A) Immunization (B) Accommodation (C) Avoidance (D) Assimilation\nA: ",
        {
          "until": [
            "</s>"
          ]
        }
      ]
    ],
    "resps": [
      [
        "(D)"
      ]
    ],
    "filtered_resps": [
      "(D)"
    ],
    "exact_match": 0.0
  },
  {
    "doc_id": 19,
    "doc": {
      "question": "The Hayflick number for human cells is",
      "subject": "human_aging",
      "choices": [
        "Unknown",
        "Between 45 and 55",
        "Less than 30",
        "More than 60"
      ],
      "answer": 1
    },
    "target": "(B)",
    "arguments": [
      [
        "The following are multiple choice questions (with answers) about human aging.\n\nQ: Which of the following persons is more likely to remain at home alone, as of 2019?\n(A) An Asian man or woman (B) A Hispanic man (C) An African American woman (D) A white man or woman\nA:  (C)\n\nQ: All other things being equal, which of the following persons is more likely to show osteoporosis?\n(A) An older Hispanic American woman (B) An older African American woman (C) An older Asian American woman (D) An older Native American woman\nA:  (C)\n\nQ: The finding that adults tend to remember events from their adolescence better than from other periods in their lives is referred to as the\n(A) Adolescence advantage (B) Reminiscence bump (C) Memorial memorial (D) Quadratic retrieval spike\nA:  (B)\n\nQ: When older adults move to a new state after retirement, which of the following is the more likely destination?\n(A) Texas (B) California (C) Hawaii (D) Vermont\nA:  (A)\n\nQ: Which element in tobacco smoke is responsible for cancers?\n(A) Nicotine (B) Tar (C) Carbon monoxide (D) Smoke particles\nA:  (B)\n\nQ: The Hayflick number for human cells is\n(A) Unknown (B) Between 45 and 55 (C) Less than 30 (D) More than 60\nA: ",
        {
          "until": [
            "</s>"
          ]
        }
      ]
    ],
    "resps": [
      [
        "(D)"
      ]
    ],
    "filtered_resps": [
      "(D)"
    ],
    "exact_match": 0.0
  },
  {
    "doc_id": 27,
    "doc": {
      "question": "Hearing loss occurs more frequently for",
      "subject": "human_aging",
      "choices": [
        "Men than women",
        "Women than men",
        "People who already have some loss of vision",
        "People who are obese"
      ],
      "answer": 0
    },
    "target": "(A)",
    "arguments": [
      [
        "The following are multiple choice questions (with answers) about human aging.\n\nQ: The finding that adults tend to remember events from their adolescence better than from other periods in their lives is referred to as the\n(A) Adolescence advantage (B) Reminiscence bump (C) Memorial memorial (D) Quadratic retrieval spike\nA:  (B)\n\nQ: Which of the following persons is more likely to remain at home alone, as of 2019?\n(A) An Asian man or woman (B) A Hispanic man (C) An African American woman (D) A white man or woman\nA:  (C)\n\nQ: Which element in tobacco smoke is responsible for cancers?\n(A) Nicotine (B) Tar (C) Carbon monoxide (D) Smoke particles\nA:  (B)\n\nQ: When older adults move to a new state after retirement, which of the following is the more likely destination?\n(A) Texas (B) California (C) Hawaii (D) Vermont\nA:  (A)\n\nQ: All other things being equal, which of the following persons is more likely to show osteoporosis?\n(A) An older Hispanic American woman (B) An older African American woman (C) An older Asian American woman (D) An older Native American woman\nA:  (C)\n\nQ: Hearing loss occurs more frequently for\n(A) Men than women (B) Women than men (C) People who already have some loss of vision (D) People who are obese\nA: ",
        {
          "until": [
            "</s>"
          ]
        }
      ]
    ],
    "resps": [
      [
        "(C)"
      ]
    ],
    "filtered_resps": [
      "(C)"
    ],
    "exact_match": 0.0
  },
  {
    "doc_id": 35,
    "doc": {
      "question": "Loss of smell for adults 80 and older is",
      "subject": "human_aging",
      "choices": [
        "Very infrequent (less than 15%)",
        "Very frequent (more than 75%)",
        "Infrequent (less than 40%)",
        "Frequent (close to 50%)"
      ],
      "answer": 1
    },
    "target": "(B)",
    "arguments": [
      [
        "The following are multiple choice questions (with answers) about human aging.\n\nQ: All other things being equal, which of the following persons is more likely to show osteoporosis?\n(A) An older Hispanic American woman (B) An older African American woman (C) An older Asian American woman (D) An older Native American woman\nA:  (C)\n\nQ: Which element in tobacco smoke is responsible for cancers?\n(A) Nicotine (B) Tar (C) Carbon monoxide (D) Smoke particles\nA:  (B)\n\nQ: Which of the following persons is more likely to remain at home alone, as of 2019?\n(A) An Asian man or woman (B) A Hispanic man (C) An African American woman (D) A white man or woman\nA:  (C)\n\nQ: When older adults move to a new state after retirement, which of the following is the more likely destination?\n(A) Texas (B) California (C) Hawaii (D) Vermont\nA:  (A)\n\nQ: The finding that adults tend to remember events from their adolescence better than from other periods in their lives is referred to as the\n(A) Adolescence advantage (B) Reminiscence bump (C) Memorial memorial (D) Quadratic retrieval spike\nA:  (B)\n\nQ: Loss of smell for adults 80 and older is\n(A) Very infrequent (less than 15%) (B) Very frequent (more than 75%) (C) Infrequent (less than 40%) (D) Frequent (close to 50%)\nA: ",
        {
          "until": [
            "</s>"
          ]
        }
      ]
    ],
    "resps": [
      [
        "(C)"
      ]
    ],
    "filtered_resps": [
      "(C)"
    ],
    "exact_match": 0.0
  },
  {
    "doc_id": 43,
    "doc": {
      "question": "A researcher who wants to examine both age and cohort differences is advised to use a _____ design.",
      "subject": "human_aging",
      "choices": [
        "Cross-sectional",
        "Cross-sequential",
        "Correlational",
        "Quasi-experimental"
      ],
      "answer": 1
    },
    "target": "(B)",
    "arguments": [
      [
        "The following are multiple choice questions (with answers) about human aging.\n\nQ: Which of the following persons is more likely to remain at home alone, as of 2019?\n(A) An Asian man or woman (B) A Hispanic man (C) An African American woman (D) A white man or woman\nA:  (C)\n\nQ: All other things being equal, which of the following persons is more likely to show osteoporosis?\n(A) An older Hispanic American woman (B) An older African American woman (C) An older Asian American woman (D) An older Native American woman\nA:  (C)\n\nQ: When older adults move to a new state after retirement, which of the following is the more likely destination?\n(A) Texas (B) California (C) Hawaii (D) Vermont\nA:  (A)\n\nQ: Which element in tobacco smoke is responsible for cancers?\n(A) Nicotine (B) Tar (C) Carbon monoxide (D) Smoke particles\nA:  (B)\n\nQ: The finding that adults tend to remember events from their adolescence better than from other periods in their lives is referred to as the\n(A) Adolescence advantage (B) Reminiscence bump (C) Memorial memorial (D) Quadratic retrieval spike\nA:  (B)\n\nQ: A researcher who wants to examine both age and cohort differences is advised to use a _____ design.\n(A) Cross-sectional (B) Cross-sequential (C) Correlational (D) Quasi-experimental\nA: ",
        {
          "until": [
            "</s>"
          ]
        }
      ]
    ],
    "resps": [
      [
        "(A)"
      ]
    ],
    "filtered_resps": [
      "(A)"
    ],
    "exact_match": 0.0
  },
  {
    "doc_id": 51,
    "doc": {
      "question": "Quantitative analyses of TV shows have shown that",
      "subject": "human_aging",
      "choices": [
        "Older adults are almost always portrayed in a negative way",
        "The more positive portrayals occur during commercials",
        "The proportion of older men is particularly low",
        "The proportion of older women is particularly low"
      ],
      "answer": 3
    },
    "target": "(D)",
    "arguments": [
      [
        "The following are multiple choice questions (with answers) about human aging.\n\nQ: All other things being equal, which of the following persons is more likely to show osteoporosis?\n(A) An older Hispanic American woman (B) An older African American woman (C) An older Asian American woman (D) An older Native American woman\nA:  (C)\n\nQ: Which of the following persons is more likely to remain at home alone, as of 2019?\n(A) An Asian man or woman (B) A Hispanic man (C) An African American woman (D) A white man or woman\nA:  (C)\n\nQ: When older adults move to a new state after retirement, which of the following is the more likely destination?\n(A) Texas (B) California (C) Hawaii (D) Vermont\nA:  (A)\n\nQ: The finding that adults tend to remember events from their adolescence better than from other periods in their lives is referred to as the\n(A) Adolescence advantage (B) Reminiscence bump (C) Memorial memorial (D) Quadratic retrieval spike\nA:  (B)\n\nQ: Which element in tobacco smoke is responsible for cancers?\n(A) Nicotine (B) Tar (C) Carbon monoxide (D) Smoke particles\nA:  (B)\n\nQ: Quantitative analyses of TV shows have shown that\n(A) Older adults are almost always portrayed in a negative way (B) The more positive portrayals occur during commercials (C) The proportion of older men is particularly low (D) The proportion of older women is particularly low\nA: ",
        {
          "until": [
            "</s>"
          ]
        }
      ]
    ],
    "resps": [
      [
        "(A)"
      ]
    ],
    "filtered_resps": [
      "(A)"
    ],
    "exact_match": 0.0
  },
  {
    "doc_id": 59,
    "doc": {
      "question": "With respect to marital satisfaction, most long lasting marriages",
      "subject": "human_aging",
      "choices": [
        "Show high satisfaction through all the years of marriage",
        "Show high satisfaction that steadily declines as the years pass",
        "Show lower levels during the years when children are present",
        "Show ups and downs throughout the marriage"
      ],
      "answer": 2
    },
    "target": "(C)",
    "arguments": [
      [
        "The following are multiple choice questions (with answers) about human aging.\n\nQ: When older adults move to a new state after retirement, which of the following is the more likely destination?\n(A) Texas (B) California (C) Hawaii (D) Vermont\nA:  (A)\n\nQ: All other things being equal, which of the following persons is more likely to show osteoporosis?\n(A) An older Hispanic American woman (B) An older African American woman (C) An older Asian American woman (D) An older Native American woman\nA:  (C)\n\nQ: Which of the following persons is more likely to remain at home alone, as of 2019?\n(A) An Asian man or woman (B) A Hispanic man (C) An African American woman (D) A white man or woman\nA:  (C)\n\nQ: Which element in tobacco smoke is responsible for cancers?\n(A) Nicotine (B) Tar (C) Carbon monoxide (D) Smoke particles\nA:  (B)\n\nQ: The finding that adults tend to remember events from their adolescence better than from other periods in their lives is referred to as the\n(A) Adolescence advantage (B) Reminiscence bump (C) Memorial memorial (D) Quadratic retrieval spike\nA:  (B)\n\nQ: With respect to marital satisfaction, most long lasting marriages\n(A) Show high satisfaction through all the years of marriage (B) Show high satisfaction that steadily declines as the years pass (C) Show lower levels during the years when children are present (D) Show ups and downs throughout the marriage\nA: ",
        {
          "until": [
            "</s>"
          ]
        }
      ]
    ],
    "resps": [
      [
        "(A)"
      ]
    ],
    "filtered_resps": [
      "(A)"
    ],
    "exact_match": 0.0
  },
  {
    "doc_id": 67,
    "doc": {
      "question": "Older married men have been found to have",
      "subject": "human_aging",
      "choices": [
        "Higher levels of positive emotions",
        "Lower levels of positive emotions",
        "Higher levels of negative emotions",
        "Lower levels of negative emotions"
      ],
      "answer": 3
    },
    "target": "(D)",
    "arguments": [
      [
        "The following are multiple choice questions (with answers) about human aging.\n\nQ: All other things being equal, which of the following persons is more likely to show osteoporosis?\n(A) An older Hispanic American woman (B) An older African American woman (C) An older Asian American woman (D) An older Native American woman\nA:  (C)\n\nQ: Which of the following persons is more likely to remain at home alone, as of 2019?\n(A) An Asian man or woman (B) A Hispanic man (C) An African American woman (D) A white man or woman\nA:  (C)\n\nQ: When older adults move to a new state after retirement, which of the following is the more likely destination?\n(A) Texas (B) California (C) Hawaii (D) Vermont\nA:  (A)\n\nQ: Which element in tobacco smoke is responsible for cancers?\n(A) Nicotine (B) Tar (C) Carbon monoxide (D) Smoke particles\nA:  (B)\n\nQ: The finding that adults tend to remember events from their adolescence better than from other periods in their lives is referred to as the\n(A) Adolescence advantage (B) Reminiscence bump (C) Memorial memorial (D) Quadratic retrieval spike\nA:  (B)\n\nQ: Older married men have been found to have\n(A) Higher levels of positive emotions (B) Lower levels of positive emotions (C) Higher levels of negative emotions (D) Lower levels of negative emotions\nA: ",
        {
          "until": [
            "</s>"
          ]
        }
      ]
    ],
    "resps": [
      [
        "(C)"
      ]
    ],
    "filtered_resps": [
      "(C)"
    ],
    "exact_match": 0.0
  },
  {
    "doc_id": 75,
    "doc": {
      "question": "Remarriages are",
      "subject": "human_aging",
      "choices": [
        "More frequent for woman than men",
        "Typically more successful",
        "Typically less successful",
        "Most common among those who have never been married before"
      ],
      "answer": 2
    },
    "target": "(C)",
    "arguments": [
      [
        "The following are multiple choice questions (with answers) about human aging.\n\nQ: When older adults move to a new state after retirement, which of the following is the more likely destination?\n(A) Texas (B) California (C) Hawaii (D) Vermont\nA:  (A)\n\nQ: The finding that adults tend to remember events from their adolescence better than from other periods in their lives is referred to as the\n(A) Adolescence advantage (B) Reminiscence bump (C) Memorial memorial (D) Quadratic retrieval spike\nA:  (B)\n\nQ: All other things being equal, which of the following persons is more likely to show osteoporosis?\n(A) An older Hispanic American woman (B) An older African American woman (C) An older Asian American woman (D) An older Native American woman\nA:  (C)\n\nQ: Which element in tobacco smoke is responsible for cancers?\n(A) Nicotine (B) Tar (C) Carbon monoxide (D) Smoke particles\nA:  (B)\n\nQ: Which of the following persons is more likely to remain at home alone, as of 2019?\n(A) An Asian man or woman (B) A Hispanic man (C) An African American woman (D) A white man or woman\nA:  (C)\n\nQ: Remarriages are\n(A) More frequent for woman than men (B) Typically more successful (C) Typically less successful (D) Most common among those who have never been married before\nA: ",
        {
          "until": [
            "</s>"
          ]
        }
      ]
    ],
    "resps": [
      [
        "(A)"
      ]
    ],
    "filtered_resps": [
      "(A)"
    ],
    "exact_match": 0.0
  },
  {
    "doc_id": 83,
    "doc": {
      "question": "An example of a discontinuous change over the adult years is the change in",
      "subject": "human_aging",
      "choices": [
        "Personality",
        "Working memory",
        "Female hormone levels",
        "Male sexuality"
      ],
      "answer": 2
    },
    "target": "(C)",
    "arguments": [
      [
        "The following are multiple choice questions (with answers) about human aging.\n\nQ: The finding that adults tend to remember events from their adolescence better than from other periods in their lives is referred to as the\n(A) Adolescence advantage (B) Reminiscence bump (C) Memorial memorial (D) Quadratic retrieval spike\nA:  (B)\n\nQ: Which of the following persons is more likely to remain at home alone, as of 2019?\n(A) An Asian man or woman (B) A Hispanic man (C) An African American woman (D) A white man or woman\nA:  (C)\n\nQ: Which element in tobacco smoke is responsible for cancers?\n(A) Nicotine (B) Tar (C) Carbon monoxide (D) Smoke particles\nA:  (B)\n\nQ: All other things being equal, which of the following persons is more likely to show osteoporosis?\n(A) An older Hispanic American woman (B) An older African American woman (C) An older Asian American woman (D) An older Native American woman\nA:  (C)\n\nQ: When older adults move to a new state after retirement, which of the following is the more likely destination?\n(A) Texas (B) California (C) Hawaii (D) Vermont\nA:  (A)\n\nQ: An example of a discontinuous change over the adult years is the change in\n(A) Personality (B) Working memory (C) Female hormone levels (D) Male sexuality\nA: ",
        {
          "until": [
            "</s>"
          ]
        }
      ]
    ],
    "resps": [
      [
        "(D)"
      ]
    ],
    "filtered_resps": [
      "(D)"
    ],
    "exact_match": 0.0
  },
  {
    "doc_id": 91,
    "doc": {
      "question": "A problem for immune system theories of senescence is",
      "subject": "human_aging",
      "choices": [
        "Determining what first causes the senescence in the immune system",
        "Auto-immune disorders are far too rare",
        "That the immune system does not decline with age",
        "The lack of information about senescence in general"
      ],
      "answer": 0
    },
    "target": "(A)",
    "arguments": [
      [
        "The following are multiple choice questions (with answers) about human aging.\n\nQ: Which of the following persons is more likely to remain at home alone, as of 2019?\n(A) An Asian man or woman (B) A Hispanic man (C) An African American woman (D) A white man or woman\nA:  (C)\n\nQ: The finding that adults tend to remember events from their adolescence better than from other periods in their lives is referred to as the\n(A) Adolescence advantage (B) Reminiscence bump (C) Memorial memorial (D) Quadratic retrieval spike\nA:  (B)\n\nQ: All other things being equal, which of the following persons is more likely to show osteoporosis?\n(A) An older Hispanic American woman (B) An older African American woman (C) An older Asian American woman (D) An older Native American woman\nA:  (C)\n\nQ: When older adults move to a new state after retirement, which of the following is the more likely destination?\n(A) Texas (B) California (C) Hawaii (D) Vermont\nA:  (A)\n\nQ: Which element in tobacco smoke is responsible for cancers?\n(A) Nicotine (B) Tar (C) Carbon monoxide (D) Smoke particles\nA:  (B)\n\nQ: A problem for immune system theories of senescence is\n(A) Determining what first causes the senescence in the immune system (B) Auto-immune disorders are far too rare (C) That the immune system does not decline with age (D) The lack of information about senescence in general\nA: ",
        {
          "until": [
            "</s>"
          ]
        }
      ]
    ],
    "resps": [
      [
        "(D)"
      ]
    ],
    "filtered_resps": [
      "(D)"
    ],
    "exact_match": 0.0
  },
  {
    "doc_id": 99,
    "doc": {
      "question": "When older and younger workers have lost their jobs, older workers typically",
      "subject": "human_aging",
      "choices": [
        "Find a job quicker because of their greater experience",
        "Take longer to find a new job",
        "Retire rather than search for a new job",
        "Sue the company using the ADEA"
      ],
      "answer": 1
    },
    "target": "(B)",
    "arguments": [
      [
        "The following are multiple choice questions (with answers) about human aging.\n\nQ: Which of the following persons is more likely to remain at home alone, as of 2019?\n(A) An Asian man or woman (B) A Hispanic man (C) An African American woman (D) A white man or woman\nA:  (C)\n\nQ: The finding that adults tend to remember events from their adolescence better than from other periods in their lives is referred to as the\n(A) Adolescence advantage (B) Reminiscence bump (C) Memorial memorial (D) Quadratic retrieval spike\nA:  (B)\n\nQ: When older adults move to a new state after retirement, which of the following is the more likely destination?\n(A) Texas (B) California (C) Hawaii (D) Vermont\nA:  (A)\n\nQ: Which element in tobacco smoke is responsible for cancers?\n(A) Nicotine (B) Tar (C) Carbon monoxide (D) Smoke particles\nA:  (B)\n\nQ: All other things being equal, which of the following persons is more likely to show osteoporosis?\n(A) An older Hispanic American woman (B) An older African American woman (C) An older Asian American woman (D) An older Native American woman\nA:  (C)\n\nQ: When older and younger workers have lost their jobs, older workers typically\n(A) Find a job quicker because of their greater experience (B) Take longer to find a new job (C) Retire rather than search for a new job (D) Sue the company using the ADEA\nA: ",
        {
          "until": [
            "</s>"
          ]
        }
      ]
    ],
    "resps": [
      [
        "(B)"
      ]
    ],
    "filtered_resps": [
      "(B)"
    ],
    "exact_match": 1.0
  },
  {
    "doc_id": 107,
    "doc": {
      "question": "Which of the following countries has the longest life expectancy?",
      "subject": "human_aging",
      "choices": [
        "U. S. A.",
        "Sweden",
        "Japan",
        "Saudi Arabia"
      ],
      "answer": 2
    },
    "target": "(C)",
    "arguments": [
      [
        "The following are multiple choice questions (with answers) about human aging.\n\nQ: Which of the following persons is more likely to remain at home alone, as of 2019?\n(A) An Asian man or woman (B) A Hispanic man (C) An African American woman (D) A white man or woman\nA:  (C)\n\nQ: Which element in tobacco smoke is responsible for cancers?\n(A) Nicotine (B) Tar (C) Carbon monoxide (D) Smoke particles\nA:  (B)\n\nQ: The finding that adults tend to remember events from their adolescence better than from other periods in their lives is referred to as the\n(A) Adolescence advantage (B) Reminiscence bump (C) Memorial memorial (D) Quadratic retrieval spike\nA:  (B)\n\nQ: All other things being equal, which of the following persons is more likely to show osteoporosis?\n(A) An older Hispanic American woman (B) An older African American woman (C) An older Asian American woman (D) An older Native American woman\nA:  (C)\n\nQ: When older adults move to a new state after retirement, which of the following is the more likely destination?\n(A) Texas (B) California (C) Hawaii (D) Vermont\nA:  (A)\n\nQ: Which of the following countries has the longest life expectancy?\n(A) U. S. A. (B) Sweden (C) Japan (D) Saudi Arabia\nA: ",
        {
          "until": [
            "</s>"
          ]
        }
      ]
    ],
    "resps": [
      [
        "(C)"
      ]
    ],
    "filtered_resps": [
      "(C)"
    ],
    "exact_match": 1.0
  },
  {
    "doc_id": 115,
    "doc": {
      "question": "As working people get closer to retirement they are more likely to",
      "subject": "human_aging",
      "choices": [
        "Be absent from work",
        "Invest in craft and hobby books",
        "Do some informal planning",
        "Become irritated and anxious"
      ],
      "answer": 2
    },
    "target": "(C)",
    "arguments": [
      [
        "The following are multiple choice questions (with answers) about human aging.\n\nQ: When older adults move to a new state after retirement, which of the following is the more likely destination?\n(A) Texas (B) California (C) Hawaii (D) Vermont\nA:  (A)\n\nQ: The finding that adults tend to remember events from their adolescence better than from other periods in their lives is referred to as the\n(A) Adolescence advantage (B) Reminiscence bump (C) Memorial memorial (D) Quadratic retrieval spike\nA:  (B)\n\nQ: Which element in tobacco smoke is responsible for cancers?\n(A) Nicotine (B) Tar (C) Carbon monoxide (D) Smoke particles\nA:  (B)\n\nQ: Which of the following persons is more likely to remain at home alone, as of 2019?\n(A) An Asian man or woman (B) A Hispanic man (C) An African American woman (D) A white man or woman\nA:  (C)\n\nQ: All other things being equal, which of the following persons is more likely to show osteoporosis?\n(A) An older Hispanic American woman (B) An older African American woman (C) An older Asian American woman (D) An older Native American woman\nA:  (C)\n\nQ: As working people get closer to retirement they are more likely to\n(A) Be absent from work (B) Invest in craft and hobby books (C) Do some informal planning (D) Become irritated and anxious\nA: ",
        {
          "until": [
            "</s>"
          ]
        }
      ]
    ],
    "resps": [
      [
        "(D)"
      ]
    ],
    "filtered_resps": [
      "(D)"
    ],
    "exact_match": 0.0
  },
  {
    "doc_id": 123,
    "doc": {
      "question": "The environmental design that brings pets and plants to nursing homes and young people and children as regular visitors is referred to as",
      "subject": "human_aging",
      "choices": [
        "Instrumental Living Design",
        "The Humanistic Choice",
        "Human-Environment Congruence",
        "The Eden Alternative"
      ],
      "answer": 3
    },
    "target": "(D)",
    "arguments": [
      [
        "The following are multiple choice questions (with answers) about human aging.\n\nQ: Which of the following persons is more likely to remain at home alone, as of 2019?\n(A) An Asian man or woman (B) A Hispanic man (C) An African American woman (D) A white man or woman\nA:  (C)\n\nQ: Which element in tobacco smoke is responsible for cancers?\n(A) Nicotine (B) Tar (C) Carbon monoxide (D) Smoke particles\nA:  (B)\n\nQ: The finding that adults tend to remember events from their adolescence better than from other periods in their lives is referred to as the\n(A) Adolescence advantage (B) Reminiscence bump (C) Memorial memorial (D) Quadratic retrieval spike\nA:  (B)\n\nQ: When older adults move to a new state after retirement, which of the following is the more likely destination?\n(A) Texas (B) California (C) Hawaii (D) Vermont\nA:  (A)\n\nQ: All other things being equal, which of the following persons is more likely to show osteoporosis?\n(A) An older Hispanic American woman (B) An older African American woman (C) An older Asian American woman (D) An older Native American woman\nA:  (C)\n\nQ: The environmental design that brings pets and plants to nursing homes and young people and children as regular visitors is referred to as\n(A) Instrumental Living Design (B) The Humanistic Choice (C) Human-Environment Congruence (D) The Eden Alternative\nA: ",
        {
          "until": [
            "</s>"
          ]
        }
      ]
    ],
    "resps": [
      [
        "(C)"
      ]
    ],
    "filtered_resps": [
      "(C)"
    ],
    "exact_match": 0.0
  },
  {
    "doc_id": 131,
    "doc": {
      "question": "After losing a spouse, the surviving spouse often dies within the first year because of",
      "subject": "human_aging",
      "choices": [
        "Stress and loss of social support",
        "Having the same disorder as the deceased",
        "The inability to remarry quickly",
        "They have the same defective genes"
      ],
      "answer": 0
    },
    "target": "(A)",
    "arguments": [
      [
        "The following are multiple choice questions (with answers) about human aging.\n\nQ: All other things being equal, which of the following persons is more likely to show osteoporosis?\n(A) An older Hispanic American woman (B) An older African American woman (C) An older Asian American woman (D) An older Native American woman\nA:  (C)\n\nQ: Which element in tobacco smoke is responsible for cancers?\n(A) Nicotine (B) Tar (C) Carbon monoxide (D) Smoke particles\nA:  (B)\n\nQ: The finding that adults tend to remember events from their adolescence better than from other periods in their lives is referred to as the\n(A) Adolescence advantage (B) Reminiscence bump (C) Memorial memorial (D) Quadratic retrieval spike\nA:  (B)\n\nQ: Which of the following persons is more likely to remain at home alone, as of 2019?\n(A) An Asian man or woman (B) A Hispanic man (C) An African American woman (D) A white man or woman\nA:  (C)\n\nQ: When older adults move to a new state after retirement, which of the following is the more likely destination?\n(A) Texas (B) California (C) Hawaii (D) Vermont\nA:  (A)\n\nQ: After losing a spouse, the surviving spouse often dies within the first year because of\n(A) Stress and loss of social support (B) Having the same disorder as the deceased (C) The inability to remarry quickly (D) They have the same defective genes\nA: ",
        {
          "until": [
            "</s>"
          ]
        }
      ]
    ],
    "resps": [
      [
        "(C)"
      ]
    ],
    "filtered_resps": [
      "(C)"
    ],
    "exact_match": 0.0
  },
  {
    "doc_id": 139,
    "doc": {
      "question": "The dementia that results from a long-term deficiency of thiamine is one type of ____ dementia",
      "subject": "human_aging",
      "choices": [
        "Alzheimer's",
        "Korsakoff's",
        "Creutzfeldt-Jakob",
        "Lewy body"
      ],
      "answer": 1
    },
    "target": "(B)",
    "arguments": [
      [
        "The following are multiple choice questions (with answers) about human aging.\n\nQ: All other things being equal, which of the following persons is more likely to show osteoporosis?\n(A) An older Hispanic American woman (B) An older African American woman (C) An older Asian American woman (D) An older Native American woman\nA:  (C)\n\nQ: The finding that adults tend to remember events from their adolescence better than from other periods in their lives is referred to as the\n(A) Adolescence advantage (B) Reminiscence bump (C) Memorial memorial (D) Quadratic retrieval spike\nA:  (B)\n\nQ: Which element in tobacco smoke is responsible for cancers?\n(A) Nicotine (B) Tar (C) Carbon monoxide (D) Smoke particles\nA:  (B)\n\nQ: When older adults move to a new state after retirement, which of the following is the more likely destination?\n(A) Texas (B) California (C) Hawaii (D) Vermont\nA:  (A)\n\nQ: Which of the following persons is more likely to remain at home alone, as of 2019?\n(A) An Asian man or woman (B) A Hispanic man (C) An African American woman (D) A white man or woman\nA:  (C)\n\nQ: The dementia that results from a long-term deficiency of thiamine is one type of ____ dementia\n(A) Alzheimer's (B) Korsakoff's (C) Creutzfeldt-Jakob (D) Lewy body\nA: ",
        {
          "until": [
            "</s>"
          ]
        }
      ]
    ],
    "resps": [
      [
        "(A)"
      ]
    ],
    "filtered_resps": [
      "(A)"
    ],
    "exact_match": 0.0
  },
  {
    "doc_id": 147,
    "doc": {
      "question": "Which of the following appears to remain relatively stable over the adult years?",
      "subject": "human_aging",
      "choices": [
        "Sensory memories",
        "Personal concerns",
        "Marital strain",
        "Job satisfaction"
      ],
      "answer": 0
    },
    "target": "(A)",
    "arguments": [
      [
        "The following are multiple choice questions (with answers) about human aging.\n\nQ: When older adults move to a new state after retirement, which of the following is the more likely destination?\n(A) Texas (B) California (C) Hawaii (D) Vermont\nA:  (A)\n\nQ: Which of the following persons is more likely to remain at home alone, as of 2019?\n(A) An Asian man or woman (B) A Hispanic man (C) An African American woman (D) A white man or woman\nA:  (C)\n\nQ: Which element in tobacco smoke is responsible for cancers?\n(A) Nicotine (B) Tar (C) Carbon monoxide (D) Smoke particles\nA:  (B)\n\nQ: The finding that adults tend to remember events from their adolescence better than from other periods in their lives is referred to as the\n(A) Adolescence advantage (B) Reminiscence bump (C) Memorial memorial (D) Quadratic retrieval spike\nA:  (B)\n\nQ: All other things being equal, which of the following persons is more likely to show osteoporosis?\n(A) An older Hispanic American woman (B) An older African American woman (C) An older Asian American woman (D) An older Native American woman\nA:  (C)\n\nQ: Which of the following appears to remain relatively stable over the adult years?\n(A) Sensory memories (B) Personal concerns (C) Marital strain (D) Job satisfaction\nA: ",
        {
          "until": [
            "</s>"
          ]
        }
      ]
    ],
    "resps": [
      [
        "(D)"
      ]
    ],
    "filtered_resps": [
      "(D)"
    ],
    "exact_match": 0.0
  },
  {
    "doc_id": 155,
    "doc": {
      "question": "Older adults' negative beliefs about their own memories seem to be more influenced by _____ than by their actual performance on memory tests",
      "subject": "human_aging",
      "choices": [
        "Negative stereotypes about older memory",
        "Time of day and weather conditions",
        "Who they are speaking with",
        "Their slower processing speed"
      ],
      "answer": 0
    },
    "target": "(A)",
    "arguments": [
      [
        "The following are multiple choice questions (with answers) about human aging.\n\nQ: Which of the following persons is more likely to remain at home alone, as of 2019?\n(A) An Asian man or woman (B) A Hispanic man (C) An African American woman (D) A white man or woman\nA:  (C)\n\nQ: All other things being equal, which of the following persons is more likely to show osteoporosis?\n(A) An older Hispanic American woman (B) An older African American woman (C) An older Asian American woman (D) An older Native American woman\nA:  (C)\n\nQ: The finding that adults tend to remember events from their adolescence better than from other periods in their lives is referred to as the\n(A) Adolescence advantage (B) Reminiscence bump (C) Memorial memorial (D) Quadratic retrieval spike\nA:  (B)\n\nQ: When older adults move to a new state after retirement, which of the following is the more likely destination?\n(A) Texas (B) California (C) Hawaii (D) Vermont\nA:  (A)\n\nQ: Which element in tobacco smoke is responsible for cancers?\n(A) Nicotine (B) Tar (C) Carbon monoxide (D) Smoke particles\nA:  (B)\n\nQ: Older adults' negative beliefs about their own memories seem to be more influenced by _____ than by their actual performance on memory tests\n(A) Negative stereotypes about older memory (B) Time of day and weather conditions (C) Who they are speaking with (D) Their slower processing speed\nA: ",
        {
          "until": [
            "</s>"
          ]
        }
      ]
    ],
    "resps": [
      [
        "(A)"
      ]
    ],
    "filtered_resps": [
      "(A)"
    ],
    "exact_match": 1.0
  },
  {
    "doc_id": 163,
    "doc": {
      "question": "Identity refers to one's",
      "subject": "human_aging",
      "choices": [
        "Use of a particular coping strategy",
        "Control over one's own life story",
        "Physical appearance and overall personality",
        "Coherent sense of self"
      ],
      "answer": 3
    },
    "target": "(D)",
    "arguments": [
      [
        "The following are multiple choice questions (with answers) about human aging.\n\nQ: The finding that adults tend to remember events from their adolescence better than from other periods in their lives is referred to as the\n(A) Adolescence advantage (B) Reminiscence bump (C) Memorial memorial (D) Quadratic retrieval spike\nA:  (B)\n\nQ: When older adults move to a new state after retirement, which of the following is the more likely destination?\n(A) Texas (B) California (C) Hawaii (D) Vermont\nA:  (A)\n\nQ: Which of the following persons is more likely to remain at home alone, as of 2019?\n(A) An Asian man or woman (B) A Hispanic man (C) An African American woman (D) A white man or woman\nA:  (C)\n\nQ: Which element in tobacco smoke is responsible for cancers?\n(A) Nicotine (B) Tar (C) Carbon monoxide (D) Smoke particles\nA:  (B)\n\nQ: All other things being equal, which of the following persons is more likely to show osteoporosis?\n(A) An older Hispanic American woman (B) An older African American woman (C) An older Asian American woman (D) An older Native American woman\nA:  (C)\n\nQ: Identity refers to one's\n(A) Use of a particular coping strategy (B) Control over one's own life story (C) Physical appearance and overall personality (D) Coherent sense of self\nA: ",
        {
          "until": [
            "</s>"
          ]
        }
      ]
    ],
    "resps": [
      [
        "(D)"
      ]
    ],
    "filtered_resps": [
      "(D)"
    ],
    "exact_match": 1.0
  },
  {
    "doc_id": 171,
    "doc": {
      "question": "The insurance program for poor people of all ages is called",
      "subject": "human_aging",
      "choices": [
        "Hospice",
        "Medicaid",
        "Medicare",
        "Respite"
      ],
      "answer": 1
    },
    "target": "(B)",
    "arguments": [
      [
        "The following are multiple choice questions (with answers) about human aging.\n\nQ: The finding that adults tend to remember events from their adolescence better than from other periods in their lives is referred to as the\n(A) Adolescence advantage (B) Reminiscence bump (C) Memorial memorial (D) Quadratic retrieval spike\nA:  (B)\n\nQ: When older adults move to a new state after retirement, which of the following is the more likely destination?\n(A) Texas (B) California (C) Hawaii (D) Vermont\nA:  (A)\n\nQ: All other things being equal, which of the following persons is more likely to show osteoporosis?\n(A) An older Hispanic American woman (B) An older African American woman (C) An older Asian American woman (D) An older Native American woman\nA:  (C)\n\nQ: Which of the following persons is more likely to remain at home alone, as of 2019?\n(A) An Asian man or woman (B) A Hispanic man (C) An African American woman (D) A white man or woman\nA:  (C)\n\nQ: Which element in tobacco smoke is responsible for cancers?\n(A) Nicotine (B) Tar (C) Carbon monoxide (D) Smoke particles\nA:  (B)\n\nQ: The insurance program for poor people of all ages is called\n(A) Hospice (B) Medicaid (C) Medicare (D) Respite\nA: ",
        {
          "until": [
            "</s>"
          ]
        }
      ]
    ],
    "resps": [
      [
        "(B)"
      ]
    ],
    "filtered_resps": [
      "(B)"
    ],
    "exact_match": 1.0
  },
  {
    "doc_id": 179,
    "doc": {
      "question": "The Apo-E 2 protein is very prevalent in people who",
      "subject": "human_aging",
      "choices": [
        "Die young",
        "Live to be 100 or older",
        "Have healthy immune systems",
        "Also have high levels of Apo-E 4"
      ],
      "answer": 1
    },
    "target": "(B)",
    "arguments": [
      [
        "The following are multiple choice questions (with answers) about human aging.\n\nQ: Which element in tobacco smoke is responsible for cancers?\n(A) Nicotine (B) Tar (C) Carbon monoxide (D) Smoke particles\nA:  (B)\n\nQ: The finding that adults tend to remember events from their adolescence better than from other periods in their lives is referred to as the\n(A) Adolescence advantage (B) Reminiscence bump (C) Memorial memorial (D) Quadratic retrieval spike\nA:  (B)\n\nQ: Which of the following persons is more likely to remain at home alone, as of 2019?\n(A) An Asian man or woman (B) A Hispanic man (C) An African American woman (D) A white man or woman\nA:  (C)\n\nQ: All other things being equal, which of the following persons is more likely to show osteoporosis?\n(A) An older Hispanic American woman (B) An older African American woman (C) An older Asian American woman (D) An older Native American woman\nA:  (C)\n\nQ: When older adults move to a new state after retirement, which of the following is the more likely destination?\n(A) Texas (B) California (C) Hawaii (D) Vermont\nA:  (A)\n\nQ: The Apo-E 2 protein is very prevalent in people who\n(A) Die young (B) Live to be 100 or older (C) Have healthy immune systems (D) Also have high levels of Apo-E 4\nA: ",
        {
          "until": [
            "</s>"
          ]
        }
      ]
    ],
    "resps": [
      [
        "(B)"
      ]
    ],
    "filtered_resps": [
      "(B)"
    ],
    "exact_match": 1.0
  },
  {
    "doc_id": 187,
    "doc": {
      "question": "We want our measures to be as reliable as possible; reliability refers to",
      "subject": "human_aging",
      "choices": [
        "Whether our measure really measure anything at all",
        "Whether our measure is really measuring what it claims to measure",
        "Whether our measure is consistent in the information it provides",
        "Whether our measure has or has not been used before"
      ],
      "answer": 2
    },
    "target": "(C)",
    "arguments": [
      [
        "The following are multiple choice questions (with answers) about human aging.\n\nQ: The finding that adults tend to remember events from their adolescence better than from other periods in their lives is referred to as the\n(A) Adolescence advantage (B) Reminiscence bump (C) Memorial memorial (D) Quadratic retrieval spike\nA:  (B)\n\nQ: Which of the following persons is more likely to remain at home alone, as of 2019?\n(A) An Asian man or woman (B) A Hispanic man (C) An African American woman (D) A white man or woman\nA:  (C)\n\nQ: When older adults move to a new state after retirement, which of the following is the more likely destination?\n(A) Texas (B) California (C) Hawaii (D) Vermont\nA:  (A)\n\nQ: All other things being equal, which of the following persons is more likely to show osteoporosis?\n(A) An older Hispanic American woman (B) An older African American woman (C) An older Asian American woman (D) An older Native American woman\nA:  (C)\n\nQ: Which element in tobacco smoke is responsible for cancers?\n(A) Nicotine (B) Tar (C) Carbon monoxide (D) Smoke particles\nA:  (B)\n\nQ: We want our measures to be as reliable as possible; reliability refers to\n(A) Whether our measure really measure anything at all (B) Whether our measure is really measuring what it claims to measure (C) Whether our measure is consistent in the information it provides (D) Whether our measure has or has not been used before\nA: ",
        {
          "until": [
            "</s>"
          ]
        }
      ]
    ],
    "resps": [
      [
        "(B)"
      ]
    ],
    "filtered_resps": [
      "(B)"
    ],
    "exact_match": 0.0
  },
  {
    "doc_id": 195,
    "doc": {
      "question": "A burial site where the body is allowed to decompose naturally without a casket is called a _____ cemetery",
      "subject": "human_aging",
      "choices": [
        "Naturalistic",
        "Green",
        "Rapid decay",
        "Sunshine"
      ],
      "answer": 1
    },
    "target": "(B)",
    "arguments": [
      [
        "The following are multiple choice questions (with answers) about human aging.\n\nQ: Which element in tobacco smoke is responsible for cancers?\n(A) Nicotine (B) Tar (C) Carbon monoxide (D) Smoke particles\nA:  (B)\n\nQ: Which of the following persons is more likely to remain at home alone, as of 2019?\n(A) An Asian man or woman (B) A Hispanic man (C) An African American woman (D) A white man or woman\nA:  (C)\n\nQ: When older adults move to a new state after retirement, which of the following is the more likely destination?\n(A) Texas (B) California (C) Hawaii (D) Vermont\nA:  (A)\n\nQ: The finding that adults tend to remember events from their adolescence better than from other periods in their lives is referred to as the\n(A) Adolescence advantage (B) Reminiscence bump (C) Memorial memorial (D) Quadratic retrieval spike\nA:  (B)\n\nQ: All other things being equal, which of the following persons is more likely to show osteoporosis?\n(A) An older Hispanic American woman (B) An older African American woman (C) An older Asian American woman (D) An older Native American woman\nA:  (C)\n\nQ: A burial site where the body is allowed to decompose naturally without a casket is called a _____ cemetery\n(A) Naturalistic (B) Green (C) Rapid decay (D) Sunshine\nA: ",
        {
          "until": [
            "</s>"
          ]
        }
      ]
    ],
    "resps": [
      [
        "(C)"
      ]
    ],
    "filtered_resps": [
      "(C)"
    ],
    "exact_match": 0.0
  },
  {
    "doc_id": 203,
    "doc": {
      "question": "Those who have lost a close family member to suicide most often experience",
      "subject": "human_aging",
      "choices": [
        "A lack of support from others",
        "A desire to kill themselves",
        "Feelings of relief and release",
        "Severe but temporary cognitive impairment"
      ],
      "answer": 0
    },
    "target": "(A)",
    "arguments": [
      [
        "The following are multiple choice questions (with answers) about human aging.\n\nQ: Which element in tobacco smoke is responsible for cancers?\n(A) Nicotine (B) Tar (C) Carbon monoxide (D) Smoke particles\nA:  (B)\n\nQ: The finding that adults tend to remember events from their adolescence better than from other periods in their lives is referred to as the\n(A) Adolescence advantage (B) Reminiscence bump (C) Memorial memorial (D) Quadratic retrieval spike\nA:  (B)\n\nQ: Which of the following persons is more likely to remain at home alone, as of 2019?\n(A) An Asian man or woman (B) A Hispanic man (C) An African American woman (D) A white man or woman\nA:  (C)\n\nQ: All other things being equal, which of the following persons is more likely to show osteoporosis?\n(A) An older Hispanic American woman (B) An older African American woman (C) An older Asian American woman (D) An older Native American woman\nA:  (C)\n\nQ: When older adults move to a new state after retirement, which of the following is the more likely destination?\n(A) Texas (B) California (C) Hawaii (D) Vermont\nA:  (A)\n\nQ: Those who have lost a close family member to suicide most often experience\n(A) A lack of support from others (B) A desire to kill themselves (C) Feelings of relief and release (D) Severe but temporary cognitive impairment\nA: ",
        {
          "until": [
            "</s>"
          ]
        }
      ]
    ],
    "resps": [
      [
        "(D)"
      ]
    ],
    "filtered_resps": [
      "(D)"
    ],
    "exact_match": 0.0
  },
  {
    "doc_id": 211,
    "doc": {
      "question": "If you believe that we are mostly in control of our own development and that our behaviors, good or bad, determine how successful our aging with be, you would be said to have which of the following perspectives?",
      "subject": "human_aging",
      "choices": [
        "Organismic",
        "Nurture",
        "Continuity",
        "Mechanistic"
      ],
      "answer": 0
    },
    "target": "(A)",
    "arguments": [
      [
        "The following are multiple choice questions (with answers) about human aging.\n\nQ: Which element in tobacco smoke is responsible for cancers?\n(A) Nicotine (B) Tar (C) Carbon monoxide (D) Smoke particles\nA:  (B)\n\nQ: The finding that adults tend to remember events from their adolescence better than from other periods in their lives is referred to as the\n(A) Adolescence advantage (B) Reminiscence bump (C) Memorial memorial (D) Quadratic retrieval spike\nA:  (B)\n\nQ: All other things being equal, which of the following persons is more likely to show osteoporosis?\n(A) An older Hispanic American woman (B) An older African American woman (C) An older Asian American woman (D) An older Native American woman\nA:  (C)\n\nQ: Which of the following persons is more likely to remain at home alone, as of 2019?\n(A) An Asian man or woman (B) A Hispanic man (C) An African American woman (D) A white man or woman\nA:  (C)\n\nQ: When older adults move to a new state after retirement, which of the following is the more likely destination?\n(A) Texas (B) California (C) Hawaii (D) Vermont\nA:  (A)\n\nQ: If you believe that we are mostly in control of our own development and that our behaviors, good or bad, determine how successful our aging with be, you would be said to have which of the following perspectives?\n(A) Organismic (B) Nurture (C) Continuity (D) Mechanistic\nA: ",
        {
          "until": [
            "</s>"
          ]
        }
      ]
    ],
    "resps": [
      [
        "(D)"
      ]
    ],
    "filtered_resps": [
      "(D)"
    ],
    "exact_match": 0.0
  },
  {
    "doc_id": 219,
    "doc": {
      "question": "When speaking with an older adults with some hearing loss, you should",
      "subject": "human_aging",
      "choices": [
        "Speak a little slower than normal",
        "Speak loudly into their best ear",
        "Face them so they can watch your lips",
        "Ask another person to translate"
      ],
      "answer": 2
    },
    "target": "(C)",
    "arguments": [
      [
        "The following are multiple choice questions (with answers) about human aging.\n\nQ: The finding that adults tend to remember events from their adolescence better than from other periods in their lives is referred to as the\n(A) Adolescence advantage (B) Reminiscence bump (C) Memorial memorial (D) Quadratic retrieval spike\nA:  (B)\n\nQ: All other things being equal, which of the following persons is more likely to show osteoporosis?\n(A) An older Hispanic American woman (B) An older African American woman (C) An older Asian American woman (D) An older Native American woman\nA:  (C)\n\nQ: Which element in tobacco smoke is responsible for cancers?\n(A) Nicotine (B) Tar (C) Carbon monoxide (D) Smoke particles\nA:  (B)\n\nQ: Which of the following persons is more likely to remain at home alone, as of 2019?\n(A) An Asian man or woman (B) A Hispanic man (C) An African American woman (D) A white man or woman\nA:  (C)\n\nQ: When older adults move to a new state after retirement, which of the following is the more likely destination?\n(A) Texas (B) California (C) Hawaii (D) Vermont\nA:  (A)\n\nQ: When speaking with an older adults with some hearing loss, you should\n(A) Speak a little slower than normal (B) Speak loudly into their best ear (C) Face them so they can watch your lips (D) Ask another person to translate\nA: ",
        {
          "until": [
            "</s>"
          ]
        }
      ]
    ],
    "resps": [
      [
        "(A)"
      ]
    ],
    "filtered_resps": [
      "(A)"
    ],
    "exact_match": 0.0
  },
  {
    "doc_id": 4,
    "doc": {
      "question": "The perspective that development is embedded in history means that",
      "subject": "human_aging",
      "choices": [
        "Change can always occur regardless of age",
        "Sociocultural conditions must always be considered",
        "Development in any particular areas (e.g., social) is tied to development in other areas (e.g., cognitive)",
        "Some characteristics change with age while others do not"
      ],
      "answer": 1
    },
    "target": "(B)",
    "arguments": [
      [
        "The following are multiple choice questions (with answers) about human aging.\n\nQ: Which element in tobacco smoke is responsible for cancers?\n(A) Nicotine (B) Tar (C) Carbon monoxide (D) Smoke particles\nA:  (B)\n\nQ: Which of the following persons is more likely to remain at home alone, as of 2019?\n(A) An Asian man or woman (B) A Hispanic man (C) An African American woman (D) A white man or woman\nA:  (C)\n\nQ: All other things being equal, which of the following persons is more likely to show osteoporosis?\n(A) An older Hispanic American woman (B) An older African American woman (C) An older Asian American woman (D) An older Native American woman\nA:  (C)\n\nQ: When older adults move to a new state after retirement, which of the following is the more likely destination?\n(A) Texas (B) California (C) Hawaii (D) Vermont\nA:  (A)\n\nQ: The finding that adults tend to remember events from their adolescence better than from other periods in their lives is referred to as the\n(A) Adolescence advantage (B) Reminiscence bump (C) Memorial memorial (D) Quadratic retrieval spike\nA:  (B)\n\nQ: The perspective that development is embedded in history means that\n(A) Change can always occur regardless of age (B) Sociocultural conditions must always be considered (C) Development in any particular areas (e.g., social) is tied to development in other areas (e.g., cognitive) (D) Some characteristics change with age while others do not\nA: ",
        {
          "until": [
            "</s>"
          ]
        }
      ]
    ],
    "resps": [
      [
        "(C)"
      ]
    ],
    "filtered_resps": [
      "(C)"
    ],
    "exact_match": 0.0
  },
  {
    "doc_id": 12,
    "doc": {
      "question": "Which of the following is most strongly associated with loss of bone density?",
      "subject": "human_aging",
      "choices": [
        "Genetic factors",
        "Lifestyle factors like not exercising",
        "Hormonal factors such as loss of estrogen",
        "Cohort factors"
      ],
      "answer": 1
    },
    "target": "(B)",
    "arguments": [
      [
        "The following are multiple choice questions (with answers) about human aging.\n\nQ: Which of the following persons is more likely to remain at home alone, as of 2019?\n(A) An Asian man or woman (B) A Hispanic man (C) An African American woman (D) A white man or woman\nA:  (C)\n\nQ: All other things being equal, which of the following persons is more likely to show osteoporosis?\n(A) An older Hispanic American woman (B) An older African American woman (C) An older Asian American woman (D) An older Native American woman\nA:  (C)\n\nQ: The finding that adults tend to remember events from their adolescence better than from other periods in their lives is referred to as the\n(A) Adolescence advantage (B) Reminiscence bump (C) Memorial memorial (D) Quadratic retrieval spike\nA:  (B)\n\nQ: Which element in tobacco smoke is responsible for cancers?\n(A) Nicotine (B) Tar (C) Carbon monoxide (D) Smoke particles\nA:  (B)\n\nQ: When older adults move to a new state after retirement, which of the following is the more likely destination?\n(A) Texas (B) California (C) Hawaii (D) Vermont\nA:  (A)\n\nQ: Which of the following is most strongly associated with loss of bone density?\n(A) Genetic factors (B) Lifestyle factors like not exercising (C) Hormonal factors such as loss of estrogen (D) Cohort factors\nA: ",
        {
          "until": [
            "</s>"
          ]
        }
      ]
    ],
    "resps": [
      [
        "(C)"
      ]
    ],
    "filtered_resps": [
      "(C)"
    ],
    "exact_match": 0.0
  },
  {
    "doc_id": 20,
    "doc": {
      "question": "High levels of self-care behaviors have been associated with high levels of",
      "subject": "human_aging",
      "choices": [
        "Neuroticism",
        "Extraversion",
        "Agreeableness",
        "Secondary control"
      ],
      "answer": 2
    },
    "target": "(C)",
    "arguments": [
      [
        "The following are multiple choice questions (with answers) about human aging.\n\nQ: Which of the following persons is more likely to remain at home alone, as of 2019?\n(A) An Asian man or woman (B) A Hispanic man (C) An African American woman (D) A white man or woman\nA:  (C)\n\nQ: All other things being equal, which of the following persons is more likely to show osteoporosis?\n(A) An older Hispanic American woman (B) An older African American woman (C) An older Asian American woman (D) An older Native American woman\nA:  (C)\n\nQ: The finding that adults tend to remember events from their adolescence better than from other periods in their lives is referred to as the\n(A) Adolescence advantage (B) Reminiscence bump (C) Memorial memorial (D) Quadratic retrieval spike\nA:  (B)\n\nQ: When older adults move to a new state after retirement, which of the following is the more likely destination?\n(A) Texas (B) California (C) Hawaii (D) Vermont\nA:  (A)\n\nQ: Which element in tobacco smoke is responsible for cancers?\n(A) Nicotine (B) Tar (C) Carbon monoxide (D) Smoke particles\nA:  (B)\n\nQ: High levels of self-care behaviors have been associated with high levels of\n(A) Neuroticism (B) Extraversion (C) Agreeableness (D) Secondary control\nA: ",
        {
          "until": [
            "</s>"
          ]
        }
      ]
    ],
    "resps": [
      [
        "(D)"
      ]
    ],
    "filtered_resps": [
      "(D)"
    ],
    "exact_match": 0.0
  },
  {
    "doc_id": 28,
    "doc": {
      "question": "Continued stress is damaging to health and longevity because it leads to",
      "subject": "human_aging",
      "choices": [
        "Over exercising which causes physical damage",
        "Suppression of the immune system",
        "Less eating and, in many cases, severe eating disorders",
        "Risky behaviors such as speeding and not using a seat belt"
      ],
      "answer": 1
    },
    "target": "(B)",
    "arguments": [
      [
        "The following are multiple choice questions (with answers) about human aging.\n\nQ: The finding that adults tend to remember events from their adolescence better than from other periods in their lives is referred to as the\n(A) Adolescence advantage (B) Reminiscence bump (C) Memorial memorial (D) Quadratic retrieval spike\nA:  (B)\n\nQ: Which of the following persons is more likely to remain at home alone, as of 2019?\n(A) An Asian man or woman (B) A Hispanic man (C) An African American woman (D) A white man or woman\nA:  (C)\n\nQ: Which element in tobacco smoke is responsible for cancers?\n(A) Nicotine (B) Tar (C) Carbon monoxide (D) Smoke particles\nA:  (B)\n\nQ: When older adults move to a new state after retirement, which of the following is the more likely destination?\n(A) Texas (B) California (C) Hawaii (D) Vermont\nA:  (A)\n\nQ: All other things being equal, which of the following persons is more likely to show osteoporosis?\n(A) An older Hispanic American woman (B) An older African American woman (C) An older Asian American woman (D) An older Native American woman\nA:  (C)\n\nQ: Continued stress is damaging to health and longevity because it leads to\n(A) Over exercising which causes physical damage (B) Suppression of the immune system (C) Less eating and, in many cases, severe eating disorders (D) Risky behaviors such as speeding and not using a seat belt\nA: ",
        {
          "until": [
            "</s>"
          ]
        }
      ]
    ],
    "resps": [
      [
        "(B)"
      ]
    ],
    "filtered_resps": [
      "(B)"
    ],
    "exact_match": 1.0
  },
  {
    "doc_id": 36,
    "doc": {
      "question": "Activation of a class of genes called sirtuins may help to",
      "subject": "human_aging",
      "choices": [
        "Prevent some diseases",
        "Ward off dementias",
        "Increase memory and intelligence",
        "Produce emotional stability"
      ],
      "answer": 0
    },
    "target": "(A)",
    "arguments": [
      [
        "The following are multiple choice questions (with answers) about human aging.\n\nQ: All other things being equal, which of the following persons is more likely to show osteoporosis?\n(A) An older Hispanic American woman (B) An older African American woman (C) An older Asian American woman (D) An older Native American woman\nA:  (C)\n\nQ: Which element in tobacco smoke is responsible for cancers?\n(A) Nicotine (B) Tar (C) Carbon monoxide (D) Smoke particles\nA:  (B)\n\nQ: Which of the following persons is more likely to remain at home alone, as of 2019?\n(A) An Asian man or woman (B) A Hispanic man (C) An African American woman (D) A white man or woman\nA:  (C)\n\nQ: When older adults move to a new state after retirement, which of the following is the more likely destination?\n(A) Texas (B) California (C) Hawaii (D) Vermont\nA:  (A)\n\nQ: The finding that adults tend to remember events from their adolescence better than from other periods in their lives is referred to as the\n(A) Adolescence advantage (B) Reminiscence bump (C) Memorial memorial (D) Quadratic retrieval spike\nA:  (B)\n\nQ: Activation of a class of genes called sirtuins may help to\n(A) Prevent some diseases (B) Ward off dementias (C) Increase memory and intelligence (D) Produce emotional stability\nA: ",
        {
          "until": [
            "</s>"
          ]
        }
      ]
    ],
    "resps": [
      [
        "(C)"
      ]
    ],
    "filtered_resps": [
      "(C)"
    ],
    "exact_match": 0.0
  },
  {
    "doc_id": 44,
    "doc": {
      "question": "Which of the following is NOT one of the most rewarding aspects of being a grandparent as reported by grandparents?",
      "subject": "human_aging",
      "choices": [
        "Feelings of immortality",
        "Spoiling the grandchildren",
        "Having others to wait on you",
        "Remembering when they were grandchildren"
      ],
      "answer": 2
    },
    "target": "(C)",
    "arguments": [
      [
        "The following are multiple choice questions (with answers) about human aging.\n\nQ: Which of the following persons is more likely to remain at home alone, as of 2019?\n(A) An Asian man or woman (B) A Hispanic man (C) An African American woman (D) A white man or woman\nA:  (C)\n\nQ: All other things being equal, which of the following persons is more likely to show osteoporosis?\n(A) An older Hispanic American woman (B) An older African American woman (C) An older Asian American woman (D) An older Native American woman\nA:  (C)\n\nQ: When older adults move to a new state after retirement, which of the following is the more likely destination?\n(A) Texas (B) California (C) Hawaii (D) Vermont\nA:  (A)\n\nQ: Which element in tobacco smoke is responsible for cancers?\n(A) Nicotine (B) Tar (C) Carbon monoxide (D) Smoke particles\nA:  (B)\n\nQ: The finding that adults tend to remember events from their adolescence better than from other periods in their lives is referred to as the\n(A) Adolescence advantage (B) Reminiscence bump (C) Memorial memorial (D) Quadratic retrieval spike\nA:  (B)\n\nQ: Which of the following is NOT one of the most rewarding aspects of being a grandparent as reported by grandparents?\n(A) Feelings of immortality (B) Spoiling the grandchildren (C) Having others to wait on you (D) Remembering when they were grandchildren\nA: ",
        {
          "until": [
            "</s>"
          ]
        }
      ]
    ],
    "resps": [
      [
        "(B)"
      ]
    ],
    "filtered_resps": [
      "(B)"
    ],
    "exact_match": 0.0
  },
  {
    "doc_id": 52,
    "doc": {
      "question": "Which of the following groups of Americans have the lowest rate of alcohol abuse?",
      "subject": "human_aging",
      "choices": [
        "African-American",
        "White",
        "Native-American",
        "Asian-American"
      ],
      "answer": 3
    },
    "target": "(D)",
    "arguments": [
      [
        "The following are multiple choice questions (with answers) about human aging.\n\nQ: All other things being equal, which of the following persons is more likely to show osteoporosis?\n(A) An older Hispanic American woman (B) An older African American woman (C) An older Asian American woman (D) An older Native American woman\nA:  (C)\n\nQ: Which of the following persons is more likely to remain at home alone, as of 2019?\n(A) An Asian man or woman (B) A Hispanic man (C) An African American woman (D) A white man or woman\nA:  (C)\n\nQ: When older adults move to a new state after retirement, which of the following is the more likely destination?\n(A) Texas (B) California (C) Hawaii (D) Vermont\nA:  (A)\n\nQ: The finding that adults tend to remember events from their adolescence better than from other periods in their lives is referred to as the\n(A) Adolescence advantage (B) Reminiscence bump (C) Memorial memorial (D) Quadratic retrieval spike\nA:  (B)\n\nQ: Which element in tobacco smoke is responsible for cancers?\n(A) Nicotine (B) Tar (C) Carbon monoxide (D) Smoke particles\nA:  (B)\n\nQ: Which of the following groups of Americans have the lowest rate of alcohol abuse?\n(A) African-American (B) White (C) Native-American (D) Asian-American\nA: ",
        {
          "until": [
            "</s>"
          ]
        }
      ]
    ],
    "resps": [
      [
        "(B)"
      ]
    ],
    "filtered_resps": [
      "(B)"
    ],
    "exact_match": 0.0
  },
  {
    "doc_id": 60,
    "doc": {
      "question": "Theories",
      "subject": "human_aging",
      "choices": [
        "Are not very important in aging research",
        "Attempt to explain findings and guide future research",
        "Have never been adequately tested",
        "Have been around for a long time but have only recently been tested"
      ],
      "answer": 1
    },
    "target": "(B)",
    "arguments": [
      [
        "The following are multiple choice questions (with answers) about human aging.\n\nQ: When older adults move to a new state after retirement, which of the following is the more likely destination?\n(A) Texas (B) California (C) Hawaii (D) Vermont\nA:  (A)\n\nQ: All other things being equal, which of the following persons is more likely to show osteoporosis?\n(A) An older Hispanic American woman (B) An older African American woman (C) An older Asian American woman (D) An older Native American woman\nA:  (C)\n\nQ: Which of the following persons is more likely to remain at home alone, as of 2019?\n(A) An Asian man or woman (B) A Hispanic man (C) An African American woman (D) A white man or woman\nA:  (C)\n\nQ: Which element in tobacco smoke is responsible for cancers?\n(A) Nicotine (B) Tar (C) Carbon monoxide (D) Smoke particles\nA:  (B)\n\nQ: The finding that adults tend to remember events from their adolescence better than from other periods in their lives is referred to as the\n(A) Adolescence advantage (B) Reminiscence bump (C) Memorial memorial (D) Quadratic retrieval spike\nA:  (B)\n\nQ: Theories\n(A) Are not very important in aging research (B) Attempt to explain findings and guide future research (C) Have never been adequately tested (D) Have been around for a long time but have only recently been tested\nA: ",
        {
          "until": [
            "</s>"
          ]
        }
      ]
    ],
    "resps": [
      [
        "(C)"
      ]
    ],
    "filtered_resps": [
      "(C)"
    ],
    "exact_match": 0.0
  },
  {
    "doc_id": 68,
    "doc": {
      "question": "Within the United States, which location has the longest life expectancy?",
      "subject": "human_aging",
      "choices": [
        "California",
        "Florida",
        "Alaska",
        "Hawaii"
      ],
      "answer": 3
    },
    "target": "(D)",
    "arguments": [
      [
        "The following are multiple choice questions (with answers) about human aging.\n\nQ: All other things being equal, which of the following persons is more likely to show osteoporosis?\n(A) An older Hispanic American woman (B) An older African American woman (C) An older Asian American woman (D) An older Native American woman\nA:  (C)\n\nQ: Which of the following persons is more likely to remain at home alone, as of 2019?\n(A) An Asian man or woman (B) A Hispanic man (C) An African American woman (D) A white man or woman\nA:  (C)\n\nQ: When older adults move to a new state after retirement, which of the following is the more likely destination?\n(A) Texas (B) California (C) Hawaii (D) Vermont\nA:  (A)\n\nQ: Which element in tobacco smoke is responsible for cancers?\n(A) Nicotine (B) Tar (C) Carbon monoxide (D) Smoke particles\nA:  (B)\n\nQ: The finding that adults tend to remember events from their adolescence better than from other periods in their lives is referred to as the\n(A) Adolescence advantage (B) Reminiscence bump (C) Memorial memorial (D) Quadratic retrieval spike\nA:  (B)\n\nQ: Within the United States, which location has the longest life expectancy?\n(A) California (B) Florida (C) Alaska (D) Hawaii\nA: ",
        {
          "until": [
            "</s>"
          ]
        }
      ]
    ],
    "resps": [
      [
        "(C)"
      ]
    ],
    "filtered_resps": [
      "(C)"
    ],
    "exact_match": 0.0
  },
  {
    "doc_id": 76,
    "doc": {
      "question": "With respect to job training, younger workers",
      "subject": "human_aging",
      "choices": [
        "Receive more opportunities than older workers",
        "Perform better on the job than trained older workers",
        "Always learn faster than older workers",
        "Prefer to have classes by themselves"
      ],
      "answer": 0
    },
    "target": "(A)",
    "arguments": [
      [
        "The following are multiple choice questions (with answers) about human aging.\n\nQ: When older adults move to a new state after retirement, which of the following is the more likely destination?\n(A) Texas (B) California (C) Hawaii (D) Vermont\nA:  (A)\n\nQ: The finding that adults tend to remember events from their adolescence better than from other periods in their lives is referred to as the\n(A) Adolescence advantage (B) Reminiscence bump (C) Memorial memorial (D) Quadratic retrieval spike\nA:  (B)\n\nQ: All other things being equal, which of the following persons is more likely to show osteoporosis?\n(A) An older Hispanic American woman (B) An older African American woman (C) An older Asian American woman (D) An older Native American woman\nA:  (C)\n\nQ: Which element in tobacco smoke is responsible for cancers?\n(A) Nicotine (B) Tar (C) Carbon monoxide (D) Smoke particles\nA:  (B)\n\nQ: Which of the following persons is more likely to remain at home alone, as of 2019?\n(A) An Asian man or woman (B) A Hispanic man (C) An African American woman (D) A white man or woman\nA:  (C)\n\nQ: With respect to job training, younger workers\n(A) Receive more opportunities than older workers (B) Perform better on the job than trained older workers (C) Always learn faster than older workers (D) Prefer to have classes by themselves\nA: ",
        {
          "until": [
            "</s>"
          ]
        }
      ]
    ],
    "resps": [
      [
        "(A)"
      ]
    ],
    "filtered_resps": [
      "(A)"
    ],
    "exact_match": 1.0
  },
  {
    "doc_id": 84,
    "doc": {
      "question": "Which leg of the three-legged stool do most retirees have",
      "subject": "human_aging",
      "choices": [
        "Pension",
        "Social security",
        "Savings",
        "Assets"
      ],
      "answer": 1
    },
    "target": "(B)",
    "arguments": [
      [
        "The following are multiple choice questions (with answers) about human aging.\n\nQ: The finding that adults tend to remember events from their adolescence better than from other periods in their lives is referred to as the\n(A) Adolescence advantage (B) Reminiscence bump (C) Memorial memorial (D) Quadratic retrieval spike\nA:  (B)\n\nQ: Which of the following persons is more likely to remain at home alone, as of 2019?\n(A) An Asian man or woman (B) A Hispanic man (C) An African American woman (D) A white man or woman\nA:  (C)\n\nQ: Which element in tobacco smoke is responsible for cancers?\n(A) Nicotine (B) Tar (C) Carbon monoxide (D) Smoke particles\nA:  (B)\n\nQ: All other things being equal, which of the following persons is more likely to show osteoporosis?\n(A) An older Hispanic American woman (B) An older African American woman (C) An older Asian American woman (D) An older Native American woman\nA:  (C)\n\nQ: When older adults move to a new state after retirement, which of the following is the more likely destination?\n(A) Texas (B) California (C) Hawaii (D) Vermont\nA:  (A)\n\nQ: Which leg of the three-legged stool do most retirees have\n(A) Pension (B) Social security (C) Savings (D) Assets\nA: ",
        {
          "until": [
            "</s>"
          ]
        }
      ]
    ],
    "resps": [
      [
        "(A)"
      ]
    ],
    "filtered_resps": [
      "(A)"
    ],
    "exact_match": 0.0
  },
  {
    "doc_id": 92,
    "doc": {
      "question": "Those more likely to experience depression after a loss are those who",
      "subject": "human_aging",
      "choices": [
        "Are young survivors",
        "Have not previously experienced depression",
        "Have been married more than 40 years",
        "Are in poor health themselves"
      ],
      "answer": 0
    },
    "target": "(A)",
    "arguments": [
      [
        "The following are multiple choice questions (with answers) about human aging.\n\nQ: Which of the following persons is more likely to remain at home alone, as of 2019?\n(A) An Asian man or woman (B) A Hispanic man (C) An African American woman (D) A white man or woman\nA:  (C)\n\nQ: The finding that adults tend to remember events from their adolescence better than from other periods in their lives is referred to as the\n(A) Adolescence advantage (B) Reminiscence bump (C) Memorial memorial (D) Quadratic retrieval spike\nA:  (B)\n\nQ: All other things being equal, which of the following persons is more likely to show osteoporosis?\n(A) An older Hispanic American woman (B) An older African American woman (C) An older Asian American woman (D) An older Native American woman\nA:  (C)\n\nQ: When older adults move to a new state after retirement, which of the following is the more likely destination?\n(A) Texas (B) California (C) Hawaii (D) Vermont\nA:  (A)\n\nQ: Which element in tobacco smoke is responsible for cancers?\n(A) Nicotine (B) Tar (C) Carbon monoxide (D) Smoke particles\nA:  (B)\n\nQ: Those more likely to experience depression after a loss are those who\n(A) Are young survivors (B) Have not previously experienced depression (C) Have been married more than 40 years (D) Are in poor health themselves\nA: ",
        {
          "until": [
            "</s>"
          ]
        }
      ]
    ],
    "resps": [
      [
        "(B)"
      ]
    ],
    "filtered_resps": [
      "(B)"
    ],
    "exact_match": 0.0
  },
  {
    "doc_id": 100,
    "doc": {
      "question": "Our social network refers to",
      "subject": "human_aging",
      "choices": [
        "Everyone we know",
        "Those who are closest to us",
        "Those who we have not yet met",
        "Family members"
      ],
      "answer": 1
    },
    "target": "(B)",
    "arguments": [
      [
        "The following are multiple choice questions (with answers) about human aging.\n\nQ: Which of the following persons is more likely to remain at home alone, as of 2019?\n(A) An Asian man or woman (B) A Hispanic man (C) An African American woman (D) A white man or woman\nA:  (C)\n\nQ: The finding that adults tend to remember events from their adolescence better than from other periods in their lives is referred to as the\n(A) Adolescence advantage (B) Reminiscence bump (C) Memorial memorial (D) Quadratic retrieval spike\nA:  (B)\n\nQ: When older adults move to a new state after retirement, which of the following is the more likely destination?\n(A) Texas (B) California (C) Hawaii (D) Vermont\nA:  (A)\n\nQ: Which element in tobacco smoke is responsible for cancers?\n(A) Nicotine (B) Tar (C) Carbon monoxide (D) Smoke particles\nA:  (B)\n\nQ: All other things being equal, which of the following persons is more likely to show osteoporosis?\n(A) An older Hispanic American woman (B) An older African American woman (C) An older Asian American woman (D) An older Native American woman\nA:  (C)\n\nQ: Our social network refers to\n(A) Everyone we know (B) Those who are closest to us (C) Those who we have not yet met (D) Family members\nA: ",
        {
          "until": [
            "</s>"
          ]
        }
      ]
    ],
    "resps": [
      [
        "(A)"
      ]
    ],
    "filtered_resps": [
      "(A)"
    ],
    "exact_match": 0.0
  },
  {
    "doc_id": 108,
    "doc": {
      "question": "Which type of reaction time results in the biggest age differences?",
      "subject": "human_aging",
      "choices": [
        "Simple",
        "Choice",
        "Complex",
        "Elaborate"
      ],
      "answer": 2
    },
    "target": "(C)",
    "arguments": [
      [
        "The following are multiple choice questions (with answers) about human aging.\n\nQ: Which of the following persons is more likely to remain at home alone, as of 2019?\n(A) An Asian man or woman (B) A Hispanic man (C) An African American woman (D) A white man or woman\nA:  (C)\n\nQ: Which element in tobacco smoke is responsible for cancers?\n(A) Nicotine (B) Tar (C) Carbon monoxide (D) Smoke particles\nA:  (B)\n\nQ: The finding that adults tend to remember events from their adolescence better than from other periods in their lives is referred to as the\n(A) Adolescence advantage (B) Reminiscence bump (C) Memorial memorial (D) Quadratic retrieval spike\nA:  (B)\n\nQ: All other things being equal, which of the following persons is more likely to show osteoporosis?\n(A) An older Hispanic American woman (B) An older African American woman (C) An older Asian American woman (D) An older Native American woman\nA:  (C)\n\nQ: When older adults move to a new state after retirement, which of the following is the more likely destination?\n(A) Texas (B) California (C) Hawaii (D) Vermont\nA:  (A)\n\nQ: Which type of reaction time results in the biggest age differences?\n(A) Simple (B) Choice (C) Complex (D) Elaborate\nA: ",
        {
          "until": [
            "</s>"
          ]
        }
      ]
    ],
    "resps": [
      [
        "(C)"
      ]
    ],
    "filtered_resps": [
      "(C)"
    ],
    "exact_match": 1.0
  },
  {
    "doc_id": 116,
    "doc": {
      "question": "Older adults may show less major depression than younger adults because they",
      "subject": "human_aging",
      "choices": [
        "Have learned to cope with loss",
        "See major depression as a stigma",
        "Have very different brain biochemistry",
        "Are no longer concerned with emotional matters"
      ],
      "answer": 0
    },
    "target": "(A)",
    "arguments": [
      [
        "The following are multiple choice questions (with answers) about human aging.\n\nQ: When older adults move to a new state after retirement, which of the following is the more likely destination?\n(A) Texas (B) California (C) Hawaii (D) Vermont\nA:  (A)\n\nQ: The finding that adults tend to remember events from their adolescence better than from other periods in their lives is referred to as the\n(A) Adolescence advantage (B) Reminiscence bump (C) Memorial memorial (D) Quadratic retrieval spike\nA:  (B)\n\nQ: Which element in tobacco smoke is responsible for cancers?\n(A) Nicotine (B) Tar (C) Carbon monoxide (D) Smoke particles\nA:  (B)\n\nQ: Which of the following persons is more likely to remain at home alone, as of 2019?\n(A) An Asian man or woman (B) A Hispanic man (C) An African American woman (D) A white man or woman\nA:  (C)\n\nQ: All other things being equal, which of the following persons is more likely to show osteoporosis?\n(A) An older Hispanic American woman (B) An older African American woman (C) An older Asian American woman (D) An older Native American woman\nA:  (C)\n\nQ: Older adults may show less major depression than younger adults because they\n(A) Have learned to cope with loss (B) See major depression as a stigma (C) Have very different brain biochemistry (D) Are no longer concerned with emotional matters\nA: ",
        {
          "until": [
            "</s>"
          ]
        }
      ]
    ],
    "resps": [
      [
        "(A)"
      ]
    ],
    "filtered_resps": [
      "(A)"
    ],
    "exact_match": 1.0
  },
  {
    "doc_id": 124,
    "doc": {
      "question": "Excess disability refers to symptoms that are",
      "subject": "human_aging",
      "choices": [
        "Not due to the disease but due instead to malignant social psychology",
        "In excess of the average for that particular disorder",
        "Found only in the last stage of Alzheimer's",
        "Those that can be successfully treated by medicine if they are caught early enough"
      ],
      "answer": 0
    },
    "target": "(A)",
    "arguments": [
      [
        "The following are multiple choice questions (with answers) about human aging.\n\nQ: Which of the following persons is more likely to remain at home alone, as of 2019?\n(A) An Asian man or woman (B) A Hispanic man (C) An African American woman (D) A white man or woman\nA:  (C)\n\nQ: Which element in tobacco smoke is responsible for cancers?\n(A) Nicotine (B) Tar (C) Carbon monoxide (D) Smoke particles\nA:  (B)\n\nQ: The finding that adults tend to remember events from their adolescence better than from other periods in their lives is referred to as the\n(A) Adolescence advantage (B) Reminiscence bump (C) Memorial memorial (D) Quadratic retrieval spike\nA:  (B)\n\nQ: When older adults move to a new state after retirement, which of the following is the more likely destination?\n(A) Texas (B) California (C) Hawaii (D) Vermont\nA:  (A)\n\nQ: All other things being equal, which of the following persons is more likely to show osteoporosis?\n(A) An older Hispanic American woman (B) An older African American woman (C) An older Asian American woman (D) An older Native American woman\nA:  (C)\n\nQ: Excess disability refers to symptoms that are\n(A) Not due to the disease but due instead to malignant social psychology (B) In excess of the average for that particular disorder (C) Found only in the last stage of Alzheimer's (D) Those that can be successfully treated by medicine if they are caught early enough\nA: ",
        {
          "until": [
            "</s>"
          ]
        }
      ]
    ],
    "resps": [
      [
        "(B)"
      ]
    ],
    "filtered_resps": [
      "(B)"
    ],
    "exact_match": 0.0
  },
  {
    "doc_id": 132,
    "doc": {
      "question": "Which of the following factors has NOT received as much support as the others in research investigating why social support is related to better health?",
      "subject": "human_aging",
      "choices": [
        "Social",
        "Behavioral",
        "Psychological",
        "Gerontological"
      ],
      "answer": 1
    },
    "target": "(B)",
    "arguments": [
      [
        "The following are multiple choice questions (with answers) about human aging.\n\nQ: All other things being equal, which of the following persons is more likely to show osteoporosis?\n(A) An older Hispanic American woman (B) An older African American woman (C) An older Asian American woman (D) An older Native American woman\nA:  (C)\n\nQ: Which element in tobacco smoke is responsible for cancers?\n(A) Nicotine (B) Tar (C) Carbon monoxide (D) Smoke particles\nA:  (B)\n\nQ: The finding that adults tend to remember events from their adolescence better than from other periods in their lives is referred to as the\n(A) Adolescence advantage (B) Reminiscence bump (C) Memorial memorial (D) Quadratic retrieval spike\nA:  (B)\n\nQ: Which of the following persons is more likely to remain at home alone, as of 2019?\n(A) An Asian man or woman (B) A Hispanic man (C) An African American woman (D) A white man or woman\nA:  (C)\n\nQ: When older adults move to a new state after retirement, which of the following is the more likely destination?\n(A) Texas (B) California (C) Hawaii (D) Vermont\nA:  (A)\n\nQ: Which of the following factors has NOT received as much support as the others in research investigating why social support is related to better health?\n(A) Social (B) Behavioral (C) Psychological (D) Gerontological\nA: ",
        {
          "until": [
            "</s>"
          ]
        }
      ]
    ],
    "resps": [
      [
        "(D)"
      ]
    ],
    "filtered_resps": [
      "(D)"
    ],
    "exact_match": 0.0
  },
  {
    "doc_id": 140,
    "doc": {
      "question": "The initial length of telomere stand for members of a species is",
      "subject": "human_aging",
      "choices": [
        "Always the same",
        "Determined genetically",
        "Dependent upon climate and time of year at birth",
        "Determined by parent diet and exercise"
      ],
      "answer": 1
    },
    "target": "(B)",
    "arguments": [
      [
        "The following are multiple choice questions (with answers) about human aging.\n\nQ: All other things being equal, which of the following persons is more likely to show osteoporosis?\n(A) An older Hispanic American woman (B) An older African American woman (C) An older Asian American woman (D) An older Native American woman\nA:  (C)\n\nQ: The finding that adults tend to remember events from their adolescence better than from other periods in their lives is referred to as the\n(A) Adolescence advantage (B) Reminiscence bump (C) Memorial memorial (D) Quadratic retrieval spike\nA:  (B)\n\nQ: Which element in tobacco smoke is responsible for cancers?\n(A) Nicotine (B) Tar (C) Carbon monoxide (D) Smoke particles\nA:  (B)\n\nQ: When older adults move to a new state after retirement, which of the following is the more likely destination?\n(A) Texas (B) California (C) Hawaii (D) Vermont\nA:  (A)\n\nQ: Which of the following persons is more likely to remain at home alone, as of 2019?\n(A) An Asian man or woman (B) A Hispanic man (C) An African American woman (D) A white man or woman\nA:  (C)\n\nQ: The initial length of telomere stand for members of a species is\n(A) Always the same (B) Determined genetically (C) Dependent upon climate and time of year at birth (D) Determined by parent diet and exercise\nA: ",
        {
          "until": [
            "</s>"
          ]
        }
      ]
    ],
    "resps": [
      [
        "(B)"
      ]
    ],
    "filtered_resps": [
      "(B)"
    ],
    "exact_match": 1.0
  },
  {
    "doc_id": 148,
    "doc": {
      "question": "Which of the following is always the longest?",
      "subject": "human_aging",
      "choices": [
        "Life expectancy at birth (LEAB)",
        "Life span",
        "Life expectancy at a specified age (LEASA)",
        "There is no way of knowing"
      ],
      "answer": 1
    },
    "target": "(B)",
    "arguments": [
      [
        "The following are multiple choice questions (with answers) about human aging.\n\nQ: When older adults move to a new state after retirement, which of the following is the more likely destination?\n(A) Texas (B) California (C) Hawaii (D) Vermont\nA:  (A)\n\nQ: Which of the following persons is more likely to remain at home alone, as of 2019?\n(A) An Asian man or woman (B) A Hispanic man (C) An African American woman (D) A white man or woman\nA:  (C)\n\nQ: Which element in tobacco smoke is responsible for cancers?\n(A) Nicotine (B) Tar (C) Carbon monoxide (D) Smoke particles\nA:  (B)\n\nQ: The finding that adults tend to remember events from their adolescence better than from other periods in their lives is referred to as the\n(A) Adolescence advantage (B) Reminiscence bump (C) Memorial memorial (D) Quadratic retrieval spike\nA:  (B)\n\nQ: All other things being equal, which of the following persons is more likely to show osteoporosis?\n(A) An older Hispanic American woman (B) An older African American woman (C) An older Asian American woman (D) An older Native American woman\nA:  (C)\n\nQ: Which of the following is always the longest?\n(A) Life expectancy at birth (LEAB) (B) Life span (C) Life expectancy at a specified age (LEASA) (D) There is no way of knowing\nA: ",
        {
          "until": [
            "</s>"
          ]
        }
      ]
    ],
    "resps": [
      [
        "(C)"
      ]
    ],
    "filtered_resps": [
      "(C)"
    ],
    "exact_match": 0.0
  },
  {
    "doc_id": 156,
    "doc": {
      "question": "Which of the following is NOT one of the more frequently named activities by those who are retired?",
      "subject": "human_aging",
      "choices": [
        "Volunteering",
        "Travel",
        "Redoing the home",
        "Household chores"
      ],
      "answer": 2
    },
    "target": "(C)",
    "arguments": [
      [
        "The following are multiple choice questions (with answers) about human aging.\n\nQ: Which of the following persons is more likely to remain at home alone, as of 2019?\n(A) An Asian man or woman (B) A Hispanic man (C) An African American woman (D) A white man or woman\nA:  (C)\n\nQ: All other things being equal, which of the following persons is more likely to show osteoporosis?\n(A) An older Hispanic American woman (B) An older African American woman (C) An older Asian American woman (D) An older Native American woman\nA:  (C)\n\nQ: The finding that adults tend to remember events from their adolescence better than from other periods in their lives is referred to as the\n(A) Adolescence advantage (B) Reminiscence bump (C) Memorial memorial (D) Quadratic retrieval spike\nA:  (B)\n\nQ: When older adults move to a new state after retirement, which of the following is the more likely destination?\n(A) Texas (B) California (C) Hawaii (D) Vermont\nA:  (A)\n\nQ: Which element in tobacco smoke is responsible for cancers?\n(A) Nicotine (B) Tar (C) Carbon monoxide (D) Smoke particles\nA:  (B)\n\nQ: Which of the following is NOT one of the more frequently named activities by those who are retired?\n(A) Volunteering (B) Travel (C) Redoing the home (D) Household chores\nA: ",
        {
          "until": [
            "</s>"
          ]
        }
      ]
    ],
    "resps": [
      [
        "(A)"
      ]
    ],
    "filtered_resps": [
      "(A)"
    ],
    "exact_match": 0.0
  },
  {
    "doc_id": 164,
    "doc": {
      "question": "Current estimates of how many people exercise on a regular basis suggest that _____ do",
      "subject": "human_aging",
      "choices": [
        "Less than 50%",
        "More than 75%",
        "Less than 25%",
        "More than 50%"
      ],
      "answer": 0
    },
    "target": "(A)",
    "arguments": [
      [
        "The following are multiple choice questions (with answers) about human aging.\n\nQ: The finding that adults tend to remember events from their adolescence better than from other periods in their lives is referred to as the\n(A) Adolescence advantage (B) Reminiscence bump (C) Memorial memorial (D) Quadratic retrieval spike\nA:  (B)\n\nQ: When older adults move to a new state after retirement, which of the following is the more likely destination?\n(A) Texas (B) California (C) Hawaii (D) Vermont\nA:  (A)\n\nQ: Which of the following persons is more likely to remain at home alone, as of 2019?\n(A) An Asian man or woman (B) A Hispanic man (C) An African American woman (D) A white man or woman\nA:  (C)\n\nQ: Which element in tobacco smoke is responsible for cancers?\n(A) Nicotine (B) Tar (C) Carbon monoxide (D) Smoke particles\nA:  (B)\n\nQ: All other things being equal, which of the following persons is more likely to show osteoporosis?\n(A) An older Hispanic American woman (B) An older African American woman (C) An older Asian American woman (D) An older Native American woman\nA:  (C)\n\nQ: Current estimates of how many people exercise on a regular basis suggest that _____ do\n(A) Less than 50% (B) More than 75% (C) Less than 25% (D) More than 50%\nA: ",
        {
          "until": [
            "</s>"
          ]
        }
      ]
    ],
    "resps": [
      [
        "(B)"
      ]
    ],
    "filtered_resps": [
      "(B)"
    ],
    "exact_match": 0.0
  },
  {
    "doc_id": 172,
    "doc": {
      "question": "When damage to the brain is irreversible and increasing we refer to the disorder as",
      "subject": "human_aging",
      "choices": [
        "Delirium",
        "MCI",
        "Dementia",
        "Pick's"
      ],
      "answer": 2
    },
    "target": "(C)",
    "arguments": [
      [
        "The following are multiple choice questions (with answers) about human aging.\n\nQ: The finding that adults tend to remember events from their adolescence better than from other periods in their lives is referred to as the\n(A) Adolescence advantage (B) Reminiscence bump (C) Memorial memorial (D) Quadratic retrieval spike\nA:  (B)\n\nQ: When older adults move to a new state after retirement, which of the following is the more likely destination?\n(A) Texas (B) California (C) Hawaii (D) Vermont\nA:  (A)\n\nQ: All other things being equal, which of the following persons is more likely to show osteoporosis?\n(A) An older Hispanic American woman (B) An older African American woman (C) An older Asian American woman (D) An older Native American woman\nA:  (C)\n\nQ: Which of the following persons is more likely to remain at home alone, as of 2019?\n(A) An Asian man or woman (B) A Hispanic man (C) An African American woman (D) A white man or woman\nA:  (C)\n\nQ: Which element in tobacco smoke is responsible for cancers?\n(A) Nicotine (B) Tar (C) Carbon monoxide (D) Smoke particles\nA:  (B)\n\nQ: When damage to the brain is irreversible and increasing we refer to the disorder as\n(A) Delirium (B) MCI (C) Dementia (D) Pick's\nA: ",
        {
          "until": [
            "</s>"
          ]
        }
      ]
    ],
    "resps": [
      [
        "(C)"
      ]
    ],
    "filtered_resps": [
      "(C)"
    ],
    "exact_match": 1.0
  },
  {
    "doc_id": 180,
    "doc": {
      "question": "Information coming into our cognitive system is thought to first enter a",
      "subject": "human_aging",
      "choices": [
        "Sensory memory",
        "Perceptual processor",
        "Working memory",
        "Meta-memory"
      ],
      "answer": 0
    },
    "target": "(A)",
    "arguments": [
      [
        "The following are multiple choice questions (with answers) about human aging.\n\nQ: Which element in tobacco smoke is responsible for cancers?\n(A) Nicotine (B) Tar (C) Carbon monoxide (D) Smoke particles\nA:  (B)\n\nQ: The finding that adults tend to remember events from their adolescence better than from other periods in their lives is referred to as the\n(A) Adolescence advantage (B) Reminiscence bump (C) Memorial memorial (D) Quadratic retrieval spike\nA:  (B)\n\nQ: Which of the following persons is more likely to remain at home alone, as of 2019?\n(A) An Asian man or woman (B) A Hispanic man (C) An African American woman (D) A white man or woman\nA:  (C)\n\nQ: All other things being equal, which of the following persons is more likely to show osteoporosis?\n(A) An older Hispanic American woman (B) An older African American woman (C) An older Asian American woman (D) An older Native American woman\nA:  (C)\n\nQ: When older adults move to a new state after retirement, which of the following is the more likely destination?\n(A) Texas (B) California (C) Hawaii (D) Vermont\nA:  (A)\n\nQ: Information coming into our cognitive system is thought to first enter a\n(A) Sensory memory (B) Perceptual processor (C) Working memory (D) Meta-memory\nA: ",
        {
          "until": [
            "</s>"
          ]
        }
      ]
    ],
    "resps": [
      [
        "(B)"
      ]
    ],
    "filtered_resps": [
      "(B)"
    ],
    "exact_match": 0.0
  },
  {
    "doc_id": 188,
    "doc": {
      "question": "A problem in comparing older adults' memory for recent events and events that happened a long time ago is that recent events",
      "subject": "human_aging",
      "choices": [
        "May be very well rehearsed",
        "Are far more meaningful",
        "Have no denominator to help in computing an average",
        "Can be verified while older events often cannot"
      ],
      "answer": 3
    },
    "target": "(D)",
    "arguments": [
      [
        "The following are multiple choice questions (with answers) about human aging.\n\nQ: The finding that adults tend to remember events from their adolescence better than from other periods in their lives is referred to as the\n(A) Adolescence advantage (B) Reminiscence bump (C) Memorial memorial (D) Quadratic retrieval spike\nA:  (B)\n\nQ: Which of the following persons is more likely to remain at home alone, as of 2019?\n(A) An Asian man or woman (B) A Hispanic man (C) An African American woman (D) A white man or woman\nA:  (C)\n\nQ: When older adults move to a new state after retirement, which of the following is the more likely destination?\n(A) Texas (B) California (C) Hawaii (D) Vermont\nA:  (A)\n\nQ: All other things being equal, which of the following persons is more likely to show osteoporosis?\n(A) An older Hispanic American woman (B) An older African American woman (C) An older Asian American woman (D) An older Native American woman\nA:  (C)\n\nQ: Which element in tobacco smoke is responsible for cancers?\n(A) Nicotine (B) Tar (C) Carbon monoxide (D) Smoke particles\nA:  (B)\n\nQ: A problem in comparing older adults' memory for recent events and events that happened a long time ago is that recent events\n(A) May be very well rehearsed (B) Are far more meaningful (C) Have no denominator to help in computing an average (D) Can be verified while older events often cannot\nA: ",
        {
          "until": [
            "</s>"
          ]
        }
      ]
    ],
    "resps": [
      [
        "(C)"
      ]
    ],
    "filtered_resps": [
      "(C)"
    ],
    "exact_match": 0.0
  },
  {
    "doc_id": 196,
    "doc": {
      "question": "Older adults with higher education and self-esteem are more likely to be",
      "subject": "human_aging",
      "choices": [
        "Sexually active",
        "Socially isolated",
        "Lonely as they grow older",
        "Married for a long time"
      ],
      "answer": 0
    },
    "target": "(A)",
    "arguments": [
      [
        "The following are multiple choice questions (with answers) about human aging.\n\nQ: Which element in tobacco smoke is responsible for cancers?\n(A) Nicotine (B) Tar (C) Carbon monoxide (D) Smoke particles\nA:  (B)\n\nQ: Which of the following persons is more likely to remain at home alone, as of 2019?\n(A) An Asian man or woman (B) A Hispanic man (C) An African American woman (D) A white man or woman\nA:  (C)\n\nQ: When older adults move to a new state after retirement, which of the following is the more likely destination?\n(A) Texas (B) California (C) Hawaii (D) Vermont\nA:  (A)\n\nQ: The finding that adults tend to remember events from their adolescence better than from other periods in their lives is referred to as the\n(A) Adolescence advantage (B) Reminiscence bump (C) Memorial memorial (D) Quadratic retrieval spike\nA:  (B)\n\nQ: All other things being equal, which of the following persons is more likely to show osteoporosis?\n(A) An older Hispanic American woman (B) An older African American woman (C) An older Asian American woman (D) An older Native American woman\nA:  (C)\n\nQ: Older adults with higher education and self-esteem are more likely to be\n(A) Sexually active (B) Socially isolated (C) Lonely as they grow older (D) Married for a long time\nA: ",
        {
          "until": [
            "</s>"
          ]
        }
      ]
    ],
    "resps": [
      [
        "(B)"
      ]
    ],
    "filtered_resps": [
      "(B)"
    ],
    "exact_match": 0.0
  },
  {
    "doc_id": 204,
    "doc": {
      "question": "Our bodies have a natural, built in defense against free radicals that is referred to as",
      "subject": "human_aging",
      "choices": [
        "AFR",
        "SOD",
        "Vitamin C",
        "Telomerase"
      ],
      "answer": 1
    },
    "target": "(B)",
    "arguments": [
      [
        "The following are multiple choice questions (with answers) about human aging.\n\nQ: Which element in tobacco smoke is responsible for cancers?\n(A) Nicotine (B) Tar (C) Carbon monoxide (D) Smoke particles\nA:  (B)\n\nQ: The finding that adults tend to remember events from their adolescence better than from other periods in their lives is referred to as the\n(A) Adolescence advantage (B) Reminiscence bump (C) Memorial memorial (D) Quadratic retrieval spike\nA:  (B)\n\nQ: Which of the following persons is more likely to remain at home alone, as of 2019?\n(A) An Asian man or woman (B) A Hispanic man (C) An African American woman (D) A white man or woman\nA:  (C)\n\nQ: All other things being equal, which of the following persons is more likely to show osteoporosis?\n(A) An older Hispanic American woman (B) An older African American woman (C) An older Asian American woman (D) An older Native American woman\nA:  (C)\n\nQ: When older adults move to a new state after retirement, which of the following is the more likely destination?\n(A) Texas (B) California (C) Hawaii (D) Vermont\nA:  (A)\n\nQ: Our bodies have a natural, built in defense against free radicals that is referred to as\n(A) AFR (B) SOD (C) Vitamin C (D) Telomerase\nA: ",
        {
          "until": [
            "</s>"
          ]
        }
      ]
    ],
    "resps": [
      [
        "(D)"
      ]
    ],
    "filtered_resps": [
      "(D)"
    ],
    "exact_match": 0.0
  },
  {
    "doc_id": 212,
    "doc": {
      "question": "The age at which one can receive full benefits from social security",
      "subject": "human_aging",
      "choices": [
        "Is 62",
        "Is 65",
        "Has been increasing",
        "Will never change"
      ],
      "answer": 2
    },
    "target": "(C)",
    "arguments": [
      [
        "The following are multiple choice questions (with answers) about human aging.\n\nQ: Which element in tobacco smoke is responsible for cancers?\n(A) Nicotine (B) Tar (C) Carbon monoxide (D) Smoke particles\nA:  (B)\n\nQ: The finding that adults tend to remember events from their adolescence better than from other periods in their lives is referred to as the\n(A) Adolescence advantage (B) Reminiscence bump (C) Memorial memorial (D) Quadratic retrieval spike\nA:  (B)\n\nQ: All other things being equal, which of the following persons is more likely to show osteoporosis?\n(A) An older Hispanic American woman (B) An older African American woman (C) An older Asian American woman (D) An older Native American woman\nA:  (C)\n\nQ: Which of the following persons is more likely to remain at home alone, as of 2019?\n(A) An Asian man or woman (B) A Hispanic man (C) An African American woman (D) A white man or woman\nA:  (C)\n\nQ: When older adults move to a new state after retirement, which of the following is the more likely destination?\n(A) Texas (B) California (C) Hawaii (D) Vermont\nA:  (A)\n\nQ: The age at which one can receive full benefits from social security\n(A) Is 62 (B) Is 65 (C) Has been increasing (D) Will never change\nA: ",
        {
          "until": [
            "</s>"
          ]
        }
      ]
    ],
    "resps": [
      [
        "(B)"
      ]
    ],
    "filtered_resps": [
      "(B)"
    ],
    "exact_match": 0.0
  },
  {
    "doc_id": 220,
    "doc": {
      "question": "Longevity is strongly associated with higher levels of",
      "subject": "human_aging",
      "choices": [
        "Social support",
        "BMI",
        "Alcohol use",
        "Supplement use"
      ],
      "answer": 0
    },
    "target": "(A)",
    "arguments": [
      [
        "The following are multiple choice questions (with answers) about human aging.\n\nQ: The finding that adults tend to remember events from their adolescence better than from other periods in their lives is referred to as the\n(A) Adolescence advantage (B) Reminiscence bump (C) Memorial memorial (D) Quadratic retrieval spike\nA:  (B)\n\nQ: All other things being equal, which of the following persons is more likely to show osteoporosis?\n(A) An older Hispanic American woman (B) An older African American woman (C) An older Asian American woman (D) An older Native American woman\nA:  (C)\n\nQ: Which element in tobacco smoke is responsible for cancers?\n(A) Nicotine (B) Tar (C) Carbon monoxide (D) Smoke particles\nA:  (B)\n\nQ: Which of the following persons is more likely to remain at home alone, as of 2019?\n(A) An Asian man or woman (B) A Hispanic man (C) An African American woman (D) A white man or woman\nA:  (C)\n\nQ: When older adults move to a new state after retirement, which of the following is the more likely destination?\n(A) Texas (B) California (C) Hawaii (D) Vermont\nA:  (A)\n\nQ: Longevity is strongly associated with higher levels of\n(A) Social support (B) BMI (C) Alcohol use (D) Supplement use\nA: ",
        {
          "until": [
            "</s>"
          ]
        }
      ]
    ],
    "resps": [
      [
        "(B)"
      ]
    ],
    "filtered_resps": [
      "(B)"
    ],
    "exact_match": 0.0
  },
  {
    "doc_id": 5,
    "doc": {
      "question": "The answer \"both play an important role\" is clearly applicable to the question of",
      "subject": "human_aging",
      "choices": [
        "Nature vs. nurture",
        "Mechanistic vs organismic",
        "Continuity vs. discontinuity",
        "All of these questions"
      ],
      "answer": 3
    },
    "target": "(D)",
    "arguments": [
      [
        "The following are multiple choice questions (with answers) about human aging.\n\nQ: Which element in tobacco smoke is responsible for cancers?\n(A) Nicotine (B) Tar (C) Carbon monoxide (D) Smoke particles\nA:  (B)\n\nQ: Which of the following persons is more likely to remain at home alone, as of 2019?\n(A) An Asian man or woman (B) A Hispanic man (C) An African American woman (D) A white man or woman\nA:  (C)\n\nQ: All other things being equal, which of the following persons is more likely to show osteoporosis?\n(A) An older Hispanic American woman (B) An older African American woman (C) An older Asian American woman (D) An older Native American woman\nA:  (C)\n\nQ: When older adults move to a new state after retirement, which of the following is the more likely destination?\n(A) Texas (B) California (C) Hawaii (D) Vermont\nA:  (A)\n\nQ: The finding that adults tend to remember events from their adolescence better than from other periods in their lives is referred to as the\n(A) Adolescence advantage (B) Reminiscence bump (C) Memorial memorial (D) Quadratic retrieval spike\nA:  (B)\n\nQ: The answer \"both play an important role\" is clearly applicable to the question of\n(A) Nature vs. nurture (B) Mechanistic vs organismic (C) Continuity vs. discontinuity (D) All of these questions\nA: ",
        {
          "until": [
            "</s>"
          ]
        }
      ]
    ],
    "resps": [
      [
        "(B)"
      ]
    ],
    "filtered_resps": [
      "(B)"
    ],
    "exact_match": 0.0
  },
  {
    "doc_id": 13,
    "doc": {
      "question": "That super sweet iced tea that your grandmother gives you might be that way because she",
      "subject": "human_aging",
      "choices": [
        "Has lost a lot of sweet taste buds and cannot taste sweetness as well anymore",
        "Is a member of that cohort that really enjoys sweets",
        "Is trying to get you to be a little sweeter than you have been in the past",
        "Has experienced damage in her parietal lobe where sweet sensations are directed"
      ],
      "answer": 0
    },
    "target": "(A)",
    "arguments": [
      [
        "The following are multiple choice questions (with answers) about human aging.\n\nQ: Which of the following persons is more likely to remain at home alone, as of 2019?\n(A) An Asian man or woman (B) A Hispanic man (C) An African American woman (D) A white man or woman\nA:  (C)\n\nQ: All other things being equal, which of the following persons is more likely to show osteoporosis?\n(A) An older Hispanic American woman (B) An older African American woman (C) An older Asian American woman (D) An older Native American woman\nA:  (C)\n\nQ: The finding that adults tend to remember events from their adolescence better than from other periods in their lives is referred to as the\n(A) Adolescence advantage (B) Reminiscence bump (C) Memorial memorial (D) Quadratic retrieval spike\nA:  (B)\n\nQ: Which element in tobacco smoke is responsible for cancers?\n(A) Nicotine (B) Tar (C) Carbon monoxide (D) Smoke particles\nA:  (B)\n\nQ: When older adults move to a new state after retirement, which of the following is the more likely destination?\n(A) Texas (B) California (C) Hawaii (D) Vermont\nA:  (A)\n\nQ: That super sweet iced tea that your grandmother gives you might be that way because she\n(A) Has lost a lot of sweet taste buds and cannot taste sweetness as well anymore (B) Is a member of that cohort that really enjoys sweets (C) Is trying to get you to be a little sweeter than you have been in the past (D) Has experienced damage in her parietal lobe where sweet sensations are directed\nA: ",
        {
          "until": [
            "</s>"
          ]
        }
      ]
    ],
    "resps": [
      [
        "(A)"
      ]
    ],
    "filtered_resps": [
      "(A)"
    ],
    "exact_match": 1.0
  },
  {
    "doc_id": 21,
    "doc": {
      "question": "Research has offered some longitudinal as well as cross sectional support for the theory put forth by",
      "subject": "human_aging",
      "choices": [
        "Peck",
        "Foos",
        "Levenson",
        "Erikson"
      ],
      "answer": 3
    },
    "target": "(D)",
    "arguments": [
      [
        "The following are multiple choice questions (with answers) about human aging.\n\nQ: Which of the following persons is more likely to remain at home alone, as of 2019?\n(A) An Asian man or woman (B) A Hispanic man (C) An African American woman (D) A white man or woman\nA:  (C)\n\nQ: All other things being equal, which of the following persons is more likely to show osteoporosis?\n(A) An older Hispanic American woman (B) An older African American woman (C) An older Asian American woman (D) An older Native American woman\nA:  (C)\n\nQ: The finding that adults tend to remember events from their adolescence better than from other periods in their lives is referred to as the\n(A) Adolescence advantage (B) Reminiscence bump (C) Memorial memorial (D) Quadratic retrieval spike\nA:  (B)\n\nQ: When older adults move to a new state after retirement, which of the following is the more likely destination?\n(A) Texas (B) California (C) Hawaii (D) Vermont\nA:  (A)\n\nQ: Which element in tobacco smoke is responsible for cancers?\n(A) Nicotine (B) Tar (C) Carbon monoxide (D) Smoke particles\nA:  (B)\n\nQ: Research has offered some longitudinal as well as cross sectional support for the theory put forth by\n(A) Peck (B) Foos (C) Levenson (D) Erikson\nA: ",
        {
          "until": [
            "</s>"
          ]
        }
      ]
    ],
    "resps": [
      [
        "(A)"
      ]
    ],
    "filtered_resps": [
      "(A)"
    ],
    "exact_match": 0.0
  },
  {
    "doc_id": 29,
    "doc": {
      "question": "One difference that seems to be mostly cohort rather than age is the difference in ____ for different age groups",
      "subject": "human_aging",
      "choices": [
        "Coping strategies",
        "Work productivity",
        "Rates of dementia",
        "Personality traits"
      ],
      "answer": 3
    },
    "target": "(D)",
    "arguments": [
      [
        "The following are multiple choice questions (with answers) about human aging.\n\nQ: The finding that adults tend to remember events from their adolescence better than from other periods in their lives is referred to as the\n(A) Adolescence advantage (B) Reminiscence bump (C) Memorial memorial (D) Quadratic retrieval spike\nA:  (B)\n\nQ: Which of the following persons is more likely to remain at home alone, as of 2019?\n(A) An Asian man or woman (B) A Hispanic man (C) An African American woman (D) A white man or woman\nA:  (C)\n\nQ: Which element in tobacco smoke is responsible for cancers?\n(A) Nicotine (B) Tar (C) Carbon monoxide (D) Smoke particles\nA:  (B)\n\nQ: When older adults move to a new state after retirement, which of the following is the more likely destination?\n(A) Texas (B) California (C) Hawaii (D) Vermont\nA:  (A)\n\nQ: All other things being equal, which of the following persons is more likely to show osteoporosis?\n(A) An older Hispanic American woman (B) An older African American woman (C) An older Asian American woman (D) An older Native American woman\nA:  (C)\n\nQ: One difference that seems to be mostly cohort rather than age is the difference in ____ for different age groups\n(A) Coping strategies (B) Work productivity (C) Rates of dementia (D) Personality traits\nA: ",
        {
          "until": [
            "</s>"
          ]
        }
      ]
    ],
    "resps": [
      [
        "(D)"
      ]
    ],
    "filtered_resps": [
      "(D)"
    ],
    "exact_match": 1.0
  },
  {
    "doc_id": 37,
    "doc": {
      "question": "Elder abuse most frequently comes from the older adult's",
      "subject": "human_aging",
      "choices": [
        "Spouse",
        "Children",
        "Grandchildren",
        "Neighbors"
      ],
      "answer": 1
    },
    "target": "(B)",
    "arguments": [
      [
        "The following are multiple choice questions (with answers) about human aging.\n\nQ: All other things being equal, which of the following persons is more likely to show osteoporosis?\n(A) An older Hispanic American woman (B) An older African American woman (C) An older Asian American woman (D) An older Native American woman\nA:  (C)\n\nQ: Which element in tobacco smoke is responsible for cancers?\n(A) Nicotine (B) Tar (C) Carbon monoxide (D) Smoke particles\nA:  (B)\n\nQ: Which of the following persons is more likely to remain at home alone, as of 2019?\n(A) An Asian man or woman (B) A Hispanic man (C) An African American woman (D) A white man or woman\nA:  (C)\n\nQ: When older adults move to a new state after retirement, which of the following is the more likely destination?\n(A) Texas (B) California (C) Hawaii (D) Vermont\nA:  (A)\n\nQ: The finding that adults tend to remember events from their adolescence better than from other periods in their lives is referred to as the\n(A) Adolescence advantage (B) Reminiscence bump (C) Memorial memorial (D) Quadratic retrieval spike\nA:  (B)\n\nQ: Elder abuse most frequently comes from the older adult's\n(A) Spouse (B) Children (C) Grandchildren (D) Neighbors\nA: ",
        {
          "until": [
            "</s>"
          ]
        }
      ]
    ],
    "resps": [
      [
        "(A)"
      ]
    ],
    "filtered_resps": [
      "(A)"
    ],
    "exact_match": 0.0
  },
  {
    "doc_id": 45,
    "doc": {
      "question": "Of the following animals, which has the longest life span by current measures?",
      "subject": "human_aging",
      "choices": [
        "Gorilla",
        "Blue whale",
        "Dog",
        "Queen honey bee"
      ],
      "answer": 1
    },
    "target": "(B)",
    "arguments": [
      [
        "The following are multiple choice questions (with answers) about human aging.\n\nQ: Which of the following persons is more likely to remain at home alone, as of 2019?\n(A) An Asian man or woman (B) A Hispanic man (C) An African American woman (D) A white man or woman\nA:  (C)\n\nQ: All other things being equal, which of the following persons is more likely to show osteoporosis?\n(A) An older Hispanic American woman (B) An older African American woman (C) An older Asian American woman (D) An older Native American woman\nA:  (C)\n\nQ: When older adults move to a new state after retirement, which of the following is the more likely destination?\n(A) Texas (B) California (C) Hawaii (D) Vermont\nA:  (A)\n\nQ: Which element in tobacco smoke is responsible for cancers?\n(A) Nicotine (B) Tar (C) Carbon monoxide (D) Smoke particles\nA:  (B)\n\nQ: The finding that adults tend to remember events from their adolescence better than from other periods in their lives is referred to as the\n(A) Adolescence advantage (B) Reminiscence bump (C) Memorial memorial (D) Quadratic retrieval spike\nA:  (B)\n\nQ: Of the following animals, which has the longest life span by current measures?\n(A) Gorilla (B) Blue whale (C) Dog (D) Queen honey bee\nA: ",
        {
          "until": [
            "</s>"
          ]
        }
      ]
    ],
    "resps": [
      [
        "(B)"
      ]
    ],
    "filtered_resps": [
      "(B)"
    ],
    "exact_match": 1.0
  },
  {
    "doc_id": 53,
    "doc": {
      "question": "If you believe that changes occur slowly and steadily throughout life, you would be holding the _____ side of this view of development.",
      "subject": "human_aging",
      "choices": [
        "Mechanistic",
        "Organismic",
        "Continuity",
        "Stability"
      ],
      "answer": 2
    },
    "target": "(C)",
    "arguments": [
      [
        "The following are multiple choice questions (with answers) about human aging.\n\nQ: All other things being equal, which of the following persons is more likely to show osteoporosis?\n(A) An older Hispanic American woman (B) An older African American woman (C) An older Asian American woman (D) An older Native American woman\nA:  (C)\n\nQ: Which of the following persons is more likely to remain at home alone, as of 2019?\n(A) An Asian man or woman (B) A Hispanic man (C) An African American woman (D) A white man or woman\nA:  (C)\n\nQ: When older adults move to a new state after retirement, which of the following is the more likely destination?\n(A) Texas (B) California (C) Hawaii (D) Vermont\nA:  (A)\n\nQ: The finding that adults tend to remember events from their adolescence better than from other periods in their lives is referred to as the\n(A) Adolescence advantage (B) Reminiscence bump (C) Memorial memorial (D) Quadratic retrieval spike\nA:  (B)\n\nQ: Which element in tobacco smoke is responsible for cancers?\n(A) Nicotine (B) Tar (C) Carbon monoxide (D) Smoke particles\nA:  (B)\n\nQ: If you believe that changes occur slowly and steadily throughout life, you would be holding the _____ side of this view of development.\n(A) Mechanistic (B) Organismic (C) Continuity (D) Stability\nA: ",
        {
          "until": [
            "</s>"
          ]
        }
      ]
    ],
    "resps": [
      [
        "(C)"
      ]
    ],
    "filtered_resps": [
      "(C)"
    ],
    "exact_match": 1.0
  },
  {
    "doc_id": 61,
    "doc": {
      "question": "The least favored theory of senescence among researchers is the _____ theory",
      "subject": "human_aging",
      "choices": [
        "Free radical",
        "Biological clock",
        "Wear and tear",
        "Garbage accumulation"
      ],
      "answer": 2
    },
    "target": "(C)",
    "arguments": [
      [
        "The following are multiple choice questions (with answers) about human aging.\n\nQ: When older adults move to a new state after retirement, which of the following is the more likely destination?\n(A) Texas (B) California (C) Hawaii (D) Vermont\nA:  (A)\n\nQ: All other things being equal, which of the following persons is more likely to show osteoporosis?\n(A) An older Hispanic American woman (B) An older African American woman (C) An older Asian American woman (D) An older Native American woman\nA:  (C)\n\nQ: Which of the following persons is more likely to remain at home alone, as of 2019?\n(A) An Asian man or woman (B) A Hispanic man (C) An African American woman (D) A white man or woman\nA:  (C)\n\nQ: Which element in tobacco smoke is responsible for cancers?\n(A) Nicotine (B) Tar (C) Carbon monoxide (D) Smoke particles\nA:  (B)\n\nQ: The finding that adults tend to remember events from their adolescence better than from other periods in their lives is referred to as the\n(A) Adolescence advantage (B) Reminiscence bump (C) Memorial memorial (D) Quadratic retrieval spike\nA:  (B)\n\nQ: The least favored theory of senescence among researchers is the _____ theory\n(A) Free radical (B) Biological clock (C) Wear and tear (D) Garbage accumulation\nA: ",
        {
          "until": [
            "</s>"
          ]
        }
      ]
    ],
    "resps": [
      [
        "(A)"
      ]
    ],
    "filtered_resps": [
      "(A)"
    ],
    "exact_match": 0.0
  },
  {
    "doc_id": 69,
    "doc": {
      "question": "The largest proportion of older adults living alone reside in",
      "subject": "human_aging",
      "choices": [
        "Hawaii",
        "Washington, DC",
        "Florida",
        "California"
      ],
      "answer": 1
    },
    "target": "(B)",
    "arguments": [
      [
        "The following are multiple choice questions (with answers) about human aging.\n\nQ: All other things being equal, which of the following persons is more likely to show osteoporosis?\n(A) An older Hispanic American woman (B) An older African American woman (C) An older Asian American woman (D) An older Native American woman\nA:  (C)\n\nQ: Which of the following persons is more likely to remain at home alone, as of 2019?\n(A) An Asian man or woman (B) A Hispanic man (C) An African American woman (D) A white man or woman\nA:  (C)\n\nQ: When older adults move to a new state after retirement, which of the following is the more likely destination?\n(A) Texas (B) California (C) Hawaii (D) Vermont\nA:  (A)\n\nQ: Which element in tobacco smoke is responsible for cancers?\n(A) Nicotine (B) Tar (C) Carbon monoxide (D) Smoke particles\nA:  (B)\n\nQ: The finding that adults tend to remember events from their adolescence better than from other periods in their lives is referred to as the\n(A) Adolescence advantage (B) Reminiscence bump (C) Memorial memorial (D) Quadratic retrieval spike\nA:  (B)\n\nQ: The largest proportion of older adults living alone reside in\n(A) Hawaii (B) Washington, DC (C) Florida (D) California\nA: ",
        {
          "until": [
            "</s>"
          ]
        }
      ]
    ],
    "resps": [
      [
        "(D)"
      ]
    ],
    "filtered_resps": [
      "(D)"
    ],
    "exact_match": 0.0
  },
  {
    "doc_id": 77,
    "doc": {
      "question": "About how many grieving individuals seem to require some professional help?",
      "subject": "human_aging",
      "choices": [
        "Less than 10%",
        "About 25%",
        "Nearly half",
        "More than 50%"
      ],
      "answer": 1
    },
    "target": "(B)",
    "arguments": [
      [
        "The following are multiple choice questions (with answers) about human aging.\n\nQ: When older adults move to a new state after retirement, which of the following is the more likely destination?\n(A) Texas (B) California (C) Hawaii (D) Vermont\nA:  (A)\n\nQ: The finding that adults tend to remember events from their adolescence better than from other periods in their lives is referred to as the\n(A) Adolescence advantage (B) Reminiscence bump (C) Memorial memorial (D) Quadratic retrieval spike\nA:  (B)\n\nQ: All other things being equal, which of the following persons is more likely to show osteoporosis?\n(A) An older Hispanic American woman (B) An older African American woman (C) An older Asian American woman (D) An older Native American woman\nA:  (C)\n\nQ: Which element in tobacco smoke is responsible for cancers?\n(A) Nicotine (B) Tar (C) Carbon monoxide (D) Smoke particles\nA:  (B)\n\nQ: Which of the following persons is more likely to remain at home alone, as of 2019?\n(A) An Asian man or woman (B) A Hispanic man (C) An African American woman (D) A white man or woman\nA:  (C)\n\nQ: About how many grieving individuals seem to require some professional help?\n(A) Less than 10% (B) About 25% (C) Nearly half (D) More than 50%\nA: ",
        {
          "until": [
            "</s>"
          ]
        }
      ]
    ],
    "resps": [
      [
        "(D)"
      ]
    ],
    "filtered_resps": [
      "(D)"
    ],
    "exact_match": 0.0
  },
  {
    "doc_id": 85,
    "doc": {
      "question": "One of the most important points made in this chapter is that physical changes",
      "subject": "human_aging",
      "choices": [
        "Occur for everyone",
        "Occur more for some and less for others and, within the same person, more for some systems and less for others",
        "Usually occur for very old people but not for very young people",
        "Can be totally avoided if one learns enough about gerontology"
      ],
      "answer": 1
    },
    "target": "(B)",
    "arguments": [
      [
        "The following are multiple choice questions (with answers) about human aging.\n\nQ: The finding that adults tend to remember events from their adolescence better than from other periods in their lives is referred to as the\n(A) Adolescence advantage (B) Reminiscence bump (C) Memorial memorial (D) Quadratic retrieval spike\nA:  (B)\n\nQ: Which of the following persons is more likely to remain at home alone, as of 2019?\n(A) An Asian man or woman (B) A Hispanic man (C) An African American woman (D) A white man or woman\nA:  (C)\n\nQ: Which element in tobacco smoke is responsible for cancers?\n(A) Nicotine (B) Tar (C) Carbon monoxide (D) Smoke particles\nA:  (B)\n\nQ: All other things being equal, which of the following persons is more likely to show osteoporosis?\n(A) An older Hispanic American woman (B) An older African American woman (C) An older Asian American woman (D) An older Native American woman\nA:  (C)\n\nQ: When older adults move to a new state after retirement, which of the following is the more likely destination?\n(A) Texas (B) California (C) Hawaii (D) Vermont\nA:  (A)\n\nQ: One of the most important points made in this chapter is that physical changes\n(A) Occur for everyone (B) Occur more for some and less for others and, within the same person, more for some systems and less for others (C) Usually occur for very old people but not for very young people (D) Can be totally avoided if one learns enough about gerontology\nA: ",
        {
          "until": [
            "</s>"
          ]
        }
      ]
    ],
    "resps": [
      [
        "(B)"
      ]
    ],
    "filtered_resps": [
      "(B)"
    ],
    "exact_match": 1.0
  },
  {
    "doc_id": 93,
    "doc": {
      "question": "Which of the following appears to lower bad cholesterol?",
      "subject": "human_aging",
      "choices": [
        "Vitamin D",
        "Niacin",
        "Thiamine",
        "Riboflavin"
      ],
      "answer": 1
    },
    "target": "(B)",
    "arguments": [
      [
        "The following are multiple choice questions (with answers) about human aging.\n\nQ: Which of the following persons is more likely to remain at home alone, as of 2019?\n(A) An Asian man or woman (B) A Hispanic man (C) An African American woman (D) A white man or woman\nA:  (C)\n\nQ: The finding that adults tend to remember events from their adolescence better than from other periods in their lives is referred to as the\n(A) Adolescence advantage (B) Reminiscence bump (C) Memorial memorial (D) Quadratic retrieval spike\nA:  (B)\n\nQ: All other things being equal, which of the following persons is more likely to show osteoporosis?\n(A) An older Hispanic American woman (B) An older African American woman (C) An older Asian American woman (D) An older Native American woman\nA:  (C)\n\nQ: When older adults move to a new state after retirement, which of the following is the more likely destination?\n(A) Texas (B) California (C) Hawaii (D) Vermont\nA:  (A)\n\nQ: Which element in tobacco smoke is responsible for cancers?\n(A) Nicotine (B) Tar (C) Carbon monoxide (D) Smoke particles\nA:  (B)\n\nQ: Which of the following appears to lower bad cholesterol?\n(A) Vitamin D (B) Niacin (C) Thiamine (D) Riboflavin\nA: ",
        {
          "until": [
            "</s>"
          ]
        }
      ]
    ],
    "resps": [
      [
        "(A)"
      ]
    ],
    "filtered_resps": [
      "(A)"
    ],
    "exact_match": 0.0
  },
  {
    "doc_id": 101,
    "doc": {
      "question": "Those who survive the loss of another are called the",
      "subject": "human_aging",
      "choices": [
        "Survivors",
        "Grieving",
        "Bereaved",
        "Family and friends"
      ],
      "answer": 2
    },
    "target": "(C)",
    "arguments": [
      [
        "The following are multiple choice questions (with answers) about human aging.\n\nQ: Which of the following persons is more likely to remain at home alone, as of 2019?\n(A) An Asian man or woman (B) A Hispanic man (C) An African American woman (D) A white man or woman\nA:  (C)\n\nQ: The finding that adults tend to remember events from their adolescence better than from other periods in their lives is referred to as the\n(A) Adolescence advantage (B) Reminiscence bump (C) Memorial memorial (D) Quadratic retrieval spike\nA:  (B)\n\nQ: When older adults move to a new state after retirement, which of the following is the more likely destination?\n(A) Texas (B) California (C) Hawaii (D) Vermont\nA:  (A)\n\nQ: Which element in tobacco smoke is responsible for cancers?\n(A) Nicotine (B) Tar (C) Carbon monoxide (D) Smoke particles\nA:  (B)\n\nQ: All other things being equal, which of the following persons is more likely to show osteoporosis?\n(A) An older Hispanic American woman (B) An older African American woman (C) An older Asian American woman (D) An older Native American woman\nA:  (C)\n\nQ: Those who survive the loss of another are called the\n(A) Survivors (B) Grieving (C) Bereaved (D) Family and friends\nA: ",
        {
          "until": [
            "</s>"
          ]
        }
      ]
    ],
    "resps": [
      [
        "(A)"
      ]
    ],
    "filtered_resps": [
      "(A)"
    ],
    "exact_match": 0.0
  },
  {
    "doc_id": 109,
    "doc": {
      "question": "Gary says he won $1000 in the lottery because he really knows how to pick those numbers. Gary would be said to have a strong ____ locus of control",
      "subject": "human_aging",
      "choices": [
        "External, powerful others",
        "Internal",
        "External, chance",
        "Secondary"
      ],
      "answer": 1
    },
    "target": "(B)",
    "arguments": [
      [
        "The following are multiple choice questions (with answers) about human aging.\n\nQ: Which of the following persons is more likely to remain at home alone, as of 2019?\n(A) An Asian man or woman (B) A Hispanic man (C) An African American woman (D) A white man or woman\nA:  (C)\n\nQ: Which element in tobacco smoke is responsible for cancers?\n(A) Nicotine (B) Tar (C) Carbon monoxide (D) Smoke particles\nA:  (B)\n\nQ: The finding that adults tend to remember events from their adolescence better than from other periods in their lives is referred to as the\n(A) Adolescence advantage (B) Reminiscence bump (C) Memorial memorial (D) Quadratic retrieval spike\nA:  (B)\n\nQ: All other things being equal, which of the following persons is more likely to show osteoporosis?\n(A) An older Hispanic American woman (B) An older African American woman (C) An older Asian American woman (D) An older Native American woman\nA:  (C)\n\nQ: When older adults move to a new state after retirement, which of the following is the more likely destination?\n(A) Texas (B) California (C) Hawaii (D) Vermont\nA:  (A)\n\nQ: Gary says he won $1000 in the lottery because he really knows how to pick those numbers. Gary would be said to have a strong ____ locus of control\n(A) External, powerful others (B) Internal (C) External, chance (D) Secondary\nA: ",
        {
          "until": [
            "</s>"
          ]
        }
      ]
    ],
    "resps": [
      [
        "(C)"
      ]
    ],
    "filtered_resps": [
      "(C)"
    ],
    "exact_match": 0.0
  },
  {
    "doc_id": 117,
    "doc": {
      "question": "The different components of memory should be thought of as",
      "subject": "human_aging",
      "choices": [
        "Being very independent",
        "Working one at a time",
        "Working as a system",
        "Taking turns"
      ],
      "answer": 2
    },
    "target": "(C)",
    "arguments": [
      [
        "The following are multiple choice questions (with answers) about human aging.\n\nQ: When older adults move to a new state after retirement, which of the following is the more likely destination?\n(A) Texas (B) California (C) Hawaii (D) Vermont\nA:  (A)\n\nQ: The finding that adults tend to remember events from their adolescence better than from other periods in their lives is referred to as the\n(A) Adolescence advantage (B) Reminiscence bump (C) Memorial memorial (D) Quadratic retrieval spike\nA:  (B)\n\nQ: Which element in tobacco smoke is responsible for cancers?\n(A) Nicotine (B) Tar (C) Carbon monoxide (D) Smoke particles\nA:  (B)\n\nQ: Which of the following persons is more likely to remain at home alone, as of 2019?\n(A) An Asian man or woman (B) A Hispanic man (C) An African American woman (D) A white man or woman\nA:  (C)\n\nQ: All other things being equal, which of the following persons is more likely to show osteoporosis?\n(A) An older Hispanic American woman (B) An older African American woman (C) An older Asian American woman (D) An older Native American woman\nA:  (C)\n\nQ: The different components of memory should be thought of as\n(A) Being very independent (B) Working one at a time (C) Working as a system (D) Taking turns\nA: ",
        {
          "until": [
            "</s>"
          ]
        }
      ]
    ],
    "resps": [
      [
        "(C)"
      ]
    ],
    "filtered_resps": [
      "(C)"
    ],
    "exact_match": 1.0
  },
  {
    "doc_id": 125,
    "doc": {
      "question": "Well being for younger adults is positively related to which form of control?",
      "subject": "human_aging",
      "choices": [
        "Positive reappraisal",
        "Lowering of aspirations",
        "Primary",
        "Internal"
      ],
      "answer": 2
    },
    "target": "(C)",
    "arguments": [
      [
        "The following are multiple choice questions (with answers) about human aging.\n\nQ: Which of the following persons is more likely to remain at home alone, as of 2019?\n(A) An Asian man or woman (B) A Hispanic man (C) An African American woman (D) A white man or woman\nA:  (C)\n\nQ: Which element in tobacco smoke is responsible for cancers?\n(A) Nicotine (B) Tar (C) Carbon monoxide (D) Smoke particles\nA:  (B)\n\nQ: The finding that adults tend to remember events from their adolescence better than from other periods in their lives is referred to as the\n(A) Adolescence advantage (B) Reminiscence bump (C) Memorial memorial (D) Quadratic retrieval spike\nA:  (B)\n\nQ: When older adults move to a new state after retirement, which of the following is the more likely destination?\n(A) Texas (B) California (C) Hawaii (D) Vermont\nA:  (A)\n\nQ: All other things being equal, which of the following persons is more likely to show osteoporosis?\n(A) An older Hispanic American woman (B) An older African American woman (C) An older Asian American woman (D) An older Native American woman\nA:  (C)\n\nQ: Well being for younger adults is positively related to which form of control?\n(A) Positive reappraisal (B) Lowering of aspirations (C) Primary (D) Internal\nA: ",
        {
          "until": [
            "</s>"
          ]
        }
      ]
    ],
    "resps": [
      [
        "(D)"
      ]
    ],
    "filtered_resps": [
      "(D)"
    ],
    "exact_match": 0.0
  },
  {
    "doc_id": 133,
    "doc": {
      "question": "Older adults' coping strategies are generally",
      "subject": "human_aging",
      "choices": [
        "Ineffective at solving problems",
        "Variable as they have more strategies",
        "Persistent as they use the same strategy over and over",
        "Narrow as they ignore many aspects of the problem"
      ],
      "answer": 1
    },
    "target": "(B)",
    "arguments": [
      [
        "The following are multiple choice questions (with answers) about human aging.\n\nQ: All other things being equal, which of the following persons is more likely to show osteoporosis?\n(A) An older Hispanic American woman (B) An older African American woman (C) An older Asian American woman (D) An older Native American woman\nA:  (C)\n\nQ: Which element in tobacco smoke is responsible for cancers?\n(A) Nicotine (B) Tar (C) Carbon monoxide (D) Smoke particles\nA:  (B)\n\nQ: The finding that adults tend to remember events from their adolescence better than from other periods in their lives is referred to as the\n(A) Adolescence advantage (B) Reminiscence bump (C) Memorial memorial (D) Quadratic retrieval spike\nA:  (B)\n\nQ: Which of the following persons is more likely to remain at home alone, as of 2019?\n(A) An Asian man or woman (B) A Hispanic man (C) An African American woman (D) A white man or woman\nA:  (C)\n\nQ: When older adults move to a new state after retirement, which of the following is the more likely destination?\n(A) Texas (B) California (C) Hawaii (D) Vermont\nA:  (A)\n\nQ: Older adults' coping strategies are generally\n(A) Ineffective at solving problems (B) Variable as they have more strategies (C) Persistent as they use the same strategy over and over (D) Narrow as they ignore many aspects of the problem\nA: ",
        {
          "until": [
            "</s>"
          ]
        }
      ]
    ],
    "resps": [
      [
        "(A)"
      ]
    ],
    "filtered_resps": [
      "(A)"
    ],
    "exact_match": 0.0
  },
  {
    "doc_id": 141,
    "doc": {
      "question": "The current record for longest lived human being is held by",
      "subject": "human_aging",
      "choices": [
        "Jeanne Calment",
        "Maggie Kuhn",
        "Maria Esther de Capovilla",
        "M. Cherie Clark"
      ],
      "answer": 0
    },
    "target": "(A)",
    "arguments": [
      [
        "The following are multiple choice questions (with answers) about human aging.\n\nQ: All other things being equal, which of the following persons is more likely to show osteoporosis?\n(A) An older Hispanic American woman (B) An older African American woman (C) An older Asian American woman (D) An older Native American woman\nA:  (C)\n\nQ: The finding that adults tend to remember events from their adolescence better than from other periods in their lives is referred to as the\n(A) Adolescence advantage (B) Reminiscence bump (C) Memorial memorial (D) Quadratic retrieval spike\nA:  (B)\n\nQ: Which element in tobacco smoke is responsible for cancers?\n(A) Nicotine (B) Tar (C) Carbon monoxide (D) Smoke particles\nA:  (B)\n\nQ: When older adults move to a new state after retirement, which of the following is the more likely destination?\n(A) Texas (B) California (C) Hawaii (D) Vermont\nA:  (A)\n\nQ: Which of the following persons is more likely to remain at home alone, as of 2019?\n(A) An Asian man or woman (B) A Hispanic man (C) An African American woman (D) A white man or woman\nA:  (C)\n\nQ: The current record for longest lived human being is held by\n(A) Jeanne Calment (B) Maggie Kuhn (C) Maria Esther de Capovilla (D) M. Cherie Clark\nA: ",
        {
          "until": [
            "</s>"
          ]
        }
      ]
    ],
    "resps": [
      [
        "(A)"
      ]
    ],
    "filtered_resps": [
      "(A)"
    ],
    "exact_match": 1.0
  },
  {
    "doc_id": 149,
    "doc": {
      "question": "Of the following, which is the more frequent stereotype of older adults?",
      "subject": "human_aging",
      "choices": [
        "Full of wisdom and knowledge",
        "Healthy and independent",
        "Confused and disoriented",
        "Sleepy and lazy"
      ],
      "answer": 2
    },
    "target": "(C)",
    "arguments": [
      [
        "The following are multiple choice questions (with answers) about human aging.\n\nQ: When older adults move to a new state after retirement, which of the following is the more likely destination?\n(A) Texas (B) California (C) Hawaii (D) Vermont\nA:  (A)\n\nQ: Which of the following persons is more likely to remain at home alone, as of 2019?\n(A) An Asian man or woman (B) A Hispanic man (C) An African American woman (D) A white man or woman\nA:  (C)\n\nQ: Which element in tobacco smoke is responsible for cancers?\n(A) Nicotine (B) Tar (C) Carbon monoxide (D) Smoke particles\nA:  (B)\n\nQ: The finding that adults tend to remember events from their adolescence better than from other periods in their lives is referred to as the\n(A) Adolescence advantage (B) Reminiscence bump (C) Memorial memorial (D) Quadratic retrieval spike\nA:  (B)\n\nQ: All other things being equal, which of the following persons is more likely to show osteoporosis?\n(A) An older Hispanic American woman (B) An older African American woman (C) An older Asian American woman (D) An older Native American woman\nA:  (C)\n\nQ: Of the following, which is the more frequent stereotype of older adults?\n(A) Full of wisdom and knowledge (B) Healthy and independent (C) Confused and disoriented (D) Sleepy and lazy\nA: ",
        {
          "until": [
            "</s>"
          ]
        }
      ]
    ],
    "resps": [
      [
        "(D)"
      ]
    ],
    "filtered_resps": [
      "(D)"
    ],
    "exact_match": 0.0
  },
  {
    "doc_id": 157,
    "doc": {
      "question": "The retirement phase that occurs least frequently is the ____ phase",
      "subject": "human_aging",
      "choices": [
        "Disenchantment",
        "Honeymoon",
        "Retirement routine",
        "Preretirement"
      ],
      "answer": 0
    },
    "target": "(A)",
    "arguments": [
      [
        "The following are multiple choice questions (with answers) about human aging.\n\nQ: Which of the following persons is more likely to remain at home alone, as of 2019?\n(A) An Asian man or woman (B) A Hispanic man (C) An African American woman (D) A white man or woman\nA:  (C)\n\nQ: All other things being equal, which of the following persons is more likely to show osteoporosis?\n(A) An older Hispanic American woman (B) An older African American woman (C) An older Asian American woman (D) An older Native American woman\nA:  (C)\n\nQ: The finding that adults tend to remember events from their adolescence better than from other periods in their lives is referred to as the\n(A) Adolescence advantage (B) Reminiscence bump (C) Memorial memorial (D) Quadratic retrieval spike\nA:  (B)\n\nQ: When older adults move to a new state after retirement, which of the following is the more likely destination?\n(A) Texas (B) California (C) Hawaii (D) Vermont\nA:  (A)\n\nQ: Which element in tobacco smoke is responsible for cancers?\n(A) Nicotine (B) Tar (C) Carbon monoxide (D) Smoke particles\nA:  (B)\n\nQ: The retirement phase that occurs least frequently is the ____ phase\n(A) Disenchantment (B) Honeymoon (C) Retirement routine (D) Preretirement\nA: ",
        {
          "until": [
            "</s>"
          ]
        }
      ]
    ],
    "resps": [
      [
        "(D)"
      ]
    ],
    "filtered_resps": [
      "(D)"
    ],
    "exact_match": 0.0
  },
  {
    "doc_id": 165,
    "doc": {
      "question": "An increased frequency of urination in older adults is most likely caused by",
      "subject": "human_aging",
      "choices": [
        "Prostate cancer",
        "Smaller bladder",
        "Kidney problems",
        "Gall stone(s)"
      ],
      "answer": 1
    },
    "target": "(B)",
    "arguments": [
      [
        "The following are multiple choice questions (with answers) about human aging.\n\nQ: The finding that adults tend to remember events from their adolescence better than from other periods in their lives is referred to as the\n(A) Adolescence advantage (B) Reminiscence bump (C) Memorial memorial (D) Quadratic retrieval spike\nA:  (B)\n\nQ: When older adults move to a new state after retirement, which of the following is the more likely destination?\n(A) Texas (B) California (C) Hawaii (D) Vermont\nA:  (A)\n\nQ: Which of the following persons is more likely to remain at home alone, as of 2019?\n(A) An Asian man or woman (B) A Hispanic man (C) An African American woman (D) A white man or woman\nA:  (C)\n\nQ: Which element in tobacco smoke is responsible for cancers?\n(A) Nicotine (B) Tar (C) Carbon monoxide (D) Smoke particles\nA:  (B)\n\nQ: All other things being equal, which of the following persons is more likely to show osteoporosis?\n(A) An older Hispanic American woman (B) An older African American woman (C) An older Asian American woman (D) An older Native American woman\nA:  (C)\n\nQ: An increased frequency of urination in older adults is most likely caused by\n(A) Prostate cancer (B) Smaller bladder (C) Kidney problems (D) Gall stone(s)\nA: ",
        {
          "until": [
            "</s>"
          ]
        }
      ]
    ],
    "resps": [
      [
        "(C)"
      ]
    ],
    "filtered_resps": [
      "(C)"
    ],
    "exact_match": 0.0
  },
  {
    "doc_id": 173,
    "doc": {
      "question": "Grandparents with grandchildren in college report feeling especially loved when such grandchildren",
      "subject": "human_aging",
      "choices": [
        "Ask about their satisfaction with life and offer to help",
        "Visit during the holidays and bring gifts",
        "Pay a surprise visit and ask for advice",
        "Invite the grandparents over to their place and cook a good meal"
      ],
      "answer": 2
    },
    "target": "(C)",
    "arguments": [
      [
        "The following are multiple choice questions (with answers) about human aging.\n\nQ: The finding that adults tend to remember events from their adolescence better than from other periods in their lives is referred to as the\n(A) Adolescence advantage (B) Reminiscence bump (C) Memorial memorial (D) Quadratic retrieval spike\nA:  (B)\n\nQ: When older adults move to a new state after retirement, which of the following is the more likely destination?\n(A) Texas (B) California (C) Hawaii (D) Vermont\nA:  (A)\n\nQ: All other things being equal, which of the following persons is more likely to show osteoporosis?\n(A) An older Hispanic American woman (B) An older African American woman (C) An older Asian American woman (D) An older Native American woman\nA:  (C)\n\nQ: Which of the following persons is more likely to remain at home alone, as of 2019?\n(A) An Asian man or woman (B) A Hispanic man (C) An African American woman (D) A white man or woman\nA:  (C)\n\nQ: Which element in tobacco smoke is responsible for cancers?\n(A) Nicotine (B) Tar (C) Carbon monoxide (D) Smoke particles\nA:  (B)\n\nQ: Grandparents with grandchildren in college report feeling especially loved when such grandchildren\n(A) Ask about their satisfaction with life and offer to help (B) Visit during the holidays and bring gifts (C) Pay a surprise visit and ask for advice (D) Invite the grandparents over to their place and cook a good meal\nA: ",
        {
          "until": [
            "</s>"
          ]
        }
      ]
    ],
    "resps": [
      [
        "(C)"
      ]
    ],
    "filtered_resps": [
      "(C)"
    ],
    "exact_match": 1.0
  },
  {
    "doc_id": 181,
    "doc": {
      "question": "Omega 3 appears to reduce the risk of",
      "subject": "human_aging",
      "choices": [
        "Some cancers",
        "Cardiovascular disease",
        "Arthritis",
        "Insomnia"
      ],
      "answer": 1
    },
    "target": "(B)",
    "arguments": [
      [
        "The following are multiple choice questions (with answers) about human aging.\n\nQ: Which element in tobacco smoke is responsible for cancers?\n(A) Nicotine (B) Tar (C) Carbon monoxide (D) Smoke particles\nA:  (B)\n\nQ: The finding that adults tend to remember events from their adolescence better than from other periods in their lives is referred to as the\n(A) Adolescence advantage (B) Reminiscence bump (C) Memorial memorial (D) Quadratic retrieval spike\nA:  (B)\n\nQ: Which of the following persons is more likely to remain at home alone, as of 2019?\n(A) An Asian man or woman (B) A Hispanic man (C) An African American woman (D) A white man or woman\nA:  (C)\n\nQ: All other things being equal, which of the following persons is more likely to show osteoporosis?\n(A) An older Hispanic American woman (B) An older African American woman (C) An older Asian American woman (D) An older Native American woman\nA:  (C)\n\nQ: When older adults move to a new state after retirement, which of the following is the more likely destination?\n(A) Texas (B) California (C) Hawaii (D) Vermont\nA:  (A)\n\nQ: Omega 3 appears to reduce the risk of\n(A) Some cancers (B) Cardiovascular disease (C) Arthritis (D) Insomnia\nA: ",
        {
          "until": [
            "</s>"
          ]
        }
      ]
    ],
    "resps": [
      [
        "(A)"
      ]
    ],
    "filtered_resps": [
      "(A)"
    ],
    "exact_match": 0.0
  },
  {
    "doc_id": 189,
    "doc": {
      "question": "Of the following types of memory, which shows the biggest deficit with advanced age?",
      "subject": "human_aging",
      "choices": [
        "Sensory memory",
        "Episodic memory",
        "Semantic memory",
        "Procedural memory"
      ],
      "answer": 1
    },
    "target": "(B)",
    "arguments": [
      [
        "The following are multiple choice questions (with answers) about human aging.\n\nQ: The finding that adults tend to remember events from their adolescence better than from other periods in their lives is referred to as the\n(A) Adolescence advantage (B) Reminiscence bump (C) Memorial memorial (D) Quadratic retrieval spike\nA:  (B)\n\nQ: Which of the following persons is more likely to remain at home alone, as of 2019?\n(A) An Asian man or woman (B) A Hispanic man (C) An African American woman (D) A white man or woman\nA:  (C)\n\nQ: When older adults move to a new state after retirement, which of the following is the more likely destination?\n(A) Texas (B) California (C) Hawaii (D) Vermont\nA:  (A)\n\nQ: All other things being equal, which of the following persons is more likely to show osteoporosis?\n(A) An older Hispanic American woman (B) An older African American woman (C) An older Asian American woman (D) An older Native American woman\nA:  (C)\n\nQ: Which element in tobacco smoke is responsible for cancers?\n(A) Nicotine (B) Tar (C) Carbon monoxide (D) Smoke particles\nA:  (B)\n\nQ: Of the following types of memory, which shows the biggest deficit with advanced age?\n(A) Sensory memory (B) Episodic memory (C) Semantic memory (D) Procedural memory\nA: ",
        {
          "until": [
            "</s>"
          ]
        }
      ]
    ],
    "resps": [
      [
        "(D)"
      ]
    ],
    "filtered_resps": [
      "(D)"
    ],
    "exact_match": 0.0
  },
  {
    "doc_id": 197,
    "doc": {
      "question": "BMI is regarded as a better measure of health than weight by itself because BMI is based on weight and",
      "subject": "human_aging",
      "choices": [
        "Height",
        "Bone structure",
        "Immune Function",
        "Diet and exercise"
      ],
      "answer": 0
    },
    "target": "(A)",
    "arguments": [
      [
        "The following are multiple choice questions (with answers) about human aging.\n\nQ: Which element in tobacco smoke is responsible for cancers?\n(A) Nicotine (B) Tar (C) Carbon monoxide (D) Smoke particles\nA:  (B)\n\nQ: Which of the following persons is more likely to remain at home alone, as of 2019?\n(A) An Asian man or woman (B) A Hispanic man (C) An African American woman (D) A white man or woman\nA:  (C)\n\nQ: When older adults move to a new state after retirement, which of the following is the more likely destination?\n(A) Texas (B) California (C) Hawaii (D) Vermont\nA:  (A)\n\nQ: The finding that adults tend to remember events from their adolescence better than from other periods in their lives is referred to as the\n(A) Adolescence advantage (B) Reminiscence bump (C) Memorial memorial (D) Quadratic retrieval spike\nA:  (B)\n\nQ: All other things being equal, which of the following persons is more likely to show osteoporosis?\n(A) An older Hispanic American woman (B) An older African American woman (C) An older Asian American woman (D) An older Native American woman\nA:  (C)\n\nQ: BMI is regarded as a better measure of health than weight by itself because BMI is based on weight and\n(A) Height (B) Bone structure (C) Immune Function (D) Diet and exercise\nA: ",
        {
          "until": [
            "</s>"
          ]
        }
      ]
    ],
    "resps": [
      [
        "(B)"
      ]
    ],
    "filtered_resps": [
      "(B)"
    ],
    "exact_match": 0.0
  },
  {
    "doc_id": 205,
    "doc": {
      "question": "Open-ended questions on a survey often make it difficult to",
      "subject": "human_aging",
      "choices": [
        "Get people to fill the survey out",
        "Interpret the answers you get from people",
        "Collect data in a timely manner",
        "Get anyone to believe your results"
      ],
      "answer": 1
    },
    "target": "(B)",
    "arguments": [
      [
        "The following are multiple choice questions (with answers) about human aging.\n\nQ: Which element in tobacco smoke is responsible for cancers?\n(A) Nicotine (B) Tar (C) Carbon monoxide (D) Smoke particles\nA:  (B)\n\nQ: The finding that adults tend to remember events from their adolescence better than from other periods in their lives is referred to as the\n(A) Adolescence advantage (B) Reminiscence bump (C) Memorial memorial (D) Quadratic retrieval spike\nA:  (B)\n\nQ: Which of the following persons is more likely to remain at home alone, as of 2019?\n(A) An Asian man or woman (B) A Hispanic man (C) An African American woman (D) A white man or woman\nA:  (C)\n\nQ: All other things being equal, which of the following persons is more likely to show osteoporosis?\n(A) An older Hispanic American woman (B) An older African American woman (C) An older Asian American woman (D) An older Native American woman\nA:  (C)\n\nQ: When older adults move to a new state after retirement, which of the following is the more likely destination?\n(A) Texas (B) California (C) Hawaii (D) Vermont\nA:  (A)\n\nQ: Open-ended questions on a survey often make it difficult to\n(A) Get people to fill the survey out (B) Interpret the answers you get from people (C) Collect data in a timely manner (D) Get anyone to believe your results\nA: ",
        {
          "until": [
            "</s>"
          ]
        }
      ]
    ],
    "resps": [
      [
        "(B)"
      ]
    ],
    "filtered_resps": [
      "(B)"
    ],
    "exact_match": 1.0
  },
  {
    "doc_id": 213,
    "doc": {
      "question": "Loss of stomach lining can lead to symptoms that resemble",
      "subject": "human_aging",
      "choices": [
        "Anorexia",
        "Dementia",
        "Senescence",
        "Hepatitis"
      ],
      "answer": 1
    },
    "target": "(B)",
    "arguments": [
      [
        "The following are multiple choice questions (with answers) about human aging.\n\nQ: Which element in tobacco smoke is responsible for cancers?\n(A) Nicotine (B) Tar (C) Carbon monoxide (D) Smoke particles\nA:  (B)\n\nQ: The finding that adults tend to remember events from their adolescence better than from other periods in their lives is referred to as the\n(A) Adolescence advantage (B) Reminiscence bump (C) Memorial memorial (D) Quadratic retrieval spike\nA:  (B)\n\nQ: All other things being equal, which of the following persons is more likely to show osteoporosis?\n(A) An older Hispanic American woman (B) An older African American woman (C) An older Asian American woman (D) An older Native American woman\nA:  (C)\n\nQ: Which of the following persons is more likely to remain at home alone, as of 2019?\n(A) An Asian man or woman (B) A Hispanic man (C) An African American woman (D) A white man or woman\nA:  (C)\n\nQ: When older adults move to a new state after retirement, which of the following is the more likely destination?\n(A) Texas (B) California (C) Hawaii (D) Vermont\nA:  (A)\n\nQ: Loss of stomach lining can lead to symptoms that resemble\n(A) Anorexia (B) Dementia (C) Senescence (D) Hepatitis\nA: ",
        {
          "until": [
            "</s>"
          ]
        }
      ]
    ],
    "resps": [
      [
        "(D)"
      ]
    ],
    "filtered_resps": [
      "(D)"
    ],
    "exact_match": 0.0
  },
  {
    "doc_id": 221,
    "doc": {
      "question": "The hypothesis that says adults will remain healthy until very old age and then quickly become ill and die is the ____ hypothesis",
      "subject": "human_aging",
      "choices": [
        "Terminal drop",
        "Compression of morbidity",
        "Klagmore-Rensfeldt",
        "Decline avoidance"
      ],
      "answer": 1
    },
    "target": "(B)",
    "arguments": [
      [
        "The following are multiple choice questions (with answers) about human aging.\n\nQ: The finding that adults tend to remember events from their adolescence better than from other periods in their lives is referred to as the\n(A) Adolescence advantage (B) Reminiscence bump (C) Memorial memorial (D) Quadratic retrieval spike\nA:  (B)\n\nQ: All other things being equal, which of the following persons is more likely to show osteoporosis?\n(A) An older Hispanic American woman (B) An older African American woman (C) An older Asian American woman (D) An older Native American woman\nA:  (C)\n\nQ: Which element in tobacco smoke is responsible for cancers?\n(A) Nicotine (B) Tar (C) Carbon monoxide (D) Smoke particles\nA:  (B)\n\nQ: Which of the following persons is more likely to remain at home alone, as of 2019?\n(A) An Asian man or woman (B) A Hispanic man (C) An African American woman (D) A white man or woman\nA:  (C)\n\nQ: When older adults move to a new state after retirement, which of the following is the more likely destination?\n(A) Texas (B) California (C) Hawaii (D) Vermont\nA:  (A)\n\nQ: The hypothesis that says adults will remain healthy until very old age and then quickly become ill and die is the ____ hypothesis\n(A) Terminal drop (B) Compression of morbidity (C) Klagmore-Rensfeldt (D) Decline avoidance\nA: ",
        {
          "until": [
            "</s>"
          ]
        }
      ]
    ],
    "resps": [
      [
        "(B)"
      ]
    ],
    "filtered_resps": [
      "(B)"
    ],
    "exact_match": 1.0
  },
  {
    "doc_id": 6,
    "doc": {
      "question": "Which of the following does NOT usually occur to the lens of the eye as one grows older?",
      "subject": "human_aging",
      "choices": [
        "It becomes thicker",
        "It yellows",
        "It becomes clouded",
        "It fills with fluid"
      ],
      "answer": 3
    },
    "target": "(D)",
    "arguments": [
      [
        "The following are multiple choice questions (with answers) about human aging.\n\nQ: Which element in tobacco smoke is responsible for cancers?\n(A) Nicotine (B) Tar (C) Carbon monoxide (D) Smoke particles\nA:  (B)\n\nQ: Which of the following persons is more likely to remain at home alone, as of 2019?\n(A) An Asian man or woman (B) A Hispanic man (C) An African American woman (D) A white man or woman\nA:  (C)\n\nQ: All other things being equal, which of the following persons is more likely to show osteoporosis?\n(A) An older Hispanic American woman (B) An older African American woman (C) An older Asian American woman (D) An older Native American woman\nA:  (C)\n\nQ: When older adults move to a new state after retirement, which of the following is the more likely destination?\n(A) Texas (B) California (C) Hawaii (D) Vermont\nA:  (A)\n\nQ: The finding that adults tend to remember events from their adolescence better than from other periods in their lives is referred to as the\n(A) Adolescence advantage (B) Reminiscence bump (C) Memorial memorial (D) Quadratic retrieval spike\nA:  (B)\n\nQ: Which of the following does NOT usually occur to the lens of the eye as one grows older?\n(A) It becomes thicker (B) It yellows (C) It becomes clouded (D) It fills with fluid\nA: ",
        {
          "until": [
            "</s>"
          ]
        }
      ]
    ],
    "resps": [
      [
        "(D)"
      ]
    ],
    "filtered_resps": [
      "(D)"
    ],
    "exact_match": 1.0
  },
  {
    "doc_id": 14,
    "doc": {
      "question": "A shortage of these two vitamins can produce symptoms that mimic dementia:",
      "subject": "human_aging",
      "choices": [
        "A and C",
        "B6 and B12",
        "B6 and D",
        "B12 and E"
      ],
      "answer": 1
    },
    "target": "(B)",
    "arguments": [
      [
        "The following are multiple choice questions (with answers) about human aging.\n\nQ: Which of the following persons is more likely to remain at home alone, as of 2019?\n(A) An Asian man or woman (B) A Hispanic man (C) An African American woman (D) A white man or woman\nA:  (C)\n\nQ: All other things being equal, which of the following persons is more likely to show osteoporosis?\n(A) An older Hispanic American woman (B) An older African American woman (C) An older Asian American woman (D) An older Native American woman\nA:  (C)\n\nQ: The finding that adults tend to remember events from their adolescence better than from other periods in their lives is referred to as the\n(A) Adolescence advantage (B) Reminiscence bump (C) Memorial memorial (D) Quadratic retrieval spike\nA:  (B)\n\nQ: Which element in tobacco smoke is responsible for cancers?\n(A) Nicotine (B) Tar (C) Carbon monoxide (D) Smoke particles\nA:  (B)\n\nQ: When older adults move to a new state after retirement, which of the following is the more likely destination?\n(A) Texas (B) California (C) Hawaii (D) Vermont\nA:  (A)\n\nQ: A shortage of these two vitamins can produce symptoms that mimic dementia:\n(A) A and C (B) B6 and B12 (C) B6 and D (D) B12 and E\nA: ",
        {
          "until": [
            "</s>"
          ]
        }
      ]
    ],
    "resps": [
      [
        "(B)"
      ]
    ],
    "filtered_resps": [
      "(B)"
    ],
    "exact_match": 1.0
  },
  {
    "doc_id": 22,
    "doc": {
      "question": "Which of the following is more likely to be a cohort, rather than an age, difference?",
      "subject": "human_aging",
      "choices": [
        "A higher proportion of older women have completed menopause",
        "A smaller proportion of older women report dreams about sex",
        "A higher proportion of older men are bald",
        "A higher proportion of older men and women are victims of cancer"
      ],
      "answer": 1
    },
    "target": "(B)",
    "arguments": [
      [
        "The following are multiple choice questions (with answers) about human aging.\n\nQ: Which of the following persons is more likely to remain at home alone, as of 2019?\n(A) An Asian man or woman (B) A Hispanic man (C) An African American woman (D) A white man or woman\nA:  (C)\n\nQ: All other things being equal, which of the following persons is more likely to show osteoporosis?\n(A) An older Hispanic American woman (B) An older African American woman (C) An older Asian American woman (D) An older Native American woman\nA:  (C)\n\nQ: The finding that adults tend to remember events from their adolescence better than from other periods in their lives is referred to as the\n(A) Adolescence advantage (B) Reminiscence bump (C) Memorial memorial (D) Quadratic retrieval spike\nA:  (B)\n\nQ: When older adults move to a new state after retirement, which of the following is the more likely destination?\n(A) Texas (B) California (C) Hawaii (D) Vermont\nA:  (A)\n\nQ: Which element in tobacco smoke is responsible for cancers?\n(A) Nicotine (B) Tar (C) Carbon monoxide (D) Smoke particles\nA:  (B)\n\nQ: Which of the following is more likely to be a cohort, rather than an age, difference?\n(A) A higher proportion of older women have completed menopause (B) A smaller proportion of older women report dreams about sex (C) A higher proportion of older men are bald (D) A higher proportion of older men and women are victims of cancer\nA: ",
        {
          "until": [
            "</s>"
          ]
        }
      ]
    ],
    "resps": [
      [
        "(D)"
      ]
    ],
    "filtered_resps": [
      "(D)"
    ],
    "exact_match": 0.0
  },
  {
    "doc_id": 30,
    "doc": {
      "question": "According to Tat Kleckley of this chapter's Senior View, the most important part of the healing process for those who are bereaved is to",
      "subject": "human_aging",
      "choices": [
        "Stay away from other people for a while",
        "Get out and be active",
        "Talk about your loss",
        "Make new friends who don't know about your loss"
      ],
      "answer": 2
    },
    "target": "(C)",
    "arguments": [
      [
        "The following are multiple choice questions (with answers) about human aging.\n\nQ: The finding that adults tend to remember events from their adolescence better than from other periods in their lives is referred to as the\n(A) Adolescence advantage (B) Reminiscence bump (C) Memorial memorial (D) Quadratic retrieval spike\nA:  (B)\n\nQ: Which of the following persons is more likely to remain at home alone, as of 2019?\n(A) An Asian man or woman (B) A Hispanic man (C) An African American woman (D) A white man or woman\nA:  (C)\n\nQ: Which element in tobacco smoke is responsible for cancers?\n(A) Nicotine (B) Tar (C) Carbon monoxide (D) Smoke particles\nA:  (B)\n\nQ: When older adults move to a new state after retirement, which of the following is the more likely destination?\n(A) Texas (B) California (C) Hawaii (D) Vermont\nA:  (A)\n\nQ: All other things being equal, which of the following persons is more likely to show osteoporosis?\n(A) An older Hispanic American woman (B) An older African American woman (C) An older Asian American woman (D) An older Native American woman\nA:  (C)\n\nQ: According to Tat Kleckley of this chapter's Senior View, the most important part of the healing process for those who are bereaved is to\n(A) Stay away from other people for a while (B) Get out and be active (C) Talk about your loss (D) Make new friends who don't know about your loss\nA: ",
        {
          "until": [
            "</s>"
          ]
        }
      ]
    ],
    "resps": [
      [
        "(B)"
      ]
    ],
    "filtered_resps": [
      "(B)"
    ],
    "exact_match": 0.0
  },
  {
    "doc_id": 38,
    "doc": {
      "question": "Projective tests generally ___ than objective tests of personality.",
      "subject": "human_aging",
      "choices": [
        "Have higher reliability",
        "Are more visual",
        "Are more valid",
        "Provide more information"
      ],
      "answer": 1
    },
    "target": "(B)",
    "arguments": [
      [
        "The following are multiple choice questions (with answers) about human aging.\n\nQ: All other things being equal, which of the following persons is more likely to show osteoporosis?\n(A) An older Hispanic American woman (B) An older African American woman (C) An older Asian American woman (D) An older Native American woman\nA:  (C)\n\nQ: Which element in tobacco smoke is responsible for cancers?\n(A) Nicotine (B) Tar (C) Carbon monoxide (D) Smoke particles\nA:  (B)\n\nQ: Which of the following persons is more likely to remain at home alone, as of 2019?\n(A) An Asian man or woman (B) A Hispanic man (C) An African American woman (D) A white man or woman\nA:  (C)\n\nQ: When older adults move to a new state after retirement, which of the following is the more likely destination?\n(A) Texas (B) California (C) Hawaii (D) Vermont\nA:  (A)\n\nQ: The finding that adults tend to remember events from their adolescence better than from other periods in their lives is referred to as the\n(A) Adolescence advantage (B) Reminiscence bump (C) Memorial memorial (D) Quadratic retrieval spike\nA:  (B)\n\nQ: Projective tests generally ___ than objective tests of personality.\n(A) Have higher reliability (B) Are more visual (C) Are more valid (D) Provide more information\nA: ",
        {
          "until": [
            "</s>"
          ]
        }
      ]
    ],
    "resps": [
      [
        "(A)"
      ]
    ],
    "filtered_resps": [
      "(A)"
    ],
    "exact_match": 0.0
  },
  {
    "doc_id": 46,
    "doc": {
      "question": "One advantage of an expected death over an unexpected death is that",
      "subject": "human_aging",
      "choices": [
        "One can use up some grief before the actual loss",
        "One can make funeral and estate plans with the loved one",
        "One can find ways to avoid having the same death for themselves",
        "One can assist the terminally ill person in speeding their death"
      ],
      "answer": 1
    },
    "target": "(B)",
    "arguments": [
      [
        "The following are multiple choice questions (with answers) about human aging.\n\nQ: Which of the following persons is more likely to remain at home alone, as of 2019?\n(A) An Asian man or woman (B) A Hispanic man (C) An African American woman (D) A white man or woman\nA:  (C)\n\nQ: All other things being equal, which of the following persons is more likely to show osteoporosis?\n(A) An older Hispanic American woman (B) An older African American woman (C) An older Asian American woman (D) An older Native American woman\nA:  (C)\n\nQ: When older adults move to a new state after retirement, which of the following is the more likely destination?\n(A) Texas (B) California (C) Hawaii (D) Vermont\nA:  (A)\n\nQ: Which element in tobacco smoke is responsible for cancers?\n(A) Nicotine (B) Tar (C) Carbon monoxide (D) Smoke particles\nA:  (B)\n\nQ: The finding that adults tend to remember events from their adolescence better than from other periods in their lives is referred to as the\n(A) Adolescence advantage (B) Reminiscence bump (C) Memorial memorial (D) Quadratic retrieval spike\nA:  (B)\n\nQ: One advantage of an expected death over an unexpected death is that\n(A) One can use up some grief before the actual loss (B) One can make funeral and estate plans with the loved one (C) One can find ways to avoid having the same death for themselves (D) One can assist the terminally ill person in speeding their death\nA: ",
        {
          "until": [
            "</s>"
          ]
        }
      ]
    ],
    "resps": [
      [
        "(A)"
      ]
    ],
    "filtered_resps": [
      "(A)"
    ],
    "exact_match": 0.0
  },
  {
    "doc_id": 54,
    "doc": {
      "question": "All other things being equal, which of the following persons is likely to live the longest?",
      "subject": "human_aging",
      "choices": [
        "A black man",
        "A white man",
        "A black woman",
        "A white woman"
      ],
      "answer": 3
    },
    "target": "(D)",
    "arguments": [
      [
        "The following are multiple choice questions (with answers) about human aging.\n\nQ: All other things being equal, which of the following persons is more likely to show osteoporosis?\n(A) An older Hispanic American woman (B) An older African American woman (C) An older Asian American woman (D) An older Native American woman\nA:  (C)\n\nQ: Which of the following persons is more likely to remain at home alone, as of 2019?\n(A) An Asian man or woman (B) A Hispanic man (C) An African American woman (D) A white man or woman\nA:  (C)\n\nQ: When older adults move to a new state after retirement, which of the following is the more likely destination?\n(A) Texas (B) California (C) Hawaii (D) Vermont\nA:  (A)\n\nQ: The finding that adults tend to remember events from their adolescence better than from other periods in their lives is referred to as the\n(A) Adolescence advantage (B) Reminiscence bump (C) Memorial memorial (D) Quadratic retrieval spike\nA:  (B)\n\nQ: Which element in tobacco smoke is responsible for cancers?\n(A) Nicotine (B) Tar (C) Carbon monoxide (D) Smoke particles\nA:  (B)\n\nQ: All other things being equal, which of the following persons is likely to live the longest?\n(A) A black man (B) A white man (C) A black woman (D) A white woman\nA: ",
        {
          "until": [
            "</s>"
          ]
        }
      ]
    ],
    "resps": [
      [
        "(B)"
      ]
    ],
    "filtered_resps": [
      "(B)"
    ],
    "exact_match": 0.0
  },
  {
    "doc_id": 62,
    "doc": {
      "question": "A researcher finds that age is negatively correlated with cigarette smoking; this means that",
      "subject": "human_aging",
      "choices": [
        "Older adults experience more negative effects from smoking that do younger adults",
        "Older adults smoke more than younger adults",
        "Older adults smoke less than younger adults",
        "Older and younger adults smoke about the same number of cigarettes and both experience negative effects"
      ],
      "answer": 2
    },
    "target": "(C)",
    "arguments": [
      [
        "The following are multiple choice questions (with answers) about human aging.\n\nQ: When older adults move to a new state after retirement, which of the following is the more likely destination?\n(A) Texas (B) California (C) Hawaii (D) Vermont\nA:  (A)\n\nQ: All other things being equal, which of the following persons is more likely to show osteoporosis?\n(A) An older Hispanic American woman (B) An older African American woman (C) An older Asian American woman (D) An older Native American woman\nA:  (C)\n\nQ: Which of the following persons is more likely to remain at home alone, as of 2019?\n(A) An Asian man or woman (B) A Hispanic man (C) An African American woman (D) A white man or woman\nA:  (C)\n\nQ: Which element in tobacco smoke is responsible for cancers?\n(A) Nicotine (B) Tar (C) Carbon monoxide (D) Smoke particles\nA:  (B)\n\nQ: The finding that adults tend to remember events from their adolescence better than from other periods in their lives is referred to as the\n(A) Adolescence advantage (B) Reminiscence bump (C) Memorial memorial (D) Quadratic retrieval spike\nA:  (B)\n\nQ: A researcher finds that age is negatively correlated with cigarette smoking; this means that\n(A) Older adults experience more negative effects from smoking that do younger adults (B) Older adults smoke more than younger adults (C) Older adults smoke less than younger adults (D) Older and younger adults smoke about the same number of cigarettes and both experience negative effects\nA: ",
        {
          "until": [
            "</s>"
          ]
        }
      ]
    ],
    "resps": [
      [
        "(A)"
      ]
    ],
    "filtered_resps": [
      "(A)"
    ],
    "exact_match": 0.0
  },
  {
    "doc_id": 70,
    "doc": {
      "question": "Which level of personality description appears to show the most change with age?",
      "subject": "human_aging",
      "choices": [
        "Traits",
        "Personal concerns",
        "Coping strategies",
        "Identity"
      ],
      "answer": 1
    },
    "target": "(B)",
    "arguments": [
      [
        "The following are multiple choice questions (with answers) about human aging.\n\nQ: All other things being equal, which of the following persons is more likely to show osteoporosis?\n(A) An older Hispanic American woman (B) An older African American woman (C) An older Asian American woman (D) An older Native American woman\nA:  (C)\n\nQ: Which of the following persons is more likely to remain at home alone, as of 2019?\n(A) An Asian man or woman (B) A Hispanic man (C) An African American woman (D) A white man or woman\nA:  (C)\n\nQ: When older adults move to a new state after retirement, which of the following is the more likely destination?\n(A) Texas (B) California (C) Hawaii (D) Vermont\nA:  (A)\n\nQ: Which element in tobacco smoke is responsible for cancers?\n(A) Nicotine (B) Tar (C) Carbon monoxide (D) Smoke particles\nA:  (B)\n\nQ: The finding that adults tend to remember events from their adolescence better than from other periods in their lives is referred to as the\n(A) Adolescence advantage (B) Reminiscence bump (C) Memorial memorial (D) Quadratic retrieval spike\nA:  (B)\n\nQ: Which level of personality description appears to show the most change with age?\n(A) Traits (B) Personal concerns (C) Coping strategies (D) Identity\nA: ",
        {
          "until": [
            "</s>"
          ]
        }
      ]
    ],
    "resps": [
      [
        "(D)"
      ]
    ],
    "filtered_resps": [
      "(D)"
    ],
    "exact_match": 0.0
  },
  {
    "doc_id": 78,
    "doc": {
      "question": "People with which of the following forms of control are least likely to have accessibility problems where they live?",
      "subject": "human_aging",
      "choices": [
        "External",
        "Internal",
        "Primary",
        "Total"
      ],
      "answer": 1
    },
    "target": "(B)",
    "arguments": [
      [
        "The following are multiple choice questions (with answers) about human aging.\n\nQ: When older adults move to a new state after retirement, which of the following is the more likely destination?\n(A) Texas (B) California (C) Hawaii (D) Vermont\nA:  (A)\n\nQ: The finding that adults tend to remember events from their adolescence better than from other periods in their lives is referred to as the\n(A) Adolescence advantage (B) Reminiscence bump (C) Memorial memorial (D) Quadratic retrieval spike\nA:  (B)\n\nQ: All other things being equal, which of the following persons is more likely to show osteoporosis?\n(A) An older Hispanic American woman (B) An older African American woman (C) An older Asian American woman (D) An older Native American woman\nA:  (C)\n\nQ: Which element in tobacco smoke is responsible for cancers?\n(A) Nicotine (B) Tar (C) Carbon monoxide (D) Smoke particles\nA:  (B)\n\nQ: Which of the following persons is more likely to remain at home alone, as of 2019?\n(A) An Asian man or woman (B) A Hispanic man (C) An African American woman (D) A white man or woman\nA:  (C)\n\nQ: People with which of the following forms of control are least likely to have accessibility problems where they live?\n(A) External (B) Internal (C) Primary (D) Total\nA: ",
        {
          "until": [
            "</s>"
          ]
        }
      ]
    ],
    "resps": [
      [
        "(B)"
      ]
    ],
    "filtered_resps": [
      "(B)"
    ],
    "exact_match": 1.0
  },
  {
    "doc_id": 86,
    "doc": {
      "question": "Which of the following forms of dementia has the highest prevalence rate?",
      "subject": "human_aging",
      "choices": [
        "Alzheimer's",
        "Vascular",
        "Parkinson's",
        "Fronto-temporal lobe"
      ],
      "answer": 0
    },
    "target": "(A)",
    "arguments": [
      [
        "The following are multiple choice questions (with answers) about human aging.\n\nQ: The finding that adults tend to remember events from their adolescence better than from other periods in their lives is referred to as the\n(A) Adolescence advantage (B) Reminiscence bump (C) Memorial memorial (D) Quadratic retrieval spike\nA:  (B)\n\nQ: Which of the following persons is more likely to remain at home alone, as of 2019?\n(A) An Asian man or woman (B) A Hispanic man (C) An African American woman (D) A white man or woman\nA:  (C)\n\nQ: Which element in tobacco smoke is responsible for cancers?\n(A) Nicotine (B) Tar (C) Carbon monoxide (D) Smoke particles\nA:  (B)\n\nQ: All other things being equal, which of the following persons is more likely to show osteoporosis?\n(A) An older Hispanic American woman (B) An older African American woman (C) An older Asian American woman (D) An older Native American woman\nA:  (C)\n\nQ: When older adults move to a new state after retirement, which of the following is the more likely destination?\n(A) Texas (B) California (C) Hawaii (D) Vermont\nA:  (A)\n\nQ: Which of the following forms of dementia has the highest prevalence rate?\n(A) Alzheimer's (B) Vascular (C) Parkinson's (D) Fronto-temporal lobe\nA: ",
        {
          "until": [
            "</s>"
          ]
        }
      ]
    ],
    "resps": [
      [
        "(A)"
      ]
    ],
    "filtered_resps": [
      "(A)"
    ],
    "exact_match": 1.0
  },
  {
    "doc_id": 94,
    "doc": {
      "question": "Most people who have used physician assisted suicide have had",
      "subject": "human_aging",
      "choices": [
        "Alzheimer's",
        "Health insurance",
        "No family",
        "Clinical depression"
      ],
      "answer": 1
    },
    "target": "(B)",
    "arguments": [
      [
        "The following are multiple choice questions (with answers) about human aging.\n\nQ: Which of the following persons is more likely to remain at home alone, as of 2019?\n(A) An Asian man or woman (B) A Hispanic man (C) An African American woman (D) A white man or woman\nA:  (C)\n\nQ: The finding that adults tend to remember events from their adolescence better than from other periods in their lives is referred to as the\n(A) Adolescence advantage (B) Reminiscence bump (C) Memorial memorial (D) Quadratic retrieval spike\nA:  (B)\n\nQ: All other things being equal, which of the following persons is more likely to show osteoporosis?\n(A) An older Hispanic American woman (B) An older African American woman (C) An older Asian American woman (D) An older Native American woman\nA:  (C)\n\nQ: When older adults move to a new state after retirement, which of the following is the more likely destination?\n(A) Texas (B) California (C) Hawaii (D) Vermont\nA:  (A)\n\nQ: Which element in tobacco smoke is responsible for cancers?\n(A) Nicotine (B) Tar (C) Carbon monoxide (D) Smoke particles\nA:  (B)\n\nQ: Most people who have used physician assisted suicide have had\n(A) Alzheimer's (B) Health insurance (C) No family (D) Clinical depression\nA: ",
        {
          "until": [
            "</s>"
          ]
        }
      ]
    ],
    "resps": [
      [
        "(D)"
      ]
    ],
    "filtered_resps": [
      "(D)"
    ],
    "exact_match": 0.0
  },
  {
    "doc_id": 102,
    "doc": {
      "question": "Financial adjustment to retirement has been most difficult for",
      "subject": "human_aging",
      "choices": [
        "Married couples",
        "Single men",
        "Single women",
        "Older adults"
      ],
      "answer": 2
    },
    "target": "(C)",
    "arguments": [
      [
        "The following are multiple choice questions (with answers) about human aging.\n\nQ: Which of the following persons is more likely to remain at home alone, as of 2019?\n(A) An Asian man or woman (B) A Hispanic man (C) An African American woman (D) A white man or woman\nA:  (C)\n\nQ: The finding that adults tend to remember events from their adolescence better than from other periods in their lives is referred to as the\n(A) Adolescence advantage (B) Reminiscence bump (C) Memorial memorial (D) Quadratic retrieval spike\nA:  (B)\n\nQ: When older adults move to a new state after retirement, which of the following is the more likely destination?\n(A) Texas (B) California (C) Hawaii (D) Vermont\nA:  (A)\n\nQ: Which element in tobacco smoke is responsible for cancers?\n(A) Nicotine (B) Tar (C) Carbon monoxide (D) Smoke particles\nA:  (B)\n\nQ: All other things being equal, which of the following persons is more likely to show osteoporosis?\n(A) An older Hispanic American woman (B) An older African American woman (C) An older Asian American woman (D) An older Native American woman\nA:  (C)\n\nQ: Financial adjustment to retirement has been most difficult for\n(A) Married couples (B) Single men (C) Single women (D) Older adults\nA: ",
        {
          "until": [
            "</s>"
          ]
        }
      ]
    ],
    "resps": [
      [
        "(D)"
      ]
    ],
    "filtered_resps": [
      "(D)"
    ],
    "exact_match": 0.0
  },
  {
    "doc_id": 110,
    "doc": {
      "question": "The advanced directive where one specifies the types of medical intervention that are and are not desired is called a",
      "subject": "human_aging",
      "choices": [
        "Living will",
        "DNH",
        "DNR",
        "Durable power of attorney"
      ],
      "answer": 0
    },
    "target": "(A)",
    "arguments": [
      [
        "The following are multiple choice questions (with answers) about human aging.\n\nQ: Which of the following persons is more likely to remain at home alone, as of 2019?\n(A) An Asian man or woman (B) A Hispanic man (C) An African American woman (D) A white man or woman\nA:  (C)\n\nQ: Which element in tobacco smoke is responsible for cancers?\n(A) Nicotine (B) Tar (C) Carbon monoxide (D) Smoke particles\nA:  (B)\n\nQ: The finding that adults tend to remember events from their adolescence better than from other periods in their lives is referred to as the\n(A) Adolescence advantage (B) Reminiscence bump (C) Memorial memorial (D) Quadratic retrieval spike\nA:  (B)\n\nQ: All other things being equal, which of the following persons is more likely to show osteoporosis?\n(A) An older Hispanic American woman (B) An older African American woman (C) An older Asian American woman (D) An older Native American woman\nA:  (C)\n\nQ: When older adults move to a new state after retirement, which of the following is the more likely destination?\n(A) Texas (B) California (C) Hawaii (D) Vermont\nA:  (A)\n\nQ: The advanced directive where one specifies the types of medical intervention that are and are not desired is called a\n(A) Living will (B) DNH (C) DNR (D) Durable power of attorney\nA: ",
        {
          "until": [
            "</s>"
          ]
        }
      ]
    ],
    "resps": [
      [
        "(D)"
      ]
    ],
    "filtered_resps": [
      "(D)"
    ],
    "exact_match": 0.0
  },
  {
    "doc_id": 118,
    "doc": {
      "question": "Very rapid disposal of the body, before sundown on the day of the death, is typical of which religion?",
      "subject": "human_aging",
      "choices": [
        "Islam",
        "Hindu",
        "Jewish",
        "Tao"
      ],
      "answer": 1
    },
    "target": "(B)",
    "arguments": [
      [
        "The following are multiple choice questions (with answers) about human aging.\n\nQ: When older adults move to a new state after retirement, which of the following is the more likely destination?\n(A) Texas (B) California (C) Hawaii (D) Vermont\nA:  (A)\n\nQ: The finding that adults tend to remember events from their adolescence better than from other periods in their lives is referred to as the\n(A) Adolescence advantage (B) Reminiscence bump (C) Memorial memorial (D) Quadratic retrieval spike\nA:  (B)\n\nQ: Which element in tobacco smoke is responsible for cancers?\n(A) Nicotine (B) Tar (C) Carbon monoxide (D) Smoke particles\nA:  (B)\n\nQ: Which of the following persons is more likely to remain at home alone, as of 2019?\n(A) An Asian man or woman (B) A Hispanic man (C) An African American woman (D) A white man or woman\nA:  (C)\n\nQ: All other things being equal, which of the following persons is more likely to show osteoporosis?\n(A) An older Hispanic American woman (B) An older African American woman (C) An older Asian American woman (D) An older Native American woman\nA:  (C)\n\nQ: Very rapid disposal of the body, before sundown on the day of the death, is typical of which religion?\n(A) Islam (B) Hindu (C) Jewish (D) Tao\nA: ",
        {
          "until": [
            "</s>"
          ]
        }
      ]
    ],
    "resps": [
      [
        "(A)"
      ]
    ],
    "filtered_resps": [
      "(A)"
    ],
    "exact_match": 0.0
  },
  {
    "doc_id": 126,
    "doc": {
      "question": "Which of the following is NOT one of the major reasons for the increase in numbers of older adults?",
      "subject": "human_aging",
      "choices": [
        "The Baby Boom generation",
        "The steadily increasing birth rate",
        "Increases in life expectancy at birth",
        "Increases in life expectancy at a specified age"
      ],
      "answer": 1
    },
    "target": "(B)",
    "arguments": [
      [
        "The following are multiple choice questions (with answers) about human aging.\n\nQ: Which of the following persons is more likely to remain at home alone, as of 2019?\n(A) An Asian man or woman (B) A Hispanic man (C) An African American woman (D) A white man or woman\nA:  (C)\n\nQ: Which element in tobacco smoke is responsible for cancers?\n(A) Nicotine (B) Tar (C) Carbon monoxide (D) Smoke particles\nA:  (B)\n\nQ: The finding that adults tend to remember events from their adolescence better than from other periods in their lives is referred to as the\n(A) Adolescence advantage (B) Reminiscence bump (C) Memorial memorial (D) Quadratic retrieval spike\nA:  (B)\n\nQ: When older adults move to a new state after retirement, which of the following is the more likely destination?\n(A) Texas (B) California (C) Hawaii (D) Vermont\nA:  (A)\n\nQ: All other things being equal, which of the following persons is more likely to show osteoporosis?\n(A) An older Hispanic American woman (B) An older African American woman (C) An older Asian American woman (D) An older Native American woman\nA:  (C)\n\nQ: Which of the following is NOT one of the major reasons for the increase in numbers of older adults?\n(A) The Baby Boom generation (B) The steadily increasing birth rate (C) Increases in life expectancy at birth (D) Increases in life expectancy at a specified age\nA: ",
        {
          "until": [
            "</s>"
          ]
        }
      ]
    ],
    "resps": [
      [
        "(B)"
      ]
    ],
    "filtered_resps": [
      "(B)"
    ],
    "exact_match": 1.0
  },
  {
    "doc_id": 134,
    "doc": {
      "question": "Men are more likely than women to die from",
      "subject": "human_aging",
      "choices": [
        "Septicemia",
        "Stroke",
        "Suicide",
        "Influenza"
      ],
      "answer": 2
    },
    "target": "(C)",
    "arguments": [
      [
        "The following are multiple choice questions (with answers) about human aging.\n\nQ: All other things being equal, which of the following persons is more likely to show osteoporosis?\n(A) An older Hispanic American woman (B) An older African American woman (C) An older Asian American woman (D) An older Native American woman\nA:  (C)\n\nQ: Which element in tobacco smoke is responsible for cancers?\n(A) Nicotine (B) Tar (C) Carbon monoxide (D) Smoke particles\nA:  (B)\n\nQ: The finding that adults tend to remember events from their adolescence better than from other periods in their lives is referred to as the\n(A) Adolescence advantage (B) Reminiscence bump (C) Memorial memorial (D) Quadratic retrieval spike\nA:  (B)\n\nQ: Which of the following persons is more likely to remain at home alone, as of 2019?\n(A) An Asian man or woman (B) A Hispanic man (C) An African American woman (D) A white man or woman\nA:  (C)\n\nQ: When older adults move to a new state after retirement, which of the following is the more likely destination?\n(A) Texas (B) California (C) Hawaii (D) Vermont\nA:  (A)\n\nQ: Men are more likely than women to die from\n(A) Septicemia (B) Stroke (C) Suicide (D) Influenza\nA: ",
        {
          "until": [
            "</s>"
          ]
        }
      ]
    ],
    "resps": [
      [
        "(B)"
      ]
    ],
    "filtered_resps": [
      "(B)"
    ],
    "exact_match": 0.0
  },
  {
    "doc_id": 142,
    "doc": {
      "question": "Glaucoma refers to the condition in which",
      "subject": "human_aging",
      "choices": [
        "Fluid pressure in the eye is above normal",
        "Inner and outer layers of the retina separate",
        "The lens becomes cloudy and opaque",
        "The central part of the retina no longer functions"
      ],
      "answer": 0
    },
    "target": "(A)",
    "arguments": [
      [
        "The following are multiple choice questions (with answers) about human aging.\n\nQ: All other things being equal, which of the following persons is more likely to show osteoporosis?\n(A) An older Hispanic American woman (B) An older African American woman (C) An older Asian American woman (D) An older Native American woman\nA:  (C)\n\nQ: The finding that adults tend to remember events from their adolescence better than from other periods in their lives is referred to as the\n(A) Adolescence advantage (B) Reminiscence bump (C) Memorial memorial (D) Quadratic retrieval spike\nA:  (B)\n\nQ: Which element in tobacco smoke is responsible for cancers?\n(A) Nicotine (B) Tar (C) Carbon monoxide (D) Smoke particles\nA:  (B)\n\nQ: When older adults move to a new state after retirement, which of the following is the more likely destination?\n(A) Texas (B) California (C) Hawaii (D) Vermont\nA:  (A)\n\nQ: Which of the following persons is more likely to remain at home alone, as of 2019?\n(A) An Asian man or woman (B) A Hispanic man (C) An African American woman (D) A white man or woman\nA:  (C)\n\nQ: Glaucoma refers to the condition in which\n(A) Fluid pressure in the eye is above normal (B) Inner and outer layers of the retina separate (C) The lens becomes cloudy and opaque (D) The central part of the retina no longer functions\nA: ",
        {
          "until": [
            "</s>"
          ]
        }
      ]
    ],
    "resps": [
      [
        "(D)"
      ]
    ],
    "filtered_resps": [
      "(D)"
    ],
    "exact_match": 0.0
  },
  {
    "doc_id": 150,
    "doc": {
      "question": "One reason that older adults may have difficulty in retrieving memories is that",
      "subject": "human_aging",
      "choices": [
        "Long-term memory often discards older and unused memories",
        "There are many more memories to search through to find the one that is sought",
        "Older adults quit searching because they have more important things to do",
        "Memory is less well organized as we grow older and finding a memory can be quite difficult"
      ],
      "answer": 1
    },
    "target": "(B)",
    "arguments": [
      [
        "The following are multiple choice questions (with answers) about human aging.\n\nQ: When older adults move to a new state after retirement, which of the following is the more likely destination?\n(A) Texas (B) California (C) Hawaii (D) Vermont\nA:  (A)\n\nQ: Which of the following persons is more likely to remain at home alone, as of 2019?\n(A) An Asian man or woman (B) A Hispanic man (C) An African American woman (D) A white man or woman\nA:  (C)\n\nQ: Which element in tobacco smoke is responsible for cancers?\n(A) Nicotine (B) Tar (C) Carbon monoxide (D) Smoke particles\nA:  (B)\n\nQ: The finding that adults tend to remember events from their adolescence better than from other periods in their lives is referred to as the\n(A) Adolescence advantage (B) Reminiscence bump (C) Memorial memorial (D) Quadratic retrieval spike\nA:  (B)\n\nQ: All other things being equal, which of the following persons is more likely to show osteoporosis?\n(A) An older Hispanic American woman (B) An older African American woman (C) An older Asian American woman (D) An older Native American woman\nA:  (C)\n\nQ: One reason that older adults may have difficulty in retrieving memories is that\n(A) Long-term memory often discards older and unused memories (B) There are many more memories to search through to find the one that is sought (C) Older adults quit searching because they have more important things to do (D) Memory is less well organized as we grow older and finding a memory can be quite difficult\nA: ",
        {
          "until": [
            "</s>"
          ]
        }
      ]
    ],
    "resps": [
      [
        "(D)"
      ]
    ],
    "filtered_resps": [
      "(D)"
    ],
    "exact_match": 0.0
  },
  {
    "doc_id": 158,
    "doc": {
      "question": "Which of the following is the most important variable for gerontological researchers?",
      "subject": "human_aging",
      "choices": [
        "Age",
        "Gender",
        "Cohort",
        "Time of measurement"
      ],
      "answer": 0
    },
    "target": "(A)",
    "arguments": [
      [
        "The following are multiple choice questions (with answers) about human aging.\n\nQ: Which of the following persons is more likely to remain at home alone, as of 2019?\n(A) An Asian man or woman (B) A Hispanic man (C) An African American woman (D) A white man or woman\nA:  (C)\n\nQ: All other things being equal, which of the following persons is more likely to show osteoporosis?\n(A) An older Hispanic American woman (B) An older African American woman (C) An older Asian American woman (D) An older Native American woman\nA:  (C)\n\nQ: The finding that adults tend to remember events from their adolescence better than from other periods in their lives is referred to as the\n(A) Adolescence advantage (B) Reminiscence bump (C) Memorial memorial (D) Quadratic retrieval spike\nA:  (B)\n\nQ: When older adults move to a new state after retirement, which of the following is the more likely destination?\n(A) Texas (B) California (C) Hawaii (D) Vermont\nA:  (A)\n\nQ: Which element in tobacco smoke is responsible for cancers?\n(A) Nicotine (B) Tar (C) Carbon monoxide (D) Smoke particles\nA:  (B)\n\nQ: Which of the following is the most important variable for gerontological researchers?\n(A) Age (B) Gender (C) Cohort (D) Time of measurement\nA: ",
        {
          "until": [
            "</s>"
          ]
        }
      ]
    ],
    "resps": [
      [
        "(A)"
      ]
    ],
    "filtered_resps": [
      "(A)"
    ],
    "exact_match": 1.0
  },
  {
    "doc_id": 166,
    "doc": {
      "question": "Some research has found that later cognitive decline is predicted by earlier",
      "subject": "human_aging",
      "choices": [
        "Cardiovascular problems",
        "Loss of muscle strength",
        "Immune system decline",
        "Graying of hair"
      ],
      "answer": 1
    },
    "target": "(B)",
    "arguments": [
      [
        "The following are multiple choice questions (with answers) about human aging.\n\nQ: The finding that adults tend to remember events from their adolescence better than from other periods in their lives is referred to as the\n(A) Adolescence advantage (B) Reminiscence bump (C) Memorial memorial (D) Quadratic retrieval spike\nA:  (B)\n\nQ: When older adults move to a new state after retirement, which of the following is the more likely destination?\n(A) Texas (B) California (C) Hawaii (D) Vermont\nA:  (A)\n\nQ: Which of the following persons is more likely to remain at home alone, as of 2019?\n(A) An Asian man or woman (B) A Hispanic man (C) An African American woman (D) A white man or woman\nA:  (C)\n\nQ: Which element in tobacco smoke is responsible for cancers?\n(A) Nicotine (B) Tar (C) Carbon monoxide (D) Smoke particles\nA:  (B)\n\nQ: All other things being equal, which of the following persons is more likely to show osteoporosis?\n(A) An older Hispanic American woman (B) An older African American woman (C) An older Asian American woman (D) An older Native American woman\nA:  (C)\n\nQ: Some research has found that later cognitive decline is predicted by earlier\n(A) Cardiovascular problems (B) Loss of muscle strength (C) Immune system decline (D) Graying of hair\nA: ",
        {
          "until": [
            "</s>"
          ]
        }
      ]
    ],
    "resps": [
      [
        "(B)"
      ]
    ],
    "filtered_resps": [
      "(B)"
    ],
    "exact_match": 1.0
  },
  {
    "doc_id": 174,
    "doc": {
      "question": "The influence of genetics on longevity is estimated to be about",
      "subject": "human_aging",
      "choices": [
        "20%",
        "33%",
        "50%",
        "75%"
      ],
      "answer": 1
    },
    "target": "(B)",
    "arguments": [
      [
        "The following are multiple choice questions (with answers) about human aging.\n\nQ: The finding that adults tend to remember events from their adolescence better than from other periods in their lives is referred to as the\n(A) Adolescence advantage (B) Reminiscence bump (C) Memorial memorial (D) Quadratic retrieval spike\nA:  (B)\n\nQ: When older adults move to a new state after retirement, which of the following is the more likely destination?\n(A) Texas (B) California (C) Hawaii (D) Vermont\nA:  (A)\n\nQ: All other things being equal, which of the following persons is more likely to show osteoporosis?\n(A) An older Hispanic American woman (B) An older African American woman (C) An older Asian American woman (D) An older Native American woman\nA:  (C)\n\nQ: Which of the following persons is more likely to remain at home alone, as of 2019?\n(A) An Asian man or woman (B) A Hispanic man (C) An African American woman (D) A white man or woman\nA:  (C)\n\nQ: Which element in tobacco smoke is responsible for cancers?\n(A) Nicotine (B) Tar (C) Carbon monoxide (D) Smoke particles\nA:  (B)\n\nQ: The influence of genetics on longevity is estimated to be about\n(A) 20% (B) 33% (C) 50% (D) 75%\nA: ",
        {
          "until": [
            "</s>"
          ]
        }
      ]
    ],
    "resps": [
      [
        "(C)"
      ]
    ],
    "filtered_resps": [
      "(C)"
    ],
    "exact_match": 0.0
  },
  {
    "doc_id": 182,
    "doc": {
      "question": "The term \"senescence\" refers to",
      "subject": "human_aging",
      "choices": [
        "An increased vulnerability",
        "The process of becoming older",
        "The loss of mental abilities",
        "Biological aging"
      ],
      "answer": 0
    },
    "target": "(A)",
    "arguments": [
      [
        "The following are multiple choice questions (with answers) about human aging.\n\nQ: Which element in tobacco smoke is responsible for cancers?\n(A) Nicotine (B) Tar (C) Carbon monoxide (D) Smoke particles\nA:  (B)\n\nQ: The finding that adults tend to remember events from their adolescence better than from other periods in their lives is referred to as the\n(A) Adolescence advantage (B) Reminiscence bump (C) Memorial memorial (D) Quadratic retrieval spike\nA:  (B)\n\nQ: Which of the following persons is more likely to remain at home alone, as of 2019?\n(A) An Asian man or woman (B) A Hispanic man (C) An African American woman (D) A white man or woman\nA:  (C)\n\nQ: All other things being equal, which of the following persons is more likely to show osteoporosis?\n(A) An older Hispanic American woman (B) An older African American woman (C) An older Asian American woman (D) An older Native American woman\nA:  (C)\n\nQ: When older adults move to a new state after retirement, which of the following is the more likely destination?\n(A) Texas (B) California (C) Hawaii (D) Vermont\nA:  (A)\n\nQ: The term \"senescence\" refers to\n(A) An increased vulnerability (B) The process of becoming older (C) The loss of mental abilities (D) Biological aging\nA: ",
        {
          "until": [
            "</s>"
          ]
        }
      ]
    ],
    "resps": [
      [
        "(B)"
      ]
    ],
    "filtered_resps": [
      "(B)"
    ],
    "exact_match": 0.0
  },
  {
    "doc_id": 190,
    "doc": {
      "question": "The loss of a ____ is regarded in the U. S. as the most severe loss and frequently produces guilt in addition to other emotions.",
      "subject": "human_aging",
      "choices": [
        "Spouse",
        "Parent",
        "Child",
        "Sibling"
      ],
      "answer": 2
    },
    "target": "(C)",
    "arguments": [
      [
        "The following are multiple choice questions (with answers) about human aging.\n\nQ: The finding that adults tend to remember events from their adolescence better than from other periods in their lives is referred to as the\n(A) Adolescence advantage (B) Reminiscence bump (C) Memorial memorial (D) Quadratic retrieval spike\nA:  (B)\n\nQ: Which of the following persons is more likely to remain at home alone, as of 2019?\n(A) An Asian man or woman (B) A Hispanic man (C) An African American woman (D) A white man or woman\nA:  (C)\n\nQ: When older adults move to a new state after retirement, which of the following is the more likely destination?\n(A) Texas (B) California (C) Hawaii (D) Vermont\nA:  (A)\n\nQ: All other things being equal, which of the following persons is more likely to show osteoporosis?\n(A) An older Hispanic American woman (B) An older African American woman (C) An older Asian American woman (D) An older Native American woman\nA:  (C)\n\nQ: Which element in tobacco smoke is responsible for cancers?\n(A) Nicotine (B) Tar (C) Carbon monoxide (D) Smoke particles\nA:  (B)\n\nQ: The loss of a ____ is regarded in the U. S. as the most severe loss and frequently produces guilt in addition to other emotions.\n(A) Spouse (B) Parent (C) Child (D) Sibling\nA: ",
        {
          "until": [
            "</s>"
          ]
        }
      ]
    ],
    "resps": [
      [
        "(C)"
      ]
    ],
    "filtered_resps": [
      "(C)"
    ],
    "exact_match": 1.0
  },
  {
    "doc_id": 198,
    "doc": {
      "question": "Morbidity refers to",
      "subject": "human_aging",
      "choices": [
        "Death",
        "Social and emotional isolation",
        "Increased disability and declining health",
        "A period of intense personal loss"
      ],
      "answer": 2
    },
    "target": "(C)",
    "arguments": [
      [
        "The following are multiple choice questions (with answers) about human aging.\n\nQ: Which element in tobacco smoke is responsible for cancers?\n(A) Nicotine (B) Tar (C) Carbon monoxide (D) Smoke particles\nA:  (B)\n\nQ: Which of the following persons is more likely to remain at home alone, as of 2019?\n(A) An Asian man or woman (B) A Hispanic man (C) An African American woman (D) A white man or woman\nA:  (C)\n\nQ: When older adults move to a new state after retirement, which of the following is the more likely destination?\n(A) Texas (B) California (C) Hawaii (D) Vermont\nA:  (A)\n\nQ: The finding that adults tend to remember events from their adolescence better than from other periods in their lives is referred to as the\n(A) Adolescence advantage (B) Reminiscence bump (C) Memorial memorial (D) Quadratic retrieval spike\nA:  (B)\n\nQ: All other things being equal, which of the following persons is more likely to show osteoporosis?\n(A) An older Hispanic American woman (B) An older African American woman (C) An older Asian American woman (D) An older Native American woman\nA:  (C)\n\nQ: Morbidity refers to\n(A) Death (B) Social and emotional isolation (C) Increased disability and declining health (D) A period of intense personal loss\nA: ",
        {
          "until": [
            "</s>"
          ]
        }
      ]
    ],
    "resps": [
      [
        "(D)"
      ]
    ],
    "filtered_resps": [
      "(D)"
    ],
    "exact_match": 0.0
  },
  {
    "doc_id": 206,
    "doc": {
      "question": "Which of the following groups is likely to have the more positive view of aging and older adults?",
      "subject": "human_aging",
      "choices": [
        "Other older adults",
        "Children younger than 10",
        "Young adults",
        "Adolescents"
      ],
      "answer": 0
    },
    "target": "(A)",
    "arguments": [
      [
        "The following are multiple choice questions (with answers) about human aging.\n\nQ: Which element in tobacco smoke is responsible for cancers?\n(A) Nicotine (B) Tar (C) Carbon monoxide (D) Smoke particles\nA:  (B)\n\nQ: The finding that adults tend to remember events from their adolescence better than from other periods in their lives is referred to as the\n(A) Adolescence advantage (B) Reminiscence bump (C) Memorial memorial (D) Quadratic retrieval spike\nA:  (B)\n\nQ: Which of the following persons is more likely to remain at home alone, as of 2019?\n(A) An Asian man or woman (B) A Hispanic man (C) An African American woman (D) A white man or woman\nA:  (C)\n\nQ: All other things being equal, which of the following persons is more likely to show osteoporosis?\n(A) An older Hispanic American woman (B) An older African American woman (C) An older Asian American woman (D) An older Native American woman\nA:  (C)\n\nQ: When older adults move to a new state after retirement, which of the following is the more likely destination?\n(A) Texas (B) California (C) Hawaii (D) Vermont\nA:  (A)\n\nQ: Which of the following groups is likely to have the more positive view of aging and older adults?\n(A) Other older adults (B) Children younger than 10 (C) Young adults (D) Adolescents\nA: ",
        {
          "until": [
            "</s>"
          ]
        }
      ]
    ],
    "resps": [
      [
        "(C)"
      ]
    ],
    "filtered_resps": [
      "(C)"
    ],
    "exact_match": 0.0
  },
  {
    "doc_id": 214,
    "doc": {
      "question": "Which of the following has NOT been shown to be an effective treatment for depression in older adults?",
      "subject": "human_aging",
      "choices": [
        "Rigorous exercise",
        "Life review",
        "Mental stimulation",
        "Anti-depressant drugs"
      ],
      "answer": 2
    },
    "target": "(C)",
    "arguments": [
      [
        "The following are multiple choice questions (with answers) about human aging.\n\nQ: Which element in tobacco smoke is responsible for cancers?\n(A) Nicotine (B) Tar (C) Carbon monoxide (D) Smoke particles\nA:  (B)\n\nQ: The finding that adults tend to remember events from their adolescence better than from other periods in their lives is referred to as the\n(A) Adolescence advantage (B) Reminiscence bump (C) Memorial memorial (D) Quadratic retrieval spike\nA:  (B)\n\nQ: All other things being equal, which of the following persons is more likely to show osteoporosis?\n(A) An older Hispanic American woman (B) An older African American woman (C) An older Asian American woman (D) An older Native American woman\nA:  (C)\n\nQ: Which of the following persons is more likely to remain at home alone, as of 2019?\n(A) An Asian man or woman (B) A Hispanic man (C) An African American woman (D) A white man or woman\nA:  (C)\n\nQ: When older adults move to a new state after retirement, which of the following is the more likely destination?\n(A) Texas (B) California (C) Hawaii (D) Vermont\nA:  (A)\n\nQ: Which of the following has NOT been shown to be an effective treatment for depression in older adults?\n(A) Rigorous exercise (B) Life review (C) Mental stimulation (D) Anti-depressant drugs\nA: ",
        {
          "until": [
            "</s>"
          ]
        }
      ]
    ],
    "resps": [
      [
        "(D)"
      ]
    ],
    "filtered_resps": [
      "(D)"
    ],
    "exact_match": 0.0
  },
  {
    "doc_id": 222,
    "doc": {
      "question": "The woman who conducted a longitudinal study on herself and found increased retrieval difficulty as she got older was named",
      "subject": "human_aging",
      "choices": [
        "Clark",
        "Smith",
        "Whitebear",
        "Ebbinghaus"
      ],
      "answer": 1
    },
    "target": "(B)",
    "arguments": [
      [
        "The following are multiple choice questions (with answers) about human aging.\n\nQ: The finding that adults tend to remember events from their adolescence better than from other periods in their lives is referred to as the\n(A) Adolescence advantage (B) Reminiscence bump (C) Memorial memorial (D) Quadratic retrieval spike\nA:  (B)\n\nQ: All other things being equal, which of the following persons is more likely to show osteoporosis?\n(A) An older Hispanic American woman (B) An older African American woman (C) An older Asian American woman (D) An older Native American woman\nA:  (C)\n\nQ: Which element in tobacco smoke is responsible for cancers?\n(A) Nicotine (B) Tar (C) Carbon monoxide (D) Smoke particles\nA:  (B)\n\nQ: Which of the following persons is more likely to remain at home alone, as of 2019?\n(A) An Asian man or woman (B) A Hispanic man (C) An African American woman (D) A white man or woman\nA:  (C)\n\nQ: When older adults move to a new state after retirement, which of the following is the more likely destination?\n(A) Texas (B) California (C) Hawaii (D) Vermont\nA:  (A)\n\nQ: The woman who conducted a longitudinal study on herself and found increased retrieval difficulty as she got older was named\n(A) Clark (B) Smith (C) Whitebear (D) Ebbinghaus\nA: ",
        {
          "until": [
            "</s>"
          ]
        }
      ]
    ],
    "resps": [
      [
        "(B)"
      ]
    ],
    "filtered_resps": [
      "(B)"
    ],
    "exact_match": 1.0
  },
  {
    "doc_id": 7,
    "doc": {
      "question": "The houses of the future may allow you to operate virtually everything in the house from a central terminal; such a house is already in production and is referred to as",
      "subject": "human_aging",
      "choices": [
        "Technohouse",
        "Compuhouse",
        "Futurehouse",
        "Smarthouse"
      ],
      "answer": 3
    },
    "target": "(D)",
    "arguments": [
      [
        "The following are multiple choice questions (with answers) about human aging.\n\nQ: Which element in tobacco smoke is responsible for cancers?\n(A) Nicotine (B) Tar (C) Carbon monoxide (D) Smoke particles\nA:  (B)\n\nQ: Which of the following persons is more likely to remain at home alone, as of 2019?\n(A) An Asian man or woman (B) A Hispanic man (C) An African American woman (D) A white man or woman\nA:  (C)\n\nQ: All other things being equal, which of the following persons is more likely to show osteoporosis?\n(A) An older Hispanic American woman (B) An older African American woman (C) An older Asian American woman (D) An older Native American woman\nA:  (C)\n\nQ: When older adults move to a new state after retirement, which of the following is the more likely destination?\n(A) Texas (B) California (C) Hawaii (D) Vermont\nA:  (A)\n\nQ: The finding that adults tend to remember events from their adolescence better than from other periods in their lives is referred to as the\n(A) Adolescence advantage (B) Reminiscence bump (C) Memorial memorial (D) Quadratic retrieval spike\nA:  (B)\n\nQ: The houses of the future may allow you to operate virtually everything in the house from a central terminal; such a house is already in production and is referred to as\n(A) Technohouse (B) Compuhouse (C) Futurehouse (D) Smarthouse\nA: ",
        {
          "until": [
            "</s>"
          ]
        }
      ]
    ],
    "resps": [
      [
        "(D)"
      ]
    ],
    "filtered_resps": [
      "(D)"
    ],
    "exact_match": 1.0
  },
  {
    "doc_id": 15,
    "doc": {
      "question": "Which of the following is one of McAdam's levels of personality?",
      "subject": "human_aging",
      "choices": [
        "Control",
        "Identity",
        "Generativity",
        "Assimilation"
      ],
      "answer": 1
    },
    "target": "(B)",
    "arguments": [
      [
        "The following are multiple choice questions (with answers) about human aging.\n\nQ: Which of the following persons is more likely to remain at home alone, as of 2019?\n(A) An Asian man or woman (B) A Hispanic man (C) An African American woman (D) A white man or woman\nA:  (C)\n\nQ: All other things being equal, which of the following persons is more likely to show osteoporosis?\n(A) An older Hispanic American woman (B) An older African American woman (C) An older Asian American woman (D) An older Native American woman\nA:  (C)\n\nQ: The finding that adults tend to remember events from their adolescence better than from other periods in their lives is referred to as the\n(A) Adolescence advantage (B) Reminiscence bump (C) Memorial memorial (D) Quadratic retrieval spike\nA:  (B)\n\nQ: Which element in tobacco smoke is responsible for cancers?\n(A) Nicotine (B) Tar (C) Carbon monoxide (D) Smoke particles\nA:  (B)\n\nQ: When older adults move to a new state after retirement, which of the following is the more likely destination?\n(A) Texas (B) California (C) Hawaii (D) Vermont\nA:  (A)\n\nQ: Which of the following is one of McAdam's levels of personality?\n(A) Control (B) Identity (C) Generativity (D) Assimilation\nA: ",
        {
          "until": [
            "</s>"
          ]
        }
      ]
    ],
    "resps": [
      [
        "(B)"
      ]
    ],
    "filtered_resps": [
      "(B)"
    ],
    "exact_match": 1.0
  },
  {
    "doc_id": 23,
    "doc": {
      "question": "Fear of aging has been associated with high levels of",
      "subject": "human_aging",
      "choices": [
        "Introversion",
        "Neuroticism",
        "Rigidity",
        "Mid-life crisis"
      ],
      "answer": 1
    },
    "target": "(B)",
    "arguments": [
      [
        "The following are multiple choice questions (with answers) about human aging.\n\nQ: Which of the following persons is more likely to remain at home alone, as of 2019?\n(A) An Asian man or woman (B) A Hispanic man (C) An African American woman (D) A white man or woman\nA:  (C)\n\nQ: All other things being equal, which of the following persons is more likely to show osteoporosis?\n(A) An older Hispanic American woman (B) An older African American woman (C) An older Asian American woman (D) An older Native American woman\nA:  (C)\n\nQ: The finding that adults tend to remember events from their adolescence better than from other periods in their lives is referred to as the\n(A) Adolescence advantage (B) Reminiscence bump (C) Memorial memorial (D) Quadratic retrieval spike\nA:  (B)\n\nQ: When older adults move to a new state after retirement, which of the following is the more likely destination?\n(A) Texas (B) California (C) Hawaii (D) Vermont\nA:  (A)\n\nQ: Which element in tobacco smoke is responsible for cancers?\n(A) Nicotine (B) Tar (C) Carbon monoxide (D) Smoke particles\nA:  (B)\n\nQ: Fear of aging has been associated with high levels of\n(A) Introversion (B) Neuroticism (C) Rigidity (D) Mid-life crisis\nA: ",
        {
          "until": [
            "</s>"
          ]
        }
      ]
    ],
    "resps": [
      [
        "(B)"
      ]
    ],
    "filtered_resps": [
      "(B)"
    ],
    "exact_match": 1.0
  },
  {
    "doc_id": 31,
    "doc": {
      "question": "Social support is most likely to have a positive influence on health and well being when it is",
      "subject": "human_aging",
      "choices": [
        "Very emotional",
        "Perceived as support",
        "Unexpected",
        "External rather than internal"
      ],
      "answer": 1
    },
    "target": "(B)",
    "arguments": [
      [
        "The following are multiple choice questions (with answers) about human aging.\n\nQ: The finding that adults tend to remember events from their adolescence better than from other periods in their lives is referred to as the\n(A) Adolescence advantage (B) Reminiscence bump (C) Memorial memorial (D) Quadratic retrieval spike\nA:  (B)\n\nQ: Which of the following persons is more likely to remain at home alone, as of 2019?\n(A) An Asian man or woman (B) A Hispanic man (C) An African American woman (D) A white man or woman\nA:  (C)\n\nQ: Which element in tobacco smoke is responsible for cancers?\n(A) Nicotine (B) Tar (C) Carbon monoxide (D) Smoke particles\nA:  (B)\n\nQ: When older adults move to a new state after retirement, which of the following is the more likely destination?\n(A) Texas (B) California (C) Hawaii (D) Vermont\nA:  (A)\n\nQ: All other things being equal, which of the following persons is more likely to show osteoporosis?\n(A) An older Hispanic American woman (B) An older African American woman (C) An older Asian American woman (D) An older Native American woman\nA:  (C)\n\nQ: Social support is most likely to have a positive influence on health and well being when it is\n(A) Very emotional (B) Perceived as support (C) Unexpected (D) External rather than internal\nA: ",
        {
          "until": [
            "</s>"
          ]
        }
      ]
    ],
    "resps": [
      [
        "(B)"
      ]
    ],
    "filtered_resps": [
      "(B)"
    ],
    "exact_match": 1.0
  },
  {
    "doc_id": 39,
    "doc": {
      "question": "Cells in the eye that respond to low levels of illumination are called",
      "subject": "human_aging",
      "choices": [
        "Rods",
        "Cones",
        "Retinal cells",
        "Nocturnal detectors"
      ],
      "answer": 0
    },
    "target": "(A)",
    "arguments": [
      [
        "The following are multiple choice questions (with answers) about human aging.\n\nQ: All other things being equal, which of the following persons is more likely to show osteoporosis?\n(A) An older Hispanic American woman (B) An older African American woman (C) An older Asian American woman (D) An older Native American woman\nA:  (C)\n\nQ: Which element in tobacco smoke is responsible for cancers?\n(A) Nicotine (B) Tar (C) Carbon monoxide (D) Smoke particles\nA:  (B)\n\nQ: Which of the following persons is more likely to remain at home alone, as of 2019?\n(A) An Asian man or woman (B) A Hispanic man (C) An African American woman (D) A white man or woman\nA:  (C)\n\nQ: When older adults move to a new state after retirement, which of the following is the more likely destination?\n(A) Texas (B) California (C) Hawaii (D) Vermont\nA:  (A)\n\nQ: The finding that adults tend to remember events from their adolescence better than from other periods in their lives is referred to as the\n(A) Adolescence advantage (B) Reminiscence bump (C) Memorial memorial (D) Quadratic retrieval spike\nA:  (B)\n\nQ: Cells in the eye that respond to low levels of illumination are called\n(A) Rods (B) Cones (C) Retinal cells (D) Nocturnal detectors\nA: ",
        {
          "until": [
            "</s>"
          ]
        }
      ]
    ],
    "resps": [
      [
        "(C)"
      ]
    ],
    "filtered_resps": [
      "(C)"
    ],
    "exact_match": 0.0
  },
  {
    "doc_id": 47,
    "doc": {
      "question": "Changes in the reproductive system are more _____ for men but not for women",
      "subject": "human_aging",
      "choices": [
        "Mechanistic",
        "Continuous",
        "Organismic",
        "Nurturant"
      ],
      "answer": 1
    },
    "target": "(B)",
    "arguments": [
      [
        "The following are multiple choice questions (with answers) about human aging.\n\nQ: Which of the following persons is more likely to remain at home alone, as of 2019?\n(A) An Asian man or woman (B) A Hispanic man (C) An African American woman (D) A white man or woman\nA:  (C)\n\nQ: All other things being equal, which of the following persons is more likely to show osteoporosis?\n(A) An older Hispanic American woman (B) An older African American woman (C) An older Asian American woman (D) An older Native American woman\nA:  (C)\n\nQ: When older adults move to a new state after retirement, which of the following is the more likely destination?\n(A) Texas (B) California (C) Hawaii (D) Vermont\nA:  (A)\n\nQ: Which element in tobacco smoke is responsible for cancers?\n(A) Nicotine (B) Tar (C) Carbon monoxide (D) Smoke particles\nA:  (B)\n\nQ: The finding that adults tend to remember events from their adolescence better than from other periods in their lives is referred to as the\n(A) Adolescence advantage (B) Reminiscence bump (C) Memorial memorial (D) Quadratic retrieval spike\nA:  (B)\n\nQ: Changes in the reproductive system are more _____ for men but not for women\n(A) Mechanistic (B) Continuous (C) Organismic (D) Nurturant\nA: ",
        {
          "until": [
            "</s>"
          ]
        }
      ]
    ],
    "resps": [
      [
        "(B)"
      ]
    ],
    "filtered_resps": [
      "(B)"
    ],
    "exact_match": 1.0
  },
  {
    "doc_id": 55,
    "doc": {
      "question": "Which of the following age differences could be, in part, a cohort effect? Differences in",
      "subject": "human_aging",
      "choices": [
        "Depression",
        "Alcoholism",
        "Dementia",
        "Suicide"
      ],
      "answer": 1
    },
    "target": "(B)",
    "arguments": [
      [
        "The following are multiple choice questions (with answers) about human aging.\n\nQ: All other things being equal, which of the following persons is more likely to show osteoporosis?\n(A) An older Hispanic American woman (B) An older African American woman (C) An older Asian American woman (D) An older Native American woman\nA:  (C)\n\nQ: Which of the following persons is more likely to remain at home alone, as of 2019?\n(A) An Asian man or woman (B) A Hispanic man (C) An African American woman (D) A white man or woman\nA:  (C)\n\nQ: When older adults move to a new state after retirement, which of the following is the more likely destination?\n(A) Texas (B) California (C) Hawaii (D) Vermont\nA:  (A)\n\nQ: The finding that adults tend to remember events from their adolescence better than from other periods in their lives is referred to as the\n(A) Adolescence advantage (B) Reminiscence bump (C) Memorial memorial (D) Quadratic retrieval spike\nA:  (B)\n\nQ: Which element in tobacco smoke is responsible for cancers?\n(A) Nicotine (B) Tar (C) Carbon monoxide (D) Smoke particles\nA:  (B)\n\nQ: Which of the following age differences could be, in part, a cohort effect? Differences in\n(A) Depression (B) Alcoholism (C) Dementia (D) Suicide\nA: ",
        {
          "until": [
            "</s>"
          ]
        }
      ]
    ],
    "resps": [
      [
        "(C)"
      ]
    ],
    "filtered_resps": [
      "(C)"
    ],
    "exact_match": 0.0
  },
  {
    "doc_id": 63,
    "doc": {
      "question": "When a researcher takes part in the situation he or she is observing, he or she is said to be a(n)",
      "subject": "human_aging",
      "choices": [
        "Active observer",
        "Participant observer",
        "Indiscreet observer",
        "Meddling observer"
      ],
      "answer": 1
    },
    "target": "(B)",
    "arguments": [
      [
        "The following are multiple choice questions (with answers) about human aging.\n\nQ: When older adults move to a new state after retirement, which of the following is the more likely destination?\n(A) Texas (B) California (C) Hawaii (D) Vermont\nA:  (A)\n\nQ: All other things being equal, which of the following persons is more likely to show osteoporosis?\n(A) An older Hispanic American woman (B) An older African American woman (C) An older Asian American woman (D) An older Native American woman\nA:  (C)\n\nQ: Which of the following persons is more likely to remain at home alone, as of 2019?\n(A) An Asian man or woman (B) A Hispanic man (C) An African American woman (D) A white man or woman\nA:  (C)\n\nQ: Which element in tobacco smoke is responsible for cancers?\n(A) Nicotine (B) Tar (C) Carbon monoxide (D) Smoke particles\nA:  (B)\n\nQ: The finding that adults tend to remember events from their adolescence better than from other periods in their lives is referred to as the\n(A) Adolescence advantage (B) Reminiscence bump (C) Memorial memorial (D) Quadratic retrieval spike\nA:  (B)\n\nQ: When a researcher takes part in the situation he or she is observing, he or she is said to be a(n)\n(A) Active observer (B) Participant observer (C) Indiscreet observer (D) Meddling observer\nA: ",
        {
          "until": [
            "</s>"
          ]
        }
      ]
    ],
    "resps": [
      [
        "(B)"
      ]
    ],
    "filtered_resps": [
      "(B)"
    ],
    "exact_match": 1.0
  },
  {
    "doc_id": 71,
    "doc": {
      "question": "The positive relationship between religion and physical health is NOT thought to be due to",
      "subject": "human_aging",
      "choices": [
        "Social support derived from a religious community",
        "The rules of some religions which forbid unhealthy behaviors",
        "The stress reducing effects of prayerful meditation",
        "The benefits of knowing that others are praying for you"
      ],
      "answer": 3
    },
    "target": "(D)",
    "arguments": [
      [
        "The following are multiple choice questions (with answers) about human aging.\n\nQ: All other things being equal, which of the following persons is more likely to show osteoporosis?\n(A) An older Hispanic American woman (B) An older African American woman (C) An older Asian American woman (D) An older Native American woman\nA:  (C)\n\nQ: Which of the following persons is more likely to remain at home alone, as of 2019?\n(A) An Asian man or woman (B) A Hispanic man (C) An African American woman (D) A white man or woman\nA:  (C)\n\nQ: When older adults move to a new state after retirement, which of the following is the more likely destination?\n(A) Texas (B) California (C) Hawaii (D) Vermont\nA:  (A)\n\nQ: Which element in tobacco smoke is responsible for cancers?\n(A) Nicotine (B) Tar (C) Carbon monoxide (D) Smoke particles\nA:  (B)\n\nQ: The finding that adults tend to remember events from their adolescence better than from other periods in their lives is referred to as the\n(A) Adolescence advantage (B) Reminiscence bump (C) Memorial memorial (D) Quadratic retrieval spike\nA:  (B)\n\nQ: The positive relationship between religion and physical health is NOT thought to be due to\n(A) Social support derived from a religious community (B) The rules of some religions which forbid unhealthy behaviors (C) The stress reducing effects of prayerful meditation (D) The benefits of knowing that others are praying for you\nA: ",
        {
          "until": [
            "</s>"
          ]
        }
      ]
    ],
    "resps": [
      [
        "(C)"
      ]
    ],
    "filtered_resps": [
      "(C)"
    ],
    "exact_match": 0.0
  },
  {
    "doc_id": 79,
    "doc": {
      "question": "Which of the following has been found to improve balance for older adults?",
      "subject": "human_aging",
      "choices": [
        "Tai chi",
        "Aerobic exercise",
        "Weight lifting",
        "Walking briskly"
      ],
      "answer": 0
    },
    "target": "(A)",
    "arguments": [
      [
        "The following are multiple choice questions (with answers) about human aging.\n\nQ: When older adults move to a new state after retirement, which of the following is the more likely destination?\n(A) Texas (B) California (C) Hawaii (D) Vermont\nA:  (A)\n\nQ: The finding that adults tend to remember events from their adolescence better than from other periods in their lives is referred to as the\n(A) Adolescence advantage (B) Reminiscence bump (C) Memorial memorial (D) Quadratic retrieval spike\nA:  (B)\n\nQ: All other things being equal, which of the following persons is more likely to show osteoporosis?\n(A) An older Hispanic American woman (B) An older African American woman (C) An older Asian American woman (D) An older Native American woman\nA:  (C)\n\nQ: Which element in tobacco smoke is responsible for cancers?\n(A) Nicotine (B) Tar (C) Carbon monoxide (D) Smoke particles\nA:  (B)\n\nQ: Which of the following persons is more likely to remain at home alone, as of 2019?\n(A) An Asian man or woman (B) A Hispanic man (C) An African American woman (D) A white man or woman\nA:  (C)\n\nQ: Which of the following has been found to improve balance for older adults?\n(A) Tai chi (B) Aerobic exercise (C) Weight lifting (D) Walking briskly\nA: ",
        {
          "until": [
            "</s>"
          ]
        }
      ]
    ],
    "resps": [
      [
        "(B)"
      ]
    ],
    "filtered_resps": [
      "(B)"
    ],
    "exact_match": 0.0
  },
  {
    "doc_id": 87,
    "doc": {
      "question": "High levels of social support are strongly associated with",
      "subject": "human_aging",
      "choices": [
        "Longevity",
        "Internal control",
        "Culture",
        "Education"
      ],
      "answer": 0
    },
    "target": "(A)",
    "arguments": [
      [
        "The following are multiple choice questions (with answers) about human aging.\n\nQ: The finding that adults tend to remember events from their adolescence better than from other periods in their lives is referred to as the\n(A) Adolescence advantage (B) Reminiscence bump (C) Memorial memorial (D) Quadratic retrieval spike\nA:  (B)\n\nQ: Which of the following persons is more likely to remain at home alone, as of 2019?\n(A) An Asian man or woman (B) A Hispanic man (C) An African American woman (D) A white man or woman\nA:  (C)\n\nQ: Which element in tobacco smoke is responsible for cancers?\n(A) Nicotine (B) Tar (C) Carbon monoxide (D) Smoke particles\nA:  (B)\n\nQ: All other things being equal, which of the following persons is more likely to show osteoporosis?\n(A) An older Hispanic American woman (B) An older African American woman (C) An older Asian American woman (D) An older Native American woman\nA:  (C)\n\nQ: When older adults move to a new state after retirement, which of the following is the more likely destination?\n(A) Texas (B) California (C) Hawaii (D) Vermont\nA:  (A)\n\nQ: High levels of social support are strongly associated with\n(A) Longevity (B) Internal control (C) Culture (D) Education\nA: ",
        {
          "until": [
            "</s>"
          ]
        }
      ]
    ],
    "resps": [
      [
        "(A)"
      ]
    ],
    "filtered_resps": [
      "(A)"
    ],
    "exact_match": 1.0
  },
  {
    "doc_id": 95,
    "doc": {
      "question": "A researcher who is interested in the differences between two or more groups of people is most likely to use which of the following approaches?",
      "subject": "human_aging",
      "choices": [
        "Quasi-experimental",
        "Longitudinal",
        "Correlational",
        "Cross-sequential"
      ],
      "answer": 0
    },
    "target": "(A)",
    "arguments": [
      [
        "The following are multiple choice questions (with answers) about human aging.\n\nQ: Which of the following persons is more likely to remain at home alone, as of 2019?\n(A) An Asian man or woman (B) A Hispanic man (C) An African American woman (D) A white man or woman\nA:  (C)\n\nQ: The finding that adults tend to remember events from their adolescence better than from other periods in their lives is referred to as the\n(A) Adolescence advantage (B) Reminiscence bump (C) Memorial memorial (D) Quadratic retrieval spike\nA:  (B)\n\nQ: All other things being equal, which of the following persons is more likely to show osteoporosis?\n(A) An older Hispanic American woman (B) An older African American woman (C) An older Asian American woman (D) An older Native American woman\nA:  (C)\n\nQ: When older adults move to a new state after retirement, which of the following is the more likely destination?\n(A) Texas (B) California (C) Hawaii (D) Vermont\nA:  (A)\n\nQ: Which element in tobacco smoke is responsible for cancers?\n(A) Nicotine (B) Tar (C) Carbon monoxide (D) Smoke particles\nA:  (B)\n\nQ: A researcher who is interested in the differences between two or more groups of people is most likely to use which of the following approaches?\n(A) Quasi-experimental (B) Longitudinal (C) Correlational (D) Cross-sequential\nA: ",
        {
          "until": [
            "</s>"
          ]
        }
      ]
    ],
    "resps": [
      [
        "(D)"
      ]
    ],
    "filtered_resps": [
      "(D)"
    ],
    "exact_match": 0.0
  },
  {
    "doc_id": 103,
    "doc": {
      "question": "Socioemotional selectivity theory says that older adults have smaller social networks because they",
      "subject": "human_aging",
      "choices": [
        "Are more concerned with those closest to them",
        "Select new network members based on emotional factors",
        "Can no longer get out to select new network members",
        "Are too emotionally involved to spend time with others"
      ],
      "answer": 0
    },
    "target": "(A)",
    "arguments": [
      [
        "The following are multiple choice questions (with answers) about human aging.\n\nQ: Which of the following persons is more likely to remain at home alone, as of 2019?\n(A) An Asian man or woman (B) A Hispanic man (C) An African American woman (D) A white man or woman\nA:  (C)\n\nQ: The finding that adults tend to remember events from their adolescence better than from other periods in their lives is referred to as the\n(A) Adolescence advantage (B) Reminiscence bump (C) Memorial memorial (D) Quadratic retrieval spike\nA:  (B)\n\nQ: When older adults move to a new state after retirement, which of the following is the more likely destination?\n(A) Texas (B) California (C) Hawaii (D) Vermont\nA:  (A)\n\nQ: Which element in tobacco smoke is responsible for cancers?\n(A) Nicotine (B) Tar (C) Carbon monoxide (D) Smoke particles\nA:  (B)\n\nQ: All other things being equal, which of the following persons is more likely to show osteoporosis?\n(A) An older Hispanic American woman (B) An older African American woman (C) An older Asian American woman (D) An older Native American woman\nA:  (C)\n\nQ: Socioemotional selectivity theory says that older adults have smaller social networks because they\n(A) Are more concerned with those closest to them (B) Select new network members based on emotional factors (C) Can no longer get out to select new network members (D) Are too emotionally involved to spend time with others\nA: ",
        {
          "until": [
            "</s>"
          ]
        }
      ]
    ],
    "resps": [
      [
        "(D)"
      ]
    ],
    "filtered_resps": [
      "(D)"
    ],
    "exact_match": 0.0
  },
  {
    "doc_id": 111,
    "doc": {
      "question": "If links between various diseases are found, then future older adults will probably",
      "subject": "human_aging",
      "choices": [
        "Take fewer medications",
        "Be able to avoid certain diseases",
        "Pay far less for pharmaceuticals",
        "Pick and choose the disease(s) they want"
      ],
      "answer": 0
    },
    "target": "(A)",
    "arguments": [
      [
        "The following are multiple choice questions (with answers) about human aging.\n\nQ: Which of the following persons is more likely to remain at home alone, as of 2019?\n(A) An Asian man or woman (B) A Hispanic man (C) An African American woman (D) A white man or woman\nA:  (C)\n\nQ: Which element in tobacco smoke is responsible for cancers?\n(A) Nicotine (B) Tar (C) Carbon monoxide (D) Smoke particles\nA:  (B)\n\nQ: The finding that adults tend to remember events from their adolescence better than from other periods in their lives is referred to as the\n(A) Adolescence advantage (B) Reminiscence bump (C) Memorial memorial (D) Quadratic retrieval spike\nA:  (B)\n\nQ: All other things being equal, which of the following persons is more likely to show osteoporosis?\n(A) An older Hispanic American woman (B) An older African American woman (C) An older Asian American woman (D) An older Native American woman\nA:  (C)\n\nQ: When older adults move to a new state after retirement, which of the following is the more likely destination?\n(A) Texas (B) California (C) Hawaii (D) Vermont\nA:  (A)\n\nQ: If links between various diseases are found, then future older adults will probably\n(A) Take fewer medications (B) Be able to avoid certain diseases (C) Pay far less for pharmaceuticals (D) Pick and choose the disease(s) they want\nA: ",
        {
          "until": [
            "</s>"
          ]
        }
      ]
    ],
    "resps": [
      [
        "(B)"
      ]
    ],
    "filtered_resps": [
      "(B)"
    ],
    "exact_match": 0.0
  },
  {
    "doc_id": 119,
    "doc": {
      "question": "An example of an objective test of personality is the",
      "subject": "human_aging",
      "choices": [
        "TAT",
        "MMPI",
        "Rorschach ink blot test",
        "McAdams test of levels"
      ],
      "answer": 1
    },
    "target": "(B)",
    "arguments": [
      [
        "The following are multiple choice questions (with answers) about human aging.\n\nQ: When older adults move to a new state after retirement, which of the following is the more likely destination?\n(A) Texas (B) California (C) Hawaii (D) Vermont\nA:  (A)\n\nQ: The finding that adults tend to remember events from their adolescence better than from other periods in their lives is referred to as the\n(A) Adolescence advantage (B) Reminiscence bump (C) Memorial memorial (D) Quadratic retrieval spike\nA:  (B)\n\nQ: Which element in tobacco smoke is responsible for cancers?\n(A) Nicotine (B) Tar (C) Carbon monoxide (D) Smoke particles\nA:  (B)\n\nQ: Which of the following persons is more likely to remain at home alone, as of 2019?\n(A) An Asian man or woman (B) A Hispanic man (C) An African American woman (D) A white man or woman\nA:  (C)\n\nQ: All other things being equal, which of the following persons is more likely to show osteoporosis?\n(A) An older Hispanic American woman (B) An older African American woman (C) An older Asian American woman (D) An older Native American woman\nA:  (C)\n\nQ: An example of an objective test of personality is the\n(A) TAT (B) MMPI (C) Rorschach ink blot test (D) McAdams test of levels\nA: ",
        {
          "until": [
            "</s>"
          ]
        }
      ]
    ],
    "resps": [
      [
        "(A)"
      ]
    ],
    "filtered_resps": [
      "(A)"
    ],
    "exact_match": 0.0
  },
  {
    "doc_id": 127,
    "doc": {
      "question": "Before we can collect data from other human beings we must make sure that they",
      "subject": "human_aging",
      "choices": [
        "Have information that will be worth our effort to collect",
        "Are going to be honest and forthright",
        "Are informed about our study and give their consent to participate",
        "Have been granted permission to participate by the IRB"
      ],
      "answer": 2
    },
    "target": "(C)",
    "arguments": [
      [
        "The following are multiple choice questions (with answers) about human aging.\n\nQ: Which of the following persons is more likely to remain at home alone, as of 2019?\n(A) An Asian man or woman (B) A Hispanic man (C) An African American woman (D) A white man or woman\nA:  (C)\n\nQ: Which element in tobacco smoke is responsible for cancers?\n(A) Nicotine (B) Tar (C) Carbon monoxide (D) Smoke particles\nA:  (B)\n\nQ: The finding that adults tend to remember events from their adolescence better than from other periods in their lives is referred to as the\n(A) Adolescence advantage (B) Reminiscence bump (C) Memorial memorial (D) Quadratic retrieval spike\nA:  (B)\n\nQ: When older adults move to a new state after retirement, which of the following is the more likely destination?\n(A) Texas (B) California (C) Hawaii (D) Vermont\nA:  (A)\n\nQ: All other things being equal, which of the following persons is more likely to show osteoporosis?\n(A) An older Hispanic American woman (B) An older African American woman (C) An older Asian American woman (D) An older Native American woman\nA:  (C)\n\nQ: Before we can collect data from other human beings we must make sure that they\n(A) Have information that will be worth our effort to collect (B) Are going to be honest and forthright (C) Are informed about our study and give their consent to participate (D) Have been granted permission to participate by the IRB\nA: ",
        {
          "until": [
            "</s>"
          ]
        }
      ]
    ],
    "resps": [
      [
        "(A)"
      ]
    ],
    "filtered_resps": [
      "(A)"
    ],
    "exact_match": 0.0
  },
  {
    "doc_id": 135,
    "doc": {
      "question": "The slowing that occurs with advanced age appears to be centered in",
      "subject": "human_aging",
      "choices": [
        "The sense organs themselves",
        "The brain",
        "The muscle fibers",
        "The peripheral nervous system"
      ],
      "answer": 1
    },
    "target": "(B)",
    "arguments": [
      [
        "The following are multiple choice questions (with answers) about human aging.\n\nQ: All other things being equal, which of the following persons is more likely to show osteoporosis?\n(A) An older Hispanic American woman (B) An older African American woman (C) An older Asian American woman (D) An older Native American woman\nA:  (C)\n\nQ: Which element in tobacco smoke is responsible for cancers?\n(A) Nicotine (B) Tar (C) Carbon monoxide (D) Smoke particles\nA:  (B)\n\nQ: The finding that adults tend to remember events from their adolescence better than from other periods in their lives is referred to as the\n(A) Adolescence advantage (B) Reminiscence bump (C) Memorial memorial (D) Quadratic retrieval spike\nA:  (B)\n\nQ: Which of the following persons is more likely to remain at home alone, as of 2019?\n(A) An Asian man or woman (B) A Hispanic man (C) An African American woman (D) A white man or woman\nA:  (C)\n\nQ: When older adults move to a new state after retirement, which of the following is the more likely destination?\n(A) Texas (B) California (C) Hawaii (D) Vermont\nA:  (A)\n\nQ: The slowing that occurs with advanced age appears to be centered in\n(A) The sense organs themselves (B) The brain (C) The muscle fibers (D) The peripheral nervous system\nA: ",
        {
          "until": [
            "</s>"
          ]
        }
      ]
    ],
    "resps": [
      [
        "(B)"
      ]
    ],
    "filtered_resps": [
      "(B)"
    ],
    "exact_match": 1.0
  },
  {
    "doc_id": 143,
    "doc": {
      "question": "Workers in which of the following jobs still have mandatory retirements once they reach a certain age?",
      "subject": "human_aging",
      "choices": [
        "Cab drivers",
        "Fire fighters",
        "Insurance regulators",
        "Computer programmers"
      ],
      "answer": 1
    },
    "target": "(B)",
    "arguments": [
      [
        "The following are multiple choice questions (with answers) about human aging.\n\nQ: All other things being equal, which of the following persons is more likely to show osteoporosis?\n(A) An older Hispanic American woman (B) An older African American woman (C) An older Asian American woman (D) An older Native American woman\nA:  (C)\n\nQ: The finding that adults tend to remember events from their adolescence better than from other periods in their lives is referred to as the\n(A) Adolescence advantage (B) Reminiscence bump (C) Memorial memorial (D) Quadratic retrieval spike\nA:  (B)\n\nQ: Which element in tobacco smoke is responsible for cancers?\n(A) Nicotine (B) Tar (C) Carbon monoxide (D) Smoke particles\nA:  (B)\n\nQ: When older adults move to a new state after retirement, which of the following is the more likely destination?\n(A) Texas (B) California (C) Hawaii (D) Vermont\nA:  (A)\n\nQ: Which of the following persons is more likely to remain at home alone, as of 2019?\n(A) An Asian man or woman (B) A Hispanic man (C) An African American woman (D) A white man or woman\nA:  (C)\n\nQ: Workers in which of the following jobs still have mandatory retirements once they reach a certain age?\n(A) Cab drivers (B) Fire fighters (C) Insurance regulators (D) Computer programmers\nA: ",
        {
          "until": [
            "</s>"
          ]
        }
      ]
    ],
    "resps": [
      [
        "(C)"
      ]
    ],
    "filtered_resps": [
      "(C)"
    ],
    "exact_match": 0.0
  },
  {
    "doc_id": 151,
    "doc": {
      "question": "Even a small amount of sleep deprivation seems to",
      "subject": "human_aging",
      "choices": [
        "Increase weight",
        "Improve sleep quality",
        "Disrupt attention the next day",
        "Increase irritability"
      ],
      "answer": 1
    },
    "target": "(B)",
    "arguments": [
      [
        "The following are multiple choice questions (with answers) about human aging.\n\nQ: When older adults move to a new state after retirement, which of the following is the more likely destination?\n(A) Texas (B) California (C) Hawaii (D) Vermont\nA:  (A)\n\nQ: Which of the following persons is more likely to remain at home alone, as of 2019?\n(A) An Asian man or woman (B) A Hispanic man (C) An African American woman (D) A white man or woman\nA:  (C)\n\nQ: Which element in tobacco smoke is responsible for cancers?\n(A) Nicotine (B) Tar (C) Carbon monoxide (D) Smoke particles\nA:  (B)\n\nQ: The finding that adults tend to remember events from their adolescence better than from other periods in their lives is referred to as the\n(A) Adolescence advantage (B) Reminiscence bump (C) Memorial memorial (D) Quadratic retrieval spike\nA:  (B)\n\nQ: All other things being equal, which of the following persons is more likely to show osteoporosis?\n(A) An older Hispanic American woman (B) An older African American woman (C) An older Asian American woman (D) An older Native American woman\nA:  (C)\n\nQ: Even a small amount of sleep deprivation seems to\n(A) Increase weight (B) Improve sleep quality (C) Disrupt attention the next day (D) Increase irritability\nA: ",
        {
          "until": [
            "</s>"
          ]
        }
      ]
    ],
    "resps": [
      [
        "(D)"
      ]
    ],
    "filtered_resps": [
      "(D)"
    ],
    "exact_match": 0.0
  },
  {
    "doc_id": 159,
    "doc": {
      "question": "Which of the following does NOT increase the risk of falling?",
      "subject": "human_aging",
      "choices": [
        "Taking many prescription medications",
        "Visual impairment",
        "Having no emotional support",
        "A change in walking style or gait"
      ],
      "answer": 2
    },
    "target": "(C)",
    "arguments": [
      [
        "The following are multiple choice questions (with answers) about human aging.\n\nQ: Which of the following persons is more likely to remain at home alone, as of 2019?\n(A) An Asian man or woman (B) A Hispanic man (C) An African American woman (D) A white man or woman\nA:  (C)\n\nQ: All other things being equal, which of the following persons is more likely to show osteoporosis?\n(A) An older Hispanic American woman (B) An older African American woman (C) An older Asian American woman (D) An older Native American woman\nA:  (C)\n\nQ: The finding that adults tend to remember events from their adolescence better than from other periods in their lives is referred to as the\n(A) Adolescence advantage (B) Reminiscence bump (C) Memorial memorial (D) Quadratic retrieval spike\nA:  (B)\n\nQ: When older adults move to a new state after retirement, which of the following is the more likely destination?\n(A) Texas (B) California (C) Hawaii (D) Vermont\nA:  (A)\n\nQ: Which element in tobacco smoke is responsible for cancers?\n(A) Nicotine (B) Tar (C) Carbon monoxide (D) Smoke particles\nA:  (B)\n\nQ: Which of the following does NOT increase the risk of falling?\n(A) Taking many prescription medications (B) Visual impairment (C) Having no emotional support (D) A change in walking style or gait\nA: ",
        {
          "until": [
            "</s>"
          ]
        }
      ]
    ],
    "resps": [
      [
        "(D)"
      ]
    ],
    "filtered_resps": [
      "(D)"
    ],
    "exact_match": 0.0
  },
  {
    "doc_id": 167,
    "doc": {
      "question": "The law that requires all healthcare institutions that receive Medicaid funds to inform patients about advance directives is called the",
      "subject": "human_aging",
      "choices": [
        "Patient Self-Determination Act",
        "Informed Consent Act",
        "Advance Directive",
        "Medicaid Directive Information Act"
      ],
      "answer": 0
    },
    "target": "(A)",
    "arguments": [
      [
        "The following are multiple choice questions (with answers) about human aging.\n\nQ: The finding that adults tend to remember events from their adolescence better than from other periods in their lives is referred to as the\n(A) Adolescence advantage (B) Reminiscence bump (C) Memorial memorial (D) Quadratic retrieval spike\nA:  (B)\n\nQ: When older adults move to a new state after retirement, which of the following is the more likely destination?\n(A) Texas (B) California (C) Hawaii (D) Vermont\nA:  (A)\n\nQ: Which of the following persons is more likely to remain at home alone, as of 2019?\n(A) An Asian man or woman (B) A Hispanic man (C) An African American woman (D) A white man or woman\nA:  (C)\n\nQ: Which element in tobacco smoke is responsible for cancers?\n(A) Nicotine (B) Tar (C) Carbon monoxide (D) Smoke particles\nA:  (B)\n\nQ: All other things being equal, which of the following persons is more likely to show osteoporosis?\n(A) An older Hispanic American woman (B) An older African American woman (C) An older Asian American woman (D) An older Native American woman\nA:  (C)\n\nQ: The law that requires all healthcare institutions that receive Medicaid funds to inform patients about advance directives is called the\n(A) Patient Self-Determination Act (B) Informed Consent Act (C) Advance Directive (D) Medicaid Directive Information Act\nA: ",
        {
          "until": [
            "</s>"
          ]
        }
      ]
    ],
    "resps": [
      [
        "(D)"
      ]
    ],
    "filtered_resps": [
      "(D)"
    ],
    "exact_match": 0.0
  },
  {
    "doc_id": 175,
    "doc": {
      "question": "Older adults are most likely to be involved in a traffic accident when they are",
      "subject": "human_aging",
      "choices": [
        "On foot",
        "Driving in a new location",
        "A passenger in a younger person's car",
        "Alone"
      ],
      "answer": 0
    },
    "target": "(A)",
    "arguments": [
      [
        "The following are multiple choice questions (with answers) about human aging.\n\nQ: The finding that adults tend to remember events from their adolescence better than from other periods in their lives is referred to as the\n(A) Adolescence advantage (B) Reminiscence bump (C) Memorial memorial (D) Quadratic retrieval spike\nA:  (B)\n\nQ: When older adults move to a new state after retirement, which of the following is the more likely destination?\n(A) Texas (B) California (C) Hawaii (D) Vermont\nA:  (A)\n\nQ: All other things being equal, which of the following persons is more likely to show osteoporosis?\n(A) An older Hispanic American woman (B) An older African American woman (C) An older Asian American woman (D) An older Native American woman\nA:  (C)\n\nQ: Which of the following persons is more likely to remain at home alone, as of 2019?\n(A) An Asian man or woman (B) A Hispanic man (C) An African American woman (D) A white man or woman\nA:  (C)\n\nQ: Which element in tobacco smoke is responsible for cancers?\n(A) Nicotine (B) Tar (C) Carbon monoxide (D) Smoke particles\nA:  (B)\n\nQ: Older adults are most likely to be involved in a traffic accident when they are\n(A) On foot (B) Driving in a new location (C) A passenger in a younger person's car (D) Alone\nA: ",
        {
          "until": [
            "</s>"
          ]
        }
      ]
    ],
    "resps": [
      [
        "(B)"
      ]
    ],
    "filtered_resps": [
      "(B)"
    ],
    "exact_match": 0.0
  },
  {
    "doc_id": 183,
    "doc": {
      "question": "Which of the following is caused by a prion?",
      "subject": "human_aging",
      "choices": [
        "Vascular dementia",
        "Alzheimer's",
        "Creutzfeldt-Jakob",
        "Huntington's"
      ],
      "answer": 2
    },
    "target": "(C)",
    "arguments": [
      [
        "The following are multiple choice questions (with answers) about human aging.\n\nQ: Which element in tobacco smoke is responsible for cancers?\n(A) Nicotine (B) Tar (C) Carbon monoxide (D) Smoke particles\nA:  (B)\n\nQ: The finding that adults tend to remember events from their adolescence better than from other periods in their lives is referred to as the\n(A) Adolescence advantage (B) Reminiscence bump (C) Memorial memorial (D) Quadratic retrieval spike\nA:  (B)\n\nQ: Which of the following persons is more likely to remain at home alone, as of 2019?\n(A) An Asian man or woman (B) A Hispanic man (C) An African American woman (D) A white man or woman\nA:  (C)\n\nQ: All other things being equal, which of the following persons is more likely to show osteoporosis?\n(A) An older Hispanic American woman (B) An older African American woman (C) An older Asian American woman (D) An older Native American woman\nA:  (C)\n\nQ: When older adults move to a new state after retirement, which of the following is the more likely destination?\n(A) Texas (B) California (C) Hawaii (D) Vermont\nA:  (A)\n\nQ: Which of the following is caused by a prion?\n(A) Vascular dementia (B) Alzheimer's (C) Creutzfeldt-Jakob (D) Huntington's\nA: ",
        {
          "until": [
            "</s>"
          ]
        }
      ]
    ],
    "resps": [
      [
        "(B)"
      ]
    ],
    "filtered_resps": [
      "(B)"
    ],
    "exact_match": 0.0
  },
  {
    "doc_id": 191,
    "doc": {
      "question": "DNA damage/repair theory claims that senescence is due to cells getting incorrect instructions from DNA damaged by sources such as",
      "subject": "human_aging",
      "choices": [
        "Radiation from anti-oxidants",
        "Metabolic processes",
        "Free radicals and sunlight",
        "Telomerase"
      ],
      "answer": 2
    },
    "target": "(C)",
    "arguments": [
      [
        "The following are multiple choice questions (with answers) about human aging.\n\nQ: The finding that adults tend to remember events from their adolescence better than from other periods in their lives is referred to as the\n(A) Adolescence advantage (B) Reminiscence bump (C) Memorial memorial (D) Quadratic retrieval spike\nA:  (B)\n\nQ: Which of the following persons is more likely to remain at home alone, as of 2019?\n(A) An Asian man or woman (B) A Hispanic man (C) An African American woman (D) A white man or woman\nA:  (C)\n\nQ: When older adults move to a new state after retirement, which of the following is the more likely destination?\n(A) Texas (B) California (C) Hawaii (D) Vermont\nA:  (A)\n\nQ: All other things being equal, which of the following persons is more likely to show osteoporosis?\n(A) An older Hispanic American woman (B) An older African American woman (C) An older Asian American woman (D) An older Native American woman\nA:  (C)\n\nQ: Which element in tobacco smoke is responsible for cancers?\n(A) Nicotine (B) Tar (C) Carbon monoxide (D) Smoke particles\nA:  (B)\n\nQ: DNA damage/repair theory claims that senescence is due to cells getting incorrect instructions from DNA damaged by sources such as\n(A) Radiation from anti-oxidants (B) Metabolic processes (C) Free radicals and sunlight (D) Telomerase\nA: ",
        {
          "until": [
            "</s>"
          ]
        }
      ]
    ],
    "resps": [
      [
        "(D)"
      ]
    ],
    "filtered_resps": [
      "(D)"
    ],
    "exact_match": 0.0
  },
  {
    "doc_id": 199,
    "doc": {
      "question": "Older adults are able to improve their memories and reduce their anxiety about declining memory when",
      "subject": "human_aging",
      "choices": [
        "They learn about memory and aging and learn some techniques",
        "They simply learn a number of memory improvement techniques",
        "They learn that many aspects of memory do not decline and some even get better",
        "Older adults cannot do either of these"
      ],
      "answer": 0
    },
    "target": "(A)",
    "arguments": [
      [
        "The following are multiple choice questions (with answers) about human aging.\n\nQ: Which element in tobacco smoke is responsible for cancers?\n(A) Nicotine (B) Tar (C) Carbon monoxide (D) Smoke particles\nA:  (B)\n\nQ: Which of the following persons is more likely to remain at home alone, as of 2019?\n(A) An Asian man or woman (B) A Hispanic man (C) An African American woman (D) A white man or woman\nA:  (C)\n\nQ: When older adults move to a new state after retirement, which of the following is the more likely destination?\n(A) Texas (B) California (C) Hawaii (D) Vermont\nA:  (A)\n\nQ: The finding that adults tend to remember events from their adolescence better than from other periods in their lives is referred to as the\n(A) Adolescence advantage (B) Reminiscence bump (C) Memorial memorial (D) Quadratic retrieval spike\nA:  (B)\n\nQ: All other things being equal, which of the following persons is more likely to show osteoporosis?\n(A) An older Hispanic American woman (B) An older African American woman (C) An older Asian American woman (D) An older Native American woman\nA:  (C)\n\nQ: Older adults are able to improve their memories and reduce their anxiety about declining memory when\n(A) They learn about memory and aging and learn some techniques (B) They simply learn a number of memory improvement techniques (C) They learn that many aspects of memory do not decline and some even get better (D) Older adults cannot do either of these\nA: ",
        {
          "until": [
            "</s>"
          ]
        }
      ]
    ],
    "resps": [
      [
        "(B)"
      ]
    ],
    "filtered_resps": [
      "(B)"
    ],
    "exact_match": 0.0
  },
  {
    "doc_id": 207,
    "doc": {
      "question": "The paradox of well-being refers to the finding of high levels of happiness among",
      "subject": "human_aging",
      "choices": [
        "Unhappy people",
        "Older adults",
        "People with very low SES",
        "Terminally ill people"
      ],
      "answer": 1
    },
    "target": "(B)",
    "arguments": [
      [
        "The following are multiple choice questions (with answers) about human aging.\n\nQ: Which element in tobacco smoke is responsible for cancers?\n(A) Nicotine (B) Tar (C) Carbon monoxide (D) Smoke particles\nA:  (B)\n\nQ: The finding that adults tend to remember events from their adolescence better than from other periods in their lives is referred to as the\n(A) Adolescence advantage (B) Reminiscence bump (C) Memorial memorial (D) Quadratic retrieval spike\nA:  (B)\n\nQ: Which of the following persons is more likely to remain at home alone, as of 2019?\n(A) An Asian man or woman (B) A Hispanic man (C) An African American woman (D) A white man or woman\nA:  (C)\n\nQ: All other things being equal, which of the following persons is more likely to show osteoporosis?\n(A) An older Hispanic American woman (B) An older African American woman (C) An older Asian American woman (D) An older Native American woman\nA:  (C)\n\nQ: When older adults move to a new state after retirement, which of the following is the more likely destination?\n(A) Texas (B) California (C) Hawaii (D) Vermont\nA:  (A)\n\nQ: The paradox of well-being refers to the finding of high levels of happiness among\n(A) Unhappy people (B) Older adults (C) People with very low SES (D) Terminally ill people\nA: ",
        {
          "until": [
            "</s>"
          ]
        }
      ]
    ],
    "resps": [
      [
        "(B)"
      ]
    ],
    "filtered_resps": [
      "(B)"
    ],
    "exact_match": 1.0
  },
  {
    "doc_id": 215,
    "doc": {
      "question": "The term Baby Boom Generation refers to people who",
      "subject": "human_aging",
      "choices": [
        "Were born before WW II",
        "Have had an extraordinary number of offspring",
        "Were born right after WW II",
        "Have raised their children in small villages"
      ],
      "answer": 2
    },
    "target": "(C)",
    "arguments": [
      [
        "The following are multiple choice questions (with answers) about human aging.\n\nQ: Which element in tobacco smoke is responsible for cancers?\n(A) Nicotine (B) Tar (C) Carbon monoxide (D) Smoke particles\nA:  (B)\n\nQ: The finding that adults tend to remember events from their adolescence better than from other periods in their lives is referred to as the\n(A) Adolescence advantage (B) Reminiscence bump (C) Memorial memorial (D) Quadratic retrieval spike\nA:  (B)\n\nQ: All other things being equal, which of the following persons is more likely to show osteoporosis?\n(A) An older Hispanic American woman (B) An older African American woman (C) An older Asian American woman (D) An older Native American woman\nA:  (C)\n\nQ: Which of the following persons is more likely to remain at home alone, as of 2019?\n(A) An Asian man or woman (B) A Hispanic man (C) An African American woman (D) A white man or woman\nA:  (C)\n\nQ: When older adults move to a new state after retirement, which of the following is the more likely destination?\n(A) Texas (B) California (C) Hawaii (D) Vermont\nA:  (A)\n\nQ: The term Baby Boom Generation refers to people who\n(A) Were born before WW II (B) Have had an extraordinary number of offspring (C) Were born right after WW II (D) Have raised their children in small villages\nA: ",
        {
          "until": [
            "</s>"
          ]
        }
      ]
    ],
    "resps": [
      [
        "(B)"
      ]
    ],
    "filtered_resps": [
      "(B)"
    ],
    "exact_match": 0.0
  }
]