[
  {
    "doc_id": 0,
    "doc": {
      "question": "What is the structure of the United Nations Security Council?",
      "subject": "us_foreign_policy",
      "choices": [
        "5 permanent members with veto power, 10 rotating members with no veto power",
        "5 permanent members and 10 rotating members, all with veto power",
        "10 permanent members with veto power, and 5 rotating members without veto power",
        "15 permanent members with veto power"
      ],
      "answer": 0
    },
    "target": "(A)",
    "arguments": [
      [
        "The following are multiple choice questions (with answers) about us foreign policy.\n\nQ: How do Defensive Realism and Offensive Realism differ in their explanation of state behaviour?\n(A) Defensive realists place greater emphasis on the role of international institutions (B) Defensive realists place less emphasis on geographical factors (C) Offensive realists give more priority to the national interest than Defensive realists. (D) Defensive realists believe states are security maximizers, while Offensive realists believe states to be power maximizers\nA:  (D)\n\nQ: How did the 2008 financial crisis affect America's international reputation?\n(A) It damaged support for the US model of political economy and capitalism (B) It created anger at the United States for exaggerating the crisis (C) It increased support for American global leadership under President Obama (D) It reduced global use of the US dollar\nA:  (A)\n\nQ: How did Donald Trump attack globalization in the 2016 campaign?\n(A) Globalization had made men like him too rich (B) Globalization only benefited certain American states, such as New York (C) Liberal elites had encouraged globalization, while 'ordinary Americans' lost jobs because of it (D) Globalization encouraged damaging trade wars\nA:  (C)\n\nQ: The realm of policy decisions concerned primarily with relations between the United States and the rest of the world is known as\n(A) terrorism policy. (B) economic policy. (C) foreign policy. (D) international policy.\nA:  (C)\n\nQ: How did NSC-68 change U.S. strategy?\n(A) It globalized containment. (B) It militarized containment. (C) It called for the development of the hydrogen bomb. (D) All of the above\nA:  (D)\n\nQ: What is the structure of the United Nations Security Council?\n(A) 5 permanent members with veto power, 10 rotating members with no veto power (B) 5 permanent members and 10 rotating members, all with veto power (C) 10 permanent members with veto power, and 5 rotating members without veto power (D) 15 permanent members with veto power\nA: ",
        {
          "until": [
            "</s>"
          ]
        }
      ]
    ],
    "resps": [
      [
        "(C)"
      ]
    ],
    "filtered_resps": [
      "(C)"
    ],
    "exact_match": 0.0
  },
  {
    "doc_id": 8,
    "doc": {
      "question": "How did World War I shift economic power from Europe to the United States?",
      "subject": "us_foreign_policy",
      "choices": [
        "The war reduced European population levels below that of the United States",
        "The United States seized German resources after the war",
        "European countries paid the United States for assistance",
        "The United States became a creditor country and financial centre, with European war spending boosting the US economy"
      ],
      "answer": 3
    },
    "target": "(D)",
    "arguments": [
      [
        "The following are multiple choice questions (with answers) about us foreign policy.\n\nQ: How did the 2008 financial crisis affect America's international reputation?\n(A) It damaged support for the US model of political economy and capitalism (B) It created anger at the United States for exaggerating the crisis (C) It increased support for American global leadership under President Obama (D) It reduced global use of the US dollar\nA:  (A)\n\nQ: How did Donald Trump attack globalization in the 2016 campaign?\n(A) Globalization had made men like him too rich (B) Globalization only benefited certain American states, such as New York (C) Liberal elites had encouraged globalization, while 'ordinary Americans' lost jobs because of it (D) Globalization encouraged damaging trade wars\nA:  (C)\n\nQ: How did NSC-68 change U.S. strategy?\n(A) It globalized containment. (B) It militarized containment. (C) It called for the development of the hydrogen bomb. (D) All of the above\nA:  (D)\n\nQ: How do Defensive Realism and Offensive Realism differ in their explanation of state behaviour?\n(A) Defensive realists place greater emphasis on the role of international institutions (B) Defensive realists place less emphasis on geographical factors (C) Offensive realists give more priority to the national interest than Defensive realists. (D) Defensive realists believe states are security maximizers, while Offensive realists believe states to be power maximizers\nA:  (D)\n\nQ: The realm of policy decisions concerned primarily with relations between the United States and the rest of the world is known as\n(A) terrorism policy. (B) economic policy. (C) foreign policy. (D) international policy.\nA:  (C)\n\nQ: How did World War I shift economic power from Europe to the United States?\n(A) The war reduced European population levels below that of the United States (B) The United States seized German resources after the war (C) European countries paid the United States for assistance (D) The United States became a creditor country and financial centre, with European war spending boosting the US economy\nA: ",
        {
          "until": [
            "</s>"
          ]
        }
      ]
    ],
    "resps": [
      [
        "(D)"
      ]
    ],
    "filtered_resps": [
      "(D)"
    ],
    "exact_match": 1.0
  },
  {
    "doc_id": 16,
    "doc": {
      "question": "What were the 'open-door notes'?",
      "subject": "us_foreign_policy",
      "choices": [
        "An American declaration that the US was always open to Chinese immigration",
        "An American proclamation that China should be divided up between the US, Japan and the European empires",
        "An American proclamation that China should be open to US trade and missionaries",
        "An American declaration of support for Chinese economic protectionism"
      ],
      "answer": 2
    },
    "target": "(C)",
    "arguments": [
      [
        "The following are multiple choice questions (with answers) about us foreign policy.\n\nQ: How did the 2008 financial crisis affect America's international reputation?\n(A) It damaged support for the US model of political economy and capitalism (B) It created anger at the United States for exaggerating the crisis (C) It increased support for American global leadership under President Obama (D) It reduced global use of the US dollar\nA:  (A)\n\nQ: How did Donald Trump attack globalization in the 2016 campaign?\n(A) Globalization had made men like him too rich (B) Globalization only benefited certain American states, such as New York (C) Liberal elites had encouraged globalization, while 'ordinary Americans' lost jobs because of it (D) Globalization encouraged damaging trade wars\nA:  (C)\n\nQ: How did NSC-68 change U.S. strategy?\n(A) It globalized containment. (B) It militarized containment. (C) It called for the development of the hydrogen bomb. (D) All of the above\nA:  (D)\n\nQ: The realm of policy decisions concerned primarily with relations between the United States and the rest of the world is known as\n(A) terrorism policy. (B) economic policy. (C) foreign policy. (D) international policy.\nA:  (C)\n\nQ: How do Defensive Realism and Offensive Realism differ in their explanation of state behaviour?\n(A) Defensive realists place greater emphasis on the role of international institutions (B) Defensive realists place less emphasis on geographical factors (C) Offensive realists give more priority to the national interest than Defensive realists. (D) Defensive realists believe states are security maximizers, while Offensive realists believe states to be power maximizers\nA:  (D)\n\nQ: What were the 'open-door notes'?\n(A) An American declaration that the US was always open to Chinese immigration (B) An American proclamation that China should be divided up between the US, Japan and the European empires (C) An American proclamation that China should be open to US trade and missionaries (D) An American declaration of support for Chinese economic protectionism\nA: ",
        {
          "until": [
            "</s>"
          ]
        }
      ]
    ],
    "resps": [
      [
        "(C)"
      ]
    ],
    "filtered_resps": [
      "(C)"
    ],
    "exact_match": 1.0
  },
  {
    "doc_id": 24,
    "doc": {
      "question": "Who said \"Globalization is not something we can hold off or turn off. It is the economic equivalent of a force of nature-like wind or water\"?",
      "subject": "us_foreign_policy",
      "choices": [
        "Ronald Reagan",
        "George Soros",
        "Bill Clinton",
        "George W. Bush"
      ],
      "answer": 2
    },
    "target": "(C)",
    "arguments": [
      [
        "The following are multiple choice questions (with answers) about us foreign policy.\n\nQ: How did NSC-68 change U.S. strategy?\n(A) It globalized containment. (B) It militarized containment. (C) It called for the development of the hydrogen bomb. (D) All of the above\nA:  (D)\n\nQ: How did the 2008 financial crisis affect America's international reputation?\n(A) It damaged support for the US model of political economy and capitalism (B) It created anger at the United States for exaggerating the crisis (C) It increased support for American global leadership under President Obama (D) It reduced global use of the US dollar\nA:  (A)\n\nQ: How do Defensive Realism and Offensive Realism differ in their explanation of state behaviour?\n(A) Defensive realists place greater emphasis on the role of international institutions (B) Defensive realists place less emphasis on geographical factors (C) Offensive realists give more priority to the national interest than Defensive realists. (D) Defensive realists believe states are security maximizers, while Offensive realists believe states to be power maximizers\nA:  (D)\n\nQ: The realm of policy decisions concerned primarily with relations between the United States and the rest of the world is known as\n(A) terrorism policy. (B) economic policy. (C) foreign policy. (D) international policy.\nA:  (C)\n\nQ: How did Donald Trump attack globalization in the 2016 campaign?\n(A) Globalization had made men like him too rich (B) Globalization only benefited certain American states, such as New York (C) Liberal elites had encouraged globalization, while 'ordinary Americans' lost jobs because of it (D) Globalization encouraged damaging trade wars\nA:  (C)\n\nQ: Who said \"Globalization is not something we can hold off or turn off. It is the economic equivalent of a force of nature-like wind or water\"?\n(A) Ronald Reagan (B) George Soros (C) Bill Clinton (D) George W. Bush\nA: ",
        {
          "until": [
            "</s>"
          ]
        }
      ]
    ],
    "resps": [
      [
        "(A)"
      ]
    ],
    "filtered_resps": [
      "(A)"
    ],
    "exact_match": 0.0
  },
  {
    "doc_id": 32,
    "doc": {
      "question": "Which of the following are possible constraints on US foreign policy decision making?",
      "subject": "us_foreign_policy",
      "choices": [
        "Foreign policies of other states",
        "International law",
        "Intergovernmental organizations",
        "All of the above"
      ],
      "answer": 3
    },
    "target": "(D)",
    "arguments": [
      [
        "The following are multiple choice questions (with answers) about us foreign policy.\n\nQ: How did Donald Trump attack globalization in the 2016 campaign?\n(A) Globalization had made men like him too rich (B) Globalization only benefited certain American states, such as New York (C) Liberal elites had encouraged globalization, while 'ordinary Americans' lost jobs because of it (D) Globalization encouraged damaging trade wars\nA:  (C)\n\nQ: How do Defensive Realism and Offensive Realism differ in their explanation of state behaviour?\n(A) Defensive realists place greater emphasis on the role of international institutions (B) Defensive realists place less emphasis on geographical factors (C) Offensive realists give more priority to the national interest than Defensive realists. (D) Defensive realists believe states are security maximizers, while Offensive realists believe states to be power maximizers\nA:  (D)\n\nQ: How did the 2008 financial crisis affect America's international reputation?\n(A) It damaged support for the US model of political economy and capitalism (B) It created anger at the United States for exaggerating the crisis (C) It increased support for American global leadership under President Obama (D) It reduced global use of the US dollar\nA:  (A)\n\nQ: The realm of policy decisions concerned primarily with relations between the United States and the rest of the world is known as\n(A) terrorism policy. (B) economic policy. (C) foreign policy. (D) international policy.\nA:  (C)\n\nQ: How did NSC-68 change U.S. strategy?\n(A) It globalized containment. (B) It militarized containment. (C) It called for the development of the hydrogen bomb. (D) All of the above\nA:  (D)\n\nQ: Which of the following are possible constraints on US foreign policy decision making?\n(A) Foreign policies of other states (B) International law (C) Intergovernmental organizations (D) All of the above\nA: ",
        {
          "until": [
            "</s>"
          ]
        }
      ]
    ],
    "resps": [
      [
        "(D)"
      ]
    ],
    "filtered_resps": [
      "(D)"
    ],
    "exact_match": 1.0
  },
  {
    "doc_id": 40,
    "doc": {
      "question": "According to realists, what is the fundamental difference between the international system and the domestic system?",
      "subject": "us_foreign_policy",
      "choices": [
        "Armed conflict",
        "Anarchy",
        "Institutions",
        "No common language"
      ],
      "answer": 1
    },
    "target": "(B)",
    "arguments": [
      [
        "The following are multiple choice questions (with answers) about us foreign policy.\n\nQ: How did the 2008 financial crisis affect America's international reputation?\n(A) It damaged support for the US model of political economy and capitalism (B) It created anger at the United States for exaggerating the crisis (C) It increased support for American global leadership under President Obama (D) It reduced global use of the US dollar\nA:  (A)\n\nQ: How did Donald Trump attack globalization in the 2016 campaign?\n(A) Globalization had made men like him too rich (B) Globalization only benefited certain American states, such as New York (C) Liberal elites had encouraged globalization, while 'ordinary Americans' lost jobs because of it (D) Globalization encouraged damaging trade wars\nA:  (C)\n\nQ: The realm of policy decisions concerned primarily with relations between the United States and the rest of the world is known as\n(A) terrorism policy. (B) economic policy. (C) foreign policy. (D) international policy.\nA:  (C)\n\nQ: How do Defensive Realism and Offensive Realism differ in their explanation of state behaviour?\n(A) Defensive realists place greater emphasis on the role of international institutions (B) Defensive realists place less emphasis on geographical factors (C) Offensive realists give more priority to the national interest than Defensive realists. (D) Defensive realists believe states are security maximizers, while Offensive realists believe states to be power maximizers\nA:  (D)\n\nQ: How did NSC-68 change U.S. strategy?\n(A) It globalized containment. (B) It militarized containment. (C) It called for the development of the hydrogen bomb. (D) All of the above\nA:  (D)\n\nQ: According to realists, what is the fundamental difference between the international system and the domestic system?\n(A) Armed conflict (B) Anarchy (C) Institutions (D) No common language\nA: ",
        {
          "until": [
            "</s>"
          ]
        }
      ]
    ],
    "resps": [
      [
        "(C)"
      ]
    ],
    "filtered_resps": [
      "(C)"
    ],
    "exact_match": 0.0
  },
  {
    "doc_id": 48,
    "doc": {
      "question": "The departments of the executive branch that assist the president in designing and carrying out U.S. foreign policy are known as",
      "subject": "us_foreign_policy",
      "choices": [
        "the United Nations.",
        "the National Security Council.",
        "the State Department.",
        "the National Security Agency."
      ],
      "answer": 2
    },
    "target": "(C)",
    "arguments": [
      [
        "The following are multiple choice questions (with answers) about us foreign policy.\n\nQ: How did Donald Trump attack globalization in the 2016 campaign?\n(A) Globalization had made men like him too rich (B) Globalization only benefited certain American states, such as New York (C) Liberal elites had encouraged globalization, while 'ordinary Americans' lost jobs because of it (D) Globalization encouraged damaging trade wars\nA:  (C)\n\nQ: How did the 2008 financial crisis affect America's international reputation?\n(A) It damaged support for the US model of political economy and capitalism (B) It created anger at the United States for exaggerating the crisis (C) It increased support for American global leadership under President Obama (D) It reduced global use of the US dollar\nA:  (A)\n\nQ: The realm of policy decisions concerned primarily with relations between the United States and the rest of the world is known as\n(A) terrorism policy. (B) economic policy. (C) foreign policy. (D) international policy.\nA:  (C)\n\nQ: How did NSC-68 change U.S. strategy?\n(A) It globalized containment. (B) It militarized containment. (C) It called for the development of the hydrogen bomb. (D) All of the above\nA:  (D)\n\nQ: How do Defensive Realism and Offensive Realism differ in their explanation of state behaviour?\n(A) Defensive realists place greater emphasis on the role of international institutions (B) Defensive realists place less emphasis on geographical factors (C) Offensive realists give more priority to the national interest than Defensive realists. (D) Defensive realists believe states are security maximizers, while Offensive realists believe states to be power maximizers\nA:  (D)\n\nQ: The departments of the executive branch that assist the president in designing and carrying out U.S. foreign policy are known as\n(A) the United Nations. (B) the National Security Council. (C) the State Department. (D) the National Security Agency.\nA: ",
        {
          "until": [
            "</s>"
          ]
        }
      ]
    ],
    "resps": [
      [
        "(C)"
      ]
    ],
    "filtered_resps": [
      "(C)"
    ],
    "exact_match": 1.0
  },
  {
    "doc_id": 56,
    "doc": {
      "question": "What was meant by the term 'American multiplication table'?",
      "subject": "us_foreign_policy",
      "choices": [
        "Increase in the US population",
        "Increase in US finances",
        "Increase in US military capability",
        "Increase in US international influence"
      ],
      "answer": 0
    },
    "target": "(A)",
    "arguments": [
      [
        "The following are multiple choice questions (with answers) about us foreign policy.\n\nQ: The realm of policy decisions concerned primarily with relations between the United States and the rest of the world is known as\n(A) terrorism policy. (B) economic policy. (C) foreign policy. (D) international policy.\nA:  (C)\n\nQ: How did Donald Trump attack globalization in the 2016 campaign?\n(A) Globalization had made men like him too rich (B) Globalization only benefited certain American states, such as New York (C) Liberal elites had encouraged globalization, while 'ordinary Americans' lost jobs because of it (D) Globalization encouraged damaging trade wars\nA:  (C)\n\nQ: How did the 2008 financial crisis affect America's international reputation?\n(A) It damaged support for the US model of political economy and capitalism (B) It created anger at the United States for exaggerating the crisis (C) It increased support for American global leadership under President Obama (D) It reduced global use of the US dollar\nA:  (A)\n\nQ: How do Defensive Realism and Offensive Realism differ in their explanation of state behaviour?\n(A) Defensive realists place greater emphasis on the role of international institutions (B) Defensive realists place less emphasis on geographical factors (C) Offensive realists give more priority to the national interest than Defensive realists. (D) Defensive realists believe states are security maximizers, while Offensive realists believe states to be power maximizers\nA:  (D)\n\nQ: How did NSC-68 change U.S. strategy?\n(A) It globalized containment. (B) It militarized containment. (C) It called for the development of the hydrogen bomb. (D) All of the above\nA:  (D)\n\nQ: What was meant by the term 'American multiplication table'?\n(A) Increase in the US population (B) Increase in US finances (C) Increase in US military capability (D) Increase in US international influence\nA: ",
        {
          "until": [
            "</s>"
          ]
        }
      ]
    ],
    "resps": [
      [
        "(D)"
      ]
    ],
    "filtered_resps": [
      "(D)"
    ],
    "exact_match": 0.0
  },
  {
    "doc_id": 64,
    "doc": {
      "question": "How many states in the international system are likely to have nuclear weapons right now?",
      "subject": "us_foreign_policy",
      "choices": [
        "Fewer than 7",
        "Between 8 and 15",
        "Between 16 and 25",
        "More than 25"
      ],
      "answer": 1
    },
    "target": "(B)",
    "arguments": [
      [
        "The following are multiple choice questions (with answers) about us foreign policy.\n\nQ: How did Donald Trump attack globalization in the 2016 campaign?\n(A) Globalization had made men like him too rich (B) Globalization only benefited certain American states, such as New York (C) Liberal elites had encouraged globalization, while 'ordinary Americans' lost jobs because of it (D) Globalization encouraged damaging trade wars\nA:  (C)\n\nQ: How did the 2008 financial crisis affect America's international reputation?\n(A) It damaged support for the US model of political economy and capitalism (B) It created anger at the United States for exaggerating the crisis (C) It increased support for American global leadership under President Obama (D) It reduced global use of the US dollar\nA:  (A)\n\nQ: The realm of policy decisions concerned primarily with relations between the United States and the rest of the world is known as\n(A) terrorism policy. (B) economic policy. (C) foreign policy. (D) international policy.\nA:  (C)\n\nQ: How do Defensive Realism and Offensive Realism differ in their explanation of state behaviour?\n(A) Defensive realists place greater emphasis on the role of international institutions (B) Defensive realists place less emphasis on geographical factors (C) Offensive realists give more priority to the national interest than Defensive realists. (D) Defensive realists believe states are security maximizers, while Offensive realists believe states to be power maximizers\nA:  (D)\n\nQ: How did NSC-68 change U.S. strategy?\n(A) It globalized containment. (B) It militarized containment. (C) It called for the development of the hydrogen bomb. (D) All of the above\nA:  (D)\n\nQ: How many states in the international system are likely to have nuclear weapons right now?\n(A) Fewer than 7 (B) Between 8 and 15 (C) Between 16 and 25 (D) More than 25\nA: ",
        {
          "until": [
            "</s>"
          ]
        }
      ]
    ],
    "resps": [
      [
        "(D)"
      ]
    ],
    "filtered_resps": [
      "(D)"
    ],
    "exact_match": 0.0
  },
  {
    "doc_id": 72,
    "doc": {
      "question": "What did Paul Kennedy argue in his book The Rise and Fall of the Great Powers?",
      "subject": "us_foreign_policy",
      "choices": [
        "All of the world's leading economies were declining due to low growth and inflation",
        "The United States could no longer remain a superpower and was in decline",
        "The soft power of the United States would allow it to avoid decline",
        "The rise of Japan had been exaggerated"
      ],
      "answer": 1
    },
    "target": "(B)",
    "arguments": [
      [
        "The following are multiple choice questions (with answers) about us foreign policy.\n\nQ: The realm of policy decisions concerned primarily with relations between the United States and the rest of the world is known as\n(A) terrorism policy. (B) economic policy. (C) foreign policy. (D) international policy.\nA:  (C)\n\nQ: How did NSC-68 change U.S. strategy?\n(A) It globalized containment. (B) It militarized containment. (C) It called for the development of the hydrogen bomb. (D) All of the above\nA:  (D)\n\nQ: How did Donald Trump attack globalization in the 2016 campaign?\n(A) Globalization had made men like him too rich (B) Globalization only benefited certain American states, such as New York (C) Liberal elites had encouraged globalization, while 'ordinary Americans' lost jobs because of it (D) Globalization encouraged damaging trade wars\nA:  (C)\n\nQ: How do Defensive Realism and Offensive Realism differ in their explanation of state behaviour?\n(A) Defensive realists place greater emphasis on the role of international institutions (B) Defensive realists place less emphasis on geographical factors (C) Offensive realists give more priority to the national interest than Defensive realists. (D) Defensive realists believe states are security maximizers, while Offensive realists believe states to be power maximizers\nA:  (D)\n\nQ: How did the 2008 financial crisis affect America's international reputation?\n(A) It damaged support for the US model of political economy and capitalism (B) It created anger at the United States for exaggerating the crisis (C) It increased support for American global leadership under President Obama (D) It reduced global use of the US dollar\nA:  (A)\n\nQ: What did Paul Kennedy argue in his book The Rise and Fall of the Great Powers?\n(A) All of the world's leading economies were declining due to low growth and inflation (B) The United States could no longer remain a superpower and was in decline (C) The soft power of the United States would allow it to avoid decline (D) The rise of Japan had been exaggerated\nA: ",
        {
          "until": [
            "</s>"
          ]
        }
      ]
    ],
    "resps": [
      [
        "(B)"
      ]
    ],
    "filtered_resps": [
      "(B)"
    ],
    "exact_match": 1.0
  },
  {
    "doc_id": 80,
    "doc": {
      "question": "What was a main organizational change proposed by the 9/11 Commission with regard to the U.S. intelligence community?",
      "subject": "us_foreign_policy",
      "choices": [
        "Creation of the Department of Homeland Security",
        "Moving the Department of Defense Intelligence Agencies to the CIA for better coordination",
        "Creation of the National Intelligence Director",
        "Moving the domestic intelligence component of the FBI to the CIA"
      ],
      "answer": 2
    },
    "target": "(C)",
    "arguments": [
      [
        "The following are multiple choice questions (with answers) about us foreign policy.\n\nQ: How did NSC-68 change U.S. strategy?\n(A) It globalized containment. (B) It militarized containment. (C) It called for the development of the hydrogen bomb. (D) All of the above\nA:  (D)\n\nQ: How did the 2008 financial crisis affect America's international reputation?\n(A) It damaged support for the US model of political economy and capitalism (B) It created anger at the United States for exaggerating the crisis (C) It increased support for American global leadership under President Obama (D) It reduced global use of the US dollar\nA:  (A)\n\nQ: How do Defensive Realism and Offensive Realism differ in their explanation of state behaviour?\n(A) Defensive realists place greater emphasis on the role of international institutions (B) Defensive realists place less emphasis on geographical factors (C) Offensive realists give more priority to the national interest than Defensive realists. (D) Defensive realists believe states are security maximizers, while Offensive realists believe states to be power maximizers\nA:  (D)\n\nQ: How did Donald Trump attack globalization in the 2016 campaign?\n(A) Globalization had made men like him too rich (B) Globalization only benefited certain American states, such as New York (C) Liberal elites had encouraged globalization, while 'ordinary Americans' lost jobs because of it (D) Globalization encouraged damaging trade wars\nA:  (C)\n\nQ: The realm of policy decisions concerned primarily with relations between the United States and the rest of the world is known as\n(A) terrorism policy. (B) economic policy. (C) foreign policy. (D) international policy.\nA:  (C)\n\nQ: What was a main organizational change proposed by the 9/11 Commission with regard to the U.S. intelligence community?\n(A) Creation of the Department of Homeland Security (B) Moving the Department of Defense Intelligence Agencies to the CIA for better coordination (C) Creation of the National Intelligence Director (D) Moving the domestic intelligence component of the FBI to the CIA\nA: ",
        {
          "until": [
            "</s>"
          ]
        }
      ]
    ],
    "resps": [
      [
        "(C)"
      ]
    ],
    "filtered_resps": [
      "(C)"
    ],
    "exact_match": 1.0
  },
  {
    "doc_id": 88,
    "doc": {
      "question": "How did the relationship between President and Congress develop under George H.W. Bush and Bill Clinton?",
      "subject": "us_foreign_policy",
      "choices": [
        "Congress asserted its primacy in foreign policy",
        "US foreign policy became substantially decentralized",
        "The Presidency welcomed the influence of Congress",
        "None of the above"
      ],
      "answer": 3
    },
    "target": "(D)",
    "arguments": [
      [
        "The following are multiple choice questions (with answers) about us foreign policy.\n\nQ: How did the 2008 financial crisis affect America's international reputation?\n(A) It damaged support for the US model of political economy and capitalism (B) It created anger at the United States for exaggerating the crisis (C) It increased support for American global leadership under President Obama (D) It reduced global use of the US dollar\nA:  (A)\n\nQ: How did NSC-68 change U.S. strategy?\n(A) It globalized containment. (B) It militarized containment. (C) It called for the development of the hydrogen bomb. (D) All of the above\nA:  (D)\n\nQ: How did Donald Trump attack globalization in the 2016 campaign?\n(A) Globalization had made men like him too rich (B) Globalization only benefited certain American states, such as New York (C) Liberal elites had encouraged globalization, while 'ordinary Americans' lost jobs because of it (D) Globalization encouraged damaging trade wars\nA:  (C)\n\nQ: The realm of policy decisions concerned primarily with relations between the United States and the rest of the world is known as\n(A) terrorism policy. (B) economic policy. (C) foreign policy. (D) international policy.\nA:  (C)\n\nQ: How do Defensive Realism and Offensive Realism differ in their explanation of state behaviour?\n(A) Defensive realists place greater emphasis on the role of international institutions (B) Defensive realists place less emphasis on geographical factors (C) Offensive realists give more priority to the national interest than Defensive realists. (D) Defensive realists believe states are security maximizers, while Offensive realists believe states to be power maximizers\nA:  (D)\n\nQ: How did the relationship between President and Congress develop under George H.W. Bush and Bill Clinton?\n(A) Congress asserted its primacy in foreign policy (B) US foreign policy became substantially decentralized (C) The Presidency welcomed the influence of Congress (D) None of the above\nA: ",
        {
          "until": [
            "</s>"
          ]
        }
      ]
    ],
    "resps": [
      [
        "(B)"
      ]
    ],
    "filtered_resps": [
      "(B)"
    ],
    "exact_match": 0.0
  },
  {
    "doc_id": 96,
    "doc": {
      "question": "What was 'democratic enlargement'?",
      "subject": "us_foreign_policy",
      "choices": [
        "A proposal for reform of the US system of government",
        "A proposal for the extension of democratic rule globally",
        "A proposal for the extension of free markets",
        "Both b and c"
      ],
      "answer": 3
    },
    "target": "(D)",
    "arguments": [
      [
        "The following are multiple choice questions (with answers) about us foreign policy.\n\nQ: How did the 2008 financial crisis affect America's international reputation?\n(A) It damaged support for the US model of political economy and capitalism (B) It created anger at the United States for exaggerating the crisis (C) It increased support for American global leadership under President Obama (D) It reduced global use of the US dollar\nA:  (A)\n\nQ: How did NSC-68 change U.S. strategy?\n(A) It globalized containment. (B) It militarized containment. (C) It called for the development of the hydrogen bomb. (D) All of the above\nA:  (D)\n\nQ: The realm of policy decisions concerned primarily with relations between the United States and the rest of the world is known as\n(A) terrorism policy. (B) economic policy. (C) foreign policy. (D) international policy.\nA:  (C)\n\nQ: How do Defensive Realism and Offensive Realism differ in their explanation of state behaviour?\n(A) Defensive realists place greater emphasis on the role of international institutions (B) Defensive realists place less emphasis on geographical factors (C) Offensive realists give more priority to the national interest than Defensive realists. (D) Defensive realists believe states are security maximizers, while Offensive realists believe states to be power maximizers\nA:  (D)\n\nQ: How did Donald Trump attack globalization in the 2016 campaign?\n(A) Globalization had made men like him too rich (B) Globalization only benefited certain American states, such as New York (C) Liberal elites had encouraged globalization, while 'ordinary Americans' lost jobs because of it (D) Globalization encouraged damaging trade wars\nA:  (C)\n\nQ: What was 'democratic enlargement'?\n(A) A proposal for reform of the US system of government (B) A proposal for the extension of democratic rule globally (C) A proposal for the extension of free markets (D) Both b and c\nA: ",
        {
          "until": [
            "</s>"
          ]
        }
      ]
    ],
    "resps": [
      [
        "(B)"
      ]
    ],
    "filtered_resps": [
      "(B)"
    ],
    "exact_match": 0.0
  },
  {
    "doc_id": 1,
    "doc": {
      "question": "What was the significance of the Gulf of Tonkin resolution?",
      "subject": "us_foreign_policy",
      "choices": [
        "It allowed the US to intensify its involvement in Vietnam",
        "It illustrated the influence of public opinion on US foreign policy",
        "It enhanced Congressional control over the Vietnam War",
        "It curtailed US involvement in Vietnam"
      ],
      "answer": 0
    },
    "target": "(A)",
    "arguments": [
      [
        "The following are multiple choice questions (with answers) about us foreign policy.\n\nQ: How do Defensive Realism and Offensive Realism differ in their explanation of state behaviour?\n(A) Defensive realists place greater emphasis on the role of international institutions (B) Defensive realists place less emphasis on geographical factors (C) Offensive realists give more priority to the national interest than Defensive realists. (D) Defensive realists believe states are security maximizers, while Offensive realists believe states to be power maximizers\nA:  (D)\n\nQ: How did the 2008 financial crisis affect America's international reputation?\n(A) It damaged support for the US model of political economy and capitalism (B) It created anger at the United States for exaggerating the crisis (C) It increased support for American global leadership under President Obama (D) It reduced global use of the US dollar\nA:  (A)\n\nQ: How did Donald Trump attack globalization in the 2016 campaign?\n(A) Globalization had made men like him too rich (B) Globalization only benefited certain American states, such as New York (C) Liberal elites had encouraged globalization, while 'ordinary Americans' lost jobs because of it (D) Globalization encouraged damaging trade wars\nA:  (C)\n\nQ: The realm of policy decisions concerned primarily with relations between the United States and the rest of the world is known as\n(A) terrorism policy. (B) economic policy. (C) foreign policy. (D) international policy.\nA:  (C)\n\nQ: How did NSC-68 change U.S. strategy?\n(A) It globalized containment. (B) It militarized containment. (C) It called for the development of the hydrogen bomb. (D) All of the above\nA:  (D)\n\nQ: What was the significance of the Gulf of Tonkin resolution?\n(A) It allowed the US to intensify its involvement in Vietnam (B) It illustrated the influence of public opinion on US foreign policy (C) It enhanced Congressional control over the Vietnam War (D) It curtailed US involvement in Vietnam\nA: ",
        {
          "until": [
            "</s>"
          ]
        }
      ]
    ],
    "resps": [
      [
        "(B)"
      ]
    ],
    "filtered_resps": [
      "(B)"
    ],
    "exact_match": 0.0
  },
  {
    "doc_id": 9,
    "doc": {
      "question": "In American government, the power to declare war rests with",
      "subject": "us_foreign_policy",
      "choices": [
        "the president of the United States.",
        "the secretary of defense.",
        "the chairman of the Joint Chiefs of Staff.",
        "Congress."
      ],
      "answer": 3
    },
    "target": "(D)",
    "arguments": [
      [
        "The following are multiple choice questions (with answers) about us foreign policy.\n\nQ: How did the 2008 financial crisis affect America's international reputation?\n(A) It damaged support for the US model of political economy and capitalism (B) It created anger at the United States for exaggerating the crisis (C) It increased support for American global leadership under President Obama (D) It reduced global use of the US dollar\nA:  (A)\n\nQ: How did Donald Trump attack globalization in the 2016 campaign?\n(A) Globalization had made men like him too rich (B) Globalization only benefited certain American states, such as New York (C) Liberal elites had encouraged globalization, while 'ordinary Americans' lost jobs because of it (D) Globalization encouraged damaging trade wars\nA:  (C)\n\nQ: How did NSC-68 change U.S. strategy?\n(A) It globalized containment. (B) It militarized containment. (C) It called for the development of the hydrogen bomb. (D) All of the above\nA:  (D)\n\nQ: How do Defensive Realism and Offensive Realism differ in their explanation of state behaviour?\n(A) Defensive realists place greater emphasis on the role of international institutions (B) Defensive realists place less emphasis on geographical factors (C) Offensive realists give more priority to the national interest than Defensive realists. (D) Defensive realists believe states are security maximizers, while Offensive realists believe states to be power maximizers\nA:  (D)\n\nQ: The realm of policy decisions concerned primarily with relations between the United States and the rest of the world is known as\n(A) terrorism policy. (B) economic policy. (C) foreign policy. (D) international policy.\nA:  (C)\n\nQ: In American government, the power to declare war rests with\n(A) the president of the United States. (B) the secretary of defense. (C) the chairman of the Joint Chiefs of Staff. (D) Congress.\nA: ",
        {
          "until": [
            "</s>"
          ]
        }
      ]
    ],
    "resps": [
      [
        "(A)"
      ]
    ],
    "filtered_resps": [
      "(A)"
    ],
    "exact_match": 0.0
  },
  {
    "doc_id": 17,
    "doc": {
      "question": "International trade will almost always benefit both countries, so why do countries try to protect their own firms from exposure to the world market?",
      "subject": "us_foreign_policy",
      "choices": [
        "Irrationality on the part of the leadership",
        "Costs of free trade are concentrated, but benefits are dispersed",
        "Regime type",
        "International conflict prevents trade"
      ],
      "answer": 1
    },
    "target": "(B)",
    "arguments": [
      [
        "The following are multiple choice questions (with answers) about us foreign policy.\n\nQ: How did the 2008 financial crisis affect America's international reputation?\n(A) It damaged support for the US model of political economy and capitalism (B) It created anger at the United States for exaggerating the crisis (C) It increased support for American global leadership under President Obama (D) It reduced global use of the US dollar\nA:  (A)\n\nQ: How did Donald Trump attack globalization in the 2016 campaign?\n(A) Globalization had made men like him too rich (B) Globalization only benefited certain American states, such as New York (C) Liberal elites had encouraged globalization, while 'ordinary Americans' lost jobs because of it (D) Globalization encouraged damaging trade wars\nA:  (C)\n\nQ: How did NSC-68 change U.S. strategy?\n(A) It globalized containment. (B) It militarized containment. (C) It called for the development of the hydrogen bomb. (D) All of the above\nA:  (D)\n\nQ: The realm of policy decisions concerned primarily with relations between the United States and the rest of the world is known as\n(A) terrorism policy. (B) economic policy. (C) foreign policy. (D) international policy.\nA:  (C)\n\nQ: How do Defensive Realism and Offensive Realism differ in their explanation of state behaviour?\n(A) Defensive realists place greater emphasis on the role of international institutions (B) Defensive realists place less emphasis on geographical factors (C) Offensive realists give more priority to the national interest than Defensive realists. (D) Defensive realists believe states are security maximizers, while Offensive realists believe states to be power maximizers\nA:  (D)\n\nQ: International trade will almost always benefit both countries, so why do countries try to protect their own firms from exposure to the world market?\n(A) Irrationality on the part of the leadership (B) Costs of free trade are concentrated, but benefits are dispersed (C) Regime type (D) International conflict prevents trade\nA: ",
        {
          "until": [
            "</s>"
          ]
        }
      ]
    ],
    "resps": [
      [
        "(B)"
      ]
    ],
    "filtered_resps": [
      "(B)"
    ],
    "exact_match": 1.0
  },
  {
    "doc_id": 25,
    "doc": {
      "question": "The idea that war is \"the continuation of politics by other means\" helps to capture",
      "subject": "us_foreign_policy",
      "choices": [
        "diplomacy is the quietest instrument of influence in global politics.",
        "the way political parties fight with each other.",
        "the idea that governments use their military to help pursue policy goals.",
        "the way Democrats and Republicans differ over the war in Iraq."
      ],
      "answer": 2
    },
    "target": "(C)",
    "arguments": [
      [
        "The following are multiple choice questions (with answers) about us foreign policy.\n\nQ: How did NSC-68 change U.S. strategy?\n(A) It globalized containment. (B) It militarized containment. (C) It called for the development of the hydrogen bomb. (D) All of the above\nA:  (D)\n\nQ: How did the 2008 financial crisis affect America's international reputation?\n(A) It damaged support for the US model of political economy and capitalism (B) It created anger at the United States for exaggerating the crisis (C) It increased support for American global leadership under President Obama (D) It reduced global use of the US dollar\nA:  (A)\n\nQ: How do Defensive Realism and Offensive Realism differ in their explanation of state behaviour?\n(A) Defensive realists place greater emphasis on the role of international institutions (B) Defensive realists place less emphasis on geographical factors (C) Offensive realists give more priority to the national interest than Defensive realists. (D) Defensive realists believe states are security maximizers, while Offensive realists believe states to be power maximizers\nA:  (D)\n\nQ: The realm of policy decisions concerned primarily with relations between the United States and the rest of the world is known as\n(A) terrorism policy. (B) economic policy. (C) foreign policy. (D) international policy.\nA:  (C)\n\nQ: How did Donald Trump attack globalization in the 2016 campaign?\n(A) Globalization had made men like him too rich (B) Globalization only benefited certain American states, such as New York (C) Liberal elites had encouraged globalization, while 'ordinary Americans' lost jobs because of it (D) Globalization encouraged damaging trade wars\nA:  (C)\n\nQ: The idea that war is \"the continuation of politics by other means\" helps to capture\n(A) diplomacy is the quietest instrument of influence in global politics. (B) the way political parties fight with each other. (C) the idea that governments use their military to help pursue policy goals. (D) the way Democrats and Republicans differ over the war in Iraq.\nA: ",
        {
          "until": [
            "</s>"
          ]
        }
      ]
    ],
    "resps": [
      [
        "(B)"
      ]
    ],
    "filtered_resps": [
      "(B)"
    ],
    "exact_match": 0.0
  },
  {
    "doc_id": 33,
    "doc": {
      "question": "What is direct diplomacy?",
      "subject": "us_foreign_policy",
      "choices": [
        "Members of Congress negotiating directly with foreign governments",
        "Face-to-face meetings between state leaders",
        "The president consulting Congress on foreign policy issues",
        "Bilateral talks that do not involve a third-party negotiator"
      ],
      "answer": 0
    },
    "target": "(A)",
    "arguments": [
      [
        "The following are multiple choice questions (with answers) about us foreign policy.\n\nQ: How did Donald Trump attack globalization in the 2016 campaign?\n(A) Globalization had made men like him too rich (B) Globalization only benefited certain American states, such as New York (C) Liberal elites had encouraged globalization, while 'ordinary Americans' lost jobs because of it (D) Globalization encouraged damaging trade wars\nA:  (C)\n\nQ: How do Defensive Realism and Offensive Realism differ in their explanation of state behaviour?\n(A) Defensive realists place greater emphasis on the role of international institutions (B) Defensive realists place less emphasis on geographical factors (C) Offensive realists give more priority to the national interest than Defensive realists. (D) Defensive realists believe states are security maximizers, while Offensive realists believe states to be power maximizers\nA:  (D)\n\nQ: How did the 2008 financial crisis affect America's international reputation?\n(A) It damaged support for the US model of political economy and capitalism (B) It created anger at the United States for exaggerating the crisis (C) It increased support for American global leadership under President Obama (D) It reduced global use of the US dollar\nA:  (A)\n\nQ: The realm of policy decisions concerned primarily with relations between the United States and the rest of the world is known as\n(A) terrorism policy. (B) economic policy. (C) foreign policy. (D) international policy.\nA:  (C)\n\nQ: How did NSC-68 change U.S. strategy?\n(A) It globalized containment. (B) It militarized containment. (C) It called for the development of the hydrogen bomb. (D) All of the above\nA:  (D)\n\nQ: What is direct diplomacy?\n(A) Members of Congress negotiating directly with foreign governments (B) Face-to-face meetings between state leaders (C) The president consulting Congress on foreign policy issues (D) Bilateral talks that do not involve a third-party negotiator\nA: ",
        {
          "until": [
            "</s>"
          ]
        }
      ]
    ],
    "resps": [
      [
        "(D)"
      ]
    ],
    "filtered_resps": [
      "(D)"
    ],
    "exact_match": 0.0
  },
  {
    "doc_id": 41,
    "doc": {
      "question": "Which is NOT a reason for why intergovernmental organizations are ineffective at promoting human rights?",
      "subject": "us_foreign_policy",
      "choices": [
        "These organizations merely identify those states who already support human rights",
        "They cannot get enough information about which leaders will abuse their citizens",
        "These organizations have little ability to constrain abusive leaders",
        "None of the above"
      ],
      "answer": 1
    },
    "target": "(B)",
    "arguments": [
      [
        "The following are multiple choice questions (with answers) about us foreign policy.\n\nQ: How did the 2008 financial crisis affect America's international reputation?\n(A) It damaged support for the US model of political economy and capitalism (B) It created anger at the United States for exaggerating the crisis (C) It increased support for American global leadership under President Obama (D) It reduced global use of the US dollar\nA:  (A)\n\nQ: How did Donald Trump attack globalization in the 2016 campaign?\n(A) Globalization had made men like him too rich (B) Globalization only benefited certain American states, such as New York (C) Liberal elites had encouraged globalization, while 'ordinary Americans' lost jobs because of it (D) Globalization encouraged damaging trade wars\nA:  (C)\n\nQ: The realm of policy decisions concerned primarily with relations between the United States and the rest of the world is known as\n(A) terrorism policy. (B) economic policy. (C) foreign policy. (D) international policy.\nA:  (C)\n\nQ: How do Defensive Realism and Offensive Realism differ in their explanation of state behaviour?\n(A) Defensive realists place greater emphasis on the role of international institutions (B) Defensive realists place less emphasis on geographical factors (C) Offensive realists give more priority to the national interest than Defensive realists. (D) Defensive realists believe states are security maximizers, while Offensive realists believe states to be power maximizers\nA:  (D)\n\nQ: How did NSC-68 change U.S. strategy?\n(A) It globalized containment. (B) It militarized containment. (C) It called for the development of the hydrogen bomb. (D) All of the above\nA:  (D)\n\nQ: Which is NOT a reason for why intergovernmental organizations are ineffective at promoting human rights?\n(A) These organizations merely identify those states who already support human rights (B) They cannot get enough information about which leaders will abuse their citizens (C) These organizations have little ability to constrain abusive leaders (D) None of the above\nA: ",
        {
          "until": [
            "</s>"
          ]
        }
      ]
    ],
    "resps": [
      [
        "(D)"
      ]
    ],
    "filtered_resps": [
      "(D)"
    ],
    "exact_match": 0.0
  },
  {
    "doc_id": 49,
    "doc": {
      "question": "The largest increase in peacetime defense spending in American history occurred under which president?",
      "subject": "us_foreign_policy",
      "choices": [
        "Jimmy Carter",
        "Ronald Reagan",
        "Bill Clinton",
        "Dwight Eisenhower"
      ],
      "answer": 1
    },
    "target": "(B)",
    "arguments": [
      [
        "The following are multiple choice questions (with answers) about us foreign policy.\n\nQ: How did Donald Trump attack globalization in the 2016 campaign?\n(A) Globalization had made men like him too rich (B) Globalization only benefited certain American states, such as New York (C) Liberal elites had encouraged globalization, while 'ordinary Americans' lost jobs because of it (D) Globalization encouraged damaging trade wars\nA:  (C)\n\nQ: How did the 2008 financial crisis affect America's international reputation?\n(A) It damaged support for the US model of political economy and capitalism (B) It created anger at the United States for exaggerating the crisis (C) It increased support for American global leadership under President Obama (D) It reduced global use of the US dollar\nA:  (A)\n\nQ: The realm of policy decisions concerned primarily with relations between the United States and the rest of the world is known as\n(A) terrorism policy. (B) economic policy. (C) foreign policy. (D) international policy.\nA:  (C)\n\nQ: How did NSC-68 change U.S. strategy?\n(A) It globalized containment. (B) It militarized containment. (C) It called for the development of the hydrogen bomb. (D) All of the above\nA:  (D)\n\nQ: How do Defensive Realism and Offensive Realism differ in their explanation of state behaviour?\n(A) Defensive realists place greater emphasis on the role of international institutions (B) Defensive realists place less emphasis on geographical factors (C) Offensive realists give more priority to the national interest than Defensive realists. (D) Defensive realists believe states are security maximizers, while Offensive realists believe states to be power maximizers\nA:  (D)\n\nQ: The largest increase in peacetime defense spending in American history occurred under which president?\n(A) Jimmy Carter (B) Ronald Reagan (C) Bill Clinton (D) Dwight Eisenhower\nA: ",
        {
          "until": [
            "</s>"
          ]
        }
      ]
    ],
    "resps": [
      [
        "(B)"
      ]
    ],
    "filtered_resps": [
      "(B)"
    ],
    "exact_match": 1.0
  },
  {
    "doc_id": 57,
    "doc": {
      "question": "Global and regional international trade agreements work by using which of the following mechanisms?",
      "subject": "us_foreign_policy",
      "choices": [
        "Reciprocity across multiple issues",
        "Reputational concerns of the actors",
        "Side payments for adjusting to the organization (such as the Common Agricultural Policy in the EU)",
        "ALL of the above"
      ],
      "answer": 3
    },
    "target": "(D)",
    "arguments": [
      [
        "The following are multiple choice questions (with answers) about us foreign policy.\n\nQ: The realm of policy decisions concerned primarily with relations between the United States and the rest of the world is known as\n(A) terrorism policy. (B) economic policy. (C) foreign policy. (D) international policy.\nA:  (C)\n\nQ: How did Donald Trump attack globalization in the 2016 campaign?\n(A) Globalization had made men like him too rich (B) Globalization only benefited certain American states, such as New York (C) Liberal elites had encouraged globalization, while 'ordinary Americans' lost jobs because of it (D) Globalization encouraged damaging trade wars\nA:  (C)\n\nQ: How did the 2008 financial crisis affect America's international reputation?\n(A) It damaged support for the US model of political economy and capitalism (B) It created anger at the United States for exaggerating the crisis (C) It increased support for American global leadership under President Obama (D) It reduced global use of the US dollar\nA:  (A)\n\nQ: How do Defensive Realism and Offensive Realism differ in their explanation of state behaviour?\n(A) Defensive realists place greater emphasis on the role of international institutions (B) Defensive realists place less emphasis on geographical factors (C) Offensive realists give more priority to the national interest than Defensive realists. (D) Defensive realists believe states are security maximizers, while Offensive realists believe states to be power maximizers\nA:  (D)\n\nQ: How did NSC-68 change U.S. strategy?\n(A) It globalized containment. (B) It militarized containment. (C) It called for the development of the hydrogen bomb. (D) All of the above\nA:  (D)\n\nQ: Global and regional international trade agreements work by using which of the following mechanisms?\n(A) Reciprocity across multiple issues (B) Reputational concerns of the actors (C) Side payments for adjusting to the organization (such as the Common Agricultural Policy in the EU) (D) ALL of the above\nA: ",
        {
          "until": [
            "</s>"
          ]
        }
      ]
    ],
    "resps": [
      [
        "(D)"
      ]
    ],
    "filtered_resps": [
      "(D)"
    ],
    "exact_match": 1.0
  },
  {
    "doc_id": 65,
    "doc": {
      "question": "Why is NSC 68 seen as a turning point in US Cold War Foreign policy?",
      "subject": "us_foreign_policy",
      "choices": [
        "It indicated the primacy of economic containment",
        "It indicated a desire to engage with the Soviet Union",
        "It indicated a shift towards military containment",
        "It dispensed with the idea of containment"
      ],
      "answer": 2
    },
    "target": "(C)",
    "arguments": [
      [
        "The following are multiple choice questions (with answers) about us foreign policy.\n\nQ: How did Donald Trump attack globalization in the 2016 campaign?\n(A) Globalization had made men like him too rich (B) Globalization only benefited certain American states, such as New York (C) Liberal elites had encouraged globalization, while 'ordinary Americans' lost jobs because of it (D) Globalization encouraged damaging trade wars\nA:  (C)\n\nQ: How did the 2008 financial crisis affect America's international reputation?\n(A) It damaged support for the US model of political economy and capitalism (B) It created anger at the United States for exaggerating the crisis (C) It increased support for American global leadership under President Obama (D) It reduced global use of the US dollar\nA:  (A)\n\nQ: The realm of policy decisions concerned primarily with relations between the United States and the rest of the world is known as\n(A) terrorism policy. (B) economic policy. (C) foreign policy. (D) international policy.\nA:  (C)\n\nQ: How do Defensive Realism and Offensive Realism differ in their explanation of state behaviour?\n(A) Defensive realists place greater emphasis on the role of international institutions (B) Defensive realists place less emphasis on geographical factors (C) Offensive realists give more priority to the national interest than Defensive realists. (D) Defensive realists believe states are security maximizers, while Offensive realists believe states to be power maximizers\nA:  (D)\n\nQ: How did NSC-68 change U.S. strategy?\n(A) It globalized containment. (B) It militarized containment. (C) It called for the development of the hydrogen bomb. (D) All of the above\nA:  (D)\n\nQ: Why is NSC 68 seen as a turning point in US Cold War Foreign policy?\n(A) It indicated the primacy of economic containment (B) It indicated a desire to engage with the Soviet Union (C) It indicated a shift towards military containment (D) It dispensed with the idea of containment\nA: ",
        {
          "until": [
            "</s>"
          ]
        }
      ]
    ],
    "resps": [
      [
        "(C)"
      ]
    ],
    "filtered_resps": [
      "(C)"
    ],
    "exact_match": 1.0
  },
  {
    "doc_id": 73,
    "doc": {
      "question": "The Joint Chiefs of Staff is made up of",
      "subject": "us_foreign_policy",
      "choices": [
        "the critical domestic and foreign policy advisers to the president.",
        "foreign policy advisers who meet with the president daily.",
        "the commanding officers of each branch of the armed services, along with a chairperson and vice chairperson.",
        "the highest-ranking generals in the U.S. Army."
      ],
      "answer": 2
    },
    "target": "(C)",
    "arguments": [
      [
        "The following are multiple choice questions (with answers) about us foreign policy.\n\nQ: The realm of policy decisions concerned primarily with relations between the United States and the rest of the world is known as\n(A) terrorism policy. (B) economic policy. (C) foreign policy. (D) international policy.\nA:  (C)\n\nQ: How did NSC-68 change U.S. strategy?\n(A) It globalized containment. (B) It militarized containment. (C) It called for the development of the hydrogen bomb. (D) All of the above\nA:  (D)\n\nQ: How did Donald Trump attack globalization in the 2016 campaign?\n(A) Globalization had made men like him too rich (B) Globalization only benefited certain American states, such as New York (C) Liberal elites had encouraged globalization, while 'ordinary Americans' lost jobs because of it (D) Globalization encouraged damaging trade wars\nA:  (C)\n\nQ: How do Defensive Realism and Offensive Realism differ in their explanation of state behaviour?\n(A) Defensive realists place greater emphasis on the role of international institutions (B) Defensive realists place less emphasis on geographical factors (C) Offensive realists give more priority to the national interest than Defensive realists. (D) Defensive realists believe states are security maximizers, while Offensive realists believe states to be power maximizers\nA:  (D)\n\nQ: How did the 2008 financial crisis affect America's international reputation?\n(A) It damaged support for the US model of political economy and capitalism (B) It created anger at the United States for exaggerating the crisis (C) It increased support for American global leadership under President Obama (D) It reduced global use of the US dollar\nA:  (A)\n\nQ: The Joint Chiefs of Staff is made up of\n(A) the critical domestic and foreign policy advisers to the president. (B) foreign policy advisers who meet with the president daily. (C) the commanding officers of each branch of the armed services, along with a chairperson and vice chairperson. (D) the highest-ranking generals in the U.S. Army.\nA: ",
        {
          "until": [
            "</s>"
          ]
        }
      ]
    ],
    "resps": [
      [
        "(D)"
      ]
    ],
    "filtered_resps": [
      "(D)"
    ],
    "exact_match": 0.0
  },
  {
    "doc_id": 81,
    "doc": {
      "question": "The government body formed to coordinate American foreign and military policy is known as",
      "subject": "us_foreign_policy",
      "choices": [
        "the National Security Council.",
        "the Pentagon.",
        "the Defense Policy Institute.",
        "the Joint Chiefs of Staff."
      ],
      "answer": 0
    },
    "target": "(A)",
    "arguments": [
      [
        "The following are multiple choice questions (with answers) about us foreign policy.\n\nQ: How did NSC-68 change U.S. strategy?\n(A) It globalized containment. (B) It militarized containment. (C) It called for the development of the hydrogen bomb. (D) All of the above\nA:  (D)\n\nQ: How did the 2008 financial crisis affect America's international reputation?\n(A) It damaged support for the US model of political economy and capitalism (B) It created anger at the United States for exaggerating the crisis (C) It increased support for American global leadership under President Obama (D) It reduced global use of the US dollar\nA:  (A)\n\nQ: How do Defensive Realism and Offensive Realism differ in their explanation of state behaviour?\n(A) Defensive realists place greater emphasis on the role of international institutions (B) Defensive realists place less emphasis on geographical factors (C) Offensive realists give more priority to the national interest than Defensive realists. (D) Defensive realists believe states are security maximizers, while Offensive realists believe states to be power maximizers\nA:  (D)\n\nQ: How did Donald Trump attack globalization in the 2016 campaign?\n(A) Globalization had made men like him too rich (B) Globalization only benefited certain American states, such as New York (C) Liberal elites had encouraged globalization, while 'ordinary Americans' lost jobs because of it (D) Globalization encouraged damaging trade wars\nA:  (C)\n\nQ: The realm of policy decisions concerned primarily with relations between the United States and the rest of the world is known as\n(A) terrorism policy. (B) economic policy. (C) foreign policy. (D) international policy.\nA:  (C)\n\nQ: The government body formed to coordinate American foreign and military policy is known as\n(A) the National Security Council. (B) the Pentagon. (C) the Defense Policy Institute. (D) the Joint Chiefs of Staff.\nA: ",
        {
          "until": [
            "</s>"
          ]
        }
      ]
    ],
    "resps": [
      [
        "(B)"
      ]
    ],
    "filtered_resps": [
      "(B)"
    ],
    "exact_match": 0.0
  },
  {
    "doc_id": 89,
    "doc": {
      "question": "Which of the following points supports the argument for American unilateralism?",
      "subject": "us_foreign_policy",
      "choices": [
        "Benevolent hegemony",
        "Ineffectiveness of multilateralism",
        "American power",
        "All of the above"
      ],
      "answer": 3
    },
    "target": "(D)",
    "arguments": [
      [
        "The following are multiple choice questions (with answers) about us foreign policy.\n\nQ: How did the 2008 financial crisis affect America's international reputation?\n(A) It damaged support for the US model of political economy and capitalism (B) It created anger at the United States for exaggerating the crisis (C) It increased support for American global leadership under President Obama (D) It reduced global use of the US dollar\nA:  (A)\n\nQ: How did NSC-68 change U.S. strategy?\n(A) It globalized containment. (B) It militarized containment. (C) It called for the development of the hydrogen bomb. (D) All of the above\nA:  (D)\n\nQ: How did Donald Trump attack globalization in the 2016 campaign?\n(A) Globalization had made men like him too rich (B) Globalization only benefited certain American states, such as New York (C) Liberal elites had encouraged globalization, while 'ordinary Americans' lost jobs because of it (D) Globalization encouraged damaging trade wars\nA:  (C)\n\nQ: The realm of policy decisions concerned primarily with relations between the United States and the rest of the world is known as\n(A) terrorism policy. (B) economic policy. (C) foreign policy. (D) international policy.\nA:  (C)\n\nQ: How do Defensive Realism and Offensive Realism differ in their explanation of state behaviour?\n(A) Defensive realists place greater emphasis on the role of international institutions (B) Defensive realists place less emphasis on geographical factors (C) Offensive realists give more priority to the national interest than Defensive realists. (D) Defensive realists believe states are security maximizers, while Offensive realists believe states to be power maximizers\nA:  (D)\n\nQ: Which of the following points supports the argument for American unilateralism?\n(A) Benevolent hegemony (B) Ineffectiveness of multilateralism (C) American power (D) All of the above\nA: ",
        {
          "until": [
            "</s>"
          ]
        }
      ]
    ],
    "resps": [
      [
        "(D)"
      ]
    ],
    "filtered_resps": [
      "(D)"
    ],
    "exact_match": 1.0
  },
  {
    "doc_id": 97,
    "doc": {
      "question": "What is meant by the phrase 'empire by invitation'?",
      "subject": "us_foreign_policy",
      "choices": [
        "Voluntary reliance on an external power for security",
        "Willful openness to colonization",
        "Cultural imperialism",
        "Open advocacy of imperialism for economic gain"
      ],
      "answer": 0
    },
    "target": "(A)",
    "arguments": [
      [
        "The following are multiple choice questions (with answers) about us foreign policy.\n\nQ: How did the 2008 financial crisis affect America's international reputation?\n(A) It damaged support for the US model of political economy and capitalism (B) It created anger at the United States for exaggerating the crisis (C) It increased support for American global leadership under President Obama (D) It reduced global use of the US dollar\nA:  (A)\n\nQ: How did NSC-68 change U.S. strategy?\n(A) It globalized containment. (B) It militarized containment. (C) It called for the development of the hydrogen bomb. (D) All of the above\nA:  (D)\n\nQ: The realm of policy decisions concerned primarily with relations between the United States and the rest of the world is known as\n(A) terrorism policy. (B) economic policy. (C) foreign policy. (D) international policy.\nA:  (C)\n\nQ: How do Defensive Realism and Offensive Realism differ in their explanation of state behaviour?\n(A) Defensive realists place greater emphasis on the role of international institutions (B) Defensive realists place less emphasis on geographical factors (C) Offensive realists give more priority to the national interest than Defensive realists. (D) Defensive realists believe states are security maximizers, while Offensive realists believe states to be power maximizers\nA:  (D)\n\nQ: How did Donald Trump attack globalization in the 2016 campaign?\n(A) Globalization had made men like him too rich (B) Globalization only benefited certain American states, such as New York (C) Liberal elites had encouraged globalization, while 'ordinary Americans' lost jobs because of it (D) Globalization encouraged damaging trade wars\nA:  (C)\n\nQ: What is meant by the phrase 'empire by invitation'?\n(A) Voluntary reliance on an external power for security (B) Willful openness to colonization (C) Cultural imperialism (D) Open advocacy of imperialism for economic gain\nA: ",
        {
          "until": [
            "</s>"
          ]
        }
      ]
    ],
    "resps": [
      [
        "(B)"
      ]
    ],
    "filtered_resps": [
      "(B)"
    ],
    "exact_match": 0.0
  },
  {
    "doc_id": 2,
    "doc": {
      "question": "Which is not a nonstate actor that poses a threat to the United States?",
      "subject": "us_foreign_policy",
      "choices": [
        "Terrorists",
        "Organized crime",
        "Drug traffickers",
        "China"
      ],
      "answer": 3
    },
    "target": "(D)",
    "arguments": [
      [
        "The following are multiple choice questions (with answers) about us foreign policy.\n\nQ: How do Defensive Realism and Offensive Realism differ in their explanation of state behaviour?\n(A) Defensive realists place greater emphasis on the role of international institutions (B) Defensive realists place less emphasis on geographical factors (C) Offensive realists give more priority to the national interest than Defensive realists. (D) Defensive realists believe states are security maximizers, while Offensive realists believe states to be power maximizers\nA:  (D)\n\nQ: How did the 2008 financial crisis affect America's international reputation?\n(A) It damaged support for the US model of political economy and capitalism (B) It created anger at the United States for exaggerating the crisis (C) It increased support for American global leadership under President Obama (D) It reduced global use of the US dollar\nA:  (A)\n\nQ: How did Donald Trump attack globalization in the 2016 campaign?\n(A) Globalization had made men like him too rich (B) Globalization only benefited certain American states, such as New York (C) Liberal elites had encouraged globalization, while 'ordinary Americans' lost jobs because of it (D) Globalization encouraged damaging trade wars\nA:  (C)\n\nQ: The realm of policy decisions concerned primarily with relations between the United States and the rest of the world is known as\n(A) terrorism policy. (B) economic policy. (C) foreign policy. (D) international policy.\nA:  (C)\n\nQ: How did NSC-68 change U.S. strategy?\n(A) It globalized containment. (B) It militarized containment. (C) It called for the development of the hydrogen bomb. (D) All of the above\nA:  (D)\n\nQ: Which is not a nonstate actor that poses a threat to the United States?\n(A) Terrorists (B) Organized crime (C) Drug traffickers (D) China\nA: ",
        {
          "until": [
            "</s>"
          ]
        }
      ]
    ],
    "resps": [
      [
        "(D)"
      ]
    ],
    "filtered_resps": [
      "(D)"
    ],
    "exact_match": 1.0
  },
  {
    "doc_id": 10,
    "doc": {
      "question": "How did the Cold War context shape US perceptions of the Third World?",
      "subject": "us_foreign_policy",
      "choices": [
        "The US ignored the Third World",
        "Local developments were viewed through a geopolitical lens",
        "The US unreservedly supported decolonization",
        "None of the above"
      ],
      "answer": 1
    },
    "target": "(B)",
    "arguments": [
      [
        "The following are multiple choice questions (with answers) about us foreign policy.\n\nQ: How did the 2008 financial crisis affect America's international reputation?\n(A) It damaged support for the US model of political economy and capitalism (B) It created anger at the United States for exaggerating the crisis (C) It increased support for American global leadership under President Obama (D) It reduced global use of the US dollar\nA:  (A)\n\nQ: How did Donald Trump attack globalization in the 2016 campaign?\n(A) Globalization had made men like him too rich (B) Globalization only benefited certain American states, such as New York (C) Liberal elites had encouraged globalization, while 'ordinary Americans' lost jobs because of it (D) Globalization encouraged damaging trade wars\nA:  (C)\n\nQ: How did NSC-68 change U.S. strategy?\n(A) It globalized containment. (B) It militarized containment. (C) It called for the development of the hydrogen bomb. (D) All of the above\nA:  (D)\n\nQ: How do Defensive Realism and Offensive Realism differ in their explanation of state behaviour?\n(A) Defensive realists place greater emphasis on the role of international institutions (B) Defensive realists place less emphasis on geographical factors (C) Offensive realists give more priority to the national interest than Defensive realists. (D) Defensive realists believe states are security maximizers, while Offensive realists believe states to be power maximizers\nA:  (D)\n\nQ: The realm of policy decisions concerned primarily with relations between the United States and the rest of the world is known as\n(A) terrorism policy. (B) economic policy. (C) foreign policy. (D) international policy.\nA:  (C)\n\nQ: How did the Cold War context shape US perceptions of the Third World?\n(A) The US ignored the Third World (B) Local developments were viewed through a geopolitical lens (C) The US unreservedly supported decolonization (D) None of the above\nA: ",
        {
          "until": [
            "</s>"
          ]
        }
      ]
    ],
    "resps": [
      [
        "(B)"
      ]
    ],
    "filtered_resps": [
      "(B)"
    ],
    "exact_match": 1.0
  },
  {
    "doc_id": 18,
    "doc": {
      "question": "Why did George H.W. Bush allow Saddam Hussein to remain in power after the Gulf War of 1991?",
      "subject": "us_foreign_policy",
      "choices": [
        "Lack of US firepower",
        "Concern over oil supplies",
        "Limited UN mandate and fear of a protracted conflict",
        "Difficult terrain and fear of civilian casualties"
      ],
      "answer": 2
    },
    "target": "(C)",
    "arguments": [
      [
        "The following are multiple choice questions (with answers) about us foreign policy.\n\nQ: How did the 2008 financial crisis affect America's international reputation?\n(A) It damaged support for the US model of political economy and capitalism (B) It created anger at the United States for exaggerating the crisis (C) It increased support for American global leadership under President Obama (D) It reduced global use of the US dollar\nA:  (A)\n\nQ: How did Donald Trump attack globalization in the 2016 campaign?\n(A) Globalization had made men like him too rich (B) Globalization only benefited certain American states, such as New York (C) Liberal elites had encouraged globalization, while 'ordinary Americans' lost jobs because of it (D) Globalization encouraged damaging trade wars\nA:  (C)\n\nQ: How did NSC-68 change U.S. strategy?\n(A) It globalized containment. (B) It militarized containment. (C) It called for the development of the hydrogen bomb. (D) All of the above\nA:  (D)\n\nQ: The realm of policy decisions concerned primarily with relations between the United States and the rest of the world is known as\n(A) terrorism policy. (B) economic policy. (C) foreign policy. (D) international policy.\nA:  (C)\n\nQ: How do Defensive Realism and Offensive Realism differ in their explanation of state behaviour?\n(A) Defensive realists place greater emphasis on the role of international institutions (B) Defensive realists place less emphasis on geographical factors (C) Offensive realists give more priority to the national interest than Defensive realists. (D) Defensive realists believe states are security maximizers, while Offensive realists believe states to be power maximizers\nA:  (D)\n\nQ: Why did George H.W. Bush allow Saddam Hussein to remain in power after the Gulf War of 1991?\n(A) Lack of US firepower (B) Concern over oil supplies (C) Limited UN mandate and fear of a protracted conflict (D) Difficult terrain and fear of civilian casualties\nA: ",
        {
          "until": [
            "</s>"
          ]
        }
      ]
    ],
    "resps": [
      [
        "(C)"
      ]
    ],
    "filtered_resps": [
      "(C)"
    ],
    "exact_match": 1.0
  },
  {
    "doc_id": 26,
    "doc": {
      "question": "What are the key elements of the Liberal approach to US foreign policy?",
      "subject": "us_foreign_policy",
      "choices": [
        "Promotion of Democracy, free-trade and international institutions",
        "Alliances, diplomacy and protectionism",
        "The balance of power, self-sufficiency and prudence",
        "None of the above"
      ],
      "answer": 0
    },
    "target": "(A)",
    "arguments": [
      [
        "The following are multiple choice questions (with answers) about us foreign policy.\n\nQ: How did NSC-68 change U.S. strategy?\n(A) It globalized containment. (B) It militarized containment. (C) It called for the development of the hydrogen bomb. (D) All of the above\nA:  (D)\n\nQ: How did the 2008 financial crisis affect America's international reputation?\n(A) It damaged support for the US model of political economy and capitalism (B) It created anger at the United States for exaggerating the crisis (C) It increased support for American global leadership under President Obama (D) It reduced global use of the US dollar\nA:  (A)\n\nQ: How do Defensive Realism and Offensive Realism differ in their explanation of state behaviour?\n(A) Defensive realists place greater emphasis on the role of international institutions (B) Defensive realists place less emphasis on geographical factors (C) Offensive realists give more priority to the national interest than Defensive realists. (D) Defensive realists believe states are security maximizers, while Offensive realists believe states to be power maximizers\nA:  (D)\n\nQ: The realm of policy decisions concerned primarily with relations between the United States and the rest of the world is known as\n(A) terrorism policy. (B) economic policy. (C) foreign policy. (D) international policy.\nA:  (C)\n\nQ: How did Donald Trump attack globalization in the 2016 campaign?\n(A) Globalization had made men like him too rich (B) Globalization only benefited certain American states, such as New York (C) Liberal elites had encouraged globalization, while 'ordinary Americans' lost jobs because of it (D) Globalization encouraged damaging trade wars\nA:  (C)\n\nQ: What are the key elements of the Liberal approach to US foreign policy?\n(A) Promotion of Democracy, free-trade and international institutions (B) Alliances, diplomacy and protectionism (C) The balance of power, self-sufficiency and prudence (D) None of the above\nA: ",
        {
          "until": [
            "</s>"
          ]
        }
      ]
    ],
    "resps": [
      [
        "(B)"
      ]
    ],
    "filtered_resps": [
      "(B)"
    ],
    "exact_match": 0.0
  },
  {
    "doc_id": 34,
    "doc": {
      "question": "What was the Clinton Administration's policy on the Russian economy?",
      "subject": "us_foreign_policy",
      "choices": [
        "The US inhibited the marketization of the Russian economy",
        "The US promoted the marketization of the Russian economy",
        "The US supported public ownership of natural resources",
        "None, the US was only concerned with security issues"
      ],
      "answer": 1
    },
    "target": "(B)",
    "arguments": [
      [
        "The following are multiple choice questions (with answers) about us foreign policy.\n\nQ: How did Donald Trump attack globalization in the 2016 campaign?\n(A) Globalization had made men like him too rich (B) Globalization only benefited certain American states, such as New York (C) Liberal elites had encouraged globalization, while 'ordinary Americans' lost jobs because of it (D) Globalization encouraged damaging trade wars\nA:  (C)\n\nQ: How do Defensive Realism and Offensive Realism differ in their explanation of state behaviour?\n(A) Defensive realists place greater emphasis on the role of international institutions (B) Defensive realists place less emphasis on geographical factors (C) Offensive realists give more priority to the national interest than Defensive realists. (D) Defensive realists believe states are security maximizers, while Offensive realists believe states to be power maximizers\nA:  (D)\n\nQ: How did the 2008 financial crisis affect America's international reputation?\n(A) It damaged support for the US model of political economy and capitalism (B) It created anger at the United States for exaggerating the crisis (C) It increased support for American global leadership under President Obama (D) It reduced global use of the US dollar\nA:  (A)\n\nQ: The realm of policy decisions concerned primarily with relations between the United States and the rest of the world is known as\n(A) terrorism policy. (B) economic policy. (C) foreign policy. (D) international policy.\nA:  (C)\n\nQ: How did NSC-68 change U.S. strategy?\n(A) It globalized containment. (B) It militarized containment. (C) It called for the development of the hydrogen bomb. (D) All of the above\nA:  (D)\n\nQ: What was the Clinton Administration's policy on the Russian economy?\n(A) The US inhibited the marketization of the Russian economy (B) The US promoted the marketization of the Russian economy (C) The US supported public ownership of natural resources (D) None, the US was only concerned with security issues\nA: ",
        {
          "until": [
            "</s>"
          ]
        }
      ]
    ],
    "resps": [
      [
        "(A)"
      ]
    ],
    "filtered_resps": [
      "(A)"
    ],
    "exact_match": 0.0
  },
  {
    "doc_id": 42,
    "doc": {
      "question": "Why might the 'Philadelphian System' be linked to the idea of American exceptionalism?",
      "subject": "us_foreign_policy",
      "choices": [
        "It encouraged greater involvement in European politics",
        "It was designed as the antithesis of European politics",
        "It created a large standing army",
        "It encouraged the centralization of political power in the US"
      ],
      "answer": 1
    },
    "target": "(B)",
    "arguments": [
      [
        "The following are multiple choice questions (with answers) about us foreign policy.\n\nQ: How did the 2008 financial crisis affect America's international reputation?\n(A) It damaged support for the US model of political economy and capitalism (B) It created anger at the United States for exaggerating the crisis (C) It increased support for American global leadership under President Obama (D) It reduced global use of the US dollar\nA:  (A)\n\nQ: How did Donald Trump attack globalization in the 2016 campaign?\n(A) Globalization had made men like him too rich (B) Globalization only benefited certain American states, such as New York (C) Liberal elites had encouraged globalization, while 'ordinary Americans' lost jobs because of it (D) Globalization encouraged damaging trade wars\nA:  (C)\n\nQ: The realm of policy decisions concerned primarily with relations between the United States and the rest of the world is known as\n(A) terrorism policy. (B) economic policy. (C) foreign policy. (D) international policy.\nA:  (C)\n\nQ: How do Defensive Realism and Offensive Realism differ in their explanation of state behaviour?\n(A) Defensive realists place greater emphasis on the role of international institutions (B) Defensive realists place less emphasis on geographical factors (C) Offensive realists give more priority to the national interest than Defensive realists. (D) Defensive realists believe states are security maximizers, while Offensive realists believe states to be power maximizers\nA:  (D)\n\nQ: How did NSC-68 change U.S. strategy?\n(A) It globalized containment. (B) It militarized containment. (C) It called for the development of the hydrogen bomb. (D) All of the above\nA:  (D)\n\nQ: Why might the 'Philadelphian System' be linked to the idea of American exceptionalism?\n(A) It encouraged greater involvement in European politics (B) It was designed as the antithesis of European politics (C) It created a large standing army (D) It encouraged the centralization of political power in the US\nA: ",
        {
          "until": [
            "</s>"
          ]
        }
      ]
    ],
    "resps": [
      [
        "(B)"
      ]
    ],
    "filtered_resps": [
      "(B)"
    ],
    "exact_match": 1.0
  },
  {
    "doc_id": 50,
    "doc": {
      "question": "What caused a public uproar involving the National Security Agency in 2005?",
      "subject": "us_foreign_policy",
      "choices": [
        "Revelations that the NSA was monitoring the communications of American citizens without obtaining warrants",
        "A leaked memo that linked the events of September 11, 2001, with the Democratic National Committee",
        "Revelations that the NSA had tortured prisoners at Guantanamo, Cuba",
        "A scathing report condemning the George W. Bush administration for \"building a case for the war in Iraq on a quicksand foundation\""
      ],
      "answer": 0
    },
    "target": "(A)",
    "arguments": [
      [
        "The following are multiple choice questions (with answers) about us foreign policy.\n\nQ: How did Donald Trump attack globalization in the 2016 campaign?\n(A) Globalization had made men like him too rich (B) Globalization only benefited certain American states, such as New York (C) Liberal elites had encouraged globalization, while 'ordinary Americans' lost jobs because of it (D) Globalization encouraged damaging trade wars\nA:  (C)\n\nQ: How did the 2008 financial crisis affect America's international reputation?\n(A) It damaged support for the US model of political economy and capitalism (B) It created anger at the United States for exaggerating the crisis (C) It increased support for American global leadership under President Obama (D) It reduced global use of the US dollar\nA:  (A)\n\nQ: The realm of policy decisions concerned primarily with relations between the United States and the rest of the world is known as\n(A) terrorism policy. (B) economic policy. (C) foreign policy. (D) international policy.\nA:  (C)\n\nQ: How did NSC-68 change U.S. strategy?\n(A) It globalized containment. (B) It militarized containment. (C) It called for the development of the hydrogen bomb. (D) All of the above\nA:  (D)\n\nQ: How do Defensive Realism and Offensive Realism differ in their explanation of state behaviour?\n(A) Defensive realists place greater emphasis on the role of international institutions (B) Defensive realists place less emphasis on geographical factors (C) Offensive realists give more priority to the national interest than Defensive realists. (D) Defensive realists believe states are security maximizers, while Offensive realists believe states to be power maximizers\nA:  (D)\n\nQ: What caused a public uproar involving the National Security Agency in 2005?\n(A) Revelations that the NSA was monitoring the communications of American citizens without obtaining warrants (B) A leaked memo that linked the events of September 11, 2001, with the Democratic National Committee (C) Revelations that the NSA had tortured prisoners at Guantanamo, Cuba (D) A scathing report condemning the George W. Bush administration for \"building a case for the war in Iraq on a quicksand foundation\"\nA: ",
        {
          "until": [
            "</s>"
          ]
        }
      ]
    ],
    "resps": [
      [
        "(A)"
      ]
    ],
    "filtered_resps": [
      "(A)"
    ],
    "exact_match": 1.0
  },
  {
    "doc_id": 58,
    "doc": {
      "question": "Why did Lincoln oppose the southward expansion of the US?",
      "subject": "us_foreign_policy",
      "choices": [
        "It would have drained the US economically",
        "It would have involved compromising opposition to slavery",
        "It would have increased immigration to the US",
        "None of the above"
      ],
      "answer": 1
    },
    "target": "(B)",
    "arguments": [
      [
        "The following are multiple choice questions (with answers) about us foreign policy.\n\nQ: The realm of policy decisions concerned primarily with relations between the United States and the rest of the world is known as\n(A) terrorism policy. (B) economic policy. (C) foreign policy. (D) international policy.\nA:  (C)\n\nQ: How did Donald Trump attack globalization in the 2016 campaign?\n(A) Globalization had made men like him too rich (B) Globalization only benefited certain American states, such as New York (C) Liberal elites had encouraged globalization, while 'ordinary Americans' lost jobs because of it (D) Globalization encouraged damaging trade wars\nA:  (C)\n\nQ: How did the 2008 financial crisis affect America's international reputation?\n(A) It damaged support for the US model of political economy and capitalism (B) It created anger at the United States for exaggerating the crisis (C) It increased support for American global leadership under President Obama (D) It reduced global use of the US dollar\nA:  (A)\n\nQ: How do Defensive Realism and Offensive Realism differ in their explanation of state behaviour?\n(A) Defensive realists place greater emphasis on the role of international institutions (B) Defensive realists place less emphasis on geographical factors (C) Offensive realists give more priority to the national interest than Defensive realists. (D) Defensive realists believe states are security maximizers, while Offensive realists believe states to be power maximizers\nA:  (D)\n\nQ: How did NSC-68 change U.S. strategy?\n(A) It globalized containment. (B) It militarized containment. (C) It called for the development of the hydrogen bomb. (D) All of the above\nA:  (D)\n\nQ: Why did Lincoln oppose the southward expansion of the US?\n(A) It would have drained the US economically (B) It would have involved compromising opposition to slavery (C) It would have increased immigration to the US (D) None of the above\nA: ",
        {
          "until": [
            "</s>"
          ]
        }
      ]
    ],
    "resps": [
      [
        "(A)"
      ]
    ],
    "filtered_resps": [
      "(A)"
    ],
    "exact_match": 0.0
  },
  {
    "doc_id": 66,
    "doc": {
      "question": "What was meant by the term 'Rogue States'?",
      "subject": "us_foreign_policy",
      "choices": [
        "States aligned with the USSR during the Cold War",
        "States outside of the 'family of nations'",
        "Communist States",
        "The former Soviet states"
      ],
      "answer": 1
    },
    "target": "(B)",
    "arguments": [
      [
        "The following are multiple choice questions (with answers) about us foreign policy.\n\nQ: How did Donald Trump attack globalization in the 2016 campaign?\n(A) Globalization had made men like him too rich (B) Globalization only benefited certain American states, such as New York (C) Liberal elites had encouraged globalization, while 'ordinary Americans' lost jobs because of it (D) Globalization encouraged damaging trade wars\nA:  (C)\n\nQ: How did the 2008 financial crisis affect America's international reputation?\n(A) It damaged support for the US model of political economy and capitalism (B) It created anger at the United States for exaggerating the crisis (C) It increased support for American global leadership under President Obama (D) It reduced global use of the US dollar\nA:  (A)\n\nQ: The realm of policy decisions concerned primarily with relations between the United States and the rest of the world is known as\n(A) terrorism policy. (B) economic policy. (C) foreign policy. (D) international policy.\nA:  (C)\n\nQ: How do Defensive Realism and Offensive Realism differ in their explanation of state behaviour?\n(A) Defensive realists place greater emphasis on the role of international institutions (B) Defensive realists place less emphasis on geographical factors (C) Offensive realists give more priority to the national interest than Defensive realists. (D) Defensive realists believe states are security maximizers, while Offensive realists believe states to be power maximizers\nA:  (D)\n\nQ: How did NSC-68 change U.S. strategy?\n(A) It globalized containment. (B) It militarized containment. (C) It called for the development of the hydrogen bomb. (D) All of the above\nA:  (D)\n\nQ: What was meant by the term 'Rogue States'?\n(A) States aligned with the USSR during the Cold War (B) States outside of the 'family of nations' (C) Communist States (D) The former Soviet states\nA: ",
        {
          "until": [
            "</s>"
          ]
        }
      ]
    ],
    "resps": [
      [
        "(B)"
      ]
    ],
    "filtered_resps": [
      "(B)"
    ],
    "exact_match": 1.0
  },
  {
    "doc_id": 74,
    "doc": {
      "question": "What is American exceptionalism?",
      "subject": "us_foreign_policy",
      "choices": [
        "The belief that the United States is different from other major powers because it is concerned not only with Power, but also with Principles.",
        "The belief that the United States is different because it is the most powerful nation in the world.",
        "The belief that the United States is pacifist.",
        "The belief that the United States is different because it is motivated more by economic factors than other countries are."
      ],
      "answer": 0
    },
    "target": "(A)",
    "arguments": [
      [
        "The following are multiple choice questions (with answers) about us foreign policy.\n\nQ: The realm of policy decisions concerned primarily with relations between the United States and the rest of the world is known as\n(A) terrorism policy. (B) economic policy. (C) foreign policy. (D) international policy.\nA:  (C)\n\nQ: How did NSC-68 change U.S. strategy?\n(A) It globalized containment. (B) It militarized containment. (C) It called for the development of the hydrogen bomb. (D) All of the above\nA:  (D)\n\nQ: How did Donald Trump attack globalization in the 2016 campaign?\n(A) Globalization had made men like him too rich (B) Globalization only benefited certain American states, such as New York (C) Liberal elites had encouraged globalization, while 'ordinary Americans' lost jobs because of it (D) Globalization encouraged damaging trade wars\nA:  (C)\n\nQ: How do Defensive Realism and Offensive Realism differ in their explanation of state behaviour?\n(A) Defensive realists place greater emphasis on the role of international institutions (B) Defensive realists place less emphasis on geographical factors (C) Offensive realists give more priority to the national interest than Defensive realists. (D) Defensive realists believe states are security maximizers, while Offensive realists believe states to be power maximizers\nA:  (D)\n\nQ: How did the 2008 financial crisis affect America's international reputation?\n(A) It damaged support for the US model of political economy and capitalism (B) It created anger at the United States for exaggerating the crisis (C) It increased support for American global leadership under President Obama (D) It reduced global use of the US dollar\nA:  (A)\n\nQ: What is American exceptionalism?\n(A) The belief that the United States is different from other major powers because it is concerned not only with Power, but also with Principles. (B) The belief that the United States is different because it is the most powerful nation in the world. (C) The belief that the United States is pacifist. (D) The belief that the United States is different because it is motivated more by economic factors than other countries are.\nA: ",
        {
          "until": [
            "</s>"
          ]
        }
      ]
    ],
    "resps": [
      [
        "(A)"
      ]
    ],
    "filtered_resps": [
      "(A)"
    ],
    "exact_match": 1.0
  },
  {
    "doc_id": 82,
    "doc": {
      "question": "What drives US foreign policy according to the Marxist perspective?",
      "subject": "us_foreign_policy",
      "choices": [
        "Economic protectionism",
        "Class consciousness",
        "The search for new markets",
        "Superstructure"
      ],
      "answer": 2
    },
    "target": "(C)",
    "arguments": [
      [
        "The following are multiple choice questions (with answers) about us foreign policy.\n\nQ: How did NSC-68 change U.S. strategy?\n(A) It globalized containment. (B) It militarized containment. (C) It called for the development of the hydrogen bomb. (D) All of the above\nA:  (D)\n\nQ: How did the 2008 financial crisis affect America's international reputation?\n(A) It damaged support for the US model of political economy and capitalism (B) It created anger at the United States for exaggerating the crisis (C) It increased support for American global leadership under President Obama (D) It reduced global use of the US dollar\nA:  (A)\n\nQ: How do Defensive Realism and Offensive Realism differ in their explanation of state behaviour?\n(A) Defensive realists place greater emphasis on the role of international institutions (B) Defensive realists place less emphasis on geographical factors (C) Offensive realists give more priority to the national interest than Defensive realists. (D) Defensive realists believe states are security maximizers, while Offensive realists believe states to be power maximizers\nA:  (D)\n\nQ: How did Donald Trump attack globalization in the 2016 campaign?\n(A) Globalization had made men like him too rich (B) Globalization only benefited certain American states, such as New York (C) Liberal elites had encouraged globalization, while 'ordinary Americans' lost jobs because of it (D) Globalization encouraged damaging trade wars\nA:  (C)\n\nQ: The realm of policy decisions concerned primarily with relations between the United States and the rest of the world is known as\n(A) terrorism policy. (B) economic policy. (C) foreign policy. (D) international policy.\nA:  (C)\n\nQ: What drives US foreign policy according to the Marxist perspective?\n(A) Economic protectionism (B) Class consciousness (C) The search for new markets (D) Superstructure\nA: ",
        {
          "until": [
            "</s>"
          ]
        }
      ]
    ],
    "resps": [
      [
        "(A)"
      ]
    ],
    "filtered_resps": [
      "(A)"
    ],
    "exact_match": 0.0
  },
  {
    "doc_id": 90,
    "doc": {
      "question": "Historically, what has been the general pattern of defense spending in the United States?",
      "subject": "us_foreign_policy",
      "choices": [
        "Steady increases over time.",
        "Increased spending during wars, with demobilization bringing spending down but not back to prewar levels",
        "Unpredictable fluctuations.",
        "Increased spending during wars, with further increases after the war to prepare for future engagements."
      ],
      "answer": 1
    },
    "target": "(B)",
    "arguments": [
      [
        "The following are multiple choice questions (with answers) about us foreign policy.\n\nQ: How did the 2008 financial crisis affect America's international reputation?\n(A) It damaged support for the US model of political economy and capitalism (B) It created anger at the United States for exaggerating the crisis (C) It increased support for American global leadership under President Obama (D) It reduced global use of the US dollar\nA:  (A)\n\nQ: How did NSC-68 change U.S. strategy?\n(A) It globalized containment. (B) It militarized containment. (C) It called for the development of the hydrogen bomb. (D) All of the above\nA:  (D)\n\nQ: How did Donald Trump attack globalization in the 2016 campaign?\n(A) Globalization had made men like him too rich (B) Globalization only benefited certain American states, such as New York (C) Liberal elites had encouraged globalization, while 'ordinary Americans' lost jobs because of it (D) Globalization encouraged damaging trade wars\nA:  (C)\n\nQ: The realm of policy decisions concerned primarily with relations between the United States and the rest of the world is known as\n(A) terrorism policy. (B) economic policy. (C) foreign policy. (D) international policy.\nA:  (C)\n\nQ: How do Defensive Realism and Offensive Realism differ in their explanation of state behaviour?\n(A) Defensive realists place greater emphasis on the role of international institutions (B) Defensive realists place less emphasis on geographical factors (C) Offensive realists give more priority to the national interest than Defensive realists. (D) Defensive realists believe states are security maximizers, while Offensive realists believe states to be power maximizers\nA:  (D)\n\nQ: Historically, what has been the general pattern of defense spending in the United States?\n(A) Steady increases over time. (B) Increased spending during wars, with demobilization bringing spending down but not back to prewar levels (C) Unpredictable fluctuations. (D) Increased spending during wars, with further increases after the war to prepare for future engagements.\nA: ",
        {
          "until": [
            "</s>"
          ]
        }
      ]
    ],
    "resps": [
      [
        "(A)"
      ]
    ],
    "filtered_resps": [
      "(A)"
    ],
    "exact_match": 0.0
  },
  {
    "doc_id": 98,
    "doc": {
      "question": "In what way did the George W Bush administration change the direction of US foreign policy?",
      "subject": "us_foreign_policy",
      "choices": [
        "It criticized international organizations, rather than trying to strengthen them",
        "It expanded NATO to include former Soviet states",
        "It focused on a more personal style of leadership",
        "It increased international support for the United States"
      ],
      "answer": 0
    },
    "target": "(A)",
    "arguments": [
      [
        "The following are multiple choice questions (with answers) about us foreign policy.\n\nQ: How did the 2008 financial crisis affect America's international reputation?\n(A) It damaged support for the US model of political economy and capitalism (B) It created anger at the United States for exaggerating the crisis (C) It increased support for American global leadership under President Obama (D) It reduced global use of the US dollar\nA:  (A)\n\nQ: How did NSC-68 change U.S. strategy?\n(A) It globalized containment. (B) It militarized containment. (C) It called for the development of the hydrogen bomb. (D) All of the above\nA:  (D)\n\nQ: The realm of policy decisions concerned primarily with relations between the United States and the rest of the world is known as\n(A) terrorism policy. (B) economic policy. (C) foreign policy. (D) international policy.\nA:  (C)\n\nQ: How do Defensive Realism and Offensive Realism differ in their explanation of state behaviour?\n(A) Defensive realists place greater emphasis on the role of international institutions (B) Defensive realists place less emphasis on geographical factors (C) Offensive realists give more priority to the national interest than Defensive realists. (D) Defensive realists believe states are security maximizers, while Offensive realists believe states to be power maximizers\nA:  (D)\n\nQ: How did Donald Trump attack globalization in the 2016 campaign?\n(A) Globalization had made men like him too rich (B) Globalization only benefited certain American states, such as New York (C) Liberal elites had encouraged globalization, while 'ordinary Americans' lost jobs because of it (D) Globalization encouraged damaging trade wars\nA:  (C)\n\nQ: In what way did the George W Bush administration change the direction of US foreign policy?\n(A) It criticized international organizations, rather than trying to strengthen them (B) It expanded NATO to include former Soviet states (C) It focused on a more personal style of leadership (D) It increased international support for the United States\nA: ",
        {
          "until": [
            "</s>"
          ]
        }
      ]
    ],
    "resps": [
      [
        "(D)"
      ]
    ],
    "filtered_resps": [
      "(D)"
    ],
    "exact_match": 0.0
  },
  {
    "doc_id": 3,
    "doc": {
      "question": "Who was the first American president to visit communist China?",
      "subject": "us_foreign_policy",
      "choices": [
        "Richard Nixon",
        "George H. W. Bush",
        "Jimmy Carter",
        "Ronald Reagan"
      ],
      "answer": 0
    },
    "target": "(A)",
    "arguments": [
      [
        "The following are multiple choice questions (with answers) about us foreign policy.\n\nQ: How do Defensive Realism and Offensive Realism differ in their explanation of state behaviour?\n(A) Defensive realists place greater emphasis on the role of international institutions (B) Defensive realists place less emphasis on geographical factors (C) Offensive realists give more priority to the national interest than Defensive realists. (D) Defensive realists believe states are security maximizers, while Offensive realists believe states to be power maximizers\nA:  (D)\n\nQ: How did the 2008 financial crisis affect America's international reputation?\n(A) It damaged support for the US model of political economy and capitalism (B) It created anger at the United States for exaggerating the crisis (C) It increased support for American global leadership under President Obama (D) It reduced global use of the US dollar\nA:  (A)\n\nQ: How did Donald Trump attack globalization in the 2016 campaign?\n(A) Globalization had made men like him too rich (B) Globalization only benefited certain American states, such as New York (C) Liberal elites had encouraged globalization, while 'ordinary Americans' lost jobs because of it (D) Globalization encouraged damaging trade wars\nA:  (C)\n\nQ: The realm of policy decisions concerned primarily with relations between the United States and the rest of the world is known as\n(A) terrorism policy. (B) economic policy. (C) foreign policy. (D) international policy.\nA:  (C)\n\nQ: How did NSC-68 change U.S. strategy?\n(A) It globalized containment. (B) It militarized containment. (C) It called for the development of the hydrogen bomb. (D) All of the above\nA:  (D)\n\nQ: Who was the first American president to visit communist China?\n(A) Richard Nixon (B) George H. W. Bush (C) Jimmy Carter (D) Ronald Reagan\nA: ",
        {
          "until": [
            "</s>"
          ]
        }
      ]
    ],
    "resps": [
      [
        "(D)"
      ]
    ],
    "filtered_resps": [
      "(D)"
    ],
    "exact_match": 0.0
  },
  {
    "doc_id": 11,
    "doc": {
      "question": "What was unique about the NATO intervention in Kosovo?",
      "subject": "us_foreign_policy",
      "choices": [
        "It was the first time the US became involved in the Balkans",
        "It was the first time NATO used military force",
        "It was the first war won by airpower alone",
        "It was the first war to employ 'smart weapons'"
      ],
      "answer": 2
    },
    "target": "(C)",
    "arguments": [
      [
        "The following are multiple choice questions (with answers) about us foreign policy.\n\nQ: How did the 2008 financial crisis affect America's international reputation?\n(A) It damaged support for the US model of political economy and capitalism (B) It created anger at the United States for exaggerating the crisis (C) It increased support for American global leadership under President Obama (D) It reduced global use of the US dollar\nA:  (A)\n\nQ: How did Donald Trump attack globalization in the 2016 campaign?\n(A) Globalization had made men like him too rich (B) Globalization only benefited certain American states, such as New York (C) Liberal elites had encouraged globalization, while 'ordinary Americans' lost jobs because of it (D) Globalization encouraged damaging trade wars\nA:  (C)\n\nQ: How did NSC-68 change U.S. strategy?\n(A) It globalized containment. (B) It militarized containment. (C) It called for the development of the hydrogen bomb. (D) All of the above\nA:  (D)\n\nQ: How do Defensive Realism and Offensive Realism differ in their explanation of state behaviour?\n(A) Defensive realists place greater emphasis on the role of international institutions (B) Defensive realists place less emphasis on geographical factors (C) Offensive realists give more priority to the national interest than Defensive realists. (D) Defensive realists believe states are security maximizers, while Offensive realists believe states to be power maximizers\nA:  (D)\n\nQ: The realm of policy decisions concerned primarily with relations between the United States and the rest of the world is known as\n(A) terrorism policy. (B) economic policy. (C) foreign policy. (D) international policy.\nA:  (C)\n\nQ: What was unique about the NATO intervention in Kosovo?\n(A) It was the first time the US became involved in the Balkans (B) It was the first time NATO used military force (C) It was the first war won by airpower alone (D) It was the first war to employ 'smart weapons'\nA: ",
        {
          "until": [
            "</s>"
          ]
        }
      ]
    ],
    "resps": [
      [
        "(B)"
      ]
    ],
    "filtered_resps": [
      "(B)"
    ],
    "exact_match": 0.0
  },
  {
    "doc_id": 19,
    "doc": {
      "question": "Why do Liberal Internationalists argue that international institutions are important to US grand strategy?",
      "subject": "us_foreign_policy",
      "choices": [
        "They allow the US to withdraw from the international arena",
        "They serve American interests",
        "The US is incapable of acting alone",
        "None of the above"
      ],
      "answer": 1
    },
    "target": "(B)",
    "arguments": [
      [
        "The following are multiple choice questions (with answers) about us foreign policy.\n\nQ: How did the 2008 financial crisis affect America's international reputation?\n(A) It damaged support for the US model of political economy and capitalism (B) It created anger at the United States for exaggerating the crisis (C) It increased support for American global leadership under President Obama (D) It reduced global use of the US dollar\nA:  (A)\n\nQ: How did Donald Trump attack globalization in the 2016 campaign?\n(A) Globalization had made men like him too rich (B) Globalization only benefited certain American states, such as New York (C) Liberal elites had encouraged globalization, while 'ordinary Americans' lost jobs because of it (D) Globalization encouraged damaging trade wars\nA:  (C)\n\nQ: How did NSC-68 change U.S. strategy?\n(A) It globalized containment. (B) It militarized containment. (C) It called for the development of the hydrogen bomb. (D) All of the above\nA:  (D)\n\nQ: The realm of policy decisions concerned primarily with relations between the United States and the rest of the world is known as\n(A) terrorism policy. (B) economic policy. (C) foreign policy. (D) international policy.\nA:  (C)\n\nQ: How do Defensive Realism and Offensive Realism differ in their explanation of state behaviour?\n(A) Defensive realists place greater emphasis on the role of international institutions (B) Defensive realists place less emphasis on geographical factors (C) Offensive realists give more priority to the national interest than Defensive realists. (D) Defensive realists believe states are security maximizers, while Offensive realists believe states to be power maximizers\nA:  (D)\n\nQ: Why do Liberal Internationalists argue that international institutions are important to US grand strategy?\n(A) They allow the US to withdraw from the international arena (B) They serve American interests (C) The US is incapable of acting alone (D) None of the above\nA: ",
        {
          "until": [
            "</s>"
          ]
        }
      ]
    ],
    "resps": [
      [
        "(B)"
      ]
    ],
    "filtered_resps": [
      "(B)"
    ],
    "exact_match": 1.0
  },
  {
    "doc_id": 27,
    "doc": {
      "question": "What was the key difference between US expansion pre- and post- 1865?",
      "subject": "us_foreign_policy",
      "choices": [
        "US expansion was based on territory rather than markets post-1865",
        "US expansion was based on markets rather than territory post-1865",
        "US expansion was limited to Latin America post-1865",
        "US expansion ended after 1865"
      ],
      "answer": 1
    },
    "target": "(B)",
    "arguments": [
      [
        "The following are multiple choice questions (with answers) about us foreign policy.\n\nQ: How did NSC-68 change U.S. strategy?\n(A) It globalized containment. (B) It militarized containment. (C) It called for the development of the hydrogen bomb. (D) All of the above\nA:  (D)\n\nQ: How did the 2008 financial crisis affect America's international reputation?\n(A) It damaged support for the US model of political economy and capitalism (B) It created anger at the United States for exaggerating the crisis (C) It increased support for American global leadership under President Obama (D) It reduced global use of the US dollar\nA:  (A)\n\nQ: How do Defensive Realism and Offensive Realism differ in their explanation of state behaviour?\n(A) Defensive realists place greater emphasis on the role of international institutions (B) Defensive realists place less emphasis on geographical factors (C) Offensive realists give more priority to the national interest than Defensive realists. (D) Defensive realists believe states are security maximizers, while Offensive realists believe states to be power maximizers\nA:  (D)\n\nQ: The realm of policy decisions concerned primarily with relations between the United States and the rest of the world is known as\n(A) terrorism policy. (B) economic policy. (C) foreign policy. (D) international policy.\nA:  (C)\n\nQ: How did Donald Trump attack globalization in the 2016 campaign?\n(A) Globalization had made men like him too rich (B) Globalization only benefited certain American states, such as New York (C) Liberal elites had encouraged globalization, while 'ordinary Americans' lost jobs because of it (D) Globalization encouraged damaging trade wars\nA:  (C)\n\nQ: What was the key difference between US expansion pre- and post- 1865?\n(A) US expansion was based on territory rather than markets post-1865 (B) US expansion was based on markets rather than territory post-1865 (C) US expansion was limited to Latin America post-1865 (D) US expansion ended after 1865\nA: ",
        {
          "until": [
            "</s>"
          ]
        }
      ]
    ],
    "resps": [
      [
        "(A)"
      ]
    ],
    "filtered_resps": [
      "(A)"
    ],
    "exact_match": 0.0
  },
  {
    "doc_id": 35,
    "doc": {
      "question": "How many major powers are there in a multipolar system?",
      "subject": "us_foreign_policy",
      "choices": [
        "0",
        "1",
        "2",
        "3 or more"
      ],
      "answer": 3
    },
    "target": "(D)",
    "arguments": [
      [
        "The following are multiple choice questions (with answers) about us foreign policy.\n\nQ: How did Donald Trump attack globalization in the 2016 campaign?\n(A) Globalization had made men like him too rich (B) Globalization only benefited certain American states, such as New York (C) Liberal elites had encouraged globalization, while 'ordinary Americans' lost jobs because of it (D) Globalization encouraged damaging trade wars\nA:  (C)\n\nQ: How do Defensive Realism and Offensive Realism differ in their explanation of state behaviour?\n(A) Defensive realists place greater emphasis on the role of international institutions (B) Defensive realists place less emphasis on geographical factors (C) Offensive realists give more priority to the national interest than Defensive realists. (D) Defensive realists believe states are security maximizers, while Offensive realists believe states to be power maximizers\nA:  (D)\n\nQ: How did the 2008 financial crisis affect America's international reputation?\n(A) It damaged support for the US model of political economy and capitalism (B) It created anger at the United States for exaggerating the crisis (C) It increased support for American global leadership under President Obama (D) It reduced global use of the US dollar\nA:  (A)\n\nQ: The realm of policy decisions concerned primarily with relations between the United States and the rest of the world is known as\n(A) terrorism policy. (B) economic policy. (C) foreign policy. (D) international policy.\nA:  (C)\n\nQ: How did NSC-68 change U.S. strategy?\n(A) It globalized containment. (B) It militarized containment. (C) It called for the development of the hydrogen bomb. (D) All of the above\nA:  (D)\n\nQ: How many major powers are there in a multipolar system?\n(A) 0 (B) 1 (C) 2 (D) 3 or more\nA: ",
        {
          "until": [
            "</s>"
          ]
        }
      ]
    ],
    "resps": [
      [
        "(D)"
      ]
    ],
    "filtered_resps": [
      "(D)"
    ],
    "exact_match": 1.0
  },
  {
    "doc_id": 43,
    "doc": {
      "question": "Which of the following are possible constraints on US foreign policy decision making?",
      "subject": "us_foreign_policy",
      "choices": [
        "Foreign policies of other states",
        "International law",
        "Intergovernmental organizations",
        "All of the above"
      ],
      "answer": 3
    },
    "target": "(D)",
    "arguments": [
      [
        "The following are multiple choice questions (with answers) about us foreign policy.\n\nQ: How did the 2008 financial crisis affect America's international reputation?\n(A) It damaged support for the US model of political economy and capitalism (B) It created anger at the United States for exaggerating the crisis (C) It increased support for American global leadership under President Obama (D) It reduced global use of the US dollar\nA:  (A)\n\nQ: How did Donald Trump attack globalization in the 2016 campaign?\n(A) Globalization had made men like him too rich (B) Globalization only benefited certain American states, such as New York (C) Liberal elites had encouraged globalization, while 'ordinary Americans' lost jobs because of it (D) Globalization encouraged damaging trade wars\nA:  (C)\n\nQ: The realm of policy decisions concerned primarily with relations between the United States and the rest of the world is known as\n(A) terrorism policy. (B) economic policy. (C) foreign policy. (D) international policy.\nA:  (C)\n\nQ: How do Defensive Realism and Offensive Realism differ in their explanation of state behaviour?\n(A) Defensive realists place greater emphasis on the role of international institutions (B) Defensive realists place less emphasis on geographical factors (C) Offensive realists give more priority to the national interest than Defensive realists. (D) Defensive realists believe states are security maximizers, while Offensive realists believe states to be power maximizers\nA:  (D)\n\nQ: How did NSC-68 change U.S. strategy?\n(A) It globalized containment. (B) It militarized containment. (C) It called for the development of the hydrogen bomb. (D) All of the above\nA:  (D)\n\nQ: Which of the following are possible constraints on US foreign policy decision making?\n(A) Foreign policies of other states (B) International law (C) Intergovernmental organizations (D) All of the above\nA: ",
        {
          "until": [
            "</s>"
          ]
        }
      ]
    ],
    "resps": [
      [
        "(D)"
      ]
    ],
    "filtered_resps": [
      "(D)"
    ],
    "exact_match": 1.0
  },
  {
    "doc_id": 51,
    "doc": {
      "question": "What was the Marshall Plan?",
      "subject": "us_foreign_policy",
      "choices": [
        "A plan that provided economic assistance to rebuild Europe.",
        "A plan to provide aid to Greece and Turkey in their stand against Soviet and Soviet-assisted threats",
        "A plan that provided Europe with military assistance to counter the Soviet threat",
        "The plan designed to stop communism in Asia"
      ],
      "answer": 0
    },
    "target": "(A)",
    "arguments": [
      [
        "The following are multiple choice questions (with answers) about us foreign policy.\n\nQ: How did Donald Trump attack globalization in the 2016 campaign?\n(A) Globalization had made men like him too rich (B) Globalization only benefited certain American states, such as New York (C) Liberal elites had encouraged globalization, while 'ordinary Americans' lost jobs because of it (D) Globalization encouraged damaging trade wars\nA:  (C)\n\nQ: How did the 2008 financial crisis affect America's international reputation?\n(A) It damaged support for the US model of political economy and capitalism (B) It created anger at the United States for exaggerating the crisis (C) It increased support for American global leadership under President Obama (D) It reduced global use of the US dollar\nA:  (A)\n\nQ: The realm of policy decisions concerned primarily with relations between the United States and the rest of the world is known as\n(A) terrorism policy. (B) economic policy. (C) foreign policy. (D) international policy.\nA:  (C)\n\nQ: How did NSC-68 change U.S. strategy?\n(A) It globalized containment. (B) It militarized containment. (C) It called for the development of the hydrogen bomb. (D) All of the above\nA:  (D)\n\nQ: How do Defensive Realism and Offensive Realism differ in their explanation of state behaviour?\n(A) Defensive realists place greater emphasis on the role of international institutions (B) Defensive realists place less emphasis on geographical factors (C) Offensive realists give more priority to the national interest than Defensive realists. (D) Defensive realists believe states are security maximizers, while Offensive realists believe states to be power maximizers\nA:  (D)\n\nQ: What was the Marshall Plan?\n(A) A plan that provided economic assistance to rebuild Europe. (B) A plan to provide aid to Greece and Turkey in their stand against Soviet and Soviet-assisted threats (C) A plan that provided Europe with military assistance to counter the Soviet threat (D) The plan designed to stop communism in Asia\nA: ",
        {
          "until": [
            "</s>"
          ]
        }
      ]
    ],
    "resps": [
      [
        "(C)"
      ]
    ],
    "filtered_resps": [
      "(C)"
    ],
    "exact_match": 0.0
  },
  {
    "doc_id": 59,
    "doc": {
      "question": "Growing tension between the United States and the Soviet Union resulted in a policy that John Foster Dulles referred to as",
      "subject": "us_foreign_policy",
      "choices": [
        "\"mutual assured destruction.\"",
        "\"brinkmanship.\"",
        "\"realism.\"",
        "\"not in my backyard.\""
      ],
      "answer": 1
    },
    "target": "(B)",
    "arguments": [
      [
        "The following are multiple choice questions (with answers) about us foreign policy.\n\nQ: The realm of policy decisions concerned primarily with relations between the United States and the rest of the world is known as\n(A) terrorism policy. (B) economic policy. (C) foreign policy. (D) international policy.\nA:  (C)\n\nQ: How did Donald Trump attack globalization in the 2016 campaign?\n(A) Globalization had made men like him too rich (B) Globalization only benefited certain American states, such as New York (C) Liberal elites had encouraged globalization, while 'ordinary Americans' lost jobs because of it (D) Globalization encouraged damaging trade wars\nA:  (C)\n\nQ: How did the 2008 financial crisis affect America's international reputation?\n(A) It damaged support for the US model of political economy and capitalism (B) It created anger at the United States for exaggerating the crisis (C) It increased support for American global leadership under President Obama (D) It reduced global use of the US dollar\nA:  (A)\n\nQ: How do Defensive Realism and Offensive Realism differ in their explanation of state behaviour?\n(A) Defensive realists place greater emphasis on the role of international institutions (B) Defensive realists place less emphasis on geographical factors (C) Offensive realists give more priority to the national interest than Defensive realists. (D) Defensive realists believe states are security maximizers, while Offensive realists believe states to be power maximizers\nA:  (D)\n\nQ: How did NSC-68 change U.S. strategy?\n(A) It globalized containment. (B) It militarized containment. (C) It called for the development of the hydrogen bomb. (D) All of the above\nA:  (D)\n\nQ: Growing tension between the United States and the Soviet Union resulted in a policy that John Foster Dulles referred to as\n(A) \"mutual assured destruction.\" (B) \"brinkmanship.\" (C) \"realism.\" (D) \"not in my backyard.\"\nA: ",
        {
          "until": [
            "</s>"
          ]
        }
      ]
    ],
    "resps": [
      [
        "(A)"
      ]
    ],
    "filtered_resps": [
      "(A)"
    ],
    "exact_match": 0.0
  },
  {
    "doc_id": 67,
    "doc": {
      "question": "The foreign policy doctrine that European nations should stay out of Latin America is known as",
      "subject": "us_foreign_policy",
      "choices": [
        "the Powell Doctrine.",
        "the Roosevelt Doctrine.",
        "the Bush Doctrine.",
        "the Monroe Doctrine."
      ],
      "answer": 3
    },
    "target": "(D)",
    "arguments": [
      [
        "The following are multiple choice questions (with answers) about us foreign policy.\n\nQ: How did Donald Trump attack globalization in the 2016 campaign?\n(A) Globalization had made men like him too rich (B) Globalization only benefited certain American states, such as New York (C) Liberal elites had encouraged globalization, while 'ordinary Americans' lost jobs because of it (D) Globalization encouraged damaging trade wars\nA:  (C)\n\nQ: How did the 2008 financial crisis affect America's international reputation?\n(A) It damaged support for the US model of political economy and capitalism (B) It created anger at the United States for exaggerating the crisis (C) It increased support for American global leadership under President Obama (D) It reduced global use of the US dollar\nA:  (A)\n\nQ: The realm of policy decisions concerned primarily with relations between the United States and the rest of the world is known as\n(A) terrorism policy. (B) economic policy. (C) foreign policy. (D) international policy.\nA:  (C)\n\nQ: How do Defensive Realism and Offensive Realism differ in their explanation of state behaviour?\n(A) Defensive realists place greater emphasis on the role of international institutions (B) Defensive realists place less emphasis on geographical factors (C) Offensive realists give more priority to the national interest than Defensive realists. (D) Defensive realists believe states are security maximizers, while Offensive realists believe states to be power maximizers\nA:  (D)\n\nQ: How did NSC-68 change U.S. strategy?\n(A) It globalized containment. (B) It militarized containment. (C) It called for the development of the hydrogen bomb. (D) All of the above\nA:  (D)\n\nQ: The foreign policy doctrine that European nations should stay out of Latin America is known as\n(A) the Powell Doctrine. (B) the Roosevelt Doctrine. (C) the Bush Doctrine. (D) the Monroe Doctrine.\nA: ",
        {
          "until": [
            "</s>"
          ]
        }
      ]
    ],
    "resps": [
      [
        "(D)"
      ]
    ],
    "filtered_resps": [
      "(D)"
    ],
    "exact_match": 1.0
  },
  {
    "doc_id": 75,
    "doc": {
      "question": "The role of gathering and interpreting intelligence about foreign countries in order to allow policymakers to make good foreign policy decisions was given to",
      "subject": "us_foreign_policy",
      "choices": [
        "the Central Intelligence Agency (CIA).",
        "the Federal Bureau of Investigation (FBI).",
        "the National Security Council.",
        "Both A and B are correct."
      ],
      "answer": 0
    },
    "target": "(A)",
    "arguments": [
      [
        "The following are multiple choice questions (with answers) about us foreign policy.\n\nQ: The realm of policy decisions concerned primarily with relations between the United States and the rest of the world is known as\n(A) terrorism policy. (B) economic policy. (C) foreign policy. (D) international policy.\nA:  (C)\n\nQ: How did NSC-68 change U.S. strategy?\n(A) It globalized containment. (B) It militarized containment. (C) It called for the development of the hydrogen bomb. (D) All of the above\nA:  (D)\n\nQ: How did Donald Trump attack globalization in the 2016 campaign?\n(A) Globalization had made men like him too rich (B) Globalization only benefited certain American states, such as New York (C) Liberal elites had encouraged globalization, while 'ordinary Americans' lost jobs because of it (D) Globalization encouraged damaging trade wars\nA:  (C)\n\nQ: How do Defensive Realism and Offensive Realism differ in their explanation of state behaviour?\n(A) Defensive realists place greater emphasis on the role of international institutions (B) Defensive realists place less emphasis on geographical factors (C) Offensive realists give more priority to the national interest than Defensive realists. (D) Defensive realists believe states are security maximizers, while Offensive realists believe states to be power maximizers\nA:  (D)\n\nQ: How did the 2008 financial crisis affect America's international reputation?\n(A) It damaged support for the US model of political economy and capitalism (B) It created anger at the United States for exaggerating the crisis (C) It increased support for American global leadership under President Obama (D) It reduced global use of the US dollar\nA:  (A)\n\nQ: The role of gathering and interpreting intelligence about foreign countries in order to allow policymakers to make good foreign policy decisions was given to\n(A) the Central Intelligence Agency (CIA). (B) the Federal Bureau of Investigation (FBI). (C) the National Security Council. (D) Both A and B are correct.\nA: ",
        {
          "until": [
            "</s>"
          ]
        }
      ]
    ],
    "resps": [
      [
        "(A)"
      ]
    ],
    "filtered_resps": [
      "(A)"
    ],
    "exact_match": 1.0
  },
  {
    "doc_id": 83,
    "doc": {
      "question": "Why might American exceptionalism lead to opposition to world government?",
      "subject": "us_foreign_policy",
      "choices": [
        "Its general anti-statism opposes centralized government",
        "It views world government as impractical",
        "It views the UN as a sufficient form of global governance",
        "None of the above"
      ],
      "answer": 0
    },
    "target": "(A)",
    "arguments": [
      [
        "The following are multiple choice questions (with answers) about us foreign policy.\n\nQ: How did NSC-68 change U.S. strategy?\n(A) It globalized containment. (B) It militarized containment. (C) It called for the development of the hydrogen bomb. (D) All of the above\nA:  (D)\n\nQ: How did the 2008 financial crisis affect America's international reputation?\n(A) It damaged support for the US model of political economy and capitalism (B) It created anger at the United States for exaggerating the crisis (C) It increased support for American global leadership under President Obama (D) It reduced global use of the US dollar\nA:  (A)\n\nQ: How do Defensive Realism and Offensive Realism differ in their explanation of state behaviour?\n(A) Defensive realists place greater emphasis on the role of international institutions (B) Defensive realists place less emphasis on geographical factors (C) Offensive realists give more priority to the national interest than Defensive realists. (D) Defensive realists believe states are security maximizers, while Offensive realists believe states to be power maximizers\nA:  (D)\n\nQ: How did Donald Trump attack globalization in the 2016 campaign?\n(A) Globalization had made men like him too rich (B) Globalization only benefited certain American states, such as New York (C) Liberal elites had encouraged globalization, while 'ordinary Americans' lost jobs because of it (D) Globalization encouraged damaging trade wars\nA:  (C)\n\nQ: The realm of policy decisions concerned primarily with relations between the United States and the rest of the world is known as\n(A) terrorism policy. (B) economic policy. (C) foreign policy. (D) international policy.\nA:  (C)\n\nQ: Why might American exceptionalism lead to opposition to world government?\n(A) Its general anti-statism opposes centralized government (B) It views world government as impractical (C) It views the UN as a sufficient form of global governance (D) None of the above\nA: ",
        {
          "until": [
            "</s>"
          ]
        }
      ]
    ],
    "resps": [
      [
        "(A)"
      ]
    ],
    "filtered_resps": [
      "(A)"
    ],
    "exact_match": 1.0
  },
  {
    "doc_id": 91,
    "doc": {
      "question": "International development may be tied to the security of the state, why?",
      "subject": "us_foreign_policy",
      "choices": [
        "Threats to the state centralize political and economic power, threatening state development",
        "Too many casualties drain the productive power of the state",
        "Threats to the state encourage socialism",
        "The two are correlated, but there is no causal effect"
      ],
      "answer": 0
    },
    "target": "(A)",
    "arguments": [
      [
        "The following are multiple choice questions (with answers) about us foreign policy.\n\nQ: How did the 2008 financial crisis affect America's international reputation?\n(A) It damaged support for the US model of political economy and capitalism (B) It created anger at the United States for exaggerating the crisis (C) It increased support for American global leadership under President Obama (D) It reduced global use of the US dollar\nA:  (A)\n\nQ: How did NSC-68 change U.S. strategy?\n(A) It globalized containment. (B) It militarized containment. (C) It called for the development of the hydrogen bomb. (D) All of the above\nA:  (D)\n\nQ: How did Donald Trump attack globalization in the 2016 campaign?\n(A) Globalization had made men like him too rich (B) Globalization only benefited certain American states, such as New York (C) Liberal elites had encouraged globalization, while 'ordinary Americans' lost jobs because of it (D) Globalization encouraged damaging trade wars\nA:  (C)\n\nQ: The realm of policy decisions concerned primarily with relations between the United States and the rest of the world is known as\n(A) terrorism policy. (B) economic policy. (C) foreign policy. (D) international policy.\nA:  (C)\n\nQ: How do Defensive Realism and Offensive Realism differ in their explanation of state behaviour?\n(A) Defensive realists place greater emphasis on the role of international institutions (B) Defensive realists place less emphasis on geographical factors (C) Offensive realists give more priority to the national interest than Defensive realists. (D) Defensive realists believe states are security maximizers, while Offensive realists believe states to be power maximizers\nA:  (D)\n\nQ: International development may be tied to the security of the state, why?\n(A) Threats to the state centralize political and economic power, threatening state development (B) Too many casualties drain the productive power of the state (C) Threats to the state encourage socialism (D) The two are correlated, but there is no causal effect\nA: ",
        {
          "until": [
            "</s>"
          ]
        }
      ]
    ],
    "resps": [
      [
        "(A)"
      ]
    ],
    "filtered_resps": [
      "(A)"
    ],
    "exact_match": 1.0
  },
  {
    "doc_id": 99,
    "doc": {
      "question": "Peace, commerce, and honest friendship with all nations, entangling alliances with none'. Identify the speaker.",
      "subject": "us_foreign_policy",
      "choices": [
        "James Madison",
        "Abraham Lincoln",
        "Woodrow Wilson",
        "Thomas Jefferson"
      ],
      "answer": 3
    },
    "target": "(D)",
    "arguments": [
      [
        "The following are multiple choice questions (with answers) about us foreign policy.\n\nQ: How did the 2008 financial crisis affect America's international reputation?\n(A) It damaged support for the US model of political economy and capitalism (B) It created anger at the United States for exaggerating the crisis (C) It increased support for American global leadership under President Obama (D) It reduced global use of the US dollar\nA:  (A)\n\nQ: How did NSC-68 change U.S. strategy?\n(A) It globalized containment. (B) It militarized containment. (C) It called for the development of the hydrogen bomb. (D) All of the above\nA:  (D)\n\nQ: The realm of policy decisions concerned primarily with relations between the United States and the rest of the world is known as\n(A) terrorism policy. (B) economic policy. (C) foreign policy. (D) international policy.\nA:  (C)\n\nQ: How do Defensive Realism and Offensive Realism differ in their explanation of state behaviour?\n(A) Defensive realists place greater emphasis on the role of international institutions (B) Defensive realists place less emphasis on geographical factors (C) Offensive realists give more priority to the national interest than Defensive realists. (D) Defensive realists believe states are security maximizers, while Offensive realists believe states to be power maximizers\nA:  (D)\n\nQ: How did Donald Trump attack globalization in the 2016 campaign?\n(A) Globalization had made men like him too rich (B) Globalization only benefited certain American states, such as New York (C) Liberal elites had encouraged globalization, while 'ordinary Americans' lost jobs because of it (D) Globalization encouraged damaging trade wars\nA:  (C)\n\nQ: Peace, commerce, and honest friendship with all nations, entangling alliances with none'. Identify the speaker.\n(A) James Madison (B) Abraham Lincoln (C) Woodrow Wilson (D) Thomas Jefferson\nA: ",
        {
          "until": [
            "</s>"
          ]
        }
      ]
    ],
    "resps": [
      [
        "(D)"
      ]
    ],
    "filtered_resps": [
      "(D)"
    ],
    "exact_match": 1.0
  },
  {
    "doc_id": 4,
    "doc": {
      "question": "The Strategic Arms Reduction Treaty was the first accord",
      "subject": "us_foreign_policy",
      "choices": [
        "on nuclear weapons signed between the United States and the Soviet Union.",
        "cutting conventional arms in Europe.",
        "to be rejected by the U.S. Senate.",
        "mandating the elimination of many long-range nuclear missiles."
      ],
      "answer": 3
    },
    "target": "(D)",
    "arguments": [
      [
        "The following are multiple choice questions (with answers) about us foreign policy.\n\nQ: How do Defensive Realism and Offensive Realism differ in their explanation of state behaviour?\n(A) Defensive realists place greater emphasis on the role of international institutions (B) Defensive realists place less emphasis on geographical factors (C) Offensive realists give more priority to the national interest than Defensive realists. (D) Defensive realists believe states are security maximizers, while Offensive realists believe states to be power maximizers\nA:  (D)\n\nQ: How did the 2008 financial crisis affect America's international reputation?\n(A) It damaged support for the US model of political economy and capitalism (B) It created anger at the United States for exaggerating the crisis (C) It increased support for American global leadership under President Obama (D) It reduced global use of the US dollar\nA:  (A)\n\nQ: How did Donald Trump attack globalization in the 2016 campaign?\n(A) Globalization had made men like him too rich (B) Globalization only benefited certain American states, such as New York (C) Liberal elites had encouraged globalization, while 'ordinary Americans' lost jobs because of it (D) Globalization encouraged damaging trade wars\nA:  (C)\n\nQ: The realm of policy decisions concerned primarily with relations between the United States and the rest of the world is known as\n(A) terrorism policy. (B) economic policy. (C) foreign policy. (D) international policy.\nA:  (C)\n\nQ: How did NSC-68 change U.S. strategy?\n(A) It globalized containment. (B) It militarized containment. (C) It called for the development of the hydrogen bomb. (D) All of the above\nA:  (D)\n\nQ: The Strategic Arms Reduction Treaty was the first accord\n(A) on nuclear weapons signed between the United States and the Soviet Union. (B) cutting conventional arms in Europe. (C) to be rejected by the U.S. Senate. (D) mandating the elimination of many long-range nuclear missiles.\nA: ",
        {
          "until": [
            "</s>"
          ]
        }
      ]
    ],
    "resps": [
      [
        "(A)"
      ]
    ],
    "filtered_resps": [
      "(A)"
    ],
    "exact_match": 0.0
  },
  {
    "doc_id": 12,
    "doc": {
      "question": "What, according to Systemic theories, is the primary determinant of a state's foreign policy?",
      "subject": "us_foreign_policy",
      "choices": [
        "The character of a state's leader",
        "The distribution of power in the international system",
        "The distribution of power within a state's governmental system",
        "A state's political ideology"
      ],
      "answer": 1
    },
    "target": "(B)",
    "arguments": [
      [
        "The following are multiple choice questions (with answers) about us foreign policy.\n\nQ: How did the 2008 financial crisis affect America's international reputation?\n(A) It damaged support for the US model of political economy and capitalism (B) It created anger at the United States for exaggerating the crisis (C) It increased support for American global leadership under President Obama (D) It reduced global use of the US dollar\nA:  (A)\n\nQ: How did Donald Trump attack globalization in the 2016 campaign?\n(A) Globalization had made men like him too rich (B) Globalization only benefited certain American states, such as New York (C) Liberal elites had encouraged globalization, while 'ordinary Americans' lost jobs because of it (D) Globalization encouraged damaging trade wars\nA:  (C)\n\nQ: How did NSC-68 change U.S. strategy?\n(A) It globalized containment. (B) It militarized containment. (C) It called for the development of the hydrogen bomb. (D) All of the above\nA:  (D)\n\nQ: How do Defensive Realism and Offensive Realism differ in their explanation of state behaviour?\n(A) Defensive realists place greater emphasis on the role of international institutions (B) Defensive realists place less emphasis on geographical factors (C) Offensive realists give more priority to the national interest than Defensive realists. (D) Defensive realists believe states are security maximizers, while Offensive realists believe states to be power maximizers\nA:  (D)\n\nQ: The realm of policy decisions concerned primarily with relations between the United States and the rest of the world is known as\n(A) terrorism policy. (B) economic policy. (C) foreign policy. (D) international policy.\nA:  (C)\n\nQ: What, according to Systemic theories, is the primary determinant of a state's foreign policy?\n(A) The character of a state's leader (B) The distribution of power in the international system (C) The distribution of power within a state's governmental system (D) A state's political ideology\nA: ",
        {
          "until": [
            "</s>"
          ]
        }
      ]
    ],
    "resps": [
      [
        "(B)"
      ]
    ],
    "filtered_resps": [
      "(B)"
    ],
    "exact_match": 1.0
  },
  {
    "doc_id": 20,
    "doc": {
      "question": "What was the significance of the Truman Doctrine?",
      "subject": "us_foreign_policy",
      "choices": [
        "It indicated the special place of Greece and Turkey in American interests",
        "It was Truman's first statement on European affairs",
        "It indicated US reluctance to get involved in incidents outside of its immediate sphere of influence",
        "It indicated that the US would now view all local revolts through a geopolitical lens"
      ],
      "answer": 3
    },
    "target": "(D)",
    "arguments": [
      [
        "The following are multiple choice questions (with answers) about us foreign policy.\n\nQ: How did the 2008 financial crisis affect America's international reputation?\n(A) It damaged support for the US model of political economy and capitalism (B) It created anger at the United States for exaggerating the crisis (C) It increased support for American global leadership under President Obama (D) It reduced global use of the US dollar\nA:  (A)\n\nQ: How did Donald Trump attack globalization in the 2016 campaign?\n(A) Globalization had made men like him too rich (B) Globalization only benefited certain American states, such as New York (C) Liberal elites had encouraged globalization, while 'ordinary Americans' lost jobs because of it (D) Globalization encouraged damaging trade wars\nA:  (C)\n\nQ: How did NSC-68 change U.S. strategy?\n(A) It globalized containment. (B) It militarized containment. (C) It called for the development of the hydrogen bomb. (D) All of the above\nA:  (D)\n\nQ: The realm of policy decisions concerned primarily with relations between the United States and the rest of the world is known as\n(A) terrorism policy. (B) economic policy. (C) foreign policy. (D) international policy.\nA:  (C)\n\nQ: How do Defensive Realism and Offensive Realism differ in their explanation of state behaviour?\n(A) Defensive realists place greater emphasis on the role of international institutions (B) Defensive realists place less emphasis on geographical factors (C) Offensive realists give more priority to the national interest than Defensive realists. (D) Defensive realists believe states are security maximizers, while Offensive realists believe states to be power maximizers\nA:  (D)\n\nQ: What was the significance of the Truman Doctrine?\n(A) It indicated the special place of Greece and Turkey in American interests (B) It was Truman's first statement on European affairs (C) It indicated US reluctance to get involved in incidents outside of its immediate sphere of influence (D) It indicated that the US would now view all local revolts through a geopolitical lens\nA: ",
        {
          "until": [
            "</s>"
          ]
        }
      ]
    ],
    "resps": [
      [
        "(B)"
      ]
    ],
    "filtered_resps": [
      "(B)"
    ],
    "exact_match": 0.0
  },
  {
    "doc_id": 28,
    "doc": {
      "question": "What case did President Eisenhower make against the 'military-industrial complex' in his farewell speech?",
      "subject": "us_foreign_policy",
      "choices": [
        "That the capitalist search for profits was the leading cause of armed conflict",
        "That the United States no longer needed to be militarily strong",
        "That military spending gave the arms industry unwarranted influence on politics and government",
        "That private companies would undermine the role of the Armed Forces"
      ],
      "answer": 2
    },
    "target": "(C)",
    "arguments": [
      [
        "The following are multiple choice questions (with answers) about us foreign policy.\n\nQ: How did NSC-68 change U.S. strategy?\n(A) It globalized containment. (B) It militarized containment. (C) It called for the development of the hydrogen bomb. (D) All of the above\nA:  (D)\n\nQ: How did the 2008 financial crisis affect America's international reputation?\n(A) It damaged support for the US model of political economy and capitalism (B) It created anger at the United States for exaggerating the crisis (C) It increased support for American global leadership under President Obama (D) It reduced global use of the US dollar\nA:  (A)\n\nQ: How do Defensive Realism and Offensive Realism differ in their explanation of state behaviour?\n(A) Defensive realists place greater emphasis on the role of international institutions (B) Defensive realists place less emphasis on geographical factors (C) Offensive realists give more priority to the national interest than Defensive realists. (D) Defensive realists believe states are security maximizers, while Offensive realists believe states to be power maximizers\nA:  (D)\n\nQ: The realm of policy decisions concerned primarily with relations between the United States and the rest of the world is known as\n(A) terrorism policy. (B) economic policy. (C) foreign policy. (D) international policy.\nA:  (C)\n\nQ: How did Donald Trump attack globalization in the 2016 campaign?\n(A) Globalization had made men like him too rich (B) Globalization only benefited certain American states, such as New York (C) Liberal elites had encouraged globalization, while 'ordinary Americans' lost jobs because of it (D) Globalization encouraged damaging trade wars\nA:  (C)\n\nQ: What case did President Eisenhower make against the 'military-industrial complex' in his farewell speech?\n(A) That the capitalist search for profits was the leading cause of armed conflict (B) That the United States no longer needed to be militarily strong (C) That military spending gave the arms industry unwarranted influence on politics and government (D) That private companies would undermine the role of the Armed Forces\nA: ",
        {
          "until": [
            "</s>"
          ]
        }
      ]
    ],
    "resps": [
      [
        "(D)"
      ]
    ],
    "filtered_resps": [
      "(D)"
    ],
    "exact_match": 0.0
  },
  {
    "doc_id": 36,
    "doc": {
      "question": "Why did Americans believe that they could found a different kind of empire after 1776?",
      "subject": "us_foreign_policy",
      "choices": [
        "This would be an 'empire of liberty'",
        "This empire would be multi-cultural",
        "This type of empire would be based on expansion",
        "This would be empire free of slavery"
      ],
      "answer": 0
    },
    "target": "(A)",
    "arguments": [
      [
        "The following are multiple choice questions (with answers) about us foreign policy.\n\nQ: How did Donald Trump attack globalization in the 2016 campaign?\n(A) Globalization had made men like him too rich (B) Globalization only benefited certain American states, such as New York (C) Liberal elites had encouraged globalization, while 'ordinary Americans' lost jobs because of it (D) Globalization encouraged damaging trade wars\nA:  (C)\n\nQ: How do Defensive Realism and Offensive Realism differ in their explanation of state behaviour?\n(A) Defensive realists place greater emphasis on the role of international institutions (B) Defensive realists place less emphasis on geographical factors (C) Offensive realists give more priority to the national interest than Defensive realists. (D) Defensive realists believe states are security maximizers, while Offensive realists believe states to be power maximizers\nA:  (D)\n\nQ: How did the 2008 financial crisis affect America's international reputation?\n(A) It damaged support for the US model of political economy and capitalism (B) It created anger at the United States for exaggerating the crisis (C) It increased support for American global leadership under President Obama (D) It reduced global use of the US dollar\nA:  (A)\n\nQ: The realm of policy decisions concerned primarily with relations between the United States and the rest of the world is known as\n(A) terrorism policy. (B) economic policy. (C) foreign policy. (D) international policy.\nA:  (C)\n\nQ: How did NSC-68 change U.S. strategy?\n(A) It globalized containment. (B) It militarized containment. (C) It called for the development of the hydrogen bomb. (D) All of the above\nA:  (D)\n\nQ: Why did Americans believe that they could found a different kind of empire after 1776?\n(A) This would be an 'empire of liberty' (B) This empire would be multi-cultural (C) This type of empire would be based on expansion (D) This would be empire free of slavery\nA: ",
        {
          "until": [
            "</s>"
          ]
        }
      ]
    ],
    "resps": [
      [
        "(D)"
      ]
    ],
    "filtered_resps": [
      "(D)"
    ],
    "exact_match": 0.0
  },
  {
    "doc_id": 44,
    "doc": {
      "question": "D\u00e9tente, or the relaxing of tensions coupled with firm guarantees of mutual security, represented a shift in American foreign policy toward the communist world ushered in by",
      "subject": "us_foreign_policy",
      "choices": [
        "Richard Nixon.",
        "Eugene McCarthy",
        "Lyndon Johnson.",
        "Robert Kennedy."
      ],
      "answer": 0
    },
    "target": "(A)",
    "arguments": [
      [
        "The following are multiple choice questions (with answers) about us foreign policy.\n\nQ: How did the 2008 financial crisis affect America's international reputation?\n(A) It damaged support for the US model of political economy and capitalism (B) It created anger at the United States for exaggerating the crisis (C) It increased support for American global leadership under President Obama (D) It reduced global use of the US dollar\nA:  (A)\n\nQ: How did Donald Trump attack globalization in the 2016 campaign?\n(A) Globalization had made men like him too rich (B) Globalization only benefited certain American states, such as New York (C) Liberal elites had encouraged globalization, while 'ordinary Americans' lost jobs because of it (D) Globalization encouraged damaging trade wars\nA:  (C)\n\nQ: The realm of policy decisions concerned primarily with relations between the United States and the rest of the world is known as\n(A) terrorism policy. (B) economic policy. (C) foreign policy. (D) international policy.\nA:  (C)\n\nQ: How do Defensive Realism and Offensive Realism differ in their explanation of state behaviour?\n(A) Defensive realists place greater emphasis on the role of international institutions (B) Defensive realists place less emphasis on geographical factors (C) Offensive realists give more priority to the national interest than Defensive realists. (D) Defensive realists believe states are security maximizers, while Offensive realists believe states to be power maximizers\nA:  (D)\n\nQ: How did NSC-68 change U.S. strategy?\n(A) It globalized containment. (B) It militarized containment. (C) It called for the development of the hydrogen bomb. (D) All of the above\nA:  (D)\n\nQ: D\u00e9tente, or the relaxing of tensions coupled with firm guarantees of mutual security, represented a shift in American foreign policy toward the communist world ushered in by\n(A) Richard Nixon. (B) Eugene McCarthy (C) Lyndon Johnson. (D) Robert Kennedy.\nA: ",
        {
          "until": [
            "</s>"
          ]
        }
      ]
    ],
    "resps": [
      [
        "(C)"
      ]
    ],
    "filtered_resps": [
      "(C)"
    ],
    "exact_match": 0.0
  },
  {
    "doc_id": 52,
    "doc": {
      "question": "Bureaucratic politics suggests we should be worried about which of the following with regard to nuclear weapons?",
      "subject": "us_foreign_policy",
      "choices": [
        "Having the capability to deter the most powerful rival",
        "Having the capability to deter smaller states",
        "How nuclear attacks are identified and responded to; who controls the weapons",
        "Bureaucratic politics provides no information about nuclear proliferation and use"
      ],
      "answer": 2
    },
    "target": "(C)",
    "arguments": [
      [
        "The following are multiple choice questions (with answers) about us foreign policy.\n\nQ: How did Donald Trump attack globalization in the 2016 campaign?\n(A) Globalization had made men like him too rich (B) Globalization only benefited certain American states, such as New York (C) Liberal elites had encouraged globalization, while 'ordinary Americans' lost jobs because of it (D) Globalization encouraged damaging trade wars\nA:  (C)\n\nQ: How did the 2008 financial crisis affect America's international reputation?\n(A) It damaged support for the US model of political economy and capitalism (B) It created anger at the United States for exaggerating the crisis (C) It increased support for American global leadership under President Obama (D) It reduced global use of the US dollar\nA:  (A)\n\nQ: The realm of policy decisions concerned primarily with relations between the United States and the rest of the world is known as\n(A) terrorism policy. (B) economic policy. (C) foreign policy. (D) international policy.\nA:  (C)\n\nQ: How did NSC-68 change U.S. strategy?\n(A) It globalized containment. (B) It militarized containment. (C) It called for the development of the hydrogen bomb. (D) All of the above\nA:  (D)\n\nQ: How do Defensive Realism and Offensive Realism differ in their explanation of state behaviour?\n(A) Defensive realists place greater emphasis on the role of international institutions (B) Defensive realists place less emphasis on geographical factors (C) Offensive realists give more priority to the national interest than Defensive realists. (D) Defensive realists believe states are security maximizers, while Offensive realists believe states to be power maximizers\nA:  (D)\n\nQ: Bureaucratic politics suggests we should be worried about which of the following with regard to nuclear weapons?\n(A) Having the capability to deter the most powerful rival (B) Having the capability to deter smaller states (C) How nuclear attacks are identified and responded to; who controls the weapons (D) Bureaucratic politics provides no information about nuclear proliferation and use\nA: ",
        {
          "until": [
            "</s>"
          ]
        }
      ]
    ],
    "resps": [
      [
        "(C)"
      ]
    ],
    "filtered_resps": [
      "(C)"
    ],
    "exact_match": 1.0
  },
  {
    "doc_id": 60,
    "doc": {
      "question": "Why do some scholars claim that Reagan 'won the Cold War'?",
      "subject": "us_foreign_policy",
      "choices": [
        "Reagan's first term military spending pressured the Soviet Union to keep up its international commitments",
        "Reagan encouraged engagement with the Soviet Union",
        "Reagan encouraged a softer approach towards communism",
        "Reagan reduced military spending and this allowed the Soviet Union space to reform"
      ],
      "answer": 0
    },
    "target": "(A)",
    "arguments": [
      [
        "The following are multiple choice questions (with answers) about us foreign policy.\n\nQ: The realm of policy decisions concerned primarily with relations between the United States and the rest of the world is known as\n(A) terrorism policy. (B) economic policy. (C) foreign policy. (D) international policy.\nA:  (C)\n\nQ: How did Donald Trump attack globalization in the 2016 campaign?\n(A) Globalization had made men like him too rich (B) Globalization only benefited certain American states, such as New York (C) Liberal elites had encouraged globalization, while 'ordinary Americans' lost jobs because of it (D) Globalization encouraged damaging trade wars\nA:  (C)\n\nQ: How did the 2008 financial crisis affect America's international reputation?\n(A) It damaged support for the US model of political economy and capitalism (B) It created anger at the United States for exaggerating the crisis (C) It increased support for American global leadership under President Obama (D) It reduced global use of the US dollar\nA:  (A)\n\nQ: How do Defensive Realism and Offensive Realism differ in their explanation of state behaviour?\n(A) Defensive realists place greater emphasis on the role of international institutions (B) Defensive realists place less emphasis on geographical factors (C) Offensive realists give more priority to the national interest than Defensive realists. (D) Defensive realists believe states are security maximizers, while Offensive realists believe states to be power maximizers\nA:  (D)\n\nQ: How did NSC-68 change U.S. strategy?\n(A) It globalized containment. (B) It militarized containment. (C) It called for the development of the hydrogen bomb. (D) All of the above\nA:  (D)\n\nQ: Why do some scholars claim that Reagan 'won the Cold War'?\n(A) Reagan's first term military spending pressured the Soviet Union to keep up its international commitments (B) Reagan encouraged engagement with the Soviet Union (C) Reagan encouraged a softer approach towards communism (D) Reagan reduced military spending and this allowed the Soviet Union space to reform\nA: ",
        {
          "until": [
            "</s>"
          ]
        }
      ]
    ],
    "resps": [
      [
        "(A)"
      ]
    ],
    "filtered_resps": [
      "(A)"
    ],
    "exact_match": 1.0
  },
  {
    "doc_id": 68,
    "doc": {
      "question": "Why do contemporary European liberal democrats tend to object to the influence of exceptionalism on American foreign policy?",
      "subject": "us_foreign_policy",
      "choices": [
        "They see it as a challenge to European global influence",
        "They see it as an ideological fa\u00e7ade for US imperialism",
        "They see it as a temporary phenomenon",
        "None of the above"
      ],
      "answer": 1
    },
    "target": "(B)",
    "arguments": [
      [
        "The following are multiple choice questions (with answers) about us foreign policy.\n\nQ: How did Donald Trump attack globalization in the 2016 campaign?\n(A) Globalization had made men like him too rich (B) Globalization only benefited certain American states, such as New York (C) Liberal elites had encouraged globalization, while 'ordinary Americans' lost jobs because of it (D) Globalization encouraged damaging trade wars\nA:  (C)\n\nQ: How did the 2008 financial crisis affect America's international reputation?\n(A) It damaged support for the US model of political economy and capitalism (B) It created anger at the United States for exaggerating the crisis (C) It increased support for American global leadership under President Obama (D) It reduced global use of the US dollar\nA:  (A)\n\nQ: The realm of policy decisions concerned primarily with relations between the United States and the rest of the world is known as\n(A) terrorism policy. (B) economic policy. (C) foreign policy. (D) international policy.\nA:  (C)\n\nQ: How do Defensive Realism and Offensive Realism differ in their explanation of state behaviour?\n(A) Defensive realists place greater emphasis on the role of international institutions (B) Defensive realists place less emphasis on geographical factors (C) Offensive realists give more priority to the national interest than Defensive realists. (D) Defensive realists believe states are security maximizers, while Offensive realists believe states to be power maximizers\nA:  (D)\n\nQ: How did NSC-68 change U.S. strategy?\n(A) It globalized containment. (B) It militarized containment. (C) It called for the development of the hydrogen bomb. (D) All of the above\nA:  (D)\n\nQ: Why do contemporary European liberal democrats tend to object to the influence of exceptionalism on American foreign policy?\n(A) They see it as a challenge to European global influence (B) They see it as an ideological fa\u00e7ade for US imperialism (C) They see it as a temporary phenomenon (D) None of the above\nA: ",
        {
          "until": [
            "</s>"
          ]
        }
      ]
    ],
    "resps": [
      [
        "(A)"
      ]
    ],
    "filtered_resps": [
      "(A)"
    ],
    "exact_match": 0.0
  },
  {
    "doc_id": 76,
    "doc": {
      "question": "The cooperative international organization of 185 countries designed to stabilize the exchange of currencies and the world economy is",
      "subject": "us_foreign_policy",
      "choices": [
        "the World Bank.",
        "the United Nations.",
        "UNICEF.",
        "the International Monetary Fund."
      ],
      "answer": 3
    },
    "target": "(D)",
    "arguments": [
      [
        "The following are multiple choice questions (with answers) about us foreign policy.\n\nQ: The realm of policy decisions concerned primarily with relations between the United States and the rest of the world is known as\n(A) terrorism policy. (B) economic policy. (C) foreign policy. (D) international policy.\nA:  (C)\n\nQ: How did NSC-68 change U.S. strategy?\n(A) It globalized containment. (B) It militarized containment. (C) It called for the development of the hydrogen bomb. (D) All of the above\nA:  (D)\n\nQ: How did Donald Trump attack globalization in the 2016 campaign?\n(A) Globalization had made men like him too rich (B) Globalization only benefited certain American states, such as New York (C) Liberal elites had encouraged globalization, while 'ordinary Americans' lost jobs because of it (D) Globalization encouraged damaging trade wars\nA:  (C)\n\nQ: How do Defensive Realism and Offensive Realism differ in their explanation of state behaviour?\n(A) Defensive realists place greater emphasis on the role of international institutions (B) Defensive realists place less emphasis on geographical factors (C) Offensive realists give more priority to the national interest than Defensive realists. (D) Defensive realists believe states are security maximizers, while Offensive realists believe states to be power maximizers\nA:  (D)\n\nQ: How did the 2008 financial crisis affect America's international reputation?\n(A) It damaged support for the US model of political economy and capitalism (B) It created anger at the United States for exaggerating the crisis (C) It increased support for American global leadership under President Obama (D) It reduced global use of the US dollar\nA:  (A)\n\nQ: The cooperative international organization of 185 countries designed to stabilize the exchange of currencies and the world economy is\n(A) the World Bank. (B) the United Nations. (C) UNICEF. (D) the International Monetary Fund.\nA: ",
        {
          "until": [
            "</s>"
          ]
        }
      ]
    ],
    "resps": [
      [
        "(D)"
      ]
    ],
    "filtered_resps": [
      "(D)"
    ],
    "exact_match": 1.0
  },
  {
    "doc_id": 84,
    "doc": {
      "question": "Which of the following considers states to be the primary actors in international relations?",
      "subject": "us_foreign_policy",
      "choices": [
        "Realism",
        "Idealism",
        "Liberalism",
        "None of the above"
      ],
      "answer": 0
    },
    "target": "(A)",
    "arguments": [
      [
        "The following are multiple choice questions (with answers) about us foreign policy.\n\nQ: How did NSC-68 change U.S. strategy?\n(A) It globalized containment. (B) It militarized containment. (C) It called for the development of the hydrogen bomb. (D) All of the above\nA:  (D)\n\nQ: How did the 2008 financial crisis affect America's international reputation?\n(A) It damaged support for the US model of political economy and capitalism (B) It created anger at the United States for exaggerating the crisis (C) It increased support for American global leadership under President Obama (D) It reduced global use of the US dollar\nA:  (A)\n\nQ: How do Defensive Realism and Offensive Realism differ in their explanation of state behaviour?\n(A) Defensive realists place greater emphasis on the role of international institutions (B) Defensive realists place less emphasis on geographical factors (C) Offensive realists give more priority to the national interest than Defensive realists. (D) Defensive realists believe states are security maximizers, while Offensive realists believe states to be power maximizers\nA:  (D)\n\nQ: How did Donald Trump attack globalization in the 2016 campaign?\n(A) Globalization had made men like him too rich (B) Globalization only benefited certain American states, such as New York (C) Liberal elites had encouraged globalization, while 'ordinary Americans' lost jobs because of it (D) Globalization encouraged damaging trade wars\nA:  (C)\n\nQ: The realm of policy decisions concerned primarily with relations between the United States and the rest of the world is known as\n(A) terrorism policy. (B) economic policy. (C) foreign policy. (D) international policy.\nA:  (C)\n\nQ: Which of the following considers states to be the primary actors in international relations?\n(A) Realism (B) Idealism (C) Liberalism (D) None of the above\nA: ",
        {
          "until": [
            "</s>"
          ]
        }
      ]
    ],
    "resps": [
      [
        "(D)"
      ]
    ],
    "filtered_resps": [
      "(D)"
    ],
    "exact_match": 0.0
  },
  {
    "doc_id": 92,
    "doc": {
      "question": "What was the 'Domino Theory'?",
      "subject": "us_foreign_policy",
      "choices": [
        "The idea that the Cold War operated according to the principles of game theory",
        "The idea that certain states were of higher value than others to the US during the Cold War",
        "The idea that the fall of one state to communism would inexorably lead to the fall of its neighbors",
        "The idea that the growth of democracy in one state would inexorably lead to its growth in others"
      ],
      "answer": 2
    },
    "target": "(C)",
    "arguments": [
      [
        "The following are multiple choice questions (with answers) about us foreign policy.\n\nQ: How did the 2008 financial crisis affect America's international reputation?\n(A) It damaged support for the US model of political economy and capitalism (B) It created anger at the United States for exaggerating the crisis (C) It increased support for American global leadership under President Obama (D) It reduced global use of the US dollar\nA:  (A)\n\nQ: How did NSC-68 change U.S. strategy?\n(A) It globalized containment. (B) It militarized containment. (C) It called for the development of the hydrogen bomb. (D) All of the above\nA:  (D)\n\nQ: How did Donald Trump attack globalization in the 2016 campaign?\n(A) Globalization had made men like him too rich (B) Globalization only benefited certain American states, such as New York (C) Liberal elites had encouraged globalization, while 'ordinary Americans' lost jobs because of it (D) Globalization encouraged damaging trade wars\nA:  (C)\n\nQ: The realm of policy decisions concerned primarily with relations between the United States and the rest of the world is known as\n(A) terrorism policy. (B) economic policy. (C) foreign policy. (D) international policy.\nA:  (C)\n\nQ: How do Defensive Realism and Offensive Realism differ in their explanation of state behaviour?\n(A) Defensive realists place greater emphasis on the role of international institutions (B) Defensive realists place less emphasis on geographical factors (C) Offensive realists give more priority to the national interest than Defensive realists. (D) Defensive realists believe states are security maximizers, while Offensive realists believe states to be power maximizers\nA:  (D)\n\nQ: What was the 'Domino Theory'?\n(A) The idea that the Cold War operated according to the principles of game theory (B) The idea that certain states were of higher value than others to the US during the Cold War (C) The idea that the fall of one state to communism would inexorably lead to the fall of its neighbors (D) The idea that the growth of democracy in one state would inexorably lead to its growth in others\nA: ",
        {
          "until": [
            "</s>"
          ]
        }
      ]
    ],
    "resps": [
      [
        "(B)"
      ]
    ],
    "filtered_resps": [
      "(B)"
    ],
    "exact_match": 0.0
  },
  {
    "doc_id": 5,
    "doc": {
      "question": "What were the implications of the Cold War for American exceptionalism?",
      "subject": "us_foreign_policy",
      "choices": [
        "It ended the influence of American exceptionalism entirely",
        "Exceptionalism was enhanced by America's status as the 'leader of the free world'",
        "The extension of American power globally challenged core assumptions of exceptionalism",
        "Both b and c"
      ],
      "answer": 3
    },
    "target": "(D)",
    "arguments": [
      [
        "The following are multiple choice questions (with answers) about us foreign policy.\n\nQ: How do Defensive Realism and Offensive Realism differ in their explanation of state behaviour?\n(A) Defensive realists place greater emphasis on the role of international institutions (B) Defensive realists place less emphasis on geographical factors (C) Offensive realists give more priority to the national interest than Defensive realists. (D) Defensive realists believe states are security maximizers, while Offensive realists believe states to be power maximizers\nA:  (D)\n\nQ: How did the 2008 financial crisis affect America's international reputation?\n(A) It damaged support for the US model of political economy and capitalism (B) It created anger at the United States for exaggerating the crisis (C) It increased support for American global leadership under President Obama (D) It reduced global use of the US dollar\nA:  (A)\n\nQ: How did Donald Trump attack globalization in the 2016 campaign?\n(A) Globalization had made men like him too rich (B) Globalization only benefited certain American states, such as New York (C) Liberal elites had encouraged globalization, while 'ordinary Americans' lost jobs because of it (D) Globalization encouraged damaging trade wars\nA:  (C)\n\nQ: The realm of policy decisions concerned primarily with relations between the United States and the rest of the world is known as\n(A) terrorism policy. (B) economic policy. (C) foreign policy. (D) international policy.\nA:  (C)\n\nQ: How did NSC-68 change U.S. strategy?\n(A) It globalized containment. (B) It militarized containment. (C) It called for the development of the hydrogen bomb. (D) All of the above\nA:  (D)\n\nQ: What were the implications of the Cold War for American exceptionalism?\n(A) It ended the influence of American exceptionalism entirely (B) Exceptionalism was enhanced by America's status as the 'leader of the free world' (C) The extension of American power globally challenged core assumptions of exceptionalism (D) Both b and c\nA: ",
        {
          "until": [
            "</s>"
          ]
        }
      ]
    ],
    "resps": [
      [
        "(D)"
      ]
    ],
    "filtered_resps": [
      "(D)"
    ],
    "exact_match": 1.0
  },
  {
    "doc_id": 13,
    "doc": {
      "question": "Why is there so much uncertainty over which states have nuclear weapons?",
      "subject": "us_foreign_policy",
      "choices": [
        "Leaders have incentives to lie",
        "If leaders revealed their programs, they would be more likely to be attacked",
        "Leaders will not always grant foreign monitors access to their nuclear programs",
        "ALL of the above"
      ],
      "answer": 3
    },
    "target": "(D)",
    "arguments": [
      [
        "The following are multiple choice questions (with answers) about us foreign policy.\n\nQ: How did the 2008 financial crisis affect America's international reputation?\n(A) It damaged support for the US model of political economy and capitalism (B) It created anger at the United States for exaggerating the crisis (C) It increased support for American global leadership under President Obama (D) It reduced global use of the US dollar\nA:  (A)\n\nQ: How did Donald Trump attack globalization in the 2016 campaign?\n(A) Globalization had made men like him too rich (B) Globalization only benefited certain American states, such as New York (C) Liberal elites had encouraged globalization, while 'ordinary Americans' lost jobs because of it (D) Globalization encouraged damaging trade wars\nA:  (C)\n\nQ: How did NSC-68 change U.S. strategy?\n(A) It globalized containment. (B) It militarized containment. (C) It called for the development of the hydrogen bomb. (D) All of the above\nA:  (D)\n\nQ: How do Defensive Realism and Offensive Realism differ in their explanation of state behaviour?\n(A) Defensive realists place greater emphasis on the role of international institutions (B) Defensive realists place less emphasis on geographical factors (C) Offensive realists give more priority to the national interest than Defensive realists. (D) Defensive realists believe states are security maximizers, while Offensive realists believe states to be power maximizers\nA:  (D)\n\nQ: The realm of policy decisions concerned primarily with relations between the United States and the rest of the world is known as\n(A) terrorism policy. (B) economic policy. (C) foreign policy. (D) international policy.\nA:  (C)\n\nQ: Why is there so much uncertainty over which states have nuclear weapons?\n(A) Leaders have incentives to lie (B) If leaders revealed their programs, they would be more likely to be attacked (C) Leaders will not always grant foreign monitors access to their nuclear programs (D) ALL of the above\nA: ",
        {
          "until": [
            "</s>"
          ]
        }
      ]
    ],
    "resps": [
      [
        "(D)"
      ]
    ],
    "filtered_resps": [
      "(D)"
    ],
    "exact_match": 1.0
  },
  {
    "doc_id": 21,
    "doc": {
      "question": "What tend to be the effects of oil and other natural resource trade on developing states?",
      "subject": "us_foreign_policy",
      "choices": [
        "It democratizes countries",
        "It has no real effect",
        "It encourages stability of the regime",
        "It changes the nature of the investor"
      ],
      "answer": 2
    },
    "target": "(C)",
    "arguments": [
      [
        "The following are multiple choice questions (with answers) about us foreign policy.\n\nQ: How did the 2008 financial crisis affect America's international reputation?\n(A) It damaged support for the US model of political economy and capitalism (B) It created anger at the United States for exaggerating the crisis (C) It increased support for American global leadership under President Obama (D) It reduced global use of the US dollar\nA:  (A)\n\nQ: How did Donald Trump attack globalization in the 2016 campaign?\n(A) Globalization had made men like him too rich (B) Globalization only benefited certain American states, such as New York (C) Liberal elites had encouraged globalization, while 'ordinary Americans' lost jobs because of it (D) Globalization encouraged damaging trade wars\nA:  (C)\n\nQ: How did NSC-68 change U.S. strategy?\n(A) It globalized containment. (B) It militarized containment. (C) It called for the development of the hydrogen bomb. (D) All of the above\nA:  (D)\n\nQ: The realm of policy decisions concerned primarily with relations between the United States and the rest of the world is known as\n(A) terrorism policy. (B) economic policy. (C) foreign policy. (D) international policy.\nA:  (C)\n\nQ: How do Defensive Realism and Offensive Realism differ in their explanation of state behaviour?\n(A) Defensive realists place greater emphasis on the role of international institutions (B) Defensive realists place less emphasis on geographical factors (C) Offensive realists give more priority to the national interest than Defensive realists. (D) Defensive realists believe states are security maximizers, while Offensive realists believe states to be power maximizers\nA:  (D)\n\nQ: What tend to be the effects of oil and other natural resource trade on developing states?\n(A) It democratizes countries (B) It has no real effect (C) It encourages stability of the regime (D) It changes the nature of the investor\nA: ",
        {
          "until": [
            "</s>"
          ]
        }
      ]
    ],
    "resps": [
      [
        "(B)"
      ]
    ],
    "filtered_resps": [
      "(B)"
    ],
    "exact_match": 0.0
  },
  {
    "doc_id": 29,
    "doc": {
      "question": "Within the United Nations, real power is located in",
      "subject": "us_foreign_policy",
      "choices": [
        "the Security Council.",
        "the Chamber of Deputies.",
        "the Council of Ministers.",
        "the Secretariat."
      ],
      "answer": 0
    },
    "target": "(A)",
    "arguments": [
      [
        "The following are multiple choice questions (with answers) about us foreign policy.\n\nQ: How did NSC-68 change U.S. strategy?\n(A) It globalized containment. (B) It militarized containment. (C) It called for the development of the hydrogen bomb. (D) All of the above\nA:  (D)\n\nQ: How did the 2008 financial crisis affect America's international reputation?\n(A) It damaged support for the US model of political economy and capitalism (B) It created anger at the United States for exaggerating the crisis (C) It increased support for American global leadership under President Obama (D) It reduced global use of the US dollar\nA:  (A)\n\nQ: How do Defensive Realism and Offensive Realism differ in their explanation of state behaviour?\n(A) Defensive realists place greater emphasis on the role of international institutions (B) Defensive realists place less emphasis on geographical factors (C) Offensive realists give more priority to the national interest than Defensive realists. (D) Defensive realists believe states are security maximizers, while Offensive realists believe states to be power maximizers\nA:  (D)\n\nQ: The realm of policy decisions concerned primarily with relations between the United States and the rest of the world is known as\n(A) terrorism policy. (B) economic policy. (C) foreign policy. (D) international policy.\nA:  (C)\n\nQ: How did Donald Trump attack globalization in the 2016 campaign?\n(A) Globalization had made men like him too rich (B) Globalization only benefited certain American states, such as New York (C) Liberal elites had encouraged globalization, while 'ordinary Americans' lost jobs because of it (D) Globalization encouraged damaging trade wars\nA:  (C)\n\nQ: Within the United Nations, real power is located in\n(A) the Security Council. (B) the Chamber of Deputies. (C) the Council of Ministers. (D) the Secretariat.\nA: ",
        {
          "until": [
            "</s>"
          ]
        }
      ]
    ],
    "resps": [
      [
        "(D)"
      ]
    ],
    "filtered_resps": [
      "(D)"
    ],
    "exact_match": 0.0
  },
  {
    "doc_id": 37,
    "doc": {
      "question": "The trade-off between defense and social spending is often referred to as a choice between",
      "subject": "us_foreign_policy",
      "choices": [
        "bread and butter.",
        "war and peace.",
        "guns and butter.",
        "bombs and books."
      ],
      "answer": 2
    },
    "target": "(C)",
    "arguments": [
      [
        "The following are multiple choice questions (with answers) about us foreign policy.\n\nQ: How did Donald Trump attack globalization in the 2016 campaign?\n(A) Globalization had made men like him too rich (B) Globalization only benefited certain American states, such as New York (C) Liberal elites had encouraged globalization, while 'ordinary Americans' lost jobs because of it (D) Globalization encouraged damaging trade wars\nA:  (C)\n\nQ: How do Defensive Realism and Offensive Realism differ in their explanation of state behaviour?\n(A) Defensive realists place greater emphasis on the role of international institutions (B) Defensive realists place less emphasis on geographical factors (C) Offensive realists give more priority to the national interest than Defensive realists. (D) Defensive realists believe states are security maximizers, while Offensive realists believe states to be power maximizers\nA:  (D)\n\nQ: How did the 2008 financial crisis affect America's international reputation?\n(A) It damaged support for the US model of political economy and capitalism (B) It created anger at the United States for exaggerating the crisis (C) It increased support for American global leadership under President Obama (D) It reduced global use of the US dollar\nA:  (A)\n\nQ: The realm of policy decisions concerned primarily with relations between the United States and the rest of the world is known as\n(A) terrorism policy. (B) economic policy. (C) foreign policy. (D) international policy.\nA:  (C)\n\nQ: How did NSC-68 change U.S. strategy?\n(A) It globalized containment. (B) It militarized containment. (C) It called for the development of the hydrogen bomb. (D) All of the above\nA:  (D)\n\nQ: The trade-off between defense and social spending is often referred to as a choice between\n(A) bread and butter. (B) war and peace. (C) guns and butter. (D) bombs and books.\nA: ",
        {
          "until": [
            "</s>"
          ]
        }
      ]
    ],
    "resps": [
      [
        "(B)"
      ]
    ],
    "filtered_resps": [
      "(B)"
    ],
    "exact_match": 0.0
  },
  {
    "doc_id": 45,
    "doc": {
      "question": "Which of these is not a component of the 'American Creed'?",
      "subject": "us_foreign_policy",
      "choices": [
        "Liberty",
        "Equality",
        "Autocracy",
        "Individualism"
      ],
      "answer": 2
    },
    "target": "(C)",
    "arguments": [
      [
        "The following are multiple choice questions (with answers) about us foreign policy.\n\nQ: How did the 2008 financial crisis affect America's international reputation?\n(A) It damaged support for the US model of political economy and capitalism (B) It created anger at the United States for exaggerating the crisis (C) It increased support for American global leadership under President Obama (D) It reduced global use of the US dollar\nA:  (A)\n\nQ: How did Donald Trump attack globalization in the 2016 campaign?\n(A) Globalization had made men like him too rich (B) Globalization only benefited certain American states, such as New York (C) Liberal elites had encouraged globalization, while 'ordinary Americans' lost jobs because of it (D) Globalization encouraged damaging trade wars\nA:  (C)\n\nQ: The realm of policy decisions concerned primarily with relations between the United States and the rest of the world is known as\n(A) terrorism policy. (B) economic policy. (C) foreign policy. (D) international policy.\nA:  (C)\n\nQ: How do Defensive Realism and Offensive Realism differ in their explanation of state behaviour?\n(A) Defensive realists place greater emphasis on the role of international institutions (B) Defensive realists place less emphasis on geographical factors (C) Offensive realists give more priority to the national interest than Defensive realists. (D) Defensive realists believe states are security maximizers, while Offensive realists believe states to be power maximizers\nA:  (D)\n\nQ: How did NSC-68 change U.S. strategy?\n(A) It globalized containment. (B) It militarized containment. (C) It called for the development of the hydrogen bomb. (D) All of the above\nA:  (D)\n\nQ: Which of these is not a component of the 'American Creed'?\n(A) Liberty (B) Equality (C) Autocracy (D) Individualism\nA: ",
        {
          "until": [
            "</s>"
          ]
        }
      ]
    ],
    "resps": [
      [
        "(C)"
      ]
    ],
    "filtered_resps": [
      "(C)"
    ],
    "exact_match": 1.0
  },
  {
    "doc_id": 53,
    "doc": {
      "question": "According to International Institutionalists, what problems have international institutions been designed to address?",
      "subject": "us_foreign_policy",
      "choices": [
        "War",
        "Anarchy",
        "Collective action and coordination problems",
        "All of the above"
      ],
      "answer": 3
    },
    "target": "(D)",
    "arguments": [
      [
        "The following are multiple choice questions (with answers) about us foreign policy.\n\nQ: How did Donald Trump attack globalization in the 2016 campaign?\n(A) Globalization had made men like him too rich (B) Globalization only benefited certain American states, such as New York (C) Liberal elites had encouraged globalization, while 'ordinary Americans' lost jobs because of it (D) Globalization encouraged damaging trade wars\nA:  (C)\n\nQ: How did the 2008 financial crisis affect America's international reputation?\n(A) It damaged support for the US model of political economy and capitalism (B) It created anger at the United States for exaggerating the crisis (C) It increased support for American global leadership under President Obama (D) It reduced global use of the US dollar\nA:  (A)\n\nQ: The realm of policy decisions concerned primarily with relations between the United States and the rest of the world is known as\n(A) terrorism policy. (B) economic policy. (C) foreign policy. (D) international policy.\nA:  (C)\n\nQ: How did NSC-68 change U.S. strategy?\n(A) It globalized containment. (B) It militarized containment. (C) It called for the development of the hydrogen bomb. (D) All of the above\nA:  (D)\n\nQ: How do Defensive Realism and Offensive Realism differ in their explanation of state behaviour?\n(A) Defensive realists place greater emphasis on the role of international institutions (B) Defensive realists place less emphasis on geographical factors (C) Offensive realists give more priority to the national interest than Defensive realists. (D) Defensive realists believe states are security maximizers, while Offensive realists believe states to be power maximizers\nA:  (D)\n\nQ: According to International Institutionalists, what problems have international institutions been designed to address?\n(A) War (B) Anarchy (C) Collective action and coordination problems (D) All of the above\nA: ",
        {
          "until": [
            "</s>"
          ]
        }
      ]
    ],
    "resps": [
      [
        "(D)"
      ]
    ],
    "filtered_resps": [
      "(D)"
    ],
    "exact_match": 1.0
  },
  {
    "doc_id": 61,
    "doc": {
      "question": "What is the implication of American exceptionalism in terms of global economics?",
      "subject": "us_foreign_policy",
      "choices": [
        "It encourages the use of tariffs",
        "It encourages nationalization",
        "It encourages liberalization of global trade",
        "It encourages redistribution of wealth"
      ],
      "answer": 2
    },
    "target": "(C)",
    "arguments": [
      [
        "The following are multiple choice questions (with answers) about us foreign policy.\n\nQ: The realm of policy decisions concerned primarily with relations between the United States and the rest of the world is known as\n(A) terrorism policy. (B) economic policy. (C) foreign policy. (D) international policy.\nA:  (C)\n\nQ: How did Donald Trump attack globalization in the 2016 campaign?\n(A) Globalization had made men like him too rich (B) Globalization only benefited certain American states, such as New York (C) Liberal elites had encouraged globalization, while 'ordinary Americans' lost jobs because of it (D) Globalization encouraged damaging trade wars\nA:  (C)\n\nQ: How did the 2008 financial crisis affect America's international reputation?\n(A) It damaged support for the US model of political economy and capitalism (B) It created anger at the United States for exaggerating the crisis (C) It increased support for American global leadership under President Obama (D) It reduced global use of the US dollar\nA:  (A)\n\nQ: How do Defensive Realism and Offensive Realism differ in their explanation of state behaviour?\n(A) Defensive realists place greater emphasis on the role of international institutions (B) Defensive realists place less emphasis on geographical factors (C) Offensive realists give more priority to the national interest than Defensive realists. (D) Defensive realists believe states are security maximizers, while Offensive realists believe states to be power maximizers\nA:  (D)\n\nQ: How did NSC-68 change U.S. strategy?\n(A) It globalized containment. (B) It militarized containment. (C) It called for the development of the hydrogen bomb. (D) All of the above\nA:  (D)\n\nQ: What is the implication of American exceptionalism in terms of global economics?\n(A) It encourages the use of tariffs (B) It encourages nationalization (C) It encourages liberalization of global trade (D) It encourages redistribution of wealth\nA: ",
        {
          "until": [
            "</s>"
          ]
        }
      ]
    ],
    "resps": [
      [
        "(C)"
      ]
    ],
    "filtered_resps": [
      "(C)"
    ],
    "exact_match": 1.0
  },
  {
    "doc_id": 69,
    "doc": {
      "question": "In what sense might exceptionalism link isolationist and internationalist strategies?",
      "subject": "us_foreign_policy",
      "choices": [
        "Both encourage world government",
        "Both focus on the decline of the American power",
        "It doesn't - the two are fundamentally opposed",
        "Both can be viewed as different means of achieving the same liberal ends"
      ],
      "answer": 3
    },
    "target": "(D)",
    "arguments": [
      [
        "The following are multiple choice questions (with answers) about us foreign policy.\n\nQ: How did Donald Trump attack globalization in the 2016 campaign?\n(A) Globalization had made men like him too rich (B) Globalization only benefited certain American states, such as New York (C) Liberal elites had encouraged globalization, while 'ordinary Americans' lost jobs because of it (D) Globalization encouraged damaging trade wars\nA:  (C)\n\nQ: How did the 2008 financial crisis affect America's international reputation?\n(A) It damaged support for the US model of political economy and capitalism (B) It created anger at the United States for exaggerating the crisis (C) It increased support for American global leadership under President Obama (D) It reduced global use of the US dollar\nA:  (A)\n\nQ: The realm of policy decisions concerned primarily with relations between the United States and the rest of the world is known as\n(A) terrorism policy. (B) economic policy. (C) foreign policy. (D) international policy.\nA:  (C)\n\nQ: How do Defensive Realism and Offensive Realism differ in their explanation of state behaviour?\n(A) Defensive realists place greater emphasis on the role of international institutions (B) Defensive realists place less emphasis on geographical factors (C) Offensive realists give more priority to the national interest than Defensive realists. (D) Defensive realists believe states are security maximizers, while Offensive realists believe states to be power maximizers\nA:  (D)\n\nQ: How did NSC-68 change U.S. strategy?\n(A) It globalized containment. (B) It militarized containment. (C) It called for the development of the hydrogen bomb. (D) All of the above\nA:  (D)\n\nQ: In what sense might exceptionalism link isolationist and internationalist strategies?\n(A) Both encourage world government (B) Both focus on the decline of the American power (C) It doesn't - the two are fundamentally opposed (D) Both can be viewed as different means of achieving the same liberal ends\nA: ",
        {
          "until": [
            "</s>"
          ]
        }
      ]
    ],
    "resps": [
      [
        "(D)"
      ]
    ],
    "filtered_resps": [
      "(D)"
    ],
    "exact_match": 1.0
  },
  {
    "doc_id": 77,
    "doc": {
      "question": "What policies are part of a grand strategy of Offshore Balancing?",
      "subject": "us_foreign_policy",
      "choices": [
        "Maintaining a balance between the United States and other countries and not entering into alliances",
        "Investing equally in domestic and international security with balanced protection against terrorism and other states",
        "Embrace multi-polarity, show greater restraint internationally and require other states to meet their own security burdens.",
        "Isolate the US from the international system and not seek global power"
      ],
      "answer": 2
    },
    "target": "(C)",
    "arguments": [
      [
        "The following are multiple choice questions (with answers) about us foreign policy.\n\nQ: The realm of policy decisions concerned primarily with relations between the United States and the rest of the world is known as\n(A) terrorism policy. (B) economic policy. (C) foreign policy. (D) international policy.\nA:  (C)\n\nQ: How did NSC-68 change U.S. strategy?\n(A) It globalized containment. (B) It militarized containment. (C) It called for the development of the hydrogen bomb. (D) All of the above\nA:  (D)\n\nQ: How did Donald Trump attack globalization in the 2016 campaign?\n(A) Globalization had made men like him too rich (B) Globalization only benefited certain American states, such as New York (C) Liberal elites had encouraged globalization, while 'ordinary Americans' lost jobs because of it (D) Globalization encouraged damaging trade wars\nA:  (C)\n\nQ: How do Defensive Realism and Offensive Realism differ in their explanation of state behaviour?\n(A) Defensive realists place greater emphasis on the role of international institutions (B) Defensive realists place less emphasis on geographical factors (C) Offensive realists give more priority to the national interest than Defensive realists. (D) Defensive realists believe states are security maximizers, while Offensive realists believe states to be power maximizers\nA:  (D)\n\nQ: How did the 2008 financial crisis affect America's international reputation?\n(A) It damaged support for the US model of political economy and capitalism (B) It created anger at the United States for exaggerating the crisis (C) It increased support for American global leadership under President Obama (D) It reduced global use of the US dollar\nA:  (A)\n\nQ: What policies are part of a grand strategy of Offshore Balancing?\n(A) Maintaining a balance between the United States and other countries and not entering into alliances (B) Investing equally in domestic and international security with balanced protection against terrorism and other states (C) Embrace multi-polarity, show greater restraint internationally and require other states to meet their own security burdens. (D) Isolate the US from the international system and not seek global power\nA: ",
        {
          "until": [
            "</s>"
          ]
        }
      ]
    ],
    "resps": [
      [
        "(B)"
      ]
    ],
    "filtered_resps": [
      "(B)"
    ],
    "exact_match": 0.0
  },
  {
    "doc_id": 85,
    "doc": {
      "question": "The importance of oil in shaping U.S. foreign policy helps to highlight",
      "subject": "us_foreign_policy",
      "choices": [
        "the importance of military superiority.",
        "how the importance of oil is often overexaggerated.",
        "the increasing importance of economic instruments of foreign policy.",
        "the need to drill for domestic sources."
      ],
      "answer": 2
    },
    "target": "(C)",
    "arguments": [
      [
        "The following are multiple choice questions (with answers) about us foreign policy.\n\nQ: How did NSC-68 change U.S. strategy?\n(A) It globalized containment. (B) It militarized containment. (C) It called for the development of the hydrogen bomb. (D) All of the above\nA:  (D)\n\nQ: How did the 2008 financial crisis affect America's international reputation?\n(A) It damaged support for the US model of political economy and capitalism (B) It created anger at the United States for exaggerating the crisis (C) It increased support for American global leadership under President Obama (D) It reduced global use of the US dollar\nA:  (A)\n\nQ: How do Defensive Realism and Offensive Realism differ in their explanation of state behaviour?\n(A) Defensive realists place greater emphasis on the role of international institutions (B) Defensive realists place less emphasis on geographical factors (C) Offensive realists give more priority to the national interest than Defensive realists. (D) Defensive realists believe states are security maximizers, while Offensive realists believe states to be power maximizers\nA:  (D)\n\nQ: How did Donald Trump attack globalization in the 2016 campaign?\n(A) Globalization had made men like him too rich (B) Globalization only benefited certain American states, such as New York (C) Liberal elites had encouraged globalization, while 'ordinary Americans' lost jobs because of it (D) Globalization encouraged damaging trade wars\nA:  (C)\n\nQ: The realm of policy decisions concerned primarily with relations between the United States and the rest of the world is known as\n(A) terrorism policy. (B) economic policy. (C) foreign policy. (D) international policy.\nA:  (C)\n\nQ: The importance of oil in shaping U.S. foreign policy helps to highlight\n(A) the importance of military superiority. (B) how the importance of oil is often overexaggerated. (C) the increasing importance of economic instruments of foreign policy. (D) the need to drill for domestic sources.\nA: ",
        {
          "until": [
            "</s>"
          ]
        }
      ]
    ],
    "resps": [
      [
        "(C)"
      ]
    ],
    "filtered_resps": [
      "(C)"
    ],
    "exact_match": 1.0
  },
  {
    "doc_id": 93,
    "doc": {
      "question": "What has been an effective way of disbursing US foreign aid to encourage change in target states?",
      "subject": "us_foreign_policy",
      "choices": [
        "Conditional programs, such as the Millennium Challenge, that require change before receipt of aid",
        "the use of intergovernmental organizations to monitor aid disbursement",
        "withdrawal of aid for bad policies",
        "None of the above, international aid never works"
      ],
      "answer": 0
    },
    "target": "(A)",
    "arguments": [
      [
        "The following are multiple choice questions (with answers) about us foreign policy.\n\nQ: How did the 2008 financial crisis affect America's international reputation?\n(A) It damaged support for the US model of political economy and capitalism (B) It created anger at the United States for exaggerating the crisis (C) It increased support for American global leadership under President Obama (D) It reduced global use of the US dollar\nA:  (A)\n\nQ: How did NSC-68 change U.S. strategy?\n(A) It globalized containment. (B) It militarized containment. (C) It called for the development of the hydrogen bomb. (D) All of the above\nA:  (D)\n\nQ: How did Donald Trump attack globalization in the 2016 campaign?\n(A) Globalization had made men like him too rich (B) Globalization only benefited certain American states, such as New York (C) Liberal elites had encouraged globalization, while 'ordinary Americans' lost jobs because of it (D) Globalization encouraged damaging trade wars\nA:  (C)\n\nQ: The realm of policy decisions concerned primarily with relations between the United States and the rest of the world is known as\n(A) terrorism policy. (B) economic policy. (C) foreign policy. (D) international policy.\nA:  (C)\n\nQ: How do Defensive Realism and Offensive Realism differ in their explanation of state behaviour?\n(A) Defensive realists place greater emphasis on the role of international institutions (B) Defensive realists place less emphasis on geographical factors (C) Offensive realists give more priority to the national interest than Defensive realists. (D) Defensive realists believe states are security maximizers, while Offensive realists believe states to be power maximizers\nA:  (D)\n\nQ: What has been an effective way of disbursing US foreign aid to encourage change in target states?\n(A) Conditional programs, such as the Millennium Challenge, that require change before receipt of aid (B) the use of intergovernmental organizations to monitor aid disbursement (C) withdrawal of aid for bad policies (D) None of the above, international aid never works\nA: ",
        {
          "until": [
            "</s>"
          ]
        }
      ]
    ],
    "resps": [
      [
        "(A)"
      ]
    ],
    "filtered_resps": [
      "(A)"
    ],
    "exact_match": 1.0
  },
  {
    "doc_id": 6,
    "doc": {
      "question": "Why did Franklin D. Roosevelt initially favour an 'isolationist' stance on the part of the US during the 1930s?",
      "subject": "us_foreign_policy",
      "choices": [
        "He believed that internal reform rather than international negotiation was the key to economic regeneration of the US",
        "He believed that German domination of Europe would be in US interests",
        "He always favoured isolationism",
        "All of the above"
      ],
      "answer": 0
    },
    "target": "(A)",
    "arguments": [
      [
        "The following are multiple choice questions (with answers) about us foreign policy.\n\nQ: How do Defensive Realism and Offensive Realism differ in their explanation of state behaviour?\n(A) Defensive realists place greater emphasis on the role of international institutions (B) Defensive realists place less emphasis on geographical factors (C) Offensive realists give more priority to the national interest than Defensive realists. (D) Defensive realists believe states are security maximizers, while Offensive realists believe states to be power maximizers\nA:  (D)\n\nQ: How did the 2008 financial crisis affect America's international reputation?\n(A) It damaged support for the US model of political economy and capitalism (B) It created anger at the United States for exaggerating the crisis (C) It increased support for American global leadership under President Obama (D) It reduced global use of the US dollar\nA:  (A)\n\nQ: How did Donald Trump attack globalization in the 2016 campaign?\n(A) Globalization had made men like him too rich (B) Globalization only benefited certain American states, such as New York (C) Liberal elites had encouraged globalization, while 'ordinary Americans' lost jobs because of it (D) Globalization encouraged damaging trade wars\nA:  (C)\n\nQ: The realm of policy decisions concerned primarily with relations between the United States and the rest of the world is known as\n(A) terrorism policy. (B) economic policy. (C) foreign policy. (D) international policy.\nA:  (C)\n\nQ: How did NSC-68 change U.S. strategy?\n(A) It globalized containment. (B) It militarized containment. (C) It called for the development of the hydrogen bomb. (D) All of the above\nA:  (D)\n\nQ: Why did Franklin D. Roosevelt initially favour an 'isolationist' stance on the part of the US during the 1930s?\n(A) He believed that internal reform rather than international negotiation was the key to economic regeneration of the US (B) He believed that German domination of Europe would be in US interests (C) He always favoured isolationism (D) All of the above\nA: ",
        {
          "until": [
            "</s>"
          ]
        }
      ]
    ],
    "resps": [
      [
        "(D)"
      ]
    ],
    "filtered_resps": [
      "(D)"
    ],
    "exact_match": 0.0
  },
  {
    "doc_id": 14,
    "doc": {
      "question": "Within American politics, the power to accord official recognition to other countries belongs to",
      "subject": "us_foreign_policy",
      "choices": [
        "the Senate.",
        "the president.",
        "the Secretary of State.",
        "the chairman of the Joint Chiefs."
      ],
      "answer": 1
    },
    "target": "(B)",
    "arguments": [
      [
        "The following are multiple choice questions (with answers) about us foreign policy.\n\nQ: How did the 2008 financial crisis affect America's international reputation?\n(A) It damaged support for the US model of political economy and capitalism (B) It created anger at the United States for exaggerating the crisis (C) It increased support for American global leadership under President Obama (D) It reduced global use of the US dollar\nA:  (A)\n\nQ: How did Donald Trump attack globalization in the 2016 campaign?\n(A) Globalization had made men like him too rich (B) Globalization only benefited certain American states, such as New York (C) Liberal elites had encouraged globalization, while 'ordinary Americans' lost jobs because of it (D) Globalization encouraged damaging trade wars\nA:  (C)\n\nQ: How did NSC-68 change U.S. strategy?\n(A) It globalized containment. (B) It militarized containment. (C) It called for the development of the hydrogen bomb. (D) All of the above\nA:  (D)\n\nQ: How do Defensive Realism and Offensive Realism differ in their explanation of state behaviour?\n(A) Defensive realists place greater emphasis on the role of international institutions (B) Defensive realists place less emphasis on geographical factors (C) Offensive realists give more priority to the national interest than Defensive realists. (D) Defensive realists believe states are security maximizers, while Offensive realists believe states to be power maximizers\nA:  (D)\n\nQ: The realm of policy decisions concerned primarily with relations between the United States and the rest of the world is known as\n(A) terrorism policy. (B) economic policy. (C) foreign policy. (D) international policy.\nA:  (C)\n\nQ: Within American politics, the power to accord official recognition to other countries belongs to\n(A) the Senate. (B) the president. (C) the Secretary of State. (D) the chairman of the Joint Chiefs.\nA: ",
        {
          "until": [
            "</s>"
          ]
        }
      ]
    ],
    "resps": [
      [
        "(B)"
      ]
    ],
    "filtered_resps": [
      "(B)"
    ],
    "exact_match": 1.0
  },
  {
    "doc_id": 22,
    "doc": {
      "question": "The dominant course for foreign policy throughout most of American history can be categorized as",
      "subject": "us_foreign_policy",
      "choices": [
        "containment.",
        "neoconservatism.",
        "isolationism.",
        "protectionism."
      ],
      "answer": 2
    },
    "target": "(C)",
    "arguments": [
      [
        "The following are multiple choice questions (with answers) about us foreign policy.\n\nQ: How did the 2008 financial crisis affect America's international reputation?\n(A) It damaged support for the US model of political economy and capitalism (B) It created anger at the United States for exaggerating the crisis (C) It increased support for American global leadership under President Obama (D) It reduced global use of the US dollar\nA:  (A)\n\nQ: How did Donald Trump attack globalization in the 2016 campaign?\n(A) Globalization had made men like him too rich (B) Globalization only benefited certain American states, such as New York (C) Liberal elites had encouraged globalization, while 'ordinary Americans' lost jobs because of it (D) Globalization encouraged damaging trade wars\nA:  (C)\n\nQ: How did NSC-68 change U.S. strategy?\n(A) It globalized containment. (B) It militarized containment. (C) It called for the development of the hydrogen bomb. (D) All of the above\nA:  (D)\n\nQ: The realm of policy decisions concerned primarily with relations between the United States and the rest of the world is known as\n(A) terrorism policy. (B) economic policy. (C) foreign policy. (D) international policy.\nA:  (C)\n\nQ: How do Defensive Realism and Offensive Realism differ in their explanation of state behaviour?\n(A) Defensive realists place greater emphasis on the role of international institutions (B) Defensive realists place less emphasis on geographical factors (C) Offensive realists give more priority to the national interest than Defensive realists. (D) Defensive realists believe states are security maximizers, while Offensive realists believe states to be power maximizers\nA:  (D)\n\nQ: The dominant course for foreign policy throughout most of American history can be categorized as\n(A) containment. (B) neoconservatism. (C) isolationism. (D) protectionism.\nA: ",
        {
          "until": [
            "</s>"
          ]
        }
      ]
    ],
    "resps": [
      [
        "(D)"
      ]
    ],
    "filtered_resps": [
      "(D)"
    ],
    "exact_match": 0.0
  },
  {
    "doc_id": 30,
    "doc": {
      "question": "In general, how do conservatives and liberals differ when it comes to defense spending?",
      "subject": "us_foreign_policy",
      "choices": [
        "Conservatives are skeptical of increases in defense spending; liberals advocate increases in defense spending.",
        "Conservatives favor social spending over defense spending; liberals favor defense spending over social spending.",
        "Conservatives advocate increases in defense spending; liberals are generally skeptical of increases in defense spending.",
        "Conservatives emphasize strong economies; liberals emphasize strong military readiness."
      ],
      "answer": 2
    },
    "target": "(C)",
    "arguments": [
      [
        "The following are multiple choice questions (with answers) about us foreign policy.\n\nQ: How did NSC-68 change U.S. strategy?\n(A) It globalized containment. (B) It militarized containment. (C) It called for the development of the hydrogen bomb. (D) All of the above\nA:  (D)\n\nQ: How did the 2008 financial crisis affect America's international reputation?\n(A) It damaged support for the US model of political economy and capitalism (B) It created anger at the United States for exaggerating the crisis (C) It increased support for American global leadership under President Obama (D) It reduced global use of the US dollar\nA:  (A)\n\nQ: How do Defensive Realism and Offensive Realism differ in their explanation of state behaviour?\n(A) Defensive realists place greater emphasis on the role of international institutions (B) Defensive realists place less emphasis on geographical factors (C) Offensive realists give more priority to the national interest than Defensive realists. (D) Defensive realists believe states are security maximizers, while Offensive realists believe states to be power maximizers\nA:  (D)\n\nQ: The realm of policy decisions concerned primarily with relations between the United States and the rest of the world is known as\n(A) terrorism policy. (B) economic policy. (C) foreign policy. (D) international policy.\nA:  (C)\n\nQ: How did Donald Trump attack globalization in the 2016 campaign?\n(A) Globalization had made men like him too rich (B) Globalization only benefited certain American states, such as New York (C) Liberal elites had encouraged globalization, while 'ordinary Americans' lost jobs because of it (D) Globalization encouraged damaging trade wars\nA:  (C)\n\nQ: In general, how do conservatives and liberals differ when it comes to defense spending?\n(A) Conservatives are skeptical of increases in defense spending; liberals advocate increases in defense spending. (B) Conservatives favor social spending over defense spending; liberals favor defense spending over social spending. (C) Conservatives advocate increases in defense spending; liberals are generally skeptical of increases in defense spending. (D) Conservatives emphasize strong economies; liberals emphasize strong military readiness.\nA: ",
        {
          "until": [
            "</s>"
          ]
        }
      ]
    ],
    "resps": [
      [
        "(C)"
      ]
    ],
    "filtered_resps": [
      "(C)"
    ],
    "exact_match": 1.0
  },
  {
    "doc_id": 38,
    "doc": {
      "question": "What did Charles Krauthammer mean by a 'unipolar moment' when describing the post-Cold War system?",
      "subject": "us_foreign_policy",
      "choices": [
        "The chance for the United States to share power with other countries in the world",
        "An opportunity to use to collapse of the Soviet Union to extend US power",
        "An international system that didn't face any threats",
        "The never-ending domination of the United States"
      ],
      "answer": 1
    },
    "target": "(B)",
    "arguments": [
      [
        "The following are multiple choice questions (with answers) about us foreign policy.\n\nQ: How did Donald Trump attack globalization in the 2016 campaign?\n(A) Globalization had made men like him too rich (B) Globalization only benefited certain American states, such as New York (C) Liberal elites had encouraged globalization, while 'ordinary Americans' lost jobs because of it (D) Globalization encouraged damaging trade wars\nA:  (C)\n\nQ: How do Defensive Realism and Offensive Realism differ in their explanation of state behaviour?\n(A) Defensive realists place greater emphasis on the role of international institutions (B) Defensive realists place less emphasis on geographical factors (C) Offensive realists give more priority to the national interest than Defensive realists. (D) Defensive realists believe states are security maximizers, while Offensive realists believe states to be power maximizers\nA:  (D)\n\nQ: How did the 2008 financial crisis affect America's international reputation?\n(A) It damaged support for the US model of political economy and capitalism (B) It created anger at the United States for exaggerating the crisis (C) It increased support for American global leadership under President Obama (D) It reduced global use of the US dollar\nA:  (A)\n\nQ: The realm of policy decisions concerned primarily with relations between the United States and the rest of the world is known as\n(A) terrorism policy. (B) economic policy. (C) foreign policy. (D) international policy.\nA:  (C)\n\nQ: How did NSC-68 change U.S. strategy?\n(A) It globalized containment. (B) It militarized containment. (C) It called for the development of the hydrogen bomb. (D) All of the above\nA:  (D)\n\nQ: What did Charles Krauthammer mean by a 'unipolar moment' when describing the post-Cold War system?\n(A) The chance for the United States to share power with other countries in the world (B) An opportunity to use to collapse of the Soviet Union to extend US power (C) An international system that didn't face any threats (D) The never-ending domination of the United States\nA: ",
        {
          "until": [
            "</s>"
          ]
        }
      ]
    ],
    "resps": [
      [
        "(B)"
      ]
    ],
    "filtered_resps": [
      "(B)"
    ],
    "exact_match": 1.0
  },
  {
    "doc_id": 46,
    "doc": {
      "question": "During the early years of his administration, Reagan's foreign and defense policies emphasized",
      "subject": "us_foreign_policy",
      "choices": [
        "nuclear disarmament.",
        "d\u00e9tente.",
        "anticommunism.",
        "international free trade."
      ],
      "answer": 2
    },
    "target": "(C)",
    "arguments": [
      [
        "The following are multiple choice questions (with answers) about us foreign policy.\n\nQ: How did the 2008 financial crisis affect America's international reputation?\n(A) It damaged support for the US model of political economy and capitalism (B) It created anger at the United States for exaggerating the crisis (C) It increased support for American global leadership under President Obama (D) It reduced global use of the US dollar\nA:  (A)\n\nQ: How did Donald Trump attack globalization in the 2016 campaign?\n(A) Globalization had made men like him too rich (B) Globalization only benefited certain American states, such as New York (C) Liberal elites had encouraged globalization, while 'ordinary Americans' lost jobs because of it (D) Globalization encouraged damaging trade wars\nA:  (C)\n\nQ: The realm of policy decisions concerned primarily with relations between the United States and the rest of the world is known as\n(A) terrorism policy. (B) economic policy. (C) foreign policy. (D) international policy.\nA:  (C)\n\nQ: How do Defensive Realism and Offensive Realism differ in their explanation of state behaviour?\n(A) Defensive realists place greater emphasis on the role of international institutions (B) Defensive realists place less emphasis on geographical factors (C) Offensive realists give more priority to the national interest than Defensive realists. (D) Defensive realists believe states are security maximizers, while Offensive realists believe states to be power maximizers\nA:  (D)\n\nQ: How did NSC-68 change U.S. strategy?\n(A) It globalized containment. (B) It militarized containment. (C) It called for the development of the hydrogen bomb. (D) All of the above\nA:  (D)\n\nQ: During the early years of his administration, Reagan's foreign and defense policies emphasized\n(A) nuclear disarmament. (B) d\u00e9tente. (C) anticommunism. (D) international free trade.\nA: ",
        {
          "until": [
            "</s>"
          ]
        }
      ]
    ],
    "resps": [
      [
        "(D)"
      ]
    ],
    "filtered_resps": [
      "(D)"
    ],
    "exact_match": 0.0
  },
  {
    "doc_id": 54,
    "doc": {
      "question": "What was meant by the term 'New World Order'?",
      "subject": "us_foreign_policy",
      "choices": [
        "A new democratic internationalism led by the United States",
        "A new balance of power between the US and China",
        "A new global economic framework",
        "A new era of globalization"
      ],
      "answer": 0
    },
    "target": "(A)",
    "arguments": [
      [
        "The following are multiple choice questions (with answers) about us foreign policy.\n\nQ: How did Donald Trump attack globalization in the 2016 campaign?\n(A) Globalization had made men like him too rich (B) Globalization only benefited certain American states, such as New York (C) Liberal elites had encouraged globalization, while 'ordinary Americans' lost jobs because of it (D) Globalization encouraged damaging trade wars\nA:  (C)\n\nQ: How did the 2008 financial crisis affect America's international reputation?\n(A) It damaged support for the US model of political economy and capitalism (B) It created anger at the United States for exaggerating the crisis (C) It increased support for American global leadership under President Obama (D) It reduced global use of the US dollar\nA:  (A)\n\nQ: The realm of policy decisions concerned primarily with relations between the United States and the rest of the world is known as\n(A) terrorism policy. (B) economic policy. (C) foreign policy. (D) international policy.\nA:  (C)\n\nQ: How did NSC-68 change U.S. strategy?\n(A) It globalized containment. (B) It militarized containment. (C) It called for the development of the hydrogen bomb. (D) All of the above\nA:  (D)\n\nQ: How do Defensive Realism and Offensive Realism differ in their explanation of state behaviour?\n(A) Defensive realists place greater emphasis on the role of international institutions (B) Defensive realists place less emphasis on geographical factors (C) Offensive realists give more priority to the national interest than Defensive realists. (D) Defensive realists believe states are security maximizers, while Offensive realists believe states to be power maximizers\nA:  (D)\n\nQ: What was meant by the term 'New World Order'?\n(A) A new democratic internationalism led by the United States (B) A new balance of power between the US and China (C) A new global economic framework (D) A new era of globalization\nA: ",
        {
          "until": [
            "</s>"
          ]
        }
      ]
    ],
    "resps": [
      [
        "(D)"
      ]
    ],
    "filtered_resps": [
      "(D)"
    ],
    "exact_match": 0.0
  },
  {
    "doc_id": 62,
    "doc": {
      "question": "What were the primary institutions of the liberal international economic order?\nI. GATT\nII. IMF\nIII. World Bank\nIV. NATO",
      "subject": "us_foreign_policy",
      "choices": [
        "IV only",
        "II and III",
        "I, II, and III",
        "I, II, III, and IV"
      ],
      "answer": 2
    },
    "target": "(C)",
    "arguments": [
      [
        "The following are multiple choice questions (with answers) about us foreign policy.\n\nQ: The realm of policy decisions concerned primarily with relations between the United States and the rest of the world is known as\n(A) terrorism policy. (B) economic policy. (C) foreign policy. (D) international policy.\nA:  (C)\n\nQ: How did Donald Trump attack globalization in the 2016 campaign?\n(A) Globalization had made men like him too rich (B) Globalization only benefited certain American states, such as New York (C) Liberal elites had encouraged globalization, while 'ordinary Americans' lost jobs because of it (D) Globalization encouraged damaging trade wars\nA:  (C)\n\nQ: How did the 2008 financial crisis affect America's international reputation?\n(A) It damaged support for the US model of political economy and capitalism (B) It created anger at the United States for exaggerating the crisis (C) It increased support for American global leadership under President Obama (D) It reduced global use of the US dollar\nA:  (A)\n\nQ: How do Defensive Realism and Offensive Realism differ in their explanation of state behaviour?\n(A) Defensive realists place greater emphasis on the role of international institutions (B) Defensive realists place less emphasis on geographical factors (C) Offensive realists give more priority to the national interest than Defensive realists. (D) Defensive realists believe states are security maximizers, while Offensive realists believe states to be power maximizers\nA:  (D)\n\nQ: How did NSC-68 change U.S. strategy?\n(A) It globalized containment. (B) It militarized containment. (C) It called for the development of the hydrogen bomb. (D) All of the above\nA:  (D)\n\nQ: What were the primary institutions of the liberal international economic order?\nI. GATT\nII. IMF\nIII. World Bank\nIV. NATO\n(A) IV only (B) II and III (C) I, II, and III (D) I, II, III, and IV\nA: ",
        {
          "until": [
            "</s>"
          ]
        }
      ]
    ],
    "resps": [
      [
        "(D)"
      ]
    ],
    "filtered_resps": [
      "(D)"
    ],
    "exact_match": 0.0
  },
  {
    "doc_id": 70,
    "doc": {
      "question": "Why do realists tend to object to the influence of exceptionalism on American foreign policy?",
      "subject": "us_foreign_policy",
      "choices": [
        "It leads to a diminished focus on collective security",
        "It diminishes the prospects for world government",
        "It enhances the prospects for world government",
        "It leads to a diminished focus on security, power and interest"
      ],
      "answer": 3
    },
    "target": "(D)",
    "arguments": [
      [
        "The following are multiple choice questions (with answers) about us foreign policy.\n\nQ: How did Donald Trump attack globalization in the 2016 campaign?\n(A) Globalization had made men like him too rich (B) Globalization only benefited certain American states, such as New York (C) Liberal elites had encouraged globalization, while 'ordinary Americans' lost jobs because of it (D) Globalization encouraged damaging trade wars\nA:  (C)\n\nQ: How did the 2008 financial crisis affect America's international reputation?\n(A) It damaged support for the US model of political economy and capitalism (B) It created anger at the United States for exaggerating the crisis (C) It increased support for American global leadership under President Obama (D) It reduced global use of the US dollar\nA:  (A)\n\nQ: The realm of policy decisions concerned primarily with relations between the United States and the rest of the world is known as\n(A) terrorism policy. (B) economic policy. (C) foreign policy. (D) international policy.\nA:  (C)\n\nQ: How do Defensive Realism and Offensive Realism differ in their explanation of state behaviour?\n(A) Defensive realists place greater emphasis on the role of international institutions (B) Defensive realists place less emphasis on geographical factors (C) Offensive realists give more priority to the national interest than Defensive realists. (D) Defensive realists believe states are security maximizers, while Offensive realists believe states to be power maximizers\nA:  (D)\n\nQ: How did NSC-68 change U.S. strategy?\n(A) It globalized containment. (B) It militarized containment. (C) It called for the development of the hydrogen bomb. (D) All of the above\nA:  (D)\n\nQ: Why do realists tend to object to the influence of exceptionalism on American foreign policy?\n(A) It leads to a diminished focus on collective security (B) It diminishes the prospects for world government (C) It enhances the prospects for world government (D) It leads to a diminished focus on security, power and interest\nA: ",
        {
          "until": [
            "</s>"
          ]
        }
      ]
    ],
    "resps": [
      [
        "(D)"
      ]
    ],
    "filtered_resps": [
      "(D)"
    ],
    "exact_match": 1.0
  },
  {
    "doc_id": 78,
    "doc": {
      "question": "What was the Marshall plan?",
      "subject": "us_foreign_policy",
      "choices": [
        "A plan designed to aid the economy recovery of Europe",
        "An attempt to diminish the potential attraction of the Soviet system to Europeans",
        "An aid programme that embedded US influence in Europe",
        "All of the above"
      ],
      "answer": 3
    },
    "target": "(D)",
    "arguments": [
      [
        "The following are multiple choice questions (with answers) about us foreign policy.\n\nQ: The realm of policy decisions concerned primarily with relations between the United States and the rest of the world is known as\n(A) terrorism policy. (B) economic policy. (C) foreign policy. (D) international policy.\nA:  (C)\n\nQ: How did NSC-68 change U.S. strategy?\n(A) It globalized containment. (B) It militarized containment. (C) It called for the development of the hydrogen bomb. (D) All of the above\nA:  (D)\n\nQ: How did Donald Trump attack globalization in the 2016 campaign?\n(A) Globalization had made men like him too rich (B) Globalization only benefited certain American states, such as New York (C) Liberal elites had encouraged globalization, while 'ordinary Americans' lost jobs because of it (D) Globalization encouraged damaging trade wars\nA:  (C)\n\nQ: How do Defensive Realism and Offensive Realism differ in their explanation of state behaviour?\n(A) Defensive realists place greater emphasis on the role of international institutions (B) Defensive realists place less emphasis on geographical factors (C) Offensive realists give more priority to the national interest than Defensive realists. (D) Defensive realists believe states are security maximizers, while Offensive realists believe states to be power maximizers\nA:  (D)\n\nQ: How did the 2008 financial crisis affect America's international reputation?\n(A) It damaged support for the US model of political economy and capitalism (B) It created anger at the United States for exaggerating the crisis (C) It increased support for American global leadership under President Obama (D) It reduced global use of the US dollar\nA:  (A)\n\nQ: What was the Marshall plan?\n(A) A plan designed to aid the economy recovery of Europe (B) An attempt to diminish the potential attraction of the Soviet system to Europeans (C) An aid programme that embedded US influence in Europe (D) All of the above\nA: ",
        {
          "until": [
            "</s>"
          ]
        }
      ]
    ],
    "resps": [
      [
        "(D)"
      ]
    ],
    "filtered_resps": [
      "(D)"
    ],
    "exact_match": 1.0
  },
  {
    "doc_id": 86,
    "doc": {
      "question": "The president's principal civilian adviser on the military is the",
      "subject": "us_foreign_policy",
      "choices": [
        "national security adviser.",
        "director of the CIA.",
        "secretary of defense.",
        "secretary of state."
      ],
      "answer": 2
    },
    "target": "(C)",
    "arguments": [
      [
        "The following are multiple choice questions (with answers) about us foreign policy.\n\nQ: How did NSC-68 change U.S. strategy?\n(A) It globalized containment. (B) It militarized containment. (C) It called for the development of the hydrogen bomb. (D) All of the above\nA:  (D)\n\nQ: How did the 2008 financial crisis affect America's international reputation?\n(A) It damaged support for the US model of political economy and capitalism (B) It created anger at the United States for exaggerating the crisis (C) It increased support for American global leadership under President Obama (D) It reduced global use of the US dollar\nA:  (A)\n\nQ: How do Defensive Realism and Offensive Realism differ in their explanation of state behaviour?\n(A) Defensive realists place greater emphasis on the role of international institutions (B) Defensive realists place less emphasis on geographical factors (C) Offensive realists give more priority to the national interest than Defensive realists. (D) Defensive realists believe states are security maximizers, while Offensive realists believe states to be power maximizers\nA:  (D)\n\nQ: How did Donald Trump attack globalization in the 2016 campaign?\n(A) Globalization had made men like him too rich (B) Globalization only benefited certain American states, such as New York (C) Liberal elites had encouraged globalization, while 'ordinary Americans' lost jobs because of it (D) Globalization encouraged damaging trade wars\nA:  (C)\n\nQ: The realm of policy decisions concerned primarily with relations between the United States and the rest of the world is known as\n(A) terrorism policy. (B) economic policy. (C) foreign policy. (D) international policy.\nA:  (C)\n\nQ: The president's principal civilian adviser on the military is the\n(A) national security adviser. (B) director of the CIA. (C) secretary of defense. (D) secretary of state.\nA: ",
        {
          "until": [
            "</s>"
          ]
        }
      ]
    ],
    "resps": [
      [
        "(A)"
      ]
    ],
    "filtered_resps": [
      "(A)"
    ],
    "exact_match": 0.0
  },
  {
    "doc_id": 94,
    "doc": {
      "question": "What was established at Bretton Woods in 1994 to stabilize the global economy?",
      "subject": "us_foreign_policy",
      "choices": [
        "The International Monetary Fund (IMF)",
        "The US Dollar as the world's reserve currency",
        "The General Agreement on Tariffs and Trade (GATT)",
        "All of the above"
      ],
      "answer": 3
    },
    "target": "(D)",
    "arguments": [
      [
        "The following are multiple choice questions (with answers) about us foreign policy.\n\nQ: How did the 2008 financial crisis affect America's international reputation?\n(A) It damaged support for the US model of political economy and capitalism (B) It created anger at the United States for exaggerating the crisis (C) It increased support for American global leadership under President Obama (D) It reduced global use of the US dollar\nA:  (A)\n\nQ: How did NSC-68 change U.S. strategy?\n(A) It globalized containment. (B) It militarized containment. (C) It called for the development of the hydrogen bomb. (D) All of the above\nA:  (D)\n\nQ: How did Donald Trump attack globalization in the 2016 campaign?\n(A) Globalization had made men like him too rich (B) Globalization only benefited certain American states, such as New York (C) Liberal elites had encouraged globalization, while 'ordinary Americans' lost jobs because of it (D) Globalization encouraged damaging trade wars\nA:  (C)\n\nQ: The realm of policy decisions concerned primarily with relations between the United States and the rest of the world is known as\n(A) terrorism policy. (B) economic policy. (C) foreign policy. (D) international policy.\nA:  (C)\n\nQ: How do Defensive Realism and Offensive Realism differ in their explanation of state behaviour?\n(A) Defensive realists place greater emphasis on the role of international institutions (B) Defensive realists place less emphasis on geographical factors (C) Offensive realists give more priority to the national interest than Defensive realists. (D) Defensive realists believe states are security maximizers, while Offensive realists believe states to be power maximizers\nA:  (D)\n\nQ: What was established at Bretton Woods in 1994 to stabilize the global economy?\n(A) The International Monetary Fund (IMF) (B) The US Dollar as the world's reserve currency (C) The General Agreement on Tariffs and Trade (GATT) (D) All of the above\nA: ",
        {
          "until": [
            "</s>"
          ]
        }
      ]
    ],
    "resps": [
      [
        "(D)"
      ]
    ],
    "filtered_resps": [
      "(D)"
    ],
    "exact_match": 1.0
  },
  {
    "doc_id": 7,
    "doc": {
      "question": "What was the 'New Populism'?",
      "subject": "us_foreign_policy",
      "choices": [
        "A strand of neo-isolationist sentiment",
        "A strand of internationalist sentiment",
        "An expression of American cultural superiority",
        "Increased incorporation of public opinion in foreign policy making"
      ],
      "answer": 0
    },
    "target": "(A)",
    "arguments": [
      [
        "The following are multiple choice questions (with answers) about us foreign policy.\n\nQ: How do Defensive Realism and Offensive Realism differ in their explanation of state behaviour?\n(A) Defensive realists place greater emphasis on the role of international institutions (B) Defensive realists place less emphasis on geographical factors (C) Offensive realists give more priority to the national interest than Defensive realists. (D) Defensive realists believe states are security maximizers, while Offensive realists believe states to be power maximizers\nA:  (D)\n\nQ: How did the 2008 financial crisis affect America's international reputation?\n(A) It damaged support for the US model of political economy and capitalism (B) It created anger at the United States for exaggerating the crisis (C) It increased support for American global leadership under President Obama (D) It reduced global use of the US dollar\nA:  (A)\n\nQ: How did Donald Trump attack globalization in the 2016 campaign?\n(A) Globalization had made men like him too rich (B) Globalization only benefited certain American states, such as New York (C) Liberal elites had encouraged globalization, while 'ordinary Americans' lost jobs because of it (D) Globalization encouraged damaging trade wars\nA:  (C)\n\nQ: The realm of policy decisions concerned primarily with relations between the United States and the rest of the world is known as\n(A) terrorism policy. (B) economic policy. (C) foreign policy. (D) international policy.\nA:  (C)\n\nQ: How did NSC-68 change U.S. strategy?\n(A) It globalized containment. (B) It militarized containment. (C) It called for the development of the hydrogen bomb. (D) All of the above\nA:  (D)\n\nQ: What was the 'New Populism'?\n(A) A strand of neo-isolationist sentiment (B) A strand of internationalist sentiment (C) An expression of American cultural superiority (D) Increased incorporation of public opinion in foreign policy making\nA: ",
        {
          "until": [
            "</s>"
          ]
        }
      ]
    ],
    "resps": [
      [
        "(D)"
      ]
    ],
    "filtered_resps": [
      "(D)"
    ],
    "exact_match": 0.0
  },
  {
    "doc_id": 15,
    "doc": {
      "question": "What did the Moscow Treaty on Strategic Offensive Reductions do?",
      "subject": "us_foreign_policy",
      "choices": [
        "Required the United States and Russia to demobilize their armies",
        "Required the United States and Russia to dismantle a significant number of their nuclear weapons",
        "Prohibited the acquisition of new military bases",
        "Prohibited short-range nuclear weapons"
      ],
      "answer": 1
    },
    "target": "(B)",
    "arguments": [
      [
        "The following are multiple choice questions (with answers) about us foreign policy.\n\nQ: How did the 2008 financial crisis affect America's international reputation?\n(A) It damaged support for the US model of political economy and capitalism (B) It created anger at the United States for exaggerating the crisis (C) It increased support for American global leadership under President Obama (D) It reduced global use of the US dollar\nA:  (A)\n\nQ: How did Donald Trump attack globalization in the 2016 campaign?\n(A) Globalization had made men like him too rich (B) Globalization only benefited certain American states, such as New York (C) Liberal elites had encouraged globalization, while 'ordinary Americans' lost jobs because of it (D) Globalization encouraged damaging trade wars\nA:  (C)\n\nQ: How did NSC-68 change U.S. strategy?\n(A) It globalized containment. (B) It militarized containment. (C) It called for the development of the hydrogen bomb. (D) All of the above\nA:  (D)\n\nQ: How do Defensive Realism and Offensive Realism differ in their explanation of state behaviour?\n(A) Defensive realists place greater emphasis on the role of international institutions (B) Defensive realists place less emphasis on geographical factors (C) Offensive realists give more priority to the national interest than Defensive realists. (D) Defensive realists believe states are security maximizers, while Offensive realists believe states to be power maximizers\nA:  (D)\n\nQ: The realm of policy decisions concerned primarily with relations between the United States and the rest of the world is known as\n(A) terrorism policy. (B) economic policy. (C) foreign policy. (D) international policy.\nA:  (C)\n\nQ: What did the Moscow Treaty on Strategic Offensive Reductions do?\n(A) Required the United States and Russia to demobilize their armies (B) Required the United States and Russia to dismantle a significant number of their nuclear weapons (C) Prohibited the acquisition of new military bases (D) Prohibited short-range nuclear weapons\nA: ",
        {
          "until": [
            "</s>"
          ]
        }
      ]
    ],
    "resps": [
      [
        "(A)"
      ]
    ],
    "filtered_resps": [
      "(A)"
    ],
    "exact_match": 0.0
  },
  {
    "doc_id": 23,
    "doc": {
      "question": "What led Britain to impose new taxes on their American colonies?",
      "subject": "us_foreign_policy",
      "choices": [
        "To increase the wealth of King George III",
        "The growing costs of war with France",
        "Anger at America's growing prosperity",
        "Pressure from rich merchants"
      ],
      "answer": 1
    },
    "target": "(B)",
    "arguments": [
      [
        "The following are multiple choice questions (with answers) about us foreign policy.\n\nQ: How did the 2008 financial crisis affect America's international reputation?\n(A) It damaged support for the US model of political economy and capitalism (B) It created anger at the United States for exaggerating the crisis (C) It increased support for American global leadership under President Obama (D) It reduced global use of the US dollar\nA:  (A)\n\nQ: How did Donald Trump attack globalization in the 2016 campaign?\n(A) Globalization had made men like him too rich (B) Globalization only benefited certain American states, such as New York (C) Liberal elites had encouraged globalization, while 'ordinary Americans' lost jobs because of it (D) Globalization encouraged damaging trade wars\nA:  (C)\n\nQ: How did NSC-68 change U.S. strategy?\n(A) It globalized containment. (B) It militarized containment. (C) It called for the development of the hydrogen bomb. (D) All of the above\nA:  (D)\n\nQ: The realm of policy decisions concerned primarily with relations between the United States and the rest of the world is known as\n(A) terrorism policy. (B) economic policy. (C) foreign policy. (D) international policy.\nA:  (C)\n\nQ: How do Defensive Realism and Offensive Realism differ in their explanation of state behaviour?\n(A) Defensive realists place greater emphasis on the role of international institutions (B) Defensive realists place less emphasis on geographical factors (C) Offensive realists give more priority to the national interest than Defensive realists. (D) Defensive realists believe states are security maximizers, while Offensive realists believe states to be power maximizers\nA:  (D)\n\nQ: What led Britain to impose new taxes on their American colonies?\n(A) To increase the wealth of King George III (B) The growing costs of war with France (C) Anger at America's growing prosperity (D) Pressure from rich merchants\nA: ",
        {
          "until": [
            "</s>"
          ]
        }
      ]
    ],
    "resps": [
      [
        "(B)"
      ]
    ],
    "filtered_resps": [
      "(B)"
    ],
    "exact_match": 1.0
  },
  {
    "doc_id": 31,
    "doc": {
      "question": "Intergovernmental organizations SELDOM do which of the following?",
      "subject": "us_foreign_policy",
      "choices": [
        "Provide strong enforcement",
        "Monitor parties",
        "Provide fora for discussion",
        "Reduce transaction costs for agreements"
      ],
      "answer": 0
    },
    "target": "(A)",
    "arguments": [
      [
        "The following are multiple choice questions (with answers) about us foreign policy.\n\nQ: How did NSC-68 change U.S. strategy?\n(A) It globalized containment. (B) It militarized containment. (C) It called for the development of the hydrogen bomb. (D) All of the above\nA:  (D)\n\nQ: How did the 2008 financial crisis affect America's international reputation?\n(A) It damaged support for the US model of political economy and capitalism (B) It created anger at the United States for exaggerating the crisis (C) It increased support for American global leadership under President Obama (D) It reduced global use of the US dollar\nA:  (A)\n\nQ: How do Defensive Realism and Offensive Realism differ in their explanation of state behaviour?\n(A) Defensive realists place greater emphasis on the role of international institutions (B) Defensive realists place less emphasis on geographical factors (C) Offensive realists give more priority to the national interest than Defensive realists. (D) Defensive realists believe states are security maximizers, while Offensive realists believe states to be power maximizers\nA:  (D)\n\nQ: The realm of policy decisions concerned primarily with relations between the United States and the rest of the world is known as\n(A) terrorism policy. (B) economic policy. (C) foreign policy. (D) international policy.\nA:  (C)\n\nQ: How did Donald Trump attack globalization in the 2016 campaign?\n(A) Globalization had made men like him too rich (B) Globalization only benefited certain American states, such as New York (C) Liberal elites had encouraged globalization, while 'ordinary Americans' lost jobs because of it (D) Globalization encouraged damaging trade wars\nA:  (C)\n\nQ: Intergovernmental organizations SELDOM do which of the following?\n(A) Provide strong enforcement (B) Monitor parties (C) Provide fora for discussion (D) Reduce transaction costs for agreements\nA: ",
        {
          "until": [
            "</s>"
          ]
        }
      ]
    ],
    "resps": [
      [
        "(A)"
      ]
    ],
    "filtered_resps": [
      "(A)"
    ],
    "exact_match": 1.0
  },
  {
    "doc_id": 39,
    "doc": {
      "question": "Which of the following considers it immoral to use force abroad to do good things (such human rights protection, democracy, etc)?",
      "subject": "us_foreign_policy",
      "choices": [
        "Realism",
        "Idealism",
        "Liberalism",
        "None of the above"
      ],
      "answer": 0
    },
    "target": "(A)",
    "arguments": [
      [
        "The following are multiple choice questions (with answers) about us foreign policy.\n\nQ: How did Donald Trump attack globalization in the 2016 campaign?\n(A) Globalization had made men like him too rich (B) Globalization only benefited certain American states, such as New York (C) Liberal elites had encouraged globalization, while 'ordinary Americans' lost jobs because of it (D) Globalization encouraged damaging trade wars\nA:  (C)\n\nQ: How do Defensive Realism and Offensive Realism differ in their explanation of state behaviour?\n(A) Defensive realists place greater emphasis on the role of international institutions (B) Defensive realists place less emphasis on geographical factors (C) Offensive realists give more priority to the national interest than Defensive realists. (D) Defensive realists believe states are security maximizers, while Offensive realists believe states to be power maximizers\nA:  (D)\n\nQ: How did the 2008 financial crisis affect America's international reputation?\n(A) It damaged support for the US model of political economy and capitalism (B) It created anger at the United States for exaggerating the crisis (C) It increased support for American global leadership under President Obama (D) It reduced global use of the US dollar\nA:  (A)\n\nQ: The realm of policy decisions concerned primarily with relations between the United States and the rest of the world is known as\n(A) terrorism policy. (B) economic policy. (C) foreign policy. (D) international policy.\nA:  (C)\n\nQ: How did NSC-68 change U.S. strategy?\n(A) It globalized containment. (B) It militarized containment. (C) It called for the development of the hydrogen bomb. (D) All of the above\nA:  (D)\n\nQ: Which of the following considers it immoral to use force abroad to do good things (such human rights protection, democracy, etc)?\n(A) Realism (B) Idealism (C) Liberalism (D) None of the above\nA: ",
        {
          "until": [
            "</s>"
          ]
        }
      ]
    ],
    "resps": [
      [
        "(D)"
      ]
    ],
    "filtered_resps": [
      "(D)"
    ],
    "exact_match": 0.0
  },
  {
    "doc_id": 47,
    "doc": {
      "question": "The Vietnam War can be understood as",
      "subject": "us_foreign_policy",
      "choices": [
        "a war that deeply divided the United States and fostered cynicism toward the American government.",
        "an example of the doctrine of containment, because U.S. involvement was designed to prevent the fall of South Vietnam to the communists.",
        "an example of how even a great power may not be able to prevail against a determined enemy unless there is a clear objective and the national will to do so.",
        "All of the above are true."
      ],
      "answer": 3
    },
    "target": "(D)",
    "arguments": [
      [
        "The following are multiple choice questions (with answers) about us foreign policy.\n\nQ: How did the 2008 financial crisis affect America's international reputation?\n(A) It damaged support for the US model of political economy and capitalism (B) It created anger at the United States for exaggerating the crisis (C) It increased support for American global leadership under President Obama (D) It reduced global use of the US dollar\nA:  (A)\n\nQ: How did Donald Trump attack globalization in the 2016 campaign?\n(A) Globalization had made men like him too rich (B) Globalization only benefited certain American states, such as New York (C) Liberal elites had encouraged globalization, while 'ordinary Americans' lost jobs because of it (D) Globalization encouraged damaging trade wars\nA:  (C)\n\nQ: The realm of policy decisions concerned primarily with relations between the United States and the rest of the world is known as\n(A) terrorism policy. (B) economic policy. (C) foreign policy. (D) international policy.\nA:  (C)\n\nQ: How do Defensive Realism and Offensive Realism differ in their explanation of state behaviour?\n(A) Defensive realists place greater emphasis on the role of international institutions (B) Defensive realists place less emphasis on geographical factors (C) Offensive realists give more priority to the national interest than Defensive realists. (D) Defensive realists believe states are security maximizers, while Offensive realists believe states to be power maximizers\nA:  (D)\n\nQ: How did NSC-68 change U.S. strategy?\n(A) It globalized containment. (B) It militarized containment. (C) It called for the development of the hydrogen bomb. (D) All of the above\nA:  (D)\n\nQ: The Vietnam War can be understood as\n(A) a war that deeply divided the United States and fostered cynicism toward the American government. (B) an example of the doctrine of containment, because U.S. involvement was designed to prevent the fall of South Vietnam to the communists. (C) an example of how even a great power may not be able to prevail against a determined enemy unless there is a clear objective and the national will to do so. (D) All of the above are true.\nA: ",
        {
          "until": [
            "</s>"
          ]
        }
      ]
    ],
    "resps": [
      [
        "(D)"
      ]
    ],
    "filtered_resps": [
      "(D)"
    ],
    "exact_match": 1.0
  },
  {
    "doc_id": 55,
    "doc": {
      "question": "The best known and perhaps most important international organization is",
      "subject": "us_foreign_policy",
      "choices": [
        "the United Nations.",
        "the North Atlantic Treaty Organization (NATO).",
        "the Organization of Petroleum Exporting Countries (OPEC).",
        "the World Trade Organization (WTO)."
      ],
      "answer": 0
    },
    "target": "(A)",
    "arguments": [
      [
        "The following are multiple choice questions (with answers) about us foreign policy.\n\nQ: How did Donald Trump attack globalization in the 2016 campaign?\n(A) Globalization had made men like him too rich (B) Globalization only benefited certain American states, such as New York (C) Liberal elites had encouraged globalization, while 'ordinary Americans' lost jobs because of it (D) Globalization encouraged damaging trade wars\nA:  (C)\n\nQ: How did the 2008 financial crisis affect America's international reputation?\n(A) It damaged support for the US model of political economy and capitalism (B) It created anger at the United States for exaggerating the crisis (C) It increased support for American global leadership under President Obama (D) It reduced global use of the US dollar\nA:  (A)\n\nQ: The realm of policy decisions concerned primarily with relations between the United States and the rest of the world is known as\n(A) terrorism policy. (B) economic policy. (C) foreign policy. (D) international policy.\nA:  (C)\n\nQ: How did NSC-68 change U.S. strategy?\n(A) It globalized containment. (B) It militarized containment. (C) It called for the development of the hydrogen bomb. (D) All of the above\nA:  (D)\n\nQ: How do Defensive Realism and Offensive Realism differ in their explanation of state behaviour?\n(A) Defensive realists place greater emphasis on the role of international institutions (B) Defensive realists place less emphasis on geographical factors (C) Offensive realists give more priority to the national interest than Defensive realists. (D) Defensive realists believe states are security maximizers, while Offensive realists believe states to be power maximizers\nA:  (D)\n\nQ: The best known and perhaps most important international organization is\n(A) the United Nations. (B) the North Atlantic Treaty Organization (NATO). (C) the Organization of Petroleum Exporting Countries (OPEC). (D) the World Trade Organization (WTO).\nA: ",
        {
          "until": [
            "</s>"
          ]
        }
      ]
    ],
    "resps": [
      [
        "(A)"
      ]
    ],
    "filtered_resps": [
      "(A)"
    ],
    "exact_match": 1.0
  },
  {
    "doc_id": 63,
    "doc": {
      "question": "According to Rosenau, which factor is important to consider in explaining the foreign policy behavior of the United States?",
      "subject": "us_foreign_policy",
      "choices": [
        "The external environment of the international system",
        "Domestic environment, government and bureaucracy",
        "The President's individual personality.",
        "All of the above"
      ],
      "answer": 3
    },
    "target": "(D)",
    "arguments": [
      [
        "The following are multiple choice questions (with answers) about us foreign policy.\n\nQ: The realm of policy decisions concerned primarily with relations between the United States and the rest of the world is known as\n(A) terrorism policy. (B) economic policy. (C) foreign policy. (D) international policy.\nA:  (C)\n\nQ: How did Donald Trump attack globalization in the 2016 campaign?\n(A) Globalization had made men like him too rich (B) Globalization only benefited certain American states, such as New York (C) Liberal elites had encouraged globalization, while 'ordinary Americans' lost jobs because of it (D) Globalization encouraged damaging trade wars\nA:  (C)\n\nQ: How did the 2008 financial crisis affect America's international reputation?\n(A) It damaged support for the US model of political economy and capitalism (B) It created anger at the United States for exaggerating the crisis (C) It increased support for American global leadership under President Obama (D) It reduced global use of the US dollar\nA:  (A)\n\nQ: How do Defensive Realism and Offensive Realism differ in their explanation of state behaviour?\n(A) Defensive realists place greater emphasis on the role of international institutions (B) Defensive realists place less emphasis on geographical factors (C) Offensive realists give more priority to the national interest than Defensive realists. (D) Defensive realists believe states are security maximizers, while Offensive realists believe states to be power maximizers\nA:  (D)\n\nQ: How did NSC-68 change U.S. strategy?\n(A) It globalized containment. (B) It militarized containment. (C) It called for the development of the hydrogen bomb. (D) All of the above\nA:  (D)\n\nQ: According to Rosenau, which factor is important to consider in explaining the foreign policy behavior of the United States?\n(A) The external environment of the international system (B) Domestic environment, government and bureaucracy (C) The President's individual personality. (D) All of the above\nA: ",
        {
          "until": [
            "</s>"
          ]
        }
      ]
    ],
    "resps": [
      [
        "(D)"
      ]
    ],
    "filtered_resps": [
      "(D)"
    ],
    "exact_match": 1.0
  },
  {
    "doc_id": 71,
    "doc": {
      "question": "What features distinguish Socio-Economic accounts of US Cold War foreign policy?",
      "subject": "us_foreign_policy",
      "choices": [
        "A focus on class and economic interests",
        "A focus on liberal ideology",
        "A focus on language and culture",
        "All of the above"
      ],
      "answer": 0
    },
    "target": "(A)",
    "arguments": [
      [
        "The following are multiple choice questions (with answers) about us foreign policy.\n\nQ: How did Donald Trump attack globalization in the 2016 campaign?\n(A) Globalization had made men like him too rich (B) Globalization only benefited certain American states, such as New York (C) Liberal elites had encouraged globalization, while 'ordinary Americans' lost jobs because of it (D) Globalization encouraged damaging trade wars\nA:  (C)\n\nQ: How did the 2008 financial crisis affect America's international reputation?\n(A) It damaged support for the US model of political economy and capitalism (B) It created anger at the United States for exaggerating the crisis (C) It increased support for American global leadership under President Obama (D) It reduced global use of the US dollar\nA:  (A)\n\nQ: The realm of policy decisions concerned primarily with relations between the United States and the rest of the world is known as\n(A) terrorism policy. (B) economic policy. (C) foreign policy. (D) international policy.\nA:  (C)\n\nQ: How do Defensive Realism and Offensive Realism differ in their explanation of state behaviour?\n(A) Defensive realists place greater emphasis on the role of international institutions (B) Defensive realists place less emphasis on geographical factors (C) Offensive realists give more priority to the national interest than Defensive realists. (D) Defensive realists believe states are security maximizers, while Offensive realists believe states to be power maximizers\nA:  (D)\n\nQ: How did NSC-68 change U.S. strategy?\n(A) It globalized containment. (B) It militarized containment. (C) It called for the development of the hydrogen bomb. (D) All of the above\nA:  (D)\n\nQ: What features distinguish Socio-Economic accounts of US Cold War foreign policy?\n(A) A focus on class and economic interests (B) A focus on liberal ideology (C) A focus on language and culture (D) All of the above\nA: ",
        {
          "until": [
            "</s>"
          ]
        }
      ]
    ],
    "resps": [
      [
        "(D)"
      ]
    ],
    "filtered_resps": [
      "(D)"
    ],
    "exact_match": 0.0
  },
  {
    "doc_id": 79,
    "doc": {
      "question": "What accounted for the US avoidance of catastrophe at the hands of the British in 1814?",
      "subject": "us_foreign_policy",
      "choices": [
        "Naval victories",
        "Diplomacy",
        "British preoccupation with Europe",
        "All of the above"
      ],
      "answer": 3
    },
    "target": "(D)",
    "arguments": [
      [
        "The following are multiple choice questions (with answers) about us foreign policy.\n\nQ: The realm of policy decisions concerned primarily with relations between the United States and the rest of the world is known as\n(A) terrorism policy. (B) economic policy. (C) foreign policy. (D) international policy.\nA:  (C)\n\nQ: How did NSC-68 change U.S. strategy?\n(A) It globalized containment. (B) It militarized containment. (C) It called for the development of the hydrogen bomb. (D) All of the above\nA:  (D)\n\nQ: How did Donald Trump attack globalization in the 2016 campaign?\n(A) Globalization had made men like him too rich (B) Globalization only benefited certain American states, such as New York (C) Liberal elites had encouraged globalization, while 'ordinary Americans' lost jobs because of it (D) Globalization encouraged damaging trade wars\nA:  (C)\n\nQ: How do Defensive Realism and Offensive Realism differ in their explanation of state behaviour?\n(A) Defensive realists place greater emphasis on the role of international institutions (B) Defensive realists place less emphasis on geographical factors (C) Offensive realists give more priority to the national interest than Defensive realists. (D) Defensive realists believe states are security maximizers, while Offensive realists believe states to be power maximizers\nA:  (D)\n\nQ: How did the 2008 financial crisis affect America's international reputation?\n(A) It damaged support for the US model of political economy and capitalism (B) It created anger at the United States for exaggerating the crisis (C) It increased support for American global leadership under President Obama (D) It reduced global use of the US dollar\nA:  (A)\n\nQ: What accounted for the US avoidance of catastrophe at the hands of the British in 1814?\n(A) Naval victories (B) Diplomacy (C) British preoccupation with Europe (D) All of the above\nA: ",
        {
          "until": [
            "</s>"
          ]
        }
      ]
    ],
    "resps": [
      [
        "(D)"
      ]
    ],
    "filtered_resps": [
      "(D)"
    ],
    "exact_match": 1.0
  },
  {
    "doc_id": 87,
    "doc": {
      "question": "How do Ideational approaches to US foreign policy during the Cold War differ from Realist accounts of the same period?",
      "subject": "us_foreign_policy",
      "choices": [
        "They place greater emphasis on economic factors",
        "They place greater emphasis on material interests and power",
        "They place greater emphasis on ideology and beliefs",
        "They place greater emphasis on geopolitics"
      ],
      "answer": 2
    },
    "target": "(C)",
    "arguments": [
      [
        "The following are multiple choice questions (with answers) about us foreign policy.\n\nQ: How did NSC-68 change U.S. strategy?\n(A) It globalized containment. (B) It militarized containment. (C) It called for the development of the hydrogen bomb. (D) All of the above\nA:  (D)\n\nQ: How did the 2008 financial crisis affect America's international reputation?\n(A) It damaged support for the US model of political economy and capitalism (B) It created anger at the United States for exaggerating the crisis (C) It increased support for American global leadership under President Obama (D) It reduced global use of the US dollar\nA:  (A)\n\nQ: How do Defensive Realism and Offensive Realism differ in their explanation of state behaviour?\n(A) Defensive realists place greater emphasis on the role of international institutions (B) Defensive realists place less emphasis on geographical factors (C) Offensive realists give more priority to the national interest than Defensive realists. (D) Defensive realists believe states are security maximizers, while Offensive realists believe states to be power maximizers\nA:  (D)\n\nQ: How did Donald Trump attack globalization in the 2016 campaign?\n(A) Globalization had made men like him too rich (B) Globalization only benefited certain American states, such as New York (C) Liberal elites had encouraged globalization, while 'ordinary Americans' lost jobs because of it (D) Globalization encouraged damaging trade wars\nA:  (C)\n\nQ: The realm of policy decisions concerned primarily with relations between the United States and the rest of the world is known as\n(A) terrorism policy. (B) economic policy. (C) foreign policy. (D) international policy.\nA:  (C)\n\nQ: How do Ideational approaches to US foreign policy during the Cold War differ from Realist accounts of the same period?\n(A) They place greater emphasis on economic factors (B) They place greater emphasis on material interests and power (C) They place greater emphasis on ideology and beliefs (D) They place greater emphasis on geopolitics\nA: ",
        {
          "until": [
            "</s>"
          ]
        }
      ]
    ],
    "resps": [
      [
        "(C)"
      ]
    ],
    "filtered_resps": [
      "(C)"
    ],
    "exact_match": 1.0
  },
  {
    "doc_id": 95,
    "doc": {
      "question": "Which of the following is NOT a good predictor of which states will get nuclear weapons?",
      "subject": "us_foreign_policy",
      "choices": [
        "Receipt of sensitive nuclear assistance",
        "Wealth/GDP",
        "Rivalry with a nuclear state",
        "Regime type"
      ],
      "answer": 3
    },
    "target": "(D)",
    "arguments": [
      [
        "The following are multiple choice questions (with answers) about us foreign policy.\n\nQ: How did the 2008 financial crisis affect America's international reputation?\n(A) It damaged support for the US model of political economy and capitalism (B) It created anger at the United States for exaggerating the crisis (C) It increased support for American global leadership under President Obama (D) It reduced global use of the US dollar\nA:  (A)\n\nQ: How did NSC-68 change U.S. strategy?\n(A) It globalized containment. (B) It militarized containment. (C) It called for the development of the hydrogen bomb. (D) All of the above\nA:  (D)\n\nQ: How did Donald Trump attack globalization in the 2016 campaign?\n(A) Globalization had made men like him too rich (B) Globalization only benefited certain American states, such as New York (C) Liberal elites had encouraged globalization, while 'ordinary Americans' lost jobs because of it (D) Globalization encouraged damaging trade wars\nA:  (C)\n\nQ: The realm of policy decisions concerned primarily with relations between the United States and the rest of the world is known as\n(A) terrorism policy. (B) economic policy. (C) foreign policy. (D) international policy.\nA:  (C)\n\nQ: How do Defensive Realism and Offensive Realism differ in their explanation of state behaviour?\n(A) Defensive realists place greater emphasis on the role of international institutions (B) Defensive realists place less emphasis on geographical factors (C) Offensive realists give more priority to the national interest than Defensive realists. (D) Defensive realists believe states are security maximizers, while Offensive realists believe states to be power maximizers\nA:  (D)\n\nQ: Which of the following is NOT a good predictor of which states will get nuclear weapons?\n(A) Receipt of sensitive nuclear assistance (B) Wealth/GDP (C) Rivalry with a nuclear state (D) Regime type\nA: ",
        {
          "until": [
            "</s>"
          ]
        }
      ]
    ],
    "resps": [
      [
        "(B)"
      ]
    ],
    "filtered_resps": [
      "(B)"
    ],
    "exact_match": 0.0
  }
]