[
  {
    "doc_id": 0,
    "doc": {
      "question": "One of the aims of philosophy is to think critically about whether there are good reasons for adopting our beliefs.  Reasons are considered \"good reasons\" if they are consistent with everyday experience and:",
      "subject": "philosophy",
      "choices": [
        "are part of a set of religious, moral, or political beliefs that an individual feels deeply about.",
        "are considered good by at least one culture, sub-culture, or individual.",
        "cannot be interpreted in different ways by different people or cultures.",
        "take into account objections, are acceptable to impartial third parties, and avoid undesirable consequences."
      ],
      "answer": 3
    },
    "target": "(D)",
    "arguments": [
      [
        "The following are multiple choice questions (with answers) about philosophy.\n\nQ: The study of reality in the broadest sense, an inquiry into the elemental nature of the universe and the things in it, is known as _____.\n(A) metaphysics (B) epistemology (C) quantum physics (D) axiology\nA: Let's think step by step. We refer to Wikipedia articles on philosophy for help. Among the options, only metaphysics studies the nature of reality and existence. The answer is (A).\n\nQ: According to Moore\u2019s \u201cideal utilitarianism,\u201d the right action is the one that brings about the greatest amount of:\n(A) pleasure. (B) happiness. (C) good. (D) virtue.\nA: Let's think step by step. We refer to Wikipedia articles on philosophy for help. Moore's \"ideal utilitarianism\" states that one's actions should maximize intrinsic goods. The answer is (C).\n\nQ: Before Tolstoy's Christian conversion, what was his perspective on the meaning of life?\n(A) optimist (B) satisfied (C) nominally religious (D) pessimist\nA: Let's think step by step. We refer to Wikipedia articles on philosophy for help. Before his conversion, Tolstoy feels that life was uncertain, which is a pessimist's point of view. The answer is (D).\n\nQ: According to d'Holbach, people always act according to _____.\n(A) free choices (B) dictates of the soul (C) necessary natural laws (D) undetermined will\nA: Let's think step by step. We refer to Wikipedia articles on philosophy for help. d'Holbach believes that people act according to necessary laws, and it proves nothing about people's free will. The answer is (C).\n\nQ: Psychological egoism is:\n(A) an ethical theory about how we ought to behave. (B) a generalization concerning the way people tend to behave. (C) a claim about human nature and the ways people are capable of behaving. (D) none of the above.\nA: Let's think step by step. We refer to Wikipedia articles on philosophy for help. Psychological egoism suggests that one behaves based on what makes one feels good, hence it is a claim about human nature and how humans are capable of behaving. The answer is (C).Q: One of the aims of philosophy is to think critically about whether there are good reasons for adopting our beliefs.  Reasons are considered \"good reasons\" if they are consistent with everyday experience and:\n(A) are part of a set of religious, moral, or political beliefs that an individual feels deeply about. (B) are considered good by at least one culture, sub-culture, or individual. (C) cannot be interpreted in different ways by different people or cultures. (D) take into account objections, are acceptable to impartial third parties, and avoid undesirable consequences.\nA: Let's think step by step.",
        {
          "until": [
            "</s>"
          ],
          "do_sample": false,
          "temperature": 0.0
        }
      ]
    ],
    "resps": [
      [
        "The philosophy of philosophy is to think critically about whether there are good reasons for adopting our beliefs. Reasons are considered \"good reasons\" if they are consistent with everyday experience and: (A) are part of a set of religious, moral, or political beliefs that an individual feels deeply about. (B) are considered good by at least one culture, sub-culture, or individual. (C) cannot be interpreted in different ways by different people or cultures. The answer is (C)."
      ]
    ],
    "filtered_resps": [
      "(C)"
    ],
    "exact_match": 0.0
  },
  {
    "doc_id": 8,
    "doc": {
      "question": "According to Locke, the legislative power is limited by _____.",
      "subject": "philosophy",
      "choices": [
        "the impartial rule of established laws",
        "different rules for rich and poor",
        "laws established for the good of the state",
        "a monarch"
      ],
      "answer": 0
    },
    "target": "(A)",
    "arguments": [
      [
        "The following are multiple choice questions (with answers) about philosophy.\n\nQ: The study of reality in the broadest sense, an inquiry into the elemental nature of the universe and the things in it, is known as _____.\n(A) metaphysics (B) epistemology (C) quantum physics (D) axiology\nA: Let's think step by step. We refer to Wikipedia articles on philosophy for help. Among the options, only metaphysics studies the nature of reality and existence. The answer is (A).\n\nQ: According to Moore\u2019s \u201cideal utilitarianism,\u201d the right action is the one that brings about the greatest amount of:\n(A) pleasure. (B) happiness. (C) good. (D) virtue.\nA: Let's think step by step. We refer to Wikipedia articles on philosophy for help. Moore's \"ideal utilitarianism\" states that one's actions should maximize intrinsic goods. The answer is (C).\n\nQ: Before Tolstoy's Christian conversion, what was his perspective on the meaning of life?\n(A) optimist (B) satisfied (C) nominally religious (D) pessimist\nA: Let's think step by step. We refer to Wikipedia articles on philosophy for help. Before his conversion, Tolstoy feels that life was uncertain, which is a pessimist's point of view. The answer is (D).\n\nQ: According to d'Holbach, people always act according to _____.\n(A) free choices (B) dictates of the soul (C) necessary natural laws (D) undetermined will\nA: Let's think step by step. We refer to Wikipedia articles on philosophy for help. d'Holbach believes that people act according to necessary laws, and it proves nothing about people's free will. The answer is (C).\n\nQ: Psychological egoism is:\n(A) an ethical theory about how we ought to behave. (B) a generalization concerning the way people tend to behave. (C) a claim about human nature and the ways people are capable of behaving. (D) none of the above.\nA: Let's think step by step. We refer to Wikipedia articles on philosophy for help. Psychological egoism suggests that one behaves based on what makes one feels good, hence it is a claim about human nature and how humans are capable of behaving. The answer is (C).Q: According to Locke, the legislative power is limited by _____.\n(A) the impartial rule of established laws (B) different rules for rich and poor (C) laws established for the good of the state (D) a monarch\nA: Let's think step by step.",
        {
          "until": [
            "</s>"
          ],
          "do_sample": false,
          "temperature": 0.0
        }
      ]
    ],
    "resps": [
      [
        "The impartial rule of established laws is the power to decide the laws of the state. Locke states that the impartial rule of established laws is the power to decide the laws of the state. The answer is (A)."
      ]
    ],
    "filtered_resps": [
      "(A)"
    ],
    "exact_match": 1.0
  },
  {
    "doc_id": 16,
    "doc": {
      "question": "According to Kant, the basis of morality is the concept of:",
      "subject": "philosophy",
      "choices": [
        "charity.",
        "fairness.",
        "piety.",
        "freedom."
      ],
      "answer": 3
    },
    "target": "(D)",
    "arguments": [
      [
        "The following are multiple choice questions (with answers) about philosophy.\n\nQ: The study of reality in the broadest sense, an inquiry into the elemental nature of the universe and the things in it, is known as _____.\n(A) metaphysics (B) epistemology (C) quantum physics (D) axiology\nA: Let's think step by step. We refer to Wikipedia articles on philosophy for help. Among the options, only metaphysics studies the nature of reality and existence. The answer is (A).\n\nQ: According to Moore\u2019s \u201cideal utilitarianism,\u201d the right action is the one that brings about the greatest amount of:\n(A) pleasure. (B) happiness. (C) good. (D) virtue.\nA: Let's think step by step. We refer to Wikipedia articles on philosophy for help. Moore's \"ideal utilitarianism\" states that one's actions should maximize intrinsic goods. The answer is (C).\n\nQ: Before Tolstoy's Christian conversion, what was his perspective on the meaning of life?\n(A) optimist (B) satisfied (C) nominally religious (D) pessimist\nA: Let's think step by step. We refer to Wikipedia articles on philosophy for help. Before his conversion, Tolstoy feels that life was uncertain, which is a pessimist's point of view. The answer is (D).\n\nQ: According to d'Holbach, people always act according to _____.\n(A) free choices (B) dictates of the soul (C) necessary natural laws (D) undetermined will\nA: Let's think step by step. We refer to Wikipedia articles on philosophy for help. d'Holbach believes that people act according to necessary laws, and it proves nothing about people's free will. The answer is (C).\n\nQ: Psychological egoism is:\n(A) an ethical theory about how we ought to behave. (B) a generalization concerning the way people tend to behave. (C) a claim about human nature and the ways people are capable of behaving. (D) none of the above.\nA: Let's think step by step. We refer to Wikipedia articles on philosophy for help. Psychological egoism suggests that one behaves based on what makes one feels good, hence it is a claim about human nature and how humans are capable of behaving. The answer is (C).Q: According to Kant, the basis of morality is the concept of:\n(A) charity. (B) fairness. (C) piety. (D) freedom.\nA: Let's think step by step.",
        {
          "until": [
            "</s>"
          ],
          "do_sample": false,
          "temperature": 0.0
        }
      ]
    ],
    "resps": [
      [
        "The concept of morality is the foundation of all morality. Kant's philosophy of morality states that the concept of morality is the foundation of all morality. The answer is (B)."
      ]
    ],
    "filtered_resps": [
      "(B)"
    ],
    "exact_match": 0.0
  },
  {
    "doc_id": 24,
    "doc": {
      "question": "Socrates suggests that the holy is one part of:",
      "subject": "philosophy",
      "choices": [
        "what is prudent.",
        "what is just.",
        "what is beautiful.",
        "what is legal."
      ],
      "answer": 1
    },
    "target": "(B)",
    "arguments": [
      [
        "The following are multiple choice questions (with answers) about philosophy.\n\nQ: The study of reality in the broadest sense, an inquiry into the elemental nature of the universe and the things in it, is known as _____.\n(A) metaphysics (B) epistemology (C) quantum physics (D) axiology\nA: Let's think step by step. We refer to Wikipedia articles on philosophy for help. Among the options, only metaphysics studies the nature of reality and existence. The answer is (A).\n\nQ: According to Moore\u2019s \u201cideal utilitarianism,\u201d the right action is the one that brings about the greatest amount of:\n(A) pleasure. (B) happiness. (C) good. (D) virtue.\nA: Let's think step by step. We refer to Wikipedia articles on philosophy for help. Moore's \"ideal utilitarianism\" states that one's actions should maximize intrinsic goods. The answer is (C).\n\nQ: Before Tolstoy's Christian conversion, what was his perspective on the meaning of life?\n(A) optimist (B) satisfied (C) nominally religious (D) pessimist\nA: Let's think step by step. We refer to Wikipedia articles on philosophy for help. Before his conversion, Tolstoy feels that life was uncertain, which is a pessimist's point of view. The answer is (D).\n\nQ: According to d'Holbach, people always act according to _____.\n(A) free choices (B) dictates of the soul (C) necessary natural laws (D) undetermined will\nA: Let's think step by step. We refer to Wikipedia articles on philosophy for help. d'Holbach believes that people act according to necessary laws, and it proves nothing about people's free will. The answer is (C).\n\nQ: Psychological egoism is:\n(A) an ethical theory about how we ought to behave. (B) a generalization concerning the way people tend to behave. (C) a claim about human nature and the ways people are capable of behaving. (D) none of the above.\nA: Let's think step by step. We refer to Wikipedia articles on philosophy for help. Psychological egoism suggests that one behaves based on what makes one feels good, hence it is a claim about human nature and how humans are capable of behaving. The answer is (C).Q: Socrates suggests that the holy is one part of:\n(A) what is prudent. (B) what is just. (C) what is beautiful. (D) what is legal.\nA: Let's think step by step.",
        {
          "until": [
            "</s>"
          ],
          "do_sample": false,
          "temperature": 0.0
        }
      ]
    ],
    "resps": [
      [
        "The holy is the part of what is just. Socrates says that the holy is one part of what is just. The answer is (B)."
      ]
    ],
    "filtered_resps": [
      "(B)"
    ],
    "exact_match": 1.0
  },
  {
    "doc_id": 32,
    "doc": {
      "question": "One of the tasks of philosophy is to test conceptual frameworks for depth and consistency.  It does this through (1) expressing our ideas in clear, concise language and (2) supporting those ideas with reasons and with overcoming objections to them.  Philosophy thus emphasizes the need to:",
      "subject": "philosophy",
      "choices": [
        "pose questions that can be resolved not by reasoning but only by faith or personal belief.",
        "show why the beliefs adopted by most people in a culture are preferable since more people understand those beliefs and see no reason to raise objections to them.",
        "articulate what we mean by our beliefs and to justify our beliefs by arguments.",
        "develop a set of ideas about the nature of society (i.e., an ideology) that can be used to support a religious conceptual framework."
      ],
      "answer": 2
    },
    "target": "(C)",
    "arguments": [
      [
        "The following are multiple choice questions (with answers) about philosophy.\n\nQ: The study of reality in the broadest sense, an inquiry into the elemental nature of the universe and the things in it, is known as _____.\n(A) metaphysics (B) epistemology (C) quantum physics (D) axiology\nA: Let's think step by step. We refer to Wikipedia articles on philosophy for help. Among the options, only metaphysics studies the nature of reality and existence. The answer is (A).\n\nQ: According to Moore\u2019s \u201cideal utilitarianism,\u201d the right action is the one that brings about the greatest amount of:\n(A) pleasure. (B) happiness. (C) good. (D) virtue.\nA: Let's think step by step. We refer to Wikipedia articles on philosophy for help. Moore's \"ideal utilitarianism\" states that one's actions should maximize intrinsic goods. The answer is (C).\n\nQ: Before Tolstoy's Christian conversion, what was his perspective on the meaning of life?\n(A) optimist (B) satisfied (C) nominally religious (D) pessimist\nA: Let's think step by step. We refer to Wikipedia articles on philosophy for help. Before his conversion, Tolstoy feels that life was uncertain, which is a pessimist's point of view. The answer is (D).\n\nQ: According to d'Holbach, people always act according to _____.\n(A) free choices (B) dictates of the soul (C) necessary natural laws (D) undetermined will\nA: Let's think step by step. We refer to Wikipedia articles on philosophy for help. d'Holbach believes that people act according to necessary laws, and it proves nothing about people's free will. The answer is (C).\n\nQ: Psychological egoism is:\n(A) an ethical theory about how we ought to behave. (B) a generalization concerning the way people tend to behave. (C) a claim about human nature and the ways people are capable of behaving. (D) none of the above.\nA: Let's think step by step. We refer to Wikipedia articles on philosophy for help. Psychological egoism suggests that one behaves based on what makes one feels good, hence it is a claim about human nature and how humans are capable of behaving. The answer is (C).Q: One of the tasks of philosophy is to test conceptual frameworks for depth and consistency.  It does this through (1) expressing our ideas in clear, concise language and (2) supporting those ideas with reasons and with overcoming objections to them.  Philosophy thus emphasizes the need to:\n(A) pose questions that can be resolved not by reasoning but only by faith or personal belief. (B) show why the beliefs adopted by most people in a culture are preferable since more people understand those beliefs and see no reason to raise objections to them. (C) articulate what we mean by our beliefs and to justify our beliefs by arguments. (D) develop a set of ideas about the nature of society (i.e., an ideology) that can be used to support a religious conceptual framework.\nA: Let's think step by step.",
        {
          "until": [
            "</s>"
          ],
          "do_sample": false,
          "temperature": 0.0
        }
      ]
    ],
    "resps": [
      [
        "Philosophy is a discipline that tests conceptual frameworks for depth and consistency. Philosophy is a discipline that tests conceptual frameworks for depth and consistency. The answer is (C)."
      ]
    ],
    "filtered_resps": [
      "(C)"
    ],
    "exact_match": 1.0
  },
  {
    "doc_id": 1,
    "doc": {
      "question": "The existence of a form of mental illness known as multiple personality disorder seems to suggest that _____.",
      "subject": "philosophy",
      "choices": [
        "the existence of the mind is a delusion",
        "the mind is divisible",
        "the mind is indivisible",
        "mental illness is incurable"
      ],
      "answer": 1
    },
    "target": "(B)",
    "arguments": [
      [
        "The following are multiple choice questions (with answers) about philosophy.\n\nQ: The study of reality in the broadest sense, an inquiry into the elemental nature of the universe and the things in it, is known as _____.\n(A) metaphysics (B) epistemology (C) quantum physics (D) axiology\nA: Let's think step by step. We refer to Wikipedia articles on philosophy for help. Among the options, only metaphysics studies the nature of reality and existence. The answer is (A).\n\nQ: According to Moore\u2019s \u201cideal utilitarianism,\u201d the right action is the one that brings about the greatest amount of:\n(A) pleasure. (B) happiness. (C) good. (D) virtue.\nA: Let's think step by step. We refer to Wikipedia articles on philosophy for help. Moore's \"ideal utilitarianism\" states that one's actions should maximize intrinsic goods. The answer is (C).\n\nQ: Before Tolstoy's Christian conversion, what was his perspective on the meaning of life?\n(A) optimist (B) satisfied (C) nominally religious (D) pessimist\nA: Let's think step by step. We refer to Wikipedia articles on philosophy for help. Before his conversion, Tolstoy feels that life was uncertain, which is a pessimist's point of view. The answer is (D).\n\nQ: According to d'Holbach, people always act according to _____.\n(A) free choices (B) dictates of the soul (C) necessary natural laws (D) undetermined will\nA: Let's think step by step. We refer to Wikipedia articles on philosophy for help. d'Holbach believes that people act according to necessary laws, and it proves nothing about people's free will. The answer is (C).\n\nQ: Psychological egoism is:\n(A) an ethical theory about how we ought to behave. (B) a generalization concerning the way people tend to behave. (C) a claim about human nature and the ways people are capable of behaving. (D) none of the above.\nA: Let's think step by step. We refer to Wikipedia articles on philosophy for help. Psychological egoism suggests that one behaves based on what makes one feels good, hence it is a claim about human nature and how humans are capable of behaving. The answer is (C).Q: The existence of a form of mental illness known as multiple personality disorder seems to suggest that _____.\n(A) the existence of the mind is a delusion (B) the mind is divisible (C) the mind is indivisible (D) mental illness is incurable\nA: Let's think step by step.",
        {
          "until": [
            "</s>"
          ],
          "do_sample": false,
          "temperature": 0.0
        }
      ]
    ],
    "resps": [
      [
        "The existence of a mental illness known as multiple personality disorder seems to suggest that _. The answer is (A)."
      ]
    ],
    "filtered_resps": [
      "(A)"
    ],
    "exact_match": 0.0
  },
  {
    "doc_id": 9,
    "doc": {
      "question": "According to James, indeterminism allows that the world has _____.",
      "subject": "philosophy",
      "choices": [
        "no ambiguous possibilities",
        "a fixed future",
        "ambiguous possibilities",
        "no shadow of turning"
      ],
      "answer": 2
    },
    "target": "(C)",
    "arguments": [
      [
        "The following are multiple choice questions (with answers) about philosophy.\n\nQ: The study of reality in the broadest sense, an inquiry into the elemental nature of the universe and the things in it, is known as _____.\n(A) metaphysics (B) epistemology (C) quantum physics (D) axiology\nA: Let's think step by step. We refer to Wikipedia articles on philosophy for help. Among the options, only metaphysics studies the nature of reality and existence. The answer is (A).\n\nQ: According to Moore\u2019s \u201cideal utilitarianism,\u201d the right action is the one that brings about the greatest amount of:\n(A) pleasure. (B) happiness. (C) good. (D) virtue.\nA: Let's think step by step. We refer to Wikipedia articles on philosophy for help. Moore's \"ideal utilitarianism\" states that one's actions should maximize intrinsic goods. The answer is (C).\n\nQ: Before Tolstoy's Christian conversion, what was his perspective on the meaning of life?\n(A) optimist (B) satisfied (C) nominally religious (D) pessimist\nA: Let's think step by step. We refer to Wikipedia articles on philosophy for help. Before his conversion, Tolstoy feels that life was uncertain, which is a pessimist's point of view. The answer is (D).\n\nQ: According to d'Holbach, people always act according to _____.\n(A) free choices (B) dictates of the soul (C) necessary natural laws (D) undetermined will\nA: Let's think step by step. We refer to Wikipedia articles on philosophy for help. d'Holbach believes that people act according to necessary laws, and it proves nothing about people's free will. The answer is (C).\n\nQ: Psychological egoism is:\n(A) an ethical theory about how we ought to behave. (B) a generalization concerning the way people tend to behave. (C) a claim about human nature and the ways people are capable of behaving. (D) none of the above.\nA: Let's think step by step. We refer to Wikipedia articles on philosophy for help. Psychological egoism suggests that one behaves based on what makes one feels good, hence it is a claim about human nature and how humans are capable of behaving. The answer is (C).Q: According to James, indeterminism allows that the world has _____.\n(A) no ambiguous possibilities (B) a fixed future (C) ambiguous possibilities (D) no shadow of turning\nA: Let's think step by step.",
        {
          "until": [
            "</s>"
          ],
          "do_sample": false,
          "temperature": 0.0
        }
      ]
    ],
    "resps": [
      [
        "Indeterminism allows the world to have ambiguous possibilities. James states that indeterminism allows the world to have ambiguous possibilities. The answer is (B)."
      ]
    ],
    "filtered_resps": [
      "(B)"
    ],
    "exact_match": 0.0
  },
  {
    "doc_id": 17,
    "doc": {
      "question": "According to Taylor, hard determinism conflicts with _____.",
      "subject": "philosophy",
      "choices": [
        "the findings of science",
        "the fact of deliberation and our sense that some actions are up to us",
        "the fact of deliberation and indeterminism",
        "scientific determinism"
      ],
      "answer": 1
    },
    "target": "(B)",
    "arguments": [
      [
        "The following are multiple choice questions (with answers) about philosophy.\n\nQ: The study of reality in the broadest sense, an inquiry into the elemental nature of the universe and the things in it, is known as _____.\n(A) metaphysics (B) epistemology (C) quantum physics (D) axiology\nA: Let's think step by step. We refer to Wikipedia articles on philosophy for help. Among the options, only metaphysics studies the nature of reality and existence. The answer is (A).\n\nQ: According to Moore\u2019s \u201cideal utilitarianism,\u201d the right action is the one that brings about the greatest amount of:\n(A) pleasure. (B) happiness. (C) good. (D) virtue.\nA: Let's think step by step. We refer to Wikipedia articles on philosophy for help. Moore's \"ideal utilitarianism\" states that one's actions should maximize intrinsic goods. The answer is (C).\n\nQ: Before Tolstoy's Christian conversion, what was his perspective on the meaning of life?\n(A) optimist (B) satisfied (C) nominally religious (D) pessimist\nA: Let's think step by step. We refer to Wikipedia articles on philosophy for help. Before his conversion, Tolstoy feels that life was uncertain, which is a pessimist's point of view. The answer is (D).\n\nQ: According to d'Holbach, people always act according to _____.\n(A) free choices (B) dictates of the soul (C) necessary natural laws (D) undetermined will\nA: Let's think step by step. We refer to Wikipedia articles on philosophy for help. d'Holbach believes that people act according to necessary laws, and it proves nothing about people's free will. The answer is (C).\n\nQ: Psychological egoism is:\n(A) an ethical theory about how we ought to behave. (B) a generalization concerning the way people tend to behave. (C) a claim about human nature and the ways people are capable of behaving. (D) none of the above.\nA: Let's think step by step. We refer to Wikipedia articles on philosophy for help. Psychological egoism suggests that one behaves based on what makes one feels good, hence it is a claim about human nature and how humans are capable of behaving. The answer is (C).Q: According to Taylor, hard determinism conflicts with _____.\n(A) the findings of science (B) the fact of deliberation and our sense that some actions are up to us (C) the fact of deliberation and indeterminism (D) scientific determinism\nA: Let's think step by step.",
        {
          "until": [
            "</s>"
          ],
          "do_sample": false,
          "temperature": 0.0
        }
      ]
    ],
    "resps": [
      [
        "(B) Hard determinism is a theory of the nature of the universe. Taylor's theory of the universe is based on the fact that some actions are up to us. The answer is (B)."
      ]
    ],
    "filtered_resps": [
      "(B)"
    ],
    "exact_match": 1.0
  },
  {
    "doc_id": 25,
    "doc": {
      "question": "Baggini says that almost all deniers of meaning in life really seem to be rejecting only the idea that life has _____.",
      "subject": "philosophy",
      "choices": [
        "internal meaning",
        "external meaning",
        "religious meaning",
        "secular meaning"
      ],
      "answer": 1
    },
    "target": "(B)",
    "arguments": [
      [
        "The following are multiple choice questions (with answers) about philosophy.\n\nQ: The study of reality in the broadest sense, an inquiry into the elemental nature of the universe and the things in it, is known as _____.\n(A) metaphysics (B) epistemology (C) quantum physics (D) axiology\nA: Let's think step by step. We refer to Wikipedia articles on philosophy for help. Among the options, only metaphysics studies the nature of reality and existence. The answer is (A).\n\nQ: According to Moore\u2019s \u201cideal utilitarianism,\u201d the right action is the one that brings about the greatest amount of:\n(A) pleasure. (B) happiness. (C) good. (D) virtue.\nA: Let's think step by step. We refer to Wikipedia articles on philosophy for help. Moore's \"ideal utilitarianism\" states that one's actions should maximize intrinsic goods. The answer is (C).\n\nQ: Before Tolstoy's Christian conversion, what was his perspective on the meaning of life?\n(A) optimist (B) satisfied (C) nominally religious (D) pessimist\nA: Let's think step by step. We refer to Wikipedia articles on philosophy for help. Before his conversion, Tolstoy feels that life was uncertain, which is a pessimist's point of view. The answer is (D).\n\nQ: According to d'Holbach, people always act according to _____.\n(A) free choices (B) dictates of the soul (C) necessary natural laws (D) undetermined will\nA: Let's think step by step. We refer to Wikipedia articles on philosophy for help. d'Holbach believes that people act according to necessary laws, and it proves nothing about people's free will. The answer is (C).\n\nQ: Psychological egoism is:\n(A) an ethical theory about how we ought to behave. (B) a generalization concerning the way people tend to behave. (C) a claim about human nature and the ways people are capable of behaving. (D) none of the above.\nA: Let's think step by step. We refer to Wikipedia articles on philosophy for help. Psychological egoism suggests that one behaves based on what makes one feels good, hence it is a claim about human nature and how humans are capable of behaving. The answer is (C).Q: Baggini says that almost all deniers of meaning in life really seem to be rejecting only the idea that life has _____.\n(A) internal meaning (B) external meaning (C) religious meaning (D) secular meaning\nA: Let's think step by step.",
        {
          "until": [
            "</s>"
          ],
          "do_sample": false,
          "temperature": 0.0
        }
      ]
    ],
    "resps": [
      [
        "(B) external meaning. Baggini says that almost all deniers of meaning in life really seem to be rejecting only the idea that life has _ external meaning. The answer is (B)."
      ]
    ],
    "filtered_resps": [
      "(B)"
    ],
    "exact_match": 1.0
  },
  {
    "doc_id": 33,
    "doc": {
      "question": "Brandt claims that act-utilitarianism:",
      "subject": "philosophy",
      "choices": [
        "has implausible consequences.",
        "gives rise to moral dilemmas.",
        "is self-contradictory.",
        "all of the above."
      ],
      "answer": 0
    },
    "target": "(A)",
    "arguments": [
      [
        "The following are multiple choice questions (with answers) about philosophy.\n\nQ: The study of reality in the broadest sense, an inquiry into the elemental nature of the universe and the things in it, is known as _____.\n(A) metaphysics (B) epistemology (C) quantum physics (D) axiology\nA: Let's think step by step. We refer to Wikipedia articles on philosophy for help. Among the options, only metaphysics studies the nature of reality and existence. The answer is (A).\n\nQ: According to Moore\u2019s \u201cideal utilitarianism,\u201d the right action is the one that brings about the greatest amount of:\n(A) pleasure. (B) happiness. (C) good. (D) virtue.\nA: Let's think step by step. We refer to Wikipedia articles on philosophy for help. Moore's \"ideal utilitarianism\" states that one's actions should maximize intrinsic goods. The answer is (C).\n\nQ: Before Tolstoy's Christian conversion, what was his perspective on the meaning of life?\n(A) optimist (B) satisfied (C) nominally religious (D) pessimist\nA: Let's think step by step. We refer to Wikipedia articles on philosophy for help. Before his conversion, Tolstoy feels that life was uncertain, which is a pessimist's point of view. The answer is (D).\n\nQ: According to d'Holbach, people always act according to _____.\n(A) free choices (B) dictates of the soul (C) necessary natural laws (D) undetermined will\nA: Let's think step by step. We refer to Wikipedia articles on philosophy for help. d'Holbach believes that people act according to necessary laws, and it proves nothing about people's free will. The answer is (C).\n\nQ: Psychological egoism is:\n(A) an ethical theory about how we ought to behave. (B) a generalization concerning the way people tend to behave. (C) a claim about human nature and the ways people are capable of behaving. (D) none of the above.\nA: Let's think step by step. We refer to Wikipedia articles on philosophy for help. Psychological egoism suggests that one behaves based on what makes one feels good, hence it is a claim about human nature and how humans are capable of behaving. The answer is (C).Q: Brandt claims that act-utilitarianism:\n(A) has implausible consequences. (B) gives rise to moral dilemmas. (C) is self-contradictory. (D) all of the above.\nA: Let's think step by step.",
        {
          "until": [
            "</s>"
          ],
          "do_sample": false,
          "temperature": 0.0
        }
      ]
    ],
    "resps": [
      [
        "Act-utilitarianism gives rise to moral dilemmas. Brandt claims that act-utilitarianism gives rise to moral dilemmas. The answer is (D)."
      ]
    ],
    "filtered_resps": [
      "(D)"
    ],
    "exact_match": 0.0
  },
  {
    "doc_id": 2,
    "doc": {
      "question": "Singer\u2019s argument begins with the assumption that:",
      "subject": "philosophy",
      "choices": [
        "all people are created equal.",
        "we ought to do whatever maximizes happiness.",
        "pleasure is good.",
        "suffering and death from lack of food, shelter, and medical care are bad."
      ],
      "answer": 3
    },
    "target": "(D)",
    "arguments": [
      [
        "The following are multiple choice questions (with answers) about philosophy.\n\nQ: The study of reality in the broadest sense, an inquiry into the elemental nature of the universe and the things in it, is known as _____.\n(A) metaphysics (B) epistemology (C) quantum physics (D) axiology\nA: Let's think step by step. We refer to Wikipedia articles on philosophy for help. Among the options, only metaphysics studies the nature of reality and existence. The answer is (A).\n\nQ: According to Moore\u2019s \u201cideal utilitarianism,\u201d the right action is the one that brings about the greatest amount of:\n(A) pleasure. (B) happiness. (C) good. (D) virtue.\nA: Let's think step by step. We refer to Wikipedia articles on philosophy for help. Moore's \"ideal utilitarianism\" states that one's actions should maximize intrinsic goods. The answer is (C).\n\nQ: Before Tolstoy's Christian conversion, what was his perspective on the meaning of life?\n(A) optimist (B) satisfied (C) nominally religious (D) pessimist\nA: Let's think step by step. We refer to Wikipedia articles on philosophy for help. Before his conversion, Tolstoy feels that life was uncertain, which is a pessimist's point of view. The answer is (D).\n\nQ: According to d'Holbach, people always act according to _____.\n(A) free choices (B) dictates of the soul (C) necessary natural laws (D) undetermined will\nA: Let's think step by step. We refer to Wikipedia articles on philosophy for help. d'Holbach believes that people act according to necessary laws, and it proves nothing about people's free will. The answer is (C).\n\nQ: Psychological egoism is:\n(A) an ethical theory about how we ought to behave. (B) a generalization concerning the way people tend to behave. (C) a claim about human nature and the ways people are capable of behaving. (D) none of the above.\nA: Let's think step by step. We refer to Wikipedia articles on philosophy for help. Psychological egoism suggests that one behaves based on what makes one feels good, hence it is a claim about human nature and how humans are capable of behaving. The answer is (C).Q: Singer\u2019s argument begins with the assumption that:\n(A) all people are created equal. (B) we ought to do whatever maximizes happiness. (C) pleasure is good. (D) suffering and death from lack of food, shelter, and medical care are bad.\nA: Let's think step by step.",
        {
          "until": [
            "</s>"
          ],
          "do_sample": false,
          "temperature": 0.0
        }
      ]
    ],
    "resps": [
      [
        "Singer\u2019s argument begins with the assumption that: (A) all people are created equal. The answer is (A)."
      ]
    ],
    "filtered_resps": [
      "(A)"
    ],
    "exact_match": 0.0
  },
  {
    "doc_id": 10,
    "doc": {
      "question": "The view that we ought to relieve the agony of one stranger rather than the minor pain of another is endorsed by:",
      "subject": "philosophy",
      "choices": [
        "Taurek and Parfit.",
        "Taurek, but not Parfit.",
        "Parfit, but not Taurek.",
        "neither Parfit nor Taurek."
      ],
      "answer": 2
    },
    "target": "(C)",
    "arguments": [
      [
        "The following are multiple choice questions (with answers) about philosophy.\n\nQ: The study of reality in the broadest sense, an inquiry into the elemental nature of the universe and the things in it, is known as _____.\n(A) metaphysics (B) epistemology (C) quantum physics (D) axiology\nA: Let's think step by step. We refer to Wikipedia articles on philosophy for help. Among the options, only metaphysics studies the nature of reality and existence. The answer is (A).\n\nQ: According to Moore\u2019s \u201cideal utilitarianism,\u201d the right action is the one that brings about the greatest amount of:\n(A) pleasure. (B) happiness. (C) good. (D) virtue.\nA: Let's think step by step. We refer to Wikipedia articles on philosophy for help. Moore's \"ideal utilitarianism\" states that one's actions should maximize intrinsic goods. The answer is (C).\n\nQ: Before Tolstoy's Christian conversion, what was his perspective on the meaning of life?\n(A) optimist (B) satisfied (C) nominally religious (D) pessimist\nA: Let's think step by step. We refer to Wikipedia articles on philosophy for help. Before his conversion, Tolstoy feels that life was uncertain, which is a pessimist's point of view. The answer is (D).\n\nQ: According to d'Holbach, people always act according to _____.\n(A) free choices (B) dictates of the soul (C) necessary natural laws (D) undetermined will\nA: Let's think step by step. We refer to Wikipedia articles on philosophy for help. d'Holbach believes that people act according to necessary laws, and it proves nothing about people's free will. The answer is (C).\n\nQ: Psychological egoism is:\n(A) an ethical theory about how we ought to behave. (B) a generalization concerning the way people tend to behave. (C) a claim about human nature and the ways people are capable of behaving. (D) none of the above.\nA: Let's think step by step. We refer to Wikipedia articles on philosophy for help. Psychological egoism suggests that one behaves based on what makes one feels good, hence it is a claim about human nature and how humans are capable of behaving. The answer is (C).Q: The view that we ought to relieve the agony of one stranger rather than the minor pain of another is endorsed by:\n(A) Taurek and Parfit. (B) Taurek, but not Parfit. (C) Parfit, but not Taurek. (D) neither Parfit nor Taurek.\nA: Let's think step by step.",
        {
          "until": [
            "</s>"
          ],
          "do_sample": false,
          "temperature": 0.0
        }
      ]
    ],
    "resps": [
      [
        "We refer to the following statements: The view that we ought to relieve the agony of one stranger rather than the minor pain of another is endorsed by: (A) Taurek and Parfit. The answer is (A)."
      ]
    ],
    "filtered_resps": [
      "(A)"
    ],
    "exact_match": 0.0
  },
  {
    "doc_id": 18,
    "doc": {
      "question": "Descartes argues against trusting the senses on the grounds that _____.",
      "subject": "philosophy",
      "choices": [
        "they never directly deceive him",
        "they sometimes deceive him",
        "God allows sensory deception",
        "sense perception is indubitable"
      ],
      "answer": 1
    },
    "target": "(B)",
    "arguments": [
      [
        "The following are multiple choice questions (with answers) about philosophy.\n\nQ: The study of reality in the broadest sense, an inquiry into the elemental nature of the universe and the things in it, is known as _____.\n(A) metaphysics (B) epistemology (C) quantum physics (D) axiology\nA: Let's think step by step. We refer to Wikipedia articles on philosophy for help. Among the options, only metaphysics studies the nature of reality and existence. The answer is (A).\n\nQ: According to Moore\u2019s \u201cideal utilitarianism,\u201d the right action is the one that brings about the greatest amount of:\n(A) pleasure. (B) happiness. (C) good. (D) virtue.\nA: Let's think step by step. We refer to Wikipedia articles on philosophy for help. Moore's \"ideal utilitarianism\" states that one's actions should maximize intrinsic goods. The answer is (C).\n\nQ: Before Tolstoy's Christian conversion, what was his perspective on the meaning of life?\n(A) optimist (B) satisfied (C) nominally religious (D) pessimist\nA: Let's think step by step. We refer to Wikipedia articles on philosophy for help. Before his conversion, Tolstoy feels that life was uncertain, which is a pessimist's point of view. The answer is (D).\n\nQ: According to d'Holbach, people always act according to _____.\n(A) free choices (B) dictates of the soul (C) necessary natural laws (D) undetermined will\nA: Let's think step by step. We refer to Wikipedia articles on philosophy for help. d'Holbach believes that people act according to necessary laws, and it proves nothing about people's free will. The answer is (C).\n\nQ: Psychological egoism is:\n(A) an ethical theory about how we ought to behave. (B) a generalization concerning the way people tend to behave. (C) a claim about human nature and the ways people are capable of behaving. (D) none of the above.\nA: Let's think step by step. We refer to Wikipedia articles on philosophy for help. Psychological egoism suggests that one behaves based on what makes one feels good, hence it is a claim about human nature and how humans are capable of behaving. The answer is (C).Q: Descartes argues against trusting the senses on the grounds that _____.\n(A) they never directly deceive him (B) they sometimes deceive him (C) God allows sensory deception (D) sense perception is indubitable\nA: Let's think step by step.",
        {
          "until": [
            "</s>"
          ],
          "do_sample": false,
          "temperature": 0.0
        }
      ]
    ],
    "resps": [
      [
        "Descartes argues that sense perception is indubitable. Descartes argues that sense perception is indubitable. The answer is (B)."
      ]
    ],
    "filtered_resps": [
      "(B)"
    ],
    "exact_match": 1.0
  },
  {
    "doc_id": 26,
    "doc": {
      "question": "According to Nagel, the view that moral luck is paradoxical is:",
      "subject": "philosophy",
      "choices": [
        "a logical mistake.",
        "an ethical mistake.",
        "a factual mistake.",
        "not a mistake."
      ],
      "answer": 3
    },
    "target": "(D)",
    "arguments": [
      [
        "The following are multiple choice questions (with answers) about philosophy.\n\nQ: The study of reality in the broadest sense, an inquiry into the elemental nature of the universe and the things in it, is known as _____.\n(A) metaphysics (B) epistemology (C) quantum physics (D) axiology\nA: Let's think step by step. We refer to Wikipedia articles on philosophy for help. Among the options, only metaphysics studies the nature of reality and existence. The answer is (A).\n\nQ: According to Moore\u2019s \u201cideal utilitarianism,\u201d the right action is the one that brings about the greatest amount of:\n(A) pleasure. (B) happiness. (C) good. (D) virtue.\nA: Let's think step by step. We refer to Wikipedia articles on philosophy for help. Moore's \"ideal utilitarianism\" states that one's actions should maximize intrinsic goods. The answer is (C).\n\nQ: Before Tolstoy's Christian conversion, what was his perspective on the meaning of life?\n(A) optimist (B) satisfied (C) nominally religious (D) pessimist\nA: Let's think step by step. We refer to Wikipedia articles on philosophy for help. Before his conversion, Tolstoy feels that life was uncertain, which is a pessimist's point of view. The answer is (D).\n\nQ: According to d'Holbach, people always act according to _____.\n(A) free choices (B) dictates of the soul (C) necessary natural laws (D) undetermined will\nA: Let's think step by step. We refer to Wikipedia articles on philosophy for help. d'Holbach believes that people act according to necessary laws, and it proves nothing about people's free will. The answer is (C).\n\nQ: Psychological egoism is:\n(A) an ethical theory about how we ought to behave. (B) a generalization concerning the way people tend to behave. (C) a claim about human nature and the ways people are capable of behaving. (D) none of the above.\nA: Let's think step by step. We refer to Wikipedia articles on philosophy for help. Psychological egoism suggests that one behaves based on what makes one feels good, hence it is a claim about human nature and how humans are capable of behaving. The answer is (C).Q: According to Nagel, the view that moral luck is paradoxical is:\n(A) a logical mistake. (B) an ethical mistake. (C) a factual mistake. (D) not a mistake.\nA: Let's think step by step.",
        {
          "until": [
            "</s>"
          ],
          "do_sample": false,
          "temperature": 0.0
        }
      ]
    ],
    "resps": [
      [
        "Moral luck is a paradoxical concept. Nagel's view is that moral luck is paradoxical. The answer is (A)."
      ]
    ],
    "filtered_resps": [
      "(A)"
    ],
    "exact_match": 0.0
  },
  {
    "doc_id": 3,
    "doc": {
      "question": "Interest theories of the good define goodness in terms of:",
      "subject": "philosophy",
      "choices": [
        "approval or desire.",
        "benefit to oneself.",
        "the consequences of one\u2019s actions.",
        "prima facie duties."
      ],
      "answer": 0
    },
    "target": "(A)",
    "arguments": [
      [
        "The following are multiple choice questions (with answers) about philosophy.\n\nQ: The study of reality in the broadest sense, an inquiry into the elemental nature of the universe and the things in it, is known as _____.\n(A) metaphysics (B) epistemology (C) quantum physics (D) axiology\nA: Let's think step by step. We refer to Wikipedia articles on philosophy for help. Among the options, only metaphysics studies the nature of reality and existence. The answer is (A).\n\nQ: According to Moore\u2019s \u201cideal utilitarianism,\u201d the right action is the one that brings about the greatest amount of:\n(A) pleasure. (B) happiness. (C) good. (D) virtue.\nA: Let's think step by step. We refer to Wikipedia articles on philosophy for help. Moore's \"ideal utilitarianism\" states that one's actions should maximize intrinsic goods. The answer is (C).\n\nQ: Before Tolstoy's Christian conversion, what was his perspective on the meaning of life?\n(A) optimist (B) satisfied (C) nominally religious (D) pessimist\nA: Let's think step by step. We refer to Wikipedia articles on philosophy for help. Before his conversion, Tolstoy feels that life was uncertain, which is a pessimist's point of view. The answer is (D).\n\nQ: According to d'Holbach, people always act according to _____.\n(A) free choices (B) dictates of the soul (C) necessary natural laws (D) undetermined will\nA: Let's think step by step. We refer to Wikipedia articles on philosophy for help. d'Holbach believes that people act according to necessary laws, and it proves nothing about people's free will. The answer is (C).\n\nQ: Psychological egoism is:\n(A) an ethical theory about how we ought to behave. (B) a generalization concerning the way people tend to behave. (C) a claim about human nature and the ways people are capable of behaving. (D) none of the above.\nA: Let's think step by step. We refer to Wikipedia articles on philosophy for help. Psychological egoism suggests that one behaves based on what makes one feels good, hence it is a claim about human nature and how humans are capable of behaving. The answer is (C).Q: Interest theories of the good define goodness in terms of:\n(A) approval or desire. (B) benefit to oneself. (C) the consequences of one\u2019s actions. (D) prima facie duties.\nA: Let's think step by step.",
        {
          "until": [
            "</s>"
          ],
          "do_sample": false,
          "temperature": 0.0
        }
      ]
    ],
    "resps": [
      [
        "We refer to Wikipedia articles on philosophy. Interest theories of the good define goodness in terms of: (B) approval or desire. The answer is (B)."
      ]
    ],
    "filtered_resps": [
      "(B)"
    ],
    "exact_match": 0.0
  },
  {
    "doc_id": 11,
    "doc": {
      "question": "Aquinas argues that every agent acts for the sake of:",
      "subject": "philosophy",
      "choices": [
        "pleasure.",
        "self-interest.",
        "pleasing God.",
        "an end."
      ],
      "answer": 3
    },
    "target": "(D)",
    "arguments": [
      [
        "The following are multiple choice questions (with answers) about philosophy.\n\nQ: The study of reality in the broadest sense, an inquiry into the elemental nature of the universe and the things in it, is known as _____.\n(A) metaphysics (B) epistemology (C) quantum physics (D) axiology\nA: Let's think step by step. We refer to Wikipedia articles on philosophy for help. Among the options, only metaphysics studies the nature of reality and existence. The answer is (A).\n\nQ: According to Moore\u2019s \u201cideal utilitarianism,\u201d the right action is the one that brings about the greatest amount of:\n(A) pleasure. (B) happiness. (C) good. (D) virtue.\nA: Let's think step by step. We refer to Wikipedia articles on philosophy for help. Moore's \"ideal utilitarianism\" states that one's actions should maximize intrinsic goods. The answer is (C).\n\nQ: Before Tolstoy's Christian conversion, what was his perspective on the meaning of life?\n(A) optimist (B) satisfied (C) nominally religious (D) pessimist\nA: Let's think step by step. We refer to Wikipedia articles on philosophy for help. Before his conversion, Tolstoy feels that life was uncertain, which is a pessimist's point of view. The answer is (D).\n\nQ: According to d'Holbach, people always act according to _____.\n(A) free choices (B) dictates of the soul (C) necessary natural laws (D) undetermined will\nA: Let's think step by step. We refer to Wikipedia articles on philosophy for help. d'Holbach believes that people act according to necessary laws, and it proves nothing about people's free will. The answer is (C).\n\nQ: Psychological egoism is:\n(A) an ethical theory about how we ought to behave. (B) a generalization concerning the way people tend to behave. (C) a claim about human nature and the ways people are capable of behaving. (D) none of the above.\nA: Let's think step by step. We refer to Wikipedia articles on philosophy for help. Psychological egoism suggests that one behaves based on what makes one feels good, hence it is a claim about human nature and how humans are capable of behaving. The answer is (C).Q: Aquinas argues that every agent acts for the sake of:\n(A) pleasure. (B) self-interest. (C) pleasing God. (D) an end.\nA: Let's think step by step.",
        {
          "until": [
            "</s>"
          ],
          "do_sample": false,
          "temperature": 0.0
        }
      ]
    ],
    "resps": [
      [
        "Aquinas argues that every agent acts for the sake of: (A) pleasure. Aquinas argues that every agent acts for the sake of: (B) pleasure. The answer is (B)."
      ]
    ],
    "filtered_resps": [
      "(B)"
    ],
    "exact_match": 0.0
  },
  {
    "doc_id": 19,
    "doc": {
      "question": "A question-and-answer dialogue in which propositions are methodically scrutinized to uncover the truth is known as _____.",
      "subject": "philosophy",
      "choices": [
        "an argument",
        "the Socratic method",
        "the Socratic jest",
        "a debate"
      ],
      "answer": 1
    },
    "target": "(B)",
    "arguments": [
      [
        "The following are multiple choice questions (with answers) about philosophy.\n\nQ: The study of reality in the broadest sense, an inquiry into the elemental nature of the universe and the things in it, is known as _____.\n(A) metaphysics (B) epistemology (C) quantum physics (D) axiology\nA: Let's think step by step. We refer to Wikipedia articles on philosophy for help. Among the options, only metaphysics studies the nature of reality and existence. The answer is (A).\n\nQ: According to Moore\u2019s \u201cideal utilitarianism,\u201d the right action is the one that brings about the greatest amount of:\n(A) pleasure. (B) happiness. (C) good. (D) virtue.\nA: Let's think step by step. We refer to Wikipedia articles on philosophy for help. Moore's \"ideal utilitarianism\" states that one's actions should maximize intrinsic goods. The answer is (C).\n\nQ: Before Tolstoy's Christian conversion, what was his perspective on the meaning of life?\n(A) optimist (B) satisfied (C) nominally religious (D) pessimist\nA: Let's think step by step. We refer to Wikipedia articles on philosophy for help. Before his conversion, Tolstoy feels that life was uncertain, which is a pessimist's point of view. The answer is (D).\n\nQ: According to d'Holbach, people always act according to _____.\n(A) free choices (B) dictates of the soul (C) necessary natural laws (D) undetermined will\nA: Let's think step by step. We refer to Wikipedia articles on philosophy for help. d'Holbach believes that people act according to necessary laws, and it proves nothing about people's free will. The answer is (C).\n\nQ: Psychological egoism is:\n(A) an ethical theory about how we ought to behave. (B) a generalization concerning the way people tend to behave. (C) a claim about human nature and the ways people are capable of behaving. (D) none of the above.\nA: Let's think step by step. We refer to Wikipedia articles on philosophy for help. Psychological egoism suggests that one behaves based on what makes one feels good, hence it is a claim about human nature and how humans are capable of behaving. The answer is (C).Q: A question-and-answer dialogue in which propositions are methodically scrutinized to uncover the truth is known as _____.\n(A) an argument (B) the Socratic method (C) the Socratic jest (D) a debate\nA: Let's think step by step.",
        {
          "until": [
            "</s>"
          ],
          "do_sample": false,
          "temperature": 0.0
        }
      ]
    ],
    "resps": [
      [
        "A debate is a discussion of a debate. A debate is a discussion of a debate. The answer is (B)."
      ]
    ],
    "filtered_resps": [
      "(B)"
    ],
    "exact_match": 1.0
  },
  {
    "doc_id": 27,
    "doc": {
      "question": "According to Nagel, if a driver hits a child through no fault of his own:",
      "subject": "philosophy",
      "choices": [
        "he will feel terrible about the event.",
        "he will reproach himself.",
        "he will have been the victim of moral bad luck.",
        "all of the above."
      ],
      "answer": 0
    },
    "target": "(A)",
    "arguments": [
      [
        "The following are multiple choice questions (with answers) about philosophy.\n\nQ: The study of reality in the broadest sense, an inquiry into the elemental nature of the universe and the things in it, is known as _____.\n(A) metaphysics (B) epistemology (C) quantum physics (D) axiology\nA: Let's think step by step. We refer to Wikipedia articles on philosophy for help. Among the options, only metaphysics studies the nature of reality and existence. The answer is (A).\n\nQ: According to Moore\u2019s \u201cideal utilitarianism,\u201d the right action is the one that brings about the greatest amount of:\n(A) pleasure. (B) happiness. (C) good. (D) virtue.\nA: Let's think step by step. We refer to Wikipedia articles on philosophy for help. Moore's \"ideal utilitarianism\" states that one's actions should maximize intrinsic goods. The answer is (C).\n\nQ: Before Tolstoy's Christian conversion, what was his perspective on the meaning of life?\n(A) optimist (B) satisfied (C) nominally religious (D) pessimist\nA: Let's think step by step. We refer to Wikipedia articles on philosophy for help. Before his conversion, Tolstoy feels that life was uncertain, which is a pessimist's point of view. The answer is (D).\n\nQ: According to d'Holbach, people always act according to _____.\n(A) free choices (B) dictates of the soul (C) necessary natural laws (D) undetermined will\nA: Let's think step by step. We refer to Wikipedia articles on philosophy for help. d'Holbach believes that people act according to necessary laws, and it proves nothing about people's free will. The answer is (C).\n\nQ: Psychological egoism is:\n(A) an ethical theory about how we ought to behave. (B) a generalization concerning the way people tend to behave. (C) a claim about human nature and the ways people are capable of behaving. (D) none of the above.\nA: Let's think step by step. We refer to Wikipedia articles on philosophy for help. Psychological egoism suggests that one behaves based on what makes one feels good, hence it is a claim about human nature and how humans are capable of behaving. The answer is (C).Q: According to Nagel, if a driver hits a child through no fault of his own:\n(A) he will feel terrible about the event. (B) he will reproach himself. (C) he will have been the victim of moral bad luck. (D) all of the above.\nA: Let's think step by step.",
        {
          "until": [
            "</s>"
          ],
          "do_sample": false,
          "temperature": 0.0
        }
      ]
    ],
    "resps": [
      [
        "The driver will feel terrible about the event if he hits the child through no fault of his own. Nagel states that if a driver hits a child through no fault of his own: (D) he will feel terrible about the event. The answer is (D)."
      ]
    ],
    "filtered_resps": [
      "(D)"
    ],
    "exact_match": 0.0
  },
  {
    "doc_id": 4,
    "doc": {
      "question": "Brandt views his rule-utilitarianism as a:",
      "subject": "philosophy",
      "choices": [
        "normative ethical thesis.",
        "metaethical thesis.",
        "purely descriptive thesis.",
        "both a and b."
      ],
      "answer": 0
    },
    "target": "(A)",
    "arguments": [
      [
        "The following are multiple choice questions (with answers) about philosophy.\n\nQ: The study of reality in the broadest sense, an inquiry into the elemental nature of the universe and the things in it, is known as _____.\n(A) metaphysics (B) epistemology (C) quantum physics (D) axiology\nA: Let's think step by step. We refer to Wikipedia articles on philosophy for help. Among the options, only metaphysics studies the nature of reality and existence. The answer is (A).\n\nQ: According to Moore\u2019s \u201cideal utilitarianism,\u201d the right action is the one that brings about the greatest amount of:\n(A) pleasure. (B) happiness. (C) good. (D) virtue.\nA: Let's think step by step. We refer to Wikipedia articles on philosophy for help. Moore's \"ideal utilitarianism\" states that one's actions should maximize intrinsic goods. The answer is (C).\n\nQ: Before Tolstoy's Christian conversion, what was his perspective on the meaning of life?\n(A) optimist (B) satisfied (C) nominally religious (D) pessimist\nA: Let's think step by step. We refer to Wikipedia articles on philosophy for help. Before his conversion, Tolstoy feels that life was uncertain, which is a pessimist's point of view. The answer is (D).\n\nQ: According to d'Holbach, people always act according to _____.\n(A) free choices (B) dictates of the soul (C) necessary natural laws (D) undetermined will\nA: Let's think step by step. We refer to Wikipedia articles on philosophy for help. d'Holbach believes that people act according to necessary laws, and it proves nothing about people's free will. The answer is (C).\n\nQ: Psychological egoism is:\n(A) an ethical theory about how we ought to behave. (B) a generalization concerning the way people tend to behave. (C) a claim about human nature and the ways people are capable of behaving. (D) none of the above.\nA: Let's think step by step. We refer to Wikipedia articles on philosophy for help. Psychological egoism suggests that one behaves based on what makes one feels good, hence it is a claim about human nature and how humans are capable of behaving. The answer is (C).Q: Brandt views his rule-utilitarianism as a:\n(A) normative ethical thesis. (B) metaethical thesis. (C) purely descriptive thesis. (D) both a and b.\nA: Let's think step by step.",
        {
          "until": [
            "</s>"
          ],
          "do_sample": false,
          "temperature": 0.0
        }
      ]
    ],
    "resps": [
      [
        "Rule-utilitarianism is a theory of utility. Brandt views rule-utilitarianism as a normative ethical thesis. The answer is (D)."
      ]
    ],
    "filtered_resps": [
      "(D)"
    ],
    "exact_match": 0.0
  },
  {
    "doc_id": 12,
    "doc": {
      "question": "Descartes reasons that the very fact that he is thinking shows that _____.",
      "subject": "philosophy",
      "choices": [
        "he does not exist",
        "he is not being deceived",
        "he exists",
        "he is dreaming"
      ],
      "answer": 2
    },
    "target": "(C)",
    "arguments": [
      [
        "The following are multiple choice questions (with answers) about philosophy.\n\nQ: The study of reality in the broadest sense, an inquiry into the elemental nature of the universe and the things in it, is known as _____.\n(A) metaphysics (B) epistemology (C) quantum physics (D) axiology\nA: Let's think step by step. We refer to Wikipedia articles on philosophy for help. Among the options, only metaphysics studies the nature of reality and existence. The answer is (A).\n\nQ: According to Moore\u2019s \u201cideal utilitarianism,\u201d the right action is the one that brings about the greatest amount of:\n(A) pleasure. (B) happiness. (C) good. (D) virtue.\nA: Let's think step by step. We refer to Wikipedia articles on philosophy for help. Moore's \"ideal utilitarianism\" states that one's actions should maximize intrinsic goods. The answer is (C).\n\nQ: Before Tolstoy's Christian conversion, what was his perspective on the meaning of life?\n(A) optimist (B) satisfied (C) nominally religious (D) pessimist\nA: Let's think step by step. We refer to Wikipedia articles on philosophy for help. Before his conversion, Tolstoy feels that life was uncertain, which is a pessimist's point of view. The answer is (D).\n\nQ: According to d'Holbach, people always act according to _____.\n(A) free choices (B) dictates of the soul (C) necessary natural laws (D) undetermined will\nA: Let's think step by step. We refer to Wikipedia articles on philosophy for help. d'Holbach believes that people act according to necessary laws, and it proves nothing about people's free will. The answer is (C).\n\nQ: Psychological egoism is:\n(A) an ethical theory about how we ought to behave. (B) a generalization concerning the way people tend to behave. (C) a claim about human nature and the ways people are capable of behaving. (D) none of the above.\nA: Let's think step by step. We refer to Wikipedia articles on philosophy for help. Psychological egoism suggests that one behaves based on what makes one feels good, hence it is a claim about human nature and how humans are capable of behaving. The answer is (C).Q: Descartes reasons that the very fact that he is thinking shows that _____.\n(A) he does not exist (B) he is not being deceived (C) he exists (D) he is dreaming\nA: Let's think step by step.",
        {
          "until": [
            "</s>"
          ],
          "do_sample": false,
          "temperature": 0.0
        }
      ]
    ],
    "resps": [
      [
        "Descartes believes that he is being deceived. Descartes believes that he is being deceived. The answer is (A)."
      ]
    ],
    "filtered_resps": [
      "(A)"
    ],
    "exact_match": 0.0
  },
  {
    "doc_id": 20,
    "doc": {
      "question": "According to Bentham, the principle of utility is appropriately applied to:",
      "subject": "philosophy",
      "choices": [
        "individuals.",
        "governments.",
        "both a and b.",
        "neither a nor b."
      ],
      "answer": 2
    },
    "target": "(C)",
    "arguments": [
      [
        "The following are multiple choice questions (with answers) about philosophy.\n\nQ: The study of reality in the broadest sense, an inquiry into the elemental nature of the universe and the things in it, is known as _____.\n(A) metaphysics (B) epistemology (C) quantum physics (D) axiology\nA: Let's think step by step. We refer to Wikipedia articles on philosophy for help. Among the options, only metaphysics studies the nature of reality and existence. The answer is (A).\n\nQ: According to Moore\u2019s \u201cideal utilitarianism,\u201d the right action is the one that brings about the greatest amount of:\n(A) pleasure. (B) happiness. (C) good. (D) virtue.\nA: Let's think step by step. We refer to Wikipedia articles on philosophy for help. Moore's \"ideal utilitarianism\" states that one's actions should maximize intrinsic goods. The answer is (C).\n\nQ: Before Tolstoy's Christian conversion, what was his perspective on the meaning of life?\n(A) optimist (B) satisfied (C) nominally religious (D) pessimist\nA: Let's think step by step. We refer to Wikipedia articles on philosophy for help. Before his conversion, Tolstoy feels that life was uncertain, which is a pessimist's point of view. The answer is (D).\n\nQ: According to d'Holbach, people always act according to _____.\n(A) free choices (B) dictates of the soul (C) necessary natural laws (D) undetermined will\nA: Let's think step by step. We refer to Wikipedia articles on philosophy for help. d'Holbach believes that people act according to necessary laws, and it proves nothing about people's free will. The answer is (C).\n\nQ: Psychological egoism is:\n(A) an ethical theory about how we ought to behave. (B) a generalization concerning the way people tend to behave. (C) a claim about human nature and the ways people are capable of behaving. (D) none of the above.\nA: Let's think step by step. We refer to Wikipedia articles on philosophy for help. Psychological egoism suggests that one behaves based on what makes one feels good, hence it is a claim about human nature and how humans are capable of behaving. The answer is (C).Q: According to Bentham, the principle of utility is appropriately applied to:\n(A) individuals. (B) governments. (C) both a and b. (D) neither a nor b.\nA: Let's think step by step.",
        {
          "until": [
            "</s>"
          ],
          "do_sample": false,
          "temperature": 0.0
        }
      ]
    ],
    "resps": [
      [
        "Bentham states that utility is the principle of utility that is applied to individuals and governments. Utility is the principle of utility that is applied to individuals and governments. The answer is (C)."
      ]
    ],
    "filtered_resps": [
      "(C)"
    ],
    "exact_match": 1.0
  },
  {
    "doc_id": 28,
    "doc": {
      "question": "Questions like \u201cWhat is knowledge?\u201d and \u201cWhat is truth?\u201d are mainstays in the branch of philosophy known as _____.",
      "subject": "philosophy",
      "choices": [
        "logic",
        "metaphysics",
        "epistemology",
        "aesthetics"
      ],
      "answer": 2
    },
    "target": "(C)",
    "arguments": [
      [
        "The following are multiple choice questions (with answers) about philosophy.\n\nQ: The study of reality in the broadest sense, an inquiry into the elemental nature of the universe and the things in it, is known as _____.\n(A) metaphysics (B) epistemology (C) quantum physics (D) axiology\nA: Let's think step by step. We refer to Wikipedia articles on philosophy for help. Among the options, only metaphysics studies the nature of reality and existence. The answer is (A).\n\nQ: According to Moore\u2019s \u201cideal utilitarianism,\u201d the right action is the one that brings about the greatest amount of:\n(A) pleasure. (B) happiness. (C) good. (D) virtue.\nA: Let's think step by step. We refer to Wikipedia articles on philosophy for help. Moore's \"ideal utilitarianism\" states that one's actions should maximize intrinsic goods. The answer is (C).\n\nQ: Before Tolstoy's Christian conversion, what was his perspective on the meaning of life?\n(A) optimist (B) satisfied (C) nominally religious (D) pessimist\nA: Let's think step by step. We refer to Wikipedia articles on philosophy for help. Before his conversion, Tolstoy feels that life was uncertain, which is a pessimist's point of view. The answer is (D).\n\nQ: According to d'Holbach, people always act according to _____.\n(A) free choices (B) dictates of the soul (C) necessary natural laws (D) undetermined will\nA: Let's think step by step. We refer to Wikipedia articles on philosophy for help. d'Holbach believes that people act according to necessary laws, and it proves nothing about people's free will. The answer is (C).\n\nQ: Psychological egoism is:\n(A) an ethical theory about how we ought to behave. (B) a generalization concerning the way people tend to behave. (C) a claim about human nature and the ways people are capable of behaving. (D) none of the above.\nA: Let's think step by step. We refer to Wikipedia articles on philosophy for help. Psychological egoism suggests that one behaves based on what makes one feels good, hence it is a claim about human nature and how humans are capable of behaving. The answer is (C).Q: Questions like \u201cWhat is knowledge?\u201d and \u201cWhat is truth?\u201d are mainstays in the branch of philosophy known as _____.\n(A) logic (B) metaphysics (C) epistemology (D) aesthetics\nA: Let's think step by step.",
        {
          "until": [
            "</s>"
          ],
          "do_sample": false,
          "temperature": 0.0
        }
      ]
    ],
    "resps": [
      [
        "(B) Philosophy is the study of the physical, mental, and social aspects of life. Philosophy is the study of the physical, mental, and social aspects of life. The answer is (B)."
      ]
    ],
    "filtered_resps": [
      "(B)"
    ],
    "exact_match": 0.0
  },
  {
    "doc_id": 5,
    "doc": {
      "question": "Parfit claims that choosing to save the larger number in a trade-off case:",
      "subject": "philosophy",
      "choices": [
        "does not reflect an equal concern for the survival of each, for it does not give equal weight to saving each.",
        "does not reflect an equal concern for the survival of each, for it does not give each an equal chance of survival.",
        "reflects an equal concern for the survival of each, for it gives equal weight to saving each.",
        "reflects an equal concern for the survival of each, for it gives each an equal chance of survival."
      ],
      "answer": 2
    },
    "target": "(C)",
    "arguments": [
      [
        "The following are multiple choice questions (with answers) about philosophy.\n\nQ: The study of reality in the broadest sense, an inquiry into the elemental nature of the universe and the things in it, is known as _____.\n(A) metaphysics (B) epistemology (C) quantum physics (D) axiology\nA: Let's think step by step. We refer to Wikipedia articles on philosophy for help. Among the options, only metaphysics studies the nature of reality and existence. The answer is (A).\n\nQ: According to Moore\u2019s \u201cideal utilitarianism,\u201d the right action is the one that brings about the greatest amount of:\n(A) pleasure. (B) happiness. (C) good. (D) virtue.\nA: Let's think step by step. We refer to Wikipedia articles on philosophy for help. Moore's \"ideal utilitarianism\" states that one's actions should maximize intrinsic goods. The answer is (C).\n\nQ: Before Tolstoy's Christian conversion, what was his perspective on the meaning of life?\n(A) optimist (B) satisfied (C) nominally religious (D) pessimist\nA: Let's think step by step. We refer to Wikipedia articles on philosophy for help. Before his conversion, Tolstoy feels that life was uncertain, which is a pessimist's point of view. The answer is (D).\n\nQ: According to d'Holbach, people always act according to _____.\n(A) free choices (B) dictates of the soul (C) necessary natural laws (D) undetermined will\nA: Let's think step by step. We refer to Wikipedia articles on philosophy for help. d'Holbach believes that people act according to necessary laws, and it proves nothing about people's free will. The answer is (C).\n\nQ: Psychological egoism is:\n(A) an ethical theory about how we ought to behave. (B) a generalization concerning the way people tend to behave. (C) a claim about human nature and the ways people are capable of behaving. (D) none of the above.\nA: Let's think step by step. We refer to Wikipedia articles on philosophy for help. Psychological egoism suggests that one behaves based on what makes one feels good, hence it is a claim about human nature and how humans are capable of behaving. The answer is (C).Q: Parfit claims that choosing to save the larger number in a trade-off case:\n(A) does not reflect an equal concern for the survival of each, for it does not give equal weight to saving each. (B) does not reflect an equal concern for the survival of each, for it does not give each an equal chance of survival. (C) reflects an equal concern for the survival of each, for it gives equal weight to saving each. (D) reflects an equal concern for the survival of each, for it gives each an equal chance of survival.\nA: Let's think step by step.",
        {
          "until": [
            "</s>"
          ],
          "do_sample": false,
          "temperature": 0.0
        }
      ]
    ],
    "resps": [
      [
        "We refer to the following statements: (A) does not reflect an equal concern for the survival of each, for it does not give each an equal chance of survival. The answer is (A)."
      ]
    ],
    "filtered_resps": [
      "(A)"
    ],
    "exact_match": 0.0
  },
  {
    "doc_id": 13,
    "doc": {
      "question": "The philosophic insistence on providing a logos for the world and our experience of it might itself rely ultimately on adopting a certain mythos, insofar as:",
      "subject": "philosophy",
      "choices": [
        "philosophy assumes that it is possible and meaningful to reason about the world and experience.",
        "the myths of philosophy are really lies that are told to make so-called philosophic enquiries sound more respectable.",
        "philosophy is based on logic, whereas myths are not based on logic.",
        "mythos refers to the philosophic understanding of the world, whereas logos refers to the philosophic understanding of our experience of the world."
      ],
      "answer": 0
    },
    "target": "(A)",
    "arguments": [
      [
        "The following are multiple choice questions (with answers) about philosophy.\n\nQ: The study of reality in the broadest sense, an inquiry into the elemental nature of the universe and the things in it, is known as _____.\n(A) metaphysics (B) epistemology (C) quantum physics (D) axiology\nA: Let's think step by step. We refer to Wikipedia articles on philosophy for help. Among the options, only metaphysics studies the nature of reality and existence. The answer is (A).\n\nQ: According to Moore\u2019s \u201cideal utilitarianism,\u201d the right action is the one that brings about the greatest amount of:\n(A) pleasure. (B) happiness. (C) good. (D) virtue.\nA: Let's think step by step. We refer to Wikipedia articles on philosophy for help. Moore's \"ideal utilitarianism\" states that one's actions should maximize intrinsic goods. The answer is (C).\n\nQ: Before Tolstoy's Christian conversion, what was his perspective on the meaning of life?\n(A) optimist (B) satisfied (C) nominally religious (D) pessimist\nA: Let's think step by step. We refer to Wikipedia articles on philosophy for help. Before his conversion, Tolstoy feels that life was uncertain, which is a pessimist's point of view. The answer is (D).\n\nQ: According to d'Holbach, people always act according to _____.\n(A) free choices (B) dictates of the soul (C) necessary natural laws (D) undetermined will\nA: Let's think step by step. We refer to Wikipedia articles on philosophy for help. d'Holbach believes that people act according to necessary laws, and it proves nothing about people's free will. The answer is (C).\n\nQ: Psychological egoism is:\n(A) an ethical theory about how we ought to behave. (B) a generalization concerning the way people tend to behave. (C) a claim about human nature and the ways people are capable of behaving. (D) none of the above.\nA: Let's think step by step. We refer to Wikipedia articles on philosophy for help. Psychological egoism suggests that one behaves based on what makes one feels good, hence it is a claim about human nature and how humans are capable of behaving. The answer is (C).Q: The philosophic insistence on providing a logos for the world and our experience of it might itself rely ultimately on adopting a certain mythos, insofar as:\n(A) philosophy assumes that it is possible and meaningful to reason about the world and experience. (B) the myths of philosophy are really lies that are told to make so-called philosophic enquiries sound more respectable. (C) philosophy is based on logic, whereas myths are not based on logic. (D) mythos refers to the philosophic understanding of the world, whereas logos refers to the philosophic understanding of our experience of the world.\nA: Let's think step by step.",
        {
          "until": [
            "</s>"
          ],
          "do_sample": false,
          "temperature": 0.0
        }
      ]
    ],
    "resps": [
      [
        "The philosophic insistence on providing a logos for the world and our experience of it might itself rely ultimately on adopting a certain mythos, insofar as: (A) philosophy assumes that it is possible and meaningful to reason about the world and experience. The answer is (D)."
      ]
    ],
    "filtered_resps": [
      "(D)"
    ],
    "exact_match": 0.0
  },
  {
    "doc_id": 21,
    "doc": {
      "question": "Augustine claims that to save another person from injury, it is permissible to:",
      "subject": "philosophy",
      "choices": [
        "lie.",
        "steal.",
        "both a and b.",
        "neither a nor. b."
      ],
      "answer": 3
    },
    "target": "(D)",
    "arguments": [
      [
        "The following are multiple choice questions (with answers) about philosophy.\n\nQ: The study of reality in the broadest sense, an inquiry into the elemental nature of the universe and the things in it, is known as _____.\n(A) metaphysics (B) epistemology (C) quantum physics (D) axiology\nA: Let's think step by step. We refer to Wikipedia articles on philosophy for help. Among the options, only metaphysics studies the nature of reality and existence. The answer is (A).\n\nQ: According to Moore\u2019s \u201cideal utilitarianism,\u201d the right action is the one that brings about the greatest amount of:\n(A) pleasure. (B) happiness. (C) good. (D) virtue.\nA: Let's think step by step. We refer to Wikipedia articles on philosophy for help. Moore's \"ideal utilitarianism\" states that one's actions should maximize intrinsic goods. The answer is (C).\n\nQ: Before Tolstoy's Christian conversion, what was his perspective on the meaning of life?\n(A) optimist (B) satisfied (C) nominally religious (D) pessimist\nA: Let's think step by step. We refer to Wikipedia articles on philosophy for help. Before his conversion, Tolstoy feels that life was uncertain, which is a pessimist's point of view. The answer is (D).\n\nQ: According to d'Holbach, people always act according to _____.\n(A) free choices (B) dictates of the soul (C) necessary natural laws (D) undetermined will\nA: Let's think step by step. We refer to Wikipedia articles on philosophy for help. d'Holbach believes that people act according to necessary laws, and it proves nothing about people's free will. The answer is (C).\n\nQ: Psychological egoism is:\n(A) an ethical theory about how we ought to behave. (B) a generalization concerning the way people tend to behave. (C) a claim about human nature and the ways people are capable of behaving. (D) none of the above.\nA: Let's think step by step. We refer to Wikipedia articles on philosophy for help. Psychological egoism suggests that one behaves based on what makes one feels good, hence it is a claim about human nature and how humans are capable of behaving. The answer is (C).Q: Augustine claims that to save another person from injury, it is permissible to:\n(A) lie. (B) steal. (C) both a and b. (D) neither a nor. b.\nA: Let's think step by step.",
        {
          "until": [
            "</s>"
          ],
          "do_sample": false,
          "temperature": 0.0
        }
      ]
    ],
    "resps": [
      [
        "We refer to the example of Augustine in the story of Aphrodite. To save another person from injury, it is permissible to: (C) both a and b. The answer is (C)."
      ]
    ],
    "filtered_resps": [
      "(C)"
    ],
    "exact_match": 0.0
  },
  {
    "doc_id": 29,
    "doc": {
      "question": "According to Hobbes, in the state of nature, notions of right and wrong or justice and injustice _____.",
      "subject": "philosophy",
      "choices": [
        "have no place",
        "refer to objective standards",
        "still apply to the actions of men",
        "serve as guiding ideals"
      ],
      "answer": 0
    },
    "target": "(A)",
    "arguments": [
      [
        "The following are multiple choice questions (with answers) about philosophy.\n\nQ: The study of reality in the broadest sense, an inquiry into the elemental nature of the universe and the things in it, is known as _____.\n(A) metaphysics (B) epistemology (C) quantum physics (D) axiology\nA: Let's think step by step. We refer to Wikipedia articles on philosophy for help. Among the options, only metaphysics studies the nature of reality and existence. The answer is (A).\n\nQ: According to Moore\u2019s \u201cideal utilitarianism,\u201d the right action is the one that brings about the greatest amount of:\n(A) pleasure. (B) happiness. (C) good. (D) virtue.\nA: Let's think step by step. We refer to Wikipedia articles on philosophy for help. Moore's \"ideal utilitarianism\" states that one's actions should maximize intrinsic goods. The answer is (C).\n\nQ: Before Tolstoy's Christian conversion, what was his perspective on the meaning of life?\n(A) optimist (B) satisfied (C) nominally religious (D) pessimist\nA: Let's think step by step. We refer to Wikipedia articles on philosophy for help. Before his conversion, Tolstoy feels that life was uncertain, which is a pessimist's point of view. The answer is (D).\n\nQ: According to d'Holbach, people always act according to _____.\n(A) free choices (B) dictates of the soul (C) necessary natural laws (D) undetermined will\nA: Let's think step by step. We refer to Wikipedia articles on philosophy for help. d'Holbach believes that people act according to necessary laws, and it proves nothing about people's free will. The answer is (C).\n\nQ: Psychological egoism is:\n(A) an ethical theory about how we ought to behave. (B) a generalization concerning the way people tend to behave. (C) a claim about human nature and the ways people are capable of behaving. (D) none of the above.\nA: Let's think step by step. We refer to Wikipedia articles on philosophy for help. Psychological egoism suggests that one behaves based on what makes one feels good, hence it is a claim about human nature and how humans are capable of behaving. The answer is (C).Q: According to Hobbes, in the state of nature, notions of right and wrong or justice and injustice _____.\n(A) have no place (B) refer to objective standards (C) still apply to the actions of men (D) serve as guiding ideals\nA: Let's think step by step.",
        {
          "until": [
            "</s>"
          ],
          "do_sample": false,
          "temperature": 0.0
        }
      ]
    ],
    "resps": [
      [
        "(C)"
      ]
    ],
    "filtered_resps": [
      "[invalid]"
    ],
    "exact_match": 0.0
  },
  {
    "doc_id": 6,
    "doc": {
      "question": "In Plato's idealism, the unchanging Ideas or \"Forms\" in terms of which sensible objects both exist and are known must transcend (that is, exist beyond) the changing realm of appearances; because if Forms changed, then:",
      "subject": "philosophy",
      "choices": [
        "the only things in the sensible world that we could ever experience would be concepts.",
        "the sensible realm (in contrast to the intelligible realm) would consist only of copies of real things.",
        "nothing in the experienced world could be or be identified as one determinate thing or another.",
        "the sensible world would consist of unchanging Forms."
      ],
      "answer": 2
    },
    "target": "(C)",
    "arguments": [
      [
        "The following are multiple choice questions (with answers) about philosophy.\n\nQ: The study of reality in the broadest sense, an inquiry into the elemental nature of the universe and the things in it, is known as _____.\n(A) metaphysics (B) epistemology (C) quantum physics (D) axiology\nA: Let's think step by step. We refer to Wikipedia articles on philosophy for help. Among the options, only metaphysics studies the nature of reality and existence. The answer is (A).\n\nQ: According to Moore\u2019s \u201cideal utilitarianism,\u201d the right action is the one that brings about the greatest amount of:\n(A) pleasure. (B) happiness. (C) good. (D) virtue.\nA: Let's think step by step. We refer to Wikipedia articles on philosophy for help. Moore's \"ideal utilitarianism\" states that one's actions should maximize intrinsic goods. The answer is (C).\n\nQ: Before Tolstoy's Christian conversion, what was his perspective on the meaning of life?\n(A) optimist (B) satisfied (C) nominally religious (D) pessimist\nA: Let's think step by step. We refer to Wikipedia articles on philosophy for help. Before his conversion, Tolstoy feels that life was uncertain, which is a pessimist's point of view. The answer is (D).\n\nQ: According to d'Holbach, people always act according to _____.\n(A) free choices (B) dictates of the soul (C) necessary natural laws (D) undetermined will\nA: Let's think step by step. We refer to Wikipedia articles on philosophy for help. d'Holbach believes that people act according to necessary laws, and it proves nothing about people's free will. The answer is (C).\n\nQ: Psychological egoism is:\n(A) an ethical theory about how we ought to behave. (B) a generalization concerning the way people tend to behave. (C) a claim about human nature and the ways people are capable of behaving. (D) none of the above.\nA: Let's think step by step. We refer to Wikipedia articles on philosophy for help. Psychological egoism suggests that one behaves based on what makes one feels good, hence it is a claim about human nature and how humans are capable of behaving. The answer is (C).Q: In Plato's idealism, the unchanging Ideas or \"Forms\" in terms of which sensible objects both exist and are known must transcend (that is, exist beyond) the changing realm of appearances; because if Forms changed, then:\n(A) the only things in the sensible world that we could ever experience would be concepts. (B) the sensible realm (in contrast to the intelligible realm) would consist only of copies of real things. (C) nothing in the experienced world could be or be identified as one determinate thing or another. (D) the sensible world would consist of unchanging Forms.\nA: Let's think step by step.",
        {
          "until": [
            "</s>"
          ],
          "do_sample": false,
          "temperature": 0.0
        }
      ]
    ],
    "resps": [
      [
        "The unchanging Forms of the world must transcend the changing realm of appearances. In Plato's idealism, the unchanging Forms must transcend the changing realm of appearances. The answer is (D)."
      ]
    ],
    "filtered_resps": [
      "(D)"
    ],
    "exact_match": 0.0
  },
  {
    "doc_id": 14,
    "doc": {
      "question": "Wolf defines a \u201cmoral saint\u201d as a person who:",
      "subject": "philosophy",
      "choices": [
        "is as morally worthy as possible.",
        "is as religiously observant as possible.",
        "dies for the cause of morality.",
        "all of the above."
      ],
      "answer": 0
    },
    "target": "(A)",
    "arguments": [
      [
        "The following are multiple choice questions (with answers) about philosophy.\n\nQ: The study of reality in the broadest sense, an inquiry into the elemental nature of the universe and the things in it, is known as _____.\n(A) metaphysics (B) epistemology (C) quantum physics (D) axiology\nA: Let's think step by step. We refer to Wikipedia articles on philosophy for help. Among the options, only metaphysics studies the nature of reality and existence. The answer is (A).\n\nQ: According to Moore\u2019s \u201cideal utilitarianism,\u201d the right action is the one that brings about the greatest amount of:\n(A) pleasure. (B) happiness. (C) good. (D) virtue.\nA: Let's think step by step. We refer to Wikipedia articles on philosophy for help. Moore's \"ideal utilitarianism\" states that one's actions should maximize intrinsic goods. The answer is (C).\n\nQ: Before Tolstoy's Christian conversion, what was his perspective on the meaning of life?\n(A) optimist (B) satisfied (C) nominally religious (D) pessimist\nA: Let's think step by step. We refer to Wikipedia articles on philosophy for help. Before his conversion, Tolstoy feels that life was uncertain, which is a pessimist's point of view. The answer is (D).\n\nQ: According to d'Holbach, people always act according to _____.\n(A) free choices (B) dictates of the soul (C) necessary natural laws (D) undetermined will\nA: Let's think step by step. We refer to Wikipedia articles on philosophy for help. d'Holbach believes that people act according to necessary laws, and it proves nothing about people's free will. The answer is (C).\n\nQ: Psychological egoism is:\n(A) an ethical theory about how we ought to behave. (B) a generalization concerning the way people tend to behave. (C) a claim about human nature and the ways people are capable of behaving. (D) none of the above.\nA: Let's think step by step. We refer to Wikipedia articles on philosophy for help. Psychological egoism suggests that one behaves based on what makes one feels good, hence it is a claim about human nature and how humans are capable of behaving. The answer is (C).Q: Wolf defines a \u201cmoral saint\u201d as a person who:\n(A) is as morally worthy as possible. (B) is as religiously observant as possible. (C) dies for the cause of morality. (D) all of the above.\nA: Let's think step by step.",
        {
          "until": [
            "</s>"
          ],
          "do_sample": false,
          "temperature": 0.0
        }
      ]
    ],
    "resps": [
      [
        "A moral saint is someone who is morally worthy of the cause of morality. Wolf defines a moral saint as a person who: (A) is as morally worthy as possible. The answer is (D)."
      ]
    ],
    "filtered_resps": [
      "(D)"
    ],
    "exact_match": 0.0
  },
  {
    "doc_id": 22,
    "doc": {
      "question": "The purpose of the veil of ignorance is to:",
      "subject": "philosophy",
      "choices": [
        "prevent contractors from adopting principles of justice that unfairly advantage themselves.",
        "make the decision of which principles of justice to adopt simpler and easier.",
        "ensure that the principles of justice selected are not too complicated for ordinary people to follow.",
        "all of the above."
      ],
      "answer": 0
    },
    "target": "(A)",
    "arguments": [
      [
        "The following are multiple choice questions (with answers) about philosophy.\n\nQ: The study of reality in the broadest sense, an inquiry into the elemental nature of the universe and the things in it, is known as _____.\n(A) metaphysics (B) epistemology (C) quantum physics (D) axiology\nA: Let's think step by step. We refer to Wikipedia articles on philosophy for help. Among the options, only metaphysics studies the nature of reality and existence. The answer is (A).\n\nQ: According to Moore\u2019s \u201cideal utilitarianism,\u201d the right action is the one that brings about the greatest amount of:\n(A) pleasure. (B) happiness. (C) good. (D) virtue.\nA: Let's think step by step. We refer to Wikipedia articles on philosophy for help. Moore's \"ideal utilitarianism\" states that one's actions should maximize intrinsic goods. The answer is (C).\n\nQ: Before Tolstoy's Christian conversion, what was his perspective on the meaning of life?\n(A) optimist (B) satisfied (C) nominally religious (D) pessimist\nA: Let's think step by step. We refer to Wikipedia articles on philosophy for help. Before his conversion, Tolstoy feels that life was uncertain, which is a pessimist's point of view. The answer is (D).\n\nQ: According to d'Holbach, people always act according to _____.\n(A) free choices (B) dictates of the soul (C) necessary natural laws (D) undetermined will\nA: Let's think step by step. We refer to Wikipedia articles on philosophy for help. d'Holbach believes that people act according to necessary laws, and it proves nothing about people's free will. The answer is (C).\n\nQ: Psychological egoism is:\n(A) an ethical theory about how we ought to behave. (B) a generalization concerning the way people tend to behave. (C) a claim about human nature and the ways people are capable of behaving. (D) none of the above.\nA: Let's think step by step. We refer to Wikipedia articles on philosophy for help. Psychological egoism suggests that one behaves based on what makes one feels good, hence it is a claim about human nature and how humans are capable of behaving. The answer is (C).Q: The purpose of the veil of ignorance is to:\n(A) prevent contractors from adopting principles of justice that unfairly advantage themselves. (B) make the decision of which principles of justice to adopt simpler and easier. (C) ensure that the principles of justice selected are not too complicated for ordinary people to follow. (D) all of the above.\nA: Let's think step by step.",
        {
          "until": [
            "</s>"
          ],
          "do_sample": false,
          "temperature": 0.0
        }
      ]
    ],
    "resps": [
      [
        "The veil of ignorance is a measure of the state's lack of understanding of the laws of the universe. The veil of ignorance is a measure of the state's lack of understanding of the laws of the universe. The answer is (D)."
      ]
    ],
    "filtered_resps": [
      "(D)"
    ],
    "exact_match": 0.0
  },
  {
    "doc_id": 30,
    "doc": {
      "question": "Paley says that every indication of contrivance and design that exists in the watch exists in _____.",
      "subject": "philosophy",
      "choices": [
        "God",
        "infinity",
        "the works of nature",
        "time"
      ],
      "answer": 2
    },
    "target": "(C)",
    "arguments": [
      [
        "The following are multiple choice questions (with answers) about philosophy.\n\nQ: The study of reality in the broadest sense, an inquiry into the elemental nature of the universe and the things in it, is known as _____.\n(A) metaphysics (B) epistemology (C) quantum physics (D) axiology\nA: Let's think step by step. We refer to Wikipedia articles on philosophy for help. Among the options, only metaphysics studies the nature of reality and existence. The answer is (A).\n\nQ: According to Moore\u2019s \u201cideal utilitarianism,\u201d the right action is the one that brings about the greatest amount of:\n(A) pleasure. (B) happiness. (C) good. (D) virtue.\nA: Let's think step by step. We refer to Wikipedia articles on philosophy for help. Moore's \"ideal utilitarianism\" states that one's actions should maximize intrinsic goods. The answer is (C).\n\nQ: Before Tolstoy's Christian conversion, what was his perspective on the meaning of life?\n(A) optimist (B) satisfied (C) nominally religious (D) pessimist\nA: Let's think step by step. We refer to Wikipedia articles on philosophy for help. Before his conversion, Tolstoy feels that life was uncertain, which is a pessimist's point of view. The answer is (D).\n\nQ: According to d'Holbach, people always act according to _____.\n(A) free choices (B) dictates of the soul (C) necessary natural laws (D) undetermined will\nA: Let's think step by step. We refer to Wikipedia articles on philosophy for help. d'Holbach believes that people act according to necessary laws, and it proves nothing about people's free will. The answer is (C).\n\nQ: Psychological egoism is:\n(A) an ethical theory about how we ought to behave. (B) a generalization concerning the way people tend to behave. (C) a claim about human nature and the ways people are capable of behaving. (D) none of the above.\nA: Let's think step by step. We refer to Wikipedia articles on philosophy for help. Psychological egoism suggests that one behaves based on what makes one feels good, hence it is a claim about human nature and how humans are capable of behaving. The answer is (C).Q: Paley says that every indication of contrivance and design that exists in the watch exists in _____.\n(A) God (B) infinity (C) the works of nature (D) time\nA: Let's think step by step.",
        {
          "until": [
            "</s>"
          ],
          "do_sample": false,
          "temperature": 0.0
        }
      ]
    ],
    "resps": [
      [
        "The watch is a work of art. Paley's work is a work of art. The answer is (B)."
      ]
    ],
    "filtered_resps": [
      "(B)"
    ],
    "exact_match": 0.0
  },
  {
    "doc_id": 7,
    "doc": {
      "question": "Epictetus claims that the most important part of philosophy deals with:",
      "subject": "philosophy",
      "choices": [
        "which principles of action are correct.",
        "the explanation for why certain principles of action are correct.",
        "the explanation of why certain demonstrations are valid.",
        "none of the above."
      ],
      "answer": 0
    },
    "target": "(A)",
    "arguments": [
      [
        "The following are multiple choice questions (with answers) about philosophy.\n\nQ: The study of reality in the broadest sense, an inquiry into the elemental nature of the universe and the things in it, is known as _____.\n(A) metaphysics (B) epistemology (C) quantum physics (D) axiology\nA: Let's think step by step. We refer to Wikipedia articles on philosophy for help. Among the options, only metaphysics studies the nature of reality and existence. The answer is (A).\n\nQ: According to Moore\u2019s \u201cideal utilitarianism,\u201d the right action is the one that brings about the greatest amount of:\n(A) pleasure. (B) happiness. (C) good. (D) virtue.\nA: Let's think step by step. We refer to Wikipedia articles on philosophy for help. Moore's \"ideal utilitarianism\" states that one's actions should maximize intrinsic goods. The answer is (C).\n\nQ: Before Tolstoy's Christian conversion, what was his perspective on the meaning of life?\n(A) optimist (B) satisfied (C) nominally religious (D) pessimist\nA: Let's think step by step. We refer to Wikipedia articles on philosophy for help. Before his conversion, Tolstoy feels that life was uncertain, which is a pessimist's point of view. The answer is (D).\n\nQ: According to d'Holbach, people always act according to _____.\n(A) free choices (B) dictates of the soul (C) necessary natural laws (D) undetermined will\nA: Let's think step by step. We refer to Wikipedia articles on philosophy for help. d'Holbach believes that people act according to necessary laws, and it proves nothing about people's free will. The answer is (C).\n\nQ: Psychological egoism is:\n(A) an ethical theory about how we ought to behave. (B) a generalization concerning the way people tend to behave. (C) a claim about human nature and the ways people are capable of behaving. (D) none of the above.\nA: Let's think step by step. We refer to Wikipedia articles on philosophy for help. Psychological egoism suggests that one behaves based on what makes one feels good, hence it is a claim about human nature and how humans are capable of behaving. The answer is (C).Q: Epictetus claims that the most important part of philosophy deals with:\n(A) which principles of action are correct. (B) the explanation for why certain principles of action are correct. (C) the explanation of why certain demonstrations are valid. (D) none of the above.\nA: Let's think step by step.",
        {
          "until": [
            "</s>"
          ],
          "do_sample": false,
          "temperature": 0.0
        }
      ]
    ],
    "resps": [
      [
        "Epictetus claims that the most important part of philosophy deals with: (B) the explanation for why certain principles of action are correct. The answer is (B)."
      ]
    ],
    "filtered_resps": [
      "(B)"
    ],
    "exact_match": 0.0
  },
  {
    "doc_id": 15,
    "doc": {
      "question": "According to Epicurus:",
      "subject": "philosophy",
      "choices": [
        "every pleasure is good, and every pleasure is to be chosen.",
        "every pleasure is good, but not every pleasure is to be chosen.",
        "not every pleasure is good, but every pleasure is to be chosen.",
        "not every pleasure is good, and not every pleasure is to be chosen."
      ],
      "answer": 1
    },
    "target": "(B)",
    "arguments": [
      [
        "The following are multiple choice questions (with answers) about philosophy.\n\nQ: The study of reality in the broadest sense, an inquiry into the elemental nature of the universe and the things in it, is known as _____.\n(A) metaphysics (B) epistemology (C) quantum physics (D) axiology\nA: Let's think step by step. We refer to Wikipedia articles on philosophy for help. Among the options, only metaphysics studies the nature of reality and existence. The answer is (A).\n\nQ: According to Moore\u2019s \u201cideal utilitarianism,\u201d the right action is the one that brings about the greatest amount of:\n(A) pleasure. (B) happiness. (C) good. (D) virtue.\nA: Let's think step by step. We refer to Wikipedia articles on philosophy for help. Moore's \"ideal utilitarianism\" states that one's actions should maximize intrinsic goods. The answer is (C).\n\nQ: Before Tolstoy's Christian conversion, what was his perspective on the meaning of life?\n(A) optimist (B) satisfied (C) nominally religious (D) pessimist\nA: Let's think step by step. We refer to Wikipedia articles on philosophy for help. Before his conversion, Tolstoy feels that life was uncertain, which is a pessimist's point of view. The answer is (D).\n\nQ: According to d'Holbach, people always act according to _____.\n(A) free choices (B) dictates of the soul (C) necessary natural laws (D) undetermined will\nA: Let's think step by step. We refer to Wikipedia articles on philosophy for help. d'Holbach believes that people act according to necessary laws, and it proves nothing about people's free will. The answer is (C).\n\nQ: Psychological egoism is:\n(A) an ethical theory about how we ought to behave. (B) a generalization concerning the way people tend to behave. (C) a claim about human nature and the ways people are capable of behaving. (D) none of the above.\nA: Let's think step by step. We refer to Wikipedia articles on philosophy for help. Psychological egoism suggests that one behaves based on what makes one feels good, hence it is a claim about human nature and how humans are capable of behaving. The answer is (C).Q: According to Epicurus:\n(A) every pleasure is good, and every pleasure is to be chosen. (B) every pleasure is good, but not every pleasure is to be chosen. (C) not every pleasure is good, but every pleasure is to be chosen. (D) not every pleasure is good, and not every pleasure is to be chosen.\nA: Let's think step by step.",
        {
          "until": [
            "</s>"
          ],
          "do_sample": false,
          "temperature": 0.0
        }
      ]
    ],
    "resps": [
      [
        "Epicurus says that every pleasure is good, and every pleasure is to be chosen. The answer is (A)."
      ]
    ],
    "filtered_resps": [
      "(A)"
    ],
    "exact_match": 0.0
  },
  {
    "doc_id": 23,
    "doc": {
      "question": "Butler argues that the belief that there is a conflict between public goods and private goods arises from our notions of:",
      "subject": "philosophy",
      "choices": [
        "justice.",
        "benevolence.",
        "property.",
        "charity."
      ],
      "answer": 2
    },
    "target": "(C)",
    "arguments": [
      [
        "The following are multiple choice questions (with answers) about philosophy.\n\nQ: The study of reality in the broadest sense, an inquiry into the elemental nature of the universe and the things in it, is known as _____.\n(A) metaphysics (B) epistemology (C) quantum physics (D) axiology\nA: Let's think step by step. We refer to Wikipedia articles on philosophy for help. Among the options, only metaphysics studies the nature of reality and existence. The answer is (A).\n\nQ: According to Moore\u2019s \u201cideal utilitarianism,\u201d the right action is the one that brings about the greatest amount of:\n(A) pleasure. (B) happiness. (C) good. (D) virtue.\nA: Let's think step by step. We refer to Wikipedia articles on philosophy for help. Moore's \"ideal utilitarianism\" states that one's actions should maximize intrinsic goods. The answer is (C).\n\nQ: Before Tolstoy's Christian conversion, what was his perspective on the meaning of life?\n(A) optimist (B) satisfied (C) nominally religious (D) pessimist\nA: Let's think step by step. We refer to Wikipedia articles on philosophy for help. Before his conversion, Tolstoy feels that life was uncertain, which is a pessimist's point of view. The answer is (D).\n\nQ: According to d'Holbach, people always act according to _____.\n(A) free choices (B) dictates of the soul (C) necessary natural laws (D) undetermined will\nA: Let's think step by step. We refer to Wikipedia articles on philosophy for help. d'Holbach believes that people act according to necessary laws, and it proves nothing about people's free will. The answer is (C).\n\nQ: Psychological egoism is:\n(A) an ethical theory about how we ought to behave. (B) a generalization concerning the way people tend to behave. (C) a claim about human nature and the ways people are capable of behaving. (D) none of the above.\nA: Let's think step by step. We refer to Wikipedia articles on philosophy for help. Psychological egoism suggests that one behaves based on what makes one feels good, hence it is a claim about human nature and how humans are capable of behaving. The answer is (C).Q: Butler argues that the belief that there is a conflict between public goods and private goods arises from our notions of:\n(A) justice. (B) benevolence. (C) property. (D) charity.\nA: Let's think step by step.",
        {
          "until": [
            "</s>"
          ],
          "do_sample": false,
          "temperature": 0.0
        }
      ]
    ],
    "resps": [
      [
        "Butler argues that the belief that there is a conflict between public goods and private goods arises from our notions of: (A) justice. The answer is (A)."
      ]
    ],
    "filtered_resps": [
      "(A)"
    ],
    "exact_match": 0.0
  },
  {
    "doc_id": 31,
    "doc": {
      "question": "Which of the following would Gauthier not accept?",
      "subject": "philosophy",
      "choices": [
        "Morality faces a foundational crisis.",
        "Deliberative justification is incomplete.",
        "In some situations, everyone will do better if they mutually agree to constrain their pursuit of self-interest.",
        "A rational agent is one who acts to achieve the maximal fulfillment of her preferences."
      ],
      "answer": 1
    },
    "target": "(B)",
    "arguments": [
      [
        "The following are multiple choice questions (with answers) about philosophy.\n\nQ: The study of reality in the broadest sense, an inquiry into the elemental nature of the universe and the things in it, is known as _____.\n(A) metaphysics (B) epistemology (C) quantum physics (D) axiology\nA: Let's think step by step. We refer to Wikipedia articles on philosophy for help. Among the options, only metaphysics studies the nature of reality and existence. The answer is (A).\n\nQ: According to Moore\u2019s \u201cideal utilitarianism,\u201d the right action is the one that brings about the greatest amount of:\n(A) pleasure. (B) happiness. (C) good. (D) virtue.\nA: Let's think step by step. We refer to Wikipedia articles on philosophy for help. Moore's \"ideal utilitarianism\" states that one's actions should maximize intrinsic goods. The answer is (C).\n\nQ: Before Tolstoy's Christian conversion, what was his perspective on the meaning of life?\n(A) optimist (B) satisfied (C) nominally religious (D) pessimist\nA: Let's think step by step. We refer to Wikipedia articles on philosophy for help. Before his conversion, Tolstoy feels that life was uncertain, which is a pessimist's point of view. The answer is (D).\n\nQ: According to d'Holbach, people always act according to _____.\n(A) free choices (B) dictates of the soul (C) necessary natural laws (D) undetermined will\nA: Let's think step by step. We refer to Wikipedia articles on philosophy for help. d'Holbach believes that people act according to necessary laws, and it proves nothing about people's free will. The answer is (C).\n\nQ: Psychological egoism is:\n(A) an ethical theory about how we ought to behave. (B) a generalization concerning the way people tend to behave. (C) a claim about human nature and the ways people are capable of behaving. (D) none of the above.\nA: Let's think step by step. We refer to Wikipedia articles on philosophy for help. Psychological egoism suggests that one behaves based on what makes one feels good, hence it is a claim about human nature and how humans are capable of behaving. The answer is (C).Q: Which of the following would Gauthier not accept?\n(A) Morality faces a foundational crisis. (B) Deliberative justification is incomplete. (C) In some situations, everyone will do better if they mutually agree to constrain their pursuit of self-interest. (D) A rational agent is one who acts to achieve the maximal fulfillment of her preferences.\nA: Let's think step by step.",
        {
          "until": [
            "</s>"
          ],
          "do_sample": false,
          "temperature": 0.0
        }
      ]
    ],
    "resps": [
      [
        "Gauthier would not accept the following: (B) Deliberative justification is incomplete. The answer is (B)."
      ]
    ],
    "filtered_resps": [
      "(B)"
    ],
    "exact_match": 1.0
  }
]