[
  {
    "doc_id": 0,
    "doc": {
      "question": "The main factor preventing subsistence economies from advancing economically is the lack of",
      "subject": "high_school_geography",
      "choices": [
        "a currency.",
        "a well-connected transportation infrastructure.",
        "government activity.",
        "a banking service."
      ],
      "answer": 1
    },
    "target": "(B)",
    "arguments": [
      [
        "The following are multiple choice questions (with answers) about high school geography.\n\nQ: The practice of hiring a foreign third-party service provider to run an operation is called\n(A) outsourcing. (B) offshoring. (C) maquiladoras. (D) locational interdependence.\nA:  (B)\n\nQ: The rate of natural increase of a population is found by subtracting the\n(A) crude death rate from the crude birth date. (B) crude birth rate from the crude death rate. (C) doubling time from the crude birth rate. (D) fertility rate from the crude death rate.\nA:  (A)\n\nQ: Which one of the following items is an example of nonmaterial culture?\n(A) Dove soap (B) Dove candy bar (C) Dove symbol (D) A dove (bird)\nA:  (C)\n\nQ: Which of the following statements is NOT accurate regarding the services provided by local governments in the United States?\n(A) Duplication of efforts occurs often. (B) Social problems of the central city spill over into the surrounding residential suburbs. (C) Inefficiency in providing services occurs often. (D) One neighborhood's efforts to reduce pollution are always supported by neighboring communities.\nA:  (D)\n\nQ: During the third stage of the demographic transition model, which of the following is true?\n(A) Birth rates increase and population growth rate is less rapid. (B) Birth rates decline and population growth rate is less rapid. (C) Birth rates increase and population growth rate increases. (D) Birth rates decrease and population growth rate increases.\nA:  (B)\n\nQ: The main factor preventing subsistence economies from advancing economically is the lack of\n(A) a currency. (B) a well-connected transportation infrastructure. (C) government activity. (D) a banking service.\nA: ",
        {
          "until": [
            "</s>"
          ]
        }
      ]
    ],
    "resps": [
      [
        "(B)"
      ]
    ],
    "filtered_resps": [
      "(B)"
    ],
    "exact_match": 1.0
  },
  {
    "doc_id": 8,
    "doc": {
      "question": "Which of the following is a centrifugal force in a country?",
      "subject": "high_school_geography",
      "choices": [
        "Religious differences",
        "A national holiday",
        "An attack by another country",
        "A charismatic national leader"
      ],
      "answer": 0
    },
    "target": "(A)",
    "arguments": [
      [
        "The following are multiple choice questions (with answers) about high school geography.\n\nQ: The rate of natural increase of a population is found by subtracting the\n(A) crude death rate from the crude birth date. (B) crude birth rate from the crude death rate. (C) doubling time from the crude birth rate. (D) fertility rate from the crude death rate.\nA:  (A)\n\nQ: Which one of the following items is an example of nonmaterial culture?\n(A) Dove soap (B) Dove candy bar (C) Dove symbol (D) A dove (bird)\nA:  (C)\n\nQ: During the third stage of the demographic transition model, which of the following is true?\n(A) Birth rates increase and population growth rate is less rapid. (B) Birth rates decline and population growth rate is less rapid. (C) Birth rates increase and population growth rate increases. (D) Birth rates decrease and population growth rate increases.\nA:  (B)\n\nQ: The practice of hiring a foreign third-party service provider to run an operation is called\n(A) outsourcing. (B) offshoring. (C) maquiladoras. (D) locational interdependence.\nA:  (B)\n\nQ: Which of the following statements is NOT accurate regarding the services provided by local governments in the United States?\n(A) Duplication of efforts occurs often. (B) Social problems of the central city spill over into the surrounding residential suburbs. (C) Inefficiency in providing services occurs often. (D) One neighborhood's efforts to reduce pollution are always supported by neighboring communities.\nA:  (D)\n\nQ: Which of the following is a centrifugal force in a country?\n(A) Religious differences (B) A national holiday (C) An attack by another country (D) A charismatic national leader\nA: ",
        {
          "until": [
            "</s>"
          ]
        }
      ]
    ],
    "resps": [
      [
        "(D)"
      ]
    ],
    "filtered_resps": [
      "(D)"
    ],
    "exact_match": 0.0
  },
  {
    "doc_id": 16,
    "doc": {
      "question": "Which one of the following is NOT a characteristic of world cities?",
      "subject": "high_school_geography",
      "choices": [
        "World cities contain the headquarters of many transnational corporations.",
        "World cities are well connected to secondary-level world cities.",
        "World cities contain many offices of multinational organizations.",
        "World cities are found only in the northern and western hemispheres."
      ],
      "answer": 3
    },
    "target": "(D)",
    "arguments": [
      [
        "The following are multiple choice questions (with answers) about high school geography.\n\nQ: The rate of natural increase of a population is found by subtracting the\n(A) crude death rate from the crude birth date. (B) crude birth rate from the crude death rate. (C) doubling time from the crude birth rate. (D) fertility rate from the crude death rate.\nA:  (A)\n\nQ: Which one of the following items is an example of nonmaterial culture?\n(A) Dove soap (B) Dove candy bar (C) Dove symbol (D) A dove (bird)\nA:  (C)\n\nQ: During the third stage of the demographic transition model, which of the following is true?\n(A) Birth rates increase and population growth rate is less rapid. (B) Birth rates decline and population growth rate is less rapid. (C) Birth rates increase and population growth rate increases. (D) Birth rates decrease and population growth rate increases.\nA:  (B)\n\nQ: Which of the following statements is NOT accurate regarding the services provided by local governments in the United States?\n(A) Duplication of efforts occurs often. (B) Social problems of the central city spill over into the surrounding residential suburbs. (C) Inefficiency in providing services occurs often. (D) One neighborhood's efforts to reduce pollution are always supported by neighboring communities.\nA:  (D)\n\nQ: The practice of hiring a foreign third-party service provider to run an operation is called\n(A) outsourcing. (B) offshoring. (C) maquiladoras. (D) locational interdependence.\nA:  (B)\n\nQ: Which one of the following is NOT a characteristic of world cities?\n(A) World cities contain the headquarters of many transnational corporations. (B) World cities are well connected to secondary-level world cities. (C) World cities contain many offices of multinational organizations. (D) World cities are found only in the northern and western hemispheres.\nA: ",
        {
          "until": [
            "</s>"
          ]
        }
      ]
    ],
    "resps": [
      [
        "(D)"
      ]
    ],
    "filtered_resps": [
      "(D)"
    ],
    "exact_match": 1.0
  },
  {
    "doc_id": 24,
    "doc": {
      "question": "When a country combines its religion with its government, it is called a",
      "subject": "high_school_geography",
      "choices": [
        "dictatorship.",
        "theocracy.",
        "democracy.",
        "autocracy."
      ],
      "answer": 1
    },
    "target": "(B)",
    "arguments": [
      [
        "The following are multiple choice questions (with answers) about high school geography.\n\nQ: During the third stage of the demographic transition model, which of the following is true?\n(A) Birth rates increase and population growth rate is less rapid. (B) Birth rates decline and population growth rate is less rapid. (C) Birth rates increase and population growth rate increases. (D) Birth rates decrease and population growth rate increases.\nA:  (B)\n\nQ: The rate of natural increase of a population is found by subtracting the\n(A) crude death rate from the crude birth date. (B) crude birth rate from the crude death rate. (C) doubling time from the crude birth rate. (D) fertility rate from the crude death rate.\nA:  (A)\n\nQ: The practice of hiring a foreign third-party service provider to run an operation is called\n(A) outsourcing. (B) offshoring. (C) maquiladoras. (D) locational interdependence.\nA:  (B)\n\nQ: Which of the following statements is NOT accurate regarding the services provided by local governments in the United States?\n(A) Duplication of efforts occurs often. (B) Social problems of the central city spill over into the surrounding residential suburbs. (C) Inefficiency in providing services occurs often. (D) One neighborhood's efforts to reduce pollution are always supported by neighboring communities.\nA:  (D)\n\nQ: Which one of the following items is an example of nonmaterial culture?\n(A) Dove soap (B) Dove candy bar (C) Dove symbol (D) A dove (bird)\nA:  (C)\n\nQ: When a country combines its religion with its government, it is called a\n(A) dictatorship. (B) theocracy. (C) democracy. (D) autocracy.\nA: ",
        {
          "until": [
            "</s>"
          ]
        }
      ]
    ],
    "resps": [
      [
        "(D)<0x0A>Answer: (D)"
      ]
    ],
    "filtered_resps": [
      "(D)<0x0A>Answer: (D)"
    ],
    "exact_match": 0.0
  },
  {
    "doc_id": 32,
    "doc": {
      "question": "Transnational corporations distribute their operations",
      "subject": "high_school_geography",
      "choices": [
        "manufacturing goods where production costs are the highest.",
        "conducting accounting and research services where economical.",
        "based on comparative advantage.",
        "with headquarters located in LDCs."
      ],
      "answer": 2
    },
    "target": "(C)",
    "arguments": [
      [
        "The following are multiple choice questions (with answers) about high school geography.\n\nQ: Which one of the following items is an example of nonmaterial culture?\n(A) Dove soap (B) Dove candy bar (C) Dove symbol (D) A dove (bird)\nA:  (C)\n\nQ: The practice of hiring a foreign third-party service provider to run an operation is called\n(A) outsourcing. (B) offshoring. (C) maquiladoras. (D) locational interdependence.\nA:  (B)\n\nQ: The rate of natural increase of a population is found by subtracting the\n(A) crude death rate from the crude birth date. (B) crude birth rate from the crude death rate. (C) doubling time from the crude birth rate. (D) fertility rate from the crude death rate.\nA:  (A)\n\nQ: Which of the following statements is NOT accurate regarding the services provided by local governments in the United States?\n(A) Duplication of efforts occurs often. (B) Social problems of the central city spill over into the surrounding residential suburbs. (C) Inefficiency in providing services occurs often. (D) One neighborhood's efforts to reduce pollution are always supported by neighboring communities.\nA:  (D)\n\nQ: During the third stage of the demographic transition model, which of the following is true?\n(A) Birth rates increase and population growth rate is less rapid. (B) Birth rates decline and population growth rate is less rapid. (C) Birth rates increase and population growth rate increases. (D) Birth rates decrease and population growth rate increases.\nA:  (B)\n\nQ: Transnational corporations distribute their operations\n(A) manufacturing goods where production costs are the highest. (B) conducting accounting and research services where economical. (C) based on comparative advantage. (D) with headquarters located in LDCs.\nA: ",
        {
          "until": [
            "</s>"
          ]
        }
      ]
    ],
    "resps": [
      [
        "(D)"
      ]
    ],
    "filtered_resps": [
      "(D)"
    ],
    "exact_match": 0.0
  },
  {
    "doc_id": 40,
    "doc": {
      "question": "National sports teams, flags, national anthems, and national holidays all promote",
      "subject": "high_school_geography",
      "choices": [
        "nationalism.",
        "sectarianism.",
        "political unrest.",
        "functional disputes."
      ],
      "answer": 0
    },
    "target": "(A)",
    "arguments": [
      [
        "The following are multiple choice questions (with answers) about high school geography.\n\nQ: The rate of natural increase of a population is found by subtracting the\n(A) crude death rate from the crude birth date. (B) crude birth rate from the crude death rate. (C) doubling time from the crude birth rate. (D) fertility rate from the crude death rate.\nA:  (A)\n\nQ: Which one of the following items is an example of nonmaterial culture?\n(A) Dove soap (B) Dove candy bar (C) Dove symbol (D) A dove (bird)\nA:  (C)\n\nQ: Which of the following statements is NOT accurate regarding the services provided by local governments in the United States?\n(A) Duplication of efforts occurs often. (B) Social problems of the central city spill over into the surrounding residential suburbs. (C) Inefficiency in providing services occurs often. (D) One neighborhood's efforts to reduce pollution are always supported by neighboring communities.\nA:  (D)\n\nQ: The practice of hiring a foreign third-party service provider to run an operation is called\n(A) outsourcing. (B) offshoring. (C) maquiladoras. (D) locational interdependence.\nA:  (B)\n\nQ: During the third stage of the demographic transition model, which of the following is true?\n(A) Birth rates increase and population growth rate is less rapid. (B) Birth rates decline and population growth rate is less rapid. (C) Birth rates increase and population growth rate increases. (D) Birth rates decrease and population growth rate increases.\nA:  (B)\n\nQ: National sports teams, flags, national anthems, and national holidays all promote\n(A) nationalism. (B) sectarianism. (C) political unrest. (D) functional disputes.\nA: ",
        {
          "until": [
            "</s>"
          ]
        }
      ]
    ],
    "resps": [
      [
        "(A)<0x0A><0x0A>"
      ]
    ],
    "filtered_resps": [
      "(A)<0x0A><0x0A>"
    ],
    "exact_match": 0.0
  },
  {
    "doc_id": 48,
    "doc": {
      "question": "Which of the following jobs is in the non-basic employment sector?",
      "subject": "high_school_geography",
      "choices": [
        "Software engineer",
        "F-10 pickup truck assembly-line worker",
        "Oil refinery worker",
        "Parking lot attendant"
      ],
      "answer": 3
    },
    "target": "(D)",
    "arguments": [
      [
        "The following are multiple choice questions (with answers) about high school geography.\n\nQ: Which one of the following items is an example of nonmaterial culture?\n(A) Dove soap (B) Dove candy bar (C) Dove symbol (D) A dove (bird)\nA:  (C)\n\nQ: The rate of natural increase of a population is found by subtracting the\n(A) crude death rate from the crude birth date. (B) crude birth rate from the crude death rate. (C) doubling time from the crude birth rate. (D) fertility rate from the crude death rate.\nA:  (A)\n\nQ: Which of the following statements is NOT accurate regarding the services provided by local governments in the United States?\n(A) Duplication of efforts occurs often. (B) Social problems of the central city spill over into the surrounding residential suburbs. (C) Inefficiency in providing services occurs often. (D) One neighborhood's efforts to reduce pollution are always supported by neighboring communities.\nA:  (D)\n\nQ: During the third stage of the demographic transition model, which of the following is true?\n(A) Birth rates increase and population growth rate is less rapid. (B) Birth rates decline and population growth rate is less rapid. (C) Birth rates increase and population growth rate increases. (D) Birth rates decrease and population growth rate increases.\nA:  (B)\n\nQ: The practice of hiring a foreign third-party service provider to run an operation is called\n(A) outsourcing. (B) offshoring. (C) maquiladoras. (D) locational interdependence.\nA:  (B)\n\nQ: Which of the following jobs is in the non-basic employment sector?\n(A) Software engineer (B) F-10 pickup truck assembly-line worker (C) Oil refinery worker (D) Parking lot attendant\nA: ",
        {
          "until": [
            "</s>"
          ]
        }
      ]
    ],
    "resps": [
      [
        "(D)"
      ]
    ],
    "filtered_resps": [
      "(D)"
    ],
    "exact_match": 1.0
  },
  {
    "doc_id": 56,
    "doc": {
      "question": "The theory that every society develops economically according to a five-stage pattern of growth is attributed to",
      "subject": "high_school_geography",
      "choices": [
        "Rostow.",
        "Ravenstein.",
        "von Th\u00fcnen.",
        "Burgess."
      ],
      "answer": 0
    },
    "target": "(A)",
    "arguments": [
      [
        "The following are multiple choice questions (with answers) about high school geography.\n\nQ: Which of the following statements is NOT accurate regarding the services provided by local governments in the United States?\n(A) Duplication of efforts occurs often. (B) Social problems of the central city spill over into the surrounding residential suburbs. (C) Inefficiency in providing services occurs often. (D) One neighborhood's efforts to reduce pollution are always supported by neighboring communities.\nA:  (D)\n\nQ: Which one of the following items is an example of nonmaterial culture?\n(A) Dove soap (B) Dove candy bar (C) Dove symbol (D) A dove (bird)\nA:  (C)\n\nQ: The rate of natural increase of a population is found by subtracting the\n(A) crude death rate from the crude birth date. (B) crude birth rate from the crude death rate. (C) doubling time from the crude birth rate. (D) fertility rate from the crude death rate.\nA:  (A)\n\nQ: The practice of hiring a foreign third-party service provider to run an operation is called\n(A) outsourcing. (B) offshoring. (C) maquiladoras. (D) locational interdependence.\nA:  (B)\n\nQ: During the third stage of the demographic transition model, which of the following is true?\n(A) Birth rates increase and population growth rate is less rapid. (B) Birth rates decline and population growth rate is less rapid. (C) Birth rates increase and population growth rate increases. (D) Birth rates decrease and population growth rate increases.\nA:  (B)\n\nQ: The theory that every society develops economically according to a five-stage pattern of growth is attributed to\n(A) Rostow. (B) Ravenstein. (C) von Th\u00fcnen. (D) Burgess.\nA: ",
        {
          "until": [
            "</s>"
          ]
        }
      ]
    ],
    "resps": [
      [
        "(C)<0x0A><0x0A>"
      ]
    ],
    "filtered_resps": [
      "(C)<0x0A><0x0A>"
    ],
    "exact_match": 0.0
  },
  {
    "doc_id": 64,
    "doc": {
      "question": "Which of the following is a formal region?",
      "subject": "high_school_geography",
      "choices": [
        "Dixie",
        "Pennsylvania",
        "The market area of Winn-Dixie",
        "The Pacific Northwest"
      ],
      "answer": 1
    },
    "target": "(B)",
    "arguments": [
      [
        "The following are multiple choice questions (with answers) about high school geography.\n\nQ: Which one of the following items is an example of nonmaterial culture?\n(A) Dove soap (B) Dove candy bar (C) Dove symbol (D) A dove (bird)\nA:  (C)\n\nQ: The rate of natural increase of a population is found by subtracting the\n(A) crude death rate from the crude birth date. (B) crude birth rate from the crude death rate. (C) doubling time from the crude birth rate. (D) fertility rate from the crude death rate.\nA:  (A)\n\nQ: Which of the following statements is NOT accurate regarding the services provided by local governments in the United States?\n(A) Duplication of efforts occurs often. (B) Social problems of the central city spill over into the surrounding residential suburbs. (C) Inefficiency in providing services occurs often. (D) One neighborhood's efforts to reduce pollution are always supported by neighboring communities.\nA:  (D)\n\nQ: The practice of hiring a foreign third-party service provider to run an operation is called\n(A) outsourcing. (B) offshoring. (C) maquiladoras. (D) locational interdependence.\nA:  (B)\n\nQ: During the third stage of the demographic transition model, which of the following is true?\n(A) Birth rates increase and population growth rate is less rapid. (B) Birth rates decline and population growth rate is less rapid. (C) Birth rates increase and population growth rate increases. (D) Birth rates decrease and population growth rate increases.\nA:  (B)\n\nQ: Which of the following is a formal region?\n(A) Dixie (B) Pennsylvania (C) The market area of Winn-Dixie (D) The Pacific Northwest\nA: ",
        {
          "until": [
            "</s>"
          ]
        }
      ]
    ],
    "resps": [
      [
        "(D)"
      ]
    ],
    "filtered_resps": [
      "(D)"
    ],
    "exact_match": 0.0
  },
  {
    "doc_id": 72,
    "doc": {
      "question": "The sacred book of the Hindu is called the",
      "subject": "high_school_geography",
      "choices": [
        "Talmud.",
        "Bible.",
        "Torah.",
        "Veda."
      ],
      "answer": 3
    },
    "target": "(D)",
    "arguments": [
      [
        "The following are multiple choice questions (with answers) about high school geography.\n\nQ: Which of the following statements is NOT accurate regarding the services provided by local governments in the United States?\n(A) Duplication of efforts occurs often. (B) Social problems of the central city spill over into the surrounding residential suburbs. (C) Inefficiency in providing services occurs often. (D) One neighborhood's efforts to reduce pollution are always supported by neighboring communities.\nA:  (D)\n\nQ: During the third stage of the demographic transition model, which of the following is true?\n(A) Birth rates increase and population growth rate is less rapid. (B) Birth rates decline and population growth rate is less rapid. (C) Birth rates increase and population growth rate increases. (D) Birth rates decrease and population growth rate increases.\nA:  (B)\n\nQ: Which one of the following items is an example of nonmaterial culture?\n(A) Dove soap (B) Dove candy bar (C) Dove symbol (D) A dove (bird)\nA:  (C)\n\nQ: The practice of hiring a foreign third-party service provider to run an operation is called\n(A) outsourcing. (B) offshoring. (C) maquiladoras. (D) locational interdependence.\nA:  (B)\n\nQ: The rate of natural increase of a population is found by subtracting the\n(A) crude death rate from the crude birth date. (B) crude birth rate from the crude death rate. (C) doubling time from the crude birth rate. (D) fertility rate from the crude death rate.\nA:  (A)\n\nQ: The sacred book of the Hindu is called the\n(A) Talmud. (B) Bible. (C) Torah. (D) Veda.\nA: ",
        {
          "until": [
            "</s>"
          ]
        }
      ]
    ],
    "resps": [
      [
        "(D)"
      ]
    ],
    "filtered_resps": [
      "(D)"
    ],
    "exact_match": 1.0
  },
  {
    "doc_id": 80,
    "doc": {
      "question": "Which crop began the Third Agricultural Revolution?",
      "subject": "high_school_geography",
      "choices": [
        "Rice",
        "Wheat",
        "Barley",
        "Millet"
      ],
      "answer": 0
    },
    "target": "(A)",
    "arguments": [
      [
        "The following are multiple choice questions (with answers) about high school geography.\n\nQ: During the third stage of the demographic transition model, which of the following is true?\n(A) Birth rates increase and population growth rate is less rapid. (B) Birth rates decline and population growth rate is less rapid. (C) Birth rates increase and population growth rate increases. (D) Birth rates decrease and population growth rate increases.\nA:  (B)\n\nQ: The rate of natural increase of a population is found by subtracting the\n(A) crude death rate from the crude birth date. (B) crude birth rate from the crude death rate. (C) doubling time from the crude birth rate. (D) fertility rate from the crude death rate.\nA:  (A)\n\nQ: The practice of hiring a foreign third-party service provider to run an operation is called\n(A) outsourcing. (B) offshoring. (C) maquiladoras. (D) locational interdependence.\nA:  (B)\n\nQ: Which one of the following items is an example of nonmaterial culture?\n(A) Dove soap (B) Dove candy bar (C) Dove symbol (D) A dove (bird)\nA:  (C)\n\nQ: Which of the following statements is NOT accurate regarding the services provided by local governments in the United States?\n(A) Duplication of efforts occurs often. (B) Social problems of the central city spill over into the surrounding residential suburbs. (C) Inefficiency in providing services occurs often. (D) One neighborhood's efforts to reduce pollution are always supported by neighboring communities.\nA:  (D)\n\nQ: Which crop began the Third Agricultural Revolution?\n(A) Rice (B) Wheat (C) Barley (D) Millet\nA: ",
        {
          "until": [
            "</s>"
          ]
        }
      ]
    ],
    "resps": [
      [
        "(B)"
      ]
    ],
    "filtered_resps": [
      "(B)"
    ],
    "exact_match": 0.0
  },
  {
    "doc_id": 88,
    "doc": {
      "question": "Which of the following activities are NOT secondary economic activities?",
      "subject": "high_school_geography",
      "choices": [
        "Assembling automotive parts",
        "Sewing shirts",
        "Mining copper",
        "Binding books"
      ],
      "answer": 2
    },
    "target": "(C)",
    "arguments": [
      [
        "The following are multiple choice questions (with answers) about high school geography.\n\nQ: The rate of natural increase of a population is found by subtracting the\n(A) crude death rate from the crude birth date. (B) crude birth rate from the crude death rate. (C) doubling time from the crude birth rate. (D) fertility rate from the crude death rate.\nA:  (A)\n\nQ: During the third stage of the demographic transition model, which of the following is true?\n(A) Birth rates increase and population growth rate is less rapid. (B) Birth rates decline and population growth rate is less rapid. (C) Birth rates increase and population growth rate increases. (D) Birth rates decrease and population growth rate increases.\nA:  (B)\n\nQ: Which one of the following items is an example of nonmaterial culture?\n(A) Dove soap (B) Dove candy bar (C) Dove symbol (D) A dove (bird)\nA:  (C)\n\nQ: Which of the following statements is NOT accurate regarding the services provided by local governments in the United States?\n(A) Duplication of efforts occurs often. (B) Social problems of the central city spill over into the surrounding residential suburbs. (C) Inefficiency in providing services occurs often. (D) One neighborhood's efforts to reduce pollution are always supported by neighboring communities.\nA:  (D)\n\nQ: The practice of hiring a foreign third-party service provider to run an operation is called\n(A) outsourcing. (B) offshoring. (C) maquiladoras. (D) locational interdependence.\nA:  (B)\n\nQ: Which of the following activities are NOT secondary economic activities?\n(A) Assembling automotive parts (B) Sewing shirts (C) Mining copper (D) Binding books\nA: ",
        {
          "until": [
            "</s>"
          ]
        }
      ]
    ],
    "resps": [
      [
        "(C)"
      ]
    ],
    "filtered_resps": [
      "(C)"
    ],
    "exact_match": 1.0
  },
  {
    "doc_id": 96,
    "doc": {
      "question": "Which of the following is MOST likely to experience population pressure?",
      "subject": "high_school_geography",
      "choices": [
        "An industrial society with abundant natural resources and large imports of food",
        "A society with a highly mechanized agricultural sector",
        "A non-ecumene",
        "A slash-and-burn agricultural society"
      ],
      "answer": 3
    },
    "target": "(D)",
    "arguments": [
      [
        "The following are multiple choice questions (with answers) about high school geography.\n\nQ: The rate of natural increase of a population is found by subtracting the\n(A) crude death rate from the crude birth date. (B) crude birth rate from the crude death rate. (C) doubling time from the crude birth rate. (D) fertility rate from the crude death rate.\nA:  (A)\n\nQ: During the third stage of the demographic transition model, which of the following is true?\n(A) Birth rates increase and population growth rate is less rapid. (B) Birth rates decline and population growth rate is less rapid. (C) Birth rates increase and population growth rate increases. (D) Birth rates decrease and population growth rate increases.\nA:  (B)\n\nQ: Which of the following statements is NOT accurate regarding the services provided by local governments in the United States?\n(A) Duplication of efforts occurs often. (B) Social problems of the central city spill over into the surrounding residential suburbs. (C) Inefficiency in providing services occurs often. (D) One neighborhood's efforts to reduce pollution are always supported by neighboring communities.\nA:  (D)\n\nQ: The practice of hiring a foreign third-party service provider to run an operation is called\n(A) outsourcing. (B) offshoring. (C) maquiladoras. (D) locational interdependence.\nA:  (B)\n\nQ: Which one of the following items is an example of nonmaterial culture?\n(A) Dove soap (B) Dove candy bar (C) Dove symbol (D) A dove (bird)\nA:  (C)\n\nQ: Which of the following is MOST likely to experience population pressure?\n(A) An industrial society with abundant natural resources and large imports of food (B) A society with a highly mechanized agricultural sector (C) A non-ecumene (D) A slash-and-burn agricultural society\nA: ",
        {
          "until": [
            "</s>"
          ]
        }
      ]
    ],
    "resps": [
      [
        "(B)"
      ]
    ],
    "filtered_resps": [
      "(B)"
    ],
    "exact_match": 0.0
  },
  {
    "doc_id": 104,
    "doc": {
      "question": "Which of the following capital cities is located OUTSIDE the central core area of the country?",
      "subject": "high_school_geography",
      "choices": [
        "Abuja, Nigeria",
        "Paris, France",
        "London, United Kingdom",
        "Cairo, Egypt"
      ],
      "answer": 0
    },
    "target": "(A)",
    "arguments": [
      [
        "The following are multiple choice questions (with answers) about high school geography.\n\nQ: The rate of natural increase of a population is found by subtracting the\n(A) crude death rate from the crude birth date. (B) crude birth rate from the crude death rate. (C) doubling time from the crude birth rate. (D) fertility rate from the crude death rate.\nA:  (A)\n\nQ: The practice of hiring a foreign third-party service provider to run an operation is called\n(A) outsourcing. (B) offshoring. (C) maquiladoras. (D) locational interdependence.\nA:  (B)\n\nQ: During the third stage of the demographic transition model, which of the following is true?\n(A) Birth rates increase and population growth rate is less rapid. (B) Birth rates decline and population growth rate is less rapid. (C) Birth rates increase and population growth rate increases. (D) Birth rates decrease and population growth rate increases.\nA:  (B)\n\nQ: Which one of the following items is an example of nonmaterial culture?\n(A) Dove soap (B) Dove candy bar (C) Dove symbol (D) A dove (bird)\nA:  (C)\n\nQ: Which of the following statements is NOT accurate regarding the services provided by local governments in the United States?\n(A) Duplication of efforts occurs often. (B) Social problems of the central city spill over into the surrounding residential suburbs. (C) Inefficiency in providing services occurs often. (D) One neighborhood's efforts to reduce pollution are always supported by neighboring communities.\nA:  (D)\n\nQ: Which of the following capital cities is located OUTSIDE the central core area of the country?\n(A) Abuja, Nigeria (B) Paris, France (C) London, United Kingdom (D) Cairo, Egypt\nA: ",
        {
          "until": [
            "</s>"
          ]
        }
      ]
    ],
    "resps": [
      [
        "(D)"
      ]
    ],
    "filtered_resps": [
      "(D)"
    ],
    "exact_match": 0.0
  },
  {
    "doc_id": 112,
    "doc": {
      "question": "The attempt by core countries to stimulate increased agricultural production in the periphery through use of technology, hybrid seed, and fertilizers is called the",
      "subject": "high_school_geography",
      "choices": [
        "First Agricultural Revolution.",
        "Second Agricultural Revolution.",
        "Third Agricultural Revolution.",
        "Green Revolution."
      ],
      "answer": 3
    },
    "target": "(D)",
    "arguments": [
      [
        "The following are multiple choice questions (with answers) about high school geography.\n\nQ: Which of the following statements is NOT accurate regarding the services provided by local governments in the United States?\n(A) Duplication of efforts occurs often. (B) Social problems of the central city spill over into the surrounding residential suburbs. (C) Inefficiency in providing services occurs often. (D) One neighborhood's efforts to reduce pollution are always supported by neighboring communities.\nA:  (D)\n\nQ: During the third stage of the demographic transition model, which of the following is true?\n(A) Birth rates increase and population growth rate is less rapid. (B) Birth rates decline and population growth rate is less rapid. (C) Birth rates increase and population growth rate increases. (D) Birth rates decrease and population growth rate increases.\nA:  (B)\n\nQ: The practice of hiring a foreign third-party service provider to run an operation is called\n(A) outsourcing. (B) offshoring. (C) maquiladoras. (D) locational interdependence.\nA:  (B)\n\nQ: The rate of natural increase of a population is found by subtracting the\n(A) crude death rate from the crude birth date. (B) crude birth rate from the crude death rate. (C) doubling time from the crude birth rate. (D) fertility rate from the crude death rate.\nA:  (A)\n\nQ: Which one of the following items is an example of nonmaterial culture?\n(A) Dove soap (B) Dove candy bar (C) Dove symbol (D) A dove (bird)\nA:  (C)\n\nQ: The attempt by core countries to stimulate increased agricultural production in the periphery through use of technology, hybrid seed, and fertilizers is called the\n(A) First Agricultural Revolution. (B) Second Agricultural Revolution. (C) Third Agricultural Revolution. (D) Green Revolution.\nA: ",
        {
          "until": [
            "</s>"
          ]
        }
      ]
    ],
    "resps": [
      [
        "(B)<0x0A><0x0A>"
      ]
    ],
    "filtered_resps": [
      "(B)<0x0A><0x0A>"
    ],
    "exact_match": 0.0
  },
  {
    "doc_id": 120,
    "doc": {
      "question": "The language with the largest number of \"speakers\" is",
      "subject": "high_school_geography",
      "choices": [
        "English.",
        "Russian.",
        "Spanish.",
        "Mandarin Chinese."
      ],
      "answer": 3
    },
    "target": "(D)",
    "arguments": [
      [
        "The following are multiple choice questions (with answers) about high school geography.\n\nQ: The rate of natural increase of a population is found by subtracting the\n(A) crude death rate from the crude birth date. (B) crude birth rate from the crude death rate. (C) doubling time from the crude birth rate. (D) fertility rate from the crude death rate.\nA:  (A)\n\nQ: The practice of hiring a foreign third-party service provider to run an operation is called\n(A) outsourcing. (B) offshoring. (C) maquiladoras. (D) locational interdependence.\nA:  (B)\n\nQ: During the third stage of the demographic transition model, which of the following is true?\n(A) Birth rates increase and population growth rate is less rapid. (B) Birth rates decline and population growth rate is less rapid. (C) Birth rates increase and population growth rate increases. (D) Birth rates decrease and population growth rate increases.\nA:  (B)\n\nQ: Which of the following statements is NOT accurate regarding the services provided by local governments in the United States?\n(A) Duplication of efforts occurs often. (B) Social problems of the central city spill over into the surrounding residential suburbs. (C) Inefficiency in providing services occurs often. (D) One neighborhood's efforts to reduce pollution are always supported by neighboring communities.\nA:  (D)\n\nQ: Which one of the following items is an example of nonmaterial culture?\n(A) Dove soap (B) Dove candy bar (C) Dove symbol (D) A dove (bird)\nA:  (C)\n\nQ: The language with the largest number of \"speakers\" is\n(A) English. (B) Russian. (C) Spanish. (D) Mandarin Chinese.\nA: ",
        {
          "until": [
            "</s>"
          ]
        }
      ]
    ],
    "resps": [
      [
        "(D)"
      ]
    ],
    "filtered_resps": [
      "(D)"
    ],
    "exact_match": 1.0
  },
  {
    "doc_id": 128,
    "doc": {
      "question": "Which of the following is NOT a spread effect in the core-periphery model of development?",
      "subject": "high_school_geography",
      "choices": [
        "Congestion in the core",
        "High cost of labor in the core",
        "High density in the core",
        "More infrastructure in the core"
      ],
      "answer": 3
    },
    "target": "(D)",
    "arguments": [
      [
        "The following are multiple choice questions (with answers) about high school geography.\n\nQ: Which one of the following items is an example of nonmaterial culture?\n(A) Dove soap (B) Dove candy bar (C) Dove symbol (D) A dove (bird)\nA:  (C)\n\nQ: The practice of hiring a foreign third-party service provider to run an operation is called\n(A) outsourcing. (B) offshoring. (C) maquiladoras. (D) locational interdependence.\nA:  (B)\n\nQ: During the third stage of the demographic transition model, which of the following is true?\n(A) Birth rates increase and population growth rate is less rapid. (B) Birth rates decline and population growth rate is less rapid. (C) Birth rates increase and population growth rate increases. (D) Birth rates decrease and population growth rate increases.\nA:  (B)\n\nQ: The rate of natural increase of a population is found by subtracting the\n(A) crude death rate from the crude birth date. (B) crude birth rate from the crude death rate. (C) doubling time from the crude birth rate. (D) fertility rate from the crude death rate.\nA:  (A)\n\nQ: Which of the following statements is NOT accurate regarding the services provided by local governments in the United States?\n(A) Duplication of efforts occurs often. (B) Social problems of the central city spill over into the surrounding residential suburbs. (C) Inefficiency in providing services occurs often. (D) One neighborhood's efforts to reduce pollution are always supported by neighboring communities.\nA:  (D)\n\nQ: Which of the following is NOT a spread effect in the core-periphery model of development?\n(A) Congestion in the core (B) High cost of labor in the core (C) High density in the core (D) More infrastructure in the core\nA: ",
        {
          "until": [
            "</s>"
          ]
        }
      ]
    ],
    "resps": [
      [
        "(C)"
      ]
    ],
    "filtered_resps": [
      "(C)"
    ],
    "exact_match": 0.0
  },
  {
    "doc_id": 136,
    "doc": {
      "question": "Which of the following is NOT used by geographers to determine absolute location?",
      "subject": "high_school_geography",
      "choices": [
        "Longitude",
        "Latitude",
        "Equator",
        "Distance to the nearest city"
      ],
      "answer": 3
    },
    "target": "(D)",
    "arguments": [
      [
        "The following are multiple choice questions (with answers) about high school geography.\n\nQ: Which one of the following items is an example of nonmaterial culture?\n(A) Dove soap (B) Dove candy bar (C) Dove symbol (D) A dove (bird)\nA:  (C)\n\nQ: During the third stage of the demographic transition model, which of the following is true?\n(A) Birth rates increase and population growth rate is less rapid. (B) Birth rates decline and population growth rate is less rapid. (C) Birth rates increase and population growth rate increases. (D) Birth rates decrease and population growth rate increases.\nA:  (B)\n\nQ: The practice of hiring a foreign third-party service provider to run an operation is called\n(A) outsourcing. (B) offshoring. (C) maquiladoras. (D) locational interdependence.\nA:  (B)\n\nQ: Which of the following statements is NOT accurate regarding the services provided by local governments in the United States?\n(A) Duplication of efforts occurs often. (B) Social problems of the central city spill over into the surrounding residential suburbs. (C) Inefficiency in providing services occurs often. (D) One neighborhood's efforts to reduce pollution are always supported by neighboring communities.\nA:  (D)\n\nQ: The rate of natural increase of a population is found by subtracting the\n(A) crude death rate from the crude birth date. (B) crude birth rate from the crude death rate. (C) doubling time from the crude birth rate. (D) fertility rate from the crude death rate.\nA:  (A)\n\nQ: Which of the following is NOT used by geographers to determine absolute location?\n(A) Longitude (B) Latitude (C) Equator (D) Distance to the nearest city\nA: ",
        {
          "until": [
            "</s>"
          ]
        }
      ]
    ],
    "resps": [
      [
        "(D)"
      ]
    ],
    "filtered_resps": [
      "(D)"
    ],
    "exact_match": 1.0
  },
  {
    "doc_id": 144,
    "doc": {
      "question": "The intensive agricultural practice of planting and harvesting the same crop more than once a year is called",
      "subject": "high_school_geography",
      "choices": [
        "swidden.",
        "double cropping.",
        "pastorialism.",
        "intertillage."
      ],
      "answer": 1
    },
    "target": "(B)",
    "arguments": [
      [
        "The following are multiple choice questions (with answers) about high school geography.\n\nQ: Which of the following statements is NOT accurate regarding the services provided by local governments in the United States?\n(A) Duplication of efforts occurs often. (B) Social problems of the central city spill over into the surrounding residential suburbs. (C) Inefficiency in providing services occurs often. (D) One neighborhood's efforts to reduce pollution are always supported by neighboring communities.\nA:  (D)\n\nQ: The rate of natural increase of a population is found by subtracting the\n(A) crude death rate from the crude birth date. (B) crude birth rate from the crude death rate. (C) doubling time from the crude birth rate. (D) fertility rate from the crude death rate.\nA:  (A)\n\nQ: The practice of hiring a foreign third-party service provider to run an operation is called\n(A) outsourcing. (B) offshoring. (C) maquiladoras. (D) locational interdependence.\nA:  (B)\n\nQ: During the third stage of the demographic transition model, which of the following is true?\n(A) Birth rates increase and population growth rate is less rapid. (B) Birth rates decline and population growth rate is less rapid. (C) Birth rates increase and population growth rate increases. (D) Birth rates decrease and population growth rate increases.\nA:  (B)\n\nQ: Which one of the following items is an example of nonmaterial culture?\n(A) Dove soap (B) Dove candy bar (C) Dove symbol (D) A dove (bird)\nA:  (C)\n\nQ: The intensive agricultural practice of planting and harvesting the same crop more than once a year is called\n(A) swidden. (B) double cropping. (C) pastorialism. (D) intertillage.\nA: ",
        {
          "until": [
            "</s>"
          ]
        }
      ]
    ],
    "resps": [
      [
        "(D)<0x0A>Answer: (D)"
      ]
    ],
    "filtered_resps": [
      "(D)<0x0A>Answer: (D)"
    ],
    "exact_match": 0.0
  },
  {
    "doc_id": 152,
    "doc": {
      "question": "The most rapidly urbanizing area of the world is:",
      "subject": "high_school_geography",
      "choices": [
        "Europe",
        "East Asia",
        "Sub-Saharan Africa",
        "South Asia"
      ],
      "answer": 2
    },
    "target": "(C)",
    "arguments": [
      [
        "The following are multiple choice questions (with answers) about high school geography.\n\nQ: The rate of natural increase of a population is found by subtracting the\n(A) crude death rate from the crude birth date. (B) crude birth rate from the crude death rate. (C) doubling time from the crude birth rate. (D) fertility rate from the crude death rate.\nA:  (A)\n\nQ: Which one of the following items is an example of nonmaterial culture?\n(A) Dove soap (B) Dove candy bar (C) Dove symbol (D) A dove (bird)\nA:  (C)\n\nQ: During the third stage of the demographic transition model, which of the following is true?\n(A) Birth rates increase and population growth rate is less rapid. (B) Birth rates decline and population growth rate is less rapid. (C) Birth rates increase and population growth rate increases. (D) Birth rates decrease and population growth rate increases.\nA:  (B)\n\nQ: Which of the following statements is NOT accurate regarding the services provided by local governments in the United States?\n(A) Duplication of efforts occurs often. (B) Social problems of the central city spill over into the surrounding residential suburbs. (C) Inefficiency in providing services occurs often. (D) One neighborhood's efforts to reduce pollution are always supported by neighboring communities.\nA:  (D)\n\nQ: The practice of hiring a foreign third-party service provider to run an operation is called\n(A) outsourcing. (B) offshoring. (C) maquiladoras. (D) locational interdependence.\nA:  (B)\n\nQ: The most rapidly urbanizing area of the world is:\n(A) Europe (B) East Asia (C) Sub-Saharan Africa (D) South Asia\nA: ",
        {
          "until": [
            "</s>"
          ]
        }
      ]
    ],
    "resps": [
      [
        "(D)"
      ]
    ],
    "filtered_resps": [
      "(D)"
    ],
    "exact_match": 0.0
  },
  {
    "doc_id": 160,
    "doc": {
      "question": "Urban agriculture can benefit urban society in all of the following ways EXCEPT",
      "subject": "high_school_geography",
      "choices": [
        "create sustainable food systems in urban areas.",
        "provide jobs for women and children.",
        "turn urban waste into a resource when utilized in safe manner.",
        "replace agribusiness as the main focus of global food production."
      ],
      "answer": 3
    },
    "target": "(D)",
    "arguments": [
      [
        "The following are multiple choice questions (with answers) about high school geography.\n\nQ: During the third stage of the demographic transition model, which of the following is true?\n(A) Birth rates increase and population growth rate is less rapid. (B) Birth rates decline and population growth rate is less rapid. (C) Birth rates increase and population growth rate increases. (D) Birth rates decrease and population growth rate increases.\nA:  (B)\n\nQ: Which of the following statements is NOT accurate regarding the services provided by local governments in the United States?\n(A) Duplication of efforts occurs often. (B) Social problems of the central city spill over into the surrounding residential suburbs. (C) Inefficiency in providing services occurs often. (D) One neighborhood's efforts to reduce pollution are always supported by neighboring communities.\nA:  (D)\n\nQ: The rate of natural increase of a population is found by subtracting the\n(A) crude death rate from the crude birth date. (B) crude birth rate from the crude death rate. (C) doubling time from the crude birth rate. (D) fertility rate from the crude death rate.\nA:  (A)\n\nQ: The practice of hiring a foreign third-party service provider to run an operation is called\n(A) outsourcing. (B) offshoring. (C) maquiladoras. (D) locational interdependence.\nA:  (B)\n\nQ: Which one of the following items is an example of nonmaterial culture?\n(A) Dove soap (B) Dove candy bar (C) Dove symbol (D) A dove (bird)\nA:  (C)\n\nQ: Urban agriculture can benefit urban society in all of the following ways EXCEPT\n(A) create sustainable food systems in urban areas. (B) provide jobs for women and children. (C) turn urban waste into a resource when utilized in safe manner. (D) replace agribusiness as the main focus of global food production.\nA: ",
        {
          "until": [
            "</s>"
          ]
        }
      ]
    ],
    "resps": [
      [
        "(D)"
      ]
    ],
    "filtered_resps": [
      "(D)"
    ],
    "exact_match": 1.0
  },
  {
    "doc_id": 168,
    "doc": {
      "question": "The idea that you identify with, and give allegiance, to a nation-state is",
      "subject": "high_school_geography",
      "choices": [
        "regionalism.",
        "diffusion.",
        "iconography.",
        "nationalism."
      ],
      "answer": 3
    },
    "target": "(D)",
    "arguments": [
      [
        "The following are multiple choice questions (with answers) about high school geography.\n\nQ: During the third stage of the demographic transition model, which of the following is true?\n(A) Birth rates increase and population growth rate is less rapid. (B) Birth rates decline and population growth rate is less rapid. (C) Birth rates increase and population growth rate increases. (D) Birth rates decrease and population growth rate increases.\nA:  (B)\n\nQ: Which of the following statements is NOT accurate regarding the services provided by local governments in the United States?\n(A) Duplication of efforts occurs often. (B) Social problems of the central city spill over into the surrounding residential suburbs. (C) Inefficiency in providing services occurs often. (D) One neighborhood's efforts to reduce pollution are always supported by neighboring communities.\nA:  (D)\n\nQ: Which one of the following items is an example of nonmaterial culture?\n(A) Dove soap (B) Dove candy bar (C) Dove symbol (D) A dove (bird)\nA:  (C)\n\nQ: The rate of natural increase of a population is found by subtracting the\n(A) crude death rate from the crude birth date. (B) crude birth rate from the crude death rate. (C) doubling time from the crude birth rate. (D) fertility rate from the crude death rate.\nA:  (A)\n\nQ: The practice of hiring a foreign third-party service provider to run an operation is called\n(A) outsourcing. (B) offshoring. (C) maquiladoras. (D) locational interdependence.\nA:  (B)\n\nQ: The idea that you identify with, and give allegiance, to a nation-state is\n(A) regionalism. (B) diffusion. (C) iconography. (D) nationalism.\nA: ",
        {
          "until": [
            "</s>"
          ]
        }
      ]
    ],
    "resps": [
      [
        "(D)"
      ]
    ],
    "filtered_resps": [
      "(D)"
    ],
    "exact_match": 1.0
  },
  {
    "doc_id": 176,
    "doc": {
      "question": "Which of the following statements regarding historical North American migration streams is NOT correct?",
      "subject": "high_school_geography",
      "choices": [
        "Canada's first major migration came from France.",
        "Canada's second major migration stream originated in the British Isles.",
        "Canada's third major migration stream came from Latin America.",
        "The first major migration wave to the United States originated in Europe."
      ],
      "answer": 2
    },
    "target": "(C)",
    "arguments": [
      [
        "The following are multiple choice questions (with answers) about high school geography.\n\nQ: The practice of hiring a foreign third-party service provider to run an operation is called\n(A) outsourcing. (B) offshoring. (C) maquiladoras. (D) locational interdependence.\nA:  (B)\n\nQ: During the third stage of the demographic transition model, which of the following is true?\n(A) Birth rates increase and population growth rate is less rapid. (B) Birth rates decline and population growth rate is less rapid. (C) Birth rates increase and population growth rate increases. (D) Birth rates decrease and population growth rate increases.\nA:  (B)\n\nQ: The rate of natural increase of a population is found by subtracting the\n(A) crude death rate from the crude birth date. (B) crude birth rate from the crude death rate. (C) doubling time from the crude birth rate. (D) fertility rate from the crude death rate.\nA:  (A)\n\nQ: Which one of the following items is an example of nonmaterial culture?\n(A) Dove soap (B) Dove candy bar (C) Dove symbol (D) A dove (bird)\nA:  (C)\n\nQ: Which of the following statements is NOT accurate regarding the services provided by local governments in the United States?\n(A) Duplication of efforts occurs often. (B) Social problems of the central city spill over into the surrounding residential suburbs. (C) Inefficiency in providing services occurs often. (D) One neighborhood's efforts to reduce pollution are always supported by neighboring communities.\nA:  (D)\n\nQ: Which of the following statements regarding historical North American migration streams is NOT correct?\n(A) Canada's first major migration came from France. (B) Canada's second major migration stream originated in the British Isles. (C) Canada's third major migration stream came from Latin America. (D) The first major migration wave to the United States originated in Europe.\nA: ",
        {
          "until": [
            "</s>"
          ]
        }
      ]
    ],
    "resps": [
      [
        "(C)"
      ]
    ],
    "filtered_resps": [
      "(C)"
    ],
    "exact_match": 1.0
  },
  {
    "doc_id": 184,
    "doc": {
      "question": "Which continent has the highest total fertility rates?",
      "subject": "high_school_geography",
      "choices": [
        "Africa",
        "Asia",
        "South America",
        "Europe"
      ],
      "answer": 0
    },
    "target": "(A)",
    "arguments": [
      [
        "The following are multiple choice questions (with answers) about high school geography.\n\nQ: During the third stage of the demographic transition model, which of the following is true?\n(A) Birth rates increase and population growth rate is less rapid. (B) Birth rates decline and population growth rate is less rapid. (C) Birth rates increase and population growth rate increases. (D) Birth rates decrease and population growth rate increases.\nA:  (B)\n\nQ: The rate of natural increase of a population is found by subtracting the\n(A) crude death rate from the crude birth date. (B) crude birth rate from the crude death rate. (C) doubling time from the crude birth rate. (D) fertility rate from the crude death rate.\nA:  (A)\n\nQ: Which of the following statements is NOT accurate regarding the services provided by local governments in the United States?\n(A) Duplication of efforts occurs often. (B) Social problems of the central city spill over into the surrounding residential suburbs. (C) Inefficiency in providing services occurs often. (D) One neighborhood's efforts to reduce pollution are always supported by neighboring communities.\nA:  (D)\n\nQ: Which one of the following items is an example of nonmaterial culture?\n(A) Dove soap (B) Dove candy bar (C) Dove symbol (D) A dove (bird)\nA:  (C)\n\nQ: The practice of hiring a foreign third-party service provider to run an operation is called\n(A) outsourcing. (B) offshoring. (C) maquiladoras. (D) locational interdependence.\nA:  (B)\n\nQ: Which continent has the highest total fertility rates?\n(A) Africa (B) Asia (C) South America (D) Europe\nA: ",
        {
          "until": [
            "</s>"
          ]
        }
      ]
    ],
    "resps": [
      [
        "(D)"
      ]
    ],
    "filtered_resps": [
      "(D)"
    ],
    "exact_match": 0.0
  },
  {
    "doc_id": 192,
    "doc": {
      "question": "What are the two major branches of Islam?",
      "subject": "high_school_geography",
      "choices": [
        "Sunni and Shinto",
        "Shinto and Shiite",
        "Sunni and Shiite",
        "Shamanism and Shiite"
      ],
      "answer": 2
    },
    "target": "(C)",
    "arguments": [
      [
        "The following are multiple choice questions (with answers) about high school geography.\n\nQ: The practice of hiring a foreign third-party service provider to run an operation is called\n(A) outsourcing. (B) offshoring. (C) maquiladoras. (D) locational interdependence.\nA:  (B)\n\nQ: The rate of natural increase of a population is found by subtracting the\n(A) crude death rate from the crude birth date. (B) crude birth rate from the crude death rate. (C) doubling time from the crude birth rate. (D) fertility rate from the crude death rate.\nA:  (A)\n\nQ: Which of the following statements is NOT accurate regarding the services provided by local governments in the United States?\n(A) Duplication of efforts occurs often. (B) Social problems of the central city spill over into the surrounding residential suburbs. (C) Inefficiency in providing services occurs often. (D) One neighborhood's efforts to reduce pollution are always supported by neighboring communities.\nA:  (D)\n\nQ: During the third stage of the demographic transition model, which of the following is true?\n(A) Birth rates increase and population growth rate is less rapid. (B) Birth rates decline and population growth rate is less rapid. (C) Birth rates increase and population growth rate increases. (D) Birth rates decrease and population growth rate increases.\nA:  (B)\n\nQ: Which one of the following items is an example of nonmaterial culture?\n(A) Dove soap (B) Dove candy bar (C) Dove symbol (D) A dove (bird)\nA:  (C)\n\nQ: What are the two major branches of Islam?\n(A) Sunni and Shinto (B) Shinto and Shiite (C) Sunni and Shiite (D) Shamanism and Shiite\nA: ",
        {
          "until": [
            "</s>"
          ]
        }
      ]
    ],
    "resps": [
      [
        "(C)"
      ]
    ],
    "filtered_resps": [
      "(C)"
    ],
    "exact_match": 1.0
  },
  {
    "doc_id": 1,
    "doc": {
      "question": "The tendency for a population to continue to grow long after replacement fertility has been achieved is called",
      "subject": "high_school_geography",
      "choices": [
        "zero population growth.",
        "rapid growth rate.",
        "homeostatic plateau.",
        "demographic momentum."
      ],
      "answer": 3
    },
    "target": "(D)",
    "arguments": [
      [
        "The following are multiple choice questions (with answers) about high school geography.\n\nQ: The practice of hiring a foreign third-party service provider to run an operation is called\n(A) outsourcing. (B) offshoring. (C) maquiladoras. (D) locational interdependence.\nA:  (B)\n\nQ: The rate of natural increase of a population is found by subtracting the\n(A) crude death rate from the crude birth date. (B) crude birth rate from the crude death rate. (C) doubling time from the crude birth rate. (D) fertility rate from the crude death rate.\nA:  (A)\n\nQ: Which one of the following items is an example of nonmaterial culture?\n(A) Dove soap (B) Dove candy bar (C) Dove symbol (D) A dove (bird)\nA:  (C)\n\nQ: Which of the following statements is NOT accurate regarding the services provided by local governments in the United States?\n(A) Duplication of efforts occurs often. (B) Social problems of the central city spill over into the surrounding residential suburbs. (C) Inefficiency in providing services occurs often. (D) One neighborhood's efforts to reduce pollution are always supported by neighboring communities.\nA:  (D)\n\nQ: During the third stage of the demographic transition model, which of the following is true?\n(A) Birth rates increase and population growth rate is less rapid. (B) Birth rates decline and population growth rate is less rapid. (C) Birth rates increase and population growth rate increases. (D) Birth rates decrease and population growth rate increases.\nA:  (B)\n\nQ: The tendency for a population to continue to grow long after replacement fertility has been achieved is called\n(A) zero population growth. (B) rapid growth rate. (C) homeostatic plateau. (D) demographic momentum.\nA: ",
        {
          "until": [
            "</s>"
          ]
        }
      ]
    ],
    "resps": [
      [
        "(D)"
      ]
    ],
    "filtered_resps": [
      "(D)"
    ],
    "exact_match": 1.0
  },
  {
    "doc_id": 9,
    "doc": {
      "question": "Early settlements and high population density along coastlines and rivers are best attributed to which of the following?",
      "subject": "high_school_geography",
      "choices": [
        "Mediterranean climate",
        "Limited forest cover",
        "Growth of manufacturing",
        "Access to trade routes"
      ],
      "answer": 3
    },
    "target": "(D)",
    "arguments": [
      [
        "The following are multiple choice questions (with answers) about high school geography.\n\nQ: The rate of natural increase of a population is found by subtracting the\n(A) crude death rate from the crude birth date. (B) crude birth rate from the crude death rate. (C) doubling time from the crude birth rate. (D) fertility rate from the crude death rate.\nA:  (A)\n\nQ: Which one of the following items is an example of nonmaterial culture?\n(A) Dove soap (B) Dove candy bar (C) Dove symbol (D) A dove (bird)\nA:  (C)\n\nQ: During the third stage of the demographic transition model, which of the following is true?\n(A) Birth rates increase and population growth rate is less rapid. (B) Birth rates decline and population growth rate is less rapid. (C) Birth rates increase and population growth rate increases. (D) Birth rates decrease and population growth rate increases.\nA:  (B)\n\nQ: The practice of hiring a foreign third-party service provider to run an operation is called\n(A) outsourcing. (B) offshoring. (C) maquiladoras. (D) locational interdependence.\nA:  (B)\n\nQ: Which of the following statements is NOT accurate regarding the services provided by local governments in the United States?\n(A) Duplication of efforts occurs often. (B) Social problems of the central city spill over into the surrounding residential suburbs. (C) Inefficiency in providing services occurs often. (D) One neighborhood's efforts to reduce pollution are always supported by neighboring communities.\nA:  (D)\n\nQ: Early settlements and high population density along coastlines and rivers are best attributed to which of the following?\n(A) Mediterranean climate (B) Limited forest cover (C) Growth of manufacturing (D) Access to trade routes\nA: ",
        {
          "until": [
            "</s>"
          ]
        }
      ]
    ],
    "resps": [
      [
        "(D)"
      ]
    ],
    "filtered_resps": [
      "(D)"
    ],
    "exact_match": 1.0
  },
  {
    "doc_id": 17,
    "doc": {
      "question": "Which type of transportation system created the star-shaped city pattern?",
      "subject": "high_school_geography",
      "choices": [
        "Highways to airports that link cities",
        "Interstate highways that link cities",
        "Beltways around cities",
        "Streetcar and trolley lines extending from the CBD"
      ],
      "answer": 3
    },
    "target": "(D)",
    "arguments": [
      [
        "The following are multiple choice questions (with answers) about high school geography.\n\nQ: The rate of natural increase of a population is found by subtracting the\n(A) crude death rate from the crude birth date. (B) crude birth rate from the crude death rate. (C) doubling time from the crude birth rate. (D) fertility rate from the crude death rate.\nA:  (A)\n\nQ: Which one of the following items is an example of nonmaterial culture?\n(A) Dove soap (B) Dove candy bar (C) Dove symbol (D) A dove (bird)\nA:  (C)\n\nQ: During the third stage of the demographic transition model, which of the following is true?\n(A) Birth rates increase and population growth rate is less rapid. (B) Birth rates decline and population growth rate is less rapid. (C) Birth rates increase and population growth rate increases. (D) Birth rates decrease and population growth rate increases.\nA:  (B)\n\nQ: Which of the following statements is NOT accurate regarding the services provided by local governments in the United States?\n(A) Duplication of efforts occurs often. (B) Social problems of the central city spill over into the surrounding residential suburbs. (C) Inefficiency in providing services occurs often. (D) One neighborhood's efforts to reduce pollution are always supported by neighboring communities.\nA:  (D)\n\nQ: The practice of hiring a foreign third-party service provider to run an operation is called\n(A) outsourcing. (B) offshoring. (C) maquiladoras. (D) locational interdependence.\nA:  (B)\n\nQ: Which type of transportation system created the star-shaped city pattern?\n(A) Highways to airports that link cities (B) Interstate highways that link cities (C) Beltways around cities (D) Streetcar and trolley lines extending from the CBD\nA: ",
        {
          "until": [
            "</s>"
          ]
        }
      ]
    ],
    "resps": [
      [
        "(C)"
      ]
    ],
    "filtered_resps": [
      "(C)"
    ],
    "exact_match": 0.0
  },
  {
    "doc_id": 25,
    "doc": {
      "question": "What is the chief religion practiced in Europe?",
      "subject": "high_school_geography",
      "choices": [
        "Christianity",
        "Islam",
        "Hinduism",
        "Animism"
      ],
      "answer": 0
    },
    "target": "(A)",
    "arguments": [
      [
        "The following are multiple choice questions (with answers) about high school geography.\n\nQ: During the third stage of the demographic transition model, which of the following is true?\n(A) Birth rates increase and population growth rate is less rapid. (B) Birth rates decline and population growth rate is less rapid. (C) Birth rates increase and population growth rate increases. (D) Birth rates decrease and population growth rate increases.\nA:  (B)\n\nQ: The rate of natural increase of a population is found by subtracting the\n(A) crude death rate from the crude birth date. (B) crude birth rate from the crude death rate. (C) doubling time from the crude birth rate. (D) fertility rate from the crude death rate.\nA:  (A)\n\nQ: The practice of hiring a foreign third-party service provider to run an operation is called\n(A) outsourcing. (B) offshoring. (C) maquiladoras. (D) locational interdependence.\nA:  (B)\n\nQ: Which of the following statements is NOT accurate regarding the services provided by local governments in the United States?\n(A) Duplication of efforts occurs often. (B) Social problems of the central city spill over into the surrounding residential suburbs. (C) Inefficiency in providing services occurs often. (D) One neighborhood's efforts to reduce pollution are always supported by neighboring communities.\nA:  (D)\n\nQ: Which one of the following items is an example of nonmaterial culture?\n(A) Dove soap (B) Dove candy bar (C) Dove symbol (D) A dove (bird)\nA:  (C)\n\nQ: What is the chief religion practiced in Europe?\n(A) Christianity (B) Islam (C) Hinduism (D) Animism\nA: ",
        {
          "until": [
            "</s>"
          ]
        }
      ]
    ],
    "resps": [
      [
        "(B)"
      ]
    ],
    "filtered_resps": [
      "(B)"
    ],
    "exact_match": 0.0
  },
  {
    "doc_id": 33,
    "doc": {
      "question": "Which of the following is LEAST associated with the development of alluvial landscapes?",
      "subject": "high_school_geography",
      "choices": [
        "A deep cover of loose materials",
        "A predominance of gentle slopes",
        "Frequent flooding",
        "Deep dissection and erosion"
      ],
      "answer": 3
    },
    "target": "(D)",
    "arguments": [
      [
        "The following are multiple choice questions (with answers) about high school geography.\n\nQ: Which one of the following items is an example of nonmaterial culture?\n(A) Dove soap (B) Dove candy bar (C) Dove symbol (D) A dove (bird)\nA:  (C)\n\nQ: The practice of hiring a foreign third-party service provider to run an operation is called\n(A) outsourcing. (B) offshoring. (C) maquiladoras. (D) locational interdependence.\nA:  (B)\n\nQ: The rate of natural increase of a population is found by subtracting the\n(A) crude death rate from the crude birth date. (B) crude birth rate from the crude death rate. (C) doubling time from the crude birth rate. (D) fertility rate from the crude death rate.\nA:  (A)\n\nQ: Which of the following statements is NOT accurate regarding the services provided by local governments in the United States?\n(A) Duplication of efforts occurs often. (B) Social problems of the central city spill over into the surrounding residential suburbs. (C) Inefficiency in providing services occurs often. (D) One neighborhood's efforts to reduce pollution are always supported by neighboring communities.\nA:  (D)\n\nQ: During the third stage of the demographic transition model, which of the following is true?\n(A) Birth rates increase and population growth rate is less rapid. (B) Birth rates decline and population growth rate is less rapid. (C) Birth rates increase and population growth rate increases. (D) Birth rates decrease and population growth rate increases.\nA:  (B)\n\nQ: Which of the following is LEAST associated with the development of alluvial landscapes?\n(A) A deep cover of loose materials (B) A predominance of gentle slopes (C) Frequent flooding (D) Deep dissection and erosion\nA: ",
        {
          "until": [
            "</s>"
          ]
        }
      ]
    ],
    "resps": [
      [
        "(D)"
      ]
    ],
    "filtered_resps": [
      "(D)"
    ],
    "exact_match": 1.0
  },
  {
    "doc_id": 41,
    "doc": {
      "question": "The process whereby immigrants learn the values, language, and customs of their new country is called",
      "subject": "high_school_geography",
      "choices": [
        "assimilation.",
        "acculturation.",
        "adaptation.",
        "amalgamation."
      ],
      "answer": 1
    },
    "target": "(B)",
    "arguments": [
      [
        "The following are multiple choice questions (with answers) about high school geography.\n\nQ: The rate of natural increase of a population is found by subtracting the\n(A) crude death rate from the crude birth date. (B) crude birth rate from the crude death rate. (C) doubling time from the crude birth rate. (D) fertility rate from the crude death rate.\nA:  (A)\n\nQ: Which one of the following items is an example of nonmaterial culture?\n(A) Dove soap (B) Dove candy bar (C) Dove symbol (D) A dove (bird)\nA:  (C)\n\nQ: Which of the following statements is NOT accurate regarding the services provided by local governments in the United States?\n(A) Duplication of efforts occurs often. (B) Social problems of the central city spill over into the surrounding residential suburbs. (C) Inefficiency in providing services occurs often. (D) One neighborhood's efforts to reduce pollution are always supported by neighboring communities.\nA:  (D)\n\nQ: The practice of hiring a foreign third-party service provider to run an operation is called\n(A) outsourcing. (B) offshoring. (C) maquiladoras. (D) locational interdependence.\nA:  (B)\n\nQ: During the third stage of the demographic transition model, which of the following is true?\n(A) Birth rates increase and population growth rate is less rapid. (B) Birth rates decline and population growth rate is less rapid. (C) Birth rates increase and population growth rate increases. (D) Birth rates decrease and population growth rate increases.\nA:  (B)\n\nQ: The process whereby immigrants learn the values, language, and customs of their new country is called\n(A) assimilation. (B) acculturation. (C) adaptation. (D) amalgamation.\nA: ",
        {
          "until": [
            "</s>"
          ]
        }
      ]
    ],
    "resps": [
      [
        "(B)"
      ]
    ],
    "filtered_resps": [
      "(B)"
    ],
    "exact_match": 1.0
  },
  {
    "doc_id": 49,
    "doc": {
      "question": "In which of the following regions is subsistence agriculture being replaced by large-scale commercial development?",
      "subject": "high_school_geography",
      "choices": [
        "The Swiss Alps",
        "The Amazon Basin",
        "North Africa",
        "The Alaskan tundra"
      ],
      "answer": 1
    },
    "target": "(B)",
    "arguments": [
      [
        "The following are multiple choice questions (with answers) about high school geography.\n\nQ: Which one of the following items is an example of nonmaterial culture?\n(A) Dove soap (B) Dove candy bar (C) Dove symbol (D) A dove (bird)\nA:  (C)\n\nQ: The rate of natural increase of a population is found by subtracting the\n(A) crude death rate from the crude birth date. (B) crude birth rate from the crude death rate. (C) doubling time from the crude birth rate. (D) fertility rate from the crude death rate.\nA:  (A)\n\nQ: Which of the following statements is NOT accurate regarding the services provided by local governments in the United States?\n(A) Duplication of efforts occurs often. (B) Social problems of the central city spill over into the surrounding residential suburbs. (C) Inefficiency in providing services occurs often. (D) One neighborhood's efforts to reduce pollution are always supported by neighboring communities.\nA:  (D)\n\nQ: During the third stage of the demographic transition model, which of the following is true?\n(A) Birth rates increase and population growth rate is less rapid. (B) Birth rates decline and population growth rate is less rapid. (C) Birth rates increase and population growth rate increases. (D) Birth rates decrease and population growth rate increases.\nA:  (B)\n\nQ: The practice of hiring a foreign third-party service provider to run an operation is called\n(A) outsourcing. (B) offshoring. (C) maquiladoras. (D) locational interdependence.\nA:  (B)\n\nQ: In which of the following regions is subsistence agriculture being replaced by large-scale commercial development?\n(A) The Swiss Alps (B) The Amazon Basin (C) North Africa (D) The Alaskan tundra\nA: ",
        {
          "until": [
            "</s>"
          ]
        }
      ]
    ],
    "resps": [
      [
        "(C)"
      ]
    ],
    "filtered_resps": [
      "(C)"
    ],
    "exact_match": 0.0
  },
  {
    "doc_id": 57,
    "doc": {
      "question": "Which of the following would NOT be considered a barrier to diffusion of a cultural trait?",
      "subject": "high_school_geography",
      "choices": [
        "Language",
        "Religion",
        "Oceans",
        "Tolerant complaisant citizens"
      ],
      "answer": 3
    },
    "target": "(D)",
    "arguments": [
      [
        "The following are multiple choice questions (with answers) about high school geography.\n\nQ: Which of the following statements is NOT accurate regarding the services provided by local governments in the United States?\n(A) Duplication of efforts occurs often. (B) Social problems of the central city spill over into the surrounding residential suburbs. (C) Inefficiency in providing services occurs often. (D) One neighborhood's efforts to reduce pollution are always supported by neighboring communities.\nA:  (D)\n\nQ: Which one of the following items is an example of nonmaterial culture?\n(A) Dove soap (B) Dove candy bar (C) Dove symbol (D) A dove (bird)\nA:  (C)\n\nQ: The rate of natural increase of a population is found by subtracting the\n(A) crude death rate from the crude birth date. (B) crude birth rate from the crude death rate. (C) doubling time from the crude birth rate. (D) fertility rate from the crude death rate.\nA:  (A)\n\nQ: The practice of hiring a foreign third-party service provider to run an operation is called\n(A) outsourcing. (B) offshoring. (C) maquiladoras. (D) locational interdependence.\nA:  (B)\n\nQ: During the third stage of the demographic transition model, which of the following is true?\n(A) Birth rates increase and population growth rate is less rapid. (B) Birth rates decline and population growth rate is less rapid. (C) Birth rates increase and population growth rate increases. (D) Birth rates decrease and population growth rate increases.\nA:  (B)\n\nQ: Which of the following would NOT be considered a barrier to diffusion of a cultural trait?\n(A) Language (B) Religion (C) Oceans (D) Tolerant complaisant citizens\nA: ",
        {
          "until": [
            "</s>"
          ]
        }
      ]
    ],
    "resps": [
      [
        "(D)"
      ]
    ],
    "filtered_resps": [
      "(D)"
    ],
    "exact_match": 1.0
  },
  {
    "doc_id": 65,
    "doc": {
      "question": "The concentration of production activities and people spatially to benefit everyone is called",
      "subject": "high_school_geography",
      "choices": [
        "the substitution principle.",
        "deglomeration.",
        "agglomeration.",
        "infrastructure."
      ],
      "answer": 2
    },
    "target": "(C)",
    "arguments": [
      [
        "The following are multiple choice questions (with answers) about high school geography.\n\nQ: Which one of the following items is an example of nonmaterial culture?\n(A) Dove soap (B) Dove candy bar (C) Dove symbol (D) A dove (bird)\nA:  (C)\n\nQ: The rate of natural increase of a population is found by subtracting the\n(A) crude death rate from the crude birth date. (B) crude birth rate from the crude death rate. (C) doubling time from the crude birth rate. (D) fertility rate from the crude death rate.\nA:  (A)\n\nQ: Which of the following statements is NOT accurate regarding the services provided by local governments in the United States?\n(A) Duplication of efforts occurs often. (B) Social problems of the central city spill over into the surrounding residential suburbs. (C) Inefficiency in providing services occurs often. (D) One neighborhood's efforts to reduce pollution are always supported by neighboring communities.\nA:  (D)\n\nQ: The practice of hiring a foreign third-party service provider to run an operation is called\n(A) outsourcing. (B) offshoring. (C) maquiladoras. (D) locational interdependence.\nA:  (B)\n\nQ: During the third stage of the demographic transition model, which of the following is true?\n(A) Birth rates increase and population growth rate is less rapid. (B) Birth rates decline and population growth rate is less rapid. (C) Birth rates increase and population growth rate increases. (D) Birth rates decrease and population growth rate increases.\nA:  (B)\n\nQ: The concentration of production activities and people spatially to benefit everyone is called\n(A) the substitution principle. (B) deglomeration. (C) agglomeration. (D) infrastructure.\nA: ",
        {
          "until": [
            "</s>"
          ]
        }
      ]
    ],
    "resps": [
      [
        "(A)<0x0A><0x0A>"
      ]
    ],
    "filtered_resps": [
      "(A)<0x0A><0x0A>"
    ],
    "exact_match": 0.0
  },
  {
    "doc_id": 73,
    "doc": {
      "question": "Which of the following is a distinct characteristic of an East European city?",
      "subject": "high_school_geography",
      "choices": [
        "A central park",
        "Prominent religious buildings",
        "A large central square surrounded by government and administrative buildings",
        "Luxury apartment buildings"
      ],
      "answer": 2
    },
    "target": "(C)",
    "arguments": [
      [
        "The following are multiple choice questions (with answers) about high school geography.\n\nQ: Which of the following statements is NOT accurate regarding the services provided by local governments in the United States?\n(A) Duplication of efforts occurs often. (B) Social problems of the central city spill over into the surrounding residential suburbs. (C) Inefficiency in providing services occurs often. (D) One neighborhood's efforts to reduce pollution are always supported by neighboring communities.\nA:  (D)\n\nQ: During the third stage of the demographic transition model, which of the following is true?\n(A) Birth rates increase and population growth rate is less rapid. (B) Birth rates decline and population growth rate is less rapid. (C) Birth rates increase and population growth rate increases. (D) Birth rates decrease and population growth rate increases.\nA:  (B)\n\nQ: Which one of the following items is an example of nonmaterial culture?\n(A) Dove soap (B) Dove candy bar (C) Dove symbol (D) A dove (bird)\nA:  (C)\n\nQ: The practice of hiring a foreign third-party service provider to run an operation is called\n(A) outsourcing. (B) offshoring. (C) maquiladoras. (D) locational interdependence.\nA:  (B)\n\nQ: The rate of natural increase of a population is found by subtracting the\n(A) crude death rate from the crude birth date. (B) crude birth rate from the crude death rate. (C) doubling time from the crude birth rate. (D) fertility rate from the crude death rate.\nA:  (A)\n\nQ: Which of the following is a distinct characteristic of an East European city?\n(A) A central park (B) Prominent religious buildings (C) A large central square surrounded by government and administrative buildings (D) Luxury apartment buildings\nA: ",
        {
          "until": [
            "</s>"
          ]
        }
      ]
    ],
    "resps": [
      [
        "(C)"
      ]
    ],
    "filtered_resps": [
      "(C)"
    ],
    "exact_match": 1.0
  },
  {
    "doc_id": 81,
    "doc": {
      "question": "Which factor in the last quarter century greatly destabilized Eastern Europe and led to ethnic conflict?",
      "subject": "high_school_geography",
      "choices": [
        "The introduction of new languages",
        "The end of the Cold War",
        "The invasion by the Soviets",
        "The acceptance of many Eastern European countries into the EU"
      ],
      "answer": 1
    },
    "target": "(B)",
    "arguments": [
      [
        "The following are multiple choice questions (with answers) about high school geography.\n\nQ: During the third stage of the demographic transition model, which of the following is true?\n(A) Birth rates increase and population growth rate is less rapid. (B) Birth rates decline and population growth rate is less rapid. (C) Birth rates increase and population growth rate increases. (D) Birth rates decrease and population growth rate increases.\nA:  (B)\n\nQ: The rate of natural increase of a population is found by subtracting the\n(A) crude death rate from the crude birth date. (B) crude birth rate from the crude death rate. (C) doubling time from the crude birth rate. (D) fertility rate from the crude death rate.\nA:  (A)\n\nQ: The practice of hiring a foreign third-party service provider to run an operation is called\n(A) outsourcing. (B) offshoring. (C) maquiladoras. (D) locational interdependence.\nA:  (B)\n\nQ: Which one of the following items is an example of nonmaterial culture?\n(A) Dove soap (B) Dove candy bar (C) Dove symbol (D) A dove (bird)\nA:  (C)\n\nQ: Which of the following statements is NOT accurate regarding the services provided by local governments in the United States?\n(A) Duplication of efforts occurs often. (B) Social problems of the central city spill over into the surrounding residential suburbs. (C) Inefficiency in providing services occurs often. (D) One neighborhood's efforts to reduce pollution are always supported by neighboring communities.\nA:  (D)\n\nQ: Which factor in the last quarter century greatly destabilized Eastern Europe and led to ethnic conflict?\n(A) The introduction of new languages (B) The end of the Cold War (C) The invasion by the Soviets (D) The acceptance of many Eastern European countries into the EU\nA: ",
        {
          "until": [
            "</s>"
          ]
        }
      ]
    ],
    "resps": [
      [
        "(D)"
      ]
    ],
    "filtered_resps": [
      "(D)"
    ],
    "exact_match": 0.0
  },
  {
    "doc_id": 89,
    "doc": {
      "question": "Johnny and Susie are moving to Scotland to renovate and live in the family castle. What makes their move a migration?",
      "subject": "high_school_geography",
      "choices": [
        "They are crossing another country's borders.",
        "They are not taking anything with them.",
        "They are moving permanently.",
        "They will be gone more than one year."
      ],
      "answer": 2
    },
    "target": "(C)",
    "arguments": [
      [
        "The following are multiple choice questions (with answers) about high school geography.\n\nQ: The rate of natural increase of a population is found by subtracting the\n(A) crude death rate from the crude birth date. (B) crude birth rate from the crude death rate. (C) doubling time from the crude birth rate. (D) fertility rate from the crude death rate.\nA:  (A)\n\nQ: During the third stage of the demographic transition model, which of the following is true?\n(A) Birth rates increase and population growth rate is less rapid. (B) Birth rates decline and population growth rate is less rapid. (C) Birth rates increase and population growth rate increases. (D) Birth rates decrease and population growth rate increases.\nA:  (B)\n\nQ: Which one of the following items is an example of nonmaterial culture?\n(A) Dove soap (B) Dove candy bar (C) Dove symbol (D) A dove (bird)\nA:  (C)\n\nQ: Which of the following statements is NOT accurate regarding the services provided by local governments in the United States?\n(A) Duplication of efforts occurs often. (B) Social problems of the central city spill over into the surrounding residential suburbs. (C) Inefficiency in providing services occurs often. (D) One neighborhood's efforts to reduce pollution are always supported by neighboring communities.\nA:  (D)\n\nQ: The practice of hiring a foreign third-party service provider to run an operation is called\n(A) outsourcing. (B) offshoring. (C) maquiladoras. (D) locational interdependence.\nA:  (B)\n\nQ: Johnny and Susie are moving to Scotland to renovate and live in the family castle. What makes their move a migration?\n(A) They are crossing another country's borders. (B) They are not taking anything with them. (C) They are moving permanently. (D) They will be gone more than one year.\nA: ",
        {
          "until": [
            "</s>"
          ]
        }
      ]
    ],
    "resps": [
      [
        "(C)"
      ]
    ],
    "filtered_resps": [
      "(C)"
    ],
    "exact_match": 1.0
  },
  {
    "doc_id": 97,
    "doc": {
      "question": "Part of the boundary between the United States and Mexico is the Rio Grande, an example of",
      "subject": "high_school_geography",
      "choices": [
        "a water divider.",
        "a watercourse.",
        "an artificial boundary.",
        "a natural boundary."
      ],
      "answer": 3
    },
    "target": "(D)",
    "arguments": [
      [
        "The following are multiple choice questions (with answers) about high school geography.\n\nQ: The rate of natural increase of a population is found by subtracting the\n(A) crude death rate from the crude birth date. (B) crude birth rate from the crude death rate. (C) doubling time from the crude birth rate. (D) fertility rate from the crude death rate.\nA:  (A)\n\nQ: During the third stage of the demographic transition model, which of the following is true?\n(A) Birth rates increase and population growth rate is less rapid. (B) Birth rates decline and population growth rate is less rapid. (C) Birth rates increase and population growth rate increases. (D) Birth rates decrease and population growth rate increases.\nA:  (B)\n\nQ: Which of the following statements is NOT accurate regarding the services provided by local governments in the United States?\n(A) Duplication of efforts occurs often. (B) Social problems of the central city spill over into the surrounding residential suburbs. (C) Inefficiency in providing services occurs often. (D) One neighborhood's efforts to reduce pollution are always supported by neighboring communities.\nA:  (D)\n\nQ: The practice of hiring a foreign third-party service provider to run an operation is called\n(A) outsourcing. (B) offshoring. (C) maquiladoras. (D) locational interdependence.\nA:  (B)\n\nQ: Which one of the following items is an example of nonmaterial culture?\n(A) Dove soap (B) Dove candy bar (C) Dove symbol (D) A dove (bird)\nA:  (C)\n\nQ: Part of the boundary between the United States and Mexico is the Rio Grande, an example of\n(A) a water divider. (B) a watercourse. (C) an artificial boundary. (D) a natural boundary.\nA: ",
        {
          "until": [
            "</s>"
          ]
        }
      ]
    ],
    "resps": [
      [
        "(D)"
      ]
    ],
    "filtered_resps": [
      "(D)"
    ],
    "exact_match": 1.0
  },
  {
    "doc_id": 105,
    "doc": {
      "question": "Spanish colonial architecture, uneven economic development, and rural-to-urban migration flows are most commonly found in which of the following?",
      "subject": "high_school_geography",
      "choices": [
        "Southeast Asia",
        "Sub-Saharan Africa",
        "North America",
        "Latin America"
      ],
      "answer": 3
    },
    "target": "(D)",
    "arguments": [
      [
        "The following are multiple choice questions (with answers) about high school geography.\n\nQ: The rate of natural increase of a population is found by subtracting the\n(A) crude death rate from the crude birth date. (B) crude birth rate from the crude death rate. (C) doubling time from the crude birth rate. (D) fertility rate from the crude death rate.\nA:  (A)\n\nQ: The practice of hiring a foreign third-party service provider to run an operation is called\n(A) outsourcing. (B) offshoring. (C) maquiladoras. (D) locational interdependence.\nA:  (B)\n\nQ: During the third stage of the demographic transition model, which of the following is true?\n(A) Birth rates increase and population growth rate is less rapid. (B) Birth rates decline and population growth rate is less rapid. (C) Birth rates increase and population growth rate increases. (D) Birth rates decrease and population growth rate increases.\nA:  (B)\n\nQ: Which one of the following items is an example of nonmaterial culture?\n(A) Dove soap (B) Dove candy bar (C) Dove symbol (D) A dove (bird)\nA:  (C)\n\nQ: Which of the following statements is NOT accurate regarding the services provided by local governments in the United States?\n(A) Duplication of efforts occurs often. (B) Social problems of the central city spill over into the surrounding residential suburbs. (C) Inefficiency in providing services occurs often. (D) One neighborhood's efforts to reduce pollution are always supported by neighboring communities.\nA:  (D)\n\nQ: Spanish colonial architecture, uneven economic development, and rural-to-urban migration flows are most commonly found in which of the following?\n(A) Southeast Asia (B) Sub-Saharan Africa (C) North America (D) Latin America\nA: ",
        {
          "until": [
            "</s>"
          ]
        }
      ]
    ],
    "resps": [
      [
        "(D)"
      ]
    ],
    "filtered_resps": [
      "(D)"
    ],
    "exact_match": 1.0
  },
  {
    "doc_id": 113,
    "doc": {
      "question": "Shifting cultivation is most often practiced in",
      "subject": "high_school_geography",
      "choices": [
        "alpine tundra.",
        "tropical forests.",
        "flood plains.",
        "deserts."
      ],
      "answer": 1
    },
    "target": "(B)",
    "arguments": [
      [
        "The following are multiple choice questions (with answers) about high school geography.\n\nQ: Which of the following statements is NOT accurate regarding the services provided by local governments in the United States?\n(A) Duplication of efforts occurs often. (B) Social problems of the central city spill over into the surrounding residential suburbs. (C) Inefficiency in providing services occurs often. (D) One neighborhood's efforts to reduce pollution are always supported by neighboring communities.\nA:  (D)\n\nQ: During the third stage of the demographic transition model, which of the following is true?\n(A) Birth rates increase and population growth rate is less rapid. (B) Birth rates decline and population growth rate is less rapid. (C) Birth rates increase and population growth rate increases. (D) Birth rates decrease and population growth rate increases.\nA:  (B)\n\nQ: The practice of hiring a foreign third-party service provider to run an operation is called\n(A) outsourcing. (B) offshoring. (C) maquiladoras. (D) locational interdependence.\nA:  (B)\n\nQ: The rate of natural increase of a population is found by subtracting the\n(A) crude death rate from the crude birth date. (B) crude birth rate from the crude death rate. (C) doubling time from the crude birth rate. (D) fertility rate from the crude death rate.\nA:  (A)\n\nQ: Which one of the following items is an example of nonmaterial culture?\n(A) Dove soap (B) Dove candy bar (C) Dove symbol (D) A dove (bird)\nA:  (C)\n\nQ: Shifting cultivation is most often practiced in\n(A) alpine tundra. (B) tropical forests. (C) flood plains. (D) deserts.\nA: ",
        {
          "until": [
            "</s>"
          ]
        }
      ]
    ],
    "resps": [
      [
        "(B)<0x0A><0x0A>"
      ]
    ],
    "filtered_resps": [
      "(B)<0x0A><0x0A>"
    ],
    "exact_match": 0.0
  },
  {
    "doc_id": 121,
    "doc": {
      "question": "Which one of the following statements does NOT correctly describe the Green Revolution?",
      "subject": "high_school_geography",
      "choices": [
        "It changed centuries-old methods of farming.",
        "It was an attempt to feed a growing world population.",
        "It centered on increased rice, wheat, and maize yields.",
        "It greatly improved crop yields in sub-Saharan Africa."
      ],
      "answer": 3
    },
    "target": "(D)",
    "arguments": [
      [
        "The following are multiple choice questions (with answers) about high school geography.\n\nQ: The rate of natural increase of a population is found by subtracting the\n(A) crude death rate from the crude birth date. (B) crude birth rate from the crude death rate. (C) doubling time from the crude birth rate. (D) fertility rate from the crude death rate.\nA:  (A)\n\nQ: The practice of hiring a foreign third-party service provider to run an operation is called\n(A) outsourcing. (B) offshoring. (C) maquiladoras. (D) locational interdependence.\nA:  (B)\n\nQ: During the third stage of the demographic transition model, which of the following is true?\n(A) Birth rates increase and population growth rate is less rapid. (B) Birth rates decline and population growth rate is less rapid. (C) Birth rates increase and population growth rate increases. (D) Birth rates decrease and population growth rate increases.\nA:  (B)\n\nQ: Which of the following statements is NOT accurate regarding the services provided by local governments in the United States?\n(A) Duplication of efforts occurs often. (B) Social problems of the central city spill over into the surrounding residential suburbs. (C) Inefficiency in providing services occurs often. (D) One neighborhood's efforts to reduce pollution are always supported by neighboring communities.\nA:  (D)\n\nQ: Which one of the following items is an example of nonmaterial culture?\n(A) Dove soap (B) Dove candy bar (C) Dove symbol (D) A dove (bird)\nA:  (C)\n\nQ: Which one of the following statements does NOT correctly describe the Green Revolution?\n(A) It changed centuries-old methods of farming. (B) It was an attempt to feed a growing world population. (C) It centered on increased rice, wheat, and maize yields. (D) It greatly improved crop yields in sub-Saharan Africa.\nA: ",
        {
          "until": [
            "</s>"
          ]
        }
      ]
    ],
    "resps": [
      [
        "(B)"
      ]
    ],
    "filtered_resps": [
      "(B)"
    ],
    "exact_match": 0.0
  },
  {
    "doc_id": 129,
    "doc": {
      "question": "Which of the following is NOT an important environmental factor influencing a country's agriculture?",
      "subject": "high_school_geography",
      "choices": [
        "Number of frost-free days per year",
        "Availability of sufficient rainfall",
        "Reliability of sufficient rainfall",
        "Amount of fertilizer produced in the country"
      ],
      "answer": 3
    },
    "target": "(D)",
    "arguments": [
      [
        "The following are multiple choice questions (with answers) about high school geography.\n\nQ: Which one of the following items is an example of nonmaterial culture?\n(A) Dove soap (B) Dove candy bar (C) Dove symbol (D) A dove (bird)\nA:  (C)\n\nQ: The practice of hiring a foreign third-party service provider to run an operation is called\n(A) outsourcing. (B) offshoring. (C) maquiladoras. (D) locational interdependence.\nA:  (B)\n\nQ: During the third stage of the demographic transition model, which of the following is true?\n(A) Birth rates increase and population growth rate is less rapid. (B) Birth rates decline and population growth rate is less rapid. (C) Birth rates increase and population growth rate increases. (D) Birth rates decrease and population growth rate increases.\nA:  (B)\n\nQ: The rate of natural increase of a population is found by subtracting the\n(A) crude death rate from the crude birth date. (B) crude birth rate from the crude death rate. (C) doubling time from the crude birth rate. (D) fertility rate from the crude death rate.\nA:  (A)\n\nQ: Which of the following statements is NOT accurate regarding the services provided by local governments in the United States?\n(A) Duplication of efforts occurs often. (B) Social problems of the central city spill over into the surrounding residential suburbs. (C) Inefficiency in providing services occurs often. (D) One neighborhood's efforts to reduce pollution are always supported by neighboring communities.\nA:  (D)\n\nQ: Which of the following is NOT an important environmental factor influencing a country's agriculture?\n(A) Number of frost-free days per year (B) Availability of sufficient rainfall (C) Reliability of sufficient rainfall (D) Amount of fertilizer produced in the country\nA: ",
        {
          "until": [
            "</s>"
          ]
        }
      ]
    ],
    "resps": [
      [
        "(C)"
      ]
    ],
    "filtered_resps": [
      "(C)"
    ],
    "exact_match": 0.0
  },
  {
    "doc_id": 137,
    "doc": {
      "question": "Which of the following is a characteristic of a developed country?",
      "subject": "high_school_geography",
      "choices": [
        "Over 50% of workforce engaged in agriculture",
        "Women held in inferior place in society",
        "Main disease related to age and lifestyle",
        "High birth and death rates"
      ],
      "answer": 2
    },
    "target": "(C)",
    "arguments": [
      [
        "The following are multiple choice questions (with answers) about high school geography.\n\nQ: Which one of the following items is an example of nonmaterial culture?\n(A) Dove soap (B) Dove candy bar (C) Dove symbol (D) A dove (bird)\nA:  (C)\n\nQ: During the third stage of the demographic transition model, which of the following is true?\n(A) Birth rates increase and population growth rate is less rapid. (B) Birth rates decline and population growth rate is less rapid. (C) Birth rates increase and population growth rate increases. (D) Birth rates decrease and population growth rate increases.\nA:  (B)\n\nQ: The practice of hiring a foreign third-party service provider to run an operation is called\n(A) outsourcing. (B) offshoring. (C) maquiladoras. (D) locational interdependence.\nA:  (B)\n\nQ: Which of the following statements is NOT accurate regarding the services provided by local governments in the United States?\n(A) Duplication of efforts occurs often. (B) Social problems of the central city spill over into the surrounding residential suburbs. (C) Inefficiency in providing services occurs often. (D) One neighborhood's efforts to reduce pollution are always supported by neighboring communities.\nA:  (D)\n\nQ: The rate of natural increase of a population is found by subtracting the\n(A) crude death rate from the crude birth date. (B) crude birth rate from the crude death rate. (C) doubling time from the crude birth rate. (D) fertility rate from the crude death rate.\nA:  (A)\n\nQ: Which of the following is a characteristic of a developed country?\n(A) Over 50% of workforce engaged in agriculture (B) Women held in inferior place in society (C) Main disease related to age and lifestyle (D) High birth and death rates\nA: ",
        {
          "until": [
            "</s>"
          ]
        }
      ]
    ],
    "resps": [
      [
        "(D)"
      ]
    ],
    "filtered_resps": [
      "(D)"
    ],
    "exact_match": 0.0
  },
  {
    "doc_id": 145,
    "doc": {
      "question": "When a new fashion design is introduced globally, the information initially travels through a process known as",
      "subject": "high_school_geography",
      "choices": [
        "contagious diffusion",
        "relocation diffusion",
        "innovative diffusion",
        "hierarchical diffusion"
      ],
      "answer": 3
    },
    "target": "(D)",
    "arguments": [
      [
        "The following are multiple choice questions (with answers) about high school geography.\n\nQ: Which of the following statements is NOT accurate regarding the services provided by local governments in the United States?\n(A) Duplication of efforts occurs often. (B) Social problems of the central city spill over into the surrounding residential suburbs. (C) Inefficiency in providing services occurs often. (D) One neighborhood's efforts to reduce pollution are always supported by neighboring communities.\nA:  (D)\n\nQ: The rate of natural increase of a population is found by subtracting the\n(A) crude death rate from the crude birth date. (B) crude birth rate from the crude death rate. (C) doubling time from the crude birth rate. (D) fertility rate from the crude death rate.\nA:  (A)\n\nQ: The practice of hiring a foreign third-party service provider to run an operation is called\n(A) outsourcing. (B) offshoring. (C) maquiladoras. (D) locational interdependence.\nA:  (B)\n\nQ: During the third stage of the demographic transition model, which of the following is true?\n(A) Birth rates increase and population growth rate is less rapid. (B) Birth rates decline and population growth rate is less rapid. (C) Birth rates increase and population growth rate increases. (D) Birth rates decrease and population growth rate increases.\nA:  (B)\n\nQ: Which one of the following items is an example of nonmaterial culture?\n(A) Dove soap (B) Dove candy bar (C) Dove symbol (D) A dove (bird)\nA:  (C)\n\nQ: When a new fashion design is introduced globally, the information initially travels through a process known as\n(A) contagious diffusion (B) relocation diffusion (C) innovative diffusion (D) hierarchical diffusion\nA: ",
        {
          "until": [
            "</s>"
          ]
        }
      ]
    ],
    "resps": [
      [
        "(D)<0x0A>"
      ]
    ],
    "filtered_resps": [
      "(D)<0x0A>"
    ],
    "exact_match": 0.0
  },
  {
    "doc_id": 153,
    "doc": {
      "question": "The influence of neo-Malthusianism can be seen in",
      "subject": "high_school_geography",
      "choices": [
        "government programs for birth control and planning.",
        "famine relief.",
        "increased spending in social welfare programs.",
        "increased total fertility rates."
      ],
      "answer": 0
    },
    "target": "(A)",
    "arguments": [
      [
        "The following are multiple choice questions (with answers) about high school geography.\n\nQ: The rate of natural increase of a population is found by subtracting the\n(A) crude death rate from the crude birth date. (B) crude birth rate from the crude death rate. (C) doubling time from the crude birth rate. (D) fertility rate from the crude death rate.\nA:  (A)\n\nQ: Which one of the following items is an example of nonmaterial culture?\n(A) Dove soap (B) Dove candy bar (C) Dove symbol (D) A dove (bird)\nA:  (C)\n\nQ: During the third stage of the demographic transition model, which of the following is true?\n(A) Birth rates increase and population growth rate is less rapid. (B) Birth rates decline and population growth rate is less rapid. (C) Birth rates increase and population growth rate increases. (D) Birth rates decrease and population growth rate increases.\nA:  (B)\n\nQ: Which of the following statements is NOT accurate regarding the services provided by local governments in the United States?\n(A) Duplication of efforts occurs often. (B) Social problems of the central city spill over into the surrounding residential suburbs. (C) Inefficiency in providing services occurs often. (D) One neighborhood's efforts to reduce pollution are always supported by neighboring communities.\nA:  (D)\n\nQ: The practice of hiring a foreign third-party service provider to run an operation is called\n(A) outsourcing. (B) offshoring. (C) maquiladoras. (D) locational interdependence.\nA:  (B)\n\nQ: The influence of neo-Malthusianism can be seen in\n(A) government programs for birth control and planning. (B) famine relief. (C) increased spending in social welfare programs. (D) increased total fertility rates.\nA: ",
        {
          "until": [
            "</s>"
          ]
        }
      ]
    ],
    "resps": [
      [
        "(A)"
      ]
    ],
    "filtered_resps": [
      "(A)"
    ],
    "exact_match": 1.0
  },
  {
    "doc_id": 161,
    "doc": {
      "question": "Which one of the following organizations is NOT a supranational organization?",
      "subject": "high_school_geography",
      "choices": [
        "UN",
        "NATO",
        "ASEAN",
        "PLO"
      ],
      "answer": 3
    },
    "target": "(D)",
    "arguments": [
      [
        "The following are multiple choice questions (with answers) about high school geography.\n\nQ: During the third stage of the demographic transition model, which of the following is true?\n(A) Birth rates increase and population growth rate is less rapid. (B) Birth rates decline and population growth rate is less rapid. (C) Birth rates increase and population growth rate increases. (D) Birth rates decrease and population growth rate increases.\nA:  (B)\n\nQ: Which of the following statements is NOT accurate regarding the services provided by local governments in the United States?\n(A) Duplication of efforts occurs often. (B) Social problems of the central city spill over into the surrounding residential suburbs. (C) Inefficiency in providing services occurs often. (D) One neighborhood's efforts to reduce pollution are always supported by neighboring communities.\nA:  (D)\n\nQ: The rate of natural increase of a population is found by subtracting the\n(A) crude death rate from the crude birth date. (B) crude birth rate from the crude death rate. (C) doubling time from the crude birth rate. (D) fertility rate from the crude death rate.\nA:  (A)\n\nQ: The practice of hiring a foreign third-party service provider to run an operation is called\n(A) outsourcing. (B) offshoring. (C) maquiladoras. (D) locational interdependence.\nA:  (B)\n\nQ: Which one of the following items is an example of nonmaterial culture?\n(A) Dove soap (B) Dove candy bar (C) Dove symbol (D) A dove (bird)\nA:  (C)\n\nQ: Which one of the following organizations is NOT a supranational organization?\n(A) UN (B) NATO (C) ASEAN (D) PLO\nA: ",
        {
          "until": [
            "</s>"
          ]
        }
      ]
    ],
    "resps": [
      [
        "(D)"
      ]
    ],
    "filtered_resps": [
      "(D)"
    ],
    "exact_match": 1.0
  },
  {
    "doc_id": 169,
    "doc": {
      "question": "What condition occurs when the people of one state want to annex a territory whose population is ethnically related to that state's population but now under the rule of another state?",
      "subject": "high_school_geography",
      "choices": [
        "Nationalism",
        "Resource dispute",
        "Irredentism",
        "Positional dispute"
      ],
      "answer": 2
    },
    "target": "(C)",
    "arguments": [
      [
        "The following are multiple choice questions (with answers) about high school geography.\n\nQ: During the third stage of the demographic transition model, which of the following is true?\n(A) Birth rates increase and population growth rate is less rapid. (B) Birth rates decline and population growth rate is less rapid. (C) Birth rates increase and population growth rate increases. (D) Birth rates decrease and population growth rate increases.\nA:  (B)\n\nQ: Which of the following statements is NOT accurate regarding the services provided by local governments in the United States?\n(A) Duplication of efforts occurs often. (B) Social problems of the central city spill over into the surrounding residential suburbs. (C) Inefficiency in providing services occurs often. (D) One neighborhood's efforts to reduce pollution are always supported by neighboring communities.\nA:  (D)\n\nQ: Which one of the following items is an example of nonmaterial culture?\n(A) Dove soap (B) Dove candy bar (C) Dove symbol (D) A dove (bird)\nA:  (C)\n\nQ: The rate of natural increase of a population is found by subtracting the\n(A) crude death rate from the crude birth date. (B) crude birth rate from the crude death rate. (C) doubling time from the crude birth rate. (D) fertility rate from the crude death rate.\nA:  (A)\n\nQ: The practice of hiring a foreign third-party service provider to run an operation is called\n(A) outsourcing. (B) offshoring. (C) maquiladoras. (D) locational interdependence.\nA:  (B)\n\nQ: What condition occurs when the people of one state want to annex a territory whose population is ethnically related to that state's population but now under the rule of another state?\n(A) Nationalism (B) Resource dispute (C) Irredentism (D) Positional dispute\nA: ",
        {
          "until": [
            "</s>"
          ]
        }
      ]
    ],
    "resps": [
      [
        "(D)"
      ]
    ],
    "filtered_resps": [
      "(D)"
    ],
    "exact_match": 0.0
  },
  {
    "doc_id": 177,
    "doc": {
      "question": "A chief factor that contributed to the Second Agricultural Revolution was",
      "subject": "high_school_geography",
      "choices": [
        "the Industrial Revolution.",
        "World War I.",
        "World War II.",
        "the discovery of the plow."
      ],
      "answer": 0
    },
    "target": "(A)",
    "arguments": [
      [
        "The following are multiple choice questions (with answers) about high school geography.\n\nQ: The practice of hiring a foreign third-party service provider to run an operation is called\n(A) outsourcing. (B) offshoring. (C) maquiladoras. (D) locational interdependence.\nA:  (B)\n\nQ: During the third stage of the demographic transition model, which of the following is true?\n(A) Birth rates increase and population growth rate is less rapid. (B) Birth rates decline and population growth rate is less rapid. (C) Birth rates increase and population growth rate increases. (D) Birth rates decrease and population growth rate increases.\nA:  (B)\n\nQ: The rate of natural increase of a population is found by subtracting the\n(A) crude death rate from the crude birth date. (B) crude birth rate from the crude death rate. (C) doubling time from the crude birth rate. (D) fertility rate from the crude death rate.\nA:  (A)\n\nQ: Which one of the following items is an example of nonmaterial culture?\n(A) Dove soap (B) Dove candy bar (C) Dove symbol (D) A dove (bird)\nA:  (C)\n\nQ: Which of the following statements is NOT accurate regarding the services provided by local governments in the United States?\n(A) Duplication of efforts occurs often. (B) Social problems of the central city spill over into the surrounding residential suburbs. (C) Inefficiency in providing services occurs often. (D) One neighborhood's efforts to reduce pollution are always supported by neighboring communities.\nA:  (D)\n\nQ: A chief factor that contributed to the Second Agricultural Revolution was\n(A) the Industrial Revolution. (B) World War I. (C) World War II. (D) the discovery of the plow.\nA: ",
        {
          "until": [
            "</s>"
          ]
        }
      ]
    ],
    "resps": [
      [
        "(C)"
      ]
    ],
    "filtered_resps": [
      "(C)"
    ],
    "exact_match": 0.0
  },
  {
    "doc_id": 185,
    "doc": {
      "question": "What monotheistic religion is based on the life and teachings of Jesus Christ of Nazareth?",
      "subject": "high_school_geography",
      "choices": [
        "Islam",
        "Christianity",
        "Hinduism",
        "Buddhism"
      ],
      "answer": 1
    },
    "target": "(B)",
    "arguments": [
      [
        "The following are multiple choice questions (with answers) about high school geography.\n\nQ: During the third stage of the demographic transition model, which of the following is true?\n(A) Birth rates increase and population growth rate is less rapid. (B) Birth rates decline and population growth rate is less rapid. (C) Birth rates increase and population growth rate increases. (D) Birth rates decrease and population growth rate increases.\nA:  (B)\n\nQ: The rate of natural increase of a population is found by subtracting the\n(A) crude death rate from the crude birth date. (B) crude birth rate from the crude death rate. (C) doubling time from the crude birth rate. (D) fertility rate from the crude death rate.\nA:  (A)\n\nQ: Which of the following statements is NOT accurate regarding the services provided by local governments in the United States?\n(A) Duplication of efforts occurs often. (B) Social problems of the central city spill over into the surrounding residential suburbs. (C) Inefficiency in providing services occurs often. (D) One neighborhood's efforts to reduce pollution are always supported by neighboring communities.\nA:  (D)\n\nQ: Which one of the following items is an example of nonmaterial culture?\n(A) Dove soap (B) Dove candy bar (C) Dove symbol (D) A dove (bird)\nA:  (C)\n\nQ: The practice of hiring a foreign third-party service provider to run an operation is called\n(A) outsourcing. (B) offshoring. (C) maquiladoras. (D) locational interdependence.\nA:  (B)\n\nQ: What monotheistic religion is based on the life and teachings of Jesus Christ of Nazareth?\n(A) Islam (B) Christianity (C) Hinduism (D) Buddhism\nA: ",
        {
          "until": [
            "</s>"
          ]
        }
      ]
    ],
    "resps": [
      [
        "(B)"
      ]
    ],
    "filtered_resps": [
      "(B)"
    ],
    "exact_match": 1.0
  },
  {
    "doc_id": 193,
    "doc": {
      "question": "What was the primary reason the Green Revolution did NOT help Africa much?",
      "subject": "high_school_geography",
      "choices": [
        "It targeted crops Africans don't grow and eat.",
        "It required sophisticated machinery.",
        "Population growth has fallen so drastically that Africans don't need the increased food production.",
        "African agricultural production went up without its help."
      ],
      "answer": 0
    },
    "target": "(A)",
    "arguments": [
      [
        "The following are multiple choice questions (with answers) about high school geography.\n\nQ: The practice of hiring a foreign third-party service provider to run an operation is called\n(A) outsourcing. (B) offshoring. (C) maquiladoras. (D) locational interdependence.\nA:  (B)\n\nQ: The rate of natural increase of a population is found by subtracting the\n(A) crude death rate from the crude birth date. (B) crude birth rate from the crude death rate. (C) doubling time from the crude birth rate. (D) fertility rate from the crude death rate.\nA:  (A)\n\nQ: Which of the following statements is NOT accurate regarding the services provided by local governments in the United States?\n(A) Duplication of efforts occurs often. (B) Social problems of the central city spill over into the surrounding residential suburbs. (C) Inefficiency in providing services occurs often. (D) One neighborhood's efforts to reduce pollution are always supported by neighboring communities.\nA:  (D)\n\nQ: During the third stage of the demographic transition model, which of the following is true?\n(A) Birth rates increase and population growth rate is less rapid. (B) Birth rates decline and population growth rate is less rapid. (C) Birth rates increase and population growth rate increases. (D) Birth rates decrease and population growth rate increases.\nA:  (B)\n\nQ: Which one of the following items is an example of nonmaterial culture?\n(A) Dove soap (B) Dove candy bar (C) Dove symbol (D) A dove (bird)\nA:  (C)\n\nQ: What was the primary reason the Green Revolution did NOT help Africa much?\n(A) It targeted crops Africans don't grow and eat. (B) It required sophisticated machinery. (C) Population growth has fallen so drastically that Africans don't need the increased food production. (D) African agricultural production went up without its help.\nA: ",
        {
          "until": [
            "</s>"
          ]
        }
      ]
    ],
    "resps": [
      [
        "(C)"
      ]
    ],
    "filtered_resps": [
      "(C)"
    ],
    "exact_match": 0.0
  },
  {
    "doc_id": 2,
    "doc": {
      "question": "The tendency for migration to decrease with distance is called",
      "subject": "high_school_geography",
      "choices": [
        "push factors.",
        "pull factors.",
        "distance decay.",
        "migration selectivity."
      ],
      "answer": 2
    },
    "target": "(C)",
    "arguments": [
      [
        "The following are multiple choice questions (with answers) about high school geography.\n\nQ: The practice of hiring a foreign third-party service provider to run an operation is called\n(A) outsourcing. (B) offshoring. (C) maquiladoras. (D) locational interdependence.\nA:  (B)\n\nQ: The rate of natural increase of a population is found by subtracting the\n(A) crude death rate from the crude birth date. (B) crude birth rate from the crude death rate. (C) doubling time from the crude birth rate. (D) fertility rate from the crude death rate.\nA:  (A)\n\nQ: Which one of the following items is an example of nonmaterial culture?\n(A) Dove soap (B) Dove candy bar (C) Dove symbol (D) A dove (bird)\nA:  (C)\n\nQ: Which of the following statements is NOT accurate regarding the services provided by local governments in the United States?\n(A) Duplication of efforts occurs often. (B) Social problems of the central city spill over into the surrounding residential suburbs. (C) Inefficiency in providing services occurs often. (D) One neighborhood's efforts to reduce pollution are always supported by neighboring communities.\nA:  (D)\n\nQ: During the third stage of the demographic transition model, which of the following is true?\n(A) Birth rates increase and population growth rate is less rapid. (B) Birth rates decline and population growth rate is less rapid. (C) Birth rates increase and population growth rate increases. (D) Birth rates decrease and population growth rate increases.\nA:  (B)\n\nQ: The tendency for migration to decrease with distance is called\n(A) push factors. (B) pull factors. (C) distance decay. (D) migration selectivity.\nA: ",
        {
          "until": [
            "</s>"
          ]
        }
      ]
    ],
    "resps": [
      [
        "(D)<0x0A>Answer: (D)"
      ]
    ],
    "filtered_resps": [
      "(D)<0x0A>Answer: (D)"
    ],
    "exact_match": 0.0
  },
  {
    "doc_id": 10,
    "doc": {
      "question": "The first stage of the demographic transition exhibits",
      "subject": "high_school_geography",
      "choices": [
        "high birth rates with high but fluctuating death rates.",
        "declining birth rates with continuing high death rates.",
        "low birth rates with continuing high death rates.",
        "high birth rates with declining death rates."
      ],
      "answer": 0
    },
    "target": "(A)",
    "arguments": [
      [
        "The following are multiple choice questions (with answers) about high school geography.\n\nQ: The rate of natural increase of a population is found by subtracting the\n(A) crude death rate from the crude birth date. (B) crude birth rate from the crude death rate. (C) doubling time from the crude birth rate. (D) fertility rate from the crude death rate.\nA:  (A)\n\nQ: Which one of the following items is an example of nonmaterial culture?\n(A) Dove soap (B) Dove candy bar (C) Dove symbol (D) A dove (bird)\nA:  (C)\n\nQ: During the third stage of the demographic transition model, which of the following is true?\n(A) Birth rates increase and population growth rate is less rapid. (B) Birth rates decline and population growth rate is less rapid. (C) Birth rates increase and population growth rate increases. (D) Birth rates decrease and population growth rate increases.\nA:  (B)\n\nQ: The practice of hiring a foreign third-party service provider to run an operation is called\n(A) outsourcing. (B) offshoring. (C) maquiladoras. (D) locational interdependence.\nA:  (B)\n\nQ: Which of the following statements is NOT accurate regarding the services provided by local governments in the United States?\n(A) Duplication of efforts occurs often. (B) Social problems of the central city spill over into the surrounding residential suburbs. (C) Inefficiency in providing services occurs often. (D) One neighborhood's efforts to reduce pollution are always supported by neighboring communities.\nA:  (D)\n\nQ: The first stage of the demographic transition exhibits\n(A) high birth rates with high but fluctuating death rates. (B) declining birth rates with continuing high death rates. (C) low birth rates with continuing high death rates. (D) high birth rates with declining death rates.\nA: ",
        {
          "until": [
            "</s>"
          ]
        }
      ]
    ],
    "resps": [
      [
        "(A)"
      ]
    ],
    "filtered_resps": [
      "(A)"
    ],
    "exact_match": 1.0
  },
  {
    "doc_id": 18,
    "doc": {
      "question": "In which urban US setting below would you expect to find planned communities?",
      "subject": "high_school_geography",
      "choices": [
        "Ghettos",
        "Suburbs",
        "CBDs",
        "Transition zones"
      ],
      "answer": 1
    },
    "target": "(B)",
    "arguments": [
      [
        "The following are multiple choice questions (with answers) about high school geography.\n\nQ: The rate of natural increase of a population is found by subtracting the\n(A) crude death rate from the crude birth date. (B) crude birth rate from the crude death rate. (C) doubling time from the crude birth rate. (D) fertility rate from the crude death rate.\nA:  (A)\n\nQ: Which one of the following items is an example of nonmaterial culture?\n(A) Dove soap (B) Dove candy bar (C) Dove symbol (D) A dove (bird)\nA:  (C)\n\nQ: During the third stage of the demographic transition model, which of the following is true?\n(A) Birth rates increase and population growth rate is less rapid. (B) Birth rates decline and population growth rate is less rapid. (C) Birth rates increase and population growth rate increases. (D) Birth rates decrease and population growth rate increases.\nA:  (B)\n\nQ: Which of the following statements is NOT accurate regarding the services provided by local governments in the United States?\n(A) Duplication of efforts occurs often. (B) Social problems of the central city spill over into the surrounding residential suburbs. (C) Inefficiency in providing services occurs often. (D) One neighborhood's efforts to reduce pollution are always supported by neighboring communities.\nA:  (D)\n\nQ: The practice of hiring a foreign third-party service provider to run an operation is called\n(A) outsourcing. (B) offshoring. (C) maquiladoras. (D) locational interdependence.\nA:  (B)\n\nQ: In which urban US setting below would you expect to find planned communities?\n(A) Ghettos (B) Suburbs (C) CBDs (D) Transition zones\nA: ",
        {
          "until": [
            "</s>"
          ]
        }
      ]
    ],
    "resps": [
      [
        "(D)"
      ]
    ],
    "filtered_resps": [
      "(D)"
    ],
    "exact_match": 0.0
  },
  {
    "doc_id": 26,
    "doc": {
      "question": "Which group enacted the first effective settlement in the eastern United States?",
      "subject": "high_school_geography",
      "choices": [
        "French",
        "British (English, Scotch-Irish, Welsh, Scottish)",
        "Russian",
        "Chinese"
      ],
      "answer": 1
    },
    "target": "(B)",
    "arguments": [
      [
        "The following are multiple choice questions (with answers) about high school geography.\n\nQ: During the third stage of the demographic transition model, which of the following is true?\n(A) Birth rates increase and population growth rate is less rapid. (B) Birth rates decline and population growth rate is less rapid. (C) Birth rates increase and population growth rate increases. (D) Birth rates decrease and population growth rate increases.\nA:  (B)\n\nQ: The rate of natural increase of a population is found by subtracting the\n(A) crude death rate from the crude birth date. (B) crude birth rate from the crude death rate. (C) doubling time from the crude birth rate. (D) fertility rate from the crude death rate.\nA:  (A)\n\nQ: The practice of hiring a foreign third-party service provider to run an operation is called\n(A) outsourcing. (B) offshoring. (C) maquiladoras. (D) locational interdependence.\nA:  (B)\n\nQ: Which of the following statements is NOT accurate regarding the services provided by local governments in the United States?\n(A) Duplication of efforts occurs often. (B) Social problems of the central city spill over into the surrounding residential suburbs. (C) Inefficiency in providing services occurs often. (D) One neighborhood's efforts to reduce pollution are always supported by neighboring communities.\nA:  (D)\n\nQ: Which one of the following items is an example of nonmaterial culture?\n(A) Dove soap (B) Dove candy bar (C) Dove symbol (D) A dove (bird)\nA:  (C)\n\nQ: Which group enacted the first effective settlement in the eastern United States?\n(A) French (B) British (English, Scotch-Irish, Welsh, Scottish) (C) Russian (D) Chinese\nA: ",
        {
          "until": [
            "</s>"
          ]
        }
      ]
    ],
    "resps": [
      [
        "(B)"
      ]
    ],
    "filtered_resps": [
      "(B)"
    ],
    "exact_match": 1.0
  },
  {
    "doc_id": 34,
    "doc": {
      "question": "Which of the following is LEAST self-sufficient in the natural resources needed for modern industry?",
      "subject": "high_school_geography",
      "choices": [
        "United States",
        "Japan",
        "France",
        "United Kingdom"
      ],
      "answer": 1
    },
    "target": "(B)",
    "arguments": [
      [
        "The following are multiple choice questions (with answers) about high school geography.\n\nQ: Which one of the following items is an example of nonmaterial culture?\n(A) Dove soap (B) Dove candy bar (C) Dove symbol (D) A dove (bird)\nA:  (C)\n\nQ: The practice of hiring a foreign third-party service provider to run an operation is called\n(A) outsourcing. (B) offshoring. (C) maquiladoras. (D) locational interdependence.\nA:  (B)\n\nQ: The rate of natural increase of a population is found by subtracting the\n(A) crude death rate from the crude birth date. (B) crude birth rate from the crude death rate. (C) doubling time from the crude birth rate. (D) fertility rate from the crude death rate.\nA:  (A)\n\nQ: Which of the following statements is NOT accurate regarding the services provided by local governments in the United States?\n(A) Duplication of efforts occurs often. (B) Social problems of the central city spill over into the surrounding residential suburbs. (C) Inefficiency in providing services occurs often. (D) One neighborhood's efforts to reduce pollution are always supported by neighboring communities.\nA:  (D)\n\nQ: During the third stage of the demographic transition model, which of the following is true?\n(A) Birth rates increase and population growth rate is less rapid. (B) Birth rates decline and population growth rate is less rapid. (C) Birth rates increase and population growth rate increases. (D) Birth rates decrease and population growth rate increases.\nA:  (B)\n\nQ: Which of the following is LEAST self-sufficient in the natural resources needed for modern industry?\n(A) United States (B) Japan (C) France (D) United Kingdom\nA: ",
        {
          "until": [
            "</s>"
          ]
        }
      ]
    ],
    "resps": [
      [
        "(B)"
      ]
    ],
    "filtered_resps": [
      "(B)"
    ],
    "exact_match": 1.0
  },
  {
    "doc_id": 42,
    "doc": {
      "question": "On which of the following can one most accurately depict true geographical distance, true direction, true size, and true shape?",
      "subject": "high_school_geography",
      "choices": [
        "A Mercator projection",
        "A globe",
        "A conic projection",
        "A gnomonic projection"
      ],
      "answer": 1
    },
    "target": "(B)",
    "arguments": [
      [
        "The following are multiple choice questions (with answers) about high school geography.\n\nQ: The rate of natural increase of a population is found by subtracting the\n(A) crude death rate from the crude birth date. (B) crude birth rate from the crude death rate. (C) doubling time from the crude birth rate. (D) fertility rate from the crude death rate.\nA:  (A)\n\nQ: Which one of the following items is an example of nonmaterial culture?\n(A) Dove soap (B) Dove candy bar (C) Dove symbol (D) A dove (bird)\nA:  (C)\n\nQ: Which of the following statements is NOT accurate regarding the services provided by local governments in the United States?\n(A) Duplication of efforts occurs often. (B) Social problems of the central city spill over into the surrounding residential suburbs. (C) Inefficiency in providing services occurs often. (D) One neighborhood's efforts to reduce pollution are always supported by neighboring communities.\nA:  (D)\n\nQ: The practice of hiring a foreign third-party service provider to run an operation is called\n(A) outsourcing. (B) offshoring. (C) maquiladoras. (D) locational interdependence.\nA:  (B)\n\nQ: During the third stage of the demographic transition model, which of the following is true?\n(A) Birth rates increase and population growth rate is less rapid. (B) Birth rates decline and population growth rate is less rapid. (C) Birth rates increase and population growth rate increases. (D) Birth rates decrease and population growth rate increases.\nA:  (B)\n\nQ: On which of the following can one most accurately depict true geographical distance, true direction, true size, and true shape?\n(A) A Mercator projection (B) A globe (C) A conic projection (D) A gnomonic projection\nA: ",
        {
          "until": [
            "</s>"
          ]
        }
      ]
    ],
    "resps": [
      [
        "(D)"
      ]
    ],
    "filtered_resps": [
      "(D)"
    ],
    "exact_match": 0.0
  },
  {
    "doc_id": 50,
    "doc": {
      "question": "A strong movement away from all religions is called",
      "subject": "high_school_geography",
      "choices": [
        "secularism.",
        "heathenism.",
        "sacrilege.",
        "nationalism."
      ],
      "answer": 0
    },
    "target": "(A)",
    "arguments": [
      [
        "The following are multiple choice questions (with answers) about high school geography.\n\nQ: Which one of the following items is an example of nonmaterial culture?\n(A) Dove soap (B) Dove candy bar (C) Dove symbol (D) A dove (bird)\nA:  (C)\n\nQ: The rate of natural increase of a population is found by subtracting the\n(A) crude death rate from the crude birth date. (B) crude birth rate from the crude death rate. (C) doubling time from the crude birth rate. (D) fertility rate from the crude death rate.\nA:  (A)\n\nQ: Which of the following statements is NOT accurate regarding the services provided by local governments in the United States?\n(A) Duplication of efforts occurs often. (B) Social problems of the central city spill over into the surrounding residential suburbs. (C) Inefficiency in providing services occurs often. (D) One neighborhood's efforts to reduce pollution are always supported by neighboring communities.\nA:  (D)\n\nQ: During the third stage of the demographic transition model, which of the following is true?\n(A) Birth rates increase and population growth rate is less rapid. (B) Birth rates decline and population growth rate is less rapid. (C) Birth rates increase and population growth rate increases. (D) Birth rates decrease and population growth rate increases.\nA:  (B)\n\nQ: The practice of hiring a foreign third-party service provider to run an operation is called\n(A) outsourcing. (B) offshoring. (C) maquiladoras. (D) locational interdependence.\nA:  (B)\n\nQ: A strong movement away from all religions is called\n(A) secularism. (B) heathenism. (C) sacrilege. (D) nationalism.\nA: ",
        {
          "until": [
            "</s>"
          ]
        }
      ]
    ],
    "resps": [
      [
        "(D)<0x0A>Answer: (D)"
      ]
    ],
    "filtered_resps": [
      "(D)<0x0A>Answer: (D)"
    ],
    "exact_match": 0.0
  },
  {
    "doc_id": 58,
    "doc": {
      "question": "The process of invasion and succession is a process involving migration and is best described as when",
      "subject": "high_school_geography",
      "choices": [
        "new residents tear down and rebuild housing units.",
        "new residents live peacefully with old residents.",
        "new residents assimilate with old residents completely.",
        "new residents move into areas occupied by older resident groups."
      ],
      "answer": 3
    },
    "target": "(D)",
    "arguments": [
      [
        "The following are multiple choice questions (with answers) about high school geography.\n\nQ: Which of the following statements is NOT accurate regarding the services provided by local governments in the United States?\n(A) Duplication of efforts occurs often. (B) Social problems of the central city spill over into the surrounding residential suburbs. (C) Inefficiency in providing services occurs often. (D) One neighborhood's efforts to reduce pollution are always supported by neighboring communities.\nA:  (D)\n\nQ: Which one of the following items is an example of nonmaterial culture?\n(A) Dove soap (B) Dove candy bar (C) Dove symbol (D) A dove (bird)\nA:  (C)\n\nQ: The rate of natural increase of a population is found by subtracting the\n(A) crude death rate from the crude birth date. (B) crude birth rate from the crude death rate. (C) doubling time from the crude birth rate. (D) fertility rate from the crude death rate.\nA:  (A)\n\nQ: The practice of hiring a foreign third-party service provider to run an operation is called\n(A) outsourcing. (B) offshoring. (C) maquiladoras. (D) locational interdependence.\nA:  (B)\n\nQ: During the third stage of the demographic transition model, which of the following is true?\n(A) Birth rates increase and population growth rate is less rapid. (B) Birth rates decline and population growth rate is less rapid. (C) Birth rates increase and population growth rate increases. (D) Birth rates decrease and population growth rate increases.\nA:  (B)\n\nQ: The process of invasion and succession is a process involving migration and is best described as when\n(A) new residents tear down and rebuild housing units. (B) new residents live peacefully with old residents. (C) new residents assimilate with old residents completely. (D) new residents move into areas occupied by older resident groups.\nA: ",
        {
          "until": [
            "</s>"
          ]
        }
      ]
    ],
    "resps": [
      [
        "(D)<0x0A>Answer: (D)"
      ]
    ],
    "filtered_resps": [
      "(D)<0x0A>Answer: (D)"
    ],
    "exact_match": 0.0
  },
  {
    "doc_id": 66,
    "doc": {
      "question": "Which language family contains Italian, Spanish, Portuguese, and Romanian?",
      "subject": "high_school_geography",
      "choices": [
        "European",
        "Slavic",
        "Germanic",
        "Romance"
      ],
      "answer": 3
    },
    "target": "(D)",
    "arguments": [
      [
        "The following are multiple choice questions (with answers) about high school geography.\n\nQ: Which one of the following items is an example of nonmaterial culture?\n(A) Dove soap (B) Dove candy bar (C) Dove symbol (D) A dove (bird)\nA:  (C)\n\nQ: The rate of natural increase of a population is found by subtracting the\n(A) crude death rate from the crude birth date. (B) crude birth rate from the crude death rate. (C) doubling time from the crude birth rate. (D) fertility rate from the crude death rate.\nA:  (A)\n\nQ: Which of the following statements is NOT accurate regarding the services provided by local governments in the United States?\n(A) Duplication of efforts occurs often. (B) Social problems of the central city spill over into the surrounding residential suburbs. (C) Inefficiency in providing services occurs often. (D) One neighborhood's efforts to reduce pollution are always supported by neighboring communities.\nA:  (D)\n\nQ: The practice of hiring a foreign third-party service provider to run an operation is called\n(A) outsourcing. (B) offshoring. (C) maquiladoras. (D) locational interdependence.\nA:  (B)\n\nQ: During the third stage of the demographic transition model, which of the following is true?\n(A) Birth rates increase and population growth rate is less rapid. (B) Birth rates decline and population growth rate is less rapid. (C) Birth rates increase and population growth rate increases. (D) Birth rates decrease and population growth rate increases.\nA:  (B)\n\nQ: Which language family contains Italian, Spanish, Portuguese, and Romanian?\n(A) European (B) Slavic (C) Germanic (D) Romance\nA: ",
        {
          "until": [
            "</s>"
          ]
        }
      ]
    ],
    "resps": [
      [
        "(D)"
      ]
    ],
    "filtered_resps": [
      "(D)"
    ],
    "exact_match": 1.0
  },
  {
    "doc_id": 74,
    "doc": {
      "question": "Which of the following countries is actively trying to preserve the purity of their native language from contamination by English or other languages?",
      "subject": "high_school_geography",
      "choices": [
        "Italy",
        "Russia",
        "Japan",
        "Brazil"
      ],
      "answer": 2
    },
    "target": "(C)",
    "arguments": [
      [
        "The following are multiple choice questions (with answers) about high school geography.\n\nQ: Which of the following statements is NOT accurate regarding the services provided by local governments in the United States?\n(A) Duplication of efforts occurs often. (B) Social problems of the central city spill over into the surrounding residential suburbs. (C) Inefficiency in providing services occurs often. (D) One neighborhood's efforts to reduce pollution are always supported by neighboring communities.\nA:  (D)\n\nQ: During the third stage of the demographic transition model, which of the following is true?\n(A) Birth rates increase and population growth rate is less rapid. (B) Birth rates decline and population growth rate is less rapid. (C) Birth rates increase and population growth rate increases. (D) Birth rates decrease and population growth rate increases.\nA:  (B)\n\nQ: Which one of the following items is an example of nonmaterial culture?\n(A) Dove soap (B) Dove candy bar (C) Dove symbol (D) A dove (bird)\nA:  (C)\n\nQ: The practice of hiring a foreign third-party service provider to run an operation is called\n(A) outsourcing. (B) offshoring. (C) maquiladoras. (D) locational interdependence.\nA:  (B)\n\nQ: The rate of natural increase of a population is found by subtracting the\n(A) crude death rate from the crude birth date. (B) crude birth rate from the crude death rate. (C) doubling time from the crude birth rate. (D) fertility rate from the crude death rate.\nA:  (A)\n\nQ: Which of the following countries is actively trying to preserve the purity of their native language from contamination by English or other languages?\n(A) Italy (B) Russia (C) Japan (D) Brazil\nA: ",
        {
          "until": [
            "</s>"
          ]
        }
      ]
    ],
    "resps": [
      [
        "(B)"
      ]
    ],
    "filtered_resps": [
      "(B)"
    ],
    "exact_match": 0.0
  },
  {
    "doc_id": 82,
    "doc": {
      "question": "If I wanted to ship a small piece of very valuable jewelry to my aunt who lives in Poughkeepsie, which mode of transportation makes the most sense?",
      "subject": "high_school_geography",
      "choices": [
        "Truck",
        "Air",
        "Ship",
        "Railroad"
      ],
      "answer": 1
    },
    "target": "(B)",
    "arguments": [
      [
        "The following are multiple choice questions (with answers) about high school geography.\n\nQ: During the third stage of the demographic transition model, which of the following is true?\n(A) Birth rates increase and population growth rate is less rapid. (B) Birth rates decline and population growth rate is less rapid. (C) Birth rates increase and population growth rate increases. (D) Birth rates decrease and population growth rate increases.\nA:  (B)\n\nQ: The rate of natural increase of a population is found by subtracting the\n(A) crude death rate from the crude birth date. (B) crude birth rate from the crude death rate. (C) doubling time from the crude birth rate. (D) fertility rate from the crude death rate.\nA:  (A)\n\nQ: The practice of hiring a foreign third-party service provider to run an operation is called\n(A) outsourcing. (B) offshoring. (C) maquiladoras. (D) locational interdependence.\nA:  (B)\n\nQ: Which one of the following items is an example of nonmaterial culture?\n(A) Dove soap (B) Dove candy bar (C) Dove symbol (D) A dove (bird)\nA:  (C)\n\nQ: Which of the following statements is NOT accurate regarding the services provided by local governments in the United States?\n(A) Duplication of efforts occurs often. (B) Social problems of the central city spill over into the surrounding residential suburbs. (C) Inefficiency in providing services occurs often. (D) One neighborhood's efforts to reduce pollution are always supported by neighboring communities.\nA:  (D)\n\nQ: If I wanted to ship a small piece of very valuable jewelry to my aunt who lives in Poughkeepsie, which mode of transportation makes the most sense?\n(A) Truck (B) Air (C) Ship (D) Railroad\nA: ",
        {
          "until": [
            "</s>"
          ]
        }
      ]
    ],
    "resps": [
      [
        "(C)"
      ]
    ],
    "filtered_resps": [
      "(C)"
    ],
    "exact_match": 0.0
  },
  {
    "doc_id": 90,
    "doc": {
      "question": "Which of the following entities is a state?",
      "subject": "high_school_geography",
      "choices": [
        "Antarctica",
        "American Samoa",
        "Egypt",
        "Marshall Islands"
      ],
      "answer": 2
    },
    "target": "(C)",
    "arguments": [
      [
        "The following are multiple choice questions (with answers) about high school geography.\n\nQ: The rate of natural increase of a population is found by subtracting the\n(A) crude death rate from the crude birth date. (B) crude birth rate from the crude death rate. (C) doubling time from the crude birth rate. (D) fertility rate from the crude death rate.\nA:  (A)\n\nQ: During the third stage of the demographic transition model, which of the following is true?\n(A) Birth rates increase and population growth rate is less rapid. (B) Birth rates decline and population growth rate is less rapid. (C) Birth rates increase and population growth rate increases. (D) Birth rates decrease and population growth rate increases.\nA:  (B)\n\nQ: Which one of the following items is an example of nonmaterial culture?\n(A) Dove soap (B) Dove candy bar (C) Dove symbol (D) A dove (bird)\nA:  (C)\n\nQ: Which of the following statements is NOT accurate regarding the services provided by local governments in the United States?\n(A) Duplication of efforts occurs often. (B) Social problems of the central city spill over into the surrounding residential suburbs. (C) Inefficiency in providing services occurs often. (D) One neighborhood's efforts to reduce pollution are always supported by neighboring communities.\nA:  (D)\n\nQ: The practice of hiring a foreign third-party service provider to run an operation is called\n(A) outsourcing. (B) offshoring. (C) maquiladoras. (D) locational interdependence.\nA:  (B)\n\nQ: Which of the following entities is a state?\n(A) Antarctica (B) American Samoa (C) Egypt (D) Marshall Islands\nA: ",
        {
          "until": [
            "</s>"
          ]
        }
      ]
    ],
    "resps": [
      [
        "(D)"
      ]
    ],
    "filtered_resps": [
      "(D)"
    ],
    "exact_match": 0.0
  },
  {
    "doc_id": 98,
    "doc": {
      "question": "When we talk about diffusion of a cultural trait, what do we mean by \"hearth\"?",
      "subject": "high_school_geography",
      "choices": [
        "Destination",
        "Origin point",
        "All locations along the diffusion path",
        "Axis point"
      ],
      "answer": 1
    },
    "target": "(B)",
    "arguments": [
      [
        "The following are multiple choice questions (with answers) about high school geography.\n\nQ: The rate of natural increase of a population is found by subtracting the\n(A) crude death rate from the crude birth date. (B) crude birth rate from the crude death rate. (C) doubling time from the crude birth rate. (D) fertility rate from the crude death rate.\nA:  (A)\n\nQ: During the third stage of the demographic transition model, which of the following is true?\n(A) Birth rates increase and population growth rate is less rapid. (B) Birth rates decline and population growth rate is less rapid. (C) Birth rates increase and population growth rate increases. (D) Birth rates decrease and population growth rate increases.\nA:  (B)\n\nQ: Which of the following statements is NOT accurate regarding the services provided by local governments in the United States?\n(A) Duplication of efforts occurs often. (B) Social problems of the central city spill over into the surrounding residential suburbs. (C) Inefficiency in providing services occurs often. (D) One neighborhood's efforts to reduce pollution are always supported by neighboring communities.\nA:  (D)\n\nQ: The practice of hiring a foreign third-party service provider to run an operation is called\n(A) outsourcing. (B) offshoring. (C) maquiladoras. (D) locational interdependence.\nA:  (B)\n\nQ: Which one of the following items is an example of nonmaterial culture?\n(A) Dove soap (B) Dove candy bar (C) Dove symbol (D) A dove (bird)\nA:  (C)\n\nQ: When we talk about diffusion of a cultural trait, what do we mean by \"hearth\"?\n(A) Destination (B) Origin point (C) All locations along the diffusion path (D) Axis point\nA: ",
        {
          "until": [
            "</s>"
          ]
        }
      ]
    ],
    "resps": [
      [
        "(C)"
      ]
    ],
    "filtered_resps": [
      "(C)"
    ],
    "exact_match": 0.0
  },
  {
    "doc_id": 106,
    "doc": {
      "question": "The purpose for the creation of NATO was to",
      "subject": "high_school_geography",
      "choices": [
        "defend North America and Western Europe against the threat of communism.",
        "form an economic alliance for trade between Europe and North America.",
        "defend Europe against a second Nazi invasion.",
        "defend northern Europe against Chinese missiles."
      ],
      "answer": 0
    },
    "target": "(A)",
    "arguments": [
      [
        "The following are multiple choice questions (with answers) about high school geography.\n\nQ: The rate of natural increase of a population is found by subtracting the\n(A) crude death rate from the crude birth date. (B) crude birth rate from the crude death rate. (C) doubling time from the crude birth rate. (D) fertility rate from the crude death rate.\nA:  (A)\n\nQ: The practice of hiring a foreign third-party service provider to run an operation is called\n(A) outsourcing. (B) offshoring. (C) maquiladoras. (D) locational interdependence.\nA:  (B)\n\nQ: During the third stage of the demographic transition model, which of the following is true?\n(A) Birth rates increase and population growth rate is less rapid. (B) Birth rates decline and population growth rate is less rapid. (C) Birth rates increase and population growth rate increases. (D) Birth rates decrease and population growth rate increases.\nA:  (B)\n\nQ: Which one of the following items is an example of nonmaterial culture?\n(A) Dove soap (B) Dove candy bar (C) Dove symbol (D) A dove (bird)\nA:  (C)\n\nQ: Which of the following statements is NOT accurate regarding the services provided by local governments in the United States?\n(A) Duplication of efforts occurs often. (B) Social problems of the central city spill over into the surrounding residential suburbs. (C) Inefficiency in providing services occurs often. (D) One neighborhood's efforts to reduce pollution are always supported by neighboring communities.\nA:  (D)\n\nQ: The purpose for the creation of NATO was to\n(A) defend North America and Western Europe against the threat of communism. (B) form an economic alliance for trade between Europe and North America. (C) defend Europe against a second Nazi invasion. (D) defend northern Europe against Chinese missiles.\nA: ",
        {
          "until": [
            "</s>"
          ]
        }
      ]
    ],
    "resps": [
      [
        "(A)"
      ]
    ],
    "filtered_resps": [
      "(A)"
    ],
    "exact_match": 1.0
  },
  {
    "doc_id": 114,
    "doc": {
      "question": "The migration streams into the United States between 1980 and the present have been primarily composed of emigrants from which of the following regions?",
      "subject": "high_school_geography",
      "choices": [
        "Europe and North Africa",
        "Asia and Latin America",
        "Sub-Saharan Africa and Oceania",
        "Central Europe and Australia"
      ],
      "answer": 1
    },
    "target": "(B)",
    "arguments": [
      [
        "The following are multiple choice questions (with answers) about high school geography.\n\nQ: Which of the following statements is NOT accurate regarding the services provided by local governments in the United States?\n(A) Duplication of efforts occurs often. (B) Social problems of the central city spill over into the surrounding residential suburbs. (C) Inefficiency in providing services occurs often. (D) One neighborhood's efforts to reduce pollution are always supported by neighboring communities.\nA:  (D)\n\nQ: During the third stage of the demographic transition model, which of the following is true?\n(A) Birth rates increase and population growth rate is less rapid. (B) Birth rates decline and population growth rate is less rapid. (C) Birth rates increase and population growth rate increases. (D) Birth rates decrease and population growth rate increases.\nA:  (B)\n\nQ: The practice of hiring a foreign third-party service provider to run an operation is called\n(A) outsourcing. (B) offshoring. (C) maquiladoras. (D) locational interdependence.\nA:  (B)\n\nQ: The rate of natural increase of a population is found by subtracting the\n(A) crude death rate from the crude birth date. (B) crude birth rate from the crude death rate. (C) doubling time from the crude birth rate. (D) fertility rate from the crude death rate.\nA:  (A)\n\nQ: Which one of the following items is an example of nonmaterial culture?\n(A) Dove soap (B) Dove candy bar (C) Dove symbol (D) A dove (bird)\nA:  (C)\n\nQ: The migration streams into the United States between 1980 and the present have been primarily composed of emigrants from which of the following regions?\n(A) Europe and North Africa (B) Asia and Latin America (C) Sub-Saharan Africa and Oceania (D) Central Europe and Australia\nA: ",
        {
          "until": [
            "</s>"
          ]
        }
      ]
    ],
    "resps": [
      [
        "(B)<0x0A><0x0A>"
      ]
    ],
    "filtered_resps": [
      "(B)<0x0A><0x0A>"
    ],
    "exact_match": 0.0
  },
  {
    "doc_id": 122,
    "doc": {
      "question": "Historically, the world's major languages have spread by all of the following methods EXCEPT",
      "subject": "high_school_geography",
      "choices": [
        "Sanskrit records.",
        "migration.",
        "trade.",
        "conquest."
      ],
      "answer": 0
    },
    "target": "(A)",
    "arguments": [
      [
        "The following are multiple choice questions (with answers) about high school geography.\n\nQ: The rate of natural increase of a population is found by subtracting the\n(A) crude death rate from the crude birth date. (B) crude birth rate from the crude death rate. (C) doubling time from the crude birth rate. (D) fertility rate from the crude death rate.\nA:  (A)\n\nQ: The practice of hiring a foreign third-party service provider to run an operation is called\n(A) outsourcing. (B) offshoring. (C) maquiladoras. (D) locational interdependence.\nA:  (B)\n\nQ: During the third stage of the demographic transition model, which of the following is true?\n(A) Birth rates increase and population growth rate is less rapid. (B) Birth rates decline and population growth rate is less rapid. (C) Birth rates increase and population growth rate increases. (D) Birth rates decrease and population growth rate increases.\nA:  (B)\n\nQ: Which of the following statements is NOT accurate regarding the services provided by local governments in the United States?\n(A) Duplication of efforts occurs often. (B) Social problems of the central city spill over into the surrounding residential suburbs. (C) Inefficiency in providing services occurs often. (D) One neighborhood's efforts to reduce pollution are always supported by neighboring communities.\nA:  (D)\n\nQ: Which one of the following items is an example of nonmaterial culture?\n(A) Dove soap (B) Dove candy bar (C) Dove symbol (D) A dove (bird)\nA:  (C)\n\nQ: Historically, the world's major languages have spread by all of the following methods EXCEPT\n(A) Sanskrit records. (B) migration. (C) trade. (D) conquest.\nA: ",
        {
          "until": [
            "</s>"
          ]
        }
      ]
    ],
    "resps": [
      [
        "(B)"
      ]
    ],
    "filtered_resps": [
      "(B)"
    ],
    "exact_match": 0.0
  },
  {
    "doc_id": 130,
    "doc": {
      "question": "Which of the following countries is situated in the region of tectonic activity known as the Pacific Ring of Fire?",
      "subject": "high_school_geography",
      "choices": [
        "Brazil",
        "Australia",
        "Chile",
        "India"
      ],
      "answer": 2
    },
    "target": "(C)",
    "arguments": [
      [
        "The following are multiple choice questions (with answers) about high school geography.\n\nQ: Which one of the following items is an example of nonmaterial culture?\n(A) Dove soap (B) Dove candy bar (C) Dove symbol (D) A dove (bird)\nA:  (C)\n\nQ: The practice of hiring a foreign third-party service provider to run an operation is called\n(A) outsourcing. (B) offshoring. (C) maquiladoras. (D) locational interdependence.\nA:  (B)\n\nQ: During the third stage of the demographic transition model, which of the following is true?\n(A) Birth rates increase and population growth rate is less rapid. (B) Birth rates decline and population growth rate is less rapid. (C) Birth rates increase and population growth rate increases. (D) Birth rates decrease and population growth rate increases.\nA:  (B)\n\nQ: The rate of natural increase of a population is found by subtracting the\n(A) crude death rate from the crude birth date. (B) crude birth rate from the crude death rate. (C) doubling time from the crude birth rate. (D) fertility rate from the crude death rate.\nA:  (A)\n\nQ: Which of the following statements is NOT accurate regarding the services provided by local governments in the United States?\n(A) Duplication of efforts occurs often. (B) Social problems of the central city spill over into the surrounding residential suburbs. (C) Inefficiency in providing services occurs often. (D) One neighborhood's efforts to reduce pollution are always supported by neighboring communities.\nA:  (D)\n\nQ: Which of the following countries is situated in the region of tectonic activity known as the Pacific Ring of Fire?\n(A) Brazil (B) Australia (C) Chile (D) India\nA: ",
        {
          "until": [
            "</s>"
          ]
        }
      ]
    ],
    "resps": [
      [
        "(D)"
      ]
    ],
    "filtered_resps": [
      "(D)"
    ],
    "exact_match": 0.0
  },
  {
    "doc_id": 138,
    "doc": {
      "question": "Mary lives in a neighborhood with stores, offices, and restaurants so close that she does not need to own a car; however, she feels she has very little privacy. This is an example of a(n)",
      "subject": "high_school_geography",
      "choices": [
        "win-win.",
        "trade-off.",
        "infill.",
        "leapfrog development."
      ],
      "answer": 1
    },
    "target": "(B)",
    "arguments": [
      [
        "The following are multiple choice questions (with answers) about high school geography.\n\nQ: Which one of the following items is an example of nonmaterial culture?\n(A) Dove soap (B) Dove candy bar (C) Dove symbol (D) A dove (bird)\nA:  (C)\n\nQ: During the third stage of the demographic transition model, which of the following is true?\n(A) Birth rates increase and population growth rate is less rapid. (B) Birth rates decline and population growth rate is less rapid. (C) Birth rates increase and population growth rate increases. (D) Birth rates decrease and population growth rate increases.\nA:  (B)\n\nQ: The practice of hiring a foreign third-party service provider to run an operation is called\n(A) outsourcing. (B) offshoring. (C) maquiladoras. (D) locational interdependence.\nA:  (B)\n\nQ: Which of the following statements is NOT accurate regarding the services provided by local governments in the United States?\n(A) Duplication of efforts occurs often. (B) Social problems of the central city spill over into the surrounding residential suburbs. (C) Inefficiency in providing services occurs often. (D) One neighborhood's efforts to reduce pollution are always supported by neighboring communities.\nA:  (D)\n\nQ: The rate of natural increase of a population is found by subtracting the\n(A) crude death rate from the crude birth date. (B) crude birth rate from the crude death rate. (C) doubling time from the crude birth rate. (D) fertility rate from the crude death rate.\nA:  (A)\n\nQ: Mary lives in a neighborhood with stores, offices, and restaurants so close that she does not need to own a car; however, she feels she has very little privacy. This is an example of a(n)\n(A) win-win. (B) trade-off. (C) infill. (D) leapfrog development.\nA: ",
        {
          "until": [
            "</s>"
          ]
        }
      ]
    ],
    "resps": [
      [
        "(B)"
      ]
    ],
    "filtered_resps": [
      "(B)"
    ],
    "exact_match": 1.0
  },
  {
    "doc_id": 146,
    "doc": {
      "question": "Opponents of genetically modified organisms (GMOs) in food are afraid that the GMOs",
      "subject": "high_school_geography",
      "choices": [
        "will hinder global trade.",
        "make plants more resistant to disease.",
        "may cause irreversible changes in humans.",
        "make plants more resistant to drought."
      ],
      "answer": 2
    },
    "target": "(C)",
    "arguments": [
      [
        "The following are multiple choice questions (with answers) about high school geography.\n\nQ: Which of the following statements is NOT accurate regarding the services provided by local governments in the United States?\n(A) Duplication of efforts occurs often. (B) Social problems of the central city spill over into the surrounding residential suburbs. (C) Inefficiency in providing services occurs often. (D) One neighborhood's efforts to reduce pollution are always supported by neighboring communities.\nA:  (D)\n\nQ: The rate of natural increase of a population is found by subtracting the\n(A) crude death rate from the crude birth date. (B) crude birth rate from the crude death rate. (C) doubling time from the crude birth rate. (D) fertility rate from the crude death rate.\nA:  (A)\n\nQ: The practice of hiring a foreign third-party service provider to run an operation is called\n(A) outsourcing. (B) offshoring. (C) maquiladoras. (D) locational interdependence.\nA:  (B)\n\nQ: During the third stage of the demographic transition model, which of the following is true?\n(A) Birth rates increase and population growth rate is less rapid. (B) Birth rates decline and population growth rate is less rapid. (C) Birth rates increase and population growth rate increases. (D) Birth rates decrease and population growth rate increases.\nA:  (B)\n\nQ: Which one of the following items is an example of nonmaterial culture?\n(A) Dove soap (B) Dove candy bar (C) Dove symbol (D) A dove (bird)\nA:  (C)\n\nQ: Opponents of genetically modified organisms (GMOs) in food are afraid that the GMOs\n(A) will hinder global trade. (B) make plants more resistant to disease. (C) may cause irreversible changes in humans. (D) make plants more resistant to drought.\nA: ",
        {
          "until": [
            "</s>"
          ]
        }
      ]
    ],
    "resps": [
      [
        "(B)<0x0A><0x0A>"
      ]
    ],
    "filtered_resps": [
      "(B)<0x0A><0x0A>"
    ],
    "exact_match": 0.0
  },
  {
    "doc_id": 154,
    "doc": {
      "question": "The process of devolution involves",
      "subject": "high_school_geography",
      "choices": [
        "the change of government from a democracy to a communist dictatorship.",
        "the movement of power from the central government to regional governments in the country.",
        "the movement of power from a monarchy to a military dictatorship.",
        "the movement of power from regional governments to central governments."
      ],
      "answer": 1
    },
    "target": "(B)",
    "arguments": [
      [
        "The following are multiple choice questions (with answers) about high school geography.\n\nQ: The rate of natural increase of a population is found by subtracting the\n(A) crude death rate from the crude birth date. (B) crude birth rate from the crude death rate. (C) doubling time from the crude birth rate. (D) fertility rate from the crude death rate.\nA:  (A)\n\nQ: Which one of the following items is an example of nonmaterial culture?\n(A) Dove soap (B) Dove candy bar (C) Dove symbol (D) A dove (bird)\nA:  (C)\n\nQ: During the third stage of the demographic transition model, which of the following is true?\n(A) Birth rates increase and population growth rate is less rapid. (B) Birth rates decline and population growth rate is less rapid. (C) Birth rates increase and population growth rate increases. (D) Birth rates decrease and population growth rate increases.\nA:  (B)\n\nQ: Which of the following statements is NOT accurate regarding the services provided by local governments in the United States?\n(A) Duplication of efforts occurs often. (B) Social problems of the central city spill over into the surrounding residential suburbs. (C) Inefficiency in providing services occurs often. (D) One neighborhood's efforts to reduce pollution are always supported by neighboring communities.\nA:  (D)\n\nQ: The practice of hiring a foreign third-party service provider to run an operation is called\n(A) outsourcing. (B) offshoring. (C) maquiladoras. (D) locational interdependence.\nA:  (B)\n\nQ: The process of devolution involves\n(A) the change of government from a democracy to a communist dictatorship. (B) the movement of power from the central government to regional governments in the country. (C) the movement of power from a monarchy to a military dictatorship. (D) the movement of power from regional governments to central governments.\nA: ",
        {
          "until": [
            "</s>"
          ]
        }
      ]
    ],
    "resps": [
      [
        "(D)"
      ]
    ],
    "filtered_resps": [
      "(D)"
    ],
    "exact_match": 0.0
  },
  {
    "doc_id": 162,
    "doc": {
      "question": "Which one of the following demographic factors characterizes stages 4 and 5 in the demographic transition model?",
      "subject": "high_school_geography",
      "choices": [
        "Zero population growth",
        "High mortality rates",
        "High birth rates",
        "High sex ratios"
      ],
      "answer": 0
    },
    "target": "(A)",
    "arguments": [
      [
        "The following are multiple choice questions (with answers) about high school geography.\n\nQ: During the third stage of the demographic transition model, which of the following is true?\n(A) Birth rates increase and population growth rate is less rapid. (B) Birth rates decline and population growth rate is less rapid. (C) Birth rates increase and population growth rate increases. (D) Birth rates decrease and population growth rate increases.\nA:  (B)\n\nQ: Which of the following statements is NOT accurate regarding the services provided by local governments in the United States?\n(A) Duplication of efforts occurs often. (B) Social problems of the central city spill over into the surrounding residential suburbs. (C) Inefficiency in providing services occurs often. (D) One neighborhood's efforts to reduce pollution are always supported by neighboring communities.\nA:  (D)\n\nQ: The rate of natural increase of a population is found by subtracting the\n(A) crude death rate from the crude birth date. (B) crude birth rate from the crude death rate. (C) doubling time from the crude birth rate. (D) fertility rate from the crude death rate.\nA:  (A)\n\nQ: The practice of hiring a foreign third-party service provider to run an operation is called\n(A) outsourcing. (B) offshoring. (C) maquiladoras. (D) locational interdependence.\nA:  (B)\n\nQ: Which one of the following items is an example of nonmaterial culture?\n(A) Dove soap (B) Dove candy bar (C) Dove symbol (D) A dove (bird)\nA:  (C)\n\nQ: Which one of the following demographic factors characterizes stages 4 and 5 in the demographic transition model?\n(A) Zero population growth (B) High mortality rates (C) High birth rates (D) High sex ratios\nA: ",
        {
          "until": [
            "</s>"
          ]
        }
      ]
    ],
    "resps": [
      [
        "(C)"
      ]
    ],
    "filtered_resps": [
      "(C)"
    ],
    "exact_match": 0.0
  },
  {
    "doc_id": 170,
    "doc": {
      "question": "Variations in vocabulary, pronunciation, and rhythm in a spoken language are called",
      "subject": "high_school_geography",
      "choices": [
        "syntax.",
        "isoglosses.",
        "lingua francas.",
        "dialects."
      ],
      "answer": 3
    },
    "target": "(D)",
    "arguments": [
      [
        "The following are multiple choice questions (with answers) about high school geography.\n\nQ: During the third stage of the demographic transition model, which of the following is true?\n(A) Birth rates increase and population growth rate is less rapid. (B) Birth rates decline and population growth rate is less rapid. (C) Birth rates increase and population growth rate increases. (D) Birth rates decrease and population growth rate increases.\nA:  (B)\n\nQ: Which of the following statements is NOT accurate regarding the services provided by local governments in the United States?\n(A) Duplication of efforts occurs often. (B) Social problems of the central city spill over into the surrounding residential suburbs. (C) Inefficiency in providing services occurs often. (D) One neighborhood's efforts to reduce pollution are always supported by neighboring communities.\nA:  (D)\n\nQ: Which one of the following items is an example of nonmaterial culture?\n(A) Dove soap (B) Dove candy bar (C) Dove symbol (D) A dove (bird)\nA:  (C)\n\nQ: The rate of natural increase of a population is found by subtracting the\n(A) crude death rate from the crude birth date. (B) crude birth rate from the crude death rate. (C) doubling time from the crude birth rate. (D) fertility rate from the crude death rate.\nA:  (A)\n\nQ: The practice of hiring a foreign third-party service provider to run an operation is called\n(A) outsourcing. (B) offshoring. (C) maquiladoras. (D) locational interdependence.\nA:  (B)\n\nQ: Variations in vocabulary, pronunciation, and rhythm in a spoken language are called\n(A) syntax. (B) isoglosses. (C) lingua francas. (D) dialects.\nA: ",
        {
          "until": [
            "</s>"
          ]
        }
      ]
    ],
    "resps": [
      [
        "(D)"
      ]
    ],
    "filtered_resps": [
      "(D)"
    ],
    "exact_match": 1.0
  },
  {
    "doc_id": 178,
    "doc": {
      "question": "Zero population growth (ZPG) is achieved when",
      "subject": "high_school_geography",
      "choices": [
        "CBR \u2013 CDR 5 2.",
        "Births 1 immigration 5 deaths 1 emigration.",
        "Total fertility 5 3.",
        "Replacement fertility is achieved."
      ],
      "answer": 1
    },
    "target": "(B)",
    "arguments": [
      [
        "The following are multiple choice questions (with answers) about high school geography.\n\nQ: The practice of hiring a foreign third-party service provider to run an operation is called\n(A) outsourcing. (B) offshoring. (C) maquiladoras. (D) locational interdependence.\nA:  (B)\n\nQ: During the third stage of the demographic transition model, which of the following is true?\n(A) Birth rates increase and population growth rate is less rapid. (B) Birth rates decline and population growth rate is less rapid. (C) Birth rates increase and population growth rate increases. (D) Birth rates decrease and population growth rate increases.\nA:  (B)\n\nQ: The rate of natural increase of a population is found by subtracting the\n(A) crude death rate from the crude birth date. (B) crude birth rate from the crude death rate. (C) doubling time from the crude birth rate. (D) fertility rate from the crude death rate.\nA:  (A)\n\nQ: Which one of the following items is an example of nonmaterial culture?\n(A) Dove soap (B) Dove candy bar (C) Dove symbol (D) A dove (bird)\nA:  (C)\n\nQ: Which of the following statements is NOT accurate regarding the services provided by local governments in the United States?\n(A) Duplication of efforts occurs often. (B) Social problems of the central city spill over into the surrounding residential suburbs. (C) Inefficiency in providing services occurs often. (D) One neighborhood's efforts to reduce pollution are always supported by neighboring communities.\nA:  (D)\n\nQ: Zero population growth (ZPG) is achieved when\n(A) CBR \u2013 CDR 5 2. (B) Births 1 immigration 5 deaths 1 emigration. (C) Total fertility 5 3. (D) Replacement fertility is achieved.\nA: ",
        {
          "until": [
            "</s>"
          ]
        }
      ]
    ],
    "resps": [
      [
        "(D)"
      ]
    ],
    "filtered_resps": [
      "(D)"
    ],
    "exact_match": 0.0
  },
  {
    "doc_id": 186,
    "doc": {
      "question": "Which of the following statements is true concerning folklore?",
      "subject": "high_school_geography",
      "choices": [
        "It is the written tradition of a group.",
        "It encourages changing the old values and customs.",
        "It serves to blend all cultures into one.",
        "It expresses in words the shared values of a group by expressing their ideals."
      ],
      "answer": 3
    },
    "target": "(D)",
    "arguments": [
      [
        "The following are multiple choice questions (with answers) about high school geography.\n\nQ: During the third stage of the demographic transition model, which of the following is true?\n(A) Birth rates increase and population growth rate is less rapid. (B) Birth rates decline and population growth rate is less rapid. (C) Birth rates increase and population growth rate increases. (D) Birth rates decrease and population growth rate increases.\nA:  (B)\n\nQ: The rate of natural increase of a population is found by subtracting the\n(A) crude death rate from the crude birth date. (B) crude birth rate from the crude death rate. (C) doubling time from the crude birth rate. (D) fertility rate from the crude death rate.\nA:  (A)\n\nQ: Which of the following statements is NOT accurate regarding the services provided by local governments in the United States?\n(A) Duplication of efforts occurs often. (B) Social problems of the central city spill over into the surrounding residential suburbs. (C) Inefficiency in providing services occurs often. (D) One neighborhood's efforts to reduce pollution are always supported by neighboring communities.\nA:  (D)\n\nQ: Which one of the following items is an example of nonmaterial culture?\n(A) Dove soap (B) Dove candy bar (C) Dove symbol (D) A dove (bird)\nA:  (C)\n\nQ: The practice of hiring a foreign third-party service provider to run an operation is called\n(A) outsourcing. (B) offshoring. (C) maquiladoras. (D) locational interdependence.\nA:  (B)\n\nQ: Which of the following statements is true concerning folklore?\n(A) It is the written tradition of a group. (B) It encourages changing the old values and customs. (C) It serves to blend all cultures into one. (D) It expresses in words the shared values of a group by expressing their ideals.\nA: ",
        {
          "until": [
            "</s>"
          ]
        }
      ]
    ],
    "resps": [
      [
        "(A)"
      ]
    ],
    "filtered_resps": [
      "(A)"
    ],
    "exact_match": 0.0
  },
  {
    "doc_id": 194,
    "doc": {
      "question": "The largest exporter of agricultural goods in the world is",
      "subject": "high_school_geography",
      "choices": [
        "China.",
        "Mexico.",
        "Chile.",
        "the United States."
      ],
      "answer": 3
    },
    "target": "(D)",
    "arguments": [
      [
        "The following are multiple choice questions (with answers) about high school geography.\n\nQ: The practice of hiring a foreign third-party service provider to run an operation is called\n(A) outsourcing. (B) offshoring. (C) maquiladoras. (D) locational interdependence.\nA:  (B)\n\nQ: The rate of natural increase of a population is found by subtracting the\n(A) crude death rate from the crude birth date. (B) crude birth rate from the crude death rate. (C) doubling time from the crude birth rate. (D) fertility rate from the crude death rate.\nA:  (A)\n\nQ: Which of the following statements is NOT accurate regarding the services provided by local governments in the United States?\n(A) Duplication of efforts occurs often. (B) Social problems of the central city spill over into the surrounding residential suburbs. (C) Inefficiency in providing services occurs often. (D) One neighborhood's efforts to reduce pollution are always supported by neighboring communities.\nA:  (D)\n\nQ: During the third stage of the demographic transition model, which of the following is true?\n(A) Birth rates increase and population growth rate is less rapid. (B) Birth rates decline and population growth rate is less rapid. (C) Birth rates increase and population growth rate increases. (D) Birth rates decrease and population growth rate increases.\nA:  (B)\n\nQ: Which one of the following items is an example of nonmaterial culture?\n(A) Dove soap (B) Dove candy bar (C) Dove symbol (D) A dove (bird)\nA:  (C)\n\nQ: The largest exporter of agricultural goods in the world is\n(A) China. (B) Mexico. (C) Chile. (D) the United States.\nA: ",
        {
          "until": [
            "</s>"
          ]
        }
      ]
    ],
    "resps": [
      [
        "(A)<0x0A><0x0A>"
      ]
    ],
    "filtered_resps": [
      "(A)<0x0A><0x0A>"
    ],
    "exact_match": 0.0
  },
  {
    "doc_id": 3,
    "doc": {
      "question": "Which zone contains low-income slums, ethnic ghettos, and general deterioration in Burgess's concentric zone model of urban form?",
      "subject": "high_school_geography",
      "choices": [
        "First",
        "Second",
        "Third",
        "Fourth"
      ],
      "answer": 0
    },
    "target": "(A)",
    "arguments": [
      [
        "The following are multiple choice questions (with answers) about high school geography.\n\nQ: The practice of hiring a foreign third-party service provider to run an operation is called\n(A) outsourcing. (B) offshoring. (C) maquiladoras. (D) locational interdependence.\nA:  (B)\n\nQ: The rate of natural increase of a population is found by subtracting the\n(A) crude death rate from the crude birth date. (B) crude birth rate from the crude death rate. (C) doubling time from the crude birth rate. (D) fertility rate from the crude death rate.\nA:  (A)\n\nQ: Which one of the following items is an example of nonmaterial culture?\n(A) Dove soap (B) Dove candy bar (C) Dove symbol (D) A dove (bird)\nA:  (C)\n\nQ: Which of the following statements is NOT accurate regarding the services provided by local governments in the United States?\n(A) Duplication of efforts occurs often. (B) Social problems of the central city spill over into the surrounding residential suburbs. (C) Inefficiency in providing services occurs often. (D) One neighborhood's efforts to reduce pollution are always supported by neighboring communities.\nA:  (D)\n\nQ: During the third stage of the demographic transition model, which of the following is true?\n(A) Birth rates increase and population growth rate is less rapid. (B) Birth rates decline and population growth rate is less rapid. (C) Birth rates increase and population growth rate increases. (D) Birth rates decrease and population growth rate increases.\nA:  (B)\n\nQ: Which zone contains low-income slums, ethnic ghettos, and general deterioration in Burgess's concentric zone model of urban form?\n(A) First (B) Second (C) Third (D) Fourth\nA: ",
        {
          "until": [
            "</s>"
          ]
        }
      ]
    ],
    "resps": [
      [
        "(D)"
      ]
    ],
    "filtered_resps": [
      "(D)"
    ],
    "exact_match": 0.0
  },
  {
    "doc_id": 11,
    "doc": {
      "question": "What is the population statistic that tells us the level of fertility at which a population will have just enough births to replace parents and compensate for early deaths?",
      "subject": "high_school_geography",
      "choices": [
        "Crude birth rate",
        "Replacement level",
        "Mortality rate",
        "Total fertility rate"
      ],
      "answer": 1
    },
    "target": "(B)",
    "arguments": [
      [
        "The following are multiple choice questions (with answers) about high school geography.\n\nQ: The rate of natural increase of a population is found by subtracting the\n(A) crude death rate from the crude birth date. (B) crude birth rate from the crude death rate. (C) doubling time from the crude birth rate. (D) fertility rate from the crude death rate.\nA:  (A)\n\nQ: Which one of the following items is an example of nonmaterial culture?\n(A) Dove soap (B) Dove candy bar (C) Dove symbol (D) A dove (bird)\nA:  (C)\n\nQ: During the third stage of the demographic transition model, which of the following is true?\n(A) Birth rates increase and population growth rate is less rapid. (B) Birth rates decline and population growth rate is less rapid. (C) Birth rates increase and population growth rate increases. (D) Birth rates decrease and population growth rate increases.\nA:  (B)\n\nQ: The practice of hiring a foreign third-party service provider to run an operation is called\n(A) outsourcing. (B) offshoring. (C) maquiladoras. (D) locational interdependence.\nA:  (B)\n\nQ: Which of the following statements is NOT accurate regarding the services provided by local governments in the United States?\n(A) Duplication of efforts occurs often. (B) Social problems of the central city spill over into the surrounding residential suburbs. (C) Inefficiency in providing services occurs often. (D) One neighborhood's efforts to reduce pollution are always supported by neighboring communities.\nA:  (D)\n\nQ: What is the population statistic that tells us the level of fertility at which a population will have just enough births to replace parents and compensate for early deaths?\n(A) Crude birth rate (B) Replacement level (C) Mortality rate (D) Total fertility rate\nA: ",
        {
          "until": [
            "</s>"
          ]
        }
      ]
    ],
    "resps": [
      [
        "(D)"
      ]
    ],
    "filtered_resps": [
      "(D)"
    ],
    "exact_match": 0.0
  },
  {
    "doc_id": 19,
    "doc": {
      "question": "The latitude and longitude coordinates of a place are an example of",
      "subject": "high_school_geography",
      "choices": [
        "a formal region.",
        "a functional region.",
        "an absolute location.",
        "a relative location."
      ],
      "answer": 2
    },
    "target": "(C)",
    "arguments": [
      [
        "The following are multiple choice questions (with answers) about high school geography.\n\nQ: The rate of natural increase of a population is found by subtracting the\n(A) crude death rate from the crude birth date. (B) crude birth rate from the crude death rate. (C) doubling time from the crude birth rate. (D) fertility rate from the crude death rate.\nA:  (A)\n\nQ: Which one of the following items is an example of nonmaterial culture?\n(A) Dove soap (B) Dove candy bar (C) Dove symbol (D) A dove (bird)\nA:  (C)\n\nQ: During the third stage of the demographic transition model, which of the following is true?\n(A) Birth rates increase and population growth rate is less rapid. (B) Birth rates decline and population growth rate is less rapid. (C) Birth rates increase and population growth rate increases. (D) Birth rates decrease and population growth rate increases.\nA:  (B)\n\nQ: Which of the following statements is NOT accurate regarding the services provided by local governments in the United States?\n(A) Duplication of efforts occurs often. (B) Social problems of the central city spill over into the surrounding residential suburbs. (C) Inefficiency in providing services occurs often. (D) One neighborhood's efforts to reduce pollution are always supported by neighboring communities.\nA:  (D)\n\nQ: The practice of hiring a foreign third-party service provider to run an operation is called\n(A) outsourcing. (B) offshoring. (C) maquiladoras. (D) locational interdependence.\nA:  (B)\n\nQ: The latitude and longitude coordinates of a place are an example of\n(A) a formal region. (B) a functional region. (C) an absolute location. (D) a relative location.\nA: ",
        {
          "until": [
            "</s>"
          ]
        }
      ]
    ],
    "resps": [
      [
        "(D)"
      ]
    ],
    "filtered_resps": [
      "(D)"
    ],
    "exact_match": 0.0
  },
  {
    "doc_id": 27,
    "doc": {
      "question": "A population pyramid, or age-sex structure, displays all the following information about a country's population EXCEPT",
      "subject": "high_school_geography",
      "choices": [
        "future social spending needs of the population.",
        "the impact of \"baby booms\" on the population.",
        "the impact of wars on the population.",
        "a quick visual depiction of the country's demographics."
      ],
      "answer": 1
    },
    "target": "(B)",
    "arguments": [
      [
        "The following are multiple choice questions (with answers) about high school geography.\n\nQ: During the third stage of the demographic transition model, which of the following is true?\n(A) Birth rates increase and population growth rate is less rapid. (B) Birth rates decline and population growth rate is less rapid. (C) Birth rates increase and population growth rate increases. (D) Birth rates decrease and population growth rate increases.\nA:  (B)\n\nQ: The rate of natural increase of a population is found by subtracting the\n(A) crude death rate from the crude birth date. (B) crude birth rate from the crude death rate. (C) doubling time from the crude birth rate. (D) fertility rate from the crude death rate.\nA:  (A)\n\nQ: The practice of hiring a foreign third-party service provider to run an operation is called\n(A) outsourcing. (B) offshoring. (C) maquiladoras. (D) locational interdependence.\nA:  (B)\n\nQ: Which of the following statements is NOT accurate regarding the services provided by local governments in the United States?\n(A) Duplication of efforts occurs often. (B) Social problems of the central city spill over into the surrounding residential suburbs. (C) Inefficiency in providing services occurs often. (D) One neighborhood's efforts to reduce pollution are always supported by neighboring communities.\nA:  (D)\n\nQ: Which one of the following items is an example of nonmaterial culture?\n(A) Dove soap (B) Dove candy bar (C) Dove symbol (D) A dove (bird)\nA:  (C)\n\nQ: A population pyramid, or age-sex structure, displays all the following information about a country's population EXCEPT\n(A) future social spending needs of the population. (B) the impact of \"baby booms\" on the population. (C) the impact of wars on the population. (D) a quick visual depiction of the country's demographics.\nA: ",
        {
          "until": [
            "</s>"
          ]
        }
      ]
    ],
    "resps": [
      [
        "(D)"
      ]
    ],
    "filtered_resps": [
      "(D)"
    ],
    "exact_match": 0.0
  },
  {
    "doc_id": 35,
    "doc": {
      "question": "One of the effects of the east\u2013west orientation of the Alpine mountain system and the northern plains of western and central Europe is that it",
      "subject": "high_school_geography",
      "choices": [
        "limits the marine climate of Europe to coastal areas",
        "provides a corridor for communication between southern and northern Europe",
        "enables marine-like climatic conditions to extend eastward into Germany and Poland",
        "effectively prevents population movement between parts of the Mediterranean region"
      ],
      "answer": 2
    },
    "target": "(C)",
    "arguments": [
      [
        "The following are multiple choice questions (with answers) about high school geography.\n\nQ: Which one of the following items is an example of nonmaterial culture?\n(A) Dove soap (B) Dove candy bar (C) Dove symbol (D) A dove (bird)\nA:  (C)\n\nQ: The practice of hiring a foreign third-party service provider to run an operation is called\n(A) outsourcing. (B) offshoring. (C) maquiladoras. (D) locational interdependence.\nA:  (B)\n\nQ: The rate of natural increase of a population is found by subtracting the\n(A) crude death rate from the crude birth date. (B) crude birth rate from the crude death rate. (C) doubling time from the crude birth rate. (D) fertility rate from the crude death rate.\nA:  (A)\n\nQ: Which of the following statements is NOT accurate regarding the services provided by local governments in the United States?\n(A) Duplication of efforts occurs often. (B) Social problems of the central city spill over into the surrounding residential suburbs. (C) Inefficiency in providing services occurs often. (D) One neighborhood's efforts to reduce pollution are always supported by neighboring communities.\nA:  (D)\n\nQ: During the third stage of the demographic transition model, which of the following is true?\n(A) Birth rates increase and population growth rate is less rapid. (B) Birth rates decline and population growth rate is less rapid. (C) Birth rates increase and population growth rate increases. (D) Birth rates decrease and population growth rate increases.\nA:  (B)\n\nQ: One of the effects of the east\u2013west orientation of the Alpine mountain system and the northern plains of western and central Europe is that it\n(A) limits the marine climate of Europe to coastal areas (B) provides a corridor for communication between southern and northern Europe (C) enables marine-like climatic conditions to extend eastward into Germany and Poland (D) effectively prevents population movement between parts of the Mediterranean region\nA: ",
        {
          "until": [
            "</s>"
          ]
        }
      ]
    ],
    "resps": [
      [
        "(B)"
      ]
    ],
    "filtered_resps": [
      "(B)"
    ],
    "exact_match": 0.0
  },
  {
    "doc_id": 43,
    "doc": {
      "question": "Which of the following could be considered a higher-order central place function?",
      "subject": "high_school_geography",
      "choices": [
        "Winn-Dixie grocery store",
        "Mercedes-Benz dealership",
        "Shoe store",
        "Family doctor"
      ],
      "answer": 1
    },
    "target": "(B)",
    "arguments": [
      [
        "The following are multiple choice questions (with answers) about high school geography.\n\nQ: The rate of natural increase of a population is found by subtracting the\n(A) crude death rate from the crude birth date. (B) crude birth rate from the crude death rate. (C) doubling time from the crude birth rate. (D) fertility rate from the crude death rate.\nA:  (A)\n\nQ: Which one of the following items is an example of nonmaterial culture?\n(A) Dove soap (B) Dove candy bar (C) Dove symbol (D) A dove (bird)\nA:  (C)\n\nQ: Which of the following statements is NOT accurate regarding the services provided by local governments in the United States?\n(A) Duplication of efforts occurs often. (B) Social problems of the central city spill over into the surrounding residential suburbs. (C) Inefficiency in providing services occurs often. (D) One neighborhood's efforts to reduce pollution are always supported by neighboring communities.\nA:  (D)\n\nQ: The practice of hiring a foreign third-party service provider to run an operation is called\n(A) outsourcing. (B) offshoring. (C) maquiladoras. (D) locational interdependence.\nA:  (B)\n\nQ: During the third stage of the demographic transition model, which of the following is true?\n(A) Birth rates increase and population growth rate is less rapid. (B) Birth rates decline and population growth rate is less rapid. (C) Birth rates increase and population growth rate increases. (D) Birth rates decrease and population growth rate increases.\nA:  (B)\n\nQ: Which of the following could be considered a higher-order central place function?\n(A) Winn-Dixie grocery store (B) Mercedes-Benz dealership (C) Shoe store (D) Family doctor\nA: ",
        {
          "until": [
            "</s>"
          ]
        }
      ]
    ],
    "resps": [
      [
        "(B)"
      ]
    ],
    "filtered_resps": [
      "(B)"
    ],
    "exact_match": 1.0
  },
  {
    "doc_id": 51,
    "doc": {
      "question": "Regions share all of these characteristics EXCEPT",
      "subject": "high_school_geography",
      "choices": [
        "boundaries.",
        "common features.",
        "relative location.",
        "easily defined."
      ],
      "answer": 3
    },
    "target": "(D)",
    "arguments": [
      [
        "The following are multiple choice questions (with answers) about high school geography.\n\nQ: Which one of the following items is an example of nonmaterial culture?\n(A) Dove soap (B) Dove candy bar (C) Dove symbol (D) A dove (bird)\nA:  (C)\n\nQ: The rate of natural increase of a population is found by subtracting the\n(A) crude death rate from the crude birth date. (B) crude birth rate from the crude death rate. (C) doubling time from the crude birth rate. (D) fertility rate from the crude death rate.\nA:  (A)\n\nQ: Which of the following statements is NOT accurate regarding the services provided by local governments in the United States?\n(A) Duplication of efforts occurs often. (B) Social problems of the central city spill over into the surrounding residential suburbs. (C) Inefficiency in providing services occurs often. (D) One neighborhood's efforts to reduce pollution are always supported by neighboring communities.\nA:  (D)\n\nQ: During the third stage of the demographic transition model, which of the following is true?\n(A) Birth rates increase and population growth rate is less rapid. (B) Birth rates decline and population growth rate is less rapid. (C) Birth rates increase and population growth rate increases. (D) Birth rates decrease and population growth rate increases.\nA:  (B)\n\nQ: The practice of hiring a foreign third-party service provider to run an operation is called\n(A) outsourcing. (B) offshoring. (C) maquiladoras. (D) locational interdependence.\nA:  (B)\n\nQ: Regions share all of these characteristics EXCEPT\n(A) boundaries. (B) common features. (C) relative location. (D) easily defined.\nA: ",
        {
          "until": [
            "</s>"
          ]
        }
      ]
    ],
    "resps": [
      [
        "(C)"
      ]
    ],
    "filtered_resps": [
      "(C)"
    ],
    "exact_match": 0.0
  },
  {
    "doc_id": 59,
    "doc": {
      "question": "Which of the following best illustrates the definition of a functional region?",
      "subject": "high_school_geography",
      "choices": [
        "A map showing Atlanta as a hub for Delta Airlines",
        "An article describing the region referred to as the South",
        "A map showing North Carolina's one hundred counties",
        "An essay explaining the region known as the Bible Belt"
      ],
      "answer": 0
    },
    "target": "(A)",
    "arguments": [
      [
        "The following are multiple choice questions (with answers) about high school geography.\n\nQ: Which of the following statements is NOT accurate regarding the services provided by local governments in the United States?\n(A) Duplication of efforts occurs often. (B) Social problems of the central city spill over into the surrounding residential suburbs. (C) Inefficiency in providing services occurs often. (D) One neighborhood's efforts to reduce pollution are always supported by neighboring communities.\nA:  (D)\n\nQ: Which one of the following items is an example of nonmaterial culture?\n(A) Dove soap (B) Dove candy bar (C) Dove symbol (D) A dove (bird)\nA:  (C)\n\nQ: The rate of natural increase of a population is found by subtracting the\n(A) crude death rate from the crude birth date. (B) crude birth rate from the crude death rate. (C) doubling time from the crude birth rate. (D) fertility rate from the crude death rate.\nA:  (A)\n\nQ: The practice of hiring a foreign third-party service provider to run an operation is called\n(A) outsourcing. (B) offshoring. (C) maquiladoras. (D) locational interdependence.\nA:  (B)\n\nQ: During the third stage of the demographic transition model, which of the following is true?\n(A) Birth rates increase and population growth rate is less rapid. (B) Birth rates decline and population growth rate is less rapid. (C) Birth rates increase and population growth rate increases. (D) Birth rates decrease and population growth rate increases.\nA:  (B)\n\nQ: Which of the following best illustrates the definition of a functional region?\n(A) A map showing Atlanta as a hub for Delta Airlines (B) An article describing the region referred to as the South (C) A map showing North Carolina's one hundred counties (D) An essay explaining the region known as the Bible Belt\nA: ",
        {
          "until": [
            "</s>"
          ]
        }
      ]
    ],
    "resps": [
      [
        "(C)"
      ]
    ],
    "filtered_resps": [
      "(C)"
    ],
    "exact_match": 0.0
  },
  {
    "doc_id": 67,
    "doc": {
      "question": "Ankara, Turkey and Islamabad, Pakistan are both examples of",
      "subject": "high_school_geography",
      "choices": [
        "desert cities.",
        "forward-thrust capitals.",
        "old colonial capitals.",
        "rival cities."
      ],
      "answer": 1
    },
    "target": "(B)",
    "arguments": [
      [
        "The following are multiple choice questions (with answers) about high school geography.\n\nQ: Which one of the following items is an example of nonmaterial culture?\n(A) Dove soap (B) Dove candy bar (C) Dove symbol (D) A dove (bird)\nA:  (C)\n\nQ: The rate of natural increase of a population is found by subtracting the\n(A) crude death rate from the crude birth date. (B) crude birth rate from the crude death rate. (C) doubling time from the crude birth rate. (D) fertility rate from the crude death rate.\nA:  (A)\n\nQ: Which of the following statements is NOT accurate regarding the services provided by local governments in the United States?\n(A) Duplication of efforts occurs often. (B) Social problems of the central city spill over into the surrounding residential suburbs. (C) Inefficiency in providing services occurs often. (D) One neighborhood's efforts to reduce pollution are always supported by neighboring communities.\nA:  (D)\n\nQ: The practice of hiring a foreign third-party service provider to run an operation is called\n(A) outsourcing. (B) offshoring. (C) maquiladoras. (D) locational interdependence.\nA:  (B)\n\nQ: During the third stage of the demographic transition model, which of the following is true?\n(A) Birth rates increase and population growth rate is less rapid. (B) Birth rates decline and population growth rate is less rapid. (C) Birth rates increase and population growth rate increases. (D) Birth rates decrease and population growth rate increases.\nA:  (B)\n\nQ: Ankara, Turkey and Islamabad, Pakistan are both examples of\n(A) desert cities. (B) forward-thrust capitals. (C) old colonial capitals. (D) rival cities.\nA: ",
        {
          "until": [
            "</s>"
          ]
        }
      ]
    ],
    "resps": [
      [
        "(D)"
      ]
    ],
    "filtered_resps": [
      "(D)"
    ],
    "exact_match": 0.0
  },
  {
    "doc_id": 75,
    "doc": {
      "question": "Which of the following is an example of a bulk-gaining industry?",
      "subject": "high_school_geography",
      "choices": [
        "Steel",
        "Bottled orange juice",
        "Paper",
        "Copper"
      ],
      "answer": 1
    },
    "target": "(B)",
    "arguments": [
      [
        "The following are multiple choice questions (with answers) about high school geography.\n\nQ: Which of the following statements is NOT accurate regarding the services provided by local governments in the United States?\n(A) Duplication of efforts occurs often. (B) Social problems of the central city spill over into the surrounding residential suburbs. (C) Inefficiency in providing services occurs often. (D) One neighborhood's efforts to reduce pollution are always supported by neighboring communities.\nA:  (D)\n\nQ: During the third stage of the demographic transition model, which of the following is true?\n(A) Birth rates increase and population growth rate is less rapid. (B) Birth rates decline and population growth rate is less rapid. (C) Birth rates increase and population growth rate increases. (D) Birth rates decrease and population growth rate increases.\nA:  (B)\n\nQ: Which one of the following items is an example of nonmaterial culture?\n(A) Dove soap (B) Dove candy bar (C) Dove symbol (D) A dove (bird)\nA:  (C)\n\nQ: The practice of hiring a foreign third-party service provider to run an operation is called\n(A) outsourcing. (B) offshoring. (C) maquiladoras. (D) locational interdependence.\nA:  (B)\n\nQ: The rate of natural increase of a population is found by subtracting the\n(A) crude death rate from the crude birth date. (B) crude birth rate from the crude death rate. (C) doubling time from the crude birth rate. (D) fertility rate from the crude death rate.\nA:  (A)\n\nQ: Which of the following is an example of a bulk-gaining industry?\n(A) Steel (B) Bottled orange juice (C) Paper (D) Copper\nA: ",
        {
          "until": [
            "</s>"
          ]
        }
      ]
    ],
    "resps": [
      [
        "(D)"
      ]
    ],
    "filtered_resps": [
      "(D)"
    ],
    "exact_match": 0.0
  },
  {
    "doc_id": 83,
    "doc": {
      "question": "Which of the following is a functional region?",
      "subject": "high_school_geography",
      "choices": [
        "Dixie",
        "Pennsylvania",
        "The market area of Winn-Dixie",
        "The Pacific Northwest"
      ],
      "answer": 2
    },
    "target": "(C)",
    "arguments": [
      [
        "The following are multiple choice questions (with answers) about high school geography.\n\nQ: During the third stage of the demographic transition model, which of the following is true?\n(A) Birth rates increase and population growth rate is less rapid. (B) Birth rates decline and population growth rate is less rapid. (C) Birth rates increase and population growth rate increases. (D) Birth rates decrease and population growth rate increases.\nA:  (B)\n\nQ: The rate of natural increase of a population is found by subtracting the\n(A) crude death rate from the crude birth date. (B) crude birth rate from the crude death rate. (C) doubling time from the crude birth rate. (D) fertility rate from the crude death rate.\nA:  (A)\n\nQ: The practice of hiring a foreign third-party service provider to run an operation is called\n(A) outsourcing. (B) offshoring. (C) maquiladoras. (D) locational interdependence.\nA:  (B)\n\nQ: Which one of the following items is an example of nonmaterial culture?\n(A) Dove soap (B) Dove candy bar (C) Dove symbol (D) A dove (bird)\nA:  (C)\n\nQ: Which of the following statements is NOT accurate regarding the services provided by local governments in the United States?\n(A) Duplication of efforts occurs often. (B) Social problems of the central city spill over into the surrounding residential suburbs. (C) Inefficiency in providing services occurs often. (D) One neighborhood's efforts to reduce pollution are always supported by neighboring communities.\nA:  (D)\n\nQ: Which of the following is a functional region?\n(A) Dixie (B) Pennsylvania (C) The market area of Winn-Dixie (D) The Pacific Northwest\nA: ",
        {
          "until": [
            "</s>"
          ]
        }
      ]
    ],
    "resps": [
      [
        "(D)"
      ]
    ],
    "filtered_resps": [
      "(D)"
    ],
    "exact_match": 0.0
  },
  {
    "doc_id": 91,
    "doc": {
      "question": "What is the most abundant fossil fuel?",
      "subject": "high_school_geography",
      "choices": [
        "Phosphate",
        "Oil",
        "Petroleum",
        "Coal"
      ],
      "answer": 3
    },
    "target": "(D)",
    "arguments": [
      [
        "The following are multiple choice questions (with answers) about high school geography.\n\nQ: The rate of natural increase of a population is found by subtracting the\n(A) crude death rate from the crude birth date. (B) crude birth rate from the crude death rate. (C) doubling time from the crude birth rate. (D) fertility rate from the crude death rate.\nA:  (A)\n\nQ: During the third stage of the demographic transition model, which of the following is true?\n(A) Birth rates increase and population growth rate is less rapid. (B) Birth rates decline and population growth rate is less rapid. (C) Birth rates increase and population growth rate increases. (D) Birth rates decrease and population growth rate increases.\nA:  (B)\n\nQ: Which one of the following items is an example of nonmaterial culture?\n(A) Dove soap (B) Dove candy bar (C) Dove symbol (D) A dove (bird)\nA:  (C)\n\nQ: Which of the following statements is NOT accurate regarding the services provided by local governments in the United States?\n(A) Duplication of efforts occurs often. (B) Social problems of the central city spill over into the surrounding residential suburbs. (C) Inefficiency in providing services occurs often. (D) One neighborhood's efforts to reduce pollution are always supported by neighboring communities.\nA:  (D)\n\nQ: The practice of hiring a foreign third-party service provider to run an operation is called\n(A) outsourcing. (B) offshoring. (C) maquiladoras. (D) locational interdependence.\nA:  (B)\n\nQ: What is the most abundant fossil fuel?\n(A) Phosphate (B) Oil (C) Petroleum (D) Coal\nA: ",
        {
          "until": [
            "</s>"
          ]
        }
      ]
    ],
    "resps": [
      [
        "(C)"
      ]
    ],
    "filtered_resps": [
      "(C)"
    ],
    "exact_match": 0.0
  },
  {
    "doc_id": 99,
    "doc": {
      "question": "The distance north and south of the equator is the",
      "subject": "high_school_geography",
      "choices": [
        "global grid system.",
        "Prime Meridian",
        "latitude.",
        "longitude."
      ],
      "answer": 2
    },
    "target": "(C)",
    "arguments": [
      [
        "The following are multiple choice questions (with answers) about high school geography.\n\nQ: The rate of natural increase of a population is found by subtracting the\n(A) crude death rate from the crude birth date. (B) crude birth rate from the crude death rate. (C) doubling time from the crude birth rate. (D) fertility rate from the crude death rate.\nA:  (A)\n\nQ: During the third stage of the demographic transition model, which of the following is true?\n(A) Birth rates increase and population growth rate is less rapid. (B) Birth rates decline and population growth rate is less rapid. (C) Birth rates increase and population growth rate increases. (D) Birth rates decrease and population growth rate increases.\nA:  (B)\n\nQ: Which of the following statements is NOT accurate regarding the services provided by local governments in the United States?\n(A) Duplication of efforts occurs often. (B) Social problems of the central city spill over into the surrounding residential suburbs. (C) Inefficiency in providing services occurs often. (D) One neighborhood's efforts to reduce pollution are always supported by neighboring communities.\nA:  (D)\n\nQ: The practice of hiring a foreign third-party service provider to run an operation is called\n(A) outsourcing. (B) offshoring. (C) maquiladoras. (D) locational interdependence.\nA:  (B)\n\nQ: Which one of the following items is an example of nonmaterial culture?\n(A) Dove soap (B) Dove candy bar (C) Dove symbol (D) A dove (bird)\nA:  (C)\n\nQ: The distance north and south of the equator is the\n(A) global grid system. (B) Prime Meridian (C) latitude. (D) longitude.\nA: ",
        {
          "until": [
            "</s>"
          ]
        }
      ]
    ],
    "resps": [
      [
        "(D)<0x0A>Answer: (D)"
      ]
    ],
    "filtered_resps": [
      "(D)<0x0A>Answer: (D)"
    ],
    "exact_match": 0.0
  },
  {
    "doc_id": 107,
    "doc": {
      "question": "Which of the following is NOT a key milestone reached by the EU?",
      "subject": "high_school_geography",
      "choices": [
        "The introduction of a common currency used by many EU countries",
        "A customs union",
        "A single market",
        "A common European language"
      ],
      "answer": 3
    },
    "target": "(D)",
    "arguments": [
      [
        "The following are multiple choice questions (with answers) about high school geography.\n\nQ: The rate of natural increase of a population is found by subtracting the\n(A) crude death rate from the crude birth date. (B) crude birth rate from the crude death rate. (C) doubling time from the crude birth rate. (D) fertility rate from the crude death rate.\nA:  (A)\n\nQ: The practice of hiring a foreign third-party service provider to run an operation is called\n(A) outsourcing. (B) offshoring. (C) maquiladoras. (D) locational interdependence.\nA:  (B)\n\nQ: During the third stage of the demographic transition model, which of the following is true?\n(A) Birth rates increase and population growth rate is less rapid. (B) Birth rates decline and population growth rate is less rapid. (C) Birth rates increase and population growth rate increases. (D) Birth rates decrease and population growth rate increases.\nA:  (B)\n\nQ: Which one of the following items is an example of nonmaterial culture?\n(A) Dove soap (B) Dove candy bar (C) Dove symbol (D) A dove (bird)\nA:  (C)\n\nQ: Which of the following statements is NOT accurate regarding the services provided by local governments in the United States?\n(A) Duplication of efforts occurs often. (B) Social problems of the central city spill over into the surrounding residential suburbs. (C) Inefficiency in providing services occurs often. (D) One neighborhood's efforts to reduce pollution are always supported by neighboring communities.\nA:  (D)\n\nQ: Which of the following is NOT a key milestone reached by the EU?\n(A) The introduction of a common currency used by many EU countries (B) A customs union (C) A single market (D) A common European language\nA: ",
        {
          "until": [
            "</s>"
          ]
        }
      ]
    ],
    "resps": [
      [
        "(B)"
      ]
    ],
    "filtered_resps": [
      "(B)"
    ],
    "exact_match": 0.0
  },
  {
    "doc_id": 115,
    "doc": {
      "question": "Which one of the following North American associations is NOT correct?",
      "subject": "high_school_geography",
      "choices": [
        "Southeast\u2014African Americans",
        "Oklahoma and the Southwest\u2014Native Americans",
        "Quebec and northern Maine\u2014French Americans and French Canadians",
        "Southern prairie provinces\u2014African Americans"
      ],
      "answer": 3
    },
    "target": "(D)",
    "arguments": [
      [
        "The following are multiple choice questions (with answers) about high school geography.\n\nQ: Which of the following statements is NOT accurate regarding the services provided by local governments in the United States?\n(A) Duplication of efforts occurs often. (B) Social problems of the central city spill over into the surrounding residential suburbs. (C) Inefficiency in providing services occurs often. (D) One neighborhood's efforts to reduce pollution are always supported by neighboring communities.\nA:  (D)\n\nQ: During the third stage of the demographic transition model, which of the following is true?\n(A) Birth rates increase and population growth rate is less rapid. (B) Birth rates decline and population growth rate is less rapid. (C) Birth rates increase and population growth rate increases. (D) Birth rates decrease and population growth rate increases.\nA:  (B)\n\nQ: The practice of hiring a foreign third-party service provider to run an operation is called\n(A) outsourcing. (B) offshoring. (C) maquiladoras. (D) locational interdependence.\nA:  (B)\n\nQ: The rate of natural increase of a population is found by subtracting the\n(A) crude death rate from the crude birth date. (B) crude birth rate from the crude death rate. (C) doubling time from the crude birth rate. (D) fertility rate from the crude death rate.\nA:  (A)\n\nQ: Which one of the following items is an example of nonmaterial culture?\n(A) Dove soap (B) Dove candy bar (C) Dove symbol (D) A dove (bird)\nA:  (C)\n\nQ: Which one of the following North American associations is NOT correct?\n(A) Southeast\u2014African Americans (B) Oklahoma and the Southwest\u2014Native Americans (C) Quebec and northern Maine\u2014French Americans and French Canadians (D) Southern prairie provinces\u2014African Americans\nA: ",
        {
          "until": [
            "</s>"
          ]
        }
      ]
    ],
    "resps": [
      [
        "(D)"
      ]
    ],
    "filtered_resps": [
      "(D)"
    ],
    "exact_match": 1.0
  },
  {
    "doc_id": 123,
    "doc": {
      "question": "A primate city is",
      "subject": "high_school_geography",
      "choices": [
        "a large city located on the periphery of the country.",
        "the most important city in a country.",
        "when the largest city in a country is more than twice the size of the next largest city.",
        "the largest city in a country."
      ],
      "answer": 2
    },
    "target": "(C)",
    "arguments": [
      [
        "The following are multiple choice questions (with answers) about high school geography.\n\nQ: The rate of natural increase of a population is found by subtracting the\n(A) crude death rate from the crude birth date. (B) crude birth rate from the crude death rate. (C) doubling time from the crude birth rate. (D) fertility rate from the crude death rate.\nA:  (A)\n\nQ: The practice of hiring a foreign third-party service provider to run an operation is called\n(A) outsourcing. (B) offshoring. (C) maquiladoras. (D) locational interdependence.\nA:  (B)\n\nQ: During the third stage of the demographic transition model, which of the following is true?\n(A) Birth rates increase and population growth rate is less rapid. (B) Birth rates decline and population growth rate is less rapid. (C) Birth rates increase and population growth rate increases. (D) Birth rates decrease and population growth rate increases.\nA:  (B)\n\nQ: Which of the following statements is NOT accurate regarding the services provided by local governments in the United States?\n(A) Duplication of efforts occurs often. (B) Social problems of the central city spill over into the surrounding residential suburbs. (C) Inefficiency in providing services occurs often. (D) One neighborhood's efforts to reduce pollution are always supported by neighboring communities.\nA:  (D)\n\nQ: Which one of the following items is an example of nonmaterial culture?\n(A) Dove soap (B) Dove candy bar (C) Dove symbol (D) A dove (bird)\nA:  (C)\n\nQ: A primate city is\n(A) a large city located on the periphery of the country. (B) the most important city in a country. (C) when the largest city in a country is more than twice the size of the next largest city. (D) the largest city in a country.\nA: ",
        {
          "until": [
            "</s>"
          ]
        }
      ]
    ],
    "resps": [
      [
        "(D)"
      ]
    ],
    "filtered_resps": [
      "(D)"
    ],
    "exact_match": 0.0
  },
  {
    "doc_id": 131,
    "doc": {
      "question": "Which one of the following statements is NOT true of the \"core\" countries?",
      "subject": "high_school_geography",
      "choices": [
        "They are technologically advanced.",
        "They are wealthy.",
        "They are powerful.",
        "They are less developed."
      ],
      "answer": 3
    },
    "target": "(D)",
    "arguments": [
      [
        "The following are multiple choice questions (with answers) about high school geography.\n\nQ: Which one of the following items is an example of nonmaterial culture?\n(A) Dove soap (B) Dove candy bar (C) Dove symbol (D) A dove (bird)\nA:  (C)\n\nQ: The practice of hiring a foreign third-party service provider to run an operation is called\n(A) outsourcing. (B) offshoring. (C) maquiladoras. (D) locational interdependence.\nA:  (B)\n\nQ: During the third stage of the demographic transition model, which of the following is true?\n(A) Birth rates increase and population growth rate is less rapid. (B) Birth rates decline and population growth rate is less rapid. (C) Birth rates increase and population growth rate increases. (D) Birth rates decrease and population growth rate increases.\nA:  (B)\n\nQ: The rate of natural increase of a population is found by subtracting the\n(A) crude death rate from the crude birth date. (B) crude birth rate from the crude death rate. (C) doubling time from the crude birth rate. (D) fertility rate from the crude death rate.\nA:  (A)\n\nQ: Which of the following statements is NOT accurate regarding the services provided by local governments in the United States?\n(A) Duplication of efforts occurs often. (B) Social problems of the central city spill over into the surrounding residential suburbs. (C) Inefficiency in providing services occurs often. (D) One neighborhood's efforts to reduce pollution are always supported by neighboring communities.\nA:  (D)\n\nQ: Which one of the following statements is NOT true of the \"core\" countries?\n(A) They are technologically advanced. (B) They are wealthy. (C) They are powerful. (D) They are less developed.\nA: ",
        {
          "until": [
            "</s>"
          ]
        }
      ]
    ],
    "resps": [
      [
        "(D)"
      ]
    ],
    "filtered_resps": [
      "(D)"
    ],
    "exact_match": 1.0
  },
  {
    "doc_id": 139,
    "doc": {
      "question": "Which of the following items below is an absolute location?",
      "subject": "high_school_geography",
      "choices": [
        "10 miles east of Pittsburgh",
        "Washington",
        "3 degrees south",
        "479 Elm Street, Muncie, Indiana"
      ],
      "answer": 3
    },
    "target": "(D)",
    "arguments": [
      [
        "The following are multiple choice questions (with answers) about high school geography.\n\nQ: Which one of the following items is an example of nonmaterial culture?\n(A) Dove soap (B) Dove candy bar (C) Dove symbol (D) A dove (bird)\nA:  (C)\n\nQ: During the third stage of the demographic transition model, which of the following is true?\n(A) Birth rates increase and population growth rate is less rapid. (B) Birth rates decline and population growth rate is less rapid. (C) Birth rates increase and population growth rate increases. (D) Birth rates decrease and population growth rate increases.\nA:  (B)\n\nQ: The practice of hiring a foreign third-party service provider to run an operation is called\n(A) outsourcing. (B) offshoring. (C) maquiladoras. (D) locational interdependence.\nA:  (B)\n\nQ: Which of the following statements is NOT accurate regarding the services provided by local governments in the United States?\n(A) Duplication of efforts occurs often. (B) Social problems of the central city spill over into the surrounding residential suburbs. (C) Inefficiency in providing services occurs often. (D) One neighborhood's efforts to reduce pollution are always supported by neighboring communities.\nA:  (D)\n\nQ: The rate of natural increase of a population is found by subtracting the\n(A) crude death rate from the crude birth date. (B) crude birth rate from the crude death rate. (C) doubling time from the crude birth rate. (D) fertility rate from the crude death rate.\nA:  (A)\n\nQ: Which of the following items below is an absolute location?\n(A) 10 miles east of Pittsburgh (B) Washington (C) 3 degrees south (D) 479 Elm Street, Muncie, Indiana\nA: ",
        {
          "until": [
            "</s>"
          ]
        }
      ]
    ],
    "resps": [
      [
        "(D)"
      ]
    ],
    "filtered_resps": [
      "(D)"
    ],
    "exact_match": 1.0
  },
  {
    "doc_id": 147,
    "doc": {
      "question": "Which one of the following is NOT an advantage of urban agriculture?",
      "subject": "high_school_geography",
      "choices": [
        "Helping to solve the problem of solid waste disposal",
        "Fresh produce for sale to others",
        "Beautification of a dingy urban area",
        "Renewed or purified water supplies"
      ],
      "answer": 3
    },
    "target": "(D)",
    "arguments": [
      [
        "The following are multiple choice questions (with answers) about high school geography.\n\nQ: Which of the following statements is NOT accurate regarding the services provided by local governments in the United States?\n(A) Duplication of efforts occurs often. (B) Social problems of the central city spill over into the surrounding residential suburbs. (C) Inefficiency in providing services occurs often. (D) One neighborhood's efforts to reduce pollution are always supported by neighboring communities.\nA:  (D)\n\nQ: The rate of natural increase of a population is found by subtracting the\n(A) crude death rate from the crude birth date. (B) crude birth rate from the crude death rate. (C) doubling time from the crude birth rate. (D) fertility rate from the crude death rate.\nA:  (A)\n\nQ: The practice of hiring a foreign third-party service provider to run an operation is called\n(A) outsourcing. (B) offshoring. (C) maquiladoras. (D) locational interdependence.\nA:  (B)\n\nQ: During the third stage of the demographic transition model, which of the following is true?\n(A) Birth rates increase and population growth rate is less rapid. (B) Birth rates decline and population growth rate is less rapid. (C) Birth rates increase and population growth rate increases. (D) Birth rates decrease and population growth rate increases.\nA:  (B)\n\nQ: Which one of the following items is an example of nonmaterial culture?\n(A) Dove soap (B) Dove candy bar (C) Dove symbol (D) A dove (bird)\nA:  (C)\n\nQ: Which one of the following is NOT an advantage of urban agriculture?\n(A) Helping to solve the problem of solid waste disposal (B) Fresh produce for sale to others (C) Beautification of a dingy urban area (D) Renewed or purified water supplies\nA: ",
        {
          "until": [
            "</s>"
          ]
        }
      ]
    ],
    "resps": [
      [
        "(C)"
      ]
    ],
    "filtered_resps": [
      "(C)"
    ],
    "exact_match": 0.0
  },
  {
    "doc_id": 155,
    "doc": {
      "question": "The theory that cities grow outward from a core utilizing several nodes of growth was proposed by",
      "subject": "high_school_geography",
      "choices": [
        "Rostow.",
        "Ravenstein.",
        "von Th\u00fcnen.",
        "Harris and Ullmann."
      ],
      "answer": 3
    },
    "target": "(D)",
    "arguments": [
      [
        "The following are multiple choice questions (with answers) about high school geography.\n\nQ: The rate of natural increase of a population is found by subtracting the\n(A) crude death rate from the crude birth date. (B) crude birth rate from the crude death rate. (C) doubling time from the crude birth rate. (D) fertility rate from the crude death rate.\nA:  (A)\n\nQ: Which one of the following items is an example of nonmaterial culture?\n(A) Dove soap (B) Dove candy bar (C) Dove symbol (D) A dove (bird)\nA:  (C)\n\nQ: During the third stage of the demographic transition model, which of the following is true?\n(A) Birth rates increase and population growth rate is less rapid. (B) Birth rates decline and population growth rate is less rapid. (C) Birth rates increase and population growth rate increases. (D) Birth rates decrease and population growth rate increases.\nA:  (B)\n\nQ: Which of the following statements is NOT accurate regarding the services provided by local governments in the United States?\n(A) Duplication of efforts occurs often. (B) Social problems of the central city spill over into the surrounding residential suburbs. (C) Inefficiency in providing services occurs often. (D) One neighborhood's efforts to reduce pollution are always supported by neighboring communities.\nA:  (D)\n\nQ: The practice of hiring a foreign third-party service provider to run an operation is called\n(A) outsourcing. (B) offshoring. (C) maquiladoras. (D) locational interdependence.\nA:  (B)\n\nQ: The theory that cities grow outward from a core utilizing several nodes of growth was proposed by\n(A) Rostow. (B) Ravenstein. (C) von Th\u00fcnen. (D) Harris and Ullmann.\nA: ",
        {
          "until": [
            "</s>"
          ]
        }
      ]
    ],
    "resps": [
      [
        "(D)"
      ]
    ],
    "filtered_resps": [
      "(D)"
    ],
    "exact_match": 1.0
  },
  {
    "doc_id": 163,
    "doc": {
      "question": "Which of the following statements does NOT describe a factor that contributed to suburbanization in the United States?",
      "subject": "high_school_geography",
      "choices": [
        "A shorter workweek made time for a commute possible.",
        "Changes in the housing mortgage regulations made home ownership easier.",
        "Fixed-route public transit routes increased in importance.",
        "Improved automobiles made transportation easier and less limited."
      ],
      "answer": 2
    },
    "target": "(C)",
    "arguments": [
      [
        "The following are multiple choice questions (with answers) about high school geography.\n\nQ: During the third stage of the demographic transition model, which of the following is true?\n(A) Birth rates increase and population growth rate is less rapid. (B) Birth rates decline and population growth rate is less rapid. (C) Birth rates increase and population growth rate increases. (D) Birth rates decrease and population growth rate increases.\nA:  (B)\n\nQ: Which of the following statements is NOT accurate regarding the services provided by local governments in the United States?\n(A) Duplication of efforts occurs often. (B) Social problems of the central city spill over into the surrounding residential suburbs. (C) Inefficiency in providing services occurs often. (D) One neighborhood's efforts to reduce pollution are always supported by neighboring communities.\nA:  (D)\n\nQ: The rate of natural increase of a population is found by subtracting the\n(A) crude death rate from the crude birth date. (B) crude birth rate from the crude death rate. (C) doubling time from the crude birth rate. (D) fertility rate from the crude death rate.\nA:  (A)\n\nQ: The practice of hiring a foreign third-party service provider to run an operation is called\n(A) outsourcing. (B) offshoring. (C) maquiladoras. (D) locational interdependence.\nA:  (B)\n\nQ: Which one of the following items is an example of nonmaterial culture?\n(A) Dove soap (B) Dove candy bar (C) Dove symbol (D) A dove (bird)\nA:  (C)\n\nQ: Which of the following statements does NOT describe a factor that contributed to suburbanization in the United States?\n(A) A shorter workweek made time for a commute possible. (B) Changes in the housing mortgage regulations made home ownership easier. (C) Fixed-route public transit routes increased in importance. (D) Improved automobiles made transportation easier and less limited.\nA: ",
        {
          "until": [
            "</s>"
          ]
        }
      ]
    ],
    "resps": [
      [
        "(D)"
      ]
    ],
    "filtered_resps": [
      "(D)"
    ],
    "exact_match": 0.0
  },
  {
    "doc_id": 171,
    "doc": {
      "question": "Boundary problems along the United States\u2013Mexico border are caused by which type of issue below?",
      "subject": "high_school_geography",
      "choices": [
        "Ownership of fertile ground",
        "Land use",
        "Irredentism",
        "Immigration"
      ],
      "answer": 3
    },
    "target": "(D)",
    "arguments": [
      [
        "The following are multiple choice questions (with answers) about high school geography.\n\nQ: During the third stage of the demographic transition model, which of the following is true?\n(A) Birth rates increase and population growth rate is less rapid. (B) Birth rates decline and population growth rate is less rapid. (C) Birth rates increase and population growth rate increases. (D) Birth rates decrease and population growth rate increases.\nA:  (B)\n\nQ: Which of the following statements is NOT accurate regarding the services provided by local governments in the United States?\n(A) Duplication of efforts occurs often. (B) Social problems of the central city spill over into the surrounding residential suburbs. (C) Inefficiency in providing services occurs often. (D) One neighborhood's efforts to reduce pollution are always supported by neighboring communities.\nA:  (D)\n\nQ: Which one of the following items is an example of nonmaterial culture?\n(A) Dove soap (B) Dove candy bar (C) Dove symbol (D) A dove (bird)\nA:  (C)\n\nQ: The rate of natural increase of a population is found by subtracting the\n(A) crude death rate from the crude birth date. (B) crude birth rate from the crude death rate. (C) doubling time from the crude birth rate. (D) fertility rate from the crude death rate.\nA:  (A)\n\nQ: The practice of hiring a foreign third-party service provider to run an operation is called\n(A) outsourcing. (B) offshoring. (C) maquiladoras. (D) locational interdependence.\nA:  (B)\n\nQ: Boundary problems along the United States\u2013Mexico border are caused by which type of issue below?\n(A) Ownership of fertile ground (B) Land use (C) Irredentism (D) Immigration\nA: ",
        {
          "until": [
            "</s>"
          ]
        }
      ]
    ],
    "resps": [
      [
        "(C)"
      ]
    ],
    "filtered_resps": [
      "(C)"
    ],
    "exact_match": 0.0
  },
  {
    "doc_id": 179,
    "doc": {
      "question": "In which of the following Asian countries would one find special economic zones (SEZs)?",
      "subject": "high_school_geography",
      "choices": [
        "Japan",
        "South Korea",
        "China",
        "Vietnam"
      ],
      "answer": 2
    },
    "target": "(C)",
    "arguments": [
      [
        "The following are multiple choice questions (with answers) about high school geography.\n\nQ: The practice of hiring a foreign third-party service provider to run an operation is called\n(A) outsourcing. (B) offshoring. (C) maquiladoras. (D) locational interdependence.\nA:  (B)\n\nQ: During the third stage of the demographic transition model, which of the following is true?\n(A) Birth rates increase and population growth rate is less rapid. (B) Birth rates decline and population growth rate is less rapid. (C) Birth rates increase and population growth rate increases. (D) Birth rates decrease and population growth rate increases.\nA:  (B)\n\nQ: The rate of natural increase of a population is found by subtracting the\n(A) crude death rate from the crude birth date. (B) crude birth rate from the crude death rate. (C) doubling time from the crude birth rate. (D) fertility rate from the crude death rate.\nA:  (A)\n\nQ: Which one of the following items is an example of nonmaterial culture?\n(A) Dove soap (B) Dove candy bar (C) Dove symbol (D) A dove (bird)\nA:  (C)\n\nQ: Which of the following statements is NOT accurate regarding the services provided by local governments in the United States?\n(A) Duplication of efforts occurs often. (B) Social problems of the central city spill over into the surrounding residential suburbs. (C) Inefficiency in providing services occurs often. (D) One neighborhood's efforts to reduce pollution are always supported by neighboring communities.\nA:  (D)\n\nQ: In which of the following Asian countries would one find special economic zones (SEZs)?\n(A) Japan (B) South Korea (C) China (D) Vietnam\nA: ",
        {
          "until": [
            "</s>"
          ]
        }
      ]
    ],
    "resps": [
      [
        "(C)"
      ]
    ],
    "filtered_resps": [
      "(C)"
    ],
    "exact_match": 1.0
  },
  {
    "doc_id": 187,
    "doc": {
      "question": "The irregularity of the wet monsoon in South Asia in recent years may have a significant negative effect on which of the following?",
      "subject": "high_school_geography",
      "choices": [
        "Food production",
        "Population patterns",
        "Wildlife conservation efforts",
        "Tourism"
      ],
      "answer": 0
    },
    "target": "(A)",
    "arguments": [
      [
        "The following are multiple choice questions (with answers) about high school geography.\n\nQ: During the third stage of the demographic transition model, which of the following is true?\n(A) Birth rates increase and population growth rate is less rapid. (B) Birth rates decline and population growth rate is less rapid. (C) Birth rates increase and population growth rate increases. (D) Birth rates decrease and population growth rate increases.\nA:  (B)\n\nQ: The rate of natural increase of a population is found by subtracting the\n(A) crude death rate from the crude birth date. (B) crude birth rate from the crude death rate. (C) doubling time from the crude birth rate. (D) fertility rate from the crude death rate.\nA:  (A)\n\nQ: Which of the following statements is NOT accurate regarding the services provided by local governments in the United States?\n(A) Duplication of efforts occurs often. (B) Social problems of the central city spill over into the surrounding residential suburbs. (C) Inefficiency in providing services occurs often. (D) One neighborhood's efforts to reduce pollution are always supported by neighboring communities.\nA:  (D)\n\nQ: Which one of the following items is an example of nonmaterial culture?\n(A) Dove soap (B) Dove candy bar (C) Dove symbol (D) A dove (bird)\nA:  (C)\n\nQ: The practice of hiring a foreign third-party service provider to run an operation is called\n(A) outsourcing. (B) offshoring. (C) maquiladoras. (D) locational interdependence.\nA:  (B)\n\nQ: The irregularity of the wet monsoon in South Asia in recent years may have a significant negative effect on which of the following?\n(A) Food production (B) Population patterns (C) Wildlife conservation efforts (D) Tourism\nA: ",
        {
          "until": [
            "</s>"
          ]
        }
      ]
    ],
    "resps": [
      [
        "(B)"
      ]
    ],
    "filtered_resps": [
      "(B)"
    ],
    "exact_match": 0.0
  },
  {
    "doc_id": 195,
    "doc": {
      "question": "Which of the following statements is NOT part of Gunnar Myrdal's theory of cumulative causation?",
      "subject": "high_school_geography",
      "choices": [
        "Developing and developed regions share similarly in wealth through trade.",
        "The core will always dominate the periphery.",
        "Growth and prosperity of the core exists at the expense of the periphery.",
        "Regions with initial advantage keep and expand it as they attract labor, capital, and trade."
      ],
      "answer": 0
    },
    "target": "(A)",
    "arguments": [
      [
        "The following are multiple choice questions (with answers) about high school geography.\n\nQ: The practice of hiring a foreign third-party service provider to run an operation is called\n(A) outsourcing. (B) offshoring. (C) maquiladoras. (D) locational interdependence.\nA:  (B)\n\nQ: The rate of natural increase of a population is found by subtracting the\n(A) crude death rate from the crude birth date. (B) crude birth rate from the crude death rate. (C) doubling time from the crude birth rate. (D) fertility rate from the crude death rate.\nA:  (A)\n\nQ: Which of the following statements is NOT accurate regarding the services provided by local governments in the United States?\n(A) Duplication of efforts occurs often. (B) Social problems of the central city spill over into the surrounding residential suburbs. (C) Inefficiency in providing services occurs often. (D) One neighborhood's efforts to reduce pollution are always supported by neighboring communities.\nA:  (D)\n\nQ: During the third stage of the demographic transition model, which of the following is true?\n(A) Birth rates increase and population growth rate is less rapid. (B) Birth rates decline and population growth rate is less rapid. (C) Birth rates increase and population growth rate increases. (D) Birth rates decrease and population growth rate increases.\nA:  (B)\n\nQ: Which one of the following items is an example of nonmaterial culture?\n(A) Dove soap (B) Dove candy bar (C) Dove symbol (D) A dove (bird)\nA:  (C)\n\nQ: Which of the following statements is NOT part of Gunnar Myrdal's theory of cumulative causation?\n(A) Developing and developed regions share similarly in wealth through trade. (B) The core will always dominate the periphery. (C) Growth and prosperity of the core exists at the expense of the periphery. (D) Regions with initial advantage keep and expand it as they attract labor, capital, and trade.\nA: ",
        {
          "until": [
            "</s>"
          ]
        }
      ]
    ],
    "resps": [
      [
        "(B)"
      ]
    ],
    "filtered_resps": [
      "(B)"
    ],
    "exact_match": 0.0
  },
  {
    "doc_id": 4,
    "doc": {
      "question": "Which of the following statements is TRUE concerning women in the labor force?",
      "subject": "high_school_geography",
      "choices": [
        "Most women work in agriculture",
        "The percentage of women economically active in the labor force declined worldwide",
        "The percentage of women in the total labor force declined",
        "Women spend more hours per day working than men in all regions except Anglo America and Australia"
      ],
      "answer": 3
    },
    "target": "(D)",
    "arguments": [
      [
        "The following are multiple choice questions (with answers) about high school geography.\n\nQ: The practice of hiring a foreign third-party service provider to run an operation is called\n(A) outsourcing. (B) offshoring. (C) maquiladoras. (D) locational interdependence.\nA:  (B)\n\nQ: The rate of natural increase of a population is found by subtracting the\n(A) crude death rate from the crude birth date. (B) crude birth rate from the crude death rate. (C) doubling time from the crude birth rate. (D) fertility rate from the crude death rate.\nA:  (A)\n\nQ: Which one of the following items is an example of nonmaterial culture?\n(A) Dove soap (B) Dove candy bar (C) Dove symbol (D) A dove (bird)\nA:  (C)\n\nQ: Which of the following statements is NOT accurate regarding the services provided by local governments in the United States?\n(A) Duplication of efforts occurs often. (B) Social problems of the central city spill over into the surrounding residential suburbs. (C) Inefficiency in providing services occurs often. (D) One neighborhood's efforts to reduce pollution are always supported by neighboring communities.\nA:  (D)\n\nQ: During the third stage of the demographic transition model, which of the following is true?\n(A) Birth rates increase and population growth rate is less rapid. (B) Birth rates decline and population growth rate is less rapid. (C) Birth rates increase and population growth rate increases. (D) Birth rates decrease and population growth rate increases.\nA:  (B)\n\nQ: Which of the following statements is TRUE concerning women in the labor force?\n(A) Most women work in agriculture (B) The percentage of women economically active in the labor force declined worldwide (C) The percentage of women in the total labor force declined (D) Women spend more hours per day working than men in all regions except Anglo America and Australia\nA: ",
        {
          "until": [
            "</s>"
          ]
        }
      ]
    ],
    "resps": [
      [
        "(B)"
      ]
    ],
    "filtered_resps": [
      "(B)"
    ],
    "exact_match": 0.0
  },
  {
    "doc_id": 12,
    "doc": {
      "question": "What is the most rapidly growing religion in the United States today?",
      "subject": "high_school_geography",
      "choices": [
        "Islam",
        "Christianity",
        "Hinduism",
        "Buddhism"
      ],
      "answer": 0
    },
    "target": "(A)",
    "arguments": [
      [
        "The following are multiple choice questions (with answers) about high school geography.\n\nQ: The rate of natural increase of a population is found by subtracting the\n(A) crude death rate from the crude birth date. (B) crude birth rate from the crude death rate. (C) doubling time from the crude birth rate. (D) fertility rate from the crude death rate.\nA:  (A)\n\nQ: Which one of the following items is an example of nonmaterial culture?\n(A) Dove soap (B) Dove candy bar (C) Dove symbol (D) A dove (bird)\nA:  (C)\n\nQ: During the third stage of the demographic transition model, which of the following is true?\n(A) Birth rates increase and population growth rate is less rapid. (B) Birth rates decline and population growth rate is less rapid. (C) Birth rates increase and population growth rate increases. (D) Birth rates decrease and population growth rate increases.\nA:  (B)\n\nQ: The practice of hiring a foreign third-party service provider to run an operation is called\n(A) outsourcing. (B) offshoring. (C) maquiladoras. (D) locational interdependence.\nA:  (B)\n\nQ: Which of the following statements is NOT accurate regarding the services provided by local governments in the United States?\n(A) Duplication of efforts occurs often. (B) Social problems of the central city spill over into the surrounding residential suburbs. (C) Inefficiency in providing services occurs often. (D) One neighborhood's efforts to reduce pollution are always supported by neighboring communities.\nA:  (D)\n\nQ: What is the most rapidly growing religion in the United States today?\n(A) Islam (B) Christianity (C) Hinduism (D) Buddhism\nA: ",
        {
          "until": [
            "</s>"
          ]
        }
      ]
    ],
    "resps": [
      [
        "(D)"
      ]
    ],
    "filtered_resps": [
      "(D)"
    ],
    "exact_match": 0.0
  },
  {
    "doc_id": 20,
    "doc": {
      "question": "The voluntary association of three or more countries willing to give up some measure of sovereignty is called",
      "subject": "high_school_geography",
      "choices": [
        "nationalism.",
        "devolution.",
        "supranationalism.",
        "complementarity."
      ],
      "answer": 2
    },
    "target": "(C)",
    "arguments": [
      [
        "The following are multiple choice questions (with answers) about high school geography.\n\nQ: The rate of natural increase of a population is found by subtracting the\n(A) crude death rate from the crude birth date. (B) crude birth rate from the crude death rate. (C) doubling time from the crude birth rate. (D) fertility rate from the crude death rate.\nA:  (A)\n\nQ: Which one of the following items is an example of nonmaterial culture?\n(A) Dove soap (B) Dove candy bar (C) Dove symbol (D) A dove (bird)\nA:  (C)\n\nQ: During the third stage of the demographic transition model, which of the following is true?\n(A) Birth rates increase and population growth rate is less rapid. (B) Birth rates decline and population growth rate is less rapid. (C) Birth rates increase and population growth rate increases. (D) Birth rates decrease and population growth rate increases.\nA:  (B)\n\nQ: Which of the following statements is NOT accurate regarding the services provided by local governments in the United States?\n(A) Duplication of efforts occurs often. (B) Social problems of the central city spill over into the surrounding residential suburbs. (C) Inefficiency in providing services occurs often. (D) One neighborhood's efforts to reduce pollution are always supported by neighboring communities.\nA:  (D)\n\nQ: The practice of hiring a foreign third-party service provider to run an operation is called\n(A) outsourcing. (B) offshoring. (C) maquiladoras. (D) locational interdependence.\nA:  (B)\n\nQ: The voluntary association of three or more countries willing to give up some measure of sovereignty is called\n(A) nationalism. (B) devolution. (C) supranationalism. (D) complementarity.\nA: ",
        {
          "until": [
            "</s>"
          ]
        }
      ]
    ],
    "resps": [
      [
        "(D)"
      ]
    ],
    "filtered_resps": [
      "(D)"
    ],
    "exact_match": 0.0
  },
  {
    "doc_id": 28,
    "doc": {
      "question": "The Rhine River is an example of which type of boundary?",
      "subject": "high_school_geography",
      "choices": [
        "Geometric",
        "Artificial",
        "Natural",
        "Relict"
      ],
      "answer": 2
    },
    "target": "(C)",
    "arguments": [
      [
        "The following are multiple choice questions (with answers) about high school geography.\n\nQ: During the third stage of the demographic transition model, which of the following is true?\n(A) Birth rates increase and population growth rate is less rapid. (B) Birth rates decline and population growth rate is less rapid. (C) Birth rates increase and population growth rate increases. (D) Birth rates decrease and population growth rate increases.\nA:  (B)\n\nQ: The rate of natural increase of a population is found by subtracting the\n(A) crude death rate from the crude birth date. (B) crude birth rate from the crude death rate. (C) doubling time from the crude birth rate. (D) fertility rate from the crude death rate.\nA:  (A)\n\nQ: The practice of hiring a foreign third-party service provider to run an operation is called\n(A) outsourcing. (B) offshoring. (C) maquiladoras. (D) locational interdependence.\nA:  (B)\n\nQ: Which of the following statements is NOT accurate regarding the services provided by local governments in the United States?\n(A) Duplication of efforts occurs often. (B) Social problems of the central city spill over into the surrounding residential suburbs. (C) Inefficiency in providing services occurs often. (D) One neighborhood's efforts to reduce pollution are always supported by neighboring communities.\nA:  (D)\n\nQ: Which one of the following items is an example of nonmaterial culture?\n(A) Dove soap (B) Dove candy bar (C) Dove symbol (D) A dove (bird)\nA:  (C)\n\nQ: The Rhine River is an example of which type of boundary?\n(A) Geometric (B) Artificial (C) Natural (D) Relict\nA: ",
        {
          "until": [
            "</s>"
          ]
        }
      ]
    ],
    "resps": [
      [
        "(C)"
      ]
    ],
    "filtered_resps": [
      "(C)"
    ],
    "exact_match": 1.0
  },
  {
    "doc_id": 36,
    "doc": {
      "question": "The largest Hindu temple complex ever constructed is found in",
      "subject": "high_school_geography",
      "choices": [
        "Calcutta.",
        "Bombay.",
        "Cambodia.",
        "Bali."
      ],
      "answer": 2
    },
    "target": "(C)",
    "arguments": [
      [
        "The following are multiple choice questions (with answers) about high school geography.\n\nQ: Which one of the following items is an example of nonmaterial culture?\n(A) Dove soap (B) Dove candy bar (C) Dove symbol (D) A dove (bird)\nA:  (C)\n\nQ: The practice of hiring a foreign third-party service provider to run an operation is called\n(A) outsourcing. (B) offshoring. (C) maquiladoras. (D) locational interdependence.\nA:  (B)\n\nQ: The rate of natural increase of a population is found by subtracting the\n(A) crude death rate from the crude birth date. (B) crude birth rate from the crude death rate. (C) doubling time from the crude birth rate. (D) fertility rate from the crude death rate.\nA:  (A)\n\nQ: Which of the following statements is NOT accurate regarding the services provided by local governments in the United States?\n(A) Duplication of efforts occurs often. (B) Social problems of the central city spill over into the surrounding residential suburbs. (C) Inefficiency in providing services occurs often. (D) One neighborhood's efforts to reduce pollution are always supported by neighboring communities.\nA:  (D)\n\nQ: During the third stage of the demographic transition model, which of the following is true?\n(A) Birth rates increase and population growth rate is less rapid. (B) Birth rates decline and population growth rate is less rapid. (C) Birth rates increase and population growth rate increases. (D) Birth rates decrease and population growth rate increases.\nA:  (B)\n\nQ: The largest Hindu temple complex ever constructed is found in\n(A) Calcutta. (B) Bombay. (C) Cambodia. (D) Bali.\nA: ",
        {
          "until": [
            "</s>"
          ]
        }
      ]
    ],
    "resps": [
      [
        "(B)"
      ]
    ],
    "filtered_resps": [
      "(B)"
    ],
    "exact_match": 0.0
  },
  {
    "doc_id": 44,
    "doc": {
      "question": "Which geographer viewed the US urban community of the 1920s as a set of concentric rings radiating outward from a central core?",
      "subject": "high_school_geography",
      "choices": [
        "Rostow",
        "Ravenstein",
        "Von Th\u00fcnen",
        "Burgess"
      ],
      "answer": 3
    },
    "target": "(D)",
    "arguments": [
      [
        "The following are multiple choice questions (with answers) about high school geography.\n\nQ: The rate of natural increase of a population is found by subtracting the\n(A) crude death rate from the crude birth date. (B) crude birth rate from the crude death rate. (C) doubling time from the crude birth rate. (D) fertility rate from the crude death rate.\nA:  (A)\n\nQ: Which one of the following items is an example of nonmaterial culture?\n(A) Dove soap (B) Dove candy bar (C) Dove symbol (D) A dove (bird)\nA:  (C)\n\nQ: Which of the following statements is NOT accurate regarding the services provided by local governments in the United States?\n(A) Duplication of efforts occurs often. (B) Social problems of the central city spill over into the surrounding residential suburbs. (C) Inefficiency in providing services occurs often. (D) One neighborhood's efforts to reduce pollution are always supported by neighboring communities.\nA:  (D)\n\nQ: The practice of hiring a foreign third-party service provider to run an operation is called\n(A) outsourcing. (B) offshoring. (C) maquiladoras. (D) locational interdependence.\nA:  (B)\n\nQ: During the third stage of the demographic transition model, which of the following is true?\n(A) Birth rates increase and population growth rate is less rapid. (B) Birth rates decline and population growth rate is less rapid. (C) Birth rates increase and population growth rate increases. (D) Birth rates decrease and population growth rate increases.\nA:  (B)\n\nQ: Which geographer viewed the US urban community of the 1920s as a set of concentric rings radiating outward from a central core?\n(A) Rostow (B) Ravenstein (C) Von Th\u00fcnen (D) Burgess\nA: ",
        {
          "until": [
            "</s>"
          ]
        }
      ]
    ],
    "resps": [
      [
        "(C)"
      ]
    ],
    "filtered_resps": [
      "(C)"
    ],
    "exact_match": 0.0
  },
  {
    "doc_id": 52,
    "doc": {
      "question": "Which of the following U.S. main immigration flow associations is NOT correct?",
      "subject": "high_school_geography",
      "choices": [
        "Pioneer settlement to 1870\u2014Germans, British, Scotch-Irish, Africans",
        "1870\u20131914\u2014Asians",
        "1870\u20131914\u2014Eastern and southern Europeans",
        "1965\u2013present\u2014Hispanics"
      ],
      "answer": 1
    },
    "target": "(B)",
    "arguments": [
      [
        "The following are multiple choice questions (with answers) about high school geography.\n\nQ: Which one of the following items is an example of nonmaterial culture?\n(A) Dove soap (B) Dove candy bar (C) Dove symbol (D) A dove (bird)\nA:  (C)\n\nQ: The rate of natural increase of a population is found by subtracting the\n(A) crude death rate from the crude birth date. (B) crude birth rate from the crude death rate. (C) doubling time from the crude birth rate. (D) fertility rate from the crude death rate.\nA:  (A)\n\nQ: Which of the following statements is NOT accurate regarding the services provided by local governments in the United States?\n(A) Duplication of efforts occurs often. (B) Social problems of the central city spill over into the surrounding residential suburbs. (C) Inefficiency in providing services occurs often. (D) One neighborhood's efforts to reduce pollution are always supported by neighboring communities.\nA:  (D)\n\nQ: During the third stage of the demographic transition model, which of the following is true?\n(A) Birth rates increase and population growth rate is less rapid. (B) Birth rates decline and population growth rate is less rapid. (C) Birth rates increase and population growth rate increases. (D) Birth rates decrease and population growth rate increases.\nA:  (B)\n\nQ: The practice of hiring a foreign third-party service provider to run an operation is called\n(A) outsourcing. (B) offshoring. (C) maquiladoras. (D) locational interdependence.\nA:  (B)\n\nQ: Which of the following U.S. main immigration flow associations is NOT correct?\n(A) Pioneer settlement to 1870\u2014Germans, British, Scotch-Irish, Africans (B) 1870\u20131914\u2014Asians (C) 1870\u20131914\u2014Eastern and southern Europeans (D) 1965\u2013present\u2014Hispanics\nA: ",
        {
          "until": [
            "</s>"
          ]
        }
      ]
    ],
    "resps": [
      [
        "(D)"
      ]
    ],
    "filtered_resps": [
      "(D)"
    ],
    "exact_match": 0.0
  },
  {
    "doc_id": 60,
    "doc": {
      "question": "New stores opening around a large shopping mall reflect which concept?",
      "subject": "high_school_geography",
      "choices": [
        "Gravity concept",
        "Distance decay",
        "Complementarity",
        "Movement bias"
      ],
      "answer": 3
    },
    "target": "(D)",
    "arguments": [
      [
        "The following are multiple choice questions (with answers) about high school geography.\n\nQ: Which of the following statements is NOT accurate regarding the services provided by local governments in the United States?\n(A) Duplication of efforts occurs often. (B) Social problems of the central city spill over into the surrounding residential suburbs. (C) Inefficiency in providing services occurs often. (D) One neighborhood's efforts to reduce pollution are always supported by neighboring communities.\nA:  (D)\n\nQ: Which one of the following items is an example of nonmaterial culture?\n(A) Dove soap (B) Dove candy bar (C) Dove symbol (D) A dove (bird)\nA:  (C)\n\nQ: The rate of natural increase of a population is found by subtracting the\n(A) crude death rate from the crude birth date. (B) crude birth rate from the crude death rate. (C) doubling time from the crude birth rate. (D) fertility rate from the crude death rate.\nA:  (A)\n\nQ: The practice of hiring a foreign third-party service provider to run an operation is called\n(A) outsourcing. (B) offshoring. (C) maquiladoras. (D) locational interdependence.\nA:  (B)\n\nQ: During the third stage of the demographic transition model, which of the following is true?\n(A) Birth rates increase and population growth rate is less rapid. (B) Birth rates decline and population growth rate is less rapid. (C) Birth rates increase and population growth rate increases. (D) Birth rates decrease and population growth rate increases.\nA:  (B)\n\nQ: New stores opening around a large shopping mall reflect which concept?\n(A) Gravity concept (B) Distance decay (C) Complementarity (D) Movement bias\nA: ",
        {
          "until": [
            "</s>"
          ]
        }
      ]
    ],
    "resps": [
      [
        "(C)"
      ]
    ],
    "filtered_resps": [
      "(C)"
    ],
    "exact_match": 0.0
  },
  {
    "doc_id": 68,
    "doc": {
      "question": "Which of the following is NOT an example of syncretism?",
      "subject": "high_school_geography",
      "choices": [
        "Halloween",
        "Foreign cuisine changed to suit American tastes",
        "Hasidic Judaism",
        "Catholicism in Louisiana"
      ],
      "answer": 2
    },
    "target": "(C)",
    "arguments": [
      [
        "The following are multiple choice questions (with answers) about high school geography.\n\nQ: Which one of the following items is an example of nonmaterial culture?\n(A) Dove soap (B) Dove candy bar (C) Dove symbol (D) A dove (bird)\nA:  (C)\n\nQ: The rate of natural increase of a population is found by subtracting the\n(A) crude death rate from the crude birth date. (B) crude birth rate from the crude death rate. (C) doubling time from the crude birth rate. (D) fertility rate from the crude death rate.\nA:  (A)\n\nQ: Which of the following statements is NOT accurate regarding the services provided by local governments in the United States?\n(A) Duplication of efforts occurs often. (B) Social problems of the central city spill over into the surrounding residential suburbs. (C) Inefficiency in providing services occurs often. (D) One neighborhood's efforts to reduce pollution are always supported by neighboring communities.\nA:  (D)\n\nQ: The practice of hiring a foreign third-party service provider to run an operation is called\n(A) outsourcing. (B) offshoring. (C) maquiladoras. (D) locational interdependence.\nA:  (B)\n\nQ: During the third stage of the demographic transition model, which of the following is true?\n(A) Birth rates increase and population growth rate is less rapid. (B) Birth rates decline and population growth rate is less rapid. (C) Birth rates increase and population growth rate increases. (D) Birth rates decrease and population growth rate increases.\nA:  (B)\n\nQ: Which of the following is NOT an example of syncretism?\n(A) Halloween (B) Foreign cuisine changed to suit American tastes (C) Hasidic Judaism (D) Catholicism in Louisiana\nA: ",
        {
          "until": [
            "</s>"
          ]
        }
      ]
    ],
    "resps": [
      [
        "(B)"
      ]
    ],
    "filtered_resps": [
      "(B)"
    ],
    "exact_match": 0.0
  },
  {
    "doc_id": 76,
    "doc": {
      "question": "Which of the following is NOT a feature of an export processing zone (EPZ)?",
      "subject": "high_school_geography",
      "choices": [
        "Tariff reductions on exports",
        "Raw materials imported duty-free",
        "Exemption from customs duties",
        "Strict pollution regulations"
      ],
      "answer": 3
    },
    "target": "(D)",
    "arguments": [
      [
        "The following are multiple choice questions (with answers) about high school geography.\n\nQ: Which of the following statements is NOT accurate regarding the services provided by local governments in the United States?\n(A) Duplication of efforts occurs often. (B) Social problems of the central city spill over into the surrounding residential suburbs. (C) Inefficiency in providing services occurs often. (D) One neighborhood's efforts to reduce pollution are always supported by neighboring communities.\nA:  (D)\n\nQ: During the third stage of the demographic transition model, which of the following is true?\n(A) Birth rates increase and population growth rate is less rapid. (B) Birth rates decline and population growth rate is less rapid. (C) Birth rates increase and population growth rate increases. (D) Birth rates decrease and population growth rate increases.\nA:  (B)\n\nQ: Which one of the following items is an example of nonmaterial culture?\n(A) Dove soap (B) Dove candy bar (C) Dove symbol (D) A dove (bird)\nA:  (C)\n\nQ: The practice of hiring a foreign third-party service provider to run an operation is called\n(A) outsourcing. (B) offshoring. (C) maquiladoras. (D) locational interdependence.\nA:  (B)\n\nQ: The rate of natural increase of a population is found by subtracting the\n(A) crude death rate from the crude birth date. (B) crude birth rate from the crude death rate. (C) doubling time from the crude birth rate. (D) fertility rate from the crude death rate.\nA:  (A)\n\nQ: Which of the following is NOT a feature of an export processing zone (EPZ)?\n(A) Tariff reductions on exports (B) Raw materials imported duty-free (C) Exemption from customs duties (D) Strict pollution regulations\nA: ",
        {
          "until": [
            "</s>"
          ]
        }
      ]
    ],
    "resps": [
      [
        "(D)"
      ]
    ],
    "filtered_resps": [
      "(D)"
    ],
    "exact_match": 1.0
  },
  {
    "doc_id": 84,
    "doc": {
      "question": "Which type of city model contains a distinct residential spine proceeding outward from center city along the main boulevard?",
      "subject": "high_school_geography",
      "choices": [
        "European",
        "Muslim",
        "Sub-Saharan African",
        "Latin American"
      ],
      "answer": 3
    },
    "target": "(D)",
    "arguments": [
      [
        "The following are multiple choice questions (with answers) about high school geography.\n\nQ: During the third stage of the demographic transition model, which of the following is true?\n(A) Birth rates increase and population growth rate is less rapid. (B) Birth rates decline and population growth rate is less rapid. (C) Birth rates increase and population growth rate increases. (D) Birth rates decrease and population growth rate increases.\nA:  (B)\n\nQ: The rate of natural increase of a population is found by subtracting the\n(A) crude death rate from the crude birth date. (B) crude birth rate from the crude death rate. (C) doubling time from the crude birth rate. (D) fertility rate from the crude death rate.\nA:  (A)\n\nQ: The practice of hiring a foreign third-party service provider to run an operation is called\n(A) outsourcing. (B) offshoring. (C) maquiladoras. (D) locational interdependence.\nA:  (B)\n\nQ: Which one of the following items is an example of nonmaterial culture?\n(A) Dove soap (B) Dove candy bar (C) Dove symbol (D) A dove (bird)\nA:  (C)\n\nQ: Which of the following statements is NOT accurate regarding the services provided by local governments in the United States?\n(A) Duplication of efforts occurs often. (B) Social problems of the central city spill over into the surrounding residential suburbs. (C) Inefficiency in providing services occurs often. (D) One neighborhood's efforts to reduce pollution are always supported by neighboring communities.\nA:  (D)\n\nQ: Which type of city model contains a distinct residential spine proceeding outward from center city along the main boulevard?\n(A) European (B) Muslim (C) Sub-Saharan African (D) Latin American\nA: ",
        {
          "until": [
            "</s>"
          ]
        }
      ]
    ],
    "resps": [
      [
        "(D)"
      ]
    ],
    "filtered_resps": [
      "(D)"
    ],
    "exact_match": 1.0
  },
  {
    "doc_id": 92,
    "doc": {
      "question": "A rejection of or indifference to religion in a country is called",
      "subject": "high_school_geography",
      "choices": [
        "polytheism.",
        "animism.",
        "secularism.",
        "monotheism."
      ],
      "answer": 2
    },
    "target": "(C)",
    "arguments": [
      [
        "The following are multiple choice questions (with answers) about high school geography.\n\nQ: The rate of natural increase of a population is found by subtracting the\n(A) crude death rate from the crude birth date. (B) crude birth rate from the crude death rate. (C) doubling time from the crude birth rate. (D) fertility rate from the crude death rate.\nA:  (A)\n\nQ: During the third stage of the demographic transition model, which of the following is true?\n(A) Birth rates increase and population growth rate is less rapid. (B) Birth rates decline and population growth rate is less rapid. (C) Birth rates increase and population growth rate increases. (D) Birth rates decrease and population growth rate increases.\nA:  (B)\n\nQ: Which one of the following items is an example of nonmaterial culture?\n(A) Dove soap (B) Dove candy bar (C) Dove symbol (D) A dove (bird)\nA:  (C)\n\nQ: Which of the following statements is NOT accurate regarding the services provided by local governments in the United States?\n(A) Duplication of efforts occurs often. (B) Social problems of the central city spill over into the surrounding residential suburbs. (C) Inefficiency in providing services occurs often. (D) One neighborhood's efforts to reduce pollution are always supported by neighboring communities.\nA:  (D)\n\nQ: The practice of hiring a foreign third-party service provider to run an operation is called\n(A) outsourcing. (B) offshoring. (C) maquiladoras. (D) locational interdependence.\nA:  (B)\n\nQ: A rejection of or indifference to religion in a country is called\n(A) polytheism. (B) animism. (C) secularism. (D) monotheism.\nA: ",
        {
          "until": [
            "</s>"
          ]
        }
      ]
    ],
    "resps": [
      [
        "(D)<0x0A>Answer: (D)"
      ]
    ],
    "filtered_resps": [
      "(D)<0x0A>Answer: (D)"
    ],
    "exact_match": 0.0
  },
  {
    "doc_id": 100,
    "doc": {
      "question": "Why are perceptual or vernacular regions so difficult to identify?",
      "subject": "high_school_geography",
      "choices": [
        "Boundaries are constantly being redrawn.",
        "Physical features, such as rivers, are constantly shifting.",
        "Defining criteria are subjective and differ among researchers.",
        "Antecedent boundaries were drawn before humans were located in the regions."
      ],
      "answer": 2
    },
    "target": "(C)",
    "arguments": [
      [
        "The following are multiple choice questions (with answers) about high school geography.\n\nQ: The rate of natural increase of a population is found by subtracting the\n(A) crude death rate from the crude birth date. (B) crude birth rate from the crude death rate. (C) doubling time from the crude birth rate. (D) fertility rate from the crude death rate.\nA:  (A)\n\nQ: During the third stage of the demographic transition model, which of the following is true?\n(A) Birth rates increase and population growth rate is less rapid. (B) Birth rates decline and population growth rate is less rapid. (C) Birth rates increase and population growth rate increases. (D) Birth rates decrease and population growth rate increases.\nA:  (B)\n\nQ: Which of the following statements is NOT accurate regarding the services provided by local governments in the United States?\n(A) Duplication of efforts occurs often. (B) Social problems of the central city spill over into the surrounding residential suburbs. (C) Inefficiency in providing services occurs often. (D) One neighborhood's efforts to reduce pollution are always supported by neighboring communities.\nA:  (D)\n\nQ: The practice of hiring a foreign third-party service provider to run an operation is called\n(A) outsourcing. (B) offshoring. (C) maquiladoras. (D) locational interdependence.\nA:  (B)\n\nQ: Which one of the following items is an example of nonmaterial culture?\n(A) Dove soap (B) Dove candy bar (C) Dove symbol (D) A dove (bird)\nA:  (C)\n\nQ: Why are perceptual or vernacular regions so difficult to identify?\n(A) Boundaries are constantly being redrawn. (B) Physical features, such as rivers, are constantly shifting. (C) Defining criteria are subjective and differ among researchers. (D) Antecedent boundaries were drawn before humans were located in the regions.\nA: ",
        {
          "until": [
            "</s>"
          ]
        }
      ]
    ],
    "resps": [
      [
        "(C)"
      ]
    ],
    "filtered_resps": [
      "(C)"
    ],
    "exact_match": 1.0
  },
  {
    "doc_id": 108,
    "doc": {
      "question": "The use and spread of English in nineteenth-century India is an example of what type of diffusion?",
      "subject": "high_school_geography",
      "choices": [
        "Stimulus",
        "Contagious",
        "Hierarchal",
        "Relocation"
      ],
      "answer": 2
    },
    "target": "(C)",
    "arguments": [
      [
        "The following are multiple choice questions (with answers) about high school geography.\n\nQ: The rate of natural increase of a population is found by subtracting the\n(A) crude death rate from the crude birth date. (B) crude birth rate from the crude death rate. (C) doubling time from the crude birth rate. (D) fertility rate from the crude death rate.\nA:  (A)\n\nQ: The practice of hiring a foreign third-party service provider to run an operation is called\n(A) outsourcing. (B) offshoring. (C) maquiladoras. (D) locational interdependence.\nA:  (B)\n\nQ: During the third stage of the demographic transition model, which of the following is true?\n(A) Birth rates increase and population growth rate is less rapid. (B) Birth rates decline and population growth rate is less rapid. (C) Birth rates increase and population growth rate increases. (D) Birth rates decrease and population growth rate increases.\nA:  (B)\n\nQ: Which one of the following items is an example of nonmaterial culture?\n(A) Dove soap (B) Dove candy bar (C) Dove symbol (D) A dove (bird)\nA:  (C)\n\nQ: Which of the following statements is NOT accurate regarding the services provided by local governments in the United States?\n(A) Duplication of efforts occurs often. (B) Social problems of the central city spill over into the surrounding residential suburbs. (C) Inefficiency in providing services occurs often. (D) One neighborhood's efforts to reduce pollution are always supported by neighboring communities.\nA:  (D)\n\nQ: The use and spread of English in nineteenth-century India is an example of what type of diffusion?\n(A) Stimulus (B) Contagious (C) Hierarchal (D) Relocation\nA: ",
        {
          "until": [
            "</s>"
          ]
        }
      ]
    ],
    "resps": [
      [
        "(B)"
      ]
    ],
    "filtered_resps": [
      "(B)"
    ],
    "exact_match": 0.0
  },
  {
    "doc_id": 116,
    "doc": {
      "question": "Which of the following countries is NOT a federal state?",
      "subject": "high_school_geography",
      "choices": [
        "Canada",
        "United States",
        "France",
        "People's Republic of China"
      ],
      "answer": 2
    },
    "target": "(C)",
    "arguments": [
      [
        "The following are multiple choice questions (with answers) about high school geography.\n\nQ: Which of the following statements is NOT accurate regarding the services provided by local governments in the United States?\n(A) Duplication of efforts occurs often. (B) Social problems of the central city spill over into the surrounding residential suburbs. (C) Inefficiency in providing services occurs often. (D) One neighborhood's efforts to reduce pollution are always supported by neighboring communities.\nA:  (D)\n\nQ: During the third stage of the demographic transition model, which of the following is true?\n(A) Birth rates increase and population growth rate is less rapid. (B) Birth rates decline and population growth rate is less rapid. (C) Birth rates increase and population growth rate increases. (D) Birth rates decrease and population growth rate increases.\nA:  (B)\n\nQ: The practice of hiring a foreign third-party service provider to run an operation is called\n(A) outsourcing. (B) offshoring. (C) maquiladoras. (D) locational interdependence.\nA:  (B)\n\nQ: The rate of natural increase of a population is found by subtracting the\n(A) crude death rate from the crude birth date. (B) crude birth rate from the crude death rate. (C) doubling time from the crude birth rate. (D) fertility rate from the crude death rate.\nA:  (A)\n\nQ: Which one of the following items is an example of nonmaterial culture?\n(A) Dove soap (B) Dove candy bar (C) Dove symbol (D) A dove (bird)\nA:  (C)\n\nQ: Which of the following countries is NOT a federal state?\n(A) Canada (B) United States (C) France (D) People's Republic of China\nA: ",
        {
          "until": [
            "</s>"
          ]
        }
      ]
    ],
    "resps": [
      [
        "(B)"
      ]
    ],
    "filtered_resps": [
      "(B)"
    ],
    "exact_match": 0.0
  },
  {
    "doc_id": 124,
    "doc": {
      "question": "Which of the following factors would be considered a \"pull\" factor for Riva when considering a move from India to the United States?",
      "subject": "high_school_geography",
      "choices": [
        "Abject poverty",
        "Better job and higher wages",
        "India's caste system",
        "Violence in her neighborhood"
      ],
      "answer": 1
    },
    "target": "(B)",
    "arguments": [
      [
        "The following are multiple choice questions (with answers) about high school geography.\n\nQ: The rate of natural increase of a population is found by subtracting the\n(A) crude death rate from the crude birth date. (B) crude birth rate from the crude death rate. (C) doubling time from the crude birth rate. (D) fertility rate from the crude death rate.\nA:  (A)\n\nQ: The practice of hiring a foreign third-party service provider to run an operation is called\n(A) outsourcing. (B) offshoring. (C) maquiladoras. (D) locational interdependence.\nA:  (B)\n\nQ: During the third stage of the demographic transition model, which of the following is true?\n(A) Birth rates increase and population growth rate is less rapid. (B) Birth rates decline and population growth rate is less rapid. (C) Birth rates increase and population growth rate increases. (D) Birth rates decrease and population growth rate increases.\nA:  (B)\n\nQ: Which of the following statements is NOT accurate regarding the services provided by local governments in the United States?\n(A) Duplication of efforts occurs often. (B) Social problems of the central city spill over into the surrounding residential suburbs. (C) Inefficiency in providing services occurs often. (D) One neighborhood's efforts to reduce pollution are always supported by neighboring communities.\nA:  (D)\n\nQ: Which one of the following items is an example of nonmaterial culture?\n(A) Dove soap (B) Dove candy bar (C) Dove symbol (D) A dove (bird)\nA:  (C)\n\nQ: Which of the following factors would be considered a \"pull\" factor for Riva when considering a move from India to the United States?\n(A) Abject poverty (B) Better job and higher wages (C) India's caste system (D) Violence in her neighborhood\nA: ",
        {
          "until": [
            "</s>"
          ]
        }
      ]
    ],
    "resps": [
      [
        "(B)"
      ]
    ],
    "filtered_resps": [
      "(B)"
    ],
    "exact_match": 1.0
  },
  {
    "doc_id": 132,
    "doc": {
      "question": "If you wanted to find the global distribution of coal, you would use a",
      "subject": "high_school_geography",
      "choices": [
        "reference map.",
        "topographic map.",
        "thematic map.",
        "location map."
      ],
      "answer": 2
    },
    "target": "(C)",
    "arguments": [
      [
        "The following are multiple choice questions (with answers) about high school geography.\n\nQ: Which one of the following items is an example of nonmaterial culture?\n(A) Dove soap (B) Dove candy bar (C) Dove symbol (D) A dove (bird)\nA:  (C)\n\nQ: The practice of hiring a foreign third-party service provider to run an operation is called\n(A) outsourcing. (B) offshoring. (C) maquiladoras. (D) locational interdependence.\nA:  (B)\n\nQ: During the third stage of the demographic transition model, which of the following is true?\n(A) Birth rates increase and population growth rate is less rapid. (B) Birth rates decline and population growth rate is less rapid. (C) Birth rates increase and population growth rate increases. (D) Birth rates decrease and population growth rate increases.\nA:  (B)\n\nQ: The rate of natural increase of a population is found by subtracting the\n(A) crude death rate from the crude birth date. (B) crude birth rate from the crude death rate. (C) doubling time from the crude birth rate. (D) fertility rate from the crude death rate.\nA:  (A)\n\nQ: Which of the following statements is NOT accurate regarding the services provided by local governments in the United States?\n(A) Duplication of efforts occurs often. (B) Social problems of the central city spill over into the surrounding residential suburbs. (C) Inefficiency in providing services occurs often. (D) One neighborhood's efforts to reduce pollution are always supported by neighboring communities.\nA:  (D)\n\nQ: If you wanted to find the global distribution of coal, you would use a\n(A) reference map. (B) topographic map. (C) thematic map. (D) location map.\nA: ",
        {
          "until": [
            "</s>"
          ]
        }
      ]
    ],
    "resps": [
      [
        "(D)"
      ]
    ],
    "filtered_resps": [
      "(D)"
    ],
    "exact_match": 0.0
  },
  {
    "doc_id": 140,
    "doc": {
      "question": "Which one of the following groups is excluded from the caste system of Hinduism?",
      "subject": "high_school_geography",
      "choices": [
        "Scholar-priests",
        "Warrior-landowners",
        "Businessmen and farmers",
        "Untouchables"
      ],
      "answer": 3
    },
    "target": "(D)",
    "arguments": [
      [
        "The following are multiple choice questions (with answers) about high school geography.\n\nQ: Which one of the following items is an example of nonmaterial culture?\n(A) Dove soap (B) Dove candy bar (C) Dove symbol (D) A dove (bird)\nA:  (C)\n\nQ: During the third stage of the demographic transition model, which of the following is true?\n(A) Birth rates increase and population growth rate is less rapid. (B) Birth rates decline and population growth rate is less rapid. (C) Birth rates increase and population growth rate increases. (D) Birth rates decrease and population growth rate increases.\nA:  (B)\n\nQ: The practice of hiring a foreign third-party service provider to run an operation is called\n(A) outsourcing. (B) offshoring. (C) maquiladoras. (D) locational interdependence.\nA:  (B)\n\nQ: Which of the following statements is NOT accurate regarding the services provided by local governments in the United States?\n(A) Duplication of efforts occurs often. (B) Social problems of the central city spill over into the surrounding residential suburbs. (C) Inefficiency in providing services occurs often. (D) One neighborhood's efforts to reduce pollution are always supported by neighboring communities.\nA:  (D)\n\nQ: The rate of natural increase of a population is found by subtracting the\n(A) crude death rate from the crude birth date. (B) crude birth rate from the crude death rate. (C) doubling time from the crude birth rate. (D) fertility rate from the crude death rate.\nA:  (A)\n\nQ: Which one of the following groups is excluded from the caste system of Hinduism?\n(A) Scholar-priests (B) Warrior-landowners (C) Businessmen and farmers (D) Untouchables\nA: ",
        {
          "until": [
            "</s>"
          ]
        }
      ]
    ],
    "resps": [
      [
        "(D)"
      ]
    ],
    "filtered_resps": [
      "(D)"
    ],
    "exact_match": 1.0
  },
  {
    "doc_id": 148,
    "doc": {
      "question": "Which of the following is NOT a problem Europe currently faces today?",
      "subject": "high_school_geography",
      "choices": [
        "Rising immigration",
        "Lack of population growth",
        "Environmental apathy",
        "Urban ethnic ghettos on the rise"
      ],
      "answer": 2
    },
    "target": "(C)",
    "arguments": [
      [
        "The following are multiple choice questions (with answers) about high school geography.\n\nQ: Which of the following statements is NOT accurate regarding the services provided by local governments in the United States?\n(A) Duplication of efforts occurs often. (B) Social problems of the central city spill over into the surrounding residential suburbs. (C) Inefficiency in providing services occurs often. (D) One neighborhood's efforts to reduce pollution are always supported by neighboring communities.\nA:  (D)\n\nQ: The rate of natural increase of a population is found by subtracting the\n(A) crude death rate from the crude birth date. (B) crude birth rate from the crude death rate. (C) doubling time from the crude birth rate. (D) fertility rate from the crude death rate.\nA:  (A)\n\nQ: The practice of hiring a foreign third-party service provider to run an operation is called\n(A) outsourcing. (B) offshoring. (C) maquiladoras. (D) locational interdependence.\nA:  (B)\n\nQ: During the third stage of the demographic transition model, which of the following is true?\n(A) Birth rates increase and population growth rate is less rapid. (B) Birth rates decline and population growth rate is less rapid. (C) Birth rates increase and population growth rate increases. (D) Birth rates decrease and population growth rate increases.\nA:  (B)\n\nQ: Which one of the following items is an example of nonmaterial culture?\n(A) Dove soap (B) Dove candy bar (C) Dove symbol (D) A dove (bird)\nA:  (C)\n\nQ: Which of the following is NOT a problem Europe currently faces today?\n(A) Rising immigration (B) Lack of population growth (C) Environmental apathy (D) Urban ethnic ghettos on the rise\nA: ",
        {
          "until": [
            "</s>"
          ]
        }
      ]
    ],
    "resps": [
      [
        "(C)"
      ]
    ],
    "filtered_resps": [
      "(C)"
    ],
    "exact_match": 1.0
  },
  {
    "doc_id": 156,
    "doc": {
      "question": "The theory that the main purpose of a settlement or market town is to furnish goods and services to the surrounding market area is called the",
      "subject": "high_school_geography",
      "choices": [
        "urban hierarchy theory.",
        "central place theory.",
        "concentric zone model.",
        "multiplier effect."
      ],
      "answer": 1
    },
    "target": "(B)",
    "arguments": [
      [
        "The following are multiple choice questions (with answers) about high school geography.\n\nQ: The rate of natural increase of a population is found by subtracting the\n(A) crude death rate from the crude birth date. (B) crude birth rate from the crude death rate. (C) doubling time from the crude birth rate. (D) fertility rate from the crude death rate.\nA:  (A)\n\nQ: Which one of the following items is an example of nonmaterial culture?\n(A) Dove soap (B) Dove candy bar (C) Dove symbol (D) A dove (bird)\nA:  (C)\n\nQ: During the third stage of the demographic transition model, which of the following is true?\n(A) Birth rates increase and population growth rate is less rapid. (B) Birth rates decline and population growth rate is less rapid. (C) Birth rates increase and population growth rate increases. (D) Birth rates decrease and population growth rate increases.\nA:  (B)\n\nQ: Which of the following statements is NOT accurate regarding the services provided by local governments in the United States?\n(A) Duplication of efforts occurs often. (B) Social problems of the central city spill over into the surrounding residential suburbs. (C) Inefficiency in providing services occurs often. (D) One neighborhood's efforts to reduce pollution are always supported by neighboring communities.\nA:  (D)\n\nQ: The practice of hiring a foreign third-party service provider to run an operation is called\n(A) outsourcing. (B) offshoring. (C) maquiladoras. (D) locational interdependence.\nA:  (B)\n\nQ: The theory that the main purpose of a settlement or market town is to furnish goods and services to the surrounding market area is called the\n(A) urban hierarchy theory. (B) central place theory. (C) concentric zone model. (D) multiplier effect.\nA: ",
        {
          "until": [
            "</s>"
          ]
        }
      ]
    ],
    "resps": [
      [
        "(B)"
      ]
    ],
    "filtered_resps": [
      "(B)"
    ],
    "exact_match": 1.0
  },
  {
    "doc_id": 164,
    "doc": {
      "question": "An isobar map shows lines connecting all points of equal",
      "subject": "high_school_geography",
      "choices": [
        "atmospheric pressure",
        "surface temperature",
        "elevation",
        "precipitation"
      ],
      "answer": 0
    },
    "target": "(A)",
    "arguments": [
      [
        "The following are multiple choice questions (with answers) about high school geography.\n\nQ: During the third stage of the demographic transition model, which of the following is true?\n(A) Birth rates increase and population growth rate is less rapid. (B) Birth rates decline and population growth rate is less rapid. (C) Birth rates increase and population growth rate increases. (D) Birth rates decrease and population growth rate increases.\nA:  (B)\n\nQ: Which of the following statements is NOT accurate regarding the services provided by local governments in the United States?\n(A) Duplication of efforts occurs often. (B) Social problems of the central city spill over into the surrounding residential suburbs. (C) Inefficiency in providing services occurs often. (D) One neighborhood's efforts to reduce pollution are always supported by neighboring communities.\nA:  (D)\n\nQ: The rate of natural increase of a population is found by subtracting the\n(A) crude death rate from the crude birth date. (B) crude birth rate from the crude death rate. (C) doubling time from the crude birth rate. (D) fertility rate from the crude death rate.\nA:  (A)\n\nQ: The practice of hiring a foreign third-party service provider to run an operation is called\n(A) outsourcing. (B) offshoring. (C) maquiladoras. (D) locational interdependence.\nA:  (B)\n\nQ: Which one of the following items is an example of nonmaterial culture?\n(A) Dove soap (B) Dove candy bar (C) Dove symbol (D) A dove (bird)\nA:  (C)\n\nQ: An isobar map shows lines connecting all points of equal\n(A) atmospheric pressure (B) surface temperature (C) elevation (D) precipitation\nA: ",
        {
          "until": [
            "</s>"
          ]
        }
      ]
    ],
    "resps": [
      [
        "(C)<0x0A><0x0A>"
      ]
    ],
    "filtered_resps": [
      "(C)<0x0A><0x0A>"
    ],
    "exact_match": 0.0
  },
  {
    "doc_id": 172,
    "doc": {
      "question": "In which country does language pose a centrifugal force?",
      "subject": "high_school_geography",
      "choices": [
        "Canada",
        "United States",
        "Brazil",
        "Norway"
      ],
      "answer": 0
    },
    "target": "(A)",
    "arguments": [
      [
        "The following are multiple choice questions (with answers) about high school geography.\n\nQ: During the third stage of the demographic transition model, which of the following is true?\n(A) Birth rates increase and population growth rate is less rapid. (B) Birth rates decline and population growth rate is less rapid. (C) Birth rates increase and population growth rate increases. (D) Birth rates decrease and population growth rate increases.\nA:  (B)\n\nQ: Which of the following statements is NOT accurate regarding the services provided by local governments in the United States?\n(A) Duplication of efforts occurs often. (B) Social problems of the central city spill over into the surrounding residential suburbs. (C) Inefficiency in providing services occurs often. (D) One neighborhood's efforts to reduce pollution are always supported by neighboring communities.\nA:  (D)\n\nQ: Which one of the following items is an example of nonmaterial culture?\n(A) Dove soap (B) Dove candy bar (C) Dove symbol (D) A dove (bird)\nA:  (C)\n\nQ: The rate of natural increase of a population is found by subtracting the\n(A) crude death rate from the crude birth date. (B) crude birth rate from the crude death rate. (C) doubling time from the crude birth rate. (D) fertility rate from the crude death rate.\nA:  (A)\n\nQ: The practice of hiring a foreign third-party service provider to run an operation is called\n(A) outsourcing. (B) offshoring. (C) maquiladoras. (D) locational interdependence.\nA:  (B)\n\nQ: In which country does language pose a centrifugal force?\n(A) Canada (B) United States (C) Brazil (D) Norway\nA: ",
        {
          "until": [
            "</s>"
          ]
        }
      ]
    ],
    "resps": [
      [
        "(C)"
      ]
    ],
    "filtered_resps": [
      "(C)"
    ],
    "exact_match": 0.0
  },
  {
    "doc_id": 180,
    "doc": {
      "question": "Which of the following industries does NOT need to be close to its markets?",
      "subject": "high_school_geography",
      "choices": [
        "Dairy foods",
        "Bulk-gaining products",
        "Single-market products",
        "Bulk-reducing products"
      ],
      "answer": 3
    },
    "target": "(D)",
    "arguments": [
      [
        "The following are multiple choice questions (with answers) about high school geography.\n\nQ: The practice of hiring a foreign third-party service provider to run an operation is called\n(A) outsourcing. (B) offshoring. (C) maquiladoras. (D) locational interdependence.\nA:  (B)\n\nQ: During the third stage of the demographic transition model, which of the following is true?\n(A) Birth rates increase and population growth rate is less rapid. (B) Birth rates decline and population growth rate is less rapid. (C) Birth rates increase and population growth rate increases. (D) Birth rates decrease and population growth rate increases.\nA:  (B)\n\nQ: The rate of natural increase of a population is found by subtracting the\n(A) crude death rate from the crude birth date. (B) crude birth rate from the crude death rate. (C) doubling time from the crude birth rate. (D) fertility rate from the crude death rate.\nA:  (A)\n\nQ: Which one of the following items is an example of nonmaterial culture?\n(A) Dove soap (B) Dove candy bar (C) Dove symbol (D) A dove (bird)\nA:  (C)\n\nQ: Which of the following statements is NOT accurate regarding the services provided by local governments in the United States?\n(A) Duplication of efforts occurs often. (B) Social problems of the central city spill over into the surrounding residential suburbs. (C) Inefficiency in providing services occurs often. (D) One neighborhood's efforts to reduce pollution are always supported by neighboring communities.\nA:  (D)\n\nQ: Which of the following industries does NOT need to be close to its markets?\n(A) Dairy foods (B) Bulk-gaining products (C) Single-market products (D) Bulk-reducing products\nA: ",
        {
          "until": [
            "</s>"
          ]
        }
      ]
    ],
    "resps": [
      [
        "(C)"
      ]
    ],
    "filtered_resps": [
      "(C)"
    ],
    "exact_match": 0.0
  },
  {
    "doc_id": 188,
    "doc": {
      "question": "According to Alfred Weber's least-cost theory, which one of the following costs of production is the most important factor in locating an industry?",
      "subject": "high_school_geography",
      "choices": [
        "Labor",
        "Transport",
        "Raw materials",
        "Agglomeration costs"
      ],
      "answer": 1
    },
    "target": "(B)",
    "arguments": [
      [
        "The following are multiple choice questions (with answers) about high school geography.\n\nQ: During the third stage of the demographic transition model, which of the following is true?\n(A) Birth rates increase and population growth rate is less rapid. (B) Birth rates decline and population growth rate is less rapid. (C) Birth rates increase and population growth rate increases. (D) Birth rates decrease and population growth rate increases.\nA:  (B)\n\nQ: The rate of natural increase of a population is found by subtracting the\n(A) crude death rate from the crude birth date. (B) crude birth rate from the crude death rate. (C) doubling time from the crude birth rate. (D) fertility rate from the crude death rate.\nA:  (A)\n\nQ: Which of the following statements is NOT accurate regarding the services provided by local governments in the United States?\n(A) Duplication of efforts occurs often. (B) Social problems of the central city spill over into the surrounding residential suburbs. (C) Inefficiency in providing services occurs often. (D) One neighborhood's efforts to reduce pollution are always supported by neighboring communities.\nA:  (D)\n\nQ: Which one of the following items is an example of nonmaterial culture?\n(A) Dove soap (B) Dove candy bar (C) Dove symbol (D) A dove (bird)\nA:  (C)\n\nQ: The practice of hiring a foreign third-party service provider to run an operation is called\n(A) outsourcing. (B) offshoring. (C) maquiladoras. (D) locational interdependence.\nA:  (B)\n\nQ: According to Alfred Weber's least-cost theory, which one of the following costs of production is the most important factor in locating an industry?\n(A) Labor (B) Transport (C) Raw materials (D) Agglomeration costs\nA: ",
        {
          "until": [
            "</s>"
          ]
        }
      ]
    ],
    "resps": [
      [
        "(C)"
      ]
    ],
    "filtered_resps": [
      "(C)"
    ],
    "exact_match": 0.0
  },
  {
    "doc_id": 196,
    "doc": {
      "question": "Which pair of religions below share a long-held tradition of cremating their dead?",
      "subject": "high_school_geography",
      "choices": [
        "Hindu and Buddhist",
        "Hindu and Muslim",
        "Muslim and Jewish",
        "Christian and Buddhist"
      ],
      "answer": 0
    },
    "target": "(A)",
    "arguments": [
      [
        "The following are multiple choice questions (with answers) about high school geography.\n\nQ: The practice of hiring a foreign third-party service provider to run an operation is called\n(A) outsourcing. (B) offshoring. (C) maquiladoras. (D) locational interdependence.\nA:  (B)\n\nQ: The rate of natural increase of a population is found by subtracting the\n(A) crude death rate from the crude birth date. (B) crude birth rate from the crude death rate. (C) doubling time from the crude birth rate. (D) fertility rate from the crude death rate.\nA:  (A)\n\nQ: Which of the following statements is NOT accurate regarding the services provided by local governments in the United States?\n(A) Duplication of efforts occurs often. (B) Social problems of the central city spill over into the surrounding residential suburbs. (C) Inefficiency in providing services occurs often. (D) One neighborhood's efforts to reduce pollution are always supported by neighboring communities.\nA:  (D)\n\nQ: During the third stage of the demographic transition model, which of the following is true?\n(A) Birth rates increase and population growth rate is less rapid. (B) Birth rates decline and population growth rate is less rapid. (C) Birth rates increase and population growth rate increases. (D) Birth rates decrease and population growth rate increases.\nA:  (B)\n\nQ: Which one of the following items is an example of nonmaterial culture?\n(A) Dove soap (B) Dove candy bar (C) Dove symbol (D) A dove (bird)\nA:  (C)\n\nQ: Which pair of religions below share a long-held tradition of cremating their dead?\n(A) Hindu and Buddhist (B) Hindu and Muslim (C) Muslim and Jewish (D) Christian and Buddhist\nA: ",
        {
          "until": [
            "</s>"
          ]
        }
      ]
    ],
    "resps": [
      [
        "(B)"
      ]
    ],
    "filtered_resps": [
      "(B)"
    ],
    "exact_match": 0.0
  },
  {
    "doc_id": 5,
    "doc": {
      "question": "All the following factors can be considered pull factors of migration EXCEPT",
      "subject": "high_school_geography",
      "choices": [
        "safety.",
        "better climate.",
        "better schools.",
        "overcrowding."
      ],
      "answer": 3
    },
    "target": "(D)",
    "arguments": [
      [
        "The following are multiple choice questions (with answers) about high school geography.\n\nQ: The practice of hiring a foreign third-party service provider to run an operation is called\n(A) outsourcing. (B) offshoring. (C) maquiladoras. (D) locational interdependence.\nA:  (B)\n\nQ: The rate of natural increase of a population is found by subtracting the\n(A) crude death rate from the crude birth date. (B) crude birth rate from the crude death rate. (C) doubling time from the crude birth rate. (D) fertility rate from the crude death rate.\nA:  (A)\n\nQ: Which one of the following items is an example of nonmaterial culture?\n(A) Dove soap (B) Dove candy bar (C) Dove symbol (D) A dove (bird)\nA:  (C)\n\nQ: Which of the following statements is NOT accurate regarding the services provided by local governments in the United States?\n(A) Duplication of efforts occurs often. (B) Social problems of the central city spill over into the surrounding residential suburbs. (C) Inefficiency in providing services occurs often. (D) One neighborhood's efforts to reduce pollution are always supported by neighboring communities.\nA:  (D)\n\nQ: During the third stage of the demographic transition model, which of the following is true?\n(A) Birth rates increase and population growth rate is less rapid. (B) Birth rates decline and population growth rate is less rapid. (C) Birth rates increase and population growth rate increases. (D) Birth rates decrease and population growth rate increases.\nA:  (B)\n\nQ: All the following factors can be considered pull factors of migration EXCEPT\n(A) safety. (B) better climate. (C) better schools. (D) overcrowding.\nA: ",
        {
          "until": [
            "</s>"
          ]
        }
      ]
    ],
    "resps": [
      [
        "(D)"
      ]
    ],
    "filtered_resps": [
      "(D)"
    ],
    "exact_match": 1.0
  },
  {
    "doc_id": 13,
    "doc": {
      "question": "The outlying area serviced by a urban center is referred to as a",
      "subject": "high_school_geography",
      "choices": [
        "redline area.",
        "threshold.",
        "range.",
        "hinterland."
      ],
      "answer": 3
    },
    "target": "(D)",
    "arguments": [
      [
        "The following are multiple choice questions (with answers) about high school geography.\n\nQ: The rate of natural increase of a population is found by subtracting the\n(A) crude death rate from the crude birth date. (B) crude birth rate from the crude death rate. (C) doubling time from the crude birth rate. (D) fertility rate from the crude death rate.\nA:  (A)\n\nQ: Which one of the following items is an example of nonmaterial culture?\n(A) Dove soap (B) Dove candy bar (C) Dove symbol (D) A dove (bird)\nA:  (C)\n\nQ: During the third stage of the demographic transition model, which of the following is true?\n(A) Birth rates increase and population growth rate is less rapid. (B) Birth rates decline and population growth rate is less rapid. (C) Birth rates increase and population growth rate increases. (D) Birth rates decrease and population growth rate increases.\nA:  (B)\n\nQ: The practice of hiring a foreign third-party service provider to run an operation is called\n(A) outsourcing. (B) offshoring. (C) maquiladoras. (D) locational interdependence.\nA:  (B)\n\nQ: Which of the following statements is NOT accurate regarding the services provided by local governments in the United States?\n(A) Duplication of efforts occurs often. (B) Social problems of the central city spill over into the surrounding residential suburbs. (C) Inefficiency in providing services occurs often. (D) One neighborhood's efforts to reduce pollution are always supported by neighboring communities.\nA:  (D)\n\nQ: The outlying area serviced by a urban center is referred to as a\n(A) redline area. (B) threshold. (C) range. (D) hinterland.\nA: ",
        {
          "until": [
            "</s>"
          ]
        }
      ]
    ],
    "resps": [
      [
        "(D)"
      ]
    ],
    "filtered_resps": [
      "(D)"
    ],
    "exact_match": 1.0
  },
  {
    "doc_id": 21,
    "doc": {
      "question": "The key factor Thomas Malthus failed to recognize in his population theory was",
      "subject": "high_school_geography",
      "choices": [
        "population is limited by their means of subsistence.",
        "all populations have the potential to increase more than the actual rate of increase.",
        "wars and famine inhibit population's reproductive capacity.",
        "technology's ability to raise the Earth's carrying capacity."
      ],
      "answer": 3
    },
    "target": "(D)",
    "arguments": [
      [
        "The following are multiple choice questions (with answers) about high school geography.\n\nQ: The rate of natural increase of a population is found by subtracting the\n(A) crude death rate from the crude birth date. (B) crude birth rate from the crude death rate. (C) doubling time from the crude birth rate. (D) fertility rate from the crude death rate.\nA:  (A)\n\nQ: Which one of the following items is an example of nonmaterial culture?\n(A) Dove soap (B) Dove candy bar (C) Dove symbol (D) A dove (bird)\nA:  (C)\n\nQ: During the third stage of the demographic transition model, which of the following is true?\n(A) Birth rates increase and population growth rate is less rapid. (B) Birth rates decline and population growth rate is less rapid. (C) Birth rates increase and population growth rate increases. (D) Birth rates decrease and population growth rate increases.\nA:  (B)\n\nQ: Which of the following statements is NOT accurate regarding the services provided by local governments in the United States?\n(A) Duplication of efforts occurs often. (B) Social problems of the central city spill over into the surrounding residential suburbs. (C) Inefficiency in providing services occurs often. (D) One neighborhood's efforts to reduce pollution are always supported by neighboring communities.\nA:  (D)\n\nQ: The practice of hiring a foreign third-party service provider to run an operation is called\n(A) outsourcing. (B) offshoring. (C) maquiladoras. (D) locational interdependence.\nA:  (B)\n\nQ: The key factor Thomas Malthus failed to recognize in his population theory was\n(A) population is limited by their means of subsistence. (B) all populations have the potential to increase more than the actual rate of increase. (C) wars and famine inhibit population's reproductive capacity. (D) technology's ability to raise the Earth's carrying capacity.\nA: ",
        {
          "until": [
            "</s>"
          ]
        }
      ]
    ],
    "resps": [
      [
        "(B)"
      ]
    ],
    "filtered_resps": [
      "(B)"
    ],
    "exact_match": 0.0
  },
  {
    "doc_id": 29,
    "doc": {
      "question": "Which type of economic activity is most closely tied to the physical environment?",
      "subject": "high_school_geography",
      "choices": [
        "Primary",
        "Secondary",
        "Tertiary",
        "Quaternary"
      ],
      "answer": 0
    },
    "target": "(A)",
    "arguments": [
      [
        "The following are multiple choice questions (with answers) about high school geography.\n\nQ: During the third stage of the demographic transition model, which of the following is true?\n(A) Birth rates increase and population growth rate is less rapid. (B) Birth rates decline and population growth rate is less rapid. (C) Birth rates increase and population growth rate increases. (D) Birth rates decrease and population growth rate increases.\nA:  (B)\n\nQ: The rate of natural increase of a population is found by subtracting the\n(A) crude death rate from the crude birth date. (B) crude birth rate from the crude death rate. (C) doubling time from the crude birth rate. (D) fertility rate from the crude death rate.\nA:  (A)\n\nQ: The practice of hiring a foreign third-party service provider to run an operation is called\n(A) outsourcing. (B) offshoring. (C) maquiladoras. (D) locational interdependence.\nA:  (B)\n\nQ: Which of the following statements is NOT accurate regarding the services provided by local governments in the United States?\n(A) Duplication of efforts occurs often. (B) Social problems of the central city spill over into the surrounding residential suburbs. (C) Inefficiency in providing services occurs often. (D) One neighborhood's efforts to reduce pollution are always supported by neighboring communities.\nA:  (D)\n\nQ: Which one of the following items is an example of nonmaterial culture?\n(A) Dove soap (B) Dove candy bar (C) Dove symbol (D) A dove (bird)\nA:  (C)\n\nQ: Which type of economic activity is most closely tied to the physical environment?\n(A) Primary (B) Secondary (C) Tertiary (D) Quaternary\nA: ",
        {
          "until": [
            "</s>"
          ]
        }
      ]
    ],
    "resps": [
      [
        "(D)"
      ]
    ],
    "filtered_resps": [
      "(D)"
    ],
    "exact_match": 0.0
  },
  {
    "doc_id": 37,
    "doc": {
      "question": "Which term describes the forces that unify and strengthen a country?",
      "subject": "high_school_geography",
      "choices": [
        "Diffusion",
        "Centrifugal",
        "Centripetal",
        "Ethnocentric"
      ],
      "answer": 2
    },
    "target": "(C)",
    "arguments": [
      [
        "The following are multiple choice questions (with answers) about high school geography.\n\nQ: Which one of the following items is an example of nonmaterial culture?\n(A) Dove soap (B) Dove candy bar (C) Dove symbol (D) A dove (bird)\nA:  (C)\n\nQ: The practice of hiring a foreign third-party service provider to run an operation is called\n(A) outsourcing. (B) offshoring. (C) maquiladoras. (D) locational interdependence.\nA:  (B)\n\nQ: The rate of natural increase of a population is found by subtracting the\n(A) crude death rate from the crude birth date. (B) crude birth rate from the crude death rate. (C) doubling time from the crude birth rate. (D) fertility rate from the crude death rate.\nA:  (A)\n\nQ: Which of the following statements is NOT accurate regarding the services provided by local governments in the United States?\n(A) Duplication of efforts occurs often. (B) Social problems of the central city spill over into the surrounding residential suburbs. (C) Inefficiency in providing services occurs often. (D) One neighborhood's efforts to reduce pollution are always supported by neighboring communities.\nA:  (D)\n\nQ: During the third stage of the demographic transition model, which of the following is true?\n(A) Birth rates increase and population growth rate is less rapid. (B) Birth rates decline and population growth rate is less rapid. (C) Birth rates increase and population growth rate increases. (D) Birth rates decrease and population growth rate increases.\nA:  (B)\n\nQ: Which term describes the forces that unify and strengthen a country?\n(A) Diffusion (B) Centrifugal (C) Centripetal (D) Ethnocentric\nA: ",
        {
          "until": [
            "</s>"
          ]
        }
      ]
    ],
    "resps": [
      [
        "(D)"
      ]
    ],
    "filtered_resps": [
      "(D)"
    ],
    "exact_match": 0.0
  },
  {
    "doc_id": 45,
    "doc": {
      "question": "To get to school in the morning, we ALL use this as our guide:",
      "subject": "high_school_geography",
      "choices": [
        "Rand-McNally Road Atlas.",
        "world globe.",
        "road map.",
        "mental map."
      ],
      "answer": 3
    },
    "target": "(D)",
    "arguments": [
      [
        "The following are multiple choice questions (with answers) about high school geography.\n\nQ: The rate of natural increase of a population is found by subtracting the\n(A) crude death rate from the crude birth date. (B) crude birth rate from the crude death rate. (C) doubling time from the crude birth rate. (D) fertility rate from the crude death rate.\nA:  (A)\n\nQ: Which one of the following items is an example of nonmaterial culture?\n(A) Dove soap (B) Dove candy bar (C) Dove symbol (D) A dove (bird)\nA:  (C)\n\nQ: Which of the following statements is NOT accurate regarding the services provided by local governments in the United States?\n(A) Duplication of efforts occurs often. (B) Social problems of the central city spill over into the surrounding residential suburbs. (C) Inefficiency in providing services occurs often. (D) One neighborhood's efforts to reduce pollution are always supported by neighboring communities.\nA:  (D)\n\nQ: The practice of hiring a foreign third-party service provider to run an operation is called\n(A) outsourcing. (B) offshoring. (C) maquiladoras. (D) locational interdependence.\nA:  (B)\n\nQ: During the third stage of the demographic transition model, which of the following is true?\n(A) Birth rates increase and population growth rate is less rapid. (B) Birth rates decline and population growth rate is less rapid. (C) Birth rates increase and population growth rate increases. (D) Birth rates decrease and population growth rate increases.\nA:  (B)\n\nQ: To get to school in the morning, we ALL use this as our guide:\n(A) Rand-McNally Road Atlas. (B) world globe. (C) road map. (D) mental map.\nA: ",
        {
          "until": [
            "</s>"
          ]
        }
      ]
    ],
    "resps": [
      [
        "(C)"
      ]
    ],
    "filtered_resps": [
      "(C)"
    ],
    "exact_match": 0.0
  },
  {
    "doc_id": 53,
    "doc": {
      "question": "Which one of the statements below is characteristic of most African cities?",
      "subject": "high_school_geography",
      "choices": [
        "They have thriving, clean residential areas.",
        "There are jobs for most rural-to-urban migrants.",
        "They have three separate business districts.",
        "They have a well-developed infrastructure."
      ],
      "answer": 2
    },
    "target": "(C)",
    "arguments": [
      [
        "The following are multiple choice questions (with answers) about high school geography.\n\nQ: Which one of the following items is an example of nonmaterial culture?\n(A) Dove soap (B) Dove candy bar (C) Dove symbol (D) A dove (bird)\nA:  (C)\n\nQ: The rate of natural increase of a population is found by subtracting the\n(A) crude death rate from the crude birth date. (B) crude birth rate from the crude death rate. (C) doubling time from the crude birth rate. (D) fertility rate from the crude death rate.\nA:  (A)\n\nQ: Which of the following statements is NOT accurate regarding the services provided by local governments in the United States?\n(A) Duplication of efforts occurs often. (B) Social problems of the central city spill over into the surrounding residential suburbs. (C) Inefficiency in providing services occurs often. (D) One neighborhood's efforts to reduce pollution are always supported by neighboring communities.\nA:  (D)\n\nQ: During the third stage of the demographic transition model, which of the following is true?\n(A) Birth rates increase and population growth rate is less rapid. (B) Birth rates decline and population growth rate is less rapid. (C) Birth rates increase and population growth rate increases. (D) Birth rates decrease and population growth rate increases.\nA:  (B)\n\nQ: The practice of hiring a foreign third-party service provider to run an operation is called\n(A) outsourcing. (B) offshoring. (C) maquiladoras. (D) locational interdependence.\nA:  (B)\n\nQ: Which one of the statements below is characteristic of most African cities?\n(A) They have thriving, clean residential areas. (B) There are jobs for most rural-to-urban migrants. (C) They have three separate business districts. (D) They have a well-developed infrastructure.\nA: ",
        {
          "until": [
            "</s>"
          ]
        }
      ]
    ],
    "resps": [
      [
        "(D)"
      ]
    ],
    "filtered_resps": [
      "(D)"
    ],
    "exact_match": 0.0
  },
  {
    "doc_id": 61,
    "doc": {
      "question": "The birth of an urban industrial workforce in Europe contributed to the start of the",
      "subject": "high_school_geography",
      "choices": [
        "First Agricultural Revolution.",
        "Second Agricultural Revolution.",
        "Third Agricultural Revolution.",
        "Fourth Agricultural Revolution."
      ],
      "answer": 1
    },
    "target": "(B)",
    "arguments": [
      [
        "The following are multiple choice questions (with answers) about high school geography.\n\nQ: Which of the following statements is NOT accurate regarding the services provided by local governments in the United States?\n(A) Duplication of efforts occurs often. (B) Social problems of the central city spill over into the surrounding residential suburbs. (C) Inefficiency in providing services occurs often. (D) One neighborhood's efforts to reduce pollution are always supported by neighboring communities.\nA:  (D)\n\nQ: Which one of the following items is an example of nonmaterial culture?\n(A) Dove soap (B) Dove candy bar (C) Dove symbol (D) A dove (bird)\nA:  (C)\n\nQ: The rate of natural increase of a population is found by subtracting the\n(A) crude death rate from the crude birth date. (B) crude birth rate from the crude death rate. (C) doubling time from the crude birth rate. (D) fertility rate from the crude death rate.\nA:  (A)\n\nQ: The practice of hiring a foreign third-party service provider to run an operation is called\n(A) outsourcing. (B) offshoring. (C) maquiladoras. (D) locational interdependence.\nA:  (B)\n\nQ: During the third stage of the demographic transition model, which of the following is true?\n(A) Birth rates increase and population growth rate is less rapid. (B) Birth rates decline and population growth rate is less rapid. (C) Birth rates increase and population growth rate increases. (D) Birth rates decrease and population growth rate increases.\nA:  (B)\n\nQ: The birth of an urban industrial workforce in Europe contributed to the start of the\n(A) First Agricultural Revolution. (B) Second Agricultural Revolution. (C) Third Agricultural Revolution. (D) Fourth Agricultural Revolution.\nA: ",
        {
          "until": [
            "</s>"
          ]
        }
      ]
    ],
    "resps": [
      [
        "(C)"
      ]
    ],
    "filtered_resps": [
      "(C)"
    ],
    "exact_match": 0.0
  },
  {
    "doc_id": 69,
    "doc": {
      "question": "The theory that whoever controlled the landmass of Europe would rule the world is called the",
      "subject": "high_school_geography",
      "choices": [
        "devolution theory.",
        "domino theory.",
        "heartland theory.",
        "rimland theory."
      ],
      "answer": 2
    },
    "target": "(C)",
    "arguments": [
      [
        "The following are multiple choice questions (with answers) about high school geography.\n\nQ: Which one of the following items is an example of nonmaterial culture?\n(A) Dove soap (B) Dove candy bar (C) Dove symbol (D) A dove (bird)\nA:  (C)\n\nQ: The rate of natural increase of a population is found by subtracting the\n(A) crude death rate from the crude birth date. (B) crude birth rate from the crude death rate. (C) doubling time from the crude birth rate. (D) fertility rate from the crude death rate.\nA:  (A)\n\nQ: Which of the following statements is NOT accurate regarding the services provided by local governments in the United States?\n(A) Duplication of efforts occurs often. (B) Social problems of the central city spill over into the surrounding residential suburbs. (C) Inefficiency in providing services occurs often. (D) One neighborhood's efforts to reduce pollution are always supported by neighboring communities.\nA:  (D)\n\nQ: The practice of hiring a foreign third-party service provider to run an operation is called\n(A) outsourcing. (B) offshoring. (C) maquiladoras. (D) locational interdependence.\nA:  (B)\n\nQ: During the third stage of the demographic transition model, which of the following is true?\n(A) Birth rates increase and population growth rate is less rapid. (B) Birth rates decline and population growth rate is less rapid. (C) Birth rates increase and population growth rate increases. (D) Birth rates decrease and population growth rate increases.\nA:  (B)\n\nQ: The theory that whoever controlled the landmass of Europe would rule the world is called the\n(A) devolution theory. (B) domino theory. (C) heartland theory. (D) rimland theory.\nA: ",
        {
          "until": [
            "</s>"
          ]
        }
      ]
    ],
    "resps": [
      [
        "(D)"
      ]
    ],
    "filtered_resps": [
      "(D)"
    ],
    "exact_match": 0.0
  },
  {
    "doc_id": 77,
    "doc": {
      "question": "Which of the following characteristics is NOT true of a state?",
      "subject": "high_school_geography",
      "choices": [
        "Independent territory",
        "Internationally recognized",
        "Boundaries",
        "A national language"
      ],
      "answer": 3
    },
    "target": "(D)",
    "arguments": [
      [
        "The following are multiple choice questions (with answers) about high school geography.\n\nQ: Which of the following statements is NOT accurate regarding the services provided by local governments in the United States?\n(A) Duplication of efforts occurs often. (B) Social problems of the central city spill over into the surrounding residential suburbs. (C) Inefficiency in providing services occurs often. (D) One neighborhood's efforts to reduce pollution are always supported by neighboring communities.\nA:  (D)\n\nQ: During the third stage of the demographic transition model, which of the following is true?\n(A) Birth rates increase and population growth rate is less rapid. (B) Birth rates decline and population growth rate is less rapid. (C) Birth rates increase and population growth rate increases. (D) Birth rates decrease and population growth rate increases.\nA:  (B)\n\nQ: Which one of the following items is an example of nonmaterial culture?\n(A) Dove soap (B) Dove candy bar (C) Dove symbol (D) A dove (bird)\nA:  (C)\n\nQ: The practice of hiring a foreign third-party service provider to run an operation is called\n(A) outsourcing. (B) offshoring. (C) maquiladoras. (D) locational interdependence.\nA:  (B)\n\nQ: The rate of natural increase of a population is found by subtracting the\n(A) crude death rate from the crude birth date. (B) crude birth rate from the crude death rate. (C) doubling time from the crude birth rate. (D) fertility rate from the crude death rate.\nA:  (A)\n\nQ: Which of the following characteristics is NOT true of a state?\n(A) Independent territory (B) Internationally recognized (C) Boundaries (D) A national language\nA: ",
        {
          "until": [
            "</s>"
          ]
        }
      ]
    ],
    "resps": [
      [
        "(C)"
      ]
    ],
    "filtered_resps": [
      "(C)"
    ],
    "exact_match": 0.0
  },
  {
    "doc_id": 85,
    "doc": {
      "question": "What family do most European languages belong to?",
      "subject": "high_school_geography",
      "choices": [
        "Ural-Altaic",
        "Basque",
        "Indo-European",
        "Phoenician"
      ],
      "answer": 2
    },
    "target": "(C)",
    "arguments": [
      [
        "The following are multiple choice questions (with answers) about high school geography.\n\nQ: During the third stage of the demographic transition model, which of the following is true?\n(A) Birth rates increase and population growth rate is less rapid. (B) Birth rates decline and population growth rate is less rapid. (C) Birth rates increase and population growth rate increases. (D) Birth rates decrease and population growth rate increases.\nA:  (B)\n\nQ: The rate of natural increase of a population is found by subtracting the\n(A) crude death rate from the crude birth date. (B) crude birth rate from the crude death rate. (C) doubling time from the crude birth rate. (D) fertility rate from the crude death rate.\nA:  (A)\n\nQ: The practice of hiring a foreign third-party service provider to run an operation is called\n(A) outsourcing. (B) offshoring. (C) maquiladoras. (D) locational interdependence.\nA:  (B)\n\nQ: Which one of the following items is an example of nonmaterial culture?\n(A) Dove soap (B) Dove candy bar (C) Dove symbol (D) A dove (bird)\nA:  (C)\n\nQ: Which of the following statements is NOT accurate regarding the services provided by local governments in the United States?\n(A) Duplication of efforts occurs often. (B) Social problems of the central city spill over into the surrounding residential suburbs. (C) Inefficiency in providing services occurs often. (D) One neighborhood's efforts to reduce pollution are always supported by neighboring communities.\nA:  (D)\n\nQ: What family do most European languages belong to?\n(A) Ural-Altaic (B) Basque (C) Indo-European (D) Phoenician\nA: ",
        {
          "until": [
            "</s>"
          ]
        }
      ]
    ],
    "resps": [
      [
        "(C)"
      ]
    ],
    "filtered_resps": [
      "(C)"
    ],
    "exact_match": 1.0
  },
  {
    "doc_id": 93,
    "doc": {
      "question": "In a postindustrial economy, which of the following resources is considered most important to increase productivity?",
      "subject": "high_school_geography",
      "choices": [
        "Energy",
        "Labor",
        "Information",
        "Specialization"
      ],
      "answer": 2
    },
    "target": "(C)",
    "arguments": [
      [
        "The following are multiple choice questions (with answers) about high school geography.\n\nQ: The rate of natural increase of a population is found by subtracting the\n(A) crude death rate from the crude birth date. (B) crude birth rate from the crude death rate. (C) doubling time from the crude birth rate. (D) fertility rate from the crude death rate.\nA:  (A)\n\nQ: During the third stage of the demographic transition model, which of the following is true?\n(A) Birth rates increase and population growth rate is less rapid. (B) Birth rates decline and population growth rate is less rapid. (C) Birth rates increase and population growth rate increases. (D) Birth rates decrease and population growth rate increases.\nA:  (B)\n\nQ: Which one of the following items is an example of nonmaterial culture?\n(A) Dove soap (B) Dove candy bar (C) Dove symbol (D) A dove (bird)\nA:  (C)\n\nQ: Which of the following statements is NOT accurate regarding the services provided by local governments in the United States?\n(A) Duplication of efforts occurs often. (B) Social problems of the central city spill over into the surrounding residential suburbs. (C) Inefficiency in providing services occurs often. (D) One neighborhood's efforts to reduce pollution are always supported by neighboring communities.\nA:  (D)\n\nQ: The practice of hiring a foreign third-party service provider to run an operation is called\n(A) outsourcing. (B) offshoring. (C) maquiladoras. (D) locational interdependence.\nA:  (B)\n\nQ: In a postindustrial economy, which of the following resources is considered most important to increase productivity?\n(A) Energy (B) Labor (C) Information (D) Specialization\nA: ",
        {
          "until": [
            "</s>"
          ]
        }
      ]
    ],
    "resps": [
      [
        "(C)"
      ]
    ],
    "filtered_resps": [
      "(C)"
    ],
    "exact_match": 1.0
  },
  {
    "doc_id": 101,
    "doc": {
      "question": "Which structure(s) traditionally occupies the center of a historic Asian city?",
      "subject": "high_school_geography",
      "choices": [
        "A central market",
        "High-density housing",
        "A religious building",
        "Government office buildings"
      ],
      "answer": 2
    },
    "target": "(C)",
    "arguments": [
      [
        "The following are multiple choice questions (with answers) about high school geography.\n\nQ: The rate of natural increase of a population is found by subtracting the\n(A) crude death rate from the crude birth date. (B) crude birth rate from the crude death rate. (C) doubling time from the crude birth rate. (D) fertility rate from the crude death rate.\nA:  (A)\n\nQ: During the third stage of the demographic transition model, which of the following is true?\n(A) Birth rates increase and population growth rate is less rapid. (B) Birth rates decline and population growth rate is less rapid. (C) Birth rates increase and population growth rate increases. (D) Birth rates decrease and population growth rate increases.\nA:  (B)\n\nQ: Which of the following statements is NOT accurate regarding the services provided by local governments in the United States?\n(A) Duplication of efforts occurs often. (B) Social problems of the central city spill over into the surrounding residential suburbs. (C) Inefficiency in providing services occurs often. (D) One neighborhood's efforts to reduce pollution are always supported by neighboring communities.\nA:  (D)\n\nQ: The practice of hiring a foreign third-party service provider to run an operation is called\n(A) outsourcing. (B) offshoring. (C) maquiladoras. (D) locational interdependence.\nA:  (B)\n\nQ: Which one of the following items is an example of nonmaterial culture?\n(A) Dove soap (B) Dove candy bar (C) Dove symbol (D) A dove (bird)\nA:  (C)\n\nQ: Which structure(s) traditionally occupies the center of a historic Asian city?\n(A) A central market (B) High-density housing (C) A religious building (D) Government office buildings\nA: ",
        {
          "until": [
            "</s>"
          ]
        }
      ]
    ],
    "resps": [
      [
        "(D)"
      ]
    ],
    "filtered_resps": [
      "(D)"
    ],
    "exact_match": 0.0
  },
  {
    "doc_id": 109,
    "doc": {
      "question": "The theory that most migration occurs over a short distance and in steps is attributed to",
      "subject": "high_school_geography",
      "choices": [
        "Rostow.",
        "Ravenstein.",
        "von Th\u00fcnen.",
        "Burgess."
      ],
      "answer": 1
    },
    "target": "(B)",
    "arguments": [
      [
        "The following are multiple choice questions (with answers) about high school geography.\n\nQ: The rate of natural increase of a population is found by subtracting the\n(A) crude death rate from the crude birth date. (B) crude birth rate from the crude death rate. (C) doubling time from the crude birth rate. (D) fertility rate from the crude death rate.\nA:  (A)\n\nQ: The practice of hiring a foreign third-party service provider to run an operation is called\n(A) outsourcing. (B) offshoring. (C) maquiladoras. (D) locational interdependence.\nA:  (B)\n\nQ: During the third stage of the demographic transition model, which of the following is true?\n(A) Birth rates increase and population growth rate is less rapid. (B) Birth rates decline and population growth rate is less rapid. (C) Birth rates increase and population growth rate increases. (D) Birth rates decrease and population growth rate increases.\nA:  (B)\n\nQ: Which one of the following items is an example of nonmaterial culture?\n(A) Dove soap (B) Dove candy bar (C) Dove symbol (D) A dove (bird)\nA:  (C)\n\nQ: Which of the following statements is NOT accurate regarding the services provided by local governments in the United States?\n(A) Duplication of efforts occurs often. (B) Social problems of the central city spill over into the surrounding residential suburbs. (C) Inefficiency in providing services occurs often. (D) One neighborhood's efforts to reduce pollution are always supported by neighboring communities.\nA:  (D)\n\nQ: The theory that most migration occurs over a short distance and in steps is attributed to\n(A) Rostow. (B) Ravenstein. (C) von Th\u00fcnen. (D) Burgess.\nA: ",
        {
          "until": [
            "</s>"
          ]
        }
      ]
    ],
    "resps": [
      [
        "(C)"
      ]
    ],
    "filtered_resps": [
      "(C)"
    ],
    "exact_match": 0.0
  },
  {
    "doc_id": 117,
    "doc": {
      "question": "Which of the following world regions is NOT considered one of the world's most densely populated regions?",
      "subject": "high_school_geography",
      "choices": [
        "South Asia",
        "Europe",
        "South America",
        "Northeast United States"
      ],
      "answer": 2
    },
    "target": "(C)",
    "arguments": [
      [
        "The following are multiple choice questions (with answers) about high school geography.\n\nQ: Which of the following statements is NOT accurate regarding the services provided by local governments in the United States?\n(A) Duplication of efforts occurs often. (B) Social problems of the central city spill over into the surrounding residential suburbs. (C) Inefficiency in providing services occurs often. (D) One neighborhood's efforts to reduce pollution are always supported by neighboring communities.\nA:  (D)\n\nQ: During the third stage of the demographic transition model, which of the following is true?\n(A) Birth rates increase and population growth rate is less rapid. (B) Birth rates decline and population growth rate is less rapid. (C) Birth rates increase and population growth rate increases. (D) Birth rates decrease and population growth rate increases.\nA:  (B)\n\nQ: The practice of hiring a foreign third-party service provider to run an operation is called\n(A) outsourcing. (B) offshoring. (C) maquiladoras. (D) locational interdependence.\nA:  (B)\n\nQ: The rate of natural increase of a population is found by subtracting the\n(A) crude death rate from the crude birth date. (B) crude birth rate from the crude death rate. (C) doubling time from the crude birth rate. (D) fertility rate from the crude death rate.\nA:  (A)\n\nQ: Which one of the following items is an example of nonmaterial culture?\n(A) Dove soap (B) Dove candy bar (C) Dove symbol (D) A dove (bird)\nA:  (C)\n\nQ: Which of the following world regions is NOT considered one of the world's most densely populated regions?\n(A) South Asia (B) Europe (C) South America (D) Northeast United States\nA: ",
        {
          "until": [
            "</s>"
          ]
        }
      ]
    ],
    "resps": [
      [
        "(D)"
      ]
    ],
    "filtered_resps": [
      "(D)"
    ],
    "exact_match": 0.0
  },
  {
    "doc_id": 125,
    "doc": {
      "question": "All of the following are reasons major cities attract young people in Latin America EXCEPT",
      "subject": "high_school_geography",
      "choices": [
        "the availability of jobs.",
        "the potential for decent housing.",
        "educational opportunities.",
        "their families live there already."
      ],
      "answer": 3
    },
    "target": "(D)",
    "arguments": [
      [
        "The following are multiple choice questions (with answers) about high school geography.\n\nQ: The rate of natural increase of a population is found by subtracting the\n(A) crude death rate from the crude birth date. (B) crude birth rate from the crude death rate. (C) doubling time from the crude birth rate. (D) fertility rate from the crude death rate.\nA:  (A)\n\nQ: The practice of hiring a foreign third-party service provider to run an operation is called\n(A) outsourcing. (B) offshoring. (C) maquiladoras. (D) locational interdependence.\nA:  (B)\n\nQ: During the third stage of the demographic transition model, which of the following is true?\n(A) Birth rates increase and population growth rate is less rapid. (B) Birth rates decline and population growth rate is less rapid. (C) Birth rates increase and population growth rate increases. (D) Birth rates decrease and population growth rate increases.\nA:  (B)\n\nQ: Which of the following statements is NOT accurate regarding the services provided by local governments in the United States?\n(A) Duplication of efforts occurs often. (B) Social problems of the central city spill over into the surrounding residential suburbs. (C) Inefficiency in providing services occurs often. (D) One neighborhood's efforts to reduce pollution are always supported by neighboring communities.\nA:  (D)\n\nQ: Which one of the following items is an example of nonmaterial culture?\n(A) Dove soap (B) Dove candy bar (C) Dove symbol (D) A dove (bird)\nA:  (C)\n\nQ: All of the following are reasons major cities attract young people in Latin America EXCEPT\n(A) the availability of jobs. (B) the potential for decent housing. (C) educational opportunities. (D) their families live there already.\nA: ",
        {
          "until": [
            "</s>"
          ]
        }
      ]
    ],
    "resps": [
      [
        "(B)"
      ]
    ],
    "filtered_resps": [
      "(B)"
    ],
    "exact_match": 0.0
  },
  {
    "doc_id": 133,
    "doc": {
      "question": "Which one of the following is NOT a centripetal force in a state?",
      "subject": "high_school_geography",
      "choices": [
        "A high level of confidence in central government",
        "The existence of strong separatist groups",
        "The existence of national transportation networks",
        "The national anthem"
      ],
      "answer": 1
    },
    "target": "(B)",
    "arguments": [
      [
        "The following are multiple choice questions (with answers) about high school geography.\n\nQ: Which one of the following items is an example of nonmaterial culture?\n(A) Dove soap (B) Dove candy bar (C) Dove symbol (D) A dove (bird)\nA:  (C)\n\nQ: The practice of hiring a foreign third-party service provider to run an operation is called\n(A) outsourcing. (B) offshoring. (C) maquiladoras. (D) locational interdependence.\nA:  (B)\n\nQ: During the third stage of the demographic transition model, which of the following is true?\n(A) Birth rates increase and population growth rate is less rapid. (B) Birth rates decline and population growth rate is less rapid. (C) Birth rates increase and population growth rate increases. (D) Birth rates decrease and population growth rate increases.\nA:  (B)\n\nQ: The rate of natural increase of a population is found by subtracting the\n(A) crude death rate from the crude birth date. (B) crude birth rate from the crude death rate. (C) doubling time from the crude birth rate. (D) fertility rate from the crude death rate.\nA:  (A)\n\nQ: Which of the following statements is NOT accurate regarding the services provided by local governments in the United States?\n(A) Duplication of efforts occurs often. (B) Social problems of the central city spill over into the surrounding residential suburbs. (C) Inefficiency in providing services occurs often. (D) One neighborhood's efforts to reduce pollution are always supported by neighboring communities.\nA:  (D)\n\nQ: Which one of the following is NOT a centripetal force in a state?\n(A) A high level of confidence in central government (B) The existence of strong separatist groups (C) The existence of national transportation networks (D) The national anthem\nA: ",
        {
          "until": [
            "</s>"
          ]
        }
      ]
    ],
    "resps": [
      [
        "(B)"
      ]
    ],
    "filtered_resps": [
      "(B)"
    ],
    "exact_match": 1.0
  },
  {
    "doc_id": 141,
    "doc": {
      "question": "Which of the following is a push factor?",
      "subject": "high_school_geography",
      "choices": [
        "Dissatisfaction with current jobs",
        "Higher-paying jobs elsewhere",
        "An attractive retirement community elsewhere",
        "A pleasant climate"
      ],
      "answer": 0
    },
    "target": "(A)",
    "arguments": [
      [
        "The following are multiple choice questions (with answers) about high school geography.\n\nQ: Which one of the following items is an example of nonmaterial culture?\n(A) Dove soap (B) Dove candy bar (C) Dove symbol (D) A dove (bird)\nA:  (C)\n\nQ: During the third stage of the demographic transition model, which of the following is true?\n(A) Birth rates increase and population growth rate is less rapid. (B) Birth rates decline and population growth rate is less rapid. (C) Birth rates increase and population growth rate increases. (D) Birth rates decrease and population growth rate increases.\nA:  (B)\n\nQ: The practice of hiring a foreign third-party service provider to run an operation is called\n(A) outsourcing. (B) offshoring. (C) maquiladoras. (D) locational interdependence.\nA:  (B)\n\nQ: Which of the following statements is NOT accurate regarding the services provided by local governments in the United States?\n(A) Duplication of efforts occurs often. (B) Social problems of the central city spill over into the surrounding residential suburbs. (C) Inefficiency in providing services occurs often. (D) One neighborhood's efforts to reduce pollution are always supported by neighboring communities.\nA:  (D)\n\nQ: The rate of natural increase of a population is found by subtracting the\n(A) crude death rate from the crude birth date. (B) crude birth rate from the crude death rate. (C) doubling time from the crude birth rate. (D) fertility rate from the crude death rate.\nA:  (A)\n\nQ: Which of the following is a push factor?\n(A) Dissatisfaction with current jobs (B) Higher-paying jobs elsewhere (C) An attractive retirement community elsewhere (D) A pleasant climate\nA: ",
        {
          "until": [
            "</s>"
          ]
        }
      ]
    ],
    "resps": [
      [
        "(B)"
      ]
    ],
    "filtered_resps": [
      "(B)"
    ],
    "exact_match": 0.0
  },
  {
    "doc_id": 149,
    "doc": {
      "question": "The world systems theory divides the world into",
      "subject": "high_school_geography",
      "choices": [
        "core, periphery, and semi-periphery.",
        "rich and poor.",
        "developed and undeveloped.",
        "haves and have-nots."
      ],
      "answer": 0
    },
    "target": "(A)",
    "arguments": [
      [
        "The following are multiple choice questions (with answers) about high school geography.\n\nQ: Which of the following statements is NOT accurate regarding the services provided by local governments in the United States?\n(A) Duplication of efforts occurs often. (B) Social problems of the central city spill over into the surrounding residential suburbs. (C) Inefficiency in providing services occurs often. (D) One neighborhood's efforts to reduce pollution are always supported by neighboring communities.\nA:  (D)\n\nQ: The rate of natural increase of a population is found by subtracting the\n(A) crude death rate from the crude birth date. (B) crude birth rate from the crude death rate. (C) doubling time from the crude birth rate. (D) fertility rate from the crude death rate.\nA:  (A)\n\nQ: The practice of hiring a foreign third-party service provider to run an operation is called\n(A) outsourcing. (B) offshoring. (C) maquiladoras. (D) locational interdependence.\nA:  (B)\n\nQ: During the third stage of the demographic transition model, which of the following is true?\n(A) Birth rates increase and population growth rate is less rapid. (B) Birth rates decline and population growth rate is less rapid. (C) Birth rates increase and population growth rate increases. (D) Birth rates decrease and population growth rate increases.\nA:  (B)\n\nQ: Which one of the following items is an example of nonmaterial culture?\n(A) Dove soap (B) Dove candy bar (C) Dove symbol (D) A dove (bird)\nA:  (C)\n\nQ: The world systems theory divides the world into\n(A) core, periphery, and semi-periphery. (B) rich and poor. (C) developed and undeveloped. (D) haves and have-nots.\nA: ",
        {
          "until": [
            "</s>"
          ]
        }
      ]
    ],
    "resps": [
      [
        "(A)<0x0A><0x0A>"
      ]
    ],
    "filtered_resps": [
      "(A)<0x0A><0x0A>"
    ],
    "exact_match": 0.0
  },
  {
    "doc_id": 157,
    "doc": {
      "question": "Which one of the following statements does NOT correctly describe transnational companies (TNCs)?",
      "subject": "high_school_geography",
      "choices": [
        "Many TNCs operate in areas of electronics, chemicals, pharmaceuticals and petroleum.",
        "Most TNCs produce and sell manufactured goods.",
        "Most TNCs are headquartered in the United States, Japan, and the European Union.",
        "TNCs are generally controlled by foreign governments."
      ],
      "answer": 3
    },
    "target": "(D)",
    "arguments": [
      [
        "The following are multiple choice questions (with answers) about high school geography.\n\nQ: The rate of natural increase of a population is found by subtracting the\n(A) crude death rate from the crude birth date. (B) crude birth rate from the crude death rate. (C) doubling time from the crude birth rate. (D) fertility rate from the crude death rate.\nA:  (A)\n\nQ: Which one of the following items is an example of nonmaterial culture?\n(A) Dove soap (B) Dove candy bar (C) Dove symbol (D) A dove (bird)\nA:  (C)\n\nQ: During the third stage of the demographic transition model, which of the following is true?\n(A) Birth rates increase and population growth rate is less rapid. (B) Birth rates decline and population growth rate is less rapid. (C) Birth rates increase and population growth rate increases. (D) Birth rates decrease and population growth rate increases.\nA:  (B)\n\nQ: Which of the following statements is NOT accurate regarding the services provided by local governments in the United States?\n(A) Duplication of efforts occurs often. (B) Social problems of the central city spill over into the surrounding residential suburbs. (C) Inefficiency in providing services occurs often. (D) One neighborhood's efforts to reduce pollution are always supported by neighboring communities.\nA:  (D)\n\nQ: The practice of hiring a foreign third-party service provider to run an operation is called\n(A) outsourcing. (B) offshoring. (C) maquiladoras. (D) locational interdependence.\nA:  (B)\n\nQ: Which one of the following statements does NOT correctly describe transnational companies (TNCs)?\n(A) Many TNCs operate in areas of electronics, chemicals, pharmaceuticals and petroleum. (B) Most TNCs produce and sell manufactured goods. (C) Most TNCs are headquartered in the United States, Japan, and the European Union. (D) TNCs are generally controlled by foreign governments.\nA: ",
        {
          "until": [
            "</s>"
          ]
        }
      ]
    ],
    "resps": [
      [
        "(D)"
      ]
    ],
    "filtered_resps": [
      "(D)"
    ],
    "exact_match": 1.0
  },
  {
    "doc_id": 165,
    "doc": {
      "question": "Ralph purchases garden fertilizer at the nearby garden shop rather than drive 50 miles to the neighboring town for the same product. This reflects which type of spatial interaction?",
      "subject": "high_school_geography",
      "choices": [
        "Transferability",
        "Complementarity",
        "Intervening opportunity",
        "Territoriality"
      ],
      "answer": 2
    },
    "target": "(C)",
    "arguments": [
      [
        "The following are multiple choice questions (with answers) about high school geography.\n\nQ: During the third stage of the demographic transition model, which of the following is true?\n(A) Birth rates increase and population growth rate is less rapid. (B) Birth rates decline and population growth rate is less rapid. (C) Birth rates increase and population growth rate increases. (D) Birth rates decrease and population growth rate increases.\nA:  (B)\n\nQ: Which of the following statements is NOT accurate regarding the services provided by local governments in the United States?\n(A) Duplication of efforts occurs often. (B) Social problems of the central city spill over into the surrounding residential suburbs. (C) Inefficiency in providing services occurs often. (D) One neighborhood's efforts to reduce pollution are always supported by neighboring communities.\nA:  (D)\n\nQ: The rate of natural increase of a population is found by subtracting the\n(A) crude death rate from the crude birth date. (B) crude birth rate from the crude death rate. (C) doubling time from the crude birth rate. (D) fertility rate from the crude death rate.\nA:  (A)\n\nQ: The practice of hiring a foreign third-party service provider to run an operation is called\n(A) outsourcing. (B) offshoring. (C) maquiladoras. (D) locational interdependence.\nA:  (B)\n\nQ: Which one of the following items is an example of nonmaterial culture?\n(A) Dove soap (B) Dove candy bar (C) Dove symbol (D) A dove (bird)\nA:  (C)\n\nQ: Ralph purchases garden fertilizer at the nearby garden shop rather than drive 50 miles to the neighboring town for the same product. This reflects which type of spatial interaction?\n(A) Transferability (B) Complementarity (C) Intervening opportunity (D) Territoriality\nA: ",
        {
          "until": [
            "</s>"
          ]
        }
      ]
    ],
    "resps": [
      [
        "(D)"
      ]
    ],
    "filtered_resps": [
      "(D)"
    ],
    "exact_match": 0.0
  },
  {
    "doc_id": 173,
    "doc": {
      "question": "Quebec is a strong example of which of the following situations?",
      "subject": "high_school_geography",
      "choices": [
        "Irredentism",
        "Secession",
        "Ethnonationalism",
        "A colony"
      ],
      "answer": 2
    },
    "target": "(C)",
    "arguments": [
      [
        "The following are multiple choice questions (with answers) about high school geography.\n\nQ: During the third stage of the demographic transition model, which of the following is true?\n(A) Birth rates increase and population growth rate is less rapid. (B) Birth rates decline and population growth rate is less rapid. (C) Birth rates increase and population growth rate increases. (D) Birth rates decrease and population growth rate increases.\nA:  (B)\n\nQ: Which of the following statements is NOT accurate regarding the services provided by local governments in the United States?\n(A) Duplication of efforts occurs often. (B) Social problems of the central city spill over into the surrounding residential suburbs. (C) Inefficiency in providing services occurs often. (D) One neighborhood's efforts to reduce pollution are always supported by neighboring communities.\nA:  (D)\n\nQ: Which one of the following items is an example of nonmaterial culture?\n(A) Dove soap (B) Dove candy bar (C) Dove symbol (D) A dove (bird)\nA:  (C)\n\nQ: The rate of natural increase of a population is found by subtracting the\n(A) crude death rate from the crude birth date. (B) crude birth rate from the crude death rate. (C) doubling time from the crude birth rate. (D) fertility rate from the crude death rate.\nA:  (A)\n\nQ: The practice of hiring a foreign third-party service provider to run an operation is called\n(A) outsourcing. (B) offshoring. (C) maquiladoras. (D) locational interdependence.\nA:  (B)\n\nQ: Quebec is a strong example of which of the following situations?\n(A) Irredentism (B) Secession (C) Ethnonationalism (D) A colony\nA: ",
        {
          "until": [
            "</s>"
          ]
        }
      ]
    ],
    "resps": [
      [
        "(D)"
      ]
    ],
    "filtered_resps": [
      "(D)"
    ],
    "exact_match": 0.0
  },
  {
    "doc_id": 181,
    "doc": {
      "question": "Which of the following is NOT a characteristic of a city in the developing world?",
      "subject": "high_school_geography",
      "choices": [
        "Contains modern centers of commerce",
        "Has a well-developed infrastructure",
        "Experiences large in-migrations of rural people into the city",
        "Produces a large share of its country's GDI"
      ],
      "answer": 1
    },
    "target": "(B)",
    "arguments": [
      [
        "The following are multiple choice questions (with answers) about high school geography.\n\nQ: The practice of hiring a foreign third-party service provider to run an operation is called\n(A) outsourcing. (B) offshoring. (C) maquiladoras. (D) locational interdependence.\nA:  (B)\n\nQ: During the third stage of the demographic transition model, which of the following is true?\n(A) Birth rates increase and population growth rate is less rapid. (B) Birth rates decline and population growth rate is less rapid. (C) Birth rates increase and population growth rate increases. (D) Birth rates decrease and population growth rate increases.\nA:  (B)\n\nQ: The rate of natural increase of a population is found by subtracting the\n(A) crude death rate from the crude birth date. (B) crude birth rate from the crude death rate. (C) doubling time from the crude birth rate. (D) fertility rate from the crude death rate.\nA:  (A)\n\nQ: Which one of the following items is an example of nonmaterial culture?\n(A) Dove soap (B) Dove candy bar (C) Dove symbol (D) A dove (bird)\nA:  (C)\n\nQ: Which of the following statements is NOT accurate regarding the services provided by local governments in the United States?\n(A) Duplication of efforts occurs often. (B) Social problems of the central city spill over into the surrounding residential suburbs. (C) Inefficiency in providing services occurs often. (D) One neighborhood's efforts to reduce pollution are always supported by neighboring communities.\nA:  (D)\n\nQ: Which of the following is NOT a characteristic of a city in the developing world?\n(A) Contains modern centers of commerce (B) Has a well-developed infrastructure (C) Experiences large in-migrations of rural people into the city (D) Produces a large share of its country's GDI\nA: ",
        {
          "until": [
            "</s>"
          ]
        }
      ]
    ],
    "resps": [
      [
        "(C)"
      ]
    ],
    "filtered_resps": [
      "(C)"
    ],
    "exact_match": 0.0
  },
  {
    "doc_id": 189,
    "doc": {
      "question": "The climate of Great Britain is milder than most other places along the same latitude for which of the following reasons?",
      "subject": "high_school_geography",
      "choices": [
        "The Gulf Stream brings warm waters to Great Britain, raising the temperature of winds that blow onto the island.",
        "Hot springs throughout the country raise the temperature of the surrounding land and air.",
        "Mountain ranges in the north of Great Britain act as a barrier to cold winds blowing from the Arctic.",
        "Small landmasses generate their own local climate and are largely unaffected by latitude."
      ],
      "answer": 0
    },
    "target": "(A)",
    "arguments": [
      [
        "The following are multiple choice questions (with answers) about high school geography.\n\nQ: During the third stage of the demographic transition model, which of the following is true?\n(A) Birth rates increase and population growth rate is less rapid. (B) Birth rates decline and population growth rate is less rapid. (C) Birth rates increase and population growth rate increases. (D) Birth rates decrease and population growth rate increases.\nA:  (B)\n\nQ: The rate of natural increase of a population is found by subtracting the\n(A) crude death rate from the crude birth date. (B) crude birth rate from the crude death rate. (C) doubling time from the crude birth rate. (D) fertility rate from the crude death rate.\nA:  (A)\n\nQ: Which of the following statements is NOT accurate regarding the services provided by local governments in the United States?\n(A) Duplication of efforts occurs often. (B) Social problems of the central city spill over into the surrounding residential suburbs. (C) Inefficiency in providing services occurs often. (D) One neighborhood's efforts to reduce pollution are always supported by neighboring communities.\nA:  (D)\n\nQ: Which one of the following items is an example of nonmaterial culture?\n(A) Dove soap (B) Dove candy bar (C) Dove symbol (D) A dove (bird)\nA:  (C)\n\nQ: The practice of hiring a foreign third-party service provider to run an operation is called\n(A) outsourcing. (B) offshoring. (C) maquiladoras. (D) locational interdependence.\nA:  (B)\n\nQ: The climate of Great Britain is milder than most other places along the same latitude for which of the following reasons?\n(A) The Gulf Stream brings warm waters to Great Britain, raising the temperature of winds that blow onto the island. (B) Hot springs throughout the country raise the temperature of the surrounding land and air. (C) Mountain ranges in the north of Great Britain act as a barrier to cold winds blowing from the Arctic. (D) Small landmasses generate their own local climate and are largely unaffected by latitude.\nA: ",
        {
          "until": [
            "</s>"
          ]
        }
      ]
    ],
    "resps": [
      [
        "(D)"
      ]
    ],
    "filtered_resps": [
      "(D)"
    ],
    "exact_match": 0.0
  },
  {
    "doc_id": 197,
    "doc": {
      "question": "The official languages of Guyana, Suriname, and French Guiana are English, Dutch, and French, respectively. On what continent are those countries located?",
      "subject": "high_school_geography",
      "choices": [
        "North America",
        "South America",
        "Africa",
        "Asia"
      ],
      "answer": 1
    },
    "target": "(B)",
    "arguments": [
      [
        "The following are multiple choice questions (with answers) about high school geography.\n\nQ: The practice of hiring a foreign third-party service provider to run an operation is called\n(A) outsourcing. (B) offshoring. (C) maquiladoras. (D) locational interdependence.\nA:  (B)\n\nQ: The rate of natural increase of a population is found by subtracting the\n(A) crude death rate from the crude birth date. (B) crude birth rate from the crude death rate. (C) doubling time from the crude birth rate. (D) fertility rate from the crude death rate.\nA:  (A)\n\nQ: Which of the following statements is NOT accurate regarding the services provided by local governments in the United States?\n(A) Duplication of efforts occurs often. (B) Social problems of the central city spill over into the surrounding residential suburbs. (C) Inefficiency in providing services occurs often. (D) One neighborhood's efforts to reduce pollution are always supported by neighboring communities.\nA:  (D)\n\nQ: During the third stage of the demographic transition model, which of the following is true?\n(A) Birth rates increase and population growth rate is less rapid. (B) Birth rates decline and population growth rate is less rapid. (C) Birth rates increase and population growth rate increases. (D) Birth rates decrease and population growth rate increases.\nA:  (B)\n\nQ: Which one of the following items is an example of nonmaterial culture?\n(A) Dove soap (B) Dove candy bar (C) Dove symbol (D) A dove (bird)\nA:  (C)\n\nQ: The official languages of Guyana, Suriname, and French Guiana are English, Dutch, and French, respectively. On what continent are those countries located?\n(A) North America (B) South America (C) Africa (D) Asia\nA: ",
        {
          "until": [
            "</s>"
          ]
        }
      ]
    ],
    "resps": [
      [
        "(B)"
      ]
    ],
    "filtered_resps": [
      "(B)"
    ],
    "exact_match": 1.0
  },
  {
    "doc_id": 6,
    "doc": {
      "question": "Which of the following countries does NOT have a well-known example of a relict boundary?",
      "subject": "high_school_geography",
      "choices": [
        "Vietnam",
        "United Kingdom",
        "Germany",
        "Bolivia"
      ],
      "answer": 3
    },
    "target": "(D)",
    "arguments": [
      [
        "The following are multiple choice questions (with answers) about high school geography.\n\nQ: The practice of hiring a foreign third-party service provider to run an operation is called\n(A) outsourcing. (B) offshoring. (C) maquiladoras. (D) locational interdependence.\nA:  (B)\n\nQ: The rate of natural increase of a population is found by subtracting the\n(A) crude death rate from the crude birth date. (B) crude birth rate from the crude death rate. (C) doubling time from the crude birth rate. (D) fertility rate from the crude death rate.\nA:  (A)\n\nQ: Which one of the following items is an example of nonmaterial culture?\n(A) Dove soap (B) Dove candy bar (C) Dove symbol (D) A dove (bird)\nA:  (C)\n\nQ: Which of the following statements is NOT accurate regarding the services provided by local governments in the United States?\n(A) Duplication of efforts occurs often. (B) Social problems of the central city spill over into the surrounding residential suburbs. (C) Inefficiency in providing services occurs often. (D) One neighborhood's efforts to reduce pollution are always supported by neighboring communities.\nA:  (D)\n\nQ: During the third stage of the demographic transition model, which of the following is true?\n(A) Birth rates increase and population growth rate is less rapid. (B) Birth rates decline and population growth rate is less rapid. (C) Birth rates increase and population growth rate increases. (D) Birth rates decrease and population growth rate increases.\nA:  (B)\n\nQ: Which of the following countries does NOT have a well-known example of a relict boundary?\n(A) Vietnam (B) United Kingdom (C) Germany (D) Bolivia\nA: ",
        {
          "until": [
            "</s>"
          ]
        }
      ]
    ],
    "resps": [
      [
        "(D)"
      ]
    ],
    "filtered_resps": [
      "(D)"
    ],
    "exact_match": 1.0
  },
  {
    "doc_id": 14,
    "doc": {
      "question": "The best definition of an urban area is",
      "subject": "high_school_geography",
      "choices": [
        "the central city and its developed areas.",
        "the central city and its surrounding suburbs.",
        "the central city and its hinterlands.",
        "the central city and the adjacent counties."
      ],
      "answer": 1
    },
    "target": "(B)",
    "arguments": [
      [
        "The following are multiple choice questions (with answers) about high school geography.\n\nQ: The rate of natural increase of a population is found by subtracting the\n(A) crude death rate from the crude birth date. (B) crude birth rate from the crude death rate. (C) doubling time from the crude birth rate. (D) fertility rate from the crude death rate.\nA:  (A)\n\nQ: Which one of the following items is an example of nonmaterial culture?\n(A) Dove soap (B) Dove candy bar (C) Dove symbol (D) A dove (bird)\nA:  (C)\n\nQ: During the third stage of the demographic transition model, which of the following is true?\n(A) Birth rates increase and population growth rate is less rapid. (B) Birth rates decline and population growth rate is less rapid. (C) Birth rates increase and population growth rate increases. (D) Birth rates decrease and population growth rate increases.\nA:  (B)\n\nQ: The practice of hiring a foreign third-party service provider to run an operation is called\n(A) outsourcing. (B) offshoring. (C) maquiladoras. (D) locational interdependence.\nA:  (B)\n\nQ: Which of the following statements is NOT accurate regarding the services provided by local governments in the United States?\n(A) Duplication of efforts occurs often. (B) Social problems of the central city spill over into the surrounding residential suburbs. (C) Inefficiency in providing services occurs often. (D) One neighborhood's efforts to reduce pollution are always supported by neighboring communities.\nA:  (D)\n\nQ: The best definition of an urban area is\n(A) the central city and its developed areas. (B) the central city and its surrounding suburbs. (C) the central city and its hinterlands. (D) the central city and the adjacent counties.\nA: ",
        {
          "until": [
            "</s>"
          ]
        }
      ]
    ],
    "resps": [
      [
        "(A)"
      ]
    ],
    "filtered_resps": [
      "(A)"
    ],
    "exact_match": 0.0
  },
  {
    "doc_id": 22,
    "doc": {
      "question": "Which pair of religions are both universalizing religions?",
      "subject": "high_school_geography",
      "choices": [
        "Islam and Judaism",
        "Judaism and Buddhism",
        "Hinduism and Buddhism",
        "Christianity and Buddhism"
      ],
      "answer": 3
    },
    "target": "(D)",
    "arguments": [
      [
        "The following are multiple choice questions (with answers) about high school geography.\n\nQ: The rate of natural increase of a population is found by subtracting the\n(A) crude death rate from the crude birth date. (B) crude birth rate from the crude death rate. (C) doubling time from the crude birth rate. (D) fertility rate from the crude death rate.\nA:  (A)\n\nQ: Which one of the following items is an example of nonmaterial culture?\n(A) Dove soap (B) Dove candy bar (C) Dove symbol (D) A dove (bird)\nA:  (C)\n\nQ: During the third stage of the demographic transition model, which of the following is true?\n(A) Birth rates increase and population growth rate is less rapid. (B) Birth rates decline and population growth rate is less rapid. (C) Birth rates increase and population growth rate increases. (D) Birth rates decrease and population growth rate increases.\nA:  (B)\n\nQ: Which of the following statements is NOT accurate regarding the services provided by local governments in the United States?\n(A) Duplication of efforts occurs often. (B) Social problems of the central city spill over into the surrounding residential suburbs. (C) Inefficiency in providing services occurs often. (D) One neighborhood's efforts to reduce pollution are always supported by neighboring communities.\nA:  (D)\n\nQ: The practice of hiring a foreign third-party service provider to run an operation is called\n(A) outsourcing. (B) offshoring. (C) maquiladoras. (D) locational interdependence.\nA:  (B)\n\nQ: Which pair of religions are both universalizing religions?\n(A) Islam and Judaism (B) Judaism and Buddhism (C) Hinduism and Buddhism (D) Christianity and Buddhism\nA: ",
        {
          "until": [
            "</s>"
          ]
        }
      ]
    ],
    "resps": [
      [
        "(B)"
      ]
    ],
    "filtered_resps": [
      "(B)"
    ],
    "exact_match": 0.0
  },
  {
    "doc_id": 30,
    "doc": {
      "question": "The majority of workers in periphery countries are probably employed in which type of activities?",
      "subject": "high_school_geography",
      "choices": [
        "Primary",
        "Secondary",
        "Tertiary",
        "Quaternary"
      ],
      "answer": 0
    },
    "target": "(A)",
    "arguments": [
      [
        "The following are multiple choice questions (with answers) about high school geography.\n\nQ: During the third stage of the demographic transition model, which of the following is true?\n(A) Birth rates increase and population growth rate is less rapid. (B) Birth rates decline and population growth rate is less rapid. (C) Birth rates increase and population growth rate increases. (D) Birth rates decrease and population growth rate increases.\nA:  (B)\n\nQ: The rate of natural increase of a population is found by subtracting the\n(A) crude death rate from the crude birth date. (B) crude birth rate from the crude death rate. (C) doubling time from the crude birth rate. (D) fertility rate from the crude death rate.\nA:  (A)\n\nQ: The practice of hiring a foreign third-party service provider to run an operation is called\n(A) outsourcing. (B) offshoring. (C) maquiladoras. (D) locational interdependence.\nA:  (B)\n\nQ: Which of the following statements is NOT accurate regarding the services provided by local governments in the United States?\n(A) Duplication of efforts occurs often. (B) Social problems of the central city spill over into the surrounding residential suburbs. (C) Inefficiency in providing services occurs often. (D) One neighborhood's efforts to reduce pollution are always supported by neighboring communities.\nA:  (D)\n\nQ: Which one of the following items is an example of nonmaterial culture?\n(A) Dove soap (B) Dove candy bar (C) Dove symbol (D) A dove (bird)\nA:  (C)\n\nQ: The majority of workers in periphery countries are probably employed in which type of activities?\n(A) Primary (B) Secondary (C) Tertiary (D) Quaternary\nA: ",
        {
          "until": [
            "</s>"
          ]
        }
      ]
    ],
    "resps": [
      [
        "(D)"
      ]
    ],
    "filtered_resps": [
      "(D)"
    ],
    "exact_match": 0.0
  },
  {
    "doc_id": 38,
    "doc": {
      "question": "Which one of the following statements best describes an application of the S-curve?",
      "subject": "high_school_geography",
      "choices": [
        "Graph of the Bantu migration",
        "Graph of the growth of human populations since their first appearance on Earth",
        "The chart showing how cities associate with one another based on their population sizes",
        "A model showing the decrease in population growth for several countries after they industrialize"
      ],
      "answer": 3
    },
    "target": "(D)",
    "arguments": [
      [
        "The following are multiple choice questions (with answers) about high school geography.\n\nQ: Which one of the following items is an example of nonmaterial culture?\n(A) Dove soap (B) Dove candy bar (C) Dove symbol (D) A dove (bird)\nA:  (C)\n\nQ: The practice of hiring a foreign third-party service provider to run an operation is called\n(A) outsourcing. (B) offshoring. (C) maquiladoras. (D) locational interdependence.\nA:  (B)\n\nQ: The rate of natural increase of a population is found by subtracting the\n(A) crude death rate from the crude birth date. (B) crude birth rate from the crude death rate. (C) doubling time from the crude birth rate. (D) fertility rate from the crude death rate.\nA:  (A)\n\nQ: Which of the following statements is NOT accurate regarding the services provided by local governments in the United States?\n(A) Duplication of efforts occurs often. (B) Social problems of the central city spill over into the surrounding residential suburbs. (C) Inefficiency in providing services occurs often. (D) One neighborhood's efforts to reduce pollution are always supported by neighboring communities.\nA:  (D)\n\nQ: During the third stage of the demographic transition model, which of the following is true?\n(A) Birth rates increase and population growth rate is less rapid. (B) Birth rates decline and population growth rate is less rapid. (C) Birth rates increase and population growth rate increases. (D) Birth rates decrease and population growth rate increases.\nA:  (B)\n\nQ: Which one of the following statements best describes an application of the S-curve?\n(A) Graph of the Bantu migration (B) Graph of the growth of human populations since their first appearance on Earth (C) The chart showing how cities associate with one another based on their population sizes (D) A model showing the decrease in population growth for several countries after they industrialize\nA: ",
        {
          "until": [
            "</s>"
          ]
        }
      ]
    ],
    "resps": [
      [
        "(C)"
      ]
    ],
    "filtered_resps": [
      "(C)"
    ],
    "exact_match": 0.0
  },
  {
    "doc_id": 46,
    "doc": {
      "question": "Of these, the map using the smallest map scale would be the map of",
      "subject": "high_school_geography",
      "choices": [
        "the world.",
        "Atlanta, Georgia.",
        "Main Street, Small Town, Ohio.",
        "Pennsylvania."
      ],
      "answer": 0
    },
    "target": "(A)",
    "arguments": [
      [
        "The following are multiple choice questions (with answers) about high school geography.\n\nQ: The rate of natural increase of a population is found by subtracting the\n(A) crude death rate from the crude birth date. (B) crude birth rate from the crude death rate. (C) doubling time from the crude birth rate. (D) fertility rate from the crude death rate.\nA:  (A)\n\nQ: Which one of the following items is an example of nonmaterial culture?\n(A) Dove soap (B) Dove candy bar (C) Dove symbol (D) A dove (bird)\nA:  (C)\n\nQ: Which of the following statements is NOT accurate regarding the services provided by local governments in the United States?\n(A) Duplication of efforts occurs often. (B) Social problems of the central city spill over into the surrounding residential suburbs. (C) Inefficiency in providing services occurs often. (D) One neighborhood's efforts to reduce pollution are always supported by neighboring communities.\nA:  (D)\n\nQ: The practice of hiring a foreign third-party service provider to run an operation is called\n(A) outsourcing. (B) offshoring. (C) maquiladoras. (D) locational interdependence.\nA:  (B)\n\nQ: During the third stage of the demographic transition model, which of the following is true?\n(A) Birth rates increase and population growth rate is less rapid. (B) Birth rates decline and population growth rate is less rapid. (C) Birth rates increase and population growth rate increases. (D) Birth rates decrease and population growth rate increases.\nA:  (B)\n\nQ: Of these, the map using the smallest map scale would be the map of\n(A) the world. (B) Atlanta, Georgia. (C) Main Street, Small Town, Ohio. (D) Pennsylvania.\nA: ",
        {
          "until": [
            "</s>"
          ]
        }
      ]
    ],
    "resps": [
      [
        "(C)"
      ]
    ],
    "filtered_resps": [
      "(C)"
    ],
    "exact_match": 0.0
  },
  {
    "doc_id": 54,
    "doc": {
      "question": "Which country faces a serious trade disadvantage due to its location?",
      "subject": "high_school_geography",
      "choices": [
        "Singapore",
        "Italy",
        "Spain",
        "Mongolia"
      ],
      "answer": 3
    },
    "target": "(D)",
    "arguments": [
      [
        "The following are multiple choice questions (with answers) about high school geography.\n\nQ: Which one of the following items is an example of nonmaterial culture?\n(A) Dove soap (B) Dove candy bar (C) Dove symbol (D) A dove (bird)\nA:  (C)\n\nQ: The rate of natural increase of a population is found by subtracting the\n(A) crude death rate from the crude birth date. (B) crude birth rate from the crude death rate. (C) doubling time from the crude birth rate. (D) fertility rate from the crude death rate.\nA:  (A)\n\nQ: Which of the following statements is NOT accurate regarding the services provided by local governments in the United States?\n(A) Duplication of efforts occurs often. (B) Social problems of the central city spill over into the surrounding residential suburbs. (C) Inefficiency in providing services occurs often. (D) One neighborhood's efforts to reduce pollution are always supported by neighboring communities.\nA:  (D)\n\nQ: During the third stage of the demographic transition model, which of the following is true?\n(A) Birth rates increase and population growth rate is less rapid. (B) Birth rates decline and population growth rate is less rapid. (C) Birth rates increase and population growth rate increases. (D) Birth rates decrease and population growth rate increases.\nA:  (B)\n\nQ: The practice of hiring a foreign third-party service provider to run an operation is called\n(A) outsourcing. (B) offshoring. (C) maquiladoras. (D) locational interdependence.\nA:  (B)\n\nQ: Which country faces a serious trade disadvantage due to its location?\n(A) Singapore (B) Italy (C) Spain (D) Mongolia\nA: ",
        {
          "until": [
            "</s>"
          ]
        }
      ]
    ],
    "resps": [
      [
        "(D)"
      ]
    ],
    "filtered_resps": [
      "(D)"
    ],
    "exact_match": 1.0
  },
  {
    "doc_id": 62,
    "doc": {
      "question": "Which of the following statements about East Asia's industrial regions is true?",
      "subject": "high_school_geography",
      "choices": [
        "Japan has a rich natural resource base.",
        "China lacks natural resources but has a massive labor force.",
        "China is industrializing rapidly.",
        "Taiwan lacks industrial enterprise and an educated workforce."
      ],
      "answer": 2
    },
    "target": "(C)",
    "arguments": [
      [
        "The following are multiple choice questions (with answers) about high school geography.\n\nQ: Which of the following statements is NOT accurate regarding the services provided by local governments in the United States?\n(A) Duplication of efforts occurs often. (B) Social problems of the central city spill over into the surrounding residential suburbs. (C) Inefficiency in providing services occurs often. (D) One neighborhood's efforts to reduce pollution are always supported by neighboring communities.\nA:  (D)\n\nQ: Which one of the following items is an example of nonmaterial culture?\n(A) Dove soap (B) Dove candy bar (C) Dove symbol (D) A dove (bird)\nA:  (C)\n\nQ: The rate of natural increase of a population is found by subtracting the\n(A) crude death rate from the crude birth date. (B) crude birth rate from the crude death rate. (C) doubling time from the crude birth rate. (D) fertility rate from the crude death rate.\nA:  (A)\n\nQ: The practice of hiring a foreign third-party service provider to run an operation is called\n(A) outsourcing. (B) offshoring. (C) maquiladoras. (D) locational interdependence.\nA:  (B)\n\nQ: During the third stage of the demographic transition model, which of the following is true?\n(A) Birth rates increase and population growth rate is less rapid. (B) Birth rates decline and population growth rate is less rapid. (C) Birth rates increase and population growth rate increases. (D) Birth rates decrease and population growth rate increases.\nA:  (B)\n\nQ: Which of the following statements about East Asia's industrial regions is true?\n(A) Japan has a rich natural resource base. (B) China lacks natural resources but has a massive labor force. (C) China is industrializing rapidly. (D) Taiwan lacks industrial enterprise and an educated workforce.\nA: ",
        {
          "until": [
            "</s>"
          ]
        }
      ]
    ],
    "resps": [
      [
        "(B)"
      ]
    ],
    "filtered_resps": [
      "(B)"
    ],
    "exact_match": 0.0
  },
  {
    "doc_id": 70,
    "doc": {
      "question": "Which group represents the Persian (Iranian) variation of Islam and believes in the infallibility and divine right to authority of the Imams descended from Ali?",
      "subject": "high_school_geography",
      "choices": [
        "Sunni",
        "Shiite",
        "Imam",
        "Untouchables"
      ],
      "answer": 1
    },
    "target": "(B)",
    "arguments": [
      [
        "The following are multiple choice questions (with answers) about high school geography.\n\nQ: Which one of the following items is an example of nonmaterial culture?\n(A) Dove soap (B) Dove candy bar (C) Dove symbol (D) A dove (bird)\nA:  (C)\n\nQ: The rate of natural increase of a population is found by subtracting the\n(A) crude death rate from the crude birth date. (B) crude birth rate from the crude death rate. (C) doubling time from the crude birth rate. (D) fertility rate from the crude death rate.\nA:  (A)\n\nQ: Which of the following statements is NOT accurate regarding the services provided by local governments in the United States?\n(A) Duplication of efforts occurs often. (B) Social problems of the central city spill over into the surrounding residential suburbs. (C) Inefficiency in providing services occurs often. (D) One neighborhood's efforts to reduce pollution are always supported by neighboring communities.\nA:  (D)\n\nQ: The practice of hiring a foreign third-party service provider to run an operation is called\n(A) outsourcing. (B) offshoring. (C) maquiladoras. (D) locational interdependence.\nA:  (B)\n\nQ: During the third stage of the demographic transition model, which of the following is true?\n(A) Birth rates increase and population growth rate is less rapid. (B) Birth rates decline and population growth rate is less rapid. (C) Birth rates increase and population growth rate increases. (D) Birth rates decrease and population growth rate increases.\nA:  (B)\n\nQ: Which group represents the Persian (Iranian) variation of Islam and believes in the infallibility and divine right to authority of the Imams descended from Ali?\n(A) Sunni (B) Shiite (C) Imam (D) Untouchables\nA: ",
        {
          "until": [
            "</s>"
          ]
        }
      ]
    ],
    "resps": [
      [
        "(C)"
      ]
    ],
    "filtered_resps": [
      "(C)"
    ],
    "exact_match": 0.0
  },
  {
    "doc_id": 78,
    "doc": {
      "question": "You are planning to move from your hometown to Pittsburgh. Along the way, you stop in Columbus, Ohio to visit a relative and fall in love with the city! You decide to stay and make Columbus your new home. This is an example of",
      "subject": "high_school_geography",
      "choices": [
        "intervening opportunity.",
        "distance decay.",
        "involuntary migration.",
        "push-pull factors."
      ],
      "answer": 0
    },
    "target": "(A)",
    "arguments": [
      [
        "The following are multiple choice questions (with answers) about high school geography.\n\nQ: Which of the following statements is NOT accurate regarding the services provided by local governments in the United States?\n(A) Duplication of efforts occurs often. (B) Social problems of the central city spill over into the surrounding residential suburbs. (C) Inefficiency in providing services occurs often. (D) One neighborhood's efforts to reduce pollution are always supported by neighboring communities.\nA:  (D)\n\nQ: During the third stage of the demographic transition model, which of the following is true?\n(A) Birth rates increase and population growth rate is less rapid. (B) Birth rates decline and population growth rate is less rapid. (C) Birth rates increase and population growth rate increases. (D) Birth rates decrease and population growth rate increases.\nA:  (B)\n\nQ: Which one of the following items is an example of nonmaterial culture?\n(A) Dove soap (B) Dove candy bar (C) Dove symbol (D) A dove (bird)\nA:  (C)\n\nQ: The practice of hiring a foreign third-party service provider to run an operation is called\n(A) outsourcing. (B) offshoring. (C) maquiladoras. (D) locational interdependence.\nA:  (B)\n\nQ: The rate of natural increase of a population is found by subtracting the\n(A) crude death rate from the crude birth date. (B) crude birth rate from the crude death rate. (C) doubling time from the crude birth rate. (D) fertility rate from the crude death rate.\nA:  (A)\n\nQ: You are planning to move from your hometown to Pittsburgh. Along the way, you stop in Columbus, Ohio to visit a relative and fall in love with the city! You decide to stay and make Columbus your new home. This is an example of\n(A) intervening opportunity. (B) distance decay. (C) involuntary migration. (D) push-pull factors.\nA: ",
        {
          "until": [
            "</s>"
          ]
        }
      ]
    ],
    "resps": [
      [
        "(C)<0x0A><0x0A>"
      ]
    ],
    "filtered_resps": [
      "(C)<0x0A><0x0A>"
    ],
    "exact_match": 0.0
  },
  {
    "doc_id": 86,
    "doc": {
      "question": "What do the terms apartheid, ethnic cleansing, and integration all have in common?",
      "subject": "high_school_geography",
      "choices": [
        "They all occurred in Nazi Germany during World War I.",
        "They are all forms of residential segregation.",
        "They are all ways to integrate different ethnic populations in neighborhoods.",
        "They are different expressions for the same concept."
      ],
      "answer": 1
    },
    "target": "(B)",
    "arguments": [
      [
        "The following are multiple choice questions (with answers) about high school geography.\n\nQ: During the third stage of the demographic transition model, which of the following is true?\n(A) Birth rates increase and population growth rate is less rapid. (B) Birth rates decline and population growth rate is less rapid. (C) Birth rates increase and population growth rate increases. (D) Birth rates decrease and population growth rate increases.\nA:  (B)\n\nQ: The rate of natural increase of a population is found by subtracting the\n(A) crude death rate from the crude birth date. (B) crude birth rate from the crude death rate. (C) doubling time from the crude birth rate. (D) fertility rate from the crude death rate.\nA:  (A)\n\nQ: The practice of hiring a foreign third-party service provider to run an operation is called\n(A) outsourcing. (B) offshoring. (C) maquiladoras. (D) locational interdependence.\nA:  (B)\n\nQ: Which one of the following items is an example of nonmaterial culture?\n(A) Dove soap (B) Dove candy bar (C) Dove symbol (D) A dove (bird)\nA:  (C)\n\nQ: Which of the following statements is NOT accurate regarding the services provided by local governments in the United States?\n(A) Duplication of efforts occurs often. (B) Social problems of the central city spill over into the surrounding residential suburbs. (C) Inefficiency in providing services occurs often. (D) One neighborhood's efforts to reduce pollution are always supported by neighboring communities.\nA:  (D)\n\nQ: What do the terms apartheid, ethnic cleansing, and integration all have in common?\n(A) They all occurred in Nazi Germany during World War I. (B) They are all forms of residential segregation. (C) They are all ways to integrate different ethnic populations in neighborhoods. (D) They are different expressions for the same concept.\nA: ",
        {
          "until": [
            "</s>"
          ]
        }
      ]
    ],
    "resps": [
      [
        "(B)"
      ]
    ],
    "filtered_resps": [
      "(B)"
    ],
    "exact_match": 1.0
  },
  {
    "doc_id": 94,
    "doc": {
      "question": "A city that is more than twice as large as the next largest city in a country is called a",
      "subject": "high_school_geography",
      "choices": [
        "global city.",
        "world leader city.",
        "megalopolis.",
        "primate city."
      ],
      "answer": 3
    },
    "target": "(D)",
    "arguments": [
      [
        "The following are multiple choice questions (with answers) about high school geography.\n\nQ: The rate of natural increase of a population is found by subtracting the\n(A) crude death rate from the crude birth date. (B) crude birth rate from the crude death rate. (C) doubling time from the crude birth rate. (D) fertility rate from the crude death rate.\nA:  (A)\n\nQ: During the third stage of the demographic transition model, which of the following is true?\n(A) Birth rates increase and population growth rate is less rapid. (B) Birth rates decline and population growth rate is less rapid. (C) Birth rates increase and population growth rate increases. (D) Birth rates decrease and population growth rate increases.\nA:  (B)\n\nQ: Which one of the following items is an example of nonmaterial culture?\n(A) Dove soap (B) Dove candy bar (C) Dove symbol (D) A dove (bird)\nA:  (C)\n\nQ: Which of the following statements is NOT accurate regarding the services provided by local governments in the United States?\n(A) Duplication of efforts occurs often. (B) Social problems of the central city spill over into the surrounding residential suburbs. (C) Inefficiency in providing services occurs often. (D) One neighborhood's efforts to reduce pollution are always supported by neighboring communities.\nA:  (D)\n\nQ: The practice of hiring a foreign third-party service provider to run an operation is called\n(A) outsourcing. (B) offshoring. (C) maquiladoras. (D) locational interdependence.\nA:  (B)\n\nQ: A city that is more than twice as large as the next largest city in a country is called a\n(A) global city. (B) world leader city. (C) megalopolis. (D) primate city.\nA: ",
        {
          "until": [
            "</s>"
          ]
        }
      ]
    ],
    "resps": [
      [
        "(C)"
      ]
    ],
    "filtered_resps": [
      "(C)"
    ],
    "exact_match": 0.0
  },
  {
    "doc_id": 102,
    "doc": {
      "question": "Which description best describes the urban hierarchy model in which the population of a city is inversely proportional to its rank in the hierarchy?",
      "subject": "high_school_geography",
      "choices": [
        "Multiplier effect",
        "Rank-size rule",
        "Central place theory",
        "Burgess's sector model"
      ],
      "answer": 1
    },
    "target": "(B)",
    "arguments": [
      [
        "The following are multiple choice questions (with answers) about high school geography.\n\nQ: The rate of natural increase of a population is found by subtracting the\n(A) crude death rate from the crude birth date. (B) crude birth rate from the crude death rate. (C) doubling time from the crude birth rate. (D) fertility rate from the crude death rate.\nA:  (A)\n\nQ: During the third stage of the demographic transition model, which of the following is true?\n(A) Birth rates increase and population growth rate is less rapid. (B) Birth rates decline and population growth rate is less rapid. (C) Birth rates increase and population growth rate increases. (D) Birth rates decrease and population growth rate increases.\nA:  (B)\n\nQ: Which of the following statements is NOT accurate regarding the services provided by local governments in the United States?\n(A) Duplication of efforts occurs often. (B) Social problems of the central city spill over into the surrounding residential suburbs. (C) Inefficiency in providing services occurs often. (D) One neighborhood's efforts to reduce pollution are always supported by neighboring communities.\nA:  (D)\n\nQ: The practice of hiring a foreign third-party service provider to run an operation is called\n(A) outsourcing. (B) offshoring. (C) maquiladoras. (D) locational interdependence.\nA:  (B)\n\nQ: Which one of the following items is an example of nonmaterial culture?\n(A) Dove soap (B) Dove candy bar (C) Dove symbol (D) A dove (bird)\nA:  (C)\n\nQ: Which description best describes the urban hierarchy model in which the population of a city is inversely proportional to its rank in the hierarchy?\n(A) Multiplier effect (B) Rank-size rule (C) Central place theory (D) Burgess's sector model\nA: ",
        {
          "until": [
            "</s>"
          ]
        }
      ]
    ],
    "resps": [
      [
        "(B)"
      ]
    ],
    "filtered_resps": [
      "(B)"
    ],
    "exact_match": 1.0
  },
  {
    "doc_id": 110,
    "doc": {
      "question": "The way of life based on breeding and herding of animals that are used as a source of food, shelter, and clothing is called",
      "subject": "high_school_geography",
      "choices": [
        "swidden.",
        "subsistence farming.",
        "pastorialism.",
        "hunting and gathering."
      ],
      "answer": 2
    },
    "target": "(C)",
    "arguments": [
      [
        "The following are multiple choice questions (with answers) about high school geography.\n\nQ: The rate of natural increase of a population is found by subtracting the\n(A) crude death rate from the crude birth date. (B) crude birth rate from the crude death rate. (C) doubling time from the crude birth rate. (D) fertility rate from the crude death rate.\nA:  (A)\n\nQ: The practice of hiring a foreign third-party service provider to run an operation is called\n(A) outsourcing. (B) offshoring. (C) maquiladoras. (D) locational interdependence.\nA:  (B)\n\nQ: During the third stage of the demographic transition model, which of the following is true?\n(A) Birth rates increase and population growth rate is less rapid. (B) Birth rates decline and population growth rate is less rapid. (C) Birth rates increase and population growth rate increases. (D) Birth rates decrease and population growth rate increases.\nA:  (B)\n\nQ: Which one of the following items is an example of nonmaterial culture?\n(A) Dove soap (B) Dove candy bar (C) Dove symbol (D) A dove (bird)\nA:  (C)\n\nQ: Which of the following statements is NOT accurate regarding the services provided by local governments in the United States?\n(A) Duplication of efforts occurs often. (B) Social problems of the central city spill over into the surrounding residential suburbs. (C) Inefficiency in providing services occurs often. (D) One neighborhood's efforts to reduce pollution are always supported by neighboring communities.\nA:  (D)\n\nQ: The way of life based on breeding and herding of animals that are used as a source of food, shelter, and clothing is called\n(A) swidden. (B) subsistence farming. (C) pastorialism. (D) hunting and gathering.\nA: ",
        {
          "until": [
            "</s>"
          ]
        }
      ]
    ],
    "resps": [
      [
        "(D)"
      ]
    ],
    "filtered_resps": [
      "(D)"
    ],
    "exact_match": 0.0
  },
  {
    "doc_id": 118,
    "doc": {
      "question": "Olives, grapes, and chickpeas are staple crops of which type of farming?",
      "subject": "high_school_geography",
      "choices": [
        "Pastoral nomadism",
        "Subsistence",
        "Plantation",
        "Mediterranean"
      ],
      "answer": 3
    },
    "target": "(D)",
    "arguments": [
      [
        "The following are multiple choice questions (with answers) about high school geography.\n\nQ: Which of the following statements is NOT accurate regarding the services provided by local governments in the United States?\n(A) Duplication of efforts occurs often. (B) Social problems of the central city spill over into the surrounding residential suburbs. (C) Inefficiency in providing services occurs often. (D) One neighborhood's efforts to reduce pollution are always supported by neighboring communities.\nA:  (D)\n\nQ: During the third stage of the demographic transition model, which of the following is true?\n(A) Birth rates increase and population growth rate is less rapid. (B) Birth rates decline and population growth rate is less rapid. (C) Birth rates increase and population growth rate increases. (D) Birth rates decrease and population growth rate increases.\nA:  (B)\n\nQ: The practice of hiring a foreign third-party service provider to run an operation is called\n(A) outsourcing. (B) offshoring. (C) maquiladoras. (D) locational interdependence.\nA:  (B)\n\nQ: The rate of natural increase of a population is found by subtracting the\n(A) crude death rate from the crude birth date. (B) crude birth rate from the crude death rate. (C) doubling time from the crude birth rate. (D) fertility rate from the crude death rate.\nA:  (A)\n\nQ: Which one of the following items is an example of nonmaterial culture?\n(A) Dove soap (B) Dove candy bar (C) Dove symbol (D) A dove (bird)\nA:  (C)\n\nQ: Olives, grapes, and chickpeas are staple crops of which type of farming?\n(A) Pastoral nomadism (B) Subsistence (C) Plantation (D) Mediterranean\nA: ",
        {
          "until": [
            "</s>"
          ]
        }
      ]
    ],
    "resps": [
      [
        "(A)<0x0A><0x0A>"
      ]
    ],
    "filtered_resps": [
      "(A)<0x0A><0x0A>"
    ],
    "exact_match": 0.0
  },
  {
    "doc_id": 126,
    "doc": {
      "question": "Which language family is most widely spoken in North America and Europe and includes Baltic, Celtic, Germanic, and Greek?",
      "subject": "high_school_geography",
      "choices": [
        "Dravidian",
        "Uralic-Altaic",
        "Sino-Tibetan",
        "Indo-European"
      ],
      "answer": 3
    },
    "target": "(D)",
    "arguments": [
      [
        "The following are multiple choice questions (with answers) about high school geography.\n\nQ: The rate of natural increase of a population is found by subtracting the\n(A) crude death rate from the crude birth date. (B) crude birth rate from the crude death rate. (C) doubling time from the crude birth rate. (D) fertility rate from the crude death rate.\nA:  (A)\n\nQ: The practice of hiring a foreign third-party service provider to run an operation is called\n(A) outsourcing. (B) offshoring. (C) maquiladoras. (D) locational interdependence.\nA:  (B)\n\nQ: During the third stage of the demographic transition model, which of the following is true?\n(A) Birth rates increase and population growth rate is less rapid. (B) Birth rates decline and population growth rate is less rapid. (C) Birth rates increase and population growth rate increases. (D) Birth rates decrease and population growth rate increases.\nA:  (B)\n\nQ: Which of the following statements is NOT accurate regarding the services provided by local governments in the United States?\n(A) Duplication of efforts occurs often. (B) Social problems of the central city spill over into the surrounding residential suburbs. (C) Inefficiency in providing services occurs often. (D) One neighborhood's efforts to reduce pollution are always supported by neighboring communities.\nA:  (D)\n\nQ: Which one of the following items is an example of nonmaterial culture?\n(A) Dove soap (B) Dove candy bar (C) Dove symbol (D) A dove (bird)\nA:  (C)\n\nQ: Which language family is most widely spoken in North America and Europe and includes Baltic, Celtic, Germanic, and Greek?\n(A) Dravidian (B) Uralic-Altaic (C) Sino-Tibetan (D) Indo-European\nA: ",
        {
          "until": [
            "</s>"
          ]
        }
      ]
    ],
    "resps": [
      [
        "(D)"
      ]
    ],
    "filtered_resps": [
      "(D)"
    ],
    "exact_match": 1.0
  },
  {
    "doc_id": 134,
    "doc": {
      "question": "The cities of Varanasi (Benares) in India and Mecca in Saudi Arabia are alike because both are",
      "subject": "high_school_geography",
      "choices": [
        "capitals of countries formerly colonized by the English",
        "destinations for vast numbers of pilgrims",
        "financial centers for a large fraction of the world's economy",
        "examples of modern urban planning"
      ],
      "answer": 1
    },
    "target": "(B)",
    "arguments": [
      [
        "The following are multiple choice questions (with answers) about high school geography.\n\nQ: Which one of the following items is an example of nonmaterial culture?\n(A) Dove soap (B) Dove candy bar (C) Dove symbol (D) A dove (bird)\nA:  (C)\n\nQ: The practice of hiring a foreign third-party service provider to run an operation is called\n(A) outsourcing. (B) offshoring. (C) maquiladoras. (D) locational interdependence.\nA:  (B)\n\nQ: During the third stage of the demographic transition model, which of the following is true?\n(A) Birth rates increase and population growth rate is less rapid. (B) Birth rates decline and population growth rate is less rapid. (C) Birth rates increase and population growth rate increases. (D) Birth rates decrease and population growth rate increases.\nA:  (B)\n\nQ: The rate of natural increase of a population is found by subtracting the\n(A) crude death rate from the crude birth date. (B) crude birth rate from the crude death rate. (C) doubling time from the crude birth rate. (D) fertility rate from the crude death rate.\nA:  (A)\n\nQ: Which of the following statements is NOT accurate regarding the services provided by local governments in the United States?\n(A) Duplication of efforts occurs often. (B) Social problems of the central city spill over into the surrounding residential suburbs. (C) Inefficiency in providing services occurs often. (D) One neighborhood's efforts to reduce pollution are always supported by neighboring communities.\nA:  (D)\n\nQ: The cities of Varanasi (Benares) in India and Mecca in Saudi Arabia are alike because both are\n(A) capitals of countries formerly colonized by the English (B) destinations for vast numbers of pilgrims (C) financial centers for a large fraction of the world's economy (D) examples of modern urban planning\nA: ",
        {
          "until": [
            "</s>"
          ]
        }
      ]
    ],
    "resps": [
      [
        "(B)"
      ]
    ],
    "filtered_resps": [
      "(B)"
    ],
    "exact_match": 1.0
  },
  {
    "doc_id": 142,
    "doc": {
      "question": "The Basques, Bretons, Kashmiris, and Tamils are all examples of",
      "subject": "high_school_geography",
      "choices": [
        "regionalist groups.",
        "separatist groups.",
        "terrorist groups.",
        "interventionist groups."
      ],
      "answer": 1
    },
    "target": "(B)",
    "arguments": [
      [
        "The following are multiple choice questions (with answers) about high school geography.\n\nQ: Which one of the following items is an example of nonmaterial culture?\n(A) Dove soap (B) Dove candy bar (C) Dove symbol (D) A dove (bird)\nA:  (C)\n\nQ: During the third stage of the demographic transition model, which of the following is true?\n(A) Birth rates increase and population growth rate is less rapid. (B) Birth rates decline and population growth rate is less rapid. (C) Birth rates increase and population growth rate increases. (D) Birth rates decrease and population growth rate increases.\nA:  (B)\n\nQ: The practice of hiring a foreign third-party service provider to run an operation is called\n(A) outsourcing. (B) offshoring. (C) maquiladoras. (D) locational interdependence.\nA:  (B)\n\nQ: Which of the following statements is NOT accurate regarding the services provided by local governments in the United States?\n(A) Duplication of efforts occurs often. (B) Social problems of the central city spill over into the surrounding residential suburbs. (C) Inefficiency in providing services occurs often. (D) One neighborhood's efforts to reduce pollution are always supported by neighboring communities.\nA:  (D)\n\nQ: The rate of natural increase of a population is found by subtracting the\n(A) crude death rate from the crude birth date. (B) crude birth rate from the crude death rate. (C) doubling time from the crude birth rate. (D) fertility rate from the crude death rate.\nA:  (A)\n\nQ: The Basques, Bretons, Kashmiris, and Tamils are all examples of\n(A) regionalist groups. (B) separatist groups. (C) terrorist groups. (D) interventionist groups.\nA: ",
        {
          "until": [
            "</s>"
          ]
        }
      ]
    ],
    "resps": [
      [
        "(B)"
      ]
    ],
    "filtered_resps": [
      "(B)"
    ],
    "exact_match": 1.0
  },
  {
    "doc_id": 150,
    "doc": {
      "question": "The majority of Kurds are found in which country?",
      "subject": "high_school_geography",
      "choices": [
        "Iran",
        "Iraq",
        "Turkey",
        "Egypt"
      ],
      "answer": 2
    },
    "target": "(C)",
    "arguments": [
      [
        "The following are multiple choice questions (with answers) about high school geography.\n\nQ: Which of the following statements is NOT accurate regarding the services provided by local governments in the United States?\n(A) Duplication of efforts occurs often. (B) Social problems of the central city spill over into the surrounding residential suburbs. (C) Inefficiency in providing services occurs often. (D) One neighborhood's efforts to reduce pollution are always supported by neighboring communities.\nA:  (D)\n\nQ: The rate of natural increase of a population is found by subtracting the\n(A) crude death rate from the crude birth date. (B) crude birth rate from the crude death rate. (C) doubling time from the crude birth rate. (D) fertility rate from the crude death rate.\nA:  (A)\n\nQ: The practice of hiring a foreign third-party service provider to run an operation is called\n(A) outsourcing. (B) offshoring. (C) maquiladoras. (D) locational interdependence.\nA:  (B)\n\nQ: During the third stage of the demographic transition model, which of the following is true?\n(A) Birth rates increase and population growth rate is less rapid. (B) Birth rates decline and population growth rate is less rapid. (C) Birth rates increase and population growth rate increases. (D) Birth rates decrease and population growth rate increases.\nA:  (B)\n\nQ: Which one of the following items is an example of nonmaterial culture?\n(A) Dove soap (B) Dove candy bar (C) Dove symbol (D) A dove (bird)\nA:  (C)\n\nQ: The majority of Kurds are found in which country?\n(A) Iran (B) Iraq (C) Turkey (D) Egypt\nA: ",
        {
          "until": [
            "</s>"
          ]
        }
      ]
    ],
    "resps": [
      [
        "(D)"
      ]
    ],
    "filtered_resps": [
      "(D)"
    ],
    "exact_match": 0.0
  },
  {
    "doc_id": 158,
    "doc": {
      "question": "The \"melting pot\" theory of combining several immigrant groups into one mainstream culture is called",
      "subject": "high_school_geography",
      "choices": [
        "amalgamation theory.",
        "acculturation.",
        "ethnic islands.",
        "ethnic clustering."
      ],
      "answer": 0
    },
    "target": "(A)",
    "arguments": [
      [
        "The following are multiple choice questions (with answers) about high school geography.\n\nQ: The rate of natural increase of a population is found by subtracting the\n(A) crude death rate from the crude birth date. (B) crude birth rate from the crude death rate. (C) doubling time from the crude birth rate. (D) fertility rate from the crude death rate.\nA:  (A)\n\nQ: Which one of the following items is an example of nonmaterial culture?\n(A) Dove soap (B) Dove candy bar (C) Dove symbol (D) A dove (bird)\nA:  (C)\n\nQ: During the third stage of the demographic transition model, which of the following is true?\n(A) Birth rates increase and population growth rate is less rapid. (B) Birth rates decline and population growth rate is less rapid. (C) Birth rates increase and population growth rate increases. (D) Birth rates decrease and population growth rate increases.\nA:  (B)\n\nQ: Which of the following statements is NOT accurate regarding the services provided by local governments in the United States?\n(A) Duplication of efforts occurs often. (B) Social problems of the central city spill over into the surrounding residential suburbs. (C) Inefficiency in providing services occurs often. (D) One neighborhood's efforts to reduce pollution are always supported by neighboring communities.\nA:  (D)\n\nQ: The practice of hiring a foreign third-party service provider to run an operation is called\n(A) outsourcing. (B) offshoring. (C) maquiladoras. (D) locational interdependence.\nA:  (B)\n\nQ: The \"melting pot\" theory of combining several immigrant groups into one mainstream culture is called\n(A) amalgamation theory. (B) acculturation. (C) ethnic islands. (D) ethnic clustering.\nA: ",
        {
          "until": [
            "</s>"
          ]
        }
      ]
    ],
    "resps": [
      [
        "(D)"
      ]
    ],
    "filtered_resps": [
      "(D)"
    ],
    "exact_match": 0.0
  },
  {
    "doc_id": 166,
    "doc": {
      "question": "What type of countries generally possesses a greater variety of climates and resources than other countries?",
      "subject": "high_school_geography",
      "choices": [
        "Perforated states",
        "Fragmented states",
        "Elongated states",
        "Prorupt states"
      ],
      "answer": 2
    },
    "target": "(C)",
    "arguments": [
      [
        "The following are multiple choice questions (with answers) about high school geography.\n\nQ: During the third stage of the demographic transition model, which of the following is true?\n(A) Birth rates increase and population growth rate is less rapid. (B) Birth rates decline and population growth rate is less rapid. (C) Birth rates increase and population growth rate increases. (D) Birth rates decrease and population growth rate increases.\nA:  (B)\n\nQ: Which of the following statements is NOT accurate regarding the services provided by local governments in the United States?\n(A) Duplication of efforts occurs often. (B) Social problems of the central city spill over into the surrounding residential suburbs. (C) Inefficiency in providing services occurs often. (D) One neighborhood's efforts to reduce pollution are always supported by neighboring communities.\nA:  (D)\n\nQ: The rate of natural increase of a population is found by subtracting the\n(A) crude death rate from the crude birth date. (B) crude birth rate from the crude death rate. (C) doubling time from the crude birth rate. (D) fertility rate from the crude death rate.\nA:  (A)\n\nQ: The practice of hiring a foreign third-party service provider to run an operation is called\n(A) outsourcing. (B) offshoring. (C) maquiladoras. (D) locational interdependence.\nA:  (B)\n\nQ: Which one of the following items is an example of nonmaterial culture?\n(A) Dove soap (B) Dove candy bar (C) Dove symbol (D) A dove (bird)\nA:  (C)\n\nQ: What type of countries generally possesses a greater variety of climates and resources than other countries?\n(A) Perforated states (B) Fragmented states (C) Elongated states (D) Prorupt states\nA: ",
        {
          "until": [
            "</s>"
          ]
        }
      ]
    ],
    "resps": [
      [
        "(D)"
      ]
    ],
    "filtered_resps": [
      "(D)"
    ],
    "exact_match": 0.0
  },
  {
    "doc_id": 174,
    "doc": {
      "question": "Which of the following items below is NOT considered a barrier to the diffusion of an innovation?",
      "subject": "high_school_geography",
      "choices": [
        "Internet",
        "Distance",
        "Cultural obstacles",
        "Government interference"
      ],
      "answer": 0
    },
    "target": "(A)",
    "arguments": [
      [
        "The following are multiple choice questions (with answers) about high school geography.\n\nQ: During the third stage of the demographic transition model, which of the following is true?\n(A) Birth rates increase and population growth rate is less rapid. (B) Birth rates decline and population growth rate is less rapid. (C) Birth rates increase and population growth rate increases. (D) Birth rates decrease and population growth rate increases.\nA:  (B)\n\nQ: Which of the following statements is NOT accurate regarding the services provided by local governments in the United States?\n(A) Duplication of efforts occurs often. (B) Social problems of the central city spill over into the surrounding residential suburbs. (C) Inefficiency in providing services occurs often. (D) One neighborhood's efforts to reduce pollution are always supported by neighboring communities.\nA:  (D)\n\nQ: Which one of the following items is an example of nonmaterial culture?\n(A) Dove soap (B) Dove candy bar (C) Dove symbol (D) A dove (bird)\nA:  (C)\n\nQ: The rate of natural increase of a population is found by subtracting the\n(A) crude death rate from the crude birth date. (B) crude birth rate from the crude death rate. (C) doubling time from the crude birth rate. (D) fertility rate from the crude death rate.\nA:  (A)\n\nQ: The practice of hiring a foreign third-party service provider to run an operation is called\n(A) outsourcing. (B) offshoring. (C) maquiladoras. (D) locational interdependence.\nA:  (B)\n\nQ: Which of the following items below is NOT considered a barrier to the diffusion of an innovation?\n(A) Internet (B) Distance (C) Cultural obstacles (D) Government interference\nA: ",
        {
          "until": [
            "</s>"
          ]
        }
      ]
    ],
    "resps": [
      [
        "(C)"
      ]
    ],
    "filtered_resps": [
      "(C)"
    ],
    "exact_match": 0.0
  },
  {
    "doc_id": 182,
    "doc": {
      "question": "A map that presents a single class of statistics is called a",
      "subject": "high_school_geography",
      "choices": [
        "general purpose map.",
        "thematic map.",
        "reference map.",
        "mental map."
      ],
      "answer": 1
    },
    "target": "(B)",
    "arguments": [
      [
        "The following are multiple choice questions (with answers) about high school geography.\n\nQ: The practice of hiring a foreign third-party service provider to run an operation is called\n(A) outsourcing. (B) offshoring. (C) maquiladoras. (D) locational interdependence.\nA:  (B)\n\nQ: During the third stage of the demographic transition model, which of the following is true?\n(A) Birth rates increase and population growth rate is less rapid. (B) Birth rates decline and population growth rate is less rapid. (C) Birth rates increase and population growth rate increases. (D) Birth rates decrease and population growth rate increases.\nA:  (B)\n\nQ: The rate of natural increase of a population is found by subtracting the\n(A) crude death rate from the crude birth date. (B) crude birth rate from the crude death rate. (C) doubling time from the crude birth rate. (D) fertility rate from the crude death rate.\nA:  (A)\n\nQ: Which one of the following items is an example of nonmaterial culture?\n(A) Dove soap (B) Dove candy bar (C) Dove symbol (D) A dove (bird)\nA:  (C)\n\nQ: Which of the following statements is NOT accurate regarding the services provided by local governments in the United States?\n(A) Duplication of efforts occurs often. (B) Social problems of the central city spill over into the surrounding residential suburbs. (C) Inefficiency in providing services occurs often. (D) One neighborhood's efforts to reduce pollution are always supported by neighboring communities.\nA:  (D)\n\nQ: A map that presents a single class of statistics is called a\n(A) general purpose map. (B) thematic map. (C) reference map. (D) mental map.\nA: ",
        {
          "until": [
            "</s>"
          ]
        }
      ]
    ],
    "resps": [
      [
        "(D)"
      ]
    ],
    "filtered_resps": [
      "(D)"
    ],
    "exact_match": 0.0
  },
  {
    "doc_id": 190,
    "doc": {
      "question": "Which of the following supranational organizations is not an economic union?",
      "subject": "high_school_geography",
      "choices": [
        "EU",
        "CARICOM",
        "NAFTA",
        "NATO"
      ],
      "answer": 3
    },
    "target": "(D)",
    "arguments": [
      [
        "The following are multiple choice questions (with answers) about high school geography.\n\nQ: During the third stage of the demographic transition model, which of the following is true?\n(A) Birth rates increase and population growth rate is less rapid. (B) Birth rates decline and population growth rate is less rapid. (C) Birth rates increase and population growth rate increases. (D) Birth rates decrease and population growth rate increases.\nA:  (B)\n\nQ: The rate of natural increase of a population is found by subtracting the\n(A) crude death rate from the crude birth date. (B) crude birth rate from the crude death rate. (C) doubling time from the crude birth rate. (D) fertility rate from the crude death rate.\nA:  (A)\n\nQ: Which of the following statements is NOT accurate regarding the services provided by local governments in the United States?\n(A) Duplication of efforts occurs often. (B) Social problems of the central city spill over into the surrounding residential suburbs. (C) Inefficiency in providing services occurs often. (D) One neighborhood's efforts to reduce pollution are always supported by neighboring communities.\nA:  (D)\n\nQ: Which one of the following items is an example of nonmaterial culture?\n(A) Dove soap (B) Dove candy bar (C) Dove symbol (D) A dove (bird)\nA:  (C)\n\nQ: The practice of hiring a foreign third-party service provider to run an operation is called\n(A) outsourcing. (B) offshoring. (C) maquiladoras. (D) locational interdependence.\nA:  (B)\n\nQ: Which of the following supranational organizations is not an economic union?\n(A) EU (B) CARICOM (C) NAFTA (D) NATO\nA: ",
        {
          "until": [
            "</s>"
          ]
        }
      ]
    ],
    "resps": [
      [
        "(D)"
      ]
    ],
    "filtered_resps": [
      "(D)"
    ],
    "exact_match": 1.0
  },
  {
    "doc_id": 7,
    "doc": {
      "question": "Which form of migration below are farm workers from another country most likely to be practicing during the year?",
      "subject": "high_school_geography",
      "choices": [
        "Chain migration",
        "Cluster migration",
        "Circular migration",
        "International migration"
      ],
      "answer": 2
    },
    "target": "(C)",
    "arguments": [
      [
        "The following are multiple choice questions (with answers) about high school geography.\n\nQ: The practice of hiring a foreign third-party service provider to run an operation is called\n(A) outsourcing. (B) offshoring. (C) maquiladoras. (D) locational interdependence.\nA:  (B)\n\nQ: The rate of natural increase of a population is found by subtracting the\n(A) crude death rate from the crude birth date. (B) crude birth rate from the crude death rate. (C) doubling time from the crude birth rate. (D) fertility rate from the crude death rate.\nA:  (A)\n\nQ: Which one of the following items is an example of nonmaterial culture?\n(A) Dove soap (B) Dove candy bar (C) Dove symbol (D) A dove (bird)\nA:  (C)\n\nQ: Which of the following statements is NOT accurate regarding the services provided by local governments in the United States?\n(A) Duplication of efforts occurs often. (B) Social problems of the central city spill over into the surrounding residential suburbs. (C) Inefficiency in providing services occurs often. (D) One neighborhood's efforts to reduce pollution are always supported by neighboring communities.\nA:  (D)\n\nQ: During the third stage of the demographic transition model, which of the following is true?\n(A) Birth rates increase and population growth rate is less rapid. (B) Birth rates decline and population growth rate is less rapid. (C) Birth rates increase and population growth rate increases. (D) Birth rates decrease and population growth rate increases.\nA:  (B)\n\nQ: Which form of migration below are farm workers from another country most likely to be practicing during the year?\n(A) Chain migration (B) Cluster migration (C) Circular migration (D) International migration\nA: ",
        {
          "until": [
            "</s>"
          ]
        }
      ]
    ],
    "resps": [
      [
        "(D)"
      ]
    ],
    "filtered_resps": [
      "(D)"
    ],
    "exact_match": 0.0
  },
  {
    "doc_id": 15,
    "doc": {
      "question": "Which of the following religions developed first?",
      "subject": "high_school_geography",
      "choices": [
        "Buddhism",
        "Christianity",
        "Islam",
        "Hinduism"
      ],
      "answer": 3
    },
    "target": "(D)",
    "arguments": [
      [
        "The following are multiple choice questions (with answers) about high school geography.\n\nQ: The rate of natural increase of a population is found by subtracting the\n(A) crude death rate from the crude birth date. (B) crude birth rate from the crude death rate. (C) doubling time from the crude birth rate. (D) fertility rate from the crude death rate.\nA:  (A)\n\nQ: Which one of the following items is an example of nonmaterial culture?\n(A) Dove soap (B) Dove candy bar (C) Dove symbol (D) A dove (bird)\nA:  (C)\n\nQ: During the third stage of the demographic transition model, which of the following is true?\n(A) Birth rates increase and population growth rate is less rapid. (B) Birth rates decline and population growth rate is less rapid. (C) Birth rates increase and population growth rate increases. (D) Birth rates decrease and population growth rate increases.\nA:  (B)\n\nQ: The practice of hiring a foreign third-party service provider to run an operation is called\n(A) outsourcing. (B) offshoring. (C) maquiladoras. (D) locational interdependence.\nA:  (B)\n\nQ: Which of the following statements is NOT accurate regarding the services provided by local governments in the United States?\n(A) Duplication of efforts occurs often. (B) Social problems of the central city spill over into the surrounding residential suburbs. (C) Inefficiency in providing services occurs often. (D) One neighborhood's efforts to reduce pollution are always supported by neighboring communities.\nA:  (D)\n\nQ: Which of the following religions developed first?\n(A) Buddhism (B) Christianity (C) Islam (D) Hinduism\nA: ",
        {
          "until": [
            "</s>"
          ]
        }
      ]
    ],
    "resps": [
      [
        "(C)"
      ]
    ],
    "filtered_resps": [
      "(C)"
    ],
    "exact_match": 0.0
  },
  {
    "doc_id": 23,
    "doc": {
      "question": "Which urban model theorizes that high-rent residential areas grow outward from the center of the city along major highways with lower-rent inhabitants taking over sequentially?",
      "subject": "high_school_geography",
      "choices": [
        "Concentric zone model",
        "Central place model",
        "Urban realms model",
        "Sector model"
      ],
      "answer": 3
    },
    "target": "(D)",
    "arguments": [
      [
        "The following are multiple choice questions (with answers) about high school geography.\n\nQ: The rate of natural increase of a population is found by subtracting the\n(A) crude death rate from the crude birth date. (B) crude birth rate from the crude death rate. (C) doubling time from the crude birth rate. (D) fertility rate from the crude death rate.\nA:  (A)\n\nQ: Which one of the following items is an example of nonmaterial culture?\n(A) Dove soap (B) Dove candy bar (C) Dove symbol (D) A dove (bird)\nA:  (C)\n\nQ: During the third stage of the demographic transition model, which of the following is true?\n(A) Birth rates increase and population growth rate is less rapid. (B) Birth rates decline and population growth rate is less rapid. (C) Birth rates increase and population growth rate increases. (D) Birth rates decrease and population growth rate increases.\nA:  (B)\n\nQ: Which of the following statements is NOT accurate regarding the services provided by local governments in the United States?\n(A) Duplication of efforts occurs often. (B) Social problems of the central city spill over into the surrounding residential suburbs. (C) Inefficiency in providing services occurs often. (D) One neighborhood's efforts to reduce pollution are always supported by neighboring communities.\nA:  (D)\n\nQ: The practice of hiring a foreign third-party service provider to run an operation is called\n(A) outsourcing. (B) offshoring. (C) maquiladoras. (D) locational interdependence.\nA:  (B)\n\nQ: Which urban model theorizes that high-rent residential areas grow outward from the center of the city along major highways with lower-rent inhabitants taking over sequentially?\n(A) Concentric zone model (B) Central place model (C) Urban realms model (D) Sector model\nA: ",
        {
          "until": [
            "</s>"
          ]
        }
      ]
    ],
    "resps": [
      [
        "(C)"
      ]
    ],
    "filtered_resps": [
      "(C)"
    ],
    "exact_match": 0.0
  },
  {
    "doc_id": 31,
    "doc": {
      "question": "All of the following are non-basic jobs in the city EXCEPT",
      "subject": "high_school_geography",
      "choices": [
        "city firefighter.",
        "social worker.",
        "dry cleaner.",
        "garment factory worker."
      ],
      "answer": 3
    },
    "target": "(D)",
    "arguments": [
      [
        "The following are multiple choice questions (with answers) about high school geography.\n\nQ: During the third stage of the demographic transition model, which of the following is true?\n(A) Birth rates increase and population growth rate is less rapid. (B) Birth rates decline and population growth rate is less rapid. (C) Birth rates increase and population growth rate increases. (D) Birth rates decrease and population growth rate increases.\nA:  (B)\n\nQ: The rate of natural increase of a population is found by subtracting the\n(A) crude death rate from the crude birth date. (B) crude birth rate from the crude death rate. (C) doubling time from the crude birth rate. (D) fertility rate from the crude death rate.\nA:  (A)\n\nQ: The practice of hiring a foreign third-party service provider to run an operation is called\n(A) outsourcing. (B) offshoring. (C) maquiladoras. (D) locational interdependence.\nA:  (B)\n\nQ: Which of the following statements is NOT accurate regarding the services provided by local governments in the United States?\n(A) Duplication of efforts occurs often. (B) Social problems of the central city spill over into the surrounding residential suburbs. (C) Inefficiency in providing services occurs often. (D) One neighborhood's efforts to reduce pollution are always supported by neighboring communities.\nA:  (D)\n\nQ: Which one of the following items is an example of nonmaterial culture?\n(A) Dove soap (B) Dove candy bar (C) Dove symbol (D) A dove (bird)\nA:  (C)\n\nQ: All of the following are non-basic jobs in the city EXCEPT\n(A) city firefighter. (B) social worker. (C) dry cleaner. (D) garment factory worker.\nA: ",
        {
          "until": [
            "</s>"
          ]
        }
      ]
    ],
    "resps": [
      [
        "(D)"
      ]
    ],
    "filtered_resps": [
      "(D)"
    ],
    "exact_match": 1.0
  },
  {
    "doc_id": 39,
    "doc": {
      "question": "Which of the following items is NOT a challenge to the state?",
      "subject": "high_school_geography",
      "choices": [
        "Transnational corporations",
        "EU",
        "World Trade Organization",
        "Good transportation network"
      ],
      "answer": 3
    },
    "target": "(D)",
    "arguments": [
      [
        "The following are multiple choice questions (with answers) about high school geography.\n\nQ: Which one of the following items is an example of nonmaterial culture?\n(A) Dove soap (B) Dove candy bar (C) Dove symbol (D) A dove (bird)\nA:  (C)\n\nQ: The practice of hiring a foreign third-party service provider to run an operation is called\n(A) outsourcing. (B) offshoring. (C) maquiladoras. (D) locational interdependence.\nA:  (B)\n\nQ: The rate of natural increase of a population is found by subtracting the\n(A) crude death rate from the crude birth date. (B) crude birth rate from the crude death rate. (C) doubling time from the crude birth rate. (D) fertility rate from the crude death rate.\nA:  (A)\n\nQ: Which of the following statements is NOT accurate regarding the services provided by local governments in the United States?\n(A) Duplication of efforts occurs often. (B) Social problems of the central city spill over into the surrounding residential suburbs. (C) Inefficiency in providing services occurs often. (D) One neighborhood's efforts to reduce pollution are always supported by neighboring communities.\nA:  (D)\n\nQ: During the third stage of the demographic transition model, which of the following is true?\n(A) Birth rates increase and population growth rate is less rapid. (B) Birth rates decline and population growth rate is less rapid. (C) Birth rates increase and population growth rate increases. (D) Birth rates decrease and population growth rate increases.\nA:  (B)\n\nQ: Which of the following items is NOT a challenge to the state?\n(A) Transnational corporations (B) EU (C) World Trade Organization (D) Good transportation network\nA: ",
        {
          "until": [
            "</s>"
          ]
        }
      ]
    ],
    "resps": [
      [
        "(D)"
      ]
    ],
    "filtered_resps": [
      "(D)"
    ],
    "exact_match": 1.0
  },
  {
    "doc_id": 47,
    "doc": {
      "question": "An earlier boundary formed before meticulous geographic knowledge and mapping was available is known as",
      "subject": "high_school_geography",
      "choices": [
        "an antecedent boundary.",
        "a geometric boundary.",
        "a relict boundary.",
        "a subsequent boundary."
      ],
      "answer": 0
    },
    "target": "(A)",
    "arguments": [
      [
        "The following are multiple choice questions (with answers) about high school geography.\n\nQ: The rate of natural increase of a population is found by subtracting the\n(A) crude death rate from the crude birth date. (B) crude birth rate from the crude death rate. (C) doubling time from the crude birth rate. (D) fertility rate from the crude death rate.\nA:  (A)\n\nQ: Which one of the following items is an example of nonmaterial culture?\n(A) Dove soap (B) Dove candy bar (C) Dove symbol (D) A dove (bird)\nA:  (C)\n\nQ: Which of the following statements is NOT accurate regarding the services provided by local governments in the United States?\n(A) Duplication of efforts occurs often. (B) Social problems of the central city spill over into the surrounding residential suburbs. (C) Inefficiency in providing services occurs often. (D) One neighborhood's efforts to reduce pollution are always supported by neighboring communities.\nA:  (D)\n\nQ: The practice of hiring a foreign third-party service provider to run an operation is called\n(A) outsourcing. (B) offshoring. (C) maquiladoras. (D) locational interdependence.\nA:  (B)\n\nQ: During the third stage of the demographic transition model, which of the following is true?\n(A) Birth rates increase and population growth rate is less rapid. (B) Birth rates decline and population growth rate is less rapid. (C) Birth rates increase and population growth rate increases. (D) Birth rates decrease and population growth rate increases.\nA:  (B)\n\nQ: An earlier boundary formed before meticulous geographic knowledge and mapping was available is known as\n(A) an antecedent boundary. (B) a geometric boundary. (C) a relict boundary. (D) a subsequent boundary.\nA: ",
        {
          "until": [
            "</s>"
          ]
        }
      ]
    ],
    "resps": [
      [
        "(D)"
      ]
    ],
    "filtered_resps": [
      "(D)"
    ],
    "exact_match": 0.0
  },
  {
    "doc_id": 55,
    "doc": {
      "question": "In which zone of Burgess's concentric zone model would one find better houses, single-family homes, and higher-rent apartments?",
      "subject": "high_school_geography",
      "choices": [
        "First",
        "Second",
        "Third",
        "Fourth"
      ],
      "answer": 2
    },
    "target": "(C)",
    "arguments": [
      [
        "The following are multiple choice questions (with answers) about high school geography.\n\nQ: Which one of the following items is an example of nonmaterial culture?\n(A) Dove soap (B) Dove candy bar (C) Dove symbol (D) A dove (bird)\nA:  (C)\n\nQ: The rate of natural increase of a population is found by subtracting the\n(A) crude death rate from the crude birth date. (B) crude birth rate from the crude death rate. (C) doubling time from the crude birth rate. (D) fertility rate from the crude death rate.\nA:  (A)\n\nQ: Which of the following statements is NOT accurate regarding the services provided by local governments in the United States?\n(A) Duplication of efforts occurs often. (B) Social problems of the central city spill over into the surrounding residential suburbs. (C) Inefficiency in providing services occurs often. (D) One neighborhood's efforts to reduce pollution are always supported by neighboring communities.\nA:  (D)\n\nQ: During the third stage of the demographic transition model, which of the following is true?\n(A) Birth rates increase and population growth rate is less rapid. (B) Birth rates decline and population growth rate is less rapid. (C) Birth rates increase and population growth rate increases. (D) Birth rates decrease and population growth rate increases.\nA:  (B)\n\nQ: The practice of hiring a foreign third-party service provider to run an operation is called\n(A) outsourcing. (B) offshoring. (C) maquiladoras. (D) locational interdependence.\nA:  (B)\n\nQ: In which zone of Burgess's concentric zone model would one find better houses, single-family homes, and higher-rent apartments?\n(A) First (B) Second (C) Third (D) Fourth\nA: ",
        {
          "until": [
            "</s>"
          ]
        }
      ]
    ],
    "resps": [
      [
        "(D)"
      ]
    ],
    "filtered_resps": [
      "(D)"
    ],
    "exact_match": 0.0
  },
  {
    "doc_id": 63,
    "doc": {
      "question": "Which of the following statements best describes the United Nations?",
      "subject": "high_school_geography",
      "choices": [
        "The UN operates a worldwide police force.",
        "Member states surrender sovereignty to the UN.",
        "World laws are enforced by the UN.",
        "The UN often practices interventionism in world conflicts."
      ],
      "answer": 3
    },
    "target": "(D)",
    "arguments": [
      [
        "The following are multiple choice questions (with answers) about high school geography.\n\nQ: Which of the following statements is NOT accurate regarding the services provided by local governments in the United States?\n(A) Duplication of efforts occurs often. (B) Social problems of the central city spill over into the surrounding residential suburbs. (C) Inefficiency in providing services occurs often. (D) One neighborhood's efforts to reduce pollution are always supported by neighboring communities.\nA:  (D)\n\nQ: Which one of the following items is an example of nonmaterial culture?\n(A) Dove soap (B) Dove candy bar (C) Dove symbol (D) A dove (bird)\nA:  (C)\n\nQ: The rate of natural increase of a population is found by subtracting the\n(A) crude death rate from the crude birth date. (B) crude birth rate from the crude death rate. (C) doubling time from the crude birth rate. (D) fertility rate from the crude death rate.\nA:  (A)\n\nQ: The practice of hiring a foreign third-party service provider to run an operation is called\n(A) outsourcing. (B) offshoring. (C) maquiladoras. (D) locational interdependence.\nA:  (B)\n\nQ: During the third stage of the demographic transition model, which of the following is true?\n(A) Birth rates increase and population growth rate is less rapid. (B) Birth rates decline and population growth rate is less rapid. (C) Birth rates increase and population growth rate increases. (D) Birth rates decrease and population growth rate increases.\nA:  (B)\n\nQ: Which of the following statements best describes the United Nations?\n(A) The UN operates a worldwide police force. (B) Member states surrender sovereignty to the UN. (C) World laws are enforced by the UN. (D) The UN often practices interventionism in world conflicts.\nA: ",
        {
          "until": [
            "</s>"
          ]
        }
      ]
    ],
    "resps": [
      [
        "(D)"
      ]
    ],
    "filtered_resps": [
      "(D)"
    ],
    "exact_match": 1.0
  },
  {
    "doc_id": 71,
    "doc": {
      "question": "The multiplier effect is",
      "subject": "high_school_geography",
      "choices": [
        "the addition of non-basic workers to an urban economy that has added more basic workers.",
        "a ratio of urban to rural workers in an economy.",
        "the ratio of city workers to farm workers in an economy.",
        "the addition of rural jobs created by the urban economy."
      ],
      "answer": 0
    },
    "target": "(A)",
    "arguments": [
      [
        "The following are multiple choice questions (with answers) about high school geography.\n\nQ: Which one of the following items is an example of nonmaterial culture?\n(A) Dove soap (B) Dove candy bar (C) Dove symbol (D) A dove (bird)\nA:  (C)\n\nQ: The rate of natural increase of a population is found by subtracting the\n(A) crude death rate from the crude birth date. (B) crude birth rate from the crude death rate. (C) doubling time from the crude birth rate. (D) fertility rate from the crude death rate.\nA:  (A)\n\nQ: Which of the following statements is NOT accurate regarding the services provided by local governments in the United States?\n(A) Duplication of efforts occurs often. (B) Social problems of the central city spill over into the surrounding residential suburbs. (C) Inefficiency in providing services occurs often. (D) One neighborhood's efforts to reduce pollution are always supported by neighboring communities.\nA:  (D)\n\nQ: The practice of hiring a foreign third-party service provider to run an operation is called\n(A) outsourcing. (B) offshoring. (C) maquiladoras. (D) locational interdependence.\nA:  (B)\n\nQ: During the third stage of the demographic transition model, which of the following is true?\n(A) Birth rates increase and population growth rate is less rapid. (B) Birth rates decline and population growth rate is less rapid. (C) Birth rates increase and population growth rate increases. (D) Birth rates decrease and population growth rate increases.\nA:  (B)\n\nQ: The multiplier effect is\n(A) the addition of non-basic workers to an urban economy that has added more basic workers. (B) a ratio of urban to rural workers in an economy. (C) the ratio of city workers to farm workers in an economy. (D) the addition of rural jobs created by the urban economy.\nA: ",
        {
          "until": [
            "</s>"
          ]
        }
      ]
    ],
    "resps": [
      [
        "(B)"
      ]
    ],
    "filtered_resps": [
      "(B)"
    ],
    "exact_match": 0.0
  },
  {
    "doc_id": 79,
    "doc": {
      "question": "A large node of office and commercial land use outside the central city with more jobs than residents is a(n)",
      "subject": "high_school_geography",
      "choices": [
        "suburb.",
        "primate city.",
        "town.",
        "edge city."
      ],
      "answer": 3
    },
    "target": "(D)",
    "arguments": [
      [
        "The following are multiple choice questions (with answers) about high school geography.\n\nQ: Which of the following statements is NOT accurate regarding the services provided by local governments in the United States?\n(A) Duplication of efforts occurs often. (B) Social problems of the central city spill over into the surrounding residential suburbs. (C) Inefficiency in providing services occurs often. (D) One neighborhood's efforts to reduce pollution are always supported by neighboring communities.\nA:  (D)\n\nQ: During the third stage of the demographic transition model, which of the following is true?\n(A) Birth rates increase and population growth rate is less rapid. (B) Birth rates decline and population growth rate is less rapid. (C) Birth rates increase and population growth rate increases. (D) Birth rates decrease and population growth rate increases.\nA:  (B)\n\nQ: Which one of the following items is an example of nonmaterial culture?\n(A) Dove soap (B) Dove candy bar (C) Dove symbol (D) A dove (bird)\nA:  (C)\n\nQ: The practice of hiring a foreign third-party service provider to run an operation is called\n(A) outsourcing. (B) offshoring. (C) maquiladoras. (D) locational interdependence.\nA:  (B)\n\nQ: The rate of natural increase of a population is found by subtracting the\n(A) crude death rate from the crude birth date. (B) crude birth rate from the crude death rate. (C) doubling time from the crude birth rate. (D) fertility rate from the crude death rate.\nA:  (A)\n\nQ: A large node of office and commercial land use outside the central city with more jobs than residents is a(n)\n(A) suburb. (B) primate city. (C) town. (D) edge city.\nA: ",
        {
          "until": [
            "</s>"
          ]
        }
      ]
    ],
    "resps": [
      [
        "(D)"
      ]
    ],
    "filtered_resps": [
      "(D)"
    ],
    "exact_match": 1.0
  },
  {
    "doc_id": 87,
    "doc": {
      "question": "Which one of the statements below correctly describes immigrants living in Europe?",
      "subject": "high_school_geography",
      "choices": [
        "Most find citizenship easy to get in host countries.",
        "Muslims immigrants from North Africa are well integrated in France.",
        "Immigrants to European cities rarely bring their families.",
        "They are usually restricted to certain neighborhoods."
      ],
      "answer": 3
    },
    "target": "(D)",
    "arguments": [
      [
        "The following are multiple choice questions (with answers) about high school geography.\n\nQ: During the third stage of the demographic transition model, which of the following is true?\n(A) Birth rates increase and population growth rate is less rapid. (B) Birth rates decline and population growth rate is less rapid. (C) Birth rates increase and population growth rate increases. (D) Birth rates decrease and population growth rate increases.\nA:  (B)\n\nQ: The rate of natural increase of a population is found by subtracting the\n(A) crude death rate from the crude birth date. (B) crude birth rate from the crude death rate. (C) doubling time from the crude birth rate. (D) fertility rate from the crude death rate.\nA:  (A)\n\nQ: The practice of hiring a foreign third-party service provider to run an operation is called\n(A) outsourcing. (B) offshoring. (C) maquiladoras. (D) locational interdependence.\nA:  (B)\n\nQ: Which one of the following items is an example of nonmaterial culture?\n(A) Dove soap (B) Dove candy bar (C) Dove symbol (D) A dove (bird)\nA:  (C)\n\nQ: Which of the following statements is NOT accurate regarding the services provided by local governments in the United States?\n(A) Duplication of efforts occurs often. (B) Social problems of the central city spill over into the surrounding residential suburbs. (C) Inefficiency in providing services occurs often. (D) One neighborhood's efforts to reduce pollution are always supported by neighboring communities.\nA:  (D)\n\nQ: Which one of the statements below correctly describes immigrants living in Europe?\n(A) Most find citizenship easy to get in host countries. (B) Muslims immigrants from North Africa are well integrated in France. (C) Immigrants to European cities rarely bring their families. (D) They are usually restricted to certain neighborhoods.\nA: ",
        {
          "until": [
            "</s>"
          ]
        }
      ]
    ],
    "resps": [
      [
        "(C)"
      ]
    ],
    "filtered_resps": [
      "(C)"
    ],
    "exact_match": 0.0
  },
  {
    "doc_id": 95,
    "doc": {
      "question": "Every country with a seacoast has an exclusive economic zone (EEZ) under the UN Convention on the Law of the Sea. Which one of the following statements regarding the Law of the Sea and the EEZ is NOT correct?",
      "subject": "high_school_geography",
      "choices": [
        "The EEZ extends up to 200 nautical miles (370 km) from the coastline.",
        "Countries have the right to exploit natural resources in their EEZ.",
        "Countries can exploit resources on the continental shelf extending up to 350 nautical miles (560 km) beyond their EEZ.",
        "A country does not have the right to exploit living resources in its EEZ."
      ],
      "answer": 3
    },
    "target": "(D)",
    "arguments": [
      [
        "The following are multiple choice questions (with answers) about high school geography.\n\nQ: The rate of natural increase of a population is found by subtracting the\n(A) crude death rate from the crude birth date. (B) crude birth rate from the crude death rate. (C) doubling time from the crude birth rate. (D) fertility rate from the crude death rate.\nA:  (A)\n\nQ: During the third stage of the demographic transition model, which of the following is true?\n(A) Birth rates increase and population growth rate is less rapid. (B) Birth rates decline and population growth rate is less rapid. (C) Birth rates increase and population growth rate increases. (D) Birth rates decrease and population growth rate increases.\nA:  (B)\n\nQ: Which one of the following items is an example of nonmaterial culture?\n(A) Dove soap (B) Dove candy bar (C) Dove symbol (D) A dove (bird)\nA:  (C)\n\nQ: Which of the following statements is NOT accurate regarding the services provided by local governments in the United States?\n(A) Duplication of efforts occurs often. (B) Social problems of the central city spill over into the surrounding residential suburbs. (C) Inefficiency in providing services occurs often. (D) One neighborhood's efforts to reduce pollution are always supported by neighboring communities.\nA:  (D)\n\nQ: The practice of hiring a foreign third-party service provider to run an operation is called\n(A) outsourcing. (B) offshoring. (C) maquiladoras. (D) locational interdependence.\nA:  (B)\n\nQ: Every country with a seacoast has an exclusive economic zone (EEZ) under the UN Convention on the Law of the Sea. Which one of the following statements regarding the Law of the Sea and the EEZ is NOT correct?\n(A) The EEZ extends up to 200 nautical miles (370 km) from the coastline. (B) Countries have the right to exploit natural resources in their EEZ. (C) Countries can exploit resources on the continental shelf extending up to 350 nautical miles (560 km) beyond their EEZ. (D) A country does not have the right to exploit living resources in its EEZ.\nA: ",
        {
          "until": [
            "</s>"
          ]
        }
      ]
    ],
    "resps": [
      [
        "(C)"
      ]
    ],
    "filtered_resps": [
      "(C)"
    ],
    "exact_match": 0.0
  },
  {
    "doc_id": 103,
    "doc": {
      "question": "Which of the following is a major concern in countries with a large and rapidly aging population?",
      "subject": "high_school_geography",
      "choices": [
        "Immunization",
        "Adequate schools",
        "Daycare facilities",
        "Health care"
      ],
      "answer": 3
    },
    "target": "(D)",
    "arguments": [
      [
        "The following are multiple choice questions (with answers) about high school geography.\n\nQ: The rate of natural increase of a population is found by subtracting the\n(A) crude death rate from the crude birth date. (B) crude birth rate from the crude death rate. (C) doubling time from the crude birth rate. (D) fertility rate from the crude death rate.\nA:  (A)\n\nQ: During the third stage of the demographic transition model, which of the following is true?\n(A) Birth rates increase and population growth rate is less rapid. (B) Birth rates decline and population growth rate is less rapid. (C) Birth rates increase and population growth rate increases. (D) Birth rates decrease and population growth rate increases.\nA:  (B)\n\nQ: Which of the following statements is NOT accurate regarding the services provided by local governments in the United States?\n(A) Duplication of efforts occurs often. (B) Social problems of the central city spill over into the surrounding residential suburbs. (C) Inefficiency in providing services occurs often. (D) One neighborhood's efforts to reduce pollution are always supported by neighboring communities.\nA:  (D)\n\nQ: The practice of hiring a foreign third-party service provider to run an operation is called\n(A) outsourcing. (B) offshoring. (C) maquiladoras. (D) locational interdependence.\nA:  (B)\n\nQ: Which one of the following items is an example of nonmaterial culture?\n(A) Dove soap (B) Dove candy bar (C) Dove symbol (D) A dove (bird)\nA:  (C)\n\nQ: Which of the following is a major concern in countries with a large and rapidly aging population?\n(A) Immunization (B) Adequate schools (C) Daycare facilities (D) Health care\nA: ",
        {
          "until": [
            "</s>"
          ]
        }
      ]
    ],
    "resps": [
      [
        "(D)"
      ]
    ],
    "filtered_resps": [
      "(D)"
    ],
    "exact_match": 1.0
  },
  {
    "doc_id": 111,
    "doc": {
      "question": "The European Union (EU) replaced which of the following organizations?",
      "subject": "high_school_geography",
      "choices": [
        "NATO",
        "EEC",
        "UN",
        "ASEAN"
      ],
      "answer": 1
    },
    "target": "(B)",
    "arguments": [
      [
        "The following are multiple choice questions (with answers) about high school geography.\n\nQ: The rate of natural increase of a population is found by subtracting the\n(A) crude death rate from the crude birth date. (B) crude birth rate from the crude death rate. (C) doubling time from the crude birth rate. (D) fertility rate from the crude death rate.\nA:  (A)\n\nQ: The practice of hiring a foreign third-party service provider to run an operation is called\n(A) outsourcing. (B) offshoring. (C) maquiladoras. (D) locational interdependence.\nA:  (B)\n\nQ: During the third stage of the demographic transition model, which of the following is true?\n(A) Birth rates increase and population growth rate is less rapid. (B) Birth rates decline and population growth rate is less rapid. (C) Birth rates increase and population growth rate increases. (D) Birth rates decrease and population growth rate increases.\nA:  (B)\n\nQ: Which one of the following items is an example of nonmaterial culture?\n(A) Dove soap (B) Dove candy bar (C) Dove symbol (D) A dove (bird)\nA:  (C)\n\nQ: Which of the following statements is NOT accurate regarding the services provided by local governments in the United States?\n(A) Duplication of efforts occurs often. (B) Social problems of the central city spill over into the surrounding residential suburbs. (C) Inefficiency in providing services occurs often. (D) One neighborhood's efforts to reduce pollution are always supported by neighboring communities.\nA:  (D)\n\nQ: The European Union (EU) replaced which of the following organizations?\n(A) NATO (B) EEC (C) UN (D) ASEAN\nA: ",
        {
          "until": [
            "</s>"
          ]
        }
      ]
    ],
    "resps": [
      [
        "(B)"
      ]
    ],
    "filtered_resps": [
      "(B)"
    ],
    "exact_match": 1.0
  },
  {
    "doc_id": 119,
    "doc": {
      "question": "A person who practices the Hindu religion would be most likely to",
      "subject": "high_school_geography",
      "choices": [
        "visit a shrine built on the shore of a lake.",
        "pray five times a day.",
        "bathe in the Ganges River.",
        "make a pilgrimage to Jerusalem."
      ],
      "answer": 2
    },
    "target": "(C)",
    "arguments": [
      [
        "The following are multiple choice questions (with answers) about high school geography.\n\nQ: Which of the following statements is NOT accurate regarding the services provided by local governments in the United States?\n(A) Duplication of efforts occurs often. (B) Social problems of the central city spill over into the surrounding residential suburbs. (C) Inefficiency in providing services occurs often. (D) One neighborhood's efforts to reduce pollution are always supported by neighboring communities.\nA:  (D)\n\nQ: During the third stage of the demographic transition model, which of the following is true?\n(A) Birth rates increase and population growth rate is less rapid. (B) Birth rates decline and population growth rate is less rapid. (C) Birth rates increase and population growth rate increases. (D) Birth rates decrease and population growth rate increases.\nA:  (B)\n\nQ: The practice of hiring a foreign third-party service provider to run an operation is called\n(A) outsourcing. (B) offshoring. (C) maquiladoras. (D) locational interdependence.\nA:  (B)\n\nQ: The rate of natural increase of a population is found by subtracting the\n(A) crude death rate from the crude birth date. (B) crude birth rate from the crude death rate. (C) doubling time from the crude birth rate. (D) fertility rate from the crude death rate.\nA:  (A)\n\nQ: Which one of the following items is an example of nonmaterial culture?\n(A) Dove soap (B) Dove candy bar (C) Dove symbol (D) A dove (bird)\nA:  (C)\n\nQ: A person who practices the Hindu religion would be most likely to\n(A) visit a shrine built on the shore of a lake. (B) pray five times a day. (C) bathe in the Ganges River. (D) make a pilgrimage to Jerusalem.\nA: ",
        {
          "until": [
            "</s>"
          ]
        }
      ]
    ],
    "resps": [
      [
        "(B)<0x0A><0x0A>"
      ]
    ],
    "filtered_resps": [
      "(B)<0x0A><0x0A>"
    ],
    "exact_match": 0.0
  },
  {
    "doc_id": 127,
    "doc": {
      "question": "Which theorist(s) tried to explain the prices of farm products as they relate to patterns of land use?",
      "subject": "high_school_geography",
      "choices": [
        "Rostow",
        "Ravenstein",
        "Von Th\u00fcnen",
        "Burgess"
      ],
      "answer": 2
    },
    "target": "(C)",
    "arguments": [
      [
        "The following are multiple choice questions (with answers) about high school geography.\n\nQ: The rate of natural increase of a population is found by subtracting the\n(A) crude death rate from the crude birth date. (B) crude birth rate from the crude death rate. (C) doubling time from the crude birth rate. (D) fertility rate from the crude death rate.\nA:  (A)\n\nQ: The practice of hiring a foreign third-party service provider to run an operation is called\n(A) outsourcing. (B) offshoring. (C) maquiladoras. (D) locational interdependence.\nA:  (B)\n\nQ: During the third stage of the demographic transition model, which of the following is true?\n(A) Birth rates increase and population growth rate is less rapid. (B) Birth rates decline and population growth rate is less rapid. (C) Birth rates increase and population growth rate increases. (D) Birth rates decrease and population growth rate increases.\nA:  (B)\n\nQ: Which of the following statements is NOT accurate regarding the services provided by local governments in the United States?\n(A) Duplication of efforts occurs often. (B) Social problems of the central city spill over into the surrounding residential suburbs. (C) Inefficiency in providing services occurs often. (D) One neighborhood's efforts to reduce pollution are always supported by neighboring communities.\nA:  (D)\n\nQ: Which one of the following items is an example of nonmaterial culture?\n(A) Dove soap (B) Dove candy bar (C) Dove symbol (D) A dove (bird)\nA:  (C)\n\nQ: Which theorist(s) tried to explain the prices of farm products as they relate to patterns of land use?\n(A) Rostow (B) Ravenstein (C) Von Th\u00fcnen (D) Burgess\nA: ",
        {
          "until": [
            "</s>"
          ]
        }
      ]
    ],
    "resps": [
      [
        "(C)"
      ]
    ],
    "filtered_resps": [
      "(C)"
    ],
    "exact_match": 1.0
  },
  {
    "doc_id": 135,
    "doc": {
      "question": "China and Vietnam's dispute over the Spratley Islands is",
      "subject": "high_school_geography",
      "choices": [
        "a positional dispute.",
        "a territorial dispute.",
        "a resource dispute.",
        "a functional dispute."
      ],
      "answer": 2
    },
    "target": "(C)",
    "arguments": [
      [
        "The following are multiple choice questions (with answers) about high school geography.\n\nQ: Which one of the following items is an example of nonmaterial culture?\n(A) Dove soap (B) Dove candy bar (C) Dove symbol (D) A dove (bird)\nA:  (C)\n\nQ: The practice of hiring a foreign third-party service provider to run an operation is called\n(A) outsourcing. (B) offshoring. (C) maquiladoras. (D) locational interdependence.\nA:  (B)\n\nQ: During the third stage of the demographic transition model, which of the following is true?\n(A) Birth rates increase and population growth rate is less rapid. (B) Birth rates decline and population growth rate is less rapid. (C) Birth rates increase and population growth rate increases. (D) Birth rates decrease and population growth rate increases.\nA:  (B)\n\nQ: The rate of natural increase of a population is found by subtracting the\n(A) crude death rate from the crude birth date. (B) crude birth rate from the crude death rate. (C) doubling time from the crude birth rate. (D) fertility rate from the crude death rate.\nA:  (A)\n\nQ: Which of the following statements is NOT accurate regarding the services provided by local governments in the United States?\n(A) Duplication of efforts occurs often. (B) Social problems of the central city spill over into the surrounding residential suburbs. (C) Inefficiency in providing services occurs often. (D) One neighborhood's efforts to reduce pollution are always supported by neighboring communities.\nA:  (D)\n\nQ: China and Vietnam's dispute over the Spratley Islands is\n(A) a positional dispute. (B) a territorial dispute. (C) a resource dispute. (D) a functional dispute.\nA: ",
        {
          "until": [
            "</s>"
          ]
        }
      ]
    ],
    "resps": [
      [
        "(B)"
      ]
    ],
    "filtered_resps": [
      "(B)"
    ],
    "exact_match": 0.0
  },
  {
    "doc_id": 143,
    "doc": {
      "question": "Which of the following factors does NOT play a role in gender relationships in a culture or society?",
      "subject": "high_school_geography",
      "choices": [
        "Biology",
        "Advancements in technological development",
        "Religion",
        "Custom"
      ],
      "answer": 0
    },
    "target": "(A)",
    "arguments": [
      [
        "The following are multiple choice questions (with answers) about high school geography.\n\nQ: Which one of the following items is an example of nonmaterial culture?\n(A) Dove soap (B) Dove candy bar (C) Dove symbol (D) A dove (bird)\nA:  (C)\n\nQ: During the third stage of the demographic transition model, which of the following is true?\n(A) Birth rates increase and population growth rate is less rapid. (B) Birth rates decline and population growth rate is less rapid. (C) Birth rates increase and population growth rate increases. (D) Birth rates decrease and population growth rate increases.\nA:  (B)\n\nQ: The practice of hiring a foreign third-party service provider to run an operation is called\n(A) outsourcing. (B) offshoring. (C) maquiladoras. (D) locational interdependence.\nA:  (B)\n\nQ: Which of the following statements is NOT accurate regarding the services provided by local governments in the United States?\n(A) Duplication of efforts occurs often. (B) Social problems of the central city spill over into the surrounding residential suburbs. (C) Inefficiency in providing services occurs often. (D) One neighborhood's efforts to reduce pollution are always supported by neighboring communities.\nA:  (D)\n\nQ: The rate of natural increase of a population is found by subtracting the\n(A) crude death rate from the crude birth date. (B) crude birth rate from the crude death rate. (C) doubling time from the crude birth rate. (D) fertility rate from the crude death rate.\nA:  (A)\n\nQ: Which of the following factors does NOT play a role in gender relationships in a culture or society?\n(A) Biology (B) Advancements in technological development (C) Religion (D) Custom\nA: ",
        {
          "until": [
            "</s>"
          ]
        }
      ]
    ],
    "resps": [
      [
        "(C)"
      ]
    ],
    "filtered_resps": [
      "(C)"
    ],
    "exact_match": 0.0
  },
  {
    "doc_id": 151,
    "doc": {
      "question": "In what country are the most Basque speakers found?",
      "subject": "high_school_geography",
      "choices": [
        "Denmark",
        "Finland",
        "Luxembourg",
        "Spain"
      ],
      "answer": 3
    },
    "target": "(D)",
    "arguments": [
      [
        "The following are multiple choice questions (with answers) about high school geography.\n\nQ: Which of the following statements is NOT accurate regarding the services provided by local governments in the United States?\n(A) Duplication of efforts occurs often. (B) Social problems of the central city spill over into the surrounding residential suburbs. (C) Inefficiency in providing services occurs often. (D) One neighborhood's efforts to reduce pollution are always supported by neighboring communities.\nA:  (D)\n\nQ: The rate of natural increase of a population is found by subtracting the\n(A) crude death rate from the crude birth date. (B) crude birth rate from the crude death rate. (C) doubling time from the crude birth rate. (D) fertility rate from the crude death rate.\nA:  (A)\n\nQ: The practice of hiring a foreign third-party service provider to run an operation is called\n(A) outsourcing. (B) offshoring. (C) maquiladoras. (D) locational interdependence.\nA:  (B)\n\nQ: During the third stage of the demographic transition model, which of the following is true?\n(A) Birth rates increase and population growth rate is less rapid. (B) Birth rates decline and population growth rate is less rapid. (C) Birth rates increase and population growth rate increases. (D) Birth rates decrease and population growth rate increases.\nA:  (B)\n\nQ: Which one of the following items is an example of nonmaterial culture?\n(A) Dove soap (B) Dove candy bar (C) Dove symbol (D) A dove (bird)\nA:  (C)\n\nQ: In what country are the most Basque speakers found?\n(A) Denmark (B) Finland (C) Luxembourg (D) Spain\nA: ",
        {
          "until": [
            "</s>"
          ]
        }
      ]
    ],
    "resps": [
      [
        "(D)"
      ]
    ],
    "filtered_resps": [
      "(D)"
    ],
    "exact_match": 1.0
  },
  {
    "doc_id": 159,
    "doc": {
      "question": "Which theory below was used as justification for US involvement in Vietnam in the 1960s and 1970s?",
      "subject": "high_school_geography",
      "choices": [
        "Devolution",
        "Colonialism",
        "Heartland theory",
        "Containment theory"
      ],
      "answer": 3
    },
    "target": "(D)",
    "arguments": [
      [
        "The following are multiple choice questions (with answers) about high school geography.\n\nQ: The rate of natural increase of a population is found by subtracting the\n(A) crude death rate from the crude birth date. (B) crude birth rate from the crude death rate. (C) doubling time from the crude birth rate. (D) fertility rate from the crude death rate.\nA:  (A)\n\nQ: Which one of the following items is an example of nonmaterial culture?\n(A) Dove soap (B) Dove candy bar (C) Dove symbol (D) A dove (bird)\nA:  (C)\n\nQ: During the third stage of the demographic transition model, which of the following is true?\n(A) Birth rates increase and population growth rate is less rapid. (B) Birth rates decline and population growth rate is less rapid. (C) Birth rates increase and population growth rate increases. (D) Birth rates decrease and population growth rate increases.\nA:  (B)\n\nQ: Which of the following statements is NOT accurate regarding the services provided by local governments in the United States?\n(A) Duplication of efforts occurs often. (B) Social problems of the central city spill over into the surrounding residential suburbs. (C) Inefficiency in providing services occurs often. (D) One neighborhood's efforts to reduce pollution are always supported by neighboring communities.\nA:  (D)\n\nQ: The practice of hiring a foreign third-party service provider to run an operation is called\n(A) outsourcing. (B) offshoring. (C) maquiladoras. (D) locational interdependence.\nA:  (B)\n\nQ: Which theory below was used as justification for US involvement in Vietnam in the 1960s and 1970s?\n(A) Devolution (B) Colonialism (C) Heartland theory (D) Containment theory\nA: ",
        {
          "until": [
            "</s>"
          ]
        }
      ]
    ],
    "resps": [
      [
        "(D)"
      ]
    ],
    "filtered_resps": [
      "(D)"
    ],
    "exact_match": 1.0
  },
  {
    "doc_id": 167,
    "doc": {
      "question": "Which of the following factors has little or no impact on mortality rates in the developing countries?",
      "subject": "high_school_geography",
      "choices": [
        "New medicines",
        "Improved birth control methods",
        "Pesticides",
        "Famine relief"
      ],
      "answer": 1
    },
    "target": "(B)",
    "arguments": [
      [
        "The following are multiple choice questions (with answers) about high school geography.\n\nQ: During the third stage of the demographic transition model, which of the following is true?\n(A) Birth rates increase and population growth rate is less rapid. (B) Birth rates decline and population growth rate is less rapid. (C) Birth rates increase and population growth rate increases. (D) Birth rates decrease and population growth rate increases.\nA:  (B)\n\nQ: Which of the following statements is NOT accurate regarding the services provided by local governments in the United States?\n(A) Duplication of efforts occurs often. (B) Social problems of the central city spill over into the surrounding residential suburbs. (C) Inefficiency in providing services occurs often. (D) One neighborhood's efforts to reduce pollution are always supported by neighboring communities.\nA:  (D)\n\nQ: The rate of natural increase of a population is found by subtracting the\n(A) crude death rate from the crude birth date. (B) crude birth rate from the crude death rate. (C) doubling time from the crude birth rate. (D) fertility rate from the crude death rate.\nA:  (A)\n\nQ: The practice of hiring a foreign third-party service provider to run an operation is called\n(A) outsourcing. (B) offshoring. (C) maquiladoras. (D) locational interdependence.\nA:  (B)\n\nQ: Which one of the following items is an example of nonmaterial culture?\n(A) Dove soap (B) Dove candy bar (C) Dove symbol (D) A dove (bird)\nA:  (C)\n\nQ: Which of the following factors has little or no impact on mortality rates in the developing countries?\n(A) New medicines (B) Improved birth control methods (C) Pesticides (D) Famine relief\nA: ",
        {
          "until": [
            "</s>"
          ]
        }
      ]
    ],
    "resps": [
      [
        "(D)"
      ]
    ],
    "filtered_resps": [
      "(D)"
    ],
    "exact_match": 0.0
  },
  {
    "doc_id": 175,
    "doc": {
      "question": "Change in any culture is introduced through all the following processes EXCEPT",
      "subject": "high_school_geography",
      "choices": [
        "innovation.",
        "diffusion.",
        "acculturation.",
        "gravity."
      ],
      "answer": 3
    },
    "target": "(D)",
    "arguments": [
      [
        "The following are multiple choice questions (with answers) about high school geography.\n\nQ: During the third stage of the demographic transition model, which of the following is true?\n(A) Birth rates increase and population growth rate is less rapid. (B) Birth rates decline and population growth rate is less rapid. (C) Birth rates increase and population growth rate increases. (D) Birth rates decrease and population growth rate increases.\nA:  (B)\n\nQ: Which of the following statements is NOT accurate regarding the services provided by local governments in the United States?\n(A) Duplication of efforts occurs often. (B) Social problems of the central city spill over into the surrounding residential suburbs. (C) Inefficiency in providing services occurs often. (D) One neighborhood's efforts to reduce pollution are always supported by neighboring communities.\nA:  (D)\n\nQ: Which one of the following items is an example of nonmaterial culture?\n(A) Dove soap (B) Dove candy bar (C) Dove symbol (D) A dove (bird)\nA:  (C)\n\nQ: The rate of natural increase of a population is found by subtracting the\n(A) crude death rate from the crude birth date. (B) crude birth rate from the crude death rate. (C) doubling time from the crude birth rate. (D) fertility rate from the crude death rate.\nA:  (A)\n\nQ: The practice of hiring a foreign third-party service provider to run an operation is called\n(A) outsourcing. (B) offshoring. (C) maquiladoras. (D) locational interdependence.\nA:  (B)\n\nQ: Change in any culture is introduced through all the following processes EXCEPT\n(A) innovation. (B) diffusion. (C) acculturation. (D) gravity.\nA: ",
        {
          "until": [
            "</s>"
          ]
        }
      ]
    ],
    "resps": [
      [
        "(C)"
      ]
    ],
    "filtered_resps": [
      "(C)"
    ],
    "exact_match": 0.0
  },
  {
    "doc_id": 183,
    "doc": {
      "question": "The construction of freeways leads to all but which of the following results?",
      "subject": "high_school_geography",
      "choices": [
        "Urban sprawl",
        "Traffic increase",
        "Traffic congestion",
        "Decreased dependency on cars"
      ],
      "answer": 3
    },
    "target": "(D)",
    "arguments": [
      [
        "The following are multiple choice questions (with answers) about high school geography.\n\nQ: The practice of hiring a foreign third-party service provider to run an operation is called\n(A) outsourcing. (B) offshoring. (C) maquiladoras. (D) locational interdependence.\nA:  (B)\n\nQ: During the third stage of the demographic transition model, which of the following is true?\n(A) Birth rates increase and population growth rate is less rapid. (B) Birth rates decline and population growth rate is less rapid. (C) Birth rates increase and population growth rate increases. (D) Birth rates decrease and population growth rate increases.\nA:  (B)\n\nQ: The rate of natural increase of a population is found by subtracting the\n(A) crude death rate from the crude birth date. (B) crude birth rate from the crude death rate. (C) doubling time from the crude birth rate. (D) fertility rate from the crude death rate.\nA:  (A)\n\nQ: Which one of the following items is an example of nonmaterial culture?\n(A) Dove soap (B) Dove candy bar (C) Dove symbol (D) A dove (bird)\nA:  (C)\n\nQ: Which of the following statements is NOT accurate regarding the services provided by local governments in the United States?\n(A) Duplication of efforts occurs often. (B) Social problems of the central city spill over into the surrounding residential suburbs. (C) Inefficiency in providing services occurs often. (D) One neighborhood's efforts to reduce pollution are always supported by neighboring communities.\nA:  (D)\n\nQ: The construction of freeways leads to all but which of the following results?\n(A) Urban sprawl (B) Traffic increase (C) Traffic congestion (D) Decreased dependency on cars\nA: ",
        {
          "until": [
            "</s>"
          ]
        }
      ]
    ],
    "resps": [
      [
        "(C)"
      ]
    ],
    "filtered_resps": [
      "(C)"
    ],
    "exact_match": 0.0
  },
  {
    "doc_id": 191,
    "doc": {
      "question": "The global lingua franca is",
      "subject": "high_school_geography",
      "choices": [
        "Chinese.",
        "English.",
        "French.",
        "Arabic."
      ],
      "answer": 1
    },
    "target": "(B)",
    "arguments": [
      [
        "The following are multiple choice questions (with answers) about high school geography.\n\nQ: During the third stage of the demographic transition model, which of the following is true?\n(A) Birth rates increase and population growth rate is less rapid. (B) Birth rates decline and population growth rate is less rapid. (C) Birth rates increase and population growth rate increases. (D) Birth rates decrease and population growth rate increases.\nA:  (B)\n\nQ: The rate of natural increase of a population is found by subtracting the\n(A) crude death rate from the crude birth date. (B) crude birth rate from the crude death rate. (C) doubling time from the crude birth rate. (D) fertility rate from the crude death rate.\nA:  (A)\n\nQ: Which of the following statements is NOT accurate regarding the services provided by local governments in the United States?\n(A) Duplication of efforts occurs often. (B) Social problems of the central city spill over into the surrounding residential suburbs. (C) Inefficiency in providing services occurs often. (D) One neighborhood's efforts to reduce pollution are always supported by neighboring communities.\nA:  (D)\n\nQ: Which one of the following items is an example of nonmaterial culture?\n(A) Dove soap (B) Dove candy bar (C) Dove symbol (D) A dove (bird)\nA:  (C)\n\nQ: The practice of hiring a foreign third-party service provider to run an operation is called\n(A) outsourcing. (B) offshoring. (C) maquiladoras. (D) locational interdependence.\nA:  (B)\n\nQ: The global lingua franca is\n(A) Chinese. (B) English. (C) French. (D) Arabic.\nA: ",
        {
          "until": [
            "</s>"
          ]
        }
      ]
    ],
    "resps": [
      [
        "(D)"
      ]
    ],
    "filtered_resps": [
      "(D)"
    ],
    "exact_match": 0.0
  }
]