[
  {
    "doc_id": 0,
    "doc": {
      "question": "Based on the characteristic population curves that result from plotting population growth of a species, the most effective means of controlling the mosquito population is to",
      "subject": "college_biology",
      "choices": [
        "maintain the population at a point corresponding to the midpoint of its logistic curve",
        "opt for zero population control once the K value of the curve has been reached",
        "reduce the carrying capacity cif the environment to lower the K value",
        "increase the mortality rate"
      ],
      "answer": 2
    },
    "target": "(C)",
    "arguments": [
      [
        "The following are multiple choice questions (with answers) about college biology.\n\nQ: According to the pressure-flow model of movement of phloem contents, photosynthate movement from source to sink is driven by\n(A) an ATP-dependent pressure-flow pump (B) a water-pressure potential gradient (C) transpiration (D) apoplastic diffusion\nA:  (B)\n\nQ: Which of the following represents an accurate statement concerning arthropods?\n(A) They possess an exoskeleton composed primarily of peptidoglycan. (B) They possess an open circulatory system with a dorsal heart. (C) They are members of a biologically unsuccessful phylum incapable of exploiting diverse habitats and nutrition sources. (D) They lack paired, jointed appendages.\nA:  (B)\n\nQ: Which of the following contain DNA sequences required for the segregation of chromosomes in mitosis and meiosis?\n(A) Telomeres (B) Centromeres (C) Nucleosomes (D) Spliceosomes\nA:  (B)\n\nQ: The presence of homologous structures in two different organisms, such as the humerus in the front limb of a human and a bird, indicates that\n(A) the human and bird are polyphyletic species (B) a human's and bird's evolution is convergent (C) the human and bird belong to a clade (D) the human and bird developed by analogy\nA:  (C)\n\nQ: In a given population, 1 out of every 400 people has a cancer caused by a completely recessive allele, b. Assuming the population is in Hardy-Weinberg equilibrium, which of the following is the expected proportion of individuals who carry the b allele but are not expected to develop the cancer?\n(A) 1/400 (B) 19/400 (C) 20/400 (D) 38/400\nA:  (D)\n\nQ: Based on the characteristic population curves that result from plotting population growth of a species, the most effective means of controlling the mosquito population is to\n(A) maintain the population at a point corresponding to the midpoint of its logistic curve (B) opt for zero population control once the K value of the curve has been reached (C) reduce the carrying capacity cif the environment to lower the K value (D) increase the mortality rate\nA: ",
        {
          "until": [
            "</s>"
          ]
        }
      ]
    ],
    "resps": [
      [
        "(A)"
      ]
    ],
    "filtered_resps": [
      "(A)"
    ],
    "exact_match": 0.0
  },
  {
    "doc_id": 8,
    "doc": {
      "question": "The concept of punctuated equilibrium refers to",
      "subject": "college_biology",
      "choices": [
        "oscillating ecological successional stages",
        "ecological succession arrested by sudden environmental changes, e.g., fire",
        "persistent predator-prey relationships in relatively stable environments",
        "bursts of speciation followed by relatively unchanging lineages"
      ],
      "answer": 3
    },
    "target": "(D)",
    "arguments": [
      [
        "The following are multiple choice questions (with answers) about college biology.\n\nQ: Which of the following represents an accurate statement concerning arthropods?\n(A) They possess an exoskeleton composed primarily of peptidoglycan. (B) They possess an open circulatory system with a dorsal heart. (C) They are members of a biologically unsuccessful phylum incapable of exploiting diverse habitats and nutrition sources. (D) They lack paired, jointed appendages.\nA:  (B)\n\nQ: Which of the following contain DNA sequences required for the segregation of chromosomes in mitosis and meiosis?\n(A) Telomeres (B) Centromeres (C) Nucleosomes (D) Spliceosomes\nA:  (B)\n\nQ: In a given population, 1 out of every 400 people has a cancer caused by a completely recessive allele, b. Assuming the population is in Hardy-Weinberg equilibrium, which of the following is the expected proportion of individuals who carry the b allele but are not expected to develop the cancer?\n(A) 1/400 (B) 19/400 (C) 20/400 (D) 38/400\nA:  (D)\n\nQ: According to the pressure-flow model of movement of phloem contents, photosynthate movement from source to sink is driven by\n(A) an ATP-dependent pressure-flow pump (B) a water-pressure potential gradient (C) transpiration (D) apoplastic diffusion\nA:  (B)\n\nQ: The presence of homologous structures in two different organisms, such as the humerus in the front limb of a human and a bird, indicates that\n(A) the human and bird are polyphyletic species (B) a human's and bird's evolution is convergent (C) the human and bird belong to a clade (D) the human and bird developed by analogy\nA:  (C)\n\nQ: The concept of punctuated equilibrium refers to\n(A) oscillating ecological successional stages (B) ecological succession arrested by sudden environmental changes, e.g., fire (C) persistent predator-prey relationships in relatively stable environments (D) bursts of speciation followed by relatively unchanging lineages\nA: ",
        {
          "until": [
            "</s>"
          ]
        }
      ]
    ],
    "resps": [
      [
        "(D)"
      ]
    ],
    "filtered_resps": [
      "(D)"
    ],
    "exact_match": 1.0
  },
  {
    "doc_id": 16,
    "doc": {
      "question": "Which of the following is a benefit that mycorrhizal fungi confer to many plants?",
      "subject": "college_biology",
      "choices": [
        "They protect plant roots from desiccation in extremely dry habitats.",
        "They fix nitrogen, which is particularly important for plants in nitrogen-limited habitats.",
        "They provide access to phosphorus, an essential element that is limited in many kinds of soils.",
        "They provide carbon to plants in exchange for fixed nitrogen."
      ],
      "answer": 2
    },
    "target": "(C)",
    "arguments": [
      [
        "The following are multiple choice questions (with answers) about college biology.\n\nQ: Which of the following represents an accurate statement concerning arthropods?\n(A) They possess an exoskeleton composed primarily of peptidoglycan. (B) They possess an open circulatory system with a dorsal heart. (C) They are members of a biologically unsuccessful phylum incapable of exploiting diverse habitats and nutrition sources. (D) They lack paired, jointed appendages.\nA:  (B)\n\nQ: Which of the following contain DNA sequences required for the segregation of chromosomes in mitosis and meiosis?\n(A) Telomeres (B) Centromeres (C) Nucleosomes (D) Spliceosomes\nA:  (B)\n\nQ: In a given population, 1 out of every 400 people has a cancer caused by a completely recessive allele, b. Assuming the population is in Hardy-Weinberg equilibrium, which of the following is the expected proportion of individuals who carry the b allele but are not expected to develop the cancer?\n(A) 1/400 (B) 19/400 (C) 20/400 (D) 38/400\nA:  (D)\n\nQ: The presence of homologous structures in two different organisms, such as the humerus in the front limb of a human and a bird, indicates that\n(A) the human and bird are polyphyletic species (B) a human's and bird's evolution is convergent (C) the human and bird belong to a clade (D) the human and bird developed by analogy\nA:  (C)\n\nQ: According to the pressure-flow model of movement of phloem contents, photosynthate movement from source to sink is driven by\n(A) an ATP-dependent pressure-flow pump (B) a water-pressure potential gradient (C) transpiration (D) apoplastic diffusion\nA:  (B)\n\nQ: Which of the following is a benefit that mycorrhizal fungi confer to many plants?\n(A) They protect plant roots from desiccation in extremely dry habitats. (B) They fix nitrogen, which is particularly important for plants in nitrogen-limited habitats. (C) They provide access to phosphorus, an essential element that is limited in many kinds of soils. (D) They provide carbon to plants in exchange for fixed nitrogen.\nA: ",
        {
          "until": [
            "</s>"
          ]
        }
      ]
    ],
    "resps": [
      [
        "(B)"
      ]
    ],
    "filtered_resps": [
      "(B)"
    ],
    "exact_match": 0.0
  },
  {
    "doc_id": 24,
    "doc": {
      "question": "Mobile regions of DNA capable of inserting themselves into an existing genome are",
      "subject": "college_biology",
      "choices": [
        "prions",
        "cistrons",
        "introns",
        "transposons"
      ],
      "answer": 3
    },
    "target": "(D)",
    "arguments": [
      [
        "The following are multiple choice questions (with answers) about college biology.\n\nQ: In a given population, 1 out of every 400 people has a cancer caused by a completely recessive allele, b. Assuming the population is in Hardy-Weinberg equilibrium, which of the following is the expected proportion of individuals who carry the b allele but are not expected to develop the cancer?\n(A) 1/400 (B) 19/400 (C) 20/400 (D) 38/400\nA:  (D)\n\nQ: Which of the following represents an accurate statement concerning arthropods?\n(A) They possess an exoskeleton composed primarily of peptidoglycan. (B) They possess an open circulatory system with a dorsal heart. (C) They are members of a biologically unsuccessful phylum incapable of exploiting diverse habitats and nutrition sources. (D) They lack paired, jointed appendages.\nA:  (B)\n\nQ: According to the pressure-flow model of movement of phloem contents, photosynthate movement from source to sink is driven by\n(A) an ATP-dependent pressure-flow pump (B) a water-pressure potential gradient (C) transpiration (D) apoplastic diffusion\nA:  (B)\n\nQ: The presence of homologous structures in two different organisms, such as the humerus in the front limb of a human and a bird, indicates that\n(A) the human and bird are polyphyletic species (B) a human's and bird's evolution is convergent (C) the human and bird belong to a clade (D) the human and bird developed by analogy\nA:  (C)\n\nQ: Which of the following contain DNA sequences required for the segregation of chromosomes in mitosis and meiosis?\n(A) Telomeres (B) Centromeres (C) Nucleosomes (D) Spliceosomes\nA:  (B)\n\nQ: Mobile regions of DNA capable of inserting themselves into an existing genome are\n(A) prions (B) cistrons (C) introns (D) transposons\nA: ",
        {
          "until": [
            "</s>"
          ]
        }
      ]
    ],
    "resps": [
      [
        "(D)<0x0A>Answer: D"
      ]
    ],
    "filtered_resps": [
      "(D)<0x0A>Answer: D"
    ],
    "exact_match": 0.0
  },
  {
    "doc_id": 32,
    "doc": {
      "question": "The members of a bird species capable of nesting in treetops or on the ledges of nearby cliffs make their homes only in the treetops due to the established presence of a more aggressive bird species on the cliff ledges. With respect to habitat, the treetop-nesting birds are utilizing",
      "subject": "college_biology",
      "choices": [
        "their fundamental niche only",
        "their realistic niche only",
        "their ecological niche only",
        "neither their fundamental niche nor their realistic niche"
      ],
      "answer": 1
    },
    "target": "(B)",
    "arguments": [
      [
        "The following are multiple choice questions (with answers) about college biology.\n\nQ: Which of the following contain DNA sequences required for the segregation of chromosomes in mitosis and meiosis?\n(A) Telomeres (B) Centromeres (C) Nucleosomes (D) Spliceosomes\nA:  (B)\n\nQ: According to the pressure-flow model of movement of phloem contents, photosynthate movement from source to sink is driven by\n(A) an ATP-dependent pressure-flow pump (B) a water-pressure potential gradient (C) transpiration (D) apoplastic diffusion\nA:  (B)\n\nQ: Which of the following represents an accurate statement concerning arthropods?\n(A) They possess an exoskeleton composed primarily of peptidoglycan. (B) They possess an open circulatory system with a dorsal heart. (C) They are members of a biologically unsuccessful phylum incapable of exploiting diverse habitats and nutrition sources. (D) They lack paired, jointed appendages.\nA:  (B)\n\nQ: The presence of homologous structures in two different organisms, such as the humerus in the front limb of a human and a bird, indicates that\n(A) the human and bird are polyphyletic species (B) a human's and bird's evolution is convergent (C) the human and bird belong to a clade (D) the human and bird developed by analogy\nA:  (C)\n\nQ: In a given population, 1 out of every 400 people has a cancer caused by a completely recessive allele, b. Assuming the population is in Hardy-Weinberg equilibrium, which of the following is the expected proportion of individuals who carry the b allele but are not expected to develop the cancer?\n(A) 1/400 (B) 19/400 (C) 20/400 (D) 38/400\nA:  (D)\n\nQ: The members of a bird species capable of nesting in treetops or on the ledges of nearby cliffs make their homes only in the treetops due to the established presence of a more aggressive bird species on the cliff ledges. With respect to habitat, the treetop-nesting birds are utilizing\n(A) their fundamental niche only (B) their realistic niche only (C) their ecological niche only (D) neither their fundamental niche nor their realistic niche\nA: ",
        {
          "until": [
            "</s>"
          ]
        }
      ]
    ],
    "resps": [
      [
        "(D)"
      ]
    ],
    "filtered_resps": [
      "(D)"
    ],
    "exact_match": 0.0
  },
  {
    "doc_id": 40,
    "doc": {
      "question": "A stem-boring beetle has laid its eggs in the center of a 5-year-old wood twig, and the eggs have matured into larvae. In proper order (inside to outside), what tissues and tissue regions would the larvae encounter as they eat their way toward the outside of the twig? (For simplicity, assume that the epidermis has already fallen off completely.)",
      "subject": "college_biology",
      "choices": [
        "Pith; primary xylem; secondary xylem; vascular cambium; primary phloem; secondary phloem; cortex",
        "Pith; secondary xylem; primary xylem; vascular cambium; secondary phloem; primary phloem; cortex",
        "Pith; secondary xylem; primary xylem; vascular cambium; primary phloem; secondary phloem; cortex",
        "Pith; primary xylem; secondary xylem; vascular cambium; secondary phloem; primary phloem; cortex"
      ],
      "answer": 3
    },
    "target": "(D)",
    "arguments": [
      [
        "The following are multiple choice questions (with answers) about college biology.\n\nQ: Which of the following represents an accurate statement concerning arthropods?\n(A) They possess an exoskeleton composed primarily of peptidoglycan. (B) They possess an open circulatory system with a dorsal heart. (C) They are members of a biologically unsuccessful phylum incapable of exploiting diverse habitats and nutrition sources. (D) They lack paired, jointed appendages.\nA:  (B)\n\nQ: Which of the following contain DNA sequences required for the segregation of chromosomes in mitosis and meiosis?\n(A) Telomeres (B) Centromeres (C) Nucleosomes (D) Spliceosomes\nA:  (B)\n\nQ: The presence of homologous structures in two different organisms, such as the humerus in the front limb of a human and a bird, indicates that\n(A) the human and bird are polyphyletic species (B) a human's and bird's evolution is convergent (C) the human and bird belong to a clade (D) the human and bird developed by analogy\nA:  (C)\n\nQ: According to the pressure-flow model of movement of phloem contents, photosynthate movement from source to sink is driven by\n(A) an ATP-dependent pressure-flow pump (B) a water-pressure potential gradient (C) transpiration (D) apoplastic diffusion\nA:  (B)\n\nQ: In a given population, 1 out of every 400 people has a cancer caused by a completely recessive allele, b. Assuming the population is in Hardy-Weinberg equilibrium, which of the following is the expected proportion of individuals who carry the b allele but are not expected to develop the cancer?\n(A) 1/400 (B) 19/400 (C) 20/400 (D) 38/400\nA:  (D)\n\nQ: A stem-boring beetle has laid its eggs in the center of a 5-year-old wood twig, and the eggs have matured into larvae. In proper order (inside to outside), what tissues and tissue regions would the larvae encounter as they eat their way toward the outside of the twig? (For simplicity, assume that the epidermis has already fallen off completely.)\n(A) Pith; primary xylem; secondary xylem; vascular cambium; primary phloem; secondary phloem; cortex (B) Pith; secondary xylem; primary xylem; vascular cambium; secondary phloem; primary phloem; cortex (C) Pith; secondary xylem; primary xylem; vascular cambium; primary phloem; secondary phloem; cortex (D) Pith; primary xylem; secondary xylem; vascular cambium; secondary phloem; primary phloem; cortex\nA: ",
        {
          "until": [
            "</s>"
          ]
        }
      ]
    ],
    "resps": [
      [
        "(D)"
      ]
    ],
    "filtered_resps": [
      "(D)"
    ],
    "exact_match": 1.0
  },
  {
    "doc_id": 48,
    "doc": {
      "question": "A marine ecosystem region characterized by penetrance of solar radiation and upwelling of nutrients is the",
      "subject": "college_biology",
      "choices": [
        "bathyl zone",
        "neritic zone",
        "pelagic zone",
        "benthyl zone"
      ],
      "answer": 1
    },
    "target": "(B)",
    "arguments": [
      [
        "The following are multiple choice questions (with answers) about college biology.\n\nQ: Which of the following contain DNA sequences required for the segregation of chromosomes in mitosis and meiosis?\n(A) Telomeres (B) Centromeres (C) Nucleosomes (D) Spliceosomes\nA:  (B)\n\nQ: Which of the following represents an accurate statement concerning arthropods?\n(A) They possess an exoskeleton composed primarily of peptidoglycan. (B) They possess an open circulatory system with a dorsal heart. (C) They are members of a biologically unsuccessful phylum incapable of exploiting diverse habitats and nutrition sources. (D) They lack paired, jointed appendages.\nA:  (B)\n\nQ: The presence of homologous structures in two different organisms, such as the humerus in the front limb of a human and a bird, indicates that\n(A) the human and bird are polyphyletic species (B) a human's and bird's evolution is convergent (C) the human and bird belong to a clade (D) the human and bird developed by analogy\nA:  (C)\n\nQ: In a given population, 1 out of every 400 people has a cancer caused by a completely recessive allele, b. Assuming the population is in Hardy-Weinberg equilibrium, which of the following is the expected proportion of individuals who carry the b allele but are not expected to develop the cancer?\n(A) 1/400 (B) 19/400 (C) 20/400 (D) 38/400\nA:  (D)\n\nQ: According to the pressure-flow model of movement of phloem contents, photosynthate movement from source to sink is driven by\n(A) an ATP-dependent pressure-flow pump (B) a water-pressure potential gradient (C) transpiration (D) apoplastic diffusion\nA:  (B)\n\nQ: A marine ecosystem region characterized by penetrance of solar radiation and upwelling of nutrients is the\n(A) bathyl zone (B) neritic zone (C) pelagic zone (D) benthyl zone\nA: ",
        {
          "until": [
            "</s>"
          ]
        }
      ]
    ],
    "resps": [
      [
        "(D)"
      ]
    ],
    "filtered_resps": [
      "(D)"
    ],
    "exact_match": 0.0
  },
  {
    "doc_id": 56,
    "doc": {
      "question": "Nerve outgrowth from a developing neuron begins at the growth cone, located at the tip of the axon. Microspikes of the growth cone extend and retract in order to move the growth cone forward. Exposure of the neuron to cytochasalin B at this stage of development causes",
      "subject": "college_biology",
      "choices": [
        "microtubules in the axon to undergo reversible dissociation",
        "microtubules in the axon to undergo irreversible dissociation",
        "microfilaments in the microspike to undergo reversible depolymerization",
        "microfilaments in the microspike to undergo irreversible depolymerization"
      ],
      "answer": 2
    },
    "target": "(C)",
    "arguments": [
      [
        "The following are multiple choice questions (with answers) about college biology.\n\nQ: The presence of homologous structures in two different organisms, such as the humerus in the front limb of a human and a bird, indicates that\n(A) the human and bird are polyphyletic species (B) a human's and bird's evolution is convergent (C) the human and bird belong to a clade (D) the human and bird developed by analogy\nA:  (C)\n\nQ: Which of the following contain DNA sequences required for the segregation of chromosomes in mitosis and meiosis?\n(A) Telomeres (B) Centromeres (C) Nucleosomes (D) Spliceosomes\nA:  (B)\n\nQ: Which of the following represents an accurate statement concerning arthropods?\n(A) They possess an exoskeleton composed primarily of peptidoglycan. (B) They possess an open circulatory system with a dorsal heart. (C) They are members of a biologically unsuccessful phylum incapable of exploiting diverse habitats and nutrition sources. (D) They lack paired, jointed appendages.\nA:  (B)\n\nQ: According to the pressure-flow model of movement of phloem contents, photosynthate movement from source to sink is driven by\n(A) an ATP-dependent pressure-flow pump (B) a water-pressure potential gradient (C) transpiration (D) apoplastic diffusion\nA:  (B)\n\nQ: In a given population, 1 out of every 400 people has a cancer caused by a completely recessive allele, b. Assuming the population is in Hardy-Weinberg equilibrium, which of the following is the expected proportion of individuals who carry the b allele but are not expected to develop the cancer?\n(A) 1/400 (B) 19/400 (C) 20/400 (D) 38/400\nA:  (D)\n\nQ: Nerve outgrowth from a developing neuron begins at the growth cone, located at the tip of the axon. Microspikes of the growth cone extend and retract in order to move the growth cone forward. Exposure of the neuron to cytochasalin B at this stage of development causes\n(A) microtubules in the axon to undergo reversible dissociation (B) microtubules in the axon to undergo irreversible dissociation (C) microfilaments in the microspike to undergo reversible depolymerization (D) microfilaments in the microspike to undergo irreversible depolymerization\nA: ",
        {
          "until": [
            "</s>"
          ]
        }
      ]
    ],
    "resps": [
      [
        "(D)"
      ]
    ],
    "filtered_resps": [
      "(D)"
    ],
    "exact_match": 0.0
  },
  {
    "doc_id": 64,
    "doc": {
      "question": "During the mammalian cardiac cycle, a volume of blood equivalent to ventricular stroke volume is transferred from the more compliant venous side to the less compliant arterial side of the circulation. In terms of pressures within the venous and arterial compartments, this transfer results in",
      "subject": "college_biology",
      "choices": [
        "no change in pressure in either compartment",
        "no effect on venous pressure and a small increase in arterial pressure",
        "an increase in venous pressure and an equal but opposite decrease in arterial pressure",
        "little effect on venous pressure and a large increase in arterial pressure"
      ],
      "answer": 3
    },
    "target": "(D)",
    "arguments": [
      [
        "The following are multiple choice questions (with answers) about college biology.\n\nQ: Which of the following contain DNA sequences required for the segregation of chromosomes in mitosis and meiosis?\n(A) Telomeres (B) Centromeres (C) Nucleosomes (D) Spliceosomes\nA:  (B)\n\nQ: Which of the following represents an accurate statement concerning arthropods?\n(A) They possess an exoskeleton composed primarily of peptidoglycan. (B) They possess an open circulatory system with a dorsal heart. (C) They are members of a biologically unsuccessful phylum incapable of exploiting diverse habitats and nutrition sources. (D) They lack paired, jointed appendages.\nA:  (B)\n\nQ: The presence of homologous structures in two different organisms, such as the humerus in the front limb of a human and a bird, indicates that\n(A) the human and bird are polyphyletic species (B) a human's and bird's evolution is convergent (C) the human and bird belong to a clade (D) the human and bird developed by analogy\nA:  (C)\n\nQ: According to the pressure-flow model of movement of phloem contents, photosynthate movement from source to sink is driven by\n(A) an ATP-dependent pressure-flow pump (B) a water-pressure potential gradient (C) transpiration (D) apoplastic diffusion\nA:  (B)\n\nQ: In a given population, 1 out of every 400 people has a cancer caused by a completely recessive allele, b. Assuming the population is in Hardy-Weinberg equilibrium, which of the following is the expected proportion of individuals who carry the b allele but are not expected to develop the cancer?\n(A) 1/400 (B) 19/400 (C) 20/400 (D) 38/400\nA:  (D)\n\nQ: During the mammalian cardiac cycle, a volume of blood equivalent to ventricular stroke volume is transferred from the more compliant venous side to the less compliant arterial side of the circulation. In terms of pressures within the venous and arterial compartments, this transfer results in\n(A) no change in pressure in either compartment (B) no effect on venous pressure and a small increase in arterial pressure (C) an increase in venous pressure and an equal but opposite decrease in arterial pressure (D) little effect on venous pressure and a large increase in arterial pressure\nA: ",
        {
          "until": [
            "</s>"
          ]
        }
      ]
    ],
    "resps": [
      [
        "(B)"
      ]
    ],
    "filtered_resps": [
      "(B)"
    ],
    "exact_match": 0.0
  },
  {
    "doc_id": 72,
    "doc": {
      "question": "Annelids and arthropods are similar to each other in that members of both phyla",
      "subject": "college_biology",
      "choices": [
        "have segmented bodies",
        "have a closed circulatory system",
        "conduct gas exchange by diffusion through a moist membrane",
        "have well-developed sense organs"
      ],
      "answer": 0
    },
    "target": "(A)",
    "arguments": [
      [
        "The following are multiple choice questions (with answers) about college biology.\n\nQ: The presence of homologous structures in two different organisms, such as the humerus in the front limb of a human and a bird, indicates that\n(A) the human and bird are polyphyletic species (B) a human's and bird's evolution is convergent (C) the human and bird belong to a clade (D) the human and bird developed by analogy\nA:  (C)\n\nQ: In a given population, 1 out of every 400 people has a cancer caused by a completely recessive allele, b. Assuming the population is in Hardy-Weinberg equilibrium, which of the following is the expected proportion of individuals who carry the b allele but are not expected to develop the cancer?\n(A) 1/400 (B) 19/400 (C) 20/400 (D) 38/400\nA:  (D)\n\nQ: Which of the following contain DNA sequences required for the segregation of chromosomes in mitosis and meiosis?\n(A) Telomeres (B) Centromeres (C) Nucleosomes (D) Spliceosomes\nA:  (B)\n\nQ: According to the pressure-flow model of movement of phloem contents, photosynthate movement from source to sink is driven by\n(A) an ATP-dependent pressure-flow pump (B) a water-pressure potential gradient (C) transpiration (D) apoplastic diffusion\nA:  (B)\n\nQ: Which of the following represents an accurate statement concerning arthropods?\n(A) They possess an exoskeleton composed primarily of peptidoglycan. (B) They possess an open circulatory system with a dorsal heart. (C) They are members of a biologically unsuccessful phylum incapable of exploiting diverse habitats and nutrition sources. (D) They lack paired, jointed appendages.\nA:  (B)\n\nQ: Annelids and arthropods are similar to each other in that members of both phyla\n(A) have segmented bodies (B) have a closed circulatory system (C) conduct gas exchange by diffusion through a moist membrane (D) have well-developed sense organs\nA: ",
        {
          "until": [
            "</s>"
          ]
        }
      ]
    ],
    "resps": [
      [
        "(A)"
      ]
    ],
    "filtered_resps": [
      "(A)"
    ],
    "exact_match": 1.0
  },
  {
    "doc_id": 80,
    "doc": {
      "question": "Cancer cells grown in culture are similar to normal cells grown in culture in that they",
      "subject": "college_biology",
      "choices": [
        "divide an indefinite number of times",
        "do not display contact inhibition",
        "require a surface for attachment in order to grow",
        "proliferate to the same cell density"
      ],
      "answer": 2
    },
    "target": "(C)",
    "arguments": [
      [
        "The following are multiple choice questions (with answers) about college biology.\n\nQ: In a given population, 1 out of every 400 people has a cancer caused by a completely recessive allele, b. Assuming the population is in Hardy-Weinberg equilibrium, which of the following is the expected proportion of individuals who carry the b allele but are not expected to develop the cancer?\n(A) 1/400 (B) 19/400 (C) 20/400 (D) 38/400\nA:  (D)\n\nQ: Which of the following represents an accurate statement concerning arthropods?\n(A) They possess an exoskeleton composed primarily of peptidoglycan. (B) They possess an open circulatory system with a dorsal heart. (C) They are members of a biologically unsuccessful phylum incapable of exploiting diverse habitats and nutrition sources. (D) They lack paired, jointed appendages.\nA:  (B)\n\nQ: According to the pressure-flow model of movement of phloem contents, photosynthate movement from source to sink is driven by\n(A) an ATP-dependent pressure-flow pump (B) a water-pressure potential gradient (C) transpiration (D) apoplastic diffusion\nA:  (B)\n\nQ: Which of the following contain DNA sequences required for the segregation of chromosomes in mitosis and meiosis?\n(A) Telomeres (B) Centromeres (C) Nucleosomes (D) Spliceosomes\nA:  (B)\n\nQ: The presence of homologous structures in two different organisms, such as the humerus in the front limb of a human and a bird, indicates that\n(A) the human and bird are polyphyletic species (B) a human's and bird's evolution is convergent (C) the human and bird belong to a clade (D) the human and bird developed by analogy\nA:  (C)\n\nQ: Cancer cells grown in culture are similar to normal cells grown in culture in that they\n(A) divide an indefinite number of times (B) do not display contact inhibition (C) require a surface for attachment in order to grow (D) proliferate to the same cell density\nA: ",
        {
          "until": [
            "</s>"
          ]
        }
      ]
    ],
    "resps": [
      [
        "(D)"
      ]
    ],
    "filtered_resps": [
      "(D)"
    ],
    "exact_match": 0.0
  },
  {
    "doc_id": 88,
    "doc": {
      "question": "Which of the following tissues in an actively photosynthesizing plant would have the highest rate of oxygen production?",
      "subject": "college_biology",
      "choices": [
        "Cortex",
        "Palisade mesophyll",
        "Epidermis",
        "Vascular cambium"
      ],
      "answer": 1
    },
    "target": "(B)",
    "arguments": [
      [
        "The following are multiple choice questions (with answers) about college biology.\n\nQ: Which of the following represents an accurate statement concerning arthropods?\n(A) They possess an exoskeleton composed primarily of peptidoglycan. (B) They possess an open circulatory system with a dorsal heart. (C) They are members of a biologically unsuccessful phylum incapable of exploiting diverse habitats and nutrition sources. (D) They lack paired, jointed appendages.\nA:  (B)\n\nQ: In a given population, 1 out of every 400 people has a cancer caused by a completely recessive allele, b. Assuming the population is in Hardy-Weinberg equilibrium, which of the following is the expected proportion of individuals who carry the b allele but are not expected to develop the cancer?\n(A) 1/400 (B) 19/400 (C) 20/400 (D) 38/400\nA:  (D)\n\nQ: Which of the following contain DNA sequences required for the segregation of chromosomes in mitosis and meiosis?\n(A) Telomeres (B) Centromeres (C) Nucleosomes (D) Spliceosomes\nA:  (B)\n\nQ: The presence of homologous structures in two different organisms, such as the humerus in the front limb of a human and a bird, indicates that\n(A) the human and bird are polyphyletic species (B) a human's and bird's evolution is convergent (C) the human and bird belong to a clade (D) the human and bird developed by analogy\nA:  (C)\n\nQ: According to the pressure-flow model of movement of phloem contents, photosynthate movement from source to sink is driven by\n(A) an ATP-dependent pressure-flow pump (B) a water-pressure potential gradient (C) transpiration (D) apoplastic diffusion\nA:  (B)\n\nQ: Which of the following tissues in an actively photosynthesizing plant would have the highest rate of oxygen production?\n(A) Cortex (B) Palisade mesophyll (C) Epidermis (D) Vascular cambium\nA: ",
        {
          "until": [
            "</s>"
          ]
        }
      ]
    ],
    "resps": [
      [
        "(C)"
      ]
    ],
    "filtered_resps": [
      "(C)"
    ],
    "exact_match": 0.0
  },
  {
    "doc_id": 96,
    "doc": {
      "question": "Which of the following depicts the correct sequence of membranes of the chloroplast, beginning with the innermost membrane and ending with the outermost membrane?",
      "subject": "college_biology",
      "choices": [
        "Thylakoid membrane, inner membrane, outer membrane",
        "Inner membrane, outer membrane, thylakoid membrane",
        "Outer membrane, inner membrane, thylakoid membrane",
        "Strama, outer membrane, inner membrane"
      ],
      "answer": 0
    },
    "target": "(A)",
    "arguments": [
      [
        "The following are multiple choice questions (with answers) about college biology.\n\nQ: Which of the following represents an accurate statement concerning arthropods?\n(A) They possess an exoskeleton composed primarily of peptidoglycan. (B) They possess an open circulatory system with a dorsal heart. (C) They are members of a biologically unsuccessful phylum incapable of exploiting diverse habitats and nutrition sources. (D) They lack paired, jointed appendages.\nA:  (B)\n\nQ: In a given population, 1 out of every 400 people has a cancer caused by a completely recessive allele, b. Assuming the population is in Hardy-Weinberg equilibrium, which of the following is the expected proportion of individuals who carry the b allele but are not expected to develop the cancer?\n(A) 1/400 (B) 19/400 (C) 20/400 (D) 38/400\nA:  (D)\n\nQ: The presence of homologous structures in two different organisms, such as the humerus in the front limb of a human and a bird, indicates that\n(A) the human and bird are polyphyletic species (B) a human's and bird's evolution is convergent (C) the human and bird belong to a clade (D) the human and bird developed by analogy\nA:  (C)\n\nQ: According to the pressure-flow model of movement of phloem contents, photosynthate movement from source to sink is driven by\n(A) an ATP-dependent pressure-flow pump (B) a water-pressure potential gradient (C) transpiration (D) apoplastic diffusion\nA:  (B)\n\nQ: Which of the following contain DNA sequences required for the segregation of chromosomes in mitosis and meiosis?\n(A) Telomeres (B) Centromeres (C) Nucleosomes (D) Spliceosomes\nA:  (B)\n\nQ: Which of the following depicts the correct sequence of membranes of the chloroplast, beginning with the innermost membrane and ending with the outermost membrane?\n(A) Thylakoid membrane, inner membrane, outer membrane (B) Inner membrane, outer membrane, thylakoid membrane (C) Outer membrane, inner membrane, thylakoid membrane (D) Strama, outer membrane, inner membrane\nA: ",
        {
          "until": [
            "</s>"
          ]
        }
      ]
    ],
    "resps": [
      [
        "(C)"
      ]
    ],
    "filtered_resps": [
      "(C)"
    ],
    "exact_match": 0.0
  },
  {
    "doc_id": 104,
    "doc": {
      "question": "A prokaryote that is thermophilic and methanogenic and has isoprenylglycerol ethers in its membrane instead of phospholipids is most likely",
      "subject": "college_biology",
      "choices": [
        "a proteobacterium",
        "a spirochete",
        "a member of the genus Chlamydia",
        "an archaeon"
      ],
      "answer": 3
    },
    "target": "(D)",
    "arguments": [
      [
        "The following are multiple choice questions (with answers) about college biology.\n\nQ: Which of the following represents an accurate statement concerning arthropods?\n(A) They possess an exoskeleton composed primarily of peptidoglycan. (B) They possess an open circulatory system with a dorsal heart. (C) They are members of a biologically unsuccessful phylum incapable of exploiting diverse habitats and nutrition sources. (D) They lack paired, jointed appendages.\nA:  (B)\n\nQ: According to the pressure-flow model of movement of phloem contents, photosynthate movement from source to sink is driven by\n(A) an ATP-dependent pressure-flow pump (B) a water-pressure potential gradient (C) transpiration (D) apoplastic diffusion\nA:  (B)\n\nQ: In a given population, 1 out of every 400 people has a cancer caused by a completely recessive allele, b. Assuming the population is in Hardy-Weinberg equilibrium, which of the following is the expected proportion of individuals who carry the b allele but are not expected to develop the cancer?\n(A) 1/400 (B) 19/400 (C) 20/400 (D) 38/400\nA:  (D)\n\nQ: Which of the following contain DNA sequences required for the segregation of chromosomes in mitosis and meiosis?\n(A) Telomeres (B) Centromeres (C) Nucleosomes (D) Spliceosomes\nA:  (B)\n\nQ: The presence of homologous structures in two different organisms, such as the humerus in the front limb of a human and a bird, indicates that\n(A) the human and bird are polyphyletic species (B) a human's and bird's evolution is convergent (C) the human and bird belong to a clade (D) the human and bird developed by analogy\nA:  (C)\n\nQ: A prokaryote that is thermophilic and methanogenic and has isoprenylglycerol ethers in its membrane instead of phospholipids is most likely\n(A) a proteobacterium (B) a spirochete (C) a member of the genus Chlamydia (D) an archaeon\nA: ",
        {
          "until": [
            "</s>"
          ]
        }
      ]
    ],
    "resps": [
      [
        "(A)<0x0A>Q: What is the most likely organism that is thermophilic and methanogenic and has isoprenylglycerol ethers in its membrane instead of phospholipids?<0x0A>Options:<0x0A>(A) a proteobacterium<0x0A>(B) a spirochete<0x0A>(C) a member of the genus Chlamydia<0x0A>(D) an archaeon"
      ]
    ],
    "filtered_resps": [
      "(A)<0x0A>Q: What is the most likely organism that is thermophilic and methanogenic and has isoprenylglycerol ethers in its membrane instead of phospholipids?<0x0A>Options:<0x0A>(A) a proteobacterium<0x0A>(B) a spirochete<0x0A>(C) a member of the genus Chlamydia<0x0A>(D) an archaeon"
    ],
    "exact_match": 0.0
  },
  {
    "doc_id": 112,
    "doc": {
      "question": "From an evolutionary perspective, the optimality theory as applied to a given trait is best represented by the idea that",
      "subject": "college_biology",
      "choices": [
        "if the benefits gained from the trait exceed the cost of the trait to the animal performing them, that trait will persist in the genome",
        "if the trait reaps the best return for the cost relative to alternative forms of the trait, that trait will win out over the alternative forms",
        "beneficial traits are always worth the cost to the organism in energy and physiology, so those traits will persist in the genome",
        "the relative fitness of an organism must be improved due to a specific trait in order for the trait to remain in a population's gene pool"
      ],
      "answer": 1
    },
    "target": "(B)",
    "arguments": [
      [
        "The following are multiple choice questions (with answers) about college biology.\n\nQ: The presence of homologous structures in two different organisms, such as the humerus in the front limb of a human and a bird, indicates that\n(A) the human and bird are polyphyletic species (B) a human's and bird's evolution is convergent (C) the human and bird belong to a clade (D) the human and bird developed by analogy\nA:  (C)\n\nQ: In a given population, 1 out of every 400 people has a cancer caused by a completely recessive allele, b. Assuming the population is in Hardy-Weinberg equilibrium, which of the following is the expected proportion of individuals who carry the b allele but are not expected to develop the cancer?\n(A) 1/400 (B) 19/400 (C) 20/400 (D) 38/400\nA:  (D)\n\nQ: According to the pressure-flow model of movement of phloem contents, photosynthate movement from source to sink is driven by\n(A) an ATP-dependent pressure-flow pump (B) a water-pressure potential gradient (C) transpiration (D) apoplastic diffusion\nA:  (B)\n\nQ: Which of the following represents an accurate statement concerning arthropods?\n(A) They possess an exoskeleton composed primarily of peptidoglycan. (B) They possess an open circulatory system with a dorsal heart. (C) They are members of a biologically unsuccessful phylum incapable of exploiting diverse habitats and nutrition sources. (D) They lack paired, jointed appendages.\nA:  (B)\n\nQ: Which of the following contain DNA sequences required for the segregation of chromosomes in mitosis and meiosis?\n(A) Telomeres (B) Centromeres (C) Nucleosomes (D) Spliceosomes\nA:  (B)\n\nQ: From an evolutionary perspective, the optimality theory as applied to a given trait is best represented by the idea that\n(A) if the benefits gained from the trait exceed the cost of the trait to the animal performing them, that trait will persist in the genome (B) if the trait reaps the best return for the cost relative to alternative forms of the trait, that trait will win out over the alternative forms (C) beneficial traits are always worth the cost to the organism in energy and physiology, so those traits will persist in the genome (D) the relative fitness of an organism must be improved due to a specific trait in order for the trait to remain in a population's gene pool\nA: ",
        {
          "until": [
            "</s>"
          ]
        }
      ]
    ],
    "resps": [
      [
        "(B)"
      ]
    ],
    "filtered_resps": [
      "(B)"
    ],
    "exact_match": 1.0
  },
  {
    "doc_id": 120,
    "doc": {
      "question": "A subunit of DNA and protein consisting of 134-base-pair long stretches of DNA surrounding a protein octomer is called (a)",
      "subject": "college_biology",
      "choices": [
        "histone",
        "chromatin",
        "nucleosome",
        "solenoid"
      ],
      "answer": 2
    },
    "target": "(C)",
    "arguments": [
      [
        "The following are multiple choice questions (with answers) about college biology.\n\nQ: Which of the following represents an accurate statement concerning arthropods?\n(A) They possess an exoskeleton composed primarily of peptidoglycan. (B) They possess an open circulatory system with a dorsal heart. (C) They are members of a biologically unsuccessful phylum incapable of exploiting diverse habitats and nutrition sources. (D) They lack paired, jointed appendages.\nA:  (B)\n\nQ: According to the pressure-flow model of movement of phloem contents, photosynthate movement from source to sink is driven by\n(A) an ATP-dependent pressure-flow pump (B) a water-pressure potential gradient (C) transpiration (D) apoplastic diffusion\nA:  (B)\n\nQ: In a given population, 1 out of every 400 people has a cancer caused by a completely recessive allele, b. Assuming the population is in Hardy-Weinberg equilibrium, which of the following is the expected proportion of individuals who carry the b allele but are not expected to develop the cancer?\n(A) 1/400 (B) 19/400 (C) 20/400 (D) 38/400\nA:  (D)\n\nQ: The presence of homologous structures in two different organisms, such as the humerus in the front limb of a human and a bird, indicates that\n(A) the human and bird are polyphyletic species (B) a human's and bird's evolution is convergent (C) the human and bird belong to a clade (D) the human and bird developed by analogy\nA:  (C)\n\nQ: Which of the following contain DNA sequences required for the segregation of chromosomes in mitosis and meiosis?\n(A) Telomeres (B) Centromeres (C) Nucleosomes (D) Spliceosomes\nA:  (B)\n\nQ: A subunit of DNA and protein consisting of 134-base-pair long stretches of DNA surrounding a protein octomer is called (a)\n(A) histone (B) chromatin (C) nucleosome (D) solenoid\nA: ",
        {
          "until": [
            "</s>"
          ]
        }
      ]
    ],
    "resps": [
      [
        "(C)"
      ]
    ],
    "filtered_resps": [
      "(C)"
    ],
    "exact_match": 1.0
  },
  {
    "doc_id": 128,
    "doc": {
      "question": "Root pressure created by a plant's roots causes water to enter the roots by",
      "subject": "college_biology",
      "choices": [
        "translocation",
        "adhesion",
        "osmosis",
        "capillary action"
      ],
      "answer": 2
    },
    "target": "(C)",
    "arguments": [
      [
        "The following are multiple choice questions (with answers) about college biology.\n\nQ: Which of the following contain DNA sequences required for the segregation of chromosomes in mitosis and meiosis?\n(A) Telomeres (B) Centromeres (C) Nucleosomes (D) Spliceosomes\nA:  (B)\n\nQ: According to the pressure-flow model of movement of phloem contents, photosynthate movement from source to sink is driven by\n(A) an ATP-dependent pressure-flow pump (B) a water-pressure potential gradient (C) transpiration (D) apoplastic diffusion\nA:  (B)\n\nQ: In a given population, 1 out of every 400 people has a cancer caused by a completely recessive allele, b. Assuming the population is in Hardy-Weinberg equilibrium, which of the following is the expected proportion of individuals who carry the b allele but are not expected to develop the cancer?\n(A) 1/400 (B) 19/400 (C) 20/400 (D) 38/400\nA:  (D)\n\nQ: Which of the following represents an accurate statement concerning arthropods?\n(A) They possess an exoskeleton composed primarily of peptidoglycan. (B) They possess an open circulatory system with a dorsal heart. (C) They are members of a biologically unsuccessful phylum incapable of exploiting diverse habitats and nutrition sources. (D) They lack paired, jointed appendages.\nA:  (B)\n\nQ: The presence of homologous structures in two different organisms, such as the humerus in the front limb of a human and a bird, indicates that\n(A) the human and bird are polyphyletic species (B) a human's and bird's evolution is convergent (C) the human and bird belong to a clade (D) the human and bird developed by analogy\nA:  (C)\n\nQ: Root pressure created by a plant's roots causes water to enter the roots by\n(A) translocation (B) adhesion (C) osmosis (D) capillary action\nA: ",
        {
          "until": [
            "</s>"
          ]
        }
      ]
    ],
    "resps": [
      [
        "(D)<0x0A>Q: Root pressure creates water in the roots by (A) translocation (B) adhesion (C) osmosis (D) capillary action"
      ]
    ],
    "filtered_resps": [
      "(D)<0x0A>Q: Root pressure creates water in the roots by (A) translocation (B) adhesion (C) osmosis (D) capillary action"
    ],
    "exact_match": 0.0
  },
  {
    "doc_id": 136,
    "doc": {
      "question": "A female fruit fly bearing linked genes that produce the phenotype gray body and normal wings mates with a male fruit fly of phenotype black body and vestigial wings. The presence of gray-bodied, vestigialwinged flies among the progeny is best explained by",
      "subject": "college_biology",
      "choices": [
        "crossing over",
        "independent assortment",
        "segregation of alleles",
        "penetrance"
      ],
      "answer": 0
    },
    "target": "(A)",
    "arguments": [
      [
        "The following are multiple choice questions (with answers) about college biology.\n\nQ: Which of the following contain DNA sequences required for the segregation of chromosomes in mitosis and meiosis?\n(A) Telomeres (B) Centromeres (C) Nucleosomes (D) Spliceosomes\nA:  (B)\n\nQ: In a given population, 1 out of every 400 people has a cancer caused by a completely recessive allele, b. Assuming the population is in Hardy-Weinberg equilibrium, which of the following is the expected proportion of individuals who carry the b allele but are not expected to develop the cancer?\n(A) 1/400 (B) 19/400 (C) 20/400 (D) 38/400\nA:  (D)\n\nQ: According to the pressure-flow model of movement of phloem contents, photosynthate movement from source to sink is driven by\n(A) an ATP-dependent pressure-flow pump (B) a water-pressure potential gradient (C) transpiration (D) apoplastic diffusion\nA:  (B)\n\nQ: The presence of homologous structures in two different organisms, such as the humerus in the front limb of a human and a bird, indicates that\n(A) the human and bird are polyphyletic species (B) a human's and bird's evolution is convergent (C) the human and bird belong to a clade (D) the human and bird developed by analogy\nA:  (C)\n\nQ: Which of the following represents an accurate statement concerning arthropods?\n(A) They possess an exoskeleton composed primarily of peptidoglycan. (B) They possess an open circulatory system with a dorsal heart. (C) They are members of a biologically unsuccessful phylum incapable of exploiting diverse habitats and nutrition sources. (D) They lack paired, jointed appendages.\nA:  (B)\n\nQ: A female fruit fly bearing linked genes that produce the phenotype gray body and normal wings mates with a male fruit fly of phenotype black body and vestigial wings. The presence of gray-bodied, vestigialwinged flies among the progeny is best explained by\n(A) crossing over (B) independent assortment (C) segregation of alleles (D) penetrance\nA: ",
        {
          "until": [
            "</s>"
          ]
        }
      ]
    ],
    "resps": [
      [
        "(B)"
      ]
    ],
    "filtered_resps": [
      "(B)"
    ],
    "exact_match": 0.0
  },
  {
    "doc_id": 1,
    "doc": {
      "question": "A frameshift mutation is created when",
      "subject": "college_biology",
      "choices": [
        "telomeric sequences are removed from DNA",
        "a codon's nucleotide sequence changes so that it calls for production of a different amino acid than the original one",
        "a base pair is either inserted or deleted in a gene",
        "a codon's nucleotide sequence is changed so that instead of coding for a given amino acid it acts to terminate translation"
      ],
      "answer": 2
    },
    "target": "(C)",
    "arguments": [
      [
        "The following are multiple choice questions (with answers) about college biology.\n\nQ: According to the pressure-flow model of movement of phloem contents, photosynthate movement from source to sink is driven by\n(A) an ATP-dependent pressure-flow pump (B) a water-pressure potential gradient (C) transpiration (D) apoplastic diffusion\nA:  (B)\n\nQ: Which of the following represents an accurate statement concerning arthropods?\n(A) They possess an exoskeleton composed primarily of peptidoglycan. (B) They possess an open circulatory system with a dorsal heart. (C) They are members of a biologically unsuccessful phylum incapable of exploiting diverse habitats and nutrition sources. (D) They lack paired, jointed appendages.\nA:  (B)\n\nQ: Which of the following contain DNA sequences required for the segregation of chromosomes in mitosis and meiosis?\n(A) Telomeres (B) Centromeres (C) Nucleosomes (D) Spliceosomes\nA:  (B)\n\nQ: The presence of homologous structures in two different organisms, such as the humerus in the front limb of a human and a bird, indicates that\n(A) the human and bird are polyphyletic species (B) a human's and bird's evolution is convergent (C) the human and bird belong to a clade (D) the human and bird developed by analogy\nA:  (C)\n\nQ: In a given population, 1 out of every 400 people has a cancer caused by a completely recessive allele, b. Assuming the population is in Hardy-Weinberg equilibrium, which of the following is the expected proportion of individuals who carry the b allele but are not expected to develop the cancer?\n(A) 1/400 (B) 19/400 (C) 20/400 (D) 38/400\nA:  (D)\n\nQ: A frameshift mutation is created when\n(A) telomeric sequences are removed from DNA (B) a codon's nucleotide sequence changes so that it calls for production of a different amino acid than the original one (C) a base pair is either inserted or deleted in a gene (D) a codon's nucleotide sequence is changed so that instead of coding for a given amino acid it acts to terminate translation\nA: ",
        {
          "until": [
            "</s>"
          ]
        }
      ]
    ],
    "resps": [
      [
        "(D)"
      ]
    ],
    "filtered_resps": [
      "(D)"
    ],
    "exact_match": 0.0
  },
  {
    "doc_id": 9,
    "doc": {
      "question": "When an influenza virus enters a cell, it immediately starts to do which of the following?",
      "subject": "college_biology",
      "choices": [
        "Incorporate viral DNA into the host cell\u2019s chromosome",
        "Destroy the host cell\u2019s transcriptional machinery",
        "Replicate its genetic material and synthesize viral proteins",
        "Use a viral copy of reverse transcriptase to manufacture viral DNA"
      ],
      "answer": 2
    },
    "target": "(C)",
    "arguments": [
      [
        "The following are multiple choice questions (with answers) about college biology.\n\nQ: Which of the following represents an accurate statement concerning arthropods?\n(A) They possess an exoskeleton composed primarily of peptidoglycan. (B) They possess an open circulatory system with a dorsal heart. (C) They are members of a biologically unsuccessful phylum incapable of exploiting diverse habitats and nutrition sources. (D) They lack paired, jointed appendages.\nA:  (B)\n\nQ: Which of the following contain DNA sequences required for the segregation of chromosomes in mitosis and meiosis?\n(A) Telomeres (B) Centromeres (C) Nucleosomes (D) Spliceosomes\nA:  (B)\n\nQ: In a given population, 1 out of every 400 people has a cancer caused by a completely recessive allele, b. Assuming the population is in Hardy-Weinberg equilibrium, which of the following is the expected proportion of individuals who carry the b allele but are not expected to develop the cancer?\n(A) 1/400 (B) 19/400 (C) 20/400 (D) 38/400\nA:  (D)\n\nQ: According to the pressure-flow model of movement of phloem contents, photosynthate movement from source to sink is driven by\n(A) an ATP-dependent pressure-flow pump (B) a water-pressure potential gradient (C) transpiration (D) apoplastic diffusion\nA:  (B)\n\nQ: The presence of homologous structures in two different organisms, such as the humerus in the front limb of a human and a bird, indicates that\n(A) the human and bird are polyphyletic species (B) a human's and bird's evolution is convergent (C) the human and bird belong to a clade (D) the human and bird developed by analogy\nA:  (C)\n\nQ: When an influenza virus enters a cell, it immediately starts to do which of the following?\n(A) Incorporate viral DNA into the host cell\u2019s chromosome (B) Destroy the host cell\u2019s transcriptional machinery (C) Replicate its genetic material and synthesize viral proteins (D) Use a viral copy of reverse transcriptase to manufacture viral DNA\nA: ",
        {
          "until": [
            "</s>"
          ]
        }
      ]
    ],
    "resps": [
      [
        "(A)"
      ]
    ],
    "filtered_resps": [
      "(A)"
    ],
    "exact_match": 0.0
  },
  {
    "doc_id": 17,
    "doc": {
      "question": "Experiments on song development in birds have shown that when a young male reared in isolation hears only the song of a different bird species, he will develop an adult song repertoire that lacks certain characteristics typical of his own species. This result shows that the song of his species is most likely",
      "subject": "college_biology",
      "choices": [
        "entirely learned during development",
        "entirely instinctive",
        "both instinctive and learned",
        "dependent upon hormones for proper development"
      ],
      "answer": 2
    },
    "target": "(C)",
    "arguments": [
      [
        "The following are multiple choice questions (with answers) about college biology.\n\nQ: Which of the following represents an accurate statement concerning arthropods?\n(A) They possess an exoskeleton composed primarily of peptidoglycan. (B) They possess an open circulatory system with a dorsal heart. (C) They are members of a biologically unsuccessful phylum incapable of exploiting diverse habitats and nutrition sources. (D) They lack paired, jointed appendages.\nA:  (B)\n\nQ: Which of the following contain DNA sequences required for the segregation of chromosomes in mitosis and meiosis?\n(A) Telomeres (B) Centromeres (C) Nucleosomes (D) Spliceosomes\nA:  (B)\n\nQ: In a given population, 1 out of every 400 people has a cancer caused by a completely recessive allele, b. Assuming the population is in Hardy-Weinberg equilibrium, which of the following is the expected proportion of individuals who carry the b allele but are not expected to develop the cancer?\n(A) 1/400 (B) 19/400 (C) 20/400 (D) 38/400\nA:  (D)\n\nQ: The presence of homologous structures in two different organisms, such as the humerus in the front limb of a human and a bird, indicates that\n(A) the human and bird are polyphyletic species (B) a human's and bird's evolution is convergent (C) the human and bird belong to a clade (D) the human and bird developed by analogy\nA:  (C)\n\nQ: According to the pressure-flow model of movement of phloem contents, photosynthate movement from source to sink is driven by\n(A) an ATP-dependent pressure-flow pump (B) a water-pressure potential gradient (C) transpiration (D) apoplastic diffusion\nA:  (B)\n\nQ: Experiments on song development in birds have shown that when a young male reared in isolation hears only the song of a different bird species, he will develop an adult song repertoire that lacks certain characteristics typical of his own species. This result shows that the song of his species is most likely\n(A) entirely learned during development (B) entirely instinctive (C) both instinctive and learned (D) dependent upon hormones for proper development\nA: ",
        {
          "until": [
            "</s>"
          ]
        }
      ]
    ],
    "resps": [
      [
        "(C)"
      ]
    ],
    "filtered_resps": [
      "(C)"
    ],
    "exact_match": 1.0
  },
  {
    "doc_id": 25,
    "doc": {
      "question": "The process in which pioneer species colonize a bare substrate such as rock, sand, or glacial till is known as",
      "subject": "college_biology",
      "choices": [
        "weathering",
        "stabilizing succession",
        "secondary succession",
        "primary succession"
      ],
      "answer": 3
    },
    "target": "(D)",
    "arguments": [
      [
        "The following are multiple choice questions (with answers) about college biology.\n\nQ: In a given population, 1 out of every 400 people has a cancer caused by a completely recessive allele, b. Assuming the population is in Hardy-Weinberg equilibrium, which of the following is the expected proportion of individuals who carry the b allele but are not expected to develop the cancer?\n(A) 1/400 (B) 19/400 (C) 20/400 (D) 38/400\nA:  (D)\n\nQ: Which of the following represents an accurate statement concerning arthropods?\n(A) They possess an exoskeleton composed primarily of peptidoglycan. (B) They possess an open circulatory system with a dorsal heart. (C) They are members of a biologically unsuccessful phylum incapable of exploiting diverse habitats and nutrition sources. (D) They lack paired, jointed appendages.\nA:  (B)\n\nQ: According to the pressure-flow model of movement of phloem contents, photosynthate movement from source to sink is driven by\n(A) an ATP-dependent pressure-flow pump (B) a water-pressure potential gradient (C) transpiration (D) apoplastic diffusion\nA:  (B)\n\nQ: The presence of homologous structures in two different organisms, such as the humerus in the front limb of a human and a bird, indicates that\n(A) the human and bird are polyphyletic species (B) a human's and bird's evolution is convergent (C) the human and bird belong to a clade (D) the human and bird developed by analogy\nA:  (C)\n\nQ: Which of the following contain DNA sequences required for the segregation of chromosomes in mitosis and meiosis?\n(A) Telomeres (B) Centromeres (C) Nucleosomes (D) Spliceosomes\nA:  (B)\n\nQ: The process in which pioneer species colonize a bare substrate such as rock, sand, or glacial till is known as\n(A) weathering (B) stabilizing succession (C) secondary succession (D) primary succession\nA: ",
        {
          "until": [
            "</s>"
          ]
        }
      ]
    ],
    "resps": [
      [
        "(D)"
      ]
    ],
    "filtered_resps": [
      "(D)"
    ],
    "exact_match": 1.0
  },
  {
    "doc_id": 33,
    "doc": {
      "question": "All of the following characteristics are typical of r-selected species EXCEPT",
      "subject": "college_biology",
      "choices": [
        "high reproductive rate",
        "small body size",
        "occupancy of unstable environments",
        "high competitive ability"
      ],
      "answer": 3
    },
    "target": "(D)",
    "arguments": [
      [
        "The following are multiple choice questions (with answers) about college biology.\n\nQ: Which of the following contain DNA sequences required for the segregation of chromosomes in mitosis and meiosis?\n(A) Telomeres (B) Centromeres (C) Nucleosomes (D) Spliceosomes\nA:  (B)\n\nQ: According to the pressure-flow model of movement of phloem contents, photosynthate movement from source to sink is driven by\n(A) an ATP-dependent pressure-flow pump (B) a water-pressure potential gradient (C) transpiration (D) apoplastic diffusion\nA:  (B)\n\nQ: Which of the following represents an accurate statement concerning arthropods?\n(A) They possess an exoskeleton composed primarily of peptidoglycan. (B) They possess an open circulatory system with a dorsal heart. (C) They are members of a biologically unsuccessful phylum incapable of exploiting diverse habitats and nutrition sources. (D) They lack paired, jointed appendages.\nA:  (B)\n\nQ: The presence of homologous structures in two different organisms, such as the humerus in the front limb of a human and a bird, indicates that\n(A) the human and bird are polyphyletic species (B) a human's and bird's evolution is convergent (C) the human and bird belong to a clade (D) the human and bird developed by analogy\nA:  (C)\n\nQ: In a given population, 1 out of every 400 people has a cancer caused by a completely recessive allele, b. Assuming the population is in Hardy-Weinberg equilibrium, which of the following is the expected proportion of individuals who carry the b allele but are not expected to develop the cancer?\n(A) 1/400 (B) 19/400 (C) 20/400 (D) 38/400\nA:  (D)\n\nQ: All of the following characteristics are typical of r-selected species EXCEPT\n(A) high reproductive rate (B) small body size (C) occupancy of unstable environments (D) high competitive ability\nA: ",
        {
          "until": [
            "</s>"
          ]
        }
      ]
    ],
    "resps": [
      [
        "(B)"
      ]
    ],
    "filtered_resps": [
      "(B)"
    ],
    "exact_match": 0.0
  },
  {
    "doc_id": 41,
    "doc": {
      "question": "The following pairs were placed in solution together. Which two could be separated by performing low-speed centrifugation?",
      "subject": "college_biology",
      "choices": [
        "DNA and mRNA",
        "Nuclei and secretory vesicles",
        "Golgi apparatus and endoplasmic reticulum",
        "Lysosomes and endosomes"
      ],
      "answer": 1
    },
    "target": "(B)",
    "arguments": [
      [
        "The following are multiple choice questions (with answers) about college biology.\n\nQ: Which of the following represents an accurate statement concerning arthropods?\n(A) They possess an exoskeleton composed primarily of peptidoglycan. (B) They possess an open circulatory system with a dorsal heart. (C) They are members of a biologically unsuccessful phylum incapable of exploiting diverse habitats and nutrition sources. (D) They lack paired, jointed appendages.\nA:  (B)\n\nQ: Which of the following contain DNA sequences required for the segregation of chromosomes in mitosis and meiosis?\n(A) Telomeres (B) Centromeres (C) Nucleosomes (D) Spliceosomes\nA:  (B)\n\nQ: The presence of homologous structures in two different organisms, such as the humerus in the front limb of a human and a bird, indicates that\n(A) the human and bird are polyphyletic species (B) a human's and bird's evolution is convergent (C) the human and bird belong to a clade (D) the human and bird developed by analogy\nA:  (C)\n\nQ: According to the pressure-flow model of movement of phloem contents, photosynthate movement from source to sink is driven by\n(A) an ATP-dependent pressure-flow pump (B) a water-pressure potential gradient (C) transpiration (D) apoplastic diffusion\nA:  (B)\n\nQ: In a given population, 1 out of every 400 people has a cancer caused by a completely recessive allele, b. Assuming the population is in Hardy-Weinberg equilibrium, which of the following is the expected proportion of individuals who carry the b allele but are not expected to develop the cancer?\n(A) 1/400 (B) 19/400 (C) 20/400 (D) 38/400\nA:  (D)\n\nQ: The following pairs were placed in solution together. Which two could be separated by performing low-speed centrifugation?\n(A) DNA and mRNA (B) Nuclei and secretory vesicles (C) Golgi apparatus and endoplasmic reticulum (D) Lysosomes and endosomes\nA: ",
        {
          "until": [
            "</s>"
          ]
        }
      ]
    ],
    "resps": [
      [
        "(B)"
      ]
    ],
    "filtered_resps": [
      "(B)"
    ],
    "exact_match": 1.0
  },
  {
    "doc_id": 49,
    "doc": {
      "question": "In humans, a hereditary disorder called xeroderma pigmentosum (XP) can result in the inability to repair ultraviolet damage to DNA. Which of the following molecular lesions is most likely to accrue in individuals with XP?",
      "subject": "college_biology",
      "choices": [
        "Thymine dimers",
        "Deamination of cytosine",
        "Depurination",
        "Single strand DNA breaks"
      ],
      "answer": 0
    },
    "target": "(A)",
    "arguments": [
      [
        "The following are multiple choice questions (with answers) about college biology.\n\nQ: Which of the following contain DNA sequences required for the segregation of chromosomes in mitosis and meiosis?\n(A) Telomeres (B) Centromeres (C) Nucleosomes (D) Spliceosomes\nA:  (B)\n\nQ: Which of the following represents an accurate statement concerning arthropods?\n(A) They possess an exoskeleton composed primarily of peptidoglycan. (B) They possess an open circulatory system with a dorsal heart. (C) They are members of a biologically unsuccessful phylum incapable of exploiting diverse habitats and nutrition sources. (D) They lack paired, jointed appendages.\nA:  (B)\n\nQ: The presence of homologous structures in two different organisms, such as the humerus in the front limb of a human and a bird, indicates that\n(A) the human and bird are polyphyletic species (B) a human's and bird's evolution is convergent (C) the human and bird belong to a clade (D) the human and bird developed by analogy\nA:  (C)\n\nQ: In a given population, 1 out of every 400 people has a cancer caused by a completely recessive allele, b. Assuming the population is in Hardy-Weinberg equilibrium, which of the following is the expected proportion of individuals who carry the b allele but are not expected to develop the cancer?\n(A) 1/400 (B) 19/400 (C) 20/400 (D) 38/400\nA:  (D)\n\nQ: According to the pressure-flow model of movement of phloem contents, photosynthate movement from source to sink is driven by\n(A) an ATP-dependent pressure-flow pump (B) a water-pressure potential gradient (C) transpiration (D) apoplastic diffusion\nA:  (B)\n\nQ: In humans, a hereditary disorder called xeroderma pigmentosum (XP) can result in the inability to repair ultraviolet damage to DNA. Which of the following molecular lesions is most likely to accrue in individuals with XP?\n(A) Thymine dimers (B) Deamination of cytosine (C) Depurination (D) Single strand DNA breaks\nA: ",
        {
          "until": [
            "</s>"
          ]
        }
      ]
    ],
    "resps": [
      [
        "(D)"
      ]
    ],
    "filtered_resps": [
      "(D)"
    ],
    "exact_match": 0.0
  },
  {
    "doc_id": 57,
    "doc": {
      "question": "Monoclonal antisera are distinguished from polyclonal antisera in which of the following ways?",
      "subject": "college_biology",
      "choices": [
        "Each type of antibody in a monoclonal antiserum reacts against a single region of a single antigen; each type of antibody in a polyclonal antiserum reacts against multiple regions of different antigens.",
        "A monoclonal antibody reacts against multiple regions of a single antigen; a polyclonal antibody reacts against a single region of related antigens.",
        "A monoclonal antiserum contains antibodies secreted from the descendants of a single B lymphocyte; a polyclonal antiserum contains antibodies secreted from the descendants of different B lymphocytes.",
        "A monoclonal antiserum contains antibodies secreted from the descendants of a single B lymphocyte; a polyclonal antiserum contains antibodies secreted from the descendants of both B and T lymphocytes."
      ],
      "answer": 2
    },
    "target": "(C)",
    "arguments": [
      [
        "The following are multiple choice questions (with answers) about college biology.\n\nQ: The presence of homologous structures in two different organisms, such as the humerus in the front limb of a human and a bird, indicates that\n(A) the human and bird are polyphyletic species (B) a human's and bird's evolution is convergent (C) the human and bird belong to a clade (D) the human and bird developed by analogy\nA:  (C)\n\nQ: Which of the following contain DNA sequences required for the segregation of chromosomes in mitosis and meiosis?\n(A) Telomeres (B) Centromeres (C) Nucleosomes (D) Spliceosomes\nA:  (B)\n\nQ: Which of the following represents an accurate statement concerning arthropods?\n(A) They possess an exoskeleton composed primarily of peptidoglycan. (B) They possess an open circulatory system with a dorsal heart. (C) They are members of a biologically unsuccessful phylum incapable of exploiting diverse habitats and nutrition sources. (D) They lack paired, jointed appendages.\nA:  (B)\n\nQ: According to the pressure-flow model of movement of phloem contents, photosynthate movement from source to sink is driven by\n(A) an ATP-dependent pressure-flow pump (B) a water-pressure potential gradient (C) transpiration (D) apoplastic diffusion\nA:  (B)\n\nQ: In a given population, 1 out of every 400 people has a cancer caused by a completely recessive allele, b. Assuming the population is in Hardy-Weinberg equilibrium, which of the following is the expected proportion of individuals who carry the b allele but are not expected to develop the cancer?\n(A) 1/400 (B) 19/400 (C) 20/400 (D) 38/400\nA:  (D)\n\nQ: Monoclonal antisera are distinguished from polyclonal antisera in which of the following ways?\n(A) Each type of antibody in a monoclonal antiserum reacts against a single region of a single antigen; each type of antibody in a polyclonal antiserum reacts against multiple regions of different antigens. (B) A monoclonal antibody reacts against multiple regions of a single antigen; a polyclonal antibody reacts against a single region of related antigens. (C) A monoclonal antiserum contains antibodies secreted from the descendants of a single B lymphocyte; a polyclonal antiserum contains antibodies secreted from the descendants of different B lymphocytes. (D) A monoclonal antiserum contains antibodies secreted from the descendants of a single B lymphocyte; a polyclonal antiserum contains antibodies secreted from the descendants of both B and T lymphocytes.\nA: ",
        {
          "until": [
            "</s>"
          ]
        }
      ]
    ],
    "resps": [
      [
        "(D)"
      ]
    ],
    "filtered_resps": [
      "(D)"
    ],
    "exact_match": 0.0
  },
  {
    "doc_id": 65,
    "doc": {
      "question": "Which of the following statements concerning the Golgi apparatus of a eukaryote is correct?",
      "subject": "college_biology",
      "choices": [
        "It is oriented in the cytoplasm so that its cis face is closest to the endoplasmic reticulum.",
        "It is typically associated with small secretory vesicles located near its cis face.",
        "Its composite flattened cisternae are continuous with one another.",
        "Glycosylation of certain secretory proteins occurs prior to the protein's entry into its lumen."
      ],
      "answer": 0
    },
    "target": "(A)",
    "arguments": [
      [
        "The following are multiple choice questions (with answers) about college biology.\n\nQ: Which of the following contain DNA sequences required for the segregation of chromosomes in mitosis and meiosis?\n(A) Telomeres (B) Centromeres (C) Nucleosomes (D) Spliceosomes\nA:  (B)\n\nQ: Which of the following represents an accurate statement concerning arthropods?\n(A) They possess an exoskeleton composed primarily of peptidoglycan. (B) They possess an open circulatory system with a dorsal heart. (C) They are members of a biologically unsuccessful phylum incapable of exploiting diverse habitats and nutrition sources. (D) They lack paired, jointed appendages.\nA:  (B)\n\nQ: The presence of homologous structures in two different organisms, such as the humerus in the front limb of a human and a bird, indicates that\n(A) the human and bird are polyphyletic species (B) a human's and bird's evolution is convergent (C) the human and bird belong to a clade (D) the human and bird developed by analogy\nA:  (C)\n\nQ: According to the pressure-flow model of movement of phloem contents, photosynthate movement from source to sink is driven by\n(A) an ATP-dependent pressure-flow pump (B) a water-pressure potential gradient (C) transpiration (D) apoplastic diffusion\nA:  (B)\n\nQ: In a given population, 1 out of every 400 people has a cancer caused by a completely recessive allele, b. Assuming the population is in Hardy-Weinberg equilibrium, which of the following is the expected proportion of individuals who carry the b allele but are not expected to develop the cancer?\n(A) 1/400 (B) 19/400 (C) 20/400 (D) 38/400\nA:  (D)\n\nQ: Which of the following statements concerning the Golgi apparatus of a eukaryote is correct?\n(A) It is oriented in the cytoplasm so that its cis face is closest to the endoplasmic reticulum. (B) It is typically associated with small secretory vesicles located near its cis face. (C) Its composite flattened cisternae are continuous with one another. (D) Glycosylation of certain secretory proteins occurs prior to the protein's entry into its lumen.\nA: ",
        {
          "until": [
            "</s>"
          ]
        }
      ]
    ],
    "resps": [
      [
        "(B)"
      ]
    ],
    "filtered_resps": [
      "(B)"
    ],
    "exact_match": 0.0
  },
  {
    "doc_id": 73,
    "doc": {
      "question": "Approximately what fraction of the human genome encodes proteins?",
      "subject": "college_biology",
      "choices": [
        "2%",
        "25%",
        "50%",
        "90%"
      ],
      "answer": 0
    },
    "target": "(A)",
    "arguments": [
      [
        "The following are multiple choice questions (with answers) about college biology.\n\nQ: The presence of homologous structures in two different organisms, such as the humerus in the front limb of a human and a bird, indicates that\n(A) the human and bird are polyphyletic species (B) a human's and bird's evolution is convergent (C) the human and bird belong to a clade (D) the human and bird developed by analogy\nA:  (C)\n\nQ: In a given population, 1 out of every 400 people has a cancer caused by a completely recessive allele, b. Assuming the population is in Hardy-Weinberg equilibrium, which of the following is the expected proportion of individuals who carry the b allele but are not expected to develop the cancer?\n(A) 1/400 (B) 19/400 (C) 20/400 (D) 38/400\nA:  (D)\n\nQ: Which of the following contain DNA sequences required for the segregation of chromosomes in mitosis and meiosis?\n(A) Telomeres (B) Centromeres (C) Nucleosomes (D) Spliceosomes\nA:  (B)\n\nQ: According to the pressure-flow model of movement of phloem contents, photosynthate movement from source to sink is driven by\n(A) an ATP-dependent pressure-flow pump (B) a water-pressure potential gradient (C) transpiration (D) apoplastic diffusion\nA:  (B)\n\nQ: Which of the following represents an accurate statement concerning arthropods?\n(A) They possess an exoskeleton composed primarily of peptidoglycan. (B) They possess an open circulatory system with a dorsal heart. (C) They are members of a biologically unsuccessful phylum incapable of exploiting diverse habitats and nutrition sources. (D) They lack paired, jointed appendages.\nA:  (B)\n\nQ: Approximately what fraction of the human genome encodes proteins?\n(A) 2% (B) 25% (C) 50% (D) 90%\nA: ",
        {
          "until": [
            "</s>"
          ]
        }
      ]
    ],
    "resps": [
      [
        "(D)"
      ]
    ],
    "filtered_resps": [
      "(D)"
    ],
    "exact_match": 0.0
  },
  {
    "doc_id": 81,
    "doc": {
      "question": "Which of the following techniques could be used to demonstrate protein binding to specific DNA sequences?",
      "subject": "college_biology",
      "choices": [
        "Western blot hybridization",
        "Northern blot hybridization",
        "Southern blot hybridization",
        "Electrophoretic mobility shift assay"
      ],
      "answer": 3
    },
    "target": "(D)",
    "arguments": [
      [
        "The following are multiple choice questions (with answers) about college biology.\n\nQ: In a given population, 1 out of every 400 people has a cancer caused by a completely recessive allele, b. Assuming the population is in Hardy-Weinberg equilibrium, which of the following is the expected proportion of individuals who carry the b allele but are not expected to develop the cancer?\n(A) 1/400 (B) 19/400 (C) 20/400 (D) 38/400\nA:  (D)\n\nQ: Which of the following represents an accurate statement concerning arthropods?\n(A) They possess an exoskeleton composed primarily of peptidoglycan. (B) They possess an open circulatory system with a dorsal heart. (C) They are members of a biologically unsuccessful phylum incapable of exploiting diverse habitats and nutrition sources. (D) They lack paired, jointed appendages.\nA:  (B)\n\nQ: According to the pressure-flow model of movement of phloem contents, photosynthate movement from source to sink is driven by\n(A) an ATP-dependent pressure-flow pump (B) a water-pressure potential gradient (C) transpiration (D) apoplastic diffusion\nA:  (B)\n\nQ: Which of the following contain DNA sequences required for the segregation of chromosomes in mitosis and meiosis?\n(A) Telomeres (B) Centromeres (C) Nucleosomes (D) Spliceosomes\nA:  (B)\n\nQ: The presence of homologous structures in two different organisms, such as the humerus in the front limb of a human and a bird, indicates that\n(A) the human and bird are polyphyletic species (B) a human's and bird's evolution is convergent (C) the human and bird belong to a clade (D) the human and bird developed by analogy\nA:  (C)\n\nQ: Which of the following techniques could be used to demonstrate protein binding to specific DNA sequences?\n(A) Western blot hybridization (B) Northern blot hybridization (C) Southern blot hybridization (D) Electrophoretic mobility shift assay\nA: ",
        {
          "until": [
            "</s>"
          ]
        }
      ]
    ],
    "resps": [
      [
        "(D)"
      ]
    ],
    "filtered_resps": [
      "(D)"
    ],
    "exact_match": 1.0
  },
  {
    "doc_id": 89,
    "doc": {
      "question": "A recent theory concerning an unusual rise in asthma attacks following a thunderstorm proposes that while pollen grains at 5 microns are too large to enter the airways, their exposure to water precipitates the release of starch granules as a result of osmotic shock. The starch granules are small enough to enter the lower airways and trigger an asthmatic attack. If this theory is true, which of the following is a correct statement?",
      "subject": "college_biology",
      "choices": [
        "The interior of the pollen grains was hypotonic compared to the surrounding environment.",
        "The interior of the pollen grains had a higher osmotic pressure than did the surrounding environment.",
        "The pollen grains underwent plasmolysis prior to releasing their contents.",
        "The pollen grains underwent shrinking before they ruptured and released their contents."
      ],
      "answer": 1
    },
    "target": "(B)",
    "arguments": [
      [
        "The following are multiple choice questions (with answers) about college biology.\n\nQ: Which of the following represents an accurate statement concerning arthropods?\n(A) They possess an exoskeleton composed primarily of peptidoglycan. (B) They possess an open circulatory system with a dorsal heart. (C) They are members of a biologically unsuccessful phylum incapable of exploiting diverse habitats and nutrition sources. (D) They lack paired, jointed appendages.\nA:  (B)\n\nQ: In a given population, 1 out of every 400 people has a cancer caused by a completely recessive allele, b. Assuming the population is in Hardy-Weinberg equilibrium, which of the following is the expected proportion of individuals who carry the b allele but are not expected to develop the cancer?\n(A) 1/400 (B) 19/400 (C) 20/400 (D) 38/400\nA:  (D)\n\nQ: Which of the following contain DNA sequences required for the segregation of chromosomes in mitosis and meiosis?\n(A) Telomeres (B) Centromeres (C) Nucleosomes (D) Spliceosomes\nA:  (B)\n\nQ: The presence of homologous structures in two different organisms, such as the humerus in the front limb of a human and a bird, indicates that\n(A) the human and bird are polyphyletic species (B) a human's and bird's evolution is convergent (C) the human and bird belong to a clade (D) the human and bird developed by analogy\nA:  (C)\n\nQ: According to the pressure-flow model of movement of phloem contents, photosynthate movement from source to sink is driven by\n(A) an ATP-dependent pressure-flow pump (B) a water-pressure potential gradient (C) transpiration (D) apoplastic diffusion\nA:  (B)\n\nQ: A recent theory concerning an unusual rise in asthma attacks following a thunderstorm proposes that while pollen grains at 5 microns are too large to enter the airways, their exposure to water precipitates the release of starch granules as a result of osmotic shock. The starch granules are small enough to enter the lower airways and trigger an asthmatic attack. If this theory is true, which of the following is a correct statement?\n(A) The interior of the pollen grains was hypotonic compared to the surrounding environment. (B) The interior of the pollen grains had a higher osmotic pressure than did the surrounding environment. (C) The pollen grains underwent plasmolysis prior to releasing their contents. (D) The pollen grains underwent shrinking before they ruptured and released their contents.\nA: ",
        {
          "until": [
            "</s>"
          ]
        }
      ]
    ],
    "resps": [
      [
        "(D)"
      ]
    ],
    "filtered_resps": [
      "(D)"
    ],
    "exact_match": 0.0
  },
  {
    "doc_id": 97,
    "doc": {
      "question": "Antibiotics that affect bacterial cells interfere with all of the following EXCEPT",
      "subject": "college_biology",
      "choices": [
        "peptidoglycan synthesis",
        "protein synthesis",
        "DNA synthesis",
        "reverse transcriptase"
      ],
      "answer": 3
    },
    "target": "(D)",
    "arguments": [
      [
        "The following are multiple choice questions (with answers) about college biology.\n\nQ: Which of the following represents an accurate statement concerning arthropods?\n(A) They possess an exoskeleton composed primarily of peptidoglycan. (B) They possess an open circulatory system with a dorsal heart. (C) They are members of a biologically unsuccessful phylum incapable of exploiting diverse habitats and nutrition sources. (D) They lack paired, jointed appendages.\nA:  (B)\n\nQ: In a given population, 1 out of every 400 people has a cancer caused by a completely recessive allele, b. Assuming the population is in Hardy-Weinberg equilibrium, which of the following is the expected proportion of individuals who carry the b allele but are not expected to develop the cancer?\n(A) 1/400 (B) 19/400 (C) 20/400 (D) 38/400\nA:  (D)\n\nQ: The presence of homologous structures in two different organisms, such as the humerus in the front limb of a human and a bird, indicates that\n(A) the human and bird are polyphyletic species (B) a human's and bird's evolution is convergent (C) the human and bird belong to a clade (D) the human and bird developed by analogy\nA:  (C)\n\nQ: According to the pressure-flow model of movement of phloem contents, photosynthate movement from source to sink is driven by\n(A) an ATP-dependent pressure-flow pump (B) a water-pressure potential gradient (C) transpiration (D) apoplastic diffusion\nA:  (B)\n\nQ: Which of the following contain DNA sequences required for the segregation of chromosomes in mitosis and meiosis?\n(A) Telomeres (B) Centromeres (C) Nucleosomes (D) Spliceosomes\nA:  (B)\n\nQ: Antibiotics that affect bacterial cells interfere with all of the following EXCEPT\n(A) peptidoglycan synthesis (B) protein synthesis (C) DNA synthesis (D) reverse transcriptase\nA: ",
        {
          "until": [
            "</s>"
          ]
        }
      ]
    ],
    "resps": [
      [
        "(C)"
      ]
    ],
    "filtered_resps": [
      "(C)"
    ],
    "exact_match": 0.0
  },
  {
    "doc_id": 105,
    "doc": {
      "question": "All of the following environmental conditions increase the rate of transpiration from plants EXCEPT",
      "subject": "college_biology",
      "choices": [
        "high temperature",
        "high relative humidity",
        "low relative humidity",
        "wind"
      ],
      "answer": 1
    },
    "target": "(B)",
    "arguments": [
      [
        "The following are multiple choice questions (with answers) about college biology.\n\nQ: Which of the following represents an accurate statement concerning arthropods?\n(A) They possess an exoskeleton composed primarily of peptidoglycan. (B) They possess an open circulatory system with a dorsal heart. (C) They are members of a biologically unsuccessful phylum incapable of exploiting diverse habitats and nutrition sources. (D) They lack paired, jointed appendages.\nA:  (B)\n\nQ: According to the pressure-flow model of movement of phloem contents, photosynthate movement from source to sink is driven by\n(A) an ATP-dependent pressure-flow pump (B) a water-pressure potential gradient (C) transpiration (D) apoplastic diffusion\nA:  (B)\n\nQ: In a given population, 1 out of every 400 people has a cancer caused by a completely recessive allele, b. Assuming the population is in Hardy-Weinberg equilibrium, which of the following is the expected proportion of individuals who carry the b allele but are not expected to develop the cancer?\n(A) 1/400 (B) 19/400 (C) 20/400 (D) 38/400\nA:  (D)\n\nQ: Which of the following contain DNA sequences required for the segregation of chromosomes in mitosis and meiosis?\n(A) Telomeres (B) Centromeres (C) Nucleosomes (D) Spliceosomes\nA:  (B)\n\nQ: The presence of homologous structures in two different organisms, such as the humerus in the front limb of a human and a bird, indicates that\n(A) the human and bird are polyphyletic species (B) a human's and bird's evolution is convergent (C) the human and bird belong to a clade (D) the human and bird developed by analogy\nA:  (C)\n\nQ: All of the following environmental conditions increase the rate of transpiration from plants EXCEPT\n(A) high temperature (B) high relative humidity (C) low relative humidity (D) wind\nA: ",
        {
          "until": [
            "</s>"
          ]
        }
      ]
    ],
    "resps": [
      [
        "(C)"
      ]
    ],
    "filtered_resps": [
      "(C)"
    ],
    "exact_match": 0.0
  },
  {
    "doc_id": 113,
    "doc": {
      "question": "In the presence of alcohol dehydrogenase, the rate of reduction of acetaldehyde to ethanol increases as the concentration of acetaldehyde is increased. Eventually, the rate of the reaction reaches a maximum, after which point further increases in the concentration of acetaldehyde have no effect. Which of the following is true at the maximal rate of reaction?",
      "subject": "college_biology",
      "choices": [
        "Nearly all of the enzyme molecules are interacting with acetaldehyde molecules.",
        "The activation energy of the reaction decreases.",
        "The change in free energy of the reaction decreases.",
        "The enzyme is no longer specific for acetaldehyde."
      ],
      "answer": 0
    },
    "target": "(A)",
    "arguments": [
      [
        "The following are multiple choice questions (with answers) about college biology.\n\nQ: The presence of homologous structures in two different organisms, such as the humerus in the front limb of a human and a bird, indicates that\n(A) the human and bird are polyphyletic species (B) a human's and bird's evolution is convergent (C) the human and bird belong to a clade (D) the human and bird developed by analogy\nA:  (C)\n\nQ: In a given population, 1 out of every 400 people has a cancer caused by a completely recessive allele, b. Assuming the population is in Hardy-Weinberg equilibrium, which of the following is the expected proportion of individuals who carry the b allele but are not expected to develop the cancer?\n(A) 1/400 (B) 19/400 (C) 20/400 (D) 38/400\nA:  (D)\n\nQ: According to the pressure-flow model of movement of phloem contents, photosynthate movement from source to sink is driven by\n(A) an ATP-dependent pressure-flow pump (B) a water-pressure potential gradient (C) transpiration (D) apoplastic diffusion\nA:  (B)\n\nQ: Which of the following represents an accurate statement concerning arthropods?\n(A) They possess an exoskeleton composed primarily of peptidoglycan. (B) They possess an open circulatory system with a dorsal heart. (C) They are members of a biologically unsuccessful phylum incapable of exploiting diverse habitats and nutrition sources. (D) They lack paired, jointed appendages.\nA:  (B)\n\nQ: Which of the following contain DNA sequences required for the segregation of chromosomes in mitosis and meiosis?\n(A) Telomeres (B) Centromeres (C) Nucleosomes (D) Spliceosomes\nA:  (B)\n\nQ: In the presence of alcohol dehydrogenase, the rate of reduction of acetaldehyde to ethanol increases as the concentration of acetaldehyde is increased. Eventually, the rate of the reaction reaches a maximum, after which point further increases in the concentration of acetaldehyde have no effect. Which of the following is true at the maximal rate of reaction?\n(A) Nearly all of the enzyme molecules are interacting with acetaldehyde molecules. (B) The activation energy of the reaction decreases. (C) The change in free energy of the reaction decreases. (D) The enzyme is no longer specific for acetaldehyde.\nA: ",
        {
          "until": [
            "</s>"
          ]
        }
      ]
    ],
    "resps": [
      [
        "(D)"
      ]
    ],
    "filtered_resps": [
      "(D)"
    ],
    "exact_match": 0.0
  },
  {
    "doc_id": 121,
    "doc": {
      "question": "Which of the following would be the most dependable environmental signal that a plant in a temperate ecosystem could use to initiate flowering at the correct time of the year?",
      "subject": "college_biology",
      "choices": [
        "Circadian rhythm",
        "Photoperiod",
        "Changing air temperature",
        "Fluctuations in abscisic acid levels"
      ],
      "answer": 1
    },
    "target": "(B)",
    "arguments": [
      [
        "The following are multiple choice questions (with answers) about college biology.\n\nQ: Which of the following represents an accurate statement concerning arthropods?\n(A) They possess an exoskeleton composed primarily of peptidoglycan. (B) They possess an open circulatory system with a dorsal heart. (C) They are members of a biologically unsuccessful phylum incapable of exploiting diverse habitats and nutrition sources. (D) They lack paired, jointed appendages.\nA:  (B)\n\nQ: According to the pressure-flow model of movement of phloem contents, photosynthate movement from source to sink is driven by\n(A) an ATP-dependent pressure-flow pump (B) a water-pressure potential gradient (C) transpiration (D) apoplastic diffusion\nA:  (B)\n\nQ: In a given population, 1 out of every 400 people has a cancer caused by a completely recessive allele, b. Assuming the population is in Hardy-Weinberg equilibrium, which of the following is the expected proportion of individuals who carry the b allele but are not expected to develop the cancer?\n(A) 1/400 (B) 19/400 (C) 20/400 (D) 38/400\nA:  (D)\n\nQ: The presence of homologous structures in two different organisms, such as the humerus in the front limb of a human and a bird, indicates that\n(A) the human and bird are polyphyletic species (B) a human's and bird's evolution is convergent (C) the human and bird belong to a clade (D) the human and bird developed by analogy\nA:  (C)\n\nQ: Which of the following contain DNA sequences required for the segregation of chromosomes in mitosis and meiosis?\n(A) Telomeres (B) Centromeres (C) Nucleosomes (D) Spliceosomes\nA:  (B)\n\nQ: Which of the following would be the most dependable environmental signal that a plant in a temperate ecosystem could use to initiate flowering at the correct time of the year?\n(A) Circadian rhythm (B) Photoperiod (C) Changing air temperature (D) Fluctuations in abscisic acid levels\nA: ",
        {
          "until": [
            "</s>"
          ]
        }
      ]
    ],
    "resps": [
      [
        "(C)"
      ]
    ],
    "filtered_resps": [
      "(C)"
    ],
    "exact_match": 0.0
  },
  {
    "doc_id": 129,
    "doc": {
      "question": "Cellular uptake of cholesterol occurs through internalization of low density lipoproteincholesterol complexes. Cholesterol uptake involves all of the following EXCEPT",
      "subject": "college_biology",
      "choices": [
        "cell-surface receptors",
        "adhesion plaques",
        "endosome formation",
        "receptor-mediated endocytosis"
      ],
      "answer": 1
    },
    "target": "(B)",
    "arguments": [
      [
        "The following are multiple choice questions (with answers) about college biology.\n\nQ: Which of the following contain DNA sequences required for the segregation of chromosomes in mitosis and meiosis?\n(A) Telomeres (B) Centromeres (C) Nucleosomes (D) Spliceosomes\nA:  (B)\n\nQ: According to the pressure-flow model of movement of phloem contents, photosynthate movement from source to sink is driven by\n(A) an ATP-dependent pressure-flow pump (B) a water-pressure potential gradient (C) transpiration (D) apoplastic diffusion\nA:  (B)\n\nQ: In a given population, 1 out of every 400 people has a cancer caused by a completely recessive allele, b. Assuming the population is in Hardy-Weinberg equilibrium, which of the following is the expected proportion of individuals who carry the b allele but are not expected to develop the cancer?\n(A) 1/400 (B) 19/400 (C) 20/400 (D) 38/400\nA:  (D)\n\nQ: Which of the following represents an accurate statement concerning arthropods?\n(A) They possess an exoskeleton composed primarily of peptidoglycan. (B) They possess an open circulatory system with a dorsal heart. (C) They are members of a biologically unsuccessful phylum incapable of exploiting diverse habitats and nutrition sources. (D) They lack paired, jointed appendages.\nA:  (B)\n\nQ: The presence of homologous structures in two different organisms, such as the humerus in the front limb of a human and a bird, indicates that\n(A) the human and bird are polyphyletic species (B) a human's and bird's evolution is convergent (C) the human and bird belong to a clade (D) the human and bird developed by analogy\nA:  (C)\n\nQ: Cellular uptake of cholesterol occurs through internalization of low density lipoproteincholesterol complexes. Cholesterol uptake involves all of the following EXCEPT\n(A) cell-surface receptors (B) adhesion plaques (C) endosome formation (D) receptor-mediated endocytosis\nA: ",
        {
          "until": [
            "</s>"
          ]
        }
      ]
    ],
    "resps": [
      [
        "(D)"
      ]
    ],
    "filtered_resps": [
      "(D)"
    ],
    "exact_match": 0.0
  },
  {
    "doc_id": 137,
    "doc": {
      "question": "Which of the following active pools of carbon is the largest on Earth and contributes the most to carbon cycling?",
      "subject": "college_biology",
      "choices": [
        "The atmosphere",
        "Rain-forest vegetation",
        "Recoverable fossil fuels",
        "The oceans"
      ],
      "answer": 3
    },
    "target": "(D)",
    "arguments": [
      [
        "The following are multiple choice questions (with answers) about college biology.\n\nQ: Which of the following contain DNA sequences required for the segregation of chromosomes in mitosis and meiosis?\n(A) Telomeres (B) Centromeres (C) Nucleosomes (D) Spliceosomes\nA:  (B)\n\nQ: In a given population, 1 out of every 400 people has a cancer caused by a completely recessive allele, b. Assuming the population is in Hardy-Weinberg equilibrium, which of the following is the expected proportion of individuals who carry the b allele but are not expected to develop the cancer?\n(A) 1/400 (B) 19/400 (C) 20/400 (D) 38/400\nA:  (D)\n\nQ: According to the pressure-flow model of movement of phloem contents, photosynthate movement from source to sink is driven by\n(A) an ATP-dependent pressure-flow pump (B) a water-pressure potential gradient (C) transpiration (D) apoplastic diffusion\nA:  (B)\n\nQ: The presence of homologous structures in two different organisms, such as the humerus in the front limb of a human and a bird, indicates that\n(A) the human and bird are polyphyletic species (B) a human's and bird's evolution is convergent (C) the human and bird belong to a clade (D) the human and bird developed by analogy\nA:  (C)\n\nQ: Which of the following represents an accurate statement concerning arthropods?\n(A) They possess an exoskeleton composed primarily of peptidoglycan. (B) They possess an open circulatory system with a dorsal heart. (C) They are members of a biologically unsuccessful phylum incapable of exploiting diverse habitats and nutrition sources. (D) They lack paired, jointed appendages.\nA:  (B)\n\nQ: Which of the following active pools of carbon is the largest on Earth and contributes the most to carbon cycling?\n(A) The atmosphere (B) Rain-forest vegetation (C) Recoverable fossil fuels (D) The oceans\nA: ",
        {
          "until": [
            "</s>"
          ]
        }
      ]
    ],
    "resps": [
      [
        "(D)"
      ]
    ],
    "filtered_resps": [
      "(D)"
    ],
    "exact_match": 1.0
  },
  {
    "doc_id": 2,
    "doc": {
      "question": "To prevent desiccation and injury, the embryos of terrestrial vertebrates are encased within a fluid secreted by the",
      "subject": "college_biology",
      "choices": [
        "amnion",
        "chorion",
        "allantois",
        "yolk sac"
      ],
      "answer": 0
    },
    "target": "(A)",
    "arguments": [
      [
        "The following are multiple choice questions (with answers) about college biology.\n\nQ: According to the pressure-flow model of movement of phloem contents, photosynthate movement from source to sink is driven by\n(A) an ATP-dependent pressure-flow pump (B) a water-pressure potential gradient (C) transpiration (D) apoplastic diffusion\nA:  (B)\n\nQ: Which of the following represents an accurate statement concerning arthropods?\n(A) They possess an exoskeleton composed primarily of peptidoglycan. (B) They possess an open circulatory system with a dorsal heart. (C) They are members of a biologically unsuccessful phylum incapable of exploiting diverse habitats and nutrition sources. (D) They lack paired, jointed appendages.\nA:  (B)\n\nQ: Which of the following contain DNA sequences required for the segregation of chromosomes in mitosis and meiosis?\n(A) Telomeres (B) Centromeres (C) Nucleosomes (D) Spliceosomes\nA:  (B)\n\nQ: The presence of homologous structures in two different organisms, such as the humerus in the front limb of a human and a bird, indicates that\n(A) the human and bird are polyphyletic species (B) a human's and bird's evolution is convergent (C) the human and bird belong to a clade (D) the human and bird developed by analogy\nA:  (C)\n\nQ: In a given population, 1 out of every 400 people has a cancer caused by a completely recessive allele, b. Assuming the population is in Hardy-Weinberg equilibrium, which of the following is the expected proportion of individuals who carry the b allele but are not expected to develop the cancer?\n(A) 1/400 (B) 19/400 (C) 20/400 (D) 38/400\nA:  (D)\n\nQ: To prevent desiccation and injury, the embryos of terrestrial vertebrates are encased within a fluid secreted by the\n(A) amnion (B) chorion (C) allantois (D) yolk sac\nA: ",
        {
          "until": [
            "</s>"
          ]
        }
      ]
    ],
    "resps": [
      [
        "(D)"
      ]
    ],
    "filtered_resps": [
      "(D)"
    ],
    "exact_match": 0.0
  },
  {
    "doc_id": 10,
    "doc": {
      "question": "Cleavage symmetry arising from early cell divisions that occur at an oblique angle to the polar axis is known as",
      "subject": "college_biology",
      "choices": [
        "meroblastic cleavage",
        "radial cleavage",
        "spiral cleavage",
        "superficial cleavage"
      ],
      "answer": 2
    },
    "target": "(C)",
    "arguments": [
      [
        "The following are multiple choice questions (with answers) about college biology.\n\nQ: Which of the following represents an accurate statement concerning arthropods?\n(A) They possess an exoskeleton composed primarily of peptidoglycan. (B) They possess an open circulatory system with a dorsal heart. (C) They are members of a biologically unsuccessful phylum incapable of exploiting diverse habitats and nutrition sources. (D) They lack paired, jointed appendages.\nA:  (B)\n\nQ: Which of the following contain DNA sequences required for the segregation of chromosomes in mitosis and meiosis?\n(A) Telomeres (B) Centromeres (C) Nucleosomes (D) Spliceosomes\nA:  (B)\n\nQ: In a given population, 1 out of every 400 people has a cancer caused by a completely recessive allele, b. Assuming the population is in Hardy-Weinberg equilibrium, which of the following is the expected proportion of individuals who carry the b allele but are not expected to develop the cancer?\n(A) 1/400 (B) 19/400 (C) 20/400 (D) 38/400\nA:  (D)\n\nQ: According to the pressure-flow model of movement of phloem contents, photosynthate movement from source to sink is driven by\n(A) an ATP-dependent pressure-flow pump (B) a water-pressure potential gradient (C) transpiration (D) apoplastic diffusion\nA:  (B)\n\nQ: The presence of homologous structures in two different organisms, such as the humerus in the front limb of a human and a bird, indicates that\n(A) the human and bird are polyphyletic species (B) a human's and bird's evolution is convergent (C) the human and bird belong to a clade (D) the human and bird developed by analogy\nA:  (C)\n\nQ: Cleavage symmetry arising from early cell divisions that occur at an oblique angle to the polar axis is known as\n(A) meroblastic cleavage (B) radial cleavage (C) spiral cleavage (D) superficial cleavage\nA: ",
        {
          "until": [
            "</s>"
          ]
        }
      ]
    ],
    "resps": [
      [
        "(D)"
      ]
    ],
    "filtered_resps": [
      "(D)"
    ],
    "exact_match": 0.0
  },
  {
    "doc_id": 18,
    "doc": {
      "question": "Which of the following most accurately describes a retrotransposon?",
      "subject": "college_biology",
      "choices": [
        "A DNA sequence that can move from one site in the genome to another without replicating",
        "A DNA sequence that can be deleted from the genome without consequence",
        "A DNA sequence that replicates via an RNA intermediate",
        "A DNA sequence that replicates via a protein intermediate"
      ],
      "answer": 2
    },
    "target": "(C)",
    "arguments": [
      [
        "The following are multiple choice questions (with answers) about college biology.\n\nQ: Which of the following represents an accurate statement concerning arthropods?\n(A) They possess an exoskeleton composed primarily of peptidoglycan. (B) They possess an open circulatory system with a dorsal heart. (C) They are members of a biologically unsuccessful phylum incapable of exploiting diverse habitats and nutrition sources. (D) They lack paired, jointed appendages.\nA:  (B)\n\nQ: Which of the following contain DNA sequences required for the segregation of chromosomes in mitosis and meiosis?\n(A) Telomeres (B) Centromeres (C) Nucleosomes (D) Spliceosomes\nA:  (B)\n\nQ: In a given population, 1 out of every 400 people has a cancer caused by a completely recessive allele, b. Assuming the population is in Hardy-Weinberg equilibrium, which of the following is the expected proportion of individuals who carry the b allele but are not expected to develop the cancer?\n(A) 1/400 (B) 19/400 (C) 20/400 (D) 38/400\nA:  (D)\n\nQ: The presence of homologous structures in two different organisms, such as the humerus in the front limb of a human and a bird, indicates that\n(A) the human and bird are polyphyletic species (B) a human's and bird's evolution is convergent (C) the human and bird belong to a clade (D) the human and bird developed by analogy\nA:  (C)\n\nQ: According to the pressure-flow model of movement of phloem contents, photosynthate movement from source to sink is driven by\n(A) an ATP-dependent pressure-flow pump (B) a water-pressure potential gradient (C) transpiration (D) apoplastic diffusion\nA:  (B)\n\nQ: Which of the following most accurately describes a retrotransposon?\n(A) A DNA sequence that can move from one site in the genome to another without replicating (B) A DNA sequence that can be deleted from the genome without consequence (C) A DNA sequence that replicates via an RNA intermediate (D) A DNA sequence that replicates via a protein intermediate\nA: ",
        {
          "until": [
            "</s>"
          ]
        }
      ]
    ],
    "resps": [
      [
        "(A)"
      ]
    ],
    "filtered_resps": [
      "(A)"
    ],
    "exact_match": 0.0
  },
  {
    "doc_id": 26,
    "doc": {
      "question": "Brood parasites such as the cuckoo successfully trick other species of birds into rearing their young by exploiting the host birds' instinctive response to the loud begging cues of a fledgling in their nest. The genes that allow the host bird species to be duped into rearing the cuckoo fledglings to the detriment of their own offspring most likely remain in the gene pool of the population because",
      "subject": "college_biology",
      "choices": [
        "on average, the host birds' response allows them to rear their own young efficiently by feeding only those who indicate they are hungry",
        "the maximum fitness of the duped bird is not compromised when the bird rears an interloper of another species",
        "on average, little energy is spent on rearing a fledgling bird, whether it is an interloper or one's own",
        "the maximum fitness of the cuckoo would then be reduced"
      ],
      "answer": 0
    },
    "target": "(A)",
    "arguments": [
      [
        "The following are multiple choice questions (with answers) about college biology.\n\nQ: In a given population, 1 out of every 400 people has a cancer caused by a completely recessive allele, b. Assuming the population is in Hardy-Weinberg equilibrium, which of the following is the expected proportion of individuals who carry the b allele but are not expected to develop the cancer?\n(A) 1/400 (B) 19/400 (C) 20/400 (D) 38/400\nA:  (D)\n\nQ: Which of the following represents an accurate statement concerning arthropods?\n(A) They possess an exoskeleton composed primarily of peptidoglycan. (B) They possess an open circulatory system with a dorsal heart. (C) They are members of a biologically unsuccessful phylum incapable of exploiting diverse habitats and nutrition sources. (D) They lack paired, jointed appendages.\nA:  (B)\n\nQ: According to the pressure-flow model of movement of phloem contents, photosynthate movement from source to sink is driven by\n(A) an ATP-dependent pressure-flow pump (B) a water-pressure potential gradient (C) transpiration (D) apoplastic diffusion\nA:  (B)\n\nQ: The presence of homologous structures in two different organisms, such as the humerus in the front limb of a human and a bird, indicates that\n(A) the human and bird are polyphyletic species (B) a human's and bird's evolution is convergent (C) the human and bird belong to a clade (D) the human and bird developed by analogy\nA:  (C)\n\nQ: Which of the following contain DNA sequences required for the segregation of chromosomes in mitosis and meiosis?\n(A) Telomeres (B) Centromeres (C) Nucleosomes (D) Spliceosomes\nA:  (B)\n\nQ: Brood parasites such as the cuckoo successfully trick other species of birds into rearing their young by exploiting the host birds' instinctive response to the loud begging cues of a fledgling in their nest. The genes that allow the host bird species to be duped into rearing the cuckoo fledglings to the detriment of their own offspring most likely remain in the gene pool of the population because\n(A) on average, the host birds' response allows them to rear their own young efficiently by feeding only those who indicate they are hungry (B) the maximum fitness of the duped bird is not compromised when the bird rears an interloper of another species (C) on average, little energy is spent on rearing a fledgling bird, whether it is an interloper or one's own (D) the maximum fitness of the cuckoo would then be reduced\nA: ",
        {
          "until": [
            "</s>"
          ]
        }
      ]
    ],
    "resps": [
      [
        "(B)"
      ]
    ],
    "filtered_resps": [
      "(B)"
    ],
    "exact_match": 0.0
  },
  {
    "doc_id": 34,
    "doc": {
      "question": "A DNA strand with the sequence 5\u2032 CGA TTG 3\u2032 would be complementary to the sequence",
      "subject": "college_biology",
      "choices": [
        "5\u2032 GCU AAC 3\u2032",
        "5\u2032 GCT AAC 3\u2032",
        "5\u2032 GTT AGC 3\u2032",
        "5\u2032 CAA TCG 3\u2032"
      ],
      "answer": 3
    },
    "target": "(D)",
    "arguments": [
      [
        "The following are multiple choice questions (with answers) about college biology.\n\nQ: Which of the following contain DNA sequences required for the segregation of chromosomes in mitosis and meiosis?\n(A) Telomeres (B) Centromeres (C) Nucleosomes (D) Spliceosomes\nA:  (B)\n\nQ: According to the pressure-flow model of movement of phloem contents, photosynthate movement from source to sink is driven by\n(A) an ATP-dependent pressure-flow pump (B) a water-pressure potential gradient (C) transpiration (D) apoplastic diffusion\nA:  (B)\n\nQ: Which of the following represents an accurate statement concerning arthropods?\n(A) They possess an exoskeleton composed primarily of peptidoglycan. (B) They possess an open circulatory system with a dorsal heart. (C) They are members of a biologically unsuccessful phylum incapable of exploiting diverse habitats and nutrition sources. (D) They lack paired, jointed appendages.\nA:  (B)\n\nQ: The presence of homologous structures in two different organisms, such as the humerus in the front limb of a human and a bird, indicates that\n(A) the human and bird are polyphyletic species (B) a human's and bird's evolution is convergent (C) the human and bird belong to a clade (D) the human and bird developed by analogy\nA:  (C)\n\nQ: In a given population, 1 out of every 400 people has a cancer caused by a completely recessive allele, b. Assuming the population is in Hardy-Weinberg equilibrium, which of the following is the expected proportion of individuals who carry the b allele but are not expected to develop the cancer?\n(A) 1/400 (B) 19/400 (C) 20/400 (D) 38/400\nA:  (D)\n\nQ: A DNA strand with the sequence 5\u2032 CGA TTG 3\u2032 would be complementary to the sequence\n(A) 5\u2032 GCU AAC 3\u2032 (B) 5\u2032 GCT AAC 3\u2032 (C) 5\u2032 GTT AGC 3\u2032 (D) 5\u2032 CAA TCG 3\u2032\nA: ",
        {
          "until": [
            "</s>"
          ]
        }
      ]
    ],
    "resps": [
      [
        "(D)"
      ]
    ],
    "filtered_resps": [
      "(D)"
    ],
    "exact_match": 1.0
  },
  {
    "doc_id": 42,
    "doc": {
      "question": "Which of the following would increase the rate at which a gas diffuses between the alveoli of the lung and the blood within a pulmonary capillary?",
      "subject": "college_biology",
      "choices": [
        "Decreasing the partial pressure gradient of the gas",
        "Decreasing the solubility of the gas in water",
        "Increasing the total surface area available for diffusion",
        "Decreasing the rate of blood flow through the pulmonary capillary"
      ],
      "answer": 2
    },
    "target": "(C)",
    "arguments": [
      [
        "The following are multiple choice questions (with answers) about college biology.\n\nQ: Which of the following represents an accurate statement concerning arthropods?\n(A) They possess an exoskeleton composed primarily of peptidoglycan. (B) They possess an open circulatory system with a dorsal heart. (C) They are members of a biologically unsuccessful phylum incapable of exploiting diverse habitats and nutrition sources. (D) They lack paired, jointed appendages.\nA:  (B)\n\nQ: Which of the following contain DNA sequences required for the segregation of chromosomes in mitosis and meiosis?\n(A) Telomeres (B) Centromeres (C) Nucleosomes (D) Spliceosomes\nA:  (B)\n\nQ: The presence of homologous structures in two different organisms, such as the humerus in the front limb of a human and a bird, indicates that\n(A) the human and bird are polyphyletic species (B) a human's and bird's evolution is convergent (C) the human and bird belong to a clade (D) the human and bird developed by analogy\nA:  (C)\n\nQ: According to the pressure-flow model of movement of phloem contents, photosynthate movement from source to sink is driven by\n(A) an ATP-dependent pressure-flow pump (B) a water-pressure potential gradient (C) transpiration (D) apoplastic diffusion\nA:  (B)\n\nQ: In a given population, 1 out of every 400 people has a cancer caused by a completely recessive allele, b. Assuming the population is in Hardy-Weinberg equilibrium, which of the following is the expected proportion of individuals who carry the b allele but are not expected to develop the cancer?\n(A) 1/400 (B) 19/400 (C) 20/400 (D) 38/400\nA:  (D)\n\nQ: Which of the following would increase the rate at which a gas diffuses between the alveoli of the lung and the blood within a pulmonary capillary?\n(A) Decreasing the partial pressure gradient of the gas (B) Decreasing the solubility of the gas in water (C) Increasing the total surface area available for diffusion (D) Decreasing the rate of blood flow through the pulmonary capillary\nA: ",
        {
          "until": [
            "</s>"
          ]
        }
      ]
    ],
    "resps": [
      [
        "(D)"
      ]
    ],
    "filtered_resps": [
      "(D)"
    ],
    "exact_match": 0.0
  },
  {
    "doc_id": 50,
    "doc": {
      "question": "Chemosynthetic bacteria can produce their own food despite their lack of photonabsorbing pigments because the chemosynthetic bacteria derive energy by",
      "subject": "college_biology",
      "choices": [
        "oxidizing inorganic substances such as ammonia, sulfur, or hydrogen",
        "reducing inorganic substances such as ammonia, sulfur, or hydrogen",
        "oxidizing organic compounds",
        "transducing light energy into chemical energy"
      ],
      "answer": 0
    },
    "target": "(A)",
    "arguments": [
      [
        "The following are multiple choice questions (with answers) about college biology.\n\nQ: Which of the following contain DNA sequences required for the segregation of chromosomes in mitosis and meiosis?\n(A) Telomeres (B) Centromeres (C) Nucleosomes (D) Spliceosomes\nA:  (B)\n\nQ: Which of the following represents an accurate statement concerning arthropods?\n(A) They possess an exoskeleton composed primarily of peptidoglycan. (B) They possess an open circulatory system with a dorsal heart. (C) They are members of a biologically unsuccessful phylum incapable of exploiting diverse habitats and nutrition sources. (D) They lack paired, jointed appendages.\nA:  (B)\n\nQ: The presence of homologous structures in two different organisms, such as the humerus in the front limb of a human and a bird, indicates that\n(A) the human and bird are polyphyletic species (B) a human's and bird's evolution is convergent (C) the human and bird belong to a clade (D) the human and bird developed by analogy\nA:  (C)\n\nQ: In a given population, 1 out of every 400 people has a cancer caused by a completely recessive allele, b. Assuming the population is in Hardy-Weinberg equilibrium, which of the following is the expected proportion of individuals who carry the b allele but are not expected to develop the cancer?\n(A) 1/400 (B) 19/400 (C) 20/400 (D) 38/400\nA:  (D)\n\nQ: According to the pressure-flow model of movement of phloem contents, photosynthate movement from source to sink is driven by\n(A) an ATP-dependent pressure-flow pump (B) a water-pressure potential gradient (C) transpiration (D) apoplastic diffusion\nA:  (B)\n\nQ: Chemosynthetic bacteria can produce their own food despite their lack of photonabsorbing pigments because the chemosynthetic bacteria derive energy by\n(A) oxidizing inorganic substances such as ammonia, sulfur, or hydrogen (B) reducing inorganic substances such as ammonia, sulfur, or hydrogen (C) oxidizing organic compounds (D) transducing light energy into chemical energy\nA: ",
        {
          "until": [
            "</s>"
          ]
        }
      ]
    ],
    "resps": [
      [
        "(D)"
      ]
    ],
    "filtered_resps": [
      "(D)"
    ],
    "exact_match": 0.0
  },
  {
    "doc_id": 58,
    "doc": {
      "question": "The first groups of animals to develop lung tissue adequate to support their respiratory requirements without the use of supplementary gas exchange organs were the",
      "subject": "college_biology",
      "choices": [
        "amphibians",
        "reptiles",
        "mammals",
        "trematoda"
      ],
      "answer": 1
    },
    "target": "(B)",
    "arguments": [
      [
        "The following are multiple choice questions (with answers) about college biology.\n\nQ: The presence of homologous structures in two different organisms, such as the humerus in the front limb of a human and a bird, indicates that\n(A) the human and bird are polyphyletic species (B) a human's and bird's evolution is convergent (C) the human and bird belong to a clade (D) the human and bird developed by analogy\nA:  (C)\n\nQ: Which of the following contain DNA sequences required for the segregation of chromosomes in mitosis and meiosis?\n(A) Telomeres (B) Centromeres (C) Nucleosomes (D) Spliceosomes\nA:  (B)\n\nQ: Which of the following represents an accurate statement concerning arthropods?\n(A) They possess an exoskeleton composed primarily of peptidoglycan. (B) They possess an open circulatory system with a dorsal heart. (C) They are members of a biologically unsuccessful phylum incapable of exploiting diverse habitats and nutrition sources. (D) They lack paired, jointed appendages.\nA:  (B)\n\nQ: According to the pressure-flow model of movement of phloem contents, photosynthate movement from source to sink is driven by\n(A) an ATP-dependent pressure-flow pump (B) a water-pressure potential gradient (C) transpiration (D) apoplastic diffusion\nA:  (B)\n\nQ: In a given population, 1 out of every 400 people has a cancer caused by a completely recessive allele, b. Assuming the population is in Hardy-Weinberg equilibrium, which of the following is the expected proportion of individuals who carry the b allele but are not expected to develop the cancer?\n(A) 1/400 (B) 19/400 (C) 20/400 (D) 38/400\nA:  (D)\n\nQ: The first groups of animals to develop lung tissue adequate to support their respiratory requirements without the use of supplementary gas exchange organs were the\n(A) amphibians (B) reptiles (C) mammals (D) trematoda\nA: ",
        {
          "until": [
            "</s>"
          ]
        }
      ]
    ],
    "resps": [
      [
        "(C)"
      ]
    ],
    "filtered_resps": [
      "(C)"
    ],
    "exact_match": 0.0
  },
  {
    "doc_id": 66,
    "doc": {
      "question": "The first point of entry of water at the roots of a monocot plant is through the cytoplasm of cells of the",
      "subject": "college_biology",
      "choices": [
        "root cap",
        "Casparian strip",
        "pericycle",
        "endoderm"
      ],
      "answer": 3
    },
    "target": "(D)",
    "arguments": [
      [
        "The following are multiple choice questions (with answers) about college biology.\n\nQ: Which of the following contain DNA sequences required for the segregation of chromosomes in mitosis and meiosis?\n(A) Telomeres (B) Centromeres (C) Nucleosomes (D) Spliceosomes\nA:  (B)\n\nQ: Which of the following represents an accurate statement concerning arthropods?\n(A) They possess an exoskeleton composed primarily of peptidoglycan. (B) They possess an open circulatory system with a dorsal heart. (C) They are members of a biologically unsuccessful phylum incapable of exploiting diverse habitats and nutrition sources. (D) They lack paired, jointed appendages.\nA:  (B)\n\nQ: The presence of homologous structures in two different organisms, such as the humerus in the front limb of a human and a bird, indicates that\n(A) the human and bird are polyphyletic species (B) a human's and bird's evolution is convergent (C) the human and bird belong to a clade (D) the human and bird developed by analogy\nA:  (C)\n\nQ: According to the pressure-flow model of movement of phloem contents, photosynthate movement from source to sink is driven by\n(A) an ATP-dependent pressure-flow pump (B) a water-pressure potential gradient (C) transpiration (D) apoplastic diffusion\nA:  (B)\n\nQ: In a given population, 1 out of every 400 people has a cancer caused by a completely recessive allele, b. Assuming the population is in Hardy-Weinberg equilibrium, which of the following is the expected proportion of individuals who carry the b allele but are not expected to develop the cancer?\n(A) 1/400 (B) 19/400 (C) 20/400 (D) 38/400\nA:  (D)\n\nQ: The first point of entry of water at the roots of a monocot plant is through the cytoplasm of cells of the\n(A) root cap (B) Casparian strip (C) pericycle (D) endoderm\nA: ",
        {
          "until": [
            "</s>"
          ]
        }
      ]
    ],
    "resps": [
      [
        "(D)"
      ]
    ],
    "filtered_resps": [
      "(D)"
    ],
    "exact_match": 1.0
  },
  {
    "doc_id": 74,
    "doc": {
      "question": "Which of the following statements is true of air as compared to water?",
      "subject": "college_biology",
      "choices": [
        "Air provides more physical support.",
        "Air has a higher O2 concentration.",
        "Air offers more resistance to motion.",
        "Air has more thermal inertia."
      ],
      "answer": 1
    },
    "target": "(B)",
    "arguments": [
      [
        "The following are multiple choice questions (with answers) about college biology.\n\nQ: The presence of homologous structures in two different organisms, such as the humerus in the front limb of a human and a bird, indicates that\n(A) the human and bird are polyphyletic species (B) a human's and bird's evolution is convergent (C) the human and bird belong to a clade (D) the human and bird developed by analogy\nA:  (C)\n\nQ: In a given population, 1 out of every 400 people has a cancer caused by a completely recessive allele, b. Assuming the population is in Hardy-Weinberg equilibrium, which of the following is the expected proportion of individuals who carry the b allele but are not expected to develop the cancer?\n(A) 1/400 (B) 19/400 (C) 20/400 (D) 38/400\nA:  (D)\n\nQ: Which of the following contain DNA sequences required for the segregation of chromosomes in mitosis and meiosis?\n(A) Telomeres (B) Centromeres (C) Nucleosomes (D) Spliceosomes\nA:  (B)\n\nQ: According to the pressure-flow model of movement of phloem contents, photosynthate movement from source to sink is driven by\n(A) an ATP-dependent pressure-flow pump (B) a water-pressure potential gradient (C) transpiration (D) apoplastic diffusion\nA:  (B)\n\nQ: Which of the following represents an accurate statement concerning arthropods?\n(A) They possess an exoskeleton composed primarily of peptidoglycan. (B) They possess an open circulatory system with a dorsal heart. (C) They are members of a biologically unsuccessful phylum incapable of exploiting diverse habitats and nutrition sources. (D) They lack paired, jointed appendages.\nA:  (B)\n\nQ: Which of the following statements is true of air as compared to water?\n(A) Air provides more physical support. (B) Air has a higher O2 concentration. (C) Air offers more resistance to motion. (D) Air has more thermal inertia.\nA: ",
        {
          "until": [
            "</s>"
          ]
        }
      ]
    ],
    "resps": [
      [
        "(A)"
      ]
    ],
    "filtered_resps": [
      "(A)"
    ],
    "exact_match": 0.0
  },
  {
    "doc_id": 82,
    "doc": {
      "question": "Adequate serum levels of calcium are maintained in humans by the secretion of",
      "subject": "college_biology",
      "choices": [
        "thyroxine",
        "glucagon",
        "growth hormone",
        "parathyroid hormone"
      ],
      "answer": 3
    },
    "target": "(D)",
    "arguments": [
      [
        "The following are multiple choice questions (with answers) about college biology.\n\nQ: In a given population, 1 out of every 400 people has a cancer caused by a completely recessive allele, b. Assuming the population is in Hardy-Weinberg equilibrium, which of the following is the expected proportion of individuals who carry the b allele but are not expected to develop the cancer?\n(A) 1/400 (B) 19/400 (C) 20/400 (D) 38/400\nA:  (D)\n\nQ: Which of the following represents an accurate statement concerning arthropods?\n(A) They possess an exoskeleton composed primarily of peptidoglycan. (B) They possess an open circulatory system with a dorsal heart. (C) They are members of a biologically unsuccessful phylum incapable of exploiting diverse habitats and nutrition sources. (D) They lack paired, jointed appendages.\nA:  (B)\n\nQ: According to the pressure-flow model of movement of phloem contents, photosynthate movement from source to sink is driven by\n(A) an ATP-dependent pressure-flow pump (B) a water-pressure potential gradient (C) transpiration (D) apoplastic diffusion\nA:  (B)\n\nQ: Which of the following contain DNA sequences required for the segregation of chromosomes in mitosis and meiosis?\n(A) Telomeres (B) Centromeres (C) Nucleosomes (D) Spliceosomes\nA:  (B)\n\nQ: The presence of homologous structures in two different organisms, such as the humerus in the front limb of a human and a bird, indicates that\n(A) the human and bird are polyphyletic species (B) a human's and bird's evolution is convergent (C) the human and bird belong to a clade (D) the human and bird developed by analogy\nA:  (C)\n\nQ: Adequate serum levels of calcium are maintained in humans by the secretion of\n(A) thyroxine (B) glucagon (C) growth hormone (D) parathyroid hormone\nA: ",
        {
          "until": [
            "</s>"
          ]
        }
      ]
    ],
    "resps": [
      [
        "(D)"
      ]
    ],
    "filtered_resps": [
      "(D)"
    ],
    "exact_match": 1.0
  },
  {
    "doc_id": 90,
    "doc": {
      "question": "Hybrids between some related species of plants are sterile because the parent plants had different chromosome numbers. Occasionally the chromosome number of such a hybrid plant doubles spontaneously. Which of the following best describes the descendants of those plants with the double chromosome number?",
      "subject": "college_biology",
      "choices": [
        "The plant with the double chromosome number would be genetically defective and have no descendants.",
        "The descendants would be at a selective advantage because of the increased ability to introgress.",
        "The descendants would be reproductively successful because they could backcross with the parental species.",
        "The descendants would regain the ability to reproduce sexually because chromosomes could pair normally."
      ],
      "answer": 3
    },
    "target": "(D)",
    "arguments": [
      [
        "The following are multiple choice questions (with answers) about college biology.\n\nQ: Which of the following represents an accurate statement concerning arthropods?\n(A) They possess an exoskeleton composed primarily of peptidoglycan. (B) They possess an open circulatory system with a dorsal heart. (C) They are members of a biologically unsuccessful phylum incapable of exploiting diverse habitats and nutrition sources. (D) They lack paired, jointed appendages.\nA:  (B)\n\nQ: In a given population, 1 out of every 400 people has a cancer caused by a completely recessive allele, b. Assuming the population is in Hardy-Weinberg equilibrium, which of the following is the expected proportion of individuals who carry the b allele but are not expected to develop the cancer?\n(A) 1/400 (B) 19/400 (C) 20/400 (D) 38/400\nA:  (D)\n\nQ: Which of the following contain DNA sequences required for the segregation of chromosomes in mitosis and meiosis?\n(A) Telomeres (B) Centromeres (C) Nucleosomes (D) Spliceosomes\nA:  (B)\n\nQ: The presence of homologous structures in two different organisms, such as the humerus in the front limb of a human and a bird, indicates that\n(A) the human and bird are polyphyletic species (B) a human's and bird's evolution is convergent (C) the human and bird belong to a clade (D) the human and bird developed by analogy\nA:  (C)\n\nQ: According to the pressure-flow model of movement of phloem contents, photosynthate movement from source to sink is driven by\n(A) an ATP-dependent pressure-flow pump (B) a water-pressure potential gradient (C) transpiration (D) apoplastic diffusion\nA:  (B)\n\nQ: Hybrids between some related species of plants are sterile because the parent plants had different chromosome numbers. Occasionally the chromosome number of such a hybrid plant doubles spontaneously. Which of the following best describes the descendants of those plants with the double chromosome number?\n(A) The plant with the double chromosome number would be genetically defective and have no descendants. (B) The descendants would be at a selective advantage because of the increased ability to introgress. (C) The descendants would be reproductively successful because they could backcross with the parental species. (D) The descendants would regain the ability to reproduce sexually because chromosomes could pair normally.\nA: ",
        {
          "until": [
            "</s>"
          ]
        }
      ]
    ],
    "resps": [
      [
        "(B)"
      ]
    ],
    "filtered_resps": [
      "(B)"
    ],
    "exact_match": 0.0
  },
  {
    "doc_id": 98,
    "doc": {
      "question": "The polytene chromosomes seen in Drosophila silvarentis with the aid of a light microscope are",
      "subject": "college_biology",
      "choices": [
        "not actively carrying out transcription",
        "produced only during mitosis",
        "produced by repeated rounds of DNA replication followed by nuclear division",
        "multiple copies of a single chromosome"
      ],
      "answer": 3
    },
    "target": "(D)",
    "arguments": [
      [
        "The following are multiple choice questions (with answers) about college biology.\n\nQ: Which of the following represents an accurate statement concerning arthropods?\n(A) They possess an exoskeleton composed primarily of peptidoglycan. (B) They possess an open circulatory system with a dorsal heart. (C) They are members of a biologically unsuccessful phylum incapable of exploiting diverse habitats and nutrition sources. (D) They lack paired, jointed appendages.\nA:  (B)\n\nQ: In a given population, 1 out of every 400 people has a cancer caused by a completely recessive allele, b. Assuming the population is in Hardy-Weinberg equilibrium, which of the following is the expected proportion of individuals who carry the b allele but are not expected to develop the cancer?\n(A) 1/400 (B) 19/400 (C) 20/400 (D) 38/400\nA:  (D)\n\nQ: The presence of homologous structures in two different organisms, such as the humerus in the front limb of a human and a bird, indicates that\n(A) the human and bird are polyphyletic species (B) a human's and bird's evolution is convergent (C) the human and bird belong to a clade (D) the human and bird developed by analogy\nA:  (C)\n\nQ: According to the pressure-flow model of movement of phloem contents, photosynthate movement from source to sink is driven by\n(A) an ATP-dependent pressure-flow pump (B) a water-pressure potential gradient (C) transpiration (D) apoplastic diffusion\nA:  (B)\n\nQ: Which of the following contain DNA sequences required for the segregation of chromosomes in mitosis and meiosis?\n(A) Telomeres (B) Centromeres (C) Nucleosomes (D) Spliceosomes\nA:  (B)\n\nQ: The polytene chromosomes seen in Drosophila silvarentis with the aid of a light microscope are\n(A) not actively carrying out transcription (B) produced only during mitosis (C) produced by repeated rounds of DNA replication followed by nuclear division (D) multiple copies of a single chromosome\nA: ",
        {
          "until": [
            "</s>"
          ]
        }
      ]
    ],
    "resps": [
      [
        "(D)"
      ]
    ],
    "filtered_resps": [
      "(D)"
    ],
    "exact_match": 1.0
  },
  {
    "doc_id": 106,
    "doc": {
      "question": "Which of the following statements about embryonic cleavage is NOT true?",
      "subject": "college_biology",
      "choices": [
        "The presence of yolk inhibits cleavage.",
        "Telolecithal eggs undergo meroblastic cleavage.",
        "The vegetal pole undergoes cleavage more readily than does the animal pole",
        "The rapid mitotic divisions of cleavage directly give rise to blastomeres."
      ],
      "answer": 2
    },
    "target": "(C)",
    "arguments": [
      [
        "The following are multiple choice questions (with answers) about college biology.\n\nQ: Which of the following represents an accurate statement concerning arthropods?\n(A) They possess an exoskeleton composed primarily of peptidoglycan. (B) They possess an open circulatory system with a dorsal heart. (C) They are members of a biologically unsuccessful phylum incapable of exploiting diverse habitats and nutrition sources. (D) They lack paired, jointed appendages.\nA:  (B)\n\nQ: According to the pressure-flow model of movement of phloem contents, photosynthate movement from source to sink is driven by\n(A) an ATP-dependent pressure-flow pump (B) a water-pressure potential gradient (C) transpiration (D) apoplastic diffusion\nA:  (B)\n\nQ: In a given population, 1 out of every 400 people has a cancer caused by a completely recessive allele, b. Assuming the population is in Hardy-Weinberg equilibrium, which of the following is the expected proportion of individuals who carry the b allele but are not expected to develop the cancer?\n(A) 1/400 (B) 19/400 (C) 20/400 (D) 38/400\nA:  (D)\n\nQ: Which of the following contain DNA sequences required for the segregation of chromosomes in mitosis and meiosis?\n(A) Telomeres (B) Centromeres (C) Nucleosomes (D) Spliceosomes\nA:  (B)\n\nQ: The presence of homologous structures in two different organisms, such as the humerus in the front limb of a human and a bird, indicates that\n(A) the human and bird are polyphyletic species (B) a human's and bird's evolution is convergent (C) the human and bird belong to a clade (D) the human and bird developed by analogy\nA:  (C)\n\nQ: Which of the following statements about embryonic cleavage is NOT true?\n(A) The presence of yolk inhibits cleavage. (B) Telolecithal eggs undergo meroblastic cleavage. (C) The vegetal pole undergoes cleavage more readily than does the animal pole (D) The rapid mitotic divisions of cleavage directly give rise to blastomeres.\nA: ",
        {
          "until": [
            "</s>"
          ]
        }
      ]
    ],
    "resps": [
      [
        "(D)"
      ]
    ],
    "filtered_resps": [
      "(D)"
    ],
    "exact_match": 0.0
  },
  {
    "doc_id": 114,
    "doc": {
      "question": "Which of the following best explains how mutations in DNA can result in the expression of a new phenotype?",
      "subject": "college_biology",
      "choices": [
        "A different polypeptide is produced.",
        "The polarity of tRNA becomes the opposite of that of DNA.",
        "Nucleic acids are methylated.",
        "The gene is now read in the 3\u2032 to 5\u2032 direction."
      ],
      "answer": 0
    },
    "target": "(A)",
    "arguments": [
      [
        "The following are multiple choice questions (with answers) about college biology.\n\nQ: The presence of homologous structures in two different organisms, such as the humerus in the front limb of a human and a bird, indicates that\n(A) the human and bird are polyphyletic species (B) a human's and bird's evolution is convergent (C) the human and bird belong to a clade (D) the human and bird developed by analogy\nA:  (C)\n\nQ: In a given population, 1 out of every 400 people has a cancer caused by a completely recessive allele, b. Assuming the population is in Hardy-Weinberg equilibrium, which of the following is the expected proportion of individuals who carry the b allele but are not expected to develop the cancer?\n(A) 1/400 (B) 19/400 (C) 20/400 (D) 38/400\nA:  (D)\n\nQ: According to the pressure-flow model of movement of phloem contents, photosynthate movement from source to sink is driven by\n(A) an ATP-dependent pressure-flow pump (B) a water-pressure potential gradient (C) transpiration (D) apoplastic diffusion\nA:  (B)\n\nQ: Which of the following represents an accurate statement concerning arthropods?\n(A) They possess an exoskeleton composed primarily of peptidoglycan. (B) They possess an open circulatory system with a dorsal heart. (C) They are members of a biologically unsuccessful phylum incapable of exploiting diverse habitats and nutrition sources. (D) They lack paired, jointed appendages.\nA:  (B)\n\nQ: Which of the following contain DNA sequences required for the segregation of chromosomes in mitosis and meiosis?\n(A) Telomeres (B) Centromeres (C) Nucleosomes (D) Spliceosomes\nA:  (B)\n\nQ: Which of the following best explains how mutations in DNA can result in the expression of a new phenotype?\n(A) A different polypeptide is produced. (B) The polarity of tRNA becomes the opposite of that of DNA. (C) Nucleic acids are methylated. (D) The gene is now read in the 3\u2032 to 5\u2032 direction.\nA: ",
        {
          "until": [
            "</s>"
          ]
        }
      ]
    ],
    "resps": [
      [
        "(B)"
      ]
    ],
    "filtered_resps": [
      "(B)"
    ],
    "exact_match": 0.0
  },
  {
    "doc_id": 122,
    "doc": {
      "question": "Mitochondria isolated and placed in a buffered solution with a low pH begin to manufacture ATP. Which of the following is the best explanation for the effect of low external pH?",
      "subject": "college_biology",
      "choices": [
        "It increases the concentration of OH-, causing the mitochondria to pump H+ to the intermembrane space.",
        "It increases the OH- concentration in the mitochondria matrix.",
        "It increases the acid concentration in the mitochondria matrix.",
        "It increases diffusion of H+ from the intermembrane space to the matrix."
      ],
      "answer": 3
    },
    "target": "(D)",
    "arguments": [
      [
        "The following are multiple choice questions (with answers) about college biology.\n\nQ: Which of the following represents an accurate statement concerning arthropods?\n(A) They possess an exoskeleton composed primarily of peptidoglycan. (B) They possess an open circulatory system with a dorsal heart. (C) They are members of a biologically unsuccessful phylum incapable of exploiting diverse habitats and nutrition sources. (D) They lack paired, jointed appendages.\nA:  (B)\n\nQ: According to the pressure-flow model of movement of phloem contents, photosynthate movement from source to sink is driven by\n(A) an ATP-dependent pressure-flow pump (B) a water-pressure potential gradient (C) transpiration (D) apoplastic diffusion\nA:  (B)\n\nQ: In a given population, 1 out of every 400 people has a cancer caused by a completely recessive allele, b. Assuming the population is in Hardy-Weinberg equilibrium, which of the following is the expected proportion of individuals who carry the b allele but are not expected to develop the cancer?\n(A) 1/400 (B) 19/400 (C) 20/400 (D) 38/400\nA:  (D)\n\nQ: The presence of homologous structures in two different organisms, such as the humerus in the front limb of a human and a bird, indicates that\n(A) the human and bird are polyphyletic species (B) a human's and bird's evolution is convergent (C) the human and bird belong to a clade (D) the human and bird developed by analogy\nA:  (C)\n\nQ: Which of the following contain DNA sequences required for the segregation of chromosomes in mitosis and meiosis?\n(A) Telomeres (B) Centromeres (C) Nucleosomes (D) Spliceosomes\nA:  (B)\n\nQ: Mitochondria isolated and placed in a buffered solution with a low pH begin to manufacture ATP. Which of the following is the best explanation for the effect of low external pH?\n(A) It increases the concentration of OH-, causing the mitochondria to pump H+ to the intermembrane space. (B) It increases the OH- concentration in the mitochondria matrix. (C) It increases the acid concentration in the mitochondria matrix. (D) It increases diffusion of H+ from the intermembrane space to the matrix.\nA: ",
        {
          "until": [
            "</s>"
          ]
        }
      ]
    ],
    "resps": [
      [
        "(B)"
      ]
    ],
    "filtered_resps": [
      "(B)"
    ],
    "exact_match": 0.0
  },
  {
    "doc_id": 130,
    "doc": {
      "question": "Two xylem plant cell types that provide support and conduct water and minerals are the",
      "subject": "college_biology",
      "choices": [
        "collenchyma and sclerenchyma",
        "sieve tube members and companion cells",
        "tracheids and vessel elements",
        "vessel elements and companion cells"
      ],
      "answer": 2
    },
    "target": "(C)",
    "arguments": [
      [
        "The following are multiple choice questions (with answers) about college biology.\n\nQ: Which of the following contain DNA sequences required for the segregation of chromosomes in mitosis and meiosis?\n(A) Telomeres (B) Centromeres (C) Nucleosomes (D) Spliceosomes\nA:  (B)\n\nQ: According to the pressure-flow model of movement of phloem contents, photosynthate movement from source to sink is driven by\n(A) an ATP-dependent pressure-flow pump (B) a water-pressure potential gradient (C) transpiration (D) apoplastic diffusion\nA:  (B)\n\nQ: In a given population, 1 out of every 400 people has a cancer caused by a completely recessive allele, b. Assuming the population is in Hardy-Weinberg equilibrium, which of the following is the expected proportion of individuals who carry the b allele but are not expected to develop the cancer?\n(A) 1/400 (B) 19/400 (C) 20/400 (D) 38/400\nA:  (D)\n\nQ: Which of the following represents an accurate statement concerning arthropods?\n(A) They possess an exoskeleton composed primarily of peptidoglycan. (B) They possess an open circulatory system with a dorsal heart. (C) They are members of a biologically unsuccessful phylum incapable of exploiting diverse habitats and nutrition sources. (D) They lack paired, jointed appendages.\nA:  (B)\n\nQ: The presence of homologous structures in two different organisms, such as the humerus in the front limb of a human and a bird, indicates that\n(A) the human and bird are polyphyletic species (B) a human's and bird's evolution is convergent (C) the human and bird belong to a clade (D) the human and bird developed by analogy\nA:  (C)\n\nQ: Two xylem plant cell types that provide support and conduct water and minerals are the\n(A) collenchyma and sclerenchyma (B) sieve tube members and companion cells (C) tracheids and vessel elements (D) vessel elements and companion cells\nA: ",
        {
          "until": [
            "</s>"
          ]
        }
      ]
    ],
    "resps": [
      [
        "(D)"
      ]
    ],
    "filtered_resps": [
      "(D)"
    ],
    "exact_match": 0.0
  },
  {
    "doc_id": 138,
    "doc": {
      "question": "Charles Darwin's proposed conditions for natural selection encompass all of the following with regard to a given population EXCEPT",
      "subject": "college_biology",
      "choices": [
        "inheritance of both \"fit\" and \"unfit\" genes",
        "differential survival and reproductive success",
        "competition for limited resources",
        "overproduction of offspring"
      ],
      "answer": 0
    },
    "target": "(A)",
    "arguments": [
      [
        "The following are multiple choice questions (with answers) about college biology.\n\nQ: Which of the following contain DNA sequences required for the segregation of chromosomes in mitosis and meiosis?\n(A) Telomeres (B) Centromeres (C) Nucleosomes (D) Spliceosomes\nA:  (B)\n\nQ: In a given population, 1 out of every 400 people has a cancer caused by a completely recessive allele, b. Assuming the population is in Hardy-Weinberg equilibrium, which of the following is the expected proportion of individuals who carry the b allele but are not expected to develop the cancer?\n(A) 1/400 (B) 19/400 (C) 20/400 (D) 38/400\nA:  (D)\n\nQ: According to the pressure-flow model of movement of phloem contents, photosynthate movement from source to sink is driven by\n(A) an ATP-dependent pressure-flow pump (B) a water-pressure potential gradient (C) transpiration (D) apoplastic diffusion\nA:  (B)\n\nQ: The presence of homologous structures in two different organisms, such as the humerus in the front limb of a human and a bird, indicates that\n(A) the human and bird are polyphyletic species (B) a human's and bird's evolution is convergent (C) the human and bird belong to a clade (D) the human and bird developed by analogy\nA:  (C)\n\nQ: Which of the following represents an accurate statement concerning arthropods?\n(A) They possess an exoskeleton composed primarily of peptidoglycan. (B) They possess an open circulatory system with a dorsal heart. (C) They are members of a biologically unsuccessful phylum incapable of exploiting diverse habitats and nutrition sources. (D) They lack paired, jointed appendages.\nA:  (B)\n\nQ: Charles Darwin's proposed conditions for natural selection encompass all of the following with regard to a given population EXCEPT\n(A) inheritance of both \"fit\" and \"unfit\" genes (B) differential survival and reproductive success (C) competition for limited resources (D) overproduction of offspring\nA: ",
        {
          "until": [
            "</s>"
          ]
        }
      ]
    ],
    "resps": [
      [
        "(C)"
      ]
    ],
    "filtered_resps": [
      "(C)"
    ],
    "exact_match": 0.0
  },
  {
    "doc_id": 3,
    "doc": {
      "question": "Which of the following is a second messenger that stimulates release of calcium ions into the cytoplasm?",
      "subject": "college_biology",
      "choices": [
        "Prostaglandins",
        "Inositol triphosphate",
        "Cyclic AMP",
        "Calmodulin"
      ],
      "answer": 1
    },
    "target": "(B)",
    "arguments": [
      [
        "The following are multiple choice questions (with answers) about college biology.\n\nQ: According to the pressure-flow model of movement of phloem contents, photosynthate movement from source to sink is driven by\n(A) an ATP-dependent pressure-flow pump (B) a water-pressure potential gradient (C) transpiration (D) apoplastic diffusion\nA:  (B)\n\nQ: Which of the following represents an accurate statement concerning arthropods?\n(A) They possess an exoskeleton composed primarily of peptidoglycan. (B) They possess an open circulatory system with a dorsal heart. (C) They are members of a biologically unsuccessful phylum incapable of exploiting diverse habitats and nutrition sources. (D) They lack paired, jointed appendages.\nA:  (B)\n\nQ: Which of the following contain DNA sequences required for the segregation of chromosomes in mitosis and meiosis?\n(A) Telomeres (B) Centromeres (C) Nucleosomes (D) Spliceosomes\nA:  (B)\n\nQ: The presence of homologous structures in two different organisms, such as the humerus in the front limb of a human and a bird, indicates that\n(A) the human and bird are polyphyletic species (B) a human's and bird's evolution is convergent (C) the human and bird belong to a clade (D) the human and bird developed by analogy\nA:  (C)\n\nQ: In a given population, 1 out of every 400 people has a cancer caused by a completely recessive allele, b. Assuming the population is in Hardy-Weinberg equilibrium, which of the following is the expected proportion of individuals who carry the b allele but are not expected to develop the cancer?\n(A) 1/400 (B) 19/400 (C) 20/400 (D) 38/400\nA:  (D)\n\nQ: Which of the following is a second messenger that stimulates release of calcium ions into the cytoplasm?\n(A) Prostaglandins (B) Inositol triphosphate (C) Cyclic AMP (D) Calmodulin\nA: ",
        {
          "until": [
            "</s>"
          ]
        }
      ]
    ],
    "resps": [
      [
        "(D)"
      ]
    ],
    "filtered_resps": [
      "(D)"
    ],
    "exact_match": 0.0
  },
  {
    "doc_id": 11,
    "doc": {
      "question": "Targeting of a newly synthesized protein is most likely to require two different signal peptides for which of the following destinations?",
      "subject": "college_biology",
      "choices": [
        "Plasma membrane",
        "Lysosome",
        "Cytosol",
        "Chloroplast"
      ],
      "answer": 3
    },
    "target": "(D)",
    "arguments": [
      [
        "The following are multiple choice questions (with answers) about college biology.\n\nQ: Which of the following represents an accurate statement concerning arthropods?\n(A) They possess an exoskeleton composed primarily of peptidoglycan. (B) They possess an open circulatory system with a dorsal heart. (C) They are members of a biologically unsuccessful phylum incapable of exploiting diverse habitats and nutrition sources. (D) They lack paired, jointed appendages.\nA:  (B)\n\nQ: Which of the following contain DNA sequences required for the segregation of chromosomes in mitosis and meiosis?\n(A) Telomeres (B) Centromeres (C) Nucleosomes (D) Spliceosomes\nA:  (B)\n\nQ: In a given population, 1 out of every 400 people has a cancer caused by a completely recessive allele, b. Assuming the population is in Hardy-Weinberg equilibrium, which of the following is the expected proportion of individuals who carry the b allele but are not expected to develop the cancer?\n(A) 1/400 (B) 19/400 (C) 20/400 (D) 38/400\nA:  (D)\n\nQ: According to the pressure-flow model of movement of phloem contents, photosynthate movement from source to sink is driven by\n(A) an ATP-dependent pressure-flow pump (B) a water-pressure potential gradient (C) transpiration (D) apoplastic diffusion\nA:  (B)\n\nQ: The presence of homologous structures in two different organisms, such as the humerus in the front limb of a human and a bird, indicates that\n(A) the human and bird are polyphyletic species (B) a human's and bird's evolution is convergent (C) the human and bird belong to a clade (D) the human and bird developed by analogy\nA:  (C)\n\nQ: Targeting of a newly synthesized protein is most likely to require two different signal peptides for which of the following destinations?\n(A) Plasma membrane (B) Lysosome (C) Cytosol (D) Chloroplast\nA: ",
        {
          "until": [
            "</s>"
          ]
        }
      ]
    ],
    "resps": [
      [
        "(B)"
      ]
    ],
    "filtered_resps": [
      "(B)"
    ],
    "exact_match": 0.0
  },
  {
    "doc_id": 19,
    "doc": {
      "question": "The soils of which of the following biomes has the highest rate of leaching and cycling of nutrients?",
      "subject": "college_biology",
      "choices": [
        "Tropical rain forest",
        "Tundra",
        "Taiga",
        "Desert"
      ],
      "answer": 0
    },
    "target": "(A)",
    "arguments": [
      [
        "The following are multiple choice questions (with answers) about college biology.\n\nQ: Which of the following represents an accurate statement concerning arthropods?\n(A) They possess an exoskeleton composed primarily of peptidoglycan. (B) They possess an open circulatory system with a dorsal heart. (C) They are members of a biologically unsuccessful phylum incapable of exploiting diverse habitats and nutrition sources. (D) They lack paired, jointed appendages.\nA:  (B)\n\nQ: Which of the following contain DNA sequences required for the segregation of chromosomes in mitosis and meiosis?\n(A) Telomeres (B) Centromeres (C) Nucleosomes (D) Spliceosomes\nA:  (B)\n\nQ: In a given population, 1 out of every 400 people has a cancer caused by a completely recessive allele, b. Assuming the population is in Hardy-Weinberg equilibrium, which of the following is the expected proportion of individuals who carry the b allele but are not expected to develop the cancer?\n(A) 1/400 (B) 19/400 (C) 20/400 (D) 38/400\nA:  (D)\n\nQ: The presence of homologous structures in two different organisms, such as the humerus in the front limb of a human and a bird, indicates that\n(A) the human and bird are polyphyletic species (B) a human's and bird's evolution is convergent (C) the human and bird belong to a clade (D) the human and bird developed by analogy\nA:  (C)\n\nQ: According to the pressure-flow model of movement of phloem contents, photosynthate movement from source to sink is driven by\n(A) an ATP-dependent pressure-flow pump (B) a water-pressure potential gradient (C) transpiration (D) apoplastic diffusion\nA:  (B)\n\nQ: The soils of which of the following biomes has the highest rate of leaching and cycling of nutrients?\n(A) Tropical rain forest (B) Tundra (C) Taiga (D) Desert\nA: ",
        {
          "until": [
            "</s>"
          ]
        }
      ]
    ],
    "resps": [
      [
        "(C)"
      ]
    ],
    "filtered_resps": [
      "(C)"
    ],
    "exact_match": 0.0
  },
  {
    "doc_id": 27,
    "doc": {
      "question": "Cell motility, as viewed in a cultured fibroblast, encompasses all of the following EXCEPT",
      "subject": "college_biology",
      "choices": [
        "adhesion plaques",
        "vinculin",
        "clathrin",
        "lamellipodia"
      ],
      "answer": 2
    },
    "target": "(C)",
    "arguments": [
      [
        "The following are multiple choice questions (with answers) about college biology.\n\nQ: In a given population, 1 out of every 400 people has a cancer caused by a completely recessive allele, b. Assuming the population is in Hardy-Weinberg equilibrium, which of the following is the expected proportion of individuals who carry the b allele but are not expected to develop the cancer?\n(A) 1/400 (B) 19/400 (C) 20/400 (D) 38/400\nA:  (D)\n\nQ: Which of the following represents an accurate statement concerning arthropods?\n(A) They possess an exoskeleton composed primarily of peptidoglycan. (B) They possess an open circulatory system with a dorsal heart. (C) They are members of a biologically unsuccessful phylum incapable of exploiting diverse habitats and nutrition sources. (D) They lack paired, jointed appendages.\nA:  (B)\n\nQ: According to the pressure-flow model of movement of phloem contents, photosynthate movement from source to sink is driven by\n(A) an ATP-dependent pressure-flow pump (B) a water-pressure potential gradient (C) transpiration (D) apoplastic diffusion\nA:  (B)\n\nQ: The presence of homologous structures in two different organisms, such as the humerus in the front limb of a human and a bird, indicates that\n(A) the human and bird are polyphyletic species (B) a human's and bird's evolution is convergent (C) the human and bird belong to a clade (D) the human and bird developed by analogy\nA:  (C)\n\nQ: Which of the following contain DNA sequences required for the segregation of chromosomes in mitosis and meiosis?\n(A) Telomeres (B) Centromeres (C) Nucleosomes (D) Spliceosomes\nA:  (B)\n\nQ: Cell motility, as viewed in a cultured fibroblast, encompasses all of the following EXCEPT\n(A) adhesion plaques (B) vinculin (C) clathrin (D) lamellipodia\nA: ",
        {
          "until": [
            "</s>"
          ]
        }
      ]
    ],
    "resps": [
      [
        "(D)"
      ]
    ],
    "filtered_resps": [
      "(D)"
    ],
    "exact_match": 0.0
  },
  {
    "doc_id": 35,
    "doc": {
      "question": "Ferns undergo alternation of generations in which a",
      "subject": "college_biology",
      "choices": [
        "dominant sporophyte alternates with an independent gametophyte",
        "dominant gametophyte alternates with a dependent sporophyte",
        "sporophyte and a gametophyte have equal life spans",
        "gametophyte produces gametes by meiosis"
      ],
      "answer": 0
    },
    "target": "(A)",
    "arguments": [
      [
        "The following are multiple choice questions (with answers) about college biology.\n\nQ: Which of the following contain DNA sequences required for the segregation of chromosomes in mitosis and meiosis?\n(A) Telomeres (B) Centromeres (C) Nucleosomes (D) Spliceosomes\nA:  (B)\n\nQ: According to the pressure-flow model of movement of phloem contents, photosynthate movement from source to sink is driven by\n(A) an ATP-dependent pressure-flow pump (B) a water-pressure potential gradient (C) transpiration (D) apoplastic diffusion\nA:  (B)\n\nQ: Which of the following represents an accurate statement concerning arthropods?\n(A) They possess an exoskeleton composed primarily of peptidoglycan. (B) They possess an open circulatory system with a dorsal heart. (C) They are members of a biologically unsuccessful phylum incapable of exploiting diverse habitats and nutrition sources. (D) They lack paired, jointed appendages.\nA:  (B)\n\nQ: The presence of homologous structures in two different organisms, such as the humerus in the front limb of a human and a bird, indicates that\n(A) the human and bird are polyphyletic species (B) a human's and bird's evolution is convergent (C) the human and bird belong to a clade (D) the human and bird developed by analogy\nA:  (C)\n\nQ: In a given population, 1 out of every 400 people has a cancer caused by a completely recessive allele, b. Assuming the population is in Hardy-Weinberg equilibrium, which of the following is the expected proportion of individuals who carry the b allele but are not expected to develop the cancer?\n(A) 1/400 (B) 19/400 (C) 20/400 (D) 38/400\nA:  (D)\n\nQ: Ferns undergo alternation of generations in which a\n(A) dominant sporophyte alternates with an independent gametophyte (B) dominant gametophyte alternates with a dependent sporophyte (C) sporophyte and a gametophyte have equal life spans (D) gametophyte produces gametes by meiosis\nA: ",
        {
          "until": [
            "</s>"
          ]
        }
      ]
    ],
    "resps": [
      [
        "(C)"
      ]
    ],
    "filtered_resps": [
      "(C)"
    ],
    "exact_match": 0.0
  },
  {
    "doc_id": 43,
    "doc": {
      "question": "The structures that act as sites of gas exchange in a woody stem are the",
      "subject": "college_biology",
      "choices": [
        "lenticels",
        "terminal buds",
        "nodes",
        "internodes"
      ],
      "answer": 0
    },
    "target": "(A)",
    "arguments": [
      [
        "The following are multiple choice questions (with answers) about college biology.\n\nQ: Which of the following represents an accurate statement concerning arthropods?\n(A) They possess an exoskeleton composed primarily of peptidoglycan. (B) They possess an open circulatory system with a dorsal heart. (C) They are members of a biologically unsuccessful phylum incapable of exploiting diverse habitats and nutrition sources. (D) They lack paired, jointed appendages.\nA:  (B)\n\nQ: Which of the following contain DNA sequences required for the segregation of chromosomes in mitosis and meiosis?\n(A) Telomeres (B) Centromeres (C) Nucleosomes (D) Spliceosomes\nA:  (B)\n\nQ: The presence of homologous structures in two different organisms, such as the humerus in the front limb of a human and a bird, indicates that\n(A) the human and bird are polyphyletic species (B) a human's and bird's evolution is convergent (C) the human and bird belong to a clade (D) the human and bird developed by analogy\nA:  (C)\n\nQ: According to the pressure-flow model of movement of phloem contents, photosynthate movement from source to sink is driven by\n(A) an ATP-dependent pressure-flow pump (B) a water-pressure potential gradient (C) transpiration (D) apoplastic diffusion\nA:  (B)\n\nQ: In a given population, 1 out of every 400 people has a cancer caused by a completely recessive allele, b. Assuming the population is in Hardy-Weinberg equilibrium, which of the following is the expected proportion of individuals who carry the b allele but are not expected to develop the cancer?\n(A) 1/400 (B) 19/400 (C) 20/400 (D) 38/400\nA:  (D)\n\nQ: The structures that act as sites of gas exchange in a woody stem are the\n(A) lenticels (B) terminal buds (C) nodes (D) internodes\nA: ",
        {
          "until": [
            "</s>"
          ]
        }
      ]
    ],
    "resps": [
      [
        "(D)<0x0A>Answer: (D)"
      ]
    ],
    "filtered_resps": [
      "(D)<0x0A>Answer: (D)"
    ],
    "exact_match": 0.0
  },
  {
    "doc_id": 51,
    "doc": {
      "question": "All of the following may serve as intracellular messengers EXCEPT",
      "subject": "college_biology",
      "choices": [
        "calcium ions",
        "cAMP",
        "acetylcholine",
        "inositol 1,4,5-triphosphate"
      ],
      "answer": 2
    },
    "target": "(C)",
    "arguments": [
      [
        "The following are multiple choice questions (with answers) about college biology.\n\nQ: Which of the following contain DNA sequences required for the segregation of chromosomes in mitosis and meiosis?\n(A) Telomeres (B) Centromeres (C) Nucleosomes (D) Spliceosomes\nA:  (B)\n\nQ: Which of the following represents an accurate statement concerning arthropods?\n(A) They possess an exoskeleton composed primarily of peptidoglycan. (B) They possess an open circulatory system with a dorsal heart. (C) They are members of a biologically unsuccessful phylum incapable of exploiting diverse habitats and nutrition sources. (D) They lack paired, jointed appendages.\nA:  (B)\n\nQ: The presence of homologous structures in two different organisms, such as the humerus in the front limb of a human and a bird, indicates that\n(A) the human and bird are polyphyletic species (B) a human's and bird's evolution is convergent (C) the human and bird belong to a clade (D) the human and bird developed by analogy\nA:  (C)\n\nQ: In a given population, 1 out of every 400 people has a cancer caused by a completely recessive allele, b. Assuming the population is in Hardy-Weinberg equilibrium, which of the following is the expected proportion of individuals who carry the b allele but are not expected to develop the cancer?\n(A) 1/400 (B) 19/400 (C) 20/400 (D) 38/400\nA:  (D)\n\nQ: According to the pressure-flow model of movement of phloem contents, photosynthate movement from source to sink is driven by\n(A) an ATP-dependent pressure-flow pump (B) a water-pressure potential gradient (C) transpiration (D) apoplastic diffusion\nA:  (B)\n\nQ: All of the following may serve as intracellular messengers EXCEPT\n(A) calcium ions (B) cAMP (C) acetylcholine (D) inositol 1,4,5-triphosphate\nA: ",
        {
          "until": [
            "</s>"
          ]
        }
      ]
    ],
    "resps": [
      [
        "(D)"
      ]
    ],
    "filtered_resps": [
      "(D)"
    ],
    "exact_match": 0.0
  },
  {
    "doc_id": 59,
    "doc": {
      "question": "Which of the following is a biological attribute that would most likely allow a species to become cosmopolitan in distribution?",
      "subject": "college_biology",
      "choices": [
        "Extreme habitat specialization",
        "K-selected reproductive rate",
        "Limited dispersal abilities",
        "Capacity for long-distance dispersal"
      ],
      "answer": 3
    },
    "target": "(D)",
    "arguments": [
      [
        "The following are multiple choice questions (with answers) about college biology.\n\nQ: The presence of homologous structures in two different organisms, such as the humerus in the front limb of a human and a bird, indicates that\n(A) the human and bird are polyphyletic species (B) a human's and bird's evolution is convergent (C) the human and bird belong to a clade (D) the human and bird developed by analogy\nA:  (C)\n\nQ: Which of the following contain DNA sequences required for the segregation of chromosomes in mitosis and meiosis?\n(A) Telomeres (B) Centromeres (C) Nucleosomes (D) Spliceosomes\nA:  (B)\n\nQ: Which of the following represents an accurate statement concerning arthropods?\n(A) They possess an exoskeleton composed primarily of peptidoglycan. (B) They possess an open circulatory system with a dorsal heart. (C) They are members of a biologically unsuccessful phylum incapable of exploiting diverse habitats and nutrition sources. (D) They lack paired, jointed appendages.\nA:  (B)\n\nQ: According to the pressure-flow model of movement of phloem contents, photosynthate movement from source to sink is driven by\n(A) an ATP-dependent pressure-flow pump (B) a water-pressure potential gradient (C) transpiration (D) apoplastic diffusion\nA:  (B)\n\nQ: In a given population, 1 out of every 400 people has a cancer caused by a completely recessive allele, b. Assuming the population is in Hardy-Weinberg equilibrium, which of the following is the expected proportion of individuals who carry the b allele but are not expected to develop the cancer?\n(A) 1/400 (B) 19/400 (C) 20/400 (D) 38/400\nA:  (D)\n\nQ: Which of the following is a biological attribute that would most likely allow a species to become cosmopolitan in distribution?\n(A) Extreme habitat specialization (B) K-selected reproductive rate (C) Limited dispersal abilities (D) Capacity for long-distance dispersal\nA: ",
        {
          "until": [
            "</s>"
          ]
        }
      ]
    ],
    "resps": [
      [
        "(D)"
      ]
    ],
    "filtered_resps": [
      "(D)"
    ],
    "exact_match": 1.0
  },
  {
    "doc_id": 67,
    "doc": {
      "question": "Which of the following plant cells undergoes programmed cell death to become functional?",
      "subject": "college_biology",
      "choices": [
        "Phloem sieve tube member",
        "Xylem vessel member",
        "Stomatal guard cell",
        "Root cap cell"
      ],
      "answer": 1
    },
    "target": "(B)",
    "arguments": [
      [
        "The following are multiple choice questions (with answers) about college biology.\n\nQ: Which of the following contain DNA sequences required for the segregation of chromosomes in mitosis and meiosis?\n(A) Telomeres (B) Centromeres (C) Nucleosomes (D) Spliceosomes\nA:  (B)\n\nQ: Which of the following represents an accurate statement concerning arthropods?\n(A) They possess an exoskeleton composed primarily of peptidoglycan. (B) They possess an open circulatory system with a dorsal heart. (C) They are members of a biologically unsuccessful phylum incapable of exploiting diverse habitats and nutrition sources. (D) They lack paired, jointed appendages.\nA:  (B)\n\nQ: The presence of homologous structures in two different organisms, such as the humerus in the front limb of a human and a bird, indicates that\n(A) the human and bird are polyphyletic species (B) a human's and bird's evolution is convergent (C) the human and bird belong to a clade (D) the human and bird developed by analogy\nA:  (C)\n\nQ: According to the pressure-flow model of movement of phloem contents, photosynthate movement from source to sink is driven by\n(A) an ATP-dependent pressure-flow pump (B) a water-pressure potential gradient (C) transpiration (D) apoplastic diffusion\nA:  (B)\n\nQ: In a given population, 1 out of every 400 people has a cancer caused by a completely recessive allele, b. Assuming the population is in Hardy-Weinberg equilibrium, which of the following is the expected proportion of individuals who carry the b allele but are not expected to develop the cancer?\n(A) 1/400 (B) 19/400 (C) 20/400 (D) 38/400\nA:  (D)\n\nQ: Which of the following plant cells undergoes programmed cell death to become functional?\n(A) Phloem sieve tube member (B) Xylem vessel member (C) Stomatal guard cell (D) Root cap cell\nA: ",
        {
          "until": [
            "</s>"
          ]
        }
      ]
    ],
    "resps": [
      [
        "(D)"
      ]
    ],
    "filtered_resps": [
      "(D)"
    ],
    "exact_match": 0.0
  },
  {
    "doc_id": 75,
    "doc": {
      "question": "Which of the following is true of organisms belonging to the kingdom Protista?",
      "subject": "college_biology",
      "choices": [
        "They are eukaryotic.",
        "They include the cyanobacteria.",
        "They are heterotrophic.",
        "They possess cell walls composed of peptidoglycan."
      ],
      "answer": 0
    },
    "target": "(A)",
    "arguments": [
      [
        "The following are multiple choice questions (with answers) about college biology.\n\nQ: The presence of homologous structures in two different organisms, such as the humerus in the front limb of a human and a bird, indicates that\n(A) the human and bird are polyphyletic species (B) a human's and bird's evolution is convergent (C) the human and bird belong to a clade (D) the human and bird developed by analogy\nA:  (C)\n\nQ: In a given population, 1 out of every 400 people has a cancer caused by a completely recessive allele, b. Assuming the population is in Hardy-Weinberg equilibrium, which of the following is the expected proportion of individuals who carry the b allele but are not expected to develop the cancer?\n(A) 1/400 (B) 19/400 (C) 20/400 (D) 38/400\nA:  (D)\n\nQ: Which of the following contain DNA sequences required for the segregation of chromosomes in mitosis and meiosis?\n(A) Telomeres (B) Centromeres (C) Nucleosomes (D) Spliceosomes\nA:  (B)\n\nQ: According to the pressure-flow model of movement of phloem contents, photosynthate movement from source to sink is driven by\n(A) an ATP-dependent pressure-flow pump (B) a water-pressure potential gradient (C) transpiration (D) apoplastic diffusion\nA:  (B)\n\nQ: Which of the following represents an accurate statement concerning arthropods?\n(A) They possess an exoskeleton composed primarily of peptidoglycan. (B) They possess an open circulatory system with a dorsal heart. (C) They are members of a biologically unsuccessful phylum incapable of exploiting diverse habitats and nutrition sources. (D) They lack paired, jointed appendages.\nA:  (B)\n\nQ: Which of the following is true of organisms belonging to the kingdom Protista?\n(A) They are eukaryotic. (B) They include the cyanobacteria. (C) They are heterotrophic. (D) They possess cell walls composed of peptidoglycan.\nA: ",
        {
          "until": [
            "</s>"
          ]
        }
      ]
    ],
    "resps": [
      [
        "(D)"
      ]
    ],
    "filtered_resps": [
      "(D)"
    ],
    "exact_match": 0.0
  },
  {
    "doc_id": 83,
    "doc": {
      "question": "The amino acid ornithine is regenerated during each turn of the urea cycle in a similar manner to which of the following participants in the citric acid cycle?",
      "subject": "college_biology",
      "choices": [
        "Succinate",
        "Fumarate",
        "Oxaloacetate",
        "Citrate"
      ],
      "answer": 2
    },
    "target": "(C)",
    "arguments": [
      [
        "The following are multiple choice questions (with answers) about college biology.\n\nQ: In a given population, 1 out of every 400 people has a cancer caused by a completely recessive allele, b. Assuming the population is in Hardy-Weinberg equilibrium, which of the following is the expected proportion of individuals who carry the b allele but are not expected to develop the cancer?\n(A) 1/400 (B) 19/400 (C) 20/400 (D) 38/400\nA:  (D)\n\nQ: Which of the following represents an accurate statement concerning arthropods?\n(A) They possess an exoskeleton composed primarily of peptidoglycan. (B) They possess an open circulatory system with a dorsal heart. (C) They are members of a biologically unsuccessful phylum incapable of exploiting diverse habitats and nutrition sources. (D) They lack paired, jointed appendages.\nA:  (B)\n\nQ: According to the pressure-flow model of movement of phloem contents, photosynthate movement from source to sink is driven by\n(A) an ATP-dependent pressure-flow pump (B) a water-pressure potential gradient (C) transpiration (D) apoplastic diffusion\nA:  (B)\n\nQ: Which of the following contain DNA sequences required for the segregation of chromosomes in mitosis and meiosis?\n(A) Telomeres (B) Centromeres (C) Nucleosomes (D) Spliceosomes\nA:  (B)\n\nQ: The presence of homologous structures in two different organisms, such as the humerus in the front limb of a human and a bird, indicates that\n(A) the human and bird are polyphyletic species (B) a human's and bird's evolution is convergent (C) the human and bird belong to a clade (D) the human and bird developed by analogy\nA:  (C)\n\nQ: The amino acid ornithine is regenerated during each turn of the urea cycle in a similar manner to which of the following participants in the citric acid cycle?\n(A) Succinate (B) Fumarate (C) Oxaloacetate (D) Citrate\nA: ",
        {
          "until": [
            "</s>"
          ]
        }
      ]
    ],
    "resps": [
      [
        "(D)"
      ]
    ],
    "filtered_resps": [
      "(D)"
    ],
    "exact_match": 0.0
  },
  {
    "doc_id": 91,
    "doc": {
      "question": "Phalloidin is a toxin made by the death cap mushroom. The toxin binds to actin subunits and disrupts actin function. Which of the following structures would be most directly affected by phalloidin?",
      "subject": "college_biology",
      "choices": [
        "Intermediate filaments",
        "Collagen fibers",
        "Microfilaments",
        "Microtubules"
      ],
      "answer": 2
    },
    "target": "(C)",
    "arguments": [
      [
        "The following are multiple choice questions (with answers) about college biology.\n\nQ: Which of the following represents an accurate statement concerning arthropods?\n(A) They possess an exoskeleton composed primarily of peptidoglycan. (B) They possess an open circulatory system with a dorsal heart. (C) They are members of a biologically unsuccessful phylum incapable of exploiting diverse habitats and nutrition sources. (D) They lack paired, jointed appendages.\nA:  (B)\n\nQ: In a given population, 1 out of every 400 people has a cancer caused by a completely recessive allele, b. Assuming the population is in Hardy-Weinberg equilibrium, which of the following is the expected proportion of individuals who carry the b allele but are not expected to develop the cancer?\n(A) 1/400 (B) 19/400 (C) 20/400 (D) 38/400\nA:  (D)\n\nQ: Which of the following contain DNA sequences required for the segregation of chromosomes in mitosis and meiosis?\n(A) Telomeres (B) Centromeres (C) Nucleosomes (D) Spliceosomes\nA:  (B)\n\nQ: The presence of homologous structures in two different organisms, such as the humerus in the front limb of a human and a bird, indicates that\n(A) the human and bird are polyphyletic species (B) a human's and bird's evolution is convergent (C) the human and bird belong to a clade (D) the human and bird developed by analogy\nA:  (C)\n\nQ: According to the pressure-flow model of movement of phloem contents, photosynthate movement from source to sink is driven by\n(A) an ATP-dependent pressure-flow pump (B) a water-pressure potential gradient (C) transpiration (D) apoplastic diffusion\nA:  (B)\n\nQ: Phalloidin is a toxin made by the death cap mushroom. The toxin binds to actin subunits and disrupts actin function. Which of the following structures would be most directly affected by phalloidin?\n(A) Intermediate filaments (B) Collagen fibers (C) Microfilaments (D) Microtubules\nA: ",
        {
          "until": [
            "</s>"
          ]
        }
      ]
    ],
    "resps": [
      [
        "(C)"
      ]
    ],
    "filtered_resps": [
      "(C)"
    ],
    "exact_match": 1.0
  },
  {
    "doc_id": 99,
    "doc": {
      "question": "Which of the following agents will induce polyploidy in a dividing eukaryote?",
      "subject": "college_biology",
      "choices": [
        "Penicillin",
        "Colchicine",
        "Tetracycline",
        "Puromycin"
      ],
      "answer": 1
    },
    "target": "(B)",
    "arguments": [
      [
        "The following are multiple choice questions (with answers) about college biology.\n\nQ: Which of the following represents an accurate statement concerning arthropods?\n(A) They possess an exoskeleton composed primarily of peptidoglycan. (B) They possess an open circulatory system with a dorsal heart. (C) They are members of a biologically unsuccessful phylum incapable of exploiting diverse habitats and nutrition sources. (D) They lack paired, jointed appendages.\nA:  (B)\n\nQ: In a given population, 1 out of every 400 people has a cancer caused by a completely recessive allele, b. Assuming the population is in Hardy-Weinberg equilibrium, which of the following is the expected proportion of individuals who carry the b allele but are not expected to develop the cancer?\n(A) 1/400 (B) 19/400 (C) 20/400 (D) 38/400\nA:  (D)\n\nQ: The presence of homologous structures in two different organisms, such as the humerus in the front limb of a human and a bird, indicates that\n(A) the human and bird are polyphyletic species (B) a human's and bird's evolution is convergent (C) the human and bird belong to a clade (D) the human and bird developed by analogy\nA:  (C)\n\nQ: According to the pressure-flow model of movement of phloem contents, photosynthate movement from source to sink is driven by\n(A) an ATP-dependent pressure-flow pump (B) a water-pressure potential gradient (C) transpiration (D) apoplastic diffusion\nA:  (B)\n\nQ: Which of the following contain DNA sequences required for the segregation of chromosomes in mitosis and meiosis?\n(A) Telomeres (B) Centromeres (C) Nucleosomes (D) Spliceosomes\nA:  (B)\n\nQ: Which of the following agents will induce polyploidy in a dividing eukaryote?\n(A) Penicillin (B) Colchicine (C) Tetracycline (D) Puromycin\nA: ",
        {
          "until": [
            "</s>"
          ]
        }
      ]
    ],
    "resps": [
      [
        "(D)"
      ]
    ],
    "filtered_resps": [
      "(D)"
    ],
    "exact_match": 0.0
  },
  {
    "doc_id": 107,
    "doc": {
      "question": "In eukaryotic photosynthetic cells, which of the following occurs when electrons flow cyclically through the electron transport chain associated with photosystem I?",
      "subject": "college_biology",
      "choices": [
        "Synthesis of ATP",
        "Reduction of NADP+ to NADPH",
        "Release of O2",
        "Reduction of CO2 to sugar"
      ],
      "answer": 0
    },
    "target": "(A)",
    "arguments": [
      [
        "The following are multiple choice questions (with answers) about college biology.\n\nQ: Which of the following represents an accurate statement concerning arthropods?\n(A) They possess an exoskeleton composed primarily of peptidoglycan. (B) They possess an open circulatory system with a dorsal heart. (C) They are members of a biologically unsuccessful phylum incapable of exploiting diverse habitats and nutrition sources. (D) They lack paired, jointed appendages.\nA:  (B)\n\nQ: According to the pressure-flow model of movement of phloem contents, photosynthate movement from source to sink is driven by\n(A) an ATP-dependent pressure-flow pump (B) a water-pressure potential gradient (C) transpiration (D) apoplastic diffusion\nA:  (B)\n\nQ: In a given population, 1 out of every 400 people has a cancer caused by a completely recessive allele, b. Assuming the population is in Hardy-Weinberg equilibrium, which of the following is the expected proportion of individuals who carry the b allele but are not expected to develop the cancer?\n(A) 1/400 (B) 19/400 (C) 20/400 (D) 38/400\nA:  (D)\n\nQ: Which of the following contain DNA sequences required for the segregation of chromosomes in mitosis and meiosis?\n(A) Telomeres (B) Centromeres (C) Nucleosomes (D) Spliceosomes\nA:  (B)\n\nQ: The presence of homologous structures in two different organisms, such as the humerus in the front limb of a human and a bird, indicates that\n(A) the human and bird are polyphyletic species (B) a human's and bird's evolution is convergent (C) the human and bird belong to a clade (D) the human and bird developed by analogy\nA:  (C)\n\nQ: In eukaryotic photosynthetic cells, which of the following occurs when electrons flow cyclically through the electron transport chain associated with photosystem I?\n(A) Synthesis of ATP (B) Reduction of NADP+ to NADPH (C) Release of O2 (D) Reduction of CO2 to sugar\nA: ",
        {
          "until": [
            "</s>"
          ]
        }
      ]
    ],
    "resps": [
      [
        "(B)"
      ]
    ],
    "filtered_resps": [
      "(B)"
    ],
    "exact_match": 0.0
  },
  {
    "doc_id": 115,
    "doc": {
      "question": "A competitive inhibitor of an enzyme exerts its effect by",
      "subject": "college_biology",
      "choices": [
        "irreversibly forming covalent links with the enzyme, effectively preventing the enzyme's dissociation from it",
        "irreversibly modifying some of the amino acid residues that help to comprise the enzyme's active site",
        "competing with the substrate molecule for the same enzyme but a different binding site than the substrate binding site",
        "reversibly decreasing the number of enzyme molecules that are available to bind substrates"
      ],
      "answer": 3
    },
    "target": "(D)",
    "arguments": [
      [
        "The following are multiple choice questions (with answers) about college biology.\n\nQ: The presence of homologous structures in two different organisms, such as the humerus in the front limb of a human and a bird, indicates that\n(A) the human and bird are polyphyletic species (B) a human's and bird's evolution is convergent (C) the human and bird belong to a clade (D) the human and bird developed by analogy\nA:  (C)\n\nQ: In a given population, 1 out of every 400 people has a cancer caused by a completely recessive allele, b. Assuming the population is in Hardy-Weinberg equilibrium, which of the following is the expected proportion of individuals who carry the b allele but are not expected to develop the cancer?\n(A) 1/400 (B) 19/400 (C) 20/400 (D) 38/400\nA:  (D)\n\nQ: According to the pressure-flow model of movement of phloem contents, photosynthate movement from source to sink is driven by\n(A) an ATP-dependent pressure-flow pump (B) a water-pressure potential gradient (C) transpiration (D) apoplastic diffusion\nA:  (B)\n\nQ: Which of the following represents an accurate statement concerning arthropods?\n(A) They possess an exoskeleton composed primarily of peptidoglycan. (B) They possess an open circulatory system with a dorsal heart. (C) They are members of a biologically unsuccessful phylum incapable of exploiting diverse habitats and nutrition sources. (D) They lack paired, jointed appendages.\nA:  (B)\n\nQ: Which of the following contain DNA sequences required for the segregation of chromosomes in mitosis and meiosis?\n(A) Telomeres (B) Centromeres (C) Nucleosomes (D) Spliceosomes\nA:  (B)\n\nQ: A competitive inhibitor of an enzyme exerts its effect by\n(A) irreversibly forming covalent links with the enzyme, effectively preventing the enzyme's dissociation from it (B) irreversibly modifying some of the amino acid residues that help to comprise the enzyme's active site (C) competing with the substrate molecule for the same enzyme but a different binding site than the substrate binding site (D) reversibly decreasing the number of enzyme molecules that are available to bind substrates\nA: ",
        {
          "until": [
            "</s>"
          ]
        }
      ]
    ],
    "resps": [
      [
        "(C)"
      ]
    ],
    "filtered_resps": [
      "(C)"
    ],
    "exact_match": 0.0
  },
  {
    "doc_id": 123,
    "doc": {
      "question": "An organism belonging to the nekton is which one of the following?",
      "subject": "college_biology",
      "choices": [
        "Whale",
        "Barnacle",
        "Cyanobacterium",
        "Protist"
      ],
      "answer": 0
    },
    "target": "(A)",
    "arguments": [
      [
        "The following are multiple choice questions (with answers) about college biology.\n\nQ: Which of the following represents an accurate statement concerning arthropods?\n(A) They possess an exoskeleton composed primarily of peptidoglycan. (B) They possess an open circulatory system with a dorsal heart. (C) They are members of a biologically unsuccessful phylum incapable of exploiting diverse habitats and nutrition sources. (D) They lack paired, jointed appendages.\nA:  (B)\n\nQ: According to the pressure-flow model of movement of phloem contents, photosynthate movement from source to sink is driven by\n(A) an ATP-dependent pressure-flow pump (B) a water-pressure potential gradient (C) transpiration (D) apoplastic diffusion\nA:  (B)\n\nQ: In a given population, 1 out of every 400 people has a cancer caused by a completely recessive allele, b. Assuming the population is in Hardy-Weinberg equilibrium, which of the following is the expected proportion of individuals who carry the b allele but are not expected to develop the cancer?\n(A) 1/400 (B) 19/400 (C) 20/400 (D) 38/400\nA:  (D)\n\nQ: The presence of homologous structures in two different organisms, such as the humerus in the front limb of a human and a bird, indicates that\n(A) the human and bird are polyphyletic species (B) a human's and bird's evolution is convergent (C) the human and bird belong to a clade (D) the human and bird developed by analogy\nA:  (C)\n\nQ: Which of the following contain DNA sequences required for the segregation of chromosomes in mitosis and meiosis?\n(A) Telomeres (B) Centromeres (C) Nucleosomes (D) Spliceosomes\nA:  (B)\n\nQ: An organism belonging to the nekton is which one of the following?\n(A) Whale (B) Barnacle (C) Cyanobacterium (D) Protist\nA: ",
        {
          "until": [
            "</s>"
          ]
        }
      ]
    ],
    "resps": [
      [
        "(D)"
      ]
    ],
    "filtered_resps": [
      "(D)"
    ],
    "exact_match": 0.0
  },
  {
    "doc_id": 131,
    "doc": {
      "question": "Which of the following statements about excretory organs is true?",
      "subject": "college_biology",
      "choices": [
        "The kidneys of saltwater fishes produce urine hyperosmotic to their tissues.",
        "The kidneys of desert mammals produce urine that is hypoosmotic to the urine of freshwater fishes.",
        "Malpighian tubules allow insects to excrete waste through the exoskeleton.",
        "Juxtamedullary nephrons in the mammalian kidney allow the organism to produce hyperosmotic urine."
      ],
      "answer": 3
    },
    "target": "(D)",
    "arguments": [
      [
        "The following are multiple choice questions (with answers) about college biology.\n\nQ: Which of the following contain DNA sequences required for the segregation of chromosomes in mitosis and meiosis?\n(A) Telomeres (B) Centromeres (C) Nucleosomes (D) Spliceosomes\nA:  (B)\n\nQ: According to the pressure-flow model of movement of phloem contents, photosynthate movement from source to sink is driven by\n(A) an ATP-dependent pressure-flow pump (B) a water-pressure potential gradient (C) transpiration (D) apoplastic diffusion\nA:  (B)\n\nQ: In a given population, 1 out of every 400 people has a cancer caused by a completely recessive allele, b. Assuming the population is in Hardy-Weinberg equilibrium, which of the following is the expected proportion of individuals who carry the b allele but are not expected to develop the cancer?\n(A) 1/400 (B) 19/400 (C) 20/400 (D) 38/400\nA:  (D)\n\nQ: Which of the following represents an accurate statement concerning arthropods?\n(A) They possess an exoskeleton composed primarily of peptidoglycan. (B) They possess an open circulatory system with a dorsal heart. (C) They are members of a biologically unsuccessful phylum incapable of exploiting diverse habitats and nutrition sources. (D) They lack paired, jointed appendages.\nA:  (B)\n\nQ: The presence of homologous structures in two different organisms, such as the humerus in the front limb of a human and a bird, indicates that\n(A) the human and bird are polyphyletic species (B) a human's and bird's evolution is convergent (C) the human and bird belong to a clade (D) the human and bird developed by analogy\nA:  (C)\n\nQ: Which of the following statements about excretory organs is true?\n(A) The kidneys of saltwater fishes produce urine hyperosmotic to their tissues. (B) The kidneys of desert mammals produce urine that is hypoosmotic to the urine of freshwater fishes. (C) Malpighian tubules allow insects to excrete waste through the exoskeleton. (D) Juxtamedullary nephrons in the mammalian kidney allow the organism to produce hyperosmotic urine.\nA: ",
        {
          "until": [
            "</s>"
          ]
        }
      ]
    ],
    "resps": [
      [
        "(D)"
      ]
    ],
    "filtered_resps": [
      "(D)"
    ],
    "exact_match": 1.0
  },
  {
    "doc_id": 139,
    "doc": {
      "question": "Which of the following is a correct statement about the cohesion-tension theory for the ascent of water in the xylem?",
      "subject": "college_biology",
      "choices": [
        "The evaporation of water from leaf mesophyll cells generates tension in the water column.",
        "Water moves from a source region with high hydrostatic pressure to a sink region with low hydrostatic pressure.",
        "The cohesion of water molecules is responsible for the formation of embolisms (air bubbles) in the water column.",
        "Living cells of the xylem provide the main conduit for an ascent of water."
      ],
      "answer": 0
    },
    "target": "(A)",
    "arguments": [
      [
        "The following are multiple choice questions (with answers) about college biology.\n\nQ: Which of the following contain DNA sequences required for the segregation of chromosomes in mitosis and meiosis?\n(A) Telomeres (B) Centromeres (C) Nucleosomes (D) Spliceosomes\nA:  (B)\n\nQ: In a given population, 1 out of every 400 people has a cancer caused by a completely recessive allele, b. Assuming the population is in Hardy-Weinberg equilibrium, which of the following is the expected proportion of individuals who carry the b allele but are not expected to develop the cancer?\n(A) 1/400 (B) 19/400 (C) 20/400 (D) 38/400\nA:  (D)\n\nQ: According to the pressure-flow model of movement of phloem contents, photosynthate movement from source to sink is driven by\n(A) an ATP-dependent pressure-flow pump (B) a water-pressure potential gradient (C) transpiration (D) apoplastic diffusion\nA:  (B)\n\nQ: The presence of homologous structures in two different organisms, such as the humerus in the front limb of a human and a bird, indicates that\n(A) the human and bird are polyphyletic species (B) a human's and bird's evolution is convergent (C) the human and bird belong to a clade (D) the human and bird developed by analogy\nA:  (C)\n\nQ: Which of the following represents an accurate statement concerning arthropods?\n(A) They possess an exoskeleton composed primarily of peptidoglycan. (B) They possess an open circulatory system with a dorsal heart. (C) They are members of a biologically unsuccessful phylum incapable of exploiting diverse habitats and nutrition sources. (D) They lack paired, jointed appendages.\nA:  (B)\n\nQ: Which of the following is a correct statement about the cohesion-tension theory for the ascent of water in the xylem?\n(A) The evaporation of water from leaf mesophyll cells generates tension in the water column. (B) Water moves from a source region with high hydrostatic pressure to a sink region with low hydrostatic pressure. (C) The cohesion of water molecules is responsible for the formation of embolisms (air bubbles) in the water column. (D) Living cells of the xylem provide the main conduit for an ascent of water.\nA: ",
        {
          "until": [
            "</s>"
          ]
        }
      ]
    ],
    "resps": [
      [
        "(D)"
      ]
    ],
    "filtered_resps": [
      "(D)"
    ],
    "exact_match": 0.0
  },
  {
    "doc_id": 4,
    "doc": {
      "question": "Synthesis of an RNA/DNA hybrid from a single-stranded RNA template requires",
      "subject": "college_biology",
      "choices": [
        "a DNA or RNA primer and reverse transcriptase",
        "a DNA or RNA primer and DNA polymerase",
        "RNase only",
        "reverse transcriptase only"
      ],
      "answer": 0
    },
    "target": "(A)",
    "arguments": [
      [
        "The following are multiple choice questions (with answers) about college biology.\n\nQ: According to the pressure-flow model of movement of phloem contents, photosynthate movement from source to sink is driven by\n(A) an ATP-dependent pressure-flow pump (B) a water-pressure potential gradient (C) transpiration (D) apoplastic diffusion\nA:  (B)\n\nQ: Which of the following represents an accurate statement concerning arthropods?\n(A) They possess an exoskeleton composed primarily of peptidoglycan. (B) They possess an open circulatory system with a dorsal heart. (C) They are members of a biologically unsuccessful phylum incapable of exploiting diverse habitats and nutrition sources. (D) They lack paired, jointed appendages.\nA:  (B)\n\nQ: Which of the following contain DNA sequences required for the segregation of chromosomes in mitosis and meiosis?\n(A) Telomeres (B) Centromeres (C) Nucleosomes (D) Spliceosomes\nA:  (B)\n\nQ: The presence of homologous structures in two different organisms, such as the humerus in the front limb of a human and a bird, indicates that\n(A) the human and bird are polyphyletic species (B) a human's and bird's evolution is convergent (C) the human and bird belong to a clade (D) the human and bird developed by analogy\nA:  (C)\n\nQ: In a given population, 1 out of every 400 people has a cancer caused by a completely recessive allele, b. Assuming the population is in Hardy-Weinberg equilibrium, which of the following is the expected proportion of individuals who carry the b allele but are not expected to develop the cancer?\n(A) 1/400 (B) 19/400 (C) 20/400 (D) 38/400\nA:  (D)\n\nQ: Synthesis of an RNA/DNA hybrid from a single-stranded RNA template requires\n(A) a DNA or RNA primer and reverse transcriptase (B) a DNA or RNA primer and DNA polymerase (C) RNase only (D) reverse transcriptase only\nA: ",
        {
          "until": [
            "</s>"
          ]
        }
      ]
    ],
    "resps": [
      [
        "(D)"
      ]
    ],
    "filtered_resps": [
      "(D)"
    ],
    "exact_match": 0.0
  },
  {
    "doc_id": 12,
    "doc": {
      "question": "In Sweden, the red fox (Vulpes vulpes) severely limits populations of its prey, including hares. However, red fox populations are sometimes attacked by a fatal parasite, the mange mite. As mite population sizes increase at a given site, how are hare and fox populations most likely to respond at the same site? (Assume that hares have no major predators at this site other than foxes.)",
      "subject": "college_biology",
      "choices": [
        "Both fox and hare populations will decrease.",
        "Both fox and hare populations will increase.",
        "Fox populations will decrease and hare populations will increase.",
        "Fox populations will increase and hare populations will decrease."
      ],
      "answer": 2
    },
    "target": "(C)",
    "arguments": [
      [
        "The following are multiple choice questions (with answers) about college biology.\n\nQ: Which of the following represents an accurate statement concerning arthropods?\n(A) They possess an exoskeleton composed primarily of peptidoglycan. (B) They possess an open circulatory system with a dorsal heart. (C) They are members of a biologically unsuccessful phylum incapable of exploiting diverse habitats and nutrition sources. (D) They lack paired, jointed appendages.\nA:  (B)\n\nQ: Which of the following contain DNA sequences required for the segregation of chromosomes in mitosis and meiosis?\n(A) Telomeres (B) Centromeres (C) Nucleosomes (D) Spliceosomes\nA:  (B)\n\nQ: In a given population, 1 out of every 400 people has a cancer caused by a completely recessive allele, b. Assuming the population is in Hardy-Weinberg equilibrium, which of the following is the expected proportion of individuals who carry the b allele but are not expected to develop the cancer?\n(A) 1/400 (B) 19/400 (C) 20/400 (D) 38/400\nA:  (D)\n\nQ: According to the pressure-flow model of movement of phloem contents, photosynthate movement from source to sink is driven by\n(A) an ATP-dependent pressure-flow pump (B) a water-pressure potential gradient (C) transpiration (D) apoplastic diffusion\nA:  (B)\n\nQ: The presence of homologous structures in two different organisms, such as the humerus in the front limb of a human and a bird, indicates that\n(A) the human and bird are polyphyletic species (B) a human's and bird's evolution is convergent (C) the human and bird belong to a clade (D) the human and bird developed by analogy\nA:  (C)\n\nQ: In Sweden, the red fox (Vulpes vulpes) severely limits populations of its prey, including hares. However, red fox populations are sometimes attacked by a fatal parasite, the mange mite. As mite population sizes increase at a given site, how are hare and fox populations most likely to respond at the same site? (Assume that hares have no major predators at this site other than foxes.)\n(A) Both fox and hare populations will decrease. (B) Both fox and hare populations will increase. (C) Fox populations will decrease and hare populations will increase. (D) Fox populations will increase and hare populations will decrease.\nA: ",
        {
          "until": [
            "</s>"
          ]
        }
      ]
    ],
    "resps": [
      [
        "(C)"
      ]
    ],
    "filtered_resps": [
      "(C)"
    ],
    "exact_match": 1.0
  },
  {
    "doc_id": 20,
    "doc": {
      "question": "Which of the following best explains why enzymes are effective in facilitating chemical reactions?",
      "subject": "college_biology",
      "choices": [
        "They raise the temperature of the reaction mixture, thereby speeding up the conversion of reactants to products.",
        "They alter the equilibrium constant of a reaction (K_eq) so that more reactant can be converted to product.",
        "They increase the maximal rate of the chemical reaction (V_max).",
        "They lower the activation energy, thereby speeding up the conversion of reactants to products."
      ],
      "answer": 3
    },
    "target": "(D)",
    "arguments": [
      [
        "The following are multiple choice questions (with answers) about college biology.\n\nQ: Which of the following represents an accurate statement concerning arthropods?\n(A) They possess an exoskeleton composed primarily of peptidoglycan. (B) They possess an open circulatory system with a dorsal heart. (C) They are members of a biologically unsuccessful phylum incapable of exploiting diverse habitats and nutrition sources. (D) They lack paired, jointed appendages.\nA:  (B)\n\nQ: Which of the following contain DNA sequences required for the segregation of chromosomes in mitosis and meiosis?\n(A) Telomeres (B) Centromeres (C) Nucleosomes (D) Spliceosomes\nA:  (B)\n\nQ: In a given population, 1 out of every 400 people has a cancer caused by a completely recessive allele, b. Assuming the population is in Hardy-Weinberg equilibrium, which of the following is the expected proportion of individuals who carry the b allele but are not expected to develop the cancer?\n(A) 1/400 (B) 19/400 (C) 20/400 (D) 38/400\nA:  (D)\n\nQ: The presence of homologous structures in two different organisms, such as the humerus in the front limb of a human and a bird, indicates that\n(A) the human and bird are polyphyletic species (B) a human's and bird's evolution is convergent (C) the human and bird belong to a clade (D) the human and bird developed by analogy\nA:  (C)\n\nQ: According to the pressure-flow model of movement of phloem contents, photosynthate movement from source to sink is driven by\n(A) an ATP-dependent pressure-flow pump (B) a water-pressure potential gradient (C) transpiration (D) apoplastic diffusion\nA:  (B)\n\nQ: Which of the following best explains why enzymes are effective in facilitating chemical reactions?\n(A) They raise the temperature of the reaction mixture, thereby speeding up the conversion of reactants to products. (B) They alter the equilibrium constant of a reaction (K_eq) so that more reactant can be converted to product. (C) They increase the maximal rate of the chemical reaction (V_max). (D) They lower the activation energy, thereby speeding up the conversion of reactants to products.\nA: ",
        {
          "until": [
            "</s>"
          ]
        }
      ]
    ],
    "resps": [
      [
        "(B)"
      ]
    ],
    "filtered_resps": [
      "(B)"
    ],
    "exact_match": 0.0
  },
  {
    "doc_id": 28,
    "doc": {
      "question": "According to Hamilton\u2019s rule, an altruistic trait can evolve if c < br, where c is the fitness cost of the altruistic behavior to the donor, b is the fitness benefit to the recipient, and r is the",
      "subject": "college_biology",
      "choices": [
        "coefficient of relatedness",
        "frequency of the altruistic allele",
        "inbreeding coefficient",
        "rate of reciprocity"
      ],
      "answer": 0
    },
    "target": "(A)",
    "arguments": [
      [
        "The following are multiple choice questions (with answers) about college biology.\n\nQ: In a given population, 1 out of every 400 people has a cancer caused by a completely recessive allele, b. Assuming the population is in Hardy-Weinberg equilibrium, which of the following is the expected proportion of individuals who carry the b allele but are not expected to develop the cancer?\n(A) 1/400 (B) 19/400 (C) 20/400 (D) 38/400\nA:  (D)\n\nQ: Which of the following represents an accurate statement concerning arthropods?\n(A) They possess an exoskeleton composed primarily of peptidoglycan. (B) They possess an open circulatory system with a dorsal heart. (C) They are members of a biologically unsuccessful phylum incapable of exploiting diverse habitats and nutrition sources. (D) They lack paired, jointed appendages.\nA:  (B)\n\nQ: According to the pressure-flow model of movement of phloem contents, photosynthate movement from source to sink is driven by\n(A) an ATP-dependent pressure-flow pump (B) a water-pressure potential gradient (C) transpiration (D) apoplastic diffusion\nA:  (B)\n\nQ: The presence of homologous structures in two different organisms, such as the humerus in the front limb of a human and a bird, indicates that\n(A) the human and bird are polyphyletic species (B) a human's and bird's evolution is convergent (C) the human and bird belong to a clade (D) the human and bird developed by analogy\nA:  (C)\n\nQ: Which of the following contain DNA sequences required for the segregation of chromosomes in mitosis and meiosis?\n(A) Telomeres (B) Centromeres (C) Nucleosomes (D) Spliceosomes\nA:  (B)\n\nQ: According to Hamilton\u2019s rule, an altruistic trait can evolve if c < br, where c is the fitness cost of the altruistic behavior to the donor, b is the fitness benefit to the recipient, and r is the\n(A) coefficient of relatedness (B) frequency of the altruistic allele (C) inbreeding coefficient (D) rate of reciprocity\nA: ",
        {
          "until": [
            "</s>"
          ]
        }
      ]
    ],
    "resps": [
      [
        "(D)"
      ]
    ],
    "filtered_resps": [
      "(D)"
    ],
    "exact_match": 0.0
  },
  {
    "doc_id": 36,
    "doc": {
      "question": "Which of the following statements concerning a sarcomere of a striated muscle (such as skeletal muscle) is correct?",
      "subject": "college_biology",
      "choices": [
        "During contraction H zones become elongated.",
        "In the relaxed position tropomyosin impedes myosin's access to the binding site of actin.",
        "Each myosin helical tail contains an actinbinding site and an ATP-hydrolyzing site.",
        "The proteins troponin and tropomyosin constitute the thick and thin filaments, respectively."
      ],
      "answer": 1
    },
    "target": "(B)",
    "arguments": [
      [
        "The following are multiple choice questions (with answers) about college biology.\n\nQ: Which of the following contain DNA sequences required for the segregation of chromosomes in mitosis and meiosis?\n(A) Telomeres (B) Centromeres (C) Nucleosomes (D) Spliceosomes\nA:  (B)\n\nQ: According to the pressure-flow model of movement of phloem contents, photosynthate movement from source to sink is driven by\n(A) an ATP-dependent pressure-flow pump (B) a water-pressure potential gradient (C) transpiration (D) apoplastic diffusion\nA:  (B)\n\nQ: Which of the following represents an accurate statement concerning arthropods?\n(A) They possess an exoskeleton composed primarily of peptidoglycan. (B) They possess an open circulatory system with a dorsal heart. (C) They are members of a biologically unsuccessful phylum incapable of exploiting diverse habitats and nutrition sources. (D) They lack paired, jointed appendages.\nA:  (B)\n\nQ: The presence of homologous structures in two different organisms, such as the humerus in the front limb of a human and a bird, indicates that\n(A) the human and bird are polyphyletic species (B) a human's and bird's evolution is convergent (C) the human and bird belong to a clade (D) the human and bird developed by analogy\nA:  (C)\n\nQ: In a given population, 1 out of every 400 people has a cancer caused by a completely recessive allele, b. Assuming the population is in Hardy-Weinberg equilibrium, which of the following is the expected proportion of individuals who carry the b allele but are not expected to develop the cancer?\n(A) 1/400 (B) 19/400 (C) 20/400 (D) 38/400\nA:  (D)\n\nQ: Which of the following statements concerning a sarcomere of a striated muscle (such as skeletal muscle) is correct?\n(A) During contraction H zones become elongated. (B) In the relaxed position tropomyosin impedes myosin's access to the binding site of actin. (C) Each myosin helical tail contains an actinbinding site and an ATP-hydrolyzing site. (D) The proteins troponin and tropomyosin constitute the thick and thin filaments, respectively.\nA: ",
        {
          "until": [
            "</s>"
          ]
        }
      ]
    ],
    "resps": [
      [
        "(D)"
      ]
    ],
    "filtered_resps": [
      "(D)"
    ],
    "exact_match": 0.0
  },
  {
    "doc_id": 44,
    "doc": {
      "question": "Natural enemies have been implicated as a strong selective force for all of the following EXCEPT",
      "subject": "college_biology",
      "choices": [
        "aposematic coloration",
        "chemical defenses",
        "masting (synchronous fruiting)",
        "lekking behavior"
      ],
      "answer": 3
    },
    "target": "(D)",
    "arguments": [
      [
        "The following are multiple choice questions (with answers) about college biology.\n\nQ: Which of the following represents an accurate statement concerning arthropods?\n(A) They possess an exoskeleton composed primarily of peptidoglycan. (B) They possess an open circulatory system with a dorsal heart. (C) They are members of a biologically unsuccessful phylum incapable of exploiting diverse habitats and nutrition sources. (D) They lack paired, jointed appendages.\nA:  (B)\n\nQ: Which of the following contain DNA sequences required for the segregation of chromosomes in mitosis and meiosis?\n(A) Telomeres (B) Centromeres (C) Nucleosomes (D) Spliceosomes\nA:  (B)\n\nQ: The presence of homologous structures in two different organisms, such as the humerus in the front limb of a human and a bird, indicates that\n(A) the human and bird are polyphyletic species (B) a human's and bird's evolution is convergent (C) the human and bird belong to a clade (D) the human and bird developed by analogy\nA:  (C)\n\nQ: According to the pressure-flow model of movement of phloem contents, photosynthate movement from source to sink is driven by\n(A) an ATP-dependent pressure-flow pump (B) a water-pressure potential gradient (C) transpiration (D) apoplastic diffusion\nA:  (B)\n\nQ: In a given population, 1 out of every 400 people has a cancer caused by a completely recessive allele, b. Assuming the population is in Hardy-Weinberg equilibrium, which of the following is the expected proportion of individuals who carry the b allele but are not expected to develop the cancer?\n(A) 1/400 (B) 19/400 (C) 20/400 (D) 38/400\nA:  (D)\n\nQ: Natural enemies have been implicated as a strong selective force for all of the following EXCEPT\n(A) aposematic coloration (B) chemical defenses (C) masting (synchronous fruiting) (D) lekking behavior\nA: ",
        {
          "until": [
            "</s>"
          ]
        }
      ]
    ],
    "resps": [
      [
        "(D)"
      ]
    ],
    "filtered_resps": [
      "(D)"
    ],
    "exact_match": 1.0
  },
  {
    "doc_id": 52,
    "doc": {
      "question": "All of the following statements about plant embryogenesis are correct EXCEPT:",
      "subject": "college_biology",
      "choices": [
        "The suspensor is derived from the basal cell.",
        "Cotyledons are derived from the apical cell.",
        "Shoot apical meristem formation occurs after seed formation.",
        "Precursors of all three plant tissue systems are formed during embryogenesis."
      ],
      "answer": 2
    },
    "target": "(C)",
    "arguments": [
      [
        "The following are multiple choice questions (with answers) about college biology.\n\nQ: Which of the following contain DNA sequences required for the segregation of chromosomes in mitosis and meiosis?\n(A) Telomeres (B) Centromeres (C) Nucleosomes (D) Spliceosomes\nA:  (B)\n\nQ: Which of the following represents an accurate statement concerning arthropods?\n(A) They possess an exoskeleton composed primarily of peptidoglycan. (B) They possess an open circulatory system with a dorsal heart. (C) They are members of a biologically unsuccessful phylum incapable of exploiting diverse habitats and nutrition sources. (D) They lack paired, jointed appendages.\nA:  (B)\n\nQ: The presence of homologous structures in two different organisms, such as the humerus in the front limb of a human and a bird, indicates that\n(A) the human and bird are polyphyletic species (B) a human's and bird's evolution is convergent (C) the human and bird belong to a clade (D) the human and bird developed by analogy\nA:  (C)\n\nQ: In a given population, 1 out of every 400 people has a cancer caused by a completely recessive allele, b. Assuming the population is in Hardy-Weinberg equilibrium, which of the following is the expected proportion of individuals who carry the b allele but are not expected to develop the cancer?\n(A) 1/400 (B) 19/400 (C) 20/400 (D) 38/400\nA:  (D)\n\nQ: According to the pressure-flow model of movement of phloem contents, photosynthate movement from source to sink is driven by\n(A) an ATP-dependent pressure-flow pump (B) a water-pressure potential gradient (C) transpiration (D) apoplastic diffusion\nA:  (B)\n\nQ: All of the following statements about plant embryogenesis are correct EXCEPT:\n(A) The suspensor is derived from the basal cell. (B) Cotyledons are derived from the apical cell. (C) Shoot apical meristem formation occurs after seed formation. (D) Precursors of all three plant tissue systems are formed during embryogenesis.\nA: ",
        {
          "until": [
            "</s>"
          ]
        }
      ]
    ],
    "resps": [
      [
        "(D)"
      ]
    ],
    "filtered_resps": [
      "(D)"
    ],
    "exact_match": 0.0
  },
  {
    "doc_id": 60,
    "doc": {
      "question": "In the formation of the earliest cells, which of the following components most likely arose first?",
      "subject": "college_biology",
      "choices": [
        "Nucleus",
        "Plasma membrane",
        "Mitochondrion",
        "Flagellum"
      ],
      "answer": 1
    },
    "target": "(B)",
    "arguments": [
      [
        "The following are multiple choice questions (with answers) about college biology.\n\nQ: The presence of homologous structures in two different organisms, such as the humerus in the front limb of a human and a bird, indicates that\n(A) the human and bird are polyphyletic species (B) a human's and bird's evolution is convergent (C) the human and bird belong to a clade (D) the human and bird developed by analogy\nA:  (C)\n\nQ: Which of the following contain DNA sequences required for the segregation of chromosomes in mitosis and meiosis?\n(A) Telomeres (B) Centromeres (C) Nucleosomes (D) Spliceosomes\nA:  (B)\n\nQ: Which of the following represents an accurate statement concerning arthropods?\n(A) They possess an exoskeleton composed primarily of peptidoglycan. (B) They possess an open circulatory system with a dorsal heart. (C) They are members of a biologically unsuccessful phylum incapable of exploiting diverse habitats and nutrition sources. (D) They lack paired, jointed appendages.\nA:  (B)\n\nQ: According to the pressure-flow model of movement of phloem contents, photosynthate movement from source to sink is driven by\n(A) an ATP-dependent pressure-flow pump (B) a water-pressure potential gradient (C) transpiration (D) apoplastic diffusion\nA:  (B)\n\nQ: In a given population, 1 out of every 400 people has a cancer caused by a completely recessive allele, b. Assuming the population is in Hardy-Weinberg equilibrium, which of the following is the expected proportion of individuals who carry the b allele but are not expected to develop the cancer?\n(A) 1/400 (B) 19/400 (C) 20/400 (D) 38/400\nA:  (D)\n\nQ: In the formation of the earliest cells, which of the following components most likely arose first?\n(A) Nucleus (B) Plasma membrane (C) Mitochondrion (D) Flagellum\nA: ",
        {
          "until": [
            "</s>"
          ]
        }
      ]
    ],
    "resps": [
      [
        "(A)"
      ]
    ],
    "filtered_resps": [
      "(A)"
    ],
    "exact_match": 0.0
  },
  {
    "doc_id": 68,
    "doc": {
      "question": "Which of the following characteristics distinguishes angiosperms from gymnosperms?",
      "subject": "college_biology",
      "choices": [
        "Perennial growth",
        "True roots",
        "Apical growth",
        "Seeds enclosed in ovaries"
      ],
      "answer": 3
    },
    "target": "(D)",
    "arguments": [
      [
        "The following are multiple choice questions (with answers) about college biology.\n\nQ: Which of the following contain DNA sequences required for the segregation of chromosomes in mitosis and meiosis?\n(A) Telomeres (B) Centromeres (C) Nucleosomes (D) Spliceosomes\nA:  (B)\n\nQ: Which of the following represents an accurate statement concerning arthropods?\n(A) They possess an exoskeleton composed primarily of peptidoglycan. (B) They possess an open circulatory system with a dorsal heart. (C) They are members of a biologically unsuccessful phylum incapable of exploiting diverse habitats and nutrition sources. (D) They lack paired, jointed appendages.\nA:  (B)\n\nQ: The presence of homologous structures in two different organisms, such as the humerus in the front limb of a human and a bird, indicates that\n(A) the human and bird are polyphyletic species (B) a human's and bird's evolution is convergent (C) the human and bird belong to a clade (D) the human and bird developed by analogy\nA:  (C)\n\nQ: According to the pressure-flow model of movement of phloem contents, photosynthate movement from source to sink is driven by\n(A) an ATP-dependent pressure-flow pump (B) a water-pressure potential gradient (C) transpiration (D) apoplastic diffusion\nA:  (B)\n\nQ: In a given population, 1 out of every 400 people has a cancer caused by a completely recessive allele, b. Assuming the population is in Hardy-Weinberg equilibrium, which of the following is the expected proportion of individuals who carry the b allele but are not expected to develop the cancer?\n(A) 1/400 (B) 19/400 (C) 20/400 (D) 38/400\nA:  (D)\n\nQ: Which of the following characteristics distinguishes angiosperms from gymnosperms?\n(A) Perennial growth (B) True roots (C) Apical growth (D) Seeds enclosed in ovaries\nA: ",
        {
          "until": [
            "</s>"
          ]
        }
      ]
    ],
    "resps": [
      [
        "(C)"
      ]
    ],
    "filtered_resps": [
      "(C)"
    ],
    "exact_match": 0.0
  },
  {
    "doc_id": 76,
    "doc": {
      "question": "The section of chromosome that serves as the site of attachment by the mitotic spindle during cell division is the",
      "subject": "college_biology",
      "choices": [
        "chromatophore",
        "chromomere",
        "kinetochore",
        "centriole"
      ],
      "answer": 2
    },
    "target": "(C)",
    "arguments": [
      [
        "The following are multiple choice questions (with answers) about college biology.\n\nQ: The presence of homologous structures in two different organisms, such as the humerus in the front limb of a human and a bird, indicates that\n(A) the human and bird are polyphyletic species (B) a human's and bird's evolution is convergent (C) the human and bird belong to a clade (D) the human and bird developed by analogy\nA:  (C)\n\nQ: In a given population, 1 out of every 400 people has a cancer caused by a completely recessive allele, b. Assuming the population is in Hardy-Weinberg equilibrium, which of the following is the expected proportion of individuals who carry the b allele but are not expected to develop the cancer?\n(A) 1/400 (B) 19/400 (C) 20/400 (D) 38/400\nA:  (D)\n\nQ: Which of the following contain DNA sequences required for the segregation of chromosomes in mitosis and meiosis?\n(A) Telomeres (B) Centromeres (C) Nucleosomes (D) Spliceosomes\nA:  (B)\n\nQ: According to the pressure-flow model of movement of phloem contents, photosynthate movement from source to sink is driven by\n(A) an ATP-dependent pressure-flow pump (B) a water-pressure potential gradient (C) transpiration (D) apoplastic diffusion\nA:  (B)\n\nQ: Which of the following represents an accurate statement concerning arthropods?\n(A) They possess an exoskeleton composed primarily of peptidoglycan. (B) They possess an open circulatory system with a dorsal heart. (C) They are members of a biologically unsuccessful phylum incapable of exploiting diverse habitats and nutrition sources. (D) They lack paired, jointed appendages.\nA:  (B)\n\nQ: The section of chromosome that serves as the site of attachment by the mitotic spindle during cell division is the\n(A) chromatophore (B) chromomere (C) kinetochore (D) centriole\nA: ",
        {
          "until": [
            "</s>"
          ]
        }
      ]
    ],
    "resps": [
      [
        "(B)"
      ]
    ],
    "filtered_resps": [
      "(B)"
    ],
    "exact_match": 0.0
  },
  {
    "doc_id": 84,
    "doc": {
      "question": "Which is a characteristic unique to angiosperms?",
      "subject": "college_biology",
      "choices": [
        "Wind-borne pollen",
        "A dominant sporophyte life cycle",
        "Alteration of generations",
        "Double fertilization"
      ],
      "answer": 3
    },
    "target": "(D)",
    "arguments": [
      [
        "The following are multiple choice questions (with answers) about college biology.\n\nQ: In a given population, 1 out of every 400 people has a cancer caused by a completely recessive allele, b. Assuming the population is in Hardy-Weinberg equilibrium, which of the following is the expected proportion of individuals who carry the b allele but are not expected to develop the cancer?\n(A) 1/400 (B) 19/400 (C) 20/400 (D) 38/400\nA:  (D)\n\nQ: Which of the following represents an accurate statement concerning arthropods?\n(A) They possess an exoskeleton composed primarily of peptidoglycan. (B) They possess an open circulatory system with a dorsal heart. (C) They are members of a biologically unsuccessful phylum incapable of exploiting diverse habitats and nutrition sources. (D) They lack paired, jointed appendages.\nA:  (B)\n\nQ: According to the pressure-flow model of movement of phloem contents, photosynthate movement from source to sink is driven by\n(A) an ATP-dependent pressure-flow pump (B) a water-pressure potential gradient (C) transpiration (D) apoplastic diffusion\nA:  (B)\n\nQ: Which of the following contain DNA sequences required for the segregation of chromosomes in mitosis and meiosis?\n(A) Telomeres (B) Centromeres (C) Nucleosomes (D) Spliceosomes\nA:  (B)\n\nQ: The presence of homologous structures in two different organisms, such as the humerus in the front limb of a human and a bird, indicates that\n(A) the human and bird are polyphyletic species (B) a human's and bird's evolution is convergent (C) the human and bird belong to a clade (D) the human and bird developed by analogy\nA:  (C)\n\nQ: Which is a characteristic unique to angiosperms?\n(A) Wind-borne pollen (B) A dominant sporophyte life cycle (C) Alteration of generations (D) Double fertilization\nA: ",
        {
          "until": [
            "</s>"
          ]
        }
      ]
    ],
    "resps": [
      [
        "(D)"
      ]
    ],
    "filtered_resps": [
      "(D)"
    ],
    "exact_match": 1.0
  },
  {
    "doc_id": 92,
    "doc": {
      "question": "Hardy-Weinberg equilibrium generally assumes all of the following EXCEPT",
      "subject": "college_biology",
      "choices": [
        "a large population",
        "genetic drift",
        "random mating",
        "absence of selection"
      ],
      "answer": 1
    },
    "target": "(B)",
    "arguments": [
      [
        "The following are multiple choice questions (with answers) about college biology.\n\nQ: Which of the following represents an accurate statement concerning arthropods?\n(A) They possess an exoskeleton composed primarily of peptidoglycan. (B) They possess an open circulatory system with a dorsal heart. (C) They are members of a biologically unsuccessful phylum incapable of exploiting diverse habitats and nutrition sources. (D) They lack paired, jointed appendages.\nA:  (B)\n\nQ: In a given population, 1 out of every 400 people has a cancer caused by a completely recessive allele, b. Assuming the population is in Hardy-Weinberg equilibrium, which of the following is the expected proportion of individuals who carry the b allele but are not expected to develop the cancer?\n(A) 1/400 (B) 19/400 (C) 20/400 (D) 38/400\nA:  (D)\n\nQ: Which of the following contain DNA sequences required for the segregation of chromosomes in mitosis and meiosis?\n(A) Telomeres (B) Centromeres (C) Nucleosomes (D) Spliceosomes\nA:  (B)\n\nQ: The presence of homologous structures in two different organisms, such as the humerus in the front limb of a human and a bird, indicates that\n(A) the human and bird are polyphyletic species (B) a human's and bird's evolution is convergent (C) the human and bird belong to a clade (D) the human and bird developed by analogy\nA:  (C)\n\nQ: According to the pressure-flow model of movement of phloem contents, photosynthate movement from source to sink is driven by\n(A) an ATP-dependent pressure-flow pump (B) a water-pressure potential gradient (C) transpiration (D) apoplastic diffusion\nA:  (B)\n\nQ: Hardy-Weinberg equilibrium generally assumes all of the following EXCEPT\n(A) a large population (B) genetic drift (C) random mating (D) absence of selection\nA: ",
        {
          "until": [
            "</s>"
          ]
        }
      ]
    ],
    "resps": [
      [
        "(D)<0x0A>Answer: (D)"
      ]
    ],
    "filtered_resps": [
      "(D)<0x0A>Answer: (D)"
    ],
    "exact_match": 0.0
  },
  {
    "doc_id": 100,
    "doc": {
      "question": "Which of the following statements about mitochondria and chloroplasts is generally true?",
      "subject": "college_biology",
      "choices": [
        "Plants have chloroplasts but no mitochondria; animals have mitochondria but no chloroplasts.",
        "Plants have chloroplasts but no mitochondria; fungi have mitochondria but no chloroplasts.",
        "Plants and fungi have chloroplasts but no mitochondria; animals have only mitochondria.",
        "Plants have both chloroplasts and mitochondria; animals and fungi have only mitochondria."
      ],
      "answer": 3
    },
    "target": "(D)",
    "arguments": [
      [
        "The following are multiple choice questions (with answers) about college biology.\n\nQ: Which of the following represents an accurate statement concerning arthropods?\n(A) They possess an exoskeleton composed primarily of peptidoglycan. (B) They possess an open circulatory system with a dorsal heart. (C) They are members of a biologically unsuccessful phylum incapable of exploiting diverse habitats and nutrition sources. (D) They lack paired, jointed appendages.\nA:  (B)\n\nQ: In a given population, 1 out of every 400 people has a cancer caused by a completely recessive allele, b. Assuming the population is in Hardy-Weinberg equilibrium, which of the following is the expected proportion of individuals who carry the b allele but are not expected to develop the cancer?\n(A) 1/400 (B) 19/400 (C) 20/400 (D) 38/400\nA:  (D)\n\nQ: The presence of homologous structures in two different organisms, such as the humerus in the front limb of a human and a bird, indicates that\n(A) the human and bird are polyphyletic species (B) a human's and bird's evolution is convergent (C) the human and bird belong to a clade (D) the human and bird developed by analogy\nA:  (C)\n\nQ: According to the pressure-flow model of movement of phloem contents, photosynthate movement from source to sink is driven by\n(A) an ATP-dependent pressure-flow pump (B) a water-pressure potential gradient (C) transpiration (D) apoplastic diffusion\nA:  (B)\n\nQ: Which of the following contain DNA sequences required for the segregation of chromosomes in mitosis and meiosis?\n(A) Telomeres (B) Centromeres (C) Nucleosomes (D) Spliceosomes\nA:  (B)\n\nQ: Which of the following statements about mitochondria and chloroplasts is generally true?\n(A) Plants have chloroplasts but no mitochondria; animals have mitochondria but no chloroplasts. (B) Plants have chloroplasts but no mitochondria; fungi have mitochondria but no chloroplasts. (C) Plants and fungi have chloroplasts but no mitochondria; animals have only mitochondria. (D) Plants have both chloroplasts and mitochondria; animals and fungi have only mitochondria.\nA: ",
        {
          "until": [
            "</s>"
          ]
        }
      ]
    ],
    "resps": [
      [
        "(A)"
      ]
    ],
    "filtered_resps": [
      "(A)"
    ],
    "exact_match": 0.0
  },
  {
    "doc_id": 108,
    "doc": {
      "question": "Many marine birds drink seawater yet maintain their internal osmolarity at a constant level that is hypoosmotic to seawater. Which of the following physiological strategies best explains how the birds maintain their tissue osmolarity?",
      "subject": "college_biology",
      "choices": [
        "Marine birds absorb water from the environment through specialized salt-exchange glands and produce large volumes of dilute urine in the kidneys.",
        "Marine birds absorb salts from the environment through specialized salt-exchange glands and produce large volumes of concentrated urine in the kidneys.",
        "Marine birds excrete salts through specialized salt-exchange glands and excrete small volumes of urine.",
        "Marine birds excrete salts and nitrogenous wastes through specialized nasal glands."
      ],
      "answer": 2
    },
    "target": "(C)",
    "arguments": [
      [
        "The following are multiple choice questions (with answers) about college biology.\n\nQ: Which of the following represents an accurate statement concerning arthropods?\n(A) They possess an exoskeleton composed primarily of peptidoglycan. (B) They possess an open circulatory system with a dorsal heart. (C) They are members of a biologically unsuccessful phylum incapable of exploiting diverse habitats and nutrition sources. (D) They lack paired, jointed appendages.\nA:  (B)\n\nQ: According to the pressure-flow model of movement of phloem contents, photosynthate movement from source to sink is driven by\n(A) an ATP-dependent pressure-flow pump (B) a water-pressure potential gradient (C) transpiration (D) apoplastic diffusion\nA:  (B)\n\nQ: In a given population, 1 out of every 400 people has a cancer caused by a completely recessive allele, b. Assuming the population is in Hardy-Weinberg equilibrium, which of the following is the expected proportion of individuals who carry the b allele but are not expected to develop the cancer?\n(A) 1/400 (B) 19/400 (C) 20/400 (D) 38/400\nA:  (D)\n\nQ: Which of the following contain DNA sequences required for the segregation of chromosomes in mitosis and meiosis?\n(A) Telomeres (B) Centromeres (C) Nucleosomes (D) Spliceosomes\nA:  (B)\n\nQ: The presence of homologous structures in two different organisms, such as the humerus in the front limb of a human and a bird, indicates that\n(A) the human and bird are polyphyletic species (B) a human's and bird's evolution is convergent (C) the human and bird belong to a clade (D) the human and bird developed by analogy\nA:  (C)\n\nQ: Many marine birds drink seawater yet maintain their internal osmolarity at a constant level that is hypoosmotic to seawater. Which of the following physiological strategies best explains how the birds maintain their tissue osmolarity?\n(A) Marine birds absorb water from the environment through specialized salt-exchange glands and produce large volumes of dilute urine in the kidneys. (B) Marine birds absorb salts from the environment through specialized salt-exchange glands and produce large volumes of concentrated urine in the kidneys. (C) Marine birds excrete salts through specialized salt-exchange glands and excrete small volumes of urine. (D) Marine birds excrete salts and nitrogenous wastes through specialized nasal glands.\nA: ",
        {
          "until": [
            "</s>"
          ]
        }
      ]
    ],
    "resps": [
      [
        "(B)"
      ]
    ],
    "filtered_resps": [
      "(B)"
    ],
    "exact_match": 0.0
  },
  {
    "doc_id": 116,
    "doc": {
      "question": "The ability of the brain to detect differences in stimulus intensity is best explained by the fact that which of the following varies with the stimulus intensity?",
      "subject": "college_biology",
      "choices": [
        "The amplitude of the action potential",
        "The threshold potential",
        "The number of action potentials per second",
        "The number of synapses crossed"
      ],
      "answer": 2
    },
    "target": "(C)",
    "arguments": [
      [
        "The following are multiple choice questions (with answers) about college biology.\n\nQ: The presence of homologous structures in two different organisms, such as the humerus in the front limb of a human and a bird, indicates that\n(A) the human and bird are polyphyletic species (B) a human's and bird's evolution is convergent (C) the human and bird belong to a clade (D) the human and bird developed by analogy\nA:  (C)\n\nQ: In a given population, 1 out of every 400 people has a cancer caused by a completely recessive allele, b. Assuming the population is in Hardy-Weinberg equilibrium, which of the following is the expected proportion of individuals who carry the b allele but are not expected to develop the cancer?\n(A) 1/400 (B) 19/400 (C) 20/400 (D) 38/400\nA:  (D)\n\nQ: According to the pressure-flow model of movement of phloem contents, photosynthate movement from source to sink is driven by\n(A) an ATP-dependent pressure-flow pump (B) a water-pressure potential gradient (C) transpiration (D) apoplastic diffusion\nA:  (B)\n\nQ: Which of the following represents an accurate statement concerning arthropods?\n(A) They possess an exoskeleton composed primarily of peptidoglycan. (B) They possess an open circulatory system with a dorsal heart. (C) They are members of a biologically unsuccessful phylum incapable of exploiting diverse habitats and nutrition sources. (D) They lack paired, jointed appendages.\nA:  (B)\n\nQ: Which of the following contain DNA sequences required for the segregation of chromosomes in mitosis and meiosis?\n(A) Telomeres (B) Centromeres (C) Nucleosomes (D) Spliceosomes\nA:  (B)\n\nQ: The ability of the brain to detect differences in stimulus intensity is best explained by the fact that which of the following varies with the stimulus intensity?\n(A) The amplitude of the action potential (B) The threshold potential (C) The number of action potentials per second (D) The number of synapses crossed\nA: ",
        {
          "until": [
            "</s>"
          ]
        }
      ]
    ],
    "resps": [
      [
        "(C)"
      ]
    ],
    "filtered_resps": [
      "(C)"
    ],
    "exact_match": 1.0
  },
  {
    "doc_id": 124,
    "doc": {
      "question": "A behavioral response called a fixed action pattern shown by animals",
      "subject": "college_biology",
      "choices": [
        "occurs the second time an animal is exposed to the correct stimulus at the appropriate time in its life",
        "occurs in the absence of sensory feedback",
        "is a motor response which once released may be terminated spontaneously",
        "is triggered by a number of sensory signals in the animal's environment"
      ],
      "answer": 1
    },
    "target": "(B)",
    "arguments": [
      [
        "The following are multiple choice questions (with answers) about college biology.\n\nQ: Which of the following represents an accurate statement concerning arthropods?\n(A) They possess an exoskeleton composed primarily of peptidoglycan. (B) They possess an open circulatory system with a dorsal heart. (C) They are members of a biologically unsuccessful phylum incapable of exploiting diverse habitats and nutrition sources. (D) They lack paired, jointed appendages.\nA:  (B)\n\nQ: According to the pressure-flow model of movement of phloem contents, photosynthate movement from source to sink is driven by\n(A) an ATP-dependent pressure-flow pump (B) a water-pressure potential gradient (C) transpiration (D) apoplastic diffusion\nA:  (B)\n\nQ: In a given population, 1 out of every 400 people has a cancer caused by a completely recessive allele, b. Assuming the population is in Hardy-Weinberg equilibrium, which of the following is the expected proportion of individuals who carry the b allele but are not expected to develop the cancer?\n(A) 1/400 (B) 19/400 (C) 20/400 (D) 38/400\nA:  (D)\n\nQ: The presence of homologous structures in two different organisms, such as the humerus in the front limb of a human and a bird, indicates that\n(A) the human and bird are polyphyletic species (B) a human's and bird's evolution is convergent (C) the human and bird belong to a clade (D) the human and bird developed by analogy\nA:  (C)\n\nQ: Which of the following contain DNA sequences required for the segregation of chromosomes in mitosis and meiosis?\n(A) Telomeres (B) Centromeres (C) Nucleosomes (D) Spliceosomes\nA:  (B)\n\nQ: A behavioral response called a fixed action pattern shown by animals\n(A) occurs the second time an animal is exposed to the correct stimulus at the appropriate time in its life (B) occurs in the absence of sensory feedback (C) is a motor response which once released may be terminated spontaneously (D) is triggered by a number of sensory signals in the animal's environment\nA: ",
        {
          "until": [
            "</s>"
          ]
        }
      ]
    ],
    "resps": [
      [
        "(C)"
      ]
    ],
    "filtered_resps": [
      "(C)"
    ],
    "exact_match": 0.0
  },
  {
    "doc_id": 132,
    "doc": {
      "question": "Mimicry is a strategy that has evolved through natural selection to increase the fitness of organisms to their environment. Which of the following represents a form of Batesian mimicry?",
      "subject": "college_biology",
      "choices": [
        "A type of millipede that is toxic to a toad is permanently avoided by the toad following the toad's initial attempt to consume it.",
        "A moth exhibits false eyes at its tail end in order to disorient predators.",
        "A moth exhibits nearly identical coloration to that of a stinging bee.",
        "A ground-nesting gull chick displays a coloration pattern that is nearly indistinguishable from its surroundings."
      ],
      "answer": 2
    },
    "target": "(C)",
    "arguments": [
      [
        "The following are multiple choice questions (with answers) about college biology.\n\nQ: Which of the following contain DNA sequences required for the segregation of chromosomes in mitosis and meiosis?\n(A) Telomeres (B) Centromeres (C) Nucleosomes (D) Spliceosomes\nA:  (B)\n\nQ: According to the pressure-flow model of movement of phloem contents, photosynthate movement from source to sink is driven by\n(A) an ATP-dependent pressure-flow pump (B) a water-pressure potential gradient (C) transpiration (D) apoplastic diffusion\nA:  (B)\n\nQ: In a given population, 1 out of every 400 people has a cancer caused by a completely recessive allele, b. Assuming the population is in Hardy-Weinberg equilibrium, which of the following is the expected proportion of individuals who carry the b allele but are not expected to develop the cancer?\n(A) 1/400 (B) 19/400 (C) 20/400 (D) 38/400\nA:  (D)\n\nQ: Which of the following represents an accurate statement concerning arthropods?\n(A) They possess an exoskeleton composed primarily of peptidoglycan. (B) They possess an open circulatory system with a dorsal heart. (C) They are members of a biologically unsuccessful phylum incapable of exploiting diverse habitats and nutrition sources. (D) They lack paired, jointed appendages.\nA:  (B)\n\nQ: The presence of homologous structures in two different organisms, such as the humerus in the front limb of a human and a bird, indicates that\n(A) the human and bird are polyphyletic species (B) a human's and bird's evolution is convergent (C) the human and bird belong to a clade (D) the human and bird developed by analogy\nA:  (C)\n\nQ: Mimicry is a strategy that has evolved through natural selection to increase the fitness of organisms to their environment. Which of the following represents a form of Batesian mimicry?\n(A) A type of millipede that is toxic to a toad is permanently avoided by the toad following the toad's initial attempt to consume it. (B) A moth exhibits false eyes at its tail end in order to disorient predators. (C) A moth exhibits nearly identical coloration to that of a stinging bee. (D) A ground-nesting gull chick displays a coloration pattern that is nearly indistinguishable from its surroundings.\nA: ",
        {
          "until": [
            "</s>"
          ]
        }
      ]
    ],
    "resps": [
      [
        "(C)"
      ]
    ],
    "filtered_resps": [
      "(C)"
    ],
    "exact_match": 1.0
  },
  {
    "doc_id": 140,
    "doc": {
      "question": "In fungi, cell walls are reinforced by which of the following?",
      "subject": "college_biology",
      "choices": [
        "Chitin",
        "Silica",
        "Lignin",
        "Collagen fibers"
      ],
      "answer": 0
    },
    "target": "(A)",
    "arguments": [
      [
        "The following are multiple choice questions (with answers) about college biology.\n\nQ: Which of the following contain DNA sequences required for the segregation of chromosomes in mitosis and meiosis?\n(A) Telomeres (B) Centromeres (C) Nucleosomes (D) Spliceosomes\nA:  (B)\n\nQ: In a given population, 1 out of every 400 people has a cancer caused by a completely recessive allele, b. Assuming the population is in Hardy-Weinberg equilibrium, which of the following is the expected proportion of individuals who carry the b allele but are not expected to develop the cancer?\n(A) 1/400 (B) 19/400 (C) 20/400 (D) 38/400\nA:  (D)\n\nQ: According to the pressure-flow model of movement of phloem contents, photosynthate movement from source to sink is driven by\n(A) an ATP-dependent pressure-flow pump (B) a water-pressure potential gradient (C) transpiration (D) apoplastic diffusion\nA:  (B)\n\nQ: The presence of homologous structures in two different organisms, such as the humerus in the front limb of a human and a bird, indicates that\n(A) the human and bird are polyphyletic species (B) a human's and bird's evolution is convergent (C) the human and bird belong to a clade (D) the human and bird developed by analogy\nA:  (C)\n\nQ: Which of the following represents an accurate statement concerning arthropods?\n(A) They possess an exoskeleton composed primarily of peptidoglycan. (B) They possess an open circulatory system with a dorsal heart. (C) They are members of a biologically unsuccessful phylum incapable of exploiting diverse habitats and nutrition sources. (D) They lack paired, jointed appendages.\nA:  (B)\n\nQ: In fungi, cell walls are reinforced by which of the following?\n(A) Chitin (B) Silica (C) Lignin (D) Collagen fibers\nA: ",
        {
          "until": [
            "</s>"
          ]
        }
      ]
    ],
    "resps": [
      [
        "(D)"
      ]
    ],
    "filtered_resps": [
      "(D)"
    ],
    "exact_match": 0.0
  },
  {
    "doc_id": 5,
    "doc": {
      "question": "In order for the Hardy-Weinberg law to operate with respect to a population of organisms, each of the following conditions must be met EXCEPT:",
      "subject": "college_biology",
      "choices": [
        "Genes are exchanged with other populations.",
        "Population size is large.",
        "Natural selection does not take place.",
        "Matings are random."
      ],
      "answer": 0
    },
    "target": "(A)",
    "arguments": [
      [
        "The following are multiple choice questions (with answers) about college biology.\n\nQ: According to the pressure-flow model of movement of phloem contents, photosynthate movement from source to sink is driven by\n(A) an ATP-dependent pressure-flow pump (B) a water-pressure potential gradient (C) transpiration (D) apoplastic diffusion\nA:  (B)\n\nQ: Which of the following represents an accurate statement concerning arthropods?\n(A) They possess an exoskeleton composed primarily of peptidoglycan. (B) They possess an open circulatory system with a dorsal heart. (C) They are members of a biologically unsuccessful phylum incapable of exploiting diverse habitats and nutrition sources. (D) They lack paired, jointed appendages.\nA:  (B)\n\nQ: Which of the following contain DNA sequences required for the segregation of chromosomes in mitosis and meiosis?\n(A) Telomeres (B) Centromeres (C) Nucleosomes (D) Spliceosomes\nA:  (B)\n\nQ: The presence of homologous structures in two different organisms, such as the humerus in the front limb of a human and a bird, indicates that\n(A) the human and bird are polyphyletic species (B) a human's and bird's evolution is convergent (C) the human and bird belong to a clade (D) the human and bird developed by analogy\nA:  (C)\n\nQ: In a given population, 1 out of every 400 people has a cancer caused by a completely recessive allele, b. Assuming the population is in Hardy-Weinberg equilibrium, which of the following is the expected proportion of individuals who carry the b allele but are not expected to develop the cancer?\n(A) 1/400 (B) 19/400 (C) 20/400 (D) 38/400\nA:  (D)\n\nQ: In order for the Hardy-Weinberg law to operate with respect to a population of organisms, each of the following conditions must be met EXCEPT:\n(A) Genes are exchanged with other populations. (B) Population size is large. (C) Natural selection does not take place. (D) Matings are random.\nA: ",
        {
          "until": [
            "</s>"
          ]
        }
      ]
    ],
    "resps": [
      [
        "(C)"
      ]
    ],
    "filtered_resps": [
      "(C)"
    ],
    "exact_match": 0.0
  },
  {
    "doc_id": 13,
    "doc": {
      "question": "A cell nucleus contains which of the following?\nI. DNA\nII. Protein\nIII. RNA",
      "subject": "college_biology",
      "choices": [
        "I only",
        "II only",
        "III only",
        "I, II, and III"
      ],
      "answer": 3
    },
    "target": "(D)",
    "arguments": [
      [
        "The following are multiple choice questions (with answers) about college biology.\n\nQ: Which of the following represents an accurate statement concerning arthropods?\n(A) They possess an exoskeleton composed primarily of peptidoglycan. (B) They possess an open circulatory system with a dorsal heart. (C) They are members of a biologically unsuccessful phylum incapable of exploiting diverse habitats and nutrition sources. (D) They lack paired, jointed appendages.\nA:  (B)\n\nQ: Which of the following contain DNA sequences required for the segregation of chromosomes in mitosis and meiosis?\n(A) Telomeres (B) Centromeres (C) Nucleosomes (D) Spliceosomes\nA:  (B)\n\nQ: In a given population, 1 out of every 400 people has a cancer caused by a completely recessive allele, b. Assuming the population is in Hardy-Weinberg equilibrium, which of the following is the expected proportion of individuals who carry the b allele but are not expected to develop the cancer?\n(A) 1/400 (B) 19/400 (C) 20/400 (D) 38/400\nA:  (D)\n\nQ: According to the pressure-flow model of movement of phloem contents, photosynthate movement from source to sink is driven by\n(A) an ATP-dependent pressure-flow pump (B) a water-pressure potential gradient (C) transpiration (D) apoplastic diffusion\nA:  (B)\n\nQ: The presence of homologous structures in two different organisms, such as the humerus in the front limb of a human and a bird, indicates that\n(A) the human and bird are polyphyletic species (B) a human's and bird's evolution is convergent (C) the human and bird belong to a clade (D) the human and bird developed by analogy\nA:  (C)\n\nQ: A cell nucleus contains which of the following?\nI. DNA\nII. Protein\nIII. RNA\n(A) I only (B) II only (C) III only (D) I, II, and III\nA: ",
        {
          "until": [
            "</s>"
          ]
        }
      ]
    ],
    "resps": [
      [
        "(D)"
      ]
    ],
    "filtered_resps": [
      "(D)"
    ],
    "exact_match": 1.0
  },
  {
    "doc_id": 21,
    "doc": {
      "question": "In the growth of a population, the point at which natality and mortality rates are equal to one another is referred to as",
      "subject": "college_biology",
      "choices": [
        "a population crash",
        "a population explosion",
        "zero population growth",
        "exponential growth"
      ],
      "answer": 2
    },
    "target": "(C)",
    "arguments": [
      [
        "The following are multiple choice questions (with answers) about college biology.\n\nQ: Which of the following represents an accurate statement concerning arthropods?\n(A) They possess an exoskeleton composed primarily of peptidoglycan. (B) They possess an open circulatory system with a dorsal heart. (C) They are members of a biologically unsuccessful phylum incapable of exploiting diverse habitats and nutrition sources. (D) They lack paired, jointed appendages.\nA:  (B)\n\nQ: Which of the following contain DNA sequences required for the segregation of chromosomes in mitosis and meiosis?\n(A) Telomeres (B) Centromeres (C) Nucleosomes (D) Spliceosomes\nA:  (B)\n\nQ: In a given population, 1 out of every 400 people has a cancer caused by a completely recessive allele, b. Assuming the population is in Hardy-Weinberg equilibrium, which of the following is the expected proportion of individuals who carry the b allele but are not expected to develop the cancer?\n(A) 1/400 (B) 19/400 (C) 20/400 (D) 38/400\nA:  (D)\n\nQ: The presence of homologous structures in two different organisms, such as the humerus in the front limb of a human and a bird, indicates that\n(A) the human and bird are polyphyletic species (B) a human's and bird's evolution is convergent (C) the human and bird belong to a clade (D) the human and bird developed by analogy\nA:  (C)\n\nQ: According to the pressure-flow model of movement of phloem contents, photosynthate movement from source to sink is driven by\n(A) an ATP-dependent pressure-flow pump (B) a water-pressure potential gradient (C) transpiration (D) apoplastic diffusion\nA:  (B)\n\nQ: In the growth of a population, the point at which natality and mortality rates are equal to one another is referred to as\n(A) a population crash (B) a population explosion (C) zero population growth (D) exponential growth\nA: ",
        {
          "until": [
            "</s>"
          ]
        }
      ]
    ],
    "resps": [
      [
        "(D)"
      ]
    ],
    "filtered_resps": [
      "(D)"
    ],
    "exact_match": 0.0
  },
  {
    "doc_id": 29,
    "doc": {
      "question": "Adaptations of plants to minimize water loss in environments with high temperatures include which of the following?",
      "subject": "college_biology",
      "choices": [
        "Numerous stomata",
        "Thin cuticles",
        "Spines instead of leaves",
        "Large surface-to-volume ratios"
      ],
      "answer": 2
    },
    "target": "(C)",
    "arguments": [
      [
        "The following are multiple choice questions (with answers) about college biology.\n\nQ: In a given population, 1 out of every 400 people has a cancer caused by a completely recessive allele, b. Assuming the population is in Hardy-Weinberg equilibrium, which of the following is the expected proportion of individuals who carry the b allele but are not expected to develop the cancer?\n(A) 1/400 (B) 19/400 (C) 20/400 (D) 38/400\nA:  (D)\n\nQ: Which of the following represents an accurate statement concerning arthropods?\n(A) They possess an exoskeleton composed primarily of peptidoglycan. (B) They possess an open circulatory system with a dorsal heart. (C) They are members of a biologically unsuccessful phylum incapable of exploiting diverse habitats and nutrition sources. (D) They lack paired, jointed appendages.\nA:  (B)\n\nQ: According to the pressure-flow model of movement of phloem contents, photosynthate movement from source to sink is driven by\n(A) an ATP-dependent pressure-flow pump (B) a water-pressure potential gradient (C) transpiration (D) apoplastic diffusion\nA:  (B)\n\nQ: The presence of homologous structures in two different organisms, such as the humerus in the front limb of a human and a bird, indicates that\n(A) the human and bird are polyphyletic species (B) a human's and bird's evolution is convergent (C) the human and bird belong to a clade (D) the human and bird developed by analogy\nA:  (C)\n\nQ: Which of the following contain DNA sequences required for the segregation of chromosomes in mitosis and meiosis?\n(A) Telomeres (B) Centromeres (C) Nucleosomes (D) Spliceosomes\nA:  (B)\n\nQ: Adaptations of plants to minimize water loss in environments with high temperatures include which of the following?\n(A) Numerous stomata (B) Thin cuticles (C) Spines instead of leaves (D) Large surface-to-volume ratios\nA: ",
        {
          "until": [
            "</s>"
          ]
        }
      ]
    ],
    "resps": [
      [
        "(D)"
      ]
    ],
    "filtered_resps": [
      "(D)"
    ],
    "exact_match": 0.0
  },
  {
    "doc_id": 37,
    "doc": {
      "question": "Aggressive ants live in the swollen thorns of a small tropical tree and feed on oil-rich bodies that the tree produces at the tips of its leaflets. Which of the following experiments best tests the hypothesis that ants defend the plant by either killing or chasing away leaf-feeding insects?",
      "subject": "college_biology",
      "choices": [
        "Remove ants and measure subsequent leaf damage.",
        "Remove oil-rich bodies and measure subsequent ant density.",
        "Remove the thorns and measure subsequent density of ants.",
        "Remove leaf-feeding insects and measure subsequent ant density."
      ],
      "answer": 0
    },
    "target": "(A)",
    "arguments": [
      [
        "The following are multiple choice questions (with answers) about college biology.\n\nQ: Which of the following contain DNA sequences required for the segregation of chromosomes in mitosis and meiosis?\n(A) Telomeres (B) Centromeres (C) Nucleosomes (D) Spliceosomes\nA:  (B)\n\nQ: According to the pressure-flow model of movement of phloem contents, photosynthate movement from source to sink is driven by\n(A) an ATP-dependent pressure-flow pump (B) a water-pressure potential gradient (C) transpiration (D) apoplastic diffusion\nA:  (B)\n\nQ: Which of the following represents an accurate statement concerning arthropods?\n(A) They possess an exoskeleton composed primarily of peptidoglycan. (B) They possess an open circulatory system with a dorsal heart. (C) They are members of a biologically unsuccessful phylum incapable of exploiting diverse habitats and nutrition sources. (D) They lack paired, jointed appendages.\nA:  (B)\n\nQ: The presence of homologous structures in two different organisms, such as the humerus in the front limb of a human and a bird, indicates that\n(A) the human and bird are polyphyletic species (B) a human's and bird's evolution is convergent (C) the human and bird belong to a clade (D) the human and bird developed by analogy\nA:  (C)\n\nQ: In a given population, 1 out of every 400 people has a cancer caused by a completely recessive allele, b. Assuming the population is in Hardy-Weinberg equilibrium, which of the following is the expected proportion of individuals who carry the b allele but are not expected to develop the cancer?\n(A) 1/400 (B) 19/400 (C) 20/400 (D) 38/400\nA:  (D)\n\nQ: Aggressive ants live in the swollen thorns of a small tropical tree and feed on oil-rich bodies that the tree produces at the tips of its leaflets. Which of the following experiments best tests the hypothesis that ants defend the plant by either killing or chasing away leaf-feeding insects?\n(A) Remove ants and measure subsequent leaf damage. (B) Remove oil-rich bodies and measure subsequent ant density. (C) Remove the thorns and measure subsequent density of ants. (D) Remove leaf-feeding insects and measure subsequent ant density.\nA: ",
        {
          "until": [
            "</s>"
          ]
        }
      ]
    ],
    "resps": [
      [
        "(D)"
      ]
    ],
    "filtered_resps": [
      "(D)"
    ],
    "exact_match": 0.0
  },
  {
    "doc_id": 45,
    "doc": {
      "question": "Which of the following is NOT a characteristic of introns?",
      "subject": "college_biology",
      "choices": [
        "They occur only in eukaryotes.",
        "They represent noncoding regions.",
        "They are found interspersed with exons on a region of DNA that codes for a polypeptide chain.",
        "They are excised from the primary transcript before it gains a 5' cap and a 3' poly(A)tail."
      ],
      "answer": 3
    },
    "target": "(D)",
    "arguments": [
      [
        "The following are multiple choice questions (with answers) about college biology.\n\nQ: Which of the following represents an accurate statement concerning arthropods?\n(A) They possess an exoskeleton composed primarily of peptidoglycan. (B) They possess an open circulatory system with a dorsal heart. (C) They are members of a biologically unsuccessful phylum incapable of exploiting diverse habitats and nutrition sources. (D) They lack paired, jointed appendages.\nA:  (B)\n\nQ: Which of the following contain DNA sequences required for the segregation of chromosomes in mitosis and meiosis?\n(A) Telomeres (B) Centromeres (C) Nucleosomes (D) Spliceosomes\nA:  (B)\n\nQ: The presence of homologous structures in two different organisms, such as the humerus in the front limb of a human and a bird, indicates that\n(A) the human and bird are polyphyletic species (B) a human's and bird's evolution is convergent (C) the human and bird belong to a clade (D) the human and bird developed by analogy\nA:  (C)\n\nQ: According to the pressure-flow model of movement of phloem contents, photosynthate movement from source to sink is driven by\n(A) an ATP-dependent pressure-flow pump (B) a water-pressure potential gradient (C) transpiration (D) apoplastic diffusion\nA:  (B)\n\nQ: In a given population, 1 out of every 400 people has a cancer caused by a completely recessive allele, b. Assuming the population is in Hardy-Weinberg equilibrium, which of the following is the expected proportion of individuals who carry the b allele but are not expected to develop the cancer?\n(A) 1/400 (B) 19/400 (C) 20/400 (D) 38/400\nA:  (D)\n\nQ: Which of the following is NOT a characteristic of introns?\n(A) They occur only in eukaryotes. (B) They represent noncoding regions. (C) They are found interspersed with exons on a region of DNA that codes for a polypeptide chain. (D) They are excised from the primary transcript before it gains a 5' cap and a 3' poly(A)tail.\nA: ",
        {
          "until": [
            "</s>"
          ]
        }
      ]
    ],
    "resps": [
      [
        "(B)"
      ]
    ],
    "filtered_resps": [
      "(B)"
    ],
    "exact_match": 0.0
  },
  {
    "doc_id": 53,
    "doc": {
      "question": "Mouse sperm contain receptor proteins that bind to a glycoprotein (ZP3) in the zona pellucida of mouse eggs. Binding of ZP3 receptors to ZP3 initiates the sperm\u2019s acrosomal reaction. All of the following experimental observations would be expected EXCEPT:",
      "subject": "college_biology",
      "choices": [
        "Injecting eggs with antibodies that bind to ZP3 blocks in vitro fertilization.",
        "Incubating sperm with purified ZP3 prior to mixing sperm and eggs blocks in vitro fertilization.",
        "Incubating eggs with antibodies that bind to ZP3 blocks in vitro fertilization.",
        "Coating synthetic beads with a different glycoprotein, ZP2, fails to lead to sperm aggregation on the beads."
      ],
      "answer": 0
    },
    "target": "(A)",
    "arguments": [
      [
        "The following are multiple choice questions (with answers) about college biology.\n\nQ: Which of the following contain DNA sequences required for the segregation of chromosomes in mitosis and meiosis?\n(A) Telomeres (B) Centromeres (C) Nucleosomes (D) Spliceosomes\nA:  (B)\n\nQ: Which of the following represents an accurate statement concerning arthropods?\n(A) They possess an exoskeleton composed primarily of peptidoglycan. (B) They possess an open circulatory system with a dorsal heart. (C) They are members of a biologically unsuccessful phylum incapable of exploiting diverse habitats and nutrition sources. (D) They lack paired, jointed appendages.\nA:  (B)\n\nQ: The presence of homologous structures in two different organisms, such as the humerus in the front limb of a human and a bird, indicates that\n(A) the human and bird are polyphyletic species (B) a human's and bird's evolution is convergent (C) the human and bird belong to a clade (D) the human and bird developed by analogy\nA:  (C)\n\nQ: In a given population, 1 out of every 400 people has a cancer caused by a completely recessive allele, b. Assuming the population is in Hardy-Weinberg equilibrium, which of the following is the expected proportion of individuals who carry the b allele but are not expected to develop the cancer?\n(A) 1/400 (B) 19/400 (C) 20/400 (D) 38/400\nA:  (D)\n\nQ: According to the pressure-flow model of movement of phloem contents, photosynthate movement from source to sink is driven by\n(A) an ATP-dependent pressure-flow pump (B) a water-pressure potential gradient (C) transpiration (D) apoplastic diffusion\nA:  (B)\n\nQ: Mouse sperm contain receptor proteins that bind to a glycoprotein (ZP3) in the zona pellucida of mouse eggs. Binding of ZP3 receptors to ZP3 initiates the sperm\u2019s acrosomal reaction. All of the following experimental observations would be expected EXCEPT:\n(A) Injecting eggs with antibodies that bind to ZP3 blocks in vitro fertilization. (B) Incubating sperm with purified ZP3 prior to mixing sperm and eggs blocks in vitro fertilization. (C) Incubating eggs with antibodies that bind to ZP3 blocks in vitro fertilization. (D) Coating synthetic beads with a different glycoprotein, ZP2, fails to lead to sperm aggregation on the beads.\nA: ",
        {
          "until": [
            "</s>"
          ]
        }
      ]
    ],
    "resps": [
      [
        "(B)"
      ]
    ],
    "filtered_resps": [
      "(B)"
    ],
    "exact_match": 0.0
  },
  {
    "doc_id": 61,
    "doc": {
      "question": "Which of the following facts was established prior to 1859, the year in which Charles Darwin published On the Origin of Species?",
      "subject": "college_biology",
      "choices": [
        "DNA provides the macromolecular basis of heredity.",
        "Mendelian principles explain why some traits are dominant and others are recessive.",
        "Prokaryotes include two major domains, the Bacteria and the Archaea.",
        "There exist fossilized remains of species that have become extinct."
      ],
      "answer": 3
    },
    "target": "(D)",
    "arguments": [
      [
        "The following are multiple choice questions (with answers) about college biology.\n\nQ: The presence of homologous structures in two different organisms, such as the humerus in the front limb of a human and a bird, indicates that\n(A) the human and bird are polyphyletic species (B) a human's and bird's evolution is convergent (C) the human and bird belong to a clade (D) the human and bird developed by analogy\nA:  (C)\n\nQ: Which of the following contain DNA sequences required for the segregation of chromosomes in mitosis and meiosis?\n(A) Telomeres (B) Centromeres (C) Nucleosomes (D) Spliceosomes\nA:  (B)\n\nQ: Which of the following represents an accurate statement concerning arthropods?\n(A) They possess an exoskeleton composed primarily of peptidoglycan. (B) They possess an open circulatory system with a dorsal heart. (C) They are members of a biologically unsuccessful phylum incapable of exploiting diverse habitats and nutrition sources. (D) They lack paired, jointed appendages.\nA:  (B)\n\nQ: According to the pressure-flow model of movement of phloem contents, photosynthate movement from source to sink is driven by\n(A) an ATP-dependent pressure-flow pump (B) a water-pressure potential gradient (C) transpiration (D) apoplastic diffusion\nA:  (B)\n\nQ: In a given population, 1 out of every 400 people has a cancer caused by a completely recessive allele, b. Assuming the population is in Hardy-Weinberg equilibrium, which of the following is the expected proportion of individuals who carry the b allele but are not expected to develop the cancer?\n(A) 1/400 (B) 19/400 (C) 20/400 (D) 38/400\nA:  (D)\n\nQ: Which of the following facts was established prior to 1859, the year in which Charles Darwin published On the Origin of Species?\n(A) DNA provides the macromolecular basis of heredity. (B) Mendelian principles explain why some traits are dominant and others are recessive. (C) Prokaryotes include two major domains, the Bacteria and the Archaea. (D) There exist fossilized remains of species that have become extinct.\nA: ",
        {
          "until": [
            "</s>"
          ]
        }
      ]
    ],
    "resps": [
      [
        "(A)"
      ]
    ],
    "filtered_resps": [
      "(A)"
    ],
    "exact_match": 0.0
  },
  {
    "doc_id": 69,
    "doc": {
      "question": "A species of goose nests on both cliffs and beaches near the ocean. Soon after hatching, all chicks must make their way to the ocean. Chicks from cliff nests must tumble down the cliff to get to the ocean, and many are killed by the fall. Which of the following is most consistent with the hypothesis that cliff nesting is adaptive in this goose species?",
      "subject": "college_biology",
      "choices": [
        "Many more geese nest on the beaches than on the cliffs.",
        "Cliff-side nesting confers a higher fitness than does beach nesting.",
        "Chicks from cliff nests instinctively step off the cliffs at the appropriate time.",
        "More chicks survive the fall from the cliffs than are killed."
      ],
      "answer": 1
    },
    "target": "(B)",
    "arguments": [
      [
        "The following are multiple choice questions (with answers) about college biology.\n\nQ: Which of the following contain DNA sequences required for the segregation of chromosomes in mitosis and meiosis?\n(A) Telomeres (B) Centromeres (C) Nucleosomes (D) Spliceosomes\nA:  (B)\n\nQ: Which of the following represents an accurate statement concerning arthropods?\n(A) They possess an exoskeleton composed primarily of peptidoglycan. (B) They possess an open circulatory system with a dorsal heart. (C) They are members of a biologically unsuccessful phylum incapable of exploiting diverse habitats and nutrition sources. (D) They lack paired, jointed appendages.\nA:  (B)\n\nQ: The presence of homologous structures in two different organisms, such as the humerus in the front limb of a human and a bird, indicates that\n(A) the human and bird are polyphyletic species (B) a human's and bird's evolution is convergent (C) the human and bird belong to a clade (D) the human and bird developed by analogy\nA:  (C)\n\nQ: According to the pressure-flow model of movement of phloem contents, photosynthate movement from source to sink is driven by\n(A) an ATP-dependent pressure-flow pump (B) a water-pressure potential gradient (C) transpiration (D) apoplastic diffusion\nA:  (B)\n\nQ: In a given population, 1 out of every 400 people has a cancer caused by a completely recessive allele, b. Assuming the population is in Hardy-Weinberg equilibrium, which of the following is the expected proportion of individuals who carry the b allele but are not expected to develop the cancer?\n(A) 1/400 (B) 19/400 (C) 20/400 (D) 38/400\nA:  (D)\n\nQ: A species of goose nests on both cliffs and beaches near the ocean. Soon after hatching, all chicks must make their way to the ocean. Chicks from cliff nests must tumble down the cliff to get to the ocean, and many are killed by the fall. Which of the following is most consistent with the hypothesis that cliff nesting is adaptive in this goose species?\n(A) Many more geese nest on the beaches than on the cliffs. (B) Cliff-side nesting confers a higher fitness than does beach nesting. (C) Chicks from cliff nests instinctively step off the cliffs at the appropriate time. (D) More chicks survive the fall from the cliffs than are killed.\nA: ",
        {
          "until": [
            "</s>"
          ]
        }
      ]
    ],
    "resps": [
      [
        "(B)"
      ]
    ],
    "filtered_resps": [
      "(B)"
    ],
    "exact_match": 1.0
  },
  {
    "doc_id": 77,
    "doc": {
      "question": "A plant that grows along a trellis exhibits",
      "subject": "college_biology",
      "choices": [
        "thigmotropism",
        "phototropism",
        "gravidotropism",
        "negative gravidotropism"
      ],
      "answer": 0
    },
    "target": "(A)",
    "arguments": [
      [
        "The following are multiple choice questions (with answers) about college biology.\n\nQ: The presence of homologous structures in two different organisms, such as the humerus in the front limb of a human and a bird, indicates that\n(A) the human and bird are polyphyletic species (B) a human's and bird's evolution is convergent (C) the human and bird belong to a clade (D) the human and bird developed by analogy\nA:  (C)\n\nQ: In a given population, 1 out of every 400 people has a cancer caused by a completely recessive allele, b. Assuming the population is in Hardy-Weinberg equilibrium, which of the following is the expected proportion of individuals who carry the b allele but are not expected to develop the cancer?\n(A) 1/400 (B) 19/400 (C) 20/400 (D) 38/400\nA:  (D)\n\nQ: Which of the following contain DNA sequences required for the segregation of chromosomes in mitosis and meiosis?\n(A) Telomeres (B) Centromeres (C) Nucleosomes (D) Spliceosomes\nA:  (B)\n\nQ: According to the pressure-flow model of movement of phloem contents, photosynthate movement from source to sink is driven by\n(A) an ATP-dependent pressure-flow pump (B) a water-pressure potential gradient (C) transpiration (D) apoplastic diffusion\nA:  (B)\n\nQ: Which of the following represents an accurate statement concerning arthropods?\n(A) They possess an exoskeleton composed primarily of peptidoglycan. (B) They possess an open circulatory system with a dorsal heart. (C) They are members of a biologically unsuccessful phylum incapable of exploiting diverse habitats and nutrition sources. (D) They lack paired, jointed appendages.\nA:  (B)\n\nQ: A plant that grows along a trellis exhibits\n(A) thigmotropism (B) phototropism (C) gravidotropism (D) negative gravidotropism\nA: ",
        {
          "until": [
            "</s>"
          ]
        }
      ]
    ],
    "resps": [
      [
        "(C)<0x0A>"
      ]
    ],
    "filtered_resps": [
      "(C)<0x0A>"
    ],
    "exact_match": 0.0
  },
  {
    "doc_id": 85,
    "doc": {
      "question": "Mammals are homeostatic for all of the following EXCEPT",
      "subject": "college_biology",
      "choices": [
        "body temperature",
        "blood glucose concentration",
        "blood pH",
        "metabolic rate"
      ],
      "answer": 3
    },
    "target": "(D)",
    "arguments": [
      [
        "The following are multiple choice questions (with answers) about college biology.\n\nQ: In a given population, 1 out of every 400 people has a cancer caused by a completely recessive allele, b. Assuming the population is in Hardy-Weinberg equilibrium, which of the following is the expected proportion of individuals who carry the b allele but are not expected to develop the cancer?\n(A) 1/400 (B) 19/400 (C) 20/400 (D) 38/400\nA:  (D)\n\nQ: Which of the following represents an accurate statement concerning arthropods?\n(A) They possess an exoskeleton composed primarily of peptidoglycan. (B) They possess an open circulatory system with a dorsal heart. (C) They are members of a biologically unsuccessful phylum incapable of exploiting diverse habitats and nutrition sources. (D) They lack paired, jointed appendages.\nA:  (B)\n\nQ: According to the pressure-flow model of movement of phloem contents, photosynthate movement from source to sink is driven by\n(A) an ATP-dependent pressure-flow pump (B) a water-pressure potential gradient (C) transpiration (D) apoplastic diffusion\nA:  (B)\n\nQ: Which of the following contain DNA sequences required for the segregation of chromosomes in mitosis and meiosis?\n(A) Telomeres (B) Centromeres (C) Nucleosomes (D) Spliceosomes\nA:  (B)\n\nQ: The presence of homologous structures in two different organisms, such as the humerus in the front limb of a human and a bird, indicates that\n(A) the human and bird are polyphyletic species (B) a human's and bird's evolution is convergent (C) the human and bird belong to a clade (D) the human and bird developed by analogy\nA:  (C)\n\nQ: Mammals are homeostatic for all of the following EXCEPT\n(A) body temperature (B) blood glucose concentration (C) blood pH (D) metabolic rate\nA: ",
        {
          "until": [
            "</s>"
          ]
        }
      ]
    ],
    "resps": [
      [
        "(D)<0x0A>Answer: (D)"
      ]
    ],
    "filtered_resps": [
      "(D)<0x0A>Answer: (D)"
    ],
    "exact_match": 0.0
  },
  {
    "doc_id": 93,
    "doc": {
      "question": "Which of the following statements about fungi is NOT true?",
      "subject": "college_biology",
      "choices": [
        "They all are eukaryotic.",
        "They all have rigid cell walls.",
        "Most are filamentous.",
        "Some are photosynthetic."
      ],
      "answer": 3
    },
    "target": "(D)",
    "arguments": [
      [
        "The following are multiple choice questions (with answers) about college biology.\n\nQ: Which of the following represents an accurate statement concerning arthropods?\n(A) They possess an exoskeleton composed primarily of peptidoglycan. (B) They possess an open circulatory system with a dorsal heart. (C) They are members of a biologically unsuccessful phylum incapable of exploiting diverse habitats and nutrition sources. (D) They lack paired, jointed appendages.\nA:  (B)\n\nQ: In a given population, 1 out of every 400 people has a cancer caused by a completely recessive allele, b. Assuming the population is in Hardy-Weinberg equilibrium, which of the following is the expected proportion of individuals who carry the b allele but are not expected to develop the cancer?\n(A) 1/400 (B) 19/400 (C) 20/400 (D) 38/400\nA:  (D)\n\nQ: Which of the following contain DNA sequences required for the segregation of chromosomes in mitosis and meiosis?\n(A) Telomeres (B) Centromeres (C) Nucleosomes (D) Spliceosomes\nA:  (B)\n\nQ: The presence of homologous structures in two different organisms, such as the humerus in the front limb of a human and a bird, indicates that\n(A) the human and bird are polyphyletic species (B) a human's and bird's evolution is convergent (C) the human and bird belong to a clade (D) the human and bird developed by analogy\nA:  (C)\n\nQ: According to the pressure-flow model of movement of phloem contents, photosynthate movement from source to sink is driven by\n(A) an ATP-dependent pressure-flow pump (B) a water-pressure potential gradient (C) transpiration (D) apoplastic diffusion\nA:  (B)\n\nQ: Which of the following statements about fungi is NOT true?\n(A) They all are eukaryotic. (B) They all have rigid cell walls. (C) Most are filamentous. (D) Some are photosynthetic.\nA: ",
        {
          "until": [
            "</s>"
          ]
        }
      ]
    ],
    "resps": [
      [
        "(C)"
      ]
    ],
    "filtered_resps": [
      "(C)"
    ],
    "exact_match": 0.0
  },
  {
    "doc_id": 101,
    "doc": {
      "question": "How do cyanobacteria differ from green unicellular algae?",
      "subject": "college_biology",
      "choices": [
        "Cyanobacteria reduce sulfur compounds.",
        "Cyanobacteria lack cell walls.",
        "Cyanobacteria have no nuclei.",
        "Green algae produce cell membranes."
      ],
      "answer": 2
    },
    "target": "(C)",
    "arguments": [
      [
        "The following are multiple choice questions (with answers) about college biology.\n\nQ: Which of the following represents an accurate statement concerning arthropods?\n(A) They possess an exoskeleton composed primarily of peptidoglycan. (B) They possess an open circulatory system with a dorsal heart. (C) They are members of a biologically unsuccessful phylum incapable of exploiting diverse habitats and nutrition sources. (D) They lack paired, jointed appendages.\nA:  (B)\n\nQ: In a given population, 1 out of every 400 people has a cancer caused by a completely recessive allele, b. Assuming the population is in Hardy-Weinberg equilibrium, which of the following is the expected proportion of individuals who carry the b allele but are not expected to develop the cancer?\n(A) 1/400 (B) 19/400 (C) 20/400 (D) 38/400\nA:  (D)\n\nQ: The presence of homologous structures in two different organisms, such as the humerus in the front limb of a human and a bird, indicates that\n(A) the human and bird are polyphyletic species (B) a human's and bird's evolution is convergent (C) the human and bird belong to a clade (D) the human and bird developed by analogy\nA:  (C)\n\nQ: According to the pressure-flow model of movement of phloem contents, photosynthate movement from source to sink is driven by\n(A) an ATP-dependent pressure-flow pump (B) a water-pressure potential gradient (C) transpiration (D) apoplastic diffusion\nA:  (B)\n\nQ: Which of the following contain DNA sequences required for the segregation of chromosomes in mitosis and meiosis?\n(A) Telomeres (B) Centromeres (C) Nucleosomes (D) Spliceosomes\nA:  (B)\n\nQ: How do cyanobacteria differ from green unicellular algae?\n(A) Cyanobacteria reduce sulfur compounds. (B) Cyanobacteria lack cell walls. (C) Cyanobacteria have no nuclei. (D) Green algae produce cell membranes.\nA: ",
        {
          "until": [
            "</s>"
          ]
        }
      ]
    ],
    "resps": [
      [
        "(D)"
      ]
    ],
    "filtered_resps": [
      "(D)"
    ],
    "exact_match": 0.0
  },
  {
    "doc_id": 109,
    "doc": {
      "question": "A species of small rodent eats seeds from only one species of pine. In normal years, a pair of these rodents will have a litter of two or three. It is unusual for small rodents to have such small litter sizes. The rodents are most likely to exhibit which other characteristic?",
      "subject": "college_biology",
      "choices": [
        "Moderate sexual size dimorphism",
        "High parental investment",
        "Precocial young",
        "Frequent extrapair matings"
      ],
      "answer": 1
    },
    "target": "(B)",
    "arguments": [
      [
        "The following are multiple choice questions (with answers) about college biology.\n\nQ: Which of the following represents an accurate statement concerning arthropods?\n(A) They possess an exoskeleton composed primarily of peptidoglycan. (B) They possess an open circulatory system with a dorsal heart. (C) They are members of a biologically unsuccessful phylum incapable of exploiting diverse habitats and nutrition sources. (D) They lack paired, jointed appendages.\nA:  (B)\n\nQ: According to the pressure-flow model of movement of phloem contents, photosynthate movement from source to sink is driven by\n(A) an ATP-dependent pressure-flow pump (B) a water-pressure potential gradient (C) transpiration (D) apoplastic diffusion\nA:  (B)\n\nQ: In a given population, 1 out of every 400 people has a cancer caused by a completely recessive allele, b. Assuming the population is in Hardy-Weinberg equilibrium, which of the following is the expected proportion of individuals who carry the b allele but are not expected to develop the cancer?\n(A) 1/400 (B) 19/400 (C) 20/400 (D) 38/400\nA:  (D)\n\nQ: Which of the following contain DNA sequences required for the segregation of chromosomes in mitosis and meiosis?\n(A) Telomeres (B) Centromeres (C) Nucleosomes (D) Spliceosomes\nA:  (B)\n\nQ: The presence of homologous structures in two different organisms, such as the humerus in the front limb of a human and a bird, indicates that\n(A) the human and bird are polyphyletic species (B) a human's and bird's evolution is convergent (C) the human and bird belong to a clade (D) the human and bird developed by analogy\nA:  (C)\n\nQ: A species of small rodent eats seeds from only one species of pine. In normal years, a pair of these rodents will have a litter of two or three. It is unusual for small rodents to have such small litter sizes. The rodents are most likely to exhibit which other characteristic?\n(A) Moderate sexual size dimorphism (B) High parental investment (C) Precocial young (D) Frequent extrapair matings\nA: ",
        {
          "until": [
            "</s>"
          ]
        }
      ]
    ],
    "resps": [
      [
        "(A)"
      ]
    ],
    "filtered_resps": [
      "(A)"
    ],
    "exact_match": 0.0
  },
  {
    "doc_id": 117,
    "doc": {
      "question": "Which of the following is the best explanation for why net primary productivity in terrestrial ecosystems tends to increase toward the tropics?",
      "subject": "college_biology",
      "choices": [
        "The higher species diversity in the tropics tends to increase plant growth.",
        "There are lower metabolic costs to plant growth in the tropics.",
        "The availability of water and warm temperatures in the tropics fosters photosynthesis.",
        "The tropics have more predators that minimize herbivory."
      ],
      "answer": 2
    },
    "target": "(C)",
    "arguments": [
      [
        "The following are multiple choice questions (with answers) about college biology.\n\nQ: The presence of homologous structures in two different organisms, such as the humerus in the front limb of a human and a bird, indicates that\n(A) the human and bird are polyphyletic species (B) a human's and bird's evolution is convergent (C) the human and bird belong to a clade (D) the human and bird developed by analogy\nA:  (C)\n\nQ: In a given population, 1 out of every 400 people has a cancer caused by a completely recessive allele, b. Assuming the population is in Hardy-Weinberg equilibrium, which of the following is the expected proportion of individuals who carry the b allele but are not expected to develop the cancer?\n(A) 1/400 (B) 19/400 (C) 20/400 (D) 38/400\nA:  (D)\n\nQ: According to the pressure-flow model of movement of phloem contents, photosynthate movement from source to sink is driven by\n(A) an ATP-dependent pressure-flow pump (B) a water-pressure potential gradient (C) transpiration (D) apoplastic diffusion\nA:  (B)\n\nQ: Which of the following represents an accurate statement concerning arthropods?\n(A) They possess an exoskeleton composed primarily of peptidoglycan. (B) They possess an open circulatory system with a dorsal heart. (C) They are members of a biologically unsuccessful phylum incapable of exploiting diverse habitats and nutrition sources. (D) They lack paired, jointed appendages.\nA:  (B)\n\nQ: Which of the following contain DNA sequences required for the segregation of chromosomes in mitosis and meiosis?\n(A) Telomeres (B) Centromeres (C) Nucleosomes (D) Spliceosomes\nA:  (B)\n\nQ: Which of the following is the best explanation for why net primary productivity in terrestrial ecosystems tends to increase toward the tropics?\n(A) The higher species diversity in the tropics tends to increase plant growth. (B) There are lower metabolic costs to plant growth in the tropics. (C) The availability of water and warm temperatures in the tropics fosters photosynthesis. (D) The tropics have more predators that minimize herbivory.\nA: ",
        {
          "until": [
            "</s>"
          ]
        }
      ]
    ],
    "resps": [
      [
        "(A)"
      ]
    ],
    "filtered_resps": [
      "(A)"
    ],
    "exact_match": 0.0
  },
  {
    "doc_id": 125,
    "doc": {
      "question": "Which of the following adaptations would limit pollination by bees and promote hummingbird pollination?",
      "subject": "college_biology",
      "choices": [
        "Patterns of ultraviolet color on the petals",
        "Modified petals to provide a landing space",
        "Pendant (hanging) red-colored flowers",
        "Nectar with high sugar concentration produced in limited amounts"
      ],
      "answer": 2
    },
    "target": "(C)",
    "arguments": [
      [
        "The following are multiple choice questions (with answers) about college biology.\n\nQ: Which of the following represents an accurate statement concerning arthropods?\n(A) They possess an exoskeleton composed primarily of peptidoglycan. (B) They possess an open circulatory system with a dorsal heart. (C) They are members of a biologically unsuccessful phylum incapable of exploiting diverse habitats and nutrition sources. (D) They lack paired, jointed appendages.\nA:  (B)\n\nQ: According to the pressure-flow model of movement of phloem contents, photosynthate movement from source to sink is driven by\n(A) an ATP-dependent pressure-flow pump (B) a water-pressure potential gradient (C) transpiration (D) apoplastic diffusion\nA:  (B)\n\nQ: In a given population, 1 out of every 400 people has a cancer caused by a completely recessive allele, b. Assuming the population is in Hardy-Weinberg equilibrium, which of the following is the expected proportion of individuals who carry the b allele but are not expected to develop the cancer?\n(A) 1/400 (B) 19/400 (C) 20/400 (D) 38/400\nA:  (D)\n\nQ: The presence of homologous structures in two different organisms, such as the humerus in the front limb of a human and a bird, indicates that\n(A) the human and bird are polyphyletic species (B) a human's and bird's evolution is convergent (C) the human and bird belong to a clade (D) the human and bird developed by analogy\nA:  (C)\n\nQ: Which of the following contain DNA sequences required for the segregation of chromosomes in mitosis and meiosis?\n(A) Telomeres (B) Centromeres (C) Nucleosomes (D) Spliceosomes\nA:  (B)\n\nQ: Which of the following adaptations would limit pollination by bees and promote hummingbird pollination?\n(A) Patterns of ultraviolet color on the petals (B) Modified petals to provide a landing space (C) Pendant (hanging) red-colored flowers (D) Nectar with high sugar concentration produced in limited amounts\nA: ",
        {
          "until": [
            "</s>"
          ]
        }
      ]
    ],
    "resps": [
      [
        "(C)"
      ]
    ],
    "filtered_resps": [
      "(C)"
    ],
    "exact_match": 1.0
  },
  {
    "doc_id": 133,
    "doc": {
      "question": "Keystone species are thought to have profound effects on the structure and composition of ecological communities because they",
      "subject": "college_biology",
      "choices": [
        "tend to reduce diversity by eliminating food resources for other species",
        "provide the foundation for food webs",
        "are more abundant than most other species in their communities",
        "can prevent superior competitors from driving inferior competitors to local extinction"
      ],
      "answer": 3
    },
    "target": "(D)",
    "arguments": [
      [
        "The following are multiple choice questions (with answers) about college biology.\n\nQ: Which of the following contain DNA sequences required for the segregation of chromosomes in mitosis and meiosis?\n(A) Telomeres (B) Centromeres (C) Nucleosomes (D) Spliceosomes\nA:  (B)\n\nQ: According to the pressure-flow model of movement of phloem contents, photosynthate movement from source to sink is driven by\n(A) an ATP-dependent pressure-flow pump (B) a water-pressure potential gradient (C) transpiration (D) apoplastic diffusion\nA:  (B)\n\nQ: In a given population, 1 out of every 400 people has a cancer caused by a completely recessive allele, b. Assuming the population is in Hardy-Weinberg equilibrium, which of the following is the expected proportion of individuals who carry the b allele but are not expected to develop the cancer?\n(A) 1/400 (B) 19/400 (C) 20/400 (D) 38/400\nA:  (D)\n\nQ: Which of the following represents an accurate statement concerning arthropods?\n(A) They possess an exoskeleton composed primarily of peptidoglycan. (B) They possess an open circulatory system with a dorsal heart. (C) They are members of a biologically unsuccessful phylum incapable of exploiting diverse habitats and nutrition sources. (D) They lack paired, jointed appendages.\nA:  (B)\n\nQ: The presence of homologous structures in two different organisms, such as the humerus in the front limb of a human and a bird, indicates that\n(A) the human and bird are polyphyletic species (B) a human's and bird's evolution is convergent (C) the human and bird belong to a clade (D) the human and bird developed by analogy\nA:  (C)\n\nQ: Keystone species are thought to have profound effects on the structure and composition of ecological communities because they\n(A) tend to reduce diversity by eliminating food resources for other species (B) provide the foundation for food webs (C) are more abundant than most other species in their communities (D) can prevent superior competitors from driving inferior competitors to local extinction\nA: ",
        {
          "until": [
            "</s>"
          ]
        }
      ]
    ],
    "resps": [
      [
        "(D)"
      ]
    ],
    "filtered_resps": [
      "(D)"
    ],
    "exact_match": 1.0
  },
  {
    "doc_id": 141,
    "doc": {
      "question": "In plants, proton pumps are involved in the process of loading sugars into the phloem for transport. Which of the following is true about this process?",
      "subject": "college_biology",
      "choices": [
        "It is passive.",
        "It depends on DNA.",
        "It requires ATP.",
        "It translocates starch."
      ],
      "answer": 2
    },
    "target": "(C)",
    "arguments": [
      [
        "The following are multiple choice questions (with answers) about college biology.\n\nQ: Which of the following contain DNA sequences required for the segregation of chromosomes in mitosis and meiosis?\n(A) Telomeres (B) Centromeres (C) Nucleosomes (D) Spliceosomes\nA:  (B)\n\nQ: In a given population, 1 out of every 400 people has a cancer caused by a completely recessive allele, b. Assuming the population is in Hardy-Weinberg equilibrium, which of the following is the expected proportion of individuals who carry the b allele but are not expected to develop the cancer?\n(A) 1/400 (B) 19/400 (C) 20/400 (D) 38/400\nA:  (D)\n\nQ: According to the pressure-flow model of movement of phloem contents, photosynthate movement from source to sink is driven by\n(A) an ATP-dependent pressure-flow pump (B) a water-pressure potential gradient (C) transpiration (D) apoplastic diffusion\nA:  (B)\n\nQ: The presence of homologous structures in two different organisms, such as the humerus in the front limb of a human and a bird, indicates that\n(A) the human and bird are polyphyletic species (B) a human's and bird's evolution is convergent (C) the human and bird belong to a clade (D) the human and bird developed by analogy\nA:  (C)\n\nQ: Which of the following represents an accurate statement concerning arthropods?\n(A) They possess an exoskeleton composed primarily of peptidoglycan. (B) They possess an open circulatory system with a dorsal heart. (C) They are members of a biologically unsuccessful phylum incapable of exploiting diverse habitats and nutrition sources. (D) They lack paired, jointed appendages.\nA:  (B)\n\nQ: In plants, proton pumps are involved in the process of loading sugars into the phloem for transport. Which of the following is true about this process?\n(A) It is passive. (B) It depends on DNA. (C) It requires ATP. (D) It translocates starch.\nA: ",
        {
          "until": [
            "</s>"
          ]
        }
      ]
    ],
    "resps": [
      [
        "(D)"
      ]
    ],
    "filtered_resps": [
      "(D)"
    ],
    "exact_match": 0.0
  },
  {
    "doc_id": 6,
    "doc": {
      "question": "The Barr body found within female mammalian cells' nuclei is an example of",
      "subject": "college_biology",
      "choices": [
        "euchromatin",
        "heterochromatin",
        "a cistron",
        "pseudogenes"
      ],
      "answer": 1
    },
    "target": "(B)",
    "arguments": [
      [
        "The following are multiple choice questions (with answers) about college biology.\n\nQ: According to the pressure-flow model of movement of phloem contents, photosynthate movement from source to sink is driven by\n(A) an ATP-dependent pressure-flow pump (B) a water-pressure potential gradient (C) transpiration (D) apoplastic diffusion\nA:  (B)\n\nQ: Which of the following represents an accurate statement concerning arthropods?\n(A) They possess an exoskeleton composed primarily of peptidoglycan. (B) They possess an open circulatory system with a dorsal heart. (C) They are members of a biologically unsuccessful phylum incapable of exploiting diverse habitats and nutrition sources. (D) They lack paired, jointed appendages.\nA:  (B)\n\nQ: Which of the following contain DNA sequences required for the segregation of chromosomes in mitosis and meiosis?\n(A) Telomeres (B) Centromeres (C) Nucleosomes (D) Spliceosomes\nA:  (B)\n\nQ: The presence of homologous structures in two different organisms, such as the humerus in the front limb of a human and a bird, indicates that\n(A) the human and bird are polyphyletic species (B) a human's and bird's evolution is convergent (C) the human and bird belong to a clade (D) the human and bird developed by analogy\nA:  (C)\n\nQ: In a given population, 1 out of every 400 people has a cancer caused by a completely recessive allele, b. Assuming the population is in Hardy-Weinberg equilibrium, which of the following is the expected proportion of individuals who carry the b allele but are not expected to develop the cancer?\n(A) 1/400 (B) 19/400 (C) 20/400 (D) 38/400\nA:  (D)\n\nQ: The Barr body found within female mammalian cells' nuclei is an example of\n(A) euchromatin (B) heterochromatin (C) a cistron (D) pseudogenes\nA: ",
        {
          "until": [
            "</s>"
          ]
        }
      ]
    ],
    "resps": [
      [
        "(B)"
      ]
    ],
    "filtered_resps": [
      "(B)"
    ],
    "exact_match": 1.0
  },
  {
    "doc_id": 14,
    "doc": {
      "question": "In one taxonomic classification, Archaea, Eukarya, and Bacteria represent the three major domains of life. Eukarya utilize the general transcription factors TBP (TATA-binding protein) and TFIIB in transcription, whereas Bacteria do not. At least one member of Archaea has a protein similar to TBP and a protein similar to TFIIB. Based on this observation, which of the following scenarios is most likely?",
      "subject": "college_biology",
      "choices": [
        "Archaea and Eukarya diverged after their common ancestor diverged from Bacteria.",
        "Archaea and Bacteria diverged after their common ancestor diverged from Eukarya.",
        "Bacteria and Eukarya diverged after their common ancestor diverged from Archaea.",
        "Archaea, Eukarya, and Bacteria diverged simultaneously from a common ancestor."
      ],
      "answer": 0
    },
    "target": "(A)",
    "arguments": [
      [
        "The following are multiple choice questions (with answers) about college biology.\n\nQ: Which of the following represents an accurate statement concerning arthropods?\n(A) They possess an exoskeleton composed primarily of peptidoglycan. (B) They possess an open circulatory system with a dorsal heart. (C) They are members of a biologically unsuccessful phylum incapable of exploiting diverse habitats and nutrition sources. (D) They lack paired, jointed appendages.\nA:  (B)\n\nQ: Which of the following contain DNA sequences required for the segregation of chromosomes in mitosis and meiosis?\n(A) Telomeres (B) Centromeres (C) Nucleosomes (D) Spliceosomes\nA:  (B)\n\nQ: In a given population, 1 out of every 400 people has a cancer caused by a completely recessive allele, b. Assuming the population is in Hardy-Weinberg equilibrium, which of the following is the expected proportion of individuals who carry the b allele but are not expected to develop the cancer?\n(A) 1/400 (B) 19/400 (C) 20/400 (D) 38/400\nA:  (D)\n\nQ: According to the pressure-flow model of movement of phloem contents, photosynthate movement from source to sink is driven by\n(A) an ATP-dependent pressure-flow pump (B) a water-pressure potential gradient (C) transpiration (D) apoplastic diffusion\nA:  (B)\n\nQ: The presence of homologous structures in two different organisms, such as the humerus in the front limb of a human and a bird, indicates that\n(A) the human and bird are polyphyletic species (B) a human's and bird's evolution is convergent (C) the human and bird belong to a clade (D) the human and bird developed by analogy\nA:  (C)\n\nQ: In one taxonomic classification, Archaea, Eukarya, and Bacteria represent the three major domains of life. Eukarya utilize the general transcription factors TBP (TATA-binding protein) and TFIIB in transcription, whereas Bacteria do not. At least one member of Archaea has a protein similar to TBP and a protein similar to TFIIB. Based on this observation, which of the following scenarios is most likely?\n(A) Archaea and Eukarya diverged after their common ancestor diverged from Bacteria. (B) Archaea and Bacteria diverged after their common ancestor diverged from Eukarya. (C) Bacteria and Eukarya diverged after their common ancestor diverged from Archaea. (D) Archaea, Eukarya, and Bacteria diverged simultaneously from a common ancestor.\nA: ",
        {
          "until": [
            "</s>"
          ]
        }
      ]
    ],
    "resps": [
      [
        "(B)"
      ]
    ],
    "filtered_resps": [
      "(B)"
    ],
    "exact_match": 0.0
  },
  {
    "doc_id": 22,
    "doc": {
      "question": "The wings of a bat and the wings of a butterfly are",
      "subject": "college_biology",
      "choices": [
        "homologous structures",
        "analogous structures",
        "vestigial structures",
        "dissimilar in form and function"
      ],
      "answer": 1
    },
    "target": "(B)",
    "arguments": [
      [
        "The following are multiple choice questions (with answers) about college biology.\n\nQ: Which of the following represents an accurate statement concerning arthropods?\n(A) They possess an exoskeleton composed primarily of peptidoglycan. (B) They possess an open circulatory system with a dorsal heart. (C) They are members of a biologically unsuccessful phylum incapable of exploiting diverse habitats and nutrition sources. (D) They lack paired, jointed appendages.\nA:  (B)\n\nQ: Which of the following contain DNA sequences required for the segregation of chromosomes in mitosis and meiosis?\n(A) Telomeres (B) Centromeres (C) Nucleosomes (D) Spliceosomes\nA:  (B)\n\nQ: In a given population, 1 out of every 400 people has a cancer caused by a completely recessive allele, b. Assuming the population is in Hardy-Weinberg equilibrium, which of the following is the expected proportion of individuals who carry the b allele but are not expected to develop the cancer?\n(A) 1/400 (B) 19/400 (C) 20/400 (D) 38/400\nA:  (D)\n\nQ: The presence of homologous structures in two different organisms, such as the humerus in the front limb of a human and a bird, indicates that\n(A) the human and bird are polyphyletic species (B) a human's and bird's evolution is convergent (C) the human and bird belong to a clade (D) the human and bird developed by analogy\nA:  (C)\n\nQ: According to the pressure-flow model of movement of phloem contents, photosynthate movement from source to sink is driven by\n(A) an ATP-dependent pressure-flow pump (B) a water-pressure potential gradient (C) transpiration (D) apoplastic diffusion\nA:  (B)\n\nQ: The wings of a bat and the wings of a butterfly are\n(A) homologous structures (B) analogous structures (C) vestigial structures (D) dissimilar in form and function\nA: ",
        {
          "until": [
            "</s>"
          ]
        }
      ]
    ],
    "resps": [
      [
        "(D)<0x0A>Answer this question based on the passage: What are the different types of wings of a bat and a butterfly?<0x0A>Options:<0x0A>(A) homologous structures<0x0A>(B) analogous structures<0x0A>(C) dissimilar in form and function<0x0A>(D)"
      ]
    ],
    "filtered_resps": [
      "(D)<0x0A>Answer this question based on the passage: What are the different types of wings of a bat and a butterfly?<0x0A>Options:<0x0A>(A) homologous structures<0x0A>(B) analogous structures<0x0A>(C) dissimilar in form and function<0x0A>(D)"
    ],
    "exact_match": 0.0
  },
  {
    "doc_id": 30,
    "doc": {
      "question": "All of the following might be found in connective tissue EXCEPT",
      "subject": "college_biology",
      "choices": [
        "thrombin",
        "glycosaminoglycans",
        "collagens",
        "fibroblasts"
      ],
      "answer": 0
    },
    "target": "(A)",
    "arguments": [
      [
        "The following are multiple choice questions (with answers) about college biology.\n\nQ: In a given population, 1 out of every 400 people has a cancer caused by a completely recessive allele, b. Assuming the population is in Hardy-Weinberg equilibrium, which of the following is the expected proportion of individuals who carry the b allele but are not expected to develop the cancer?\n(A) 1/400 (B) 19/400 (C) 20/400 (D) 38/400\nA:  (D)\n\nQ: Which of the following represents an accurate statement concerning arthropods?\n(A) They possess an exoskeleton composed primarily of peptidoglycan. (B) They possess an open circulatory system with a dorsal heart. (C) They are members of a biologically unsuccessful phylum incapable of exploiting diverse habitats and nutrition sources. (D) They lack paired, jointed appendages.\nA:  (B)\n\nQ: According to the pressure-flow model of movement of phloem contents, photosynthate movement from source to sink is driven by\n(A) an ATP-dependent pressure-flow pump (B) a water-pressure potential gradient (C) transpiration (D) apoplastic diffusion\nA:  (B)\n\nQ: The presence of homologous structures in two different organisms, such as the humerus in the front limb of a human and a bird, indicates that\n(A) the human and bird are polyphyletic species (B) a human's and bird's evolution is convergent (C) the human and bird belong to a clade (D) the human and bird developed by analogy\nA:  (C)\n\nQ: Which of the following contain DNA sequences required for the segregation of chromosomes in mitosis and meiosis?\n(A) Telomeres (B) Centromeres (C) Nucleosomes (D) Spliceosomes\nA:  (B)\n\nQ: All of the following might be found in connective tissue EXCEPT\n(A) thrombin (B) glycosaminoglycans (C) collagens (D) fibroblasts\nA: ",
        {
          "until": [
            "</s>"
          ]
        }
      ]
    ],
    "resps": [
      [
        "(D)"
      ]
    ],
    "filtered_resps": [
      "(D)"
    ],
    "exact_match": 0.0
  },
  {
    "doc_id": 38,
    "doc": {
      "question": "The sight organs of crustaceans and insects contain ommatidia, which make up the individual visual units of the",
      "subject": "college_biology",
      "choices": [
        "eyespot",
        "simple eye",
        "compound eye",
        "binocular eye"
      ],
      "answer": 2
    },
    "target": "(C)",
    "arguments": [
      [
        "The following are multiple choice questions (with answers) about college biology.\n\nQ: Which of the following contain DNA sequences required for the segregation of chromosomes in mitosis and meiosis?\n(A) Telomeres (B) Centromeres (C) Nucleosomes (D) Spliceosomes\nA:  (B)\n\nQ: According to the pressure-flow model of movement of phloem contents, photosynthate movement from source to sink is driven by\n(A) an ATP-dependent pressure-flow pump (B) a water-pressure potential gradient (C) transpiration (D) apoplastic diffusion\nA:  (B)\n\nQ: Which of the following represents an accurate statement concerning arthropods?\n(A) They possess an exoskeleton composed primarily of peptidoglycan. (B) They possess an open circulatory system with a dorsal heart. (C) They are members of a biologically unsuccessful phylum incapable of exploiting diverse habitats and nutrition sources. (D) They lack paired, jointed appendages.\nA:  (B)\n\nQ: The presence of homologous structures in two different organisms, such as the humerus in the front limb of a human and a bird, indicates that\n(A) the human and bird are polyphyletic species (B) a human's and bird's evolution is convergent (C) the human and bird belong to a clade (D) the human and bird developed by analogy\nA:  (C)\n\nQ: In a given population, 1 out of every 400 people has a cancer caused by a completely recessive allele, b. Assuming the population is in Hardy-Weinberg equilibrium, which of the following is the expected proportion of individuals who carry the b allele but are not expected to develop the cancer?\n(A) 1/400 (B) 19/400 (C) 20/400 (D) 38/400\nA:  (D)\n\nQ: The sight organs of crustaceans and insects contain ommatidia, which make up the individual visual units of the\n(A) eyespot (B) simple eye (C) compound eye (D) binocular eye\nA: ",
        {
          "until": [
            "</s>"
          ]
        }
      ]
    ],
    "resps": [
      [
        "(D)"
      ]
    ],
    "filtered_resps": [
      "(D)"
    ],
    "exact_match": 0.0
  },
  {
    "doc_id": 46,
    "doc": {
      "question": "A healthy person sitting at rest consciously begins to breathe too fast. Which of the following describes the change in the person\u2019s blood caused by this hyperventilation?",
      "subject": "college_biology",
      "choices": [
        "A decrease in partial pressure of carbon dioxide and an increase in concentration of hydrogen ions",
        "A decrease in partial pressure of carbon dioxide and a decrease in concentration of hydrogen ions",
        "An increase in partial pressure of carbon dioxide and an increase in concentration of hydrogen ions",
        "An increase in partial pressure of carbon dioxide and a decrease in concentration of hydrogen ions"
      ],
      "answer": 1
    },
    "target": "(B)",
    "arguments": [
      [
        "The following are multiple choice questions (with answers) about college biology.\n\nQ: Which of the following represents an accurate statement concerning arthropods?\n(A) They possess an exoskeleton composed primarily of peptidoglycan. (B) They possess an open circulatory system with a dorsal heart. (C) They are members of a biologically unsuccessful phylum incapable of exploiting diverse habitats and nutrition sources. (D) They lack paired, jointed appendages.\nA:  (B)\n\nQ: Which of the following contain DNA sequences required for the segregation of chromosomes in mitosis and meiosis?\n(A) Telomeres (B) Centromeres (C) Nucleosomes (D) Spliceosomes\nA:  (B)\n\nQ: The presence of homologous structures in two different organisms, such as the humerus in the front limb of a human and a bird, indicates that\n(A) the human and bird are polyphyletic species (B) a human's and bird's evolution is convergent (C) the human and bird belong to a clade (D) the human and bird developed by analogy\nA:  (C)\n\nQ: According to the pressure-flow model of movement of phloem contents, photosynthate movement from source to sink is driven by\n(A) an ATP-dependent pressure-flow pump (B) a water-pressure potential gradient (C) transpiration (D) apoplastic diffusion\nA:  (B)\n\nQ: In a given population, 1 out of every 400 people has a cancer caused by a completely recessive allele, b. Assuming the population is in Hardy-Weinberg equilibrium, which of the following is the expected proportion of individuals who carry the b allele but are not expected to develop the cancer?\n(A) 1/400 (B) 19/400 (C) 20/400 (D) 38/400\nA:  (D)\n\nQ: A healthy person sitting at rest consciously begins to breathe too fast. Which of the following describes the change in the person\u2019s blood caused by this hyperventilation?\n(A) A decrease in partial pressure of carbon dioxide and an increase in concentration of hydrogen ions (B) A decrease in partial pressure of carbon dioxide and a decrease in concentration of hydrogen ions (C) An increase in partial pressure of carbon dioxide and an increase in concentration of hydrogen ions (D) An increase in partial pressure of carbon dioxide and a decrease in concentration of hydrogen ions\nA: ",
        {
          "until": [
            "</s>"
          ]
        }
      ]
    ],
    "resps": [
      [
        "(D)"
      ]
    ],
    "filtered_resps": [
      "(D)"
    ],
    "exact_match": 0.0
  },
  {
    "doc_id": 54,
    "doc": {
      "question": "Which of the following factors does NOT promote linkage disequilibrium?",
      "subject": "college_biology",
      "choices": [
        "Asexual reproduction",
        "Coadapted gene complexes",
        "Epistasis",
        "Random mating"
      ],
      "answer": 3
    },
    "target": "(D)",
    "arguments": [
      [
        "The following are multiple choice questions (with answers) about college biology.\n\nQ: Which of the following contain DNA sequences required for the segregation of chromosomes in mitosis and meiosis?\n(A) Telomeres (B) Centromeres (C) Nucleosomes (D) Spliceosomes\nA:  (B)\n\nQ: Which of the following represents an accurate statement concerning arthropods?\n(A) They possess an exoskeleton composed primarily of peptidoglycan. (B) They possess an open circulatory system with a dorsal heart. (C) They are members of a biologically unsuccessful phylum incapable of exploiting diverse habitats and nutrition sources. (D) They lack paired, jointed appendages.\nA:  (B)\n\nQ: The presence of homologous structures in two different organisms, such as the humerus in the front limb of a human and a bird, indicates that\n(A) the human and bird are polyphyletic species (B) a human's and bird's evolution is convergent (C) the human and bird belong to a clade (D) the human and bird developed by analogy\nA:  (C)\n\nQ: In a given population, 1 out of every 400 people has a cancer caused by a completely recessive allele, b. Assuming the population is in Hardy-Weinberg equilibrium, which of the following is the expected proportion of individuals who carry the b allele but are not expected to develop the cancer?\n(A) 1/400 (B) 19/400 (C) 20/400 (D) 38/400\nA:  (D)\n\nQ: According to the pressure-flow model of movement of phloem contents, photosynthate movement from source to sink is driven by\n(A) an ATP-dependent pressure-flow pump (B) a water-pressure potential gradient (C) transpiration (D) apoplastic diffusion\nA:  (B)\n\nQ: Which of the following factors does NOT promote linkage disequilibrium?\n(A) Asexual reproduction (B) Coadapted gene complexes (C) Epistasis (D) Random mating\nA: ",
        {
          "until": [
            "</s>"
          ]
        }
      ]
    ],
    "resps": [
      [
        "(D)"
      ]
    ],
    "filtered_resps": [
      "(D)"
    ],
    "exact_match": 1.0
  },
  {
    "doc_id": 62,
    "doc": {
      "question": "Fungi participate in each of the following EXCEPT",
      "subject": "college_biology",
      "choices": [
        "photosynthesis to produce glucose",
        "fermentation to produce alcohol",
        "association with humans to produce ringworm",
        "association with the roots of plants to form mycorrhizae"
      ],
      "answer": 0
    },
    "target": "(A)",
    "arguments": [
      [
        "The following are multiple choice questions (with answers) about college biology.\n\nQ: The presence of homologous structures in two different organisms, such as the humerus in the front limb of a human and a bird, indicates that\n(A) the human and bird are polyphyletic species (B) a human's and bird's evolution is convergent (C) the human and bird belong to a clade (D) the human and bird developed by analogy\nA:  (C)\n\nQ: Which of the following contain DNA sequences required for the segregation of chromosomes in mitosis and meiosis?\n(A) Telomeres (B) Centromeres (C) Nucleosomes (D) Spliceosomes\nA:  (B)\n\nQ: Which of the following represents an accurate statement concerning arthropods?\n(A) They possess an exoskeleton composed primarily of peptidoglycan. (B) They possess an open circulatory system with a dorsal heart. (C) They are members of a biologically unsuccessful phylum incapable of exploiting diverse habitats and nutrition sources. (D) They lack paired, jointed appendages.\nA:  (B)\n\nQ: According to the pressure-flow model of movement of phloem contents, photosynthate movement from source to sink is driven by\n(A) an ATP-dependent pressure-flow pump (B) a water-pressure potential gradient (C) transpiration (D) apoplastic diffusion\nA:  (B)\n\nQ: In a given population, 1 out of every 400 people has a cancer caused by a completely recessive allele, b. Assuming the population is in Hardy-Weinberg equilibrium, which of the following is the expected proportion of individuals who carry the b allele but are not expected to develop the cancer?\n(A) 1/400 (B) 19/400 (C) 20/400 (D) 38/400\nA:  (D)\n\nQ: Fungi participate in each of the following EXCEPT\n(A) photosynthesis to produce glucose (B) fermentation to produce alcohol (C) association with humans to produce ringworm (D) association with the roots of plants to form mycorrhizae\nA: ",
        {
          "until": [
            "</s>"
          ]
        }
      ]
    ],
    "resps": [
      [
        "(D)"
      ]
    ],
    "filtered_resps": [
      "(D)"
    ],
    "exact_match": 0.0
  },
  {
    "doc_id": 70,
    "doc": {
      "question": "Immunoglobulins having epsilon heavy chains and located on the plasma membranes of mast cells and basophilic leukocytes belong to the class of antibodies called",
      "subject": "college_biology",
      "choices": [
        "IgE",
        "IgA",
        "IgD",
        "IgM"
      ],
      "answer": 0
    },
    "target": "(A)",
    "arguments": [
      [
        "The following are multiple choice questions (with answers) about college biology.\n\nQ: Which of the following contain DNA sequences required for the segregation of chromosomes in mitosis and meiosis?\n(A) Telomeres (B) Centromeres (C) Nucleosomes (D) Spliceosomes\nA:  (B)\n\nQ: Which of the following represents an accurate statement concerning arthropods?\n(A) They possess an exoskeleton composed primarily of peptidoglycan. (B) They possess an open circulatory system with a dorsal heart. (C) They are members of a biologically unsuccessful phylum incapable of exploiting diverse habitats and nutrition sources. (D) They lack paired, jointed appendages.\nA:  (B)\n\nQ: The presence of homologous structures in two different organisms, such as the humerus in the front limb of a human and a bird, indicates that\n(A) the human and bird are polyphyletic species (B) a human's and bird's evolution is convergent (C) the human and bird belong to a clade (D) the human and bird developed by analogy\nA:  (C)\n\nQ: According to the pressure-flow model of movement of phloem contents, photosynthate movement from source to sink is driven by\n(A) an ATP-dependent pressure-flow pump (B) a water-pressure potential gradient (C) transpiration (D) apoplastic diffusion\nA:  (B)\n\nQ: In a given population, 1 out of every 400 people has a cancer caused by a completely recessive allele, b. Assuming the population is in Hardy-Weinberg equilibrium, which of the following is the expected proportion of individuals who carry the b allele but are not expected to develop the cancer?\n(A) 1/400 (B) 19/400 (C) 20/400 (D) 38/400\nA:  (D)\n\nQ: Immunoglobulins having epsilon heavy chains and located on the plasma membranes of mast cells and basophilic leukocytes belong to the class of antibodies called\n(A) IgE (B) IgA (C) IgD (D) IgM\nA: ",
        {
          "until": [
            "</s>"
          ]
        }
      ]
    ],
    "resps": [
      [
        "(D)"
      ]
    ],
    "filtered_resps": [
      "(D)"
    ],
    "exact_match": 0.0
  },
  {
    "doc_id": 78,
    "doc": {
      "question": "If the activity of an enzyme is constant over a broad range of pH values, it is likely that",
      "subject": "college_biology",
      "choices": [
        "only ionizing groups on the enzyme participate in the reaction",
        "only ionizing groups on the substrate participate in the reaction",
        "ionizing groups on both the enzyme and substrate participate in the reaction",
        "no ionizing groups on the enzyme or substrate participate in the reaction"
      ],
      "answer": 3
    },
    "target": "(D)",
    "arguments": [
      [
        "The following are multiple choice questions (with answers) about college biology.\n\nQ: The presence of homologous structures in two different organisms, such as the humerus in the front limb of a human and a bird, indicates that\n(A) the human and bird are polyphyletic species (B) a human's and bird's evolution is convergent (C) the human and bird belong to a clade (D) the human and bird developed by analogy\nA:  (C)\n\nQ: In a given population, 1 out of every 400 people has a cancer caused by a completely recessive allele, b. Assuming the population is in Hardy-Weinberg equilibrium, which of the following is the expected proportion of individuals who carry the b allele but are not expected to develop the cancer?\n(A) 1/400 (B) 19/400 (C) 20/400 (D) 38/400\nA:  (D)\n\nQ: Which of the following contain DNA sequences required for the segregation of chromosomes in mitosis and meiosis?\n(A) Telomeres (B) Centromeres (C) Nucleosomes (D) Spliceosomes\nA:  (B)\n\nQ: According to the pressure-flow model of movement of phloem contents, photosynthate movement from source to sink is driven by\n(A) an ATP-dependent pressure-flow pump (B) a water-pressure potential gradient (C) transpiration (D) apoplastic diffusion\nA:  (B)\n\nQ: Which of the following represents an accurate statement concerning arthropods?\n(A) They possess an exoskeleton composed primarily of peptidoglycan. (B) They possess an open circulatory system with a dorsal heart. (C) They are members of a biologically unsuccessful phylum incapable of exploiting diverse habitats and nutrition sources. (D) They lack paired, jointed appendages.\nA:  (B)\n\nQ: If the activity of an enzyme is constant over a broad range of pH values, it is likely that\n(A) only ionizing groups on the enzyme participate in the reaction (B) only ionizing groups on the substrate participate in the reaction (C) ionizing groups on both the enzyme and substrate participate in the reaction (D) no ionizing groups on the enzyme or substrate participate in the reaction\nA: ",
        {
          "until": [
            "</s>"
          ]
        }
      ]
    ],
    "resps": [
      [
        "(C)"
      ]
    ],
    "filtered_resps": [
      "(C)"
    ],
    "exact_match": 0.0
  },
  {
    "doc_id": 86,
    "doc": {
      "question": "The crouching of very young birds in response to a predator\u2019s shape overhead is an example of",
      "subject": "college_biology",
      "choices": [
        "a conditioned response",
        "a fixed action pattern",
        "an imprinted behavior",
        "learned behavior"
      ],
      "answer": 1
    },
    "target": "(B)",
    "arguments": [
      [
        "The following are multiple choice questions (with answers) about college biology.\n\nQ: In a given population, 1 out of every 400 people has a cancer caused by a completely recessive allele, b. Assuming the population is in Hardy-Weinberg equilibrium, which of the following is the expected proportion of individuals who carry the b allele but are not expected to develop the cancer?\n(A) 1/400 (B) 19/400 (C) 20/400 (D) 38/400\nA:  (D)\n\nQ: Which of the following represents an accurate statement concerning arthropods?\n(A) They possess an exoskeleton composed primarily of peptidoglycan. (B) They possess an open circulatory system with a dorsal heart. (C) They are members of a biologically unsuccessful phylum incapable of exploiting diverse habitats and nutrition sources. (D) They lack paired, jointed appendages.\nA:  (B)\n\nQ: According to the pressure-flow model of movement of phloem contents, photosynthate movement from source to sink is driven by\n(A) an ATP-dependent pressure-flow pump (B) a water-pressure potential gradient (C) transpiration (D) apoplastic diffusion\nA:  (B)\n\nQ: Which of the following contain DNA sequences required for the segregation of chromosomes in mitosis and meiosis?\n(A) Telomeres (B) Centromeres (C) Nucleosomes (D) Spliceosomes\nA:  (B)\n\nQ: The presence of homologous structures in two different organisms, such as the humerus in the front limb of a human and a bird, indicates that\n(A) the human and bird are polyphyletic species (B) a human's and bird's evolution is convergent (C) the human and bird belong to a clade (D) the human and bird developed by analogy\nA:  (C)\n\nQ: The crouching of very young birds in response to a predator\u2019s shape overhead is an example of\n(A) a conditioned response (B) a fixed action pattern (C) an imprinted behavior (D) learned behavior\nA: ",
        {
          "until": [
            "</s>"
          ]
        }
      ]
    ],
    "resps": [
      [
        "(D)"
      ]
    ],
    "filtered_resps": [
      "(D)"
    ],
    "exact_match": 0.0
  },
  {
    "doc_id": 94,
    "doc": {
      "question": "Which of the following is encoded by the src oncogene and catalyzes the specific addition of phosphate groups to cellular proteins?",
      "subject": "college_biology",
      "choices": [
        "Protein phosphatase",
        "Adenylate cyclase",
        "G protein-linked receptor",
        "Tyrosine kinase"
      ],
      "answer": 3
    },
    "target": "(D)",
    "arguments": [
      [
        "The following are multiple choice questions (with answers) about college biology.\n\nQ: Which of the following represents an accurate statement concerning arthropods?\n(A) They possess an exoskeleton composed primarily of peptidoglycan. (B) They possess an open circulatory system with a dorsal heart. (C) They are members of a biologically unsuccessful phylum incapable of exploiting diverse habitats and nutrition sources. (D) They lack paired, jointed appendages.\nA:  (B)\n\nQ: In a given population, 1 out of every 400 people has a cancer caused by a completely recessive allele, b. Assuming the population is in Hardy-Weinberg equilibrium, which of the following is the expected proportion of individuals who carry the b allele but are not expected to develop the cancer?\n(A) 1/400 (B) 19/400 (C) 20/400 (D) 38/400\nA:  (D)\n\nQ: Which of the following contain DNA sequences required for the segregation of chromosomes in mitosis and meiosis?\n(A) Telomeres (B) Centromeres (C) Nucleosomes (D) Spliceosomes\nA:  (B)\n\nQ: The presence of homologous structures in two different organisms, such as the humerus in the front limb of a human and a bird, indicates that\n(A) the human and bird are polyphyletic species (B) a human's and bird's evolution is convergent (C) the human and bird belong to a clade (D) the human and bird developed by analogy\nA:  (C)\n\nQ: According to the pressure-flow model of movement of phloem contents, photosynthate movement from source to sink is driven by\n(A) an ATP-dependent pressure-flow pump (B) a water-pressure potential gradient (C) transpiration (D) apoplastic diffusion\nA:  (B)\n\nQ: Which of the following is encoded by the src oncogene and catalyzes the specific addition of phosphate groups to cellular proteins?\n(A) Protein phosphatase (B) Adenylate cyclase (C) G protein-linked receptor (D) Tyrosine kinase\nA: ",
        {
          "until": [
            "</s>"
          ]
        }
      ]
    ],
    "resps": [
      [
        "(D)"
      ]
    ],
    "filtered_resps": [
      "(D)"
    ],
    "exact_match": 1.0
  },
  {
    "doc_id": 102,
    "doc": {
      "question": "Stabilization of the unique coiled structure of an alpha helix in a protein is primarily attributed to (A) hydrogen bonding between the peptide backbone atoms",
      "subject": "college_biology",
      "choices": [
        "hydrogen bonding between the peptide backbone atoms",
        "disulfide bridges between cysteine side chains",
        "carbohydrate moieties attached to polar amino acids",
        "peptide linkages that covalently bond amino acids"
      ],
      "answer": 0
    },
    "target": "(A)",
    "arguments": [
      [
        "The following are multiple choice questions (with answers) about college biology.\n\nQ: Which of the following represents an accurate statement concerning arthropods?\n(A) They possess an exoskeleton composed primarily of peptidoglycan. (B) They possess an open circulatory system with a dorsal heart. (C) They are members of a biologically unsuccessful phylum incapable of exploiting diverse habitats and nutrition sources. (D) They lack paired, jointed appendages.\nA:  (B)\n\nQ: In a given population, 1 out of every 400 people has a cancer caused by a completely recessive allele, b. Assuming the population is in Hardy-Weinberg equilibrium, which of the following is the expected proportion of individuals who carry the b allele but are not expected to develop the cancer?\n(A) 1/400 (B) 19/400 (C) 20/400 (D) 38/400\nA:  (D)\n\nQ: The presence of homologous structures in two different organisms, such as the humerus in the front limb of a human and a bird, indicates that\n(A) the human and bird are polyphyletic species (B) a human's and bird's evolution is convergent (C) the human and bird belong to a clade (D) the human and bird developed by analogy\nA:  (C)\n\nQ: According to the pressure-flow model of movement of phloem contents, photosynthate movement from source to sink is driven by\n(A) an ATP-dependent pressure-flow pump (B) a water-pressure potential gradient (C) transpiration (D) apoplastic diffusion\nA:  (B)\n\nQ: Which of the following contain DNA sequences required for the segregation of chromosomes in mitosis and meiosis?\n(A) Telomeres (B) Centromeres (C) Nucleosomes (D) Spliceosomes\nA:  (B)\n\nQ: Stabilization of the unique coiled structure of an alpha helix in a protein is primarily attributed to (A) hydrogen bonding between the peptide backbone atoms\n(A) hydrogen bonding between the peptide backbone atoms (B) disulfide bridges between cysteine side chains (C) carbohydrate moieties attached to polar amino acids (D) peptide linkages that covalently bond amino acids\nA: ",
        {
          "until": [
            "</s>"
          ]
        }
      ]
    ],
    "resps": [
      [
        "(A)"
      ]
    ],
    "filtered_resps": [
      "(A)"
    ],
    "exact_match": 1.0
  },
  {
    "doc_id": 110,
    "doc": {
      "question": "Which of the following sources makes the greatest contribution to the dry mass of organic matter that comprises an oak tree?",
      "subject": "college_biology",
      "choices": [
        "Organic molecules from decaying matter in the soil that are taken up by the roots",
        "Mineral nutrients dissolved in groundwater that are taken up by the roots",
        "Water that is taken up by the roots and carbon dioxide from the air",
        "Endosperm located in the cotyledons of the acorn"
      ],
      "answer": 2
    },
    "target": "(C)",
    "arguments": [
      [
        "The following are multiple choice questions (with answers) about college biology.\n\nQ: Which of the following represents an accurate statement concerning arthropods?\n(A) They possess an exoskeleton composed primarily of peptidoglycan. (B) They possess an open circulatory system with a dorsal heart. (C) They are members of a biologically unsuccessful phylum incapable of exploiting diverse habitats and nutrition sources. (D) They lack paired, jointed appendages.\nA:  (B)\n\nQ: According to the pressure-flow model of movement of phloem contents, photosynthate movement from source to sink is driven by\n(A) an ATP-dependent pressure-flow pump (B) a water-pressure potential gradient (C) transpiration (D) apoplastic diffusion\nA:  (B)\n\nQ: In a given population, 1 out of every 400 people has a cancer caused by a completely recessive allele, b. Assuming the population is in Hardy-Weinberg equilibrium, which of the following is the expected proportion of individuals who carry the b allele but are not expected to develop the cancer?\n(A) 1/400 (B) 19/400 (C) 20/400 (D) 38/400\nA:  (D)\n\nQ: Which of the following contain DNA sequences required for the segregation of chromosomes in mitosis and meiosis?\n(A) Telomeres (B) Centromeres (C) Nucleosomes (D) Spliceosomes\nA:  (B)\n\nQ: The presence of homologous structures in two different organisms, such as the humerus in the front limb of a human and a bird, indicates that\n(A) the human and bird are polyphyletic species (B) a human's and bird's evolution is convergent (C) the human and bird belong to a clade (D) the human and bird developed by analogy\nA:  (C)\n\nQ: Which of the following sources makes the greatest contribution to the dry mass of organic matter that comprises an oak tree?\n(A) Organic molecules from decaying matter in the soil that are taken up by the roots (B) Mineral nutrients dissolved in groundwater that are taken up by the roots (C) Water that is taken up by the roots and carbon dioxide from the air (D) Endosperm located in the cotyledons of the acorn\nA: ",
        {
          "until": [
            "</s>"
          ]
        }
      ]
    ],
    "resps": [
      [
        "(A)"
      ]
    ],
    "filtered_resps": [
      "(A)"
    ],
    "exact_match": 0.0
  },
  {
    "doc_id": 118,
    "doc": {
      "question": "Proteins were shown to move about in a plane of the plasma membrane when mouse cellsurface proteins and human cell-surface proteins were observed to integrate along a fused mouse-human cell plasma membrane. Which of the following cell culture techniques was most likely employed in order to yield these results?",
      "subject": "college_biology",
      "choices": [
        "Producing a heterokaryon",
        "Producing a hybrid cell",
        "Isolating an immortal variant cell from culture and using it to create a cell line",
        "Inserting a tumor-inducing virus into a normal cell to initiate transformation"
      ],
      "answer": 0
    },
    "target": "(A)",
    "arguments": [
      [
        "The following are multiple choice questions (with answers) about college biology.\n\nQ: The presence of homologous structures in two different organisms, such as the humerus in the front limb of a human and a bird, indicates that\n(A) the human and bird are polyphyletic species (B) a human's and bird's evolution is convergent (C) the human and bird belong to a clade (D) the human and bird developed by analogy\nA:  (C)\n\nQ: In a given population, 1 out of every 400 people has a cancer caused by a completely recessive allele, b. Assuming the population is in Hardy-Weinberg equilibrium, which of the following is the expected proportion of individuals who carry the b allele but are not expected to develop the cancer?\n(A) 1/400 (B) 19/400 (C) 20/400 (D) 38/400\nA:  (D)\n\nQ: According to the pressure-flow model of movement of phloem contents, photosynthate movement from source to sink is driven by\n(A) an ATP-dependent pressure-flow pump (B) a water-pressure potential gradient (C) transpiration (D) apoplastic diffusion\nA:  (B)\n\nQ: Which of the following represents an accurate statement concerning arthropods?\n(A) They possess an exoskeleton composed primarily of peptidoglycan. (B) They possess an open circulatory system with a dorsal heart. (C) They are members of a biologically unsuccessful phylum incapable of exploiting diverse habitats and nutrition sources. (D) They lack paired, jointed appendages.\nA:  (B)\n\nQ: Which of the following contain DNA sequences required for the segregation of chromosomes in mitosis and meiosis?\n(A) Telomeres (B) Centromeres (C) Nucleosomes (D) Spliceosomes\nA:  (B)\n\nQ: Proteins were shown to move about in a plane of the plasma membrane when mouse cellsurface proteins and human cell-surface proteins were observed to integrate along a fused mouse-human cell plasma membrane. Which of the following cell culture techniques was most likely employed in order to yield these results?\n(A) Producing a heterokaryon (B) Producing a hybrid cell (C) Isolating an immortal variant cell from culture and using it to create a cell line (D) Inserting a tumor-inducing virus into a normal cell to initiate transformation\nA: ",
        {
          "until": [
            "</s>"
          ]
        }
      ]
    ],
    "resps": [
      [
        "(B)"
      ]
    ],
    "filtered_resps": [
      "(B)"
    ],
    "exact_match": 0.0
  },
  {
    "doc_id": 126,
    "doc": {
      "question": "Double fertilization is a unique feature of flowering plants. In this process, one sperm unites with the egg to yield a zygote. The second sperm unites with the polar nuclei to initiate the formation of the",
      "subject": "college_biology",
      "choices": [
        "megagametophyte",
        "endodermis",
        "embryo",
        "endosperm"
      ],
      "answer": 3
    },
    "target": "(D)",
    "arguments": [
      [
        "The following are multiple choice questions (with answers) about college biology.\n\nQ: Which of the following represents an accurate statement concerning arthropods?\n(A) They possess an exoskeleton composed primarily of peptidoglycan. (B) They possess an open circulatory system with a dorsal heart. (C) They are members of a biologically unsuccessful phylum incapable of exploiting diverse habitats and nutrition sources. (D) They lack paired, jointed appendages.\nA:  (B)\n\nQ: According to the pressure-flow model of movement of phloem contents, photosynthate movement from source to sink is driven by\n(A) an ATP-dependent pressure-flow pump (B) a water-pressure potential gradient (C) transpiration (D) apoplastic diffusion\nA:  (B)\n\nQ: In a given population, 1 out of every 400 people has a cancer caused by a completely recessive allele, b. Assuming the population is in Hardy-Weinberg equilibrium, which of the following is the expected proportion of individuals who carry the b allele but are not expected to develop the cancer?\n(A) 1/400 (B) 19/400 (C) 20/400 (D) 38/400\nA:  (D)\n\nQ: The presence of homologous structures in two different organisms, such as the humerus in the front limb of a human and a bird, indicates that\n(A) the human and bird are polyphyletic species (B) a human's and bird's evolution is convergent (C) the human and bird belong to a clade (D) the human and bird developed by analogy\nA:  (C)\n\nQ: Which of the following contain DNA sequences required for the segregation of chromosomes in mitosis and meiosis?\n(A) Telomeres (B) Centromeres (C) Nucleosomes (D) Spliceosomes\nA:  (B)\n\nQ: Double fertilization is a unique feature of flowering plants. In this process, one sperm unites with the egg to yield a zygote. The second sperm unites with the polar nuclei to initiate the formation of the\n(A) megagametophyte (B) endodermis (C) embryo (D) endosperm\nA: ",
        {
          "until": [
            "</s>"
          ]
        }
      ]
    ],
    "resps": [
      [
        "(D)"
      ]
    ],
    "filtered_resps": [
      "(D)"
    ],
    "exact_match": 1.0
  },
  {
    "doc_id": 134,
    "doc": {
      "question": "Which of the following is a reason that geneticists use mitochondrial DNA (mtDNA) to study the relatedness of animal populations?",
      "subject": "college_biology",
      "choices": [
        "mtDNA mutates at a slower rate than nuclear DNA.",
        "mtDNA is passed from mother to child and is free from recombination that occurs between pairs of chromosomes.",
        "There are few single nucleotide polymorphisms in the hypervariable, noncoding regions.",
        "All mitochondrial proteins are coded for by mitochondrial genes."
      ],
      "answer": 1
    },
    "target": "(B)",
    "arguments": [
      [
        "The following are multiple choice questions (with answers) about college biology.\n\nQ: Which of the following contain DNA sequences required for the segregation of chromosomes in mitosis and meiosis?\n(A) Telomeres (B) Centromeres (C) Nucleosomes (D) Spliceosomes\nA:  (B)\n\nQ: According to the pressure-flow model of movement of phloem contents, photosynthate movement from source to sink is driven by\n(A) an ATP-dependent pressure-flow pump (B) a water-pressure potential gradient (C) transpiration (D) apoplastic diffusion\nA:  (B)\n\nQ: In a given population, 1 out of every 400 people has a cancer caused by a completely recessive allele, b. Assuming the population is in Hardy-Weinberg equilibrium, which of the following is the expected proportion of individuals who carry the b allele but are not expected to develop the cancer?\n(A) 1/400 (B) 19/400 (C) 20/400 (D) 38/400\nA:  (D)\n\nQ: Which of the following represents an accurate statement concerning arthropods?\n(A) They possess an exoskeleton composed primarily of peptidoglycan. (B) They possess an open circulatory system with a dorsal heart. (C) They are members of a biologically unsuccessful phylum incapable of exploiting diverse habitats and nutrition sources. (D) They lack paired, jointed appendages.\nA:  (B)\n\nQ: The presence of homologous structures in two different organisms, such as the humerus in the front limb of a human and a bird, indicates that\n(A) the human and bird are polyphyletic species (B) a human's and bird's evolution is convergent (C) the human and bird belong to a clade (D) the human and bird developed by analogy\nA:  (C)\n\nQ: Which of the following is a reason that geneticists use mitochondrial DNA (mtDNA) to study the relatedness of animal populations?\n(A) mtDNA mutates at a slower rate than nuclear DNA. (B) mtDNA is passed from mother to child and is free from recombination that occurs between pairs of chromosomes. (C) There are few single nucleotide polymorphisms in the hypervariable, noncoding regions. (D) All mitochondrial proteins are coded for by mitochondrial genes.\nA: ",
        {
          "until": [
            "</s>"
          ]
        }
      ]
    ],
    "resps": [
      [
        "(A)"
      ]
    ],
    "filtered_resps": [
      "(A)"
    ],
    "exact_match": 0.0
  },
  {
    "doc_id": 142,
    "doc": {
      "question": "Which of the following characteristics is predicted for an early-successional plant community?",
      "subject": "college_biology",
      "choices": [
        "High niche divergence among co-occurring species",
        "High ratios of primary production to standing-crop biomass",
        "High frequency of K-selected species",
        "High detrital biomass"
      ],
      "answer": 1
    },
    "target": "(B)",
    "arguments": [
      [
        "The following are multiple choice questions (with answers) about college biology.\n\nQ: Which of the following contain DNA sequences required for the segregation of chromosomes in mitosis and meiosis?\n(A) Telomeres (B) Centromeres (C) Nucleosomes (D) Spliceosomes\nA:  (B)\n\nQ: In a given population, 1 out of every 400 people has a cancer caused by a completely recessive allele, b. Assuming the population is in Hardy-Weinberg equilibrium, which of the following is the expected proportion of individuals who carry the b allele but are not expected to develop the cancer?\n(A) 1/400 (B) 19/400 (C) 20/400 (D) 38/400\nA:  (D)\n\nQ: According to the pressure-flow model of movement of phloem contents, photosynthate movement from source to sink is driven by\n(A) an ATP-dependent pressure-flow pump (B) a water-pressure potential gradient (C) transpiration (D) apoplastic diffusion\nA:  (B)\n\nQ: The presence of homologous structures in two different organisms, such as the humerus in the front limb of a human and a bird, indicates that\n(A) the human and bird are polyphyletic species (B) a human's and bird's evolution is convergent (C) the human and bird belong to a clade (D) the human and bird developed by analogy\nA:  (C)\n\nQ: Which of the following represents an accurate statement concerning arthropods?\n(A) They possess an exoskeleton composed primarily of peptidoglycan. (B) They possess an open circulatory system with a dorsal heart. (C) They are members of a biologically unsuccessful phylum incapable of exploiting diverse habitats and nutrition sources. (D) They lack paired, jointed appendages.\nA:  (B)\n\nQ: Which of the following characteristics is predicted for an early-successional plant community?\n(A) High niche divergence among co-occurring species (B) High ratios of primary production to standing-crop biomass (C) High frequency of K-selected species (D) High detrital biomass\nA: ",
        {
          "until": [
            "</s>"
          ]
        }
      ]
    ],
    "resps": [
      [
        "(B)"
      ]
    ],
    "filtered_resps": [
      "(B)"
    ],
    "exact_match": 1.0
  },
  {
    "doc_id": 7,
    "doc": {
      "question": "Which of the following is NOT a source of atmospheric carbon?",
      "subject": "college_biology",
      "choices": [
        "Respiration",
        "Photosynthesis",
        "Bacterial decomposition",
        "Combustion of fossil fuels"
      ],
      "answer": 1
    },
    "target": "(B)",
    "arguments": [
      [
        "The following are multiple choice questions (with answers) about college biology.\n\nQ: According to the pressure-flow model of movement of phloem contents, photosynthate movement from source to sink is driven by\n(A) an ATP-dependent pressure-flow pump (B) a water-pressure potential gradient (C) transpiration (D) apoplastic diffusion\nA:  (B)\n\nQ: Which of the following represents an accurate statement concerning arthropods?\n(A) They possess an exoskeleton composed primarily of peptidoglycan. (B) They possess an open circulatory system with a dorsal heart. (C) They are members of a biologically unsuccessful phylum incapable of exploiting diverse habitats and nutrition sources. (D) They lack paired, jointed appendages.\nA:  (B)\n\nQ: Which of the following contain DNA sequences required for the segregation of chromosomes in mitosis and meiosis?\n(A) Telomeres (B) Centromeres (C) Nucleosomes (D) Spliceosomes\nA:  (B)\n\nQ: The presence of homologous structures in two different organisms, such as the humerus in the front limb of a human and a bird, indicates that\n(A) the human and bird are polyphyletic species (B) a human's and bird's evolution is convergent (C) the human and bird belong to a clade (D) the human and bird developed by analogy\nA:  (C)\n\nQ: In a given population, 1 out of every 400 people has a cancer caused by a completely recessive allele, b. Assuming the population is in Hardy-Weinberg equilibrium, which of the following is the expected proportion of individuals who carry the b allele but are not expected to develop the cancer?\n(A) 1/400 (B) 19/400 (C) 20/400 (D) 38/400\nA:  (D)\n\nQ: Which of the following is NOT a source of atmospheric carbon?\n(A) Respiration (B) Photosynthesis (C) Bacterial decomposition (D) Combustion of fossil fuels\nA: ",
        {
          "until": [
            "</s>"
          ]
        }
      ]
    ],
    "resps": [
      [
        "(D)"
      ]
    ],
    "filtered_resps": [
      "(D)"
    ],
    "exact_match": 0.0
  },
  {
    "doc_id": 15,
    "doc": {
      "question": "A rise in intracellular free calcium in the sea urchin oocyte causes the release of proteolytic enzymes which act to prevent polyspermy. The events just described entail the",
      "subject": "college_biology",
      "choices": [
        "zona reaction",
        "acrosomal reaction",
        "cortical reaction",
        "fertilization reaction"
      ],
      "answer": 2
    },
    "target": "(C)",
    "arguments": [
      [
        "The following are multiple choice questions (with answers) about college biology.\n\nQ: Which of the following represents an accurate statement concerning arthropods?\n(A) They possess an exoskeleton composed primarily of peptidoglycan. (B) They possess an open circulatory system with a dorsal heart. (C) They are members of a biologically unsuccessful phylum incapable of exploiting diverse habitats and nutrition sources. (D) They lack paired, jointed appendages.\nA:  (B)\n\nQ: Which of the following contain DNA sequences required for the segregation of chromosomes in mitosis and meiosis?\n(A) Telomeres (B) Centromeres (C) Nucleosomes (D) Spliceosomes\nA:  (B)\n\nQ: In a given population, 1 out of every 400 people has a cancer caused by a completely recessive allele, b. Assuming the population is in Hardy-Weinberg equilibrium, which of the following is the expected proportion of individuals who carry the b allele but are not expected to develop the cancer?\n(A) 1/400 (B) 19/400 (C) 20/400 (D) 38/400\nA:  (D)\n\nQ: According to the pressure-flow model of movement of phloem contents, photosynthate movement from source to sink is driven by\n(A) an ATP-dependent pressure-flow pump (B) a water-pressure potential gradient (C) transpiration (D) apoplastic diffusion\nA:  (B)\n\nQ: The presence of homologous structures in two different organisms, such as the humerus in the front limb of a human and a bird, indicates that\n(A) the human and bird are polyphyletic species (B) a human's and bird's evolution is convergent (C) the human and bird belong to a clade (D) the human and bird developed by analogy\nA:  (C)\n\nQ: A rise in intracellular free calcium in the sea urchin oocyte causes the release of proteolytic enzymes which act to prevent polyspermy. The events just described entail the\n(A) zona reaction (B) acrosomal reaction (C) cortical reaction (D) fertilization reaction\nA: ",
        {
          "until": [
            "</s>"
          ]
        }
      ]
    ],
    "resps": [
      [
        "(D)"
      ]
    ],
    "filtered_resps": [
      "(D)"
    ],
    "exact_match": 0.0
  },
  {
    "doc_id": 23,
    "doc": {
      "question": "The cell type comprising the pith tissue centered within a dicot stem is the",
      "subject": "college_biology",
      "choices": [
        "parenchyma",
        "sclerenchyma",
        "vascular cambium",
        "vascular bundle"
      ],
      "answer": 0
    },
    "target": "(A)",
    "arguments": [
      [
        "The following are multiple choice questions (with answers) about college biology.\n\nQ: Which of the following represents an accurate statement concerning arthropods?\n(A) They possess an exoskeleton composed primarily of peptidoglycan. (B) They possess an open circulatory system with a dorsal heart. (C) They are members of a biologically unsuccessful phylum incapable of exploiting diverse habitats and nutrition sources. (D) They lack paired, jointed appendages.\nA:  (B)\n\nQ: Which of the following contain DNA sequences required for the segregation of chromosomes in mitosis and meiosis?\n(A) Telomeres (B) Centromeres (C) Nucleosomes (D) Spliceosomes\nA:  (B)\n\nQ: In a given population, 1 out of every 400 people has a cancer caused by a completely recessive allele, b. Assuming the population is in Hardy-Weinberg equilibrium, which of the following is the expected proportion of individuals who carry the b allele but are not expected to develop the cancer?\n(A) 1/400 (B) 19/400 (C) 20/400 (D) 38/400\nA:  (D)\n\nQ: The presence of homologous structures in two different organisms, such as the humerus in the front limb of a human and a bird, indicates that\n(A) the human and bird are polyphyletic species (B) a human's and bird's evolution is convergent (C) the human and bird belong to a clade (D) the human and bird developed by analogy\nA:  (C)\n\nQ: According to the pressure-flow model of movement of phloem contents, photosynthate movement from source to sink is driven by\n(A) an ATP-dependent pressure-flow pump (B) a water-pressure potential gradient (C) transpiration (D) apoplastic diffusion\nA:  (B)\n\nQ: The cell type comprising the pith tissue centered within a dicot stem is the\n(A) parenchyma (B) sclerenchyma (C) vascular cambium (D) vascular bundle\nA: ",
        {
          "until": [
            "</s>"
          ]
        }
      ]
    ],
    "resps": [
      [
        "(A)"
      ]
    ],
    "filtered_resps": [
      "(A)"
    ],
    "exact_match": 1.0
  },
  {
    "doc_id": 31,
    "doc": {
      "question": "Which of the following is typically NOT found in normal somatic cells of a human male?",
      "subject": "college_biology",
      "choices": [
        "The entire genetic information possessed by the original zygote",
        "An inactivated X chromosome",
        "Forty-four autosomes",
        "A diploid nucleus"
      ],
      "answer": 1
    },
    "target": "(B)",
    "arguments": [
      [
        "The following are multiple choice questions (with answers) about college biology.\n\nQ: In a given population, 1 out of every 400 people has a cancer caused by a completely recessive allele, b. Assuming the population is in Hardy-Weinberg equilibrium, which of the following is the expected proportion of individuals who carry the b allele but are not expected to develop the cancer?\n(A) 1/400 (B) 19/400 (C) 20/400 (D) 38/400\nA:  (D)\n\nQ: Which of the following represents an accurate statement concerning arthropods?\n(A) They possess an exoskeleton composed primarily of peptidoglycan. (B) They possess an open circulatory system with a dorsal heart. (C) They are members of a biologically unsuccessful phylum incapable of exploiting diverse habitats and nutrition sources. (D) They lack paired, jointed appendages.\nA:  (B)\n\nQ: According to the pressure-flow model of movement of phloem contents, photosynthate movement from source to sink is driven by\n(A) an ATP-dependent pressure-flow pump (B) a water-pressure potential gradient (C) transpiration (D) apoplastic diffusion\nA:  (B)\n\nQ: The presence of homologous structures in two different organisms, such as the humerus in the front limb of a human and a bird, indicates that\n(A) the human and bird are polyphyletic species (B) a human's and bird's evolution is convergent (C) the human and bird belong to a clade (D) the human and bird developed by analogy\nA:  (C)\n\nQ: Which of the following contain DNA sequences required for the segregation of chromosomes in mitosis and meiosis?\n(A) Telomeres (B) Centromeres (C) Nucleosomes (D) Spliceosomes\nA:  (B)\n\nQ: Which of the following is typically NOT found in normal somatic cells of a human male?\n(A) The entire genetic information possessed by the original zygote (B) An inactivated X chromosome (C) Forty-four autosomes (D) A diploid nucleus\nA: ",
        {
          "until": [
            "</s>"
          ]
        }
      ]
    ],
    "resps": [
      [
        "(D)"
      ]
    ],
    "filtered_resps": [
      "(D)"
    ],
    "exact_match": 0.0
  },
  {
    "doc_id": 39,
    "doc": {
      "question": "An embryologist studying the development of a vertebrate organism from the zygote stage to fetus would be justified in drawing which of the following conclusions?",
      "subject": "college_biology",
      "choices": [
        "Ontogeny recapitulates phylogeny.",
        "Early embryos display identical features of their class, order, and species.",
        "An early human embryo has features in common with early fish and avian embryos.",
        "A human embryo displays features of adult fish and birds in the course of its development."
      ],
      "answer": 0
    },
    "target": "(A)",
    "arguments": [
      [
        "The following are multiple choice questions (with answers) about college biology.\n\nQ: Which of the following contain DNA sequences required for the segregation of chromosomes in mitosis and meiosis?\n(A) Telomeres (B) Centromeres (C) Nucleosomes (D) Spliceosomes\nA:  (B)\n\nQ: According to the pressure-flow model of movement of phloem contents, photosynthate movement from source to sink is driven by\n(A) an ATP-dependent pressure-flow pump (B) a water-pressure potential gradient (C) transpiration (D) apoplastic diffusion\nA:  (B)\n\nQ: Which of the following represents an accurate statement concerning arthropods?\n(A) They possess an exoskeleton composed primarily of peptidoglycan. (B) They possess an open circulatory system with a dorsal heart. (C) They are members of a biologically unsuccessful phylum incapable of exploiting diverse habitats and nutrition sources. (D) They lack paired, jointed appendages.\nA:  (B)\n\nQ: The presence of homologous structures in two different organisms, such as the humerus in the front limb of a human and a bird, indicates that\n(A) the human and bird are polyphyletic species (B) a human's and bird's evolution is convergent (C) the human and bird belong to a clade (D) the human and bird developed by analogy\nA:  (C)\n\nQ: In a given population, 1 out of every 400 people has a cancer caused by a completely recessive allele, b. Assuming the population is in Hardy-Weinberg equilibrium, which of the following is the expected proportion of individuals who carry the b allele but are not expected to develop the cancer?\n(A) 1/400 (B) 19/400 (C) 20/400 (D) 38/400\nA:  (D)\n\nQ: An embryologist studying the development of a vertebrate organism from the zygote stage to fetus would be justified in drawing which of the following conclusions?\n(A) Ontogeny recapitulates phylogeny. (B) Early embryos display identical features of their class, order, and species. (C) An early human embryo has features in common with early fish and avian embryos. (D) A human embryo displays features of adult fish and birds in the course of its development.\nA: ",
        {
          "until": [
            "</s>"
          ]
        }
      ]
    ],
    "resps": [
      [
        "(B)"
      ]
    ],
    "filtered_resps": [
      "(B)"
    ],
    "exact_match": 0.0
  },
  {
    "doc_id": 47,
    "doc": {
      "question": "Which of the following is the correct anatomical order of structures in the mammalian female reproductive tract?",
      "subject": "college_biology",
      "choices": [
        "Oviduct, uterus, rete, vagina",
        "Oviduct, epididymis, uterus, vagina",
        "Ovary, oviduct, uterus, vagina",
        "Ovary, uterus, vagina, rete"
      ],
      "answer": 2
    },
    "target": "(C)",
    "arguments": [
      [
        "The following are multiple choice questions (with answers) about college biology.\n\nQ: Which of the following represents an accurate statement concerning arthropods?\n(A) They possess an exoskeleton composed primarily of peptidoglycan. (B) They possess an open circulatory system with a dorsal heart. (C) They are members of a biologically unsuccessful phylum incapable of exploiting diverse habitats and nutrition sources. (D) They lack paired, jointed appendages.\nA:  (B)\n\nQ: Which of the following contain DNA sequences required for the segregation of chromosomes in mitosis and meiosis?\n(A) Telomeres (B) Centromeres (C) Nucleosomes (D) Spliceosomes\nA:  (B)\n\nQ: The presence of homologous structures in two different organisms, such as the humerus in the front limb of a human and a bird, indicates that\n(A) the human and bird are polyphyletic species (B) a human's and bird's evolution is convergent (C) the human and bird belong to a clade (D) the human and bird developed by analogy\nA:  (C)\n\nQ: According to the pressure-flow model of movement of phloem contents, photosynthate movement from source to sink is driven by\n(A) an ATP-dependent pressure-flow pump (B) a water-pressure potential gradient (C) transpiration (D) apoplastic diffusion\nA:  (B)\n\nQ: In a given population, 1 out of every 400 people has a cancer caused by a completely recessive allele, b. Assuming the population is in Hardy-Weinberg equilibrium, which of the following is the expected proportion of individuals who carry the b allele but are not expected to develop the cancer?\n(A) 1/400 (B) 19/400 (C) 20/400 (D) 38/400\nA:  (D)\n\nQ: Which of the following is the correct anatomical order of structures in the mammalian female reproductive tract?\n(A) Oviduct, uterus, rete, vagina (B) Oviduct, epididymis, uterus, vagina (C) Ovary, oviduct, uterus, vagina (D) Ovary, uterus, vagina, rete\nA: ",
        {
          "until": [
            "</s>"
          ]
        }
      ]
    ],
    "resps": [
      [
        "(A)"
      ]
    ],
    "filtered_resps": [
      "(A)"
    ],
    "exact_match": 0.0
  },
  {
    "doc_id": 55,
    "doc": {
      "question": "In an experiment, the first cleavage plane of an amphibian zygote was manipulated so that the gray crescent was contained in only one of the two blastomeres that result from the first cleavage. The two blastomeres were then separated. What is the expected fate of the blastomeres?",
      "subject": "college_biology",
      "choices": [
        "The blastomere with the gray crescent will grow in size more quickly than the one without the gray crescent.",
        "The blastomere with the gray crescent will form a complete, but small, embryo.",
        "The blastomere without the gray crescent will form a complete, but small, embryo.",
        "The blastomere with the gray crescent will stop dividing and die before the second cleavage."
      ],
      "answer": 1
    },
    "target": "(B)",
    "arguments": [
      [
        "The following are multiple choice questions (with answers) about college biology.\n\nQ: Which of the following contain DNA sequences required for the segregation of chromosomes in mitosis and meiosis?\n(A) Telomeres (B) Centromeres (C) Nucleosomes (D) Spliceosomes\nA:  (B)\n\nQ: Which of the following represents an accurate statement concerning arthropods?\n(A) They possess an exoskeleton composed primarily of peptidoglycan. (B) They possess an open circulatory system with a dorsal heart. (C) They are members of a biologically unsuccessful phylum incapable of exploiting diverse habitats and nutrition sources. (D) They lack paired, jointed appendages.\nA:  (B)\n\nQ: The presence of homologous structures in two different organisms, such as the humerus in the front limb of a human and a bird, indicates that\n(A) the human and bird are polyphyletic species (B) a human's and bird's evolution is convergent (C) the human and bird belong to a clade (D) the human and bird developed by analogy\nA:  (C)\n\nQ: In a given population, 1 out of every 400 people has a cancer caused by a completely recessive allele, b. Assuming the population is in Hardy-Weinberg equilibrium, which of the following is the expected proportion of individuals who carry the b allele but are not expected to develop the cancer?\n(A) 1/400 (B) 19/400 (C) 20/400 (D) 38/400\nA:  (D)\n\nQ: According to the pressure-flow model of movement of phloem contents, photosynthate movement from source to sink is driven by\n(A) an ATP-dependent pressure-flow pump (B) a water-pressure potential gradient (C) transpiration (D) apoplastic diffusion\nA:  (B)\n\nQ: In an experiment, the first cleavage plane of an amphibian zygote was manipulated so that the gray crescent was contained in only one of the two blastomeres that result from the first cleavage. The two blastomeres were then separated. What is the expected fate of the blastomeres?\n(A) The blastomere with the gray crescent will grow in size more quickly than the one without the gray crescent. (B) The blastomere with the gray crescent will form a complete, but small, embryo. (C) The blastomere without the gray crescent will form a complete, but small, embryo. (D) The blastomere with the gray crescent will stop dividing and die before the second cleavage.\nA: ",
        {
          "until": [
            "</s>"
          ]
        }
      ]
    ],
    "resps": [
      [
        "(B)"
      ]
    ],
    "filtered_resps": [
      "(B)"
    ],
    "exact_match": 1.0
  },
  {
    "doc_id": 63,
    "doc": {
      "question": "In chloroplasts, a certain protein is found in the lumen of the thylakoid (thylakoid space). It is transcribed in the nucleus and synthesized on cytoplasmic ribosomes. How many membrane bilayers must this protein cross to reach its final location?",
      "subject": "college_biology",
      "choices": [
        "One",
        "Two",
        "Three",
        "Four"
      ],
      "answer": 2
    },
    "target": "(C)",
    "arguments": [
      [
        "The following are multiple choice questions (with answers) about college biology.\n\nQ: The presence of homologous structures in two different organisms, such as the humerus in the front limb of a human and a bird, indicates that\n(A) the human and bird are polyphyletic species (B) a human's and bird's evolution is convergent (C) the human and bird belong to a clade (D) the human and bird developed by analogy\nA:  (C)\n\nQ: Which of the following contain DNA sequences required for the segregation of chromosomes in mitosis and meiosis?\n(A) Telomeres (B) Centromeres (C) Nucleosomes (D) Spliceosomes\nA:  (B)\n\nQ: Which of the following represents an accurate statement concerning arthropods?\n(A) They possess an exoskeleton composed primarily of peptidoglycan. (B) They possess an open circulatory system with a dorsal heart. (C) They are members of a biologically unsuccessful phylum incapable of exploiting diverse habitats and nutrition sources. (D) They lack paired, jointed appendages.\nA:  (B)\n\nQ: According to the pressure-flow model of movement of phloem contents, photosynthate movement from source to sink is driven by\n(A) an ATP-dependent pressure-flow pump (B) a water-pressure potential gradient (C) transpiration (D) apoplastic diffusion\nA:  (B)\n\nQ: In a given population, 1 out of every 400 people has a cancer caused by a completely recessive allele, b. Assuming the population is in Hardy-Weinberg equilibrium, which of the following is the expected proportion of individuals who carry the b allele but are not expected to develop the cancer?\n(A) 1/400 (B) 19/400 (C) 20/400 (D) 38/400\nA:  (D)\n\nQ: In chloroplasts, a certain protein is found in the lumen of the thylakoid (thylakoid space). It is transcribed in the nucleus and synthesized on cytoplasmic ribosomes. How many membrane bilayers must this protein cross to reach its final location?\n(A) One (B) Two (C) Three (D) Four\nA: ",
        {
          "until": [
            "</s>"
          ]
        }
      ]
    ],
    "resps": [
      [
        "(B)"
      ]
    ],
    "filtered_resps": [
      "(B)"
    ],
    "exact_match": 0.0
  },
  {
    "doc_id": 71,
    "doc": {
      "question": "A fluorescent molecule of 1,000 daltons injected into one cell is observed to enter an adjacent cell by passing through a",
      "subject": "college_biology",
      "choices": [
        "spot desmosome",
        "belt desmosome",
        "gap junction",
        "tight junction"
      ],
      "answer": 2
    },
    "target": "(C)",
    "arguments": [
      [
        "The following are multiple choice questions (with answers) about college biology.\n\nQ: Which of the following contain DNA sequences required for the segregation of chromosomes in mitosis and meiosis?\n(A) Telomeres (B) Centromeres (C) Nucleosomes (D) Spliceosomes\nA:  (B)\n\nQ: Which of the following represents an accurate statement concerning arthropods?\n(A) They possess an exoskeleton composed primarily of peptidoglycan. (B) They possess an open circulatory system with a dorsal heart. (C) They are members of a biologically unsuccessful phylum incapable of exploiting diverse habitats and nutrition sources. (D) They lack paired, jointed appendages.\nA:  (B)\n\nQ: The presence of homologous structures in two different organisms, such as the humerus in the front limb of a human and a bird, indicates that\n(A) the human and bird are polyphyletic species (B) a human's and bird's evolution is convergent (C) the human and bird belong to a clade (D) the human and bird developed by analogy\nA:  (C)\n\nQ: According to the pressure-flow model of movement of phloem contents, photosynthate movement from source to sink is driven by\n(A) an ATP-dependent pressure-flow pump (B) a water-pressure potential gradient (C) transpiration (D) apoplastic diffusion\nA:  (B)\n\nQ: In a given population, 1 out of every 400 people has a cancer caused by a completely recessive allele, b. Assuming the population is in Hardy-Weinberg equilibrium, which of the following is the expected proportion of individuals who carry the b allele but are not expected to develop the cancer?\n(A) 1/400 (B) 19/400 (C) 20/400 (D) 38/400\nA:  (D)\n\nQ: A fluorescent molecule of 1,000 daltons injected into one cell is observed to enter an adjacent cell by passing through a\n(A) spot desmosome (B) belt desmosome (C) gap junction (D) tight junction\nA: ",
        {
          "until": [
            "</s>"
          ]
        }
      ]
    ],
    "resps": [
      [
        "(C)"
      ]
    ],
    "filtered_resps": [
      "(C)"
    ],
    "exact_match": 1.0
  },
  {
    "doc_id": 79,
    "doc": {
      "question": "In garden peas, the allele for tall plants (D) is completely dominant to the allele for dwarf plants (d) and the allele for violet flower color (W) is completely dominant to the allele for white flower color (w). In a cross between a tall violet plant, with the genotype DDWw, and a dwarf white plant, what phenotypic ratio of the progeny would be expected from this cross?",
      "subject": "college_biology",
      "choices": [
        "All tall violet",
        "1 tall violet: 1 dwarf violet",
        "1 tall violet: 1 tall white: 1 dwarf violet: 1 dwarf white",
        "1 tall violet: 1 tall white"
      ],
      "answer": 3
    },
    "target": "(D)",
    "arguments": [
      [
        "The following are multiple choice questions (with answers) about college biology.\n\nQ: The presence of homologous structures in two different organisms, such as the humerus in the front limb of a human and a bird, indicates that\n(A) the human and bird are polyphyletic species (B) a human's and bird's evolution is convergent (C) the human and bird belong to a clade (D) the human and bird developed by analogy\nA:  (C)\n\nQ: In a given population, 1 out of every 400 people has a cancer caused by a completely recessive allele, b. Assuming the population is in Hardy-Weinberg equilibrium, which of the following is the expected proportion of individuals who carry the b allele but are not expected to develop the cancer?\n(A) 1/400 (B) 19/400 (C) 20/400 (D) 38/400\nA:  (D)\n\nQ: Which of the following contain DNA sequences required for the segregation of chromosomes in mitosis and meiosis?\n(A) Telomeres (B) Centromeres (C) Nucleosomes (D) Spliceosomes\nA:  (B)\n\nQ: According to the pressure-flow model of movement of phloem contents, photosynthate movement from source to sink is driven by\n(A) an ATP-dependent pressure-flow pump (B) a water-pressure potential gradient (C) transpiration (D) apoplastic diffusion\nA:  (B)\n\nQ: Which of the following represents an accurate statement concerning arthropods?\n(A) They possess an exoskeleton composed primarily of peptidoglycan. (B) They possess an open circulatory system with a dorsal heart. (C) They are members of a biologically unsuccessful phylum incapable of exploiting diverse habitats and nutrition sources. (D) They lack paired, jointed appendages.\nA:  (B)\n\nQ: In garden peas, the allele for tall plants (D) is completely dominant to the allele for dwarf plants (d) and the allele for violet flower color (W) is completely dominant to the allele for white flower color (w). In a cross between a tall violet plant, with the genotype DDWw, and a dwarf white plant, what phenotypic ratio of the progeny would be expected from this cross?\n(A) All tall violet (B) 1 tall violet: 1 dwarf violet (C) 1 tall violet: 1 tall white: 1 dwarf violet: 1 dwarf white (D) 1 tall violet: 1 tall white\nA: ",
        {
          "until": [
            "</s>"
          ]
        }
      ]
    ],
    "resps": [
      [
        "(B)"
      ]
    ],
    "filtered_resps": [
      "(B)"
    ],
    "exact_match": 0.0
  },
  {
    "doc_id": 87,
    "doc": {
      "question": "Among primates, a high degree of sexual dimorphism in a species usually indicates intense competition between",
      "subject": "college_biology",
      "choices": [
        "males in order to obtain individual food resources",
        "males in order to obtain mates",
        "females in order to obtain individual food resources",
        "females in order to obtain mates"
      ],
      "answer": 1
    },
    "target": "(B)",
    "arguments": [
      [
        "The following are multiple choice questions (with answers) about college biology.\n\nQ: In a given population, 1 out of every 400 people has a cancer caused by a completely recessive allele, b. Assuming the population is in Hardy-Weinberg equilibrium, which of the following is the expected proportion of individuals who carry the b allele but are not expected to develop the cancer?\n(A) 1/400 (B) 19/400 (C) 20/400 (D) 38/400\nA:  (D)\n\nQ: Which of the following represents an accurate statement concerning arthropods?\n(A) They possess an exoskeleton composed primarily of peptidoglycan. (B) They possess an open circulatory system with a dorsal heart. (C) They are members of a biologically unsuccessful phylum incapable of exploiting diverse habitats and nutrition sources. (D) They lack paired, jointed appendages.\nA:  (B)\n\nQ: According to the pressure-flow model of movement of phloem contents, photosynthate movement from source to sink is driven by\n(A) an ATP-dependent pressure-flow pump (B) a water-pressure potential gradient (C) transpiration (D) apoplastic diffusion\nA:  (B)\n\nQ: Which of the following contain DNA sequences required for the segregation of chromosomes in mitosis and meiosis?\n(A) Telomeres (B) Centromeres (C) Nucleosomes (D) Spliceosomes\nA:  (B)\n\nQ: The presence of homologous structures in two different organisms, such as the humerus in the front limb of a human and a bird, indicates that\n(A) the human and bird are polyphyletic species (B) a human's and bird's evolution is convergent (C) the human and bird belong to a clade (D) the human and bird developed by analogy\nA:  (C)\n\nQ: Among primates, a high degree of sexual dimorphism in a species usually indicates intense competition between\n(A) males in order to obtain individual food resources (B) males in order to obtain mates (C) females in order to obtain individual food resources (D) females in order to obtain mates\nA: ",
        {
          "until": [
            "</s>"
          ]
        }
      ]
    ],
    "resps": [
      [
        "(C)"
      ]
    ],
    "filtered_resps": [
      "(C)"
    ],
    "exact_match": 0.0
  },
  {
    "doc_id": 95,
    "doc": {
      "question": "Both C4 and CAM plants employ physiological and biochemical strategies to reduce photorespiration. Which of the following is an accurate comparison of the two strategies?",
      "subject": "college_biology",
      "choices": [
        "C4 plants fix CO2 as the 4-carbon acid oxaloacetate, while CAM plants fix CO2 as the 5-carbon acid ribulose 1, 5-bisphosphate.",
        "C4 plants fix CO2 in the mesophyll but carry out the Calvin cycle in the bundle sheath, while CAM plants fix CO2 and carry out the Calvin cycle in the mesophyll.",
        "C4 plants fix CO2 in the bundle sheath but carry out the Calvin cycle in the mesophyll, while CAM plants fix CO2 and carry out the Calvin cycle in the bundle sheath.",
        "C4 plants store CO2 as phosphoglycolate, while CAM plants store CO2 as oxaloacetate."
      ],
      "answer": 1
    },
    "target": "(B)",
    "arguments": [
      [
        "The following are multiple choice questions (with answers) about college biology.\n\nQ: Which of the following represents an accurate statement concerning arthropods?\n(A) They possess an exoskeleton composed primarily of peptidoglycan. (B) They possess an open circulatory system with a dorsal heart. (C) They are members of a biologically unsuccessful phylum incapable of exploiting diverse habitats and nutrition sources. (D) They lack paired, jointed appendages.\nA:  (B)\n\nQ: In a given population, 1 out of every 400 people has a cancer caused by a completely recessive allele, b. Assuming the population is in Hardy-Weinberg equilibrium, which of the following is the expected proportion of individuals who carry the b allele but are not expected to develop the cancer?\n(A) 1/400 (B) 19/400 (C) 20/400 (D) 38/400\nA:  (D)\n\nQ: Which of the following contain DNA sequences required for the segregation of chromosomes in mitosis and meiosis?\n(A) Telomeres (B) Centromeres (C) Nucleosomes (D) Spliceosomes\nA:  (B)\n\nQ: The presence of homologous structures in two different organisms, such as the humerus in the front limb of a human and a bird, indicates that\n(A) the human and bird are polyphyletic species (B) a human's and bird's evolution is convergent (C) the human and bird belong to a clade (D) the human and bird developed by analogy\nA:  (C)\n\nQ: According to the pressure-flow model of movement of phloem contents, photosynthate movement from source to sink is driven by\n(A) an ATP-dependent pressure-flow pump (B) a water-pressure potential gradient (C) transpiration (D) apoplastic diffusion\nA:  (B)\n\nQ: Both C4 and CAM plants employ physiological and biochemical strategies to reduce photorespiration. Which of the following is an accurate comparison of the two strategies?\n(A) C4 plants fix CO2 as the 4-carbon acid oxaloacetate, while CAM plants fix CO2 as the 5-carbon acid ribulose 1, 5-bisphosphate. (B) C4 plants fix CO2 in the mesophyll but carry out the Calvin cycle in the bundle sheath, while CAM plants fix CO2 and carry out the Calvin cycle in the mesophyll. (C) C4 plants fix CO2 in the bundle sheath but carry out the Calvin cycle in the mesophyll, while CAM plants fix CO2 and carry out the Calvin cycle in the bundle sheath. (D) C4 plants store CO2 as phosphoglycolate, while CAM plants store CO2 as oxaloacetate.\nA: ",
        {
          "until": [
            "</s>"
          ]
        }
      ]
    ],
    "resps": [
      [
        "(A)"
      ]
    ],
    "filtered_resps": [
      "(A)"
    ],
    "exact_match": 0.0
  },
  {
    "doc_id": 103,
    "doc": {
      "question": "The target of digestion of a nucleosome dimer to nucleosome monomers by DNase is",
      "subject": "college_biology",
      "choices": [
        "the H1 histone",
        "histones H2A, H2B, H3, and H4",
        "the nucleosome core",
        "linker DNA"
      ],
      "answer": 3
    },
    "target": "(D)",
    "arguments": [
      [
        "The following are multiple choice questions (with answers) about college biology.\n\nQ: Which of the following represents an accurate statement concerning arthropods?\n(A) They possess an exoskeleton composed primarily of peptidoglycan. (B) They possess an open circulatory system with a dorsal heart. (C) They are members of a biologically unsuccessful phylum incapable of exploiting diverse habitats and nutrition sources. (D) They lack paired, jointed appendages.\nA:  (B)\n\nQ: In a given population, 1 out of every 400 people has a cancer caused by a completely recessive allele, b. Assuming the population is in Hardy-Weinberg equilibrium, which of the following is the expected proportion of individuals who carry the b allele but are not expected to develop the cancer?\n(A) 1/400 (B) 19/400 (C) 20/400 (D) 38/400\nA:  (D)\n\nQ: The presence of homologous structures in two different organisms, such as the humerus in the front limb of a human and a bird, indicates that\n(A) the human and bird are polyphyletic species (B) a human's and bird's evolution is convergent (C) the human and bird belong to a clade (D) the human and bird developed by analogy\nA:  (C)\n\nQ: According to the pressure-flow model of movement of phloem contents, photosynthate movement from source to sink is driven by\n(A) an ATP-dependent pressure-flow pump (B) a water-pressure potential gradient (C) transpiration (D) apoplastic diffusion\nA:  (B)\n\nQ: Which of the following contain DNA sequences required for the segregation of chromosomes in mitosis and meiosis?\n(A) Telomeres (B) Centromeres (C) Nucleosomes (D) Spliceosomes\nA:  (B)\n\nQ: The target of digestion of a nucleosome dimer to nucleosome monomers by DNase is\n(A) the H1 histone (B) histones H2A, H2B, H3, and H4 (C) the nucleosome core (D) linker DNA\nA: ",
        {
          "until": [
            "</s>"
          ]
        }
      ]
    ],
    "resps": [
      [
        "(C)"
      ]
    ],
    "filtered_resps": [
      "(C)"
    ],
    "exact_match": 0.0
  },
  {
    "doc_id": 111,
    "doc": {
      "question": "Which of the following must be true in order for evolution to have occurred?",
      "subject": "college_biology",
      "choices": [
        "The frequencies of some alleles in a population's gene pool has changed over successive generations.",
        "The frequencies of some alleles in a population's gene pool has changed during the organisms' lifetimes.",
        "The frequencies of each allele in a population's gene pool has remained constant over successive generations.",
        "The frequencies of each allele in an organism's genotype has remained constant within the organism's lifetime."
      ],
      "answer": 0
    },
    "target": "(A)",
    "arguments": [
      [
        "The following are multiple choice questions (with answers) about college biology.\n\nQ: Which of the following represents an accurate statement concerning arthropods?\n(A) They possess an exoskeleton composed primarily of peptidoglycan. (B) They possess an open circulatory system with a dorsal heart. (C) They are members of a biologically unsuccessful phylum incapable of exploiting diverse habitats and nutrition sources. (D) They lack paired, jointed appendages.\nA:  (B)\n\nQ: According to the pressure-flow model of movement of phloem contents, photosynthate movement from source to sink is driven by\n(A) an ATP-dependent pressure-flow pump (B) a water-pressure potential gradient (C) transpiration (D) apoplastic diffusion\nA:  (B)\n\nQ: In a given population, 1 out of every 400 people has a cancer caused by a completely recessive allele, b. Assuming the population is in Hardy-Weinberg equilibrium, which of the following is the expected proportion of individuals who carry the b allele but are not expected to develop the cancer?\n(A) 1/400 (B) 19/400 (C) 20/400 (D) 38/400\nA:  (D)\n\nQ: Which of the following contain DNA sequences required for the segregation of chromosomes in mitosis and meiosis?\n(A) Telomeres (B) Centromeres (C) Nucleosomes (D) Spliceosomes\nA:  (B)\n\nQ: The presence of homologous structures in two different organisms, such as the humerus in the front limb of a human and a bird, indicates that\n(A) the human and bird are polyphyletic species (B) a human's and bird's evolution is convergent (C) the human and bird belong to a clade (D) the human and bird developed by analogy\nA:  (C)\n\nQ: Which of the following must be true in order for evolution to have occurred?\n(A) The frequencies of some alleles in a population's gene pool has changed over successive generations. (B) The frequencies of some alleles in a population's gene pool has changed during the organisms' lifetimes. (C) The frequencies of each allele in a population's gene pool has remained constant over successive generations. (D) The frequencies of each allele in an organism's genotype has remained constant within the organism's lifetime.\nA: ",
        {
          "until": [
            "</s>"
          ]
        }
      ]
    ],
    "resps": [
      [
        "(A)"
      ]
    ],
    "filtered_resps": [
      "(A)"
    ],
    "exact_match": 1.0
  },
  {
    "doc_id": 119,
    "doc": {
      "question": "Gene flow between populations results in",
      "subject": "college_biology",
      "choices": [
        "an increase in genetic homogeneity in the metapopulation",
        "an increase in the rate of deleterious mutations in the metapopulation",
        "an increased likelihood of speciation",
        "disruption of Hardy-Weinberg equilibrium in the metapopulation"
      ],
      "answer": 0
    },
    "target": "(A)",
    "arguments": [
      [
        "The following are multiple choice questions (with answers) about college biology.\n\nQ: The presence of homologous structures in two different organisms, such as the humerus in the front limb of a human and a bird, indicates that\n(A) the human and bird are polyphyletic species (B) a human's and bird's evolution is convergent (C) the human and bird belong to a clade (D) the human and bird developed by analogy\nA:  (C)\n\nQ: In a given population, 1 out of every 400 people has a cancer caused by a completely recessive allele, b. Assuming the population is in Hardy-Weinberg equilibrium, which of the following is the expected proportion of individuals who carry the b allele but are not expected to develop the cancer?\n(A) 1/400 (B) 19/400 (C) 20/400 (D) 38/400\nA:  (D)\n\nQ: According to the pressure-flow model of movement of phloem contents, photosynthate movement from source to sink is driven by\n(A) an ATP-dependent pressure-flow pump (B) a water-pressure potential gradient (C) transpiration (D) apoplastic diffusion\nA:  (B)\n\nQ: Which of the following represents an accurate statement concerning arthropods?\n(A) They possess an exoskeleton composed primarily of peptidoglycan. (B) They possess an open circulatory system with a dorsal heart. (C) They are members of a biologically unsuccessful phylum incapable of exploiting diverse habitats and nutrition sources. (D) They lack paired, jointed appendages.\nA:  (B)\n\nQ: Which of the following contain DNA sequences required for the segregation of chromosomes in mitosis and meiosis?\n(A) Telomeres (B) Centromeres (C) Nucleosomes (D) Spliceosomes\nA:  (B)\n\nQ: Gene flow between populations results in\n(A) an increase in genetic homogeneity in the metapopulation (B) an increase in the rate of deleterious mutations in the metapopulation (C) an increased likelihood of speciation (D) disruption of Hardy-Weinberg equilibrium in the metapopulation\nA: ",
        {
          "until": [
            "</s>"
          ]
        }
      ]
    ],
    "resps": [
      [
        "(D)"
      ]
    ],
    "filtered_resps": [
      "(D)"
    ],
    "exact_match": 0.0
  },
  {
    "doc_id": 127,
    "doc": {
      "question": "Mutation of homeotic cluster genes often results in which of the following developmental defects in Drosophila?",
      "subject": "college_biology",
      "choices": [
        "Absence of a group of contiguous segments",
        "Transformation of one segment into another",
        "Polarity defects in every segment along the anterior-posterior axis",
        "Tumor formation in imaginal discs"
      ],
      "answer": 1
    },
    "target": "(B)",
    "arguments": [
      [
        "The following are multiple choice questions (with answers) about college biology.\n\nQ: Which of the following represents an accurate statement concerning arthropods?\n(A) They possess an exoskeleton composed primarily of peptidoglycan. (B) They possess an open circulatory system with a dorsal heart. (C) They are members of a biologically unsuccessful phylum incapable of exploiting diverse habitats and nutrition sources. (D) They lack paired, jointed appendages.\nA:  (B)\n\nQ: According to the pressure-flow model of movement of phloem contents, photosynthate movement from source to sink is driven by\n(A) an ATP-dependent pressure-flow pump (B) a water-pressure potential gradient (C) transpiration (D) apoplastic diffusion\nA:  (B)\n\nQ: In a given population, 1 out of every 400 people has a cancer caused by a completely recessive allele, b. Assuming the population is in Hardy-Weinberg equilibrium, which of the following is the expected proportion of individuals who carry the b allele but are not expected to develop the cancer?\n(A) 1/400 (B) 19/400 (C) 20/400 (D) 38/400\nA:  (D)\n\nQ: The presence of homologous structures in two different organisms, such as the humerus in the front limb of a human and a bird, indicates that\n(A) the human and bird are polyphyletic species (B) a human's and bird's evolution is convergent (C) the human and bird belong to a clade (D) the human and bird developed by analogy\nA:  (C)\n\nQ: Which of the following contain DNA sequences required for the segregation of chromosomes in mitosis and meiosis?\n(A) Telomeres (B) Centromeres (C) Nucleosomes (D) Spliceosomes\nA:  (B)\n\nQ: Mutation of homeotic cluster genes often results in which of the following developmental defects in Drosophila?\n(A) Absence of a group of contiguous segments (B) Transformation of one segment into another (C) Polarity defects in every segment along the anterior-posterior axis (D) Tumor formation in imaginal discs\nA: ",
        {
          "until": [
            "</s>"
          ]
        }
      ]
    ],
    "resps": [
      [
        "(C)"
      ]
    ],
    "filtered_resps": [
      "(C)"
    ],
    "exact_match": 0.0
  },
  {
    "doc_id": 135,
    "doc": {
      "question": "A quote from a natural resources text states: \"Whenever the original ecosystem becomes restructured by man, it tends to become simplified, with a resultant disruption of the stabilizing influences of density-dependent regulatory factors.\" This implies that in a disturbed ecosystem",
      "subject": "college_biology",
      "choices": [
        "there exist large populations of a low number of species",
        "population levels of a species are kept at equilibrium through natural regulatory mechanisms",
        "a given prey organism is subject to higher predation rates by more diverse predators",
        "a given prey organism is less likely to undergo a population surge"
      ],
      "answer": 0
    },
    "target": "(A)",
    "arguments": [
      [
        "The following are multiple choice questions (with answers) about college biology.\n\nQ: Which of the following contain DNA sequences required for the segregation of chromosomes in mitosis and meiosis?\n(A) Telomeres (B) Centromeres (C) Nucleosomes (D) Spliceosomes\nA:  (B)\n\nQ: According to the pressure-flow model of movement of phloem contents, photosynthate movement from source to sink is driven by\n(A) an ATP-dependent pressure-flow pump (B) a water-pressure potential gradient (C) transpiration (D) apoplastic diffusion\nA:  (B)\n\nQ: In a given population, 1 out of every 400 people has a cancer caused by a completely recessive allele, b. Assuming the population is in Hardy-Weinberg equilibrium, which of the following is the expected proportion of individuals who carry the b allele but are not expected to develop the cancer?\n(A) 1/400 (B) 19/400 (C) 20/400 (D) 38/400\nA:  (D)\n\nQ: Which of the following represents an accurate statement concerning arthropods?\n(A) They possess an exoskeleton composed primarily of peptidoglycan. (B) They possess an open circulatory system with a dorsal heart. (C) They are members of a biologically unsuccessful phylum incapable of exploiting diverse habitats and nutrition sources. (D) They lack paired, jointed appendages.\nA:  (B)\n\nQ: The presence of homologous structures in two different organisms, such as the humerus in the front limb of a human and a bird, indicates that\n(A) the human and bird are polyphyletic species (B) a human's and bird's evolution is convergent (C) the human and bird belong to a clade (D) the human and bird developed by analogy\nA:  (C)\n\nQ: A quote from a natural resources text states: \"Whenever the original ecosystem becomes restructured by man, it tends to become simplified, with a resultant disruption of the stabilizing influences of density-dependent regulatory factors.\" This implies that in a disturbed ecosystem\n(A) there exist large populations of a low number of species (B) population levels of a species are kept at equilibrium through natural regulatory mechanisms (C) a given prey organism is subject to higher predation rates by more diverse predators (D) a given prey organism is less likely to undergo a population surge\nA: ",
        {
          "until": [
            "</s>"
          ]
        }
      ]
    ],
    "resps": [
      [
        "(B)"
      ]
    ],
    "filtered_resps": [
      "(B)"
    ],
    "exact_match": 0.0
  },
  {
    "doc_id": 143,
    "doc": {
      "question": "Which of the following is the symplastic pathway for the movement of sucrose from the site of photosynthesis in mesophyll cells into the phloem?",
      "subject": "college_biology",
      "choices": [
        "Fibers, phloem parenchyma, companion cell, sieve tube",
        "Phloem parenchyma, fibers, bundle sheath, tracheids",
        "Companion cells, phloem parenchyma, fibers, sieve tube",
        "Bundle sheath, phloem parenchyma, companion cell, sieve tube"
      ],
      "answer": 3
    },
    "target": "(D)",
    "arguments": [
      [
        "The following are multiple choice questions (with answers) about college biology.\n\nQ: Which of the following contain DNA sequences required for the segregation of chromosomes in mitosis and meiosis?\n(A) Telomeres (B) Centromeres (C) Nucleosomes (D) Spliceosomes\nA:  (B)\n\nQ: In a given population, 1 out of every 400 people has a cancer caused by a completely recessive allele, b. Assuming the population is in Hardy-Weinberg equilibrium, which of the following is the expected proportion of individuals who carry the b allele but are not expected to develop the cancer?\n(A) 1/400 (B) 19/400 (C) 20/400 (D) 38/400\nA:  (D)\n\nQ: According to the pressure-flow model of movement of phloem contents, photosynthate movement from source to sink is driven by\n(A) an ATP-dependent pressure-flow pump (B) a water-pressure potential gradient (C) transpiration (D) apoplastic diffusion\nA:  (B)\n\nQ: The presence of homologous structures in two different organisms, such as the humerus in the front limb of a human and a bird, indicates that\n(A) the human and bird are polyphyletic species (B) a human's and bird's evolution is convergent (C) the human and bird belong to a clade (D) the human and bird developed by analogy\nA:  (C)\n\nQ: Which of the following represents an accurate statement concerning arthropods?\n(A) They possess an exoskeleton composed primarily of peptidoglycan. (B) They possess an open circulatory system with a dorsal heart. (C) They are members of a biologically unsuccessful phylum incapable of exploiting diverse habitats and nutrition sources. (D) They lack paired, jointed appendages.\nA:  (B)\n\nQ: Which of the following is the symplastic pathway for the movement of sucrose from the site of photosynthesis in mesophyll cells into the phloem?\n(A) Fibers, phloem parenchyma, companion cell, sieve tube (B) Phloem parenchyma, fibers, bundle sheath, tracheids (C) Companion cells, phloem parenchyma, fibers, sieve tube (D) Bundle sheath, phloem parenchyma, companion cell, sieve tube\nA: ",
        {
          "until": [
            "</s>"
          ]
        }
      ]
    ],
    "resps": [
      [
        "(D)"
      ]
    ],
    "filtered_resps": [
      "(D)"
    ],
    "exact_match": 1.0
  }
]