[
  {
    "doc_id": 0,
    "doc": {
      "question": "Simon (1960) is associated with what type of decision making model?",
      "subject": "management",
      "choices": [
        "Rational",
        "Classical",
        "Programmed",
        "Administrative"
      ],
      "answer": 3
    },
    "target": "(D)",
    "arguments": [
      [
        "The following are multiple choice questions (with answers) about management.\n\nQ: How can organisational structures that are characterised by democratic and inclusive styles of management be described?\n(A) Hierarchical (B) Bureaucratic (C) Flat (D) Functional\nA: Let's think step by step. We refer to Wikipedia articles on management for help. Flat organizational structures are characterized by democratic and inclusive styles of management, and have few (if any) levels of management between the workers and managers.  The answer is (C).\n\nQ: Hygiene factors are associated with which writer?\n(A) Frederick Hertzberg (B) D.C. McClelland (C) Abraham Maslow (D) Douglas McGregor\nA: Let's think step by step. We refer to Wikipedia articles on management for help. Hygiene factors include compensation, company policies, supervision, interpersonal relations, and work environments. Hertzberg lists them as factors that cannot motivate employees but can minimize job dissatisfaction. The answer is (A).\n\nQ: What characteristic is not a key feature of the 'open systems' model of management?\n(A) Morale (B) Innovation (C) Growth resource (D) Adaptation\nA: Let's think step by step. We refer to Wikipedia articles on management for help. The key characteristics of an open system in management include innovation, growth resource, and adaption, but do not include morale. The answer is (A).\n\nQ: Which element of the cultural web forms regalia?\n(A) Symbols (B) Rituals and routines (C) Power structures (D) Control systems\nA: Let's think step by step. We refer to Wikipedia articles on management for help. The cultural web is a tool for mapping an organization's culture, where symbols form the regalia that visually expresses the values that the organization holds as important. The answer is (A).\n\nQ: What are the two main dimensions of the Ohio Studies into leadership?\n(A) Starting position and end position (B) Initial environment and changed environment (C) Organisational structure and conditioning (D) Initiating structure and considerations\nA: Let's think step by step. We refer to Wikipedia articles on management for help. The Ohio State Leadership Studies conducted in the 1940s identified initiating structure and consideration as the two main dimensions of leader behavior. The answer is (D).Q: Simon (1960) is associated with what type of decision making model?\n(A) Rational (B) Classical (C) Programmed (D) Administrative\nA: Let's think step by step.",
        {
          "until": [
            "</s>"
          ],
          "do_sample": false,
          "temperature": 0.0
        }
      ]
    ],
    "resps": [
      [
        "Rational decision making is a type of decision making model. Simon (1960) is associated with a rational decision making model. The answer is (A)."
      ]
    ],
    "filtered_resps": [
      "(A)"
    ],
    "exact_match": 0.0
  },
  {
    "doc_id": 8,
    "doc": {
      "question": "What are the three interpersonal roles of managers?",
      "subject": "management",
      "choices": [
        "Figurehead, leader and liaison",
        "Spokesperson, leader, coordinator",
        "Director, coordinator, disseminator",
        "Communicator, organiser, spokesperson"
      ],
      "answer": 0
    },
    "target": "(A)",
    "arguments": [
      [
        "The following are multiple choice questions (with answers) about management.\n\nQ: How can organisational structures that are characterised by democratic and inclusive styles of management be described?\n(A) Hierarchical (B) Bureaucratic (C) Flat (D) Functional\nA: Let's think step by step. We refer to Wikipedia articles on management for help. Flat organizational structures are characterized by democratic and inclusive styles of management, and have few (if any) levels of management between the workers and managers.  The answer is (C).\n\nQ: Hygiene factors are associated with which writer?\n(A) Frederick Hertzberg (B) D.C. McClelland (C) Abraham Maslow (D) Douglas McGregor\nA: Let's think step by step. We refer to Wikipedia articles on management for help. Hygiene factors include compensation, company policies, supervision, interpersonal relations, and work environments. Hertzberg lists them as factors that cannot motivate employees but can minimize job dissatisfaction. The answer is (A).\n\nQ: What characteristic is not a key feature of the 'open systems' model of management?\n(A) Morale (B) Innovation (C) Growth resource (D) Adaptation\nA: Let's think step by step. We refer to Wikipedia articles on management for help. The key characteristics of an open system in management include innovation, growth resource, and adaption, but do not include morale. The answer is (A).\n\nQ: Which element of the cultural web forms regalia?\n(A) Symbols (B) Rituals and routines (C) Power structures (D) Control systems\nA: Let's think step by step. We refer to Wikipedia articles on management for help. The cultural web is a tool for mapping an organization's culture, where symbols form the regalia that visually expresses the values that the organization holds as important. The answer is (A).\n\nQ: What are the two main dimensions of the Ohio Studies into leadership?\n(A) Starting position and end position (B) Initial environment and changed environment (C) Organisational structure and conditioning (D) Initiating structure and considerations\nA: Let's think step by step. We refer to Wikipedia articles on management for help. The Ohio State Leadership Studies conducted in the 1940s identified initiating structure and consideration as the two main dimensions of leader behavior. The answer is (D).Q: What are the three interpersonal roles of managers?\n(A) Figurehead, leader and liaison (B) Spokesperson, leader, coordinator (C) Director, coordinator, disseminator (D) Communicator, organiser, spokesperson\nA: Let's think step by step.",
        {
          "until": [
            "</s>"
          ],
          "do_sample": false,
          "temperature": 0.0
        }
      ]
    ],
    "resps": [
      [
        "We refer to Wikipedia articles on management for help. Figurehead, leader and liaison are the three interpersonal roles of managers. The answer is (A)."
      ]
    ],
    "filtered_resps": [
      "(A)"
    ],
    "exact_match": 1.0
  },
  {
    "doc_id": 1,
    "doc": {
      "question": "At what level of an organisation does a corporate manager operate?",
      "subject": "management",
      "choices": [
        "Functional",
        "Operational",
        "Middle level",
        "Top level"
      ],
      "answer": 3
    },
    "target": "(D)",
    "arguments": [
      [
        "The following are multiple choice questions (with answers) about management.\n\nQ: How can organisational structures that are characterised by democratic and inclusive styles of management be described?\n(A) Hierarchical (B) Bureaucratic (C) Flat (D) Functional\nA: Let's think step by step. We refer to Wikipedia articles on management for help. Flat organizational structures are characterized by democratic and inclusive styles of management, and have few (if any) levels of management between the workers and managers.  The answer is (C).\n\nQ: Hygiene factors are associated with which writer?\n(A) Frederick Hertzberg (B) D.C. McClelland (C) Abraham Maslow (D) Douglas McGregor\nA: Let's think step by step. We refer to Wikipedia articles on management for help. Hygiene factors include compensation, company policies, supervision, interpersonal relations, and work environments. Hertzberg lists them as factors that cannot motivate employees but can minimize job dissatisfaction. The answer is (A).\n\nQ: What characteristic is not a key feature of the 'open systems' model of management?\n(A) Morale (B) Innovation (C) Growth resource (D) Adaptation\nA: Let's think step by step. We refer to Wikipedia articles on management for help. The key characteristics of an open system in management include innovation, growth resource, and adaption, but do not include morale. The answer is (A).\n\nQ: Which element of the cultural web forms regalia?\n(A) Symbols (B) Rituals and routines (C) Power structures (D) Control systems\nA: Let's think step by step. We refer to Wikipedia articles on management for help. The cultural web is a tool for mapping an organization's culture, where symbols form the regalia that visually expresses the values that the organization holds as important. The answer is (A).\n\nQ: What are the two main dimensions of the Ohio Studies into leadership?\n(A) Starting position and end position (B) Initial environment and changed environment (C) Organisational structure and conditioning (D) Initiating structure and considerations\nA: Let's think step by step. We refer to Wikipedia articles on management for help. The Ohio State Leadership Studies conducted in the 1940s identified initiating structure and consideration as the two main dimensions of leader behavior. The answer is (D).Q: At what level of an organisation does a corporate manager operate?\n(A) Functional (B) Operational (C) Middle level (D) Top level\nA: Let's think step by step.",
        {
          "until": [
            "</s>"
          ],
          "do_sample": false,
          "temperature": 0.0
        }
      ]
    ],
    "resps": [
      [
        "The corporate manager is a person who is a manager. The corporate manager is a person who is a manager. The answer is (D)."
      ]
    ],
    "filtered_resps": [
      "(D)"
    ],
    "exact_match": 1.0
  },
  {
    "doc_id": 9,
    "doc": {
      "question": "According to Lewin, Lippet and White's 1939 experiment, which form of leadership produced the most work from participants?",
      "subject": "management",
      "choices": [
        "Laissez-faire",
        "Democratic",
        "Authoritarian",
        "A mix of laissez-faire and democratic"
      ],
      "answer": 2
    },
    "target": "(C)",
    "arguments": [
      [
        "The following are multiple choice questions (with answers) about management.\n\nQ: How can organisational structures that are characterised by democratic and inclusive styles of management be described?\n(A) Hierarchical (B) Bureaucratic (C) Flat (D) Functional\nA: Let's think step by step. We refer to Wikipedia articles on management for help. Flat organizational structures are characterized by democratic and inclusive styles of management, and have few (if any) levels of management between the workers and managers.  The answer is (C).\n\nQ: Hygiene factors are associated with which writer?\n(A) Frederick Hertzberg (B) D.C. McClelland (C) Abraham Maslow (D) Douglas McGregor\nA: Let's think step by step. We refer to Wikipedia articles on management for help. Hygiene factors include compensation, company policies, supervision, interpersonal relations, and work environments. Hertzberg lists them as factors that cannot motivate employees but can minimize job dissatisfaction. The answer is (A).\n\nQ: What characteristic is not a key feature of the 'open systems' model of management?\n(A) Morale (B) Innovation (C) Growth resource (D) Adaptation\nA: Let's think step by step. We refer to Wikipedia articles on management for help. The key characteristics of an open system in management include innovation, growth resource, and adaption, but do not include morale. The answer is (A).\n\nQ: Which element of the cultural web forms regalia?\n(A) Symbols (B) Rituals and routines (C) Power structures (D) Control systems\nA: Let's think step by step. We refer to Wikipedia articles on management for help. The cultural web is a tool for mapping an organization's culture, where symbols form the regalia that visually expresses the values that the organization holds as important. The answer is (A).\n\nQ: What are the two main dimensions of the Ohio Studies into leadership?\n(A) Starting position and end position (B) Initial environment and changed environment (C) Organisational structure and conditioning (D) Initiating structure and considerations\nA: Let's think step by step. We refer to Wikipedia articles on management for help. The Ohio State Leadership Studies conducted in the 1940s identified initiating structure and consideration as the two main dimensions of leader behavior. The answer is (D).Q: According to Lewin, Lippet and White's 1939 experiment, which form of leadership produced the most work from participants?\n(A) Laissez-faire (B) Democratic (C) Authoritarian (D) A mix of laissez-faire and democratic\nA: Let's think step by step.",
        {
          "until": [
            "</s>"
          ],
          "do_sample": false,
          "temperature": 0.0
        }
      ]
    ],
    "resps": [
      [
        "The experiment was conducted in 1939. The experiment was conducted in 1939. The experiment was conducted in 1939. The experiment was conducted in 1939. The answer is (A)."
      ]
    ],
    "filtered_resps": [
      "(A)"
    ],
    "exact_match": 0.0
  },
  {
    "doc_id": 2,
    "doc": {
      "question": "Which one is not a recognised key skill of management?",
      "subject": "management",
      "choices": [
        "Conceptual skills",
        "Human skills",
        "Technical skills",
        "Writing skills"
      ],
      "answer": 3
    },
    "target": "(D)",
    "arguments": [
      [
        "The following are multiple choice questions (with answers) about management.\n\nQ: How can organisational structures that are characterised by democratic and inclusive styles of management be described?\n(A) Hierarchical (B) Bureaucratic (C) Flat (D) Functional\nA: Let's think step by step. We refer to Wikipedia articles on management for help. Flat organizational structures are characterized by democratic and inclusive styles of management, and have few (if any) levels of management between the workers and managers.  The answer is (C).\n\nQ: Hygiene factors are associated with which writer?\n(A) Frederick Hertzberg (B) D.C. McClelland (C) Abraham Maslow (D) Douglas McGregor\nA: Let's think step by step. We refer to Wikipedia articles on management for help. Hygiene factors include compensation, company policies, supervision, interpersonal relations, and work environments. Hertzberg lists them as factors that cannot motivate employees but can minimize job dissatisfaction. The answer is (A).\n\nQ: What characteristic is not a key feature of the 'open systems' model of management?\n(A) Morale (B) Innovation (C) Growth resource (D) Adaptation\nA: Let's think step by step. We refer to Wikipedia articles on management for help. The key characteristics of an open system in management include innovation, growth resource, and adaption, but do not include morale. The answer is (A).\n\nQ: Which element of the cultural web forms regalia?\n(A) Symbols (B) Rituals and routines (C) Power structures (D) Control systems\nA: Let's think step by step. We refer to Wikipedia articles on management for help. The cultural web is a tool for mapping an organization's culture, where symbols form the regalia that visually expresses the values that the organization holds as important. The answer is (A).\n\nQ: What are the two main dimensions of the Ohio Studies into leadership?\n(A) Starting position and end position (B) Initial environment and changed environment (C) Organisational structure and conditioning (D) Initiating structure and considerations\nA: Let's think step by step. We refer to Wikipedia articles on management for help. The Ohio State Leadership Studies conducted in the 1940s identified initiating structure and consideration as the two main dimensions of leader behavior. The answer is (D).Q: Which one is not a recognised key skill of management?\n(A) Conceptual skills (B) Human skills (C) Technical skills (D) Writing skills\nA: Let's think step by step.",
        {
          "until": [
            "</s>"
          ],
          "do_sample": false,
          "temperature": 0.0
        }
      ]
    ],
    "resps": [
      [
        "We refer to Wikipedia articles on management for help. Human skills are not recognised key skills of management. The answer is (B)."
      ]
    ],
    "filtered_resps": [
      "(B)"
    ],
    "exact_match": 0.0
  },
  {
    "doc_id": 10,
    "doc": {
      "question": "Which of the following motivators is the most basic need in Maslow's hierarchy?",
      "subject": "management",
      "choices": [
        "Safety",
        "Belonging",
        "Physiological",
        "Esteem"
      ],
      "answer": 2
    },
    "target": "(C)",
    "arguments": [
      [
        "The following are multiple choice questions (with answers) about management.\n\nQ: How can organisational structures that are characterised by democratic and inclusive styles of management be described?\n(A) Hierarchical (B) Bureaucratic (C) Flat (D) Functional\nA: Let's think step by step. We refer to Wikipedia articles on management for help. Flat organizational structures are characterized by democratic and inclusive styles of management, and have few (if any) levels of management between the workers and managers.  The answer is (C).\n\nQ: Hygiene factors are associated with which writer?\n(A) Frederick Hertzberg (B) D.C. McClelland (C) Abraham Maslow (D) Douglas McGregor\nA: Let's think step by step. We refer to Wikipedia articles on management for help. Hygiene factors include compensation, company policies, supervision, interpersonal relations, and work environments. Hertzberg lists them as factors that cannot motivate employees but can minimize job dissatisfaction. The answer is (A).\n\nQ: What characteristic is not a key feature of the 'open systems' model of management?\n(A) Morale (B) Innovation (C) Growth resource (D) Adaptation\nA: Let's think step by step. We refer to Wikipedia articles on management for help. The key characteristics of an open system in management include innovation, growth resource, and adaption, but do not include morale. The answer is (A).\n\nQ: Which element of the cultural web forms regalia?\n(A) Symbols (B) Rituals and routines (C) Power structures (D) Control systems\nA: Let's think step by step. We refer to Wikipedia articles on management for help. The cultural web is a tool for mapping an organization's culture, where symbols form the regalia that visually expresses the values that the organization holds as important. The answer is (A).\n\nQ: What are the two main dimensions of the Ohio Studies into leadership?\n(A) Starting position and end position (B) Initial environment and changed environment (C) Organisational structure and conditioning (D) Initiating structure and considerations\nA: Let's think step by step. We refer to Wikipedia articles on management for help. The Ohio State Leadership Studies conducted in the 1940s identified initiating structure and consideration as the two main dimensions of leader behavior. The answer is (D).Q: Which of the following motivators is the most basic need in Maslow's hierarchy?\n(A) Safety (B) Belonging (C) Physiological (D) Esteem\nA: Let's think step by step.",
        {
          "until": [
            "</s>"
          ],
          "do_sample": false,
          "temperature": 0.0
        }
      ]
    ],
    "resps": [
      [
        "We refer to Wikipedia articles on motivation for help. Belonging is the most basic need in Maslow's hierarchy. Belonging is the most basic need in Maslow's hierarchy. The answer is (B)."
      ]
    ],
    "filtered_resps": [
      "(B)"
    ],
    "exact_match": 0.0
  },
  {
    "doc_id": 3,
    "doc": {
      "question": "Which one of the following is not a characteristic of a bureaucratic organisation?",
      "subject": "management",
      "choices": [
        "Authority",
        "Regulations",
        "Command structure",
        "Change"
      ],
      "answer": 3
    },
    "target": "(D)",
    "arguments": [
      [
        "The following are multiple choice questions (with answers) about management.\n\nQ: How can organisational structures that are characterised by democratic and inclusive styles of management be described?\n(A) Hierarchical (B) Bureaucratic (C) Flat (D) Functional\nA: Let's think step by step. We refer to Wikipedia articles on management for help. Flat organizational structures are characterized by democratic and inclusive styles of management, and have few (if any) levels of management between the workers and managers.  The answer is (C).\n\nQ: Hygiene factors are associated with which writer?\n(A) Frederick Hertzberg (B) D.C. McClelland (C) Abraham Maslow (D) Douglas McGregor\nA: Let's think step by step. We refer to Wikipedia articles on management for help. Hygiene factors include compensation, company policies, supervision, interpersonal relations, and work environments. Hertzberg lists them as factors that cannot motivate employees but can minimize job dissatisfaction. The answer is (A).\n\nQ: What characteristic is not a key feature of the 'open systems' model of management?\n(A) Morale (B) Innovation (C) Growth resource (D) Adaptation\nA: Let's think step by step. We refer to Wikipedia articles on management for help. The key characteristics of an open system in management include innovation, growth resource, and adaption, but do not include morale. The answer is (A).\n\nQ: Which element of the cultural web forms regalia?\n(A) Symbols (B) Rituals and routines (C) Power structures (D) Control systems\nA: Let's think step by step. We refer to Wikipedia articles on management for help. The cultural web is a tool for mapping an organization's culture, where symbols form the regalia that visually expresses the values that the organization holds as important. The answer is (A).\n\nQ: What are the two main dimensions of the Ohio Studies into leadership?\n(A) Starting position and end position (B) Initial environment and changed environment (C) Organisational structure and conditioning (D) Initiating structure and considerations\nA: Let's think step by step. We refer to Wikipedia articles on management for help. The Ohio State Leadership Studies conducted in the 1940s identified initiating structure and consideration as the two main dimensions of leader behavior. The answer is (D).Q: Which one of the following is not a characteristic of a bureaucratic organisation?\n(A) Authority (B) Regulations (C) Command structure (D) Change\nA: Let's think step by step.",
        {
          "until": [
            "</s>"
          ],
          "do_sample": false,
          "temperature": 0.0
        }
      ]
    ],
    "resps": [
      [
        "We refer to Wikipedia articles on management for help. Bureaucratic organisations are governed by a set of rules. The answer is (B)."
      ]
    ],
    "filtered_resps": [
      "(B)"
    ],
    "exact_match": 0.0
  },
  {
    "doc_id": 4,
    "doc": {
      "question": "To what does authority refer?",
      "subject": "management",
      "choices": [
        "The ability to organise people",
        "The power to command and direct",
        "The need for order",
        "The right to change jobs"
      ],
      "answer": 1
    },
    "target": "(B)",
    "arguments": [
      [
        "The following are multiple choice questions (with answers) about management.\n\nQ: How can organisational structures that are characterised by democratic and inclusive styles of management be described?\n(A) Hierarchical (B) Bureaucratic (C) Flat (D) Functional\nA: Let's think step by step. We refer to Wikipedia articles on management for help. Flat organizational structures are characterized by democratic and inclusive styles of management, and have few (if any) levels of management between the workers and managers.  The answer is (C).\n\nQ: Hygiene factors are associated with which writer?\n(A) Frederick Hertzberg (B) D.C. McClelland (C) Abraham Maslow (D) Douglas McGregor\nA: Let's think step by step. We refer to Wikipedia articles on management for help. Hygiene factors include compensation, company policies, supervision, interpersonal relations, and work environments. Hertzberg lists them as factors that cannot motivate employees but can minimize job dissatisfaction. The answer is (A).\n\nQ: What characteristic is not a key feature of the 'open systems' model of management?\n(A) Morale (B) Innovation (C) Growth resource (D) Adaptation\nA: Let's think step by step. We refer to Wikipedia articles on management for help. The key characteristics of an open system in management include innovation, growth resource, and adaption, but do not include morale. The answer is (A).\n\nQ: Which element of the cultural web forms regalia?\n(A) Symbols (B) Rituals and routines (C) Power structures (D) Control systems\nA: Let's think step by step. We refer to Wikipedia articles on management for help. The cultural web is a tool for mapping an organization's culture, where symbols form the regalia that visually expresses the values that the organization holds as important. The answer is (A).\n\nQ: What are the two main dimensions of the Ohio Studies into leadership?\n(A) Starting position and end position (B) Initial environment and changed environment (C) Organisational structure and conditioning (D) Initiating structure and considerations\nA: Let's think step by step. We refer to Wikipedia articles on management for help. The Ohio State Leadership Studies conducted in the 1940s identified initiating structure and consideration as the two main dimensions of leader behavior. The answer is (D).Q: To what does authority refer?\n(A) The ability to organise people (B) The power to command and direct (C) The need for order (D) The right to change jobs\nA: Let's think step by step.",
        {
          "until": [
            "</s>"
          ],
          "do_sample": false,
          "temperature": 0.0
        }
      ]
    ],
    "resps": [
      [
        "The power to command and direct refers to the ability to organise people. The answer is (A)."
      ]
    ],
    "filtered_resps": [
      "(A)"
    ],
    "exact_match": 0.0
  },
  {
    "doc_id": 5,
    "doc": {
      "question": "Power distance in national cultures is a characteristic of a model by which writer?",
      "subject": "management",
      "choices": [
        "Geert Hofstede",
        "David Yip",
        "Tony Purdie",
        "Michael Porter"
      ],
      "answer": 0
    },
    "target": "(A)",
    "arguments": [
      [
        "The following are multiple choice questions (with answers) about management.\n\nQ: How can organisational structures that are characterised by democratic and inclusive styles of management be described?\n(A) Hierarchical (B) Bureaucratic (C) Flat (D) Functional\nA: Let's think step by step. We refer to Wikipedia articles on management for help. Flat organizational structures are characterized by democratic and inclusive styles of management, and have few (if any) levels of management between the workers and managers.  The answer is (C).\n\nQ: Hygiene factors are associated with which writer?\n(A) Frederick Hertzberg (B) D.C. McClelland (C) Abraham Maslow (D) Douglas McGregor\nA: Let's think step by step. We refer to Wikipedia articles on management for help. Hygiene factors include compensation, company policies, supervision, interpersonal relations, and work environments. Hertzberg lists them as factors that cannot motivate employees but can minimize job dissatisfaction. The answer is (A).\n\nQ: What characteristic is not a key feature of the 'open systems' model of management?\n(A) Morale (B) Innovation (C) Growth resource (D) Adaptation\nA: Let's think step by step. We refer to Wikipedia articles on management for help. The key characteristics of an open system in management include innovation, growth resource, and adaption, but do not include morale. The answer is (A).\n\nQ: Which element of the cultural web forms regalia?\n(A) Symbols (B) Rituals and routines (C) Power structures (D) Control systems\nA: Let's think step by step. We refer to Wikipedia articles on management for help. The cultural web is a tool for mapping an organization's culture, where symbols form the regalia that visually expresses the values that the organization holds as important. The answer is (A).\n\nQ: What are the two main dimensions of the Ohio Studies into leadership?\n(A) Starting position and end position (B) Initial environment and changed environment (C) Organisational structure and conditioning (D) Initiating structure and considerations\nA: Let's think step by step. We refer to Wikipedia articles on management for help. The Ohio State Leadership Studies conducted in the 1940s identified initiating structure and consideration as the two main dimensions of leader behavior. The answer is (D).Q: Power distance in national cultures is a characteristic of a model by which writer?\n(A) Geert Hofstede (B) David Yip (C) Tony Purdie (D) Michael Porter\nA: Let's think step by step.",
        {
          "until": [
            "</s>"
          ],
          "do_sample": false,
          "temperature": 0.0
        }
      ]
    ],
    "resps": [
      [
        "We refer to Wikipedia articles on culture for help. Power distance in national cultures is a characteristic of a model by Geert Hofstede. The answer is (A)."
      ]
    ],
    "filtered_resps": [
      "(A)"
    ],
    "exact_match": 1.0
  },
  {
    "doc_id": 6,
    "doc": {
      "question": "Of what is an investment decision an example?",
      "subject": "management",
      "choices": [
        "Programmed decision",
        "Routine decision",
        "Management decision",
        "Non-programmed decision"
      ],
      "answer": 3
    },
    "target": "(D)",
    "arguments": [
      [
        "The following are multiple choice questions (with answers) about management.\n\nQ: How can organisational structures that are characterised by democratic and inclusive styles of management be described?\n(A) Hierarchical (B) Bureaucratic (C) Flat (D) Functional\nA: Let's think step by step. We refer to Wikipedia articles on management for help. Flat organizational structures are characterized by democratic and inclusive styles of management, and have few (if any) levels of management between the workers and managers.  The answer is (C).\n\nQ: Hygiene factors are associated with which writer?\n(A) Frederick Hertzberg (B) D.C. McClelland (C) Abraham Maslow (D) Douglas McGregor\nA: Let's think step by step. We refer to Wikipedia articles on management for help. Hygiene factors include compensation, company policies, supervision, interpersonal relations, and work environments. Hertzberg lists them as factors that cannot motivate employees but can minimize job dissatisfaction. The answer is (A).\n\nQ: What characteristic is not a key feature of the 'open systems' model of management?\n(A) Morale (B) Innovation (C) Growth resource (D) Adaptation\nA: Let's think step by step. We refer to Wikipedia articles on management for help. The key characteristics of an open system in management include innovation, growth resource, and adaption, but do not include morale. The answer is (A).\n\nQ: Which element of the cultural web forms regalia?\n(A) Symbols (B) Rituals and routines (C) Power structures (D) Control systems\nA: Let's think step by step. We refer to Wikipedia articles on management for help. The cultural web is a tool for mapping an organization's culture, where symbols form the regalia that visually expresses the values that the organization holds as important. The answer is (A).\n\nQ: What are the two main dimensions of the Ohio Studies into leadership?\n(A) Starting position and end position (B) Initial environment and changed environment (C) Organisational structure and conditioning (D) Initiating structure and considerations\nA: Let's think step by step. We refer to Wikipedia articles on management for help. The Ohio State Leadership Studies conducted in the 1940s identified initiating structure and consideration as the two main dimensions of leader behavior. The answer is (D).Q: Of what is an investment decision an example?\n(A) Programmed decision (B) Routine decision (C) Management decision (D) Non-programmed decision\nA: Let's think step by step.",
        {
          "until": [
            "</s>"
          ],
          "do_sample": false,
          "temperature": 0.0
        }
      ]
    ],
    "resps": [
      [
        "We refer to Wikipedia articles on investment for help. Investment is a decision that involves the investment of money. The answer is (C)."
      ]
    ],
    "filtered_resps": [
      "(C)"
    ],
    "exact_match": 0.0
  },
  {
    "doc_id": 7,
    "doc": {
      "question": "How do you call a system that allows workers to work part of the week from home?",
      "subject": "management",
      "choices": [
        "Piece time",
        "Part-time",
        "Job sharing",
        "Telecommuting"
      ],
      "answer": 3
    },
    "target": "(D)",
    "arguments": [
      [
        "The following are multiple choice questions (with answers) about management.\n\nQ: How can organisational structures that are characterised by democratic and inclusive styles of management be described?\n(A) Hierarchical (B) Bureaucratic (C) Flat (D) Functional\nA: Let's think step by step. We refer to Wikipedia articles on management for help. Flat organizational structures are characterized by democratic and inclusive styles of management, and have few (if any) levels of management between the workers and managers.  The answer is (C).\n\nQ: Hygiene factors are associated with which writer?\n(A) Frederick Hertzberg (B) D.C. McClelland (C) Abraham Maslow (D) Douglas McGregor\nA: Let's think step by step. We refer to Wikipedia articles on management for help. Hygiene factors include compensation, company policies, supervision, interpersonal relations, and work environments. Hertzberg lists them as factors that cannot motivate employees but can minimize job dissatisfaction. The answer is (A).\n\nQ: What characteristic is not a key feature of the 'open systems' model of management?\n(A) Morale (B) Innovation (C) Growth resource (D) Adaptation\nA: Let's think step by step. We refer to Wikipedia articles on management for help. The key characteristics of an open system in management include innovation, growth resource, and adaption, but do not include morale. The answer is (A).\n\nQ: Which element of the cultural web forms regalia?\n(A) Symbols (B) Rituals and routines (C) Power structures (D) Control systems\nA: Let's think step by step. We refer to Wikipedia articles on management for help. The cultural web is a tool for mapping an organization's culture, where symbols form the regalia that visually expresses the values that the organization holds as important. The answer is (A).\n\nQ: What are the two main dimensions of the Ohio Studies into leadership?\n(A) Starting position and end position (B) Initial environment and changed environment (C) Organisational structure and conditioning (D) Initiating structure and considerations\nA: Let's think step by step. We refer to Wikipedia articles on management for help. The Ohio State Leadership Studies conducted in the 1940s identified initiating structure and consideration as the two main dimensions of leader behavior. The answer is (D).Q: How do you call a system that allows workers to work part of the week from home?\n(A) Piece time (B) Part-time (C) Job sharing (D) Telecommuting\nA: Let's think step by step.",
        {
          "until": [
            "</s>"
          ],
          "do_sample": false,
          "temperature": 0.0
        }
      ]
    ],
    "resps": [
      [
        "Part-time is a system that allows workers to work part of the week from home. Part-time is a system that allows workers to work part of the week from home. The answer is (B)."
      ]
    ],
    "filtered_resps": [
      "(B)"
    ],
    "exact_match": 0.0
  }
]